[32m[I 2022-02-17 09:01:45,623][0m Trial 26 pruned. [0m
epoch 0 0.017796304436065058 1.9676280817961638
Trial Id: 27 | Model params: 2693 | Timestamp: 2022-02-17 09:01:45.624087

[32m[I 2022-02-17 09:02:11,776][0m Trial 27 pruned. [0m
epoch 0 0.020880416776937083 1.9645364841763269
Trial Id: 28 | Model params: 767 | Timestamp: 2022-02-17 09:02:11.776988

[32m[I 2022-02-17 09:02:38,072][0m Trial 28 pruned. [0m
epoch 0 -0.7878183723123824 2.6546295729723743
Trial Id: 29 | Model params: 5496 | Timestamp: 2022-02-17 09:02:38.073115

[32m[I 2022-02-17 09:02:46,946][0m Trial 29 pruned. [0m
epoch 0 -0.04260397911485092 2.0272248408929148
Trial Id: 30 | Model params: 2943 | Timestamp: 2022-02-17 09:02:46.946304

[32m[I 2022-02-17 09:03:13,210][0m Trial 30 pruned. [0m
epoch 0 0.025942301970676596 1.9594517406053906
Trial Id: 31 | Model params: 1467 | Timestamp: 2022-02-17 09:03:13.210749

[32m[I 2022-02-17 09:03:39,479][0m Trial 31 pruned. [0m
epoch 0 0.01631501330155427 1.9691112425520008
Trial Id: 32 | Model params: 1503 | Timestamp: 2022-02-17 09:03:39.479207

epoch 0 -2.916524281914817 3.9290960166779114
epoch 5 0.023138867232933902 1.96226946294109
epoch 10 0.026542426199903768 1.958848031171053
epoch 15 0.027559988741999275 1.9578239641761603
epoch 20 0.02753443480804807 1.9578496880126024
epoch 25 0.028348956532199154 1.9570295843365968
epoch 30 0.027811457133000372 1.957570805796642
epoch 35 0.02828363475812745 1.957095366438491
epoch 40 0.02886294386694499 1.9565118977213165
epoch 45 0.028459916368929083 1.9569178374885403
epoch 50 0.029111551624049548 1.9562614515227108
epoch 55 0.02933780274189579 1.956033499418811
epoch 60 0.02858147137792033 1.9567954129945708
epoch 65 0.02905880885086254 1.9563145870054572
epoch 70 0.02874507076455446 1.9566306312863975
epoch 75 0.02939937495369649 1.9559714597003348
epoch 80 0.029487136801666702 1.9558830280910824
epoch 85 0.029475344630021105 1.9558949104881123
epoch 90 0.029612425720759394 1.955756776091239
epoch 95 0.02939376097746338 1.9559771163840036
[32m[I 2022-02-17 09:47:07,600][0m Trial 32 finished with value: 1.9558265668906025 and parameters: {'n_layers_mlp': 2, 'mlp_n_units_l0': 46, 'mlp_dropout_l0': 0.05926653999792609, 'mlp_n_units_l1': 15, 'mlp_dropout_l1': 0.1216289258626756, 'lr': 2.0670440500424115e-05, 'weight_decay': 0.04466280383828884, 'criterion': 'MSELoss', 'batch_size': 32}. Best is trial 22 with value: 1.9554414462709924.[0m
Trial Id: 33 | Model params: 1753 | Timestamp: 2022-02-17 09:47:07.601144

epoch 0 -2.916524281914817 3.9290960166779114
epoch 5 0.024065231561818945 1.9613388252433839
epoch 10 0.026581028007351626 1.958809192383321
epoch 15 0.027127284423648867 1.9582594998675424
epoch 20 0.027238140236669373 1.9581479279065532
epoch 25 0.027550142973589598 1.9578338754469449
epoch 30 0.02793833544541091 1.9574430623736787
epoch 35 0.0284182386031413 1.9569598116129159
epoch 40 0.028521089264633592 1.9568562279794537
epoch 45 0.02856159757250154 1.956815429481407
epoch 50 0.028671928190955542 1.956704304171541
epoch 55 0.028811386769599268 1.9565638320672245
epoch 60 0.02892957429491183 1.9564447777095735
epoch 65 0.029098534874850923 1.9562745653255245
epoch 70 0.028635668149118776 1.9567408260840924
epoch 75 0.029153312759082395 1.956219378420856
epoch 80 0.028980194456582287 1.956393784064316
epoch 85 0.028495347935122983 1.956882153270646
epoch 90 0.02899367071179526 1.9563802081551238
epoch 95 0.02898985498678064 1.9563840521061566
[32m[I 2022-02-17 10:30:43,237][0m Trial 33 finished with value: 1.9563039375954434 and parameters: {'n_layers_mlp': 2, 'mlp_n_units_l0': 45, 'mlp_dropout_l0': 0.051905307219009066, 'mlp_n_units_l1': 21, 'mlp_dropout_l1': 0.1735948469175308, 'lr': 2.1136348910989648e-05, 'weight_decay': 0.05014063290293407, 'criterion': 'MSELoss', 'batch_size': 32}. Best is trial 22 with value: 1.9554414462709924.[0m
Trial Id: 34 | Model params: 1471 | Timestamp: 2022-02-17 10:30:43.237614

[32m[I 2022-02-17 10:31:09,063][0m Trial 34 pruned. [0m
epoch 0 0.0018111377331866407 1.9835748358549212
Trial Id: 35 | Model params: 2112 | Timestamp: 2022-02-17 10:31:09.063306

epoch 0 -1.578456764773171 3.1880282197552603
epoch 5 -1.228614172827558 2.9638735717904114
epoch 10 -1.2138424759777897 2.9540346701333204
epoch 15 -1.2116347002883452 2.952561332981752
epoch 20 -1.1961786604673108 2.94222623664022
epoch 25 -1.202195976611831 2.9462541864875833
epoch 30 -1.1960918925003643 2.942168114431166
epoch 35 -1.1968479723250889 2.9426745419004683
epoch 40 -1.203718049535515 2.947272179249211
epoch 45 -1.2037824569582174 2.947315248465377
epoch 50 -1.1935746511315668 2.9404814202555336
epoch 55 -1.2036081292104832 2.9471986741209406
epoch 60 -1.2020754777837133 2.946173579439624
epoch 65 -1.1899249469755158 2.9380341921789492
epoch 70 -1.191572252563967 2.9391390086559714
epoch 75 -1.1943464376337873 2.940998663716066
epoch 80 -1.197877387552757 2.9433639112240577
epoch 85 -1.182525554290621 2.933066427527538
epoch 90 -1.1898626596040218 2.9379924090738405
epoch 95 -1.1903094021727783 2.9382920761183606
[32m[I 2022-02-17 10:43:20,280][0m Trial 35 finished with value: 2.9378242869530973 and parameters: {'n_layers_mlp': 2, 'mlp_n_units_l0': 53, 'mlp_dropout_l0': 0.10178431488411756, 'mlp_n_units_l1': 22, 'mlp_dropout_l1': 0.14378289879358266, 'lr': 2.048612495206918e-05, 'weight_decay': 0.015950182208517006, 'criterion': 'PoissonNLLLoss', 'batch_size': 128}. Best is trial 22 with value: 1.9554414462709924.[0m
Trial Id: 36 | Model params: 2270 | Timestamp: 2022-02-17 10:43:20.281186

[32m[I 2022-02-17 10:43:46,773][0m Trial 36 pruned. [0m
epoch 0 -0.06438179360909468 2.048287661303983
Trial Id: 37 | Model params: 2312 | Timestamp: 2022-02-17 10:43:46.773760

[32m[I 2022-02-17 10:43:50,811][0m Trial 37 pruned. [0m
epoch 0 -0.9538162365776357 2.7750486909071483
Trial Id: 38 | Model params: 1587 | Timestamp: 2022-02-17 10:43:50.811893

epoch 0 -2.916524281914817 3.9290960166779114
epoch 5 -1.2118308267692033 2.952692245791682
epoch 10 -1.1975173136919919 2.9431227986342243
epoch 15 -1.1817937318898348 2.9325746432103013
epoch 20 -1.2036101541995436 2.94720002827362
epoch 25 -1.2111543068064843 2.952240649767155
epoch 30 -1.2120810816779364 2.952859280453536
epoch 35 -1.1972623926077857 2.9429520864833347
epoch 40 -1.1880383843490456 2.9367683999961427
epoch 45 -1.1648924035189387 2.9211939228615114
epoch 50 -1.1757999196450233 2.9285436960527815
epoch 55 -1.1810642145074728 2.9320843257690776
epoch 60 -1.1907551100828742 2.9385910186791824
epoch 65 -1.1806340389614807 2.9317951611571003
epoch 70 -1.2065564301517888 2.949169606255069
epoch 75 -1.1809688444708528 2.932020220355637
epoch 80 -1.2002081134410987 2.944924134001158
epoch 85 -1.197086515335077 2.942834301564593
epoch 90 -1.1984242534784832 2.9437300657071734
epoch 95 -1.2062495508526259 2.948964519596275
[32m[I 2022-02-17 11:29:11,792][0m Trial 38 finished with value: 2.936668262227348 and parameters: {'n_layers_mlp': 2, 'mlp_n_units_l0': 58, 'mlp_dropout_l0': 0.07246843548369145, 'mlp_n_units_l1': 10, 'mlp_dropout_l1': 0.03775035727855057, 'lr': 7.809762904685971e-05, 'weight_decay': 0.03816149960527373, 'criterion': 'PoissonNLLLoss', 'batch_size': 32}. Best is trial 22 with value: 1.9554414462709924.[0m
Trial Id: 39 | Model params: 3856 | Timestamp: 2022-02-17 11:29:11.792355

[32m[I 2022-02-17 11:29:17,157][0m Trial 39 pruned. [0m
epoch 0 0.006780186677331601 1.9785700816091818
Trial Id: 40 | Model params: 4455 | Timestamp: 2022-02-17 11:29:17.157500

[32m[I 2022-02-17 11:29:43,060][0m Trial 40 pruned. [0m
epoch 0 0.02010302631371874 1.9653162198358973
Trial Id: 41 | Model params: 1335 | Timestamp: 2022-02-17 11:29:43.060605

[32m[I 2022-02-17 11:30:08,934][0m Trial 41 pruned. [0m
epoch 0 0.01802549309432888 1.9673985039845978
Trial Id: 42 | Model params: 917 | Timestamp: 2022-02-17 11:30:08.934549

[32m[I 2022-02-17 11:30:34,392][0m Trial 42 pruned. [0m
epoch 0 0.01804408611464059 1.9673798782192424
Trial Id: 43 | Model params: 1122 | Timestamp: 2022-02-17 11:30:34.392745

[32m[I 2022-02-17 11:31:00,493][0m Trial 43 pruned. [0m
epoch 0 -0.013716701749244775 1.9989435560288096
Trial Id: 44 | Model params: 2099 | Timestamp: 2022-02-17 11:31:00.493390

[32m[I 2022-02-17 11:31:26,875][0m Trial 44 pruned. [0m
epoch 0 0.01954520380883573 1.9658755345746362
Trial Id: 45 | Model params: 2181 | Timestamp: 2022-02-17 11:31:26.875345

[32m[I 2022-02-17 11:31:53,995][0m Trial 45 pruned. [0m
epoch 0 -1.336404593759386 3.034703432868465
Trial Id: 46 | Model params: 1272 | Timestamp: 2022-02-17 11:31:53.995477

[32m[I 2022-02-17 11:32:20,209][0m Trial 46 pruned. [0m
epoch 0 -0.1253371461285313 2.106122159458716
Trial Id: 47 | Model params: 1257 | Timestamp: 2022-02-17 11:32:20.209865

epoch 0 -2.4275911740344784 3.6755578148801322
epoch 5 0.014857185234969261 1.9705086585536826
epoch 10 0.02092908904428825 1.9644266814128133
epoch 15 0.024317569611425838 1.9610243788445545
epoch 20 0.026779019733372378 1.9585491821225642
epoch 25 0.02749803759227054 1.9578255581638857
epoch 30 0.028377983457401723 1.9569396111673367
epoch 35 0.028873945846431215 1.9564400895859069
epoch 40 0.029268924367009008 1.9560421853186443
epoch 45 0.029553208914309348 1.955755744872165
epoch 50 0.029532454814842235 1.9557766577818794
epoch 55 0.02986047699180261 1.9554460994134224
epoch 60 0.030081246959351216 1.955223591039806
epoch 65 0.030112777983345662 1.9551918096649106
epoch 70 0.03020353238819462 1.9551003318022628
epoch 75 0.029885280844934914 1.9554211015101663
epoch 80 0.030427992091565215 1.9548740644097646
epoch 85 0.03009480084789562 1.9552099295990242
epoch 90 0.030570432402147962 1.9547304633701938
epoch 95 0.03058145824199132 1.9547193472422
[32m[I 2022-02-17 11:39:18,068][0m Trial 47 finished with value: 1.9546326616856085 and parameters: {'n_layers_mlp': 2, 'mlp_n_units_l0': 28, 'mlp_dropout_l0': 0.029135652905257468, 'mlp_n_units_l1': 26, 'mlp_dropout_l1': 0.08297408119658459, 'lr': 3.2159813310938584e-05, 'weight_decay': 0.03322909464431904, 'criterion': 'MSELoss', 'batch_size': 256}. Best is trial 47 with value: 1.9546326616856085.[0m
Trial Id: 48 | Model params: 1573 | Timestamp: 2022-02-17 11:39:18.069003

[32m[I 2022-02-17 11:39:22,073][0m Trial 48 pruned. [0m
epoch 0 0.0200241791835154 1.9653342860099656
Trial Id: 49 | Model params: 4480 | Timestamp: 2022-02-17 11:39:22.073865

epoch 0 -2.91622743706747 3.9288251691460694
epoch 5 -2.91622743706747 3.9288251691460694
epoch 10 -2.7837303293774265 3.861791644528658
epoch 15 0.02182169950196111 1.9635310018368162
epoch 20 0.019957661566507023 1.965400985173484
epoch 25 0.02342537377150533 1.9619207862944497
epoch 30 0.023942445757002107 1.961401323384628
epoch 35 0.024994094033422454 1.960344387641318
epoch 40 0.025441916200691028 1.9598941408819335
epoch 45 0.023032774791699073 1.9623151087972808
epoch 50 0.02388788783471818 1.9614561400730406
epoch 55 0.02324290849797006 1.9621040624534474
epoch 60 0.024948543688929292 1.9603901788097338
epoch 65 0.023551300913806528 1.9617942895391849
epoch 70 0.024007680023352962 1.9613357777035652
epoch 75 0.023963171394445815 1.9613804990447448
epoch 80 0.022300742524000494 1.9630501431760758
epoch 85 0.021594446047497495 1.9637590754350216
epoch 90 0.023479374622665694 1.961866542177227
epoch 95 0.023457549302807745 1.9618884659975966
[32m[I 2022-02-17 11:47:51,836][0m Trial 49 finished with value: 1.96141897580844 and parameters: {'n_layers_mlp': 4, 'mlp_n_units_l0': 27, 'mlp_dropout_l0': 0.05831618444266118, 'mlp_n_units_l1': 37, 'mlp_dropout_l1': 0.01666601014239226, 'mlp_n_units_l2': 58, 'mlp_dropout_l2': 0.10080402172856079, 'mlp_n_units_l3': 13, 'mlp_dropout_l3': 0.2273037943024075, 'lr': 6.719495118115785e-05, 'weight_decay': 0.07354361197553078, 'criterion': 'MSELoss', 'batch_size': 256}. Best is trial 47 with value: 1.9546326616856085.[0m
Trial Id: 50 | Model params: 2418 | Timestamp: 2022-02-17 11:47:51.837235

epoch 0 -1.8489458948192694 3.3509724030610175
epoch 5 0.020726655317053422 1.9646297543757634
epoch 10 0.024735301320485736 1.9606045343642553
epoch 15 0.025926876370443885 1.9594064383612082
epoch 20 0.027344239597973052 1.9579803638875422
epoch 25 0.028422555404104433 1.956894724572078
epoch 30 0.028857051625678865 1.9564571071434487
epoch 35 0.029065332901410668 1.9562472949659426
epoch 40 0.02963830073155338 1.9556699995947648
epoch 45 0.02969474230467506 1.9556131225063005
epoch 50 0.029867077875066705 1.955439446920105
epoch 55 0.029958223651528004 1.9553475861920002
epoch 60 0.029968226980977897 1.9553375041331664
epoch 65 0.029266898507942285 1.956044226390486
epoch 70 0.02990687412470261 1.955399339037627
epoch 75 0.03023086226077787 1.9550727832283135
epoch 80 0.030215293099922214 1.9550884770255756
epoch 85 0.030257591654305527 1.9550458395631354
epoch 90 0.030238781688417093 1.9550648003546358
epoch 95 0.030408057136925404 1.9548941609705004
[32m[I 2022-02-17 11:54:45,774][0m Trial 50 finished with value: 1.9548951001181076 and parameters: {'n_layers_mlp': 2, 'mlp_n_units_l0': 55, 'mlp_dropout_l0': 0.1425638810838949, 'mlp_n_units_l1': 26, 'mlp_dropout_l1': 0.0771303149599949, 'lr': 4.186206665793796e-05, 'weight_decay': 0.037242741588288296, 'criterion': 'MSELoss', 'batch_size': 256}. Best is trial 47 with value: 1.9546326616856085.[0m
Trial Id: 51 | Model params: 2175 | Timestamp: 2022-02-17 11:54:45.774794

epoch 0 -2.91622743706747 3.9288251691460694
epoch 5 -2.91622743706747 3.9288251691460694
epoch 10 -2.91622743706747 3.9288251691460694
epoch 15 0.023071685889739513 1.9622760304157787
epoch 20 0.027218869058339812 1.958106546836972
epoch 25 0.028116745737911453 1.9572026723547404
epoch 30 0.029781234335353624 1.9555259598745585
epoch 35 0.03041253899877383 1.9548896427936802
epoch 40 0.031001241901243426 1.9542960790380117
epoch 45 0.031122412719775006 1.9541738853525417
epoch 50 0.03161384226870223 1.953678229033755
epoch 55 0.03180265673317606 1.9534877571396534
epoch 60 0.03216908553549758 1.953118058790113
epoch 65 0.03241822608666034 1.9528666552537082
epoch 70 0.03260902876331229 1.9526740975980263
epoch 75 0.03269065624286949 1.952591713519512
epoch 80 0.0328545998650267 1.9524262398140586
epoch 85 0.032992201329574034 1.9522873432911034
epoch 90 0.03295603991961993 1.9523238459972232
epoch 95 0.03316486395119389 1.9521130416465498
[32m[I 2022-02-17 12:01:43,025][0m Trial 51 finished with value: 1.9520837588591413 and parameters: {'n_layers_mlp': 2, 'mlp_n_units_l0': 46, 'mlp_dropout_l0': 0.17181981188389472, 'mlp_n_units_l1': 29, 'mlp_dropout_l1': 0.06818962823430286, 'lr': 4.636591277183415e-05, 'weight_decay': 0.011987550694549577, 'criterion': 'MSELoss', 'batch_size': 256}. Best is trial 51 with value: 1.9520837588591413.[0m
Trial Id: 52 | Model params: 2532 | Timestamp: 2022-02-17 12:01:43.026010

[32m[I 2022-02-17 12:01:47,239][0m Trial 52 pruned. [0m
epoch 0 -1.1523468631020202 2.9126270685108433
Trial Id: 53 | Model params: 1983 | Timestamp: 2022-02-17 12:01:47.239200

epoch 0 -2.2522290306737474 3.580299118261919
epoch 5 0.009439682855824194 1.9759193457529556
epoch 10 0.018272039809522855 1.9670904526801833
epoch 15 0.023464452102601285 1.9618815320710579
epoch 20 0.0257678787112553 1.9595663484939239
epoch 25 0.02685367969459429 1.9584740563220255
epoch 30 0.0278782216532234 1.9574428304878975
epoch 35 0.028179447600264584 1.957139536051365
epoch 40 0.028306398572994662 1.9570116992392987
epoch 45 0.02907968892963586 1.9562328325895617
epoch 50 0.029068942812595977 1.956243658322925
epoch 55 0.029316916827089368 1.955993831846109
epoch 60 0.02904124675769204 1.9562715592974558
epoch 65 0.029771012961910426 1.9555362607000923
epoch 70 0.029732864250677782 1.9555747054671573
epoch 75 0.02969235636169376 1.9556155268932183
epoch 80 0.029724021092420005 1.95558361714548
epoch 85 0.030025579402741975 1.9552796993261514
epoch 90 0.0300517840133675 1.955253287449634
epoch 95 0.03002153886725356 1.9552837717885894
[32m[I 2022-02-17 12:08:42,809][0m Trial 53 finished with value: 1.9552148934724838 and parameters: {'n_layers_mlp': 2, 'mlp_n_units_l0': 46, 'mlp_dropout_l0': 0.21478161064177798, 'mlp_n_units_l1': 25, 'mlp_dropout_l1': 0.05333900627229339, 'lr': 2.494945143665157e-05, 'weight_decay': 0.03734850055530917, 'criterion': 'MSELoss', 'batch_size': 256}. Best is trial 51 with value: 1.9520837588591413.[0m
Trial Id: 54 | Model params: 2511 | Timestamp: 2022-02-17 12:08:42.809958

[32m[I 2022-02-17 12:08:46,942][0m Trial 54 pruned. [0m
epoch 0 -1.9031928424639486 3.3827249971245084
Trial Id: 55 | Model params: 2074 | Timestamp: 2022-02-17 12:08:46.942678

[32m[I 2022-02-17 12:08:51,020][0m Trial 55 pruned. [0m
epoch 0 -1.2095919761123346 2.9511058875359315
Trial Id: 56 | Model params: 3078 | Timestamp: 2022-02-17 12:08:51.021182

[32m[I 2022-02-17 12:08:55,210][0m Trial 56 pruned. [0m
epoch 0 0.019774797736916816 1.9655843364295273
Trial Id: 57 | Model params: 2622 | Timestamp: 2022-02-17 12:08:55.210380

[32m[I 2022-02-17 12:08:59,212][0m Trial 57 pruned. [0m
epoch 0 0.008304116559215369 1.977051606293136
Trial Id: 58 | Model params: 2181 | Timestamp: 2022-02-17 12:08:59.212724

epoch 0 -2.5591476558131188 3.745430590981988
epoch 5 0.01800089616953282 1.9673620794774018
epoch 10 0.022829336964825253 1.9625194085583206
epoch 15 0.02493895483404751 1.9603998182244535
epoch 20 0.026528458976829872 1.958801285187137
epoch 25 0.027718873963878177 1.9576032533989074
epoch 30 0.028069536139455065 1.9572502077093243
epoch 35 0.02883437151465973 1.9564799525985905
epoch 40 0.029197016063923997 1.9561146322986156
epoch 45 0.0296655114014045 1.9556425791680294
epoch 50 0.02978188806186577 1.9555253010646974
epoch 55 0.029958557585158196 1.955347249631045
epoch 60 0.03034599736009147 1.9549567225228162
epoch 65 0.030714283895624583 1.9545854289406717
epoch 70 0.030660530696487442 1.9546396254285854
epoch 75 0.03070101460288155 1.9545988078015448
epoch 80 0.031254344388800814 1.9540408312892794
epoch 85 0.031475548239553786 1.9538177252390623
epoch 90 0.031219381260008783 1.954076092745387
epoch 95 0.03164698476274508 1.9536447969557733
[32m[I 2022-02-17 12:15:55,892][0m Trial 58 finished with value: 1.9535097075828556 and parameters: {'n_layers_mlp': 2, 'mlp_n_units_l0': 52, 'mlp_dropout_l0': 0.2545758598613722, 'mlp_n_units_l1': 24, 'mlp_dropout_l1': 0.08171451915432033, 'lr': 1.6362096256017073e-05, 'weight_decay': 0.010361899555904192, 'criterion': 'MSELoss', 'batch_size': 256}. Best is trial 51 with value: 1.9520837588591413.[0m
Trial Id: 59 | Model params: 2505 | Timestamp: 2022-02-17 12:15:55.892639

[32m[I 2022-02-17 12:16:00,220][0m Trial 59 pruned. [0m
epoch 0 -1.4293454286685825 3.0943781532578205
Trial Id: 60 | Model params: 2319 | Timestamp: 2022-02-17 12:16:00.220935

[32m[I 2022-02-17 12:16:04,485][0m Trial 60 pruned. [0m
epoch 0 -0.6305688228472293 2.5351188094943766
Trial Id: 61 | Model params: 2307 | Timestamp: 2022-02-17 12:16:04.485367

epoch 0 -2.91622743706747 3.9288251691460694
epoch 5 -2.91622743706747 3.9288251691460694
epoch 10 -2.91622743706747 3.9288251691460694
epoch 15 -0.31539352379513974 2.276966285295219
epoch 20 0.019244812219610496 1.9661156380410816
epoch 25 0.0228046823121818 1.9625441662239775
epoch 30 0.02461349097468446 1.9607269700783225
epoch 35 0.025745930249791882 1.9595884218906576
epoch 40 0.026070112095351483 1.9592623694442728
epoch 45 0.026489960220602127 1.9588400180439403
epoch 50 0.027208170114680907 1.9581173147339601
epoch 55 0.02746976552337088 1.9578540163978688
epoch 60 0.02755803357191211 1.957765165754128
epoch 65 0.027956399432566892 1.9573641203849863
epoch 70 0.027524819330384642 1.9577985996926444
epoch 75 0.027966200820076503 1.957354252035155
epoch 80 0.027686310717897844 1.9576360347523845
epoch 85 0.02796199509213304 1.9573584865024007
epoch 90 0.028268914609313245 1.9570494456276226
epoch 95 0.027981643641610265 1.9573387036085086
[32m[I 2022-02-17 12:23:01,121][0m Trial 61 finished with value: 1.957259011202213 and parameters: {'n_layers_mlp': 2, 'mlp_n_units_l0': 50, 'mlp_dropout_l0': 0.2382378540387029, 'mlp_n_units_l1': 28, 'mlp_dropout_l1': 0.10512893665553093, 'lr': 2.4661987680276178e-05, 'weight_decay': 0.060041681994203004, 'criterion': 'MSELoss', 'batch_size': 256}. Best is trial 51 with value: 1.9520837588591413.[0m
Trial Id: 62 | Model params: 1682 | Timestamp: 2022-02-17 12:23:01.121967

epoch 0 -2.581467079843629 3.757156039527962
epoch 5 -0.3066942449423855 2.2694245030279094
epoch 10 0.01567996390124915 1.9696856148671262
epoch 15 0.018996154079158334 1.9663648641886815
epoch 20 0.021757281617410085 1.9635956548918636
epoch 25 0.023507468481751226 1.9618383211662367
epoch 30 0.024717787956308745 1.9606221381117888
epoch 35 0.025700354225469013 1.959634256549133
epoch 40 0.02613180081075317 1.959200318626162
epoch 45 0.02684108345937275 1.9584867313532852
epoch 50 0.027112715403197152 1.9582133820181735
epoch 55 0.027488191619570834 1.9578354690170001
epoch 60 0.027925516125022587 1.9573952143595426
epoch 65 0.02789846698675913 1.9574224476047066
epoch 70 0.02827909868562284 1.9570391903247844
epoch 75 0.02804919935347583 1.9572706844676149
epoch 80 0.02824692406158802 1.957071589791992
epoch 85 0.028378643016294114 1.9569389469598983
epoch 90 0.028182555649118313 1.9571364064148595
epoch 95 0.028754400119733403 1.9565605048779817
[32m[I 2022-02-17 12:29:55,667][0m Trial 62 finished with value: 1.9566648196980292 and parameters: {'n_layers_mlp': 2, 'mlp_n_units_l0': 47, 'mlp_dropout_l0': 0.22331019198312976, 'mlp_n_units_l1': 18, 'mlp_dropout_l1': 0.0850442335554848, 'lr': 1.313537319170231e-05, 'weight_decay': 0.041240885971739194, 'criterion': 'MSELoss', 'batch_size': 256}. Best is trial 51 with value: 1.9520837588591413.[0m
Trial Id: 63 | Model params: 2327 | Timestamp: 2022-02-17 12:29:55.668142

