[32m[I 2022-02-16 20:02:50,643][0m Trial 95 finished with value: 4.2861286160067555 and parameters: {'n_layers_mlp': 2, 'mlp_n_units_l0': 41, 'mlp_dropout_l0': 0.10588636308559862, 'mlp_n_units_l1': 64, 'mlp_dropout_l1': 0.05838200144672516, 'lr': 1.8358216364153427e-05, 'weight_decay': 0.024248948391988805, 'criterion': 'MSELoss', 'batch_size': 256}. Best is trial 73 with value: 4.272035952774967.[0m
Trial Id: 96 | Model params: 2739 | Timestamp: 2022-02-16 20:02:50.643945

epoch 0 -3.3470245967459027 8.978399079938553
epoch 5 -0.4045466080851141 5.103533081721797
epoch 10 -0.00027804129865893756 4.3068844892753795
epoch 15 0.004706312679592761 4.296140553499937
epoch 20 0.0066376258245666175 4.291970316211246
epoch 25 0.007354395243848955 4.290421582187352
epoch 30 0.0076548667685572 4.289772182704458
epoch 35 0.007853816273661662 4.289342145409884
epoch 40 0.008029900527891876 4.288961496297966
epoch 45 0.008173477608047208 4.288651094375079
epoch 50 0.008311351237441533 4.288353001700346
epoch 55 0.008421660664612696 4.288114489885609
epoch 60 0.00855091444068301 4.287834999586543
epoch 65 0.008592036533030867 4.287746075920277
epoch 70 0.008723256532533807 4.287462309460243
epoch 75 0.008828964495789071 4.287233699743275
epoch 80 0.008913008327569028 4.287051933341065
epoch 85 0.008905009186812696 4.287069233872168
epoch 90 0.009035196147568536 4.286787657005822
epoch 95 0.009123781848600854 4.286596047487796
[32m[I 2022-02-16 20:09:40,022][0m Trial 96 finished with value: 4.286559464114072 and parameters: {'n_layers_mlp': 2, 'mlp_n_units_l0': 31, 'mlp_dropout_l0': 0.06233967994214061, 'mlp_n_units_l1': 67, 'mlp_dropout_l1': 0.028255328803813207, 'lr': 1.2014593136532147e-05, 'weight_decay': 0.015207259989775044, 'criterion': 'MSELoss', 'batch_size': 256}. Best is trial 73 with value: 4.272035952774967.[0m
Trial Id: 97 | Model params: 4855 | Timestamp: 2022-02-16 20:09:40.022762

[32m[I 2022-02-16 20:10:05,887][0m Trial 97 pruned. [0m
epoch 0 0.0004030532491421379 4.305486079937116
Trial Id: 98 | Model params: 3522 | Timestamp: 2022-02-16 20:10:05.888168

epoch 0 -3.313871526752332 8.944096167885277
epoch 5 -0.10783908456899383 4.532535331255135
epoch 10 -0.0008899290013135719 4.308201586447754
epoch 15 0.0037067330860138803 4.298297332357053
epoch 20 0.0053175959982226795 4.29482106235792
epoch 25 0.005927199440554087 4.29350479348869
epoch 30 0.006421504585622517 4.292437182844817
epoch 35 0.006616680669442654 4.2920155643062685
epoch 40 0.006999687499697038 4.29118807418883
epoch 45 0.007242673901428964 4.290663016879698
epoch 50 0.007437912755241527 4.2902410883288145
epoch 55 0.0076371763716159835 4.289810419116343
epoch 60 0.007844323937870601 4.289362664451961
epoch 65 0.007994499756344475 4.28903802642301
epoch 70 0.00815359813689498 4.288694073508319
epoch 75 0.008286395353478526 4.288406959647106
epoch 80 0.008437884786254735 4.288079408857253
epoch 85 0.008524314081444384 4.28789252003211
epoch 90 0.008481729899698198 4.287984602186203
epoch 95 0.008771168978276789 4.287358692942998
[32m[I 2022-02-16 20:16:55,307][0m Trial 98 finished with value: 4.287326299723912 and parameters: {'n_layers_mlp': 2, 'mlp_n_units_l0': 43, 'mlp_dropout_l0': 0.09464209796928098, 'mlp_n_units_l1': 62, 'mlp_dropout_l1': 0.04173876084250504, 'lr': 1.479877552124088e-05, 'weight_decay': 0.02114082666046003, 'criterion': 'MSELoss', 'batch_size': 256}. Best is trial 73 with value: 4.272035952774967.[0m
Trial Id: 99 | Model params: 4191 | Timestamp: 2022-02-16 20:16:55.307338

[32m[I 2022-02-16 20:16:59,540][0m Trial 99 pruned. [0m
epoch 0 -1.3502790353061278 6.601803140689353
Study statistics: 
  Number of finished trials:  100
  Number of pruned trials:  61
  Number of complete trials:  39

Best trial:
  Value:  4.272035952774967
  Params: 
    n_layers_mlp: 2
    mlp_n_units_l0: 40
    mlp_dropout_l0: 0.07978735733820252
    mlp_n_units_l1: 73
    mlp_dropout_l1: 0.013519451075517101
    lr: 0.00034294857273689517
    weight_decay: 0.0004828378731781737
    criterion: MSELoss
    batch_size: 256
Target: 67706, NaN: 0, Max: 143.0, Min: 0.0, Mean: 8.148790358313887
Prediction: 67706, NaN: 0, Max: 13.990699768066406, Min: 6.309191703796387, Mean: 8.079091314283062

 XXXXXX======== TRIAL des - lrg ended

Test Set - R-squared:  0.015538538551172931
Test Set - RMSE:  4.17722801255978
Test Set - MAE:  3.082781167318102



[32m[I 2022-02-16 20:17:11,291][0m A new study created in memory with name: NeuralNetwork[0m
++++++++ Session Characteristics +++++++

Area: des
Gal Type: elg
Training Samples: 216656
Validation Samples: 54164
Test Samples: 67706
Number of features: 16
Device: cuda:0
Number of Workers: 8
Number of Trials: 100

+++++++++++++++++++++++++++++++++++++++
Trial Id: 0 | Model params: 2187 | Timestamp: 2022-02-16 20:17:11.292089

epoch 0 -18.351469942863307 31.710014485692877
epoch 5 -15.038292234338545 28.868121321996405
epoch 10 -14.966712091023027 28.803628949646306
epoch 15 -14.932903085072157 28.773117404349858
epoch 20 -14.914812492954386 28.756777928564713
epoch 25 -14.896030683349096 28.73980431442991
epoch 30 -14.865994279408705 28.712638773571143
epoch 35 -14.845967709452296 28.694512042137156
epoch 40 -14.85230763104697 28.70025175986911
epoch 45 -14.840059914565765 28.689162507855897
epoch 50 -14.83475015673554 28.684353647469557
epoch 55 -14.835364332083817 28.684909925651805
epoch 60 -14.828701903613903 28.67887497557538
epoch 65 -14.830052272702881 28.680098267307685
epoch 70 -14.82503962659956 28.675557076825896
epoch 75 -14.812538746016111 28.664228810237503
epoch 80 -14.816057218985128 28.667417694267364
epoch 85 -14.813780111174218 28.665353932432318
epoch 90 -14.809174101436039 28.66117901302681
epoch 95 -14.800039637735841 28.652897671892564
[32m[I 2022-02-16 20:24:13,081][0m Trial 0 finished with value: 28.65339312644443 and parameters: {'n_layers_mlp': 2, 'mlp_n_units_l0': 72, 'mlp_dropout_l0': 0.16430705947200677, 'mlp_n_units_l1': 13, 'mlp_dropout_l1': 0.1465155042818285, 'lr': 1.5636857417858997e-05, 'weight_decay': 0.11212427958533645, 'criterion': 'PoissonNLLLoss', 'batch_size': 256}. Best is trial 0 with value: 28.65339312644443.[0m
Trial Id: 1 | Model params: 3608 | Timestamp: 2022-02-16 20:24:13.081516

epoch 0 -0.446579375777024 8.669830263956827
epoch 5 -0.06795309514735592 7.449301462995401
epoch 10 0.015346187379540188 7.152885020020518
epoch 15 0.009652686580077008 7.1735350471259265
epoch 20 -0.001083774053586728 7.21231475520182
epoch 25 0.015683911771397274 7.151658238136727
epoch 30 0.014590048158989455 7.155630928729249
epoch 35 0.014955203049573873 7.154305005579167
epoch 40 0.012742368801304305 7.162336320595637
epoch 45 0.01796588778136321 7.143363452310804
epoch 50 0.014595852611694049 7.155609853956062
epoch 55 -0.006477846630969619 7.231719467047482
epoch 60 0.011932134402964256 7.1652747537413575
epoch 65 0.01850045310458248 7.141418960696469
epoch 70 0.0125959740353071 7.162867331777179
epoch 75 0.0010752782763728819 7.204533103750143
epoch 80 0.01515735959338016 7.153570844153556
epoch 85 0.014541666103551565 7.155806591600436
epoch 90 -0.011585293285306442 7.250045196668962
epoch 95 0.014293312850804929 7.156708230881598
[32m[I 2022-02-16 20:32:33,850][0m Trial 1 finished with value: 7.1479586967124265 and parameters: {'n_layers_mlp': 4, 'mlp_n_units_l0': 55, 'mlp_dropout_l0': 0.07789322704288139, 'mlp_n_units_l1': 21, 'mlp_dropout_l1': 0.044577339262187876, 'mlp_n_units_l2': 20, 'mlp_dropout_l2': 0.23320018791009348, 'mlp_n_units_l3': 48, 'mlp_dropout_l3': 0.05936284891541843, 'lr': 0.007241888639465851, 'weight_decay': 0.2922130443964712, 'criterion': 'MSELoss', 'batch_size': 256}. Best is trial 1 with value: 7.1479586967124265.[0m
Trial Id: 2 | Model params: 5880 | Timestamp: 2022-02-16 20:32:33.850210

epoch 0 -14.78316479754434 28.637592576135006
epoch 5 -14.728116441888222 28.587608007533962
epoch 10 -14.756961661944514 28.613810703475117
epoch 15 -14.748785808538106 28.6063862811416
epoch 20 -14.720899812589199 28.581048740220727
epoch 25 -14.762330328385085 28.618684895775452
epoch 30 -14.736137523677488 28.59489668431305
epoch 35 -14.71855898982651 28.578920819398586
epoch 40 -14.766412482480822 28.62239051278664
epoch 45 -14.744914566117236 28.602870166829376
epoch 50 -14.753281087460108 28.610468643801894
epoch 55 -14.759978359551958 28.616549654201965
epoch 60 -14.785531538946373 28.639739649810817
epoch 65 -14.761571924480942 28.617996394044155
epoch 70 -14.750949098476678 28.60835093363576
epoch 75 -14.735178273815345 28.59402512136786
epoch 80 -14.732792334434563 28.591857170175857
epoch 85 -14.745778802963367 28.603655160453634
epoch 90 -14.739858773268653 28.598277515770224
epoch 95 -14.747328508786628 28.605062717390023
[32m[I 2022-02-16 20:39:34,697][0m Trial 2 finished with value: 28.571122995049613 and parameters: {'n_layers_mlp': 2, 'mlp_n_units_l0': 79, 'mlp_dropout_l0': 0.2335854718903412, 'mlp_n_units_l1': 56, 'mlp_dropout_l1': 0.2850649168069633, 'lr': 0.0024249866601875197, 'weight_decay': 0.20090494664048011, 'criterion': 'PoissonNLLLoss', 'batch_size': 256}. Best is trial 1 with value: 7.1479586967124265.[0m
Trial Id: 3 | Model params: 7028 | Timestamp: 2022-02-16 20:39:34.697454

epoch 0 -0.12122050443706534 7.632819216648141
epoch 5 -0.052249925431200994 7.3943314245473735
epoch 10 -0.004787373253891003 7.2256437412602725
epoch 15 -0.005995313749980635 7.2299857176230296
epoch 20 0.014471826041927649 7.15606015540006
epoch 25 0.013044145773902338 7.16124157424955
epoch 30 0.007473654927684259 7.181422568431886
epoch 35 0.005716994855425761 7.18777491432223
epoch 40 0.008985708915160706 7.175950251510277
epoch 45 0.013523491510254226 7.159502323449853
epoch 50 0.02029640868116489 7.134882256858839
epoch 55 0.015109173867009162 7.153745844593687
epoch 60 0.015408607636763882 7.152658294650973
epoch 65 0.012819803128561347 7.162055430606781
epoch 70 0.014392011090130441 7.156349923388322
epoch 75 0.025285555416353467 7.116691852102004
epoch 80 0.01971528570941017 7.136998013782985
epoch 85 0.024532142656679246 7.119441770688959
epoch 90 0.014311764212018852 7.15664124765608
epoch 95 0.011086863483396048 7.168338968165321
[32m[I 2022-02-16 20:47:58,279][0m Trial 3 finished with value: 7.107373750656026 and parameters: {'n_layers_mlp': 4, 'mlp_n_units_l0': 78, 'mlp_dropout_l0': 0.16507918553950113, 'mlp_n_units_l1': 39, 'mlp_dropout_l1': 0.0675747674695317, 'mlp_n_units_l2': 52, 'mlp_dropout_l2': 0.11261628338913152, 'mlp_n_units_l3': 10, 'mlp_dropout_l3': 0.20403457541442788, 'lr': 0.00015904077774715354, 'weight_decay': 0.20128920999141223, 'criterion': 'MSELoss', 'batch_size': 256}. Best is trial 3 with value: 7.107373750656026.[0m
Trial Id: 4 | Model params: 7144 | Timestamp: 2022-02-16 20:47:58.279198

epoch 0 0.016261396809755357 7.148220614328262
epoch 5 0.0323771681550139 7.089427152381079
epoch 10 0.03172628396921717 7.091811149608814
epoch 15 0.02969871546544889 7.0992324051206515
epoch 20 0.024906312949237508 7.1167426740113005
epoch 25 0.037156010804551 7.071899046599976
epoch 30 0.0358027714959549 7.076866939472506
epoch 35 0.028953051611808056 7.101959714897817
epoch 40 0.03409657541979505 7.083125610078041
epoch 45 0.015276939870147443 7.151796440103367
epoch 50 0.03337445872637823 7.085772814497132
epoch 55 0.03374544077090247 7.08441295660018
epoch 60 0.02463039230490882 7.117749509229663
epoch 65 0.02447310702140304 7.118323379950955
epoch 70 0.03155816032659853 7.092426806810119
epoch 75 0.03318057346813663 7.086483409215488
epoch 80 0.03534231522736808 7.07855653092893
epoch 85 0.03577835515361483 7.0769565425676495
epoch 90 0.024028781594850113 7.119944294776093
epoch 95 0.03599617745374406 7.076157138183178
[32m[I 2022-02-16 21:43:43,048][0m Trial 4 finished with value: 7.0801956527286 and parameters: {'n_layers_mlp': 4, 'mlp_n_units_l0': 43, 'mlp_dropout_l0': 0.036547866584701216, 'mlp_n_units_l1': 52, 'mlp_dropout_l1': 0.010798612524738594, 'mlp_n_units_l2': 45, 'mlp_dropout_l2': 0.07619457259310598, 'mlp_n_units_l3': 37, 'mlp_dropout_l3': 0.14351994312657673, 'lr': 0.0025520831171457286, 'weight_decay': 0.05990478954993249, 'criterion': 'MSELoss', 'batch_size': 32}. Best is trial 4 with value: 7.0801956527286.[0m
Trial Id: 5 | Model params: 8014 | Timestamp: 2022-02-16 21:43:43.049013

epoch 0 -14.712223981066915 28.567808194162662
epoch 5 -14.736392392949996 28.589771133755505
epoch 10 -14.712916798686937 28.568438024246866
epoch 15 -14.73953689150625 28.592627442914655
epoch 20 -14.725894534915472 28.580233324111973
epoch 25 -14.724941431371814 28.57936722602305
epoch 30 -14.742057050449137 28.594916426448982
epoch 35 -14.70870888090848 28.564612455474894
epoch 40 -14.753115933072365 28.604958706975466
epoch 45 -14.777579863802815 28.627161243160362
epoch 50 -14.732411705313796 28.586154861877187
epoch 55 -14.729672977399513 28.583666587693607
epoch 60 -14.732363708724781 28.5861112563894
epoch 65 -14.690888368651418 28.5484055068554
epoch 70 -14.750695455582413 28.602761036408147
epoch 75 -14.716426817707468 28.571628716425607
epoch 80 -14.731688463413322 28.585497780719706
epoch 85 -14.721930497101397 28.576630976857555
epoch 90 -14.750776516129111 28.602834637998313
epoch 95 -14.758380934851964 28.60973847808351
[32m[I 2022-02-16 22:40:32,821][0m Trial 5 finished with value: 28.582172707383123 and parameters: {'n_layers_mlp': 4, 'mlp_n_units_l0': 41, 'mlp_dropout_l0': 0.26518272920727637, 'mlp_n_units_l1': 59, 'mlp_dropout_l1': 0.017194591853832642, 'mlp_n_units_l2': 35, 'mlp_dropout_l2': 0.1140682985161512, 'mlp_n_units_l3': 74, 'mlp_dropout_l3': 0.1357393320050139, 'lr': 0.0020007769848796315, 'weight_decay': 0.17435956046188147, 'criterion': 'PoissonNLLLoss', 'batch_size': 32}. Best is trial 4 with value: 7.0801956527286.[0m
Trial Id: 6 | Model params: 1221 | Timestamp: 2022-02-16 22:40:32.821726

epoch 0 -18.618272994773548 31.921881228743914
epoch 5 -0.12674975344778794 7.650183042550879
epoch 10 -0.0004216344911809333 7.208578431369445
epoch 15 0.008477470124878317 7.176445384446198
epoch 20 0.012459926119894549 7.162018766456616
epoch 25 0.0142615239165782 7.155482845632323
epoch 30 0.015291097182934754 7.151745029413797
epoch 35 0.01614952619021459 7.148627050109415
epoch 40 0.016411163087831526 7.147676464112935
epoch 45 0.01723767425039735 7.144672731388223
epoch 50 0.017861541496473232 7.142404616912463
epoch 55 0.018549157589989096 7.139903904190059
epoch 60 0.019380740145821695 7.136878445600439
epoch 65 0.0204389945962703 7.133026455113471
epoch 70 0.021042930764990198 7.13082722666108
epoch 75 0.021958749883883022 7.127490984364213
epoch 80 0.022803055264894123 7.124413875765453
epoch 85 0.023045968618333856 7.123528320996579
epoch 90 0.02331615439227397 7.122543213693187
epoch 95 0.023545970173473596 7.121705189627678
[32m[I 2022-02-16 22:52:13,515][0m Trial 6 finished with value: 7.118464753501459 and parameters: {'n_layers_mlp': 2, 'mlp_n_units_l0': 31, 'mlp_dropout_l0': 0.0027696754049410964, 'mlp_n_units_l1': 21, 'mlp_dropout_l1': 0.0029221129604794283, 'lr': 7.95418156346147e-05, 'weight_decay': 0.08348194611732099, 'criterion': 'MSELoss', 'batch_size': 128}. Best is trial 4 with value: 7.0801956527286.[0m
Trial Id: 7 | Model params: 6086 | Timestamp: 2022-02-16 22:52:13.516060

epoch 0 -18.320293038311426 31.684460390648844
epoch 5 -15.025863140006287 28.856933280902396
epoch 10 -14.927225412380782 28.767990312999014
epoch 15 -14.852337598231905 28.700278887318493
epoch 20 -14.822100426467436 28.672893983494014
epoch 25 -14.79979566739117 28.652676454589745
epoch 30 -14.783589626669647 28.637977986846188
epoch 35 -14.763088220154406 28.61937291602881
epoch 40 -14.749153309693423 28.606720047147636
epoch 45 -14.745125934696391 28.60306215668462
epoch 50 -14.744616134021653 28.602599093433064
epoch 55 -14.747292759013458 28.605030247594165
epoch 60 -14.744377418317463 28.602382260091208
epoch 65 -14.739585380379909 28.598029146335428
epoch 70 -14.743903374226283 28.601951665346018
epoch 75 -14.742344377497984 28.600535515490318
epoch 80 -14.740459407698836 28.598823166989224
epoch 85 -14.744591099737132 28.60257635404449
epoch 90 -14.738193000382992 28.596764176406072
epoch 95 -14.740483675383963 28.598845212945765
[32m[I 2022-02-16 23:00:51,255][0m Trial 7 finished with value: 28.597615921971386 and parameters: {'n_layers_mlp': 4, 'mlp_n_units_l0': 45, 'mlp_dropout_l0': 0.20112521694442215, 'mlp_n_units_l1': 53, 'mlp_dropout_l1': 0.24939692084700552, 'mlp_n_units_l2': 24, 'mlp_dropout_l2': 0.12192798612566609, 'mlp_n_units_l3': 61, 'mlp_dropout_l3': 0.11865141734016418, 'lr': 1.7394052119175376e-05, 'weight_decay': 0.01684561547747806, 'criterion': 'PoissonNLLLoss', 'batch_size': 256}. Best is trial 4 with value: 7.0801956527286.[0m
Trial Id: 8 | Model params: 5500 | Timestamp: 2022-02-16 23:00:51.256076

epoch 0 -14.901848629339428 28.739678009719704
epoch 5 -14.77965025910565 28.629039465182235
epoch 10 -14.751157427448497 28.603180496426265
epoch 15 -14.74601795324404 28.59851362344823
epoch 20 -14.746736973473178 28.599166571867976
epoch 25 -14.758444986804095 28.60979662199261
epoch 30 -14.732953640479447 28.586647211983795
epoch 35 -14.725620330415873 28.579984153461563
epoch 40 -14.732790093859197 28.586498630166524
epoch 45 -14.741834263884465 28.594714083587533
epoch 50 -14.745987465141164 28.598485936611787
epoch 55 -14.750204523112169 28.602315274073668
epoch 60 -14.755336085749791 28.606974344342014
epoch 65 -14.743530227695262 28.596254383572322
epoch 70 -14.733495585612518 28.587139562665968
epoch 75 -14.744324132829798 28.596975391715123
epoch 80 -14.742469095715009 28.59529065717386
epoch 85 -14.74379545314502 28.59649525783552
epoch 90 -14.75126212174815 28.603275555630255
epoch 95 -14.74166101483469 28.59455673150927
[32m[I 2022-02-16 23:16:09,785][0m Trial 8 finished with value: 28.601220020483034 and parameters: {'n_layers_mlp': 4, 'mlp_n_units_l0': 54, 'mlp_dropout_l0': 0.205376655742129, 'mlp_n_units_l1': 30, 'mlp_dropout_l1': 0.27746038423726754, 'mlp_n_units_l2': 39, 'mlp_dropout_l2': 0.10507901516782521, 'mlp_n_units_l3': 42, 'mlp_dropout_l3': 0.10065325865608338, 'lr': 0.0001412518971235332, 'weight_decay': 0.19367031118703265, 'criterion': 'PoissonNLLLoss', 'batch_size': 128}. Best is trial 4 with value: 7.0801956527286.[0m
Trial Id: 9 | Model params: 7718 | Timestamp: 2022-02-16 23:16:09.786082

epoch 0 -18.61379064900279 31.924215095733725
epoch 5 -18.61379064900279 31.924215095733725
epoch 10 -18.61379064900279 31.924215095733725
epoch 15 -18.61379064900279 31.924215095733725
epoch 20 -10.113206086666905 24.030297340507335
epoch 25 -0.07020833397486559 7.45716280730163
epoch 30 -0.020732471486683446 7.2827504031733525
epoch 35 -0.0082195401902867 7.237973948911943
epoch 40 -0.0025583515412062052 7.217624602288188
epoch 45 0.0016690093735380884 7.202391705578165
epoch 50 0.006235298230916841 7.185901235695844
epoch 55 0.00960823576682901 7.173696034026394
epoch 60 0.011301748209015083 7.1675601079284785
epoch 65 0.011207201884203877 7.167902806150509
epoch 70 0.011996896826517722 7.165039927684002
epoch 75 0.011841186795543579 7.165604513276597
epoch 80 0.014277903395921832 7.156764170717978
epoch 85 0.015349746414378918 7.152872092944189
epoch 90 0.014845708009430192 7.154702621580148
epoch 95 0.015895721772921978 7.150888732152136
[32m[I 2022-02-16 23:24:33,058][0m Trial 9 finished with value: 7.148412658098681 and parameters: {'n_layers_mlp': 4, 'mlp_n_units_l0': 30, 'mlp_dropout_l0': 0.23845543160134544, 'mlp_n_units_l1': 63, 'mlp_dropout_l1': 0.20575517337816238, 'mlp_n_units_l2': 67, 'mlp_dropout_l2': 0.01403981516134164, 'mlp_n_units_l3': 14, 'mlp_dropout_l3': 0.08719814213388227, 'lr': 1.5487519729303905e-05, 'weight_decay': 0.2575606031296158, 'criterion': 'MSELoss', 'batch_size': 256}. Best is trial 4 with value: 7.0801956527286.[0m
Trial Id: 10 | Model params: 1925 | Timestamp: 2022-02-16 23:24:33.059028

[32m[I 2022-02-16 23:24:59,432][0m Trial 10 pruned. [0m
epoch 0 0.01293762989549796 7.160286311568781
Trial Id: 11 | Model params: 6706 | Timestamp: 2022-02-16 23:24:59.432689

[32m[I 2022-02-16 23:25:32,834][0m Trial 11 pruned. [0m
epoch 0 -0.010522946493024765 7.244879732952905
Trial Id: 12 | Model params: 4716 | Timestamp: 2022-02-16 23:25:32.834195

[32m[I 2022-02-16 23:26:06,172][0m Trial 12 pruned. [0m
epoch 0 -0.012584097307587694 7.252264613729321
Trial Id: 13 | Model params: 5524 | Timestamp: 2022-02-16 23:26:06.172252

[32m[I 2022-02-16 23:26:40,112][0m Trial 13 pruned. [0m
epoch 0 -0.009705068562232189 7.2419472776814215
Trial Id: 14 | Model params: 9780 | Timestamp: 2022-02-16 23:26:40.113158

[32m[I 2022-02-16 23:26:49,130][0m Trial 14 pruned. [0m
epoch 0 0.00044545115746763564 7.205453843882733
Trial Id: 15 | Model params: 10602 | Timestamp: 2022-02-16 23:26:49.130670

[32m[I 2022-02-16 23:27:22,283][0m Trial 15 pruned. [0m
epoch 0 0.008480569529369819 7.176434167996864
Trial Id: 16 | Model params: 6066 | Timestamp: 2022-02-16 23:27:22.284095

[32m[I 2022-02-16 23:27:27,396][0m Trial 16 pruned. [0m
epoch 0 -0.10671129988344918 7.583271981818526
Trial Id: 17 | Model params: 6658 | Timestamp: 2022-02-16 23:27:27.396712

[32m[I 2022-02-16 23:28:00,839][0m Trial 17 pruned. [0m
epoch 0 -0.009120162202256976 7.239849400403696
Trial Id: 18 | Model params: 6251 | Timestamp: 2022-02-16 23:28:00.839221

[32m[I 2022-02-16 23:28:06,096][0m Trial 18 pruned. [0m
epoch 0 -0.36437315539178217 8.419882743636629
Trial Id: 19 | Model params: 1164 | Timestamp: 2022-02-16 23:28:06.096521

[32m[I 2022-02-16 23:28:13,096][0m Trial 19 pruned. [0m
epoch 0 -0.08810929461065076 7.517862020797927
Trial Id: 20 | Model params: 6240 | Timestamp: 2022-02-16 23:28:13.096433

