[32m[I 2022-02-17 12:29:59,776][0m Trial 63 pruned. [0m
epoch 0 -2.047379274443403 3.465708290420953
Trial Id: 64 | Model params: 2246 | Timestamp: 2022-02-17 12:29:59.777121

epoch 0 -2.476410764163267 3.701640971174014
epoch 5 0.012837940828145489 1.9725270977636713
epoch 10 0.019366382154348494 1.9659937789062971
epoch 15 0.023159002694835062 1.962188335392548
epoch 20 0.02522921296565106 1.960108008627269
epoch 25 0.02626148901630143 1.9590698627629257
epoch 30 0.02711066298517073 1.9582154475556663
epoch 35 0.027779732766116227 1.957541985494778
epoch 40 0.028415072188392898 1.9569022606862772
epoch 45 0.02861026869172656 1.9567056748525973
epoch 50 0.029072569868951126 1.9562400044009667
epoch 55 0.029151383936130704 1.9561606048725855
epoch 60 0.02948608885482551 1.955823377726133
epoch 65 0.029759850330021265 1.9555475100386144
epoch 70 0.02989562060409401 1.9554106807647025
epoch 75 0.03000822106391776 1.9552971947646656
epoch 80 0.030159790044056112 1.9551444233771818
epoch 85 0.03025780806543843 1.9550456214156642
epoch 90 0.03031895008453178 1.9549839878588606
epoch 95 0.030495636060516418 1.9548058705335334
[32m[I 2022-02-17 12:36:59,120][0m Trial 64 finished with value: 1.954773052384328 and parameters: {'n_layers_mlp': 2, 'mlp_n_units_l0': 41, 'mlp_dropout_l0': 0.14305379605114554, 'mlp_n_units_l1': 36, 'mlp_dropout_l1': 0.06825700268794119, 'lr': 1.5818162959152425e-05, 'weight_decay': 0.02825368568467998, 'criterion': 'MSELoss', 'batch_size': 256}. Best is trial 51 with value: 1.9520837588591413.[0m
Trial Id: 65 | Model params: 2255 | Timestamp: 2022-02-17 12:36:59.120740

epoch 0 -2.91622743706747 3.9288251691460694
epoch 5 -2.91622743706747 3.9288251691460694
epoch 10 -2.91622743706747 3.9288251691460694
epoch 15 0.016407796276882713 1.9689572612745885
epoch 20 0.02334541609685059 1.962001101412658
epoch 25 0.02584814349321296 1.9594856247105659
epoch 30 0.027734741297167353 1.9575872795878515
epoch 35 0.028556339279496412 1.9567599900872437
epoch 40 0.028775926084930847 1.95653882288184
epoch 45 0.029453989493840038 1.9558557214982324
epoch 50 0.02974744279720687 1.9555600138719893
epoch 55 0.029898620195963677 1.9554076576680963
epoch 60 0.030211490427778598 1.955092310120256
epoch 65 0.030378090551723136 1.954924370096225
epoch 70 0.030153436888679663 1.9551508271722788
epoch 75 0.030690520716530334 1.9546093882738993
epoch 80 0.03077734560437284 1.9545218452625694
epoch 85 0.030885997930272246 1.9544122887558693
epoch 90 0.030949532786622158 1.954348222330759
epoch 95 0.031003660502674002 1.9542936400946165
[32m[I 2022-02-17 12:43:55,996][0m Trial 65 finished with value: 1.9542351378774687 and parameters: {'n_layers_mlp': 2, 'mlp_n_units_l0': 42, 'mlp_dropout_l0': 0.14074966058242408, 'mlp_n_units_l1': 35, 'mlp_dropout_l1': 0.06902067826016488, 'lr': 3.2395789451604665e-05, 'weight_decay': 0.02954866543754808, 'criterion': 'MSELoss', 'batch_size': 256}. Best is trial 51 with value: 1.9520837588591413.[0m
Trial Id: 66 | Model params: 1839 | Timestamp: 2022-02-17 12:43:55.996473

[32m[I 2022-02-17 12:44:00,255][0m Trial 66 pruned. [0m
epoch 0 -2.178233976123321 3.5393351035240834
Trial Id: 67 | Model params: 863 | Timestamp: 2022-02-17 12:44:00.255427

epoch 0 -2.91622743706747 3.9288251691460694
epoch 5 -2.91622743706747 3.9288251691460694
epoch 10 -0.9492354098311653 2.7717936567906785
epoch 15 0.015874866039117252 1.9694905995628673
epoch 20 0.022086400167566578 1.9632653124786936
epoch 25 0.02508403893902067 1.9602539640569727
epoch 30 0.026277031643612614 1.9590542275518723
epoch 35 0.027785527506070773 1.957536151701737
epoch 40 0.028580550579429098 1.9567356057610485
epoch 45 0.029031267577046105 1.9562816122152846
epoch 50 0.029129466605476217 1.9561826853370934
epoch 55 0.0297776979979405 1.95552952370653
epoch 60 0.0300699179850219 1.955235009838092
epoch 65 0.03037071747780995 1.9549318027740217
epoch 70 0.030596039265693542 1.9547046467206604
epoch 75 0.030415757016648337 1.9548863986948823
epoch 80 0.030808758432982253 1.9544901716543728
epoch 85 0.03102654066595767 1.9542705673441207
epoch 90 0.031173044052935417 1.9541228243500983
epoch 95 0.03132372089643565 1.9539708609337696
[32m[I 2022-02-17 12:50:56,015][0m Trial 67 finished with value: 1.9537635202677175 and parameters: {'n_layers_mlp': 2, 'mlp_n_units_l0': 14, 'mlp_dropout_l0': 0.18571144939383796, 'mlp_n_units_l1': 39, 'mlp_dropout_l1': 0.06675243507842128, 'lr': 3.169127518650076e-05, 'weight_decay': 0.024043284890002112, 'criterion': 'MSELoss', 'batch_size': 256}. Best is trial 51 with value: 1.9520837588591413.[0m
Trial Id: 68 | Model params: 847 | Timestamp: 2022-02-17 12:50:56.015470

epoch 0 -2.91622743706747 3.9288251691460694
epoch 5 -2.91622743706747 3.9288251691460694
epoch 10 -2.91622743706747 3.9288251691460694
epoch 15 0.015693232973045257 1.9696723387033979
epoch 20 0.021655521398554534 1.9636977822697186
epoch 25 0.025904449530219975 1.9594289946976517
epoch 30 0.027644065199842305 1.9576785624114477
epoch 35 0.028203610592879347 1.957115205097469
epoch 40 0.02905881967155899 1.9562538564099523
epoch 45 0.029534038870322465 1.9557750616130984
epoch 50 0.029932350301724475 1.9553736629321852
epoch 55 0.030431265612769876 1.954870764331456
epoch 60 0.03073142518987182 1.9545681459705737
epoch 65 0.031117325713723276 1.954179015454354
epoch 70 0.031292578209536126 1.9540022705052438
epoch 75 0.031539730161758706 1.953752986628398
epoch 80 0.031871288943371545 1.9534185178676398
epoch 85 0.032189469346662225 1.9530974910448988
epoch 90 0.03229386198623685 1.9529921530193326
epoch 95 0.032629282810247684 1.9526536561420844
[32m[I 2022-02-17 12:57:52,022][0m Trial 68 finished with value: 1.9525679521747998 and parameters: {'n_layers_mlp': 2, 'mlp_n_units_l0': 14, 'mlp_dropout_l0': 0.1768941290210561, 'mlp_n_units_l1': 38, 'mlp_dropout_l1': 0.0670880348726304, 'lr': 3.225799081391836e-05, 'weight_decay': 0.010401149622497694, 'criterion': 'MSELoss', 'batch_size': 256}. Best is trial 51 with value: 1.9520837588591413.[0m
Trial Id: 69 | Model params: 822 | Timestamp: 2022-02-17 12:57:52.022648

[32m[I 2022-02-17 12:57:56,189][0m Trial 69 pruned. [0m
epoch 0 0.018889265192515547 1.9664719875332786
Trial Id: 70 | Model params: 1007 | Timestamp: 2022-02-17 12:57:56.189493

epoch 0 -2.91622743706747 3.9288251691460694
epoch 5 -2.91622743706747 3.9288251691460694
epoch 10 -2.91622743706747 3.9288251691460694
epoch 15 0.0016365897550960629 1.983686685690113
epoch 20 0.0204296579456833 1.9649276516084098
epoch 25 0.0255152588124522 1.959820391322004
epoch 30 0.0271938948740017 1.9581316818845367
epoch 35 0.028071823653888273 1.9572479044371764
epoch 40 0.028755146997942238 1.9565597525900504
epoch 45 0.0289492842928486 1.9563641993268563
epoch 50 0.029664051686606352 1.9556440501449825
epoch 55 0.0300615953549751 1.9552433984132254
epoch 60 0.030330738282130287 1.9549721046692314
epoch 65 0.03062257505455912 1.9546778931757676
epoch 70 0.030888042810399585 1.95441022679982
epoch 75 0.031110839900789 1.9541855561938364
epoch 80 0.031289025918229796 1.9540058532066655
epoch 85 0.03145469979014015 1.9538387540580695
epoch 90 0.031680448781688963 1.9536110399630788
epoch 95 0.031788284851272386 1.9535022558321744
[32m[I 2022-02-17 13:04:51,616][0m Trial 70 finished with value: 1.953425790748931 and parameters: {'n_layers_mlp': 2, 'mlp_n_units_l0': 14, 'mlp_dropout_l0': 0.16997035854602643, 'mlp_n_units_l1': 48, 'mlp_dropout_l1': 0.0013718516427286415, 'lr': 3.246501734331426e-05, 'weight_decay': 0.019527929534473614, 'criterion': 'MSELoss', 'batch_size': 256}. Best is trial 51 with value: 1.9520837588591413.[0m
Trial Id: 71 | Model params: 1023 | Timestamp: 2022-02-17 13:04:51.617265

epoch 0 -2.91622743706747 3.9288251691460694
epoch 5 0.01732413288575907 1.9680398851386272
epoch 10 0.021800096648088907 1.9635526837935156
epoch 15 0.025096046154048035 1.9602418926250407
epoch 20 0.02665935498392291 1.958669587507362
epoch 25 0.02728528397676666 1.9580397025581258
epoch 30 0.027569203076867388 1.9577539222397242
epoch 35 0.02852378073007389 1.956792780837555
epoch 40 0.028886268942132864 1.9564276764316928
epoch 45 0.02940445014192905 1.955905637003242
epoch 50 0.029798775305598824 1.9555082824295686
epoch 55 0.029774671132933972 1.9555325740998553
epoch 60 0.0295810372694133 1.9557277032236975
epoch 65 0.03018111143659219 1.9551229318828083
epoch 70 0.03059795900230866 1.9547027112427318
epoch 75 0.031015682434683334 1.9542815170054049
epoch 80 0.031162229411057174 1.9541337308796012
epoch 85 0.03128229002962324 1.954012646741185
epoch 90 0.03150950614631076 1.9537834730621635
epoch 95 0.03147608210632791 1.9538171867505871
[32m[I 2022-02-17 13:11:47,623][0m Trial 71 finished with value: 1.9535628797715563 and parameters: {'n_layers_mlp': 2, 'mlp_n_units_l0': 14, 'mlp_dropout_l0': 0.16599947509365623, 'mlp_n_units_l1': 49, 'mlp_dropout_l1': 0.047739294640535335, 'lr': 3.364349211070607e-05, 'weight_decay': 0.02260676273741962, 'criterion': 'MSELoss', 'batch_size': 256}. Best is trial 51 with value: 1.9520837588591413.[0m
Trial Id: 72 | Model params: 1023 | Timestamp: 2022-02-17 13:11:47.624089

epoch 0 -2.91622743706747 3.9288251691460694
epoch 5 -2.91622743706747 3.9288251691460694
epoch 10 -0.04621147348695076 2.0306659642198133
epoch 15 0.018940631623228343 1.9664205091600122
epoch 20 0.023619073709064575 1.9617262068073598
epoch 25 0.026101739962062775 1.9592305561726298
epoch 30 0.027663146147503426 1.9576593541441318
epoch 35 0.027905481339803306 1.957415385545649
epoch 40 0.028717960310309376 1.9565972082737073
epoch 45 0.029260326198885744 1.9560508480382925
epoch 50 0.02938072786104884 1.9559295389567388
epoch 55 0.03020875055239658 1.9550950719108184
epoch 60 0.03051051206302524 1.954790873278407
epoch 65 0.030779202974828168 1.9545199724870765
epoch 70 0.030695516821876212 1.95460435095238
epoch 75 0.0312511512955862 1.954044051654368
epoch 80 0.03145891678170365 1.9538345006016182
epoch 85 0.0315916305919014 1.953700634465834
epoch 90 0.03178318324557472 1.9535074024261243
epoch 95 0.03198476376341841 1.9533040339627776
[32m[I 2022-02-17 13:18:44,258][0m Trial 72 finished with value: 1.9532806269321048 and parameters: {'n_layers_mlp': 2, 'mlp_n_units_l0': 14, 'mlp_dropout_l0': 0.18566996038770664, 'mlp_n_units_l1': 49, 'mlp_dropout_l1': 0.0022976821810731934, 'lr': 3.2864309653404645e-05, 'weight_decay': 0.020549984752115596, 'criterion': 'MSELoss', 'batch_size': 256}. Best is trial 51 with value: 1.9520837588591413.[0m
Trial Id: 73 | Model params: 975 | Timestamp: 2022-02-17 13:18:44.259087

epoch 0 -2.91622743706747 3.9288251691460694
epoch 5 -2.91622743706747 3.9288251691460694
epoch 10 0.017062748762535773 1.9683016093724535
epoch 15 0.022490876649247538 1.9628592557600717
epoch 20 0.02552465719545549 1.9598109405906137
epoch 25 0.027065942524388098 1.9582604533376535
epoch 30 0.027976231446568356 1.9573441528286861
epoch 35 0.028810577436064078 1.9565039198556988
epoch 40 0.029328631102630065 1.9559820292710826
epoch 45 0.029538668504816012 1.9557703965682394
epoch 50 0.030122134058527483 1.9551823792047152
epoch 55 0.030464690794187232 1.9548370676626219
epoch 60 0.030631202589925355 1.954669194762878
epoch 65 0.030766248121204764 1.9545330347509153
epoch 70 0.031211533667150793 1.9540840072113859
epoch 75 0.031426859857446976 1.9538668344940173
epoch 80 0.03168165003670964 1.9536098281803596
epoch 85 0.03184652663430598 1.953443499485901
epoch 90 0.03188348258859308 1.953406216111114
epoch 95 0.032123357094582916 1.9531641990752944
[32m[I 2022-02-17 13:25:42,349][0m Trial 73 finished with value: 1.9531657834862768 and parameters: {'n_layers_mlp': 2, 'mlp_n_units_l0': 14, 'mlp_dropout_l0': 0.1672126155678813, 'mlp_n_units_l1': 46, 'mlp_dropout_l1': 0.0006784616879988747, 'lr': 3.427425087125953e-05, 'weight_decay': 0.019239064724360447, 'criterion': 'MSELoss', 'batch_size': 256}. Best is trial 51 with value: 1.9520837588591413.[0m
Trial Id: 74 | Model params: 942 | Timestamp: 2022-02-17 13:25:42.349949

[32m[I 2022-02-17 13:25:46,506][0m Trial 74 pruned. [0m
epoch 0 -1.6478879631887007 3.2305655173852244
Trial Id: 75 | Model params: 1055 | Timestamp: 2022-02-17 13:25:46.507195

[32m[I 2022-02-17 13:25:50,786][0m Trial 75 pruned. [0m
epoch 0 -0.7519963953904727 2.6278184325208707
Trial Id: 76 | Model params: 1245 | Timestamp: 2022-02-17 13:25:50.786744

[32m[I 2022-02-17 13:25:54,936][0m Trial 76 pruned. [0m
epoch 0 -0.004907064011547835 1.990176986847036
Trial Id: 77 | Model params: 1397 | Timestamp: 2022-02-17 13:25:54.937091

epoch 0 -2.91622743706747 3.9288251691460694
epoch 5 -2.91622743706747 3.9288251691460694
epoch 10 -2.91622743706747 3.9288251691460694
epoch 15 0.019446510361070146 1.9659134559542815
epoch 20 0.025042414974647098 1.9602958100588503
epoch 25 0.027207653078873628 1.9581178351004975
epoch 30 0.028287935463533143 1.9570302916996847
epoch 35 0.029058792883847162 1.9562538833959147
epoch 40 0.02957813132750209 1.9557306314573075
epoch 45 0.030000822425245488 1.9553046517917092
epoch 50 0.03034529973448885 1.9549574257775921
epoch 55 0.03063580179587655 1.9546645577573953
epoch 60 0.030841360370018944 1.9544572985233277
epoch 65 0.03089100347394902 1.9544072414091769
epoch 70 0.03130523402316521 1.9539895062955448
epoch 75 0.03136180917757281 1.9539324455597766
epoch 80 0.03165346428821936 1.953638260748313
epoch 85 0.03164903444570322 1.9536427293448388
epoch 90 0.031856647677882655 1.953433288843168
epoch 95 0.032052175756914325 1.9532360193249678
[32m[I 2022-02-17 13:32:49,115][0m Trial 77 finished with value: 1.9532948260328316 and parameters: {'n_layers_mlp': 2, 'mlp_n_units_l0': 20, 'mlp_dropout_l0': 0.15530979311592, 'mlp_n_units_l1': 48, 'mlp_dropout_l1': 0.014904091165560913, 'lr': 3.4642741464316545e-05, 'weight_decay': 0.0203228762776501, 'criterion': 'MSELoss', 'batch_size': 256}. Best is trial 51 with value: 1.9520837588591413.[0m
Trial Id: 78 | Model params: 759 | Timestamp: 2022-02-17 13:32:49.115485

[32m[I 2022-02-17 13:32:53,406][0m Trial 78 pruned. [0m
epoch 0 0.0175722487894594 1.9677914141841115
Trial Id: 79 | Model params: 1227 | Timestamp: 2022-02-17 13:32:53.406718

[32m[I 2022-02-17 13:32:57,581][0m Trial 79 pruned. [0m
epoch 0 -2.4426723320925143 3.683635036676212
Trial Id: 80 | Model params: 1479 | Timestamp: 2022-02-17 13:32:57.582189

epoch 0 -2.916524281914817 3.9290960166779114
epoch 5 -2.916524281914817 3.9290960166779114
epoch 10 0.014553452014053891 1.9708735743193544
epoch 15 0.01991670357149944 1.965503058713811
epoch 20 0.02253497824440276 1.9628759001302558
epoch 25 0.024585653112034977 1.96081580918867
epoch 30 0.025466455371324193 1.9599302977808273
epoch 35 0.026391625114526307 1.9589997506593242
epoch 40 0.026787957307049637 1.9586009795942274
epoch 45 0.02713807564271209 1.9582486392145981
epoch 50 0.027633446315891708 1.9577500163166943
epoch 55 0.0275212166805886 1.957862993891859
epoch 60 0.027808737400311978 1.9575735439823705
epoch 65 0.028048060327327318 1.9573325826180885
epoch 70 0.028381246941424187 1.9569970655575581
epoch 75 0.02832048308228674 1.957058258713059
epoch 80 0.02861051239029544 1.9567661631177895
epoch 85 0.028711534742721256 1.9566644108015303
epoch 90 0.028736110056303943 1.956639657112303
epoch 95 0.028540789968259928 1.9568363862517488
[32m[I 2022-02-17 13:44:50,823][0m Trial 80 finished with value: 1.9567301727136153 and parameters: {'n_layers_mlp': 2, 'mlp_n_units_l0': 22, 'mlp_dropout_l0': 0.15216721422210575, 'mlp_n_units_l1': 46, 'mlp_dropout_l1': 0.019263647051727506, 'lr': 1.306859845747646e-05, 'weight_decay': 0.05119132495262733, 'criterion': 'MSELoss', 'batch_size': 128}. Best is trial 51 with value: 1.9520837588591413.[0m
Trial Id: 81 | Model params: 905 | Timestamp: 2022-02-17 13:44:50.823248

epoch 0 -2.91622743706747 3.9288251691460694
epoch 5 -2.91622743706747 3.9288251691460694
epoch 10 0.01709599340345669 1.9682683234056026
epoch 15 0.022283430117205683 1.9630675232507422
epoch 20 0.025088615592647967 1.9602493629352853
epoch 25 0.027085606826102393 1.9582406637030583
epoch 30 0.027722813054720463 1.9575992878869521
epoch 35 0.02865033872576339 1.9566653171727497
epoch 40 0.029021473421030897 1.9562914786910852
epoch 45 0.029698137887275378 1.9556097006698996
epoch 50 0.03004870801344306 1.9552563877977231
epoch 55 0.030418695005409502 1.954883436890036
epoch 60 0.030716760229358875 1.954582932149042
epoch 65 0.030604687520539353 1.954695927537368
epoch 70 0.031187840587735494 1.954107901996526
epoch 75 0.03136751040503438 1.9539266953065786
epoch 80 0.03158127445201686 1.9537110808558127
epoch 85 0.031647445914257166 1.953644331770895
epoch 90 0.031839658198638876 1.9534504286957721
epoch 95 0.03190839293303083 1.9533810846657698
[32m[I 2022-02-17 13:51:47,383][0m Trial 81 finished with value: 1.9532461093312146 and parameters: {'n_layers_mlp': 2, 'mlp_n_units_l0': 12, 'mlp_dropout_l0': 0.1745726996056429, 'mlp_n_units_l1': 50, 'mlp_dropout_l1': 0.04154946330332665, 'lr': 3.616347134608619e-05, 'weight_decay': 0.021686405740580502, 'criterion': 'MSELoss', 'batch_size': 256}. Best is trial 51 with value: 1.9520837588591413.[0m
Trial Id: 82 | Model params: 1240 | Timestamp: 2022-02-17 13:51:47.384008

epoch 0 -2.91622743706747 3.9288251691460694
epoch 5 0.012079859443407726 1.973284343794269
epoch 10 0.01523994204652257 1.9701258212259896
epoch 15 0.016777483633827583 1.9685872059752918
epoch 20 0.018432627136311885 1.9669295615121472
epoch 25 0.018072028340518242 1.967290824183176
epoch 30 0.018439764753397925 1.966922410084769
epoch 35 0.017756116355623908 1.9676072632640653
epoch 40 0.017199049897997365 1.9681651352256737
epoch 45 0.017406908094958484 1.9679569949663156
epoch 50 0.017689324910387216 1.967674159633157
epoch 55 0.01763286446695944 1.9677307069974839
epoch 60 0.01828453016846876 1.9670779391606654
epoch 65 0.016677283056854897 1.968687513151585
epoch 70 0.01782998625979826 1.967533274667533
epoch 75 0.01771973026688456 1.9676437067943662
epoch 80 0.01687494824416913 1.9684896327724588
epoch 85 0.017389881064748147 1.9679740459298931
epoch 90 0.018573476095499197 1.9667884352235727
epoch 95 0.017506706798451788 1.967857053014041
[32m[I 2022-02-17 13:58:42,469][0m Trial 82 finished with value: 1.9670400385146949 and parameters: {'n_layers_mlp': 2, 'mlp_n_units_l0': 17, 'mlp_dropout_l0': 0.1735040030151494, 'mlp_n_units_l1': 50, 'mlp_dropout_l1': 0.038603390666921554, 'lr': 3.591476692194573e-05, 'weight_decay': 0.2586404539804578, 'criterion': 'MSELoss', 'batch_size': 256}. Best is trial 51 with value: 1.9520837588591413.[0m
Trial Id: 83 | Model params: 1059 | Timestamp: 2022-02-17 13:58:42.469703

epoch 0 -2.91622743706747 3.9288251691460694
epoch 5 -2.91622743706747 3.9288251691460694
epoch 10 -2.91622743706747 3.9288251691460694
epoch 15 -2.91622743706747 3.9288251691460694
epoch 20 -1.411295770511511 3.082861347496471
epoch 25 0.015851094472056793 1.969514385966409
epoch 30 0.020639055948173057 1.9647176238551747
epoch 35 0.023464941943494244 1.9618810400203979
epoch 40 0.025740831511481543 1.959593549616472
epoch 45 0.026620919082307903 1.958708259728004
epoch 50 0.02721949817421132 1.9581059136646854
epoch 55 0.027867469367779507 1.9574536557395912
epoch 60 0.02830992592428272 1.9570081471556002
epoch 65 0.02848346381211353 1.956833384526017
epoch 70 0.02897074835839586 1.9563425775100054
epoch 75 0.02932032527921502 1.95599039770921
epoch 80 0.029388070207279626 1.9559221410307706
epoch 85 0.029662870683702658 1.9556452402588822
epoch 90 0.03008242910721859 1.9552223995152092
epoch 95 0.030332448999316086 1.9549703801606881
[32m[I 2022-02-17 14:05:38,353][0m Trial 83 finished with value: 1.9548638435470693 and parameters: {'n_layers_mlp': 2, 'mlp_n_units_l0': 12, 'mlp_dropout_l0': 0.1983596248826578, 'mlp_n_units_l1': 61, 'mlp_dropout_l1': 0.044725420344742556, 'lr': 1.8506208305589797e-05, 'weight_decay': 0.01538906827313824, 'criterion': 'MSELoss', 'batch_size': 256}. Best is trial 51 with value: 1.9520837588591413.[0m
Trial Id: 84 | Model params: 795 | Timestamp: 2022-02-17 14:05:38.353745

[32m[I 2022-02-17 14:05:42,488][0m Trial 84 pruned. [0m
epoch 0 -1.2102357829127168 2.9515357867398673
Trial Id: 85 | Model params: 1551 | Timestamp: 2022-02-17 14:05:42.489097

[32m[I 2022-02-17 14:05:46,769][0m Trial 85 pruned. [0m
epoch 0 0.02103105498200608 1.9643243855413448
Trial Id: 86 | Model params: 1227 | Timestamp: 2022-02-17 14:05:46.770146

[32m[I 2022-02-17 14:05:50,881][0m Trial 86 pruned. [0m
epoch 0 -2.3258028241286595 3.6205704235956655
Trial Id: 87 | Model params: 1431 | Timestamp: 2022-02-17 14:05:50.881703

[32m[I 2022-02-17 14:05:55,161][0m Trial 87 pruned. [0m
epoch 0 -2.176080413927172 3.538135778684427
Trial Id: 88 | Model params: 1560 | Timestamp: 2022-02-17 14:05:55.161485

