[32m[I 2022-02-26 20:35:29,986][0m Trial 15 finished with value: 4.2920717196260645 and parameters: {'n_layers_mlp': 2, 'mlp_n_units_l0': 52, 'mlp_dropout_l0': 0.056325086971728944, 'mlp_n_units_l1': 52, 'mlp_dropout_l1': 0.19566793538632915, 'lr': 0.0003094042026117449, 'weight_decay': 0.23936094150091036, 'criterion': 'MSELoss', 'batch_size': 128}. Best is trial 10 with value: 4.290564541936973.[0m
Trial Id: 16 | Model params: 7265 | Timestamp: 2022-02-26 20:35:29.986436

epoch 0 -3.2203032643552367 8.846705270077623
epoch 5 -0.004885813499120539 4.316861215252496
epoch 10 0.0021349805187305115 4.301754565184145
epoch 15 0.004968107834656843 4.295643477499474
epoch 20 0.0054866875777271895 4.294523953578949
epoch 25 0.005779102635605771 4.29389255137583
epoch 30 0.005762146537616086 4.293929166655506
epoch 35 0.006054896641961904 4.293296953370587
epoch 40 0.006101416084557831 4.293196482973662
epoch 45 0.006051452512296551 4.29330439173843
epoch 50 0.005550968936315015 4.294385160919394
epoch 55 0.00658196795831778 4.292158473116998
epoch 60 0.006488445774114782 4.292360504173127
epoch 65 0.006732733522063938 4.2918327621751065
epoch 70 0.0067766821812483835 4.291737811707995
epoch 75 0.006877280597252011 4.2915204623210075
epoch 80 0.007078540511585962 4.291085594209187
epoch 85 0.007056848431220342 4.291132467032961
epoch 90 0.006717992106496484 4.291864610328009
epoch 95 0.006759624920303797 4.29177466393254
[32m[I 2022-02-26 20:41:29,067][0m Trial 16 finished with value: 4.29192694172851 and parameters: {'n_layers_mlp': 2, 'mlp_n_units_l0': 80, 'mlp_dropout_l0': 0.2810278078081573, 'mlp_n_units_l1': 72, 'mlp_dropout_l1': 0.24780271230359122, 'lr': 1.0492299044182264e-05, 'weight_decay': 0.15359750167601915, 'criterion': 'MSELoss', 'batch_size': 128}. Best is trial 10 with value: 4.290564541936973.[0m
Trial Id: 17 | Model params: 5211 | Timestamp: 2022-02-26 20:41:29.067164

[32m[I 2022-02-26 20:41:40,829][0m Trial 17 pruned. [0m
epoch 0 0.0038016122177139122 4.298160673987644
Trial Id: 18 | Model params: 5302 | Timestamp: 2022-02-26 20:41:40.829295

[32m[I 2022-02-26 20:41:44,483][0m Trial 18 pruned. [0m
epoch 0 0.003681868897068008 4.298418986274114
Trial Id: 19 | Model params: 6358 | Timestamp: 2022-02-26 20:41:44.483702

[32m[I 2022-02-26 20:41:48,113][0m Trial 19 pruned. [0m
epoch 0 -0.025777739578294767 4.361504893660716
Trial Id: 20 | Model params: 4420 | Timestamp: 2022-02-26 20:41:48.114066

[32m[I 2022-02-26 20:41:51,769][0m Trial 20 pruned. [0m
epoch 0 0.00043468945052382857 4.305417947324841
Trial Id: 21 | Model params: 7839 | Timestamp: 2022-02-26 20:41:51.769889

epoch 0 -2.9387556872448983 8.546518767274351
epoch 5 0.00454828298815857 4.296549593018436
epoch 10 0.005904378437056379 4.293622019053359
epoch 15 0.005819922816249878 4.293804402319003
epoch 20 0.006026339871363584 4.29335862771014
epoch 25 0.006334569877619156 4.292692893487318
epoch 30 0.006095046610285815 4.293210239588862
epoch 35 0.0063122819813429265 4.2927410357264275
epoch 40 0.006231299610579222 4.292915954494829
epoch 45 0.006522257778793117 4.2922874629751275
epoch 50 0.006564868451012562 4.292195412993753
epoch 55 0.006748130434408917 4.2917994975991185
epoch 60 0.006872995103515023 4.291529721631999
epoch 65 0.006676863987735149 4.291953464494708
epoch 70 0.0069815961665858906 4.291295070157555
epoch 75 0.007022226482698124 4.291207277998775
epoch 80 0.006923985594074589 4.291419549411536
epoch 85 0.00707678241121612 4.291089393178258
epoch 90 0.00715464282457845 4.290921146259451
epoch 95 0.007174172081595653 4.290878944866564
[32m[I 2022-02-26 20:47:51,800][0m Trial 21 finished with value: 4.2916236846876314 and parameters: {'n_layers_mlp': 2, 'mlp_n_units_l0': 80, 'mlp_dropout_l0': 4.801229504036893e-06, 'mlp_n_units_l1': 79, 'mlp_dropout_l1': 0.1382393047783293, 'lr': 1.0380678808747753e-05, 'weight_decay': 0.20010281476926411, 'criterion': 'MSELoss', 'batch_size': 128}. Best is trial 10 with value: 4.290564541936973.[0m
Trial Id: 22 | Model params: 6553 | Timestamp: 2022-02-26 20:47:51.800340

epoch 0 -2.825353584503693 8.422587297220764
epoch 5 0.0020499667223167206 4.301937806750299
epoch 10 0.00508693983605113 4.295386965543879
epoch 15 0.005771171852385737 4.2939096772797285
epoch 20 0.006310333852902694 4.292745243691691
epoch 25 0.006448824332595526 4.29244609342189
epoch 30 0.006400384930667635 4.2925507286900375
epoch 35 0.006438148286667 4.292469155257886
epoch 40 0.006767449704712103 4.291757758519481
epoch 45 0.006756776370554718 4.2917808181954875
epoch 50 0.006781854226375117 4.291726637438255
epoch 55 0.006665559000715082 4.291977887735443
epoch 60 0.007053928157963685 4.291138777197924
epoch 65 0.007069386933609145 4.2911053735662
epoch 70 0.007186680978583659 4.290851913774974
epoch 75 0.0071114473917683885 4.291014487170399
epoch 80 0.0072074765105991645 4.290806975308749
epoch 85 0.00715835867837511 4.290913116584721
epoch 90 0.0070388915849727285 4.291171268276236
epoch 95 0.007187926772827202 4.290849221667512
[32m[I 2022-02-26 20:53:51,165][0m Trial 22 finished with value: 4.2905405408036374 and parameters: {'n_layers_mlp': 2, 'mlp_n_units_l0': 72, 'mlp_dropout_l0': 0.01769517157776384, 'mlp_n_units_l1': 72, 'mlp_dropout_l1': 0.15292904677328456, 'lr': 1.1737210159350752e-05, 'weight_decay': 0.1829575417573893, 'criterion': 'MSELoss', 'batch_size': 128}. Best is trial 22 with value: 4.2905405408036374.[0m
Trial Id: 23 | Model params: 6807 | Timestamp: 2022-02-26 20:53:51.165819

[32m[I 2022-02-26 20:53:54,730][0m Trial 23 pruned. [0m
epoch 0 -1.1005960581972682 6.241385419880445
Trial Id: 24 | Model params: 5796 | Timestamp: 2022-02-26 20:53:54.730698

epoch 0 -3.032584061980117 8.647716500998543
epoch 5 0.00010679171431915435 4.3061240647869905
epoch 10 0.004735931062289422 4.296144612424469
epoch 15 0.005977449169098037 4.293464215386007
epoch 20 0.006394744036911648 4.292562913572091
epoch 25 0.0064625412028954665 4.292416462774272
epoch 30 0.006572755335757963 4.292178375083255
epoch 35 0.006673554960013872 4.291960613317005
epoch 40 0.006689781289588526 4.291925557846473
epoch 45 0.006937321843689892 4.291390734077348
epoch 50 0.007084404588808102 4.291072922867358
epoch 55 0.0070944797279079985 4.291051152000601
epoch 60 0.006939256070498057 4.2913865548209795
epoch 65 0.00729146633948452 4.2906254712394105
epoch 70 0.007278163031617768 4.290654220524029
epoch 75 0.007344541226310564 4.290510771155013
epoch 80 0.007430093817526906 4.290325877081181
epoch 85 0.0074551706742082 4.290271680109252
epoch 90 0.007255920543393968 4.290702287509088
epoch 95 0.007499978717288247 4.290174837708652
[32m[I 2022-02-26 20:59:54,013][0m Trial 24 finished with value: 4.29008877077044 and parameters: {'n_layers_mlp': 2, 'mlp_n_units_l0': 65, 'mlp_dropout_l0': 0.02342861811526638, 'mlp_n_units_l1': 70, 'mlp_dropout_l1': 0.15578291657025317, 'lr': 1.0402065895135546e-05, 'weight_decay': 0.1431013546401757, 'criterion': 'MSELoss', 'batch_size': 128}. Best is trial 24 with value: 4.29008877077044.[0m
Study statistics: 
  Number of finished trials:  25
  Number of pruned trials:  7
  Number of complete trials:  18

Best trial:
  Value:  4.29008877077044
  Params: 
    n_layers_mlp: 2
    mlp_n_units_l0: 65
    mlp_dropout_l0: 0.02342861811526638
    mlp_n_units_l1: 70
    mlp_dropout_l1: 0.15578291657025317
    lr: 1.0402065895135546e-05
    weight_decay: 0.1431013546401757
    criterion: MSELoss
    batch_size: 128
Target: 67706, NaN: 0, Max: 143.0, Min: 0.0, Mean: 8.148790358313887
Prediction: 67706, NaN: 0, Max: 10.83764362335205, Min: 6.640140056610107, Mean: 8.13141252685149

 XXXXXX======== TRIAL des - lrg ended

Test Set - R-squared:  0.006502861219005784
Test Set - RMSE:  4.196354141180452
Test Set - MAE:  3.1000785021240613



[32m[I 2022-02-26 21:00:07,491][0m A new study created in memory with name: NeuralNetwork[0m
++++++++ Session Characteristics +++++++

Area: des
Gal Type: elg
Training Samples: 216656
Validation Samples: 54164
Test Samples: 67706
Number of features: 16
Device: cuda:0
Number of Workers: 8
Number of Trials: 25

+++++++++++++++++++++++++++++++++++++++
Trial Id: 0 | Model params: 2977 | Timestamp: 2022-02-26 21:00:07.491876

epoch 0 -14.758014926363332 28.609406227327945
epoch 5 -14.715001948229268 28.570333518575055
epoch 10 -14.718248994806785 28.57328497898398
epoch 15 -14.76153947166045 28.612605536089358
epoch 20 -14.741328745312137 28.594254947922366
epoch 25 -14.716378085727483 28.571584420316377
epoch 30 -14.76698725459875 28.61754990709365
epoch 35 -14.745158454890952 28.59773308608085
epoch 40 -14.781083342451371 28.63033945813233
epoch 45 -14.757348497562614 28.608801254748652
epoch 50 -14.72116384969486 28.575934228226284
epoch 55 -14.74752842413302 28.599885277746083
epoch 60 -14.75285011554962 28.604717366425117
epoch 65 -14.734801475607107 28.588325913299876
epoch 70 -14.751245604418902 28.60326055842431
epoch 75 -14.737111432462012 28.59042429935242
epoch 80 -14.754075030733851 28.60582947221173
epoch 85 -14.707535582609628 28.563545676617
epoch 90 -14.726577010531994 28.580853482815684
epoch 95 -14.705679055464953 28.561857615347616
[32m[I 2022-02-26 21:25:39,239][0m Trial 0 finished with value: 28.587133102578314 and parameters: {'n_layers_mlp': 4, 'mlp_n_units_l0': 12, 'mlp_dropout_l0': 0.07186820314648663, 'mlp_n_units_l1': 34, 'mlp_dropout_l1': 0.10941807166338471, 'mlp_n_units_l2': 23, 'mlp_dropout_l2': 0.15631901293541603, 'mlp_n_units_l3': 61, 'mlp_dropout_l3': 0.10617915456294554, 'lr': 0.0007850698516452294, 'weight_decay': 0.22745484527511192, 'criterion': 'PoissonNLLLoss', 'batch_size': 32}. Best is trial 0 with value: 28.587133102578314.[0m
Trial Id: 1 | Model params: 3180 | Timestamp: 2022-02-26 21:25:39.239543

epoch 0 -18.065942989723723 31.475207769648133
epoch 5 -5.123560206087898 17.83780683354019
epoch 10 -0.1003943905794833 7.561599034084436
epoch 15 -0.04367687633955275 7.364147714102402
epoch 20 -0.014568316887957566 7.26072701250747
epoch 25 -0.006768912486722067 7.232765071013567
epoch 30 -0.0030390475762906988 7.219354709940078
epoch 35 -0.00021878092384031156 7.20919815742865
epoch 40 0.002407018840719033 7.199729053598104
epoch 45 0.0045314976894276215 7.192058678757413
epoch 50 0.006212288571055269 7.1859844265084405
epoch 55 0.007732941819747263 7.180484472242515
epoch 60 0.009001972102431366 7.175891370269797
epoch 65 0.010030238963552374 7.172167525147282
epoch 70 0.011037946161910006 7.168516259573749
epoch 75 0.011841252694893778 7.1656042743429955
epoch 80 0.01224329417807335 7.164146430011325
epoch 85 0.012930360062314517 7.161654370566834
epoch 90 0.013405430781360472 7.159930732422174
epoch 95 0.014059125613239964 7.157558336808863
[32m[I 2022-02-26 21:29:33,131][0m Trial 1 finished with value: 7.157190221159913 and parameters: {'n_layers_mlp': 2, 'mlp_n_units_l0': 61, 'mlp_dropout_l0': 0.06275799305483386, 'mlp_n_units_l1': 34, 'mlp_dropout_l1': 0.04795604392348144, 'lr': 1.8918075620211628e-05, 'weight_decay': 0.09846363393450232, 'criterion': 'MSELoss', 'batch_size': 256}. Best is trial 1 with value: 7.157190221159913.[0m
Trial Id: 2 | Model params: 7765 | Timestamp: 2022-02-26 21:29:33.131359

epoch 0 -18.618272994773548 31.921881228743914
epoch 5 0.010088622631986177 7.170612411195521
epoch 10 0.01869953468300356 7.139356898126543
epoch 15 0.01619922177467159 7.1484465045412655
epoch 20 0.02171361456783516 7.128384142137198
epoch 25 0.006670282274898298 7.1829824425348
epoch 30 0.023040312463858625 7.1235489420887586
epoch 35 0.01634512510182884 7.147916406972206
epoch 40 0.022912225647075957 7.124015902402004
epoch 45 0.019678149408424606 7.135796101614111
epoch 50 0.02006743987017867 7.134379131671263
epoch 55 0.02080591891525685 7.131690384158555
epoch 60 0.023461431008851896 7.122013473457882
epoch 65 0.018214399680163473 7.141121456526246
epoch 70 0.01934151639578996 7.1370211780290145
epoch 75 0.01788092780403394 7.142334125051199
epoch 80 0.025985543351923712 7.112803190268476
epoch 85 0.026458182674706565 7.111077241343825
epoch 90 0.011915786002996254 7.16399165097188
epoch 95 0.01846987280675516 7.140192290666892
[32m[I 2022-02-26 21:54:34,148][0m Trial 2 finished with value: 7.123397720004812 and parameters: {'n_layers_mlp': 4, 'mlp_n_units_l0': 47, 'mlp_dropout_l0': 0.06282103864435386, 'mlp_n_units_l1': 67, 'mlp_dropout_l1': 0.1979631673750645, 'mlp_n_units_l2': 35, 'mlp_dropout_l2': 0.19566344964570406, 'mlp_n_units_l3': 37, 'mlp_dropout_l3': 0.11830897582981116, 'lr': 0.00016553019957809116, 'weight_decay': 0.25326017884842, 'criterion': 'MSELoss', 'batch_size': 32}. Best is trial 2 with value: 7.123397720004812.[0m
Trial Id: 3 | Model params: 2964 | Timestamp: 2022-02-26 21:54:34.148966

epoch 0 -0.12402996852118164 7.640944334620708
epoch 5 0.00018254007087059598 7.206401400546013
epoch 10 0.005833613340303412 7.186006872994795
epoch 15 0.012037170041963363 7.163551596906653
epoch 20 0.010651210749881512 7.168574514287486
epoch 25 0.01179396891175144 7.164433247809513
epoch 30 0.015285994234347289 7.1517635602404255
epoch 35 0.010673231941702888 7.1684947338123814
epoch 40 0.013103893574647696 7.159683236363582
epoch 45 0.01721596028507566 7.144751661112596
epoch 50 0.01383015384961983 7.157048333626211
epoch 55 0.018964723662146854 7.13839215452211
epoch 60 0.015450250546183764 7.151167056438076
epoch 65 0.019589322593592362 7.136119380994756
epoch 70 0.019754023710875757 7.135519950456249
epoch 75 0.018304496816496485 7.140793783480945
epoch 80 0.015636029265544082 7.150492333126233
epoch 85 0.020915425119167108 7.131291593871657
epoch 90 0.019953312210054475 7.134794571633134
epoch 95 0.0203036181160825 7.13351933439729
[32m[I 2022-02-26 22:14:14,441][0m Trial 3 finished with value: 7.139416798158823 and parameters: {'n_layers_mlp': 2, 'mlp_n_units_l0': 79, 'mlp_dropout_l0': 0.004744582837708966, 'mlp_n_units_l1': 20, 'mlp_dropout_l1': 0.17561640262248776, 'lr': 3.6629580343718067e-05, 'weight_decay': 0.1026806748349493, 'criterion': 'MSELoss', 'batch_size': 32}. Best is trial 2 with value: 7.123397720004812.[0m
Trial Id: 4 | Model params: 990 | Timestamp: 2022-02-26 22:14:14.441635

epoch 0 -18.618272994773548 31.921881228743914
epoch 5 -14.956061105969821 28.788625886624978
epoch 10 -14.872643697341307 28.713274599223634
epoch 15 -14.798987797507186 28.646576154357362
epoch 20 -14.763663647782238 28.61453352560921
epoch 25 -14.75259759630186 28.604488097733853
epoch 30 -14.749555921234231 28.6017263386612
epoch 35 -14.738159737642864 28.59137653861609
epoch 40 -14.741251069606308 28.594184398551608
epoch 45 -14.742183409930524 28.59503119008971
epoch 50 -14.744222018061253 28.596882654223393
epoch 55 -14.742545160528884 28.595359740772526
epoch 60 -14.741844101338275 28.594723018351115
epoch 65 -14.733388742811034 28.587042497927683
epoch 70 -14.739293003216332 28.592405916891583
epoch 75 -14.741290191775633 28.594219931490628
epoch 80 -14.740693186559573 28.59367769320833
epoch 85 -14.73670659573706 28.590056553078682
epoch 90 -14.744061681900765 28.596737041247565
epoch 95 -14.73931393598373 28.592424930388034
[32m[I 2022-02-26 22:20:27,594][0m Trial 4 finished with value: 28.587380162809506 and parameters: {'n_layers_mlp': 2, 'mlp_n_units_l0': 29, 'mlp_dropout_l0': 0.2545729782084477, 'mlp_n_units_l1': 16, 'mlp_dropout_l1': 0.005389115148512524, 'lr': 2.1766074842092276e-05, 'weight_decay': 0.2721566071089932, 'criterion': 'PoissonNLLLoss', 'batch_size': 128}. Best is trial 2 with value: 7.123397720004812.[0m
Trial Id: 5 | Model params: 5439 | Timestamp: 2022-02-26 22:20:27.594323

[32m[I 2022-02-26 22:20:39,659][0m Trial 5 pruned. [0m
epoch 0 -14.836789722510394 28.680826726458935
Trial Id: 6 | Model params: 13993 | Timestamp: 2022-02-26 22:20:39.659636

[32m[I 2022-02-26 22:20:54,546][0m Trial 6 pruned. [0m
epoch 0 -0.0797314593864955 7.488864422475059
Trial Id: 7 | Model params: 2142 | Timestamp: 2022-02-26 22:20:54.547098

[32m[I 2022-02-26 22:21:06,190][0m Trial 7 pruned. [0m
epoch 0 -12.33324816914047 26.316375338022215
Trial Id: 8 | Model params: 3273 | Timestamp: 2022-02-26 22:21:06.190422

[32m[I 2022-02-26 22:21:09,941][0m Trial 8 pruned. [0m
epoch 0 -11.710282466265484 25.694234989010518
Trial Id: 9 | Model params: 6357 | Timestamp: 2022-02-26 22:21:09.941629

[32m[I 2022-02-26 22:21:12,181][0m Trial 9 pruned. [0m
epoch 0 0.004031139352824398 7.193865945599704
Trial Id: 10 | Model params: 5592 | Timestamp: 2022-02-26 22:21:12.182100

[32m[I 2022-02-26 22:21:16,699][0m Trial 10 pruned. [0m
epoch 0 -0.0014100963207670514 7.21213875293429
Trial Id: 11 | Model params: 3353 | Timestamp: 2022-02-26 22:21:16.699935

[32m[I 2022-02-26 22:21:31,504][0m Trial 11 pruned. [0m
epoch 0 -0.13905175157501382 7.691832506788863
Trial Id: 12 | Model params: 3511 | Timestamp: 2022-02-26 22:21:31.504528

[32m[I 2022-02-26 22:21:46,608][0m Trial 12 pruned. [0m
epoch 0 -0.2859445457785581 8.172768756138554
Trial Id: 13 | Model params: 8016 | Timestamp: 2022-02-26 22:21:46.608272

[32m[I 2022-02-26 22:22:01,751][0m Trial 13 pruned. [0m
epoch 0 9.743110419446754e-05 7.20670811469607
Trial Id: 14 | Model params: 3128 | Timestamp: 2022-02-26 22:22:01.751594

[32m[I 2022-02-26 22:22:16,546][0m Trial 14 pruned. [0m
epoch 0 0.012390491065224385 7.1622705468332875
Trial Id: 15 | Model params: 3282 | Timestamp: 2022-02-26 22:22:16.546907

[32m[I 2022-02-26 22:22:19,071][0m Trial 15 pruned. [0m
epoch 0 -16.571513609813042 30.21649227060127
Trial Id: 16 | Model params: 6042 | Timestamp: 2022-02-26 22:22:19.071890

[32m[I 2022-02-26 22:22:30,976][0m Trial 16 pruned. [0m
epoch 0 0.001959718913231878 7.199993850755441
Trial Id: 17 | Model params: 11326 | Timestamp: 2022-02-26 22:22:30.976799

epoch 0 -18.618272994773548 31.921881228743914
epoch 5 -14.792666407774828 28.64084463876678
epoch 10 -14.763895503632341 28.614743959641203
epoch 15 -14.757248356625263 28.60871034742607
epoch 20 -14.745454690631203 28.598002109438333
epoch 25 -14.744652117158038 28.597273254958964
epoch 30 -14.743689007012211 28.59639858510224
epoch 35 -14.738432468818727 28.591624271708486
epoch 40 -14.738750227408133 28.591912902369707
epoch 45 -14.738730161016983 28.591894675487566
epoch 50 -14.73640610812804 28.589783592574083
epoch 55 -14.735508539379122 28.588968232890284
epoch 60 -14.738573694435571 28.59175255197795
epoch 65 -14.73785842921139 28.591102845115852
epoch 70 -14.737492167303985 28.590770147600573
epoch 75 -14.73479385647781 28.588318991757895
epoch 80 -14.736721812972243 28.590070376222258
epoch 85 -14.73528732615285 28.588767277194766
epoch 90 -14.732404340752737 28.586148171087768
epoch 95 -14.734084270204374 28.58767436598035
[32m[I 2022-02-26 22:48:08,641][0m Trial 17 finished with value: 28.588347370080722 and parameters: {'n_layers_mlp': 4, 'mlp_n_units_l0': 66, 'mlp_dropout_l0': 0.17838658018521047, 'mlp_n_units_l1': 80, 'mlp_dropout_l1': 0.19762821800491698, 'mlp_n_units_l2': 53, 'mlp_dropout_l2': 0.09667808498909429, 'mlp_n_units_l3': 10, 'mlp_dropout_l3': 0.059977584581401636, 'lr': 5.032391819799499e-05, 'weight_decay': 0.05292825550222169, 'criterion': 'PoissonNLLLoss', 'batch_size': 32}. Best is trial 2 with value: 7.123397720004812.[0m
Trial Id: 18 | Model params: 4204 | Timestamp: 2022-02-26 22:48:08.641201

[32m[I 2022-02-26 22:48:23,515][0m Trial 18 pruned. [0m
epoch 0 0.015620092830075039 7.150550214612054
Trial Id: 19 | Model params: 642 | Timestamp: 2022-02-26 22:48:23.515509

[32m[I 2022-02-26 22:48:35,588][0m Trial 19 pruned. [0m
epoch 0 0.017059144920349434 7.145321655181593
Trial Id: 20 | Model params: 11836 | Timestamp: 2022-02-26 22:48:35.588333

epoch 0 -18.618272994773548 31.921881228743914
epoch 5 -0.01589366876711029 7.264106745085338
epoch 10 0.006415173814649289 7.183904755600056
epoch 15 0.010672880354104741 7.168496007584457
epoch 20 0.014167241176584966 7.155825037001558
epoch 25 0.0119482683665314 7.163873895172131
epoch 30 0.01708879201189506 7.145213897119901
epoch 35 0.016038172603465295 7.149031584518357
epoch 40 0.0164286306646092 7.147612995955789
epoch 45 0.021363843945515937 7.129658348021422
epoch 50 0.0181304516100822 7.141426752585826
epoch 55 0.022464775491819022 7.125646911022457
epoch 60 0.019440541472893424 7.136660827342926
epoch 65 0.02032698914977138 7.133434247467268
epoch 70 0.017779897710939574 7.1427014797567185
epoch 75 0.019085366438019724 7.13795321927505
epoch 80 0.021965163029182833 7.127467616377315
epoch 85 0.024462959079466162 7.118360404119643
epoch 90 0.02226546368744231 7.126373305898945
epoch 95 0.02186728134667648 7.127824265773453
[32m[I 2022-02-26 22:56:18,434][0m Trial 20 finished with value: 7.132485319227157 and parameters: {'n_layers_mlp': 4, 'mlp_n_units_l0': 79, 'mlp_dropout_l0': 0.12794423374931155, 'mlp_n_units_l1': 41, 'mlp_dropout_l1': 0.2654348551936342, 'mlp_n_units_l2': 74, 'mlp_dropout_l2': 0.28886006162135525, 'mlp_n_units_l3': 54, 'mlp_dropout_l3': 0.29582822932096503, 'lr': 5.907388623626099e-05, 'weight_decay': 0.2983865120863641, 'criterion': 'MSELoss', 'batch_size': 128}. Best is trial 2 with value: 7.123397720004812.[0m
Trial Id: 21 | Model params: 11771 | Timestamp: 2022-02-26 22:56:18.434416

