[32m[I 2022-02-16 23:28:46,831][0m Trial 20 pruned. [0m
epoch 0 -0.08302357946507088 7.500272572394792
Trial Id: 21 | Model params: 831 | Timestamp: 2022-02-16 23:28:46.831971

epoch 0 -16.169672008092192 29.863388906409835
epoch 5 -0.07314361877061826 7.4659833029713205
epoch 10 -0.008635691309317961 7.238111293527632
epoch 15 -0.0008372774056430998 7.210075741755458
epoch 20 0.004007372518987862 7.192604037226227
epoch 25 0.007409512272086638 7.180309178935487
epoch 30 0.009834068988321065 7.171534305937827
epoch 35 0.01169475812731724 7.1647928748413205
epoch 40 0.012915173173176697 7.16036776318306
epoch 45 0.013927932171903912 7.156693515676503
epoch 50 0.014015524743840158 7.156375644836266
epoch 55 0.015699297981072613 7.150262535130578
epoch 60 0.016302001322830106 7.148073088851685
epoch 65 0.016865079131485605 7.146026984520465
epoch 70 0.016458510720840924 7.147504425949101
epoch 75 0.01778834105882332 7.142670779691178
epoch 80 0.018198976505968578 7.141177547350754
epoch 85 0.018521736976138126 7.140003643867268
epoch 90 0.01896349240921824 7.138396634056996
epoch 95 0.019332176397954925 7.137055165194141
[32m[I 2022-02-16 23:40:31,655][0m Trial 21 finished with value: 7.135990397991424 and parameters: {'n_layers_mlp': 2, 'mlp_n_units_l0': 30, 'mlp_dropout_l0': 0.006057898414086656, 'mlp_n_units_l1': 10, 'mlp_dropout_l1': 0.0035441567661460283, 'lr': 4.114074382230498e-05, 'weight_decay': 0.07080567871926895, 'criterion': 'MSELoss', 'batch_size': 128}. Best is trial 4 with value: 7.0801956527286.[0m
Trial Id: 22 | Model params: 892 | Timestamp: 2022-02-16 23:40:31.655413

[32m[I 2022-02-16 23:40:38,616][0m Trial 22 pruned. [0m
epoch 0 -6.984864456723675 20.36534936640027
Trial Id: 23 | Model params: 1373 | Timestamp: 2022-02-16 23:40:38.616517

[32m[I 2022-02-16 23:40:45,794][0m Trial 23 pruned. [0m
epoch 0 -0.050856736086143384 7.388050355015114
Trial Id: 24 | Model params: 1199 | Timestamp: 2022-02-16 23:40:45.794952

[32m[I 2022-02-16 23:40:52,745][0m Trial 24 pruned. [0m
epoch 0 -0.44013148615085207 8.648865899126012
Trial Id: 25 | Model params: 2613 | Timestamp: 2022-02-16 23:40:52.745291

[32m[I 2022-02-16 23:40:59,802][0m Trial 25 pruned. [0m
epoch 0 -13.626976791113355 27.56356432400544
Trial Id: 26 | Model params: 6090 | Timestamp: 2022-02-16 23:40:59.802233

[32m[I 2022-02-16 23:41:04,787][0m Trial 26 pruned. [0m
epoch 0 -0.010865299127191808 7.247464633575142
Trial Id: 27 | Model params: 3399 | Timestamp: 2022-02-16 23:41:04.787371

[32m[I 2022-02-16 23:41:30,955][0m Trial 27 pruned. [0m
epoch 0 -0.01631611202770844 7.265616919862796
Trial Id: 28 | Model params: 10996 | Timestamp: 2022-02-16 23:41:30.955628

epoch 0 -18.61379064900279 31.924215095733725
epoch 5 -0.03487337889299291 7.333023355209897
epoch 10 0.013656259730887799 7.159020514526144
epoch 15 0.01935764074140045 7.138299818563975
epoch 20 0.01857784207311952 7.141137412964957
epoch 25 0.021225881063531737 7.1314969218815145
epoch 30 0.022529245752679672 7.126747083534846
epoch 35 0.023291734719117163 7.123966884671385
epoch 40 0.023356371928947794 7.123731153605444
epoch 45 0.020267872718884528 7.13498616545436
epoch 50 0.023491113314072498 7.1232397284406765
epoch 55 0.023407174176407253 7.1235458729928975
epoch 60 0.024618815526199822 7.119125473155157
epoch 65 0.025199179394170157 7.117007174152926
epoch 70 0.025749453742418438 7.114998117920347
epoch 75 0.025542635454810392 7.115753279745117
epoch 80 0.026543999242051752 7.112096224339379
epoch 85 0.026677712343975202 7.111607751770867
epoch 90 0.027272280669350946 7.109435304525924
epoch 95 0.02795198950379807 7.106950955435769
[32m[I 2022-02-16 23:49:54,693][0m Trial 28 finished with value: 7.107537491499566 and parameters: {'n_layers_mlp': 4, 'mlp_n_units_l0': 49, 'mlp_dropout_l0': 0.15101830619863083, 'mlp_n_units_l1': 43, 'mlp_dropout_l1': 0.05061097107492818, 'mlp_n_units_l2': 79, 'mlp_dropout_l2': 0.13646140367873005, 'mlp_n_units_l3': 56, 'mlp_dropout_l3': 0.04843929893449726, 'lr': 9.938905049665317e-05, 'weight_decay': 0.1798149263999218, 'criterion': 'MSELoss', 'batch_size': 256}. Best is trial 4 with value: 7.0801956527286.[0m
Trial Id: 29 | Model params: 12175 | Timestamp: 2022-02-16 23:49:54.693746

[32m[I 2022-02-16 23:49:59,872][0m Trial 29 pruned. [0m
epoch 0 -14.738090771876 28.596671300138325
Trial Id: 30 | Model params: 10343 | Timestamp: 2022-02-16 23:49:59.873117

[32m[I 2022-02-16 23:50:04,830][0m Trial 30 pruned. [0m
epoch 0 -0.007833948592820938 7.236589742039876
Trial Id: 31 | Model params: 11647 | Timestamp: 2022-02-16 23:50:04.830470

[32m[I 2022-02-16 23:50:09,858][0m Trial 31 pruned. [0m
epoch 0 -0.09288807793316134 7.535764272127675
Trial Id: 32 | Model params: 9826 | Timestamp: 2022-02-16 23:50:09.858584

epoch 0 -18.61379064900279 31.924215095733725
epoch 5 -18.61379064900279 31.924215095733725
epoch 10 -18.61379064900279 31.924215095733725
epoch 15 -0.10841351706615221 7.5891016033898016
epoch 20 -0.013291557314901059 7.256157028963858
epoch 25 0.0011966263023318602 7.204095491984436
epoch 30 0.005806885307123477 7.187449993281446
epoch 35 0.013701949155276338 7.158854702496772
epoch 40 0.01676367882405605 7.147734577876277
epoch 45 0.01792148937925464 7.143524928543866
epoch 50 0.017996952978223457 7.143250466547832
epoch 55 0.019593000364884205 7.137443151319164
epoch 60 0.02096906370528262 7.132432465660383
epoch 65 0.02197885754758533 7.128753243572223
epoch 70 0.021825553498181827 7.129311934928093
epoch 75 0.022588260675611704 7.126531941150041
epoch 80 0.02250399450733309 7.126839136456189
epoch 85 0.023918145734264873 7.121682043216436
epoch 90 0.024403536043917762 7.11991107221814
epoch 95 0.02479625179575007 7.118477906572965
[32m[I 2022-02-16 23:58:37,602][0m Trial 32 finished with value: 7.120546605855182 and parameters: {'n_layers_mlp': 4, 'mlp_n_units_l0': 51, 'mlp_dropout_l0': 0.19489547463318685, 'mlp_n_units_l1': 35, 'mlp_dropout_l1': 0.027122704055136358, 'mlp_n_units_l2': 68, 'mlp_dropout_l2': 0.04745525100756774, 'mlp_n_units_l3': 67, 'mlp_dropout_l3': 0.16129157254764107, 'lr': 2.261475721623384e-05, 'weight_decay': 0.12369722271908583, 'criterion': 'MSELoss', 'batch_size': 256}. Best is trial 4 with value: 7.0801956527286.[0m
Trial Id: 33 | Model params: 6123 | Timestamp: 2022-02-16 23:58:37.603026

[32m[I 2022-02-16 23:58:42,934][0m Trial 33 pruned. [0m
epoch 0 -6.3551725656906335 19.54951078091784
Trial Id: 34 | Model params: 9106 | Timestamp: 2022-02-16 23:58:42.934662

[32m[I 2022-02-16 23:58:47,871][0m Trial 34 pruned. [0m
epoch 0 -0.052961858998692435 7.396832438087919
Trial Id: 35 | Model params: 5788 | Timestamp: 2022-02-16 23:58:47.872004

[32m[I 2022-02-16 23:58:53,150][0m Trial 35 pruned. [0m
epoch 0 -14.977291097189395 28.8131695272548
Trial Id: 36 | Model params: 1939 | Timestamp: 2022-02-16 23:58:53.150536

epoch 0 -18.61379064900279 31.924215095733725
epoch 5 -18.61379064900279 31.924215095733725
epoch 10 -18.61379064900279 31.924215095733725
epoch 15 -0.0355217675251327 7.335320208414133
epoch 20 -0.008243160103536429 7.238058731694207
epoch 25 0.0002671062598479379 7.207446899321527
epoch 30 0.00495459344235849 7.190530125683523
epoch 35 0.008002297429982819 7.179509817771172
epoch 40 0.008524101816516971 7.177621309114735
epoch 45 0.011542381690383685 7.166687819595895
epoch 50 0.012450284885664686 7.163395744429221
epoch 55 0.012504815110983003 7.163197968575274
epoch 60 0.013929561557445291 7.158028614412348
epoch 65 0.013861279153779438 7.158276446067736
epoch 70 0.01481577120720512 7.154811329064822
epoch 75 0.015387342032071039 7.152735537243014
epoch 80 0.01572235246196474 7.15151858921257
epoch 85 0.01564837253883755 7.15178734409883
epoch 90 0.016271003154454178 7.1495251310819
epoch 95 0.016112257266531538 7.150101972841681
[32m[I 2022-02-17 00:05:42,511][0m Trial 36 finished with value: 7.14849058360828 and parameters: {'n_layers_mlp': 2, 'mlp_n_units_l0': 56, 'mlp_dropout_l0': 0.11612225386564602, 'mlp_n_units_l1': 17, 'mlp_dropout_l1': 0.03928652529881719, 'lr': 6.616231499840935e-05, 'weight_decay': 0.25711390799800526, 'criterion': 'MSELoss', 'batch_size': 256}. Best is trial 4 with value: 7.0801956527286.[0m
Trial Id: 37 | Model params: 10454 | Timestamp: 2022-02-17 00:05:42.511421

epoch 0 -18.618272994773548 31.921881228743914
epoch 5 -14.750822723785435 28.602876593675298
epoch 10 -14.757239460873157 28.60870227190344
epoch 15 -14.757992050983491 28.609385461664406
epoch 20 -14.769965160068589 28.6202522729141
epoch 25 -14.741703691925473 28.594595492719577
epoch 30 -14.759460177969393 28.610718157874988
epoch 35 -14.732602676643452 28.586328361005588
epoch 40 -14.747265959971445 28.599646939513374
epoch 45 -14.730867219381755 28.584751644159716
epoch 50 -14.722118354146646 28.576801703519383
epoch 55 -14.738325788045968 28.591527369372542
epoch 60 -14.734548521567458 28.588096118167037
epoch 65 -14.726074038688122 28.58039643868246
epoch 70 -14.726225360964442 28.58053394408377
epoch 75 -14.739159940381143 28.592285053945684
epoch 80 -14.752841729376108 28.604709752432942
epoch 85 -14.728122287199726 28.5822576104
epoch 90 -14.73910050243613 28.59223106541397
epoch 95 -14.754218110243164 28.60595937189621
[32m[I 2022-02-17 00:21:01,220][0m Trial 37 finished with value: 28.593114724730196 and parameters: {'n_layers_mlp': 4, 'mlp_n_units_l0': 27, 'mlp_dropout_l0': 0.08543865741206691, 'mlp_n_units_l1': 60, 'mlp_dropout_l1': 0.08360774747829308, 'mlp_n_units_l2': 74, 'mlp_dropout_l2': 0.0875410997536819, 'mlp_n_units_l3': 50, 'mlp_dropout_l3': 0.1306188426094472, 'lr': 0.0001397640647140756, 'weight_decay': 0.17867061365753253, 'criterion': 'PoissonNLLLoss', 'batch_size': 128}. Best is trial 4 with value: 7.0801956527286.[0m
Trial Id: 38 | Model params: 6556 | Timestamp: 2022-02-17 00:21:01.220218

[32m[I 2022-02-17 00:21:06,085][0m Trial 38 pruned. [0m
epoch 0 -16.803677466507875 30.415455129845853
Trial Id: 39 | Model params: 5579 | Timestamp: 2022-02-17 00:21:06.085863

[32m[I 2022-02-17 00:21:39,464][0m Trial 39 pruned. [0m
epoch 0 -0.02203895695636704 7.286044436828353
Trial Id: 40 | Model params: 1927 | Timestamp: 2022-02-17 00:21:39.464727

[32m[I 2022-02-17 00:21:46,524][0m Trial 40 pruned. [0m
epoch 0 0.0017671047796545825 7.2006885890834536
Trial Id: 41 | Model params: 9792 | Timestamp: 2022-02-17 00:21:46.524215

[32m[I 2022-02-17 00:21:51,477][0m Trial 41 pruned. [0m
epoch 0 -16.86370034915745 30.466682949781855
Trial Id: 42 | Model params: 9966 | Timestamp: 2022-02-17 00:21:51.478031

[32m[I 2022-02-17 00:21:56,522][0m Trial 42 pruned. [0m
epoch 0 -18.294439721873577 31.663254123307212
Trial Id: 43 | Model params: 8389 | Timestamp: 2022-02-17 00:21:56.523019

[32m[I 2022-02-17 00:22:01,486][0m Trial 43 pruned. [0m
epoch 0 -0.11915248820386592 7.625776855577352
Trial Id: 44 | Model params: 11612 | Timestamp: 2022-02-17 00:22:01.486661

[32m[I 2022-02-17 00:22:06,667][0m Trial 44 pruned. [0m
epoch 0 -4.997736400650679 17.653594548740415
Trial Id: 45 | Model params: 9512 | Timestamp: 2022-02-17 00:22:06.667709

epoch 0 -18.61379064900279 31.924215095733725
epoch 5 -18.61379064900279 31.924215095733725
epoch 10 -18.61379064900279 31.924215095733725
epoch 15 -18.61379064900279 31.924215095733725
epoch 20 -18.4485172308135 31.78942763413992
epoch 25 -0.0648780905747155 7.438569180383936
epoch 30 -0.014874459879264945 7.261822381341967
epoch 35 -0.0058347987508613475 7.229408892148968
epoch 40 0.00035380650133820524 7.207134365374063
epoch 45 0.005684005228538513 7.18789415604943
epoch 50 0.007901860479133216 7.179873261064296
epoch 55 0.010172844677996618 7.171650929110516
epoch 60 0.014521130709397978 7.155881149061803
epoch 65 0.015288259300311746 7.153095422291261
epoch 70 0.016360277421547775 7.1492007108911215
epoch 75 0.016935697997619403 7.147109295250368
epoch 80 0.01846879627847442 7.141534127756923
epoch 85 0.018410680840270643 7.141745546018751
epoch 90 0.017946998134905523 7.143432154079704
epoch 95 0.01891746479661649 7.139901704980947
[32m[I 2022-02-17 00:30:30,369][0m Trial 45 finished with value: 7.139873478814414 and parameters: {'n_layers_mlp': 4, 'mlp_n_units_l0': 58, 'mlp_dropout_l0': 0.23373007416068425, 'mlp_n_units_l1': 49, 'mlp_dropout_l1': 0.26147948123133846, 'mlp_n_units_l2': 45, 'mlp_dropout_l2': 0.10797681187194019, 'mlp_n_units_l3': 72, 'mlp_dropout_l3': 0.1099043758788185, 'lr': 1.3426420652812337e-05, 'weight_decay': 0.1944648164802488, 'criterion': 'MSELoss', 'batch_size': 256}. Best is trial 4 with value: 7.0801956527286.[0m
Trial Id: 46 | Model params: 9608 | Timestamp: 2022-02-17 00:30:30.370009

[32m[I 2022-02-17 00:31:03,771][0m Trial 46 pruned. [0m
epoch 0 -0.00862461546844595 7.238071552524177
Trial Id: 47 | Model params: 5486 | Timestamp: 2022-02-17 00:31:03.771554

[32m[I 2022-02-17 00:31:08,915][0m Trial 47 pruned. [0m
epoch 0 -14.811139524721971 28.66296056080343
Trial Id: 48 | Model params: 9126 | Timestamp: 2022-02-17 00:31:08.915887

[32m[I 2022-02-17 00:31:41,884][0m Trial 48 pruned. [0m
epoch 0 -0.018713603476994356 7.274181673151441
Trial Id: 49 | Model params: 11992 | Timestamp: 2022-02-17 00:31:41.885050

[32m[I 2022-02-17 00:31:47,013][0m Trial 49 pruned. [0m
epoch 0 -0.008976957156870302 7.240692173878089
Trial Id: 50 | Model params: 6255 | Timestamp: 2022-02-17 00:31:47.013392

[32m[I 2022-02-17 00:32:20,792][0m Trial 50 pruned. [0m
epoch 0 0.0015719044765228896 7.2013925870658495
Trial Id: 51 | Model params: 885 | Timestamp: 2022-02-17 00:32:20.792300

[32m[I 2022-02-17 00:32:27,827][0m Trial 51 pruned. [0m
epoch 0 -13.036564849001628 27.00153841435883
Trial Id: 52 | Model params: 807 | Timestamp: 2022-02-17 00:32:27.828092

[32m[I 2022-02-17 00:32:35,015][0m Trial 52 pruned. [0m
epoch 0 -16.71150060175671 30.330932999846947
Trial Id: 53 | Model params: 703 | Timestamp: 2022-02-17 00:32:35.015690

[32m[I 2022-02-17 00:32:42,096][0m Trial 53 pruned. [0m
epoch 0 -17.69669938916343 31.163093541023937
Trial Id: 54 | Model params: 929 | Timestamp: 2022-02-17 00:32:42.096850

[32m[I 2022-02-17 00:32:49,163][0m Trial 54 pruned. [0m
epoch 0 -4.42736559626436 16.790074735889753
Trial Id: 55 | Model params: 3486 | Timestamp: 2022-02-17 00:32:49.164038

[32m[I 2022-02-17 00:32:56,176][0m Trial 55 pruned. [0m
epoch 0 -0.06025473983151741 7.421013162884216
Trial Id: 56 | Model params: 732 | Timestamp: 2022-02-17 00:32:56.176184

[32m[I 2022-02-17 00:33:03,406][0m Trial 56 pruned. [0m
epoch 0 -18.009930127100322 31.423051043428337
Trial Id: 57 | Model params: 4136 | Timestamp: 2022-02-17 00:33:03.406393

[32m[I 2022-02-17 00:33:12,346][0m Trial 57 pruned. [0m
epoch 0 -0.0831201618166224 7.500606996236845
Trial Id: 58 | Model params: 1607 | Timestamp: 2022-02-17 00:33:12.346785

epoch 0 -18.618272994773548 31.921881228743914
epoch 5 -0.0013038628012029818 7.2117561967733295
epoch 10 0.0085745096771499 7.1760941992406835
epoch 15 0.01112419652977048 7.166860740951004
epoch 20 0.013232801503173075 7.159215623780375
epoch 25 0.015212913134961425 7.152028941378236
epoch 30 0.015802933481838144 7.14988610517214
epoch 35 0.01766376483911647 7.143123726214443
epoch 40 0.018354327997776698 7.140612546679903
epoch 45 0.01844648751346689 7.140277348930351
epoch 50 0.0166212368160481 7.146913127254413
epoch 55 0.017980597714302604 7.141971697580069
epoch 60 0.01694015211121247 7.1457541411043035
epoch 65 0.01856378326862773 7.139850704210729
epoch 70 0.018951448459005982 7.138440452115304
epoch 75 0.020210879710859775 7.133856957136336
epoch 80 0.019518260825846734 7.136377995104701
epoch 85 0.02039358272152758 7.133191794662505
epoch 90 0.019120053600580333 7.137827011792715
epoch 95 0.019534118676090118 7.136320284661666
[32m[I 2022-02-17 01:16:33,206][0m Trial 58 finished with value: 7.13275937508473 and parameters: {'n_layers_mlp': 2, 'mlp_n_units_l0': 39, 'mlp_dropout_l0': 0.16572158482911975, 'mlp_n_units_l1': 23, 'mlp_dropout_l1': 0.03001775385603157, 'lr': 4.793726845877745e-05, 'weight_decay': 0.22012907945095733, 'criterion': 'MSELoss', 'batch_size': 32}. Best is trial 4 with value: 7.0801956527286.[0m
Trial Id: 59 | Model params: 6603 | Timestamp: 2022-02-17 01:16:33.206601

[32m[I 2022-02-17 01:17:06,903][0m Trial 59 pruned. [0m
epoch 0 -0.01991383350456477 7.278465566665915
Trial Id: 60 | Model params: 2076 | Timestamp: 2022-02-17 01:17:06.903246

[32m[I 2022-02-17 01:17:33,128][0m Trial 60 pruned. [0m
epoch 0 -0.01572199296342558 7.263492938694013
Trial Id: 61 | Model params: 2099 | Timestamp: 2022-02-17 01:17:33.128657

[32m[I 2022-02-17 01:17:59,273][0m Trial 61 pruned. [0m
epoch 0 -0.07817152568256125 7.483452727565409
Trial Id: 62 | Model params: 1023 | Timestamp: 2022-02-17 01:17:59.273967

[32m[I 2022-02-17 01:18:25,277][0m Trial 62 pruned. [0m
epoch 0 -0.13102718002765212 7.6646903005787355
Trial Id: 63 | Model params: 1973 | Timestamp: 2022-02-17 01:18:25.278170

[32m[I 2022-02-17 01:18:51,877][0m Trial 63 pruned. [0m
epoch 0 -10.690145676140206 24.64155169462483
Trial Id: 64 | Model params: 1472 | Timestamp: 2022-02-17 01:18:51.877684

[32m[I 2022-02-17 01:18:55,976][0m Trial 64 pruned. [0m
epoch 0 -10.62960351487452 24.58226606330983
Trial Id: 65 | Model params: 1407 | Timestamp: 2022-02-17 01:18:55.976582

[32m[I 2022-02-17 01:19:21,906][0m Trial 65 pruned. [0m
epoch 0 -0.08734553970380787 7.515223125997966
Trial Id: 66 | Model params: 1935 | Timestamp: 2022-02-17 01:19:21.906450

[32m[I 2022-02-17 01:19:26,015][0m Trial 66 pruned. [0m
epoch 0 -17.971417972328545 31.39708702488412
Trial Id: 67 | Model params: 3096 | Timestamp: 2022-02-17 01:19:26.015568

epoch 0 -18.618272994773548 31.921881228743914
epoch 5 -18.515623343296195 31.8382584874589
epoch 10 -14.752432199699061 28.6043379289269
epoch 15 -14.751851469086334 28.603810658992206
epoch 20 -14.755411059480354 28.607042409187585
epoch 25 -14.742891308366179 28.59567411711447
epoch 30 -14.749925264446615 28.602061706579065
epoch 35 -14.749147724673898 28.60135568687841
epoch 40 -14.7493103456765 28.601503351031802
epoch 45 -14.746352816314754 28.598817717321477
epoch 50 -14.747135872114269 28.599528808706427
epoch 55 -14.74307193187024 28.595838160552994
epoch 60 -14.744318797715957 28.596970546536287
epoch 65 -14.736878523712372 28.590212729883586
epoch 70 -14.74606876681887 28.598559768179683
epoch 75 -14.725615252578852 28.57997953919166
epoch 80 -14.748335141283729 28.600617828336365
epoch 85 -14.749686664277965 28.601845055309965
epoch 90 -14.74644275742307 28.59889939355848
epoch 95 -14.73918127710858 28.592304434445932
[32m[I 2022-02-17 01:34:42,807][0m Trial 67 finished with value: 28.590411148357255 and parameters: {'n_layers_mlp': 4, 'mlp_n_units_l0': 25, 'mlp_dropout_l0': 0.05676851978187628, 'mlp_n_units_l1': 23, 'mlp_dropout_l1': 0.03955646216736926, 'mlp_n_units_l2': 51, 'mlp_dropout_l2': 0.041997180451480605, 'mlp_n_units_l3': 16, 'mlp_dropout_l3': 0.02380067927349555, 'lr': 6.38403478396411e-05, 'weight_decay': 0.2911873505719908, 'criterion': 'PoissonNLLLoss', 'batch_size': 128}. Best is trial 4 with value: 7.0801956527286.[0m
Trial Id: 68 | Model params: 1947 | Timestamp: 2022-02-17 01:34:42.807252

[32m[I 2022-02-17 01:34:46,806][0m Trial 68 pruned. [0m
epoch 0 -0.12919647431257753 7.659919707172714
Trial Id: 69 | Model params: 8962 | Timestamp: 2022-02-17 01:34:46.806584

[32m[I 2022-02-17 01:35:20,485][0m Trial 69 pruned. [0m
epoch 0 -0.07733084353231434 7.480534624175408
Trial Id: 70 | Model params: 9488 | Timestamp: 2022-02-17 01:35:20.485637

[32m[I 2022-02-17 01:35:29,344][0m Trial 70 pruned. [0m
epoch 0 0.01709128126675774 7.145204849369933
Trial Id: 71 | Model params: 9040 | Timestamp: 2022-02-17 01:35:29.345075

epoch 0 -18.61379064900279 31.924215095733725
epoch 5 -18.61379064900279 31.924215095733725
epoch 10 -0.12411442963566865 7.642663209453246
epoch 15 -0.047761675371792434 7.378544740793236
epoch 20 -0.013503963687150788 7.256917507633026
epoch 25 -0.005144028469060924 7.226926019952496
epoch 30 0.0023984929511088326 7.199759819634523
epoch 35 0.004606775858671308 7.191786738839205
epoch 40 0.007890352828932023 7.179914901718124
epoch 45 0.011230467677337042 7.167818477095321
epoch 50 0.01336993868836922 7.160059518171598
epoch 55 0.014001784883322599 7.15776646980292
epoch 60 0.016856146690865437 7.147398467780079
epoch 65 0.016376068037787128 7.149143326700894
epoch 70 0.01734042889856502 7.145637899244684
epoch 75 0.017291341199452304 7.145816373333318
epoch 80 0.018486389284986582 7.1414701248913275
epoch 85 0.01844681074849963 7.141614109693728
epoch 90 0.01986267071047365 7.1364614727224875
epoch 95 0.019998998117568 7.135965149864602
[32m[I 2022-02-17 01:43:54,788][0m Trial 71 finished with value: 7.133973454035088 and parameters: {'n_layers_mlp': 4, 'mlp_n_units_l0': 59, 'mlp_dropout_l0': 0.29465325548365173, 'mlp_n_units_l1': 45, 'mlp_dropout_l1': 0.19361625238527128, 'mlp_n_units_l2': 44, 'mlp_dropout_l2': 0.11062791434157568, 'mlp_n_units_l3': 72, 'mlp_dropout_l3': 0.11133390682671196, 'lr': 1.2536089184718958e-05, 'weight_decay': 0.1979076032474143, 'criterion': 'MSELoss', 'batch_size': 256}. Best is trial 4 with value: 7.0801956527286.[0m
Trial Id: 72 | Model params: 8377 | Timestamp: 2022-02-17 01:43:54.788560

