[32m[I 2022-02-16 18:33:00,513][0m Trial 58 pruned. [0m
epoch 0 -1.968710324991327 7.419707213734313
Trial Id: 59 | Model params: 2091 | Timestamp: 2022-02-16 18:33:00.514098

epoch 0 -3.582312501986956 9.218326386669025
epoch 5 0.0072125210604293555 4.290796074130214
epoch 10 0.0039626303516704375 4.2978132985112
epoch 15 0.005814585815837714 4.293815927396619
epoch 20 0.007374977120120141 4.2904449947922
epoch 25 0.006848080095023801 4.291583553029357
epoch 30 0.007318304310959922 4.290567472109556
epoch 35 0.006189436179087848 4.293006375082764
epoch 40 0.004914425124497801 4.295759352515825
epoch 45 0.0072175528976581305 4.290785200395783
epoch 50 0.007247395804985679 4.290720709697053
epoch 55 0.007386732290710074 4.290419589900636
epoch 60 0.004188065910095684 4.297326903723752
epoch 65 0.007329787536073495 4.29054265564782
epoch 70 0.007414565587543387 4.290359436886867
epoch 75 0.0060241630464807905 4.293363328984001
epoch 80 0.007003427528534334 4.291247898156281
epoch 85 0.006761220356625963 4.291771217004633
epoch 90 0.003775485190938177 4.298217036969204
epoch 95 0.006627568519515181 4.292059961173921
[32m[I 2022-02-16 18:44:39,788][0m Trial 59 finished with value: 4.291349106764494 and parameters: {'n_layers_mlp': 2, 'mlp_n_units_l0': 34, 'mlp_dropout_l0': 0.10561131054110977, 'mlp_n_units_l1': 42, 'mlp_dropout_l1': 0.20113087326123955, 'lr': 0.0003168252827899575, 'weight_decay': 0.16838385631159855, 'criterion': 'MSELoss', 'batch_size': 128}. Best is trial 29 with value: 4.274750411481795.[0m
Trial Id: 60 | Model params: 2291 | Timestamp: 2022-02-16 18:44:39.788276

[32m[I 2022-02-16 18:45:05,049][0m Trial 60 pruned. [0m
epoch 0 -1.968369833845248 7.419399111521071
Trial Id: 61 | Model params: 4191 | Timestamp: 2022-02-16 18:45:05.049498

epoch 0 -3.582821042664899 9.218692013232362
epoch 5 -3.582821042664899 9.218692013232362
epoch 10 -3.582821042664899 9.218692013232362
epoch 15 -0.0032774609936059296 4.313336937530352
epoch 20 0.004890303866587731 4.295743440293876
epoch 25 0.006710442057011101 4.291813006631295
epoch 30 0.007311195257764913 4.290514940851931
epoch 35 0.007712773837820097 4.289647018711317
epoch 40 0.008063471304381342 4.288888921032816
epoch 45 0.008349764689566497 4.28826994537103
epoch 50 0.008597124645177923 4.287735073103229
epoch 55 0.008736705894778263 4.287433223824127
epoch 60 0.008959122752565274 4.286952195761925
epoch 65 0.009183046622593172 4.286467853905169
epoch 70 0.00934500748154099 4.286117502416997
epoch 75 0.009474807917818184 4.285836699235901
epoch 80 0.009588461762586209 4.28559081160162
epoch 85 0.009685535144649982 4.285380784268313
epoch 90 0.00964157496671647 4.285475897496434
epoch 95 0.009751968293497337 4.285237044009914
[32m[I 2022-02-16 18:51:53,675][0m Trial 61 finished with value: 4.28480020506778 and parameters: {'n_layers_mlp': 2, 'mlp_n_units_l0': 42, 'mlp_dropout_l0': 0.06334842130488165, 'mlp_n_units_l1': 79, 'mlp_dropout_l1': 0.040435917281069655, 'lr': 2.7765537936711868e-05, 'weight_decay': 0.011031480034642265, 'criterion': 'MSELoss', 'batch_size': 256}. Best is trial 29 with value: 4.274750411481795.[0m
Trial Id: 62 | Model params: 4197 | Timestamp: 2022-02-16 18:51:53.675610

[32m[I 2022-02-16 18:51:57,707][0m Trial 62 pruned. [0m
epoch 0 -2.9528863800159364 8.56170031771618
Trial Id: 63 | Model params: 4475 | Timestamp: 2022-02-16 18:51:57.707989

epoch 0 -3.582821042664899 9.218692013232362
epoch 5 -3.582821042664899 9.218692013232362
epoch 10 -2.5199599167704014 8.079262440242161
epoch 15 -0.0008683250673413578 4.308155090523394
epoch 20 0.0032247283683747296 4.299336960515881
epoch 25 0.005425107848520128 4.294588949758453
epoch 30 0.006213273601230251 4.292886956867786
epoch 35 0.006688447181679269 4.29186052417978
epoch 40 0.007019521747811619 4.29114521775016
epoch 45 0.007255597950414416 4.290635088141209
epoch 50 0.007480354806195466 4.290149361786078
epoch 55 0.007758615699047566 4.289547930630074
epoch 60 0.007968127527307467 4.28909503756932
epoch 65 0.00815813235663232 4.2886842706278
epoch 70 0.008246458841839277 4.288493306294707
epoch 75 0.008520475226393764 4.287900821083844
epoch 80 0.00869258278075935 4.287528643881046
epoch 85 0.008826210687180258 4.287239655432277
epoch 90 0.008946719107899903 4.286979022942608
epoch 95 0.009127231065947927 4.286588586710131
[32m[I 2022-02-16 18:58:46,288][0m Trial 63 finished with value: 4.286390656903688 and parameters: {'n_layers_mlp': 2, 'mlp_n_units_l0': 47, 'mlp_dropout_l0': 0.017867797289316853, 'mlp_n_units_l1': 75, 'mlp_dropout_l1': 0.04150436248316726, 'lr': 1.3160212077978024e-05, 'weight_decay': 0.0002455053528649803, 'criterion': 'MSELoss', 'batch_size': 256}. Best is trial 29 with value: 4.274750411481795.[0m
Trial Id: 64 | Model params: 4138 | Timestamp: 2022-02-16 18:58:46.288408

[32m[I 2022-02-16 18:58:50,539][0m Trial 64 pruned. [0m
epoch 0 0.004709258535965821 4.29613419566679
Trial Id: 65 | Model params: 3223 | Timestamp: 2022-02-16 18:58:50.539708

[32m[I 2022-02-16 18:58:54,527][0m Trial 65 pruned. [0m
epoch 0 -2.544299384302629 8.107147158463267
Trial Id: 66 | Model params: 3001 | Timestamp: 2022-02-16 18:58:54.527799

epoch 0 -3.1353179550365686 8.757039530115453
epoch 5 -0.00020465905661182227 4.30672650588291
epoch 10 0.0040894038752796735 4.2974717768401876
epoch 15 0.005460195678650415 4.294513194208117
epoch 20 0.006135430098327288 4.293055084900543
epoch 25 0.00665642247926812 4.291929709143895
epoch 30 0.007063911070677609 4.291049302894063
epoch 35 0.007453958483861767 4.290206410234958
epoch 40 0.0076894518558239255 4.289697428753931
epoch 45 0.007978598626832811 4.289072401371446
epoch 50 0.008199979673021662 4.2885937966185415
epoch 55 0.00840280770974522 4.288155254816361
epoch 60 0.008568047062880058 4.287797951706058
epoch 65 0.008630792921999753 4.2876622662349915
epoch 70 0.008823148852958651 4.287246277281591
epoch 75 0.008924862902245034 4.287026294154151
epoch 80 0.009008084185263443 4.2868462980544155
epoch 85 0.009099588334204545 4.286648378539977
epoch 90 0.009075324074086843 4.286700861974908
epoch 95 0.009193632134314678 4.286444956347377
[32m[I 2022-02-16 19:05:43,868][0m Trial 66 finished with value: 4.286212043638399 and parameters: {'n_layers_mlp': 2, 'mlp_n_units_l0': 39, 'mlp_dropout_l0': 0.0996850962315219, 'mlp_n_units_l1': 57, 'mlp_dropout_l1': 0.06577015428324906, 'lr': 2.3423311773977477e-05, 'weight_decay': 0.030795047071453453, 'criterion': 'MSELoss', 'batch_size': 256}. Best is trial 29 with value: 4.274750411481795.[0m
Trial Id: 67 | Model params: 4927 | Timestamp: 2022-02-16 19:05:43.868860

[32m[I 2022-02-16 19:06:09,764][0m Trial 67 pruned. [0m
epoch 0 0.004838351331827417 4.295923553700633
Trial Id: 68 | Model params: 4642 | Timestamp: 2022-02-16 19:06:09.764909

[32m[I 2022-02-16 19:06:13,858][0m Trial 68 pruned. [0m
epoch 0 -0.4142672851891698 5.121163061733869
Trial Id: 69 | Model params: 4659 | Timestamp: 2022-02-16 19:06:13.859079

epoch 0 -3.2819776036252515 8.910971452371554
epoch 5 -0.0068608453864975605 4.321032997784381
epoch 10 0.001989662936080161 4.301999706467299
epoch 15 0.0040878244169364475 4.297475184613429
epoch 20 0.005028485488762002 4.295445174983308
epoch 25 0.005423961349947937 4.294591425056552
epoch 30 0.005894138449841435 4.293576189840052
epoch 35 0.005786152955508994 4.293809379973524
epoch 40 0.005883263198077859 4.293599675062367
epoch 45 0.006315576724232108 4.292665990420064
epoch 50 0.006461105912185627 4.292351639578108
epoch 55 0.006712179049399358 4.291809254024755
epoch 60 0.0065614411797878525 4.292134896616801
epoch 65 0.006505238054760221 4.292256307236667
epoch 70 0.0069651778591153235 4.291262639156057
epoch 75 0.006952487827563081 4.291290058176569
epoch 80 0.006941749368573946 4.291313260348248
epoch 85 0.007045359543224827 4.291089388629695
epoch 90 0.007048431705090619 4.291082750395256
epoch 95 0.00712353879100347 4.290920458081185
[32m[I 2022-02-16 19:13:02,717][0m Trial 69 finished with value: 4.2910390857307545 and parameters: {'n_layers_mlp': 2, 'mlp_n_units_l0': 49, 'mlp_dropout_l0': 0.0658330191341719, 'mlp_n_units_l1': 75, 'mlp_dropout_l1': 0.16600288864303114, 'lr': 1.6669842800729592e-05, 'weight_decay': 0.19783308762281654, 'criterion': 'MSELoss', 'batch_size': 256}. Best is trial 29 with value: 4.274750411481795.[0m
Trial Id: 70 | Model params: 3711 | Timestamp: 2022-02-16 19:13:02.717504

epoch 0 -3.299531226759078 8.929217677504493
epoch 5 -0.11088780493225658 4.538767707010641
epoch 10 -0.0004273241208785361 4.307205859863521
epoch 15 0.0038179743461740356 4.298057362171898
epoch 20 0.0055622594012800786 4.294292828342646
epoch 25 0.00624086966244819 4.292827352734152
epoch 30 0.0065507228150533114 4.292158050813312
epoch 35 0.006749294290437802 4.291729069299015
epoch 40 0.006867719419864637 4.291473210572675
epoch 45 0.0069581917021237505 4.291277733985107
epoch 50 0.00741403833682408 4.290292685300051
epoch 55 0.007412965927801829 4.29029500295692
epoch 60 0.007798592077179478 4.289461519037073
epoch 65 0.007885312640585895 4.289274060802742
epoch 70 0.008088599470275293 4.288834596692634
epoch 75 0.008211244186067224 4.288569442385355
epoch 80 0.008321389472034646 4.2883312975079875
epoch 85 0.008407115731600912 4.288145939800764
epoch 90 0.008563665773571039 4.287807425912793
epoch 95 0.008629401230462852 4.287665275760178
[32m[I 2022-02-16 19:19:50,956][0m Trial 70 finished with value: 4.287594590557552 and parameters: {'n_layers_mlp': 2, 'mlp_n_units_l0': 46, 'mlp_dropout_l0': 0.15244148213340353, 'mlp_n_units_l1': 61, 'mlp_dropout_l1': 0.12452107123059304, 'lr': 1.238067507885883e-05, 'weight_decay': 0.023990993259970426, 'criterion': 'MSELoss', 'batch_size': 256}. Best is trial 29 with value: 4.274750411481795.[0m
Trial Id: 71 | Model params: 4147 | Timestamp: 2022-02-16 19:19:50.957175

[32m[I 2022-02-16 19:19:55,257][0m Trial 71 pruned. [0m
epoch 0 -2.6081179434274735 8.179810062725226
Trial Id: 72 | Model params: 2912 | Timestamp: 2022-02-16 19:19:55.257613

epoch 0 -3.582821042664899 9.218692013232362
epoch 5 -0.6867796614586092 5.592835355243735
epoch 10 0.001074101569449315 4.303972552669593
epoch 15 0.00488998820118558 4.295744121634575
epoch 20 0.006186921201062345 4.292943874072459
epoch 25 0.006753592221972582 4.2917197838398895
epoch 30 0.007067932275295896 4.2910406139135056
epoch 35 0.0073219219120498336 4.290491759873873
epoch 40 0.007520666503157747 4.290062237587624
epoch 45 0.0077551383280336506 4.289555447115883
epoch 50 0.007927596965580541 4.289182654540323
epoch 55 0.007884020853912044 4.289276853234575
epoch 60 0.008138375073580617 4.288726985262994
epoch 65 0.008333128692817438 4.28830591538502
epoch 70 0.008112233108455658 4.2887835027296095
epoch 75 0.00857275908332955 4.287787762294885
epoch 80 0.008654168669613327 4.287611715995434
epoch 85 0.008694220090725846 4.2875251030943256
epoch 90 0.008806773047184024 4.28728169317245
epoch 95 0.00878026749002192 4.287339016016885
[32m[I 2022-02-16 19:26:43,864][0m Trial 72 finished with value: 4.286869514765195 and parameters: {'n_layers_mlp': 2, 'mlp_n_units_l0': 29, 'mlp_dropout_l0': 0.06651209449290192, 'mlp_n_units_l1': 78, 'mlp_dropout_l1': 0.020364742607390227, 'lr': 1.6805952076802524e-05, 'weight_decay': 0.017824715624036043, 'criterion': 'MSELoss', 'batch_size': 256}. Best is trial 29 with value: 4.274750411481795.[0m
Trial Id: 73 | Model params: 3747 | Timestamp: 2022-02-16 19:26:43.864286

epoch 0 -3.582821042664899 9.218692013232362
epoch 5 0.00872899547572048 4.287449898426501
epoch 10 0.010561221108697505 4.283485690399826
epoch 15 0.008766416850934933 4.287368970110799
epoch 20 0.010841053095372977 4.282879922211402
epoch 25 0.010742969053443185 4.283092260057592
epoch 30 0.011361997207303909 4.281751976636244
epoch 35 0.011393225603532842 4.281684351629506
epoch 40 0.011785959785624023 4.28083379563335
epoch 45 0.012485713953623634 4.2793178984487845
epoch 50 0.01230231941153781 4.279715243137252
epoch 55 0.012957364681540295 4.278295845155385
epoch 60 0.013168630777643409 4.2778379585356054
epoch 65 0.013285625759169695 4.277584368903507
epoch 70 0.013683514791444473 4.2767218216629885
epoch 75 0.014818899094231508 4.274259568876676
epoch 80 0.014956333119794718 4.273961426135963
epoch 85 0.015101602081182941 4.273646264051914
epoch 90 0.013682883412674762 4.276723190509079
epoch 95 0.014635047245527222 4.274658375686857
[32m[I 2022-02-16 19:33:32,679][0m Trial 73 finished with value: 4.272035952774967 and parameters: {'n_layers_mlp': 2, 'mlp_n_units_l0': 40, 'mlp_dropout_l0': 0.07978735733820252, 'mlp_n_units_l1': 73, 'mlp_dropout_l1': 0.013519451075517101, 'lr': 0.00034294857273689517, 'weight_decay': 0.0004828378731781737, 'criterion': 'MSELoss', 'batch_size': 256}. Best is trial 73 with value: 4.272035952774967.[0m
Trial Id: 74 | Model params: 2925 | Timestamp: 2022-02-16 19:33:32.679863

[32m[I 2022-02-16 19:33:36,740][0m Trial 74 pruned. [0m
epoch 0 0.003409858286702372 4.298937686535321
Trial Id: 75 | Model params: 3657 | Timestamp: 2022-02-16 19:33:36.740291

[32m[I 2022-02-16 19:33:40,762][0m Trial 75 pruned. [0m
epoch 0 0.004037693662189645 4.297583343228611
Trial Id: 76 | Model params: 2099 | Timestamp: 2022-02-16 19:33:40.762748

[32m[I 2022-02-16 19:34:06,505][0m Trial 76 pruned. [0m
epoch 0 0.000776876120677561 4.304680935583809
Trial Id: 77 | Model params: 2323 | Timestamp: 2022-02-16 19:34:06.505688

[32m[I 2022-02-16 19:34:10,686][0m Trial 77 pruned. [0m
epoch 0 0.007150567729143242 4.29086205211756
Trial Id: 78 | Model params: 4595 | Timestamp: 2022-02-16 19:34:10.686883

[32m[I 2022-02-16 19:34:14,616][0m Trial 78 pruned. [0m
epoch 0 0.005635403719557619 4.294134895430084
Trial Id: 79 | Model params: 3594 | Timestamp: 2022-02-16 19:34:14.616435

[32m[I 2022-02-16 19:34:21,656][0m Trial 79 pruned. [0m
epoch 0 0.00636396949135587 4.2926293889904095
Trial Id: 80 | Model params: 9296 | Timestamp: 2022-02-16 19:34:21.656688

[32m[I 2022-02-16 19:34:26,885][0m Trial 80 pruned. [0m
epoch 0 -1.9875785966510375 7.443248633217268
Trial Id: 81 | Model params: 4235 | Timestamp: 2022-02-16 19:34:26.885746

[32m[I 2022-02-16 19:34:30,949][0m Trial 81 pruned. [0m
epoch 0 -2.715151998989761 8.3002495550245
Trial Id: 82 | Model params: 3789 | Timestamp: 2022-02-16 19:34:30.949867

[32m[I 2022-02-16 19:34:34,906][0m Trial 82 pruned. [0m
epoch 0 -2.0166781356025467 7.479410064794391
Trial Id: 83 | Model params: 4432 | Timestamp: 2022-02-16 19:34:34.907075

[32m[I 2022-02-16 19:34:38,918][0m Trial 83 pruned. [0m
epoch 0 0.005897171985824845 4.293569638863788
Trial Id: 84 | Model params: 2977 | Timestamp: 2022-02-16 19:34:38.918605

[32m[I 2022-02-16 19:34:43,079][0m Trial 84 pruned. [0m
epoch 0 -0.9919711301709784 6.077771615401788
Trial Id: 85 | Model params: 3243 | Timestamp: 2022-02-16 19:34:43.079688

[32m[I 2022-02-16 19:34:47,290][0m Trial 85 pruned. [0m
epoch 0 -3.0656845777857233 8.682997936292795
Trial Id: 86 | Model params: 3267 | Timestamp: 2022-02-16 19:34:47.290512

[32m[I 2022-02-16 19:34:51,315][0m Trial 86 pruned. [0m
epoch 0 -2.968045795406506 8.578101772227148
Trial Id: 87 | Model params: 4524 | Timestamp: 2022-02-16 19:34:51.315796

[32m[I 2022-02-16 19:35:17,054][0m Trial 87 pruned. [0m
epoch 0 0.007833334314602203 4.289454296714592
Trial Id: 88 | Model params: 4808 | Timestamp: 2022-02-16 19:35:17.054979

[32m[I 2022-02-16 19:35:22,145][0m Trial 88 pruned. [0m
epoch 0 -0.011864929894553455 4.331757426420995
Trial Id: 89 | Model params: 2079 | Timestamp: 2022-02-16 19:35:22.146046

epoch 0 -3.582821042664899 9.218692013232362
epoch 5 -3.582821042664899 9.218692013232362
epoch 10 -3.582821042664899 9.218692013232362
epoch 15 -3.4911532005168375 9.126027886683685
epoch 20 -0.5036559209968494 5.280524853220854
epoch 25 0.0016944367917169911 4.302635956828294
epoch 30 0.004281043586922162 4.297058282959241
epoch 35 0.005584718803687605 4.294244334710856
epoch 40 0.006382333624417202 4.292521794797468
epoch 45 0.006766617842096645 4.291691642537578
epoch 50 0.0069113116736615465 4.291379025212922
epoch 55 0.007045855053065875 4.291088317947712
epoch 60 0.007275023491386867 4.290593109402643
epoch 65 0.007406621529390978 4.290308714246897
epoch 70 0.00749156451738886 4.290125134824252
epoch 75 0.0076496513019741474 4.28978345556373
epoch 80 0.007739840151480659 4.289588514620772
epoch 85 0.007789981127413803 4.289480132323261
epoch 90 0.007987535594608963 4.289053081532117
epoch 95 0.008077711208152927 4.288858136006283
[32m[I 2022-02-16 19:42:09,604][0m Trial 89 finished with value: 4.288761910441831 and parameters: {'n_layers_mlp': 2, 'mlp_n_units_l0': 20, 'mlp_dropout_l0': 0.12062752680439087, 'mlp_n_units_l1': 79, 'mlp_dropout_l1': 0.05465912879482103, 'lr': 1.0254509891373688e-05, 'weight_decay': 0.0003643242000677101, 'criterion': 'MSELoss', 'batch_size': 256}. Best is trial 73 with value: 4.272035952774967.[0m
Trial Id: 90 | Model params: 2739 | Timestamp: 2022-02-16 19:42:09.604804

[32m[I 2022-02-16 19:42:13,647][0m Trial 90 pruned. [0m
epoch 0 0.006285238059173359 4.29273152066216
Trial Id: 91 | Model params: 3567 | Timestamp: 2022-02-16 19:42:13.647720

epoch 0 -3.3640494521655135 8.995963574049135
epoch 5 -0.01667133424223688 4.342033260409572
epoch 10 -0.0012610812507585223 4.309000300899239
epoch 15 0.003453766285131832 4.298842983697907
epoch 20 0.0050289061444290795 4.29544426696558
epoch 25 0.005973557352986769 4.293404679976034
epoch 30 0.00650190880202739 4.292263499017952
epoch 35 0.006981750516009799 4.291226830784337
epoch 40 0.007214511874080398 4.290723874104884
epoch 45 0.0076175031335083965 4.289852940884357
epoch 50 0.007915332800016439 4.289209166256342
epoch 55 0.008206381031766408 4.288579956695605
epoch 60 0.008327778365754934 4.28831748368931
epoch 65 0.008610431304400978 4.287706297908842
epoch 70 0.00876417488688297 4.287373818676181
epoch 75 0.00904748888456064 4.286761068515278
epoch 80 0.009212207381419368 4.286404775869117
epoch 85 0.009364666700600321 4.2860749739173825
epoch 90 0.00953748611409011 4.285701098059042
epoch 95 0.009608123733125473 4.285548271922287
[32m[I 2022-02-16 19:49:03,323][0m Trial 91 finished with value: 4.285133285786846 and parameters: {'n_layers_mlp': 2, 'mlp_n_units_l0': 38, 'mlp_dropout_l0': 0.11027136580585939, 'mlp_n_units_l1': 73, 'mlp_dropout_l1': 0.0675606879055737, 'lr': 1.5163341191777409e-05, 'weight_decay': 0.0001133639475003642, 'criterion': 'MSELoss', 'batch_size': 256}. Best is trial 73 with value: 4.272035952774967.[0m
Trial Id: 92 | Model params: 3487 | Timestamp: 2022-02-16 19:49:03.323782

epoch 0 -3.2334418146589083 8.860325039122824
epoch 5 -0.010947045992002913 4.329792266648749
epoch 10 0.0020689261828257255 4.301828867938724
epoch 15 0.0062614053733934805 4.292782997560751
epoch 20 0.006956970961682685 4.291280371605507
epoch 25 0.007381509463021518 4.290362985128655
epoch 30 0.007509453569658486 4.290086471868926
epoch 35 0.008049569406816226 4.288918975115824
epoch 40 0.008237095338776146 4.288513550853341
epoch 45 0.008364351253666968 4.288238406350398
epoch 50 0.008630320996315333 4.287663286771888
epoch 55 0.008863544451236494 4.287158912628792
epoch 60 0.009004608534795233 4.28685381555584
epoch 65 0.009184826927566947 4.2864640029297485
epoch 70 0.009323737335728666 4.286163515335513
epoch 75 0.009333693926918074 4.286141976672113
epoch 80 0.009560784185268845 4.2856506927408144
epoch 85 0.009640847119630314 4.285477472264969
epoch 90 0.009754708896294484 4.285231114111355
epoch 95 0.009844996046328491 4.285035753362108
[32m[I 2022-02-16 19:55:53,477][0m Trial 92 finished with value: 4.284903500852058 and parameters: {'n_layers_mlp': 2, 'mlp_n_units_l0': 38, 'mlp_dropout_l0': 0.10605878168804837, 'mlp_n_units_l1': 71, 'mlp_dropout_l1': 0.07179748821524588, 'lr': 1.751120603006869e-05, 'weight_decay': 0.006018244600510978, 'criterion': 'MSELoss', 'batch_size': 256}. Best is trial 73 with value: 4.272035952774967.[0m
Trial Id: 93 | Model params: 3969 | Timestamp: 2022-02-16 19:55:53.478162

[32m[I 2022-02-16 19:55:57,497][0m Trial 93 pruned. [0m
epoch 0 -2.1727298285383463 7.670424551543325
Trial Id: 94 | Model params: 3334 | Timestamp: 2022-02-16 19:55:57.497589

[32m[I 2022-02-16 19:56:01,731][0m Trial 94 pruned. [0m
epoch 0 -3.0661925576146185 8.683540360324427
Trial Id: 95 | Model params: 3450 | Timestamp: 2022-02-16 19:56:01.731337

epoch 0 -3.2452323020562543 8.872654831132673
epoch 5 -0.0008490578280548888 4.30811362320326
epoch 10 0.0042871869417193675 4.297045027012789
epoch 15 0.0062330789757431004 4.292844179753103
epoch 20 0.006880185336526012 4.291446276942422
epoch 25 0.007372088884183281 4.290383344212852
epoch 30 0.007661037908760604 4.289758844186512
epoch 35 0.007820615786507168 4.289413912584819
epoch 40 0.007960232194690997 4.289112105450659
epoch 45 0.008151565632355862 4.288698467729889
epoch 50 0.008380683838400294 4.288203091814456
epoch 55 0.00856988060461572 4.2877939868045285
epoch 60 0.00873157167242622 4.287444327133973
epoch 65 0.008743257366919499 4.287419055516926
epoch 70 0.008928744260656596 4.287017899481922
epoch 75 0.00901260577842744 4.286836518258679
epoch 80 0.009091958137031453 4.286664882675503
epoch 85 0.009161740918863903 4.286513939977315
epoch 90 0.009196069792612338 4.286439683422777
epoch 95 0.00917551634752245 4.286484142595316
