[32m[I 2022-02-27 02:33:41,588][0m Trial 16 finished with value: 1.9614058189527939 and parameters: {'n_layers_mlp': 4, 'mlp_n_units_l0': 49, 'mlp_dropout_l0': 0.20830722653828884, 'mlp_n_units_l1': 10, 'mlp_dropout_l1': 0.23998440607759375, 'mlp_n_units_l2': 60, 'mlp_dropout_l2': 0.2278262069569514, 'mlp_n_units_l3': 32, 'mlp_dropout_l3': 0.19607655892064604, 'lr': 3.377805408234038e-05, 'weight_decay': 0.06953400363413133, 'criterion': 'MSELoss', 'batch_size': 32}. Best is trial 16 with value: 1.9614058189527939.[0m
Trial Id: 17 | Model params: 3169 | Timestamp: 2022-02-27 02:33:41.588913

[32m[I 2022-02-27 02:33:58,823][0m Trial 17 pruned. [0m
epoch 0 -0.0042980880346426 1.9896356234661678
Trial Id: 18 | Model params: 3388 | Timestamp: 2022-02-27 02:33:58.823912

[32m[I 2022-02-27 02:34:16,362][0m Trial 18 pruned. [0m
epoch 0 0.0038615654706940505 1.981536510338316
Trial Id: 19 | Model params: 3645 | Timestamp: 2022-02-27 02:34:16.363049

[32m[I 2022-02-27 02:34:21,659][0m Trial 19 pruned. [0m
epoch 0 -0.002565948299091625 1.9879190941609632
Trial Id: 20 | Model params: 3640 | Timestamp: 2022-02-27 02:34:21.659596

[32m[I 2022-02-27 02:34:24,935][0m Trial 20 pruned. [0m
epoch 0 0.016598690407706895 1.9687661858359702
Trial Id: 21 | Model params: 4088 | Timestamp: 2022-02-27 02:34:24.935255

[32m[I 2022-02-27 02:34:42,219][0m Trial 21 pruned. [0m
epoch 0 0.0130044093377929 1.9724219933937748
Trial Id: 22 | Model params: 3933 | Timestamp: 2022-02-27 02:34:42.219729

[32m[I 2022-02-27 02:34:59,376][0m Trial 22 pruned. [0m
epoch 0 0.02494242640394373 1.9604571766268188
Trial Id: 23 | Model params: 9263 | Timestamp: 2022-02-27 02:34:59.376417

[32m[I 2022-02-27 02:35:16,707][0m Trial 23 pruned. [0m
epoch 0 0.012193076971964256 1.973232514273544
Trial Id: 24 | Model params: 3940 | Timestamp: 2022-02-27 02:35:16.707856

[32m[I 2022-02-27 02:35:34,232][0m Trial 24 pruned. [0m
epoch 0 0.012480240812857035 1.9729456757211983
Study statistics: 
  Number of finished trials:  25
  Number of pruned trials:  15
  Number of complete trials:  10

Best trial:
  Value:  1.9614058189527939
  Params: 
    n_layers_mlp: 4
    mlp_n_units_l0: 49
    mlp_dropout_l0: 0.20830722653828884
    mlp_n_units_l1: 10
    mlp_dropout_l1: 0.23998440607759375
    mlp_n_units_l2: 60
    mlp_dropout_l2: 0.2278262069569514
    mlp_n_units_l3: 32
    mlp_dropout_l3: 0.19607655892064604
    lr: 3.377805408234038e-05
    weight_decay: 0.06953400363413133
    criterion: MSELoss
    batch_size: 32
Target: 67706, NaN: 0, Max: 45.0, Min: 0.0, Mean: 3.39903405901988
Prediction: 67706, NaN: 0, Max: 4.470162391662598, Min: 3.0866003036499023, Mean: 3.3536457029596245

 XXXXXX======== TRIAL des - qso ended

Test Set - R-squared:  0.0232411944553802
Test Set - RMSE:  1.9666208394543916
Test Set - MAE:  1.551879142646518



[32m[I 2022-02-27 02:35:42,690][0m A new study created in memory with name: NeuralNetwork[0m
++++++++ Session Characteristics +++++++

Area: des
Gal Type: glbg
Training Samples: 216656
Validation Samples: 54164
Test Samples: 67706
Number of features: 16
Device: cuda:0
Number of Workers: 8
Number of Trials: 25

+++++++++++++++++++++++++++++++++++++++
Trial Id: 0 | Model params: 2167 | Timestamp: 2022-02-27 02:35:42.690699

epoch 0 -9.609696254252556 31.06145222660002
epoch 5 -7.566736229553753 27.911165945414613
epoch 10 -7.550340262486879 27.884443415319534
epoch 15 -7.533311784552421 27.856662867239777
epoch 20 -7.539795374500635 27.867243570837463
epoch 25 -7.553373214368099 27.88938852124795
epoch 30 -7.548542539549519 27.881511886446933
epoch 35 -7.546530056518904 27.878229784728354
epoch 40 -7.535097910401307 27.859578083719118
epoch 45 -7.542643081865117 27.87188953345396
epoch 50 -7.533008435359367 27.8561677270459
epoch 55 -7.534717292103307 27.858956885021364
epoch 60 -7.552108078021686 27.88732587397264
epoch 65 -7.532058778422337 27.854617597382514
epoch 70 -7.541397330756112 27.86985721729081
epoch 75 -7.518614732207336 27.832663552656303
epoch 80 -7.53414703929394 27.85802616211256
epoch 85 -7.532718558652501 27.855694569026248
epoch 90 -7.524787394443113 27.84274562149404
epoch 95 -7.541762404151772 27.870452812736147
[32m[I 2022-02-27 02:40:17,612][0m Trial 0 finished with value: 27.856846691910192 and parameters: {'n_layers_mlp': 2, 'mlp_n_units_l0': 38, 'mlp_dropout_l0': 0.17268175819022108, 'mlp_n_units_l1': 38, 'mlp_dropout_l1': 0.21744878577840093, 'lr': 0.0007426957288723439, 'weight_decay': 0.09465120037834249, 'criterion': 'PoissonNLLLoss', 'batch_size': 256}. Best is trial 0 with value: 27.856846691910192.[0m
Trial Id: 1 | Model params: 3033 | Timestamp: 2022-02-27 02:40:17.612974

epoch 0 -9.605213203305738 31.05691769195428
epoch 5 -7.5338935355076 27.859432106901007
epoch 10 -7.540294437670472 27.869878222292122
epoch 15 -7.548414036415574 27.88312357754194
epoch 20 -7.52673817097434 27.847750088904295
epoch 25 -7.54925791079625 27.884499813699268
epoch 30 -7.528141287864747 27.850041237079477
epoch 35 -7.528569900642262 27.850741080875828
epoch 40 -7.525133239107435 27.845129166111587
epoch 45 -7.530059588035828 27.853173322553634
epoch 50 -7.517453649814039 27.832584650440396
epoch 55 -7.53285529472347 27.857737354188004
epoch 60 -7.520286744211701 27.837213133727026
epoch 65 -7.532283957353913 27.856804698455136
epoch 70 -7.534140535125319 27.85983527687615
epoch 75 -7.527024151411462 27.848217081370162
epoch 80 -7.537241748911805 27.864896797551744
epoch 85 -7.533452849168322 27.858712773480644
epoch 90 -7.52832131849039 27.850335195265572
epoch 95 -7.534543150266154 27.86049244083818
[32m[I 2022-02-27 03:04:36,252][0m Trial 1 finished with value: 27.8496158189809 and parameters: {'n_layers_mlp': 2, 'mlp_n_units_l0': 71, 'mlp_dropout_l0': 0.06960520447711227, 'mlp_n_units_l1': 25, 'mlp_dropout_l1': 0.08730219752849988, 'lr': 7.429978524250534e-05, 'weight_decay': 0.04342698775533758, 'criterion': 'PoissonNLLLoss', 'batch_size': 32}. Best is trial 1 with value: 27.8496158189809.[0m
Trial Id: 2 | Model params: 1563 | Timestamp: 2022-02-27 03:04:36.252291

epoch 0 -0.017825217126807846 9.620704700248933
epoch 5 0.06763416491323893 9.207960696209392
epoch 10 0.07175936901470115 9.187568043263907
epoch 15 0.07328603382809151 9.180009599707871
epoch 20 0.07268925877962762 9.182964944710513
epoch 25 0.07443604160762862 9.174311854727248
epoch 30 0.07440790644088247 9.174451293406728
epoch 35 0.07491486385811463 9.171938473127538
epoch 40 0.07500200030233217 9.171506497250524
epoch 45 0.0754415626112469 9.169327072199364
epoch 50 0.0757422128745614 9.167836098434897
epoch 55 0.07558877575348422 9.168597048475284
epoch 60 0.07559882270014273 9.168547223974372
epoch 65 0.07401236675991019 9.176411374936881
epoch 70 0.07514242270732807 9.170810315268602
epoch 75 0.07607578265058479 9.16618158762153
epoch 80 0.07667715096361138 9.163198037506167
epoch 85 0.07665105771747283 9.163327513286413
epoch 90 0.07602224971712668 9.16644713184702
epoch 95 0.07539137430979381 9.16957594057131
[32m[I 2022-02-27 03:09:15,572][0m Trial 2 finished with value: 9.163239189962354 and parameters: {'n_layers_mlp': 2, 'mlp_n_units_l0': 36, 'mlp_dropout_l0': 0.001328018064099723, 'mlp_n_units_l1': 25, 'mlp_dropout_l1': 0.040970648388509334, 'lr': 0.000260478298643815, 'weight_decay': 0.1676933671648693, 'criterion': 'MSELoss', 'batch_size': 256}. Best is trial 2 with value: 9.163239189962354.[0m
Trial Id: 3 | Model params: 7162 | Timestamp: 2022-02-27 03:09:15.572208

epoch 0 -7.544509064191329 27.87493341653606
epoch 5 -7.533901705599904 27.857625737702566
epoch 10 -7.544622207741682 27.875117971228924
epoch 15 -7.525227035899498 27.84346356710671
epoch 20 -7.54601277085561 27.877386095727807
epoch 25 -7.539385945609432 27.866575534257304
epoch 30 -7.558785595827551 27.89821101349717
epoch 35 -7.563042166487142 27.905147508407598
epoch 40 -7.550373739470398 27.884498002979807
epoch 45 -7.540241480781869 27.867971433128222
epoch 50 -7.523690534318693 27.84095434046629
epoch 55 -7.556928276250792 27.895183790516494
epoch 60 -7.545908927460417 27.87721672485902
epoch 65 -7.525749388894734 27.844316558689975
epoch 70 -7.549131839658118 27.88247288621694
epoch 75 -7.5476608996500545 27.880074092399152
epoch 80 -7.5734924652937625 27.922169975786762
epoch 85 -7.519882464449882 27.83473449103314
epoch 90 -7.52507806985389 27.843220303861916
epoch 95 -7.549391917090679 27.882896996345746
[32m[I 2022-02-27 03:14:49,767][0m Trial 3 finished with value: 27.91732311160172 and parameters: {'n_layers_mlp': 4, 'mlp_n_units_l0': 80, 'mlp_dropout_l0': 0.03161914145999895, 'mlp_n_units_l1': 14, 'mlp_dropout_l1': 0.1486670724222757, 'mlp_n_units_l2': 75, 'mlp_dropout_l2': 0.008752278373638355, 'mlp_n_units_l3': 46, 'mlp_dropout_l3': 0.16356242313308322, 'lr': 0.008556372005821739, 'weight_decay': 0.14053801413004932, 'criterion': 'PoissonNLLLoss', 'batch_size': 256}. Best is trial 2 with value: 9.163239189962354.[0m
Trial Id: 4 | Model params: 999 | Timestamp: 2022-02-27 03:14:49.767665

epoch 0 -0.6247784267771359 12.156140785074276
epoch 5 0.04394308300768501 9.324821414634958
epoch 10 0.05950833418140811 9.248602729023235
epoch 15 0.06342378359153611 9.22933078546021
epoch 20 0.0657381666828214 9.21792038504355
epoch 25 0.06730529050918366 9.210186104898309
epoch 30 0.06749871985192057 9.209231016055991
epoch 35 0.06915713440647542 9.201038255574929
epoch 40 0.06720853505728974 9.210663813520263
epoch 45 0.06964262278357147 9.198638505898215
epoch 50 0.06917815559084728 9.200934361662902
epoch 55 0.07120867315162971 9.190893310982966
epoch 60 0.07079247001711886 9.192952358075402
epoch 65 0.07278298467379118 9.183100674768566
epoch 70 0.07396633632833727 9.17723888266075
epoch 75 0.07625061180270465 9.165913006387159
epoch 80 0.07577791779519505 9.16825786207967
epoch 85 0.07851781400316149 9.154657927352103
epoch 90 0.07887778821995783 9.152869633031885
epoch 95 0.07947469643251204 9.149903518234566
[32m[I 2022-02-27 03:38:12,488][0m Trial 4 finished with value: 9.146762363597983 and parameters: {'n_layers_mlp': 2, 'mlp_n_units_l0': 22, 'mlp_dropout_l0': 0.20295792024061568, 'mlp_n_units_l1': 26, 'mlp_dropout_l1': 0.2593410720051137, 'lr': 2.4783331974364187e-05, 'weight_decay': 0.007203833306232709, 'criterion': 'MSELoss', 'batch_size': 32}. Best is trial 4 with value: 9.146762363597983.[0m
Trial Id: 5 | Model params: 5081 | Timestamp: 2022-02-27 03:38:12.488921

[32m[I 2022-02-27 03:38:30,185][0m Trial 5 pruned. [0m
epoch 0 0.06789224549651085 9.20728761336117
Trial Id: 6 | Model params: 1687 | Timestamp: 2022-02-27 03:38:30.185623

epoch 0 -7.567337385901624 27.913968504252516
epoch 5 -7.54272455937223 27.873843096054227
epoch 10 -7.526237872894569 27.846933107076882
epoch 15 -7.533762104732814 27.859217574060292
epoch 20 -7.495753956232598 27.797107866739374
epoch 25 -7.5703496762625875 27.918875372318308
epoch 30 -7.553141770134669 27.89083294688028
epoch 35 -7.559174877819666 27.90066785554966
epoch 40 -7.592095080324846 27.95427198015211
epoch 45 -7.5464093980685885 27.87985403211285
epoch 50 -7.548381912086494 27.88307118609978
epoch 55 -7.5523069670480485 27.889471814198806
epoch 60 -7.535459125015743 27.861987472408725
epoch 65 -7.576724365131957 27.9292565742813
epoch 70 -7.525175319007317 27.845197887547883
epoch 75 -7.554955453962515 27.893789899581044
epoch 80 -7.529857941315765 27.85284410244801
epoch 85 -7.517967624456578 27.83342439830011
epoch 90 -7.562557983194136 27.90618132941312
epoch 95 -7.541075215835235 27.871152165199323
[32m[I 2022-02-27 04:02:26,038][0m Trial 6 finished with value: 27.871087966300525 and parameters: {'n_layers_mlp': 2, 'mlp_n_units_l0': 38, 'mlp_dropout_l0': 0.23432957437554958, 'mlp_n_units_l1': 26, 'mlp_dropout_l1': 0.2815016383189319, 'lr': 0.0037467010483044788, 'weight_decay': 0.1567369130026654, 'criterion': 'PoissonNLLLoss', 'batch_size': 32}. Best is trial 4 with value: 9.146762363597983.[0m
Trial Id: 7 | Model params: 7578 | Timestamp: 2022-02-27 04:02:26.038314

epoch 0 -9.609696254252556 31.06145222660002
epoch 5 -9.609696254252556 31.06145222660002
epoch 10 -9.609696254252556 31.06145222660002
epoch 15 -9.609696254252556 31.06145222660002
epoch 20 -9.609696254252556 31.06145222660002
epoch 25 -7.855497708455987 28.377672268819154
epoch 30 -7.6622016023784525 28.066252294110804
epoch 35 -7.624463235558629 28.00504783872503
epoch 40 -7.610561581017725 27.982468258995112
epoch 45 -7.596790136172903 27.960082191573584
epoch 50 -7.5969726919868705 27.960379061008847
epoch 55 -7.592123537055933 27.952492369993095
epoch 60 -7.587215746320165 27.94450804702596
epoch 65 -7.577054836883681 27.92797034331458
epoch 70 -7.578260932179639 27.929933873351217
epoch 75 -7.569984594732251 27.916457170918548
epoch 80 -7.573162803629344 27.921633149192928
epoch 85 -7.574851100610646 27.92438229145632
epoch 90 -7.570700265579054 27.91762278430054
epoch 95 -7.572280388774354 27.92019615922448
[32m[I 2022-02-27 04:07:51,825][0m Trial 7 finished with value: 27.916916021551696 and parameters: {'n_layers_mlp': 4, 'mlp_n_units_l0': 51, 'mlp_dropout_l0': 0.2897577703154957, 'mlp_n_units_l1': 59, 'mlp_dropout_l1': 0.1686849915646496, 'mlp_n_units_l2': 31, 'mlp_dropout_l2': 0.17548575442284556, 'mlp_n_units_l3': 54, 'mlp_dropout_l3': 0.28831102905875433, 'lr': 1.0976161912700686e-05, 'weight_decay': 0.24645195995927127, 'criterion': 'PoissonNLLLoss', 'batch_size': 256}. Best is trial 4 with value: 9.146762363597983.[0m
Trial Id: 8 | Model params: 5217 | Timestamp: 2022-02-27 04:07:51.825494

epoch 0 -7.620940644476049 27.99932803887337
epoch 5 -7.555881823334488 27.893478044715863
epoch 10 -7.53316507728951 27.85642340614708
epoch 15 -7.553165815344208 27.8890503934196
epoch 20 -7.542242395119331 27.871235869970203
epoch 25 -7.550429966623559 27.884589686888035
epoch 30 -7.563521127521774 27.905927913967506
epoch 35 -7.542715603933475 27.87200784126389
epoch 40 -7.5428024951317845 27.872149589281417
epoch 45 -7.540437734949046 27.8682916333308
epoch 50 -7.551568534407348 27.886446168888092
epoch 55 -7.547863756902306 27.880404922186035
epoch 60 -7.544489334015106 27.874901233430986
epoch 65 -7.553590566228095 27.88974287103536
epoch 70 -7.552527337364307 27.88800944102491
epoch 75 -7.545321709920936 27.8762589407327
epoch 80 -7.540671583104514 27.868673165530126
epoch 85 -7.538937678602821 27.865844109865805
epoch 90 -7.552888474294022 27.88859823094585
epoch 95 -7.539342058202761 27.866503925284942
[32m[I 2022-02-27 04:12:38,194][0m Trial 8 finished with value: 27.897155802075655 and parameters: {'n_layers_mlp': 2, 'mlp_n_units_l0': 68, 'mlp_dropout_l0': 0.2555602141398497, 'mlp_n_units_l1': 58, 'mlp_dropout_l1': 0.2983412505713845, 'lr': 0.0003756188102920157, 'weight_decay': 0.2768717454185328, 'criterion': 'PoissonNLLLoss', 'batch_size': 256}. Best is trial 4 with value: 9.146762363597983.[0m
Trial Id: 9 | Model params: 14694 | Timestamp: 2022-02-27 04:12:38.194305

[32m[I 2022-02-27 04:12:41,272][0m Trial 9 pruned. [0m
epoch 0 0.0657587247500131 9.21721688262788
Trial Id: 10 | Model params: 786 | Timestamp: 2022-02-27 04:12:41.272276

epoch 0 -9.410627882505938 30.770681205560784
epoch 5 -5.577129095520157 24.457768631144177
epoch 10 -0.0959155036960424 9.983600280759324
epoch 15 0.0015109229639801436 9.529504254721092
epoch 20 0.02310364154391742 9.425901443748506
epoch 25 0.037435609254677815 9.356502647180324
epoch 30 0.04674144501229638 9.311164618781788
epoch 35 0.05174390255755501 9.286701174621909
epoch 40 0.05640218421749554 9.263862761428527
epoch 45 0.058554978758204146 9.253289092852805
epoch 50 0.06126673747378353 9.239952794805651
epoch 55 0.061881823294122174 9.236925153486334
epoch 60 0.06362917444006877 9.228318735406617
epoch 65 0.06481324145547362 9.222482156528244
epoch 70 0.06564378847440622 9.218385965895964
epoch 75 0.0657123834485962 9.218047579665095
epoch 80 0.0660712300335412 9.21627714916693
epoch 85 0.06723844591255312 9.210516137940495
epoch 90 0.06739862131776375 9.209725281215782
epoch 95 0.06796157993913232 9.206945166887825
[32m[I 2022-02-27 04:20:02,365][0m Trial 10 finished with value: 9.210751472871122 and parameters: {'n_layers_mlp': 2, 'mlp_n_units_l0': 11, 'mlp_dropout_l0': 0.11104312034130696, 'mlp_n_units_l1': 46, 'mlp_dropout_l1': 0.26435828583335236, 'lr': 1.1751997531321168e-05, 'weight_decay': 0.022776687566924123, 'criterion': 'MSELoss', 'batch_size': 128}. Best is trial 4 with value: 9.146762363597983.[0m
Trial Id: 11 | Model params: 898 | Timestamp: 2022-02-27 04:20:02.365920

epoch 0 -9.529883888491927 30.94642177392584
epoch 5 0.06459455852173523 9.223560380502342
epoch 10 0.07028989665043539 9.19543808291199
epoch 15 0.0708223599747223 9.19280450134959
epoch 20 0.07092393181891787 9.19230203788885
epoch 25 0.07517307176817545 9.171257399457406
epoch 30 0.07667683425192517 9.163798164044914
epoch 35 0.07759580356486129 9.159236735260563
epoch 40 0.0781234334237445 9.156616746054139
epoch 45 0.07843685784139298 9.155060056499202
epoch 50 0.07877524744685993 9.153379074774623
epoch 55 0.07842294418288198 9.155129167281011
epoch 60 0.07906131474582057 9.15195776812199
epoch 65 0.07913720486297338 9.151580675994468
epoch 70 0.07928697738193691 9.150836422325943
epoch 75 0.07914726242790915 9.15153069956545
epoch 80 0.07946490682162755 9.149952171843857
epoch 85 0.0793975526426356 9.150286909893564
epoch 90 0.07924714195379212 9.15103437952596
epoch 95 0.07960897212947193 9.14923615228905
[32m[I 2022-02-27 04:43:44,166][0m Trial 11 finished with value: 9.148942671550978 and parameters: {'n_layers_mlp': 2, 'mlp_n_units_l0': 17, 'mlp_dropout_l0': 0.20782765991877583, 'mlp_n_units_l1': 32, 'mlp_dropout_l1': 0.024957907188884937, 'lr': 5.56586109983058e-05, 'weight_decay': 0.0840476028105309, 'criterion': 'MSELoss', 'batch_size': 32}. Best is trial 4 with value: 9.146762363597983.[0m
Trial Id: 12 | Model params: 669 | Timestamp: 2022-02-27 04:43:44.166778

[32m[I 2022-02-27 04:43:58,492][0m Trial 12 pruned. [0m
epoch 0 -0.015730415342905424 9.611427133565583
Trial Id: 13 | Model params: 1239 | Timestamp: 2022-02-27 04:43:58.492688

[32m[I 2022-02-27 04:44:12,956][0m Trial 13 pruned. [0m
epoch 0 0.005322633330274051 9.511297524392072
Trial Id: 14 | Model params: 1617 | Timestamp: 2022-02-27 04:44:12.956545

[32m[I 2022-02-27 04:44:17,392][0m Trial 14 pruned. [0m
epoch 0 -8.122221168671658 28.8037443679115
Trial Id: 15 | Model params: 667 | Timestamp: 2022-02-27 04:44:17.392945

[32m[I 2022-02-27 04:44:31,790][0m Trial 15 pruned. [0m
epoch 0 0.022313495878875433 9.42971266164083
Trial Id: 16 | Model params: 813 | Timestamp: 2022-02-27 04:44:31.790789

[32m[I 2022-02-27 04:44:45,814][0m Trial 16 pruned. [0m
epoch 0 -3.7100721781452703 20.69723974711301
Trial Id: 17 | Model params: 1017 | Timestamp: 2022-02-27 04:44:45.814899

[32m[I 2022-02-27 04:45:00,172][0m Trial 17 pruned. [0m
epoch 0 0.05504301573378145 9.27053224457463
Trial Id: 18 | Model params: 2207 | Timestamp: 2022-02-27 04:45:00.172794

[32m[I 2022-02-27 04:45:04,628][0m Trial 18 pruned. [0m
epoch 0 -0.021375321042829354 9.638097806498626
Trial Id: 19 | Model params: 2134 | Timestamp: 2022-02-27 04:45:04.628924

[32m[I 2022-02-27 04:45:22,725][0m Trial 19 pruned. [0m
epoch 0 -0.11507038117932944 10.070471140476998
Trial Id: 20 | Model params: 898 | Timestamp: 2022-02-27 04:45:22.725968

[32m[I 2022-02-27 04:45:36,553][0m Trial 20 pruned. [0m
epoch 0 -0.02310912580969604 9.646274768460701
Trial Id: 21 | Model params: 1410 | Timestamp: 2022-02-27 04:45:36.553194

[32m[I 2022-02-27 04:45:39,616][0m Trial 21 pruned. [0m
epoch 0 -0.41706160239122414 11.351797789759047
Trial Id: 22 | Model params: 1753 | Timestamp: 2022-02-27 04:45:39.617082

epoch 0 -8.913177742458087 30.02456526421816
epoch 5 -0.03197963225609324 9.687369033924401
epoch 10 0.019826778476945583 9.441080440297902
epoch 15 0.052174156800930294 9.283987653245172
epoch 20 0.062356686199607214 9.233983874695685
epoch 25 0.06591908715995776 9.216425781557097
epoch 30 0.0678507678246767 9.206891058696856
epoch 35 0.06932375707834293 9.199613783281018
epoch 40 0.06911180868323641 9.200661264825808
epoch 45 0.07045253166074306 9.194033195588023
epoch 50 0.0706319838336863 9.193145683692142
epoch 55 0.07015990615108059 9.19548024215457
epoch 60 0.07119170295043409 9.190376945007696
epoch 65 0.0709458261767999 9.191593315872447
epoch 70 0.07130747762863487 9.189804143227319
epoch 75 0.07163483880632071 9.188184312016855
epoch 80 0.0714705347856075 9.188997348146936
epoch 85 0.07122195532382303 9.1902272731218
epoch 90 0.07177793110203712 9.187476180611423
epoch 95 0.0718841286249079 9.186950597804731
[32m[I 2022-02-27 04:50:22,067][0m Trial 22 finished with value: 9.188820841982936 and parameters: {'n_layers_mlp': 2, 'mlp_n_units_l0': 45, 'mlp_dropout_l0': 0.08121797870667524, 'mlp_n_units_l1': 21, 'mlp_dropout_l1': 0.05546132014670037, 'lr': 4.3682320594852856e-05, 'weight_decay': 0.18207169236637008, 'criterion': 'MSELoss', 'batch_size': 256}. Best is trial 4 with value: 9.146762363597983.[0m
Trial Id: 23 | Model params: 1127 | Timestamp: 2022-02-27 04:50:22.068081

[32m[I 2022-02-27 04:50:36,040][0m Trial 23 pruned. [0m
epoch 0 0.053977029228157614 9.275759718953841
Trial Id: 24 | Model params: 1471 | Timestamp: 2022-02-27 04:50:36.040738

