[32m[I 2022-02-17 14:05:59,285][0m Trial 88 pruned. [0m
epoch 0 -1.4247626239574829 3.091458102288239
Trial Id: 89 | Model params: 1017 | Timestamp: 2022-02-17 14:05:59.285504

epoch 0 -2.91622743706747 3.9288251691460694
epoch 5 -2.91622743706747 3.9288251691460694
epoch 10 0.016899620342182398 1.968464932418329
epoch 15 0.02707370725099778 1.958252639145483
epoch 20 0.029385216488688748 1.9559250163546265
epoch 25 0.0303829744396511 1.9549194467114188
epoch 30 0.031249625771555545 1.9540455902058658
epoch 35 0.031885578821013505 1.9534041012852728
epoch 40 0.03256612619065269 1.9527173964379154
epoch 45 0.03302739347742123 1.9522518183397923
epoch 50 0.03329778084765733 1.9519788524163069
epoch 55 0.03362632964542289 1.951647119028066
epoch 60 0.03367262630388268 1.9516003690880213
epoch 65 0.03386889509895097 1.9514021662248773
epoch 70 0.033950459678244393 1.9513197919718412
epoch 75 0.03401938838260088 1.9512501763161565
epoch 80 0.034015274616364444 1.9512543311503485
epoch 85 0.0340805106423121 1.9511884428272648
epoch 90 0.03413015064143132 1.9511383049855051
epoch 95 0.03416028808118121 1.9511078646669417
[32m[I 2022-02-17 14:12:55,906][0m Trial 89 finished with value: 1.9511926320799853 and parameters: {'n_layers_mlp': 2, 'mlp_n_units_l0': 12, 'mlp_dropout_l0': 0.16269994227241932, 'mlp_n_units_l1': 58, 'mlp_dropout_l1': 0.011644837547720412, 'lr': 7.274339370730868e-05, 'weight_decay': 0.008569901646051892, 'criterion': 'MSELoss', 'batch_size': 256}. Best is trial 89 with value: 1.9511926320799853.[0m
Trial Id: 90 | Model params: 955 | Timestamp: 2022-02-17 14:12:55.906523

[32m[I 2022-02-17 14:12:59,996][0m Trial 90 pruned. [0m
epoch 0 -0.6230769948890176 2.5292881631723296
Trial Id: 91 | Model params: 975 | Timestamp: 2022-02-17 14:12:59.996586

[32m[I 2022-02-17 14:13:04,241][0m Trial 91 pruned. [0m
epoch 0 -1.4907165648179457 3.1332201077936386
Trial Id: 92 | Model params: 1667 | Timestamp: 2022-02-17 14:13:04.242150

[32m[I 2022-02-17 14:13:08,306][0m Trial 92 pruned. [0m
epoch 0 -1.9492967135349417 3.4094787178948716
Trial Id: 93 | Model params: 905 | Timestamp: 2022-02-17 14:13:08.307038

[32m[I 2022-02-17 14:13:12,518][0m Trial 93 pruned. [0m
epoch 0 -1.5827856552893351 3.190604205571089
Trial Id: 94 | Model params: 1242 | Timestamp: 2022-02-17 14:13:12.518442

[32m[I 2022-02-17 14:13:16,565][0m Trial 94 pruned. [0m
epoch 0 0.015721684471812547 1.9696438716964844
Trial Id: 95 | Model params: 795 | Timestamp: 2022-02-17 14:13:16.565527

epoch 0 -2.91622743706747 3.9288251691460694
epoch 5 -2.91622743706747 3.9288251691460694
epoch 10 -2.91622743706747 3.9288251691460694
epoch 15 0.02108537601457794 1.964269886565809
epoch 20 0.02710608782064361 1.9582200519577182
epoch 25 0.028478115888290523 1.956838770425836
epoch 30 0.029377705244136187 1.9559325844459803
epoch 35 0.03022950320395068 1.9550741531698694
epoch 40 0.030987342889105984 1.9543100948906083
epoch 45 0.03153622764846409 1.9537565195764373
epoch 50 0.03197430060336304 1.9533145904482294
epoch 55 0.03230392873530674 1.9529819948048202
epoch 60 0.03269517077958517 1.9525871570364575
epoch 65 0.03294336481427096 1.9523366405703546
epoch 70 0.03316524413815958 1.9521126578334365
epoch 75 0.03333234997188117 1.951943950870951
epoch 80 0.03341338781499614 1.9518621313112683
epoch 85 0.03322575571468822 1.9520515681476778
epoch 90 0.033531020562947544 1.9517433577377068
epoch 95 0.033583322199990384 1.9516905465477237
[32m[I 2022-02-17 14:20:12,185][0m Trial 95 finished with value: 1.9517077426696638 and parameters: {'n_layers_mlp': 2, 'mlp_n_units_l0': 10, 'mlp_dropout_l0': 0.20495449486094247, 'mlp_n_units_l1': 52, 'mlp_dropout_l1': 0.022349586448501935, 'lr': 5.6620783713518686e-05, 'weight_decay': 0.010823534410964557, 'criterion': 'MSELoss', 'batch_size': 256}. Best is trial 89 with value: 1.9511926320799853.[0m
Trial Id: 96 | Model params: 933 | Timestamp: 2022-02-17 14:20:12.185945

[32m[I 2022-02-17 14:20:16,359][0m Trial 96 pruned. [0m
epoch 0 -1.4721082611614094 3.121493920482117
Trial Id: 97 | Model params: 819 | Timestamp: 2022-02-17 14:20:16.359877

[32m[I 2022-02-17 14:20:23,467][0m Trial 97 pruned. [0m
epoch 0 0.012029543917504992 1.973395843451741
Trial Id: 98 | Model params: 1373 | Timestamp: 2022-02-17 14:20:23.468080

[32m[I 2022-02-17 14:20:27,761][0m Trial 98 pruned. [0m
epoch 0 0.01829810810057164 1.9670643359610256
Trial Id: 99 | Model params: 1309 | Timestamp: 2022-02-17 14:20:27.761286

epoch 0 -2.91622743706747 3.9288251691460694
epoch 5 -2.91622743706747 3.9288251691460694
epoch 10 -2.91622743706747 3.9288251691460694
epoch 15 0.02158462359208857 1.963768932741873
epoch 20 0.02700198195691239 1.9583248201826942
epoch 25 0.028820737049769396 1.9564936863340185
epoch 30 0.02952861046198274 1.9557805315271573
epoch 35 0.029605461440562864 1.9557030915196076
epoch 40 0.03081464687830726 1.9544842342678688
epoch 45 0.031306681920323154 1.9539880459919439
epoch 50 0.03041737207151607 1.954884770548524
epoch 55 0.031837021054363035 1.9534530891678479
epoch 60 0.03234937589607145 1.9529361340581164
epoch 65 0.032536453277907995 1.9527473428612279
epoch 70 0.03288829079457789 1.95239223271039
epoch 75 0.0329548246710617 1.9523250727036043
epoch 80 0.033216715581008915 1.9520606947695218
epoch 85 0.03335440806864454 1.9519216803345532
epoch 90 0.03327107211529379 1.9520058175559414
epoch 95 0.03341965391515889 1.9518558046234753
[32m[I 2022-02-17 14:27:24,757][0m Trial 99 finished with value: 1.951905746162593 and parameters: {'n_layers_mlp': 2, 'mlp_n_units_l0': 20, 'mlp_dropout_l0': 0.20499692969489228, 'mlp_n_units_l1': 44, 'mlp_dropout_l1': 0.05740362831748356, 'lr': 5.004860707747174e-05, 'weight_decay': 0.01251542156245597, 'criterion': 'MSELoss', 'batch_size': 256}. Best is trial 89 with value: 1.9511926320799853.[0m
Study statistics: 
  Number of finished trials:  100
  Number of pruned trials:  61
  Number of complete trials:  39

Best trial:
  Value:  1.9511926320799853
  Params: 
    n_layers_mlp: 2
    mlp_n_units_l0: 12
    mlp_dropout_l0: 0.16269994227241932
    mlp_n_units_l1: 58
    mlp_dropout_l1: 0.011644837547720412
    lr: 7.274339370730868e-05
    weight_decay: 0.008569901646051892
    criterion: MSELoss
    batch_size: 256
Target: 67706, NaN: 0, Max: 45.0, Min: 0.0, Mean: 3.39903405901988
Prediction: 67706, NaN: 0, Max: 5.394487380981445, Min: 3.0206499099731445, Mean: 3.410136184914089

 XXXXXX======== TRIAL des - qso ended

Test Set - R-squared:  0.03383985885377583
Test Set - RMSE:  1.955921982378471
Test Set - MAE:  1.5463690626263122



[32m[I 2022-02-17 14:27:35,052][0m A new study created in memory with name: NeuralNetwork[0m
++++++++ Session Characteristics +++++++

Area: des
Gal Type: glbg
Training Samples: 216656
Validation Samples: 54164
Test Samples: 67706
Number of features: 16
Device: cuda:0
Number of Workers: 8
Number of Trials: 100

+++++++++++++++++++++++++++++++++++++++
Trial Id: 0 | Model params: 11400 | Timestamp: 2022-02-17 14:27:35.053221

epoch 0 -9.605213203305738 31.05691769195428
epoch 5 -7.538369100552655 27.866736531102205
epoch 10 -7.531253111502336 27.855121858367667
epoch 15 -7.544777501006445 27.877192140911603
epoch 20 -7.521062382969781 27.838480176181065
epoch 25 -7.538743567944117 27.867347600359285
epoch 30 -7.530680883861988 27.854187661612784
epoch 35 -7.536830614378006 27.864225833813045
epoch 40 -7.543347211977389 27.874858896379948
epoch 45 -7.540155504779708 27.869651528790943
epoch 50 -7.532171406216937 27.856620965389247
epoch 55 -7.519191092760371 27.835423237185424
epoch 60 -7.5228640191548575 27.841423011249628
epoch 65 -7.539883558850564 27.8692077957341
epoch 70 -7.5340284843885446 27.8596523805843
epoch 75 -7.525656420007271 27.84598357013227
epoch 80 -7.5319579580344005 27.856272520543186
epoch 85 -7.531267996631636 27.855146158837027
epoch 90 -7.532905565238151 27.85781941468731
epoch 95 -7.525746122390105 27.84613005999682
[32m[I 2022-02-17 15:24:15,421][0m Trial 0 finished with value: 27.861485240749268 and parameters: {'n_layers_mlp': 4, 'mlp_n_units_l0': 36, 'mlp_dropout_l0': 0.04510046593891221, 'mlp_n_units_l1': 50, 'mlp_dropout_l1': 0.2793280753979773, 'mlp_n_units_l2': 67, 'mlp_dropout_l2': 0.19194111719068263, 'mlp_n_units_l3': 80, 'mlp_dropout_l3': 0.07184599821778498, 'lr': 3.4489126244098964e-05, 'weight_decay': 0.08547333195492601, 'criterion': 'PoissonNLLLoss', 'batch_size': 32}. Best is trial 0 with value: 27.861485240749268.[0m
Trial Id: 1 | Model params: 587 | Timestamp: 2022-02-17 15:24:15.421541

epoch 0 -7.653466714089971 28.05209784330908
epoch 5 -7.581166102958965 27.934662941375915
epoch 10 -7.536808394510283 27.862369555992217
epoch 15 -7.535552369188936 27.8603197777032
epoch 20 -7.534890787761222 27.859240045161574
epoch 25 -7.536290371105956 27.861524182766775
epoch 30 -7.5316712576599105 27.853985020562632
epoch 35 -7.535512570959577 27.86025482627176
epoch 40 -7.533102510420822 27.856321281533035
epoch 45 -7.528062631909423 27.84809372239652
epoch 50 -7.524407351316642 27.842124986542032
epoch 55 -7.529246879859038 27.850027215646207
epoch 60 -7.532699603470627 27.855663628708317
epoch 65 -7.528261227840119 27.84841797458205
epoch 70 -7.533018554866748 27.856184244702806
epoch 75 -7.528148619929723 27.848234117496528
epoch 80 -7.5369152915712085 27.862544000348617
epoch 85 -7.547415857974562 27.87967446090276
epoch 90 -7.541308519578012 27.869712325232104
epoch 95 -7.52987108711887 27.85104628986041
[32m[I 2022-02-17 15:31:25,072][0m Trial 1 finished with value: 27.844276941741462 and parameters: {'n_layers_mlp': 2, 'mlp_n_units_l0': 18, 'mlp_dropout_l0': 0.044983287358358104, 'mlp_n_units_l1': 14, 'mlp_dropout_l1': 0.18121240489419088, 'lr': 0.0005834401393627569, 'weight_decay': 0.03467803559282059, 'criterion': 'PoissonNLLLoss', 'batch_size': 256}. Best is trial 1 with value: 27.844276941741462.[0m
Trial Id: 2 | Model params: 4451 | Timestamp: 2022-02-17 15:31:25.072607

epoch 0 0.05549499726239038 9.268314889411156
epoch 5 0.0696923757183584 9.198392543759539
epoch 10 0.06794893281131498 9.207007632669718
epoch 15 0.07051992779070038 9.19430043368386
epoch 20 0.07034029858277124 9.195188825574679
epoch 25 0.07015925404458212 9.19608413042164
epoch 30 0.0680212869461948 9.206650260619801
epoch 35 0.07206978521761642 9.186631737812561
epoch 40 0.07236178942691163 9.185186183952766
epoch 45 0.07212623371339233 9.186352309779423
epoch 50 0.07200246128704602 9.186964989672308
epoch 55 0.07066517826457297 9.193582005869818
epoch 60 0.07257499471841289 9.184130576921657
epoch 65 0.06985672196603498 9.19758002323941
epoch 70 0.06894813077877848 9.202071159468163
epoch 75 0.0692497465679568 9.200580525667753
epoch 80 0.0725339006649568 9.184334048345244
epoch 85 0.07015018508036641 9.196128976141143
epoch 90 0.07249703776743222 9.18451656596021
epoch 95 0.07249355020909753 9.184533833563922
[32m[I 2022-02-17 16:14:35,906][0m Trial 2 finished with value: 9.186053286907798 and parameters: {'n_layers_mlp': 2, 'mlp_n_units_l0': 74, 'mlp_dropout_l0': 0.18075761490631595, 'mlp_n_units_l1': 42, 'mlp_dropout_l1': 0.19437459600386425, 'lr': 0.00011550190045390632, 'weight_decay': 0.1747682625625074, 'criterion': 'MSELoss', 'batch_size': 32}. Best is trial 2 with value: 9.186053286907798.[0m
Trial Id: 3 | Model params: 5364 | Timestamp: 2022-02-17 16:14:35.907008

epoch 0 0.0730413486225171 9.181821175248793
epoch 5 0.07112175948790045 9.191323329815342
epoch 10 0.08178930033140441 9.138392844934891
epoch 15 0.07545182182700527 9.169875150991755
epoch 20 0.08269299198758495 9.133894791114008
epoch 25 0.08077304843815392 9.14344851506949
epoch 30 0.0852822529356656 9.120994666304947
epoch 35 0.07723195851907927 9.161043001078797
epoch 40 0.08547370637365381 9.120040089236964
epoch 45 0.08594760888781816 9.117676805636876
epoch 50 0.0854178269344168 9.120318711593175
epoch 55 0.07631209701487252 9.16560795747927
epoch 60 0.08485723550439772 9.123113424541474
epoch 65 0.08283680751294531 9.133178756374837
epoch 70 0.083207260126124 9.13133407285337
epoch 75 0.06751143476061916 9.209168230656548
epoch 80 0.08530687719077712 9.120871896624452
epoch 85 0.08041130753793868 9.14524743640855
epoch 90 0.07424822879415083 9.175841961843938
epoch 95 0.08567463564164901 9.119038158698661
[32m[I 2022-02-17 16:29:29,945][0m Trial 3 finished with value: 9.12512482353794 and parameters: {'n_layers_mlp': 4, 'mlp_n_units_l0': 29, 'mlp_dropout_l0': 0.022834124076772665, 'mlp_n_units_l1': 34, 'mlp_dropout_l1': 0.06216196632049591, 'mlp_n_units_l2': 33, 'mlp_dropout_l2': 0.11646947980726563, 'mlp_n_units_l3': 77, 'mlp_dropout_l3': 0.06952092055564442, 'lr': 0.0008996066632023036, 'weight_decay': 0.2042771039242255, 'criterion': 'MSELoss', 'batch_size': 128}. Best is trial 3 with value: 9.12512482353794.[0m
Trial Id: 4 | Model params: 4287 | Timestamp: 2022-02-17 16:29:29.945377

epoch 0 -9.20939759459176 30.471842001202322
epoch 5 -0.28448000227550274 10.808422746670018
epoch 10 -0.00024102215793253556 9.537860806622898
epoch 15 0.02590768114122144 9.41236387948588
epoch 20 0.042292534620255395 9.332867186581673
epoch 25 0.050307152802379296 9.293733882066071
epoch 30 0.05725098513089666 9.259695231501311
epoch 35 0.06002108320206112 9.246081250792766
epoch 40 0.0630058532519564 9.231389767459838
epoch 45 0.06362803787593563 9.228324336057884
epoch 50 0.06609767328195637 9.21614667346093
epoch 55 0.06575464247892249 9.217839105234775
epoch 60 0.06605335848628291 9.216365329523912
epoch 65 0.06749902957687459 9.209229486659222
epoch 70 0.0687531855184158 9.203034481880536
epoch 75 0.0685415281318188 9.204080273140422
epoch 80 0.06801791853245598 9.206666898220409
epoch 85 0.06915506500811386 9.201048483188854
epoch 90 0.06902590422689225 9.201686813668653
epoch 95 0.06950229970707611 9.199332181586076
[32m[I 2022-02-17 16:41:19,605][0m Trial 4 finished with value: 9.203053849808041 and parameters: {'n_layers_mlp': 2, 'mlp_n_units_l0': 43, 'mlp_dropout_l0': 0.25079384472466454, 'mlp_n_units_l1': 79, 'mlp_dropout_l1': 0.2479807252081178, 'lr': 1.1335191941282401e-05, 'weight_decay': 0.27016159799063877, 'criterion': 'MSELoss', 'batch_size': 128}. Best is trial 3 with value: 9.12512482353794.[0m
Trial Id: 5 | Model params: 6670 | Timestamp: 2022-02-17 16:41:19.605945

[32m[I 2022-02-17 16:41:28,620][0m Trial 5 pruned. [0m
epoch 0 0.05834372711018432 9.254327211319842
Trial Id: 6 | Model params: 8172 | Timestamp: 2022-02-17 16:41:28.620703

[32m[I 2022-02-17 16:41:33,640][0m Trial 6 pruned. [0m
epoch 0 0.04934829676954622 9.297817052600726
Trial Id: 7 | Model params: 9056 | Timestamp: 2022-02-17 16:41:33.641006

[32m[I 2022-02-17 16:41:39,149][0m Trial 7 pruned. [0m
epoch 0 -7.563207011691361 27.905416104982976
Trial Id: 8 | Model params: 4972 | Timestamp: 2022-02-17 16:41:39.149964

epoch 0 -9.456474196093415 30.83634644466696
epoch 5 -0.02048520431246481 9.63326788533033
epoch 10 0.025064402129862717 9.415822118334969
epoch 15 0.04859275417112452 9.3015110982772
epoch 20 0.05845631332539658 9.253169530328325
epoch 25 0.06447814119522421 9.223531832870039
epoch 30 0.0632360533057047 9.229652821352843
epoch 35 0.06720010224940243 9.21010382861791
epoch 40 0.06566611735922578 9.217673703192588
epoch 45 0.06704224343610066 9.210883113949283
epoch 50 0.06795939256215955 9.206354596708188
epoch 55 0.06728574541727816 9.209681015227705
epoch 60 0.06757356882777554 9.208259912078734
epoch 65 0.06704523273608665 9.210868357592616
epoch 70 0.06953284908646229 9.198580301559016
epoch 75 0.06965227590274481 9.197989957014734
epoch 80 0.0686617332088999 9.20288521159521
epoch 85 0.06890081766330713 9.20170389644133
epoch 90 0.06779628492610723 9.207160120111519
epoch 95 0.067395632784927 9.209138481751701
[32m[I 2022-02-17 16:50:10,100][0m Trial 8 finished with value: 9.203944978616533 and parameters: {'n_layers_mlp': 4, 'mlp_n_units_l0': 79, 'mlp_dropout_l0': 0.05748927942076145, 'mlp_n_units_l1': 17, 'mlp_dropout_l1': 0.06675507290577438, 'mlp_n_units_l2': 62, 'mlp_dropout_l2': 0.1092694923828936, 'mlp_n_units_l3': 18, 'mlp_dropout_l3': 0.11114082215946759, 'lr': 1.7506912814251372e-05, 'weight_decay': 0.251836580248002, 'criterion': 'MSELoss', 'batch_size': 256}. Best is trial 3 with value: 9.12512482353794.[0m
Trial Id: 9 | Model params: 5919 | Timestamp: 2022-02-17 16:50:10.101043

[32m[I 2022-02-17 16:50:14,438][0m Trial 9 pruned. [0m
epoch 0 -7.565260447351141 27.90876172897915
Trial Id: 10 | Model params: 3778 | Timestamp: 2022-02-17 16:50:14.438431

[32m[I 2022-02-17 16:50:23,437][0m Trial 10 pruned. [0m
epoch 0 0.050212094106566574 9.29419899461205
Trial Id: 11 | Model params: 6447 | Timestamp: 2022-02-17 16:50:23.437402

[32m[I 2022-02-17 16:50:49,391][0m Trial 11 pruned. [0m
epoch 0 0.0483412243127983 9.30334823821536
Trial Id: 12 | Model params: 3322 | Timestamp: 2022-02-17 16:50:49.391270

[32m[I 2022-02-17 16:51:15,354][0m Trial 12 pruned. [0m
epoch 0 0.05513026480542349 9.27010425472074
Trial Id: 13 | Model params: 1767 | Timestamp: 2022-02-17 16:51:15.355179

[32m[I 2022-02-17 16:51:41,270][0m Trial 13 pruned. [0m
epoch 0 0.06181083164741208 9.237274646832773
Trial Id: 14 | Model params: 8984 | Timestamp: 2022-02-17 16:51:41.270850

[32m[I 2022-02-17 16:51:50,155][0m Trial 14 pruned. [0m
epoch 0 0.03630981460764138 9.361972630569063
Trial Id: 15 | Model params: 513 | Timestamp: 2022-02-17 16:51:50.156152

[32m[I 2022-02-17 16:52:16,215][0m Trial 15 pruned. [0m
epoch 0 -0.07927838180118463 9.907529821384847
Trial Id: 16 | Model params: 3129 | Timestamp: 2022-02-17 16:52:16.215704

[32m[I 2022-02-17 16:52:23,254][0m Trial 16 pruned. [0m
epoch 0 0.06532003251131502 9.219982920515799
Trial Id: 17 | Model params: 5625 | Timestamp: 2022-02-17 16:52:23.254716

[32m[I 2022-02-17 16:52:32,398][0m Trial 17 pruned. [0m
epoch 0 0.05291358773700572 9.280971779056863
Trial Id: 18 | Model params: 3848 | Timestamp: 2022-02-17 16:52:32.398648

[32m[I 2022-02-17 16:53:06,155][0m Trial 18 pruned. [0m
epoch 0 0.06630918567147603 9.2151029671043
Trial Id: 19 | Model params: 5295 | Timestamp: 2022-02-17 16:53:06.155673

[32m[I 2022-02-17 16:53:31,842][0m Trial 19 pruned. [0m
epoch 0 0.0717005992241645 9.18845905113574
Trial Id: 20 | Model params: 3707 | Timestamp: 2022-02-17 16:53:31.842235

[32m[I 2022-02-17 16:53:38,845][0m Trial 20 pruned. [0m
epoch 0 0.057975923478525426 9.256134369062918
Trial Id: 21 | Model params: 4095 | Timestamp: 2022-02-17 16:53:38.845584

epoch 0 -9.285520749855554 30.585232870647015
epoch 5 -0.28785281507047045 10.822603927736704
epoch 10 0.0150403842014597 9.464721979833673
epoch 15 0.03602689615718102 9.363346765358573
epoch 20 0.0464314278224468 9.312678576572592
epoch 25 0.054087572013104546 9.275217766856041
epoch 30 0.057908606022254006 9.256465086878322
epoch 35 0.06147682248239339 9.23891880343714
epoch 40 0.06334067895913842 9.229740246599135
epoch 45 0.06469495748905241 9.223065375477894
epoch 50 0.0659292939534839 9.216977455547811
epoch 55 0.06645561997015503 9.214380318861515
epoch 60 0.06626455732489511 9.215323195197229
epoch 65 0.0677177839550629 9.208149231787633
epoch 70 0.06806127447647181 9.206452747978174
epoch 75 0.0686014372697683 9.203784276379409
epoch 80 0.06885225083297752 9.202544963022858
epoch 85 0.06927034998780557 9.200478691436821
epoch 90 0.06922365206287251 9.200709498457012
epoch 95 0.06999777964862708 9.196882583099981
[32m[I 2022-02-17 17:05:28,073][0m Trial 21 finished with value: 9.196710569463734 and parameters: {'n_layers_mlp': 2, 'mlp_n_units_l0': 41, 'mlp_dropout_l0': 0.2453144868040869, 'mlp_n_units_l1': 79, 'mlp_dropout_l1': 0.2488591665695538, 'lr': 1.1056188282071402e-05, 'weight_decay': 0.29291927517145494, 'criterion': 'MSELoss', 'batch_size': 128}. Best is trial 3 with value: 9.12512482353794.[0m
Trial Id: 22 | Model params: 1797 | Timestamp: 2022-02-17 17:05:28.074096

[32m[I 2022-02-17 17:05:35,096][0m Trial 22 pruned. [0m
epoch 0 -9.016910554542022 30.18321845885204
Trial Id: 23 | Model params: 2670 | Timestamp: 2022-02-17 17:05:35.096336

[32m[I 2022-02-17 17:05:42,078][0m Trial 23 pruned. [0m
epoch 0 -1.2621245370890106 14.343558348290765
Trial Id: 24 | Model params: 2781 | Timestamp: 2022-02-17 17:05:42.078643

[32m[I 2022-02-17 17:05:49,215][0m Trial 24 pruned. [0m
epoch 0 0.06338017964330567 9.229545626799768
Trial Id: 25 | Model params: 2993 | Timestamp: 2022-02-17 17:05:49.215455

[32m[I 2022-02-17 17:05:56,398][0m Trial 25 pruned. [0m
epoch 0 0.0274555234118411 9.404882737035079
Trial Id: 26 | Model params: 1335 | Timestamp: 2022-02-17 17:05:56.399110

[32m[I 2022-02-17 17:06:23,144][0m Trial 26 pruned. [0m
epoch 0 -7.596794591091108 27.96191583430954
Trial Id: 27 | Model params: 3856 | Timestamp: 2022-02-17 17:06:23.144584

epoch 0 -9.40815170556542 30.767021571227207
epoch 5 -0.03569108566795376 9.705407354454705
epoch 10 -0.01959872323804812 9.62971182166247
epoch 15 -0.03782179149520526 9.715385591889332
epoch 20 -0.0658531892868599 9.845716891053478
epoch 25 -0.1030115004711627 10.015869779531487
epoch 30 -0.1266767322124509 10.122745352922436
epoch 35 -0.10940160370344465 10.044840471425347
epoch 40 -0.11417336939068701 10.06641975999183
epoch 45 -0.12125310836972014 10.098351401627736
epoch 50 -0.10156418816683344 10.009296480008157
epoch 55 -0.10691498431211466 10.03357687354874
epoch 60 -0.09918326813271583 9.998473585634251
epoch 65 -0.089808378459872 9.955743992216824
epoch 70 -0.07575584038144978 9.891348543386849
epoch 75 -0.07403521488360743 9.883434983109517
epoch 80 -0.06691598714427482 9.850624414771849
epoch 85 -0.05625144594678244 9.801268969396666
epoch 90 -0.054098447647508596 9.791274720493428
epoch 95 -0.03956213204420189 9.723528125227256
