[32m[I 2022-02-17 18:58:50,282][0m Trial 64 pruned. [0m
epoch 0 0.018414417634119107 9.4478799590343
Trial Id: 65 | Model params: 8258 | Timestamp: 2022-02-17 18:58:50.283126

[32m[I 2022-02-17 18:58:55,315][0m Trial 65 pruned. [0m
epoch 0 -8.572990771559502 29.50489689906324
Trial Id: 66 | Model params: 13904 | Timestamp: 2022-02-17 18:58:55.315810

epoch 0 -9.609696254252556 31.06145222660002
epoch 5 0.06641768085818789 9.213965681404746
epoch 10 0.06954936887231045 9.19849864405449
epoch 15 0.07371447419326704 9.177887293633853
epoch 20 0.07580653140352978 9.167517100857168
epoch 25 0.07679099406941625 9.16263312184224
epoch 30 0.07768909104523536 9.158175336393185
epoch 35 0.07869816992927625 9.153164092179956
epoch 40 0.07923214637228726 9.15051117092979
epoch 45 0.07939987049880337 9.14967771905294
epoch 50 0.07997197938049794 9.146834234005592
epoch 55 0.08053269735522728 9.144046505840972
epoch 60 0.08055758329093676 9.143922760443726
epoch 65 0.0805490170644354 9.143965356222218
epoch 70 0.0810870197020831 9.141289739239182
epoch 75 0.0809245679984748 9.142097733301759
epoch 80 0.081415782618118 9.139654336328679
epoch 85 0.08208961310113938 9.136301509551766
epoch 90 0.08227737789081935 9.135367015567985
epoch 95 0.08242291941717583 9.13464259843708
[32m[I 2022-02-17 19:07:29,006][0m Trial 66 finished with value: 9.13523576043352 and parameters: {'n_layers_mlp': 4, 'mlp_n_units_l0': 18, 'mlp_dropout_l0': 0.11965035900051814, 'mlp_n_units_l1': 75, 'mlp_dropout_l1': 0.25724389465675473, 'mlp_n_units_l2': 77, 'mlp_dropout_l2': 0.18144837765664437, 'mlp_n_units_l3': 80, 'mlp_dropout_l3': 0.01110628280030955, 'lr': 8.92031272871673e-05, 'weight_decay': 0.17810676862289093, 'criterion': 'MSELoss', 'batch_size': 256}. Best is trial 3 with value: 9.12512482353794.[0m
Trial Id: 67 | Model params: 13986 | Timestamp: 2022-02-17 19:07:29.006953

[32m[I 2022-02-17 19:07:34,069][0m Trial 67 pruned. [0m
epoch 0 -0.0062915518637285395 9.566040045748673
Trial Id: 68 | Model params: 13128 | Timestamp: 2022-02-17 19:07:34.069192

[32m[I 2022-02-17 19:07:39,109][0m Trial 68 pruned. [0m
epoch 0 -0.23511110750570685 10.59798486513297
Trial Id: 69 | Model params: 10177 | Timestamp: 2022-02-17 19:07:39.109244

[32m[I 2022-02-17 19:07:44,308][0m Trial 69 pruned. [0m
epoch 0 -7.550069009997538 27.884001106332565
Trial Id: 70 | Model params: 14550 | Timestamp: 2022-02-17 19:07:44.308247

[32m[I 2022-02-17 19:07:49,678][0m Trial 70 pruned. [0m
epoch 0 0.05715213355764104 9.259575829166469
Trial Id: 71 | Model params: 4536 | Timestamp: 2022-02-17 19:07:49.678686

[32m[I 2022-02-17 19:07:54,774][0m Trial 71 pruned. [0m
epoch 0 0.02842456004717664 9.39958209315657
Trial Id: 72 | Model params: 12386 | Timestamp: 2022-02-17 19:07:54.774807

epoch 0 -9.609696254252556 31.06145222660002
epoch 5 -9.609696254252556 31.06145222660002
epoch 10 0.008781007566025734 9.494128133228084
epoch 15 0.06567492787218654 9.2176302430192
epoch 20 0.07043211423600715 9.194134168080764
epoch 25 0.07482177441578908 9.172399938308375
epoch 30 0.07725928411916494 9.160308992557741
epoch 35 0.07750933470055232 9.159067746914483
epoch 40 0.07680161298147503 9.162580426583363
epoch 45 0.07798140143166654 9.156723959266065
epoch 50 0.07763259072099737 9.15845584481319
epoch 55 0.0778768972485544 9.157242868996022
epoch 60 0.07763572496183668 9.158440284402865
epoch 65 0.07671919284419915 9.162989420085141
epoch 70 0.07704441736787981 9.161375452091525
epoch 75 0.07856834036921956 9.153808999943005
epoch 80 0.07848582392687187 9.15421886367779
epoch 85 0.07852635276985398 9.15401755696543
epoch 90 0.07874028366529007 9.152954889110507
epoch 95 0.07775627635886528 9.15784176878496
[32m[I 2022-02-17 19:16:27,470][0m Trial 72 finished with value: 9.152330667338852 and parameters: {'n_layers_mlp': 4, 'mlp_n_units_l0': 19, 'mlp_dropout_l0': 0.12570886309872306, 'mlp_n_units_l1': 70, 'mlp_dropout_l1': 0.2703722452236031, 'mlp_n_units_l2': 71, 'mlp_dropout_l2': 0.1370240348750766, 'mlp_n_units_l3': 77, 'mlp_dropout_l3': 0.03353559625818381, 'lr': 5.4449508237739796e-05, 'weight_decay': 0.2218658707502547, 'criterion': 'MSELoss', 'batch_size': 256}. Best is trial 3 with value: 9.12512482353794.[0m
Trial Id: 73 | Model params: 12024 | Timestamp: 2022-02-17 19:16:27.470488

[32m[I 2022-02-17 19:16:32,599][0m Trial 73 pruned. [0m
epoch 0 0.008957974827729975 9.493280578414815
Trial Id: 74 | Model params: 12317 | Timestamp: 2022-02-17 19:16:32.599443

[32m[I 2022-02-17 19:16:37,660][0m Trial 74 pruned. [0m
epoch 0 -4.240362767952413 21.829860350423797
Trial Id: 75 | Model params: 6206 | Timestamp: 2022-02-17 19:16:37.661208

epoch 0 -9.609696254252556 31.06145222660002
epoch 5 -9.609696254252556 31.06145222660002
epoch 10 -9.609696254252556 31.06145222660002
epoch 15 -9.609696254252556 31.06145222660002
epoch 20 0.018675381614477127 9.446623970611531
epoch 25 0.06148906264087739 9.238255098813552
epoch 30 0.06433374428274063 9.224243627104382
epoch 35 0.06784080186106689 9.20694027576041
epoch 40 0.06779919160798276 9.2071457657886
epoch 45 0.06782157466481631 9.207035228819429
epoch 50 0.0707577939060644 9.192523417028797
epoch 55 0.06596695503850358 9.216189626211198
epoch 60 0.06848099553152964 9.203778134966353
epoch 65 0.06885807685316625 9.201915089713452
epoch 70 0.06961753582322183 9.19816168631087
epoch 75 0.0699783798606608 9.196377783553528
epoch 80 0.07188871778602657 9.186927884881754
epoch 85 0.07441681218879592 9.174407156498273
epoch 90 0.07554466062889631 9.16881581960494
epoch 95 0.0744411059710901 9.174286755374105
[32m[I 2022-02-17 19:25:11,520][0m Trial 75 finished with value: 9.164904320812438 and parameters: {'n_layers_mlp': 4, 'mlp_n_units_l0': 24, 'mlp_dropout_l0': 0.12909871041276602, 'mlp_n_units_l1': 78, 'mlp_dropout_l1': 0.23523321956093932, 'mlp_n_units_l2': 43, 'mlp_dropout_l2': 0.15598288997794998, 'mlp_n_units_l3': 10, 'mlp_dropout_l3': 0.06200297483278455, 'lr': 4.5106397634344246e-05, 'weight_decay': 0.19301876851314295, 'criterion': 'MSELoss', 'batch_size': 256}. Best is trial 3 with value: 9.12512482353794.[0m
Trial Id: 76 | Model params: 11411 | Timestamp: 2022-02-17 19:25:11.520757

epoch 0 -9.609696254252556 31.06145222660002
epoch 5 -9.609696254252556 31.06145222660002
epoch 10 0.017353405230483787 9.45298476629927
epoch 15 0.06277956250813066 9.231901380571967
epoch 20 0.06910226220557025 9.200708442179065
epoch 25 0.0735338021280284 9.178782323814147
epoch 30 0.07584060523127478 9.16734810200119
epoch 35 0.07673294691747501 9.162921169507257
epoch 40 0.07727092537793157 9.160251209335508
epoch 45 0.07762053767934307 9.158515683706053
epoch 50 0.0775233805527763 9.158998018619867
epoch 55 0.077746174830581 9.157891922525216
epoch 60 0.07646675987872786 9.164241954793026
epoch 65 0.07677344063376745 9.16272022829665
epoch 70 0.07834251759313104 9.15493063056066
epoch 75 0.07629178090946387 9.165110073878502
epoch 80 0.07840858768573122 9.154602483734646
epoch 85 0.07856145138542914 9.15384321860876
epoch 90 0.07692324614835377 9.161976812885229
epoch 95 0.07870435327235681 9.153133376269617
[32m[I 2022-02-17 19:33:46,274][0m Trial 76 finished with value: 9.15289115716061 and parameters: {'n_layers_mlp': 4, 'mlp_n_units_l0': 18, 'mlp_dropout_l0': 0.10086783639219335, 'mlp_n_units_l1': 70, 'mlp_dropout_l1': 0.2745140397289532, 'mlp_n_units_l2': 65, 'mlp_dropout_l2': 0.18887223225730562, 'mlp_n_units_l3': 77, 'mlp_dropout_l3': 0.04618680866033792, 'lr': 5.869290921293437e-05, 'weight_decay': 0.2183700098851112, 'criterion': 'MSELoss', 'batch_size': 256}. Best is trial 3 with value: 9.12512482353794.[0m
Trial Id: 77 | Model params: 7327 | Timestamp: 2022-02-17 19:33:46.274419

[32m[I 2022-02-17 19:33:51,404][0m Trial 77 pruned. [0m
epoch 0 -0.01659894173133858 9.614907443091914
Trial Id: 78 | Model params: 6892 | Timestamp: 2022-02-17 19:33:51.404558

epoch 0 -9.609696254252556 31.06145222660002
epoch 5 -9.609696254252556 31.06145222660002
epoch 10 0.07219399743519994 9.185416852294313
epoch 15 0.07735872350087725 9.159815397775981
epoch 20 0.07789766225302153 9.157139763857995
epoch 25 0.07817889072197748 9.155743256835878
epoch 30 0.07631551377330359 9.164992333393934
epoch 35 0.07819274302666601 9.155674464409431
epoch 40 0.07838307881661821 9.15472917867641
epoch 45 0.07762419058960934 9.158497548399243
epoch 50 0.07804814091034129 9.156392552696008
epoch 55 0.07859040075045143 9.153699421699828
epoch 60 0.07860669897680517 9.153618464368254
epoch 65 0.0783274130800865 9.15500564769296
epoch 70 0.07869248151344643 9.153192349435857
epoch 75 0.07893110678401327 9.152006901360593
epoch 80 0.07904070618839243 9.151462379472397
epoch 85 0.07899034699341045 9.15171258270152
epoch 90 0.07922430834903993 9.15055011764495
epoch 95 0.07879151930323547 9.152700365877301
[32m[I 2022-02-17 19:42:23,706][0m Trial 78 finished with value: 9.151044783667428 and parameters: {'n_layers_mlp': 4, 'mlp_n_units_l0': 14, 'mlp_dropout_l0': 0.16999525047059857, 'mlp_n_units_l1': 75, 'mlp_dropout_l1': 0.15977568227211714, 'mlp_n_units_l2': 38, 'mlp_dropout_l2': 0.21193962085393342, 'mlp_n_units_l3': 66, 'mlp_dropout_l3': 0.0023018067579229987, 'lr': 9.609106967028229e-05, 'weight_decay': 0.13827456246196168, 'criterion': 'MSELoss', 'batch_size': 256}. Best is trial 3 with value: 9.12512482353794.[0m
Trial Id: 79 | Model params: 3668 | Timestamp: 2022-02-17 19:42:23.706852

[32m[I 2022-02-17 19:42:28,990][0m Trial 79 pruned. [0m
epoch 0 -9.446747655323597 30.8220012286718
Trial Id: 80 | Model params: 7076 | Timestamp: 2022-02-17 19:42:28.990271

epoch 0 -9.609696254252556 31.06145222660002
epoch 5 -9.609696254252556 31.06145222660002
epoch 10 0.07206543431953849 9.186053227193895
epoch 15 0.07831649232482119 9.155059885651966
epoch 20 0.07659160238958707 9.163622526280404
epoch 25 0.07812791083045267 9.155996425449722
epoch 30 0.07836670268537649 9.15481051311
epoch 35 0.07887572921511432 9.152282020995436
epoch 40 0.07827130274925775 9.155284316379076
epoch 45 0.07825307579612584 9.155374837653765
epoch 50 0.07727003799442911 9.160255614016183
epoch 55 0.08015072759285335 9.145945641673404
epoch 60 0.08149146113115413 9.139277838625238
epoch 65 0.08291435265845504 9.132196118279483
epoch 70 0.0834737052998964 9.12941072022837
epoch 75 0.08289156423057997 9.132309579383358
epoch 80 0.08400537812005904 9.126762370856431
epoch 85 0.08451740555595233 9.124211151743618
epoch 90 0.08309980649098192 9.131272711396258
epoch 95 0.08499255550040197 9.121843039490347
[32m[I 2022-02-17 19:52:39,333][0m Trial 80 finished with value: 9.126660529994231 and parameters: {'n_layers_mlp': 4, 'mlp_n_units_l0': 21, 'mlp_dropout_l0': 0.18365822365933537, 'mlp_n_units_l1': 74, 'mlp_dropout_l1': 0.10052733921477644, 'mlp_n_units_l2': 38, 'mlp_dropout_l2': 0.2595917785445677, 'mlp_n_units_l3': 56, 'mlp_dropout_l3': 0.10227813813110838, 'lr': 0.00016196517316231898, 'weight_decay': 0.10309637323940518, 'criterion': 'MSELoss', 'batch_size': 256}. Best is trial 3 with value: 9.12512482353794.[0m
Trial Id: 81 | Model params: 6906 | Timestamp: 2022-02-17 19:52:39.333586

[32m[I 2022-02-17 19:52:46,949][0m Trial 81 pruned. [0m
epoch 0 0.008841818125641443 9.49383689985563
Trial Id: 82 | Model params: 5992 | Timestamp: 2022-02-17 19:52:46.949820

[32m[I 2022-02-17 19:52:54,451][0m Trial 82 pruned. [0m
epoch 0 0.023742778824757282 9.422202004093807
Trial Id: 83 | Model params: 5816 | Timestamp: 2022-02-17 19:52:54.451693

epoch 0 -9.609696254252556 31.06145222660002
epoch 5 -9.609696254252556 31.06145222660002
epoch 10 0.031583493720975464 9.384288977559633
epoch 15 0.0664695491270838 9.21370972160455
epoch 20 0.07649826154726747 9.164085657563122
epoch 25 0.07393417923890944 9.176798780603281
epoch 30 0.07207215488861307 9.186019962123652
epoch 35 0.07696392186545331 9.16177494772022
epoch 40 0.08034007576332114 9.145004260701883
epoch 45 0.0800803107786403 9.146295707738211
epoch 50 0.08122586334738002 9.140599109133865
epoch 55 0.08160108027508084 9.138732460077712
epoch 60 0.08187811605607864 9.1373540030775
epoch 65 0.08171888992321674 9.138146295742466
epoch 70 0.08268457287166098 9.133340102300567
epoch 75 0.08294117863715744 9.132062552842704
epoch 80 0.08336808497226045 9.129936740910226
epoch 85 0.0838642261350534 9.127465546928164
epoch 90 0.08232754340544102 9.135117328658524
epoch 95 0.0821359552238099 9.136070876499002
[32m[I 2022-02-17 20:05:17,630][0m Trial 83 finished with value: 9.122739234280427 and parameters: {'n_layers_mlp': 4, 'mlp_n_units_l0': 23, 'mlp_dropout_l0': 0.16499131913735846, 'mlp_n_units_l1': 75, 'mlp_dropout_l1': 0.08469890664781476, 'mlp_n_units_l2': 30, 'mlp_dropout_l2': 0.29348761793320555, 'mlp_n_units_l3': 42, 'mlp_dropout_l3': 0.18884125239450217, 'lr': 8.208795049625633e-05, 'weight_decay': 0.07454263516346277, 'criterion': 'MSELoss', 'batch_size': 256}. Best is trial 83 with value: 9.122739234280427.[0m
Trial Id: 84 | Model params: 6611 | Timestamp: 2022-02-17 20:05:17.630472

[32m[I 2022-02-17 20:05:24,652][0m Trial 84 pruned. [0m
epoch 0 0.02091787211930296 9.435824241230089
Trial Id: 85 | Model params: 5054 | Timestamp: 2022-02-17 20:05:24.652241

[32m[I 2022-02-17 20:05:31,661][0m Trial 85 pruned. [0m
epoch 0 -0.0038539774708827856 9.554446948152284
Trial Id: 86 | Model params: 7406 | Timestamp: 2022-02-17 20:05:31.661820

[32m[I 2022-02-17 20:06:23,113][0m Trial 86 pruned. [0m
epoch 0 -7.649687888760235 28.047804239845988
Trial Id: 87 | Model params: 7056 | Timestamp: 2022-02-17 20:06:23.114119

[32m[I 2022-02-17 20:06:30,762][0m Trial 87 pruned. [0m
epoch 0 0.0012333051604528356 9.530206415843773
Trial Id: 88 | Model params: 3020 | Timestamp: 2022-02-17 20:06:30.762336

[32m[I 2022-02-17 20:06:38,183][0m Trial 88 pruned. [0m
epoch 0 -0.8772020479309055 13.065492679217108
Trial Id: 89 | Model params: 3450 | Timestamp: 2022-02-17 20:06:38.183737

epoch 0 -9.609696254252556 31.06145222660002
epoch 5 -9.609696254252556 31.06145222660002
epoch 10 0.05952998684052435 9.247892177252954
epoch 15 0.07594540241777048 9.166828310972042
epoch 20 0.07472770035326104 9.172866260886877
epoch 25 0.0775069967002453 9.159079353476177
epoch 30 0.07799997907277789 9.15663170994017
epoch 35 0.07742069622892889 9.159507765603179
epoch 40 0.07720370390455134 9.160584868686572
epoch 45 0.07872616698417578 9.153025015291083
epoch 50 0.07814395977113164 9.155916726386934
epoch 55 0.07877355953746112 9.152789585395489
epoch 60 0.07814727280172351 9.155900273785802
epoch 65 0.07895227009009165 9.151901758391753
epoch 70 0.07885231554502892 9.152398339258266
epoch 75 0.07907638051421051 9.151285132000954
epoch 80 0.07890513798668786 9.1521359171915
epoch 85 0.07884312074746114 9.152444018274457
epoch 90 0.07988668632562035 9.1472582120454
epoch 95 0.07930352063239199 9.150156508449468
[32m[I 2022-02-17 20:19:09,932][0m Trial 89 finished with value: 9.143514166674516 and parameters: {'n_layers_mlp': 4, 'mlp_n_units_l0': 14, 'mlp_dropout_l0': 0.1937079254438249, 'mlp_n_units_l1': 39, 'mlp_dropout_l1': 0.07365245478368156, 'mlp_n_units_l2': 31, 'mlp_dropout_l2': 0.2220498445624735, 'mlp_n_units_l3': 42, 'mlp_dropout_l3': 0.09913735594793655, 'lr': 9.383646405769384e-05, 'weight_decay': 0.08434995853111213, 'criterion': 'MSELoss', 'batch_size': 256}. Best is trial 83 with value: 9.122739234280427.[0m
Trial Id: 90 | Model params: 3149 | Timestamp: 2022-02-17 20:19:09.932687

[32m[I 2022-02-17 20:19:23,617][0m Trial 90 pruned. [0m
epoch 0 -9.605213203305738 31.05691769195428
Trial Id: 91 | Model params: 3888 | Timestamp: 2022-02-17 20:19:23.617647

[32m[I 2022-02-17 20:19:31,129][0m Trial 91 pruned. [0m
epoch 0 -0.024559917834728218 9.6524811485289
Trial Id: 92 | Model params: 2804 | Timestamp: 2022-02-17 20:19:31.129584

[32m[I 2022-02-17 20:19:38,779][0m Trial 92 pruned. [0m
epoch 0 -0.0523230597393165 9.782386662151259
Trial Id: 93 | Model params: 4601 | Timestamp: 2022-02-17 20:19:38.779515

[32m[I 2022-02-17 20:19:46,278][0m Trial 93 pruned. [0m
epoch 0 -3.2037721163079187 19.551940361703625
Trial Id: 94 | Model params: 3578 | Timestamp: 2022-02-17 20:19:46.278298

[32m[I 2022-02-17 20:19:53,798][0m Trial 94 pruned. [0m
epoch 0 -0.031582105402374605 9.685503027977216
Trial Id: 95 | Model params: 8641 | Timestamp: 2022-02-17 20:19:53.798273

epoch 0 -9.609696254252556 31.06145222660002
epoch 5 -9.609696254252556 31.06145222660002
epoch 10 0.07194385142765403 9.186655010108131
epoch 15 0.07582684196313993 9.167416365225568
epoch 20 0.07284244635759485 9.182206421058998
epoch 25 0.07641650392604471 9.164491296898253
epoch 30 0.07885304924228875 9.152394694299357
epoch 35 0.07978886787421391 9.147744427623323
epoch 40 0.0803774474605844 9.144818448645825
epoch 45 0.08039424338120182 9.144734938109018
epoch 50 0.07983931967337832 9.147493655558849
epoch 55 0.08067923765432383 9.143317809616606
epoch 60 0.08071672973543509 9.143131364622581
epoch 65 0.08132460027154587 9.14010794441026
epoch 70 0.081711764441734 9.138181749790899
epoch 75 0.08152973410296671 9.13908742615101
epoch 80 0.07719548839983237 9.160625646191331
epoch 85 0.08174344030915415 9.138024140056508
epoch 90 0.08253901809035391 9.134064688713519
epoch 95 0.08271205079199839 9.133203307985466
[32m[I 2022-02-17 20:32:11,449][0m Trial 95 finished with value: 9.133333703583311 and parameters: {'n_layers_mlp': 4, 'mlp_n_units_l0': 25, 'mlp_dropout_l0': 0.18879440965901725, 'mlp_n_units_l1': 74, 'mlp_dropout_l1': 0.030658190712950707, 'mlp_n_units_l2': 55, 'mlp_dropout_l2': 0.21776130406802563, 'mlp_n_units_l3': 38, 'mlp_dropout_l3': 0.0917440477158652, 'lr': 0.00015510316043959617, 'weight_decay': 0.05329665522141962, 'criterion': 'MSELoss', 'batch_size': 256}. Best is trial 83 with value: 9.122739234280427.[0m
Trial Id: 96 | Model params: 5530 | Timestamp: 2022-02-17 20:32:11.449256

epoch 0 -9.609696254252556 31.06145222660002
epoch 5 0.07122066066717836 9.190233678411378
epoch 10 0.07422629123879709 9.175351332479496
epoch 15 0.07795251271107917 9.15686740754811
epoch 20 0.07953580801649196 9.14900216494688
epoch 25 0.07672803222392377 9.162945557299231
epoch 30 0.08000002760345237 9.146694806512333
epoch 35 0.07950320549241274 9.149164190762104
epoch 40 0.07710012504470898 9.161098967148
epoch 45 0.07789339464437361 9.15716095404591
epoch 50 0.07926048707433919 9.150370346125118
epoch 55 0.08144207851492169 9.13952351700764
epoch 60 0.08073504253552777 9.143040295212211
epoch 65 0.08203512546078662 9.13657267334427
epoch 70 0.08284681384898618 9.132532382564184
epoch 75 0.0802408609473092 9.145497538391645
epoch 80 0.07539712812960431 9.169547409488906
epoch 85 0.08280836408527592 9.132723811889909
epoch 90 0.0836904358343713 9.128331242715795
epoch 95 0.08411805794006055 9.126200995524421
[32m[I 2022-02-17 20:44:34,395][0m Trial 96 finished with value: 9.120511095941094 and parameters: {'n_layers_mlp': 4, 'mlp_n_units_l0': 17, 'mlp_dropout_l0': 0.19406909612060674, 'mlp_n_units_l1': 37, 'mlp_dropout_l1': 0.01820302980761379, 'mlp_n_units_l2': 60, 'mlp_dropout_l2': 0.21433557227634883, 'mlp_n_units_l3': 37, 'mlp_dropout_l3': 0.09209491013157622, 'lr': 0.0002457175859357712, 'weight_decay': 0.05368768012361619, 'criterion': 'MSELoss', 'batch_size': 256}. Best is trial 96 with value: 9.120511095941094.[0m
Trial Id: 97 | Model params: 6350 | Timestamp: 2022-02-17 20:44:34.395433

epoch 0 -9.609696254252556 31.06145222660002
epoch 5 0.056403547471824744 9.263250978977409
epoch 10 0.07324972054181944 9.180189457281601
epoch 15 0.07944407832789946 9.149458029617767
epoch 20 0.07926475580658376 9.150349134628451
epoch 25 0.07999556025099619 9.146717013828166
epoch 30 0.0786158956717049 9.153572781788288
epoch 35 0.08022400217358117 9.145581354447701
epoch 40 0.08111122028710427 9.141169365481902
epoch 45 0.08037243210622513 9.14484338520399
epoch 50 0.08080296792422414 9.142702494867654
epoch 55 0.0823715134700006 9.134898472514683
epoch 60 0.0820093063471703 9.136701162219898
epoch 65 0.08047354053223654 9.144340656616444
epoch 70 0.08574594464760665 9.118086942869297
epoch 75 0.08698921344104782 9.111885116656103
epoch 80 0.0872976696667308 9.110345783735951
epoch 85 0.08800028454390152 9.106838453547644
epoch 90 0.08896176390327626 9.102036727163883
epoch 95 0.08946883033074937 9.099503364982182
[32m[I 2022-02-17 20:56:58,306][0m Trial 97 finished with value: 9.1243638511939 and parameters: {'n_layers_mlp': 4, 'mlp_n_units_l0': 35, 'mlp_dropout_l0': 0.18965977569945405, 'mlp_n_units_l1': 38, 'mlp_dropout_l1': 0.018166909429708857, 'mlp_n_units_l2': 60, 'mlp_dropout_l2': 0.2401250853426012, 'mlp_n_units_l3': 33, 'mlp_dropout_l3': 0.09099690932670453, 'lr': 0.00024654623526026976, 'weight_decay': 0.04676022184631887, 'criterion': 'MSELoss', 'batch_size': 256}. Best is trial 96 with value: 9.120511095941094.[0m
Trial Id: 98 | Model params: 6704 | Timestamp: 2022-02-17 20:56:58.307001

[32m[I 2022-02-17 20:57:06,032][0m Trial 98 pruned. [0m
epoch 0 0.036699549786907815 9.359467981056488
Trial Id: 99 | Model params: 6120 | Timestamp: 2022-02-17 20:57:06.032435

