[32m[I 2022-02-18 04:59:34,624][0m Trial 70 pruned. [0m
epoch 0 0.01815941019453704 2.563022789851059
Trial Id: 71 | Model params: 7581 | Timestamp: 2022-02-18 04:59:34.625034

epoch 0 -2.397109458556357 4.768628506368844
epoch 5 -2.397109458556357 4.768628506368844
epoch 10 0.011871316592605208 2.571849041516996
epoch 15 0.019664657990077217 2.5616869164908
epoch 20 0.01892285570227137 2.56265592464322
epoch 25 0.021611828606870498 2.5591416033767342
epoch 30 0.02250104501090555 2.5579783902205477
epoch 35 0.02281105530068772 2.5575727312159113
epoch 40 0.021045416250206395 2.559882270393087
epoch 45 0.02350136793236768 2.5566692024325888
epoch 50 0.019977774931822734 2.5612777852493243
epoch 55 0.019378535489243953 2.5620607185781057
epoch 60 0.021393231573528237 2.5594274763742866
epoch 65 0.01847424245457907 2.563241765425876
epoch 70 0.022449579410606102 2.5580457284821154
epoch 75 0.021675965584172174 2.5590577213850363
epoch 80 0.02162366713271402 2.55912612048531
epoch 85 0.022143274198844654 2.558446465545359
epoch 90 0.022429723129977375 2.55807170822436
epoch 95 0.022672539252878043 2.557753992125231
[32m[I 2022-02-18 05:11:41,933][0m Trial 71 finished with value: 2.559180469560316 and parameters: {'n_layers_mlp': 4, 'mlp_n_units_l0': 39, 'mlp_dropout_l0': 0.09708037925931777, 'mlp_n_units_l1': 68, 'mlp_dropout_l1': 0.2316299682188811, 'mlp_n_units_l2': 49, 'mlp_dropout_l2': 0.15955916135875928, 'mlp_n_units_l3': 16, 'mlp_dropout_l3': 0.29803346941696096, 'lr': 0.00012865103565013828, 'weight_decay': 0.049384598809549846, 'criterion': 'MSELoss', 'batch_size': 256}. Best is trial 16 with value: 2.542146508943635.[0m
Trial Id: 72 | Model params: 8573 | Timestamp: 2022-02-18 05:11:41.933379

[32m[I 2022-02-18 05:11:49,309][0m Trial 72 pruned. [0m
epoch 0 0.018669119968257042 2.562987292746431
Trial Id: 73 | Model params: 8660 | Timestamp: 2022-02-18 05:11:49.309219

[32m[I 2022-02-18 05:11:56,625][0m Trial 73 pruned. [0m
epoch 0 0.016873749580122888 2.565330747365532
Trial Id: 74 | Model params: 7070 | Timestamp: 2022-02-18 05:11:56.625549

[32m[I 2022-02-18 05:12:04,124][0m Trial 74 pruned. [0m
epoch 0 -0.4538104159588616 3.1195547229655247
Trial Id: 75 | Model params: 8098 | Timestamp: 2022-02-18 05:12:04.125117

[32m[I 2022-02-18 05:12:11,682][0m Trial 75 pruned. [0m
epoch 0 0.007644454640079679 2.577343897822973
Trial Id: 76 | Model params: 5676 | Timestamp: 2022-02-18 05:12:11.682425

[32m[I 2022-02-18 05:12:19,125][0m Trial 76 pruned. [0m
epoch 0 0.012156476804991545 2.571477914785059
Trial Id: 77 | Model params: 10076 | Timestamp: 2022-02-18 05:12:19.125465

[32m[I 2022-02-18 05:12:26,790][0m Trial 77 pruned. [0m
epoch 0 -1.7458977966074545 4.287270687591844
Trial Id: 78 | Model params: 5037 | Timestamp: 2022-02-18 05:12:26.790239

epoch 0 -2.397109458556357 4.768628506368844
epoch 5 -2.397109458556357 4.768628506368844
epoch 10 0.014914286869711746 2.5678859470533015
epoch 15 0.016440827028019966 2.565895510689535
epoch 20 0.01584618505983615 2.566671040343547
epoch 25 0.017396187687388043 2.5646490421228676
epoch 30 0.017193086914648603 2.5649140804233412
epoch 35 0.01702916669290533 2.5651279697181555
epoch 40 0.016840181100409524 2.565374543123219
epoch 45 0.01747445087368027 2.5645469045165763
epoch 50 0.016883515269594418 2.565318006231993
epoch 55 0.017076132531532395 2.5650666887415103
epoch 60 0.012683608933106272 2.5707917284238793
epoch 65 0.0173240911507615 2.5647431283251088
epoch 70 0.015683919508371558 2.566882625727694
epoch 75 0.016895516421584045 2.5653023484408117
epoch 80 0.016855966962846303 2.565353947889659
epoch 85 0.015819973456935532 2.566705220018063
epoch 90 0.017045395394099994 2.5651067946915123
epoch 95 0.01654164706705208 2.5657639983604557
[32m[I 2022-02-18 05:24:36,848][0m Trial 78 finished with value: 2.567096457238629 and parameters: {'n_layers_mlp': 4, 'mlp_n_units_l0': 26, 'mlp_dropout_l0': 0.16267603993034765, 'mlp_n_units_l1': 32, 'mlp_dropout_l1': 0.2447225466307254, 'mlp_n_units_l2': 50, 'mlp_dropout_l2': 0.07555973918488004, 'mlp_n_units_l3': 40, 'mlp_dropout_l3': 0.11335577607712885, 'lr': 0.00013196518804298301, 'weight_decay': 0.089626888248271, 'criterion': 'MSELoss', 'batch_size': 256}. Best is trial 16 with value: 2.542146508943635.[0m
Trial Id: 79 | Model params: 8008 | Timestamp: 2022-02-18 05:24:36.848953

[32m[I 2022-02-18 05:24:44,256][0m Trial 79 pruned. [0m
epoch 0 -2.2589963094656573 4.670685818067741
Trial Id: 80 | Model params: 11762 | Timestamp: 2022-02-18 05:24:44.256288

[32m[I 2022-02-18 05:24:57,458][0m Trial 80 pruned. [0m
epoch 0 -2.396768235889979 4.767217148196782
Trial Id: 81 | Model params: 7162 | Timestamp: 2022-02-18 05:24:57.458296

[32m[I 2022-02-18 05:25:05,152][0m Trial 81 pruned. [0m
epoch 0 -0.018751929357510022 2.611397250230304
Trial Id: 82 | Model params: 7996 | Timestamp: 2022-02-18 05:25:05.152178

[32m[I 2022-02-18 05:25:12,434][0m Trial 82 pruned. [0m
epoch 0 0.007422103671511082 2.5776326264026403
Trial Id: 83 | Model params: 6304 | Timestamp: 2022-02-18 05:25:12.435049

epoch 0 -2.397109458556357 4.768628506368844
epoch 5 0.011732943744535262 2.572029109976094
epoch 10 0.013606655877977158 2.569589724509512
epoch 15 0.015748456132674393 2.5667984755962694
epoch 20 0.01599862838424715 2.5664722467133814
epoch 25 0.019425558445833713 2.5619992896176895
epoch 30 0.02051676774697364 2.560573362352533
epoch 35 0.018134883801186108 2.563684842488617
epoch 40 0.02087630603115942 2.5601033652042138
epoch 45 0.02115389964421388 2.5597404290781327
epoch 50 0.020931898812756367 2.560030685271948
epoch 55 0.02157055030994981 2.5591955880302026
epoch 60 0.020845233760073967 2.560143987035326
epoch 65 0.021192985002467246 2.5596893233065394
epoch 70 0.0224040668401172 2.558105276245079
epoch 75 0.02212968812294358 2.558464238663966
epoch 80 0.01917944109291625 2.562320791431072
epoch 85 0.021282778058138163 2.559571911194702
epoch 90 0.020256377760443423 2.5609136965892563
epoch 95 0.020478068546204486 2.560623945742127
[32m[I 2022-02-18 05:37:22,262][0m Trial 83 finished with value: 2.5602698717050933 and parameters: {'n_layers_mlp': 4, 'mlp_n_units_l0': 49, 'mlp_dropout_l0': 0.09789138281289325, 'mlp_n_units_l1': 69, 'mlp_dropout_l1': 0.26993899214629646, 'mlp_n_units_l2': 25, 'mlp_dropout_l2': 0.151861129103941, 'mlp_n_units_l3': 10, 'mlp_dropout_l3': 0.29921887628824545, 'lr': 0.00015442697894158642, 'weight_decay': 0.049068516456378886, 'criterion': 'MSELoss', 'batch_size': 256}. Best is trial 16 with value: 2.542146508943635.[0m
Trial Id: 84 | Model params: 6704 | Timestamp: 2022-02-18 05:37:22.263110

[32m[I 2022-02-18 05:37:29,668][0m Trial 84 pruned. [0m
epoch 0 -0.03844640704416036 2.636518143790131
Trial Id: 85 | Model params: 6712 | Timestamp: 2022-02-18 05:37:29.668524

[32m[I 2022-02-18 05:37:37,227][0m Trial 85 pruned. [0m
epoch 0 0.003389856882341502 2.5828630050555414
Trial Id: 86 | Model params: 2772 | Timestamp: 2022-02-18 05:37:37.228056

epoch 0 -2.397109458556357 4.768628506368844
epoch 5 -2.397109458556357 4.768628506368844
epoch 10 -2.397109458556357 4.768628506368844
epoch 15 -2.3775673734745912 4.7548928068262
epoch 20 -1.0564565766837233 3.7102100043007415
epoch 25 -1.0456453924987237 3.7004445120440357
epoch 30 -1.032145797419867 3.6882143399581957
epoch 35 -1.0321476949450612 3.6882160619010818
epoch 40 -1.0317216900719837 3.6878294560526124
epoch 45 -1.0269437605804823 3.6834906333192867
epoch 50 -1.0277055817731773 3.6841827831607583
epoch 55 -1.0292937320849687 3.6856252733494066
epoch 60 -1.0222442625974524 3.6792180426139387
epoch 65 -1.0207982826220792 3.6779024184170295
epoch 70 -1.0285012480514526 3.6849055440289753
epoch 75 -1.0304377478236115 3.6866640138650753
epoch 80 -1.028352900233401 3.684770799795419
epoch 85 -1.0291929665055326 3.685533766444612
epoch 90 -1.0287993752474724 3.6851763178817034
epoch 95 -1.0268648195038454 3.6834189042577203
[32m[I 2022-02-18 05:49:56,766][0m Trial 86 finished with value: 3.6825675068985477 and parameters: {'n_layers_mlp': 4, 'mlp_n_units_l0': 16, 'mlp_dropout_l0': 0.1278583731547055, 'mlp_n_units_l1': 65, 'mlp_dropout_l1': 0.2810731672267144, 'mlp_n_units_l2': 12, 'mlp_dropout_l2': 0.09207496695752442, 'mlp_n_units_l3': 43, 'mlp_dropout_l3': 0.008994286432483546, 'lr': 2.355068020756412e-05, 'weight_decay': 0.01638701624524285, 'criterion': 'PoissonNLLLoss', 'batch_size': 256}. Best is trial 16 with value: 2.542146508943635.[0m
Trial Id: 87 | Model params: 8261 | Timestamp: 2022-02-18 05:49:56.766639

[32m[I 2022-02-18 05:50:04,051][0m Trial 87 pruned. [0m
epoch 0 0.008556392377518374 2.5761593841679296
Trial Id: 88 | Model params: 3868 | Timestamp: 2022-02-18 05:50:04.051865

epoch 0 -2.397109458556357 4.768628506368844
epoch 5 0.017777443935781956 2.564151444146264
epoch 10 0.022094735192504378 2.558509963041926
epoch 15 0.02714338007720185 2.5518969895865373
epoch 20 0.02284950699196875 2.5575224113852
epoch 25 0.029693302649049347 2.548550448528366
epoch 30 0.03131947432371607 2.5464139496009413
epoch 35 0.030822627500148636 2.5470669076503416
epoch 40 0.03128797426380747 2.5464553520745916
epoch 45 0.03012724649329368 2.547980499120229
epoch 50 0.03179072190948329 2.5457944794175464
epoch 55 0.03191660785673767 2.5456289727576595
epoch 60 0.03234808187441651 2.5450616171028866
epoch 65 0.03204346435073291 2.545462179199952
epoch 70 0.031362611988766775 2.5463572500121274
epoch 75 0.03040300424129405 2.5476182478289147
epoch 80 0.032041853392006714 2.5454642973905175
epoch 85 0.03015511616318911 2.5479438902530887
epoch 90 0.03224829681225139 2.545192838144326
epoch 95 0.03136975416144794 2.5463478623109417
[32m[I 2022-02-18 06:02:10,517][0m Trial 88 finished with value: 2.546025980920733 and parameters: {'n_layers_mlp': 4, 'mlp_n_units_l0': 53, 'mlp_dropout_l0': 0.07901850109707612, 'mlp_n_units_l1': 28, 'mlp_dropout_l1': 0.20771972851426734, 'mlp_n_units_l2': 34, 'mlp_dropout_l2': 0.10688702832258232, 'mlp_n_units_l3': 13, 'mlp_dropout_l3': 0.030572739662666413, 'lr': 0.0003344291307862674, 'weight_decay': 0.036975698272496964, 'criterion': 'MSELoss', 'batch_size': 256}. Best is trial 16 with value: 2.542146508943635.[0m
Trial Id: 89 | Model params: 3340 | Timestamp: 2022-02-18 06:02:10.517681

epoch 0 -2.397109458556357 4.768628506368844
epoch 5 -2.353056099726324 4.737608073842462
epoch 10 0.012350569162527192 2.5712252792625154
epoch 15 0.01689573541129641 2.5653020627260865
epoch 20 0.019097441815053795 2.5624278977011303
epoch 25 0.019350201600568995 2.5620977321564538
epoch 30 0.021136949271404637 2.55976259209575
epoch 35 0.022096169807410693 2.5585080863377048
epoch 40 0.02310009672574831 2.557194452714062
epoch 45 0.023343075948592418 2.5568764141107785
epoch 50 0.023795353683492393 2.5562843166422264
epoch 55 0.024171320278358888 2.555792017170668
epoch 60 0.024148088148525537 2.5558224406147647
epoch 65 0.02487960819986401 2.5548643106712805
epoch 70 0.025053030102931473 2.554637113529308
epoch 75 0.025603722875026214 2.553915526124178
epoch 80 0.025128115146587415 2.5545387395980104
epoch 85 0.02564120015789162 2.553866411232635
epoch 90 0.02629307693257832 2.553011959697658
epoch 95 0.026912933920769766 2.552199212966516
[32m[I 2022-02-18 06:14:17,069][0m Trial 89 finished with value: 2.5518646689261595 and parameters: {'n_layers_mlp': 4, 'mlp_n_units_l0': 53, 'mlp_dropout_l0': 0.0782911923447716, 'mlp_n_units_l1': 22, 'mlp_dropout_l1': 0.21195749832802538, 'mlp_n_units_l2': 34, 'mlp_dropout_l2': 0.10774017316781023, 'mlp_n_units_l3': 13, 'mlp_dropout_l3': 0.027694755263478588, 'lr': 4.1933862745282936e-05, 'weight_decay': 0.03765810659000873, 'criterion': 'MSELoss', 'batch_size': 256}. Best is trial 16 with value: 2.542146508943635.[0m
Trial Id: 90 | Model params: 3184 | Timestamp: 2022-02-18 06:14:17.070096

[32m[I 2022-02-18 06:14:24,305][0m Trial 90 pruned. [0m
epoch 0 0.02035690027185355 2.5607823172804753
Trial Id: 91 | Model params: 4606 | Timestamp: 2022-02-18 06:14:24.305464

[32m[I 2022-02-18 06:14:31,916][0m Trial 91 pruned. [0m
epoch 0 -0.11757987698240813 2.735130213820218
Trial Id: 92 | Model params: 2472 | Timestamp: 2022-02-18 06:14:31.916462

[32m[I 2022-02-18 06:14:39,221][0m Trial 92 pruned. [0m
epoch 0 0.003411939080348758 2.582834390251328
Trial Id: 93 | Model params: 6024 | Timestamp: 2022-02-18 06:14:39.221417

[32m[I 2022-02-18 06:14:46,621][0m Trial 93 pruned. [0m
epoch 0 -0.6807991558858222 3.3542592878502484
Trial Id: 94 | Model params: 3309 | Timestamp: 2022-02-18 06:14:46.621236

[32m[I 2022-02-18 06:14:53,915][0m Trial 94 pruned. [0m
epoch 0 0.020383368682100556 2.5607477228987165
Trial Id: 95 | Model params: 4374 | Timestamp: 2022-02-18 06:14:53.916175

[32m[I 2022-02-18 06:15:43,622][0m Trial 95 pruned. [0m
epoch 0 0.0229755119796462 2.5567290222549928
Trial Id: 96 | Model params: 3093 | Timestamp: 2022-02-18 06:15:43.622462

[32m[I 2022-02-18 06:15:50,948][0m Trial 96 pruned. [0m
epoch 0 -2.0894533465508696 4.547571552127182
Trial Id: 97 | Model params: 3102 | Timestamp: 2022-02-18 06:15:50.949057

[32m[I 2022-02-18 06:15:58,264][0m Trial 97 pruned. [0m
epoch 0 0.0019901747498626277 2.584676110603012
Trial Id: 98 | Model params: 2694 | Timestamp: 2022-02-18 06:15:58.264716

epoch 0 -2.397109458556357 4.768628506368844
epoch 5 0.009070826164417012 2.5754909470661693
epoch 10 0.0156493846961423 2.5669276549788256
epoch 15 0.01654221626190222 2.565763255868483
epoch 20 0.01878911092582458 2.5628305949866883
epoch 25 0.01745849451855741 2.564567728735873
epoch 30 0.017496757077854252 2.56451779299291
epoch 35 0.017750229355003255 2.5641869665555257
epoch 40 0.01765162125297215 2.564315672752261
epoch 45 0.019266427375460804 2.562207166313647
epoch 50 0.02056787461276044 2.5605065594804053
epoch 55 0.020607310708359305 2.5604550105290795
epoch 60 0.02148524888888581 2.559307143473824
epoch 65 0.020804171508476466 2.560197668117227
epoch 70 0.02015652937603274 2.561044188166284
epoch 75 0.016759495158820026 2.565479808518494
epoch 80 0.019900183142181005 2.561379175905873
epoch 85 0.02098653634829928 2.559959252182217
epoch 90 0.020557721899668202 2.5605198304465224
epoch 95 0.020605976041565777 2.560456755157742
[32m[I 2022-02-18 06:28:07,359][0m Trial 98 finished with value: 2.5596124920981738 and parameters: {'n_layers_mlp': 4, 'mlp_n_units_l0': 23, 'mlp_dropout_l0': 0.28828314795963195, 'mlp_n_units_l1': 29, 'mlp_dropout_l1': 0.14615342027088352, 'mlp_n_units_l2': 32, 'mlp_dropout_l2': 0.10284106710087708, 'mlp_n_units_l3': 19, 'mlp_dropout_l3': 0.01999783157069574, 'lr': 0.00041314133361733114, 'weight_decay': 0.05938196827220378, 'criterion': 'MSELoss', 'batch_size': 256}. Best is trial 16 with value: 2.542146508943635.[0m
Trial Id: 99 | Model params: 2636 | Timestamp: 2022-02-18 06:28:07.359357

[32m[I 2022-02-18 06:28:13,134][0m Trial 99 pruned. [0m
epoch 0 -0.02355517028177756 2.6175461564592046
Study statistics: 
  Number of finished trials:  100
  Number of pruned trials:  72
  Number of complete trials:  28

Best trial:
  Value:  2.542146508943635
  Params: 
    n_layers_mlp: 4
    mlp_n_units_l0: 43
    mlp_dropout_l0: 0.01048071780205545
    mlp_n_units_l1: 11
    mlp_dropout_l1: 0.2426981625835966
    mlp_n_units_l2: 52
    mlp_dropout_l2: 0.06598424471633312
    mlp_n_units_l3: 16
    mlp_dropout_l3: 0.010507656999217671
    lr: 3.15390633591755e-05
    weight_decay: 0.00714665318674708
    criterion: MSELoss
    batch_size: 256
Target: 67706, NaN: 0, Max: 52.0, Min: 0.0, Mean: 3.995007827962071
Prediction: 67706, NaN: 0, Max: 6.253964424133301, Min: 3.421111822128296, Mean: 3.9491623537306544

 XXXXXX======== TRIAL des - rlbg ended

Test Set - R-squared:  0.030859731504672583
Test Set - RMSE:  2.5464363598376476
Test Set - MAE:  1.963462343544276



