[32m[I 2022-02-26 18:42:49,541][0m A new study created in memory with name: NeuralNetwork[0m
++++++++ Session Characteristics +++++++

Area: des
Gal Type: lrg
Training Samples: 216656
Validation Samples: 54164
Test Samples: 67706
Number of features: 16
Device: cuda:0
Number of Workers: 8
Number of Trials: 25

+++++++++++++++++++++++++++++++++++++++
Trial Id: 0 | Model params: 2571 | Timestamp: 2022-02-26 18:42:49.541728

epoch 0 -1.971004217256556 7.4226906837248405
epoch 5 -1.9919693448724405 7.448834047779671
epoch 10 -2.0099246606946584 7.471151473849669
epoch 15 -2.0138527039661986 7.476024924374711
epoch 20 -1.9839274694234423 7.438816749007572
epoch 25 -1.9682374707621726 7.419233689834434
epoch 30 -1.9579027077284175 7.406306341261042
epoch 35 -2.0294009821371484 7.495284290070603
epoch 40 -2.0530715088396967 7.52450988753568
epoch 45 -1.897702650352242 7.330551311245477
epoch 50 -1.9967909119866953 7.454833540336326
epoch 55 -1.9656007050581281 7.415937604597972
epoch 60 -1.9549305322776869 7.402584384082465
epoch 65 -2.0065765593117493 7.466995035495446
epoch 70 -2.018314505181972 7.48155674759042
epoch 75 -2.0580910512070636 7.530692855180523
epoch 80 -1.9835796631175437 7.4383832024824725
epoch 85 -2.051964478096766 7.523145586212064
epoch 90 -1.981287335248688 7.435525144130962
epoch 95 -2.0235419222044135 7.488032596672735
[32m[I 2022-02-26 18:49:05,391][0m Trial 0 finished with value: 7.543886885929391 and parameters: {'n_layers_mlp': 2, 'mlp_n_units_l0': 40, 'mlp_dropout_l0': 0.11447148849547592, 'mlp_n_units_l1': 45, 'mlp_dropout_l1': 0.09095725075027712, 'lr': 0.006116226846311095, 'weight_decay': 0.2616756757555855, 'criterion': 'PoissonNLLLoss', 'batch_size': 128}. Best is trial 0 with value: 7.543886885929391.[0m
Trial Id: 1 | Model params: 4484 | Timestamp: 2022-02-26 18:49:05.391612

epoch 0 0.0005743447645757405 4.305049044237289
epoch 5 -0.004874677331484278 4.316768985355458
epoch 10 -0.0007443675070177846 4.307888299719338
epoch 15 -0.004150949751050348 4.315214200681725
epoch 20 -6.782282294426345e-05 4.306431897981231
epoch 25 -0.02543282445339279 4.360702554339108
epoch 30 -0.015274064993252123 4.339048482864294
epoch 35 -0.044854353832157745 4.401804347210251
epoch 40 -0.0004925514287077437 4.307346271293954
epoch 45 -0.008841581796727338 4.325281162884455
epoch 50 -0.005918398128727631 4.319010226157547
epoch 55 -0.009127368925879065 4.325893757656005
epoch 60 -0.0006846166981382407 4.307759693623193
epoch 65 -0.0011314364527252874 4.308721323932722
epoch 70 -0.004902520285274603 4.316828789214358
epoch 75 -0.0001746892142178158 4.306661982647425
epoch 80 -0.0005772210452290594 4.307528528343664
epoch 85 -0.00029494869595514395 4.3069208881047345
epoch 90 -0.0001679587107541458 4.30664749215268
epoch 95 -0.006247929731936663 4.319717606509771
[32m[I 2022-02-26 18:53:36,029][0m Trial 1 finished with value: 4.331534995156353 and parameters: {'n_layers_mlp': 4, 'mlp_n_units_l0': 29, 'mlp_dropout_l0': 0.1313124997597805, 'mlp_n_units_l1': 23, 'mlp_dropout_l1': 0.07801471078845239, 'mlp_n_units_l2': 52, 'mlp_dropout_l2': 0.03218450515493536, 'mlp_n_units_l3': 38, 'mlp_dropout_l3': 0.08424225484713725, 'lr': 0.0076411758832024435, 'weight_decay': 0.20686259809620416, 'criterion': 'MSELoss', 'batch_size': 256}. Best is trial 1 with value: 4.331534995156353.[0m
Trial Id: 2 | Model params: 6547 | Timestamp: 2022-02-26 18:53:36.029640

epoch 0 -3.582312501986956 9.218326386669025
epoch 5 0.007223819294553846 4.290771658755534
epoch 10 0.007382721571244311 4.290428257753738
epoch 15 0.005855829711664207 4.293726861750008
epoch 20 0.0064055354195996506 4.292539603100145
epoch 25 0.005331379473524023 4.294859267509836
epoch 30 0.007261334839423483 4.290690587029319
epoch 35 0.005115438823675045 4.295325445064596
epoch 40 0.006631748426039974 4.292050931112415
epoch 45 0.0072409732498577295 4.290734588958418
epoch 50 0.007351605168782083 4.290495505044847
epoch 55 0.007420803430202461 4.290345955614506
epoch 60 0.007376530857030494 4.290441636915254
epoch 65 0.007287046120515117 4.290635023631852
epoch 70 0.006054112061850692 4.293298647847839
epoch 75 0.007359091161907805 4.29047932676834
epoch 80 0.004640110741632952 4.296351415854558
epoch 85 0.007291890005456714 4.290624555667446
epoch 90 0.005291427933836634 4.294945519611291
epoch 95 0.0072297566461253515 4.290758828140519
[32m[I 2022-02-26 18:59:34,853][0m Trial 2 finished with value: 4.292643419658143 and parameters: {'n_layers_mlp': 2, 'mlp_n_units_l0': 68, 'mlp_dropout_l0': 0.03449237456229952, 'mlp_n_units_l1': 77, 'mlp_dropout_l1': 0.1293544437367257, 'lr': 0.0003189105657769417, 'weight_decay': 0.20027855686632265, 'criterion': 'MSELoss', 'batch_size': 128}. Best is trial 2 with value: 4.292643419658143.[0m
Trial Id: 3 | Model params: 2227 | Timestamp: 2022-02-26 18:59:34.853875

epoch 0 0.004585602388500365 4.296401065879653
epoch 5 -0.0021457912345317354 4.31090358762194
epoch 10 -0.0028208052542446627 4.312355188048683
epoch 15 -6.681713338840822e-06 4.3063002548850635
epoch 20 -0.0010319523394650698 4.308507236174602
epoch 25 -0.0009187515014401626 4.308263617368056
epoch 30 -0.0016219951371498897 4.309776840582457
epoch 35 -0.0014476576384572226 4.3094017547640835
epoch 40 -4.4692359009834703e-05 4.306382096187091
epoch 45 -0.0017344498434765931 4.3100187687193685
epoch 50 -0.002697661310291588 4.312090406581037
epoch 55 -0.0003856267009543224 4.307116097599658
epoch 60 -0.00028850329961671584 4.306907012268974
epoch 65 -0.003946248383827289 4.3147743388913185
epoch 70 -0.0004718641989871486 4.307301739466959
epoch 75 -0.0008540162983123878 4.30812429495573
epoch 80 -0.00010672378591625176 4.30651565366005
epoch 85 -6.08067951159974e-05 4.3064167919562495
epoch 90 -1.3220792374202261e-06 4.30628871484986
epoch 95 -2.0302590491017014e-06 4.306290239660939
[32m[I 2022-02-26 19:04:07,633][0m Trial 3 finished with value: 4.313658368409283 and parameters: {'n_layers_mlp': 4, 'mlp_n_units_l0': 16, 'mlp_dropout_l0': 0.08961052362570739, 'mlp_n_units_l1': 35, 'mlp_dropout_l1': 0.016198229888761493, 'mlp_n_units_l2': 25, 'mlp_dropout_l2': 0.13607332592588972, 'mlp_n_units_l3': 17, 'mlp_dropout_l3': 0.20559715974840578, 'lr': 0.0025814745438767577, 'weight_decay': 0.1086603976368108, 'criterion': 'MSELoss', 'batch_size': 256}. Best is trial 2 with value: 4.292643419658143.[0m
Trial Id: 4 | Model params: 3509 | Timestamp: 2022-02-26 19:04:07.633451

epoch 0 -3.582312501986956 9.218326386669025
epoch 5 -2.0095741262297095 7.47071641772153
epoch 10 -1.9824427479711777 7.43696584191757
epoch 15 -1.9855997423007858 7.440900913119279
epoch 20 -1.9819253718443983 7.436320754016272
epoch 25 -1.9714936877043479 7.423302099569161
epoch 30 -1.9971450796648411 7.455274042053004
epoch 35 -1.983649202973576 7.438469887126661
epoch 40 -1.9749240157356058 7.427585638270536
epoch 45 -1.966110399140212 7.416574861175998
epoch 50 -1.9763975051757465 7.429424864091714
epoch 55 -1.9770254390459585 7.430208519747798
epoch 60 -1.9831956880021475 7.43790454156657
epoch 65 -1.992357452824979 7.449317150654879
epoch 70 -1.9751984451664604 7.427928218632684
epoch 75 -1.9878459727378428 7.443699485772009
epoch 80 -1.9831084987433174 7.4377958477042565
epoch 85 -1.9726876884147333 7.424793359305601
epoch 90 -1.9838299284402563 7.43869516504874
epoch 95 -1.995365301259139 7.453060150865503
[32m[I 2022-02-26 19:24:09,155][0m Trial 4 finished with value: 7.442335203374976 and parameters: {'n_layers_mlp': 2, 'mlp_n_units_l0': 44, 'mlp_dropout_l0': 0.18841728494730192, 'mlp_n_units_l1': 60, 'mlp_dropout_l1': 0.2901918597181615, 'lr': 6.461703210236013e-05, 'weight_decay': 0.08938900930871327, 'criterion': 'PoissonNLLLoss', 'batch_size': 32}. Best is trial 2 with value: 4.292643419658143.[0m
Trial Id: 5 | Model params: 12214 | Timestamp: 2022-02-26 19:24:09.156049

epoch 0 -1.9903362417157062 7.446683037175739
epoch 5 -1.9656544927269453 7.41588750485222
epoch 10 -1.9615674359541933 7.410775715360987
epoch 15 -1.966530644335899 7.416982872159276
epoch 20 -1.993279901574073 7.450347359216947
epoch 25 -1.9737231357157277 7.425968838526313
epoch 30 -1.9730108703825677 7.425079452277852
epoch 35 -1.975938995021835 7.428735040559981
epoch 40 -1.9816120534139108 7.435812400370671
epoch 45 -1.9849053453532681 7.439917820910573
epoch 50 -1.9878271360960587 7.443558232170338
epoch 55 -1.964147496851084 7.414003075629761
epoch 60 -1.9780642125096342 7.43138712113451
epoch 65 -1.984344080832702 7.439218308239198
epoch 70 -1.9930261807710035 7.450031593863179
epoch 75 -1.9957651238693908 7.453439607237359
epoch 80 -1.9830033263024878 7.4375470387935945
epoch 85 -1.9745940815512961 7.427056220042563
epoch 90 -1.97524967356203 7.42787462590438
epoch 95 -1.994509339498808 7.451877252768337
[32m[I 2022-02-26 19:28:46,748][0m Trial 5 finished with value: 7.432414080875244 and parameters: {'n_layers_mlp': 4, 'mlp_n_units_l0': 32, 'mlp_dropout_l0': 0.13745544401512597, 'mlp_n_units_l1': 76, 'mlp_dropout_l1': 0.056511500008238055, 'mlp_n_units_l2': 79, 'mlp_dropout_l2': 0.18479110786134123, 'mlp_n_units_l3': 38, 'mlp_dropout_l3': 0.1079334608700646, 'lr': 0.0020208493826509655, 'weight_decay': 0.050398349233225205, 'criterion': 'PoissonNLLLoss', 'batch_size': 256}. Best is trial 2 with value: 4.292643419658143.[0m
Trial Id: 6 | Model params: 4414 | Timestamp: 2022-02-26 19:28:46.748440

epoch 0 -2.0876156680433526 7.56695841104598
epoch 5 -2.009596107686113 7.470743700140985
epoch 10 -1.9963073086199743 7.454232008871247
epoch 15 -1.9929175503752266 7.450014284792503
epoch 20 -1.992334219612935 7.449288231666488
epoch 25 -1.9873191016481755 7.443043152914821
epoch 30 -1.9918378617556725 7.448670375200809
epoch 35 -1.993028536687917 7.4501524178910055
epoch 40 -1.9932795960018983 7.450464875809507
epoch 45 -1.9919327213396074 7.448788458500221
epoch 50 -1.9946045630730582 7.45211365737817
epoch 55 -1.9894219701413678 7.445662388914943
epoch 60 -1.992440344445174 7.449420327113825
epoch 65 -1.9932656825874657 7.450447560098985
epoch 70 -1.9940707081889024 7.451449375248007
epoch 75 -1.9905039720909339 7.447009721686744
epoch 80 -1.9933962204636777 7.45061001727806
epoch 85 -1.9914026618135958 7.448128604730758
epoch 90 -1.9926688584649606 7.449704754586201
epoch 95 -1.986784349785529 7.442376943649818
[32m[I 2022-02-26 19:53:59,926][0m Trial 6 finished with value: 7.452140704057617 and parameters: {'n_layers_mlp': 4, 'mlp_n_units_l0': 62, 'mlp_dropout_l0': 0.058165578826987425, 'mlp_n_units_l1': 28, 'mlp_dropout_l1': 0.23269789740802507, 'mlp_n_units_l2': 27, 'mlp_dropout_l2': 0.1707230953827756, 'mlp_n_units_l3': 28, 'mlp_dropout_l3': 0.261738401339877, 'lr': 4.81030925754967e-05, 'weight_decay': 0.13326042077653882, 'criterion': 'PoissonNLLLoss', 'batch_size': 32}. Best is trial 2 with value: 4.292643419658143.[0m
Trial Id: 7 | Model params: 2168 | Timestamp: 2022-02-26 19:53:59.927243

epoch 0 -1.9975187907567622 7.455620842647265
epoch 5 -1.9954886708705537 7.453095692880751
epoch 10 -1.9871581844767348 7.44272490767588
epoch 15 -2.00728474883083 7.467756224777255
epoch 20 -1.9749681560324492 7.427523205584942
epoch 25 -2.009964298041542 7.471082442042928
epoch 30 -1.9663878100691705 7.41680431137745
epoch 35 -2.003147657111735 7.4626177979656
epoch 40 -2.005455875215305 7.465485129660507
epoch 45 -1.9762085074166205 7.4290714202448696
epoch 50 -1.986624484316756 7.442060001322278
epoch 55 -1.9855555532733602 7.440728102899579
epoch 60 -1.9932101224407721 7.45026051772058
epoch 65 -1.9934808299449513 7.4505974128513515
epoch 70 -1.9811760292133243 7.435268682301226
epoch 75 -1.975433508325048 7.428104099163626
epoch 80 -1.9984152631575176 7.456735641106723
epoch 85 -1.9948751729063359 7.452332429573933
epoch 90 -1.987949562969241 7.443710731324958
epoch 95 -1.9815216660745398 7.435699691476848
[32m[I 2022-02-26 19:57:53,988][0m Trial 7 finished with value: 7.4412127604074385 and parameters: {'n_layers_mlp': 2, 'mlp_n_units_l0': 69, 'mlp_dropout_l0': 0.26012056669752875, 'mlp_n_units_l1': 14, 'mlp_dropout_l1': 0.22045791452967833, 'lr': 0.005093129423909791, 'weight_decay': 0.1103118100656099, 'criterion': 'PoissonNLLLoss', 'batch_size': 256}. Best is trial 2 with value: 4.292643419658143.[0m
Trial Id: 8 | Model params: 6026 | Timestamp: 2022-02-26 19:57:53.988983

epoch 0 -2.095655679300972 7.576804014207042
epoch 5 -1.995153906497357 7.452797150276987
epoch 10 -1.9962304926755006 7.4541364566659665
epoch 15 -1.9846385742908366 7.439703074787196
epoch 20 -1.987716856346382 7.443538648498441
epoch 25 -1.9841183765602914 7.439054707287061
epoch 30 -1.9810087522020945 7.43517773386701
epoch 35 -1.9848894166304345 7.440015701135345
epoch 40 -1.9836107230862368 7.438421920293658
epoch 45 -1.9812874197177548 7.435525249466643
epoch 50 -1.9788854135623208 7.432529265884097
epoch 55 -1.9774582378654788 7.4307486005554795
epoch 60 -1.9840700258119948 7.438994440690147
epoch 65 -1.982662029739732 7.437239235438542
epoch 70 -1.9791838711089698 7.432901592875843
epoch 75 -1.9740411218569252 7.426483382131821
epoch 80 -1.9769167186593744 7.430072843628353
epoch 85 -1.9815930725647553 7.435906398764464
epoch 90 -1.9764867323714403 7.42953622384406
epoch 95 -1.9806208634420321 7.434693985589986
[32m[I 2022-02-26 20:05:23,656][0m Trial 8 finished with value: 7.4242355837553315 and parameters: {'n_layers_mlp': 4, 'mlp_n_units_l0': 67, 'mlp_dropout_l0': 0.006059190475328302, 'mlp_n_units_l1': 38, 'mlp_dropout_l1': 0.2955449310255326, 'mlp_n_units_l2': 33, 'mlp_dropout_l2': 0.13588730102789195, 'mlp_n_units_l3': 29, 'mlp_dropout_l3': 0.16587146758118207, 'lr': 9.389307205211093e-05, 'weight_decay': 0.027297944109889203, 'criterion': 'PoissonNLLLoss', 'batch_size': 128}. Best is trial 2 with value: 4.292643419658143.[0m
Trial Id: 9 | Model params: 2100 | Timestamp: 2022-02-26 20:05:23.657157

[32m[I 2022-02-26 20:05:25,884][0m Trial 9 pruned. [0m
epoch 0 0.006180038186563874 4.292958740220024
Trial Id: 10 | Model params: 7407 | Timestamp: 2022-02-26 20:05:25.884965

epoch 0 -2.8807746387231683 8.483380385525788
epoch 5 0.004032593773744764 4.297662352866291
epoch 10 0.006290916206436181 4.292787185660671
epoch 15 0.006473451698800092 4.29239289420099
epoch 20 0.006339879502997636 4.29268142452559
epoch 25 0.006666260651699729 4.291976371896004
epoch 30 0.006691929162813581 4.291920917545387
epoch 35 0.006710898934264464 4.2918799347174
epoch 40 0.00681225907626315 4.291660946782384
epoch 45 0.0069565027142275415 4.2913492900631
epoch 50 0.006796221867319763 4.291695595813301
epoch 55 0.0070684281008723815 4.291107445438726
epoch 60 0.006842991615111482 4.291594547122149
epoch 65 0.0068491386432589785 4.291581265942499
epoch 70 0.007170475059040449 4.2908869339120885
epoch 75 0.0072076532127580695 4.290806593459132
epoch 80 0.007218609807506882 4.2907829164239235
epoch 85 0.007139833034064402 4.290953148930288
epoch 90 0.007131966743232465 4.290970147204406
epoch 95 0.007348799153620855 4.29050156921973
[32m[I 2022-02-26 20:11:24,947][0m Trial 10 finished with value: 4.290564541936973 and parameters: {'n_layers_mlp': 2, 'mlp_n_units_l0': 78, 'mlp_dropout_l0': 0.010925541766399788, 'mlp_n_units_l1': 76, 'mlp_dropout_l1': 0.1387143455940646, 'lr': 1.1627525911824381e-05, 'weight_decay': 0.18666810107274684, 'criterion': 'MSELoss', 'batch_size': 128}. Best is trial 10 with value: 4.290564541936973.[0m
Trial Id: 11 | Model params: 7824 | Timestamp: 2022-02-26 20:11:24.947324

epoch 0 -2.714843425164726 8.300036186567008
epoch 5 0.003111317896447696 4.299649575264974
epoch 10 0.004761978735907779 4.296088393523192
epoch 15 0.005750918391125515 4.293953412729731
epoch 20 0.006000531346546545 4.293414365873978
epoch 25 0.005937075129463509 4.29355140794221
epoch 30 0.006347354740678046 4.292665277719642
epoch 35 0.006540946348272292 4.292247091114583
epoch 40 0.006553882156689506 4.292219146396284
epoch 45 0.006762865307233801 4.291767663098593
epoch 50 0.006737488287326898 4.291822489672206
epoch 55 0.006827875387811155 4.291627206848287
epoch 60 0.006962371516604171 4.291336609290208
epoch 65 0.00697561104679878 4.2913080023833015
epoch 70 0.007012966969504375 4.291227285696247
epoch 75 0.007098857106256351 4.291041693107119
epoch 80 0.007096718559659987 4.291046314205469
epoch 85 0.007172789898016618 4.290881931684688
epoch 90 0.006947759623361804 4.291368181266909
epoch 95 0.007234444396394757 4.290748697886449
[32m[I 2022-02-26 20:17:26,685][0m Trial 11 finished with value: 4.290845573902273 and parameters: {'n_layers_mlp': 2, 'mlp_n_units_l0': 79, 'mlp_dropout_l0': 0.004431900465075661, 'mlp_n_units_l1': 80, 'mlp_dropout_l1': 0.13574439551674164, 'lr': 1.1476320971875451e-05, 'weight_decay': 0.1992700620140351, 'criterion': 'MSELoss', 'batch_size': 128}. Best is trial 10 with value: 4.290564541936973.[0m
Trial Id: 12 | Model params: 7921 | Timestamp: 2022-02-26 20:17:26.685384

epoch 0 -2.673160745970637 8.253339236194774
epoch 5 0.004078849795690731 4.29756255287732
epoch 10 0.00635842133902309 4.29264137332259
epoch 15 0.006097451959510725 4.293205044586998
epoch 20 0.006296932614903716 4.2927741903078624
epoch 25 0.006569210434445583 4.2921860330850174
epoch 30 0.0066098141482571204 4.292098316620031
epoch 35 0.0064983651955444754 4.292339076219489
epoch 40 0.006907241259565655 4.291455728244032
epoch 45 0.006534152148079286 4.292261768285247
epoch 50 0.00685998997210302 4.291557820618834
epoch 55 0.007046254803122043 4.291155357840031
epoch 60 0.00693390500962332 4.291398116772198
epoch 65 0.007124148835385258 4.290987040860977
epoch 70 0.007049139451614894 4.291149124677667
epoch 75 0.007140873619138732 4.290950900324129
epoch 80 0.007246483288227634 4.290722681665516
epoch 85 0.007191012640092698 4.290842553234582
epoch 90 0.0072216352423701835 4.290776378482014
epoch 95 0.007303357950885991 4.290599772556543
[32m[I 2022-02-26 20:23:27,875][0m Trial 12 finished with value: 4.290829306196582 and parameters: {'n_layers_mlp': 2, 'mlp_n_units_l0': 80, 'mlp_dropout_l0': 0.0022240905961136426, 'mlp_n_units_l1': 80, 'mlp_dropout_l1': 0.16149558447386703, 'lr': 1.042302876117692e-05, 'weight_decay': 0.19135466117754624, 'criterion': 'MSELoss', 'batch_size': 128}. Best is trial 10 with value: 4.290564541936973.[0m
Trial Id: 13 | Model params: 6609 | Timestamp: 2022-02-26 20:23:27.875935

[32m[I 2022-02-26 20:23:31,432][0m Trial 13 pruned. [0m
epoch 0 -1.9458251727955904 7.391170376952944
Trial Id: 14 | Model params: 5100 | Timestamp: 2022-02-26 20:23:31.432482

epoch 0 -3.582312501986956 9.218326386669025
epoch 5 -3.582312501986956 9.218326386669025
epoch 10 0.0026235505675920034 4.300701333676249
epoch 15 0.005843480217887276 4.29375353051198
epoch 20 0.005938201686745748 4.293548975031348
epoch 25 0.006267345300129734 4.292838098088752
epoch 30 0.00652707239748429 4.292277062262758
epoch 35 0.006671514698224024 4.291965021091906
epoch 40 0.006687655436755646 4.291930150569397
epoch 45 0.0068127609476235085 4.291659862464737
epoch 50 0.006702603127541562 4.2918978572598085
epoch 55 0.006921008391872485 4.291425982158865
epoch 60 0.006833319129741056 4.291615445270204
epoch 65 0.0064135040404549315 4.292522389996406
epoch 70 0.006518287257768707 4.292296040218412
epoch 75 0.0068975785189359096 4.291476606013199
epoch 80 0.007022253832640324 4.291207218901646
epoch 85 0.007015263388742032 4.291222323666401
epoch 90 0.006792177069353866 4.291704334716799
epoch 95 0.006988151341857152 4.291280906151309
[32m[I 2022-02-26 20:29:30,890][0m Trial 14 finished with value: 4.291380299238912 and parameters: {'n_layers_mlp': 2, 'mlp_n_units_l0': 57, 'mlp_dropout_l0': 0.0014815733653663061, 'mlp_n_units_l1': 70, 'mlp_dropout_l1': 0.12086927996007207, 'lr': 1.9277553266187423e-05, 'weight_decay': 0.26074459334950667, 'criterion': 'MSELoss', 'batch_size': 128}. Best is trial 10 with value: 4.290564541936973.[0m
Trial Id: 15 | Model params: 3693 | Timestamp: 2022-02-26 20:29:30.891149

epoch 0 -3.582312501986956 9.218326386669025
epoch 5 0.006930153467524569 4.291406222650334
epoch 10 0.0066479694601574435 4.29201588781971
epoch 15 0.0049333382050466 4.295718528675766
epoch 20 0.006934815425598928 4.291396149653233
epoch 25 0.006668457912732295 4.291971624952818
epoch 30 0.0055373677501427965 4.294414528202449
epoch 35 0.006857351515201726 4.291563521266636
epoch 40 0.00688148598414573 4.291511376070809
epoch 45 0.006443349447095459 4.292457919998657
epoch 50 0.00608661874085803 4.293228441801507
epoch 55 0.006818168501777633 4.291648179161834
epoch 60 0.002752564737236285 4.300423169219926
epoch 65 0.007023074309460586 4.291205446033727
epoch 70 0.006760484599581673 4.291772806602414
epoch 75 0.006779956403511811 4.291730737712238
epoch 80 0.00560675301266067 4.294264711473612
epoch 85 0.006367863131214735 4.2926209784815565
epoch 90 0.007004135454537819 4.291246368500188
epoch 95 0.006872659295873995 4.291530447182882
