[32m[I 2022-02-17 01:43:59,752][0m Trial 72 pruned. [0m
epoch 0 -0.08598130862005515 7.511914493051756
Trial Id: 73 | Model params: 9269 | Timestamp: 2022-02-17 01:43:59.752609

epoch 0 -18.61379064900279 31.924215095733725
epoch 5 -0.131478091684871 7.667654493285351
epoch 10 -0.02297442422369822 7.290743989616741
epoch 15 -0.006062852285827258 7.23022840983416
epoch 20 0.008077941707225422 7.179236077628756
epoch 25 0.011600499024716937 7.166477130282161
epoch 30 0.01131675310027247 7.167505718802241
epoch 35 0.011453527833784727 7.167009924221435
epoch 40 0.014830606938795565 7.154757457282789
epoch 45 0.018583356188444866 7.141117351714943
epoch 50 0.020161029826701093 7.1353752012704215
epoch 55 0.02124242146180022 7.131436663699669
epoch 60 0.02183286413454244 7.1292852935122255
epoch 65 0.019818803030495213 7.1366211730501385
epoch 70 0.02351724916096465 7.123144402555179
epoch 75 0.02240809273722777 7.127188733652248
epoch 80 0.02186588538219103 7.129164956264397
epoch 85 0.023216045490454307 7.124242912392112
epoch 90 0.022917158909475654 7.125332804241661
epoch 95 0.02335114758091117 7.123750207024739
[32m[I 2022-02-17 01:52:24,778][0m Trial 73 finished with value: 7.1199040162408425 and parameters: {'n_layers_mlp': 4, 'mlp_n_units_l0': 56, 'mlp_dropout_l0': 0.2888545913755027, 'mlp_n_units_l1': 50, 'mlp_dropout_l1': 0.1972216269674268, 'mlp_n_units_l2': 46, 'mlp_dropout_l2': 0.1527045799530963, 'mlp_n_units_l3': 65, 'mlp_dropout_l3': 0.17778674588607257, 'lr': 2.8110373030912742e-05, 'weight_decay': 0.18982460769349277, 'criterion': 'MSELoss', 'batch_size': 256}. Best is trial 4 with value: 7.0801956527286.[0m
Trial Id: 74 | Model params: 9508 | Timestamp: 2022-02-17 01:52:24.779114

[32m[I 2022-02-17 01:52:30,018][0m Trial 74 pruned. [0m
epoch 0 -17.628614088729652 31.11212919087043
Trial Id: 75 | Model params: 8772 | Timestamp: 2022-02-17 01:52:30.018179

[32m[I 2022-02-17 01:52:35,094][0m Trial 75 pruned. [0m
epoch 0 -16.968575644490844 30.555984896710235
Trial Id: 76 | Model params: 7980 | Timestamp: 2022-02-17 01:52:35.094222

[32m[I 2022-02-17 01:52:40,249][0m Trial 76 pruned. [0m
epoch 0 -14.195126798722738 28.09904920378652
Trial Id: 77 | Model params: 9425 | Timestamp: 2022-02-17 01:52:40.250122

[32m[I 2022-02-17 01:52:45,281][0m Trial 77 pruned. [0m
epoch 0 -0.052779361781142065 7.396191408300034
Trial Id: 78 | Model params: 9086 | Timestamp: 2022-02-17 01:52:45.281218

epoch 0 -18.61379064900279 31.924215095733725
epoch 5 -18.61379064900279 31.924215095733725
epoch 10 -18.61379064900279 31.924215095733725
epoch 15 -18.61379064900279 31.924215095733725
epoch 20 -0.1257692091038134 7.64828642313566
epoch 25 -0.05265123373120595 7.395741319491362
epoch 30 -0.020288906256636485 7.281167850462911
epoch 35 -0.008229816330839634 7.238010834850536
epoch 40 -0.002985785988762535 7.219163032757474
epoch 45 -0.003650225691363973 7.221553846496427
epoch 50 0.0008477494321300627 7.2053535588462445
epoch 55 0.003294529884958819 7.196525712662552
epoch 60 0.008700375717301312 7.176983228274934
epoch 65 0.008897829544470381 7.176268412417895
epoch 70 0.01033220170769289 7.171073606602245
epoch 75 0.010717891135009872 7.169676129186214
epoch 80 0.012216409711839571 7.16424392514404
epoch 85 0.014046553547745422 7.157603970886765
epoch 90 0.012063278483115059 7.164799222362429
epoch 95 0.015778026815728707 7.151316328291917
[32m[I 2022-02-17 02:01:10,718][0m Trial 78 finished with value: 7.148650248681741 and parameters: {'n_layers_mlp': 4, 'mlp_n_units_l0': 56, 'mlp_dropout_l0': 0.2854600536310623, 'mlp_n_units_l1': 57, 'mlp_dropout_l1': 0.18494296374115257, 'mlp_n_units_l2': 38, 'mlp_dropout_l2': 0.1912556127693013, 'mlp_n_units_l3': 67, 'mlp_dropout_l3': 0.2281125640552204, 'lr': 1.1402210345654625e-05, 'weight_decay': 0.19676274998232934, 'criterion': 'MSELoss', 'batch_size': 256}. Best is trial 4 with value: 7.0801956527286.[0m
Trial Id: 79 | Model params: 9133 | Timestamp: 2022-02-17 02:01:10.718833

[32m[I 2022-02-17 02:01:15,735][0m Trial 79 pruned. [0m
epoch 0 -18.144618685991254 31.540082202936958
Trial Id: 80 | Model params: 12822 | Timestamp: 2022-02-17 02:01:15.735251

epoch 0 -18.61379064900279 31.924215095733725
epoch 5 -18.61379064900279 31.924215095733725
epoch 10 0.01191470002904349 7.16533796879601
epoch 15 0.01733570482323399 7.145655075330964
epoch 20 0.02042898643073865 7.134399478881213
epoch 25 0.018227701565849408 7.14241116579381
epoch 30 0.023473635372436408 7.123303475434099
epoch 35 0.02265627625902844 7.126283978269593
epoch 40 0.024809166369580082 7.118430771595778
epoch 45 0.023283850368233883 7.123995638263039
epoch 50 0.025122170011869116 7.117288290813187
epoch 55 0.025082317366860618 7.117433765382517
epoch 60 0.02517894381173147 7.117081043621925
epoch 65 0.027527924464809672 7.108501023319508
epoch 70 0.027998282762035198 7.106781721082344
epoch 75 0.028404834042045635 7.105295317645279
epoch 80 0.02861828809133904 7.104514777859067
epoch 85 0.028747718388491217 7.104041446891307
epoch 90 0.029217054244252916 7.10232480522961
epoch 95 0.028137741140875083 7.106271878459537
[32m[I 2022-02-17 02:09:43,455][0m Trial 80 finished with value: 7.099862100539842 and parameters: {'n_layers_mlp': 4, 'mlp_n_units_l0': 44, 'mlp_dropout_l0': 0.1461011450249047, 'mlp_n_units_l1': 53, 'mlp_dropout_l1': 0.16632767970097767, 'mlp_n_units_l2': 77, 'mlp_dropout_l2': 0.12432016266746046, 'mlp_n_units_l3': 70, 'mlp_dropout_l3': 0.14526858996492162, 'lr': 9.592735544746098e-05, 'weight_decay': 0.16998779630717983, 'criterion': 'MSELoss', 'batch_size': 256}. Best is trial 4 with value: 7.0801956527286.[0m
Trial Id: 81 | Model params: 12813 | Timestamp: 2022-02-17 02:09:43.455953

epoch 0 -18.61379064900279 31.924215095733725
epoch 5 0.0013585604573620458 7.2035114749321085
epoch 10 0.014331769845679854 7.156568621310185
epoch 15 0.019043467667021696 7.139443192590387
epoch 20 0.021147828179885364 7.131781268796636
epoch 25 0.023026128051470862 7.124935466872292
epoch 30 0.023758682579920865 7.1222637564707405
epoch 35 0.0252543635373218 7.116805721972661
epoch 40 0.025413417637140667 7.116225055968173
epoch 45 0.025914029653715254 7.1143971396817465
epoch 50 0.026825660445991883 7.111067237663647
epoch 55 0.02670458244541052 7.111509587502498
epoch 60 0.0273756217836012 7.109057646695389
epoch 65 0.02754985211524874 7.108420880347702
epoch 70 0.028001665777482754 7.106769353628234
epoch 75 0.027900489023953035 7.107139221104062
epoch 80 0.02667646998961115 7.111612290418661
epoch 85 0.027301847590373796 7.109327254911757
epoch 90 0.028768905075427176 7.10396396345792
epoch 95 0.028752642799175998 7.104023437532352
[32m[I 2022-02-17 02:18:10,095][0m Trial 81 finished with value: 7.110082094321409 and parameters: {'n_layers_mlp': 4, 'mlp_n_units_l0': 45, 'mlp_dropout_l0': 0.11136622169086997, 'mlp_n_units_l1': 53, 'mlp_dropout_l1': 0.15368353138102314, 'mlp_n_units_l2': 77, 'mlp_dropout_l2': 0.1281041826132597, 'mlp_n_units_l3': 69, 'mlp_dropout_l3': 0.14938986850563815, 'lr': 9.503822868895996e-05, 'weight_decay': 0.1811097312954415, 'criterion': 'MSELoss', 'batch_size': 256}. Best is trial 4 with value: 7.0801956527286.[0m
Trial Id: 82 | Model params: 13324 | Timestamp: 2022-02-17 02:18:10.096188

epoch 0 -18.61379064900279 31.924215095733725
epoch 5 -0.021363201706500634 7.285000131439439
epoch 10 0.016934177151538665 7.147114823703051
epoch 15 0.01991635476989262 7.136266030993855
epoch 20 0.023956827757894428 7.121540926054361
epoch 25 0.024964484058905723 7.117863876272767
epoch 30 0.02258088223568222 7.126558840043558
epoch 35 0.025000402348204553 7.117732771382601
epoch 40 0.02694888140468843 7.110617030426811
epoch 45 0.025948659356730297 7.1142706766911665
epoch 50 0.026797693589999838 7.1111694150210445
epoch 55 0.027850167864388542 7.107323170820389
epoch 60 0.02776863189119283 7.107621216626663
epoch 65 0.026516728775172083 7.112195843030961
epoch 70 0.028855946168770297 7.103645630031386
epoch 75 0.02994877192956724 7.099647648437932
epoch 80 0.03070399722781958 7.09688342456669
epoch 85 0.027444221834582727 7.108806938237234
epoch 90 0.031672463446336674 7.0933371345304215
epoch 95 0.03051743010461394 7.097566384887663
[32m[I 2022-02-17 02:26:35,148][0m Trial 82 finished with value: 7.100444458634265 and parameters: {'n_layers_mlp': 4, 'mlp_n_units_l0': 45, 'mlp_dropout_l0': 0.11993458295293, 'mlp_n_units_l1': 60, 'mlp_dropout_l1': 0.15604821112377576, 'mlp_n_units_l2': 78, 'mlp_dropout_l2': 0.12527244684850722, 'mlp_n_units_l3': 63, 'mlp_dropout_l3': 0.14495945759937584, 'lr': 0.00013812441916035128, 'weight_decay': 0.15303685057543343, 'criterion': 'MSELoss', 'batch_size': 256}. Best is trial 4 with value: 7.0801956527286.[0m
Trial Id: 83 | Model params: 13280 | Timestamp: 2022-02-17 02:26:35.148612

[32m[I 2022-02-17 02:26:40,314][0m Trial 83 pruned. [0m
epoch 0 -0.006372140431040396 7.231339698303014
Trial Id: 84 | Model params: 13900 | Timestamp: 2022-02-17 02:26:40.314750

[32m[I 2022-02-17 02:26:45,443][0m Trial 84 pruned. [0m
epoch 0 -0.010051412856163733 7.244546440741837
Trial Id: 85 | Model params: 14781 | Timestamp: 2022-02-17 02:26:45.443385

[32m[I 2022-02-17 02:26:50,439][0m Trial 85 pruned. [0m
epoch 0 -0.039778874446391166 7.350382766648514
Trial Id: 86 | Model params: 12253 | Timestamp: 2022-02-17 02:26:50.440157

epoch 0 -18.61379064900279 31.924215095733725
epoch 5 -18.61379064900279 31.924215095733725
epoch 10 -0.0013261001702542519 7.2131876224479194
epoch 15 0.016047405670284953 7.150337613487161
epoch 20 0.018389349299813618 7.141823146499631
epoch 25 0.01766661623557897 7.144451827219812
epoch 30 0.021369728700683988 7.130972854757131
epoch 35 0.023073534408469487 7.124762600769339
epoch 40 0.023810909576525652 7.1220732403486
epoch 45 0.024364971384349454 7.120051793429929
epoch 50 0.024498468913590754 7.1195646533561705
epoch 55 0.02570972182466258 7.115143198484585
epoch 60 0.023296668591401004 7.123948891178138
epoch 65 0.025528576712915307 7.115804609942605
epoch 70 0.022954663579844214 7.1251960523659275
epoch 75 0.027670355355693954 7.107980439112481
epoch 80 0.028434763778731553 7.105185878414238
epoch 85 0.02396306539352755 7.12151817006893
epoch 90 0.02729681999855904 7.109345627903029
epoch 95 0.025983373807915933 7.114143901955431
[32m[I 2022-02-17 02:35:18,035][0m Trial 86 finished with value: 7.1070673601944465 and parameters: {'n_layers_mlp': 4, 'mlp_n_units_l0': 44, 'mlp_dropout_l0': 0.12097339974960356, 'mlp_n_units_l1': 54, 'mlp_dropout_l1': 0.14625147439177885, 'mlp_n_units_l2': 80, 'mlp_dropout_l2': 0.16346009812737033, 'mlp_n_units_l3': 57, 'mlp_dropout_l3': 0.18460392871023978, 'lr': 9.23584989317909e-05, 'weight_decay': 0.18038031828251333, 'criterion': 'MSELoss', 'batch_size': 256}. Best is trial 4 with value: 7.0801956527286.[0m
Trial Id: 87 | Model params: 11824 | Timestamp: 2022-02-17 02:35:18.035331

[32m[I 2022-02-17 02:35:23,333][0m Trial 87 pruned. [0m
epoch 0 -14.948258623975038 28.7869792950088
Trial Id: 88 | Model params: 14378 | Timestamp: 2022-02-17 02:35:23.333660

[32m[I 2022-02-17 02:35:28,374][0m Trial 88 pruned. [0m
epoch 0 0.0028930434454439435 7.197974995659101
Trial Id: 89 | Model params: 13106 | Timestamp: 2022-02-17 02:35:28.374368

[32m[I 2022-02-17 02:35:33,474][0m Trial 89 pruned. [0m
epoch 0 -0.02240988062271909 7.288731959410509
Trial Id: 90 | Model params: 11920 | Timestamp: 2022-02-17 02:35:33.474421

epoch 0 -18.61379064900279 31.924215095733725
epoch 5 -18.61379064900279 31.924215095733725
epoch 10 -0.01458100570137888 7.26077241591736
epoch 15 0.01309694911484749 7.161050004111607
epoch 20 0.013758877500957056 7.158648097791556
epoch 25 0.019880028712554898 7.136398279913761
epoch 30 0.019360445359473233 7.13828961085736
epoch 35 0.022195954030723386 7.127961996285009
epoch 40 0.02222491482798339 7.1278564367960415
epoch 45 0.022092028704059574 7.1283407818401425
epoch 50 0.023077658576371562 7.124747561895241
epoch 55 0.023368800627025732 7.123685825410575
epoch 60 0.023158300657443398 7.1244534922934015
epoch 65 0.023852477567370634 7.121921603012237
epoch 70 0.024917971422049878 7.11803364786777
epoch 75 0.025375846452224904 7.116362223068346
epoch 80 0.025858644498762184 7.114599394102356
epoch 85 0.02581887684161932 7.114744613305058
epoch 90 0.02724780414752981 7.109524750498447
epoch 95 0.027018297391907753 7.110363395599828
[32m[I 2022-02-17 02:44:00,654][0m Trial 90 finished with value: 7.109350650037437 and parameters: {'n_layers_mlp': 4, 'mlp_n_units_l0': 43, 'mlp_dropout_l0': 0.12855176151702147, 'mlp_n_units_l1': 51, 'mlp_dropout_l1': 0.12439912026919148, 'mlp_n_units_l2': 76, 'mlp_dropout_l2': 0.1819672695421227, 'mlp_n_units_l3': 64, 'mlp_dropout_l3': 0.12520839929041444, 'lr': 7.152880918687596e-05, 'weight_decay': 0.14343512963575872, 'criterion': 'MSELoss', 'batch_size': 256}. Best is trial 4 with value: 7.0801956527286.[0m
Trial Id: 91 | Model params: 11804 | Timestamp: 2022-02-17 02:44:00.654990

epoch 0 -18.61379064900279 31.924215095733725
epoch 5 -18.61379064900279 31.924215095733725
epoch 10 -0.0069811200338389945 7.233527294819347
epoch 15 0.013609701032459842 7.159189477297574
epoch 20 0.018792958940953453 7.140354740957692
epoch 25 0.019849230417337105 7.136510402501239
epoch 30 0.02332213281591322 7.123856024178227
epoch 35 0.024381942045372806 7.1199898683722145
epoch 40 0.02567891152085866 7.115255699858856
epoch 45 0.025214758982026186 7.11695030074903
epoch 50 0.02664725096082543 7.111719034393482
epoch 55 0.026625257868651664 7.111799379267876
epoch 60 0.028240311764631487 7.105896869570434
epoch 65 0.024867861727855378 7.118216544227525
epoch 70 0.028326796746239058 7.10558065608593
epoch 75 0.028192077245912772 7.106073222462317
epoch 80 0.029419751679796602 7.101583291286601
epoch 85 0.030084311635622307 7.099151634545324
epoch 90 0.029940069108651324 7.099679495634081
epoch 95 0.03150310180783866 7.093957423962383
[32m[I 2022-02-17 02:52:27,055][0m Trial 91 finished with value: 7.096571053440204 and parameters: {'n_layers_mlp': 4, 'mlp_n_units_l0': 43, 'mlp_dropout_l0': 0.1248156757500746, 'mlp_n_units_l1': 51, 'mlp_dropout_l1': 0.15385358215191208, 'mlp_n_units_l2': 75, 'mlp_dropout_l2': 0.21213247628748297, 'mlp_n_units_l3': 64, 'mlp_dropout_l3': 0.1258946682848336, 'lr': 7.264875222252507e-05, 'weight_decay': 0.13197720660601084, 'criterion': 'MSELoss', 'batch_size': 256}. Best is trial 4 with value: 7.0801956527286.[0m
Trial Id: 92 | Model params: 11812 | Timestamp: 2022-02-17 02:52:27.056229

epoch 0 -18.61379064900279 31.924215095733725
epoch 5 -18.61379064900279 31.924215095733725
epoch 10 -18.61379064900279 31.924215095733725
epoch 15 0.009527004808990824 7.173990217738821
epoch 20 0.015433861445222519 7.152566564709894
epoch 25 0.020439088615489265 7.13436269073291
epoch 30 0.024202279963847606 7.12064541861737
epoch 35 0.025650262907368493 7.115360306396902
epoch 40 0.02517101152454515 7.117110000021443
epoch 45 0.025983522516870305 7.114143358875922
epoch 50 0.02769835466212789 7.107878097300577
epoch 55 0.028220458937638693 7.105969455119299
epoch 60 0.028268828129906054 7.105792607251368
epoch 65 0.027453668854077296 7.108772412093685
epoch 70 0.029034975412774222 7.102990825566964
epoch 75 0.026833958903553112 7.111036918833254
epoch 80 0.029798243267533664 7.100198474504926
epoch 85 0.02962773012822484 7.100822377695007
epoch 90 0.025993135252652344 7.1141082534384195
epoch 95 0.029994559506404284 7.099480090535373
[32m[I 2022-02-17 03:00:56,193][0m Trial 92 finished with value: 7.0969363156232665 and parameters: {'n_layers_mlp': 4, 'mlp_n_units_l0': 43, 'mlp_dropout_l0': 0.12684808112094595, 'mlp_n_units_l1': 54, 'mlp_dropout_l1': 0.12340594281137539, 'mlp_n_units_l2': 76, 'mlp_dropout_l2': 0.2290783230930868, 'mlp_n_units_l3': 58, 'mlp_dropout_l3': 0.12582965781147126, 'lr': 7.341198691164658e-05, 'weight_decay': 0.128707923044455, 'criterion': 'MSELoss', 'batch_size': 256}. Best is trial 4 with value: 7.0801956527286.[0m
Trial Id: 93 | Model params: 11614 | Timestamp: 2022-02-17 03:00:56.194080

[32m[I 2022-02-17 03:01:01,276][0m Trial 93 pruned. [0m
epoch 0 -0.06774242003296349 7.4485666648799
Trial Id: 94 | Model params: 11623 | Timestamp: 2022-02-17 03:01:01.277003

[32m[I 2022-02-17 03:01:06,352][0m Trial 94 pruned. [0m
epoch 0 -0.0475758826768633 7.37789051735582
Trial Id: 95 | Model params: 11429 | Timestamp: 2022-02-17 03:01:06.352468

epoch 0 -18.61379064900279 31.924215095733725
epoch 5 -18.61379064900279 31.924215095733725
epoch 10 0.017468148259774385 7.145173513616514
epoch 15 0.021953693473242608 7.128844952899825
epoch 20 0.02256695465406422 7.126609614258282
epoch 25 0.022713410531506772 7.1260756784712225
epoch 30 0.023080054680002737 7.124738824433086
epoch 35 0.023951697681545703 7.121559641415374
epoch 40 0.024249471516987975 7.120473232121803
epoch 45 0.024523618082929355 7.119472878876372
epoch 50 0.026141984487123904 7.1135646381592545
epoch 55 0.027348661523449835 7.1091561743077545
epoch 60 0.028099758339934944 7.106410742516931
epoch 65 0.028568107644484586 7.104698280964897
epoch 70 0.029075839016748373 7.102841357331386
epoch 75 0.02994567334353737 7.099658987453241
epoch 80 0.03079213718970686 7.096560750557239
epoch 85 0.03097233286706158 7.095901021585093
epoch 90 0.028770460879985804 7.103958273574223
epoch 95 0.03204502192610681 7.091972442813125
[32m[I 2022-02-17 03:09:37,086][0m Trial 95 finished with value: 7.092316016249612 and parameters: {'n_layers_mlp': 4, 'mlp_n_units_l0': 44, 'mlp_dropout_l0': 0.13901433747467573, 'mlp_n_units_l1': 52, 'mlp_dropout_l1': 0.14146879622563535, 'mlp_n_units_l2': 80, 'mlp_dropout_l2': 0.25220084244246255, 'mlp_n_units_l3': 50, 'mlp_dropout_l3': 0.10097464037335808, 'lr': 0.00015528271830758276, 'weight_decay': 0.13063098001157106, 'criterion': 'MSELoss', 'batch_size': 256}. Best is trial 4 with value: 7.0801956527286.[0m
Trial Id: 96 | Model params: 11818 | Timestamp: 2022-02-17 03:09:37.087176

epoch 0 -18.61379064900279 31.924215095733725
epoch 5 -0.013888578140307084 7.258294340240025
epoch 10 0.018588064031095364 7.1411002237716925
epoch 15 0.018907193036842074 7.139939081634048
epoch 20 0.0227252138880627 7.126032645103655
epoch 25 0.021281320417481764 7.13129494924396
epoch 30 0.019982820415015756 7.13602404931724
epoch 35 0.020488403962089397 7.134183101085603
epoch 40 0.022903516227242404 7.125382548392231
epoch 45 0.0250981724212076 7.1173758898510835
epoch 50 0.026599914011971038 7.111891963985348
epoch 55 0.028088903886846595 7.106450425595172
epoch 60 0.02901020976530666 7.103081410212451
epoch 65 0.02974182812982562 7.100404902110926
epoch 70 0.028909818787210773 7.10344859577241
epoch 75 0.0309069076018611 7.096140562408355
epoch 80 0.0313623811079593 7.0944727742936875
epoch 85 0.031813496911559325 7.0928205560448045
epoch 90 0.03163861040929161 7.09346112610197
epoch 95 0.0325090212326149 7.090272433608869
[32m[I 2022-02-17 03:18:04,957][0m Trial 96 finished with value: 7.090413987507649 and parameters: {'n_layers_mlp': 4, 'mlp_n_units_l0': 37, 'mlp_dropout_l0': 0.13500864142734506, 'mlp_n_units_l1': 58, 'mlp_dropout_l1': 0.12138410997502558, 'mlp_n_units_l2': 80, 'mlp_dropout_l2': 0.25873753902526125, 'mlp_n_units_l3': 52, 'mlp_dropout_l3': 0.10396778445777578, 'lr': 0.0001486263018686253, 'weight_decay': 0.12757250930281144, 'criterion': 'MSELoss', 'batch_size': 256}. Best is trial 4 with value: 7.0801956527286.[0m
Trial Id: 97 | Model params: 11818 | Timestamp: 2022-02-17 03:18:04.957688

epoch 0 -18.61379064900279 31.924215095733725
epoch 5 -18.028377903146165 31.44418512689251
epoch 10 0.011917925714573951 7.16532627286962
epoch 15 0.01893246361280032 7.139847127267704
epoch 20 0.023536597746860344 7.123073831183625
epoch 25 0.025532179672594357 7.115791455128528
epoch 30 0.026001715231216194 7.11407691945457
epoch 35 0.02624160083005822 7.113200804106669
epoch 40 0.02867425153634906 7.104310121520607
epoch 45 0.027924807740668633 7.107050321981911
epoch 50 0.029209292857372948 7.102353196632974
epoch 55 0.030850376852321948 7.096347531324967
epoch 60 0.030278764174650363 7.098439965854322
epoch 65 0.03180381200122473 7.092856031213638
epoch 70 0.031979993692028086 7.092210661898302
epoch 75 0.031161189087398955 7.095209518962028
epoch 80 0.03153888652629244 7.093826366436766
epoch 85 0.03364276001380073 7.08611690485657
epoch 90 0.0340528302166605 7.0846132612717545
epoch 95 0.029498931474390977 7.101293612315765
[32m[I 2022-02-17 03:26:32,232][0m Trial 97 finished with value: 7.087516590299039 and parameters: {'n_layers_mlp': 4, 'mlp_n_units_l0': 37, 'mlp_dropout_l0': 0.13680478762876327, 'mlp_n_units_l1': 58, 'mlp_dropout_l1': 0.14372055499769065, 'mlp_n_units_l2': 80, 'mlp_dropout_l2': 0.27773669610309387, 'mlp_n_units_l3': 52, 'mlp_dropout_l3': 0.09824845315664857, 'lr': 0.00014348767118800142, 'weight_decay': 0.13031985577856248, 'criterion': 'MSELoss', 'batch_size': 256}. Best is trial 4 with value: 7.0801956527286.[0m
Trial Id: 98 | Model params: 11982 | Timestamp: 2022-02-17 03:26:32.232749

