[32m[I 2022-02-17 20:57:19,739][0m Trial 99 pruned. [0m
epoch 0 -9.605213203305738 31.05691769195428
Study statistics: 
  Number of finished trials:  100
  Number of pruned trials:  70
  Number of complete trials:  30

Best trial:
  Value:  9.120511095941094
  Params: 
    n_layers_mlp: 4
    mlp_n_units_l0: 17
    mlp_dropout_l0: 0.19406909612060674
    mlp_n_units_l1: 37
    mlp_dropout_l1: 0.01820302980761379
    mlp_n_units_l2: 60
    mlp_dropout_l2: 0.21433557227634883
    mlp_n_units_l3: 37
    mlp_dropout_l3: 0.09209491013157622
    lr: 0.0002457175859357712
    weight_decay: 0.05368768012361619
    criterion: MSELoss
    batch_size: 256
Target: 67706, NaN: 0, Max: 122.0, Min: 3.0, Mean: 29.60900067940803
Prediction: 67706, NaN: 0, Max: 45.74047088623047, Min: 26.74628257751465, Mean: 29.45270982984637

 XXXXXX======== TRIAL des - glbg ended

Test Set - R-squared:  0.0865618076824034
Test Set - RMSE:  9.101800442584864
Test Set - MAE:  7.064074383160038



[32m[I 2022-02-17 20:57:30,998][0m A new study created in memory with name: NeuralNetwork[0m
++++++++ Session Characteristics +++++++

Area: des
Gal Type: rlbg
Training Samples: 216656
Validation Samples: 54164
Test Samples: 67706
Number of features: 16
Device: cuda:0
Number of Workers: 8
Number of Trials: 100

+++++++++++++++++++++++++++++++++++++++
Trial Id: 0 | Model params: 7138 | Timestamp: 2022-02-17 20:57:30.999098

epoch 0 0.014810375437470213 2.568021379770839
epoch 5 0.03192568706937127 2.545617035583079
epoch 10 0.03416703925763287 2.542668434128127
epoch 15 0.03545452045681796 2.5409731464193475
epoch 20 0.03761570263081404 2.5381248694153515
epoch 25 0.037763933162311525 2.53792939548275
epoch 30 0.03635647392264685 2.539784827353943
epoch 35 0.037265360367096045 2.53858681143957
epoch 40 0.03192981320637234 2.5456116105988125
epoch 45 0.03703269611675586 2.538893543270172
epoch 50 0.03526620620333498 2.541221179362535
epoch 55 0.03573468427916149 2.5406040915297954
epoch 60 0.028522199588116637 2.5500879599248627
epoch 65 0.036013079668475556 2.5402373130550195
epoch 70 0.03613323466283014 2.5400789957038303
epoch 75 0.03660489625721686 2.5394574345330985
epoch 80 0.035805455779423956 2.5405108569918347
epoch 85 0.036592596556988655 2.5394736451539397
epoch 90 0.02580964570049127 2.5536456475839837
epoch 95 0.036079421344763385 2.5401499018580855
[32m[I 2022-02-17 21:10:02,255][0m Trial 0 finished with value: 2.542335706520992 and parameters: {'n_layers_mlp': 4, 'mlp_n_units_l0': 52, 'mlp_dropout_l0': 0.07045711740085299, 'mlp_n_units_l1': 51, 'mlp_dropout_l1': 0.09627237572902203, 'mlp_n_units_l2': 27, 'mlp_dropout_l2': 0.06340557948523841, 'mlp_n_units_l3': 74, 'mlp_dropout_l3': 0.20933006250869066, 'lr': 0.0018921454533940775, 'weight_decay': 0.02728303826734757, 'criterion': 'MSELoss', 'batch_size': 256}. Best is trial 0 with value: 2.542335706520992.[0m
Trial Id: 1 | Model params: 16938 | Timestamp: 2022-02-17 21:10:02.256057

epoch 0 -4.242735076243065e-05 2.5866709731999107
epoch 5 -0.0009766820921441877 2.587878944687025
epoch 10 -0.00748221972953611 2.5962748835524967
epoch 15 -0.0006251333777991253 2.5874244658640406
epoch 20 -0.008423627688709079 2.5974876013027153
epoch 25 -0.006653985922231431 2.5952074876684517
epoch 30 -0.007243864231249342 2.5959677451297676
epoch 35 -0.013824512437529801 2.604434085526073
epoch 40 -0.002615158843351839 2.589996099769725
epoch 45 -0.0012063652992786444 2.5881758338419143
epoch 50 -0.004330112285060084 2.592210221977567
epoch 55 -0.002247407743610985 2.5895210614354456
epoch 60 -0.003450021767716027 2.5910742012521557
epoch 65 -0.005130763774397806 2.593243270512101
epoch 70 -0.0016599596518993565 2.588762051151916
epoch 75 -0.0069667353538676036 2.5956105986910174
epoch 80 -9.246408744445489e-06 2.5866280605748155
epoch 85 -0.002140477594022805 2.589382919267005
epoch 90 -0.0021387636266543275 2.5893807049468447
epoch 95 -0.000639235048459641 2.5874426979061456
[32m[I 2022-02-17 22:35:30,680][0m Trial 1 finished with value: 2.6120869907419975 and parameters: {'n_layers_mlp': 4, 'mlp_n_units_l0': 59, 'mlp_dropout_l0': 0.16585972050880485, 'mlp_n_units_l1': 74, 'mlp_dropout_l1': 0.06569887068747253, 'mlp_n_units_l2': 80, 'mlp_dropout_l2': 0.005432493826720297, 'mlp_n_units_l3': 67, 'mlp_dropout_l3': 0.20514003031722455, 'lr': 0.0024206674387689453, 'weight_decay': 0.2672937519008358, 'criterion': 'MSELoss', 'batch_size': 32}. Best is trial 0 with value: 2.542335706520992.[0m
Trial Id: 2 | Model params: 2127 | Timestamp: 2022-02-17 22:35:30.681067

epoch 0 -1.0352625604300587 3.6910416188256945
epoch 5 -0.994880078786526 3.654240419786897
epoch 10 -1.0286007021813393 3.684995875396306
epoch 15 -1.0343272509103922 3.6901934080969987
epoch 20 -1.012270000525235 3.6701333716604707
epoch 25 -1.0533723652614615 3.7074267299253294
epoch 30 -1.025462703151561 3.68214465170077
epoch 35 -1.0380444953223322 3.693563340404274
epoch 40 -1.0276100275705575 3.684095974873892
epoch 45 -1.0299750665601461 3.6862439449537585
epoch 50 -1.0486253277527 3.7031387894031753
epoch 55 -1.0515518952775977 3.7057829083299056
epoch 60 -1.0472721849825137 3.7019156025368614
epoch 65 -1.031258542798458 3.687409096926709
epoch 70 -1.0510386131061629 3.7053193004409932
epoch 75 -1.0292695426203236 3.685603306699996
epoch 80 -1.046079255413734 3.7008369066717877
epoch 85 -1.0061702289079153 3.6645665325991494
epoch 90 -1.032603884235764 3.6886300156353724
epoch 95 -1.0287683276088035 3.6851481198100045
[32m[I 2022-02-17 22:47:16,990][0m Trial 2 finished with value: 3.7046009051508406 and parameters: {'n_layers_mlp': 2, 'mlp_n_units_l0': 25, 'mlp_dropout_l0': 0.1648607442963986, 'mlp_n_units_l1': 63, 'mlp_dropout_l1': 0.1402062397149518, 'lr': 0.004538664187571225, 'weight_decay': 0.035909921905985784, 'criterion': 'PoissonNLLLoss', 'batch_size': 256}. Best is trial 0 with value: 2.542335706520992.[0m
Trial Id: 3 | Model params: 7845 | Timestamp: 2022-02-17 22:47:16.991091

epoch 0 0.009283327114507633 2.5745819059828143
epoch 5 0.017269697076082835 2.5641837922887767
epoch 10 0.019214340683636144 2.5616455104965565
epoch 15 0.019254975983791334 2.5615924436967794
epoch 20 0.019332143768488463 2.5614916650551116
epoch 25 0.018617084942170292 2.56242535705413
epoch 30 0.018896751030835213 2.5620602220351243
epoch 35 0.017376184185500132 2.5640448630644874
epoch 40 0.01916560424969105 2.5617091553485865
epoch 45 0.018440185365574013 2.5626562921603595
epoch 50 0.019157732089626456 2.5617194354448665
epoch 55 0.018496718096152165 2.5625824932733097
epoch 60 0.01730000304219803 2.5641442541438675
epoch 65 0.019370891518769473 2.5614410602457593
epoch 70 0.01798323243887323 2.563252729086276
epoch 75 0.018685068555220008 2.562336601712929
epoch 80 0.019355305753643526 2.5614614154747537
epoch 85 0.018811826508755014 2.5621711058956396
epoch 90 0.019239291171852746 2.5616129270712147
epoch 95 0.019277851586751327 2.561562569309476
[32m[I 2022-02-17 23:09:48,863][0m Trial 3 finished with value: 2.56317147312564 and parameters: {'n_layers_mlp': 4, 'mlp_n_units_l0': 65, 'mlp_dropout_l0': 0.06504807946180095, 'mlp_n_units_l1': 19, 'mlp_dropout_l1': 0.0004018744342044411, 'mlp_n_units_l2': 63, 'mlp_dropout_l2': 0.24928699535346563, 'mlp_n_units_l3': 65, 'mlp_dropout_l3': 0.11654505776759835, 'lr': 0.00012018787372697103, 'weight_decay': 0.08604947392322906, 'criterion': 'MSELoss', 'batch_size': 128}. Best is trial 0 with value: 2.542335706520992.[0m
Trial Id: 4 | Model params: 2073 | Timestamp: 2022-02-17 23:09:48.863781

epoch 0 -1.0693339186142206 3.7218083725487077
epoch 5 -1.0565631811705303 3.710306169693236
epoch 10 -1.0505279479915761 3.7048579987654136
epoch 15 -1.0430184203374586 3.6980677346171973
epoch 20 -1.0486737855030346 3.7031825857751497
epoch 25 -1.0337245311715528 3.689646712089598
epoch 30 -1.046569891864146 3.701280598341968
epoch 35 -1.0463450495873956 3.7010772758905093
epoch 40 -1.041394654275598 3.6965978529873227
epoch 45 -1.046854050665122 3.7015375441114844
epoch 50 -1.0445398091065399 3.6994444113097353
epoch 55 -1.0485512808825286 3.703071864448362
epoch 60 -1.0427523434099668 3.6978269138467734
epoch 65 -1.0474952706960856 3.7021172909087223
epoch 70 -1.0525686205076599 3.7067010660156745
epoch 75 -1.0478629896483462 3.702449715992698
epoch 80 -1.0476702804192142 3.7022755068242796
epoch 85 -1.0483977400345732 3.7029330874859347
epoch 90 -1.0517736423444313 3.7059831772795264
epoch 95 -1.051402820943034 3.7056482670472914
[32m[I 2022-02-17 23:21:20,850][0m Trial 4 finished with value: 3.7034334653232714 and parameters: {'n_layers_mlp': 2, 'mlp_n_units_l0': 52, 'mlp_dropout_l0': 0.0006411032364607827, 'mlp_n_units_l1': 22, 'mlp_dropout_l1': 0.14339538128985477, 'lr': 0.00018291914637695393, 'weight_decay': 0.11310643424847028, 'criterion': 'PoissonNLLLoss', 'batch_size': 256}. Best is trial 0 with value: 2.542335706520992.[0m
Trial Id: 5 | Model params: 1584 | Timestamp: 2022-02-17 23:21:20.850933

epoch 0 -1.073076188744678 3.72425670646634
epoch 5 -1.040701064004487 3.695061509770306
epoch 10 -1.0543096260789748 3.7073614300671194
epoch 15 -1.0587918607203801 3.711403714959491
epoch 20 -1.0575474667085967 3.710281904945892
epoch 25 -1.0667754641121876 3.7185928111892657
epoch 30 -1.0599053995295078 3.712407272792854
epoch 35 -1.0567483576002794 3.7095613363935134
epoch 40 -1.0584803749821408 3.7111229451843473
epoch 45 -1.052581978522383 3.705802180907564
epoch 50 -1.0586596878183623 3.7112845783720663
epoch 55 -1.0636731430759756 3.715800877264245
epoch 60 -1.0537080281625615 3.706818545928735
epoch 65 -1.0518904198416221 3.705177846387829
epoch 70 -1.053369870606021 3.7065133564159036
epoch 75 -1.0549752494081384 3.7079619983471463
epoch 80 -1.055943209634726 3.7088351809277835
epoch 85 -1.0498048461424303 3.703294367143706
epoch 90 -1.0594708836178413 3.712015705027975
epoch 95 -1.058341715543416 3.7109979522777494
[32m[I 2022-02-18 00:39:15,657][0m Trial 5 finished with value: 3.7109329091036733 and parameters: {'n_layers_mlp': 2, 'mlp_n_units_l0': 31, 'mlp_dropout_l0': 0.04474359934875675, 'mlp_n_units_l1': 32, 'mlp_dropout_l1': 0.28332509778088577, 'lr': 0.0001147169389436547, 'weight_decay': 0.13689185777576707, 'criterion': 'PoissonNLLLoss', 'batch_size': 32}. Best is trial 0 with value: 2.542335706520992.[0m
Trial Id: 6 | Model params: 2837 | Timestamp: 2022-02-18 00:39:15.658097

epoch 0 -2.396768235889979 4.767217148196782
epoch 5 0.017886164796208748 2.5633794085687946
epoch 10 0.019203837458545148 2.5616592267795752
epoch 15 0.017792217652260467 2.563502009639458
epoch 20 0.01618954775983472 2.5655925921973393
epoch 25 0.018667799806075913 2.562359147050779
epoch 30 0.018701587279708498 2.5623150353894486
epoch 35 0.01677603598659383 2.5648277527078465
epoch 40 0.014815475801506772 2.567383627631544
epoch 45 0.017492681028699053 2.5638928659413693
epoch 50 0.01769672764976893 2.563626618132894
epoch 55 0.01830249737164713 2.5628360237598624
epoch 60 0.018754198829860513 2.5622463462062255
epoch 65 0.018566881033670435 2.5624908983026056
epoch 70 0.018308639213690525 2.5628280067492155
epoch 75 0.01793911648568025 2.563310304003111
epoch 80 0.016693611251245577 2.5649352566062817
epoch 85 0.01899324680037273 2.5619342240566896
epoch 90 0.01823337765560351 2.562926244718857
epoch 95 0.018456804549316863 2.562634597386679
[32m[I 2022-02-18 01:53:54,533][0m Trial 6 finished with value: 2.5627143704726283 and parameters: {'n_layers_mlp': 2, 'mlp_n_units_l0': 33, 'mlp_dropout_l0': 0.2612816618562683, 'mlp_n_units_l1': 65, 'mlp_dropout_l1': 0.2981136903229501, 'lr': 0.0001313786880047264, 'weight_decay': 0.0927971676768843, 'criterion': 'MSELoss', 'batch_size': 32}. Best is trial 0 with value: 2.542335706520992.[0m
Trial Id: 7 | Model params: 2002 | Timestamp: 2022-02-18 01:53:54.533753

epoch 0 -2.397109458556357 4.768628506368844
epoch 5 0.008479547016496891 2.576259219428624
epoch 10 0.01163332096605807 2.5721587440803306
epoch 15 0.007503334729922262 2.5775271494867726
epoch 20 0.011373381138640504 2.572496959926339
epoch 25 0.008204704641940008 2.576616254998772
epoch 30 0.010078422310608959 2.574181209280389
epoch 35 0.00896340158128539 2.575630545107445
epoch 40 0.01148435115679236 2.572352578802007
epoch 45 0.010239175173747062 2.573972190803675
epoch 50 0.011860256920688816 2.5718634342410946
epoch 55 0.01053491964009079 2.5735876055146885
epoch 60 0.010934155180811644 2.573068349543531
epoch 65 0.01123945838149254 2.5726711936625746
epoch 70 0.00968907523474416 2.5746873864461124
epoch 75 0.006296863809857833 2.579093284265465
epoch 80 0.0109159135741006 2.573092077329049
epoch 85 0.008814002651511554 2.57582467615498
epoch 90 0.009025637426685162 2.5755496706668075
epoch 95 0.009140970585792552 2.5753997904405845
[32m[I 2022-02-18 02:05:04,007][0m Trial 7 finished with value: 2.5775553016118087 and parameters: {'n_layers_mlp': 2, 'mlp_n_units_l0': 53, 'mlp_dropout_l0': 0.2534878796854885, 'mlp_n_units_l1': 20, 'mlp_dropout_l1': 0.060433709191975736, 'lr': 0.00034847580164417384, 'weight_decay': 0.2853152226232567, 'criterion': 'MSELoss', 'batch_size': 256}. Best is trial 0 with value: 2.542335706520992.[0m
Trial Id: 8 | Model params: 5012 | Timestamp: 2022-02-18 02:05:04.007548

epoch 0 -2.397109458556357 4.768628506368844
epoch 5 -1.0489186284180412 3.703403868181508
epoch 10 -1.0414905667128211 3.696684692037368
epoch 15 -1.0535895983282408 3.707622835218337
epoch 20 -1.0476757511110004 3.7022804524434236
epoch 25 -1.051003914766381 3.7052879580345093
epoch 30 -1.0493047656840595 3.7037528217358306
epoch 35 -1.0471469521832266 3.7018023766680845
epoch 40 -1.0479280787095862 3.7025085546607777
epoch 45 -1.0408943218809186 3.696144819324103
epoch 50 -1.0457870425562832 3.700572627871539
epoch 55 -1.0505696714134576 3.704895691147788
epoch 60 -1.0459218062888813 3.700694511224282
epoch 65 -1.0395734314350569 3.6949485318592803
epoch 70 -1.0430662036814788 3.698110980680913
epoch 75 -1.051811995381208 3.7060178143959073
epoch 80 -1.0455949014532129 3.700398844191272
epoch 85 -1.0459703422072115 3.7007384072179486
epoch 90 -1.0390143687441804 3.69444209031297
epoch 95 -1.039333761043173 3.6947314286733057
[32m[I 2022-02-18 02:17:19,138][0m Trial 8 finished with value: 3.7040078821645297 and parameters: {'n_layers_mlp': 4, 'mlp_n_units_l0': 53, 'mlp_dropout_l0': 0.2455653203619958, 'mlp_n_units_l1': 36, 'mlp_dropout_l1': 0.20761502062965037, 'mlp_n_units_l2': 33, 'mlp_dropout_l2': 0.24168122963759373, 'mlp_n_units_l3': 27, 'mlp_dropout_l3': 0.10238814702168253, 'lr': 0.00026623632305709024, 'weight_decay': 0.09977898288690602, 'criterion': 'PoissonNLLLoss', 'batch_size': 256}. Best is trial 0 with value: 2.542335706520992.[0m
Trial Id: 9 | Model params: 2170 | Timestamp: 2022-02-18 02:17:19.138882

[32m[I 2022-02-18 02:18:09,605][0m Trial 9 pruned. [0m
epoch 0 0.01813147012047356 2.563059257347855
Trial Id: 10 | Model params: 7388 | Timestamp: 2022-02-18 02:18:09.605322

epoch 0 -2.317468707234571 4.711241797110641
epoch 5 0.00629585736914573 2.578460762642483
epoch 10 0.007977506598266126 2.576278069420721
epoch 15 0.009522244221723097 2.574271449539001
epoch 20 0.010638068560676395 2.5728210160667575
epoch 25 0.0128342566968771 2.5699638522776205
epoch 30 0.01162263034902411 2.571540528261058
epoch 35 0.012608045871228324 2.570258291356422
epoch 40 0.011671154998510014 2.571477402253621
epoch 45 0.012470469683449448 2.5704373458947245
epoch 50 0.010986819603630682 2.572367515143282
epoch 55 0.011698246868158901 2.5714421576038444
epoch 60 0.011901152622382338 2.571178175883759
epoch 65 0.011874638254860459 2.5712126727895956
epoch 70 0.011864288390834865 2.5712261385060375
epoch 75 0.011204866305597472 2.572083935923863
epoch 80 0.011269215458611925 2.572000241076463
epoch 85 0.010996058474571191 2.572355500224039
epoch 90 0.010988120690588854 2.5723658231158186
epoch 95 0.011121523573946246 2.572192330462377
[32m[I 2022-02-18 02:39:51,348][0m Trial 10 finished with value: 2.5716553475525585 and parameters: {'n_layers_mlp': 4, 'mlp_n_units_l0': 80, 'mlp_dropout_l0': 0.10579017680207575, 'mlp_n_units_l1': 51, 'mlp_dropout_l1': 0.001981560732203444, 'mlp_n_units_l2': 14, 'mlp_dropout_l2': 0.03516494295640006, 'mlp_n_units_l3': 73, 'mlp_dropout_l3': 0.29302239496453686, 'lr': 1.3199106382691464e-05, 'weight_decay': 0.19869812085601737, 'criterion': 'MSELoss', 'batch_size': 128}. Best is trial 0 with value: 2.542335706520992.[0m
Trial Id: 11 | Model params: 2847 | Timestamp: 2022-02-18 02:39:51.348360

[32m[I 2022-02-18 02:40:27,997][0m Trial 11 pruned. [0m
epoch 0 0.017853273981113915 2.5634223317663096
Trial Id: 12 | Model params: 1257 | Timestamp: 2022-02-18 02:40:27.997215

epoch 0 -1.9824533929766184 4.468127456461451
epoch 5 0.006465172566099686 2.578874857680387
epoch 10 0.006995796851855807 2.5781861065918226
epoch 15 0.010751589407780648 2.573305812266298
epoch 20 0.01203137774744334 2.5716407337296423
epoch 25 0.013061486002427514 2.5702997198736144
epoch 30 0.015294331497137437 2.567390555946997
epoch 35 0.0166316527088618 2.5656465869221967
epoch 40 0.017636855293457265 2.564334945161082
epoch 45 0.018304309488512915 2.5634636446894157
epoch 50 0.018743855380319308 2.5628896959203398
epoch 55 0.019465533955998038 2.561947066008677
epoch 60 0.01948109439478596 2.561926737718322
epoch 65 0.02004375257580282 2.5611915678586445
epoch 70 0.01987877819265671 2.5614071454512644
epoch 75 0.019826178030170505 2.56147587604369
epoch 80 0.020304586006725578 2.5608506909854922
epoch 85 0.02063472808967526 2.5604191712465085
epoch 90 0.02059505834236719 2.5604710263387354
epoch 95 0.02042044516877084 2.560699262907251
[32m[I 2022-02-18 02:51:36,201][0m Trial 12 finished with value: 2.560193340726863 and parameters: {'n_layers_mlp': 2, 'mlp_n_units_l0': 13, 'mlp_dropout_l0': 0.2115559731126506, 'mlp_n_units_l1': 69, 'mlp_dropout_l1': 0.20937725497929183, 'lr': 2.7999500073499863e-05, 'weight_decay': 0.06620180581058602, 'criterion': 'MSELoss', 'batch_size': 256}. Best is trial 0 with value: 2.542335706520992.[0m
Trial Id: 13 | Model params: 6694 | Timestamp: 2022-02-18 02:51:36.201910

epoch 0 -2.397109458556357 4.768628506368844
epoch 5 -2.397109458556357 4.768628506368844
epoch 10 0.008274881642399534 2.5765250958656067
epoch 15 0.012803182243598221 2.570636050169118
epoch 20 0.0156636300830838 2.566909080799348
epoch 25 0.016083528537579217 2.5663615260407497
epoch 30 0.01833124112758966 2.563428481679211
epoch 35 0.019449525822401004 2.5619679790030356
epoch 40 0.020743984129703463 2.560276349630424
epoch 45 0.02169531699665428 2.5590324119657244
epoch 50 0.02298777831534138 2.5573414543463735
epoch 55 0.02312154087558127 2.557166385784303
epoch 60 0.024814698697822934 2.5549493423309335
epoch 65 0.02537200193829714 2.5542191810808004
epoch 70 0.026093101743891345 2.553274108823823
epoch 75 0.026920580215210377 2.552189185649501
epoch 80 0.027792465211019413 2.5510455410059025
epoch 85 0.0285967583735528 2.549990101224875
epoch 90 0.029218661036685245 2.5491737051768553
epoch 95 0.029932439872578986 2.548236377299483
[32m[I 2022-02-18 03:03:47,200][0m Trial 13 finished with value: 2.547265083121046 and parameters: {'n_layers_mlp': 4, 'mlp_n_units_l0': 15, 'mlp_dropout_l0': 0.20297201214802213, 'mlp_n_units_l1': 76, 'mlp_dropout_l1': 0.20770637838506162, 'mlp_n_units_l2': 40, 'mlp_dropout_l2': 0.11006909924928031, 'mlp_n_units_l3': 51, 'mlp_dropout_l3': 0.021285638317707772, 'lr': 1.3240124036146016e-05, 'weight_decay': 0.005892464178878079, 'criterion': 'MSELoss', 'batch_size': 256}. Best is trial 0 with value: 2.542335706520992.[0m
Trial Id: 14 | Model params: 12536 | Timestamp: 2022-02-18 03:03:47.201028

[32m[I 2022-02-18 03:03:54,465][0m Trial 14 pruned. [0m
epoch 0 0.0253277759676388 2.554277132186927
Trial Id: 15 | Model params: 3694 | Timestamp: 2022-02-18 03:03:54.466073

epoch 0 -2.397109458556357 4.768628506368844
epoch 5 -0.0007678649719511377 2.5882450740165077
epoch 10 -0.002509631905566412 2.5904964252196954
epoch 15 -7.717611196111918e-06 2.587261918245078
epoch 20 -0.003829975830478727 2.5922017558557786
epoch 25 -0.001713693142928685 2.5894678635625303
epoch 30 -2.247644288844164e-05 2.5872810105088844
epoch 35 -0.0008526293572430621 2.5883546830302415
epoch 40 -0.0023545997096035 2.590296114985997
epoch 45 -0.0023673160880042232 2.5903125458384655
epoch 50 -0.0006623456099512648 2.5881086202104266
epoch 55 -0.004502864997933731 2.593070415049388
epoch 60 -0.00032616571901034064 2.5876738366061494
epoch 65 -0.0012900640633288774 2.5889202570465706
epoch 70 -0.0005480215754984918 2.5879607724014813
epoch 75 -4.7365392736864464e-05 2.5873132069385476
epoch 80 -0.0025184292872018066 2.590507791462451
epoch 85 -0.0011441917949286395 2.5887316676259617
epoch 90 -0.0010440621651561788 2.5886022081399496
epoch 95 -0.0005123581249573128 2.5879146494611134
