[32m[I 2022-02-27 04:50:38,896][0m Trial 24 pruned. [0m
epoch 0 0.0575887979677554 9.257431371073194
Study statistics: 
  Number of finished trials:  25
  Number of pruned trials:  14
  Number of complete trials:  11

Best trial:
  Value:  9.146762363597983
  Params: 
    n_layers_mlp: 2
    mlp_n_units_l0: 22
    mlp_dropout_l0: 0.20295792024061568
    mlp_n_units_l1: 26
    mlp_dropout_l1: 0.2593410720051137
    lr: 2.4783331974364187e-05
    weight_decay: 0.007203833306232709
    criterion: MSELoss
    batch_size: 32
Target: 67706, NaN: 0, Max: 122.0, Min: 3.0, Mean: 29.60900067940803
Prediction: 67706, NaN: 0, Max: 41.84429931640625, Min: 25.060714721679688, Mean: 29.240228383779787

 XXXXXX======== TRIAL des - glbg ended

Test Set - R-squared:  0.08172350966941166
Test Set - RMSE:  9.125873808041709
Test Set - MAE:  7.066148980288612



[32m[I 2022-02-27 04:50:47,121][0m A new study created in memory with name: NeuralNetwork[0m
++++++++ Session Characteristics +++++++

Area: des
Gal Type: rlbg
Training Samples: 216656
Validation Samples: 54164
Test Samples: 67706
Number of features: 16
Device: cuda:0
Number of Workers: 8
Number of Trials: 25

+++++++++++++++++++++++++++++++++++++++
Trial Id: 0 | Model params: 9370 | Timestamp: 2022-02-27 04:50:47.122002

epoch 0 -1.0770606350040892 3.7278339935556244
epoch 5 -1.0776524660705507 3.7283650543231537
epoch 10 -1.0925894218964913 3.7417432994429283
epoch 15 -1.0715134216032594 3.7228526955292143
epoch 20 -1.0920421451331022 3.7412539767293675
epoch 25 -1.076098515194801 3.7269705044719217
epoch 30 -1.0842505977108057 3.734280563208618
epoch 35 -1.0902041223501908 3.7396101233505443
epoch 40 -1.083246225777391 3.733380705354735
epoch 45 -1.0880728400686261 3.73770308531366
epoch 50 -1.086018373751251 3.735863859515494
epoch 55 -1.0815189550163047 3.7318326654562775
epoch 60 -1.0738394169270742 3.724942208552347
epoch 65 -1.0708168301303709 3.722226697776518
epoch 70 -1.0891840095441605 3.738697463744652
epoch 75 -1.0923230396504504 3.74150513382469
epoch 80 -1.0918812924549557 3.7411101454276823
epoch 85 -1.0818882288467901 3.7321636754203795
epoch 90 -1.0872220066908929 3.7369415011141887
epoch 95 -1.0946668714543013 3.743600174608637
[32m[I 2022-02-27 04:59:43,921][0m Trial 0 finished with value: 3.730802343053601 and parameters: {'n_layers_mlp': 4, 'mlp_n_units_l0': 78, 'mlp_dropout_l0': 0.23870802058054083, 'mlp_n_units_l1': 76, 'mlp_dropout_l1': 0.010883049513926346, 'mlp_n_units_l2': 15, 'mlp_dropout_l2': 0.07424502085641295, 'mlp_n_units_l3': 52, 'mlp_dropout_l3': 0.040598325066652875, 'lr': 0.0005920923878441956, 'weight_decay': 0.29682574931347294, 'criterion': 'PoissonNLLLoss', 'batch_size': 128}. Best is trial 0 with value: 3.730802343053601.[0m
Trial Id: 1 | Model params: 6514 | Timestamp: 2022-02-27 04:59:43.921584

epoch 0 -1.0769642123665193 3.727747464604147
epoch 5 -1.0426804852399054 3.6968531270225227
epoch 10 -1.0431148019605856 3.6972461203960103
epoch 15 -1.0379989328287658 3.6926143487313374
epoch 20 -1.0530759821043785 3.706248099617412
epoch 25 -1.0386123421958842 3.693170019732953
epoch 30 -1.0439881331369012 3.698036231485924
epoch 35 -1.0393484658797334 3.6938367439772186
epoch 40 -1.0405581161252138 3.6949320908989773
epoch 45 -1.034563776227448 3.6895009863908084
epoch 50 -1.0484345461335813 3.7020563291184794
epoch 55 -1.051957676497592 3.7052385698619728
epoch 60 -1.0429425328821305 3.697090246969872
epoch 65 -1.0335942189347813 3.688621778547477
epoch 70 -1.044856836161304 3.698821988004832
epoch 75 -1.050912438498409 3.7042947517916223
epoch 80 -1.0531954506673689 3.706355931401829
epoch 85 -1.0469141682025884 3.700682214057367
epoch 90 -1.0391627896748132 3.69366858409388
epoch 95 -1.0507334797765369 3.7041331334056786
[32m[I 2022-02-27 05:08:53,209][0m Trial 1 finished with value: 3.701033306789625 and parameters: {'n_layers_mlp': 4, 'mlp_n_units_l0': 51, 'mlp_dropout_l0': 0.07885602817654615, 'mlp_n_units_l1': 54, 'mlp_dropout_l1': 0.23449462940263824, 'mlp_n_units_l2': 42, 'mlp_dropout_l2': 0.18783496259992302, 'mlp_n_units_l3': 12, 'mlp_dropout_l3': 0.22956660354687725, 'lr': 0.0009925787976282755, 'weight_decay': 0.08133414012484586, 'criterion': 'PoissonNLLLoss', 'batch_size': 128}. Best is trial 1 with value: 3.701033306789625.[0m
Trial Id: 2 | Model params: 6441 | Timestamp: 2022-02-27 05:08:53.209950

epoch 0 -1.0570279388284667 3.710725387495442
epoch 5 -1.039424514431556 3.6948136382832195
epoch 10 -1.0471468313471632 3.701802267415734
epoch 15 -1.0414472573839473 3.6966454800554933
epoch 20 -1.0272499987659085 3.6837688805272677
epoch 25 -1.0328796808030756 3.688880255487271
epoch 30 -1.037703235378585 3.693254093479177
epoch 35 -1.0340009318910184 3.68989743099029
epoch 40 -1.0404285077241617 3.695722990810922
epoch 45 -1.0300441048912594 3.6863066279813683
epoch 50 -1.0334144991153433 3.689365466439426
epoch 55 -1.0281905941812282 3.6846233716614676
epoch 60 -1.0351348601026578 3.6909258218208976
epoch 65 -1.0428480626076113 3.6979135491356967
epoch 70 -1.0185266161941402 3.6758345928239327
epoch 75 -1.0346519352304222 3.690487878943276
epoch 80 -1.0231150160605536 3.680010070342247
epoch 85 -1.0319960877099947 3.6880784806932265
epoch 90 -1.0292142502537902 3.685553094760964
epoch 95 -1.024187985096654 3.68098579674286
[32m[I 2022-02-27 05:13:43,212][0m Trial 2 finished with value: 3.688203773891734 and parameters: {'n_layers_mlp': 2, 'mlp_n_units_l0': 76, 'mlp_dropout_l0': 0.052552533675625346, 'mlp_n_units_l1': 66, 'mlp_dropout_l1': 0.2527576141629866, 'lr': 3.7699317401947525e-05, 'weight_decay': 0.03144309650795065, 'criterion': 'PoissonNLLLoss', 'batch_size': 256}. Best is trial 2 with value: 3.688203773891734.[0m
Trial Id: 3 | Model params: 4581 | Timestamp: 2022-02-27 05:13:43.213034

epoch 0 -0.0038162232511951277 2.591546954574261
epoch 5 -0.0009658752909975643 2.587864974946705
epoch 10 -0.0016082586033583368 2.588695240335383
epoch 15 -0.0033114045024229544 2.5908952286989995
epoch 20 -0.0035573485932491877 2.5912127653694927
epoch 25 -0.003873101290027936 2.591620374398003
epoch 30 -0.0015140598527769722 2.5885735073180762
epoch 35 -0.004834958765644881 2.592861653103548
epoch 40 -0.0013772909840708003 2.5883967507591015
epoch 45 -0.004219946974905353 2.5920680478701
epoch 50 -0.001534485668647223 2.5885999040799192
epoch 55 -0.002098560564620655 2.589328764995527
epoch 60 -0.0023952498086361462 2.5897120452289637
epoch 65 -0.0031696790965283217 2.590712230357465
epoch 70 -0.008156605571670195 2.5971436820711062
epoch 75 -0.0015412884998793341 2.5886086954788294
epoch 80 -0.00020727217919280783 2.5868841550364423
epoch 85 -0.004531304468867292 2.5924698509146666
epoch 90 -0.011656969875924794 2.6016484740908554
epoch 95 -0.0019307581083707337 2.589111963008867
[32m[I 2022-02-27 05:43:56,002][0m Trial 3 finished with value: 2.6063767406408775 and parameters: {'n_layers_mlp': 4, 'mlp_n_units_l0': 12, 'mlp_dropout_l0': 0.23790606773632733, 'mlp_n_units_l1': 46, 'mlp_dropout_l1': 0.23868276934648622, 'mlp_n_units_l2': 30, 'mlp_dropout_l2': 0.06692152593822144, 'mlp_n_units_l3': 74, 'mlp_dropout_l3': 0.1879841555395841, 'lr': 0.0010683208104020736, 'weight_decay': 0.2766238940294552, 'criterion': 'MSELoss', 'batch_size': 32}. Best is trial 3 with value: 2.6063767406408775.[0m
Trial Id: 4 | Model params: 8568 | Timestamp: 2022-02-27 05:43:56.002293

epoch 0 -2.397109458556357 4.768628506368844
epoch 5 -2.397109458556357 4.768628506368844
epoch 10 -1.0563376626855732 3.710102731847537
epoch 15 -1.0532405966551965 3.7073077718885674
epoch 20 -1.0453546321259406 3.700181519038243
epoch 25 -1.0445795513640501 3.699480366480996
epoch 30 -1.0402101812763798 3.69552526380049
epoch 35 -1.0539570110508634 3.7079544903058554
epoch 40 -1.0559339461026402 3.7097385155157285
epoch 45 -1.0456874360633703 3.7004825389374663
epoch 50 -1.0418179580582172 3.6969810965558043
epoch 55 -1.0492038591099746 3.7036616352965397
epoch 60 -1.0487258223570497 3.703229616383272
epoch 65 -1.0444195407170151 3.6993356013069167
epoch 70 -1.0438770649531057 3.6988447693109956
epoch 75 -1.045215288566637 3.700055476043884
epoch 80 -1.051573091700214 3.7058020521638833
epoch 85 -1.0508375559923553 3.705137685366204
epoch 90 -1.0490358495749015 3.703509804813351
epoch 95 -1.0477548890950623 3.7023519940877674
[32m[I 2022-02-27 05:49:35,154][0m Trial 4 finished with value: 3.7024133043656193 and parameters: {'n_layers_mlp': 4, 'mlp_n_units_l0': 77, 'mlp_dropout_l0': 0.1458487952321498, 'mlp_n_units_l1': 53, 'mlp_dropout_l1': 0.015394042664862972, 'mlp_n_units_l2': 30, 'mlp_dropout_l2': 0.1440422309184798, 'mlp_n_units_l3': 47, 'mlp_dropout_l3': 0.0151371814327102, 'lr': 0.0001305285024204355, 'weight_decay': 0.11725966672291727, 'criterion': 'PoissonNLLLoss', 'batch_size': 256}. Best is trial 3 with value: 2.6063767406408775.[0m
Trial Id: 5 | Model params: 5192 | Timestamp: 2022-02-27 05:49:35.154893

[32m[I 2022-02-27 05:49:38,442][0m Trial 5 pruned. [0m
epoch 0 0.008277292325788332 2.5765219643577377
Trial Id: 6 | Model params: 2687 | Timestamp: 2022-02-27 05:49:38.442592

[32m[I 2022-02-27 05:49:42,843][0m Trial 6 pruned. [0m
epoch 0 -0.0017750735987969168 2.5889108012607007
Trial Id: 7 | Model params: 4881 | Timestamp: 2022-02-27 05:49:42.843500

epoch 0 -1.1114174253104432 3.7585387101709316
epoch 5 -1.0844589243420395 3.7344671843980457
epoch 10 -1.0739139011301333 3.725009100631454
epoch 15 -1.0684267942729333 3.7200780713175887
epoch 20 -1.0714216180027591 3.722770201478081
epoch 25 -1.074757601387001 3.725766719249158
epoch 30 -1.0745761304416774 3.72560377655331
epoch 35 -1.0758901249069668 3.7267834507408315
epoch 40 -1.0755279425442161 3.7264583289777127
epoch 45 -1.08219081939344 3.732434889887878
epoch 50 -1.0783742365877984 3.7290126097600638
epoch 55 -1.085388604397448 3.735299887932663
epoch 60 -1.0829225375406208 3.7330906536201525
epoch 65 -1.0822025762389753 3.732445427250285
epoch 70 -1.0846947346762383 3.734678414525947
epoch 75 -1.081506898174041 3.731821857439649
epoch 80 -1.082511674838281 3.732722453811975
epoch 85 -1.0838922444353214 3.7339595247504938
epoch 90 -1.0813730651278912 3.7317018844730425
epoch 95 -1.081813736293682 3.7320969040913634
[32m[I 2022-02-27 05:57:17,646][0m Trial 7 finished with value: 3.733398585361763 and parameters: {'n_layers_mlp': 2, 'mlp_n_units_l0': 76, 'mlp_dropout_l0': 0.05884363202397902, 'mlp_n_units_l1': 46, 'mlp_dropout_l1': 0.1776298202314356, 'lr': 4.3593818333120425e-05, 'weight_decay': 0.2883712687470311, 'criterion': 'PoissonNLLLoss', 'batch_size': 128}. Best is trial 3 with value: 2.6063767406408775.[0m
Trial Id: 8 | Model params: 12304 | Timestamp: 2022-02-27 05:57:17.646488

[32m[I 2022-02-27 05:57:23,203][0m Trial 8 pruned. [0m
epoch 0 0.008369590751176492 2.5757688986912357
Trial Id: 9 | Model params: 3927 | Timestamp: 2022-02-27 05:57:23.203377

epoch 0 -1.324207343582533 3.9443564482598337
epoch 5 -1.063059784564092 3.716161905533293
epoch 10 -1.057267463423912 3.710941423483155
epoch 15 -1.0554972712031803 3.7093445252993247
epoch 20 -1.0679144342705649 3.7205316440877114
epoch 25 -1.0587593253635545 3.7122867052860427
epoch 30 -1.0622539377279296 3.7154360540994773
epoch 35 -1.0540253411702172 3.708016167075219
epoch 40 -1.0665005109794037 3.719259481713951
epoch 45 -1.0645284681794287 3.717484430244167
epoch 50 -1.0626158846688645 3.7157620885631335
epoch 55 -1.0677288096279338 3.7203646551049063
epoch 60 -1.0584937438813369 3.7120472536922016
epoch 65 -1.0670532361304788 3.719756842059472
epoch 70 -1.065070635277939 3.717972523644902
epoch 75 -1.0643387465103604 3.7173136155604007
epoch 80 -1.062781211897069 3.715911002459759
epoch 85 -1.063975864048723 3.7169868748051287
epoch 90 -1.0639471449402444 3.7169610147835876
epoch 95 -1.0628086273155182 3.715935695557597
[32m[I 2022-02-27 06:02:12,975][0m Trial 9 finished with value: 3.716561829436035 and parameters: {'n_layers_mlp': 2, 'mlp_n_units_l0': 70, 'mlp_dropout_l0': 0.042935992606409366, 'mlp_n_units_l1': 38, 'mlp_dropout_l1': 0.2261886827367391, 'lr': 8.449210107707666e-05, 'weight_decay': 0.18265900361634627, 'criterion': 'PoissonNLLLoss', 'batch_size': 256}. Best is trial 3 with value: 2.6063767406408775.[0m
Trial Id: 10 | Model params: 1479 | Timestamp: 2022-02-27 06:02:12.975446

[32m[I 2022-02-27 06:02:30,838][0m Trial 10 pruned. [0m
epoch 0 -1.917909521198524e-06 2.586618582594222
Trial Id: 11 | Model params: 5268 | Timestamp: 2022-02-27 06:02:30.838244

[32m[I 2022-02-27 06:02:45,082][0m Trial 11 pruned. [0m
epoch 0 0.003241715963319236 2.5824201615206532
Trial Id: 12 | Model params: 1295 | Timestamp: 2022-02-27 06:02:45.082441

[32m[I 2022-02-27 06:02:59,882][0m Trial 12 pruned. [0m
epoch 0 -1.0306485041555589 3.685949277508138
Trial Id: 13 | Model params: 1565 | Timestamp: 2022-02-27 06:02:59.882154

[32m[I 2022-02-27 06:03:14,323][0m Trial 13 pruned. [0m
epoch 0 0.00976806553074272 2.5739519824726544
Trial Id: 14 | Model params: 14766 | Timestamp: 2022-02-27 06:03:14.323320

[32m[I 2022-02-27 06:03:17,847][0m Trial 14 pruned. [0m
epoch 0 -0.00018256565873042696 2.5874880954607336
Trial Id: 15 | Model params: 1823 | Timestamp: 2022-02-27 06:03:17.848094

epoch 0 -1.0881211259645034 3.7377463015499837
epoch 5 -1.0705259766006572 3.7219652886613064
epoch 10 -1.055970926289802 3.7088601806842236
epoch 15 -1.0759497797718178 3.7268369986534187
epoch 20 -1.0717788756203785 3.723091220304193
epoch 25 -1.068763338737257 3.7203806976333196
epoch 30 -1.0704063022270969 3.7218577241328195
epoch 35 -1.0735057047799912 3.7246424967080296
epoch 40 -1.0712580784456152 3.722623241486467
epoch 45 -1.0791743759667938 3.7297303444839267
epoch 50 -1.0763920957652915 3.727234010138968
epoch 55 -1.0781636069244107 3.7288236494280493
epoch 60 -1.076373813522495 3.7272176013048015
epoch 65 -1.069393817309789 3.7209475680871256
epoch 70 -1.0775600355719313 3.7282821197420533
epoch 75 -1.0732035631198809 3.7243711179836834
epoch 80 -1.079539354057744 3.7300576883908563
epoch 85 -1.0750881786592457 3.7260635261487676
epoch 90 -1.0752447622571841 3.726204105578852
epoch 95 -1.0730512974800361 3.724234347968846
[32m[I 2022-02-27 06:27:20,906][0m Trial 15 finished with value: 3.722424828342839 and parameters: {'n_layers_mlp': 2, 'mlp_n_units_l0': 27, 'mlp_dropout_l0': 0.20050187233276115, 'mlp_n_units_l1': 47, 'mlp_dropout_l1': 0.197269677716852, 'lr': 3.446729844191296e-05, 'weight_decay': 0.23869366739035694, 'criterion': 'PoissonNLLLoss', 'batch_size': 32}. Best is trial 3 with value: 2.6063767406408775.[0m
Trial Id: 16 | Model params: 4917 | Timestamp: 2022-02-27 06:27:20.906904

[32m[I 2022-02-27 06:27:23,829][0m Trial 16 pruned. [0m
epoch 0 0.010457749681775041 2.5736879626571376
Trial Id: 17 | Model params: 7212 | Timestamp: 2022-02-27 06:27:23.829704

[32m[I 2022-02-27 06:27:27,092][0m Trial 17 pruned. [0m
epoch 0 -1.0318144341370745 3.687913626141876
Trial Id: 18 | Model params: 8278 | Timestamp: 2022-02-27 06:27:27.093010

[32m[I 2022-02-27 06:27:45,601][0m Trial 18 pruned. [0m
epoch 0 -1.0435210555880463 3.6976136829501276
Trial Id: 19 | Model params: 910 | Timestamp: 2022-02-27 06:27:45.601586

[32m[I 2022-02-27 06:27:59,762][0m Trial 19 pruned. [0m
epoch 0 0.011427821764243173 2.5717939403201524
Trial Id: 20 | Model params: 1020 | Timestamp: 2022-02-27 06:27:59.762737

epoch 0 -1.1668353935665143 3.8084800132039103
epoch 5 -1.0849970865563057 3.735867344040181
epoch 10 -1.0840764717572124 3.735042480897906
epoch 15 -1.0915664170037473 3.741748130642982
epoch 20 -1.0779031117527502 3.7295064886517495
epoch 25 -1.0712324471805634 3.723515284012241
epoch 30 -1.0863093311931387 3.7370427895127536
epoch 35 -1.0875816533534715 3.738182121441142
epoch 40 -1.0924765828182097 3.7425621714478527
epoch 45 -1.094047522031131 3.7439667832478865
epoch 50 -1.0792140660442615 3.7306827806544707
epoch 55 -1.0769178268628798 3.7286221687635113
epoch 60 -1.087602603684838 3.7382008790206456
epoch 65 -1.0870856315293356 3.7377379878983032
epoch 70 -1.0857964274542788 3.7365833990932376
epoch 75 -1.0937858823820208 3.7437328819765394
epoch 80 -1.081318696613252 3.7325704465841785
epoch 85 -1.0782827032442404 3.7298471263537456
epoch 90 -1.088379542118322 3.7388964332783345
epoch 95 -1.0760632518319584 3.7278549946361577
[32m[I 2022-02-27 06:32:52,611][0m Trial 20 finished with value: 3.73347673470102 and parameters: {'n_layers_mlp': 2, 'mlp_n_units_l0': 37, 'mlp_dropout_l0': 0.1733202257471819, 'mlp_n_units_l1': 10, 'mlp_dropout_l1': 0.2955487410337452, 'lr': 0.0006804842919181089, 'weight_decay': 0.2554396886428761, 'criterion': 'PoissonNLLLoss', 'batch_size': 256}. Best is trial 3 with value: 2.6063767406408775.[0m
Trial Id: 21 | Model params: 6576 | Timestamp: 2022-02-27 06:32:52.611787

[32m[I 2022-02-27 06:32:58,437][0m Trial 21 pruned. [0m
epoch 0 -1.0562300263905264 3.7090938745949678
Trial Id: 22 | Model params: 4912 | Timestamp: 2022-02-27 06:32:58.437555

[32m[I 2022-02-27 06:33:03,908][0m Trial 22 pruned. [0m
epoch 0 -1.0242687917720001 3.680154627463132
Trial Id: 23 | Model params: 9960 | Timestamp: 2022-02-27 06:33:03.908492

[32m[I 2022-02-27 06:33:09,402][0m Trial 23 pruned. [0m
epoch 0 -1.0352378787674317 3.690112148360612
Trial Id: 24 | Model params: 8671 | Timestamp: 2022-02-27 06:33:09.402676

[32m[I 2022-02-27 06:33:14,862][0m Trial 24 pruned. [0m
epoch 0 -1.0607090504301726 3.7131313809272357
Study statistics: 
  Number of finished trials:  25
  Number of pruned trials:  16
  Number of complete trials:  9

Best trial:
  Value:  2.6063767406408775
  Params: 
    n_layers_mlp: 4
    mlp_n_units_l0: 12
    mlp_dropout_l0: 0.23790606773632733
    mlp_n_units_l1: 46
    mlp_dropout_l1: 0.23868276934648622
    mlp_n_units_l2: 30
    mlp_dropout_l2: 0.06692152593822144
    mlp_n_units_l3: 74
    mlp_dropout_l3: 0.1879841555395841
    lr: 0.0010683208104020736
    weight_decay: 0.2766238940294552
    criterion: MSELoss
    batch_size: 32
Target: 67706, NaN: 0, Max: 52.0, Min: 0.0, Mean: 3.995007827962071
Prediction: 67706, NaN: 0, Max: 3.684130907058716, Min: 3.684130907058716, Mean: 3.684130907058716

 XXXXXX======== TRIAL des - rlbg ended

Test Set - R-squared:  -0.014444348200104429
Test Set - RMSE:  2.6052752917055213
Test Set - MAE:  1.9855361638581726



