[32m[I 2022-02-18 03:16:01,068][0m Trial 15 finished with value: 2.590243294512244 and parameters: {'n_layers_mlp': 4, 'mlp_n_units_l0': 15, 'mlp_dropout_l0': 0.1990685158596559, 'mlp_n_units_l1': 42, 'mlp_dropout_l1': 0.10788705990957048, 'mlp_n_units_l2': 29, 'mlp_dropout_l2': 0.11194547512854716, 'mlp_n_units_l3': 49, 'mlp_dropout_l3': 0.19780851723641346, 'lr': 0.0008608674918525156, 'weight_decay': 0.1965254862919612, 'criterion': 'MSELoss', 'batch_size': 256}. Best is trial 0 with value: 2.542335706520992.[0m
Trial Id: 16 | Model params: 2704 | Timestamp: 2022-02-18 03:16:01.068727

epoch 0 -2.397109458556357 4.768628506368844
epoch 5 -2.397109458556357 4.768628506368844
epoch 10 -2.397109458556357 4.768628506368844
epoch 15 -2.397109458556357 4.768628506368844
epoch 20 0.012287496107533324 2.5713073794689567
epoch 25 0.01729190773646705 2.564785126665607
epoch 30 0.020862170166423222 2.5601218455782906
epoch 35 0.022027416096343733 2.5585980255671696
epoch 40 0.023449969562369333 2.5567364871661127
epoch 45 0.025317460550778326 2.5542906487122945
epoch 50 0.025918235401065748 2.5535033205003375
epoch 55 0.027152616701096588 2.551884875278953
epoch 60 0.027865751776378622 2.5509493882388723
epoch 65 0.028531724913867684 2.5500754581064764
epoch 70 0.029341155401875985 2.5490128711902598
epoch 75 0.030316924040214133 2.547731333278285
epoch 80 0.030878346871600182 2.5469936893669636
epoch 85 0.03219997758351012 2.545256377283276
epoch 90 0.033436569862193344 2.54362977553005
epoch 95 0.03454460600628628 2.542171391194609
[32m[I 2022-02-18 03:28:07,832][0m Trial 16 finished with value: 2.542146508943635 and parameters: {'n_layers_mlp': 4, 'mlp_n_units_l0': 43, 'mlp_dropout_l0': 0.01048071780205545, 'mlp_n_units_l1': 11, 'mlp_dropout_l1': 0.2426981625835966, 'mlp_n_units_l2': 52, 'mlp_dropout_l2': 0.06598424471633312, 'mlp_n_units_l3': 16, 'mlp_dropout_l3': 0.010507656999217671, 'lr': 3.15390633591755e-05, 'weight_decay': 0.00714665318674708, 'criterion': 'MSELoss', 'batch_size': 256}. Best is trial 16 with value: 2.542146508943635.[0m
Trial Id: 17 | Model params: 2737 | Timestamp: 2022-02-18 03:28:07.832895

[32m[I 2022-02-18 03:28:21,094][0m Trial 17 pruned. [0m
epoch 0 -0.0022254001147758995 2.589492630565587
Trial Id: 18 | Model params: 6025 | Timestamp: 2022-02-18 03:28:21.094438

[32m[I 2022-02-18 03:28:28,462][0m Trial 18 pruned. [0m
epoch 0 0.009790309032412292 2.574555785331336
Trial Id: 19 | Model params: 6713 | Timestamp: 2022-02-18 03:28:28.463149

[32m[I 2022-02-18 03:28:35,721][0m Trial 19 pruned. [0m
epoch 0 -0.002980291432505222 2.591104448681019
Trial Id: 20 | Model params: 3850 | Timestamp: 2022-02-18 03:28:35.721541

epoch 0 -2.397109458556357 4.768628506368844
epoch 5 -2.397109458556357 4.768628506368844
epoch 10 -2.397109458556357 4.768628506368844
epoch 15 0.01016288907774865 2.5740713837103213
epoch 20 0.011086507587839911 2.572870168474082
epoch 25 0.00874859771099512 2.575909659639942
epoch 30 0.007317651436830941 2.5777682492117626
epoch 35 0.006504775688166542 2.5788234591230617
epoch 40 0.005252038894471123 2.5804488163472272
epoch 45 0.003460553738800276 2.5827713927361247
epoch 50 0.001357559889657911 2.585495163403684
epoch 55 0.0016948808240908608 2.585058462904191
epoch 60 0.0007883438469240556 2.586231911418686
epoch 65 -0.0010698318551369823 2.5886355268766588
epoch 70 -0.0010248655893576597 2.588577387785575
epoch 75 -0.0014059648311759432 2.589070088336187
epoch 80 -0.0005100454198923021 2.587911658450194
epoch 85 -0.0013798475400694787 2.589036325836031
epoch 90 -0.00023174130696679285 2.5875517037682547
epoch 95 -0.002475769970434749 2.59045267503523
[32m[I 2022-02-18 03:40:43,491][0m Trial 20 finished with value: 2.5903673380197945 and parameters: {'n_layers_mlp': 4, 'mlp_n_units_l0': 40, 'mlp_dropout_l0': 0.02771841299283695, 'mlp_n_units_l1': 12, 'mlp_dropout_l1': 0.24268752323981596, 'mlp_n_units_l2': 51, 'mlp_dropout_l2': 0.1712812232248066, 'mlp_n_units_l3': 38, 'mlp_dropout_l3': 0.15572491491887538, 'lr': 5.537544308809413e-05, 'weight_decay': 0.14825632446491105, 'criterion': 'MSELoss', 'batch_size': 256}. Best is trial 16 with value: 2.542146508943635.[0m
Trial Id: 21 | Model params: 8563 | Timestamp: 2022-02-18 03:40:43.491482

epoch 0 -2.397109458556357 4.768628506368844
epoch 5 -2.397109458556357 4.768628506368844
epoch 10 0.006438252796586386 2.5789097946773656
epoch 15 0.010146544785111344 2.5740926352889044
epoch 20 0.013350162400245447 2.5699237901075174
epoch 25 0.015681886380249366 2.566885276704683
epoch 30 0.017616754102709575 2.5643611808369973
epoch 35 0.019389307747718965 2.5620466462489326
epoch 40 0.020403449251957695 2.560721477153489
epoch 45 0.021878027560341406 2.5587934352463995
epoch 50 0.02279960335818021 2.5575877176165576
epoch 55 0.023297280583729707 2.556936359273107
epoch 60 0.024187333140478273 2.5557710474482564
epoch 65 0.02492369358392743 2.5548065570603558
epoch 70 0.02529082475655131 2.5543255498685964
epoch 75 0.025952355773425473 2.5534585977418027
epoch 80 0.02673388505611618 2.552434005601558
epoch 85 0.02734682809207556 2.551630143726567
epoch 90 0.027920869031466955 2.550877071415663
epoch 95 0.02839812843267342 2.55025079548233
[32m[I 2022-02-18 03:52:48,554][0m Trial 21 finished with value: 2.549648911222495 and parameters: {'n_layers_mlp': 4, 'mlp_n_units_l0': 19, 'mlp_dropout_l0': 0.13004265424324563, 'mlp_n_units_l1': 78, 'mlp_dropout_l1': 0.1706828103824933, 'mlp_n_units_l2': 41, 'mlp_dropout_l2': 0.0830506047211524, 'mlp_n_units_l3': 80, 'mlp_dropout_l3': 0.0020691737472973096, 'lr': 1.3864530631776083e-05, 'weight_decay': 0.010280576471583617, 'criterion': 'MSELoss', 'batch_size': 256}. Best is trial 16 with value: 2.542146508943635.[0m
Trial Id: 22 | Model params: 7666 | Timestamp: 2022-02-18 03:52:48.554539

[32m[I 2022-02-18 03:52:55,889][0m Trial 22 pruned. [0m
epoch 0 -2.060686598190636 4.5263501934623305
Trial Id: 23 | Model params: 14842 | Timestamp: 2022-02-18 03:52:55.889856

[32m[I 2022-02-18 03:53:03,317][0m Trial 23 pruned. [0m
epoch 0 -2.019838663456609 4.496044395230206
Trial Id: 24 | Model params: 8631 | Timestamp: 2022-02-18 03:53:03.317225

[32m[I 2022-02-18 03:53:10,606][0m Trial 24 pruned. [0m
epoch 0 -1.2202257691184566 3.855114574372256
Trial Id: 25 | Model params: 6269 | Timestamp: 2022-02-18 03:53:10.606505

[32m[I 2022-02-18 03:53:18,133][0m Trial 25 pruned. [0m
epoch 0 0.005170338081438852 2.580554783107568
Trial Id: 26 | Model params: 4868 | Timestamp: 2022-02-18 03:53:18.133484

[32m[I 2022-02-18 03:53:31,382][0m Trial 26 pruned. [0m
epoch 0 0.020228661444593454 2.5603205510930604
Trial Id: 27 | Model params: 4144 | Timestamp: 2022-02-18 03:53:31.382696

[32m[I 2022-02-18 03:53:38,763][0m Trial 27 pruned. [0m
epoch 0 -1.0891675695760226 3.7396017828329318
Trial Id: 28 | Model params: 9348 | Timestamp: 2022-02-18 03:53:38.763823

[32m[I 2022-02-18 03:53:46,112][0m Trial 28 pruned. [0m
epoch 0 0.019657348678049136 2.561696466352611
Trial Id: 29 | Model params: 3305 | Timestamp: 2022-02-18 03:53:46.113034

[32m[I 2022-02-18 03:53:53,491][0m Trial 29 pruned. [0m
epoch 0 -2.06843165559348 4.532073532190411
Trial Id: 30 | Model params: 10198 | Timestamp: 2022-02-18 03:53:53.491640

[32m[I 2022-02-18 03:54:00,915][0m Trial 30 pruned. [0m
epoch 0 0.0027932057290706025 2.5836360443520303
Trial Id: 31 | Model params: 8910 | Timestamp: 2022-02-18 03:54:00.915771

[32m[I 2022-02-18 03:54:08,237][0m Trial 31 pruned. [0m
epoch 0 -2.069794443904106 4.533079839631775
Trial Id: 32 | Model params: 10776 | Timestamp: 2022-02-18 03:54:08.237536

[32m[I 2022-02-18 03:54:15,543][0m Trial 32 pruned. [0m
epoch 0 -1.6332806065119514 4.198433616084387
Trial Id: 33 | Model params: 5952 | Timestamp: 2022-02-18 03:54:15.544163

epoch 0 -2.397109458556357 4.768628506368844
epoch 5 -2.397109458556357 4.768628506368844
epoch 10 -2.397109458556357 4.768628506368844
epoch 15 0.007676488835368422 2.577302297912311
epoch 20 0.010687230141431914 2.573389518936326
epoch 25 0.013338518350817785 2.5699389546725984
epoch 30 0.014348700211235021 2.568623016733792
epoch 35 0.016099726456094254 2.5663404013380067
epoch 40 0.016431069626539396 2.5659082381447047
epoch 45 0.017738071721133952 2.564202835406189
epoch 50 0.0182800478466284 2.5634953212330087
epoch 55 0.018299578581266074 2.563469821498706
epoch 60 0.019332259793777062 2.562121169907785
epoch 65 0.01968817789282662 2.5616561867058216
epoch 70 0.020318930352338893 2.5608319433924587
epoch 75 0.021058638907990312 2.5598649822767188
epoch 80 0.021462921523185186 2.559336341940432
epoch 85 0.021745582156210475 2.5589666697552333
epoch 90 0.02192557747234769 2.5587312385649743
epoch 95 0.022282205580932413 2.5582647103248464
[32m[I 2022-02-18 04:06:20,863][0m Trial 33 finished with value: 2.558511864318415 and parameters: {'n_layers_mlp': 4, 'mlp_n_units_l0': 21, 'mlp_dropout_l0': 0.16133245705086596, 'mlp_n_units_l1': 69, 'mlp_dropout_l1': 0.18254932164154464, 'mlp_n_units_l2': 29, 'mlp_dropout_l2': 0.0979533457240498, 'mlp_n_units_l3': 66, 'mlp_dropout_l3': 0.026164495936005797, 'lr': 1.0393151469930926e-05, 'weight_decay': 0.03444677344851811, 'criterion': 'MSELoss', 'batch_size': 256}. Best is trial 16 with value: 2.542146508943635.[0m
Trial Id: 34 | Model params: 6631 | Timestamp: 2022-02-18 04:06:20.863770

[32m[I 2022-02-18 04:06:28,284][0m Trial 34 pruned. [0m
epoch 0 0.0025965429191345812 2.5838907959634336
Trial Id: 35 | Model params: 11540 | Timestamp: 2022-02-18 04:06:28.284894

[32m[I 2022-02-18 04:06:35,729][0m Trial 35 pruned. [0m
epoch 0 -1.0525138098107076 3.706651574801806
Trial Id: 36 | Model params: 8443 | Timestamp: 2022-02-18 04:06:35.730089

[32m[I 2022-02-18 04:06:48,971][0m Trial 36 pruned. [0m
epoch 0 0.009540984346991244 2.574247096444069
Trial Id: 37 | Model params: 6184 | Timestamp: 2022-02-18 04:06:48.971827

[32m[I 2022-02-18 04:07:38,700][0m Trial 37 pruned. [0m
epoch 0 -0.0005761758763809244 2.587361167740593
Trial Id: 38 | Model params: 4225 | Timestamp: 2022-02-18 04:07:38.700288

[32m[I 2022-02-18 04:07:46,212][0m Trial 38 pruned. [0m
epoch 0 -1.0927144633395192 3.7427748995965127
Trial Id: 39 | Model params: 9598 | Timestamp: 2022-02-18 04:07:46.212554

[32m[I 2022-02-18 04:07:53,599][0m Trial 39 pruned. [0m
epoch 0 0.009142934783142764 2.5753972378090797
Trial Id: 40 | Model params: 2788 | Timestamp: 2022-02-18 04:07:53.599292

[32m[I 2022-02-18 04:08:00,439][0m Trial 40 pruned. [0m
epoch 0 0.02247702121400552 2.55800982348983
Trial Id: 41 | Model params: 5719 | Timestamp: 2022-02-18 04:08:00.440111

[32m[I 2022-02-18 04:08:07,688][0m Trial 41 pruned. [0m
epoch 0 -2.21875157039868 4.641757518015709
Trial Id: 42 | Model params: 6332 | Timestamp: 2022-02-18 04:08:07.688834

[32m[I 2022-02-18 04:08:15,059][0m Trial 42 pruned. [0m
epoch 0 -1.7424233759962062 4.284557459043804
Trial Id: 43 | Model params: 4611 | Timestamp: 2022-02-18 04:08:15.060198

[32m[I 2022-02-18 04:08:22,655][0m Trial 43 pruned. [0m
epoch 0 -2.190977943823956 4.621687975066791
Trial Id: 44 | Model params: 8236 | Timestamp: 2022-02-18 04:08:22.655695

[32m[I 2022-02-18 04:09:12,290][0m Trial 44 pruned. [0m
epoch 0 0.004242903706559331 2.581122887635128
Trial Id: 45 | Model params: 3721 | Timestamp: 2022-02-18 04:09:12.290474

[32m[I 2022-02-18 04:09:19,601][0m Trial 45 pruned. [0m
epoch 0 -2.2846698022440872 4.689046928775514
Trial Id: 46 | Model params: 5834 | Timestamp: 2022-02-18 04:09:19.601991

[32m[I 2022-02-18 04:09:27,103][0m Trial 46 pruned. [0m
epoch 0 -2.06112482168097 4.526674219121498
Trial Id: 47 | Model params: 2800 | Timestamp: 2022-02-18 04:09:27.104085

[32m[I 2022-02-18 04:09:34,513][0m Trial 47 pruned. [0m
epoch 0 -1.0534066726263815 3.70745770129531
Trial Id: 48 | Model params: 9379 | Timestamp: 2022-02-18 04:09:34.513845

[32m[I 2022-02-18 04:09:47,760][0m Trial 48 pruned. [0m
epoch 0 0.0017764266031538023 2.5843176140920177
Trial Id: 49 | Model params: 3273 | Timestamp: 2022-02-18 04:09:47.761174

[32m[I 2022-02-18 04:10:34,055][0m Trial 49 pruned. [0m
epoch 0 0.010849249451221565 2.5725464150269794
Trial Id: 50 | Model params: 11120 | Timestamp: 2022-02-18 04:10:34.055580

[32m[I 2022-02-18 04:10:41,462][0m Trial 50 pruned. [0m
epoch 0 0.007445473355279786 2.5776022817747033
Trial Id: 51 | Model params: 1325 | Timestamp: 2022-02-18 04:10:41.462378

[32m[I 2022-02-18 04:10:48,310][0m Trial 51 pruned. [0m
epoch 0 -1.707694264812102 4.257341937760179
Trial Id: 52 | Model params: 1362 | Timestamp: 2022-02-18 04:10:48.310401

[32m[I 2022-02-18 04:10:53,224][0m Trial 52 pruned. [0m
epoch 0 -1.481560624197407 4.07569019925361
Trial Id: 53 | Model params: 2208 | Timestamp: 2022-02-18 04:10:53.225181

epoch 0 -2.3971094492659617 4.768628499848235
epoch 5 -0.1487132408921623 2.772965931512629
epoch 10 0.0034412736443875103 2.58279637711363
epoch 15 0.008274999207454226 2.576524943147219
epoch 20 0.010907198452867473 2.5731034134532003
epoch 25 0.01363875931046643 2.5695479088778703
epoch 30 0.015316815485336033 2.567361244899887
epoch 35 0.017112118642183982 2.565019733111666
epoch 40 0.017424351774018687 2.564612286965557
epoch 45 0.018312446086444778 2.563453021277084
epoch 50 0.01898324831816689 2.5625770481360846
epoch 55 0.01963802233954659 2.56172171669186
epoch 60 0.019791969015740096 2.5615205746464795
epoch 65 0.02005804346660245 2.5611728926154624
epoch 70 0.02054790165121978 2.5605326667710444
epoch 75 0.021069292424911068 2.5598510531282606
epoch 80 0.021486326090147445 2.5593057347624892
epoch 85 0.02089132604105226 2.5600837288060863
epoch 90 0.021519613333482623 2.559262202945016
epoch 95 0.02188760355342223 2.558780909687781
[32m[I 2022-02-18 04:21:59,238][0m Trial 53 finished with value: 2.5584494689371358 and parameters: {'n_layers_mlp': 2, 'mlp_n_units_l0': 25, 'mlp_dropout_l0': 0.26725855227021933, 'mlp_n_units_l1': 66, 'mlp_dropout_l1': 0.23132493667654977, 'lr': 1.3457190962854044e-05, 'weight_decay': 0.04051132274372496, 'criterion': 'MSELoss', 'batch_size': 256}. Best is trial 16 with value: 2.542146508943635.[0m
Trial Id: 54 | Model params: 1830 | Timestamp: 2022-02-18 04:21:59.238994

[32m[I 2022-02-18 04:22:06,093][0m Trial 54 pruned. [0m
epoch 0 -2.1475966178718786 4.590164558151542
Trial Id: 55 | Model params: 10833 | Timestamp: 2022-02-18 04:22:06.093815

[32m[I 2022-02-18 04:22:13,377][0m Trial 55 pruned. [0m
epoch 0 0.019142339518435247 2.562369253525296
Trial Id: 56 | Model params: 1887 | Timestamp: 2022-02-18 04:22:13.377887

[32m[I 2022-02-18 04:22:18,139][0m Trial 56 pruned. [0m
epoch 0 -1.8751614540945547 4.387022270311523
Trial Id: 57 | Model params: 4122 | Timestamp: 2022-02-18 04:22:18.139708

[32m[I 2022-02-18 04:22:23,416][0m Trial 57 pruned. [0m
epoch 0 -2.208592506224226 4.634426542196099
Trial Id: 58 | Model params: 7198 | Timestamp: 2022-02-18 04:22:23.416964

epoch 0 -2.397109458556357 4.768628506368844
epoch 5 -2.397109458556357 4.768628506368844
epoch 10 0.0158226066868552 2.5667017863324983
epoch 15 0.01811135081030113 2.563715565043854
epoch 20 0.019088941301252493 2.5624390006931335
epoch 25 0.017184929056306197 2.5649247255266823
epoch 30 0.017937679275047413 2.5639422835888204
epoch 35 0.015261074636771843 2.567433910337575
epoch 40 0.018353770101432798 2.563399066591872
epoch 45 0.018315591496054107 2.5634489145140957
epoch 50 0.021024188880589878 2.559910024118062
epoch 55 0.019126933759489817 2.562389376265647
epoch 60 0.018322696163370678 2.5634396383737625
epoch 65 0.020912738272202858 2.560055735282115
epoch 70 0.01957519398191121 2.5618038017753557
epoch 75 0.019279886578101313 2.5621895848905485
epoch 80 0.019617284999391305 2.5617488102628623
epoch 85 0.01995127455728818 2.561312414240393
epoch 90 0.019864724728749228 2.561425508748087
epoch 95 0.020769447711763367 2.5602430619969136
[32m[I 2022-02-18 04:34:27,319][0m Trial 58 finished with value: 2.5624308372472653 and parameters: {'n_layers_mlp': 4, 'mlp_n_units_l0': 37, 'mlp_dropout_l0': 0.09799396015673414, 'mlp_n_units_l1': 70, 'mlp_dropout_l1': 0.22713288296375717, 'mlp_n_units_l2': 48, 'mlp_dropout_l2': 0.16143733167592855, 'mlp_n_units_l3': 10, 'mlp_dropout_l3': 0.28521418026503653, 'lr': 0.00016235939840947912, 'weight_decay': 0.052658970772447855, 'criterion': 'MSELoss', 'batch_size': 256}. Best is trial 16 with value: 2.542146508943635.[0m
Trial Id: 59 | Model params: 6571 | Timestamp: 2022-02-18 04:34:27.319574

[32m[I 2022-02-18 04:34:33,953][0m Trial 59 pruned. [0m
epoch 0 0.0011378546164022563 2.5857795573263025
Trial Id: 60 | Model params: 9576 | Timestamp: 2022-02-18 04:34:33.954070

[32m[I 2022-02-18 04:34:41,010][0m Trial 60 pruned. [0m
epoch 0 -1.1145084050380385 3.7622134200016726
Trial Id: 61 | Model params: 1429 | Timestamp: 2022-02-18 04:34:41.010549

[32m[I 2022-02-18 04:34:47,238][0m Trial 61 pruned. [0m
epoch 0 -1.628006451107788 4.19422702109248
Trial Id: 62 | Model params: 1083 | Timestamp: 2022-02-18 04:34:47.238319

epoch 0 -2.397109458556357 4.768628506368844
epoch 5 -1.4369564134170028 4.038895356048896
epoch 10 -0.1697304112806206 2.798218418521483
epoch 15 0.0021004915659786905 2.5845332557373264
epoch 20 0.0037442960308360362 2.582403673399973
epoch 25 0.004049229163566426 2.5820084331496522
epoch 30 0.005167534669112128 2.5805584190837902
epoch 35 0.006045723439493722 2.579419173104742
epoch 40 0.005925036552716589 2.579575766133194
epoch 45 0.0072256814700086824 2.5778876588949173
epoch 50 0.008078215549871537 2.5767805547597695
epoch 55 0.008325510698009242 2.5764593272897858
epoch 60 0.009771991880639042 2.5745795976164576
epoch 65 0.01015847119317781 2.574077128058273
epoch 70 0.011210627709005161 2.572708700873272
epoch 75 0.011914082783343827 2.5717933861258486
epoch 80 0.012433063043185921 2.571117895623113
epoch 85 0.013143406657850742 2.570193044024882
epoch 90 0.0143989303215587 2.5685575656653628
epoch 95 0.015217173576882126 2.5674911396248303
[32m[I 2022-02-18 04:45:55,644][0m Trial 62 finished with value: 2.566537449337807 and parameters: {'n_layers_mlp': 2, 'mlp_n_units_l0': 10, 'mlp_dropout_l0': 0.236098056188844, 'mlp_n_units_l1': 76, 'mlp_dropout_l1': 0.25230676715931116, 'lr': 1.0243379889042195e-05, 'weight_decay': 0.0428115285210091, 'criterion': 'MSELoss', 'batch_size': 256}. Best is trial 16 with value: 2.542146508943635.[0m
Trial Id: 63 | Model params: 1487 | Timestamp: 2022-02-18 04:45:55.644918

[32m[I 2022-02-18 04:46:01,583][0m Trial 63 pruned. [0m
epoch 0 -1.826041613891619 4.349386445131064
Trial Id: 64 | Model params: 2463 | Timestamp: 2022-02-18 04:46:01.583461

[32m[I 2022-02-18 04:46:07,811][0m Trial 64 pruned. [0m
epoch 0 -2.0763895731444832 4.537946648784326
Trial Id: 65 | Model params: 4935 | Timestamp: 2022-02-18 04:46:07.811646

[32m[I 2022-02-18 04:46:18,916][0m Trial 65 pruned. [0m
epoch 0 -0.8375503460310003 3.5063204145283735
Trial Id: 66 | Model params: 1899 | Timestamp: 2022-02-18 04:46:18.916648

[32m[I 2022-02-18 04:46:25,709][0m Trial 66 pruned. [0m
epoch 0 -1.9565160508024482 4.448656168304221
Trial Id: 67 | Model params: 7040 | Timestamp: 2022-02-18 04:46:25.709918

[32m[I 2022-02-18 04:46:33,236][0m Trial 67 pruned. [0m
epoch 0 -1.0653409279351527 3.7182158344000444
Trial Id: 68 | Model params: 3992 | Timestamp: 2022-02-18 04:46:33.236193

epoch 0 -2.397109458556357 4.768628506368844
epoch 5 -2.397109458556357 4.768628506368844
epoch 10 -2.397109458556357 4.768628506368844
epoch 15 -2.397109458556357 4.768628506368844
epoch 20 -2.397109458556357 4.768628506368844
epoch 25 -2.397109458556357 4.768628506368844
epoch 30 -0.00010626919743828012 2.5873894035033387
epoch 35 0.005343833489910965 2.5803297526601234
epoch 40 0.0069692093107793784 2.578220621637158
epoch 45 0.0052798802161605485 2.5804127048842704
epoch 50 0.01016717365579467 2.5740658126817384
epoch 55 0.008858182959965877 2.575767269171243
epoch 60 0.00919258550226798 2.5753327118894096
epoch 65 0.010349446827633613 2.573828800567581
epoch 70 0.009959887980405924 2.574335322352964
epoch 75 0.008175656963573363 2.5766539866620475
epoch 80 0.009365915346696507 2.5751074402898175
epoch 85 0.009586141458922004 2.5748211905884872
epoch 90 0.009182121144085675 2.5753463114711175
epoch 95 0.009618842278262818 2.5747786833795674
[32m[I 2022-02-18 04:58:38,118][0m Trial 68 finished with value: 2.5755020223889997 and parameters: {'n_layers_mlp': 4, 'mlp_n_units_l0': 13, 'mlp_dropout_l0': 0.19720694976735811, 'mlp_n_units_l1': 37, 'mlp_dropout_l1': 0.22211687983837178, 'mlp_n_units_l2': 62, 'mlp_dropout_l2': 0.035329153757375664, 'mlp_n_units_l3': 14, 'mlp_dropout_l3': 0.2550754809454786, 'lr': 1.4045893052229708e-05, 'weight_decay': 0.12023843386516507, 'criterion': 'MSELoss', 'batch_size': 256}. Best is trial 16 with value: 2.542146508943635.[0m
Trial Id: 69 | Model params: 3971 | Timestamp: 2022-02-18 04:58:38.118458

[32m[I 2022-02-18 04:58:44,838][0m Trial 69 pruned. [0m
epoch 0 0.0031872674784005905 2.583125511960102
Trial Id: 70 | Model params: 7416 | Timestamp: 2022-02-18 04:58:44.839184

