[32m[I 2022-02-16 13:11:35,228][0m A new study created in memory with name: NeuralNetwork[0m
++++++++ Session Characteristics +++++++

Area: des
Gal Type: lrg
Training Samples: 216656
Validation Samples: 54164
Test Samples: 67706
Number of features: 16
Device: cuda:0
Number of Workers: 8
Number of Trials: 100

+++++++++++++++++++++++++++++++++++++++
Trial Id: 0 | Model params: 5044 | Timestamp: 2022-02-16 13:11:35.229557

epoch 0 -1.9882775904114274 7.444119318271975
epoch 5 -1.992138988430661 7.448927343441747
epoch 10 -1.9795082991521595 7.433188671650468
epoch 15 -1.983850583062206 7.438603199971944
epoch 20 -1.9785530962289548 7.431997070219769
epoch 25 -1.9836035452851504 7.4382952666515365
epoch 30 -1.9901175969996543 7.4464107922625296
epoch 35 -1.9848810087253512 7.439887491158059
epoch 40 -2.0001814125210564 7.458931429380089
epoch 45 -2.0005225098492696 7.459355428619071
epoch 50 -1.9907338899936518 7.447178142409932
epoch 55 -1.9878739721561716 7.443616573158406
epoch 60 -1.9871963081379502 7.442772401481039
epoch 65 -1.9937198476346234 7.450894857387481
epoch 70 -1.9838225098128754 7.438568207225546
epoch 75 -1.989375203927148 7.4454863291291105
epoch 80 -1.9772999368561552 7.430433482749367
epoch 85 -1.9895238901221446 7.445671489437108
epoch 90 -1.9887286710179302 7.4446811421063135
epoch 95 -1.9927670051530098 7.449709025962405
[32m[I 2022-02-16 13:20:21,044][0m Trial 0 finished with value: 7.449607665602397 and parameters: {'n_layers_mlp': 4, 'mlp_n_units_l0': 29, 'mlp_dropout_l0': 0.28982656259628725, 'mlp_n_units_l1': 14, 'mlp_dropout_l1': 0.043970230475153284, 'mlp_n_units_l2': 63, 'mlp_dropout_l2': 0.0411898048901306, 'mlp_n_units_l3': 49, 'mlp_dropout_l3': 0.028008091610356833, 'lr': 0.0004037729932351671, 'weight_decay': 0.1866339634559922, 'criterion': 'PoissonNLLLoss', 'batch_size': 256}. Best is trial 0 with value: 7.449607665602397.[0m
Trial Id: 1 | Model params: 10190 | Timestamp: 2022-02-16 13:20:21.044379

epoch 0 -0.004636661853463231 4.316326020239343
epoch 5 0.004698610575653905 4.29622516024568
epoch 10 0.005771429472680278 4.293909120969996
epoch 15 0.005354508081366616 4.2948093339484785
epoch 20 0.005781181396017021 4.29388806244458
epoch 25 0.004622249788764576 4.296389963010582
epoch 30 0.005771206619650804 4.293909602202698
epoch 35 0.004660348542472215 4.296307738614197
epoch 40 0.005719078960597979 4.294022166093137
epoch 45 0.0026922143643072216 4.300553291497725
epoch 50 0.005648584696983261 4.2941743859330845
epoch 55 0.0049149328207426235 4.295758256659737
epoch 60 0.005492671930137583 4.294511032694375
epoch 65 0.0033085567747316302 4.299224201787156
epoch 70 0.004958351108366732 4.295664537786707
epoch 75 -0.003697096279865031 4.31430717097296
epoch 80 0.005825412290598075 4.293792547946641
epoch 85 0.005309847689398128 4.29490575308314
epoch 90 0.0046754695720570005 4.29627510410443
epoch 95 0.00420533453426819 4.297289643051116
[32m[I 2022-02-16 13:35:03,846][0m Trial 1 finished with value: 4.295081354876319 and parameters: {'n_layers_mlp': 4, 'mlp_n_units_l0': 40, 'mlp_dropout_l0': 0.13450764720203304, 'mlp_n_units_l1': 64, 'mlp_dropout_l1': 0.11348476120017643, 'mlp_n_units_l2': 59, 'mlp_dropout_l2': 0.10141310450896986, 'mlp_n_units_l3': 50, 'mlp_dropout_l3': 0.02662239619657546, 'lr': 0.0002667898404512264, 'weight_decay': 0.15699143624089382, 'criterion': 'MSELoss', 'batch_size': 128}. Best is trial 1 with value: 4.295081354876319.[0m
Trial Id: 2 | Model params: 3027 | Timestamp: 2022-02-16 13:35:03.846950

epoch 0 -0.008013872499438968 4.3235748658024065
epoch 5 0.003362564442022431 4.299107719290293
epoch 10 0.006466509148683408 4.292407891334575
epoch 15 0.0054629253400945155 4.294575258517693
epoch 20 0.006384040307936711 4.292586034578154
epoch 25 0.006770785875886309 4.29175055071576
epoch 30 0.006815392170667844 4.291654177574031
epoch 35 0.006415599891708701 4.2925178627140745
epoch 40 0.004989389507660258 4.2955975397916655
epoch 45 0.006059691569753722 4.293286597630799
epoch 50 0.006826932086432591 4.291629244912384
epoch 55 0.006775609229691448 4.2917401298299325
epoch 60 0.00658962718422873 4.2921419268727705
epoch 65 0.006631129005208569 4.292052269279473
epoch 70 0.006814545598207267 4.291656006637549
epoch 75 0.006703496062331449 4.291895928136777
epoch 80 0.006832957519674943 4.291616226554571
epoch 85 0.006683315736870865 4.29193952610396
epoch 90 0.006640426645830977 4.292032183058697
epoch 95 0.006460532709560485 4.29242080145593
[32m[I 2022-02-16 13:46:40,294][0m Trial 2 finished with value: 4.294892074471085 and parameters: {'n_layers_mlp': 2, 'mlp_n_units_l0': 49, 'mlp_dropout_l0': 0.2740636364270906, 'mlp_n_units_l1': 43, 'mlp_dropout_l1': 0.03434068666552779, 'lr': 5.698549328353426e-05, 'weight_decay': 0.24516943861390367, 'criterion': 'MSELoss', 'batch_size': 128}. Best is trial 2 with value: 4.294892074471085.[0m
Trial Id: 3 | Model params: 2855 | Timestamp: 2022-02-16 13:46:40.294772

epoch 0 0.005135222581804322 4.29528273754582
epoch 5 0.01031450066029016 4.284087500925672
epoch 10 0.01001790367049793 4.2847293979083005
epoch 15 0.00908292371290309 4.286752258059983
epoch 20 0.011035384218453848 4.282526959304077
epoch 25 0.009869201209477652 4.285051184476112
epoch 30 0.008619750534144877 4.287753995115311
epoch 35 0.010737883966104533 4.283171045568665
epoch 40 0.009902489836176032 4.2849791512314175
epoch 45 0.008814772984427233 4.287332234938447
epoch 50 0.00958990626079359 4.285655502999752
epoch 55 0.01098921729928748 4.282626916757289
epoch 60 0.011557031771768478 4.2813973615715195
epoch 65 0.0117124257004797 4.281060807350364
epoch 70 0.011675721199065348 4.28114030483045
epoch 75 0.009821854343481595 4.2851536362527405
epoch 80 0.011747409804436781 4.280985034667565
epoch 85 0.012077383719692025 4.280270272397599
epoch 90 0.012107153324694031 4.28020578206549
epoch 95 0.011959906325728853 4.2805247559174555
[32m[I 2022-02-16 14:29:21,082][0m Trial 3 finished with value: 4.280955926668772 and parameters: {'n_layers_mlp': 2, 'mlp_n_units_l0': 36, 'mlp_dropout_l0': 0.057406279822578586, 'mlp_n_units_l1': 59, 'mlp_dropout_l1': 0.11650440153888829, 'lr': 0.00028674780610115464, 'weight_decay': 0.0148265526873404, 'criterion': 'MSELoss', 'batch_size': 32}. Best is trial 3 with value: 4.280955926668772.[0m
Trial Id: 4 | Model params: 2479 | Timestamp: 2022-02-16 14:29:21.082446

epoch 0 -2.0891565466105813 7.568726555533229
epoch 5 -2.000364160121332 7.4591585958202415
epoch 10 -1.97476501251993 7.427269609776051
epoch 15 -1.9753344196129956 7.42798041174225
epoch 20 -1.9766857269904268 7.429667002876591
epoch 25 -1.9810264741905392 7.435082179439151
epoch 30 -1.9818531994223498 7.436113090097134
epoch 35 -1.9798245700866706 7.433583172841365
epoch 40 -1.9779787146822656 7.431280445796415
epoch 45 -1.9793440975077 7.432983846139429
epoch 50 -1.9773161302448 7.430453689603921
epoch 55 -1.9825977737852196 7.437041437873771
epoch 60 -1.9721320322133118 7.42398192424527
epoch 65 -1.9791788122185885 7.432777663187158
epoch 70 -1.9861295453857832 7.441443332260982
epoch 75 -1.9786183579756602 7.432078489358169
epoch 80 -1.9821104172170476 7.436433806650922
epoch 85 -1.9761620502703843 7.429013437949045
epoch 90 -1.9784675878366205 7.431890390455833
epoch 95 -1.9806658490807423 7.434632442000339
[32m[I 2022-02-16 14:37:52,744][0m Trial 4 finished with value: 7.433672763008968 and parameters: {'n_layers_mlp': 4, 'mlp_n_units_l0': 32, 'mlp_dropout_l0': 0.21438031987289363, 'mlp_n_units_l1': 12, 'mlp_dropout_l1': 0.21304757076724898, 'mlp_n_units_l2': 15, 'mlp_dropout_l2': 0.056923728057689416, 'mlp_n_units_l3': 79, 'mlp_dropout_l3': 0.019924626937459475, 'lr': 5.619819426958936e-05, 'weight_decay': 0.027715871726031602, 'criterion': 'PoissonNLLLoss', 'batch_size': 256}. Best is trial 3 with value: 4.280955926668772.[0m
Trial Id: 5 | Model params: 3769 | Timestamp: 2022-02-16 14:37:52.744789

epoch 0 -1.9978445639133113 7.456143960323979
epoch 5 -1.9861307578598435 7.441562599015642
epoch 10 -1.9798062492850104 7.433677952166554
epoch 15 -1.979837098107354 7.433716431114145
epoch 20 -1.9647889261569293 7.414922546552683
epoch 25 -1.986218927191386 7.441672459033519
epoch 30 -1.9858403590862328 7.441200747280124
epoch 35 -1.9792714187708156 7.433010805398924
epoch 40 -1.9816448223460643 7.435970928841322
epoch 45 -1.9752356480719575 7.427974659173171
epoch 50 -1.9810227786220405 7.43519522606701
epoch 55 -1.9580335064103722 7.406470093164699
epoch 60 -1.9527258359109978 7.399822306250684
epoch 65 -1.958627755790765 7.407214011248942
epoch 70 -1.9759237109862098 7.428833518611198
epoch 75 -2.008269935870493 7.469097535497764
epoch 80 -1.9764050060168437 7.4294342255597545
epoch 85 -1.976317366108446 7.429324845329791
epoch 90 -1.9845307855926855 7.439568733035351
epoch 95 -1.971293543598534 7.423052098166562
[32m[I 2022-02-16 14:52:59,448][0m Trial 5 finished with value: 7.454935144067445 and parameters: {'n_layers_mlp': 4, 'mlp_n_units_l0': 19, 'mlp_dropout_l0': 0.18679314270630074, 'mlp_n_units_l1': 62, 'mlp_dropout_l1': 0.061264977640429215, 'mlp_n_units_l2': 19, 'mlp_dropout_l2': 0.29243334343974775, 'mlp_n_units_l3': 48, 'mlp_dropout_l3': 0.14266511152514663, 'lr': 0.008511186735875522, 'weight_decay': 0.04851872901381538, 'criterion': 'PoissonNLLLoss', 'batch_size': 128}. Best is trial 3 with value: 4.280955926668772.[0m
Trial Id: 6 | Model params: 3579 | Timestamp: 2022-02-16 14:52:59.448864

epoch 0 -1.9861326420618446 7.441447190722765
epoch 5 -1.923586826206221 7.363102644600324
epoch 10 -1.9912346844570972 7.447801626412029
epoch 15 -1.9868489438104708 7.4423396497421885
epoch 20 -2.022256535070357 7.486322281577518
epoch 25 -1.987038418094886 7.442575702793984
epoch 30 -1.9691942737220822 7.420311956395153
epoch 35 -1.9645253624744763 7.414475624249539
epoch 40 -1.9918892038503668 7.448616417707623
epoch 45 -1.9502797565682886 7.39663956610688
epoch 50 -2.0094775514663206 7.4704783367345575
epoch 55 -1.9685814142678453 7.419546118493653
epoch 60 -1.9737117081959665 7.425954570135596
epoch 65 -2.0030219239160574 7.462461577107992
epoch 70 -2.005479197026961 7.465514095033413
epoch 75 -1.9921178223284675 7.448900996898885
epoch 80 -1.9914495349786963 7.448069097122355
epoch 85 -2.0080347347640597 7.468687357583528
epoch 90 -1.9626089884191988 7.412078747176486
epoch 95 -1.9915899282143137 7.448243869626308
[32m[I 2022-02-16 14:59:59,589][0m Trial 6 finished with value: 7.419676697516096 and parameters: {'n_layers_mlp': 2, 'mlp_n_units_l0': 41, 'mlp_dropout_l0': 0.06978076946895326, 'mlp_n_units_l1': 67, 'mlp_dropout_l1': 0.036524355624896365, 'lr': 0.0010810106363724843, 'weight_decay': 0.09013472897304715, 'criterion': 'PoissonNLLLoss', 'batch_size': 256}. Best is trial 3 with value: 4.280955926668772.[0m
Trial Id: 7 | Model params: 651 | Timestamp: 2022-02-16 14:59:59.589309

epoch 0 -2.090881407487647 7.570959100628812
epoch 5 -2.013646424309388 7.475769076064294
epoch 10 -2.0075956622289435 7.468260426804446
epoch 15 -2.001776095026568 7.461031548161898
epoch 20 -1.9987722112665312 7.457297478639364
epoch 25 -1.9974426905530547 7.4556441802333975
epoch 30 -1.9977237660413474 7.455993736491871
epoch 35 -1.9990991087302072 7.457703929184436
epoch 40 -1.997246183864648 7.455399787243794
epoch 45 -1.9985297130046282 7.45699595219617
epoch 50 -1.9989138043844878 7.457473532281204
epoch 55 -1.9990583253978924 7.457653222115308
epoch 60 -1.9996315193865715 7.458365858767054
epoch 65 -1.9967802887554398 7.454820327120393
epoch 70 -1.9978200580236831 7.456113485125806
epoch 75 -1.9986020897857673 7.4570859479872516
epoch 80 -1.999239384812074 7.457878335767311
epoch 85 -1.9978255564066374 7.456120322852505
epoch 90 -1.9944043691450744 7.451864560576292
epoch 95 -1.9948718814881339 7.4524462626880075
[32m[I 2022-02-16 15:44:43,444][0m Trial 7 finished with value: 7.459534824120707 and parameters: {'n_layers_mlp': 2, 'mlp_n_units_l0': 16, 'mlp_dropout_l0': 0.2610811411022442, 'mlp_n_units_l1': 21, 'mlp_dropout_l1': 0.10288571243462045, 'lr': 1.662123543377813e-05, 'weight_decay': 0.2517271115193118, 'criterion': 'PoissonNLLLoss', 'batch_size': 32}. Best is trial 3 with value: 4.280955926668772.[0m
Trial Id: 8 | Model params: 3967 | Timestamp: 2022-02-16 15:44:43.444586

epoch 0 -2.0112509047454963 7.472797275666113
epoch 5 -1.9830337457885636 7.43770265620621
epoch 10 -1.9778029928599623 7.4311787851854785
epoch 15 -1.9319439348020397 7.373735576816657
epoch 20 -1.9946195758425498 7.45213233709397
epoch 25 -1.9915618910340154 7.44832683012265
epoch 30 -1.9758809078303758 7.42878009340729
epoch 35 -2.004656497156721 7.464610365752426
epoch 40 -1.9729825792166333 7.425161620152372
epoch 45 -1.9640134208005078 7.413952715584157
epoch 50 -1.9128550204975152 7.349692405559051
epoch 55 -1.9872210740293044 7.44292103174894
epoch 60 -1.9577157323374887 7.406072253286382
epoch 65 -1.9826253901533284 7.437193555069177
epoch 70 -1.9378731167503878 7.381187652921454
epoch 75 -1.9938275730141095 7.4511468195630215
epoch 80 -1.9586111744680115 7.407193254738078
epoch 85 -1.98913336103374 7.445302965276036
epoch 90 -1.9759504826502523 7.428866933746668
epoch 95 -1.9825201506709371 7.437062346284628
[32m[I 2022-02-16 15:59:48,680][0m Trial 8 finished with value: 7.432953284111335 and parameters: {'n_layers_mlp': 4, 'mlp_n_units_l0': 32, 'mlp_dropout_l0': 0.2943981441271145, 'mlp_n_units_l1': 26, 'mlp_dropout_l1': 0.2043644440873469, 'mlp_n_units_l2': 32, 'mlp_dropout_l2': 0.07146023390605957, 'mlp_n_units_l3': 50, 'mlp_dropout_l3': 0.08035382931418798, 'lr': 0.006211061165991677, 'weight_decay': 0.03770542821359283, 'criterion': 'PoissonNLLLoss', 'batch_size': 128}. Best is trial 3 with value: 4.280955926668772.[0m
Trial Id: 9 | Model params: 5970 | Timestamp: 2022-02-16 15:59:48.680443

[32m[I 2022-02-16 16:00:14,058][0m Trial 9 pruned. [0m
epoch 0 0.005297380898482529 4.294932667758093
Trial Id: 10 | Model params: 3810 | Timestamp: 2022-02-16 16:00:14.058734

[32m[I 2022-02-16 16:00:39,390][0m Trial 10 pruned. [0m
epoch 0 0.006679252585084949 4.291948304162455
Trial Id: 11 | Model params: 3802 | Timestamp: 2022-02-16 16:00:39.390487

[32m[I 2022-02-16 16:01:04,999][0m Trial 11 pruned. [0m
epoch 0 0.005179300665970832 4.2951875839453315
Trial Id: 12 | Model params: 3369 | Timestamp: 2022-02-16 16:01:04.999421

[32m[I 2022-02-16 16:01:11,950][0m Trial 12 pruned. [0m
epoch 0 0.00046730086469226606 4.305347713338332
Trial Id: 13 | Model params: 2517 | Timestamp: 2022-02-16 16:01:11.950873

[32m[I 2022-02-16 16:01:37,810][0m Trial 13 pruned. [0m
epoch 0 -0.019825831172076036 4.348833024110981
Trial Id: 14 | Model params: 5637 | Timestamp: 2022-02-16 16:01:37.810993

[32m[I 2022-02-16 16:01:44,740][0m Trial 14 pruned. [0m
epoch 0 0.004801644170347008 4.296002781887179
Trial Id: 15 | Model params: 6854 | Timestamp: 2022-02-16 16:01:44.741044

[32m[I 2022-02-16 16:01:51,804][0m Trial 15 pruned. [0m
epoch 0 0.005700582120783726 4.294062107255184
Trial Id: 16 | Model params: 1398 | Timestamp: 2022-02-16 16:01:51.804826

[32m[I 2022-02-16 16:02:17,698][0m Trial 16 pruned. [0m
epoch 0 0.0008558540975647233 4.30451081256452
Trial Id: 17 | Model params: 3106 | Timestamp: 2022-02-16 16:02:17.698724

[32m[I 2022-02-16 16:02:24,655][0m Trial 17 pruned. [0m
epoch 0 0.006204838926399336 4.292973106997769
Trial Id: 18 | Model params: 1119 | Timestamp: 2022-02-16 16:02:24.655411

epoch 0 -3.582312501986956 9.218326386669025
epoch 5 0.006287225236445426 4.292795158081485
epoch 10 0.006979009130336777 4.29130066004825
epoch 15 0.007231153201534557 4.290755810179114
epoch 20 0.007429589728320418 4.2903269665292285
epoch 25 0.0072182491008276894 4.29078369590767
epoch 30 0.007888193648624697 4.289335707838815
epoch 35 0.007812413354412628 4.2894995204822415
epoch 40 0.008028184718602338 4.2890330756782875
epoch 45 0.008077185724817415 4.288927140444716
epoch 50 0.006919516575181306 4.291429205476727
epoch 55 0.00800007846114481 4.289093837391537
epoch 60 0.00731054050737312 4.29058425042739
epoch 65 0.008110908346166235 4.2888542340183395
epoch 70 0.008133198146343168 4.288806044033318
epoch 75 0.008104878910008773 4.288867269413987
epoch 80 0.00810248661240176 4.288872441453097
epoch 85 0.008156018204203863 4.288756707083622
epoch 90 0.008157857403350954 4.288752730711592
epoch 95 0.008150774582247888 4.288768043840976
[32m[I 2022-02-16 16:45:12,978][0m Trial 18 finished with value: 4.288926187463358 and parameters: {'n_layers_mlp': 2, 'mlp_n_units_l0': 10, 'mlp_dropout_l0': 0.030604581602551702, 'mlp_n_units_l1': 79, 'mlp_dropout_l1': 0.1404810791808827, 'lr': 2.466701066093189e-05, 'weight_decay': 0.11666296105467708, 'criterion': 'MSELoss', 'batch_size': 32}. Best is trial 3 with value: 4.280955926668772.[0m
Trial Id: 19 | Model params: 1131 | Timestamp: 2022-02-16 16:45:12.979020

[32m[I 2022-02-16 16:45:38,763][0m Trial 19 pruned. [0m
epoch 0 -0.0016053662128723278 4.309809263826213
Trial Id: 20 | Model params: 1150 | Timestamp: 2022-02-16 16:45:38.763613

[32m[I 2022-02-16 16:46:03,428][0m Trial 20 pruned. [0m
epoch 0 0.004537038004575611 4.296573860641048
Trial Id: 21 | Model params: 2931 | Timestamp: 2022-02-16 16:46:03.429106

[32m[I 2022-02-16 16:46:28,929][0m Trial 21 pruned. [0m
epoch 0 0.003393702767879536 4.2990405594295895
Trial Id: 22 | Model params: 1865 | Timestamp: 2022-02-16 16:46:28.929311

[32m[I 2022-02-16 16:46:54,970][0m Trial 22 pruned. [0m
epoch 0 0.0064255037868165 4.292496469084808
Trial Id: 23 | Model params: 1800 | Timestamp: 2022-02-16 16:46:54.970381

[32m[I 2022-02-16 16:47:20,666][0m Trial 23 pruned. [0m
epoch 0 0.004557721436511564 4.29652922394535
Trial Id: 24 | Model params: 5547 | Timestamp: 2022-02-16 16:47:20.666187

[32m[I 2022-02-16 16:47:45,978][0m Trial 24 pruned. [0m
epoch 0 0.0039727650909999745 4.297791433202931
Trial Id: 25 | Model params: 5895 | Timestamp: 2022-02-16 16:47:45.978925

epoch 0 -3.3152094591615224 8.945483050683471
epoch 5 -0.2551173798212123 4.824419101445802
epoch 10 0.0022714133927138613 4.301392410182001
epoch 15 0.00471717746890421 4.296117104748104
epoch 20 0.00567583492861945 4.2940475940362015
epoch 25 0.00588615354688915 4.293593433335778
epoch 30 0.00627367328233519 4.292756499830996
epoch 35 0.006270504620145556 4.292763343910699
epoch 40 0.006622398777303085 4.292003211449735
epoch 45 0.006843683671865608 4.291525141290545
epoch 50 0.006877820162228598 4.291451387107499
epoch 55 0.007140021590676393 4.290884841023765
epoch 60 0.007075092858342513 4.291025141350443
epoch 65 0.0073425491801524245 4.290447182691436
epoch 70 0.007458305027966405 4.290197016417939
epoch 75 0.007574197193396359 4.289946540926899
epoch 80 0.007543759697787533 4.2900123263123
epoch 85 0.00776067136728531 4.289543487209279
epoch 90 0.007741137414608468 4.28958571055433
epoch 95 0.007910332973863343 4.289219974443312
[32m[I 2022-02-16 16:54:33,542][0m Trial 25 finished with value: 4.289217988152129 and parameters: {'n_layers_mlp': 2, 'mlp_n_units_l0': 76, 'mlp_dropout_l0': 0.14070704414350071, 'mlp_n_units_l1': 59, 'mlp_dropout_l1': 0.08795369908705213, 'lr': 1.059196075825281e-05, 'weight_decay': 0.0716402797134675, 'criterion': 'MSELoss', 'batch_size': 256}. Best is trial 3 with value: 4.280955926668772.[0m
Trial Id: 26 | Model params: 6129 | Timestamp: 2022-02-16 16:54:33.542329

epoch 0 -3.0874147705225576 8.706171373507225
epoch 5 -0.01052052402446546 4.328878793310706
epoch 10 0.004942172513763388 4.29563148414207
epoch 15 0.006065595338721752 4.293205909878406
epoch 20 0.006443659767242593 4.292389325400254
epoch 25 0.006634567863741725 4.2919769223941096
epoch 30 0.006930083453163816 4.291338466296859
epoch 35 0.007178209314297801 4.290802321482443
epoch 40 0.007238452202035117 4.290672139889786
epoch 45 0.007437057621882626 4.290242936438635
epoch 50 0.007209505003607619 4.290734693698766
epoch 55 0.007464591087988137 4.290183430853329
epoch 60 0.0076969527868541165 4.28968121569169
epoch 65 0.007787580777028125 4.289485320866446
epoch 70 0.007893188415887709 4.289257035842732
epoch 75 0.007975671795836137 4.289078728543811
epoch 80 0.007982693861753098 4.289063548348126
epoch 85 0.008093238620847876 4.288824567282382
epoch 90 0.008066562225274798 4.288882238837777
epoch 95 0.008149684342935615 4.28870253502432
[32m[I 2022-02-16 17:01:19,387][0m Trial 26 finished with value: 4.288576613844539 and parameters: {'n_layers_mlp': 2, 'mlp_n_units_l0': 77, 'mlp_dropout_l0': 0.14167445677430132, 'mlp_n_units_l1': 61, 'mlp_dropout_l1': 0.0875780863939167, 'lr': 1.1392838362464215e-05, 'weight_decay': 0.07172902896130676, 'criterion': 'MSELoss', 'batch_size': 256}. Best is trial 3 with value: 4.280955926668772.[0m
Trial Id: 27 | Model params: 1191 | Timestamp: 2022-02-16 17:01:19.388118

epoch 0 -3.1623932926020775 8.785660421654745
epoch 5 -0.005956925269360314 4.31909293541181
epoch 10 0.0034149587154620464 4.29892668579763
epoch 15 0.005974013789147081 4.293403694255089
epoch 20 0.006655996544722709 4.2919306293093715
epoch 25 0.006751735523759073 4.29172379514296
epoch 30 0.007061531204105909 4.291054445278749
epoch 35 0.007225217738158096 4.290700739182497
epoch 40 0.007395722168868968 4.29033226945796
epoch 45 0.007227219567580878 4.2906964132993926
epoch 50 0.0072978600847716235 4.290543758829201
epoch 55 0.007879799331329207 4.289285978810726
epoch 60 0.007154332244713735 4.290853917433794
epoch 65 0.007476674876854883 4.290157314994841
epoch 70 0.007425284384401265 4.290268380618046
epoch 75 0.007757775022168789 4.289549747790223
epoch 80 0.00733500866850445 4.290463478396208
epoch 85 0.0069976592841638485 4.2911924565891955
epoch 90 0.007568303220018002 4.289959279810297
epoch 95 0.008031644972864682 4.288957725085197
