[32m[I 2022-02-17 03:26:37,324][0m Trial 98 pruned. [0m
epoch 0 -0.027838135794597374 7.30805528616923
Trial Id: 99 | Model params: 11572 | Timestamp: 2022-02-17 03:26:37.324201

epoch 0 -18.61379064900279 31.924215095733725
epoch 5 0.017479337817801976 7.145132827118087
epoch 10 0.022638025886544177 7.126350514088427
epoch 15 0.02049463630886339 7.134160404685713
epoch 20 0.024857467914081388 7.118254480224663
epoch 25 0.025393973434395534 7.116296044341664
epoch 30 0.02771425713959841 7.107819970620432
epoch 35 0.027730767793817446 7.107759620431786
epoch 40 0.02989873101770224 7.09983076673639
epoch 45 0.03089811417297761 7.096172757078981
epoch 50 0.028312522389750017 7.105632848128741
epoch 55 0.032485222640281086 7.090359637246542
epoch 60 0.03270378691335707 7.089558726053008
epoch 65 0.034385293593471644 7.083393951755016
epoch 70 0.034254490080682154 7.083873698713084
epoch 75 0.0324924705464672 7.0903330793277775
epoch 80 0.028497989423746373 7.104954685874544
epoch 85 0.029854228367520497 7.099993614508848
epoch 90 0.03451510310815287 7.082917818350339
epoch 95 0.03498852070904468 7.081181080094096
[32m[I 2022-02-17 03:35:03,289][0m Trial 99 finished with value: 7.08562144908247 and parameters: {'n_layers_mlp': 4, 'mlp_n_units_l0': 40, 'mlp_dropout_l0': 0.14904390742933998, 'mlp_n_units_l1': 62, 'mlp_dropout_l1': 0.14363814312517145, 'mlp_n_units_l2': 73, 'mlp_dropout_l2': 0.2592359277526397, 'mlp_n_units_l3': 50, 'mlp_dropout_l3': 0.07315732129204776, 'lr': 0.0002964297392608091, 'weight_decay': 0.1303521629482704, 'criterion': 'MSELoss', 'batch_size': 256}. Best is trial 4 with value: 7.0801956527286.[0m
Study statistics: 
  Number of finished trials:  100
  Number of pruned trials:  68
  Number of complete trials:  32

Best trial:
  Value:  7.0801956527286
  Params: 
    n_layers_mlp: 4
    mlp_n_units_l0: 43
    mlp_dropout_l0: 0.036547866584701216
    mlp_n_units_l1: 52
    mlp_dropout_l1: 0.010798612524738594
    mlp_n_units_l2: 45
    mlp_dropout_l2: 0.07619457259310598
    mlp_n_units_l3: 37
    mlp_dropout_l3: 0.14351994312657673
    lr: 0.0025520831171457286
    weight_decay: 0.05990478954993249
    criterion: MSELoss
    batch_size: 32
Target: 67706, NaN: 0, Max: 114.0, Min: 8.0, Mean: 31.139042330074144
Prediction: 67706, NaN: 0, Max: 35.34367370605469, Min: 29.465682983398438, Mean: 30.840276638697308

 XXXXXX======== TRIAL des - elg ended

Test Set - R-squared:  0.03491484505098619
Test Set - RMSE:  7.086900232415436
Test Set - MAE:  5.61681516180432



[32m[I 2022-02-17 03:35:14,005][0m A new study created in memory with name: NeuralNetwork[0m
++++++++ Session Characteristics +++++++

Area: des
Gal Type: qso
Training Samples: 216656
Validation Samples: 54164
Test Samples: 67706
Number of features: 16
Device: cuda:0
Number of Workers: 8
Number of Trials: 100

+++++++++++++++++++++++++++++++++++++++
Trial Id: 0 | Model params: 13646 | Timestamp: 2022-02-17 03:35:14.006346

epoch 0 -0.0008301455151329407 1.9861974466367343
epoch 5 -0.0031581976602834683 1.9885061727430875
epoch 10 -0.01844353614347538 2.0035985480218432
epoch 15 -0.0014259812782928538 1.9867885915928771
epoch 20 -0.008239901954001816 1.9935364039923589
epoch 25 -0.014453263792402637 1.9996696359061374
epoch 30 -0.004583819527463673 1.9899186376098192
epoch 35 -9.826047481009681e-06 1.9853832972832623
epoch 40 -0.011644268007935388 1.9968991990865275
epoch 45 -0.0036682000287844296 1.9890115835528004
epoch 50 -0.0006209091122415522 1.98598981573446
epoch 55 -0.016446767244181926 2.001633448331548
epoch 60 -0.005303101869174709 1.9906309013334298
epoch 65 -0.006388366468634832 1.9917050940367869
epoch 70 -0.002446978009203571 1.9878011416572214
epoch 75 -0.004743170505791872 1.9900764556543675
epoch 80 -0.003200583907148502 1.9885481822802789
epoch 85 -0.011368914964419607 1.9966274189214306
epoch 90 -0.00039988821869663127 1.9857704671873266
epoch 95 -0.008930226855931256 1.9942187576352555
[32m[I 2022-02-17 03:50:11,279][0m Trial 0 finished with value: 1.986673682593445 and parameters: {'n_layers_mlp': 4, 'mlp_n_units_l0': 52, 'mlp_dropout_l0': 0.10504945156068222, 'mlp_n_units_l1': 75, 'mlp_dropout_l1': 0.04460903782506126, 'mlp_n_units_l2': 80, 'mlp_dropout_l2': 0.22807977201160123, 'mlp_n_units_l3': 33, 'mlp_dropout_l3': 0.2675361847477372, 'lr': 0.008077771749338809, 'weight_decay': 0.2212250568433323, 'criterion': 'MSELoss', 'batch_size': 128}. Best is trial 0 with value: 1.986673682593445.[0m
Trial Id: 1 | Model params: 6064 | Timestamp: 2022-02-17 03:50:11.279396

epoch 0 -1.2676995772290254 2.9897507931100664
epoch 5 -1.222682916477749 2.959926902530957
epoch 10 -1.2146877644560052 2.954598570499202
epoch 15 -1.2479606900320035 2.9767104113836593
epoch 20 -1.239417750747855 2.971048821580835
epoch 25 -1.225895642578763 2.9620653093475724
epoch 30 -1.2260157657031572 2.9621452339703804
epoch 35 -1.2152355528361527 2.9549639481208865
epoch 40 -1.2226366345433273 2.9598960857520735
epoch 45 -1.2288285182587626 2.9640160992614826
epoch 50 -1.2416143842780816 2.9725056078009775
epoch 55 -1.228787225029814 2.9639886421553636
epoch 60 -1.2445724875912973 2.974466266108177
epoch 65 -1.2336712050019663 2.967234384788368
epoch 70 -1.2628482227380182 2.986551051226372
epoch 75 -1.2306463581488365 2.9652245835536406
epoch 80 -1.2368540324741542 2.9693476844446223
epoch 85 -1.2333131306501142 2.966996540223001
epoch 90 -1.2251863710703006 2.9615933474375353
epoch 95 -1.2312689668714625 2.965638375250686
[32m[I 2022-02-17 04:02:23,785][0m Trial 1 finished with value: 2.971319299249155 and parameters: {'n_layers_mlp': 2, 'mlp_n_units_l0': 65, 'mlp_dropout_l0': 0.15983505600928916, 'mlp_n_units_l1': 74, 'mlp_dropout_l1': 0.1833204660297473, 'lr': 0.0015220690344330146, 'weight_decay': 0.12114219500655099, 'criterion': 'PoissonNLLLoss', 'batch_size': 128}. Best is trial 0 with value: 1.986673682593445.[0m
Trial Id: 2 | Model params: 1730 | Timestamp: 2022-02-17 04:02:23.785886

epoch 0 0.017568967117923218 1.9678557786643063
epoch 5 0.021693795828836904 1.9637203199177797
epoch 10 0.01298902040397032 1.9724373700345113
epoch 15 0.012014718422926007 1.9734106497951107
epoch 20 0.017688680147335045 1.9677358795844808
epoch 25 0.017268968644644223 1.9681562112892186
epoch 30 0.01914720397641312 1.966274501844706
epoch 35 0.021236382178731916 1.964179341595434
epoch 40 0.021489916315824975 1.9639249294173686
epoch 45 0.02017972877198937 1.965239299741527
epoch 50 0.014870034828548762 1.9705569692105633
epoch 55 0.018600765771074945 1.96682213646987
epoch 60 0.014384571956073233 1.9710424454698545
epoch 65 0.019854913493209225 1.9655650160363043
epoch 70 0.014454161322131953 1.9709728615268955
epoch 75 0.01581276687771349 1.9696138693522154
epoch 80 0.01690339483629355 1.9685222521678403
epoch 85 0.019255550816725586 1.966165899660036
epoch 90 0.01880092501901942 1.9666215566747576
epoch 95 0.012785578961039379 1.972640637696917
[32m[I 2022-02-17 04:45:47,037][0m Trial 2 finished with value: 1.964711090470626 and parameters: {'n_layers_mlp': 2, 'mlp_n_units_l0': 41, 'mlp_dropout_l0': 0.03234428962104924, 'mlp_n_units_l1': 24, 'mlp_dropout_l1': 0.1537958947956533, 'lr': 0.001507053213656798, 'weight_decay': 0.23752288687528533, 'criterion': 'MSELoss', 'batch_size': 32}. Best is trial 2 with value: 1.964711090470626.[0m
Trial Id: 3 | Model params: 7167 | Timestamp: 2022-02-17 04:45:47.037799

epoch 0 0.025130368331543917 1.9602682288830198
epoch 5 0.02973698424660154 1.9556312520196255
epoch 10 0.028029497271893966 1.9573512738199204
epoch 15 0.03062367727084092 1.95473745265059
epoch 20 0.030781881353948104 1.954577937683268
epoch 25 0.03067249320531862 1.9546882336143274
epoch 30 0.03026335748901332 1.9551007094775448
epoch 35 0.03059020646417865 1.9547711991291574
epoch 40 0.030192264381371015 1.9551723741088032
epoch 45 0.03025940036611907 1.955104698481129
epoch 50 0.03073755714351223 1.9546226304782544
epoch 55 0.030279798274698178 1.9550841361489795
epoch 60 0.0306131171874392 1.9547480997717481
epoch 65 0.030538202089076094 1.9548236306663878
epoch 70 0.030443854216314237 1.9549187499194287
epoch 75 0.030696138374481152 1.9546643927476015
epoch 80 0.02906634573198641 1.9563069940949747
epoch 85 0.030071568204846355 1.955294034557358
epoch 90 0.030570214550892927 1.9547913554217216
epoch 95 0.030143790707831797 1.9552212359603087
[32m[I 2022-02-17 05:29:11,676][0m Trial 3 finished with value: 1.9563375445149063 and parameters: {'n_layers_mlp': 2, 'mlp_n_units_l0': 73, 'mlp_dropout_l0': 0.052399921717965765, 'mlp_n_units_l1': 79, 'mlp_dropout_l1': 0.22591466918932693, 'lr': 5.5960693139385724e-05, 'weight_decay': 0.035640846311539985, 'criterion': 'MSELoss', 'batch_size': 32}. Best is trial 3 with value: 1.9563375445149063.[0m
Trial Id: 4 | Model params: 1871 | Timestamp: 2022-02-17 05:29:11.677068

epoch 0 -1.2752211562499585 2.9947049393716405
epoch 5 -1.2910361702870348 3.005094980681797
epoch 10 -1.3046441512989575 3.0140063921591325
epoch 15 -1.2756664016194876 2.994997946773755
epoch 20 -1.2735253851253665 2.99358872243828
epoch 25 -1.2925153792854798 3.0060649449102312
epoch 30 -1.2910284968719976 3.0050899481640605
epoch 35 -1.259580865929069 2.984394111836309
epoch 40 -1.320914761233376 3.0246270062669915
epoch 45 -1.3311954764573573 3.0313185424119635
epoch 50 -1.2693066652856606 2.99081000348095
epoch 55 -1.302476333790779 3.012588526190127
epoch 60 -1.3242905811357208 3.0268258991412353
epoch 65 -1.3085738634857953 3.016574930340057
epoch 70 -1.2825177352125983 2.9995030685661863
epoch 75 -1.2945274696297266 3.0073838341384875
epoch 80 -1.3024300101366957 3.0125582208165893
epoch 85 -1.2685002852829914 2.9902785760408523
epoch 90 -1.2824010264861534 2.9994263829280645
epoch 95 -1.2729173759354393 2.993188407761423
[32m[I 2022-02-17 06:14:21,494][0m Trial 4 finished with value: 3.0188421524069637 and parameters: {'n_layers_mlp': 2, 'mlp_n_units_l0': 26, 'mlp_dropout_l0': 0.16404519241518686, 'mlp_n_units_l1': 51, 'mlp_dropout_l1': 0.22972851613856332, 'lr': 0.002742443807580673, 'weight_decay': 0.26284048969591106, 'criterion': 'PoissonNLLLoss', 'batch_size': 32}. Best is trial 3 with value: 1.9563375445149063.[0m
Trial Id: 5 | Model params: 5539 | Timestamp: 2022-02-17 06:14:21.495184

[32m[I 2022-02-17 06:14:26,507][0m Trial 5 pruned. [0m
epoch 0 0.00961750409420925 1.9757419834111414
Trial Id: 6 | Model params: 9830 | Timestamp: 2022-02-17 06:14:26.508187

[32m[I 2022-02-17 06:14:31,821][0m Trial 6 pruned. [0m
epoch 0 0.017970148305581968 1.9673928797641882
Trial Id: 7 | Model params: 1692 | Timestamp: 2022-02-17 06:14:31.821315

epoch 0 -1.5392731569043319 3.163613800018093
epoch 5 -1.2711801879580062 2.9919514775293288
epoch 10 -1.2611233316614667 2.985319901219991
epoch 15 -1.2731343671672524 2.993238375033024
epoch 20 -1.2769283905788629 2.995735297766351
epoch 25 -1.2792127828853377 2.997237698783506
epoch 30 -1.2831860408928288 2.9998490418896466
epoch 35 -1.2870068690444927 3.0023580613480623
epoch 40 -1.2879258295415141 3.0029612015026634
epoch 45 -1.2895841670174586 3.0040493095552097
epoch 50 -1.2858221340948157 3.0015803069497338
epoch 55 -1.2896769039894527 3.0041101467193996
epoch 60 -1.2881692509355829 3.0031209456583765
epoch 65 -1.289684132158222 3.0041148884796818
epoch 70 -1.2907580811585229 3.004819327994778
epoch 75 -1.288456179701889 3.003309230414048
epoch 80 -1.286157830785824 3.001800705459671
epoch 85 -1.2875089591006872 3.002687612478955
epoch 90 -1.2858631235126645 3.0016072190344536
epoch 95 -1.2893778392177757 3.003913950292683
[32m[I 2022-02-17 06:21:37,512][0m Trial 7 finished with value: 3.003343399936253 and parameters: {'n_layers_mlp': 2, 'mlp_n_units_l0': 23, 'mlp_dropout_l0': 0.08804034972595079, 'mlp_n_units_l1': 52, 'mlp_dropout_l1': 0.07872092157550377, 'lr': 6.152128016392546e-05, 'weight_decay': 0.27747776608926233, 'criterion': 'PoissonNLLLoss', 'batch_size': 256}. Best is trial 3 with value: 1.9563375445149063.[0m
Trial Id: 8 | Model params: 10262 | Timestamp: 2022-02-17 06:21:37.512395

epoch 0 -1.2174150306977372 2.9563254629648674
epoch 5 -1.2127176544981193 2.9531924601161945
epoch 10 -1.2131844048295717 2.95350391668057
epoch 15 -1.1991440271547238 2.944120539441242
epoch 20 -1.2061940301014498 2.948835885485154
epoch 25 -1.2076736573998086 2.949824567055655
epoch 30 -1.2128164462396125 2.9532583853301753
epoch 35 -1.2113792710477398 2.9522991916585926
epoch 40 -1.2081378521627468 2.9501346720252584
epoch 45 -1.2087818275192403 2.950564825317386
epoch 50 -1.1974265109578832 2.942970646045758
epoch 55 -1.21628768492792 2.955573861512286
epoch 60 -1.2148733386085522 2.9546306463863905
epoch 65 -1.2130190678612989 2.9533935931795674
epoch 70 -1.207278561599936 2.949560597912892
epoch 75 -1.2050729411186731 2.948086557125232
epoch 80 -1.2021054056575822 2.9461021563785432
epoch 85 -1.1894890061398682 2.93765056440617
epoch 90 -1.2163549669782996 2.9556187238200096
epoch 95 -1.1871459535380384 2.936078299777001
[32m[I 2022-02-17 06:30:19,813][0m Trial 8 finished with value: 2.9372471966752283 and parameters: {'n_layers_mlp': 4, 'mlp_n_units_l0': 30, 'mlp_dropout_l0': 0.17793968052901263, 'mlp_n_units_l1': 57, 'mlp_dropout_l1': 0.0015147476436501162, 'mlp_n_units_l2': 79, 'mlp_dropout_l2': 0.05822797334729729, 'mlp_n_units_l3': 42, 'mlp_dropout_l3': 0.031019548892913494, 'lr': 0.0010748624705098583, 'weight_decay': 0.043044221443486526, 'criterion': 'PoissonNLLLoss', 'batch_size': 256}. Best is trial 3 with value: 1.9563375445149063.[0m
Trial Id: 9 | Model params: 9520 | Timestamp: 2022-02-17 06:30:19.813660

epoch 0 -1.5896081651001905 3.194914630317223
epoch 5 -1.2489651777029631 2.977375399648924
epoch 10 -1.253433166018056 2.980331487635638
epoch 15 -1.2262854586419851 2.9623246678877844
epoch 20 -1.2314199462226112 2.965738708870312
epoch 25 -1.2244754399453948 2.961120205700643
epoch 30 -1.2293781785877989 2.9643815606725816
epoch 35 -1.2265957249661286 2.9625310829190097
epoch 40 -1.2248799724448571 2.9613894410632278
epoch 45 -1.226753998959131 2.9626363744378796
epoch 50 -1.2277980650142144 2.963330843961682
epoch 55 -1.2217765916275791 2.9593233686635485
epoch 60 -1.2228275679116964 2.960023216472499
epoch 65 -1.2239092864024546 2.9607433628396986
epoch 70 -1.2268484362049974 2.9626991968811036
epoch 75 -1.2248112609994521 2.961343712097511
epoch 80 -1.2224059813410664 2.9597425007681806
epoch 85 -1.223255071146235 2.9603078446372773
epoch 90 -1.2216656255636975 2.959249466416225
epoch 95 -1.222124654243589 2.959555162782576
[32m[I 2022-02-17 06:45:43,064][0m Trial 9 finished with value: 2.959938778435407 and parameters: {'n_layers_mlp': 4, 'mlp_n_units_l0': 56, 'mlp_dropout_l0': 0.010939152920059935, 'mlp_n_units_l1': 70, 'mlp_dropout_l1': 0.04097496997214388, 'mlp_n_units_l2': 37, 'mlp_dropout_l2': 0.1285221377721794, 'mlp_n_units_l3': 50, 'mlp_dropout_l3': 0.17628062832445762, 'lr': 1.6910108408626408e-05, 'weight_decay': 0.08967461914600197, 'criterion': 'PoissonNLLLoss', 'batch_size': 128}. Best is trial 3 with value: 1.9563375445149063.[0m
Trial Id: 10 | Model params: 3843 | Timestamp: 2022-02-17 06:45:43.065342

[32m[I 2022-02-17 06:46:09,574][0m Trial 10 pruned. [0m
epoch 0 0.011061973638737732 1.9743619309952465
Trial Id: 11 | Model params: 1143 | Timestamp: 2022-02-17 06:46:09.574645

[32m[I 2022-02-17 06:46:34,807][0m Trial 11 pruned. [0m
epoch 0 0.021322907177954042 1.9640925206464923
Trial Id: 12 | Model params: 1992 | Timestamp: 2022-02-17 06:46:34.807875

[32m[I 2022-02-17 06:46:57,726][0m Trial 12 pruned. [0m
epoch 0 0.018783722817084403 1.9666387958231297
Trial Id: 13 | Model params: 4395 | Timestamp: 2022-02-17 06:46:57.726923

[32m[I 2022-02-17 06:47:24,019][0m Trial 13 pruned. [0m
epoch 0 0.024309800722993713 1.961093054182306
Trial Id: 14 | Model params: 1373 | Timestamp: 2022-02-17 06:47:24.019846

[32m[I 2022-02-17 06:47:50,143][0m Trial 14 pruned. [0m
epoch 0 0.020755519055340566 1.9646617795492145
Trial Id: 15 | Model params: 708 | Timestamp: 2022-02-17 06:47:50.143377

[32m[I 2022-02-17 06:48:16,491][0m Trial 15 pruned. [0m
epoch 0 -0.002766459495843643 1.9881178741561754
Trial Id: 16 | Model params: 4047 | Timestamp: 2022-02-17 06:48:16.491866

[32m[I 2022-02-17 06:48:42,803][0m Trial 16 pruned. [0m
epoch 0 0.017256344460963136 1.9681688527368466
Trial Id: 17 | Model params: 3162 | Timestamp: 2022-02-17 06:48:42.803217

[32m[I 2022-02-17 06:49:08,934][0m Trial 17 pruned. [0m
epoch 0 0.017908948959457383 1.9675152493543553
Trial Id: 18 | Model params: 2181 | Timestamp: 2022-02-17 06:49:08.934746

[32m[I 2022-02-17 06:49:34,879][0m Trial 18 pruned. [0m
epoch 0 0.022353209143886166 1.9630583995513322
Trial Id: 19 | Model params: 1410 | Timestamp: 2022-02-17 06:49:34.880118

epoch 0 -2.916524281914817 3.9290960166779114
epoch 5 0.023243033419852455 1.962164838255898
epoch 10 0.02635090812885732 1.9590407136034071
epoch 15 0.026809333665835045 1.958579469386109
epoch 20 0.0280783749333946 1.957302058357355
epoch 25 0.02768536081033668 1.957697753639325
epoch 30 0.028264785958279748 1.9571143476563022
epoch 35 0.028919478075616567 1.9564549482613944
epoch 40 0.02813765594163742 1.9572423659882374
epoch 45 0.027869635023971884 1.9575122322588174
epoch 50 0.02839648178154852 1.9569817227833493
epoch 55 0.028661601158512684 1.9567147058554353
epoch 60 0.028245559374743268 1.9571337091221757
epoch 65 0.02884102282675516 1.9565339793284626
epoch 70 0.028554285824840764 1.9568227936712934
epoch 75 0.028306353519130245 1.9570724878273196
epoch 80 0.02864232665334565 1.956734119543116
epoch 85 0.02885677656276242 1.9565181102248848
epoch 90 0.028773687993825292 1.956601805816305
epoch 95 0.028352487418118244 1.9570260285052483
[32m[I 2022-02-17 07:33:03,140][0m Trial 19 finished with value: 1.9565905395153858 and parameters: {'n_layers_mlp': 2, 'mlp_n_units_l0': 37, 'mlp_dropout_l0': 0.016587051772175725, 'mlp_n_units_l1': 20, 'mlp_dropout_l1': 0.16504206000548047, 'lr': 2.9452309725506376e-05, 'weight_decay': 0.05333398725179116, 'criterion': 'MSELoss', 'batch_size': 32}. Best is trial 3 with value: 1.9563375445149063.[0m
Trial Id: 20 | Model params: 2137 | Timestamp: 2022-02-17 07:33:03.140910

[32m[I 2022-02-17 07:33:10,309][0m Trial 20 pruned. [0m
epoch 0 -0.14220214145025234 2.1218452910911316
Trial Id: 21 | Model params: 1327 | Timestamp: 2022-02-17 07:33:10.310084

[32m[I 2022-02-17 07:33:36,691][0m Trial 21 pruned. [0m
epoch 0 0.01618464808905251 1.9692417188246611
Trial Id: 22 | Model params: 2074 | Timestamp: 2022-02-17 07:33:36.692119

epoch 0 -2.916524281914817 3.9290960166779114
epoch 5 0.02866772726433231 1.9567085354722498
epoch 10 0.029201731250392715 1.956170597097711
epoch 15 0.029957528234806685 1.9554089786665787
epoch 20 0.030367879034737255 1.9549953429038127
epoch 25 0.030498544537756134 1.9548636130183634
epoch 30 0.029739767083870383 1.9556284475185026
epoch 35 0.030387505846112273 1.9549755567817493
epoch 40 0.03022748291187538 1.9551368727818246
epoch 45 0.03020056097847168 1.9551640109500308
epoch 50 0.03025071509583488 1.9551134536960422
epoch 55 0.03052415328478142 1.9548377946258053
epoch 60 0.03027849652780812 1.955085448395458
epoch 65 0.029788851968884256 1.9555789798559662
epoch 70 0.029586007120949165 1.9557833984456996
epoch 75 0.030288696362633538 1.955075166267543
epoch 80 0.0302752816805264 1.9550886891691788
epoch 85 0.029524987437114514 1.9558448873615182
epoch 90 0.030266252513130754 1.9550977911244158
epoch 95 0.0302542838171157 1.9551098562397118
[32m[I 2022-02-17 08:16:54,368][0m Trial 22 finished with value: 1.9554414462709924 and parameters: {'n_layers_mlp': 2, 'mlp_n_units_l0': 47, 'mlp_dropout_l0': 0.07018039816716848, 'mlp_n_units_l1': 26, 'mlp_dropout_l1': 0.1189348202544692, 'lr': 6.270434104526228e-05, 'weight_decay': 0.037459379740359934, 'criterion': 'MSELoss', 'batch_size': 32}. Best is trial 22 with value: 1.9554414462709924.[0m
Trial Id: 23 | Model params: 1517 | Timestamp: 2022-02-17 08:16:54.368905

epoch 0 -2.916524281914817 3.9290960166779114
epoch 5 0.02819226090606175 1.9571873804999738
epoch 10 0.029622780472115973 1.9557463413795362
epoch 15 0.03025316609831863 1.9551109829590003
epoch 20 0.030342257333532796 1.955021172274847
epoch 25 0.030587596131403605 1.9547738309366385
epoch 30 0.029972074653316194 1.955394317296162
epoch 35 0.030757593616620782 1.9546024275154448
epoch 40 0.03047806904673911 1.9548842558862967
epoch 45 0.030403413677487112 1.9549595196796878
epoch 50 0.030601432231479708 1.9547598809692406
epoch 55 0.030631481040166664 1.9547295845241899
epoch 60 0.030901733505470208 1.9544570837654722
epoch 65 0.029916787666716127 1.9554500405986714
epoch 70 0.029790982442719494 1.9555768327397713
epoch 75 0.030618175750656174 1.9547429995223475
epoch 80 0.030745396404746383 1.9546147261028661
epoch 85 0.03053353695370664 1.9548283340522816
epoch 90 0.03073519774611999 1.95462500946692
epoch 95 0.03077207344858801 1.9545878272357664
[32m[I 2022-02-17 09:00:28,263][0m Trial 23 finished with value: 1.9566039451917594 and parameters: {'n_layers_mlp': 2, 'mlp_n_units_l0': 48, 'mlp_dropout_l0': 0.0826515509974952, 'mlp_n_units_l1': 14, 'mlp_dropout_l1': 0.11515545742574251, 'lr': 5.29699862954301e-05, 'weight_decay': 0.029996626083624748, 'criterion': 'MSELoss', 'batch_size': 32}. Best is trial 22 with value: 1.9554414462709924.[0m
Trial Id: 24 | Model params: 2719 | Timestamp: 2022-02-17 09:00:28.264116

[32m[I 2022-02-17 09:00:54,429][0m Trial 24 pruned. [0m
epoch 0 -0.025302641753725874 2.010334234354366
Trial Id: 25 | Model params: 567 | Timestamp: 2022-02-17 09:00:54.429385

[32m[I 2022-02-17 09:01:20,247][0m Trial 25 pruned. [0m
epoch 0 0.024008586750485783 1.9613957440351184
Trial Id: 26 | Model params: 4542 | Timestamp: 2022-02-17 09:01:20.248016

