[32m[I 2022-02-17 17:21:21,035][0m Trial 27 finished with value: 9.713195696991859 and parameters: {'n_layers_mlp': 4, 'mlp_n_units_l0': 55, 'mlp_dropout_l0': 0.09671927800713322, 'mlp_n_units_l1': 31, 'mlp_dropout_l1': 0.266372362746158, 'mlp_n_units_l2': 10, 'mlp_dropout_l2': 0.16356420497762542, 'mlp_n_units_l3': 72, 'mlp_dropout_l3': 0.18268773374781316, 'lr': 1.096093848158068e-05, 'weight_decay': 0.24252457604973054, 'criterion': 'MSELoss', 'batch_size': 128}. Best is trial 3 with value: 9.12512482353794.[0m
Trial Id: 28 | Model params: 783 | Timestamp: 2022-02-17 17:21:21.036004

[32m[I 2022-02-17 17:21:28,093][0m Trial 28 pruned. [0m
epoch 0 -8.903762831707525 30.01226448000601
Trial Id: 29 | Model params: 6550 | Timestamp: 2022-02-17 17:21:28.093876

[32m[I 2022-02-17 17:22:02,296][0m Trial 29 pruned. [0m
epoch 0 -7.596676456196244 27.961723710995404
Trial Id: 30 | Model params: 5223 | Timestamp: 2022-02-17 17:22:02.296517

[32m[I 2022-02-17 17:22:28,495][0m Trial 30 pruned. [0m
epoch 0 0.07257231183877777 9.184143860960221
Trial Id: 31 | Model params: 4479 | Timestamp: 2022-02-17 17:22:28.496153

[32m[I 2022-02-17 17:22:35,841][0m Trial 31 pruned. [0m
epoch 0 -8.967480166427643 30.10865388368138
Trial Id: 32 | Model params: 4062 | Timestamp: 2022-02-17 17:22:35.841967

[32m[I 2022-02-17 17:22:42,950][0m Trial 32 pruned. [0m
epoch 0 -9.096000257302567 30.30214176386172
Trial Id: 33 | Model params: 3750 | Timestamp: 2022-02-17 17:22:42.950456

[32m[I 2022-02-17 17:22:49,993][0m Trial 33 pruned. [0m
epoch 0 -8.49412881856821 29.385034786403978
Trial Id: 34 | Model params: 3698 | Timestamp: 2022-02-17 17:22:49.993746

[32m[I 2022-02-17 17:22:57,121][0m Trial 34 pruned. [0m
epoch 0 0.048379665183803766 9.303160338712814
Trial Id: 35 | Model params: 1145 | Timestamp: 2022-02-17 17:22:57.121549

[32m[I 2022-02-17 17:23:04,263][0m Trial 35 pruned. [0m
epoch 0 0.04136024340789579 9.337408674404928
Trial Id: 36 | Model params: 2177 | Timestamp: 2022-02-17 17:23:04.263769

epoch 0 -9.362331015027905 30.69721754144246
epoch 5 -7.6664132835137 28.07307456319922
epoch 10 -7.616248386511986 27.991707179540835
epoch 15 -7.591652624700922 27.9517263571257
epoch 20 -7.58579463448455 27.94219566106485
epoch 25 -7.572409761113834 27.920406843389237
epoch 30 -7.573430266000262 27.92206869020201
epoch 35 -7.568416082061914 27.913902363496486
epoch 40 -7.566939825658709 27.911497610284194
epoch 45 -7.567966669717963 27.913170313566365
epoch 50 -7.5637206775859465 27.906253048756277
epoch 55 -7.5630472545195335 27.90515579881833
epoch 60 -7.564682664308661 27.907820398513504
epoch 65 -7.563064856374535 27.90518447916069
epoch 70 -7.5601784259276155 27.900480955117118
epoch 75 -7.556638241024716 27.894711035911442
epoch 80 -7.561675747956359 27.9029209847516
epoch 85 -7.559206964607197 27.89889775172155
epoch 90 -7.557202783911425 27.89563122796052
epoch 95 -7.556426697514734 27.89436621698907
[32m[I 2022-02-17 17:31:49,763][0m Trial 36 finished with value: 27.89819779408836 and parameters: {'n_layers_mlp': 4, 'mlp_n_units_l0': 15, 'mlp_dropout_l0': 0.25266966947571784, 'mlp_n_units_l1': 11, 'mlp_dropout_l1': 0.1363716435193738, 'mlp_n_units_l2': 27, 'mlp_dropout_l2': 0.11735911328018517, 'mlp_n_units_l3': 49, 'mlp_dropout_l3': 0.28727882493839596, 'lr': 3.059272266730723e-05, 'weight_decay': 0.25378827996341163, 'criterion': 'PoissonNLLLoss', 'batch_size': 256}. Best is trial 3 with value: 9.12512482353794.[0m
Trial Id: 37 | Model params: 2271 | Timestamp: 2022-02-17 17:31:49.763359

[32m[I 2022-02-17 17:31:56,620][0m Trial 37 pruned. [0m
epoch 0 0.05059314502680401 9.292334410769636
Trial Id: 38 | Model params: 9699 | Timestamp: 2022-02-17 17:31:56.620914

epoch 0 -9.609696254252556 31.06145222660002
epoch 5 -9.609696254252556 31.06145222660002
epoch 10 0.03317680600612838 9.376565927628986
epoch 15 0.0688196973827534 9.202104728360403
epoch 20 0.07388568288888708 9.177039063426287
epoch 25 0.07686107416428511 9.162285350979715
epoch 30 0.07744664336947005 9.159378961117008
epoch 35 0.07788913740241132 9.157182092710705
epoch 40 0.07811851490030053 9.156043085330573
epoch 45 0.0773733969222804 9.159742559952049
epoch 50 0.07772422089319564 9.158000922121577
epoch 55 0.07846016791367172 9.154346294775124
epoch 60 0.07828741803131678 9.15520428163869
epoch 65 0.0777912723040548 9.157668012997428
epoch 70 0.07879372985242106 9.152689384374796
epoch 75 0.0787488297848602 9.15291243505172
epoch 80 0.0789907921108356 9.151710371222402
epoch 85 0.07752423544865483 9.158993774614487
epoch 90 0.07888584260656706 9.152231777576732
epoch 95 0.0791378045363812 9.150979939419193
[32m[I 2022-02-17 17:40:28,571][0m Trial 38 finished with value: 9.152300014605089 and parameters: {'n_layers_mlp': 4, 'mlp_n_units_l0': 24, 'mlp_dropout_l0': 0.14744876265837065, 'mlp_n_units_l1': 68, 'mlp_dropout_l1': 0.2867931483486981, 'mlp_n_units_l2': 54, 'mlp_dropout_l2': 0.04991940634617781, 'mlp_n_units_l3': 69, 'mlp_dropout_l3': 0.04627251591607885, 'lr': 7.507633313069332e-05, 'weight_decay': 0.23983028588264066, 'criterion': 'MSELoss', 'batch_size': 256}. Best is trial 3 with value: 9.12512482353794.[0m
Trial Id: 39 | Model params: 9307 | Timestamp: 2022-02-17 17:40:28.571474

epoch 0 -9.609696254252556 31.06145222660002
epoch 5 -9.609696254252556 31.06145222660002
epoch 10 0.0458817791563525 9.314753706464368
epoch 15 0.0721564077413499 9.185602922178152
epoch 20 0.07641791797095931 9.164484281286061
epoch 25 0.0772004718909981 9.160600910747345
epoch 30 0.07708085228205053 9.16119462149205
epoch 35 0.07708335400806077 9.161182205011984
epoch 40 0.07779757192733061 9.157636734852169
epoch 45 0.07782333353129678 9.157508825267875
epoch 50 0.0781912649475276 9.155681804775814
epoch 55 0.0776901968272643 9.15816984640676
epoch 60 0.07847467249013895 9.154274252073499
epoch 65 0.0779369380168844 9.156944743482201
epoch 70 0.07850961527087263 9.154100692638522
epoch 75 0.07845532229864738 9.154370362307578
epoch 80 0.07826346879634727 9.155323222574596
epoch 85 0.07801529172874222 9.156555672559392
epoch 90 0.07892077874560965 9.15205821240501
epoch 95 0.07893750317176496 9.151975123126137
[32m[I 2022-02-17 17:49:01,182][0m Trial 39 finished with value: 9.152876273427765 and parameters: {'n_layers_mlp': 4, 'mlp_n_units_l0': 22, 'mlp_dropout_l0': 0.15057647859915202, 'mlp_n_units_l1': 68, 'mlp_dropout_l1': 0.29618938176123427, 'mlp_n_units_l2': 52, 'mlp_dropout_l2': 0.04688842048666736, 'mlp_n_units_l3': 70, 'mlp_dropout_l3': 0.04751424659433834, 'lr': 6.721419024535949e-05, 'weight_decay': 0.2374470235314846, 'criterion': 'MSELoss', 'batch_size': 256}. Best is trial 3 with value: 9.12512482353794.[0m
Trial Id: 40 | Model params: 8931 | Timestamp: 2022-02-17 17:49:01.182856

[32m[I 2022-02-17 17:49:06,274][0m Trial 40 pruned. [0m
epoch 0 -7.617184471142673 27.993227672803467
Trial Id: 41 | Model params: 9856 | Timestamp: 2022-02-17 17:49:06.274601

epoch 0 -9.609696254252556 31.06145222660002
epoch 5 0.003697040993031697 9.51844470563674
epoch 10 0.06934592854431354 9.19950420159765
epoch 15 0.0764572376211401 9.164289199463688
epoch 20 0.07711405574944707 9.161029825819755
epoch 25 0.07759036170473521 9.158665494541875
epoch 30 0.07798962773201579 9.15668311077904
epoch 35 0.07713119191687146 9.160944774318763
epoch 40 0.07862125761381977 9.153546147402816
epoch 45 0.07803844315265251 9.156440709355111
epoch 50 0.07873474172005834 9.152982419402736
epoch 55 0.07869870169228066 9.153161450638075
epoch 60 0.07903429958541863 9.151494210240882
epoch 65 0.07914480378399036 9.150945162176471
epoch 70 0.07922845298332715 9.150529523201165
epoch 75 0.07885175819254475 9.152401108147156
epoch 80 0.07653503707417963 9.163903190427497
epoch 85 0.07895862792036945 9.151870171354176
epoch 90 0.07802175164952474 9.156523594626123
epoch 95 0.07926109210853549 9.15036733968964
[32m[I 2022-02-17 17:57:38,376][0m Trial 41 finished with value: 9.147022823141173 and parameters: {'n_layers_mlp': 4, 'mlp_n_units_l0': 16, 'mlp_dropout_l0': 0.08968411256133481, 'mlp_n_units_l1': 69, 'mlp_dropout_l1': 0.29626525198396153, 'mlp_n_units_l2': 55, 'mlp_dropout_l2': 0.050094918994341306, 'mlp_n_units_l3': 80, 'mlp_dropout_l3': 0.02788539290660653, 'lr': 0.00012767285067794067, 'weight_decay': 0.2375446569775344, 'criterion': 'MSELoss', 'batch_size': 256}. Best is trial 3 with value: 9.12512482353794.[0m
Trial Id: 42 | Model params: 9516 | Timestamp: 2022-02-17 17:57:38.376950

epoch 0 -9.609696254252556 31.06145222660002
epoch 5 -9.609696254252556 31.06145222660002
epoch 10 0.06732658465701913 9.209479388370251
epoch 15 0.07571224834716861 9.16798470829961
epoch 20 0.07733629031429312 9.15992675340471
epoch 25 0.0762298318285638 9.165417400702353
epoch 30 0.07675421360407908 9.162815638775715
epoch 35 0.07760184105375534 9.158608504761787
epoch 40 0.07848758341185313 9.154210124410012
epoch 45 0.0783984532765466 9.15465281853117
epoch 50 0.07874366024655277 9.152938115488613
epoch 55 0.07876977145642095 9.152808403501183
epoch 60 0.07879978003583221 9.152659328380714
epoch 65 0.0790791735898918 9.151271254492118
epoch 70 0.07853109272702274 9.153994013314957
epoch 75 0.07573935266107523 9.167850283843192
epoch 80 0.08005802778932603 9.14640648130776
epoch 85 0.08079640670050825 9.142735125091262
epoch 90 0.08097011944386667 9.141871179032563
epoch 95 0.07741335404455318 9.15954421269273
[32m[I 2022-02-17 18:06:10,792][0m Trial 42 finished with value: 9.15264902978065 and parameters: {'n_layers_mlp': 4, 'mlp_n_units_l0': 17, 'mlp_dropout_l0': 0.09204207025632677, 'mlp_n_units_l1': 68, 'mlp_dropout_l1': 0.29639864566705715, 'mlp_n_units_l2': 53, 'mlp_dropout_l2': 0.052134217631901944, 'mlp_n_units_l3': 79, 'mlp_dropout_l3': 0.025843341485414895, 'lr': 0.00012226275942455334, 'weight_decay': 0.23242986658022663, 'criterion': 'MSELoss', 'batch_size': 256}. Best is trial 3 with value: 9.12512482353794.[0m
Trial Id: 43 | Model params: 9918 | Timestamp: 2022-02-17 18:06:10.792768

[32m[I 2022-02-17 18:06:15,950][0m Trial 43 pruned. [0m
epoch 0 0.014658378515855053 9.46593886533369
Trial Id: 44 | Model params: 9301 | Timestamp: 2022-02-17 18:06:15.950664

[32m[I 2022-02-17 18:06:20,967][0m Trial 44 pruned. [0m
epoch 0 0.01005898358969548 9.488005782070907
Trial Id: 45 | Model params: 7300 | Timestamp: 2022-02-17 18:06:20.967543

[32m[I 2022-02-17 18:06:26,141][0m Trial 45 pruned. [0m
epoch 0 0.028497940212592332 9.399227125397756
Trial Id: 46 | Model params: 9076 | Timestamp: 2022-02-17 18:06:26.141728

epoch 0 -9.609696254252556 31.06145222660002
epoch 5 -9.609696254252556 31.06145222660002
epoch 10 0.07231134302670938 9.184835964557976
epoch 15 0.07503742251813805 9.17133088703688
epoch 20 0.07578061523564794 9.167645637389152
epoch 25 0.07707118868708596 9.161242583354523
epoch 30 0.07797888878549952 9.156736436016383
epoch 35 0.07644179452981192 9.164365819826712
epoch 40 0.0781147554037791 9.156061754800344
epoch 45 0.0780293585156675 9.156485821179128
epoch 50 0.07763759059896613 9.15843102215402
epoch 55 0.07873022933800855 9.153004835152503
epoch 60 0.0787903072104933 9.152706387271083
epoch 65 0.07899419002229735 9.15169348934436
epoch 70 0.07886987954873981 9.152311082064115
epoch 75 0.07825582435779876 9.155361187415028
epoch 80 0.07912958931169378 9.151020758332715
epoch 85 0.07930975672325269 9.15012552033054
epoch 90 0.07864119925807822 9.153447090554495
epoch 95 0.07837138091806983 9.15478727806179
[32m[I 2022-02-17 18:14:58,210][0m Trial 46 finished with value: 9.15306716612431 and parameters: {'n_layers_mlp': 4, 'mlp_n_units_l0': 16, 'mlp_dropout_l0': 0.062298398689543635, 'mlp_n_units_l1': 59, 'mlp_dropout_l1': 0.28119341648034657, 'mlp_n_units_l2': 58, 'mlp_dropout_l2': 0.08141418359377575, 'mlp_n_units_l3': 72, 'mlp_dropout_l3': 0.024287154406763788, 'lr': 0.00010436851103221915, 'weight_decay': 0.24825156693447192, 'criterion': 'MSELoss', 'batch_size': 256}. Best is trial 3 with value: 9.12512482353794.[0m
Trial Id: 47 | Model params: 8034 | Timestamp: 2022-02-17 18:14:58.210292

[32m[I 2022-02-17 18:15:03,275][0m Trial 47 pruned. [0m
epoch 0 0.0534690097701318 9.277643920602031
Trial Id: 48 | Model params: 9904 | Timestamp: 2022-02-17 18:15:03.276070

[32m[I 2022-02-17 18:15:08,335][0m Trial 48 pruned. [0m
epoch 0 0.034606018474504396 9.369632880693164
Trial Id: 49 | Model params: 9970 | Timestamp: 2022-02-17 18:15:08.335594

[32m[I 2022-02-17 18:15:13,706][0m Trial 49 pruned. [0m
epoch 0 0.03850835532875263 9.350676636569249
Trial Id: 50 | Model params: 6631 | Timestamp: 2022-02-17 18:15:13.706190

epoch 0 -9.609696254252556 31.06145222660002
epoch 5 -9.609696254252556 31.06145222660002
epoch 10 0.06276385516660099 9.231978741251798
epoch 15 0.07468841343339017 9.173060998066756
epoch 20 0.07460515846600135 9.173473662150702
epoch 25 0.07709803784667435 9.161109326352431
epoch 30 0.07696180354557847 9.161785460613098
epoch 35 0.07829231904437484 9.155179941168429
epoch 40 0.07835907420013288 9.154848400842898
epoch 45 0.07846840401691302 9.154305386988488
epoch 50 0.07626237299909566 9.16525596658835
epoch 55 0.07876842404261075 9.152815097059184
epoch 60 0.07863115073022353 9.153497005103095
epoch 65 0.07861873503975103 9.153558677799534
epoch 70 0.07897590666945187 9.151784326345055
epoch 75 0.07901099560637403 9.151609993532327
epoch 80 0.0777863532343287 9.15769243650702
epoch 85 0.07907502318579562 9.151291875934165
epoch 90 0.07910388732271623 9.151148462399878
epoch 95 0.0784011292611978 9.154639527685307
[32m[I 2022-02-17 18:23:46,118][0m Trial 50 finished with value: 9.156854079226964 and parameters: {'n_layers_mlp': 4, 'mlp_n_units_l0': 22, 'mlp_dropout_l0': 0.12035779543408927, 'mlp_n_units_l1': 70, 'mlp_dropout_l1': 0.26070267426509586, 'mlp_n_units_l2': 36, 'mlp_dropout_l2': 0.02696301211745558, 'mlp_n_units_l3': 55, 'mlp_dropout_l3': 0.09957565956804593, 'lr': 8.685401338925216e-05, 'weight_decay': 0.22996110180367532, 'criterion': 'MSELoss', 'batch_size': 256}. Best is trial 3 with value: 9.12512482353794.[0m
Trial Id: 51 | Model params: 9077 | Timestamp: 2022-02-17 18:23:46.118852

[32m[I 2022-02-17 18:23:51,156][0m Trial 51 pruned. [0m
epoch 0 -0.0015514863721808325 9.543483372493565
Trial Id: 52 | Model params: 9833 | Timestamp: 2022-02-17 18:23:51.156418

[32m[I 2022-02-17 18:23:56,370][0m Trial 52 pruned. [0m
epoch 0 -0.0046231199238060405 9.55810650613367
Trial Id: 53 | Model params: 11219 | Timestamp: 2022-02-17 18:23:56.370585

[32m[I 2022-02-17 18:24:01,380][0m Trial 53 pruned. [0m
epoch 0 -0.01355403250201137 9.600497396856596
Trial Id: 54 | Model params: 9177 | Timestamp: 2022-02-17 18:24:01.381140

[32m[I 2022-02-17 18:24:06,517][0m Trial 54 pruned. [0m
epoch 0 -0.007248334276334534 9.570586662637357
Trial Id: 55 | Model params: 7549 | Timestamp: 2022-02-17 18:24:06.517225

epoch 0 -9.609696254252556 31.06145222660002
epoch 5 -9.609696254252556 31.06145222660002
epoch 10 0.056135384174478054 9.264567159987221
epoch 15 0.07587494893654267 9.167177761458111
epoch 20 0.07617574163024055 9.165685731508582
epoch 25 0.07596335197242143 9.166739278741034
epoch 30 0.07301147887403336 9.181369366882164
epoch 35 0.0763116349608759 9.165011576571324
epoch 40 0.07661080841360957 9.163527228430622
epoch 45 0.07751410048941854 9.1590440880087
epoch 50 0.07799995967085827 9.156631806283027
epoch 55 0.07689111149980687 9.162136287350023
epoch 60 0.07820143753471143 9.155631286037599
epoch 65 0.07815767664052375 9.155848607843687
epoch 70 0.07841129630949961 9.154589030705589
epoch 75 0.0781205518140412 9.156032970103956
epoch 80 0.0780465840480159 9.156400283705194
epoch 85 0.07857283047199326 9.153786696827616
epoch 90 0.0777740662959302 9.15775344169191
epoch 95 0.07847380047771269 9.154278583283274
[32m[I 2022-02-17 18:32:40,016][0m Trial 55 finished with value: 9.152616069662455 and parameters: {'n_layers_mlp': 4, 'mlp_n_units_l0': 10, 'mlp_dropout_l0': 0.13545034135667142, 'mlp_n_units_l1': 68, 'mlp_dropout_l1': 0.29975105987740713, 'mlp_n_units_l2': 45, 'mlp_dropout_l2': 0.13993712009092762, 'mlp_n_units_l3': 75, 'mlp_dropout_l3': 0.02796510522247469, 'lr': 9.697314173053769e-05, 'weight_decay': 0.2745593728797052, 'criterion': 'MSELoss', 'batch_size': 256}. Best is trial 3 with value: 9.12512482353794.[0m
Trial Id: 56 | Model params: 8587 | Timestamp: 2022-02-17 18:32:40.016282

epoch 0 -9.609696254252556 31.06145222660002
epoch 5 -9.609696254252556 31.06145222660002
epoch 10 0.04560455859197676 9.316106816425894
epoch 15 0.0652378060487463 9.219786214374269
epoch 20 0.06921686356961188 9.200142082337045
epoch 25 0.06954480322751466 9.198521212165327
epoch 30 0.0702127789068756 9.195218800807751
epoch 35 0.07222369390470507 9.185269851394656
epoch 40 0.07475767343224082 9.172717687720022
epoch 45 0.07618572167485982 9.16563622306648
epoch 50 0.07662477295108616 9.163457937548525
epoch 55 0.07684582735137635 9.162361014062402
epoch 60 0.07736513073120588 9.159783592809951
epoch 65 0.07692212148570654 9.161982394289979
epoch 70 0.07786094687172895 9.157322067121733
epoch 75 0.07798569199984384 9.156702654059103
epoch 80 0.0771263397176658 9.160968857194973
epoch 85 0.07806842777261391 9.156291812351132
epoch 90 0.07608904161631225 9.166115816792457
epoch 95 0.07787676318928649 9.157243534641003
[32m[I 2022-02-17 18:41:14,142][0m Trial 56 finished with value: 9.157245572492885 and parameters: {'n_layers_mlp': 4, 'mlp_n_units_l0': 20, 'mlp_dropout_l0': 0.1398230397460222, 'mlp_n_units_l1': 68, 'mlp_dropout_l1': 0.013835336599193171, 'mlp_n_units_l2': 45, 'mlp_dropout_l2': 0.1425146309795667, 'mlp_n_units_l3': 79, 'mlp_dropout_l3': 0.06916756535662612, 'lr': 3.7602560716523997e-05, 'weight_decay': 0.2826921587581155, 'criterion': 'MSELoss', 'batch_size': 256}. Best is trial 3 with value: 9.12512482353794.[0m
Trial Id: 57 | Model params: 5380 | Timestamp: 2022-02-17 18:41:14.143126

[32m[I 2022-02-17 18:41:19,428][0m Trial 57 pruned. [0m
epoch 0 0.056424487724263894 9.263148193570803
Trial Id: 58 | Model params: 9690 | Timestamp: 2022-02-17 18:41:19.429092

[32m[I 2022-02-17 18:41:24,427][0m Trial 58 pruned. [0m
epoch 0 0.02674269139914276 9.407714259798611
Trial Id: 59 | Model params: 7211 | Timestamp: 2022-02-17 18:41:24.427994

[32m[I 2022-02-17 18:41:29,618][0m Trial 59 pruned. [0m
epoch 0 0.04497867439846315 9.319161026512347
Trial Id: 60 | Model params: 10351 | Timestamp: 2022-02-17 18:41:29.618992

epoch 0 -9.609696254252556 31.06145222660002
epoch 5 -9.609696254252556 31.06145222660002
epoch 10 0.05727259607623558 9.25898428757443
epoch 15 0.06489026828178412 9.221499979737334
epoch 20 0.07082211423428697 9.192205267276545
epoch 25 0.07584144437504348 9.167343939989298
epoch 30 0.07782937191359351 9.157478843686414
epoch 35 0.07731129346725651 9.160050833139682
epoch 40 0.07838919919078646 9.154698780763939
epoch 45 0.07870787013539648 9.153115906119126
epoch 50 0.07876807392963636 9.152816836317314
epoch 55 0.07946890049852307 9.149334674298462
epoch 60 0.07986745065297307 9.14735382676066
epoch 65 0.08031662106157877 9.145120875536422
epoch 70 0.08095703126031906 9.141936274882273
epoch 75 0.08115624081511841 9.140945429070054
epoch 80 0.08141606086203568 9.139652952104253
epoch 85 0.08114233932939541 9.141014576974952
epoch 90 0.08168730992516071 9.138303426362935
epoch 95 0.08154381297134794 9.139017381149635
[32m[I 2022-02-17 18:50:01,074][0m Trial 60 finished with value: 9.13633837364291 and parameters: {'n_layers_mlp': 4, 'mlp_n_units_l0': 31, 'mlp_dropout_l0': 0.13175426352693081, 'mlp_n_units_l1': 69, 'mlp_dropout_l1': 0.2382429656910067, 'mlp_n_units_l2': 53, 'mlp_dropout_l2': 0.19987819521973302, 'mlp_n_units_l3': 71, 'mlp_dropout_l3': 0.07622036997935971, 'lr': 8.177266356592516e-05, 'weight_decay': 0.19846773727186856, 'criterion': 'MSELoss', 'batch_size': 256}. Best is trial 3 with value: 9.12512482353794.[0m
Trial Id: 61 | Model params: 10490 | Timestamp: 2022-02-17 18:50:01.074630

[32m[I 2022-02-17 18:50:06,014][0m Trial 61 pruned. [0m
epoch 0 -0.019652262956983302 9.62933564546388
Trial Id: 62 | Model params: 13589 | Timestamp: 2022-02-17 18:50:06.014472

epoch 0 -9.609696254252556 31.06145222660002
epoch 5 -9.609696254252556 31.06145222660002
epoch 10 0.005502211569418547 9.509817708049535
epoch 15 0.06875330293666793 9.2024327839229
epoch 20 0.0742392312216138 9.175287208113929
epoch 25 0.07281172013277293 9.182358570065542
epoch 30 0.07502118319378581 9.171411396003913
epoch 35 0.07692275524981063 9.161979249085931
epoch 40 0.07802970344907156 9.156484108338189
epoch 45 0.07798918355486384 9.156685316388142
epoch 50 0.07813802081045329 9.155946219355174
epoch 55 0.0781334156154625 9.155969088757514
epoch 60 0.07795916569637762 9.15683437204019
epoch 65 0.07869897052315489 9.153160115215787
epoch 70 0.07880708461071784 9.152623040711353
epoch 75 0.07896525910358576 9.151837226125574
epoch 80 0.07862876447368272 9.153508858433046
epoch 85 0.07806945969612666 9.156286688003654
epoch 90 0.07938797088408822 9.14973685291807
epoch 95 0.07952830293989199 9.14903946342231
[32m[I 2022-02-17 18:58:39,944][0m Trial 62 finished with value: 9.148606283436216 and parameters: {'n_layers_mlp': 4, 'mlp_n_units_l0': 26, 'mlp_dropout_l0': 0.11348710255096028, 'mlp_n_units_l1': 76, 'mlp_dropout_l1': 0.28834873664283583, 'mlp_n_units_l2': 72, 'mlp_dropout_l2': 0.18502893387757868, 'mlp_n_units_l3': 75, 'mlp_dropout_l3': 0.047386838111244375, 'lr': 5.4514897636872195e-05, 'weight_decay': 0.2039922912281565, 'criterion': 'MSELoss', 'batch_size': 256}. Best is trial 3 with value: 9.12512482353794.[0m
Trial Id: 63 | Model params: 13669 | Timestamp: 2022-02-17 18:58:39.944882

[32m[I 2022-02-17 18:58:45,079][0m Trial 63 pruned. [0m
epoch 0 -0.017845921015760213 9.620802548575684
Trial Id: 64 | Model params: 13698 | Timestamp: 2022-02-17 18:58:45.079848

