[32m[I 2022-02-26 22:56:23,941][0m Trial 21 pruned. [0m
epoch 0 -0.048372185404051304 7.379311367305574
Trial Id: 22 | Model params: 11032 | Timestamp: 2022-02-26 22:56:23.941826

epoch 0 -18.618272994773548 31.921881228743914
epoch 5 0.01444271425717969 7.154825184402142
epoch 10 0.021025188518120963 7.1308918445732346
epoch 15 0.020939363652787035 7.131204413605803
epoch 20 0.023311291126356548 7.122560946544351
epoch 25 0.023498689173949705 7.121877608017785
epoch 30 0.022816098352221648 7.124366329227922
epoch 35 0.01873923602267391 7.139212475031792
epoch 40 0.020299563079881233 7.1335340974655965
epoch 45 0.0250153195430447 7.116344869384696
epoch 50 0.025181238672971284 7.115739327569384
epoch 55 0.02363387163930497 7.121384630545843
epoch 60 0.025235878976501702 7.11553989993186
epoch 65 0.025275587583454495 7.115394966891844
epoch 70 0.02241786134055246 7.125817897017586
epoch 75 0.02048976241041811 7.132841610651757
epoch 80 0.02458026061286067 7.117932424628495
epoch 85 0.023942967960515205 7.120257303425715
epoch 90 0.02161423569047216 7.12874620013678
epoch 95 0.02208235256577762 7.127040591890235
[32m[I 2022-02-26 23:05:30,381][0m Trial 22 finished with value: 7.114227903161933 and parameters: {'n_layers_mlp': 4, 'mlp_n_units_l0': 73, 'mlp_dropout_l0': 0.1644576347467661, 'mlp_n_units_l1': 48, 'mlp_dropout_l1': 0.2609637883796037, 'mlp_n_units_l2': 64, 'mlp_dropout_l2': 0.2997799334244694, 'mlp_n_units_l3': 47, 'mlp_dropout_l3': 0.08656999901780335, 'lr': 0.00021183317758094464, 'weight_decay': 0.26756875742875347, 'criterion': 'MSELoss', 'batch_size': 128}. Best is trial 22 with value: 7.114227903161933.[0m
Trial Id: 23 | Model params: 11660 | Timestamp: 2022-02-26 23:05:30.381181

epoch 0 -18.618272994773548 31.921881228743914
epoch 5 0.017586949404807983 7.1434030050425354
epoch 10 0.016912476708706214 7.145854725128078
epoch 15 0.019603155822316864 7.1360690368267
epoch 20 0.024012295871399303 7.120004428176928
epoch 25 0.019046230406898568 7.1380956110609795
epoch 30 0.02117452918480789 7.130347922121875
epoch 35 0.024592389058104014 7.117888172027009
epoch 40 0.024537505160425188 7.118088422643547
epoch 45 0.023163592946404465 7.1230994751003305
epoch 50 0.024194548324594778 7.119339615058357
epoch 55 0.024416878103036943 7.118528525426516
epoch 60 0.019807328796783708 7.1353259355435545
epoch 65 0.025193330214231535 7.115695196021091
epoch 70 0.022821888191971618 7.12434522316979
epoch 75 0.02493794298537355 7.116627246818798
epoch 80 0.02260008633840338 7.125153726398729
epoch 85 0.01858893890761837 7.139759201240585
epoch 90 0.025332470789371953 7.115187342881828
epoch 95 0.021494785766762337 7.129181356816227
[32m[I 2022-02-26 23:14:35,288][0m Trial 23 finished with value: 7.12434311397155 and parameters: {'n_layers_mlp': 4, 'mlp_n_units_l0': 72, 'mlp_dropout_l0': 0.17905446186916024, 'mlp_n_units_l1': 48, 'mlp_dropout_l1': 0.2642979548012401, 'mlp_n_units_l2': 69, 'mlp_dropout_l2': 0.2974880591634155, 'mlp_n_units_l3': 50, 'mlp_dropout_l3': 0.08124587644521279, 'lr': 0.00028279020910153567, 'weight_decay': 0.2682493494476502, 'criterion': 'MSELoss', 'batch_size': 128}. Best is trial 22 with value: 7.114227903161933.[0m
Trial Id: 24 | Model params: 10314 | Timestamp: 2022-02-26 23:14:35.288702

epoch 0 -18.618272994773548 31.921881228743914
epoch 5 0.019065043340182997 7.138027162799435
epoch 10 0.01709655874760352 7.145185667155131
epoch 15 0.021718269326840067 7.128367183427438
epoch 20 0.020159871719967803 7.134042649632466
epoch 25 0.015852751665022757 7.149705146065759
epoch 30 0.019520233141754106 7.136370817409106
epoch 35 0.02061252645811884 7.132394609735989
epoch 40 0.01567558944813907 7.15034864764358
epoch 45 0.023147201444763787 7.123159238335037
epoch 50 0.019442428372027143 7.136653960770229
epoch 55 0.02439764918041165 7.118598678833573
epoch 60 0.0239078499126526 7.120385393936538
epoch 65 0.02511370233562371 7.115985815771837
epoch 70 0.025546385784988357 7.114406497749787
epoch 75 0.024707032160813713 7.117469864462884
epoch 80 0.025405722169779765 7.114919966021437
epoch 85 0.022249180845504757 7.126432645690428
epoch 90 0.025212350933255134 7.115625773896986
epoch 95 0.02595141631781439 7.112927796607338
[32m[I 2022-02-26 23:23:27,571][0m Trial 24 finished with value: 7.114413340905183 and parameters: {'n_layers_mlp': 4, 'mlp_n_units_l0': 73, 'mlp_dropout_l0': 0.17662172002280507, 'mlp_n_units_l1': 52, 'mlp_dropout_l1': 0.21483238078830144, 'mlp_n_units_l2': 63, 'mlp_dropout_l2': 0.21241495152665202, 'mlp_n_units_l3': 29, 'mlp_dropout_l3': 0.07932672962827939, 'lr': 0.0003882153053832427, 'weight_decay': 0.25995562070587486, 'criterion': 'MSELoss', 'batch_size': 128}. Best is trial 22 with value: 7.114227903161933.[0m
Study statistics: 
  Number of finished trials:  25
  Number of pruned trials:  15
  Number of complete trials:  10

Best trial:
  Value:  7.114227903161933
  Params: 
    n_layers_mlp: 4
    mlp_n_units_l0: 73
    mlp_dropout_l0: 0.1644576347467661
    mlp_n_units_l1: 48
    mlp_dropout_l1: 0.2609637883796037
    mlp_n_units_l2: 64
    mlp_dropout_l2: 0.2997799334244694
    mlp_n_units_l3: 47
    mlp_dropout_l3: 0.08656999901780335
    lr: 0.00021183317758094464
    weight_decay: 0.26756875742875347
    criterion: MSELoss
    batch_size: 128
Target: 67706, NaN: 0, Max: 114.0, Min: 8.0, Mean: 31.139042330074144
Prediction: 67706, NaN: 0, Max: 37.10243606567383, Min: 28.698978424072266, Mean: 31.072488022763327

 XXXXXX======== TRIAL des - elg ended

Test Set - R-squared:  0.025583480291160754
Test Set - RMSE:  7.121079271347027
Test Set - MAE:  5.65610333123989



[32m[I 2022-02-26 23:23:40,437][0m A new study created in memory with name: NeuralNetwork[0m
++++++++ Session Characteristics +++++++

Area: des
Gal Type: qso
Training Samples: 216656
Validation Samples: 54164
Test Samples: 67706
Number of features: 16
Device: cuda:0
Number of Workers: 8
Number of Trials: 25

+++++++++++++++++++++++++++++++++++++++
Trial Id: 0 | Model params: 4568 | Timestamp: 2022-02-26 23:23:40.438138

epoch 0 0.009087471916843226 1.9763319417560474
epoch 5 -3.739031062766074e-06 1.9853772548030775
epoch 10 -0.00031583544898694527 1.9856870440403496
epoch 15 -0.0011758643567687521 1.9865404651772536
epoch 20 -1.997898423100608e-05 1.9853933758941684
epoch 25 -0.0006196170913788102 1.985988533560022
epoch 30 -0.0024381941742892543 1.9877924326902123
epoch 35 -0.00019533241264091394 1.9855674375539534
epoch 40 -0.0019159904584562515 1.98727461133104
epoch 45 -0.0005521735475606526 1.9859216028505606
epoch 50 -0.0004977998318074217 1.9858676409449894
epoch 55 -0.002142955264320179 1.987499688014044
epoch 60 -0.00036800239953582725 1.9857388206311348
epoch 65 -0.0006807999563716027 1.9860492492450332
epoch 70 -5.7455373758896755e-05 1.985430577490137
epoch 75 -2.9233795489691516e-05 1.9854025629098495
epoch 80 -0.002007952666264634 1.9873658115759347
epoch 85 -0.00022447132177139117 1.985596360328273
epoch 90 -2.9328669062023138e-05 1.9854026570882108
epoch 95 -0.0006297920183107042 1.9859986309219475
[32m[I 2022-02-26 23:52:53,821][0m Trial 0 finished with value: 1.9869146945453113 and parameters: {'n_layers_mlp': 4, 'mlp_n_units_l0': 44, 'mlp_dropout_l0': 0.13996669738087528, 'mlp_n_units_l1': 11, 'mlp_dropout_l1': 0.22336748338972368, 'mlp_n_units_l2': 60, 'mlp_dropout_l2': 0.23633530345808557, 'mlp_n_units_l3': 42, 'mlp_dropout_l3': 0.032772370733417766, 'lr': 0.0001271936759770227, 'weight_decay': 0.12243169337458605, 'criterion': 'MSELoss', 'batch_size': 32}. Best is trial 0 with value: 1.9869146945453113.[0m
Trial Id: 1 | Model params: 12994 | Timestamp: 2022-02-26 23:52:53.821756

epoch 0 -1.2965820582812437 3.008636599310724
epoch 5 -1.3208185461309152 3.02447043581808
epoch 10 -1.2785425363111877 2.996796968540056
epoch 15 -1.2619979377580375 2.985897208639577
epoch 20 -1.2874024015469518 3.0026176755347644
epoch 25 -1.2805587310475133 2.9981225506078095
epoch 30 -1.3075826317450505 3.015833640087054
epoch 35 -1.2223672517508537 2.959624848039193
epoch 40 -1.2485154579262558 2.9769852937859187
epoch 45 -1.2682596586569712 2.9900271711919904
epoch 50 -1.2689285244397164 2.9904679892093364
epoch 55 -1.2118135069245266 2.952589040468456
epoch 60 -1.269946972666801 2.991139075824409
epoch 65 -1.2450608083249626 2.974697474427561
epoch 70 -1.2523147438097344 2.9794993179678597
epoch 75 -1.2632780082147952 2.986741952604741
epoch 80 -1.2480249208599714 2.976660545899036
epoch 85 -1.2724479410897107 2.992786401748594
epoch 90 -1.2389413044496904 2.9706405477031756
epoch 95 -1.2524300533860524 2.979575586262014
[32m[I 2022-02-26 23:58:31,364][0m Trial 1 finished with value: 2.984608817950664 and parameters: {'n_layers_mlp': 4, 'mlp_n_units_l0': 64, 'mlp_dropout_l0': 0.10492066294837227, 'mlp_n_units_l1': 77, 'mlp_dropout_l1': 0.009037313278387383, 'mlp_n_units_l2': 54, 'mlp_dropout_l2': 0.01907346302599543, 'mlp_n_units_l3': 48, 'mlp_dropout_l3': 0.1205399976221355, 'lr': 0.006780071057202275, 'weight_decay': 0.2184345689996172, 'criterion': 'PoissonNLLLoss', 'batch_size': 256}. Best is trial 0 with value: 1.9869146945453113.[0m
Trial Id: 2 | Model params: 1507 | Timestamp: 2022-02-26 23:58:31.364230

epoch 0 -1.2055606185068748 2.948504055894472
epoch 5 -1.216725904059874 2.9559577913415964
epoch 10 -1.2199678903820845 2.958118562187456
epoch 15 -1.2405677844483254 2.971811601931701
epoch 20 -1.2343858399418175 2.9677090114439197
epoch 25 -1.2356993160442555 2.968581162105072
epoch 30 -1.232369475944048 2.9663696428953954
epoch 35 -1.229068092190234 2.964175394133899
epoch 40 -1.2245892602639126 2.9611959609388765
epoch 45 -1.2348910225237466 2.968044483979899
epoch 50 -1.2239026437444234 2.9607389410720293
epoch 55 -1.2321086013485032 2.9661963129205593
epoch 60 -1.225637653857246 2.9618936477540077
epoch 65 -1.2344891097509896 2.967777592079524
epoch 70 -1.2228972860801224 2.960069636127806
epoch 75 -1.2287601617662842 2.9639706468419647
epoch 80 -1.2243757869629035 2.9610538782061653
epoch 85 -1.224996799616409 2.961467190473305
epoch 90 -1.2312236615460739 2.9656082668469907
epoch 95 -1.2348429816985416 2.9680125835267934
[32m[I 2022-02-27 00:22:50,147][0m Trial 2 finished with value: 2.966604632545727 and parameters: {'n_layers_mlp': 2, 'mlp_n_units_l0': 18, 'mlp_dropout_l0': 0.07819647962585559, 'mlp_n_units_l1': 60, 'mlp_dropout_l1': 0.2593466307454242, 'lr': 9.581553868545757e-05, 'weight_decay': 0.11134072428608727, 'criterion': 'PoissonNLLLoss', 'batch_size': 32}. Best is trial 0 with value: 1.9869146945453113.[0m
Trial Id: 3 | Model params: 1375 | Timestamp: 2022-02-27 00:22:50.148045

epoch 0 -1.2336608867007777 2.9672275313057765
epoch 5 -1.2028555848551017 2.946695388830462
epoch 10 -1.2281181917113657 2.9635437463907417
epoch 15 -1.2184134596622496 2.9570827373933635
epoch 20 -1.2245847131818097 2.961192934580645
epoch 25 -1.237549326990532 2.9698091385049827
epoch 30 -1.2275471186932028 2.9631639397149496
epoch 35 -1.2366918925944113 2.9692400649052266
epoch 40 -1.2372036911408153 2.969579755372341
epoch 45 -1.221476066695994 2.959123217907523
epoch 50 -1.2167530044414119 2.955975860183345
epoch 55 -1.2322699731741653 2.9663035325834017
epoch 60 -1.229661271420997 2.964569767533039
epoch 65 -1.2190846985716934 2.95753007484963
epoch 70 -1.2265596824842286 2.9625071051928678
epoch 75 -1.2190715720750815 2.9575213275345895
epoch 80 -1.2293209248276473 2.9643434955559953
epoch 85 -1.222978275829429 2.960123559697656
epoch 90 -1.229914564596203 2.964738152743465
epoch 95 -1.2271700062080004 2.9629131047479826
[32m[I 2022-02-27 00:47:11,743][0m Trial 3 finished with value: 2.962212749472952 and parameters: {'n_layers_mlp': 2, 'mlp_n_units_l0': 20, 'mlp_dropout_l0': 0.21870549728628083, 'mlp_n_units_l1': 47, 'mlp_dropout_l1': 0.0727315139479834, 'lr': 7.345133828438717e-05, 'weight_decay': 0.10310066574672055, 'criterion': 'PoissonNLLLoss', 'batch_size': 32}. Best is trial 0 with value: 1.9869146945453113.[0m
Trial Id: 4 | Model params: 363 | Timestamp: 2022-02-27 00:47:11.743669

epoch 0 -2.91622743706747 3.9288251691460694
epoch 5 -2.91622743706747 3.9288251691460694
epoch 10 -1.2292381498396008 2.9641964568242027
epoch 15 -1.2295103963474001 2.9643774530755036
epoch 20 -1.2449402107377967 2.974617577670561
epoch 25 -1.2451132030966967 2.9747321856668365
epoch 30 -1.2403534044362399 2.971577191342766
epoch 35 -1.2454695435851173 2.974968248476676
epoch 40 -1.2417462353015791 2.97250076467987
epoch 45 -1.2392184196164173 2.970824381035097
epoch 50 -1.2443779011183973 2.974245015224523
epoch 55 -1.2392698826365711 2.970858519445899
epoch 60 -1.2552633890977165 2.981449003979227
epoch 65 -1.2493339945284845 2.9775271067612246
epoch 70 -1.2390331380255644 2.970701469743935
epoch 75 -1.2438762572177007 2.9739126079124496
epoch 80 -1.2489754908495931 2.9772898149759555
epoch 85 -1.233253335935447 2.966864732978755
epoch 90 -1.2444385874641002 2.9742852256634613
epoch 95 -1.2428921419057035 2.973260389705512
[32m[I 2022-02-27 00:52:01,591][0m Trial 4 finished with value: 2.9718276004871838 and parameters: {'n_layers_mlp': 2, 'mlp_n_units_l0': 10, 'mlp_dropout_l0': 0.04905915161715841, 'mlp_n_units_l1': 16, 'mlp_dropout_l1': 0.05988883081191055, 'lr': 0.0003323272610127448, 'weight_decay': 0.1445392181233398, 'criterion': 'PoissonNLLLoss', 'batch_size': 256}. Best is trial 0 with value: 1.9869146945453113.[0m
Trial Id: 5 | Model params: 5670 | Timestamp: 2022-02-27 00:52:01.591417

epoch 0 -2.916524281914817 3.9290960166779114
epoch 5 -1.2749784265142567 2.9945451915324615
epoch 10 -1.2541529801745508 2.9808074532729756
epoch 15 -1.2661754106770946 2.9887458883702473
epoch 20 -1.2641104190412884 2.987383870710451
epoch 25 -1.2510045183046663 2.9787250218532506
epoch 30 -1.2624830359881511 2.9863100512186094
epoch 35 -1.2576854204286407 2.983142122304977
epoch 40 -1.2552839830386038 2.9815551574043626
epoch 45 -1.2510370229544607 2.9787465282659107
epoch 50 -1.251727510704597 2.9792033466713597
epoch 55 -1.2717443279587197 2.992415918892146
epoch 60 -1.2632892404104585 2.9868420688940973
epoch 65 -1.2669915791247455 2.98928404187956
epoch 70 -1.2699555912777165 2.9912375956725032
epoch 75 -1.2492406330200545 2.9775577299005866
epoch 80 -1.25385121449265 2.9806079247786594
epoch 85 -1.2573728614106763 2.9829356187245506
epoch 90 -1.2620119020903457 2.985999104103254
epoch 95 -1.2464639343542947 2.975719257465792
[32m[I 2022-02-27 01:01:09,639][0m Trial 5 finished with value: 2.9886789698432326 and parameters: {'n_layers_mlp': 4, 'mlp_n_units_l0': 53, 'mlp_dropout_l0': 0.2561102232949828, 'mlp_n_units_l1': 49, 'mlp_dropout_l1': 0.12566418273042132, 'mlp_n_units_l2': 20, 'mlp_dropout_l2': 0.09253792716150508, 'mlp_n_units_l3': 51, 'mlp_dropout_l3': 0.2527705805785162, 'lr': 0.00023815505879424436, 'weight_decay': 0.19684143639894536, 'criterion': 'PoissonNLLLoss', 'batch_size': 128}. Best is trial 0 with value: 1.9869146945453113.[0m
Trial Id: 6 | Model params: 1591 | Timestamp: 2022-02-27 01:01:09.639535

epoch 0 -1.301137843092285 3.0117127499973693
epoch 5 -1.2236940221653212 2.960600066170868
epoch 10 -1.2535536460567296 2.9804111584372843
epoch 15 -1.2514319478818718 2.9790078144314664
epoch 20 -1.2526500254175437 2.979813562043689
epoch 25 -1.2447914126992896 2.9746113203388838
epoch 30 -1.2418792792356004 2.972681235351257
epoch 35 -1.2411604750075194 2.972204638068722
epoch 40 -1.2420661062249025 2.9728050969526367
epoch 45 -1.248868197125359 2.977311203301689
epoch 50 -1.2439255824195694 2.9740376017892727
epoch 55 -1.2507677306453147 2.978568348716955
epoch 60 -1.2413044333035752 2.972300094563076
epoch 65 -1.2462754364074078 2.9755944104275383
epoch 70 -1.2462645774293462 2.9755872180875094
epoch 75 -1.2468580027729423 2.9759802421946215
epoch 80 -1.244607328364467 2.9744893511951815
epoch 85 -1.2492743227527772 2.9775800291483834
epoch 90 -1.2454904944359217 2.975074466838785
epoch 95 -1.2430651188191635 2.9734673296520495
[32m[I 2022-02-27 01:08:42,331][0m Trial 6 finished with value: 2.976301370062643 and parameters: {'n_layers_mlp': 2, 'mlp_n_units_l0': 26, 'mlp_dropout_l0': 0.25675779196968374, 'mlp_n_units_l1': 41, 'mlp_dropout_l1': 0.2913974868967523, 'lr': 0.00012319982388330245, 'weight_decay': 0.1557037901544112, 'criterion': 'PoissonNLLLoss', 'batch_size': 128}. Best is trial 0 with value: 1.9869146945453113.[0m
Trial Id: 7 | Model params: 3936 | Timestamp: 2022-02-27 01:08:42.331502

epoch 0 -2.916524281914817 3.9290960166779114
epoch 5 -1.2283654325142987 2.9637081650946433
epoch 10 -1.2064344649197256 2.949088098906989
epoch 15 -1.2125226505541744 2.9531539861272518
epoch 20 -1.217330054006824 2.9563605745808563
epoch 25 -1.217680029067886 2.956593875808959
epoch 30 -1.2231187510421893 2.9602170867964923
epoch 35 -1.2255642258797108 2.961844788126364
epoch 40 -1.21961152387546 2.957881122562266
epoch 45 -1.2200370911650058 2.958164667026659
epoch 50 -1.2101690155846545 2.9515828166836204
epoch 55 -1.216547651303007 2.9558389407842367
epoch 60 -1.2151049456279015 2.954876836553894
epoch 65 -1.2250356702772622 2.9614930587541157
epoch 70 -1.2193918996655344 2.9577347820049273
epoch 75 -1.2204606319376023 2.958446834293527
epoch 80 -1.2254201772219933 2.9617489345299957
epoch 85 -1.2256008448722477 2.9618691548296003
epoch 90 -1.2205187846195078 2.958485574113727
epoch 95 -1.218710634966635 2.957280793921325
[32m[I 2022-02-27 01:32:55,571][0m Trial 7 finished with value: 2.9597181732992692 and parameters: {'n_layers_mlp': 2, 'mlp_n_units_l0': 61, 'mlp_dropout_l0': 0.25344477333033494, 'mlp_n_units_l1': 46, 'mlp_dropout_l1': 0.07634294148127593, 'lr': 1.0682205196062104e-05, 'weight_decay': 0.10784094395073653, 'criterion': 'PoissonNLLLoss', 'batch_size': 32}. Best is trial 0 with value: 1.9869146945453113.[0m
Trial Id: 8 | Model params: 7706 | Timestamp: 2022-02-27 01:32:55.571419

[32m[I 2022-02-27 01:33:13,927][0m Trial 8 pruned. [0m
epoch 0 -0.004438288313646455 1.9897744954496175
Trial Id: 9 | Model params: 3117 | Timestamp: 2022-02-27 01:33:13.927716

[32m[I 2022-02-27 01:33:18,450][0m Trial 9 pruned. [0m
epoch 0 -1.2612808437111123 2.9855165434085698
Trial Id: 10 | Model params: 3694 | Timestamp: 2022-02-27 01:33:18.450569

[32m[I 2022-02-27 01:33:36,270][0m Trial 10 pruned. [0m
epoch 0 -0.0037171059193072953 1.9890600423949778
Trial Id: 11 | Model params: 5461 | Timestamp: 2022-02-27 01:33:36.270698

[32m[I 2022-02-27 01:33:54,383][0m Trial 11 pruned. [0m
epoch 0 0.014097445219854121 1.9713295238562498
Trial Id: 12 | Model params: 2751 | Timestamp: 2022-02-27 01:33:54.383189

[32m[I 2022-02-27 01:34:08,210][0m Trial 12 pruned. [0m
epoch 0 0.010171506805382813 1.9752506157189749
Trial Id: 13 | Model params: 10478 | Timestamp: 2022-02-27 01:34:08.211055

[32m[I 2022-02-27 01:34:25,913][0m Trial 13 pruned. [0m
epoch 0 0.019949046653128688 1.965470627312025
Trial Id: 14 | Model params: 4374 | Timestamp: 2022-02-27 01:34:25.913578

epoch 0 -2.916524281914817 3.9290960166779114
epoch 5 0.025774091037384816 1.95962092307689
epoch 10 0.025966638282850285 1.9594272625240614
epoch 15 0.023155755860489124 1.9622525003553912
epoch 20 0.024923288875727034 1.9604764155525292
epoch 25 0.024965136431307267 1.9604343460286187
epoch 30 0.02387791805842121 1.961527038447788
epoch 35 0.024289165555200887 1.9611137919484012
epoch 40 0.02445727800211328 1.9609448372597251
epoch 45 0.024668498106887427 1.9607325383071732
epoch 50 0.02442972375663155 1.9609725305491488
epoch 55 0.02528874290828864 1.960108992585687
epoch 60 0.02425462381513155 1.9611485049396575
epoch 65 0.02467792890745857 1.9607230588008688
epoch 70 0.02537207391155538 1.960025202981901
epoch 75 0.02490410136236365 1.9604957045386877
epoch 80 0.024803097985873657 1.9605972389408441
epoch 85 0.02522734065668175 1.9601707304640952
epoch 90 0.024636605935544176 1.960764594847322
epoch 95 0.024775165341707317 1.9606253175128556
[32m[I 2022-02-27 02:03:49,872][0m Trial 14 finished with value: 1.9615282297644416 and parameters: {'n_layers_mlp': 4, 'mlp_n_units_l0': 67, 'mlp_dropout_l0': 0.17426828401706645, 'mlp_n_units_l1': 21, 'mlp_dropout_l1': 0.0006894975869451148, 'mlp_n_units_l2': 35, 'mlp_dropout_l2': 0.2708978671048371, 'mlp_n_units_l3': 28, 'mlp_dropout_l3': 0.22387853574493646, 'lr': 2.570138070936835e-05, 'weight_decay': 0.07054680595630425, 'criterion': 'MSELoss', 'batch_size': 32}. Best is trial 14 with value: 1.9615282297644416.[0m
Trial Id: 15 | Model params: 4051 | Timestamp: 2022-02-27 02:03:49.872222

[32m[I 2022-02-27 02:03:53,307][0m Trial 15 pruned. [0m
epoch 0 -1.176539796630908 2.9289506658332916
Trial Id: 16 | Model params: 3978 | Timestamp: 2022-02-27 02:03:53.307348

epoch 0 -2.916524281914817 3.9290960166779114
epoch 5 0.018257479648016606 1.9671660962414295
epoch 10 0.02076348844160869 1.964653785028557
epoch 15 0.023422307242086937 1.961984762277615
epoch 20 0.02492309643089563 1.9604766090160435
epoch 25 0.02453879983825591 1.9608629017586245
epoch 30 0.024912327459349237 1.9604874349613872
epoch 35 0.024342826689751518 1.96105986355369
epoch 40 0.022160668474415224 1.9632516953173813
epoch 45 0.023485603517947817 1.961921178836175
epoch 50 0.025226078406150876 1.960171999593733
epoch 55 0.023918275123931965 1.9614864890662653
epoch 60 0.024849728234038304 1.960550364187388
epoch 65 0.024619598965591738 1.9607816892551038
epoch 70 0.023078803503255974 1.962329788511922
epoch 75 0.022868698765672546 1.9625407945896123
epoch 80 0.023184938195870086 1.9622231898800577
epoch 85 0.024640599142980002 1.960760581088029
epoch 90 0.023803187527985603 1.9616021228830565
epoch 95 0.02465349551144791 1.9607476182896515
