[32m[I 2022-02-16 17:08:04,965][0m Trial 27 finished with value: 4.288196698181386 and parameters: {'n_layers_mlp': 2, 'mlp_n_units_l0': 16, 'mlp_dropout_l0': 0.0776290646742791, 'mlp_n_units_l1': 51, 'mlp_dropout_l1': 0.17800081942832904, 'lr': 2.3611904623658312e-05, 'weight_decay': 0.022046243441218916, 'criterion': 'MSELoss', 'batch_size': 256}. Best is trial 3 with value: 4.280955926668772.[0m
Trial Id: 28 | Model params: 1387 | Timestamp: 2022-02-16 17:08:04.965788

epoch 0 -3.3488271555259086 8.980260400749554
epoch 5 -1.2241687898772238 6.4222429073527
epoch 10 -0.00697591428675115 4.321279904947387
epoch 15 0.002072876597953077 4.301820353309257
epoch 20 0.00393116846865571 4.297813165508957
epoch 25 0.004523109690928173 4.296535929047791
epoch 30 0.005046775413679927 4.295405694591336
epoch 35 0.005495426181743146 4.294437129278576
epoch 40 0.005864532686420176 4.2936401235011585
epoch 45 0.005931057894056901 4.293496460947716
epoch 50 0.006370149248318802 4.292548113542288
epoch 55 0.006400322430325955 4.292482937954673
epoch 60 0.006724743667144484 4.291782109267663
epoch 65 0.0065809668065157645 4.292092716335539
epoch 70 0.006926628983944028 4.291345930163957
epoch 75 0.006823856428280539 4.291567978801748
epoch 80 0.006815951484514304 4.2915850576131245
epoch 85 0.007246007056068149 4.2906558139838
epoch 90 0.007353040012845646 4.290424510982047
epoch 95 0.007271990285342755 4.2905996642105295
[32m[I 2022-02-16 17:14:52,053][0m Trial 28 finished with value: 4.290077954649226 and parameters: {'n_layers_mlp': 2, 'mlp_n_units_l0': 18, 'mlp_dropout_l0': 0.1221659119352719, 'mlp_n_units_l1': 54, 'mlp_dropout_l1': 0.23262558066226557, 'lr': 1.1286238136863824e-05, 'weight_decay': 0.02714719010266036, 'criterion': 'MSELoss', 'batch_size': 256}. Best is trial 3 with value: 4.280955926668772.[0m
Trial Id: 29 | Model params: 6984 | Timestamp: 2022-02-16 17:14:52.053566

epoch 0 -3.582821042664899 9.218692013232362
epoch 5 0.003057909002596615 4.299696711946286
epoch 10 0.00829656753719954 4.288384966112318
epoch 15 0.010643520806438156 4.283307540464675
epoch 20 0.011903698895721626 4.280578771643274
epoch 25 0.012070271595023607 4.28021794769689
epoch 30 0.012330931376858478 4.27965325455849
epoch 35 0.01176428873411317 4.280880733673756
epoch 40 0.013099471496965442 4.277987855986166
epoch 45 0.014165535394568107 4.275676660202012
epoch 50 0.01437903365697768 4.275213651959372
epoch 55 0.0133131980295641 4.27752460310913
epoch 60 0.014341862708202369 4.275294267254108
epoch 65 0.012422843925805949 4.2794541175177825
epoch 70 0.013594954450449115 4.276913818576293
epoch 75 0.014694329954728191 4.274529785188299
epoch 80 0.01472077120073434 4.2744724300672825
epoch 85 0.014773691736543193 4.274357634990802
epoch 90 0.014947171950786542 4.273981300580741
epoch 95 0.014919711787940382 4.2740408727180155
[32m[I 2022-02-16 17:23:13,983][0m Trial 29 finished with value: 4.274750411481795 and parameters: {'n_layers_mlp': 4, 'mlp_n_units_l0': 25, 'mlp_dropout_l0': 0.0863120200982714, 'mlp_n_units_l1': 50, 'mlp_dropout_l1': 0.19076191370915813, 'mlp_n_units_l2': 78, 'mlp_dropout_l2': 0.2451287819170319, 'mlp_n_units_l3': 16, 'mlp_dropout_l3': 0.2808030638361232, 'lr': 0.00034510631309702435, 'weight_decay': 0.008486835321084303, 'criterion': 'MSELoss', 'batch_size': 256}. Best is trial 29 with value: 4.274750411481795.[0m
Trial Id: 30 | Model params: 7051 | Timestamp: 2022-02-16 17:23:13.983865

[32m[I 2022-02-16 17:23:18,678][0m Trial 30 pruned. [0m
epoch 0 -0.011302763109698244 4.330553951334011
Trial Id: 31 | Model params: 8397 | Timestamp: 2022-02-16 17:23:18.678320

[32m[I 2022-02-16 17:23:23,664][0m Trial 31 pruned. [0m
epoch 0 -0.023096657304475077 4.355732390185955
Trial Id: 32 | Model params: 6760 | Timestamp: 2022-02-16 17:23:23.665010

[32m[I 2022-02-16 17:23:28,581][0m Trial 32 pruned. [0m
epoch 0 -0.003567374318547145 4.313960096914065
Trial Id: 33 | Model params: 8355 | Timestamp: 2022-02-16 17:23:28.581195

[32m[I 2022-02-16 17:23:33,519][0m Trial 33 pruned. [0m
epoch 0 0.0028635892975527044 4.300115730811354
Trial Id: 34 | Model params: 6396 | Timestamp: 2022-02-16 17:23:33.520174

[32m[I 2022-02-16 17:23:38,654][0m Trial 34 pruned. [0m
epoch 0 0.004100920496981297 4.297446928977336
Trial Id: 35 | Model params: 6907 | Timestamp: 2022-02-16 17:23:38.654621

[32m[I 2022-02-16 17:23:43,578][0m Trial 35 pruned. [0m
epoch 0 0.006966348623144936 4.291260109507897
Trial Id: 36 | Model params: 7747 | Timestamp: 2022-02-16 17:23:43.579039

[32m[I 2022-02-16 17:23:48,637][0m Trial 36 pruned. [0m
epoch 0 0.005603733004710287 4.2942032794209375
Trial Id: 37 | Model params: 2247 | Timestamp: 2022-02-16 17:23:48.637301

[32m[I 2022-02-16 17:23:52,908][0m Trial 37 pruned. [0m
epoch 0 -2.025827237617817 7.4907434051326005
Trial Id: 38 | Model params: 1157 | Timestamp: 2022-02-16 17:23:52.909056

[32m[I 2022-02-16 17:23:57,075][0m Trial 38 pruned. [0m
epoch 0 -2.011458482950155 7.472936582572208
Trial Id: 39 | Model params: 10656 | Timestamp: 2022-02-16 17:23:57.075487

[32m[I 2022-02-16 17:24:02,109][0m Trial 39 pruned. [0m
epoch 0 -0.008683350464405715 4.324941951133356
Trial Id: 40 | Model params: 3487 | Timestamp: 2022-02-16 17:24:02.110153

epoch 0 -3.057782761191503 8.674555959847778
epoch 5 -0.0007578016296387879 4.307917214448871
epoch 10 0.004007416893744731 4.297648664951165
epoch 15 0.0056782936793741134 4.294042284902792
epoch 20 0.006151149047343818 4.2930211353148175
epoch 25 0.006749714756083658 4.2917281609055875
epoch 30 0.007024202361906484 4.291135104148283
epoch 35 0.007199620468013146 4.290756053600202
epoch 40 0.0075023821414474945 4.290101755130101
epoch 45 0.00766053222028118 4.289759937200811
epoch 50 0.007883413441911569 4.289278166265455
epoch 55 0.007923378237395529 4.289191774276173
epoch 60 0.008178886527746232 4.288639400293256
epoch 65 0.008316057491288498 4.288342826076283
epoch 70 0.008399336527845747 4.288162760360947
epoch 75 0.00850599742089131 4.287932127412381
epoch 80 0.008634094714690455 4.287655126118263
epoch 85 0.008669512720788197 4.287578534039106
epoch 90 0.008787769140940371 4.287322792479125
epoch 95 0.00870162264566332 4.287509094562943
[32m[I 2022-02-16 17:30:48,604][0m Trial 40 finished with value: 4.287061462773552 and parameters: {'n_layers_mlp': 2, 'mlp_n_units_l0': 38, 'mlp_dropout_l0': 0.116776441106099, 'mlp_n_units_l1': 71, 'mlp_dropout_l1': 0.09013447733664579, 'lr': 1.9255330436025206e-05, 'weight_decay': 0.0344420739388476, 'criterion': 'MSELoss', 'batch_size': 256}. Best is trial 29 with value: 4.274750411481795.[0m
Trial Id: 41 | Model params: 3447 | Timestamp: 2022-02-16 17:30:48.604514

epoch 0 -3.582821042664899 9.218692013232362
epoch 5 -3.582821042664899 9.218692013232362
epoch 10 -0.3231498276375502 4.953445270157335
epoch 15 0.00264126781645313 4.300595080881201
epoch 20 0.006103290230929925 4.293124499340831
epoch 25 0.006885982539474145 4.291433751554776
epoch 30 0.007361753256994508 4.290405680723248
epoch 35 0.007624973875380858 4.289836793660676
epoch 40 0.007908526284775452 4.289223879979097
epoch 45 0.008152953020868159 4.288695468232757
epoch 50 0.008337774126029873 4.288295871154124
epoch 55 0.00856743982112651 4.287799264821669
epoch 60 0.008740603473966546 4.287424794869363
epoch 65 0.0089176754319783 4.287041839301538
epoch 70 0.009084096507137374 4.286681887334121
epoch 75 0.009233536737250692 4.286358637460147
epoch 80 0.009359116908019716 4.286086979744843
epoch 85 0.00947088161121279 4.285845193463207
epoch 90 0.009607834246955771 4.28554889824349
epoch 95 0.009718875229516533 4.285308647504367
[32m[I 2022-02-16 17:37:35,725][0m Trial 41 finished with value: 4.285398797851271 and parameters: {'n_layers_mlp': 2, 'mlp_n_units_l0': 38, 'mlp_dropout_l0': 0.11637668201883293, 'mlp_n_units_l1': 70, 'mlp_dropout_l1': 0.06376283257226488, 'lr': 1.9813906436020174e-05, 'weight_decay': 0.0016191231154900126, 'criterion': 'MSELoss', 'batch_size': 256}. Best is trial 29 with value: 4.274750411481795.[0m
Trial Id: 42 | Model params: 4061 | Timestamp: 2022-02-16 17:37:35.725547

epoch 0 -2.9647183226014824 8.574504360776087
epoch 5 0.0023123389113643977 4.30130419053845
epoch 10 0.00610740741786453 4.2931156072626955
epoch 15 0.006966696545224416 4.291259357758816
epoch 20 0.007167010641767613 4.290826520767269
epoch 25 0.007675354860052441 4.289727898868282
epoch 30 0.008016337084959524 4.288990818192684
epoch 35 0.008285022212063176 4.2884099285421255
epoch 40 0.008544855766148829 4.287848100893211
epoch 45 0.008754963073307587 4.287393740472583
epoch 50 0.00892145782000664 4.2870336587141145
epoch 55 0.009063880413127778 4.286725614315253
epoch 60 0.009281957295128929 4.286253895111642
epoch 65 0.009442050290921822 4.285907567034083
epoch 70 0.009541036813196957 4.285693416168771
epoch 75 0.009681559321832234 4.285389386534668
epoch 80 0.009689133862584076 4.285372997907899
epoch 85 0.009894689783661259 4.284928223676277
epoch 90 0.009995032344055965 4.28471108941853
epoch 95 0.0100891623349606 4.28450738872184
[32m[I 2022-02-16 17:44:24,211][0m Trial 42 finished with value: 4.284365334154021 and parameters: {'n_layers_mlp': 2, 'mlp_n_units_l0': 44, 'mlp_dropout_l0': 0.11124819390688108, 'mlp_n_units_l1': 72, 'mlp_dropout_l1': 0.06482415949161945, 'lr': 2.0989691409898968e-05, 'weight_decay': 0.0031987175238923898, 'criterion': 'MSELoss', 'batch_size': 256}. Best is trial 29 with value: 4.274750411481795.[0m
Trial Id: 43 | Model params: 4056 | Timestamp: 2022-02-16 17:44:24.211468

epoch 0 -2.696084450935719 8.278922163926493
epoch 5 0.0028385283049638943 4.300169767796764
epoch 10 0.006036607939907013 4.293268513589459
epoch 15 0.006919687916457584 4.291360927278234
epoch 20 0.007253853868590898 4.290638857094913
epoch 25 0.007762106441620231 4.289540385227824
epoch 30 0.00807611181539114 4.2888615937196395
epoch 35 0.008373773391537553 4.288218033711761
epoch 40 0.008489848276849177 4.287967047518515
epoch 45 0.008792171967579976 4.2873132706232715
epoch 50 0.009148527487721658 4.286542521517964
epoch 55 0.009294585014188561 4.2862265786703615
epoch 60 0.009554664865118134 4.285663931931931
epoch 65 0.009655506889069021 4.285445754304881
epoch 70 0.009991745595358092 4.284718201886329
epoch 75 0.010144557765010775 4.284387506485566
epoch 80 0.010359585601100174 4.283922129132249
epoch 85 0.010565417797220533 4.283476606222674
epoch 90 0.010800120083756082 4.2829685375752575
epoch 95 0.01096068815415463 4.282620915260862
[32m[I 2022-02-16 17:51:12,596][0m Trial 43 finished with value: 4.28234942397538 and parameters: {'n_layers_mlp': 2, 'mlp_n_units_l0': 45, 'mlp_dropout_l0': 0.11830934983508665, 'mlp_n_units_l1': 70, 'mlp_dropout_l1': 0.05242635128334876, 'lr': 2.1724739244948395e-05, 'weight_decay': 0.001037625368075436, 'criterion': 'MSELoss', 'batch_size': 256}. Best is trial 29 with value: 4.274750411481795.[0m
Trial Id: 44 | Model params: 4197 | Timestamp: 2022-02-16 17:51:12.596996

[32m[I 2022-02-16 17:51:16,566][0m Trial 44 pruned. [0m
epoch 0 -0.014452216036073606 4.337291930347919
Trial Id: 45 | Model params: 3962 | Timestamp: 2022-02-16 17:51:16.566324

[32m[I 2022-02-16 17:51:20,800][0m Trial 45 pruned. [0m
epoch 0 -1.9890449715471084 7.44507507118882
Trial Id: 46 | Model params: 4951 | Timestamp: 2022-02-16 17:51:20.801148

[32m[I 2022-02-16 17:51:24,811][0m Trial 46 pruned. [0m
epoch 0 -1.2385566852880041 6.442981802182076
Trial Id: 47 | Model params: 3163 | Timestamp: 2022-02-16 17:51:24.811254

epoch 0 -3.182602704615552 8.806962834093486
epoch 5 0.0020510179836503717 4.301867466627847
epoch 10 0.004900704533800648 4.295720991153408
epoch 15 0.006366178920330978 4.292556689576349
epoch 20 0.006934654921566863 4.2913285889758095
epoch 25 0.007291773026155468 4.290556913203645
epoch 30 0.007603926751409085 4.289882284652344
epoch 35 0.007853236144255482 4.289343399445422
epoch 40 0.008078056251400678 4.288857390059909
epoch 45 0.008301800003833182 4.288373652820405
epoch 50 0.008466597424158229 4.288017323506874
epoch 55 0.008490679634513332 4.287965249838981
epoch 60 0.00883517877432638 4.287220260031474
epoch 65 0.00895748327702972 4.28695574170564
epoch 70 0.009149175284830169 4.2865411202936725
epoch 75 0.009295882500591768 4.286223771921532
epoch 80 0.00917065396167327 4.286494660358357
epoch 85 0.009441754071761843 4.285908207868799
epoch 90 0.009668516993775578 4.285417605372122
epoch 95 0.009655132785005738 4.285446563721467
[32m[I 2022-02-16 17:58:12,068][0m Trial 47 finished with value: 4.2848906659695905 and parameters: {'n_layers_mlp': 2, 'mlp_n_units_l0': 32, 'mlp_dropout_l0': 0.0584528192038017, 'mlp_n_units_l1': 77, 'mlp_dropout_l1': 0.06521706893144927, 'lr': 1.6146704935682958e-05, 'weight_decay': 0.00030860241032550605, 'criterion': 'MSELoss', 'batch_size': 256}. Best is trial 29 with value: 4.274750411481795.[0m
Trial Id: 48 | Model params: 3163 | Timestamp: 2022-02-16 17:58:12.068421

[32m[I 2022-02-16 17:58:16,118][0m Trial 48 pruned. [0m
epoch 0 0.004242527225915449 4.297141391474211
Trial Id: 49 | Model params: 3702 | Timestamp: 2022-02-16 17:58:16.118499

epoch 0 -3.3371812606839457 8.968228044060293
epoch 5 -0.2698402800570765 4.8526325402715385
epoch 10 0.0003172253308428852 4.3056027825682905
epoch 15 0.004397633086581587 4.296806702662295
epoch 20 0.005934852244856015 4.293488266824259
epoch 25 0.006486645083807252 4.292296471224701
epoch 30 0.006853717098096235 4.291503463529971
epoch 35 0.007078457127212223 4.29101787183065
epoch 40 0.007261192510445658 4.290622998297468
epoch 45 0.007434352412015177 4.290248782919056
epoch 50 0.007579583508941501 4.2899348992318584
epoch 55 0.00773206986319086 4.289605310253359
epoch 60 0.007817132964106022 4.289421441089235
epoch 65 0.007966561737442146 4.289098422449927
epoch 70 0.008065431764346265 4.28888468275802
epoch 75 0.008193055399445037 4.288608767048199
epoch 80 0.008277775399001874 4.288425596979632
epoch 85 0.008367338178379646 4.288231948003055
epoch 90 0.008453923533169538 4.288044728378112
epoch 95 0.0085118429419897 4.287919487278099
[32m[I 2022-02-16 18:05:05,504][0m Trial 49 finished with value: 4.287748142311407 and parameters: {'n_layers_mlp': 2, 'mlp_n_units_l0': 43, 'mlp_dropout_l0': 0.012933669189258312, 'mlp_n_units_l1': 66, 'mlp_dropout_l1': 0.03171545317644214, 'lr': 1.3569651904992086e-05, 'weight_decay': 0.029144886972324993, 'criterion': 'MSELoss', 'batch_size': 256}. Best is trial 29 with value: 4.274750411481795.[0m
Trial Id: 50 | Model params: 2271 | Timestamp: 2022-02-16 18:05:05.504444

[32m[I 2022-02-16 18:05:09,766][0m Trial 50 pruned. [0m
epoch 0 0.004575048145101124 4.296423842897196
Trial Id: 51 | Model params: 4230 | Timestamp: 2022-02-16 18:05:09.766646

epoch 0 -3.065892542955172 8.683220006895102
epoch 5 -0.0033842416062215275 4.313566469501345
epoch 10 0.0032436664094960266 4.29929611810676
epoch 15 0.005386114528088681 4.294673135797649
epoch 20 0.006072733039233169 4.293190494538676
epoch 25 0.006592993600409658 4.292066735219321
epoch 30 0.007107431298579714 4.290955263865769
epoch 35 0.007327792646313336 4.290479072792946
epoch 40 0.0077956822176520335 4.2894678089501985
epoch 45 0.008138993572867625 4.288725648093107
epoch 50 0.008266968709935818 4.288448962169305
epoch 55 0.00864322486493918 4.287635382134009
epoch 60 0.008878287391513529 4.287127027229715
epoch 65 0.008876221979248533 4.287131494229084
epoch 70 0.009210714095734707 4.286408006038345
epoch 75 0.009479963553341908 4.285825545435441
epoch 80 0.009627053742550018 4.285507315479299
epoch 85 0.00973492329224901 4.285273924444974
epoch 90 0.009870550887910334 4.284980456910562
epoch 95 0.010160420594978126 4.284353176835037
[32m[I 2022-02-16 18:11:57,525][0m Trial 51 finished with value: 4.284236191103964 and parameters: {'n_layers_mlp': 2, 'mlp_n_units_l0': 47, 'mlp_dropout_l0': 0.11018866591211594, 'mlp_n_units_l1': 70, 'mlp_dropout_l1': 0.057937101224146144, 'lr': 1.677549439225336e-05, 'weight_decay': 0.0013044517298462744, 'criterion': 'MSELoss', 'batch_size': 256}. Best is trial 29 with value: 4.274750411481795.[0m
Trial Id: 52 | Model params: 4567 | Timestamp: 2022-02-16 18:11:57.525865

epoch 0 -3.192789846416309 8.817681425226358
epoch 5 -0.008891221753716705 4.325387574105837
epoch 10 0.002565736279440345 4.300757923194753
epoch 15 0.005965060290146873 4.293423030217958
epoch 20 0.006905798787012696 4.2913909364619265
epoch 25 0.007216617175503148 4.290719324646832
epoch 30 0.007405507269615197 4.290311122341283
epoch 35 0.007622185503306289 4.289842820441077
epoch 40 0.007801950886162534 4.289454258669389
epoch 45 0.007923929907065141 4.289190581718418
epoch 50 0.008128673647471607 4.288747959290603
epoch 55 0.008255735473494452 4.2884732494639834
epoch 60 0.008377205585601732 4.288210612564144
epoch 65 0.008436606753792764 4.288082172326547
epoch 70 0.008595434507830402 4.287738727953479
epoch 75 0.0085101241030483 4.287923204034445
epoch 80 0.008802483371178726 4.2872909703895505
epoch 85 0.008851741042026351 4.287184440365187
epoch 90 0.00895226544188521 4.28696702709376
epoch 95 0.009068995049406725 4.2867145515079725
[32m[I 2022-02-16 18:18:43,633][0m Trial 52 finished with value: 4.286577420365828 and parameters: {'n_layers_mlp': 2, 'mlp_n_units_l0': 48, 'mlp_dropout_l0': 0.11026030979182437, 'mlp_n_units_l1': 75, 'mlp_dropout_l1': 0.050832967100981626, 'lr': 1.4717028012198736e-05, 'weight_decay': 0.016826232904997303, 'criterion': 'MSELoss', 'batch_size': 256}. Best is trial 29 with value: 4.274750411481795.[0m
Trial Id: 53 | Model params: 4052 | Timestamp: 2022-02-16 18:18:43.633465

epoch 0 -3.582821042664899 9.218692013232362
epoch 5 -3.582821042664899 9.218692013232362
epoch 10 -3.582821042664899 9.218692013232362
epoch 15 -0.01190868066817874 4.331851073154085
epoch 20 0.00419315442630952 4.297247923072893
epoch 25 0.006528144293363791 4.292206825338215
epoch 30 0.007074416286519614 4.291026603286882
epoch 35 0.007544980832475567 4.290009687060178
epoch 40 0.0076065973280907695 4.28987651252788
epoch 45 0.008190967589676634 4.288613280927947
epoch 50 0.008449766969682915 4.288053716115491
epoch 55 0.008649573877251626 4.287621652317408
epoch 60 0.008853776874313657 4.287180037394739
epoch 65 0.009039796531675526 4.286777706656113
epoch 70 0.009152330873257286 4.286534294558666
epoch 75 0.009331084672288714 4.286147621170347
epoch 80 0.009405386184456188 4.285986884714257
epoch 85 0.009555065007950558 4.285663066221419
epoch 90 0.009680639085574816 4.285391377596135
epoch 95 0.009784530167256444 4.285166588684443
[32m[I 2022-02-16 18:25:31,958][0m Trial 53 finished with value: 4.284996681073487 and parameters: {'n_layers_mlp': 2, 'mlp_n_units_l0': 41, 'mlp_dropout_l0': 0.06713256651998893, 'mlp_n_units_l1': 78, 'mlp_dropout_l1': 0.03860031156714345, 'lr': 2.638827822797601e-05, 'weight_decay': 0.012106325782744337, 'criterion': 'MSELoss', 'batch_size': 256}. Best is trial 29 with value: 4.274750411481795.[0m
Trial Id: 54 | Model params: 4181 | Timestamp: 2022-02-16 18:25:31.958921

[32m[I 2022-02-16 18:25:39,016][0m Trial 54 pruned. [0m
epoch 0 0.001343794394449982 4.303459612502348
Trial Id: 55 | Model params: 3836 | Timestamp: 2022-02-16 18:25:39.017179

[32m[I 2022-02-16 18:25:43,192][0m Trial 55 pruned. [0m
epoch 0 -2.2244047256803747 7.7326371411420025
Trial Id: 56 | Model params: 3747 | Timestamp: 2022-02-16 18:25:43.193130

epoch 0 -3.2247535200650326 8.851228344850712
epoch 5 -0.0038952684882198607 4.314664786443545
epoch 10 0.002671358089528897 4.300530206001053
epoch 15 0.004986381789383931 4.29553605809728
epoch 20 0.005582802301177359 4.294248472783871
epoch 25 0.006160228813703483 4.293001524828838
epoch 30 0.006572692353848164 4.2921105912920705
epoch 35 0.0069726781344147115 4.291246433424278
epoch 40 0.007286541719681461 4.290568218231637
epoch 45 0.007523406318295622 4.29005631606101
epoch 50 0.007684270185626341 4.289708628759992
epoch 55 0.007932675515600507 4.289171676079242
epoch 60 0.008078798594684855 4.288855785193167
epoch 65 0.008264680114487 4.288453910335195
epoch 70 0.008386467821521415 4.2881905855380715
epoch 75 0.008548618929670182 4.2878399634152
epoch 80 0.008652229294847547 4.2876159099314135
epoch 85 0.008769798550998242 4.287361656694198
epoch 90 0.008791144096857662 4.287315493569116
epoch 95 0.008920529310415093 4.28703566690558
[32m[I 2022-02-16 18:32:30,679][0m Trial 56 finished with value: 4.286838217058079 and parameters: {'n_layers_mlp': 2, 'mlp_n_units_l0': 40, 'mlp_dropout_l0': 0.08402660531540163, 'mlp_n_units_l1': 73, 'mlp_dropout_l1': 0.07388526761220592, 'lr': 1.656550218950695e-05, 'weight_decay': 0.025043903789068497, 'criterion': 'MSELoss', 'batch_size': 256}. Best is trial 29 with value: 4.274750411481795.[0m
Trial Id: 57 | Model params: 1089 | Timestamp: 2022-02-16 18:32:30.679633

[32m[I 2022-02-16 18:32:56,409][0m Trial 57 pruned. [0m
epoch 0 0.006962220290202881 4.291336936046893
Trial Id: 58 | Model params: 5399 | Timestamp: 2022-02-16 18:32:56.409801

