[32m[I 2021-08-20 11:58:03,302][0m A new study created in memory with name: NeuralNetwork[0m
++++++++ Session Characteristics +++++++

Area: des
Gal Type: lrg
Training Samples: 55443
Validation Samples: 13861
Test Samples: 17327
Number of features: 15
Device: cuda:0
Number of Workers: 8
Number of Trials: 30

+++++++++++++++++++++++++++++++++++++++
Trial Id: 0 | Model params: 86804 | Timestamp: 2021-08-20 11:58:03.303053

epoch 0 -0.03811682303983077 10.361188214163544
epoch 5 -0.006207702677814009 10.200706856297446
epoch 10 -0.024646600004833985 10.29374723901169
epoch 15 -1.683515871797603e-05 10.169277628624775
epoch 20 -0.02225289543031561 10.281716458183576
epoch 25 -0.00579150983079435 10.198597003473285
epoch 30 -0.026499690643344564 10.303051241951552
epoch 35 -0.002210721745936839 10.180426450365616
epoch 40 -0.008073164209253969 10.2101582919308
epoch 45 -0.0067101696781664 10.20325348699945
epoch 50 -0.007495397762724565 10.207231950581585
epoch 55 -0.014684484910461704 10.243584593635576
epoch 60 -0.012589019796470202 10.233001911023855
epoch 65 -0.010181763320718407 10.220831070970084
epoch 70 -0.006037084993440356 10.19984197782202
[32m[I 2021-08-20 12:00:06,872][0m Trial 0 finished with value: -0.008329677202014274 and parameters: {'n_layers_mlp': 4, 'mlp_n_units_l0': 253, 'mlp_dropout_l0': 0.19628249505538836, 'mlp_n_units_l1': 220, 'mlp_dropout_l1': 0.39538228735891723, 'mlp_n_units_l2': 57, 'mlp_dropout_l2': 0.38079703843370916, 'mlp_n_units_l3': 242, 'mlp_dropout_l3': 0.04022680977911253, 'lr': 0.0463046947080046, 'criterion': 'L1Loss', 'batch_size': 256, 'no_epochs': 72}. Best is trial 0 with value: -0.008329677202014274.[0m
Trial Id: 1 | Model params: 34817 | Timestamp: 2021-08-20 12:00:06.873010

epoch 0 0.011355174658812195 10.111290714023433
epoch 5 -0.014478500965227958 10.2425448019097
epoch 10 -0.0228390719871705 10.284663888044433
epoch 15 -0.05687722095491998 10.454390476286475
epoch 20 -0.00016945236260634822 10.170053589314868
epoch 25 -0.03684797624280933 10.354854254522467
epoch 30 -0.026557861664451066 10.303343171177605
epoch 35 -0.02347903653248795 10.287880812011949
epoch 40 -0.006442738626227129 10.20189815746367
epoch 45 -0.008039221652344164 10.20998639875456
epoch 50 -0.01698995951361537 10.25521526552153
epoch 55 -0.008464424482440336 10.212139518053297
[32m[I 2021-08-20 12:01:23,435][0m Trial 1 finished with value: -0.0074432340666794605 and parameters: {'n_layers_mlp': 2, 'mlp_n_units_l0': 142, 'mlp_dropout_l0': 0.4580387026564195, 'mlp_n_units_l1': 226, 'mlp_dropout_l1': 0.3377421180181402, 'lr': 0.029917175819621045, 'criterion': 'L1Loss', 'batch_size': 256, 'no_epochs': 58}. Best is trial 1 with value: -0.0074432340666794605.[0m
Trial Id: 2 | Model params: 11620 | Timestamp: 2021-08-20 12:01:23.435449

epoch 0 -0.09882543542840394 10.65984280163634
epoch 5 -0.007063601491151816 10.20504438870772
epoch 10 -0.0036691305560108134 10.187830994061107
epoch 15 -0.03144646498020087 10.327846969711802
epoch 20 -0.015116826021129182 10.24576667641819
epoch 25 -0.02366219274370529 10.2888013022764
epoch 30 -0.014966114246592 10.245006066921706
epoch 35 -0.007488614167312946 10.207197587224426
epoch 40 -0.010238660454564341 10.221118904222598
epoch 45 -0.017859556002613575 10.259598786501968
epoch 50 -0.01451537622413257 10.24273095324701
epoch 55 -0.01872523994718378 10.263960725369609
[32m[I 2021-08-20 12:02:38,611][0m Trial 2 finished with value: -0.0054753316082643 and parameters: {'n_layers_mlp': 2, 'mlp_n_units_l0': 59, 'mlp_dropout_l0': 0.47570290612154736, 'mlp_n_units_l1': 175, 'mlp_dropout_l1': 0.41847775515382685, 'lr': 0.059485025624912286, 'criterion': 'L1Loss', 'batch_size': 256, 'no_epochs': 58}. Best is trial 2 with value: -0.0054753316082643.[0m
Trial Id: 3 | Model params: 12774 | Timestamp: 2021-08-20 12:02:38.611261

epoch 0 -0.019911041322272283 10.269932639357174
epoch 5 -0.01242621974409408 10.23217926719678
epoch 10 -0.0067339984826659816 10.20337424166212
epoch 15 -0.005308307431082904 10.196146903966733
epoch 20 0.014984993522163093 10.092711795241481
epoch 25 0.012461149797698523 10.105633492585778
epoch 30 0.017024039089385656 10.082260096344854
epoch 35 0.011688735757956925 10.109584834576438
epoch 40 -0.006800886854906318 10.20371319701652
[32m[I 2021-08-20 12:03:36,696][0m Trial 3 finished with value: -0.008803675742800054 and parameters: {'n_layers_mlp': 2, 'mlp_n_units_l0': 195, 'mlp_dropout_l0': 0.02864000433583791, 'mlp_n_units_l1': 49, 'mlp_dropout_l1': 0.3132617606946448, 'lr': 0.0011070868933236871, 'criterion': 'L1Loss', 'batch_size': 256, 'no_epochs': 44}. Best is trial 2 with value: -0.0054753316082643.[0m
Trial Id: 4 | Model params: 60921 | Timestamp: 2021-08-20 12:03:36.696501

epoch 0 0.002640516089743472 10.155757196833115
epoch 5 -0.04518741427919237 10.396413251172643
epoch 10 -3.335961618833316e-05 10.169361647761049
epoch 15 -0.06833395466366432 10.510901451435318
epoch 20 -0.016323854287258355 10.25185624937087
epoch 25 -0.0002453267887161381 10.170439340121264
epoch 30 -0.007784611428797827 10.208696899777868
epoch 35 -0.018415356200100153 10.2623995210335
epoch 40 -0.002014258132474467 10.179428565712996
epoch 45 -0.01792694322430677 10.259938398392073
epoch 50 -0.03172327107507944 10.329232702907083
epoch 55 -0.027724635151896715 10.309196837157698
epoch 60 -0.014493868968056267 10.242622382095584
epoch 65 -0.014792553021550248 10.244130071259749
epoch 70 -0.008614939455802162 10.21290157892603
epoch 75 -0.010213697284784162 10.220992620645873
[32m[I 2021-08-20 12:05:47,042][0m Trial 4 finished with value: -0.010610926447220947 and parameters: {'n_layers_mlp': 4, 'mlp_n_units_l0': 185, 'mlp_dropout_l0': 0.308334864943089, 'mlp_n_units_l1': 205, 'mlp_dropout_l1': 0.07412494324296964, 'mlp_n_units_l2': 56, 'mlp_dropout_l2': 0.11851581386587068, 'mlp_n_units_l3': 143, 'mlp_dropout_l3': 0.1327300191178129, 'lr': 0.03393600582754641, 'criterion': 'L1Loss', 'batch_size': 256, 'no_epochs': 79}. Best is trial 2 with value: -0.0054753316082643.[0m
Trial Id: 5 | Model params: 61225 | Timestamp: 2021-08-20 12:05:47.042233

epoch 0 -0.00476920314656093 10.190959792374112
[32m[I 2021-08-20 12:06:06,589][0m Trial 5 pruned. [0m
Trial Id: 6 | Model params: 61469 | Timestamp: 2021-08-20 12:06:06.589659

epoch 0 -0.004917284127395227 10.191710726877012
epoch 5 0.00972570341853296 10.117184823680015
epoch 10 0.010369477601902877 10.113895714130072
epoch 15 0.01169215519753175 10.10713465744939
epoch 20 0.01308210446035818 10.100024854916086
epoch 25 0.01363417851947124 10.097199522763638
epoch 30 0.013948123831594272 10.095592501988435
epoch 35 0.014382923636055311 10.09336642963202
epoch 40 0.01337560577498731 10.098522910826423
epoch 45 0.015246909331067648 10.088941569132915
epoch 50 0.015581238019144461 10.087228800232237
epoch 55 0.015713543058829882 10.086550919993021
[32m[I 2021-08-20 12:18:04,443][0m Trial 6 finished with value: 0.01518718869916158 and parameters: {'n_layers_mlp': 2, 'mlp_n_units_l0': 248, 'mlp_dropout_l0': 0.18289107063807086, 'mlp_n_units_l1': 230, 'mlp_dropout_l1': 0.0254528158439129, 'lr': 2.4768197651316515e-05, 'criterion': 'MSELoss', 'batch_size': 16, 'no_epochs': 58}. Best is trial 6 with value: 0.01518718869916158.[0m
Trial Id: 7 | Model params: 19505 | Timestamp: 2021-08-20 12:18:04.443557

epoch 0 5.070738282597631e-06 10.166719216766447
epoch 5 0.0093041264916911 10.119338124971488
epoch 10 -0.021709767736839636 10.276511278105056
epoch 15 0.001841413566980532 10.157380089017432
epoch 20 -0.025339315353256398 10.294748365262304
epoch 25 0.0126370082294609 10.102302134651321
epoch 30 -0.03953482172998668 10.365767208672045
epoch 35 0.0026690441338107496 10.15316818237872
epoch 40 0.013093934857408174 10.0999643191497
[32m[I 2021-08-20 12:27:00,187][0m Trial 7 finished with value: 0.012284015448613794 and parameters: {'n_layers_mlp': 2, 'mlp_n_units_l0': 109, 'mlp_dropout_l0': 0.08224969147745159, 'mlp_n_units_l1': 160, 'mlp_dropout_l1': 0.03629412428910528, 'lr': 0.004499670068318845, 'criterion': 'L1Loss', 'batch_size': 16, 'no_epochs': 42}. Best is trial 6 with value: 0.01518718869916158.[0m
Trial Id: 8 | Model params: 18932 | Timestamp: 2021-08-20 12:27:00.187206

[32m[I 2021-08-20 12:27:07,043][0m Trial 8 pruned. [0m
epoch 0 -0.021357783313430412 10.274740969354713
Trial Id: 9 | Model params: 70467 | Timestamp: 2021-08-20 12:27:07.044166

[32m[I 2021-08-20 12:27:09,618][0m Trial 9 pruned. [0m
epoch 0 -4.85612328269918 24.608863300146357
Trial Id: 10 | Model params: 23689 | Timestamp: 2021-08-20 12:27:09.618446

[32m[I 2021-08-20 12:27:25,107][0m Trial 10 pruned. [0m
epoch 0 -1.4893173596807294 16.040653752506348
Trial Id: 11 | Model params: 19505 | Timestamp: 2021-08-20 12:27:25.107888

epoch 0 0.006125766621352335 10.135557604651801
epoch 5 0.013112385265789173 10.099869908271165
epoch 10 0.009530594259771097 10.118181445629384
epoch 15 0.014865175016159471 10.09089684201975
epoch 20 0.014967153652287957 10.090374536593199
epoch 25 0.016187946307068324 10.08411988520578
epoch 30 0.01652994618439607 10.082366975427805
epoch 35 0.01772616429822904 10.07623339788571
epoch 40 0.017411414469593378 10.077847631412299
epoch 45 0.01829304889919492 10.073325407411046
[32m[I 2021-08-20 12:37:25,506][0m Trial 11 finished with value: 0.014213931428422089 and parameters: {'n_layers_mlp': 2, 'mlp_n_units_l0': 109, 'mlp_dropout_l0': 0.04248400012140152, 'mlp_n_units_l1': 160, 'mlp_dropout_l1': 0.16842481483375582, 'lr': 0.00011244982184658016, 'criterion': 'MSELoss', 'batch_size': 16, 'no_epochs': 49}. Best is trial 6 with value: 0.01518718869916158.[0m
Trial Id: 12 | Model params: 18779 | Timestamp: 2021-08-20 12:37:25.507376

epoch 0 0.0013981386058264933 10.159635247943735
epoch 5 0.011442428912951663 10.10841151555417
epoch 10 0.01234576791399733 10.10379195184809
epoch 15 0.013346313728653802 10.0986728180288
epoch 20 0.013965439449574957 10.09550385949673
epoch 25 0.014384071425272427 10.09336055257246
epoch 30 0.01457605001618445 10.09237751067634
epoch 35 0.01461654206542673 10.092170155636259
epoch 40 0.01398932559917232 10.095381579717957
epoch 45 0.015643581092878334 10.086909383927914
[32m[I 2021-08-20 12:47:42,752][0m Trial 12 finished with value: 0.015309124300922128 and parameters: {'n_layers_mlp': 2, 'mlp_n_units_l0': 169, 'mlp_dropout_l0': 0.0027593759174899812, 'mlp_n_units_l1': 94, 'mlp_dropout_l1': 0.1847752993083, 'lr': 7.170167213883418e-05, 'criterion': 'MSELoss', 'batch_size': 16, 'no_epochs': 50}. Best is trial 12 with value: 0.015309124300922128.[0m
Trial Id: 13 | Model params: 21491 | Timestamp: 2021-08-20 12:47:42.753056

epoch 0 0.0018776319610500636 10.157195806010188
epoch 5 0.012109603556316295 10.104999870993138
epoch 10 0.013565409526747008 10.097551502791204
epoch 15 0.01210448924471319 10.1050260277669
epoch 20 0.014831353463880537 10.091070060373825
epoch 25 0.014403456052591745 10.093261296366737
epoch 30 0.01568246566859488 10.086710152705514
epoch 35 0.013888309951266331 10.095898696530094
epoch 40 0.016855222950811655 10.080699496619811
epoch 45 0.017575443713464423 10.0770064193599
epoch 50 0.01677049956710952 10.08113384392658
epoch 55 0.017451823201625194 10.077640404686221
epoch 60 0.017833273534321625 10.075684015908173
[32m[I 2021-08-20 13:00:48,944][0m Trial 13 finished with value: 0.019278210316042044 and parameters: {'n_layers_mlp': 2, 'mlp_n_units_l0': 209, 'mlp_dropout_l0': 0.0906123482504329, 'mlp_n_units_l1': 86, 'mlp_dropout_l1': 0.17448310075510373, 'lr': 9.042415948473466e-05, 'criterion': 'MSELoss', 'batch_size': 16, 'no_epochs': 64}. Best is trial 13 with value: 0.019278210316042044.[0m
Trial Id: 14 | Model params: 19869 | Timestamp: 2021-08-20 13:00:48.944698

[32m[I 2021-08-20 13:01:01,629][0m Trial 14 pruned. [0m
epoch 0 -0.00439479557639455 10.189060884646143
Trial Id: 15 | Model params: 18501 | Timestamp: 2021-08-20 13:01:01.629603

[32m[I 2021-08-20 13:01:13,534][0m Trial 15 pruned. [0m
epoch 0 -10.2685811037026 34.128448695957594
Trial Id: 16 | Model params: 8294 | Timestamp: 2021-08-20 13:01:13.535037

[32m[I 2021-08-20 13:01:15,722][0m Trial 16 pruned. [0m
epoch 0 -0.0035380315799702355 10.187165606540475
Trial Id: 17 | Model params: 5537 | Timestamp: 2021-08-20 13:01:15.722362

[32m[I 2021-08-20 13:01:27,592][0m Trial 17 pruned. [0m
epoch 0 -0.026667150792357264 10.301412163640565
Trial Id: 18 | Model params: 13985 | Timestamp: 2021-08-20 13:01:27.592327

epoch 0 0.012493912218867753 10.103034158624453
epoch 5 0.014336538083881134 10.093603936102836
epoch 10 0.015466079369731545 10.087818791869685
epoch 15 0.005950928884754791 10.136449065545023
epoch 20 0.01519774459993306 10.089193415973238
epoch 25 0.014645734426409596 10.092020662332937
epoch 30 -0.00850696846646537 10.209897502877451
epoch 35 0.011117385912532196 10.11007322877283
epoch 40 0.01064422335041404 10.112491683699252
epoch 45 0.012473029631445476 10.103140981448785
epoch 50 0.011889686930612986 10.106124557406035
epoch 55 0.0180976433184582 10.074327888884063
epoch 60 0.014913678828257448 10.090648422728997
[32m[I 2021-08-20 13:14:54,353][0m Trial 18 finished with value: 0.018593257642572913 and parameters: {'n_layers_mlp': 2, 'mlp_n_units_l0': 217, 'mlp_dropout_l0': 0.1354630458044081, 'mlp_n_units_l1': 48, 'mlp_dropout_l1': 0.14301976931067287, 'lr': 0.0008782550010443816, 'criterion': 'MSELoss', 'batch_size': 16, 'no_epochs': 65}. Best is trial 13 with value: 0.019278210316042044.[0m
Trial Id: 19 | Model params: 61433 | Timestamp: 2021-08-20 13:14:54.353805

[32m[I 2021-08-20 13:15:03,251][0m Trial 19 pruned. [0m
epoch 0 -0.005971494632558638 10.197055142955906
Trial Id: 20 | Model params: 14657 | Timestamp: 2021-08-20 13:15:03.251605

[32m[I 2021-08-20 13:15:05,422][0m Trial 20 pruned. [0m
epoch 0 -0.01403139262853692 10.24028746877876
Trial Id: 21 | Model params: 20249 | Timestamp: 2021-08-20 13:15:05.422420

epoch 0 0.001554510395781361 10.15883976447407
[32m[I 2021-08-20 13:15:26,562][0m Trial 21 pruned. [0m
Trial Id: 22 | Model params: 20172 | Timestamp: 2021-08-20 13:15:26.562834

[32m[I 2021-08-20 13:15:38,370][0m Trial 22 pruned. [0m
epoch 0 -0.015106946178550684 10.243251366647481
Trial Id: 23 | Model params: 21627 | Timestamp: 2021-08-20 13:15:38.370306

epoch 0 0.010878200431457041 10.111295839266726
epoch 5 0.014518290160972502 10.092673284755081
epoch 10 0.017127593893253468 10.07930301876648
epoch 15 0.012690024742539552 10.102030909161039
epoch 20 0.01653282240152454 10.082352232173713
epoch 25 -0.005274335477248426 10.193521144984256
epoch 30 0.013835104235349172 10.096171055268954
epoch 35 0.010863070917657258 10.11137316968499
epoch 40 0.02206180392607715 10.053971158413656
epoch 45 0.01883029041630513 10.07056870428942
epoch 50 0.01733244087235708 10.078252616723711
epoch 55 0.01905739650983551 10.069403146559695
epoch 60 0.004031947799391422 10.146228399352724
epoch 65 0.02154757252388617 10.056614161948406
[32m[I 2021-08-20 13:29:35,319][0m Trial 23 finished with value: 0.021022539823690956 and parameters: {'n_layers_mlp': 2, 'mlp_n_units_l0': 180, 'mlp_dropout_l0': 0.002911218935220311, 'mlp_n_units_l1': 103, 'mlp_dropout_l1': 0.20051601700387145, 'lr': 0.00041350408483660966, 'criterion': 'MSELoss', 'batch_size': 16, 'no_epochs': 68}. Best is trial 23 with value: 0.021022539823690956.[0m
Trial Id: 24 | Model params: 26169 | Timestamp: 2021-08-20 13:29:35.319347

epoch 0 0.011773518943735906 10.106718607293816
epoch 5 0.0056590393297133446 10.1379371743958
epoch 10 0.013014882186088705 10.100368822272973
epoch 15 0.010214927189409528 10.114685425894411
epoch 20 0.00812600686828957 10.125353214437823
epoch 25 0.016269451115245692 10.083702162492711
epoch 30 0.01317877688957847 10.099530174530875
epoch 35 0.016500747371245184 10.082516644938952
epoch 40 0.013223684418174009 10.099300370950699
epoch 45 0.01724368061130077 10.078707769702788
epoch 50 0.01743533984040402 10.077724936261513
epoch 55 0.017547320015492196 10.077150654688195
epoch 60 0.01837371798269949 10.07291152492725
epoch 65 0.021546982259116887 10.056617195342762
[32m[I 2021-08-20 13:43:23,919][0m Trial 24 finished with value: 0.021801307274921466 and parameters: {'n_layers_mlp': 2, 'mlp_n_units_l0': 198, 'mlp_dropout_l0': 0.24834930298100985, 'mlp_n_units_l1': 115, 'mlp_dropout_l1': 0.2232364816198657, 'lr': 0.00034136427415067995, 'criterion': 'MSELoss', 'batch_size': 16, 'no_epochs': 67}. Best is trial 24 with value: 0.021801307274921466.[0m
Trial Id: 25 | Model params: 25181 | Timestamp: 2021-08-20 13:43:23.920090

epoch 0 0.004397675418107205 10.144365339257178
[32m[I 2021-08-20 13:43:48,724][0m Trial 25 pruned. [0m
Trial Id: 26 | Model params: 29366 | Timestamp: 2021-08-20 13:43:48.724254

epoch 0 0.007204385707728744 10.130056217619048
epoch 5 0.012302463606975844 10.104013452905154
epoch 10 0.010203600112362432 10.11474330183965
epoch 15 0.01630311930828543 10.083529603586085
epoch 20 0.016540526549903567 10.082312741232125
epoch 25 0.017674669889164996 10.07649751104106
epoch 30 0.016188863550273047 10.084115184311662
epoch 35 0.018694850854155787 10.071263745288027
epoch 40 0.01704734293761012 10.079714494958154
epoch 45 0.01915006080554693 10.068927534539107
epoch 50 0.019156052475513996 10.068896780709988
epoch 55 0.020614664725528753 10.061407271087688
epoch 60 0.02114728647202746 10.058671038009836
epoch 65 0.020509016449361428 10.061949928625573
epoch 70 0.020271350656305698 10.063170581140378
[32m[I 2021-08-20 13:59:17,981][0m Trial 26 finished with value: 0.01982518520554455 and parameters: {'n_layers_mlp': 2, 'mlp_n_units_l0': 237, 'mlp_dropout_l0': 0.37485038719785513, 'mlp_n_units_l1': 107, 'mlp_dropout_l1': 0.23578325108872983, 'lr': 0.0005046106101783561, 'criterion': 'MSELoss', 'batch_size': 16, 'no_epochs': 75}. Best is trial 24 with value: 0.021801307274921466.[0m
Trial Id: 27 | Model params: 40141 | Timestamp: 2021-08-20 13:59:17.981795

epoch 0 0.012801966497055783 10.10145820598367
epoch 5 0.003681977289883287 10.14801087060563
epoch 10 0.009957174394986779 10.116002337412418
epoch 15 0.013505158215505575 10.097859876724165
epoch 20 0.015740170219887828 10.086414487133261
epoch 25 0.010685401151546814 10.11228123639897
epoch 30 -0.003245432510103896 10.183229371711848
epoch 35 0.01758351227415622 10.076965038520878
epoch 40 0.01250073129929219 10.102999276043857
epoch 45 0.016832664056580793 10.08081515004875
epoch 50 0.017706317131444438 10.076335194180878
epoch 55 0.01543540001322341 10.087975965417312
epoch 60 0.014300735394178976 10.093787251657332
[32m[I 2021-08-20 14:12:56,389][0m Trial 27 pruned. [0m
epoch 65 0.014702864436508478 10.09172809466473
Trial Id: 28 | Model params: 24019 | Timestamp: 2021-08-20 14:12:56.389679

[32m[I 2021-08-20 14:13:08,927][0m Trial 28 pruned. [0m
epoch 0 -0.006090400652922323 10.197657772069102
Trial Id: 29 | Model params: 81585 | Timestamp: 2021-08-20 14:13:08.927962

[32m[I 2021-08-20 14:13:23,732][0m Trial 29 pruned. [0m
epoch 0 -0.23686216478806843 11.306874790507074
Study statistics: 
  Number of finished trials:  30
  Number of pruned trials:  16
  Number of complete trials:  14

Best trial:
  Value:  0.021801307274921466
  Params: 
    n_layers_mlp: 2
    mlp_n_units_l0: 198
    mlp_dropout_l0: 0.24834930298100985
    mlp_n_units_l1: 115
    mlp_dropout_l1: 0.2232364816198657
    lr: 0.00034136427415067995
    criterion: MSELoss
    batch_size: 16
    no_epochs: 67
Target 17327 0 105.0 4.0 32.60899174698447
[26. 33. 36. ... 29. 25. 29.]
Prediction 17327 0 40.48262023925781 28.172216415405273 32.63068031781735
[33.79039383 30.97517014 32.724823   ... 34.03875732 31.73194695
 32.09095383]

 XXXXXX======== TRIAL des - lrg ended

Test Set - R-squared:  0.018543179045149683
Test Set - RMSE:  10.101418303233501
Test Set - MAE:  7.68501751359724



