[32m[I 2021-08-19 14:14:33,093][0m Trial 5 pruned. [0m
epoch 0 -0.29962197672574375 26.4176292729026
Trial Id: 6 | Model params: 69625 | Timestamp: 2021-08-19 14:14:33.093261

epoch 0 0.1129822907433794 21.82485983513309
epoch 5 0.09138327045786687 22.088981036745203
epoch 10 0.0692768656601227 22.356075748070168
epoch 15 0.13155123665414226 21.595209345349105
epoch 20 0.12041202035168352 21.733264263644006
epoch 25 0.10862189247183085 21.878437353176324
epoch 30 0.07146097878290436 22.32982901777942
epoch 35 0.08011462865012098 22.22553245791589
epoch 40 0.08396052036461388 22.179023119682814
[32m[I 2021-08-19 14:27:13,497][0m Trial 6 pruned. [0m
Trial Id: 7 | Model params: 30534 | Timestamp: 2021-08-19 14:27:13.497323

[32m[I 2021-08-19 14:27:46,338][0m Trial 7 pruned. [0m
epoch 0 -31.555296284418134 132.22366035764446
Trial Id: 8 | Model params: 171776 | Timestamp: 2021-08-19 14:27:46.339115

[32m[I 2021-08-19 14:27:49,956][0m Trial 8 pruned. [0m
epoch 0 -0.2878308244809338 26.297515868569903
Trial Id: 9 | Model params: 63045 | Timestamp: 2021-08-19 14:27:49.956244

epoch 0 0.0792638191231515 22.235808371053494
epoch 5 0.1505223889904147 21.358034635245144
epoch 10 0.11419151588938092 21.809978413032635
epoch 15 0.13808735293641217 21.51379096586421
epoch 20 0.14057918440073636 21.482669747310645
epoch 25 0.09994808714916947 21.98462679535102
epoch 30 0.12930932894548064 21.623065485528066
epoch 35 0.1147895488853089 21.802614920165343
epoch 40 0.12910982095565415 21.625542672534408
epoch 45 0.1373322198480963 21.5232131612235
[32m[I 2021-08-19 14:31:54,263][0m Trial 9 finished with value: 0.134415248299123 and parameters: {'n_layers_mlp': 4, 'mlp_n_units_l0': 63, 'mlp_dropout_l0': 0.22522691800443045, 'mlp_n_units_l1': 41, 'mlp_dropout_l1': 0.3330814055264496, 'mlp_n_units_l2': 220, 'mlp_dropout_l2': 0.4264218078206368, 'mlp_n_units_l3': 226, 'mlp_dropout_l3': 0.231845861214185, 'lr': 0.015545187051755484, 'criterion': 'MSELoss', 'batch_size': 128, 'no_epochs': 49}. Best is trial 4 with value: 0.21073521056214017.[0m
Trial Id: 10 | Model params: 26518 | Timestamp: 2021-08-19 14:31:54.263527

[32m[I 2021-08-19 14:31:58,354][0m Trial 10 pruned. [0m
epoch 0 -0.4173422052477982 27.58815629674945
Trial Id: 11 | Model params: 42554 | Timestamp: 2021-08-19 14:31:58.354367

epoch 0 0.013970637066299196 23.010721805612114
[32m[I 2021-08-19 14:32:05,714][0m Trial 11 pruned. [0m
Trial Id: 12 | Model params: 48655 | Timestamp: 2021-08-19 14:32:05.715068

epoch 0 0.07244566268941532 22.31865555621826
epoch 5 0.1718042244727589 21.089430634489762
epoch 10 0.17904227573661524 20.99707242353845
epoch 15 0.20215610942347317 20.6993787607555
epoch 20 0.20859098345597826 20.61573611071086
epoch 25 0.19272580600276146 20.821349989235767
epoch 30 0.20306545468136805 20.687579304396166
epoch 35 0.20361416875839222 20.68045605901824
epoch 40 0.21407633583618013 20.544166790953597
epoch 45 0.20378799816069182 20.678198944839348
epoch 50 0.2020563432626119 20.700672894245912
epoch 55 0.21135356032143138 20.579722909852133
epoch 60 0.21016596873888815 20.59521217758198
epoch 65 0.2106194978646425 20.589298359336087
epoch 70 0.20961823938409185 20.602352061917347
epoch 75 0.19916151232416068 20.738188510988547
