[32m[I 2021-08-22 04:15:19,760][0m Trial 46 pruned. [0m
epoch 0 0.008005130448890285 11.747275695588923
Trial Id: 47 | Model params: 6129 | Timestamp: 2021-08-22 04:15:19.760244

[32m[I 2021-08-22 04:15:37,804][0m Trial 47 pruned. [0m
epoch 0 0.015340713751688106 11.702914910467898
Trial Id: 48 | Model params: 8446 | Timestamp: 2021-08-22 04:15:37.804499

[32m[I 2021-08-22 04:15:40,691][0m Trial 48 pruned. [0m
epoch 0 -0.07042343564344922 12.197412250511702
Trial Id: 49 | Model params: 1919 | Timestamp: 2021-08-22 04:15:40.691681

[32m[I 2021-08-22 04:15:48,256][0m Trial 49 pruned. [0m
epoch 0 -7.490826685141583 34.368251385663044
Trial Id: 50 | Model params: 5464 | Timestamp: 2021-08-22 04:15:48.256955

[32m[I 2021-08-22 04:15:49,877][0m Trial 50 pruned. [0m
epoch 0 -0.030761497222228984 11.963022128214636
Trial Id: 51 | Model params: 4883 | Timestamp: 2021-08-22 04:15:49.877827

[32m[I 2021-08-22 04:15:51,408][0m Trial 51 pruned. [0m
epoch 0 -0.037240165009125636 12.000558960177838
Trial Id: 52 | Model params: 1633 | Timestamp: 2021-08-22 04:15:51.409078

epoch 0 -8.9263218916257 37.12410475211266
epoch 5 -8.9263218916257 37.12410475211266
epoch 10 0.005292441649716095 11.751938802038675
epoch 15 0.01780501282333946 11.677790208149046
epoch 20 -0.009389379703593548 11.838350054720026
epoch 25 -0.03424193498138206 11.983202095198013
epoch 30 -0.023709363704492947 11.922028346215367
epoch 35 0.006963556170224927 11.742062989450904
epoch 40 0.019501615830958663 11.667699982938654
[32m[I 2021-08-22 04:16:53,979][0m Trial 52 finished with value: 11.669683116680105 and parameters: {'n_layers_mlp': 2, 'mlp_n_units_l0': 30, 'mlp_dropout_l0': 0.026167574031198425, 'mlp_n_units_l1': 36, 'mlp_dropout_l1': 0.07643573706993603, 'lr': 0.009807761670452714, 'criterion': 'L1Loss', 'batch_size': 256, 'no_epochs': 42}. Best is trial 0 with value: 11.639521207561222.[0m
Trial Id: 53 | Model params: 1529 | Timestamp: 2021-08-22 04:16:53.979337

epoch 0 -8.9263218916257 37.12410475211266
epoch 5 -8.9263218916257 37.12410475211266
epoch 10 -8.9263218916257 37.12410475211266
epoch 15 -8.9263218916257 37.12410475211266
epoch 20 -8.9263218916257 37.12410475211266
epoch 25 -8.9263218916257 37.12410475211266
epoch 30 -8.9263218916257 37.12410475211266
epoch 35 -8.9263218916257 37.12410475211266
epoch 40 -8.9263218916257 37.12410475211266
epoch 45 -8.9263218916257 37.12410475211266
[32m[I 2021-08-22 04:18:03,750][0m Trial 53 finished with value: 37.12410475211266 and parameters: {'n_layers_mlp': 2, 'mlp_n_units_l0': 28, 'mlp_dropout_l0': 0.02689519587365789, 'mlp_n_units_l1': 36, 'mlp_dropout_l1': 0.0773024838392952, 'lr': 0.0032060247346098513, 'criterion': 'L1Loss', 'batch_size': 256, 'no_epochs': 47}. Best is trial 0 with value: 11.639521207561222.[0m
Trial Id: 54 | Model params: 1355 | Timestamp: 2021-08-22 04:18:03.751120

[32m[I 2021-08-22 04:18:05,260][0m Trial 54 pruned. [0m
epoch 0 -0.00812310788294579 11.83092216132196
Trial Id: 55 | Model params: 4788 | Timestamp: 2021-08-22 04:18:05.261034

[32m[I 2021-08-22 04:18:13,201][0m Trial 55 pruned. [0m
epoch 0 -0.020002955763551045 11.911958271717232
Trial Id: 56 | Model params: 1145 | Timestamp: 2021-08-22 04:18:13.201512

[32m[I 2021-08-22 04:18:15,567][0m Trial 56 pruned. [0m
epoch 0 -0.03568222285426548 11.997842565927249
Trial Id: 57 | Model params: 1529 | Timestamp: 2021-08-22 04:18:15.567243

[32m[I 2021-08-22 04:18:17,037][0m Trial 57 pruned. [0m
epoch 0 -0.025905026276770382 11.93480674374815
Trial Id: 58 | Model params: 1319 | Timestamp: 2021-08-22 04:18:17.037213

[32m[I 2021-08-22 04:18:18,524][0m Trial 58 pruned. [0m
epoch 0 -7.702899105550641 34.76112205221605
Trial Id: 59 | Model params: 5728 | Timestamp: 2021-08-22 04:18:18.525204

[32m[I 2021-08-22 04:18:28,172][0m Trial 59 pruned. [0m
epoch 0 0.014454979344540986 11.70902362558816
Study statistics: 
  Number of finished trials:  60
  Number of pruned trials:  49
  Number of complete trials:  11

Best trial:
  Value:  11.639521207561222
  Params: 
    n_layers_mlp: 4
    mlp_n_units_l0: 30
    mlp_dropout_l0: 0.08752053678878081
    mlp_n_units_l1: 28
    mlp_dropout_l1: 0.2606411673450918
    mlp_n_units_l2: 50
    mlp_dropout_l2: 0.2845387977306847
    mlp_n_units_l3: 73
    mlp_dropout_l3: 0.08455566483639344
    lr: 0.00042966343711901
    criterion: MSELoss
    batch_size: 128
    no_epochs: 68
Target 19508 0 131.0 1.0 35.25584375640763
[37. 27. 21. ... 27. 25. 32.]
Prediction 19508 0 42.65390396118164 24.043638229370117 35.74281107951609
[36.9894371  34.81783295 34.24811554 ... 34.66788101 34.66122818
 34.18856812]

 XXXXXX======== TRIAL north - lrg ended

Test Set - R-squared:  0.022140414501169103
Test Set - RMSE:  11.836388571556668
Test Set - MAE:  8.752876357120986



[32m[I 2021-08-22 04:18:37,451][0m A new study created in memory with name: NeuralNetwork[0m
++++++++ Session Characteristics +++++++

Area: north
Gal Type: elg
Training Samples: 62423
Validation Samples: 15606
Test Samples: 19508
Number of features: 15
Device: cuda:0
Number of Workers: 8
Number of Trials: 60

+++++++++++++++++++++++++++++++++++++++
Trial Id: 0 | Model params: 11085 | Timestamp: 2021-08-22 04:18:37.451803

epoch 0 0.057395870788497616 21.529195132931026
epoch 5 0.14577521518219394 20.49506071138218
epoch 10 0.14628261115311358 20.488972936771138
epoch 15 0.12749860527057089 20.713151897857344
epoch 20 0.10066655195630858 21.029236155957108
epoch 25 0.14024539352342436 20.561291056740025
epoch 30 0.15617732634364723 20.369891722792534
epoch 35 0.13336691960774705 20.643377590804423
epoch 40 0.1218134512017055 20.780525003629634
epoch 45 0.1556689880981813 20.37602644535903
[32m[I 2021-08-22 04:33:14,775][0m Trial 0 finished with value: 20.640152672940452 and parameters: {'n_layers_mlp': 4, 'mlp_n_units_l0': 75, 'mlp_dropout_l0': 0.17593180929254193, 'mlp_n_units_l1': 34, 'mlp_dropout_l1': 0.21940243249752653, 'mlp_n_units_l2': 65, 'mlp_dropout_l2': 0.12200336831316314, 'mlp_n_units_l3': 75, 'mlp_dropout_l3': 0.23607901815137386, 'lr': 0.005439581645464851, 'criterion': 'L1Loss', 'batch_size': 16, 'no_epochs': 47}. Best is trial 0 with value: 20.640152672940452.[0m
Trial Id: 1 | Model params: 3280 | Timestamp: 2021-08-22 04:33:14.775913

epoch 0 0.08950116457507984 21.108960654537103
epoch 5 0.1360574379787307 20.56220042805437
epoch 10 0.12217130764176809 20.726789608851277
epoch 15 0.057990278680254526 21.471127229323535
epoch 20 0.1134263329094426 20.82977443326403
epoch 25 0.17062269302053368 20.14666788440745
epoch 30 0.17188918570423295 20.131279619291416
epoch 35 0.12165371381778989 20.732899273217768
epoch 40 0.16595155314594168 20.2033222975122
epoch 45 0.1807773458665506 20.022953085597994
epoch 50 0.15647494913833881 20.317774944916504
epoch 55 0.1700799746430819 20.153258478753006
epoch 60 0.157988543047354 20.299537983107264
epoch 65 0.181587960271974 20.013044356144675
epoch 70 0.18304002256684238 19.99528246658663
[32m[I 2021-08-22 04:36:05,731][0m Trial 1 finished with value: 19.950248315180087 and parameters: {'n_layers_mlp': 2, 'mlp_n_units_l0': 75, 'mlp_dropout_l0': 0.013310357603743283, 'mlp_n_units_l1': 27, 'mlp_dropout_l1': 0.294441451347222, 'lr': 0.008791104947043714, 'criterion': 'L1Loss', 'batch_size': 128, 'no_epochs': 72}. Best is trial 1 with value: 19.950248315180087.[0m
Trial Id: 2 | Model params: 1589 | Timestamp: 2021-08-22 04:36:05.731290

epoch 0 -31.82250194425655 126.73979328361146
epoch 5 -30.763531122064016 124.67849216022502
epoch 10 -28.08395658833918 119.30369565036337
epoch 15 -23.555178499166583 109.6222472474053
epoch 20 -17.31796913287265 94.68164930630836
epoch 25 -10.124057393935315 73.78341691069808
epoch 30 -3.846842161405907 48.70309845697279
epoch 35 -0.9424203475359325 30.831791647566746
epoch 40 -0.567471526979596 27.696633450186933
epoch 45 -0.4774754394033305 26.889782423042668
epoch 50 -0.4006767166668388 26.181595439385408
epoch 55 -0.33334809797950316 25.544589379963142
epoch 60 -0.273367774234774 24.963419817686688
epoch 65 -0.2219944115183663 24.454667539014647
epoch 70 -0.17895624519879538 24.020165575766487
[32m[I 2021-08-22 04:39:03,189][0m Trial 2 finished with value: 23.717528217623087 and parameters: {'n_layers_mlp': 2, 'mlp_n_units_l0': 28, 'mlp_dropout_l0': 0.21367224022026388, 'mlp_n_units_l1': 38, 'mlp_dropout_l1': 0.2854927567407425, 'lr': 1.5591440255946764e-05, 'criterion': 'L1Loss', 'batch_size': 128, 'no_epochs': 75}. Best is trial 1 with value: 19.950248315180087.[0m
Trial Id: 3 | Model params: 455 | Timestamp: 2021-08-22 04:39:03.189782

epoch 0 -31.41080734039366 126.24321607058256
epoch 5 -26.807836688954147 116.93559430587833
epoch 10 -13.232522933062494 83.65734380774752
epoch 15 -1.026388861261632 31.56636107120717
epoch 20 -0.5763491952308808 27.84128908733072
epoch 25 -0.47430855984226805 26.925099608907065
epoch 30 -0.3804557531297772 26.053997709247547
epoch 35 -0.30938173601319763 25.374428206279916
[32m[I 2021-08-22 04:49:07,987][0m Trial 3 finished with value: 24.773561471830945 and parameters: {'n_layers_mlp': 2, 'mlp_n_units_l0': 16, 'mlp_dropout_l0': 0.17120556456977518, 'mlp_n_units_l1': 11, 'mlp_dropout_l1': 0.19330379495158864, 'lr': 1.0052032853675194e-05, 'criterion': 'MSELoss', 'batch_size': 16, 'no_epochs': 41}. Best is trial 1 with value: 19.950248315180087.[0m
epoch 40 -0.24810361519145885 24.773561471830945
Trial Id: 4 | Model params: 1949 | Timestamp: 2021-08-22 04:49:07.987349

epoch 0 0.055486849295916296 21.550985249573507
epoch 5 0.15556643164228945 20.377263892270125
epoch 10 0.1673527590703342 20.23455457919162
epoch 15 0.17437673206650672 20.149027380839183
epoch 20 0.17637408644651997 20.12464027884828
epoch 25 0.18617597475624348 20.004531208251162
epoch 30 0.1952909804809726 19.892188210213632
epoch 35 0.19176727482303968 19.93569315973833
epoch 40 0.19767309960454693 19.862723720088777
epoch 45 0.20045017683157373 19.828318709002083
[32m[I 2021-08-22 05:01:52,287][0m Trial 4 finished with value: 19.88899012797907 and parameters: {'n_layers_mlp': 2, 'mlp_n_units_l0': 28, 'mlp_dropout_l0': 0.2883753204558193, 'mlp_n_units_l1': 50, 'mlp_dropout_l1': 0.12240702916458719, 'lr': 0.0005444179673779185, 'criterion': 'L1Loss', 'batch_size': 16, 'no_epochs': 51}. Best is trial 4 with value: 19.88899012797907.[0m
epoch 50 0.19554970704421293 19.88899012797907
Trial Id: 5 | Model params: 12009 | Timestamp: 2021-08-22 05:01:52.287466

epoch 0 -0.22182579248896284 24.511380372647558
epoch 5 0.06423975017233441 21.450895221099746
epoch 10 0.0784461782962046 21.287441983496254
epoch 15 0.09894722551390234 21.049328179521236
epoch 20 0.12783501855705515 20.70915829317023
epoch 25 0.13722004002640342 20.597435409224843
epoch 30 0.13833647867383292 20.584104538113596
epoch 35 0.1512992382730065 20.428685433315117
epoch 40 0.16027556294562417 20.320365769944964
epoch 45 0.1535389450042629 20.401712151084208
epoch 50 0.16220662425581844 20.296987590297025
epoch 55 0.16585433212508272 20.252753386353962
[32m[I 2021-08-22 05:20:37,613][0m Trial 5 finished with value: 20.30567267019962 and parameters: {'n_layers_mlp': 4, 'mlp_n_units_l0': 57, 'mlp_dropout_l0': 0.24562194460099923, 'mlp_n_units_l1': 38, 'mlp_dropout_l1': 0.03868949008835586, 'mlp_n_units_l2': 76, 'mlp_dropout_l2': 0.1209567439770519, 'mlp_n_units_l3': 76, 'mlp_dropout_l3': 0.18608737194529182, 'lr': 2.7197409051631625e-05, 'criterion': 'L1Loss', 'batch_size': 16, 'no_epochs': 60}. Best is trial 4 with value: 19.88899012797907.[0m
Trial Id: 6 | Model params: 2499 | Timestamp: 2021-08-22 05:20:37.613864

epoch 0 -27.699752078872542 118.79610393893348
epoch 5 -0.24989100494195493 24.791294041259686
epoch 10 -0.004192625859823718 22.221411359638445
epoch 15 0.04563074471858086 21.663136948647058
epoch 20 0.06382616870252766 21.45563506377236
epoch 25 0.0616173666719565 21.48093128974785
epoch 30 0.07551032129836732 21.32132344978784
epoch 35 0.07090555392446196 21.374356915239826
epoch 40 0.07989103844251388 21.270747656464543
epoch 45 0.08337389395536354 21.230451787871182
epoch 50 0.09060373173154213 21.146559027661713
epoch 55 0.09485400941297084 21.097084439673974
epoch 60 0.09510612794250195 21.094146053823405
epoch 65 0.09959659379127761 21.041741926003635
epoch 70 0.10249133454700865 21.007890753222796
[32m[I 2021-08-22 05:39:07,977][0m Trial 6 finished with value: 21.047431098271673 and parameters: {'n_layers_mlp': 2, 'mlp_n_units_l0': 44, 'mlp_dropout_l0': 0.22472640970683666, 'mlp_n_units_l1': 39, 'mlp_dropout_l1': 0.15307706451223468, 'lr': 2.6447073230327106e-05, 'criterion': 'L1Loss', 'batch_size': 16, 'no_epochs': 74}. Best is trial 4 with value: 19.88899012797907.[0m
Trial Id: 7 | Model params: 13477 | Timestamp: 2021-08-22 05:39:07.977225

epoch 0 -31.401433712683477 126.01160222099274
epoch 5 -0.3266462934568639 25.497992782020155
epoch 10 -0.06014999761538231 22.793555679541576
epoch 15 0.04990104696621289 21.578082023202082
epoch 20 0.07228224896454061 21.32241310011771
epoch 25 0.0883104722866146 21.13741640131335
epoch 30 0.09799100328206667 21.024895915500124
epoch 35 0.11638498371070205 20.809419424732585
epoch 40 0.12354268087352904 20.724965005224547
epoch 45 0.12906280617899102 20.65959667127519
epoch 50 0.1288503532074421 20.662116327742396
epoch 55 0.13810163210754367 20.552111575982092
epoch 60 0.14412530772884846 20.480167875446522
epoch 65 0.15177782068797985 20.38840406250774
[32m[I 2021-08-22 05:41:14,906][0m Trial 7 finished with value: 20.385149408617362 and parameters: {'n_layers_mlp': 4, 'mlp_n_units_l0': 60, 'mlp_dropout_l0': 0.21404904246587472, 'mlp_n_units_l1': 66, 'mlp_dropout_l1': 0.019897887217592412, 'mlp_n_units_l2': 75, 'mlp_dropout_l2': 0.2705368150333242, 'mlp_n_units_l3': 45, 'mlp_dropout_l3': 0.09778238796622778, 'lr': 4.967089197359735e-05, 'criterion': 'MSELoss', 'batch_size': 256, 'no_epochs': 71}. Best is trial 4 with value: 19.88899012797907.[0m
epoch 70 0.15204860689183453 20.385149408617362
Trial Id: 8 | Model params: 3539 | Timestamp: 2021-08-22 05:41:14.906550

[32m[I 2021-08-22 05:41:16,388][0m Trial 8 pruned. [0m
epoch 0 -0.18192734327001592 24.067102623484914
Trial Id: 9 | Model params: 2246 | Timestamp: 2021-08-22 05:41:16.388585

[32m[I 2021-08-22 05:41:23,845][0m Trial 9 pruned. [0m
epoch 0 0.09804235089509039 21.06153188531992
Trial Id: 10 | Model params: 2451 | Timestamp: 2021-08-22 05:41:23.845429

epoch 0 -31.692457510851916 126.80041265057969
epoch 5 -31.692457510851916 126.80041265057969
epoch 10 -31.692457510851916 126.80041265057969
epoch 15 -31.692457510851916 126.80041265057969
epoch 20 -31.692457510851916 126.80041265057969
epoch 25 -31.692457510851916 126.80041265057969
epoch 30 -31.692457510851916 126.80041265057969
epoch 35 -31.692457510851916 126.80041265057969
epoch 40 -31.692457510851916 126.80041265057969
epoch 45 -31.692457510851916 126.80041265057969
epoch 50 -31.692457510851916 126.80041265057969
epoch 55 -31.692457510851916 126.80041265057969
[32m[I 2021-08-22 05:51:17,531][0m Trial 10 finished with value: 126.80041265057969 and parameters: {'n_layers_mlp': 4, 'mlp_n_units_l0': 12, 'mlp_dropout_l0': 0.08663699517294725, 'mlp_n_units_l1': 80, 'mlp_dropout_l1': 0.10037137313947846, 'mlp_n_units_l2': 13, 'mlp_dropout_l2': 0.0007009450254960026, 'mlp_n_units_l3': 11, 'mlp_dropout_l3': 0.01040886055384907, 'lr': 0.0004928464932808592, 'criterion': 'L1Loss', 'batch_size': 32, 'no_epochs': 60}. Best is trial 4 with value: 19.88899012797907.[0m
Trial Id: 11 | Model params: 3085 | Timestamp: 2021-08-22 05:51:17.531537

[32m[I 2021-08-22 05:51:20,014][0m Trial 11 pruned. [0m
epoch 0 -0.5402749900839778 27.455305777436816
Trial Id: 12 | Model params: 1185 | Timestamp: 2021-08-22 05:51:20.014991

epoch 0 -30.39720603239636 123.95745599057763
epoch 5 -0.4516730308853423 26.65394869191087
epoch 10 -0.12252082320200519 23.438205413854803
epoch 15 0.010564513889771754 22.00497574618126
epoch 20 0.04045042707467339 21.67009729937937
epoch 25 0.04211094858441655 21.651338891886446
epoch 30 0.059923489652073725 21.44908417834752
epoch 35 0.06014090120730964 21.44660376938684
epoch 40 0.07223032730972867 21.308223288005276
epoch 45 0.0846029646916403 21.165664308598384
epoch 50 0.0758533750060334 21.266577053753988
epoch 55 0.0753366229212491 21.27252200443249
epoch 60 0.08337535007389918 21.179851908275296
[32m[I 2021-08-22 05:53:57,434][0m Trial 12 finished with value: 21.10533089493488 and parameters: {'n_layers_mlp': 2, 'mlp_n_units_l0': 30, 'mlp_dropout_l0': 0.2993095051068824, 'mlp_n_units_l1': 22, 'mlp_dropout_l1': 0.16678452090317383, 'lr': 0.00012973455387475528, 'criterion': 'L1Loss', 'batch_size': 128, 'no_epochs': 66}. Best is trial 4 with value: 19.88899012797907.[0m
epoch 65 0.0898142645709461 21.10533089493488
Trial Id: 13 | Model params: 2809 | Timestamp: 2021-08-22 05:53:57.434452

[32m[I 2021-08-22 05:53:59,821][0m Trial 13 pruned. [0m
epoch 0 -0.08213127715812485 23.012676263314084
Trial Id: 14 | Model params: 1694 | Timestamp: 2021-08-22 05:53:59.821505

epoch 0 -31.847658496484534 126.7883533469123
epoch 5 -31.847658496484534 126.7883533469123
epoch 10 -31.847658496484534 126.7883533469123
epoch 15 -31.847658496484534 126.7883533469123
epoch 20 -31.847658496484534 126.7883533469123
epoch 25 -31.847658496484534 126.7883533469123
epoch 30 -31.847658496484534 126.7883533469123
epoch 35 -31.847658496484534 126.7883533469123
epoch 40 -31.847658496484534 126.7883533469123
epoch 45 -31.847658496484534 126.7883533469123
epoch 50 -31.847658496484534 126.7883533469123
epoch 55 -31.847658496484534 126.7883533469123
epoch 60 -31.847658496484534 126.7883533469123
epoch 65 -31.847658496484534 126.7883533469123
epoch 70 -31.847658496484534 126.7883533469123
epoch 75 -31.847658496484534 126.7883533469123
[32m[I 2021-08-22 05:57:10,703][0m Trial 14 finished with value: 126.7883533469123 and parameters: {'n_layers_mlp': 2, 'mlp_n_units_l0': 23, 'mlp_dropout_l0': 0.0006905018790297618, 'mlp_n_units_l1': 53, 'mlp_dropout_l1': 0.10109024535811836, 'lr': 0.008422710685572715, 'criterion': 'L1Loss', 'batch_size': 128, 'no_epochs': 80}. Best is trial 4 with value: 19.88899012797907.[0m
Trial Id: 15 | Model params: 3455 | Timestamp: 2021-08-22 05:57:10.703538

[32m[I 2021-08-22 05:57:25,650][0m Trial 15 pruned. [0m
epoch 0 -0.12319978078604477 23.501286131284314
Trial Id: 16 | Model params: 1009 | Timestamp: 2021-08-22 05:57:25.650191

[32m[I 2021-08-22 05:57:40,584][0m Trial 16 pruned. [0m
epoch 0 0.06864550644552059 21.400337976842557
Trial Id: 17 | Model params: 915 | Timestamp: 2021-08-22 05:57:40.584279

[32m[I 2021-08-22 05:57:41,924][0m Trial 17 pruned. [0m
epoch 0 0.04503266487403934 21.63329528276679
Trial Id: 18 | Model params: 3193 | Timestamp: 2021-08-22 05:57:41.924626

[32m[I 2021-08-22 05:57:49,647][0m Trial 18 pruned. [0m
epoch 0 -0.16675115884315983 23.954438943854452
Trial Id: 19 | Model params: 6160 | Timestamp: 2021-08-22 05:57:49.647841

[32m[I 2021-08-22 05:57:52,664][0m Trial 19 pruned. [0m
epoch 0 -26.084281789723025 115.12928695363098
Trial Id: 20 | Model params: 1147 | Timestamp: 2021-08-22 05:57:52.665012

epoch 0 -31.695674748398808 126.79679533683928
epoch 5 -31.695674748398808 126.79679533683928
epoch 10 -31.695674748398808 126.79679533683928
epoch 15 -31.695674748398808 126.79679533683928
epoch 20 -31.695674748398808 126.79679533683928
epoch 25 -31.695674748398808 126.79679533683928
epoch 30 -31.695674748398808 126.79679533683928
epoch 35 -31.695674748398808 126.79679533683928
epoch 40 -31.695674748398808 126.79679533683928
epoch 45 -31.695674748398808 126.79679533683928
epoch 50 -31.695674748398808 126.79679533683928
[32m[I 2021-08-22 06:11:40,682][0m Trial 20 finished with value: 126.79679533683928 and parameters: {'n_layers_mlp': 2, 'mlp_n_units_l0': 36, 'mlp_dropout_l0': 0.128915156504353, 'mlp_n_units_l1': 15, 'mlp_dropout_l1': 0.17915137886345187, 'lr': 0.0021831928915789825, 'criterion': 'MSELoss', 'batch_size': 16, 'no_epochs': 56}. Best is trial 4 with value: 19.88899012797907.[0m
epoch 55 -31.695674748398808 126.79679533683928
Trial Id: 21 | Model params: 8419 | Timestamp: 2021-08-22 06:11:40.682452

[32m[I 2021-08-22 06:11:59,678][0m Trial 21 pruned. [0m
epoch 0 -0.13300272616875475 23.603619364614392
Trial Id: 22 | Model params: 8983 | Timestamp: 2021-08-22 06:11:59.678978

[32m[I 2021-08-22 06:12:18,374][0m Trial 22 pruned. [0m
epoch 0 0.11928885298925274 20.810373346133584
Trial Id: 23 | Model params: 12397 | Timestamp: 2021-08-22 06:12:18.374726

[32m[I 2021-08-22 06:12:37,023][0m Trial 23 pruned. [0m
epoch 0 0.07432391405509453 21.335000001717315
Trial Id: 24 | Model params: 6077 | Timestamp: 2021-08-22 06:12:37.023933

[32m[I 2021-08-22 06:12:55,882][0m Trial 24 pruned. [0m
epoch 0 -0.05844545114097888 22.81378610956051
Trial Id: 25 | Model params: 6855 | Timestamp: 2021-08-22 06:12:55.882527

epoch 0 -31.847658496484534 126.7883533469123
epoch 5 -31.847658496484534 126.7883533469123
epoch 10 -31.847658496484534 126.7883533469123
epoch 15 -31.847658496484534 126.7883533469123
epoch 20 -31.847658496484534 126.7883533469123
epoch 25 -31.847658496484534 126.7883533469123
epoch 30 -31.847658496484534 126.7883533469123
epoch 35 -31.847658496484534 126.7883533469123
epoch 40 -31.847658496484534 126.7883533469123
epoch 45 -31.847658496484534 126.7883533469123
