[32m[I 2021-08-22 06:15:14,776][0m Trial 25 finished with value: 126.7883533469123 and parameters: {'n_layers_mlp': 4, 'mlp_n_units_l0': 61, 'mlp_dropout_l0': 0.24028813734020338, 'mlp_n_units_l1': 17, 'mlp_dropout_l1': 0.11198672211737867, 'mlp_n_units_l2': 58, 'mlp_dropout_l2': 0.06747860052179805, 'mlp_n_units_l3': 63, 'mlp_dropout_l3': 0.29457555760739207, 'lr': 1.9725007279423787e-05, 'criterion': 'L1Loss', 'batch_size': 128, 'no_epochs': 47}. Best is trial 4 with value: 19.88899012797907.[0m
Trial Id: 26 | Model params: 3479 | Timestamp: 2021-08-22 06:15:14.776604

[32m[I 2021-08-22 06:15:29,857][0m Trial 26 pruned. [0m
epoch 0 0.043117450062335916 21.691642711951406
Trial Id: 27 | Model params: 5487 | Timestamp: 2021-08-22 06:15:29.857795

[32m[I 2021-08-22 06:15:31,559][0m Trial 27 pruned. [0m
epoch 0 -0.2332151470543078 24.583733823996333
Trial Id: 28 | Model params: 3541 | Timestamp: 2021-08-22 06:15:31.559955

epoch 0 -31.847658496484534 126.7883533469123
epoch 5 -31.847658496484534 126.7883533469123
epoch 10 -31.847658496484534 126.7883533469123
epoch 15 -31.847658496484534 126.7883533469123
epoch 20 -31.847658496484534 126.7883533469123
epoch 25 -31.847658496484534 126.7883533469123
epoch 30 -31.847658496484534 126.7883533469123
epoch 35 -31.847658496484534 126.7883533469123
epoch 40 -31.847658496484534 126.7883533469123
epoch 45 -31.847658496484534 126.7883533469123
epoch 50 -31.847658496484534 126.7883533469123
[32m[I 2021-08-22 06:17:37,202][0m Trial 28 finished with value: 126.7883533469123 and parameters: {'n_layers_mlp': 2, 'mlp_n_units_l0': 45, 'mlp_dropout_l0': 0.053435047908174604, 'mlp_n_units_l1': 60, 'mlp_dropout_l1': 0.14644165185813124, 'lr': 1.0998845927910772e-05, 'criterion': 'L1Loss', 'batch_size': 128, 'no_epochs': 53}. Best is trial 4 with value: 19.88899012797907.[0m
Trial Id: 29 | Model params: 12011 | Timestamp: 2021-08-22 06:17:37.202600

[32m[I 2021-08-22 06:17:56,302][0m Trial 29 pruned. [0m
epoch 0 -0.10320761223264485 23.291193852538274
Trial Id: 30 | Model params: 4187 | Timestamp: 2021-08-22 06:17:56.302648

[32m[I 2021-08-22 06:18:04,005][0m Trial 30 pruned. [0m
epoch 0 0.07347780023197992 21.346407594117156
Trial Id: 31 | Model params: 13677 | Timestamp: 2021-08-22 06:18:04.006132

epoch 0 -31.796139725978193 126.7767995377769
epoch 5 -31.796139725978193 126.7767995377769
epoch 10 -31.796139725978193 126.7767995377769
epoch 15 -31.796139725978193 126.7767995377769
epoch 20 -31.796139725978193 126.7767995377769
epoch 25 -31.796139725978193 126.7767995377769
epoch 30 -31.796139725978193 126.7767995377769
epoch 35 -31.796139725978193 126.7767995377769
epoch 40 -31.796139725978193 126.7767995377769
epoch 45 -31.796139725978193 126.7767995377769
epoch 50 -31.796139725978193 126.7767995377769
epoch 55 -31.796139725978193 126.7767995377769
epoch 60 -31.796139725978193 126.7767995377769
epoch 65 -31.796139725978193 126.7767995377769
[32m[I 2021-08-22 06:20:08,531][0m Trial 31 finished with value: 126.7767995377769 and parameters: {'n_layers_mlp': 4, 'mlp_n_units_l0': 58, 'mlp_dropout_l0': 0.2305773563754036, 'mlp_n_units_l1': 64, 'mlp_dropout_l1': 0.012241165031203436, 'mlp_n_units_l2': 80, 'mlp_dropout_l2': 0.2912170818486857, 'mlp_n_units_l3': 46, 'mlp_dropout_l3': 0.09760047061035575, 'lr': 4.7172759438236623e-05, 'criterion': 'MSELoss', 'batch_size': 256, 'no_epochs': 70}. Best is trial 4 with value: 19.88899012797907.[0m
Trial Id: 32 | Model params: 14743 | Timestamp: 2021-08-22 06:20:08.531814

epoch 0 -31.68805064956848 126.5677124832318
epoch 5 -3.191636908816153 45.32316687139037
epoch 10 -0.5029313266195037 27.139259162656977
epoch 15 -0.2949827744649729 25.19187053040606
epoch 20 -0.11448409926248537 23.370357621498844
epoch 25 -0.003042599259161838 22.171144313206693
epoch 30 0.05586579580077611 21.510241466340936
epoch 35 0.07976530680503291 21.236244702096137
epoch 40 0.09340383774393124 21.078289158702006
epoch 45 0.10628846346876575 20.92796989460449
epoch 50 0.1129760305752473 20.84952175810195
epoch 55 0.11563886796179423 20.81820320449272
epoch 60 0.12566348257455406 20.699875271037605
epoch 65 0.129112173646873 20.659011137418254
epoch 70 0.1362102340071072 20.574649571041583
[32m[I 2021-08-22 06:22:16,906][0m Trial 32 finished with value: 20.58887225069489 and parameters: {'n_layers_mlp': 4, 'mlp_n_units_l0': 63, 'mlp_dropout_l0': 0.19913695894319397, 'mlp_n_units_l1': 72, 'mlp_dropout_l1': 0.022772570028609773, 'mlp_n_units_l2': 74, 'mlp_dropout_l2': 0.2242834859148444, 'mlp_n_units_l3': 49, 'mlp_dropout_l3': 0.05348181455369719, 'lr': 2.5253604692662676e-05, 'criterion': 'MSELoss', 'batch_size': 256, 'no_epochs': 72}. Best is trial 4 with value: 19.88899012797907.[0m
Trial Id: 33 | Model params: 11539 | Timestamp: 2021-08-22 06:22:16.906982

epoch 0 -31.695334719627034 126.58181361059519
epoch 5 -30.595970915556876 124.43549293851423
epoch 10 -20.390787499524397 102.38629001379124
epoch 15 -3.5437748156927737 47.188570347764475
epoch 20 -0.6663982265943642 28.577077804372056
epoch 25 -0.5581754312042375 27.633544589241545
epoch 30 -0.45232440490002834 26.67842811617161
epoch 35 -0.33710814874245876 25.598333192709863
epoch 40 -0.2332757423436027 24.584337790047208
epoch 45 -0.15071074313976696 23.747150449689293
epoch 50 -0.0837672355748873 23.046046217634945
epoch 55 -0.03987206930438991 22.57451229664269
epoch 60 -0.0033124909384585344 22.174126940718693
epoch 65 0.019959090574643623 21.915456536205877
epoch 70 0.03081929851379317 21.79369148966774
[32m[I 2021-08-22 06:24:32,250][0m Trial 33 pruned. [0m
epoch 75 0.041916029852410275 21.668567779666713
Trial Id: 34 | Model params: 14656 | Timestamp: 2021-08-22 06:24:32.250806

[32m[I 2021-08-22 06:24:33,958][0m Trial 34 pruned. [0m
epoch 0 -31.49344367058177 126.19039219244755
Trial Id: 35 | Model params: 9127 | Timestamp: 2021-08-22 06:24:33.958775

epoch 0 -31.695674748398808 126.79679533683928
epoch 5 -31.695674748398808 126.79679533683928
epoch 10 -31.695674748398808 126.79679533683928
epoch 15 -31.695674748398808 126.79679533683928
epoch 20 -31.695674748398808 126.79679533683928
epoch 25 -31.695674748398808 126.79679533683928
epoch 30 -31.695674748398808 126.79679533683928
epoch 35 -31.695674748398808 126.79679533683928
epoch 40 -31.695674748398808 126.79679533683928
epoch 45 -31.695674748398808 126.79679533683928
epoch 50 -31.695674748398808 126.79679533683928
epoch 55 -31.695674748398808 126.79679533683928
epoch 60 -31.695674748398808 126.79679533683928
epoch 65 -31.695674748398808 126.79679533683928
epoch 70 -31.695674748398808 126.79679533683928
[32m[I 2021-08-22 06:47:13,270][0m Trial 35 finished with value: 126.79679533683928 and parameters: {'n_layers_mlp': 4, 'mlp_n_units_l0': 74, 'mlp_dropout_l0': 0.196083753350805, 'mlp_n_units_l1': 38, 'mlp_dropout_l1': 0.04872274604458077, 'mlp_n_units_l2': 53, 'mlp_dropout_l2': 0.09287498940122549, 'mlp_n_units_l3': 55, 'mlp_dropout_l3': 0.12420992280289198, 'lr': 7.241340821517908e-05, 'criterion': 'MSELoss', 'batch_size': 16, 'no_epochs': 73}. Best is trial 4 with value: 19.88899012797907.[0m
Trial Id: 36 | Model params: 8163 | Timestamp: 2021-08-22 06:47:13.271101

epoch 0 -31.75403506413293 126.69539348425107
epoch 5 -28.996842325827977 121.24565666837199
epoch 10 -5.720912845650091 57.39083608218664
epoch 15 -0.563967776984081 27.684859275584838
epoch 20 -0.4502875154464707 26.65971326313501
epoch 25 -0.3244991670420134 25.477350662228247
epoch 30 -0.20466986757086714 24.29754771117991
epoch 35 -0.10480240854657907 23.268625295649112
epoch 40 -0.03752051679528878 22.548973002872
epoch 45 0.012188588330848793 22.00216612107327
epoch 50 0.0398951385268701 21.691408550844333
epoch 55 0.052513876136721316 21.54839108556227
epoch 60 0.06336989061977338 21.424587907677687
[32m[I 2021-08-22 06:49:06,863][0m Trial 36 finished with value: 21.440813064341064 and parameters: {'n_layers_mlp': 4, 'mlp_n_units_l0': 67, 'mlp_dropout_l0': 0.27321942286797396, 'mlp_n_units_l1': 58, 'mlp_dropout_l1': 0.0973109378783269, 'mlp_n_units_l2': 32, 'mlp_dropout_l2': 0.15378003174157762, 'mlp_n_units_l3': 37, 'mlp_dropout_l3': 0.18726804333127006, 'lr': 1.8008590252778614e-05, 'criterion': 'MSELoss', 'batch_size': 256, 'no_epochs': 64}. Best is trial 4 with value: 19.88899012797907.[0m
Trial Id: 37 | Model params: 4127 | Timestamp: 2021-08-22 06:49:06.863621

[32m[I 2021-08-22 06:49:21,878][0m Trial 37 pruned. [0m
epoch 0 -0.0894928107335955 23.14596592924349
Trial Id: 38 | Model params: 6547 | Timestamp: 2021-08-22 06:49:21.878499

[32m[I 2021-08-22 06:49:24,799][0m Trial 38 pruned. [0m
epoch 0 0.08326590502174835 21.181116308489564
Trial Id: 39 | Model params: 473 | Timestamp: 2021-08-22 06:49:24.799609

epoch 0 -31.695674748398808 126.79679533683928
epoch 5 -31.695674748398808 126.79679533683928
epoch 10 -31.695674748398808 126.79679533683928
epoch 15 -31.695674748398808 126.79679533683928
epoch 20 -31.695674748398808 126.79679533683928
epoch 25 -31.695674748398808 126.79679533683928
epoch 30 -31.695674748398808 126.79679533683928
epoch 35 -31.695674748398808 126.79679533683928
epoch 40 -31.695674748398808 126.79679533683928
epoch 45 -31.695674748398808 126.79679533683928
epoch 50 -31.695674748398808 126.79679533683928
epoch 55 -31.695674748398808 126.79679533683928
[32m[I 2021-08-22 07:04:17,261][0m Trial 39 finished with value: 126.79679533683928 and parameters: {'n_layers_mlp': 2, 'mlp_n_units_l0': 10, 'mlp_dropout_l0': 0.16695912242835803, 'mlp_n_units_l1': 26, 'mlp_dropout_l1': 0.08515109720610667, 'lr': 2.689226862163578e-05, 'criterion': 'L1Loss', 'batch_size': 16, 'no_epochs': 60}. Best is trial 4 with value: 19.88899012797907.[0m
Trial Id: 40 | Model params: 3137 | Timestamp: 2021-08-22 07:04:17.262135

[32m[I 2021-08-22 07:04:25,188][0m Trial 40 pruned. [0m
epoch 0 -28.208249044124667 119.85320289449032
Trial Id: 41 | Model params: 14608 | Timestamp: 2021-08-22 07:04:25.189140

epoch 0 -31.745245160508382 126.67839229614347
epoch 5 -15.775814578685392 90.67138059280994
epoch 10 -0.5766736568387234 27.79708951179023
epoch 15 -0.45361028128081005 26.69023593626209
epoch 20 -0.32047127576398426 25.438581994600966
epoch 25 -0.19257015790176046 24.175217424217816
epoch 30 -0.09386693282430114 23.153180998123627
epoch 35 -0.030452911944966576 22.4720397954272
epoch 40 0.005148684318478591 22.080429108751087
epoch 45 0.02575426525597513 21.850565262512568
epoch 50 0.03646788995777883 21.730089546146612
epoch 55 0.04745250914297261 21.605868998957177
epoch 60 0.057423419371121276 21.492490446744018
epoch 65 0.06312733167085471 21.42736188913879
epoch 70 0.06871363892687654 21.36338372044627
[32m[I 2021-08-22 07:06:34,093][0m Trial 41 finished with value: 21.280558234865445 and parameters: {'n_layers_mlp': 4, 'mlp_n_units_l0': 63, 'mlp_dropout_l0': 0.19710434235813473, 'mlp_n_units_l1': 73, 'mlp_dropout_l1': 0.02435048486253408, 'mlp_n_units_l2': 73, 'mlp_dropout_l2': 0.23879221824163982, 'mlp_n_units_l3': 47, 'mlp_dropout_l3': 0.07430234971269918, 'lr': 1.924143989959785e-05, 'criterion': 'MSELoss', 'batch_size': 256, 'no_epochs': 72}. Best is trial 4 with value: 19.88899012797907.[0m
Trial Id: 42 | Model params: 11938 | Timestamp: 2021-08-22 07:06:34.093814

epoch 0 -31.796139725978193 126.7767995377769
epoch 5 -31.796139725978193 126.7767995377769
epoch 10 -31.796139725978193 126.7767995377769
epoch 15 -31.796139725978193 126.7767995377769
epoch 20 -31.796139725978193 126.7767995377769
epoch 25 -31.796139725978193 126.7767995377769
epoch 30 -31.796139725978193 126.7767995377769
epoch 35 -31.796139725978193 126.7767995377769
epoch 40 -31.796139725978193 126.7767995377769
epoch 45 -31.796139725978193 126.7767995377769
epoch 50 -31.796139725978193 126.7767995377769
epoch 55 -31.796139725978193 126.7767995377769
epoch 60 -31.796139725978193 126.7767995377769
epoch 65 -31.796139725978193 126.7767995377769
epoch 70 -31.796139725978193 126.7767995377769
[32m[I 2021-08-22 07:08:45,623][0m Trial 42 finished with value: 126.7767995377769 and parameters: {'n_layers_mlp': 4, 'mlp_n_units_l0': 34, 'mlp_dropout_l0': 0.21703309664679876, 'mlp_n_units_l1': 71, 'mlp_dropout_l1': 0.0016814238146241021, 'mlp_n_units_l2': 71, 'mlp_dropout_l2': 0.24803711268626794, 'mlp_n_units_l3': 52, 'mlp_dropout_l3': 0.038901044616486406, 'lr': 1.430754737873076e-05, 'criterion': 'MSELoss', 'batch_size': 256, 'no_epochs': 73}. Best is trial 4 with value: 19.88899012797907.[0m
Trial Id: 43 | Model params: 13374 | Timestamp: 2021-08-22 07:08:45.623923

[32m[I 2021-08-22 07:08:47,321][0m Trial 43 pruned. [0m
epoch 0 -31.144285339854044 125.51057151513663
Trial Id: 44 | Model params: 11871 | Timestamp: 2021-08-22 07:08:47.322031

[32m[I 2021-08-22 07:08:48,950][0m Trial 44 pruned. [0m
epoch 0 -28.040786580269554 119.29784742576997
Trial Id: 45 | Model params: 14263 | Timestamp: 2021-08-22 07:08:48.950498

[32m[I 2021-08-22 07:08:50,814][0m Trial 45 pruned. [0m
epoch 0 -31.69283643355275 126.57697739120549
Trial Id: 46 | Model params: 8855 | Timestamp: 2021-08-22 07:08:50.814820

[32m[I 2021-08-22 07:08:53,725][0m Trial 46 pruned. [0m
epoch 0 -24.27212561221691 111.21107501157819
Trial Id: 47 | Model params: 1669 | Timestamp: 2021-08-22 07:08:53.725988

epoch 0 -31.74498166974187 126.67788262437783
epoch 5 -31.26095307898234 125.73813563405214
epoch 10 -30.03731377409932 123.33049745769291
epoch 15 -27.912334310373005 119.03371783554356
epoch 20 -24.93162000108227 112.73097009521842
epoch 25 -20.972753760299597 103.76972462605707
epoch 30 -16.415005063553487 92.38260884909758
epoch 35 -11.566519877728739 78.47583242389881
epoch 40 -6.934849723432578 62.35880339871967
epoch 45 -3.294963268944385 45.87838767388908
epoch 50 -1.3008497343324361 33.57937032328259
epoch 55 -0.686848095435002 28.751890608612786
epoch 60 -0.5650714640266954 27.694626110968013
[32m[I 2021-08-22 07:10:30,975][0m Trial 47 finished with value: 27.381701501036634 and parameters: {'n_layers_mlp': 2, 'mlp_n_units_l0': 48, 'mlp_dropout_l0': 0.21226175932921745, 'mlp_n_units_l1': 18, 'mlp_dropout_l1': 0.20845359865517665, 'lr': 2.0514981822929067e-05, 'criterion': 'L1Loss', 'batch_size': 256, 'no_epochs': 64}. Best is trial 4 with value: 19.88899012797907.[0m
Trial Id: 48 | Model params: 9938 | Timestamp: 2021-08-22 07:10:30.975549

[32m[I 2021-08-22 07:10:33,807][0m Trial 48 pruned. [0m
epoch 0 -0.09202683210079554 23.11765657853013
Trial Id: 49 | Model params: 3219 | Timestamp: 2021-08-22 07:10:33.807833

epoch 0 -31.695674748398808 126.79679533683928
epoch 5 0.1470573551670582 20.479674009336925
epoch 10 0.16064980952053065 20.31583709692483
epoch 15 0.14795436184758592 20.4689023373409
epoch 20 0.16740490746318937 20.23392092788541
epoch 25 0.1485065950855473 20.4622680446197
epoch 30 0.20007057688511853 19.833025067093544
epoch 35 0.1895145054523184 19.96345698725197
epoch 40 0.2084204023240579 19.72924296440533
epoch 45 0.20200753654828418 19.80899853940658
epoch 50 0.20962287412328717 19.71425213164081
epoch 55 0.22862525254007215 19.475823663098794
epoch 60 0.21418438282401342 19.65728131724738
epoch 65 0.22652487015401357 19.502321074816784
[32m[I 2021-08-22 07:27:05,318][0m Trial 49 finished with value: 19.635934126720567 and parameters: {'n_layers_mlp': 2, 'mlp_n_units_l0': 48, 'mlp_dropout_l0': 0.10678045616396156, 'mlp_n_units_l1': 49, 'mlp_dropout_l1': 0.29936471201973947, 'lr': 0.0022168493798361945, 'criterion': 'MSELoss', 'batch_size': 16, 'no_epochs': 67}. Best is trial 49 with value: 19.635934126720567.[0m
Trial Id: 50 | Model params: 3105 | Timestamp: 2021-08-22 07:27:05.318952

[32m[I 2021-08-22 07:27:20,353][0m Trial 50 pruned. [0m
epoch 0 0.09087983933792587 21.143348563065242
Trial Id: 51 | Model params: 1261 | Timestamp: 2021-08-22 07:27:20.353550

[32m[I 2021-08-22 07:27:35,251][0m Trial 51 pruned. [0m
epoch 0 0.12256228220432186 20.771663321534067
Trial Id: 52 | Model params: 3889 | Timestamp: 2021-08-22 07:27:35.251386

[32m[I 2021-08-22 07:27:50,105][0m Trial 52 pruned. [0m
epoch 0 0.13383302299490785 20.63782550507619
Trial Id: 53 | Model params: 4727 | Timestamp: 2021-08-22 07:27:50.105693

[32m[I 2021-08-22 07:28:04,701][0m Trial 53 pruned. [0m
epoch 0 0.08907750647909607 21.16429655499683
Trial Id: 54 | Model params: 3995 | Timestamp: 2021-08-22 07:28:04.701875

[32m[I 2021-08-22 07:28:19,018][0m Trial 54 pruned. [0m
epoch 0 0.12405411462612015 20.753997666825498
Trial Id: 55 | Model params: 3624 | Timestamp: 2021-08-22 07:28:19.018903

[32m[I 2021-08-22 07:28:33,882][0m Trial 55 pruned. [0m
epoch 0 0.1426346408292971 20.532701394911033
Trial Id: 56 | Model params: 2927 | Timestamp: 2021-08-22 07:28:33.882272

[32m[I 2021-08-22 07:28:36,206][0m Trial 56 pruned. [0m
epoch 0 -0.2082047512476881 24.316296074814957
Trial Id: 57 | Model params: 2667 | Timestamp: 2021-08-22 07:28:36.206796

[32m[I 2021-08-22 07:28:43,965][0m Trial 57 pruned. [0m
epoch 0 0.07631468918173723 21.313702595993806
Trial Id: 58 | Model params: 12468 | Timestamp: 2021-08-22 07:28:43.965880

epoch 0 -31.695674748398808 126.79679533683928
epoch 5 -0.4712555559039191 26.89720686047307
epoch 10 0.08761454296390236 21.181284922398763
epoch 15 0.10231378084144471 21.009968640898805
epoch 20 0.11129592454998616 20.904592734397447
epoch 25 0.11489218844210602 20.862253195645323
epoch 30 0.13414078369573934 20.634158731749448
epoch 35 0.1421631844889184 20.53834597907202
epoch 40 0.15623603473303116 20.369183099776272
epoch 45 0.15123743188487093 20.429429276334485
epoch 50 0.1421591896386356 20.538393801408528
epoch 55 0.1586460846307538 20.340071965384915
epoch 60 0.15885531239758588 20.33754272509324
[32m[I 2021-08-22 07:49:08,958][0m Trial 58 finished with value: 20.195657329438276 and parameters: {'n_layers_mlp': 4, 'mlp_n_units_l0': 49, 'mlp_dropout_l0': 0.011855289743535261, 'mlp_n_units_l1': 76, 'mlp_dropout_l1': 0.28209116939369283, 'mlp_n_units_l2': 55, 'mlp_dropout_l2': 0.21828950587575044, 'mlp_n_units_l3': 64, 'mlp_dropout_l3': 0.1817533962170266, 'lr': 2.41061092837734e-05, 'criterion': 'MSELoss', 'batch_size': 16, 'no_epochs': 66}. Best is trial 49 with value: 19.635934126720567.[0m
epoch 65 0.17055090784516602 20.195657329438276
Trial Id: 59 | Model params: 4814 | Timestamp: 2021-08-22 07:49:08.958224

epoch 0 -31.695674748398808 126.79679533683928
epoch 5 -31.695674748398808 126.79679533683928
epoch 10 -31.695674748398808 126.79679533683928
epoch 15 -0.2683372558681809 24.973562535397775
epoch 20 0.09512439572740417 21.093933130916348
epoch 25 0.11612859015152088 20.847676926298448
epoch 30 0.13061327702318504 20.676147745812564
epoch 35 0.13195289458977877 20.66021190962166
epoch 40 0.1368066663066606 20.60236912307746
epoch 45 0.15725205331076297 20.35691562737766
epoch 50 0.1616477807119584 20.303755935509134
epoch 55 0.16565480420044654 20.25517547423641
epoch 60 0.16166512815702905 20.30354586860361
[32m[I 2021-08-22 08:05:34,297][0m Trial 59 finished with value: 20.190835315691075 and parameters: {'n_layers_mlp': 2, 'mlp_n_units_l0': 49, 'mlp_dropout_l0': 0.011571345691150179, 'mlp_n_units_l1': 79, 'mlp_dropout_l1': 0.2344054574528699, 'lr': 0.00020340013254011792, 'criterion': 'L1Loss', 'batch_size': 16, 'no_epochs': 66}. Best is trial 49 with value: 19.635934126720567.[0m
epoch 65 0.17094694718926318 20.190835315691075
Study statistics: 
  Number of finished trials:  60
  Number of pruned trials:  35
  Number of complete trials:  25

Best trial:
  Value:  19.635934126720567
  Params: 
    n_layers_mlp: 2
    mlp_n_units_l0: 48
    mlp_dropout_l0: 0.10678045616396156
    mlp_n_units_l1: 49
    mlp_dropout_l1: 0.29936471201973947
    lr: 0.0022168493798361945
    criterion: MSELoss
    batch_size: 16
    no_epochs: 67
Target 19508 0 285.0 1.0 125.01768505228624
[ 63. 156.  95. ... 132. 139. 111.]
Prediction 19508 0 167.42422485351562 0.0 126.70591145742861
[106.44763947 137.95899963 124.56479645 ... 127.24111938 155.86907959
 134.17895508]

 XXXXXX======== TRIAL north - elg ended

Test Set - R-squared:  0.20695097948924068
Test Set - RMSE:  19.945838772826622
Test Set - MAE:  15.552962736881046



[32m[I 2021-08-22 08:05:44,002][0m A new study created in memory with name: NeuralNetwork[0m
++++++++ Session Characteristics +++++++

Area: north
Gal Type: qso
Training Samples: 62423
Validation Samples: 15606
Test Samples: 19508
Number of features: 15
Device: cuda:0
Number of Workers: 8
Number of Trials: 60

+++++++++++++++++++++++++++++++++++++++
Trial Id: 0 | Model params: 1409 | Timestamp: 2021-08-22 08:05:44.002614

epoch 0 -23.3025234844597 141.4238360133102
epoch 5 -0.14086391672545884 30.641770075731046
epoch 10 -0.057625618601610196 29.502777791375987
epoch 15 -0.022749780556462484 29.012264268147383
epoch 20 -0.005309352763446462 28.763834993858822
epoch 25 0.010149551061570339 28.541823713822566
epoch 30 0.019488938976737757 28.40685639956653
epoch 35 0.02295283496887457 28.356634909002583
epoch 40 0.03309264160898562 28.209108412321857
epoch 45 0.03645630006740663 28.15999901685358
[32m[I 2021-08-22 08:17:38,755][0m Trial 0 finished with value: 28.122289449590614 and parameters: {'n_layers_mlp': 2, 'mlp_n_units_l0': 34, 'mlp_dropout_l0': 0.255054834831263, 'mlp_n_units_l1': 24, 'mlp_dropout_l1': 0.2030971043812936, 'lr': 3.901571038682373e-05, 'criterion': 'L1Loss', 'batch_size': 16, 'no_epochs': 49}. Best is trial 0 with value: 28.122289449590614.[0m
Trial Id: 1 | Model params: 2125 | Timestamp: 2021-08-22 08:17:38.755369

epoch 0 -2.1520190088972924 50.94110411782589
epoch 5 -0.01975280097985732 28.974863138994696
epoch 10 0.030613620200997116 28.25025657701899
epoch 15 0.0567853598957857 27.866293460182558
epoch 20 0.060617064498386 27.80963399902068
epoch 25 0.08187325123831413 27.493198014567426
epoch 30 0.08837727604642398 27.39564380785335
epoch 35 0.08639342741118439 27.425436436525107
epoch 40 0.09121950957179847 27.35290375692471
