[32m[I 2021-08-21 23:17:08,073][0m Trial 43 pruned. [0m
epoch 0 -0.2663684846280554 11.440947099117603
Trial Id: 44 | Model params: 3181 | Timestamp: 2021-08-21 23:17:08.073257

[32m[I 2021-08-21 23:17:14,601][0m Trial 44 pruned. [0m
epoch 0 -9.551723398885999 33.02506108719807
Trial Id: 45 | Model params: 1601 | Timestamp: 2021-08-21 23:17:14.601206

[32m[I 2021-08-21 23:17:27,287][0m Trial 45 pruned. [0m
epoch 0 -0.040979827546530956 10.372969176302627
Trial Id: 46 | Model params: 2596 | Timestamp: 2021-08-21 23:17:27.287857

[32m[I 2021-08-21 23:17:34,083][0m Trial 46 pruned. [0m
epoch 0 -0.008350216928960652 10.209104013405316
Trial Id: 47 | Model params: 1581 | Timestamp: 2021-08-21 23:17:34.083363

[32m[I 2021-08-21 23:17:47,199][0m Trial 47 pruned. [0m
epoch 0 -2.9950231576986215 20.32083647773147
Trial Id: 48 | Model params: 14736 | Timestamp: 2021-08-21 23:17:47.199985

[32m[I 2021-08-21 23:17:55,756][0m Trial 48 pruned. [0m
epoch 0 -0.0035541974474546656 10.18479627757203
Trial Id: 49 | Model params: 3505 | Timestamp: 2021-08-21 23:17:55.756225

[32m[I 2021-08-21 23:17:57,008][0m Trial 49 pruned. [0m
epoch 0 -0.001741842721461495 10.178044742232276
Trial Id: 50 | Model params: 4807 | Timestamp: 2021-08-21 23:17:57.008870

epoch 0 -10.06135686983811 33.82132754636409
epoch 5 -5.070229586796286 25.054688462043273
epoch 10 -0.19663957259935438 11.124183104445997
epoch 15 -0.008400820510971796 10.21181747254697
epoch 20 -0.003286535588422179 10.185889027192207
epoch 25 0.0011865794099380489 10.163156961262292
epoch 30 0.003151635898866134 10.153154587657847
epoch 35 0.004971387085323187 10.14388303965638
epoch 40 0.006089390593032928 10.138182658736968
[32m[I 2021-08-21 23:19:30,844][0m Trial 50 finished with value: 10.139927465565119 and parameters: {'n_layers_mlp': 2, 'mlp_n_units_l0': 80, 'mlp_dropout_l0': 0.28902502057760626, 'mlp_n_units_l1': 43, 'mlp_dropout_l1': 0.15920039928939175, 'lr': 2.0667295143343495e-05, 'criterion': 'MSELoss', 'batch_size': 128, 'no_epochs': 45}. Best is trial 2 with value: 10.07126560556984.[0m
Trial Id: 51 | Model params: 2247 | Timestamp: 2021-08-21 23:19:30.844492

epoch 0 -10.067980185050201 33.83145179209852
epoch 5 -6.767803079740094 28.34233010779146
epoch 10 -0.8565604203911048 13.85609946273403
epoch 15 -0.0166706267009622 10.25360508057472
epoch 20 -0.009088858893085083 10.215300672949978
epoch 25 -0.004473711729070073 10.191913661681793
epoch 30 -0.0018568654553918762 10.178629060905207
epoch 35 0.0013046082339273068 10.162556458266035
epoch 40 0.0041842974750735396 10.14789426433872
epoch 45 0.005130439333048242 10.143072273082998
[32m[I 2021-08-21 23:20:34,734][0m Trial 51 finished with value: 10.140425100179812 and parameters: {'n_layers_mlp': 2, 'mlp_n_units_l0': 32, 'mlp_dropout_l0': 0.2560292003857229, 'mlp_n_units_l1': 51, 'mlp_dropout_l1': 0.08226136694499135, 'lr': 4.6067122029989207e-05, 'criterion': 'MSELoss', 'batch_size': 256, 'no_epochs': 47}. Best is trial 2 with value: 10.07126560556984.[0m
Trial Id: 52 | Model params: 1929 | Timestamp: 2021-08-21 23:20:34.735117

epoch 0 -10.218583250228354 34.06084797530806
epoch 5 -10.103999609257034 33.88645729286324
epoch 10 -9.904551164353537 33.580746451343884
epoch 15 -9.60015782466436 33.108737006703926
epoch 20 -9.195881074321473 32.47123666059428
epoch 25 -8.66943912318659 31.621836594676296
epoch 30 -8.015166587650086 30.533270590332737
epoch 35 -7.220903576210887 29.157227506430626
epoch 40 -6.3257804351734865 27.52411713398771
[32m[I 2021-08-21 23:21:31,724][0m Trial 52 finished with value: 27.16252827625341 and parameters: {'n_layers_mlp': 2, 'mlp_n_units_l0': 26, 'mlp_dropout_l0': 0.26504490615767556, 'mlp_n_units_l1': 54, 'mlp_dropout_l1': 0.05851820822399869, 'lr': 1.0080751522199769e-05, 'criterion': 'MSELoss', 'batch_size': 256, 'no_epochs': 42}. Best is trial 2 with value: 10.07126560556984.[0m
Trial Id: 53 | Model params: 1649 | Timestamp: 2021-08-21 23:21:31.725010

epoch 0 -10.26302570359987 34.128247369569365
epoch 5 -10.26302570359987 34.128247369569365
epoch 10 -9.587864254754242 33.08953245049424
epoch 15 -6.245725167787408 27.373313853951668
epoch 20 -2.4258192641159435 18.822125808829878
epoch 25 -0.3597455793605453 11.858104578940711
epoch 30 -0.032896180364772265 10.335102402659576
epoch 35 -0.019450438976497342 10.267613373723762
epoch 40 -0.013086704288863826 10.235516347108554
epoch 45 -0.010007310533350688 10.21994849244721
epoch 50 -0.006622440708730304 10.20280890004569
epoch 55 -0.0039052933564820425 10.189029519107782
epoch 60 -0.0020593893066509494 10.179657806158927
epoch 65 -0.0025294087374490015 10.182044928163736
epoch 70 0.0011534532268526743 10.163325493142171
epoch 75 0.0001720136854282961 10.168317371289865
[32m[I 2021-08-21 23:23:18,127][0m Trial 53 finished with value: 10.166123937905583 and parameters: {'n_layers_mlp': 2, 'mlp_n_units_l0': 19, 'mlp_dropout_l0': 0.2776345352348336, 'mlp_n_units_l1': 64, 'mlp_dropout_l1': 0.08771363982034412, 'lr': 2.794181947612641e-05, 'criterion': 'MSELoss', 'batch_size': 256, 'no_epochs': 78}. Best is trial 2 with value: 10.07126560556984.[0m
Trial Id: 54 | Model params: 1949 | Timestamp: 2021-08-21 23:23:18.128448

epoch 0 -10.092823088934583 33.869399113762825
epoch 5 -8.128413632006808 30.724449045114206
epoch 10 -3.190534050033958 20.817143467863854
epoch 15 -0.2533389715378538 11.384677177497394
epoch 20 -0.014993931460419496 10.245146458589854
epoch 25 -0.010465911721922794 10.222268450218598
epoch 30 -0.006690064316803079 10.203151600116383
epoch 35 -0.004494296644757867 10.192018093786942
epoch 40 -0.0022639255788963197 10.180696668249116
epoch 45 0.0006471584028072686 10.165900957421126
[32m[I 2021-08-21 23:24:23,905][0m Trial 54 finished with value: 10.166400040966737 and parameters: {'n_layers_mlp': 2, 'mlp_n_units_l0': 28, 'mlp_dropout_l0': 0.25430808576059427, 'mlp_n_units_l1': 50, 'mlp_dropout_l1': 0.14077688983973116, 'lr': 4.057778913696316e-05, 'criterion': 'MSELoss', 'batch_size': 256, 'no_epochs': 48}. Best is trial 2 with value: 10.07126560556984.[0m
Trial Id: 55 | Model params: 1997 | Timestamp: 2021-08-21 23:24:23.905814

[32m[I 2021-08-21 23:24:37,434][0m Trial 55 pruned. [0m
epoch 0 -8.020634727174784 30.53517962960385
Trial Id: 56 | Model params: 709 | Timestamp: 2021-08-21 23:24:37.434279

[32m[I 2021-08-21 23:24:38,700][0m Trial 56 pruned. [0m
epoch 0 -9.255897518480088 32.56666483984336
Trial Id: 57 | Model params: 3465 | Timestamp: 2021-08-21 23:24:38.700428

[32m[I 2021-08-21 23:24:45,432][0m Trial 57 pruned. [0m
epoch 0 -0.13767849891608108 10.844054853008943
Trial Id: 58 | Model params: 5595 | Timestamp: 2021-08-21 23:24:45.432306

[32m[I 2021-08-21 23:24:47,941][0m Trial 58 pruned. [0m
epoch 0 -0.09306136011948651 10.631847031945108
Trial Id: 59 | Model params: 4569 | Timestamp: 2021-08-21 23:24:47.942162

[32m[I 2021-08-21 23:25:01,226][0m Trial 59 pruned. [0m
epoch 0 -0.007194112626240701 10.203249810230728
Study statistics: 
  Number of finished trials:  60
  Number of pruned trials:  39
  Number of complete trials:  21

Best trial:
  Value:  10.07126560556984
  Params: 
    n_layers_mlp: 4
    mlp_n_units_l0: 54
    mlp_dropout_l0: 0.03822269261836596
    mlp_n_units_l1: 44
    mlp_dropout_l1: 0.10638649301439075
    mlp_n_units_l2: 79
    mlp_dropout_l2: 0.279726343135355
    mlp_n_units_l3: 43
    mlp_dropout_l3: 0.2584361799959367
    lr: 0.0005231431812476474
    criterion: MSELoss
    batch_size: 32
    no_epochs: 47
Target 17327 0 105.0 4.0 32.60899174698447
[26. 33. 36. ... 29. 25. 29.]
Prediction 17327 0 38.86854553222656 29.340740203857422 32.13111384593175
[33.83504105 29.81299973 32.94749069 ... 32.82652664 31.84955978
 32.75163269]

 XXXXXX======== TRIAL des - lrg ended

Test Set - R-squared:  0.014940689336045865
Test Set - RMSE:  10.11994022022439
Test Set - MAE:  7.646266368144505



[32m[I 2021-08-21 23:25:14,014][0m A new study created in memory with name: NeuralNetwork[0m
++++++++ Session Characteristics +++++++

Area: des
Gal Type: elg
Training Samples: 55443
Validation Samples: 13861
Test Samples: 17327
Number of features: 15
Device: cuda:0
Number of Workers: 8
Number of Trials: 60

+++++++++++++++++++++++++++++++++++++++
Trial Id: 0 | Model params: 8145 | Timestamp: 2021-08-21 23:25:14.015213

epoch 0 -45.348571612960164 125.78394015648666
epoch 5 -0.38840584385021426 21.770341119413008
epoch 10 -0.18852363674300054 20.142386687096536
epoch 15 -0.1317506746464585 19.655423180415955
epoch 20 -0.12878492797444085 19.62965282019481
epoch 25 -0.0974420534213285 19.355206833391485
epoch 30 -0.09894320411750623 19.368439948099738
epoch 35 -0.08699480699451545 19.26285928888379
epoch 40 -0.0721760940625622 19.13110597347941
epoch 45 -0.08388605977932828 19.23529419063079
epoch 50 -0.0676239949594648 19.090450654464124
epoch 55 -0.07040327037598071 19.115282961981777
[32m[I 2021-08-21 23:26:49,856][0m Trial 0 finished with value: 19.088232862824484 and parameters: {'n_layers_mlp': 4, 'mlp_n_units_l0': 65, 'mlp_dropout_l0': 0.26287949824245155, 'mlp_n_units_l1': 29, 'mlp_dropout_l1': 0.2537623485380514, 'mlp_n_units_l2': 68, 'mlp_dropout_l2': 0.1702737697965105, 'mlp_n_units_l3': 45, 'mlp_dropout_l3': 0.16572769493366304, 'lr': 3.162201579002407e-05, 'criterion': 'L1Loss', 'batch_size': 256, 'no_epochs': 59}. Best is trial 0 with value: 19.088232862824484.[0m
Trial Id: 1 | Model params: 6651 | Timestamp: 2021-08-21 23:26:49.856194

epoch 0 -2.932919570143507 36.64308189518506
epoch 5 0.016675980027712867 18.322417913610998
epoch 10 -0.03623117510767093 18.808873590603362
epoch 15 0.03410548696338389 18.15930864547447
epoch 20 0.04293156920955554 18.076150821012206
epoch 25 0.06155723968502047 17.899395114640775
epoch 30 0.05126789092817974 17.997254592055807
epoch 35 0.03563473018451724 18.14492767548872
epoch 40 0.055484363184178376 17.957217248472396
epoch 45 0.062462248812838794 17.890762183561034
epoch 50 0.05984998533125763 17.915669380737555
epoch 55 0.049161706119104864 18.017220465252056
epoch 60 0.05296059892885541 17.981192261586795
epoch 65 0.0659964350351735 17.857009416948117
epoch 70 0.06026651710109254 17.911700188535566
epoch 75 0.06609480320533345 17.856069052446873
[32m[I 2021-08-21 23:47:10,417][0m Trial 1 finished with value: 17.886783130839728 and parameters: {'n_layers_mlp': 4, 'mlp_n_units_l0': 67, 'mlp_dropout_l0': 0.14864429232809284, 'mlp_n_units_l1': 68, 'mlp_dropout_l1': 0.23707818160384295, 'mlp_n_units_l2': 11, 'mlp_dropout_l2': 0.2563787959050949, 'mlp_n_units_l3': 15, 'mlp_dropout_l3': 0.19698418731298642, 'lr': 0.002846592189706126, 'criterion': 'L1Loss', 'batch_size': 16, 'no_epochs': 77}. Best is trial 1 with value: 17.886783130839728.[0m
Trial Id: 2 | Model params: 6918 | Timestamp: 2021-08-21 23:47:10.417813

epoch 0 -0.23746982977797848 20.5529576453537
epoch 5 0.03563650970568666 18.14376439052888
epoch 10 0.06678061009555292 17.84838372931658
epoch 15 0.06806946723379048 17.836054385782308
epoch 20 0.06246536358270982 17.889601981739897
epoch 25 0.05072062823100065 18.001307033037264
epoch 30 0.07542799929066646 17.76549800657431
epoch 35 0.07342902509246219 17.78469261645847
epoch 40 0.08086730308888856 17.71316325981652
epoch 45 0.06749185392610801 17.841580949268824
epoch 50 0.07496656899733223 17.7699306069611
epoch 55 0.081311714399522 17.708880482205252
epoch 60 0.056460702094125126 17.946799629555585
epoch 65 0.07657480824312601 17.754476715770796
epoch 70 0.061045255160642964 17.903145780690206
[32m[I 2021-08-21 23:50:17,435][0m Trial 2 finished with value: 17.7298231083678 and parameters: {'n_layers_mlp': 4, 'mlp_n_units_l0': 48, 'mlp_dropout_l0': 0.26622982847456433, 'mlp_n_units_l1': 33, 'mlp_dropout_l1': 0.23182166744640043, 'mlp_n_units_l2': 48, 'mlp_dropout_l2': 0.04568359043671054, 'mlp_n_units_l3': 58, 'mlp_dropout_l3': 0.20313225565340393, 'lr': 0.003155992400443771, 'criterion': 'MSELoss', 'batch_size': 128, 'no_epochs': 74}. Best is trial 2 with value: 17.7298231083678.[0m
Trial Id: 3 | Model params: 7905 | Timestamp: 2021-08-21 23:50:17.435361

epoch 0 -0.5438794311681334 22.95692461883221
epoch 5 -1.0336678349891044 26.347961941889878
epoch 10 -0.7784006750173278 24.63892892967336
epoch 15 -0.5708662339282815 23.1566973628345
epoch 20 -0.38042053320972524 21.707645611511857
epoch 25 -0.2944335782295757 21.020686859945698
epoch 30 -0.28987851640824336 20.98366877190818
epoch 35 -0.23974620886830045 20.57185298538777
epoch 40 -0.1182765365729137 19.53806832174682
epoch 45 -0.17336452863826612 20.013520718891876
epoch 50 -0.12427897672101285 19.590434230622588
[32m[I 2021-08-21 23:52:35,900][0m Trial 3 finished with value: 19.426031582343963 and parameters: {'n_layers_mlp': 4, 'mlp_n_units_l0': 11, 'mlp_dropout_l0': 0.2423873770524017, 'mlp_n_units_l1': 68, 'mlp_dropout_l1': 0.07385864967037538, 'mlp_n_units_l2': 73, 'mlp_dropout_l2': 0.08365976407280992, 'mlp_n_units_l3': 25, 'mlp_dropout_l3': 0.2586812142901275, 'lr': 0.00018830357484837093, 'criterion': 'L1Loss', 'batch_size': 128, 'no_epochs': 54}. Best is trial 2 with value: 17.7298231083678.[0m
Trial Id: 4 | Model params: 5015 | Timestamp: 2021-08-21 23:52:35.900817

epoch 0 -0.16646128367679092 19.954561188868844
epoch 5 -0.03483519148111047 18.795012211154695
epoch 10 -0.0012615097321870827 18.4876103088252
epoch 15 0.021056308215232633 18.28040754317957
epoch 20 0.03198987891360927 18.17803631237945
epoch 25 0.04684059555911757 18.038058297287414
epoch 30 0.03517369532553938 18.148117618283287
epoch 35 0.05794611787058623 17.932667224180847
epoch 40 0.06001149095085856 17.91299851329107
epoch 45 0.06379222761016357 17.876938196879216
epoch 50 0.06329432929530843 17.881691262678828
epoch 55 0.06639988389404228 17.85202416718119
epoch 60 0.06302874479499421 17.8842260842383
[32m[I 2021-08-21 23:54:51,412][0m Trial 4 finished with value: 17.85418322922816 and parameters: {'n_layers_mlp': 2, 'mlp_n_units_l0': 56, 'mlp_dropout_l0': 0.15413915813594753, 'mlp_n_units_l1': 71, 'mlp_dropout_l1': 0.05774326090493434, 'lr': 0.000687112494100747, 'criterion': 'MSELoss', 'batch_size': 128, 'no_epochs': 65}. Best is trial 2 with value: 17.7298231083678.[0m
Trial Id: 5 | Model params: 3539 | Timestamp: 2021-08-21 23:54:51.412903

[32m[I 2021-08-21 23:54:58,231][0m Trial 5 pruned. [0m
epoch 0 -0.05775921972545017 19.003249502244564
Trial Id: 6 | Model params: 2144 | Timestamp: 2021-08-21 23:54:58.231293

epoch 0 -35.11117560482941 111.0338181573802
epoch 5 -0.13411617914796592 19.677197005774758
epoch 10 -0.07621395978619772 19.168307653747302
epoch 15 -0.051962993439953475 18.951111718436305
epoch 20 -0.040950552236948434 18.85165619117141
epoch 25 -0.031934033211188595 18.76983386305964
epoch 30 -0.022761680728464073 18.686229773266266
epoch 35 -0.018351006220634236 18.645893921263042
epoch 40 -0.010887330277588259 18.57743872135288
epoch 45 -0.005479405627462741 18.527680399709606
epoch 50 -0.008613114100331831 18.556529912146747
epoch 55 -0.006438128509759666 18.536511350819524
epoch 60 -0.0050771566087504105 18.523973965372196
epoch 65 -0.0007128979968484828 18.48371269625105
[32m[I 2021-08-22 00:02:21,661][0m Trial 6 finished with value: 18.514350601305168 and parameters: {'n_layers_mlp': 2, 'mlp_n_units_l0': 27, 'mlp_dropout_l0': 0.12008051852291843, 'mlp_n_units_l1': 59, 'mlp_dropout_l1': 0.07036091555661307, 'lr': 4.6088869237404125e-05, 'criterion': 'MSELoss', 'batch_size': 32, 'no_epochs': 68}. Best is trial 2 with value: 17.7298231083678.[0m
Trial Id: 7 | Model params: 1145 | Timestamp: 2021-08-22 00:02:21.661466

epoch 0 -45.43500606814024 125.90117140989697
epoch 5 -45.43500606814024 125.90117140989697
epoch 10 -45.43500606814024 125.90117140989697
epoch 15 -45.43500606814024 125.90117140989697
epoch 20 -45.43500606814024 125.90117140989697
epoch 25 -45.43500606814024 125.90117140989697
epoch 30 -45.43500606814024 125.90117140989697
epoch 35 -45.43500606814024 125.90117140989697
epoch 40 -45.43500606814024 125.90117140989697
[32m[I 2021-08-22 00:03:47,695][0m Trial 7 finished with value: 125.90117140989697 and parameters: {'n_layers_mlp': 2, 'mlp_n_units_l0': 22, 'mlp_dropout_l0': 0.09762486944925812, 'mlp_n_units_l1': 33, 'mlp_dropout_l1': 0.24418758272226787, 'lr': 0.00040967305756853955, 'criterion': 'MSELoss', 'batch_size': 128, 'no_epochs': 42}. Best is trial 2 with value: 17.7298231083678.[0m
Trial Id: 8 | Model params: 5565 | Timestamp: 2021-08-22 00:03:47.696347

epoch 0 -45.43500606814024 125.90117140989697
epoch 5 -45.43500606814024 125.90117140989697
epoch 10 -45.43500606814024 125.90117140989697
epoch 15 -45.43500606814024 125.90117140989697
epoch 20 -45.43500606814024 125.90117140989697
epoch 25 -45.43500606814024 125.90117140989697
epoch 30 -45.43500606814024 125.90117140989697
epoch 35 -45.43500606814024 125.90117140989697
epoch 40 -45.43500606814024 125.90117140989697
epoch 45 -45.43500606814024 125.90117140989697
epoch 50 -45.43500606814024 125.90117140989697
epoch 55 -45.43500606814024 125.90117140989697
epoch 60 -45.43500606814024 125.90117140989697
epoch 65 -45.43500606814024 125.90117140989697
[32m[I 2021-08-22 00:06:42,570][0m Trial 8 finished with value: 125.90117140989697 and parameters: {'n_layers_mlp': 4, 'mlp_n_units_l0': 56, 'mlp_dropout_l0': 0.11110193198031934, 'mlp_n_units_l1': 50, 'mlp_dropout_l1': 0.11950677523169213, 'mlp_n_units_l2': 28, 'mlp_dropout_l2': 0.24541758668327332, 'mlp_n_units_l3': 13, 'mlp_dropout_l3': 0.022905036046198035, 'lr': 0.009115944534402193, 'criterion': 'MSELoss', 'batch_size': 128, 'no_epochs': 69}. Best is trial 2 with value: 17.7298231083678.[0m
Trial Id: 9 | Model params: 2101 | Timestamp: 2021-08-22 00:06:42.570936

[32m[I 2021-08-22 00:06:58,465][0m Trial 9 pruned. [0m
epoch 0 -1.2779473468869282 27.88728926210874
Trial Id: 10 | Model params: 5605 | Timestamp: 2021-08-22 00:06:58.465234

epoch 0 -45.43500606814024 125.90117140989697
epoch 5 -45.43500606814024 125.90117140989697
epoch 10 -45.43500606814024 125.90117140989697
epoch 15 -45.43500606814024 125.90117140989697
epoch 20 -45.43500606814024 125.90117140989697
epoch 25 -45.43500606814024 125.90117140989697
epoch 30 -45.43500606814024 125.90117140989697
epoch 35 -45.43500606814024 125.90117140989697
epoch 40 -45.43500606814024 125.90117140989697
epoch 45 -45.43500606814024 125.90117140989697
epoch 50 -45.43500606814024 125.90117140989697
epoch 55 -45.43500606814024 125.90117140989697
epoch 60 -45.43500606814024 125.90117140989697
epoch 65 -45.43500606814024 125.90117140989697
epoch 70 -45.43500606814024 125.90117140989697
epoch 75 -45.43500606814024 125.90117140989697
[32m[I 2021-08-22 00:09:00,968][0m Trial 10 finished with value: 125.90117140989697 and parameters: {'n_layers_mlp': 4, 'mlp_n_units_l0': 42, 'mlp_dropout_l0': 0.287564638184238, 'mlp_n_units_l1': 10, 'mlp_dropout_l1': 0.18516207014636327, 'mlp_n_units_l2': 50, 'mlp_dropout_l2': 0.004758931621910462, 'mlp_n_units_l3': 76, 'mlp_dropout_l3': 0.05763030979504312, 'lr': 0.00920128521307334, 'criterion': 'MSELoss', 'batch_size': 256, 'no_epochs': 78}. Best is trial 2 with value: 17.7298231083678.[0m
Trial Id: 11 | Model params: 4951 | Timestamp: 2021-08-22 00:09:00.968950

[32m[I 2021-08-22 00:09:03,173][0m Trial 11 pruned. [0m
epoch 0 -0.06751643986754541 19.089489020546083
Trial Id: 12 | Model params: 1409 | Timestamp: 2021-08-22 00:09:03.173546

[32m[I 2021-08-22 00:09:05,225][0m Trial 12 pruned. [0m
epoch 0 -0.3166696263721731 21.20046692927403
Trial Id: 13 | Model params: 5135 | Timestamp: 2021-08-22 00:09:05.226032

[32m[I 2021-08-22 00:09:07,264][0m Trial 13 pruned. [0m
epoch 0 -0.044860928485170426 18.88583809830377
Trial Id: 14 | Model params: 13087 | Timestamp: 2021-08-22 00:09:07.264916

[32m[I 2021-08-22 00:09:09,762][0m Trial 14 pruned. [0m
epoch 0 -0.042186922935738114 18.861656321419584
Trial Id: 15 | Model params: 1334 | Timestamp: 2021-08-22 00:09:09.762225

epoch 0 -45.431632193846326 125.89659746366695
epoch 5 -45.00854583599598 125.32169814713662
epoch 10 -44.27807843676124 124.32286542797732
epoch 15 -43.093017781900166 122.68513053378055
epoch 20 -41.41604405000733 120.32949617042348
epoch 25 -39.19587470546303 117.13798781279259
epoch 30 -36.42981321198038 113.0357570952277
epoch 35 -33.13371068610759 107.94406506643023
epoch 40 -29.353630039736693 101.79169257968246
epoch 45 -25.149912609114924 94.48049032893938
epoch 50 -20.666716877728625 86.00101398183168
epoch 55 -16.08613117456881 76.37107181826397
epoch 60 -11.633670261567241 65.67072129442138
epoch 65 -7.581371847815797 54.1234382937962
epoch 70 -4.233761342269033 42.26822154859152
[32m[I 2021-08-22 00:11:41,082][0m Trial 15 finished with value: 37.68120003250272 and parameters: {'n_layers_mlp': 2, 'mlp_n_units_l0': 37, 'mlp_dropout_l0': 0.19220048877390222, 'mlp_n_units_l1': 19, 'mlp_dropout_l1': 0.173195460018373, 'lr': 1.0972266273684282e-05, 'criterion': 'MSELoss', 'batch_size': 128, 'no_epochs': 73}. Best is trial 2 with value: 17.7298231083678.[0m
Trial Id: 16 | Model params: 4472 | Timestamp: 2021-08-22 00:11:41.082987

[32m[I 2021-08-22 00:11:53,446][0m Trial 16 pruned. [0m
epoch 0 -0.11690020938768608 19.527275201204635
Trial Id: 17 | Model params: 8451 | Timestamp: 2021-08-22 00:11:53.447017

