[32m[I 2021-08-22 11:56:04,881][0m Trial 12 pruned. [0m
epoch 0 -0.030887032752942023 11.942604601825131
Trial Id: 13 | Model params: 1665 | Timestamp: 2021-08-22 11:56:04.881310

[32m[I 2021-08-22 11:56:31,792][0m Trial 13 pruned. [0m
epoch 0 -0.021448322339362225 11.887806165720443
Trial Id: 14 | Model params: 6565 | Timestamp: 2021-08-22 11:56:31.792519

epoch 0 -8.316115461123516 35.89949217640421
epoch 5 -8.316115461123516 35.89949217640421
epoch 10 -8.316115461123516 35.89949217640421
epoch 15 -8.316115461123516 35.89949217640421
epoch 20 -8.316115461123516 35.89949217640421
epoch 25 -8.316115461123516 35.89949217640421
epoch 30 -8.316115461123516 35.89949217640421
epoch 35 -8.316115461123516 35.89949217640421
epoch 40 -8.316115461123516 35.89949217640421
epoch 45 -8.316115461123516 35.89949217640421
epoch 50 -8.316115461123516 35.89949217640421
epoch 55 -8.316115461123516 35.89949217640421
epoch 60 -8.316115461123516 35.89949217640421
epoch 65 -8.316115461123516 35.89949217640421
epoch 70 -8.316115461123516 35.89949217640421
epoch 75 -8.316115461123516 35.89949217640421
[32m[I 2021-08-22 12:00:26,764][0m Trial 14 finished with value: 35.89949217640421 and parameters: {'n_layers_mlp': 4, 'mlp_n_units_l0': 41, 'mlp_dropout_l0': 0.16538222419845383, 'mlp_n_units_l1': 78, 'mlp_dropout_l1': 0.08669218291801077, 'mlp_n_units_l2': 29, 'mlp_dropout_l2': 0.1913632059867875, 'mlp_n_units_l3': 11, 'mlp_dropout_l3': 0.2959620150211252, 'lr': 0.00014915056896891134, 'criterion': 'MSELoss', 'batch_size': 256, 'no_epochs': 80}. Best is trial 1 with value: 11.695439324660832.[0m
Trial Id: 15 | Model params: 4483 | Timestamp: 2021-08-22 12:00:26.764692

[32m[I 2021-08-22 12:00:53,904][0m Trial 15 pruned. [0m
epoch 0 -0.05277993971427919 12.068750690251504
Trial Id: 16 | Model params: 615 | Timestamp: 2021-08-22 12:00:53.905157

[32m[I 2021-08-22 12:00:57,935][0m Trial 16 pruned. [0m
epoch 0 -0.049810523182973965 12.051090139809457
Trial Id: 17 | Model params: 6645 | Timestamp: 2021-08-22 12:00:57.935385

[32m[I 2021-08-22 12:01:00,865][0m Trial 17 pruned. [0m
epoch 0 -0.06466862276521357 12.13607080345702
Trial Id: 18 | Model params: 5179 | Timestamp: 2021-08-22 12:01:00.865714

epoch 0 -8.316115461123516 35.89949217640421
epoch 5 -8.316115461123516 35.89949217640421
epoch 10 -8.316115461123516 35.89949217640421
epoch 15 -8.316115461123516 35.89949217640421
epoch 20 -8.316115461123516 35.89949217640421
epoch 25 -8.316115461123516 35.89949217640421
epoch 30 -8.316115461123516 35.89949217640421
epoch 35 -8.316115461123516 35.89949217640421
epoch 40 -8.316115461123516 35.89949217640421
epoch 45 -8.316115461123516 35.89949217640421
epoch 50 -8.316115461123516 35.89949217640421
epoch 55 -8.316115461123516 35.89949217640421
epoch 60 -8.316115461123516 35.89949217640421
[32m[I 2021-08-22 12:06:14,132][0m Trial 18 finished with value: 35.89949217640421 and parameters: {'n_layers_mlp': 4, 'mlp_n_units_l0': 52, 'mlp_dropout_l0': 0.29750327976239765, 'mlp_n_units_l1': 41, 'mlp_dropout_l1': 0.08039839107456902, 'mlp_n_units_l2': 35, 'mlp_dropout_l2': 0.2998496369664324, 'mlp_n_units_l3': 19, 'mlp_dropout_l3': 0.217949426394898, 'lr': 2.8556941479156323e-05, 'criterion': 'L1Loss', 'batch_size': 128, 'no_epochs': 62}. Best is trial 1 with value: 11.695439324660832.[0m
Trial Id: 19 | Model params: 4178 | Timestamp: 2021-08-22 12:06:14.132713

[32m[I 2021-08-22 12:06:40,913][0m Trial 19 pruned. [0m
epoch 0 0.0026101785770197283 11.746973292493642
Trial Id: 20 | Model params: 1819 | Timestamp: 2021-08-22 12:06:40.913822

[32m[I 2021-08-22 12:07:07,556][0m Trial 20 pruned. [0m
epoch 0 -0.003731575442946111 11.784259802696498
Trial Id: 21 | Model params: 1565 | Timestamp: 2021-08-22 12:07:07.556667

epoch 0 -8.316115461123516 35.89949217640421
epoch 5 -8.316115461123516 35.89949217640421
epoch 10 -8.316115461123516 35.89949217640421
epoch 15 -8.316115461123516 35.89949217640421
epoch 20 -8.316115461123516 35.89949217640421
epoch 25 -8.316115461123516 35.89949217640421
epoch 30 -8.316115461123516 35.89949217640421
epoch 35 -8.316115461123516 35.89949217640421
epoch 40 -8.316115461123516 35.89949217640421
[32m[I 2021-08-22 12:17:40,457][0m Trial 21 finished with value: 35.89949217640421 and parameters: {'n_layers_mlp': 2, 'mlp_n_units_l0': 36, 'mlp_dropout_l0': 0.23802066185120963, 'mlp_n_units_l1': 26, 'mlp_dropout_l1': 0.06871117721140425, 'lr': 0.00856367971138834, 'criterion': 'L1Loss', 'batch_size': 32, 'no_epochs': 45}. Best is trial 1 with value: 11.695439324660832.[0m
Trial Id: 22 | Model params: 1399 | Timestamp: 2021-08-22 12:17:40.457280

[32m[I 2021-08-22 12:17:54,382][0m Trial 22 pruned. [0m
epoch 0 -0.0009919319145277328 11.767552987241773
Trial Id: 23 | Model params: 2273 | Timestamp: 2021-08-22 12:17:54.383054

[32m[I 2021-08-22 12:18:08,424][0m Trial 23 pruned. [0m
epoch 0 -0.04242360770227549 12.008616982946906
Trial Id: 24 | Model params: 2615 | Timestamp: 2021-08-22 12:18:08.424574

[32m[I 2021-08-22 12:18:22,623][0m Trial 24 pruned. [0m
epoch 0 -0.025757880691288593 11.912236445945982
Trial Id: 25 | Model params: 389 | Timestamp: 2021-08-22 12:18:22.623598

epoch 0 -8.2551576126395 35.781849403310964
epoch 5 -5.581813753456145 30.174749153123223
epoch 10 -0.7629420431960074 15.616722440588507
epoch 15 -0.05903125400824538 12.103898205488282
epoch 20 -0.05348065687373804 12.072137044073422
epoch 25 -0.0475145181131551 12.037904660765715
epoch 30 -0.044214592632098704 12.018928540516361
epoch 35 -0.04310739837428734 12.012554937761234
epoch 40 -0.037894616377467605 11.982501820270993
epoch 45 -0.03535368486277224 11.96782529460611
epoch 50 -0.03532564171715369 11.967663215818447
[32m[I 2021-08-22 12:22:05,148][0m Trial 25 finished with value: 11.95506907563004 and parameters: {'n_layers_mlp': 2, 'mlp_n_units_l0': 10, 'mlp_dropout_l0': 0.16010891437744956, 'mlp_n_units_l1': 19, 'mlp_dropout_l1': 0.03669071855441865, 'lr': 2.4585967135053204e-05, 'criterion': 'L1Loss', 'batch_size': 128, 'no_epochs': 55}. Best is trial 1 with value: 11.695439324660832.[0m
Trial Id: 26 | Model params: 2939 | Timestamp: 2021-08-22 12:22:05.149024

[32m[I 2021-08-22 12:22:19,343][0m Trial 26 pruned. [0m
epoch 0 -0.02537720474724492 11.91002582551393
Trial Id: 27 | Model params: 6697 | Timestamp: 2021-08-22 12:22:19.343461

[32m[I 2021-08-22 12:22:24,428][0m Trial 27 pruned. [0m
epoch 0 -0.04687988690493161 12.034257557405637
Trial Id: 28 | Model params: 1460 | Timestamp: 2021-08-22 12:22:24.428503

[32m[I 2021-08-22 12:22:38,588][0m Trial 28 pruned. [0m
epoch 0 -0.010301372740194825 11.822146737788518
Trial Id: 29 | Model params: 4500 | Timestamp: 2021-08-22 12:22:38.588453

[32m[I 2021-08-22 12:23:12,431][0m Trial 29 pruned. [0m
epoch 0 -0.019315115224100454 11.875386346680465
Trial Id: 30 | Model params: 3449 | Timestamp: 2021-08-22 12:23:12.431190

[32m[I 2021-08-22 12:23:14,924][0m Trial 30 pruned. [0m
epoch 0 -0.012265353303400062 11.833632020336172
Trial Id: 31 | Model params: 2870 | Timestamp: 2021-08-22 12:23:14.924480

[32m[I 2021-08-22 12:23:48,545][0m Trial 31 pruned. [0m
epoch 0 -0.13337782494421768 12.522206780199737
Trial Id: 32 | Model params: 3267 | Timestamp: 2021-08-22 12:23:48.545360

[32m[I 2021-08-22 12:24:22,666][0m Trial 32 pruned. [0m
epoch 0 -0.029982829927182486 11.937365955201477
Trial Id: 33 | Model params: 3154 | Timestamp: 2021-08-22 12:24:22.667179

[32m[I 2021-08-22 12:24:55,682][0m Trial 33 pruned. [0m
epoch 0 -0.03826688574977011 11.985275375795196
Trial Id: 34 | Model params: 4678 | Timestamp: 2021-08-22 12:24:55.682270

[32m[I 2021-08-22 12:25:00,993][0m Trial 34 pruned. [0m
epoch 0 -0.07988958126858248 12.222514174349756
Trial Id: 35 | Model params: 3020 | Timestamp: 2021-08-22 12:25:00.993390

epoch 0 -8.314560456379642 35.89836742890005
epoch 5 -8.314560456379642 35.89836742890005
epoch 10 -8.314560456379642 35.89836742890005
epoch 15 -8.314560456379642 35.89836742890005
epoch 20 -8.314560456379642 35.89836742890005
epoch 25 -8.314560456379642 35.89836742890005
epoch 30 -8.314560456379642 35.89836742890005
epoch 35 -8.314560456379642 35.89836742890005
epoch 40 -8.314560456379642 35.89836742890005
epoch 45 -8.314560456379642 35.89836742890005
epoch 50 -8.314560456379642 35.89836742890005
epoch 55 -8.314560456379642 35.89836742890005
[32m[I 2021-08-22 12:58:12,707][0m Trial 35 finished with value: 35.89836742890005 and parameters: {'n_layers_mlp': 4, 'mlp_n_units_l0': 20, 'mlp_dropout_l0': 0.04653449640135765, 'mlp_n_units_l1': 29, 'mlp_dropout_l1': 0.1346619944857997, 'mlp_n_units_l2': 41, 'mlp_dropout_l2': 0.16466484083184466, 'mlp_n_units_l3': 20, 'mlp_dropout_l3': 0.10108562176032682, 'lr': 0.00010416640034614505, 'criterion': 'L1Loss', 'batch_size': 16, 'no_epochs': 59}. Best is trial 1 with value: 11.695439324660832.[0m
Trial Id: 36 | Model params: 2938 | Timestamp: 2021-08-22 12:58:12.708192

epoch 0 -8.184969934120328 35.64591306083344
epoch 5 -0.08170057454832413 12.232758563702518
epoch 10 -0.0558440656243393 12.085670947154442
epoch 15 -0.04548730652249322 12.026250789824024
epoch 20 -0.04584965333421809 12.028334648755834
epoch 25 -0.04143054768310961 12.00289564336058
epoch 30 -0.03670734662916031 11.975646339708447
epoch 35 -0.040842400881060836 11.999505853378173
epoch 40 -0.034577944116503945 11.963340996383508
epoch 45 -0.03683594033123616 11.976389049283226
epoch 50 -0.03417872976521674 11.961032616306422
[32m[I 2021-08-22 13:02:55,279][0m Trial 36 pruned. [0m
epoch 55 -0.030577517436564117 11.940189129334067
Trial Id: 37 | Model params: 3420 | Timestamp: 2021-08-22 13:02:55.280150

[32m[I 2021-08-22 13:03:28,333][0m Trial 37 pruned. [0m
epoch 0 0.009508292833219856 11.70628079872469
Trial Id: 38 | Model params: 3903 | Timestamp: 2021-08-22 13:03:28.334093

epoch 0 -8.316115461123516 35.89949217640421
epoch 5 -8.316115461123516 35.89949217640421
epoch 10 -8.316115461123516 35.89949217640421
epoch 15 -8.316115461123516 35.89949217640421
epoch 20 -8.316115461123516 35.89949217640421
epoch 25 -8.316115461123516 35.89949217640421
epoch 30 -8.316115461123516 35.89949217640421
epoch 35 -8.316115461123516 35.89949217640421
epoch 40 -8.316115461123516 35.89949217640421
epoch 45 -8.316115461123516 35.89949217640421
epoch 50 -8.316115461123516 35.89949217640421
epoch 55 -8.316115461123516 35.89949217640421
[32m[I 2021-08-22 13:21:35,588][0m Trial 38 finished with value: 35.89949217640421 and parameters: {'n_layers_mlp': 4, 'mlp_n_units_l0': 29, 'mlp_dropout_l0': 0.16584402039778243, 'mlp_n_units_l1': 35, 'mlp_dropout_l1': 0.16018581543552765, 'mlp_n_units_l2': 39, 'mlp_dropout_l2': 0.2654617933685225, 'mlp_n_units_l3': 24, 'mlp_dropout_l3': 0.10353734372575224, 'lr': 0.00015892885791582873, 'criterion': 'L1Loss', 'batch_size': 32, 'no_epochs': 61}. Best is trial 1 with value: 11.695439324660832.[0m
epoch 60 -8.316115461123516 35.89949217640421
Trial Id: 39 | Model params: 10433 | Timestamp: 2021-08-22 13:21:35.588672

[32m[I 2021-08-22 13:21:40,510][0m Trial 39 pruned. [0m
epoch 0 -0.003559981289362968 11.782638173637881
Trial Id: 40 | Model params: 2223 | Timestamp: 2021-08-22 13:21:40.511017

[32m[I 2021-08-22 13:22:07,674][0m Trial 40 pruned. [0m
epoch 0 -0.006658549033338179 11.801429287569452
Trial Id: 41 | Model params: 9663 | Timestamp: 2021-08-22 13:22:07.674722

[32m[I 2021-08-22 13:22:12,710][0m Trial 41 pruned. [0m
epoch 0 -0.0624005146768587 12.123136921823711
Trial Id: 42 | Model params: 7827 | Timestamp: 2021-08-22 13:22:12.710491

[32m[I 2021-08-22 13:22:17,912][0m Trial 42 pruned. [0m
epoch 0 -8.2083090711632 35.69117270950009
Trial Id: 43 | Model params: 6993 | Timestamp: 2021-08-22 13:22:17.912975

[32m[I 2021-08-22 13:22:22,864][0m Trial 43 pruned. [0m
epoch 0 -0.06947900528007467 12.163456483836564
Trial Id: 44 | Model params: 7529 | Timestamp: 2021-08-22 13:22:22.864585

[32m[I 2021-08-22 13:22:27,997][0m Trial 44 pruned. [0m
epoch 0 -7.868065603257744 35.02557895078352
Trial Id: 45 | Model params: 2535 | Timestamp: 2021-08-22 13:22:27.997851

[32m[I 2021-08-22 13:22:30,990][0m Trial 45 pruned. [0m
epoch 0 -0.06184780567099746 12.11998300831605
Trial Id: 46 | Model params: 9560 | Timestamp: 2021-08-22 13:22:30.991140

epoch 0 -8.314560456379642 35.89836742890005
epoch 5 -8.314560456379642 35.89836742890005
epoch 10 -8.314560456379642 35.89836742890005
epoch 15 -8.314560456379642 35.89836742890005
epoch 20 -8.314560456379642 35.89836742890005
epoch 25 -8.314560456379642 35.89836742890005
epoch 30 -8.314560456379642 35.89836742890005
epoch 35 -8.314560456379642 35.89836742890005
epoch 40 -8.314560456379642 35.89836742890005
epoch 45 -8.314560456379642 35.89836742890005
epoch 50 -8.314560456379642 35.89836742890005
[32m[I 2021-08-22 13:54:04,459][0m Trial 46 pruned. [0m
epoch 55 -8.314560456379642 35.89836742890005
Trial Id: 47 | Model params: 9066 | Timestamp: 2021-08-22 13:54:04.459254

[32m[I 2021-08-22 13:54:09,393][0m Trial 47 pruned. [0m
epoch 0 -0.006075625042777144 11.797396817140433
Trial Id: 48 | Model params: 2224 | Timestamp: 2021-08-22 13:54:09.394055

[32m[I 2021-08-22 13:54:23,440][0m Trial 48 pruned. [0m
epoch 0 -3.07987927836972 23.75716042602508
Trial Id: 49 | Model params: 7115 | Timestamp: 2021-08-22 13:54:23.440252

[32m[I 2021-08-22 13:54:56,840][0m Trial 49 pruned. [0m
epoch 0 -0.003994089336605278 11.78580071749774
Trial Id: 50 | Model params: 4994 | Timestamp: 2021-08-22 13:54:56.840462

epoch 0 -8.316115461123516 35.89949217640421
epoch 5 -8.316115461123516 35.89949217640421
epoch 10 -8.316115461123516 35.89949217640421
epoch 15 -8.316115461123516 35.89949217640421
epoch 20 -8.316115461123516 35.89949217640421
epoch 25 -8.316115461123516 35.89949217640421
epoch 30 -8.316115461123516 35.89949217640421
epoch 35 -8.316115461123516 35.89949217640421
epoch 40 -8.316115461123516 35.89949217640421
epoch 45 -8.316115461123516 35.89949217640421
[32m[I 2021-08-22 13:58:11,759][0m Trial 50 finished with value: 35.89949217640421 and parameters: {'n_layers_mlp': 2, 'mlp_n_units_l0': 73, 'mlp_dropout_l0': 0.14773660628746882, 'mlp_n_units_l1': 51, 'mlp_dropout_l1': 0.08049162762144108, 'lr': 8.880853091224686e-05, 'criterion': 'L1Loss', 'batch_size': 128, 'no_epochs': 48}. Best is trial 1 with value: 11.695439324660832.[0m
Trial Id: 51 | Model params: 2849 | Timestamp: 2021-08-22 13:58:11.759485

epoch 0 -8.316115461123516 35.89949217640421
epoch 5 -8.316115461123516 35.89949217640421
epoch 10 -8.316115461123516 35.89949217640421
epoch 15 -8.316115461123516 35.89949217640421
epoch 20 -8.316115461123516 35.89949217640421
epoch 25 -8.316115461123516 35.89949217640421
epoch 30 -8.316115461123516 35.89949217640421
epoch 35 -8.316115461123516 35.89949217640421
[32m[I 2021-08-22 14:00:52,708][0m Trial 51 finished with value: 35.89949217640421 and parameters: {'n_layers_mlp': 2, 'mlp_n_units_l0': 78, 'mlp_dropout_l0': 0.29189516173462876, 'mlp_n_units_l1': 20, 'mlp_dropout_l1': 0.2829327783267324, 'lr': 1.7079383971207802e-05, 'criterion': 'MSELoss', 'batch_size': 128, 'no_epochs': 40}. Best is trial 1 with value: 11.695439324660832.[0m
Trial Id: 52 | Model params: 4239 | Timestamp: 2021-08-22 14:00:52.708768

[32m[I 2021-08-22 14:00:56,543][0m Trial 52 pruned. [0m
epoch 0 -5.434213508905057 29.834489300404876
Trial Id: 53 | Model params: 833 | Timestamp: 2021-08-22 14:00:56.543353

epoch 0 -8.316115461123516 35.89949217640421
epoch 5 -8.316115461123516 35.89949217640421
epoch 10 -8.316115461123516 35.89949217640421
epoch 15 -8.316115461123516 35.89949217640421
epoch 20 -8.316115461123516 35.89949217640421
epoch 25 -8.146797853107705 35.571765003891585
epoch 30 -1.0401447543755724 16.79969377684858
epoch 35 -0.06814162295722825 12.155848910282335
epoch 40 -0.0543779849293744 12.07727731951402
[32m[I 2021-08-22 14:03:48,700][0m Trial 53 finished with value: 12.079628962836779 and parameters: {'n_layers_mlp': 2, 'mlp_n_units_l0': 30, 'mlp_dropout_l0': 0.24912888782425535, 'mlp_n_units_l1': 11, 'mlp_dropout_l1': 0.29355476453400053, 'lr': 3.237810236395365e-05, 'criterion': 'MSELoss', 'batch_size': 128, 'no_epochs': 43}. Best is trial 1 with value: 11.695439324660832.[0m
Trial Id: 54 | Model params: 2101 | Timestamp: 2021-08-22 14:03:48.700366

[32m[I 2021-08-22 14:03:52,742][0m Trial 54 pruned. [0m
epoch 0 -0.1534160625279244 12.631760173783764
Trial Id: 55 | Model params: 958 | Timestamp: 2021-08-22 14:03:52.742332

[32m[I 2021-08-22 14:03:55,064][0m Trial 55 pruned. [0m
epoch 0 -8.212798593058167 35.699872285828846
Trial Id: 56 | Model params: 1473 | Timestamp: 2021-08-22 14:03:55.064591

[32m[I 2021-08-22 14:04:08,456][0m Trial 56 pruned. [0m
epoch 0 -0.02625420932960343 11.91511805630423
Trial Id: 57 | Model params: 870 | Timestamp: 2021-08-22 14:04:08.457142

[32m[I 2021-08-22 14:04:35,778][0m Trial 57 pruned. [0m
epoch 0 -1.2674259897188689 17.71169298762154
Trial Id: 58 | Model params: 4961 | Timestamp: 2021-08-22 14:04:35.778387

[32m[I 2021-08-22 14:04:39,772][0m Trial 58 pruned. [0m
epoch 0 0.009633574770414932 11.704930204806
Trial Id: 59 | Model params: 1889 | Timestamp: 2021-08-22 14:04:39.772948

epoch 0 -8.316115461123516 35.89949217640421
epoch 5 -8.316115461123516 35.89949217640421
epoch 10 -8.316115461123516 35.89949217640421
epoch 15 -8.316115461123516 35.89949217640421
epoch 20 -8.316115461123516 35.89949217640421
epoch 25 -8.316115461123516 35.89949217640421
epoch 30 -8.316115461123516 35.89949217640421
epoch 35 -8.316115461123516 35.89949217640421
epoch 40 -8.316115461123516 35.89949217640421
epoch 45 -8.316115461123516 35.89949217640421
epoch 50 -8.316115461123516 35.89949217640421
epoch 55 -8.316115461123516 35.89949217640421
epoch 60 -8.316115461123516 35.89949217640421
epoch 65 -8.316115461123516 35.89949217640421
epoch 70 -8.316115461123516 35.89949217640421
[32m[I 2021-08-22 14:21:24,699][0m Trial 59 finished with value: 35.89949217640421 and parameters: {'n_layers_mlp': 2, 'mlp_n_units_l0': 38, 'mlp_dropout_l0': 0.23016988282482478, 'mlp_n_units_l1': 32, 'mlp_dropout_l1': 0.1108932903241559, 'lr': 0.0057366328035645215, 'criterion': 'MSELoss', 'batch_size': 32, 'no_epochs': 73}. Best is trial 1 with value: 11.695439324660832.[0m
Study statistics: 
  Number of finished trials:  60
  Number of pruned trials:  41
  Number of complete trials:  19

Best trial:
  Value:  11.695439324660832
  Params: 
    n_layers_mlp: 4
    mlp_n_units_l0: 61
    mlp_dropout_l0: 0.22517316480087435
    mlp_n_units_l1: 48
    mlp_dropout_l1: 0.11490311147562104
    mlp_n_units_l2: 35
    mlp_dropout_l2: 0.20090589760935196
    mlp_n_units_l3: 52
    mlp_dropout_l3: 0.2608411840583007
    lr: 4.8538834002443876e-05
    criterion: MSELoss
    batch_size: 128
    no_epochs: 43
Target 37144 0 129.0 1.0 33.86479646780099
[51. 35. 31. ... 28. 22. 36.]
Prediction 37144 0 40.779869079589844 28.607440948486328 32.97082309391179
[32.40510941 33.38031769 34.45315552 ... 32.52544022 33.30531311
 32.12153625]

 XXXXXX======== TRIAL south - lrg ended

Test Set - R-squared:  0.011096466917046133
Test Set - RMSE:  11.751728871741518
Test Set - MAE:  8.449606426158086



[32m[I 2021-08-22 14:21:34,827][0m A new study created in memory with name: NeuralNetwork[0m
++++++++ Session Characteristics +++++++

Area: south
Gal Type: elg
Training Samples: 118859
Validation Samples: 29715
Test Samples: 37144
Number of features: 15
Device: cuda:0
Number of Workers: 8
Number of Trials: 60

+++++++++++++++++++++++++++++++++++++++
Trial Id: 0 | Model params: 4860 | Timestamp: 2021-08-22 14:21:34.827860

epoch 0 0.07919676761285244 22.236618004378375
epoch 5 0.0848044709836302 22.1688039566798
epoch 10 0.08368325091917694 22.182379470749463
epoch 15 0.05461964409741671 22.53142216296232
epoch 20 0.08279534886273787 22.193124123962278
epoch 25 0.07526657514462964 22.28402288392745
epoch 30 0.08343636193537929 22.185367638478162
epoch 35 0.08685900249218514 22.14390649188986
epoch 40 0.08448234948792732 22.172704991930573
epoch 45 0.07511660698435307 22.285829760560297
epoch 50 0.0760969252484569 22.2740158398291
epoch 55 0.08447732190228241 22.17276587279957
[32m[I 2021-08-22 14:35:37,036][0m Trial 0 finished with value: 22.17388677457248 and parameters: {'n_layers_mlp': 2, 'mlp_n_units_l0': 65, 'mlp_dropout_l0': 0.24042486620928674, 'mlp_n_units_l1': 57, 'mlp_dropout_l1': 0.04217580204828597, 'lr': 0.009778707553967564, 'criterion': 'L1Loss', 'batch_size': 32, 'no_epochs': 60}. Best is trial 0 with value: 22.17388677457248.[0m
Trial Id: 1 | Model params: 4816 | Timestamp: 2021-08-22 14:35:37.036827

epoch 0 0.06586451268149474 22.397020806421306
epoch 5 0.13260867862421333 21.58205794412769
epoch 10 0.19553507294923111 20.78446620275527
epoch 15 0.2045834748891674 20.66724665567531
epoch 20 0.21334017078455658 20.553169540220352
epoch 25 0.20608353235479304 20.647749519914598
epoch 30 0.22230380740623013 20.435736975588995
epoch 35 0.20910633467225737 20.608404330135468
epoch 40 0.2238375661761961 20.415575529426725
epoch 45 0.2212107798805919 20.450092825803207
epoch 50 0.22934963762546312 20.34295373600048
epoch 55 0.23343122435560215 20.289011140291702
epoch 60 0.23237423229230703 20.302994188511715
