[32m[I 2021-08-21 22:12:51,240][0m A new study created in memory with name: NeuralNetwork[0m
++++++++ Session Characteristics +++++++

Area: des
Gal Type: lrg
Training Samples: 55443
Validation Samples: 13861
Test Samples: 17327
Number of features: 15
Device: cuda:0
Number of Workers: 8
Number of Trials: 60

+++++++++++++++++++++++++++++++++++++++
Trial Id: 0 | Model params: 5834 | Timestamp: 2021-08-21 22:12:51.240902

epoch 0 -7.271967698711233 29.240604418101093
epoch 5 -0.0020900835939501317 10.177364120887962
epoch 10 0.004254725120932834 10.145093585844407
epoch 15 0.007654955392119911 10.127757247846748
epoch 20 0.008666883383970814 10.122592121490744
epoch 25 0.010011396613043066 10.11572531929725
epoch 30 0.009753148422028568 10.117044626111682
epoch 35 0.010110842153203792 10.115217238179502
epoch 40 0.011453825733553136 10.108353246775488
epoch 45 0.011142477474706203 10.109944963225134
epoch 50 0.011741319819886686 10.106883258231429
epoch 55 0.011879922869865278 10.10617448936658
epoch 60 0.011816501141113434 10.106498812689024
epoch 65 0.011647827453809767 10.10736131832919
epoch 70 0.012441307149049896 10.10330325252985
epoch 75 0.012139745938736013 10.104845708600738
[32m[I 2021-08-21 22:29:19,641][0m Trial 0 finished with value: 10.107090174159106 and parameters: {'n_layers_mlp': 2, 'mlp_n_units_l0': 67, 'mlp_dropout_l0': 0.23273974993024193, 'mlp_n_units_l1': 69, 'mlp_dropout_l1': 0.1501103774799654, 'lr': 1.1183524962191128e-05, 'criterion': 'MSELoss', 'batch_size': 16, 'no_epochs': 77}. Best is trial 0 with value: 10.107090174159106.[0m
Trial Id: 1 | Model params: 5823 | Timestamp: 2021-08-21 22:29:19.641807

epoch 0 -0.034088392261020894 10.34106528585274
epoch 5 0.009017659504102049 10.123237037192174
epoch 10 -0.016534958126214416 10.252920916814068
epoch 15 -0.00861300905988216 10.21289180564576
epoch 20 -0.014696928427614608 10.243647404209554
epoch 25 -0.0034200312009500244 10.186566663249991
epoch 30 -0.017331956871738052 10.256939452513775
epoch 35 -0.009910213694973802 10.21945723435085
epoch 40 -0.003833214145411601 10.188663732415943
epoch 45 -0.010723320562551875 10.223570391573032
epoch 50 -0.009645053996208963 10.218115547705173
epoch 55 -0.01078581028357295 10.223886431667356
epoch 60 -0.021889669656008692 10.279889651803531
epoch 65 0.002614302167586513 10.15589065948305
[32m[I 2021-08-21 22:32:16,873][0m Trial 1 finished with value: 10.144152937370396 and parameters: {'n_layers_mlp': 4, 'mlp_n_units_l0': 34, 'mlp_dropout_l0': 0.08874668567529256, 'mlp_n_units_l1': 12, 'mlp_dropout_l1': 0.006351363685122157, 'mlp_n_units_l2': 72, 'mlp_dropout_l2': 0.2663089778070019, 'mlp_n_units_l3': 53, 'mlp_dropout_l3': 0.01663865572584867, 'lr': 0.00017881941263136596, 'criterion': 'L1Loss', 'batch_size': 128, 'no_epochs': 69}. Best is trial 0 with value: 10.107090174159106.[0m
Trial Id: 2 | Model params: 10323 | Timestamp: 2021-08-21 22:32:16.873255

epoch 0 0.005984046231076401 10.13628021317147
epoch 5 0.01646353985298754 10.082707362864314
epoch 10 -0.00020512622005952608 10.16778767276855
epoch 15 0.015086952507606277 10.089760926559936
epoch 20 0.021144989560045846 10.05868283951386
epoch 25 0.014983294979796336 10.09029186284891
epoch 30 0.02010103618038972 10.064045225944135
epoch 35 0.01637720116865915 10.08314990293258
epoch 40 0.018700878187487002 10.071232815583375
epoch 45 0.02222386068462945 10.053138088651096
[32m[I 2021-08-21 22:38:57,993][0m Trial 2 finished with value: 10.07126560556984 and parameters: {'n_layers_mlp': 4, 'mlp_n_units_l0': 54, 'mlp_dropout_l0': 0.03822269261836596, 'mlp_n_units_l1': 44, 'mlp_dropout_l1': 0.10638649301439075, 'mlp_n_units_l2': 79, 'mlp_dropout_l2': 0.279726343135355, 'mlp_n_units_l3': 43, 'mlp_dropout_l3': 0.2584361799959367, 'lr': 0.0005231431812476474, 'criterion': 'MSELoss', 'batch_size': 32, 'no_epochs': 47}. Best is trial 2 with value: 10.07126560556984.[0m
Trial Id: 3 | Model params: 3208 | Timestamp: 2021-08-21 22:38:57.993920

epoch 0 -0.005380650925108643 10.194060152136792
epoch 5 0.005486566376112445 10.138816371885111
epoch 10 0.006143014210094111 10.1354696585708
epoch 15 0.014663874760218576 10.091927765050904
epoch 20 0.0047435736478707025 10.142602977543241
epoch 25 0.004275001830641556 10.14499029127197
epoch 30 0.005790056665734511 10.137269249946259
epoch 35 0.004215317041879052 10.145294337334045
epoch 40 -0.00017770066038935717 10.167648271773789
epoch 45 -0.00788406380047002 10.206743942551054
[32m[I 2021-08-21 22:44:16,254][0m Trial 3 finished with value: 10.237526546609708 and parameters: {'n_layers_mlp': 2, 'mlp_n_units_l0': 77, 'mlp_dropout_l0': 0.2823637424533208, 'mlp_n_units_l1': 25, 'mlp_dropout_l1': 0.08661728301524657, 'lr': 0.00096323804103428, 'criterion': 'L1Loss', 'batch_size': 32, 'no_epochs': 47}. Best is trial 2 with value: 10.07126560556984.[0m
Trial Id: 4 | Model params: 10446 | Timestamp: 2021-08-21 22:44:16.254855

epoch 0 -10.195763887550799 34.026189299098476
epoch 5 -0.9766872557799153 14.297346070663213
epoch 10 -0.032163858498922115 10.33143796685745
epoch 15 -0.030721158907004442 10.32421509557855
epoch 20 -0.026526356529940065 10.30318506479352
epoch 25 -0.02561934633716767 10.29863225473113
epoch 30 -0.02653798511624128 10.3032434223489
epoch 35 -0.028394886297410826 10.31255796354181
epoch 40 -0.02069637209613684 10.273885798922205
epoch 45 -0.017866060786823956 10.25963156920228
epoch 50 -0.022406935264292827 10.282491087555455
epoch 55 -0.016757646949841387 10.254043891409951
[32m[I 2021-08-21 22:46:47,986][0m Trial 4 finished with value: 10.297200821192108 and parameters: {'n_layers_mlp': 4, 'mlp_n_units_l0': 62, 'mlp_dropout_l0': 0.0589128318516695, 'mlp_n_units_l1': 43, 'mlp_dropout_l1': 0.2851380785072108, 'mlp_n_units_l2': 59, 'mlp_dropout_l2': 0.21372470281650643, 'mlp_n_units_l3': 68, 'mlp_dropout_l3': 0.269777615682712, 'lr': 1.1703197397178523e-05, 'criterion': 'L1Loss', 'batch_size': 128, 'no_epochs': 59}. Best is trial 2 with value: 10.07126560556984.[0m
Trial Id: 5 | Model params: 3711 | Timestamp: 2021-08-21 22:46:47.986562

epoch 0 -9.981480887663071 33.698991448792604
epoch 5 -0.051973332214786394 10.430108196969913
epoch 10 -0.11298795534479655 10.72831905157234
epoch 15 -0.25804487581605295 11.406030142186133
epoch 20 -0.4860435812923205 12.396589535100206
epoch 25 -0.5590913736063614 12.697617275654252
epoch 30 -0.6543047994103488 13.079592489350178
epoch 35 -0.7058571168005174 13.281825626913912
epoch 40 -0.7328787915106942 13.386607860660677
epoch 45 -0.734746531259272 13.393820126809427
epoch 50 -0.7503949244469867 13.454094414934987
epoch 55 -0.7489248018955785 13.44844331240062
[32m[I 2021-08-21 22:48:20,067][0m Trial 5 finished with value: 13.521183212317045 and parameters: {'n_layers_mlp': 4, 'mlp_n_units_l0': 70, 'mlp_dropout_l0': 0.06847840656922023, 'mlp_n_units_l1': 12, 'mlp_dropout_l1': 0.23522064480549465, 'mlp_n_units_l2': 19, 'mlp_dropout_l2': 0.14448274968508712, 'mlp_n_units_l3': 71, 'mlp_dropout_l3': 0.03723356848447531, 'lr': 7.607357462325939e-05, 'criterion': 'MSELoss', 'batch_size': 256, 'no_epochs': 58}. Best is trial 2 with value: 10.07126560556984.[0m
Trial Id: 6 | Model params: 8824 | Timestamp: 2021-08-21 22:48:20.068145

[32m[I 2021-08-21 22:48:28,558][0m Trial 6 pruned. [0m
epoch 0 -0.036451682389541995 10.35038396418656
Trial Id: 7 | Model params: 2648 | Timestamp: 2021-08-21 22:48:28.558195

epoch 0 -8.821293741253228 31.86917335337633
epoch 5 -0.016647253191913736 10.253487213439422
epoch 10 -0.00031062257470693133 10.170771296679968
epoch 15 0.0037018329330872346 10.150352252434162
epoch 20 0.0063864709891174876 10.136667391475381
epoch 25 0.0067143807086558205 10.134994615317073
epoch 30 0.00873391177743943 10.12468622543256
epoch 35 0.006763156634683187 10.134745769563668
[32m[I 2021-08-21 22:49:52,028][0m Trial 7 finished with value: 10.126205718805407 and parameters: {'n_layers_mlp': 2, 'mlp_n_units_l0': 55, 'mlp_dropout_l0': 0.2681198841643963, 'mlp_n_units_l1': 31, 'mlp_dropout_l1': 0.19189958286126563, 'lr': 8.301171555445322e-05, 'criterion': 'MSELoss', 'batch_size': 128, 'no_epochs': 40}. Best is trial 2 with value: 10.07126560556984.[0m
Trial Id: 8 | Model params: 1643 | Timestamp: 2021-08-21 22:49:52.028354

epoch 0 -10.257356895280248 34.11965772202208
epoch 5 -10.05951288905013 33.81850834080268
epoch 10 -9.68186538910244 33.23609554311691
epoch 15 -8.990254897767963 32.14213589930325
epoch 20 -7.959931533008502 30.439589676989282
epoch 25 -6.619326639257117 28.070150712245166
epoch 30 -5.05016756827148 25.013251510168942
epoch 35 -3.4018341174968647 21.335522569517526
epoch 40 -1.8826421413724637 17.265605519117482
epoch 45 -0.743799182026248 13.428721999271094
epoch 50 -0.16565373689109064 10.979213452856321
epoch 55 -0.042460439546918805 10.382841870410456
epoch 60 -0.03297811961781316 10.33551233436068
[32m[I 2021-08-21 22:52:04,815][0m Trial 8 finished with value: 10.326514059130592 and parameters: {'n_layers_mlp': 2, 'mlp_n_units_l0': 52, 'mlp_dropout_l0': 0.28602632970290914, 'mlp_n_units_l1': 15, 'mlp_dropout_l1': 0.1955128668139622, 'lr': 1.0242076929719522e-05, 'criterion': 'MSELoss', 'batch_size': 128, 'no_epochs': 64}. Best is trial 2 with value: 10.07126560556984.[0m
Trial Id: 9 | Model params: 5963 | Timestamp: 2021-08-21 22:52:04.815612

[32m[I 2021-08-21 22:52:06,538][0m Trial 9 pruned. [0m
epoch 0 -0.36476505116370306 11.879971387377187
Trial Id: 10 | Model params: 7566 | Timestamp: 2021-08-21 22:52:06.538663

[32m[I 2021-08-21 22:52:15,042][0m Trial 10 pruned. [0m
epoch 0 -0.0033095110305478848 10.183554574215272
Trial Id: 11 | Model params: 3635 | Timestamp: 2021-08-21 22:52:15.042908

[32m[I 2021-08-21 22:52:27,875][0m Trial 11 pruned. [0m
epoch 0 -0.05880082843303902 10.461382144240014
Trial Id: 12 | Model params: 5801 | Timestamp: 2021-08-21 22:52:27.876187

[32m[I 2021-08-21 22:52:40,553][0m Trial 12 pruned. [0m
epoch 0 0.013657976895681267 10.097077712783443
Trial Id: 13 | Model params: 4577 | Timestamp: 2021-08-21 22:52:40.553540

[32m[I 2021-08-21 22:52:53,334][0m Trial 13 pruned. [0m
epoch 0 0.00782714513682381 10.126878535547881
Trial Id: 14 | Model params: 8105 | Timestamp: 2021-08-21 22:52:53.334981

[32m[I 2021-08-21 22:53:09,229][0m Trial 14 pruned. [0m
epoch 0 0.007264628404312634 10.129748867771685
Trial Id: 15 | Model params: 2094 | Timestamp: 2021-08-21 22:53:09.229665

epoch 0 -8.790663747101748 31.811782038794746
epoch 5 -0.010993002289612308 10.222473780688166
epoch 10 0.0009816604636296855 10.16175362219013
epoch 15 0.0027704329033750863 10.152652083190615
epoch 20 0.005354435320675033 10.139489871090456
epoch 25 0.00651223907284737 10.133586784534906
epoch 30 0.00401451009961995 10.14631722053019
epoch 35 0.002932788572766021 10.15182558958516
epoch 40 0.004641263630609904 10.143124281998846
epoch 45 0.00789332945348964 10.126540765919202
[32m[I 2021-08-21 22:58:22,402][0m Trial 15 finished with value: 10.132574209834715 and parameters: {'n_layers_mlp': 2, 'mlp_n_units_l0': 23, 'mlp_dropout_l0': 0.23508995217601664, 'mlp_n_units_l1': 69, 'mlp_dropout_l1': 0.07009777320109348, 'lr': 2.7292317505720956e-05, 'criterion': 'MSELoss', 'batch_size': 32, 'no_epochs': 47}. Best is trial 2 with value: 10.07126560556984.[0m
Trial Id: 16 | Model params: 3448 | Timestamp: 2021-08-21 22:58:22.402342

[32m[I 2021-08-21 22:58:28,872][0m Trial 16 pruned. [0m
epoch 0 -0.008555718810288493 10.210144268648211
Trial Id: 17 | Model params: 6361 | Timestamp: 2021-08-21 22:58:28.872950

[32m[I 2021-08-21 22:58:44,975][0m Trial 17 pruned. [0m
epoch 0 -0.009752636308596463 10.216200987422381
Trial Id: 18 | Model params: 9485 | Timestamp: 2021-08-21 22:58:44.975653

[32m[I 2021-08-21 22:59:01,076][0m Trial 18 pruned. [0m
epoch 0 -0.03786255877374112 10.357426331083854
Trial Id: 19 | Model params: 3505 | Timestamp: 2021-08-21 22:59:01.076514

[32m[I 2021-08-21 22:59:02,377][0m Trial 19 pruned. [0m
epoch 0 -0.011968342427537193 10.229865215797403
Trial Id: 20 | Model params: 6332 | Timestamp: 2021-08-21 22:59:02.377899

epoch 0 -10.2685811037026 34.128448695957594
epoch 5 -10.2685811037026 34.128448695957594
epoch 10 -10.2685811037026 34.128448695957594
epoch 15 -10.2685811037026 34.128448695957594
epoch 20 -10.2685811037026 34.128448695957594
epoch 25 -10.2685811037026 34.128448695957594
epoch 30 -10.2685811037026 34.128448695957594
epoch 35 -10.2685811037026 34.128448695957594
epoch 40 -10.2685811037026 34.128448695957594
epoch 45 -10.2685811037026 34.128448695957594
epoch 50 -10.2685811037026 34.128448695957594
epoch 55 -10.2685811037026 34.128448695957594
epoch 60 -10.2685811037026 34.128448695957594
[32m[I 2021-08-21 23:08:00,284][0m Trial 20 finished with value: 34.128448695957594 and parameters: {'n_layers_mlp': 4, 'mlp_n_units_l0': 76, 'mlp_dropout_l0': 0.03499618254731462, 'mlp_n_units_l1': 23, 'mlp_dropout_l1': 0.0449580976122214, 'mlp_n_units_l2': 62, 'mlp_dropout_l2': 0.08568775758180303, 'mlp_n_units_l3': 29, 'mlp_dropout_l3': 0.08238678098634666, 'lr': 2.7154326018877884e-05, 'criterion': 'MSELoss', 'batch_size': 32, 'no_epochs': 63}. Best is trial 2 with value: 10.07126560556984.[0m
Trial Id: 21 | Model params: 2719 | Timestamp: 2021-08-21 23:08:00.285163

epoch 0 -10.26302570359987 34.128247369569365
epoch 5 -10.26302570359987 34.128247369569365
epoch 10 -10.26302570359987 34.128247369569365
epoch 15 -10.26302570359987 34.128247369569365
epoch 20 -10.26302570359987 34.128247369569365
epoch 25 -10.26302570359987 34.128247369569365
epoch 30 -10.26302570359987 34.128247369569365
epoch 35 -10.26302570359987 34.128247369569365
[32m[I 2021-08-21 23:09:25,808][0m Trial 21 finished with value: 34.128247369569365 and parameters: {'n_layers_mlp': 2, 'mlp_n_units_l0': 53, 'mlp_dropout_l0': 0.26382525704910326, 'mlp_n_units_l1': 34, 'mlp_dropout_l1': 0.18368900295125423, 'lr': 6.120545511546568e-05, 'criterion': 'MSELoss', 'batch_size': 128, 'no_epochs': 41}. Best is trial 2 with value: 10.07126560556984.[0m
epoch 40 -10.26302570359987 34.128247369569365
Trial Id: 22 | Model params: 2279 | Timestamp: 2021-08-21 23:09:25.809062

[32m[I 2021-08-21 23:09:27,892][0m Trial 22 pruned. [0m
epoch 0 -7.126674571516425 28.989644048665298
Trial Id: 23 | Model params: 3809 | Timestamp: 2021-08-21 23:09:27.893180

epoch 0 -10.26302570359987 34.128247369569365
epoch 5 -10.26302570359987 34.128247369569365
epoch 10 -10.26302570359987 34.128247369569365
epoch 15 -10.26302570359987 34.128247369569365
epoch 20 -10.26302570359987 34.128247369569365
epoch 25 -10.26302570359987 34.128247369569365
epoch 30 -10.26302570359987 34.128247369569365
epoch 35 -10.26302570359987 34.128247369569365
epoch 40 -10.26302570359987 34.128247369569365
[32m[I 2021-08-21 23:11:00,478][0m Trial 23 finished with value: 34.128247369569365 and parameters: {'n_layers_mlp': 2, 'mlp_n_units_l0': 58, 'mlp_dropout_l0': 0.2110955626714218, 'mlp_n_units_l1': 48, 'mlp_dropout_l1': 0.14782087262664273, 'lr': 0.0002776976565314177, 'criterion': 'MSELoss', 'batch_size': 128, 'no_epochs': 44}. Best is trial 2 with value: 10.07126560556984.[0m
Trial Id: 24 | Model params: 3599 | Timestamp: 2021-08-21 23:11:00.478554

[32m[I 2021-08-21 23:11:06,832][0m Trial 24 pruned. [0m
epoch 0 -9.24722217520787 32.54505477082867
Trial Id: 25 | Model params: 1814 | Timestamp: 2021-08-21 23:11:06.832812

[32m[I 2021-08-21 23:11:19,633][0m Trial 25 pruned. [0m
epoch 0 -0.07439845083738761 10.538155853456065
Trial Id: 26 | Model params: 1089 | Timestamp: 2021-08-21 23:11:19.633705

[32m[I 2021-08-21 23:11:21,673][0m Trial 26 pruned. [0m
epoch 0 -0.03285640871699336 10.334903424283423
Trial Id: 27 | Model params: 4050 | Timestamp: 2021-08-21 23:11:21.673414

[32m[I 2021-08-21 23:11:34,392][0m Trial 27 pruned. [0m
epoch 0 -5.229970883054481 25.376103617474445
Trial Id: 28 | Model params: 4757 | Timestamp: 2021-08-21 23:11:34.392715

[32m[I 2021-08-21 23:11:40,918][0m Trial 28 pruned. [0m
epoch 0 -0.009143929410223128 10.213121218540302
Trial Id: 29 | Model params: 8745 | Timestamp: 2021-08-21 23:11:40.918536

[32m[I 2021-08-21 23:11:43,456][0m Trial 29 pruned. [0m
epoch 0 -0.049751103096646876 10.419085891104528
Trial Id: 30 | Model params: 3369 | Timestamp: 2021-08-21 23:11:43.456934

epoch 0 -9.595394020356167 33.10129649161109
epoch 5 -0.011485377795278584 10.227423809030137
epoch 10 -0.0019330641955095373 10.17901613414408
epoch 15 0.004427848282571811 10.146653232000771
epoch 20 0.007510385231889738 10.130932783381557
epoch 25 0.008929994553885767 10.123684791611643
epoch 30 0.009409235185877995 10.121236797155603
epoch 35 0.009628707464304442 10.120115519817507
epoch 40 0.011469660951205496 10.110705247094144
[32m[I 2021-08-21 23:12:44,615][0m Trial 30 finished with value: 10.109696343652388 and parameters: {'n_layers_mlp': 2, 'mlp_n_units_l0': 48, 'mlp_dropout_l0': 0.18865641912524664, 'mlp_n_units_l1': 52, 'mlp_dropout_l1': 0.10128524700025195, 'lr': 0.00010194762856367353, 'criterion': 'MSELoss', 'batch_size': 256, 'no_epochs': 45}. Best is trial 2 with value: 10.07126560556984.[0m
Trial Id: 31 | Model params: 3635 | Timestamp: 2021-08-21 23:12:44.615567

[32m[I 2021-08-21 23:12:46,031][0m Trial 31 pruned. [0m
epoch 0 -9.335616857609342 32.692990568004184
Trial Id: 32 | Model params: 2213 | Timestamp: 2021-08-21 23:12:46.031688

epoch 0 -10.113301203219063 33.900647318823445
epoch 5 -6.241736511297794 27.365778529784958
epoch 10 -0.4139340862144807 12.092080522227995
epoch 15 -0.01391008164745422 10.23967491551647
epoch 20 -0.008352236911623123 10.211571472734958
epoch 25 -0.0036552108959246876 10.187760347454658
epoch 30 0.0011082152349035645 10.163555640221661
epoch 35 0.0031038213274754423 10.153398086534422
epoch 40 0.005253242732954022 10.14244624015841
epoch 45 0.005550486956605427 10.140930774646677
[32m[I 2021-08-21 23:13:51,635][0m Trial 32 finished with value: 10.138658171953455 and parameters: {'n_layers_mlp': 2, 'mlp_n_units_l0': 31, 'mlp_dropout_l0': 0.25944371456681786, 'mlp_n_units_l1': 52, 'mlp_dropout_l1': 0.08292375006901061, 'lr': 4.240528473040687e-05, 'criterion': 'MSELoss', 'batch_size': 256, 'no_epochs': 48}. Best is trial 2 with value: 10.07126560556984.[0m
Trial Id: 33 | Model params: 3037 | Timestamp: 2021-08-21 23:13:51.636058

epoch 0 -10.26302570359987 34.128247369569365
epoch 5 -10.26302570359987 34.128247369569365
epoch 10 -10.26302570359987 34.128247369569365
epoch 15 -10.26302570359987 34.128247369569365
epoch 20 -10.26302570359987 34.128247369569365
epoch 25 -10.26302570359987 34.128247369569365
epoch 30 -10.26302570359987 34.128247369569365
epoch 35 -10.26302570359987 34.128247369569365
epoch 40 -10.26302570359987 34.128247369569365
epoch 45 -10.26302570359987 34.128247369569365
epoch 50 -10.26302570359987 34.128247369569365
[32m[I 2021-08-21 23:15:06,379][0m Trial 33 finished with value: 34.128247369569365 and parameters: {'n_layers_mlp': 2, 'mlp_n_units_l0': 50, 'mlp_dropout_l0': 0.16195473260366977, 'mlp_n_units_l1': 43, 'mlp_dropout_l1': 0.11864181475950467, 'lr': 8.50562891840283e-05, 'criterion': 'MSELoss', 'batch_size': 256, 'no_epochs': 55}. Best is trial 2 with value: 10.07126560556984.[0m
Trial Id: 34 | Model params: 2867 | Timestamp: 2021-08-21 23:15:06.379715

[32m[I 2021-08-21 23:15:07,906][0m Trial 34 pruned. [0m
epoch 0 -7.849751336529954 30.25185306429448
Trial Id: 35 | Model params: 3159 | Timestamp: 2021-08-21 23:15:07.906598

[32m[I 2021-08-21 23:15:10,074][0m Trial 35 pruned. [0m
epoch 0 -0.010562114784479881 10.222755052544327
Trial Id: 36 | Model params: 4061 | Timestamp: 2021-08-21 23:15:10.074890

[32m[I 2021-08-21 23:15:11,485][0m Trial 36 pruned. [0m
epoch 0 -9.479353301301073 32.91953481522761
Trial Id: 37 | Model params: 12028 | Timestamp: 2021-08-21 23:15:11.485438

[32m[I 2021-08-21 23:15:20,277][0m Trial 37 pruned. [0m
epoch 0 0.005011583640297523 10.141237248118085
Trial Id: 38 | Model params: 6419 | Timestamp: 2021-08-21 23:15:20.277801

[32m[I 2021-08-21 23:15:22,353][0m Trial 38 pruned. [0m
epoch 0 -0.0008554185213189847 10.173540556854327
Trial Id: 39 | Model params: 7509 | Timestamp: 2021-08-21 23:15:22.353625

epoch 0 -10.254172115598838 34.114831043781464
epoch 5 -7.299177548075988 29.29570651745505
epoch 10 -0.08428480596147647 10.589077683992578
epoch 15 -0.04022200278021004 10.371688533635586
epoch 20 -0.02684226826931524 10.304770336672068
epoch 25 -0.018667214550008415 10.263668409612956
epoch 30 -0.018650766515085238 10.263585547489049
epoch 35 -0.007291223624416032 10.20619762407778
epoch 40 -0.009143037365603623 10.215574901504459
epoch 45 -0.006192683642135766 10.200630726214406
[32m[I 2021-08-21 23:16:41,411][0m Trial 39 finished with value: 10.20537254195428 and parameters: {'n_layers_mlp': 4, 'mlp_n_units_l0': 48, 'mlp_dropout_l0': 0.034421177868534644, 'mlp_n_units_l1': 59, 'mlp_dropout_l1': 0.04861937779291355, 'mlp_n_units_l2': 47, 'mlp_dropout_l2': 0.24429903070475156, 'mlp_n_units_l3': 21, 'mlp_dropout_l3': 0.2164830415310605, 'lr': 2.1166575542583753e-05, 'criterion': 'MSELoss', 'batch_size': 256, 'no_epochs': 49}. Best is trial 2 with value: 10.07126560556984.[0m
Trial Id: 40 | Model params: 4529 | Timestamp: 2021-08-21 23:16:41.411359

[32m[I 2021-08-21 23:16:48,149][0m Trial 40 pruned. [0m
epoch 0 -9.878323371655343 33.53226678955396
Trial Id: 41 | Model params: 1993 | Timestamp: 2021-08-21 23:16:48.149894

[32m[I 2021-08-21 23:16:54,771][0m Trial 41 pruned. [0m
epoch 0 -5.542731224887742 26.005276183207425
Trial Id: 42 | Model params: 1243 | Timestamp: 2021-08-21 23:16:54.771558

[32m[I 2021-08-21 23:17:01,435][0m Trial 42 pruned. [0m
epoch 0 -9.319663878191164 32.659889165785756
Trial Id: 43 | Model params: 2127 | Timestamp: 2021-08-21 23:17:01.436020

