[32m[I 2021-08-22 18:49:56,674][0m Trial 33 pruned. [0m
epoch 0 0.07408025444741051 22.298981249401987
Trial Id: 34 | Model params: 2939 | Timestamp: 2021-08-22 18:49:56.674815

[32m[I 2021-08-22 18:50:22,967][0m Trial 34 pruned. [0m
epoch 0 0.05029167110510646 22.58361559415599
Trial Id: 35 | Model params: 2246 | Timestamp: 2021-08-22 18:50:22.967567

epoch 0 -31.557464881806133 132.22409656342933
epoch 5 -31.557464881806133 132.22409656342933
epoch 10 -31.557464881806133 132.22409656342933
epoch 15 -31.557464881806133 132.22409656342933
epoch 20 -31.557464881806133 132.22409656342933
epoch 25 -31.557464881806133 132.22409656342933
epoch 30 -31.557464881806133 132.22409656342933
epoch 35 -31.557464881806133 132.22409656342933
epoch 40 -31.557464881806133 132.22409656342933
epoch 45 -31.557464881806133 132.22409656342933
epoch 50 -31.557464881806133 132.22409656342933
[32m[I 2021-08-22 18:54:06,265][0m Trial 35 finished with value: 132.22409656342933 and parameters: {'n_layers_mlp': 2, 'mlp_n_units_l0': 67, 'mlp_dropout_l0': 0.06103260806067748, 'mlp_n_units_l1': 17, 'mlp_dropout_l1': 0.11799734362281192, 'lr': 6.596630093759087e-05, 'criterion': 'MSELoss', 'batch_size': 128, 'no_epochs': 55}. Best is trial 12 with value: 20.28013345328479.[0m
Trial Id: 36 | Model params: 2783 | Timestamp: 2021-08-22 18:54:06.265568

[32m[I 2021-08-22 18:54:20,280][0m Trial 36 pruned. [0m
epoch 0 0.03835245969852796 22.724444752186816
Trial Id: 37 | Model params: 809 | Timestamp: 2021-08-22 18:54:20.280426

[32m[I 2021-08-22 18:54:47,166][0m Trial 37 pruned. [0m
epoch 0 -0.2093057141941035 25.483929913203692
Trial Id: 38 | Model params: 8075 | Timestamp: 2021-08-22 18:54:47.167135

[32m[I 2021-08-22 18:55:05,324][0m Trial 38 pruned. [0m
epoch 0 0.057997519351475124 22.491133384476427
Trial Id: 39 | Model params: 6656 | Timestamp: 2021-08-22 18:55:05.325051

[32m[I 2021-08-22 18:55:10,449][0m Trial 39 pruned. [0m
epoch 0 -0.08147675712835412 24.098716520813415
Trial Id: 40 | Model params: 1679 | Timestamp: 2021-08-22 18:55:10.449809

[32m[I 2021-08-22 18:55:24,453][0m Trial 40 pruned. [0m
epoch 0 -26.438063876564996 121.38416896651667
Trial Id: 41 | Model params: 4611 | Timestamp: 2021-08-22 18:55:24.453863

[32m[I 2021-08-22 18:55:41,851][0m Trial 41 pruned. [0m
epoch 0 0.008647512851859718 23.07275041462433
Trial Id: 42 | Model params: 5757 | Timestamp: 2021-08-22 18:55:41.851676

[32m[I 2021-08-22 18:55:59,881][0m Trial 42 pruned. [0m
epoch 0 0.02709638133472747 22.85705257855163
Trial Id: 43 | Model params: 4089 | Timestamp: 2021-08-22 18:55:59.881925

[32m[I 2021-08-22 18:56:17,883][0m Trial 43 pruned. [0m
epoch 0 -0.9665058575146714 32.49622702383814
Trial Id: 44 | Model params: 4859 | Timestamp: 2021-08-22 18:56:17.883839

[32m[I 2021-08-22 18:56:35,617][0m Trial 44 pruned. [0m
epoch 0 -0.30318115258123823 26.45377851598169
Trial Id: 45 | Model params: 3915 | Timestamp: 2021-08-22 18:56:35.617484

epoch 0 -31.557464881806133 132.22409656342933
epoch 5 -31.557464881806133 132.22409656342933
epoch 10 -31.557464881806133 132.22409656342933
epoch 15 -31.557464881806133 132.22409656342933
epoch 20 -31.557464881806133 132.22409656342933
epoch 25 -31.557464881806133 132.22409656342933
epoch 30 -31.557464881806133 132.22409656342933
epoch 35 -31.557464881806133 132.22409656342933
epoch 40 -31.557464881806133 132.22409656342933
epoch 45 -31.557464881806133 132.22409656342933
epoch 50 -31.557464881806133 132.22409656342933
epoch 55 -31.557464881806133 132.22409656342933
epoch 60 -31.557464881806133 132.22409656342933
epoch 65 -31.557464881806133 132.22409656342933
epoch 70 -31.557464881806133 132.22409656342933
epoch 75 -31.557464881806133 132.22409656342933
[32m[I 2021-08-22 19:20:14,325][0m Trial 45 finished with value: 132.22409656342933 and parameters: {'n_layers_mlp': 4, 'mlp_n_units_l0': 61, 'mlp_dropout_l0': 0.23746025012731353, 'mlp_n_units_l1': 18, 'mlp_dropout_l1': 0.16450531276042385, 'mlp_n_units_l2': 28, 'mlp_dropout_l2': 0.11329074920655959, 'mlp_n_units_l3': 43, 'mlp_dropout_l3': 0.1960534743435058, 'lr': 0.00011276241003840193, 'criterion': 'MSELoss', 'batch_size': 32, 'no_epochs': 80}. Best is trial 12 with value: 20.28013345328479.[0m
Trial Id: 46 | Model params: 8839 | Timestamp: 2021-08-22 19:20:14.326115

[32m[I 2021-08-22 19:20:17,220][0m Trial 46 pruned. [0m
epoch 0 0.05361273964677149 22.543417838285706
Trial Id: 47 | Model params: 4304 | Timestamp: 2021-08-22 19:20:17.220787

[32m[I 2021-08-22 19:20:34,861][0m Trial 47 pruned. [0m
epoch 0 0.011362322711988004 23.04113649654464
Trial Id: 48 | Model params: 4217 | Timestamp: 2021-08-22 19:20:34.862041

epoch 0 -31.555296284418134 132.22366035764446
epoch 5 -31.555296284418134 132.22366035764446
epoch 10 -31.555296284418134 132.22366035764446
epoch 15 -31.555296284418134 132.22366035764446
epoch 20 -31.555296284418134 132.22366035764446
epoch 25 -31.555296284418134 132.22366035764446
epoch 30 -31.555296284418134 132.22366035764446
epoch 35 -31.555296284418134 132.22366035764446
epoch 40 -31.555296284418134 132.22366035764446
epoch 45 -31.555296284418134 132.22366035764446
epoch 50 -31.555296284418134 132.22366035764446
epoch 55 -31.555296284418134 132.22366035764446
epoch 60 -31.555296284418134 132.22366035764446
[32m[I 2021-08-22 19:55:37,001][0m Trial 48 finished with value: 132.22366035764446 and parameters: {'n_layers_mlp': 4, 'mlp_n_units_l0': 72, 'mlp_dropout_l0': 0.21952315773302253, 'mlp_n_units_l1': 29, 'mlp_dropout_l1': 0.27624111221268727, 'mlp_n_units_l2': 17, 'mlp_dropout_l2': 0.26315079664456414, 'mlp_n_units_l3': 23, 'mlp_dropout_l3': 0.12610825452807592, 'lr': 0.002541751047906203, 'criterion': 'MSELoss', 'batch_size': 16, 'no_epochs': 63}. Best is trial 12 with value: 20.28013345328479.[0m
Trial Id: 49 | Model params: 2199 | Timestamp: 2021-08-22 19:55:37.001381

[32m[I 2021-08-22 19:55:55,169][0m Trial 49 pruned. [0m
epoch 0 0.06694654658808596 22.38404551636212
Trial Id: 50 | Model params: 3683 | Timestamp: 2021-08-22 19:55:55.169540

[32m[I 2021-08-22 19:56:12,866][0m Trial 50 pruned. [0m
epoch 0 0.03478856781788753 22.766514514775977
Trial Id: 51 | Model params: 7393 | Timestamp: 2021-08-22 19:56:12.866513

[32m[I 2021-08-22 19:56:30,420][0m Trial 51 pruned. [0m
epoch 0 -0.01487776994848966 23.344909132215808
Trial Id: 52 | Model params: 7135 | Timestamp: 2021-08-22 19:56:30.420777

[32m[I 2021-08-22 19:56:48,188][0m Trial 52 pruned. [0m
epoch 0 0.04431498494167507 22.653885762669322
Trial Id: 53 | Model params: 5408 | Timestamp: 2021-08-22 19:56:48.188669

[32m[I 2021-08-22 19:57:05,466][0m Trial 53 pruned. [0m
epoch 0 -0.002357552509829608 23.200462972313723
Trial Id: 54 | Model params: 7467 | Timestamp: 2021-08-22 19:57:05.466525

epoch 0 -31.557464881806133 132.22409656342933
epoch 5 -31.557464881806133 132.22409656342933
epoch 10 -31.557464881806133 132.22409656342933
epoch 15 -31.557464881806133 132.22409656342933
epoch 20 -31.557464881806133 132.22409656342933
epoch 25 -31.557464881806133 132.22409656342933
epoch 30 -31.557464881806133 132.22409656342933
epoch 35 -31.557464881806133 132.22409656342933
epoch 40 -31.557464881806133 132.22409656342933
epoch 45 -31.557464881806133 132.22409656342933
epoch 50 -31.557464881806133 132.22409656342933
epoch 55 -31.557464881806133 132.22409656342933
epoch 60 -31.557464881806133 132.22409656342933
[32m[I 2021-08-22 20:16:32,826][0m Trial 54 finished with value: 132.22409656342933 and parameters: {'n_layers_mlp': 4, 'mlp_n_units_l0': 22, 'mlp_dropout_l0': 0.02974337078040193, 'mlp_n_units_l1': 46, 'mlp_dropout_l1': 0.08744705521060345, 'mlp_n_units_l2': 80, 'mlp_dropout_l2': 0.09383601996398742, 'mlp_n_units_l3': 28, 'mlp_dropout_l3': 0.16748950488523234, 'lr': 0.00012416221214741122, 'criterion': 'MSELoss', 'batch_size': 32, 'no_epochs': 66}. Best is trial 12 with value: 20.28013345328479.[0m
epoch 65 -31.557464881806133 132.22409656342933
Trial Id: 55 | Model params: 4031 | Timestamp: 2021-08-22 20:16:32.826911

[32m[I 2021-08-22 20:16:50,559][0m Trial 55 pruned. [0m
epoch 0 -0.3865593798354683 27.286922316892916
Trial Id: 56 | Model params: 6162 | Timestamp: 2021-08-22 20:16:50.560136

[32m[I 2021-08-22 20:17:08,492][0m Trial 56 pruned. [0m
epoch 0 0.07536222680289562 22.282870357801357
Trial Id: 57 | Model params: 8761 | Timestamp: 2021-08-22 20:17:08.492485

[32m[I 2021-08-22 20:17:11,445][0m Trial 57 pruned. [0m
epoch 0 -31.518863509023923 132.1456883482631
Trial Id: 58 | Model params: 4681 | Timestamp: 2021-08-22 20:17:11.445527

epoch 0 -31.557464881806133 132.22409656342933
epoch 5 0.03459224712193709 22.768829712553288
epoch 10 0.0778087217534904 22.2533717587913
epoch 15 0.06179312876888854 22.445775900834292
epoch 20 0.1065535119741623 21.903806336106413
epoch 25 0.10620896754355069 21.908029368566893
epoch 30 0.14693368432985443 21.403101683809382
epoch 35 0.17227765254324667 21.08276938953732
epoch 40 0.16449273249998841 21.181681521136444
epoch 45 0.15364910438880441 21.31869159732931
epoch 50 0.15710956671319432 21.27506424833216
epoch 55 0.17013531765423806 21.110035274712473
epoch 60 0.17142405112261172 21.09363755360963
[32m[I 2021-08-22 20:35:33,463][0m Trial 58 finished with value: 20.96781681730018 and parameters: {'n_layers_mlp': 4, 'mlp_n_units_l0': 10, 'mlp_dropout_l0': 0.1489011383244075, 'mlp_n_units_l1': 37, 'mlp_dropout_l1': 0.15796465391315626, 'mlp_n_units_l2': 57, 'mlp_dropout_l2': 0.07470517254681198, 'mlp_n_units_l3': 33, 'mlp_dropout_l3': 0.28598836863341304, 'lr': 0.00040397424262139745, 'criterion': 'MSELoss', 'batch_size': 32, 'no_epochs': 62}. Best is trial 12 with value: 20.28013345328479.[0m
Trial Id: 59 | Model params: 6399 | Timestamp: 2021-08-22 20:35:33.463717

epoch 0 -31.555296284418134 132.22366035764446
epoch 5 -31.555296284418134 132.22366035764446
epoch 10 -31.555296284418134 132.22366035764446
epoch 15 -31.555296284418134 132.22366035764446
epoch 20 0.04419536506516286 22.65598328486555
epoch 25 0.16228477474917358 21.21028742886988
epoch 30 0.12848585969435966 21.633937388270766
epoch 35 0.17914497094100346 20.99575910007582
epoch 40 0.19228298943805855 20.827059805501396
epoch 45 0.13907755163075086 21.502074662840556
epoch 50 0.21227399943699699 20.567709977820268
epoch 55 0.1731985778580536 21.071670035268923
epoch 60 0.20173595395780153 20.704828330867144
[32m[I 2021-08-22 21:10:06,155][0m Trial 59 finished with value: 21.154689578440923 and parameters: {'n_layers_mlp': 4, 'mlp_n_units_l0': 45, 'mlp_dropout_l0': 0.12614475796181057, 'mlp_n_units_l1': 35, 'mlp_dropout_l1': 0.1243955297619036, 'mlp_n_units_l2': 58, 'mlp_dropout_l2': 0.07124382936748455, 'mlp_n_units_l3': 33, 'mlp_dropout_l3': 0.29607140053773523, 'lr': 0.00035453702368033264, 'criterion': 'MSELoss', 'batch_size': 16, 'no_epochs': 62}. Best is trial 12 with value: 20.28013345328479.[0m
Study statistics: 
  Number of finished trials:  60
  Number of pruned trials:  36
  Number of complete trials:  24

Best trial:
  Value:  20.28013345328479
  Params: 
    n_layers_mlp: 4
    mlp_n_units_l0: 51
    mlp_dropout_l0: 0.10182401746071842
    mlp_n_units_l1: 19
    mlp_dropout_l1: 0.1840132160220217
    mlp_n_units_l2: 72
    mlp_dropout_l2: 0.21087378232566856
    mlp_n_units_l3: 33
    mlp_dropout_l3: 0.0041619017122395685
    lr: 0.0007693503935423424
    criterion: MSELoss
    batch_size: 32
    no_epochs: 72
Target 37144 0 274.0 1.0 130.18977493000216
[ 97. 150. 113. ... 133. 123. 139.]
Prediction 37144 0 167.02001953125 27.001218795776367 130.26666892743074
[120.15196228 142.13198853 130.71217346 ... 128.60813904 125.87666321
 142.090271  ]

 XXXXXX======== TRIAL south - elg ended

Test Set - R-squared:  0.2253363138791018
Test Set - RMSE:  20.47184349326721
Test Set - MAE:  15.781421030951604



[32m[I 2021-08-22 21:10:38,191][0m A new study created in memory with name: NeuralNetwork[0m
++++++++ Session Characteristics +++++++

Area: south
Gal Type: qso
Training Samples: 118859
Validation Samples: 29715
Test Samples: 37144
Number of features: 15
Device: cuda:0
Number of Workers: 8
Number of Trials: 60

+++++++++++++++++++++++++++++++++++++++
Trial Id: 0 | Model params: 7437 | Timestamp: 2021-08-22 21:10:38.192086

epoch 0 -0.12299091874765966 29.37892808000804
epoch 5 -1.5571625812181633 44.332987083609325
epoch 10 -1.628900787753166 44.95054091435048
epoch 15 -1.9507946389571225 47.623062130396335
epoch 20 -1.851104080152882 46.81169424496871
epoch 25 -1.7675632534046173 46.12077556045571
epoch 30 -1.7103770612240177 45.64179126547033
epoch 35 -1.6555682482871883 45.17795386380254
epoch 40 -1.5553634598905952 44.31738884648661
epoch 45 -1.4177604393210972 43.1076608618773
epoch 50 -1.404551655124608 42.98974603405356
epoch 55 -1.39125747403539 42.870741395801225
epoch 60 -1.4497211477289125 43.39164847980299
epoch 65 -1.2326456629297704 41.4245429447278
epoch 70 -1.244672252060126 41.53596386100633
epoch 75 -0.9597907070413609 38.810806797035106
epoch 80 -0.8709924806715577 37.92135481666955
epoch 85 -1.1223503530396997 40.38837341015834
epoch 90 -0.8416665689144398 37.62299165349506
epoch 95 -1.1927417022595916 41.052684543195355
[32m[I 2021-08-22 21:15:40,813][0m Trial 0 finished with value: 38.91421564644365 and parameters: {'n_layers_mlp': 4, 'mlp_n_units_l0': 67, 'mlp_dropout_l0': 0.04812958905538086, 'mlp_n_units_l1': 63, 'mlp_dropout_l1': 0.13428990250946982, 'mlp_n_units_l2': 21, 'mlp_dropout_l2': 0.25852206291124147, 'mlp_n_units_l3': 32, 'mlp_dropout_l3': 0.006012957938686358, 'lr': 0.0004385551719180354, 'weight_decay': 0.11095587066443705, 'batch_size': 256}. Best is trial 0 with value: 38.91421564644365.[0m
Trial Id: 1 | Model params: 719 | Timestamp: 2021-08-22 21:15:40.813785

epoch 0 -29.699950161814783 153.6209956611404
epoch 5 -0.14634041204870618 29.685101744945744
epoch 10 -0.065727720765133 28.622322549867455
epoch 15 -0.028107250987942978 28.112595994873963
epoch 20 -0.008849857434996888 27.84806402954166
epoch 25 0.0010152417921054369 27.7115725497375
epoch 30 0.01266693920609896 27.549491052813273
epoch 35 0.015053125999067385 27.516180105662755
epoch 40 0.01905642873927882 27.46020360497482
epoch 45 0.020738186821058102 27.436654222844155
epoch 50 0.022843596735450444 27.407143991094255
epoch 55 0.029899231458825892 27.308017008142365
epoch 60 0.03107997944460661 27.291393114817872
epoch 65 0.02841544327221035 27.328893102882414
epoch 70 0.031322086958796125 27.28798320274357
epoch 75 0.028432909885507618 27.328647449866555
epoch 80 0.029094020256030806 27.31934787242512
epoch 85 0.02920841502952054 27.317738405217696
epoch 90 0.029755098611710662 27.310045578875265
epoch 95 0.02942598694329801 27.314677034595146
[32m[I 2021-08-22 22:00:58,921][0m Trial 1 finished with value: 27.318709592643213 and parameters: {'n_layers_mlp': 2, 'mlp_n_units_l0': 13, 'mlp_dropout_l0': 0.28654364832283113, 'mlp_n_units_l1': 34, 'mlp_dropout_l1': 0.06937406682048995, 'lr': 1.887775031443658e-05, 'weight_decay': 0.26624706074204796, 'batch_size': 16}. Best is trial 1 with value: 27.318709592643213.[0m
Trial Id: 2 | Model params: 4049 | Timestamp: 2021-08-22 22:00:58.922377

epoch 0 0.03549966231425539 27.226951387926466
epoch 5 0.04953303143690935 27.028151100323775
epoch 10 0.08715629261195812 26.487809053536413
epoch 15 0.056468201602031365 26.929363865395832
epoch 20 0.10170849227440404 26.27583166467497
epoch 25 0.11407938647082771 26.094274544368457
epoch 30 0.09217989246185554 26.414824089599573
epoch 35 0.11351493702477111 26.102585985182877
epoch 40 0.1258049533689457 25.921014476294978
epoch 45 0.09825483060338236 26.326294557084143
epoch 50 0.12484739300172387 25.935207042917508
epoch 55 0.1091155886340992 26.167275315601923
epoch 60 0.12522785672792192 25.929568895865117
epoch 65 0.12548034872972302 25.92582650345877
epoch 70 0.1358233033750591 25.772057961463045
epoch 75 0.12012436609535126 26.005096486727574
epoch 80 0.13468583468385487 25.789013561569202
epoch 85 0.11831517470202113 26.03181846581207
epoch 90 0.12459811715161329 25.938900433320498
epoch 95 0.12512790415664843 25.931050226217145
[32m[I 2021-08-22 22:24:17,666][0m Trial 2 finished with value: 25.9001878893255 and parameters: {'n_layers_mlp': 2, 'mlp_n_units_l0': 78, 'mlp_dropout_l0': 0.25339941493751317, 'mlp_n_units_l1': 35, 'mlp_dropout_l1': 0.04151649821419453, 'lr': 0.004293850183621821, 'weight_decay': 0.16124178861329327, 'batch_size': 32}. Best is trial 2 with value: 25.9001878893255.[0m
Trial Id: 3 | Model params: 1373 | Timestamp: 2021-08-22 22:24:17.666174

epoch 0 0.021467662936654364 27.426433201066224
epoch 5 0.042900686688084444 27.124406397320573
epoch 10 0.1010110156423667 26.28808349289837
epoch 15 0.0913858790104175 26.42843712166288
epoch 20 0.10064283658659334 26.293466056619792
epoch 25 0.09529506735533633 26.371523466575447
epoch 30 0.10053707561428316 26.295012016834463
epoch 35 0.09969230826682907 26.307357136237112
epoch 40 0.10556209071982126 26.22145818131799
epoch 45 0.10387985358416929 26.246104939431984
epoch 50 0.09697745401148361 26.34699185244722
epoch 55 0.10450001018292254 26.237021608214494
epoch 60 0.09747506540345197 26.339731585251855
epoch 65 0.10134997014079827 26.28312720068118
epoch 70 0.10417926341073913 26.241719925730184
epoch 75 0.09095436817911562 26.434711954367177
epoch 80 0.10247922986300162 26.266608085312228
epoch 85 0.09792354602187736 26.333186432576806
epoch 90 0.10282023995114942 26.261617655223635
epoch 95 0.09832055267951334 26.32739113618224
[32m[I 2021-08-22 23:09:29,170][0m Trial 3 finished with value: 26.307289963739137 and parameters: {'n_layers_mlp': 2, 'mlp_n_units_l0': 50, 'mlp_dropout_l0': 0.09200641248496062, 'mlp_n_units_l1': 11, 'mlp_dropout_l1': 0.13428061447195191, 'lr': 0.006642905548832902, 'weight_decay': 0.014104413708446138, 'batch_size': 16}. Best is trial 2 with value: 25.9001878893255.[0m
Trial Id: 4 | Model params: 7386 | Timestamp: 2021-08-22 23:09:29.170221

epoch 0 -32.79744155873155 161.1720525691853
epoch 5 -0.011122299713073769 27.877233209861778
epoch 10 -0.019967478586326637 27.998901082736516
epoch 15 -0.026708950647158947 28.09127802018217
epoch 20 -0.029602600259279077 28.1308360285436
epoch 25 0.028368317091214568 27.32742165104701
epoch 30 0.033271646640647745 27.258380657472546
epoch 35 0.02272068406133676 27.40672723150468
epoch 40 0.045395840319543024 27.08691127363685
epoch 45 0.049057332718088986 27.03491390689555
epoch 50 0.029517315116184384 27.31125892072625
epoch 55 0.05620800126106318 26.933076801542448
epoch 60 0.06917800482472158 26.74737351371517
epoch 65 0.0811508240433334 26.57479597857358
epoch 70 0.0721245691309389 26.705004872379845
epoch 75 0.07270667893270333 26.696626762858063
epoch 80 0.06745317269520001 26.772143758233465
epoch 85 0.09214380492195495 26.41534910360689
epoch 90 0.07221907042482689 26.70364492594213
epoch 95 0.08636499129153286 26.49928708520961
[32m[I 2021-08-22 23:18:18,198][0m Trial 4 finished with value: 26.28635639955287 and parameters: {'n_layers_mlp': 4, 'mlp_n_units_l0': 64, 'mlp_dropout_l0': 0.14519987839636497, 'mlp_n_units_l1': 57, 'mlp_dropout_l1': 0.18544822648701367, 'mlp_n_units_l2': 19, 'mlp_dropout_l2': 0.178102166346044, 'mlp_n_units_l3': 74, 'mlp_dropout_l3': 0.20848489691547492, 'lr': 0.00030017117518079983, 'weight_decay': 0.15572016950233286, 'batch_size': 128}. Best is trial 2 with value: 25.9001878893255.[0m
Trial Id: 5 | Model params: 2308 | Timestamp: 2021-08-22 23:18:18.198474

[32m[I 2021-08-22 23:18:23,491][0m Trial 5 pruned. [0m
epoch 0 0.017777337664074522 27.47595516415473
Trial Id: 6 | Model params: 4527 | Timestamp: 2021-08-22 23:18:23.491650

epoch 0 -0.1615446119137347 29.87898025053018
epoch 5 0.06762584681420325 26.76966502460937
epoch 10 0.10671278559322195 26.202539413887276
epoch 15 0.11954189395032744 26.013702667949584
epoch 20 0.15003181692556034 25.55931194398667
epoch 25 0.14777162917120545 25.59327232748881
epoch 30 0.1683171041622814 25.28288963743408
epoch 35 0.15742194693653655 25.447955419163367
epoch 40 0.1569994054568744 25.45433552183637
epoch 45 0.17115505288326704 25.23971641677987
epoch 50 0.16456415753207376 25.339869608342912
epoch 55 0.15927780289101268 25.419914234156266
epoch 60 0.17249428280295775 25.219317276627613
epoch 65 0.1726916166366974 25.216310094208104
epoch 70 0.17602862960994048 25.165402729609195
epoch 75 0.17667116702756136 25.155588756089024
epoch 80 0.17294032478113075 25.212519504610682
epoch 85 0.1817545479664835 25.07781094212566
epoch 90 0.17597281191297143 25.166255096017775
epoch 95 0.17192646028593095 25.227968359150452
