[32m[I 2021-08-22 08:23:20,692][0m Trial 1 finished with value: 27.164951626310447 and parameters: {'n_layers_mlp': 2, 'mlp_n_units_l0': 26, 'mlp_dropout_l0': 0.03598950541698805, 'mlp_n_units_l1': 61, 'mlp_dropout_l1': 0.18963350403146004, 'lr': 9.091501883850752e-05, 'criterion': 'L1Loss', 'batch_size': 32, 'no_epochs': 45}. Best is trial 1 with value: 27.164951626310447.[0m
Trial Id: 2 | Model params: 2108 | Timestamp: 2021-08-22 08:23:20.692818

epoch 0 -0.05259234851921146 29.432491793501708
epoch 5 0.021506440641407942 28.377616346358614
epoch 10 0.11262481573004801 27.024058161239388
epoch 15 0.1262251120127058 26.81616732125771
epoch 20 0.12167105874582151 26.885958491869584
epoch 25 0.11982006305025461 26.914273397317412
epoch 30 0.13816143662226743 26.632374470360418
epoch 35 0.14407741981063515 26.54080976185248
epoch 40 0.14521390880152862 26.523183543003395
epoch 45 0.142379332483899 26.567124222228333
epoch 50 0.13244455590229975 26.72055946212991
epoch 55 0.14918901267418483 26.46143986673576
epoch 60 0.051458623196312336 27.939914150268596
epoch 65 0.12881390151498917 26.77641285500367
epoch 70 0.11319180898540726 27.01542319636991
[32m[I 2021-08-22 08:41:04,505][0m Trial 2 finished with value: 26.45581733714406 and parameters: {'n_layers_mlp': 2, 'mlp_n_units_l0': 21, 'mlp_dropout_l0': 0.2481551783553626, 'mlp_n_units_l1': 77, 'mlp_dropout_l1': 0.015155537552589504, 'lr': 0.0059739578840763, 'criterion': 'L1Loss', 'batch_size': 16, 'no_epochs': 73}. Best is trial 2 with value: 26.45581733714406.[0m
Trial Id: 3 | Model params: 15310 | Timestamp: 2021-08-22 08:41:04.505320

epoch 0 0.08895730778877009 27.386927004834714
epoch 5 0.09060883522972774 27.362092395721195
epoch 10 0.10349321578399728 27.167565952218666
epoch 15 0.14275644707651447 26.56599298544282
epoch 20 0.13884807862384152 26.62648431941992
epoch 25 0.14339070707538293 26.556163302567068
epoch 30 0.15105716177819828 26.43706046357018
epoch 35 0.14184257326063132 26.580149696390905
epoch 40 0.13050546854765166 26.755148592548423
epoch 45 0.14789522811293865 26.486247838971252
epoch 50 0.1391580647316102 26.621691562797256
epoch 55 0.13916084292741882 26.62164860466025
[32m[I 2021-08-22 08:50:27,143][0m Trial 3 finished with value: 26.50255326245175 and parameters: {'n_layers_mlp': 4, 'mlp_n_units_l0': 62, 'mlp_dropout_l0': 0.24319850077472321, 'mlp_n_units_l1': 59, 'mlp_dropout_l1': 0.09600867974481193, 'mlp_n_units_l2': 78, 'mlp_dropout_l2': 0.1276042690528326, 'mlp_n_units_l3': 74, 'mlp_dropout_l3': 0.11414990570594025, 'lr': 0.004784401538361221, 'criterion': 'L1Loss', 'batch_size': 32, 'no_epochs': 59}. Best is trial 2 with value: 26.45581733714406.[0m
Trial Id: 4 | Model params: 2272 | Timestamp: 2021-08-22 08:50:27.143502

epoch 0 -28.413143530991306 155.33401444760537
epoch 5 -27.209182502528375 152.12167384373524
epoch 10 -24.145250052956648 143.6229439484305
epoch 15 -19.21645346721305 128.77997321412494
epoch 20 -13.024353742349808 107.25987190736087
epoch 25 -6.724523578692271 79.60341450754105
epoch 30 -2.1127225690980853 50.53194938538733
epoch 35 -0.43613440764266076 34.323643998120346
epoch 40 -0.29279115353694896 32.56567099539681
epoch 45 -0.24382493303050512 31.942983288227502
epoch 50 -0.19833729826738367 31.353453460656368
epoch 55 -0.16183689197708273 30.87226023728453
epoch 60 -0.1309561802119441 30.459216951231287
epoch 65 -0.1038170385549877 30.09153845342129
[32m[I 2021-08-22 08:53:11,213][0m Trial 4 finished with value: 29.806041328300903 and parameters: {'n_layers_mlp': 2, 'mlp_n_units_l0': 47, 'mlp_dropout_l0': 0.05628478012636856, 'mlp_n_units_l1': 31, 'mlp_dropout_l1': 0.22385080263684645, 'lr': 1.676397883455634e-05, 'criterion': 'MSELoss', 'batch_size': 128, 'no_epochs': 71}. Best is trial 2 with value: 26.45581733714406.[0m
epoch 70 -0.08297120222037657 29.806041328300903
Trial Id: 5 | Model params: 931 | Timestamp: 2021-08-22 08:53:11.213433

epoch 0 -28.373658440894236 155.19791567258227
epoch 5 -28.18312938691889 154.6937595689015
epoch 10 -27.660895821399937 153.30338498668488
epoch 15 -26.734527079013272 150.8055227668656
epoch 20 -25.364612437768393 147.03392810032716
epoch 25 -23.56922259042396 141.9392713771325
epoch 30 -21.376948688596364 135.45882279859637
epoch 35 -18.836996164416234 127.53953191126352
epoch 40 -16.02273603297207 118.1466865922004
epoch 45 -13.01736493264662 107.21117458384582
[32m[I 2021-08-22 08:54:26,356][0m Trial 5 finished with value: 94.92624323359011 and parameters: {'n_layers_mlp': 2, 'mlp_n_units_l0': 35, 'mlp_dropout_l0': 0.08420081157500249, 'mlp_n_units_l1': 10, 'mlp_dropout_l1': 0.16848528123256304, 'lr': 2.4076688852897878e-05, 'criterion': 'MSELoss', 'batch_size': 256, 'no_epochs': 51}. Best is trial 2 with value: 26.45581733714406.[0m
epoch 50 -9.989017357286123 94.92624323359011
Trial Id: 6 | Model params: 1176 | Timestamp: 2021-08-22 08:54:26.357176

[32m[I 2021-08-22 08:54:28,645][0m Trial 6 pruned. [0m
epoch 0 -0.20876517317599208 31.489576108877692
Trial Id: 7 | Model params: 3838 | Timestamp: 2021-08-22 08:54:28.646022

[32m[I 2021-08-22 08:54:46,770][0m Trial 7 pruned. [0m
epoch 0 0.004193811385610036 28.627560272651426
Trial Id: 8 | Model params: 3929 | Timestamp: 2021-08-22 08:54:46.770674

[32m[I 2021-08-22 08:54:48,196][0m Trial 8 pruned. [0m
epoch 0 -0.03800737600041959 29.17474601013328
Trial Id: 9 | Model params: 5609 | Timestamp: 2021-08-22 08:54:48.196893

[32m[I 2021-08-22 08:54:57,818][0m Trial 9 pruned. [0m
epoch 0 -0.21795328028097782 31.665711782322283
Trial Id: 10 | Model params: 8799 | Timestamp: 2021-08-22 08:54:57.818536

epoch 0 -28.36976701056943 155.47020738590203
epoch 5 -28.36976701056943 155.47020738590203
epoch 10 -28.36976701056943 155.47020738590203
epoch 15 -28.36976701056943 155.47020738590203
epoch 20 -28.36976701056943 155.47020738590203
epoch 25 -28.36976701056943 155.47020738590203
epoch 30 -28.36976701056943 155.47020738590203
epoch 35 -28.36976701056943 155.47020738590203
epoch 40 -28.36976701056943 155.47020738590203
epoch 45 -28.36976701056943 155.47020738590203
epoch 50 -28.36976701056943 155.47020738590203
epoch 55 -28.36976701056943 155.47020738590203
epoch 60 -28.36976701056943 155.47020738590203
epoch 65 -28.36976701056943 155.47020738590203
[32m[I 2021-08-22 09:15:25,584][0m Trial 10 finished with value: 155.47020738590203 and parameters: {'n_layers_mlp': 4, 'mlp_n_units_l0': 13, 'mlp_dropout_l0': 0.20627565747148008, 'mlp_n_units_l1': 79, 'mlp_dropout_l1': 0.004915236448007065, 'mlp_n_units_l2': 76, 'mlp_dropout_l2': 0.24908552257847894, 'mlp_n_units_l3': 18, 'mlp_dropout_l3': 0.2876251373638174, 'lr': 0.00027185465294783336, 'criterion': 'L1Loss', 'batch_size': 16, 'no_epochs': 68}. Best is trial 2 with value: 26.45581733714406.[0m
Trial Id: 11 | Model params: 16825 | Timestamp: 2021-08-22 09:15:25.585178

epoch 0 -28.361274805710917 155.475296513547
epoch 5 -28.361274805710917 155.475296513547
epoch 10 -28.361274805710917 155.475296513547
epoch 15 -28.361274805710917 155.475296513547
epoch 20 -28.361274805710917 155.475296513547
epoch 25 -28.361274805710917 155.475296513547
epoch 30 -28.361274805710917 155.475296513547
epoch 35 -28.361274805710917 155.475296513547
epoch 40 -28.361274805710917 155.475296513547
epoch 45 -28.361274805710917 155.475296513547
epoch 50 -28.361274805710917 155.475296513547
epoch 55 -28.361274805710917 155.475296513547
epoch 60 -28.361274805710917 155.475296513547
[32m[I 2021-08-22 09:25:15,774][0m Trial 11 finished with value: 155.475296513547 and parameters: {'n_layers_mlp': 4, 'mlp_n_units_l0': 60, 'mlp_dropout_l0': 0.29034211743150284, 'mlp_n_units_l1': 66, 'mlp_dropout_l1': 0.08679937503311007, 'mlp_n_units_l2': 80, 'mlp_dropout_l2': 0.1425504632295223, 'mlp_n_units_l3': 79, 'mlp_dropout_l3': 0.08063813737800202, 'lr': 0.007262513366327627, 'criterion': 'L1Loss', 'batch_size': 32, 'no_epochs': 62}. Best is trial 2 with value: 26.45581733714406.[0m
Trial Id: 12 | Model params: 11189 | Timestamp: 2021-08-22 09:25:15.774757

[32m[I 2021-08-22 09:25:33,964][0m Trial 12 pruned. [0m
epoch 0 0.0697518802858178 27.66918248644342
Trial Id: 13 | Model params: 12221 | Timestamp: 2021-08-22 09:25:33.964515

[32m[I 2021-08-22 09:25:43,673][0m Trial 13 pruned. [0m
epoch 0 0.11505724775878046 26.991780167858007
Trial Id: 14 | Model params: 9765 | Timestamp: 2021-08-22 09:25:43.674002

[32m[I 2021-08-22 09:25:53,485][0m Trial 14 pruned. [0m
epoch 0 0.09637069917833319 27.275272124864312
Trial Id: 15 | Model params: 4469 | Timestamp: 2021-08-22 09:25:53.486067

[32m[I 2021-08-22 09:26:08,115][0m Trial 15 pruned. [0m
epoch 0 -0.0005711464345208306 28.695970334633213
Trial Id: 16 | Model params: 1641 | Timestamp: 2021-08-22 09:26:08.115760

[32m[I 2021-08-22 09:26:15,222][0m Trial 16 pruned. [0m
epoch 0 0.005799658778812167 28.609541234002304
Trial Id: 17 | Model params: 12863 | Timestamp: 2021-08-22 09:26:15.222211

[32m[I 2021-08-22 09:26:18,049][0m Trial 17 pruned. [0m
epoch 0 0.06805099547294724 27.649795243988482
Trial Id: 18 | Model params: 10104 | Timestamp: 2021-08-22 09:26:18.049569

[32m[I 2021-08-22 09:26:36,237][0m Trial 18 pruned. [0m
epoch 0 -0.1464220105711207 30.7163201183956
Trial Id: 19 | Model params: 2147 | Timestamp: 2021-08-22 09:26:36.237991

epoch 0 -28.26284677291104 154.9048982032824
epoch 5 -5.008943594482888 70.19495948784203
epoch 10 -0.24095249598894664 31.899541619372293
epoch 15 -0.15348302022043425 30.754768832170903
epoch 20 -0.08465389870284556 29.82307734668481
epoch 25 -0.041579197096848874 29.224898583515138
epoch 30 -0.017043200609263565 28.87862853139334
epoch 35 -0.0011641251790659446 28.652300915064554
epoch 40 0.01264741786517476 28.453978380394517
epoch 45 0.02275229506964649 28.30800043689705
epoch 50 0.03511936645829494 28.12831123794244
epoch 55 0.03402825541578414 28.144210841617014
epoch 60 0.04609512766200141 27.967870342357873
[32m[I 2021-08-22 09:28:14,059][0m Trial 19 finished with value: 27.943957957850845 and parameters: {'n_layers_mlp': 2, 'mlp_n_units_l0': 31, 'mlp_dropout_l0': 0.23101191625576073, 'mlp_n_units_l1': 50, 'mlp_dropout_l1': 0.07145905877796732, 'lr': 0.0001025936157959832, 'criterion': 'L1Loss', 'batch_size': 256, 'no_epochs': 65}. Best is trial 2 with value: 26.45581733714406.[0m
Trial Id: 20 | Model params: 4453 | Timestamp: 2021-08-22 09:28:14.059359

[32m[I 2021-08-22 09:28:28,561][0m Trial 20 pruned. [0m
epoch 0 0.0770126093089194 27.56098985472522
Trial Id: 21 | Model params: 1894 | Timestamp: 2021-08-22 09:28:28.561430

[32m[I 2021-08-22 09:28:36,245][0m Trial 21 pruned. [0m
epoch 0 -12.855246939264406 106.80241551603658
Trial Id: 22 | Model params: 2492 | Timestamp: 2021-08-22 09:28:36.245313

[32m[I 2021-08-22 09:28:43,908][0m Trial 22 pruned. [0m
epoch 0 -0.1904307770451481 31.30588698327165
Trial Id: 23 | Model params: 2839 | Timestamp: 2021-08-22 09:28:43.908791

[32m[I 2021-08-22 09:28:51,392][0m Trial 23 pruned. [0m
epoch 0 -22.4803451823995 139.03565218942276
Trial Id: 24 | Model params: 1250 | Timestamp: 2021-08-22 09:28:51.392611

[32m[I 2021-08-22 09:28:58,926][0m Trial 24 pruned. [0m
epoch 0 -8.578785812549532 88.80331353173736
Trial Id: 25 | Model params: 2318 | Timestamp: 2021-08-22 09:28:58.927190

[32m[I 2021-08-22 09:29:06,713][0m Trial 25 pruned. [0m
epoch 0 -0.2439983497937619 32.00249526265944
Trial Id: 26 | Model params: 1139 | Timestamp: 2021-08-22 09:29:06.713339

[32m[I 2021-08-22 09:29:14,392][0m Trial 26 pruned. [0m
epoch 0 -23.755395993562164 142.76076902175407
Trial Id: 27 | Model params: 13191 | Timestamp: 2021-08-22 09:29:14.392335

[32m[I 2021-08-22 09:29:32,362][0m Trial 27 pruned. [0m
epoch 0 0.12249018804605016 26.873418649217797
Trial Id: 28 | Model params: 5341 | Timestamp: 2021-08-22 09:29:32.362327

[32m[I 2021-08-22 09:29:39,884][0m Trial 28 pruned. [0m
epoch 0 -0.15368244986857116 30.81889639658877
Trial Id: 29 | Model params: 2226 | Timestamp: 2021-08-22 09:29:39.884605

epoch 0 -28.31798770029909 155.08254674635148
epoch 5 -19.38616078897816 129.31936630204817
epoch 10 -1.9843989188314173 49.47938376952385
epoch 15 -0.3023752996776983 32.68616138419008
epoch 20 -0.22389770424188327 31.68607203840451
epoch 25 -0.1507698481342763 30.724871999109048
epoch 30 -0.10138459780259002 30.058364362455077
epoch 35 -0.07243457321523494 29.66068989711988
epoch 40 -0.04546256665151871 29.2853277477499
epoch 45 -0.031132400428434126 29.083928074295557
[32m[I 2021-08-22 09:31:37,170][0m Trial 29 finished with value: 28.924233498153885 and parameters: {'n_layers_mlp': 2, 'mlp_n_units_l0': 35, 'mlp_dropout_l0': 0.2673927690564805, 'mlp_n_units_l1': 45, 'mlp_dropout_l1': 0.23049663471873627, 'lr': 3.599396128888716e-05, 'criterion': 'L1Loss', 'batch_size': 128, 'no_epochs': 50}. Best is trial 2 with value: 26.45581733714406.[0m
Trial Id: 30 | Model params: 5951 | Timestamp: 2021-08-22 09:31:37.170689

epoch 0 -28.319764482536165 155.0554739308044
epoch 5 -0.16765626914292442 30.943139251068448
epoch 10 -0.10103848774909485 30.047484114309576
epoch 15 -0.053746333851286465 29.395097320818838
epoch 20 -0.021426519141590772 28.94079311321969
epoch 25 -0.01112741829888697 28.79451763353248
epoch 30 0.00944816958545902 28.500039798404387
epoch 35 0.024186572486411873 28.287219403648773
epoch 40 0.024130353925700065 28.288034233519234
epoch 45 0.03770871696140565 28.090543360597167
[32m[I 2021-08-22 09:33:02,040][0m Trial 30 finished with value: 28.03523645173245 and parameters: {'n_layers_mlp': 4, 'mlp_n_units_l0': 29, 'mlp_dropout_l0': 0.24762298099852623, 'mlp_n_units_l1': 74, 'mlp_dropout_l1': 0.17755185270098212, 'mlp_n_units_l2': 26, 'mlp_dropout_l2': 0.07282195126732363, 'mlp_n_units_l3': 47, 'mlp_dropout_l3': 0.009560285499897153, 'lr': 4.507380151200942e-05, 'criterion': 'L1Loss', 'batch_size': 256, 'no_epochs': 48}. Best is trial 2 with value: 26.45581733714406.[0m
Trial Id: 31 | Model params: 2145 | Timestamp: 2021-08-22 09:33:02.041204

[32m[I 2021-08-22 09:33:03,512][0m Trial 31 pruned. [0m
epoch 0 -28.24711686385834 154.86325892747135
Trial Id: 32 | Model params: 1294 | Timestamp: 2021-08-22 09:33:03.512996

epoch 0 -28.3998827076105 155.26717915151247
epoch 5 -23.478143013782134 141.67593842144282
epoch 10 -7.990470335878564 85.86142070709124
epoch 15 -0.3709849017072764 33.529200672003455
epoch 20 -0.28042875746524065 32.402951727792775
epoch 25 -0.21522461752308875 31.567133243628763
epoch 30 -0.15030328395599124 30.712349681024744
epoch 35 -0.10525004502149837 30.10489623923044
epoch 40 -0.06858152525940087 29.601293890200854
epoch 45 -0.041028597210003515 29.21717312538515
epoch 50 -0.030517716420006558 29.069301430500005
epoch 55 -0.018375399668208336 28.89753603285139
epoch 60 -0.014360334319539314 28.84051379788779
[32m[I 2021-08-22 09:34:37,786][0m Trial 32 finished with value: 28.755925656603228 and parameters: {'n_layers_mlp': 2, 'mlp_n_units_l0': 23, 'mlp_dropout_l0': 0.2228473450406985, 'mlp_n_units_l1': 37, 'mlp_dropout_l1': 0.08483184473715183, 'lr': 7.25068611909755e-05, 'criterion': 'L1Loss', 'batch_size': 256, 'no_epochs': 63}. Best is trial 2 with value: 26.45581733714406.[0m
Trial Id: 33 | Model params: 2593 | Timestamp: 2021-08-22 09:34:37.786970

epoch 0 -28.446106651229613 155.38919056546138
epoch 5 -28.28819669770235 154.9719794664503
epoch 10 -27.951135036634597 154.07765554020023
epoch 15 -27.387914747218133 152.5715682281618
epoch 20 -26.575546240133047 150.37267519868794
epoch 25 -25.466725025760063 147.31839094561485
epoch 30 -24.061395518025428 143.35389232322203
epoch 35 -22.36533255390622 138.41808845528473
epoch 40 -20.387598899809703 132.43045752138633
epoch 45 -18.15267197990373 125.32033565793728
epoch 50 -15.700029241073885 117.02145127745194
epoch 55 -13.07524866362456 107.4323070657406
epoch 60 -10.366862925549356 96.54441947496765
epoch 65 -7.680600820591739 84.3687776136092
[32m[I 2021-08-22 09:36:20,576][0m Trial 33 finished with value: 76.51257998647166 and parameters: {'n_layers_mlp': 2, 'mlp_n_units_l0': 39, 'mlp_dropout_l0': 0.2794240367826143, 'mlp_n_units_l1': 48, 'mlp_dropout_l1': 0.07447363016495048, 'lr': 1.1508112678234192e-05, 'criterion': 'L1Loss', 'batch_size': 256, 'no_epochs': 69}. Best is trial 2 with value: 26.45581733714406.[0m
Trial Id: 34 | Model params: 1839 | Timestamp: 2021-08-22 09:36:20.577253

epoch 0 -28.436925737815294 155.36496451177078
epoch 5 -27.993463202141964 154.1902494405807
epoch 10 -26.492966212375265 150.14734710618706
epoch 15 -23.693683460461447 142.29832972771584
epoch 20 -19.781323021667724 130.5399555749413
epoch 25 -15.053832445267687 114.73508111361426
epoch 30 -10.100560096407213 95.40679574510885
epoch 35 -5.64994110862429 73.84409352607734
epoch 40 -2.4192245952291693 52.950574744563724
epoch 45 -0.7958129633852933 38.37403039289894
epoch 50 -0.380759095708588 33.64850865181211
epoch 55 -0.32454797963355153 32.956471784753795
epoch 60 -0.2906516792431588 32.53204687892834
epoch 65 -0.2526485772074054 32.04951699138007
epoch 70 -0.21557449807151285 31.57167723116119
[32m[I 2021-08-22 09:38:12,766][0m Trial 34 finished with value: 31.11499228312964 and parameters: {'n_layers_mlp': 2, 'mlp_n_units_l0': 32, 'mlp_dropout_l0': 0.1890520337171741, 'mlp_n_units_l1': 39, 'mlp_dropout_l1': 0.020993198343937106, 'lr': 2.4859358598630472e-05, 'criterion': 'MSELoss', 'batch_size': 256, 'no_epochs': 76}. Best is trial 2 with value: 26.45581733714406.[0m
epoch 75 -0.18066222172829338 31.11499228312964
Trial Id: 35 | Model params: 1356 | Timestamp: 2021-08-22 09:38:12.766297

epoch 0 -28.480616666698147 155.48021980038433
epoch 5 -1.7242438736061358 47.26393273018417
epoch 10 -0.251140616313124 32.030220289615336
epoch 15 -0.16036609937996937 30.8463924830117
epoch 20 -0.09066148162133336 29.90555398266094
epoch 25 -0.04684606313319484 29.298694956101688
epoch 30 -0.01958092134240741 28.91463498403389
epoch 35 -0.00796055263905382 28.74938984830535
epoch 40 0.0008822805580241955 28.6230029085555
epoch 45 0.007595329457154798 28.52668219371263
epoch 50 0.02478028777904262 28.278612681486333
epoch 55 0.03123233189880159 28.184911930415275
epoch 60 0.026856273925397578 28.248497783716413
epoch 65 0.028542421706239662 28.22401435395023
epoch 70 0.027873236247450306 28.233733691652866
[32m[I 2021-08-22 09:40:02,878][0m Trial 35 finished with value: 28.093796992061197 and parameters: {'n_layers_mlp': 2, 'mlp_n_units_l0': 17, 'mlp_dropout_l0': 0.25283932029513706, 'mlp_n_units_l1': 57, 'mlp_dropout_l1': 0.14433973386957616, 'lr': 0.00012143886623310647, 'criterion': 'L1Loss', 'batch_size': 256, 'no_epochs': 74}. Best is trial 2 with value: 26.45581733714406.[0m
Trial Id: 36 | Model params: 1671 | Timestamp: 2021-08-22 09:40:02.879153

[32m[I 2021-08-22 09:40:05,230][0m Trial 36 pruned. [0m
epoch 0 -16.230021134807874 118.8881995858727
Trial Id: 37 | Model params: 1659 | Timestamp: 2021-08-22 09:40:05.230996

[32m[I 2021-08-22 09:40:20,005][0m Trial 37 pruned. [0m
epoch 0 -26.942619600721603 151.6458348950714
Trial Id: 38 | Model params: 1426 | Timestamp: 2021-08-22 09:40:20.005527

epoch 0 -28.4824957332816 155.48517480240145
epoch 5 -28.4824957332816 155.48517480240145
epoch 10 -28.4824957332816 155.48517480240145
epoch 15 -28.4824957332816 155.48517480240145
epoch 20 -28.4824957332816 155.48517480240145
epoch 25 -28.4824957332816 155.48517480240145
epoch 30 -28.4824957332816 155.48517480240145
epoch 35 -28.4824957332816 155.48517480240145
epoch 40 -28.4824957332816 155.48517480240145
epoch 45 -28.4824957332816 155.48517480240145
epoch 50 -28.4824957332816 155.48517480240145
epoch 55 -28.4824957332816 155.48517480240145
[32m[I 2021-08-22 09:41:47,706][0m Trial 38 finished with value: 155.48517480240145 and parameters: {'n_layers_mlp': 2, 'mlp_n_units_l0': 45, 'mlp_dropout_l0': 0.1389933840878982, 'mlp_n_units_l1': 15, 'mlp_dropout_l1': 0.16129423992086322, 'lr': 0.0004101267764876743, 'criterion': 'L1Loss', 'batch_size': 256, 'no_epochs': 59}. Best is trial 2 with value: 26.45581733714406.[0m
Trial Id: 39 | Model params: 1193 | Timestamp: 2021-08-22 09:41:47.706803

[32m[I 2021-08-22 09:42:02,049][0m Trial 39 pruned. [0m
epoch 0 -5.615171804942857 73.78489968673237
Trial Id: 40 | Model params: 1947 | Timestamp: 2021-08-22 09:42:02.049888

[32m[I 2021-08-22 09:42:09,311][0m Trial 40 pruned. [0m
epoch 0 -0.027976776567737893 29.091464958785497
Trial Id: 41 | Model params: 5861 | Timestamp: 2021-08-22 09:42:09.311448

epoch 0 -28.43309179091346 155.35484660023937
epoch 5 -0.20538852399358243 31.439120643472513
epoch 10 -0.13052286507143074 30.447142461741834
epoch 15 -0.0675642037951325 29.58719987785348
epoch 20 -0.03190218939638023 29.088821790733203
epoch 25 -0.009172297277065589 28.766665551792425
epoch 30 -0.004146428186223572 28.69494442394848
epoch 35 0.01218610379400431 28.4606247841131
epoch 40 0.022998085637826016 28.30444029701224
epoch 45 0.035690393154367395 28.119986688150632
