[32m[I 2021-08-22 14:54:01,921][0m Trial 1 finished with value: 20.4818755443622 and parameters: {'n_layers_mlp': 4, 'mlp_n_units_l0': 24, 'mlp_dropout_l0': 0.0401099088142781, 'mlp_n_units_l1': 31, 'mlp_dropout_l1': 0.27998152829542033, 'mlp_n_units_l2': 58, 'mlp_dropout_l2': 0.2717411416942262, 'mlp_n_units_l3': 30, 'mlp_dropout_l3': 0.10106753418468126, 'lr': 0.000909225360107416, 'criterion': 'MSELoss', 'batch_size': 32, 'no_epochs': 63}. Best is trial 1 with value: 20.4818755443622.[0m
Trial Id: 2 | Model params: 2465 | Timestamp: 2021-08-22 14:54:01.921676

epoch 0 -31.375117529176556 131.85329729124558
epoch 5 -23.07422284495614 113.70025955332007
epoch 10 -5.464915222048859 58.92054224580215
epoch 15 -0.6081214279166782 29.38628845999529
epoch 20 -0.4379936393558477 27.788416557469606
epoch 25 -0.2792935157637009 26.210204970675
epoch 30 -0.164297829773832 25.00445320729007
epoch 35 -0.08523028751079886 24.140500550454284
epoch 40 -0.03907840059700329 23.621609001800586
epoch 45 -0.012423897017202812 23.316669224000783
epoch 50 0.0016373298348524301 23.154184251215256
[32m[I 2021-08-22 14:57:33,700][0m Trial 2 finished with value: 23.113001851427455 and parameters: {'n_layers_mlp': 2, 'mlp_n_units_l0': 37, 'mlp_dropout_l0': 0.1334813207501497, 'mlp_n_units_l1': 48, 'mlp_dropout_l1': 0.023216674770005417, 'lr': 1.9858724925542868e-05, 'criterion': 'MSELoss', 'batch_size': 128, 'no_epochs': 53}. Best is trial 1 with value: 20.4818755443622.[0m
Trial Id: 3 | Model params: 2499 | Timestamp: 2021-08-22 14:57:33.701020

epoch 0 0.07877484730297979 22.242379330671078
epoch 5 0.01567483503155842 22.99151786342692
epoch 10 0.16694047945807722 21.151265927978944
epoch 15 0.17824203900781377 21.007303483808748
epoch 20 0.1996217119685103 20.732229083098616
epoch 25 0.2052095926086105 20.65973078200799
epoch 30 0.2007645431813827 20.7174223956499
epoch 35 0.20158100743796126 20.706837681937284
epoch 40 0.20314356912747444 20.686565395280553
epoch 45 0.20588592468673772 20.6509386448871
epoch 50 0.19679825167104248 20.768764989392135
epoch 55 0.20968559542594367 20.601474180795332
epoch 60 0.20405832495416842 20.674688356110405
[32m[I 2021-08-22 15:26:10,326][0m Trial 3 finished with value: 20.620484994271134 and parameters: {'n_layers_mlp': 2, 'mlp_n_units_l0': 53, 'mlp_dropout_l0': 0.009211893362596557, 'mlp_n_units_l1': 30, 'mlp_dropout_l1': 0.10427403919959656, 'lr': 0.004283360241346004, 'criterion': 'MSELoss', 'batch_size': 16, 'no_epochs': 64}. Best is trial 1 with value: 20.4818755443622.[0m
Trial Id: 4 | Model params: 5379 | Timestamp: 2021-08-22 15:26:10.327171

epoch 0 -0.02013739093666156 23.40532364924201
epoch 5 0.07039197345817494 22.34267922605297
epoch 10 0.10808697251968757 21.88500104220026
epoch 15 0.14463427006545504 21.431927976044854
epoch 20 0.158478762955922 21.257777554753964
epoch 25 0.17243022173282552 21.080826268582115
epoch 30 0.18915424785783175 20.86673212583488
epoch 35 0.17270591665935542 21.07731456411814
epoch 40 0.19902594055450373 20.739321473555517
epoch 45 0.20850700749028805 20.616211218998096
epoch 50 0.2023299840012447 20.69650209005119
epoch 55 0.21470971326914334 20.53527063409358
epoch 60 0.21512889785674738 20.529789082785847
epoch 65 0.2169012596997001 20.506596242978738
[32m[I 2021-08-22 15:46:30,873][0m Trial 4 finished with value: 20.437039651378512 and parameters: {'n_layers_mlp': 4, 'mlp_n_units_l0': 69, 'mlp_dropout_l0': 0.15708773129733658, 'mlp_n_units_l1': 35, 'mlp_dropout_l1': 0.07134747306497544, 'mlp_n_units_l2': 22, 'mlp_dropout_l2': 0.11454695464066603, 'mlp_n_units_l3': 43, 'mlp_dropout_l3': 0.21350250106801932, 'lr': 0.0001379539400227979, 'criterion': 'MSELoss', 'batch_size': 32, 'no_epochs': 69}. Best is trial 4 with value: 20.437039651378512.[0m
Trial Id: 5 | Model params: 1937 | Timestamp: 2021-08-22 15:46:30.874019

epoch 0 -30.926592311122064 130.93676331970565
epoch 5 -7.590501590962354 67.91951550199958
epoch 10 -0.49877834782702424 28.369652957049418
epoch 15 -0.3253451675443235 26.677788022682353
epoch 20 -0.20037221224371726 25.38886489744617
epoch 25 -0.10496396219371595 24.358995485744995
epoch 30 -0.0508340703465755 23.75485536552408
epoch 35 -0.01999136128231327 23.403648387813462
epoch 40 -0.003908442444619187 23.21840440309425
epoch 45 0.004301756217806374 23.123266711170903
[32m[I 2021-08-22 15:49:52,237][0m Trial 5 finished with value: 23.03548029968137 and parameters: {'n_layers_mlp': 2, 'mlp_n_units_l0': 39, 'mlp_dropout_l0': 0.29319373452888725, 'mlp_n_units_l1': 32, 'mlp_dropout_l1': 0.12393795979755365, 'lr': 3.0544887401679216e-05, 'criterion': 'L1Loss', 'batch_size': 128, 'no_epochs': 50}. Best is trial 4 with value: 20.437039651378512.[0m
Trial Id: 6 | Model params: 677 | Timestamp: 2021-08-22 15:49:52.237932

epoch 0 -31.557464881806133 132.22409656342933
epoch 5 -31.557464881806133 132.22409656342933
epoch 10 -31.557464881806133 132.22409656342933
epoch 15 -31.557464881806133 132.22409656342933
epoch 20 -31.557464881806133 132.22409656342933
epoch 25 -31.557464881806133 132.22409656342933
epoch 30 -31.557464881806133 132.22409656342933
epoch 35 -31.557464881806133 132.22409656342933
epoch 40 -31.557464881806133 132.22409656342933
[32m[I 2021-08-22 16:00:12,048][0m Trial 6 finished with value: 132.22409656342933 and parameters: {'n_layers_mlp': 2, 'mlp_n_units_l0': 10, 'mlp_dropout_l0': 0.20649452853919567, 'mlp_n_units_l1': 43, 'mlp_dropout_l1': 0.06594557369374437, 'lr': 8.84594920236548e-05, 'criterion': 'MSELoss', 'batch_size': 32, 'no_epochs': 45}. Best is trial 4 with value: 20.437039651378512.[0m
Trial Id: 7 | Model params: 6648 | Timestamp: 2021-08-22 16:00:12.048358

epoch 0 -0.050087775633466114 23.746418604581265
epoch 5 0.09727891780769593 22.01720116684831
epoch 10 0.1217826784918482 21.716324235878396
epoch 15 0.12922344918455508 21.624131844665648
epoch 20 0.13280762377834576 21.579582768296085
epoch 25 0.13391849426250613 21.565756653014205
epoch 30 0.14701043254113033 21.40213887078551
epoch 35 0.14889903815470873 21.378432485873205
epoch 40 0.14681649141158648 21.404571795663436
epoch 45 0.1472936286128057 21.398585776446584
epoch 50 0.11820318473505764 21.76053561636745
epoch 55 0.14747572180972646 21.396300848674034
[32m[I 2021-08-22 16:17:10,281][0m Trial 7 finished with value: 21.34425914510978 and parameters: {'n_layers_mlp': 4, 'mlp_n_units_l0': 14, 'mlp_dropout_l0': 0.2724059362381695, 'mlp_n_units_l1': 47, 'mlp_dropout_l1': 0.294422563579231, 'mlp_n_units_l2': 55, 'mlp_dropout_l2': 0.08401077467964947, 'mlp_n_units_l3': 54, 'mlp_dropout_l3': 0.17555116115468222, 'lr': 0.00022389488317681636, 'criterion': 'MSELoss', 'batch_size': 32, 'no_epochs': 58}. Best is trial 4 with value: 20.437039651378512.[0m
Trial Id: 8 | Model params: 1289 | Timestamp: 2021-08-22 16:17:10.282124

epoch 0 -0.36948296683522 27.119187077072326
epoch 5 0.027709576378850187 22.85053399866156
epoch 10 0.04420904674337822 22.65582113196793
epoch 15 0.054952158100523785 22.52813535615002
epoch 20 0.05590688613385986 22.516753034381058
epoch 25 0.05033255121276481 22.583129534097385
epoch 30 0.07305400834345122 22.311335400663523
epoch 35 0.06803264831943223 22.37168515910824
epoch 40 0.07848601174056469 22.24586593035688
epoch 45 0.0918585562124492 22.083865694136875
epoch 50 0.0920781279740015 22.08119579813107
[32m[I 2021-08-22 16:40:53,357][0m Trial 8 finished with value: 21.833190182324568 and parameters: {'n_layers_mlp': 2, 'mlp_n_units_l0': 22, 'mlp_dropout_l0': 0.09208435595933132, 'mlp_n_units_l1': 39, 'mlp_dropout_l1': 0.195933575809175, 'lr': 8.402168274168761e-05, 'criterion': 'MSELoss', 'batch_size': 16, 'no_epochs': 53}. Best is trial 4 with value: 20.437039651378512.[0m
Trial Id: 9 | Model params: 2561 | Timestamp: 2021-08-22 16:40:53.357765

epoch 0 -0.18684963413142985 25.245453003677824
epoch 5 0.0016001856099501222 23.154614974565394
epoch 10 0.03187119081561118 22.800894750772688
epoch 15 0.056451797654096136 22.50957854989895
epoch 20 0.04885177243384409 22.600051011866654
epoch 25 0.04520971198315038 22.64327882097994
epoch 30 0.04550497164511158 22.63977744278091
epoch 35 0.045659533562804056 22.637944332610623
epoch 40 0.06410976684667613 22.41804700676497
epoch 45 0.042736077762399294 22.672591518788657
epoch 50 0.05287867593011264 22.552159026013605
epoch 55 0.07577620576283406 22.277881554343377
epoch 60 0.07298317108489905 22.311518405671944
[32m[I 2021-08-22 16:45:22,950][0m Trial 9 finished with value: 22.216316410159784 and parameters: {'n_layers_mlp': 2, 'mlp_n_units_l0': 70, 'mlp_dropout_l0': 0.24491977118030167, 'mlp_n_units_l1': 20, 'mlp_dropout_l1': 0.21522641213275953, 'lr': 0.0007928222992351556, 'criterion': 'L1Loss', 'batch_size': 128, 'no_epochs': 66}. Best is trial 4 with value: 20.437039651378512.[0m
epoch 65 0.08087735051911005 22.216316410159784
Trial Id: 10 | Model params: 8680 | Timestamp: 2021-08-22 16:45:22.950991

epoch 0 -31.55052050773574 132.20999438196324
epoch 5 -28.68478655952433 126.25607477322409
epoch 10 -12.873153071158681 86.31234321151742
epoch 15 -0.6800967171997747 30.036716780962138
epoch 20 -0.4500764290621686 27.904918891030267
epoch 25 -0.3612648091058892 27.03688331148686
epoch 30 -0.2557144840343897 25.967537637917143
epoch 35 -0.1659987639427405 25.02271116741885
epoch 40 -0.09943006210749505 24.297921345299073
epoch 45 -0.05166731685178183 23.764271565732496
epoch 50 -0.019225304068762217 23.394858165714282
epoch 55 -0.00143009554519824 23.189727077420297
epoch 60 0.012893369393281118 23.0232883379862
epoch 65 0.0189194476275103 22.952904589126213
epoch 70 0.021544782214207858 22.922173462663228
epoch 75 0.025787123736239925 22.872427024705434
[32m[I 2021-08-22 16:49:18,265][0m Trial 10 finished with value: 22.83419429020238 and parameters: {'n_layers_mlp': 4, 'mlp_n_units_l0': 80, 'mlp_dropout_l0': 0.1711170775944029, 'mlp_n_units_l1': 69, 'mlp_dropout_l1': 0.004906668627738531, 'mlp_n_units_l2': 11, 'mlp_dropout_l2': 0.0008122470264516485, 'mlp_n_units_l3': 80, 'mlp_dropout_l3': 0.2960181847171328, 'lr': 1.0370333664346784e-05, 'criterion': 'MSELoss', 'batch_size': 256, 'no_epochs': 79}. Best is trial 4 with value: 20.437039651378512.[0m
Trial Id: 11 | Model params: 1365 | Timestamp: 2021-08-22 16:49:18.265488

[32m[I 2021-08-22 16:49:35,879][0m Trial 11 pruned. [0m
epoch 0 0.03571179347388098 22.75562381348154
Trial Id: 12 | Model params: 5687 | Timestamp: 2021-08-22 16:49:35.879674

epoch 0 -0.5601894289949587 28.94502862922713
epoch 5 0.16978859321228823 21.11444478929506
epoch 10 0.21229745414338141 20.566786629895468
epoch 15 0.21605936314334917 20.51761643378419
epoch 20 0.22759321964380386 20.36612273444845
epoch 25 0.23039957847512582 20.329091303034062
epoch 30 0.22403174462114983 20.413021609969963
epoch 35 0.2147580404985393 20.534638748012537
epoch 40 0.2301187433598315 20.332800112050958
epoch 45 0.22488306505122913 20.401820899618162
epoch 50 0.2371828803821855 20.239302129657567
epoch 55 0.23308923395571957 20.2935364180874
epoch 60 0.2390978881332796 20.21388137334137
epoch 65 0.23890539715490733 20.216438038443
epoch 70 0.24027801367026547 20.198199872463338
[32m[I 2021-08-22 17:10:48,044][0m Trial 12 finished with value: 20.28013345328479 and parameters: {'n_layers_mlp': 4, 'mlp_n_units_l0': 51, 'mlp_dropout_l0': 0.10182401746071842, 'mlp_n_units_l1': 19, 'mlp_dropout_l1': 0.1840132160220217, 'mlp_n_units_l2': 72, 'mlp_dropout_l2': 0.21087378232566856, 'mlp_n_units_l3': 33, 'mlp_dropout_l3': 0.0041619017122395685, 'lr': 0.0007693503935423424, 'criterion': 'MSELoss', 'batch_size': 32, 'no_epochs': 72}. Best is trial 12 with value: 20.28013345328479.[0m
Trial Id: 13 | Model params: 6159 | Timestamp: 2021-08-22 17:10:48.044518

epoch 0 -31.557464881806133 132.22409656342933
epoch 5 -31.557464881806133 132.22409656342933
epoch 10 -31.557464881806133 132.22409656342933
epoch 15 -31.557464881806133 132.22409656342933
epoch 20 -31.557464881806133 132.22409656342933
epoch 25 -31.557464881806133 132.22409656342933
epoch 30 -31.557464881806133 132.22409656342933
epoch 35 -31.557464881806133 132.22409656342933
epoch 40 -31.557464881806133 132.22409656342933
epoch 45 -31.557464881806133 132.22409656342933
epoch 50 -31.557464881806133 132.22409656342933
epoch 55 -31.557464881806133 132.22409656342933
epoch 60 -31.557464881806133 132.22409656342933
epoch 65 -31.557464881806133 132.22409656342933
epoch 70 -31.557464881806133 132.22409656342933
[32m[I 2021-08-22 17:14:24,522][0m Trial 13 finished with value: 132.22409656342933 and parameters: {'n_layers_mlp': 4, 'mlp_n_units_l0': 53, 'mlp_dropout_l0': 0.11035317234052741, 'mlp_n_units_l1': 11, 'mlp_dropout_l1': 0.15718151709327183, 'mlp_n_units_l2': 77, 'mlp_dropout_l2': 0.17809182501667273, 'mlp_n_units_l3': 48, 'mlp_dropout_l3': 0.00697525278624575, 'lr': 0.0003021950722986782, 'criterion': 'MSELoss', 'batch_size': 256, 'no_epochs': 72}. Best is trial 12 with value: 20.28013345328479.[0m
Trial Id: 14 | Model params: 4401 | Timestamp: 2021-08-22 17:14:24.523023

epoch 0 -31.557464881806133 132.22409656342933
epoch 5 0.11017460165917403 21.859373806001933
epoch 10 0.11519213185198995 21.797656574061737
epoch 15 0.15781160836879404 21.26620242473649
epoch 20 0.16417209445765168 21.185745520150363
epoch 25 0.17445975380854206 21.05496109235577
epoch 30 0.19116759062830346 20.840809812233264
epoch 35 0.17173629639753785 21.089662655897456
epoch 40 0.18469896675423003 20.92398087022682
epoch 45 0.1898703840987821 20.8575153765215
epoch 50 0.1800747261629616 20.983235493752183
epoch 55 0.19355704380335137 20.810003076840452
epoch 60 0.18736781763118193 20.889705947691755
epoch 65 0.19894913318466922 20.74031582195546
epoch 70 0.2001439139066189 20.724842786827818
epoch 75 0.20226574425292743 20.69733546180354
[32m[I 2021-08-22 17:37:29,872][0m Trial 14 finished with value: 20.798549993657968 and parameters: {'n_layers_mlp': 4, 'mlp_n_units_l0': 69, 'mlp_dropout_l0': 0.16862295952602915, 'mlp_n_units_l1': 20, 'mlp_dropout_l1': 0.22791653635317263, 'mlp_n_units_l2': 32, 'mlp_dropout_l2': 0.1673998686621188, 'mlp_n_units_l3': 36, 'mlp_dropout_l3': 0.24312886462347233, 'lr': 0.0025800199859048792, 'criterion': 'MSELoss', 'batch_size': 32, 'no_epochs': 78}. Best is trial 12 with value: 20.28013345328479.[0m
Trial Id: 15 | Model params: 5015 | Timestamp: 2021-08-22 17:37:29.872845

[32m[I 2021-08-22 17:37:47,734][0m Trial 15 pruned. [0m
epoch 0 0.001645540674899526 23.154089037471856
Trial Id: 16 | Model params: 10675 | Timestamp: 2021-08-22 17:37:47.734719

[32m[I 2021-08-22 17:38:05,622][0m Trial 16 pruned. [0m
epoch 0 -0.020370343779347433 23.407995850798294
Trial Id: 17 | Model params: 3268 | Timestamp: 2021-08-22 17:38:05.622974

epoch 0 -31.555296284418134 132.22366035764446
epoch 5 -31.555296284418134 132.22366035764446
epoch 10 -31.555296284418134 132.22366035764446
epoch 15 -31.555296284418134 132.22366035764446
epoch 20 -31.555296284418134 132.22366035764446
epoch 25 -31.555296284418134 132.22366035764446
epoch 30 -31.555296284418134 132.22366035764446
epoch 35 -31.555296284418134 132.22366035764446
epoch 40 -31.555296284418134 132.22366035764446
epoch 45 -31.555296284418134 132.22366035764446
epoch 50 -31.555296284418134 132.22366035764446
epoch 55 -31.555296284418134 132.22366035764446
epoch 60 -31.555296284418134 132.22366035764446
epoch 65 -31.555296284418134 132.22366035764446
epoch 70 -31.555296284418134 132.22366035764446
[32m[I 2021-08-22 18:19:47,425][0m Trial 17 finished with value: 132.22366035764446 and parameters: {'n_layers_mlp': 4, 'mlp_n_units_l0': 45, 'mlp_dropout_l0': 0.07349705355708748, 'mlp_n_units_l1': 25, 'mlp_dropout_l1': 0.24876409077188133, 'mlp_n_units_l2': 21, 'mlp_dropout_l2': 0.10865399576495324, 'mlp_n_units_l3': 37, 'mlp_dropout_l3': 0.0691774477229799, 'lr': 0.0001562883853577198, 'criterion': 'MSELoss', 'batch_size': 16, 'no_epochs': 75}. Best is trial 12 with value: 20.28013345328479.[0m
Trial Id: 18 | Model params: 8043 | Timestamp: 2021-08-22 18:19:47.425476

[32m[I 2021-08-22 18:20:04,849][0m Trial 18 pruned. [0m
epoch 0 -0.36194895722421894 27.043676592708103
Trial Id: 19 | Model params: 14553 | Timestamp: 2021-08-22 18:20:04.849580

epoch 0 -31.557464881806133 132.22409656342933
epoch 5 -31.557464881806133 132.22409656342933
epoch 10 -31.557464881806133 132.22409656342933
epoch 15 -31.557464881806133 132.22409656342933
epoch 20 -31.557464881806133 132.22409656342933
epoch 25 -31.557464881806133 132.22409656342933
epoch 30 -31.557464881806133 132.22409656342933
epoch 35 -31.557464881806133 132.22409656342933
epoch 40 -31.557464881806133 132.22409656342933
epoch 45 -31.557464881806133 132.22409656342933
epoch 50 -31.557464881806133 132.22409656342933
epoch 55 -31.557464881806133 132.22409656342933
epoch 60 -31.557464881806133 132.22409656342933
epoch 65 -31.557464881806133 132.22409656342933
epoch 70 -31.557464881806133 132.22409656342933
epoch 75 -31.557464881806133 132.22409656342933
[32m[I 2021-08-22 18:23:55,723][0m Trial 19 finished with value: 132.22409656342933 and parameters: {'n_layers_mlp': 4, 'mlp_n_units_l0': 47, 'mlp_dropout_l0': 0.12581566494170543, 'mlp_n_units_l1': 79, 'mlp_dropout_l1': 0.18029092101854735, 'mlp_n_units_l2': 80, 'mlp_dropout_l2': 0.038544925360707305, 'mlp_n_units_l3': 44, 'mlp_dropout_l3': 0.18070001362838403, 'lr': 0.002040158257575035, 'criterion': 'MSELoss', 'batch_size': 256, 'no_epochs': 77}. Best is trial 12 with value: 20.28013345328479.[0m
Trial Id: 20 | Model params: 3910 | Timestamp: 2021-08-22 18:23:55.724154

[32m[I 2021-08-22 18:24:13,283][0m Trial 20 pruned. [0m
epoch 0 -0.24881676484403625 25.896118761319002
Trial Id: 21 | Model params: 4977 | Timestamp: 2021-08-22 18:24:13.283841

[32m[I 2021-08-22 18:24:30,794][0m Trial 21 pruned. [0m
epoch 0 0.08275339279280847 22.193631712763995
Trial Id: 22 | Model params: 4829 | Timestamp: 2021-08-22 18:24:30.794860

[32m[I 2021-08-22 18:24:48,504][0m Trial 22 pruned. [0m
epoch 0 0.04753479725669507 22.61569179719447
Trial Id: 23 | Model params: 5711 | Timestamp: 2021-08-22 18:24:48.505143

[32m[I 2021-08-22 18:25:06,025][0m Trial 23 pruned. [0m
epoch 0 0.05768454526062261 22.494869339310867
Trial Id: 24 | Model params: 5687 | Timestamp: 2021-08-22 18:25:06.025721

epoch 0 -31.557464881806133 132.22409656342933
epoch 5 -31.557464881806133 132.22409656342933
epoch 10 -31.557464881806133 132.22409656342933
epoch 15 -31.557464881806133 132.22409656342933
epoch 20 -31.557464881806133 132.22409656342933
epoch 25 -31.557464881806133 132.22409656342933
epoch 30 -31.557464881806133 132.22409656342933
epoch 35 -31.557464881806133 132.22409656342933
epoch 40 -31.557464881806133 132.22409656342933
epoch 45 -31.557464881806133 132.22409656342933
epoch 50 -31.557464881806133 132.22409656342933
epoch 55 -31.557464881806133 132.22409656342933
epoch 60 -31.557464881806133 132.22409656342933
[32m[I 2021-08-22 18:44:01,976][0m Trial 24 finished with value: 132.22409656342933 and parameters: {'n_layers_mlp': 4, 'mlp_n_units_l0': 51, 'mlp_dropout_l0': 0.10247907788242425, 'mlp_n_units_l1': 26, 'mlp_dropout_l1': 0.201382973929036, 'mlp_n_units_l2': 74, 'mlp_dropout_l2': 0.19527719814956196, 'mlp_n_units_l3': 20, 'mlp_dropout_l3': 0.1799492892807837, 'lr': 0.006162950283445176, 'criterion': 'MSELoss', 'batch_size': 32, 'no_epochs': 64}. Best is trial 12 with value: 20.28013345328479.[0m
Trial Id: 25 | Model params: 4673 | Timestamp: 2021-08-22 18:44:01.976351

[32m[I 2021-08-22 18:44:19,664][0m Trial 25 pruned. [0m
epoch 0 0.05029196665180913 22.58293444048894
Trial Id: 26 | Model params: 4820 | Timestamp: 2021-08-22 18:44:19.664644

[32m[I 2021-08-22 18:44:37,262][0m Trial 26 pruned. [0m
epoch 0 -0.11945515189379541 24.518204757807677
Trial Id: 27 | Model params: 3264 | Timestamp: 2021-08-22 18:44:37.262881

[32m[I 2021-08-22 18:44:55,149][0m Trial 27 pruned. [0m
epoch 0 -0.14149035764310525 24.75833537598705
Trial Id: 28 | Model params: 6971 | Timestamp: 2021-08-22 18:44:55.149883

[32m[I 2021-08-22 18:45:28,651][0m Trial 28 pruned. [0m
epoch 0 -0.004684923823986997 23.228078879454717
Trial Id: 29 | Model params: 9082 | Timestamp: 2021-08-22 18:45:28.651629

epoch 0 -31.557464881806133 132.22409656342933
epoch 5 -31.557464881806133 132.22409656342933
epoch 10 -31.557464881806133 132.22409656342933
epoch 15 -31.557464881806133 132.22409656342933
epoch 20 -31.557464881806133 132.22409656342933
epoch 25 -31.557464881806133 132.22409656342933
epoch 30 -31.557464881806133 132.22409656342933
epoch 35 -31.557464881806133 132.22409656342933
epoch 40 -31.557464881806133 132.22409656342933
epoch 45 -31.557464881806133 132.22409656342933
epoch 50 -31.557464881806133 132.22409656342933
epoch 55 -31.557464881806133 132.22409656342933
[32m[I 2021-08-22 18:48:30,640][0m Trial 29 finished with value: 132.22409656342933 and parameters: {'n_layers_mlp': 4, 'mlp_n_units_l0': 70, 'mlp_dropout_l0': 0.1413844581513593, 'mlp_n_units_l1': 35, 'mlp_dropout_l1': 0.006335216953188033, 'mlp_n_units_l2': 71, 'mlp_dropout_l2': 0.20464361241918091, 'mlp_n_units_l3': 40, 'mlp_dropout_l3': 0.10315093809758198, 'lr': 0.009211501301751593, 'criterion': 'L1Loss', 'batch_size': 256, 'no_epochs': 60}. Best is trial 12 with value: 20.28013345328479.[0m
Trial Id: 30 | Model params: 4593 | Timestamp: 2021-08-22 18:48:30.641074

[32m[I 2021-08-22 18:48:35,792][0m Trial 30 pruned. [0m
epoch 0 -17.210018200913545 98.88729743186637
Trial Id: 31 | Model params: 2579 | Timestamp: 2021-08-22 18:48:35.793086

[32m[I 2021-08-22 18:49:02,789][0m Trial 31 pruned. [0m
epoch 0 -0.012480334220937417 23.31801878074563
Trial Id: 32 | Model params: 2319 | Timestamp: 2021-08-22 18:49:02.789330

[32m[I 2021-08-22 18:49:29,699][0m Trial 32 pruned. [0m
epoch 0 0.08062937602274478 22.219979859793316
Trial Id: 33 | Model params: 2409 | Timestamp: 2021-08-22 18:49:29.699924

