[32m[I 2021-08-22 00:12:01,902][0m Trial 17 pruned. [0m
epoch 0 0.032327640936258284 18.17601316759754
Trial Id: 18 | Model params: 9185 | Timestamp: 2021-08-22 00:12:01.903173

epoch 0 -45.43500606814024 125.90117140989697
epoch 5 -45.43500606814024 125.90117140989697
epoch 10 -45.43500606814024 125.90117140989697
epoch 15 -45.43500606814024 125.90117140989697
epoch 20 -45.43500606814024 125.90117140989697
epoch 25 -45.43500606814024 125.90117140989697
epoch 30 -45.43500606814024 125.90117140989697
epoch 35 -45.43500606814024 125.90117140989697
epoch 40 -45.43500606814024 125.90117140989697
epoch 45 -45.43500606814024 125.90117140989697
epoch 50 -45.43500606814024 125.90117140989697
epoch 55 -45.43500606814024 125.90117140989697
epoch 60 -45.43500606814024 125.90117140989697
epoch 65 -45.43500606814024 125.90117140989697
epoch 70 -45.43500606814024 125.90117140989697
[32m[I 2021-08-22 00:15:09,497][0m Trial 18 finished with value: 125.90117140989697 and parameters: {'n_layers_mlp': 4, 'mlp_n_units_l0': 50, 'mlp_dropout_l0': 0.15601276937584693, 'mlp_n_units_l1': 40, 'mlp_dropout_l1': 0.21474362484308, 'mlp_n_units_l2': 61, 'mlp_dropout_l2': 0.07402783018871953, 'mlp_n_units_l3': 61, 'mlp_dropout_l3': 0.13060653496474506, 'lr': 0.0006179957864419874, 'criterion': 'MSELoss', 'batch_size': 128, 'no_epochs': 74}. Best is trial 2 with value: 17.7298231083678.[0m
Trial Id: 19 | Model params: 2894 | Timestamp: 2021-08-22 00:15:09.497276

[32m[I 2021-08-22 00:15:10,833][0m Trial 19 pruned. [0m
epoch 0 -0.09358232613041717 19.321140514782748
Trial Id: 20 | Model params: 3108 | Timestamp: 2021-08-22 00:15:10.834175

[32m[I 2021-08-22 00:15:12,935][0m Trial 20 pruned. [0m
epoch 0 -0.15096319292532767 19.8215556115705
Trial Id: 21 | Model params: 6604 | Timestamp: 2021-08-22 00:15:12.935916

[32m[I 2021-08-22 00:15:28,909][0m Trial 21 pruned. [0m
epoch 0 -1.7222915076956813 30.48609333357941
Trial Id: 22 | Model params: 9533 | Timestamp: 2021-08-22 00:15:28.909983

[32m[I 2021-08-22 00:15:44,751][0m Trial 22 pruned. [0m
epoch 0 -0.049544379813992956 18.929313521545104
Trial Id: 23 | Model params: 10079 | Timestamp: 2021-08-22 00:15:44.751343

[32m[I 2021-08-22 00:16:00,137][0m Trial 23 pruned. [0m
epoch 0 -0.6606995751079505 23.811129554143065
Trial Id: 24 | Model params: 8612 | Timestamp: 2021-08-22 00:16:00.138185

epoch 0 -45.42356638416528 125.8936169955846
epoch 5 -45.42356638416528 125.8936169955846
epoch 10 -45.42356638416528 125.8936169955846
epoch 15 -45.42356638416528 125.8936169955846
epoch 20 -45.42356638416528 125.8936169955846
epoch 25 -45.42356638416528 125.8936169955846
epoch 30 -45.42356638416528 125.8936169955846
epoch 35 -45.42356638416528 125.8936169955846
epoch 40 -45.42356638416528 125.8936169955846
epoch 45 -45.42356638416528 125.8936169955846
epoch 50 -45.42356638416528 125.8936169955846
epoch 55 -45.42356638416528 125.8936169955846
epoch 60 -45.42356638416528 125.8936169955846
epoch 65 -45.42356638416528 125.8936169955846
epoch 70 -45.42356638416528 125.8936169955846
epoch 75 -45.42356638416528 125.8936169955846
[32m[I 2021-08-22 00:36:40,886][0m Trial 24 pruned. [0m
Trial Id: 25 | Model params: 8683 | Timestamp: 2021-08-22 00:36:40.886569

epoch 0 -45.42356638416528 125.8936169955846
epoch 5 -45.42356638416528 125.8936169955846
epoch 10 -45.42356638416528 125.8936169955846
epoch 15 -45.42356638416528 125.8936169955846
epoch 20 -45.42356638416528 125.8936169955846
epoch 25 -45.42356638416528 125.8936169955846
epoch 30 -45.42356638416528 125.8936169955846
epoch 35 -45.42356638416528 125.8936169955846
epoch 40 -45.42356638416528 125.8936169955846
epoch 45 -45.42356638416528 125.8936169955846
epoch 50 -45.42356638416528 125.8936169955846
epoch 55 -45.42356638416528 125.8936169955846
epoch 60 -45.42356638416528 125.8936169955846
epoch 65 -45.42356638416528 125.8936169955846
[32m[I 2021-08-22 00:55:28,206][0m Trial 25 finished with value: 125.8936169955846 and parameters: {'n_layers_mlp': 4, 'mlp_n_units_l0': 72, 'mlp_dropout_l0': 0.19069449414500766, 'mlp_n_units_l1': 52, 'mlp_dropout_l1': 0.17098141222491933, 'mlp_n_units_l2': 58, 'mlp_dropout_l2': 0.21022989140752907, 'mlp_n_units_l3': 11, 'mlp_dropout_l3': 0.20188466996082668, 'lr': 0.0063361393742778814, 'criterion': 'L1Loss', 'batch_size': 16, 'no_epochs': 71}. Best is trial 2 with value: 17.7298231083678.[0m
epoch 70 -45.42356638416528 125.8936169955846
Trial Id: 26 | Model params: 10311 | Timestamp: 2021-08-22 00:55:28.206431

[32m[I 2021-08-22 00:55:30,748][0m Trial 26 pruned. [0m
epoch 0 -0.02343323659322527 18.69118241585072
Trial Id: 27 | Model params: 7315 | Timestamp: 2021-08-22 00:55:30.749112

[32m[I 2021-08-22 00:55:33,329][0m Trial 27 pruned. [0m
epoch 0 -0.12979004517064419 19.638390406489677
Trial Id: 28 | Model params: 6235 | Timestamp: 2021-08-22 00:55:33.329787

[32m[I 2021-08-22 00:55:49,133][0m Trial 28 pruned. [0m
epoch 0 0.03139376104193503 18.18478169328171
Trial Id: 29 | Model params: 9957 | Timestamp: 2021-08-22 00:55:49.133251

[32m[I 2021-08-22 00:55:50,672][0m Trial 29 pruned. [0m
epoch 0 -0.549357496169822 22.997616969474393
Trial Id: 30 | Model params: 3891 | Timestamp: 2021-08-22 00:55:50.673029

[32m[I 2021-08-22 00:55:57,568][0m Trial 30 pruned. [0m
epoch 0 0.0033724668645431777 18.445944652325583
Trial Id: 31 | Model params: 1586 | Timestamp: 2021-08-22 00:55:57.569166

[32m[I 2021-08-22 00:56:04,207][0m Trial 31 pruned. [0m
epoch 0 -44.89198570747827 125.17075896038585
Trial Id: 32 | Model params: 2418 | Timestamp: 2021-08-22 00:56:04.207507

[32m[I 2021-08-22 00:56:10,901][0m Trial 32 pruned. [0m
epoch 0 -28.347538253709086 100.09682435883589
Trial Id: 33 | Model params: 1113 | Timestamp: 2021-08-22 00:56:10.901671

[32m[I 2021-08-22 00:56:17,569][0m Trial 33 pruned. [0m
epoch 0 -15.631038644434373 75.35188950771325
Trial Id: 34 | Model params: 1940 | Timestamp: 2021-08-22 00:56:17.570036

[32m[I 2021-08-22 00:56:24,139][0m Trial 34 pruned. [0m
epoch 0 -41.23588915157248 120.08127248293887
Trial Id: 35 | Model params: 2979 | Timestamp: 2021-08-22 00:56:24.139934

[32m[I 2021-08-22 00:56:30,532][0m Trial 35 pruned. [0m
epoch 0 -0.25067439564627314 20.663628730927925
Trial Id: 36 | Model params: 1584 | Timestamp: 2021-08-22 00:56:30.533140

[32m[I 2021-08-22 00:56:32,540][0m Trial 36 pruned. [0m
epoch 0 -3.374960564363885 38.64506916444749
Trial Id: 37 | Model params: 8976 | Timestamp: 2021-08-22 00:56:32.540304

[32m[I 2021-08-22 00:56:34,216][0m Trial 37 pruned. [0m
epoch 0 -18.695766988015773 81.99615097361661
Trial Id: 38 | Model params: 4001 | Timestamp: 2021-08-22 00:56:34.216515

[32m[I 2021-08-22 00:56:36,299][0m Trial 38 pruned. [0m
epoch 0 -0.1935274137238434 20.184742660974234
Trial Id: 39 | Model params: 12324 | Timestamp: 2021-08-22 00:56:36.299767

[32m[I 2021-08-22 00:56:44,777][0m Trial 39 pruned. [0m
epoch 0 -20.094030157014974 84.86219132445743
Trial Id: 40 | Model params: 5613 | Timestamp: 2021-08-22 00:56:44.777778

epoch 0 -45.43500606814024 125.90117140989697
epoch 5 -45.43500606814024 125.90117140989697
epoch 10 -45.43500606814024 125.90117140989697
epoch 15 -45.43500606814024 125.90117140989697
epoch 20 -45.43500606814024 125.90117140989697
epoch 25 -45.43500606814024 125.90117140989697
epoch 30 -45.43500606814024 125.90117140989697
epoch 35 -45.43500606814024 125.90117140989697
epoch 40 -45.43500606814024 125.90117140989697
epoch 45 -45.43500606814024 125.90117140989697
epoch 50 -45.43500606814024 125.90117140989697
epoch 55 -45.43500606814024 125.90117140989697
epoch 60 -45.43500606814024 125.90117140989697
epoch 65 -45.43500606814024 125.90117140989697
[32m[I 2021-08-22 00:59:05,859][0m Trial 40 finished with value: 125.90117140989697 and parameters: {'n_layers_mlp': 2, 'mlp_n_units_l0': 66, 'mlp_dropout_l0': 0.11088258532759063, 'mlp_n_units_l1': 67, 'mlp_dropout_l1': 0.10793292547526971, 'lr': 0.0019493036287840505, 'criterion': 'MSELoss', 'batch_size': 128, 'no_epochs': 68}. Best is trial 2 with value: 17.7298231083678.[0m
Trial Id: 41 | Model params: 8905 | Timestamp: 2021-08-22 00:59:05.859990

[32m[I 2021-08-22 00:59:07,442][0m Trial 41 pruned. [0m
epoch 0 -45.295875363102674 125.7124144674355
Trial Id: 42 | Model params: 8919 | Timestamp: 2021-08-22 00:59:07.443137

[32m[I 2021-08-22 00:59:08,984][0m Trial 42 pruned. [0m
epoch 0 -45.33711705927852 125.76839611839469
Trial Id: 43 | Model params: 7552 | Timestamp: 2021-08-22 00:59:08.984724

[32m[I 2021-08-22 00:59:10,623][0m Trial 43 pruned. [0m
epoch 0 -44.96326058312591 125.26000719519907
Trial Id: 44 | Model params: 6396 | Timestamp: 2021-08-22 00:59:10.623975

epoch 0 -45.43500606814024 125.90117140989697
epoch 5 -45.43500606814024 125.90117140989697
epoch 10 -45.43500606814024 125.90117140989697
epoch 15 -45.43500606814024 125.90117140989697
epoch 20 -45.43500606814024 125.90117140989697
epoch 25 -45.43500606814024 125.90117140989697
epoch 30 -45.43500606814024 125.90117140989697
epoch 35 -45.43500606814024 125.90117140989697
epoch 40 -45.43500606814024 125.90117140989697
epoch 45 -45.43500606814024 125.90117140989697
epoch 50 -45.43500606814024 125.90117140989697
epoch 55 -45.43500606814024 125.90117140989697
[32m[I 2021-08-22 01:00:41,585][0m Trial 44 finished with value: 125.90117140989697 and parameters: {'n_layers_mlp': 4, 'mlp_n_units_l0': 76, 'mlp_dropout_l0': 0.20732783697911183, 'mlp_n_units_l1': 23, 'mlp_dropout_l1': 0.22255721625220745, 'mlp_n_units_l2': 52, 'mlp_dropout_l2': 0.2674478175640575, 'mlp_n_units_l3': 40, 'mlp_dropout_l3': 0.15315252012442662, 'lr': 2.50237461909848e-05, 'criterion': 'L1Loss', 'batch_size': 256, 'no_epochs': 57}. Best is trial 2 with value: 17.7298231083678.[0m
Trial Id: 45 | Model params: 6252 | Timestamp: 2021-08-22 01:00:41.585600

[32m[I 2021-08-22 01:00:44,153][0m Trial 45 pruned. [0m
epoch 0 -42.02302245609235 121.18740226517993
Trial Id: 46 | Model params: 3519 | Timestamp: 2021-08-22 01:00:44.153557

[32m[I 2021-08-22 01:00:46,761][0m Trial 46 pruned. [0m
epoch 0 -0.914695033552019 25.565649054508437
Trial Id: 47 | Model params: 2621 | Timestamp: 2021-08-22 01:00:46.762137

[32m[I 2021-08-22 01:00:59,421][0m Trial 47 pruned. [0m
epoch 0 -0.16647468409446264 19.955936787638002
Trial Id: 48 | Model params: 4341 | Timestamp: 2021-08-22 01:00:59.421685

epoch 0 -45.43500606814024 125.90117140989697
epoch 5 -45.43500606814024 125.90117140989697
epoch 10 -45.43500606814024 125.90117140989697
epoch 15 -45.320734436451204 125.74616126136519
epoch 20 -41.500844919291936 120.44972132402756
epoch 25 -22.762881083758515 90.06510608801236
epoch 30 -0.9548346426143242 25.832237860181994
epoch 35 -0.3111089179082196 21.15565145382588
epoch 40 -0.31340035175665104 21.174130320401048
epoch 45 -0.305602736788092 21.111181690436144
epoch 50 -0.28663802297383767 20.95729411710912
epoch 55 -0.28836240702147675 20.971333156340606
epoch 60 -0.29570206333336446 21.03098398886891
epoch 65 -0.3264627319777671 21.27916312654214
epoch 70 -0.3161989218139545 21.196677045973967
[32m[I 2021-08-22 01:02:56,890][0m Trial 48 finished with value: 21.262414195891083 and parameters: {'n_layers_mlp': 4, 'mlp_n_units_l0': 59, 'mlp_dropout_l0': 0.17529284698095565, 'mlp_n_units_l1': 11, 'mlp_dropout_l1': 0.16645043771615292, 'mlp_n_units_l2': 44, 'mlp_dropout_l2': 0.15660267355141994, 'mlp_n_units_l3': 48, 'mlp_dropout_l3': 0.2438759959611227, 'lr': 1.6336544317866964e-05, 'criterion': 'L1Loss', 'batch_size': 256, 'no_epochs': 74}. Best is trial 2 with value: 17.7298231083678.[0m
Trial Id: 49 | Model params: 3732 | Timestamp: 2021-08-22 01:02:56.891127

[32m[I 2021-08-22 01:02:59,010][0m Trial 49 pruned. [0m
epoch 0 -0.11012289334232772 19.466709457063878
Trial Id: 50 | Model params: 5178 | Timestamp: 2021-08-22 01:02:59.010260

[32m[I 2021-08-22 01:03:14,961][0m Trial 50 pruned. [0m
epoch 0 -0.044862889499719394 18.88704925904851
Trial Id: 51 | Model params: 8768 | Timestamp: 2021-08-22 01:03:14.961656

epoch 0 -45.43500606814024 125.90117140989697
epoch 5 -45.43500606814024 125.90117140989697
epoch 10 -45.43500606814024 125.90117140989697
epoch 15 -45.43500606814024 125.90117140989697
epoch 20 -45.43500606814024 125.90117140989697
epoch 25 -45.43500606814024 125.90117140989697
epoch 30 -45.43500606814024 125.90117140989697
epoch 35 -45.43500606814024 125.90117140989697
epoch 40 -45.43500606814024 125.90117140989697
[32m[I 2021-08-22 01:05:10,212][0m Trial 51 finished with value: 125.90117140989697 and parameters: {'n_layers_mlp': 4, 'mlp_n_units_l0': 12, 'mlp_dropout_l0': 0.2991464746401291, 'mlp_n_units_l1': 75, 'mlp_dropout_l1': 0.07202857251292548, 'mlp_n_units_l2': 74, 'mlp_dropout_l2': 0.056017881705696944, 'mlp_n_units_l3': 26, 'mlp_dropout_l3': 0.2765167081496417, 'lr': 4.2896432185851855e-05, 'criterion': 'L1Loss', 'batch_size': 128, 'no_epochs': 45}. Best is trial 2 with value: 17.7298231083678.[0m
Trial Id: 52 | Model params: 11745 | Timestamp: 2021-08-22 01:05:10.212536

[32m[I 2021-08-22 01:05:12,858][0m Trial 52 pruned. [0m
epoch 0 -0.21657441464552885 20.37869441307586
Trial Id: 53 | Model params: 7878 | Timestamp: 2021-08-22 01:05:12.858306

epoch 0 -45.43500606814024 125.90117140989697
epoch 5 -45.43500606814024 125.90117140989697
epoch 10 -45.43500606814024 125.90117140989697
epoch 15 -45.43500606814024 125.90117140989697
epoch 20 -45.43500606814024 125.90117140989697
epoch 25 -45.43500606814024 125.90117140989697
epoch 30 -45.43500606814024 125.90117140989697
epoch 35 -45.43500606814024 125.90117140989697
epoch 40 -45.43500606814024 125.90117140989697
epoch 45 -45.43500606814024 125.90117140989697
epoch 50 -45.43500606814024 125.90117140989697
[32m[I 2021-08-22 01:07:26,451][0m Trial 53 finished with value: 125.90117140989697 and parameters: {'n_layers_mlp': 4, 'mlp_n_units_l0': 16, 'mlp_dropout_l0': 0.24557892589106672, 'mlp_n_units_l1': 73, 'mlp_dropout_l1': 0.02559364526923319, 'mlp_n_units_l2': 66, 'mlp_dropout_l2': 0.06974192431827743, 'mlp_n_units_l3': 22, 'mlp_dropout_l3': 0.25704822367599833, 'lr': 0.00048012031160131984, 'criterion': 'L1Loss', 'batch_size': 128, 'no_epochs': 52}. Best is trial 2 with value: 17.7298231083678.[0m
Trial Id: 54 | Model params: 11687 | Timestamp: 2021-08-22 01:07:26.452467

epoch 0 -45.43500606814024 125.90117140989697
epoch 5 -45.43500606814024 125.90117140989697
epoch 10 -45.43500606814024 125.90117140989697
epoch 15 -45.43500606814024 125.90117140989697
epoch 20 -45.43500606814024 125.90117140989697
epoch 25 -45.43500606814024 125.90117140989697
epoch 30 -45.43500606814024 125.90117140989697
epoch 35 -45.43500606814024 125.90117140989697
epoch 40 -45.43500606814024 125.90117140989697
epoch 45 -45.43500606814024 125.90117140989697
epoch 50 -45.43500606814024 125.90117140989697
epoch 55 -45.43500606814024 125.90117140989697
epoch 60 -45.43500606814024 125.90117140989697
[32m[I 2021-08-22 01:10:13,426][0m Trial 54 finished with value: 125.90117140989697 and parameters: {'n_layers_mlp': 4, 'mlp_n_units_l0': 57, 'mlp_dropout_l0': 0.27564149699124063, 'mlp_n_units_l1': 78, 'mlp_dropout_l1': 0.25086845414534803, 'mlp_n_units_l2': 70, 'mlp_dropout_l2': 0.04000375087183966, 'mlp_n_units_l3': 10, 'mlp_dropout_l3': 0.27210958078203173, 'lr': 0.004674906569009735, 'criterion': 'L1Loss', 'batch_size': 128, 'no_epochs': 65}. Best is trial 2 with value: 17.7298231083678.[0m
Trial Id: 55 | Model params: 3952 | Timestamp: 2021-08-22 01:10:13.426723

[32m[I 2021-08-22 01:10:16,081][0m Trial 55 pruned. [0m
epoch 0 -0.24301492758268872 20.598955038625075
Trial Id: 56 | Model params: 7453 | Timestamp: 2021-08-22 01:10:16.082097

[32m[I 2021-08-22 01:10:31,994][0m Trial 56 pruned. [0m
epoch 0 -0.14077626016861577 19.73488945904583
Trial Id: 57 | Model params: 12972 | Timestamp: 2021-08-22 01:10:31.994501

epoch 0 -45.43500606814024 125.90117140989697
epoch 5 -45.43500606814024 125.90117140989697
epoch 10 -45.43500606814024 125.90117140989697
epoch 15 -45.43500606814024 125.90117140989697
epoch 20 -45.43500606814024 125.90117140989697
epoch 25 -45.43500606814024 125.90117140989697
epoch 30 -45.43500606814024 125.90117140989697
epoch 35 -45.43500606814024 125.90117140989697
epoch 40 -45.43500606814024 125.90117140989697
epoch 45 -45.43500606814024 125.90117140989697
epoch 50 -45.43500606814024 125.90117140989697
epoch 55 -45.43500606814024 125.90117140989697
epoch 60 -45.43500606814024 125.90117140989697
[32m[I 2021-08-22 01:13:11,537][0m Trial 57 finished with value: 125.90117140989697 and parameters: {'n_layers_mlp': 4, 'mlp_n_units_l0': 64, 'mlp_dropout_l0': 0.2287205435586428, 'mlp_n_units_l1': 65, 'mlp_dropout_l1': 0.07104646047464455, 'mlp_n_units_l2': 75, 'mlp_dropout_l2': 0.1481131391607025, 'mlp_n_units_l3': 36, 'mlp_dropout_l3': 0.22976603550184835, 'lr': 1.3434928541042834e-05, 'criterion': 'MSELoss', 'batch_size': 128, 'no_epochs': 63}. Best is trial 2 with value: 17.7298231083678.[0m
Trial Id: 58 | Model params: 10916 | Timestamp: 2021-08-22 01:13:11.537696

[32m[I 2021-08-22 01:13:20,150][0m Trial 58 pruned. [0m
epoch 0 -0.0017107667489879574 18.492925989932214
Trial Id: 59 | Model params: 2657 | Timestamp: 2021-08-22 01:13:20.151163

epoch 0 -45.43500606814024 125.90117140989697
epoch 5 -45.43500606814024 125.90117140989697
epoch 10 -24.575873048016234 93.43772404200672
epoch 15 -0.4733628543709072 22.42651937792331
epoch 20 -0.23398237141573563 20.523975865631087
epoch 25 -0.1852130169053936 20.114313923371316
epoch 30 -0.14645467975411663 19.78269536303041
epoch 35 -0.11791897313263622 19.534944471237118
epoch 40 -0.09535664708610447 19.3368082928203
epoch 45 -0.07946393319091793 19.19601522669022
epoch 50 -0.06855079833093702 19.098735057933542
epoch 55 -0.06375548836739542 19.055832401320178
[32m[I 2021-08-22 01:14:41,191][0m Trial 59 finished with value: 18.967492617311464 and parameters: {'n_layers_mlp': 2, 'mlp_n_units_l0': 30, 'mlp_dropout_l0': 0.13483474712012777, 'mlp_n_units_l1': 68, 'mlp_dropout_l1': 0.1499403735835516, 'lr': 7.693627815958507e-05, 'criterion': 'MSELoss', 'batch_size': 256, 'no_epochs': 60}. Best is trial 2 with value: 17.7298231083678.[0m
Study statistics: 
  Number of finished trials:  60
  Number of pruned trials:  40
  Number of complete trials:  20

Best trial:
  Value:  17.7298231083678
  Params: 
    n_layers_mlp: 4
    mlp_n_units_l0: 48
    mlp_dropout_l0: 0.26622982847456433
    mlp_n_units_l1: 33
    mlp_dropout_l1: 0.23182166744640043
    mlp_n_units_l2: 48
    mlp_dropout_l2: 0.04568359043671054
    mlp_n_units_l3: 58
    mlp_dropout_l3: 0.20313225565340393
    lr: 0.003155992400443771
    criterion: MSELoss
    batch_size: 128
    no_epochs: 74
Target 17327 0 226.0 8.0 124.33421827206095
[127. 121. 133. ... 135. 117. 110.]
Prediction 17327 0 175.043212890625 104.4248046875 123.8551520841137
[129.3614502  121.20923615 124.34805298 ... 127.05012512 120.27193451
 120.24554443]

 XXXXXX======== TRIAL des - elg ended

Test Set - R-squared:  0.07770411006453126
Test Set - RMSE:  17.834750002294964
Test Set - MAE:  14.062019380728083



[32m[I 2021-08-22 01:14:50,721][0m A new study created in memory with name: NeuralNetwork[0m
++++++++ Session Characteristics +++++++

Area: des
Gal Type: qso
Training Samples: 55443
Validation Samples: 13861
Test Samples: 17327
Number of features: 15
Device: cuda:0
Number of Workers: 8
Number of Trials: 60

+++++++++++++++++++++++++++++++++++++++
Trial Id: 0 | Model params: 1355 | Timestamp: 2021-08-22 01:14:50.721794

epoch 0 -3.6566323234202844 53.3834618424563
epoch 5 -0.04773911948040066 25.321961216405786
epoch 10 -0.04459617837367791 25.283953087834583
epoch 15 -0.07903747912946746 25.697390513035863
epoch 20 -0.06318369416427849 25.50791218468322
epoch 25 -0.13776124429923908 26.387383424069974
epoch 30 -0.1703831465080401 26.76299969883071
epoch 35 -0.25683053661083455 27.73378353638041
epoch 40 -0.27323215527441724 27.914159686064654
epoch 45 -0.3495506860468305 28.738583590377182
epoch 50 -0.26407274507885004 27.813573660349295
[32m[I 2021-08-22 01:26:36,088][0m Trial 0 finished with value: 27.92564188221056 and parameters: {'n_layers_mlp': 2, 'mlp_n_units_l0': 19, 'mlp_dropout_l0': 0.29972987602543644, 'mlp_n_units_l1': 50, 'mlp_dropout_l1': 0.2603053786921944, 'lr': 6.55401033475626e-05, 'criterion': 'L1Loss', 'batch_size': 16, 'no_epochs': 55}. Best is trial 0 with value: 27.92564188221056.[0m
Trial Id: 1 | Model params: 1809 | Timestamp: 2021-08-22 01:26:36.088807

epoch 0 -45.089451688503985 167.98859652774283
epoch 5 -44.07213971370465 166.1242827822917
epoch 10 -41.43864543005814 161.19805144650167
epoch 15 -36.97893201465083 152.4931743801576
epoch 20 -30.45401627317312 138.77686887709208
epoch 25 -22.29831242766529 119.43765374034055
epoch 30 -13.403275400347628 93.90952922547129
epoch 35 -5.353899104059915 62.373366947524275
epoch 40 -0.9584440009883246 34.62857418298255
epoch 45 -0.17423096155291318 26.81364126602693
epoch 50 -0.12236809511367852 26.21480837185399
