[32m[I 2021-08-22 02:54:10,574][0m Trial 48 pruned. [0m
epoch 0 -37.05006294686125 152.5978621476675
Trial Id: 49 | Model params: 2655 | Timestamp: 2021-08-22 02:54:10.575056

epoch 0 -45.140352916652155 168.03943612425067
epoch 5 -45.140352916652155 168.03943612425067
epoch 10 -45.140352916652155 168.03943612425067
epoch 15 -45.140352916652155 168.03943612425067
epoch 20 -45.140352916652155 168.03943612425067
epoch 25 -45.140352916652155 168.03943612425067
epoch 30 -45.140352916652155 168.03943612425067
epoch 35 -45.140352916652155 168.03943612425067
epoch 40 -45.140352916652155 168.03943612425067
epoch 45 -45.140352916652155 168.03943612425067
[32m[I 2021-08-22 03:07:21,036][0m Trial 49 finished with value: 168.03943612425067 and parameters: {'n_layers_mlp': 4, 'mlp_n_units_l0': 33, 'mlp_dropout_l0': 0.09933781868691066, 'mlp_n_units_l1': 35, 'mlp_dropout_l1': 0.2472541116832272, 'mlp_n_units_l2': 16, 'mlp_dropout_l2': 0.15222076813985472, 'mlp_n_units_l3': 20, 'mlp_dropout_l3': 0.26028457023104506, 'lr': 0.0005313003325092562, 'criterion': 'L1Loss', 'batch_size': 16, 'no_epochs': 50}. Best is trial 2 with value: 24.080821930159964.[0m
Trial Id: 50 | Model params: 4559 | Timestamp: 2021-08-22 03:07:21.036943

[32m[I 2021-08-22 03:07:22,365][0m Trial 50 pruned. [0m
epoch 0 -37.94986735738188 154.4301248441069
Trial Id: 51 | Model params: 1670 | Timestamp: 2021-08-22 03:07:22.365570

[32m[I 2021-08-22 03:07:35,129][0m Trial 51 pruned. [0m
epoch 0 -0.5316622974153571 30.616269393210516
Trial Id: 52 | Model params: 879 | Timestamp: 2021-08-22 03:07:35.130056

[32m[I 2021-08-22 03:07:48,017][0m Trial 52 pruned. [0m
epoch 0 -0.4920085721738361 30.21735304556795
Trial Id: 53 | Model params: 2069 | Timestamp: 2021-08-22 03:07:48.017916

epoch 0 -45.140352916652155 168.03943612425067
epoch 5 -9.936757891097008 81.81163246193482
epoch 10 -0.05124968051667822 25.36434769926524
epoch 15 -0.015623063211909871 24.930847189591876
epoch 20 -0.005682015961537168 24.80853400347554
epoch 25 0.00638856054798842 24.65920386029443
epoch 30 0.003927764992989857 24.689720686201273
epoch 35 0.005843512663674444 24.665966365066186
epoch 40 0.009170960700622954 24.624653194689813
epoch 45 0.009788875914367945 24.616973605034953
epoch 50 0.009788144115259412 24.616982701416312
epoch 55 0.015095720193627593 24.550920040387183
epoch 60 0.016064427243621004 24.538843486058333
[32m[I 2021-08-22 03:21:20,616][0m Trial 53 finished with value: 24.590236301029506 and parameters: {'n_layers_mlp': 2, 'mlp_n_units_l0': 26, 'mlp_dropout_l0': 0.044480153594923716, 'mlp_n_units_l1': 59, 'mlp_dropout_l1': 0.19061698184236728, 'lr': 1.417129862125641e-05, 'criterion': 'L1Loss', 'batch_size': 16, 'no_epochs': 64}. Best is trial 2 with value: 24.080821930159964.[0m
Trial Id: 54 | Model params: 2102 | Timestamp: 2021-08-22 03:21:20.616850

[32m[I 2021-08-22 03:21:33,246][0m Trial 54 pruned. [0m
epoch 0 -44.10909362778016 166.1509428184687
Trial Id: 55 | Model params: 6201 | Timestamp: 2021-08-22 03:21:33.246307

[32m[I 2021-08-22 03:21:45,875][0m Trial 55 pruned. [0m
epoch 0 0.0369662196082684 24.276804451825214
Trial Id: 56 | Model params: 2816 | Timestamp: 2021-08-22 03:21:45.876092

[32m[I 2021-08-22 03:21:47,982][0m Trial 56 pruned. [0m
epoch 0 -45.128089050508606 168.0589952442985
Trial Id: 57 | Model params: 8965 | Timestamp: 2021-08-22 03:21:47.982529

[32m[I 2021-08-22 03:21:56,356][0m Trial 57 pruned. [0m
epoch 0 -42.96952270831887 164.03881948963223
Trial Id: 58 | Model params: 2265 | Timestamp: 2021-08-22 03:21:56.356551

[32m[I 2021-08-22 03:22:09,215][0m Trial 58 pruned. [0m
epoch 0 -8.18658674385106 74.98041669489372
Trial Id: 59 | Model params: 5879 | Timestamp: 2021-08-22 03:22:09.215602

[32m[I 2021-08-22 03:22:11,707][0m Trial 59 pruned. [0m
epoch 0 -44.80859582952822 167.47597730684075
Study statistics: 
  Number of finished trials:  60
  Number of pruned trials:  43
  Number of complete trials:  17

Best trial:
  Value:  24.080821930159964
  Params: 
    n_layers_mlp: 4
    mlp_n_units_l0: 17
    mlp_dropout_l0: 0.0008526025063186893
    mlp_n_units_l1: 46
    mlp_dropout_l1: 0.22295744505363885
    mlp_n_units_l2: 59
    mlp_dropout_l2: 0.17305319637218802
    mlp_n_units_l3: 78
    mlp_dropout_l3: 0.030134693536798762
    lr: 0.00011377624891759982
    criterion: MSELoss
    batch_size: 32
    no_epochs: 62
Target 17327 0 332.0 19.0 165.8452126738616
[138. 178. 199. ... 158. 166. 161.]
Prediction 17327 0 182.66644287109375 153.283203125 163.91564679593012
[159.90490723 159.15414429 169.24562073 ... 164.57827759 162.65657043
 164.04736328]

 XXXXXX======== TRIAL des - qso ended

Test Set - R-squared:  0.05089526998285998
Test Set - RMSE:  23.988187647991644
Test Set - MAE:  18.54447865151778



[32m[I 2021-08-22 03:22:21,921][0m A new study created in memory with name: NeuralNetwork[0m
++++++++ Session Characteristics +++++++

Area: north
Gal Type: lrg
Training Samples: 62423
Validation Samples: 15606
Test Samples: 19508
Number of features: 15
Device: cuda:0
Number of Workers: 8
Number of Trials: 60

+++++++++++++++++++++++++++++++++++++++
Trial Id: 0 | Model params: 6595 | Timestamp: 2021-08-22 03:22:21.921649

epoch 0 -8.920477919975438 37.13267148804194
epoch 5 0.018540259945164173 11.679550872431365
epoch 10 0.02087268103774853 11.665664498001757
epoch 15 0.02251301896948077 11.65588862267142
epoch 20 0.02149687435674119 11.661945476696054
epoch 25 0.02390427961704944 11.647590735443588
epoch 30 0.023767983207016563 11.64840390845279
epoch 35 0.023678187973091513 11.648939614660147
epoch 40 0.025481022722090296 11.638179424335728
epoch 45 0.024154596555699737 11.646097144117322
epoch 50 0.02575433098594515 11.636547319812093
epoch 55 0.02681311642379791 11.63022244894437
epoch 60 0.026993682430832 11.629143457702783
epoch 65 0.027070011984288933 11.628687312290253
[32m[I 2021-08-22 03:25:36,081][0m Trial 0 finished with value: 11.639521207561222 and parameters: {'n_layers_mlp': 4, 'mlp_n_units_l0': 30, 'mlp_dropout_l0': 0.08752053678878081, 'mlp_n_units_l1': 28, 'mlp_dropout_l1': 0.2606411673450918, 'mlp_n_units_l2': 50, 'mlp_dropout_l2': 0.2845387977306847, 'mlp_n_units_l3': 73, 'mlp_dropout_l3': 0.08455566483639344, 'lr': 0.00042966343711901, 'criterion': 'MSELoss', 'batch_size': 128, 'no_epochs': 68}. Best is trial 0 with value: 11.639521207561222.[0m
Trial Id: 1 | Model params: 5111 | Timestamp: 2021-08-22 03:25:36.082001

epoch 0 -8.910028093687087 37.12956755688094
epoch 5 -8.910028093687087 37.12956755688094
epoch 10 -8.910028093687087 37.12956755688094
epoch 15 -8.910028093687087 37.12956755688094
epoch 20 -8.910028093687087 37.12956755688094
epoch 25 -8.910028093687087 37.12956755688094
epoch 30 -8.910028093687087 37.12956755688094
epoch 35 -8.910028093687087 37.12956755688094
epoch 40 -8.910028093687087 37.12956755688094
epoch 45 -8.910028093687087 37.12956755688094
epoch 50 -8.910028093687087 37.12956755688094
epoch 55 -8.910028093687087 37.12956755688094
epoch 60 -8.910028093687087 37.12956755688094
epoch 65 -8.910028093687087 37.12956755688094
epoch 70 -8.910028093687087 37.12956755688094
[32m[I 2021-08-22 03:37:11,272][0m Trial 1 finished with value: 37.12956755688094 and parameters: {'n_layers_mlp': 4, 'mlp_n_units_l0': 17, 'mlp_dropout_l0': 0.22346166042365076, 'mlp_n_units_l1': 39, 'mlp_dropout_l1': 0.0019608219252241986, 'mlp_n_units_l2': 60, 'mlp_dropout_l2': 0.05741931307123473, 'mlp_n_units_l3': 28, 'mlp_dropout_l3': 0.07773386720965554, 'lr': 2.3003422899047856e-05, 'criterion': 'MSELoss', 'batch_size': 32, 'no_epochs': 73}. Best is trial 0 with value: 11.639521207561222.[0m
Trial Id: 2 | Model params: 7833 | Timestamp: 2021-08-22 03:37:11.272274

epoch 0 -8.910028093687087 37.12956755688094
epoch 5 -0.026842042756335616 11.951826203495106
epoch 10 0.015614440009375952 11.702133961820712
epoch 15 0.01745869737696526 11.691166783133596
epoch 20 0.01774584649350408 11.689458278096758
epoch 25 0.021460103097653005 11.66733632031302
epoch 30 0.024137353994574173 11.651364676530372
epoch 35 0.025293561248362684 11.644460331425753
epoch 40 0.027631912155575367 11.630484233793068
epoch 45 0.028564263051008343 11.624906977027344
epoch 50 0.02912108139479186 11.621574852713664
epoch 55 0.030261021756630146 11.614750215278919
[32m[I 2021-08-22 03:46:40,416][0m Trial 2 finished with value: 11.644663719326521 and parameters: {'n_layers_mlp': 4, 'mlp_n_units_l0': 47, 'mlp_dropout_l0': 0.07388067002506032, 'mlp_n_units_l1': 43, 'mlp_dropout_l1': 0.046206913626555254, 'mlp_n_units_l2': 56, 'mlp_dropout_l2': 0.19000124111774444, 'mlp_n_units_l3': 44, 'mlp_dropout_l3': 0.20658428762628508, 'lr': 0.00022122611633550152, 'criterion': 'MSELoss', 'batch_size': 32, 'no_epochs': 60}. Best is trial 0 with value: 11.639521207561222.[0m
Trial Id: 3 | Model params: 781 | Timestamp: 2021-08-22 03:46:40.416308

epoch 0 -8.9263218916257 37.12410475211266
epoch 5 -8.9263218916257 37.12410475211266
epoch 10 -8.9263218916257 37.12410475211266
epoch 15 -8.9263218916257 37.12410475211266
epoch 20 -8.9263218916257 37.12410475211266
epoch 25 -8.9263218916257 37.12410475211266
epoch 30 -8.9263218916257 37.12410475211266
epoch 35 -8.9263218916257 37.12410475211266
epoch 40 -8.9263218916257 37.12410475211266
epoch 45 -8.9263218916257 37.12410475211266
[32m[I 2021-08-22 03:47:49,466][0m Trial 3 finished with value: 37.12410475211266 and parameters: {'n_layers_mlp': 2, 'mlp_n_units_l0': 12, 'mlp_dropout_l0': 0.027365541108111034, 'mlp_n_units_l1': 42, 'mlp_dropout_l1': 0.013274540261406642, 'lr': 1.711828161457321e-05, 'criterion': 'L1Loss', 'batch_size': 256, 'no_epochs': 47}. Best is trial 0 with value: 11.639521207561222.[0m
Trial Id: 4 | Model params: 1313 | Timestamp: 2021-08-22 03:47:49.466347

epoch 0 -0.052385588141221184 12.099568825188117
epoch 5 0.005569752927590765 11.761686815314341
epoch 10 -0.008012611269964554 11.84173753736667
epoch 15 0.00047053830928456275 11.791803898423192
epoch 20 0.004875594519387461 11.765791200475249
epoch 25 0.003364526441279936 11.774720821397757
epoch 30 0.001417329524716071 11.78621775921799
epoch 35 0.01369117136701381 11.71356005635561
epoch 40 -0.0011087866423804549 11.801116149938682
epoch 45 -0.0086871951921772 11.845699248576738
epoch 50 0.00947238098550185 11.738584836749663
epoch 55 0.0037153529916886807 11.772648223948384
epoch 60 0.005520983040226857 11.76197522624617
epoch 65 0.005788177726552268 11.760395027794498
[32m[I 2021-08-22 03:56:27,144][0m Trial 4 finished with value: 11.775095330461095 and parameters: {'n_layers_mlp': 2, 'mlp_n_units_l0': 46, 'mlp_dropout_l0': 0.13036312000739497, 'mlp_n_units_l1': 12, 'mlp_dropout_l1': 0.2110192627439, 'lr': 0.007310528391245456, 'criterion': 'L1Loss', 'batch_size': 32, 'no_epochs': 68}. Best is trial 0 with value: 11.639521207561222.[0m
Trial Id: 5 | Model params: 1187 | Timestamp: 2021-08-22 03:56:27.144764

[32m[I 2021-08-22 03:56:41,785][0m Trial 5 pruned. [0m
epoch 0 -3.7823467498694985 25.791202291682747
Trial Id: 6 | Model params: 644 | Timestamp: 2021-08-22 03:56:41.785316

epoch 0 -8.910028093687087 37.12956755688094
epoch 5 -8.910028093687087 37.12956755688094
epoch 10 -8.910028093687087 37.12956755688094
epoch 15 -0.029801254082201467 11.969035537202604
epoch 20 0.0061447169954848 11.758286111695819
epoch 25 -2.9681638113121522e-05 11.79475416550031
epoch 30 0.002906958047955932 11.77742347546608
epoch 35 -0.015416500933844057 11.885146970867646
epoch 40 0.016536875863016665 11.696649831241452
epoch 45 0.00244491581868711 11.78015192532592
epoch 50 0.008578789453504987 11.743878548470388
epoch 55 0.00808101407405415 11.746826377280321
epoch 60 0.006364529939766994 11.756985738059178
[32m[I 2021-08-22 04:04:32,437][0m Trial 6 finished with value: 11.751048172880699 and parameters: {'n_layers_mlp': 2, 'mlp_n_units_l0': 23, 'mlp_dropout_l0': 0.17622798497917394, 'mlp_n_units_l1': 11, 'mlp_dropout_l1': 0.027545978898261846, 'lr': 0.004995411017189337, 'criterion': 'L1Loss', 'batch_size': 32, 'no_epochs': 62}. Best is trial 0 with value: 11.639521207561222.[0m
Trial Id: 7 | Model params: 4807 | Timestamp: 2021-08-22 04:04:32.437962

[32m[I 2021-08-22 04:04:33,844][0m Trial 7 pruned. [0m
epoch 0 -0.021686404628129097 11.910242920136705
Trial Id: 8 | Model params: 4131 | Timestamp: 2021-08-22 04:04:33.844710

[32m[I 2021-08-22 04:04:52,183][0m Trial 8 pruned. [0m
epoch 0 0.01118160046007688 11.727604901971572
Trial Id: 9 | Model params: 4097 | Timestamp: 2021-08-22 04:04:52.183236

epoch 0 -8.9263218916257 37.12410475211266
epoch 5 -8.9263218916257 37.12410475211266
epoch 10 -8.9263218916257 37.12410475211266
epoch 15 -8.9263218916257 37.12410475211266
epoch 20 -8.9263218916257 37.12410475211266
epoch 25 -8.9263218916257 37.12410475211266
epoch 30 -8.9263218916257 37.12410475211266
epoch 35 -8.9263218916257 37.12410475211266
epoch 40 -8.9263218916257 37.12410475211266
[32m[I 2021-08-22 04:05:54,681][0m Trial 9 finished with value: 37.12410475211266 and parameters: {'n_layers_mlp': 2, 'mlp_n_units_l0': 41, 'mlp_dropout_l0': 0.020062577854328956, 'mlp_n_units_l1': 80, 'mlp_dropout_l1': 0.04016619266679063, 'lr': 0.008140385494052596, 'criterion': 'L1Loss', 'batch_size': 256, 'no_epochs': 42}. Best is trial 0 with value: 11.639521207561222.[0m
Trial Id: 10 | Model params: 3952 | Timestamp: 2021-08-22 04:05:54.682282

[32m[I 2021-08-22 04:05:57,521][0m Trial 10 pruned. [0m
epoch 0 -0.4085600933374929 13.99192884794776
Trial Id: 11 | Model params: 13545 | Timestamp: 2021-08-22 04:05:57.521255

[32m[I 2021-08-22 04:06:00,444][0m Trial 11 pruned. [0m
epoch 0 -0.01485806310512161 11.87661152536977
Trial Id: 12 | Model params: 6929 | Timestamp: 2021-08-22 04:06:00.444829

epoch 0 -8.920477919975438 37.13267148804194
epoch 5 -8.920477919975438 37.13267148804194
epoch 10 -8.920477919975438 37.13267148804194
epoch 15 -8.920477919975438 37.13267148804194
epoch 20 -8.920477919975438 37.13267148804194
epoch 25 -8.920477919975438 37.13267148804194
epoch 30 -8.920477919975438 37.13267148804194
epoch 35 -8.920477919975438 37.13267148804194
epoch 40 -8.920477919975438 37.13267148804194
epoch 45 -8.920477919975438 37.13267148804194
epoch 50 -8.920477919975438 37.13267148804194
[32m[I 2021-08-22 04:08:37,846][0m Trial 12 finished with value: 37.13267148804194 and parameters: {'n_layers_mlp': 4, 'mlp_n_units_l0': 32, 'mlp_dropout_l0': 0.08043069041642056, 'mlp_n_units_l1': 58, 'mlp_dropout_l1': 0.09669431749290194, 'mlp_n_units_l2': 40, 'mlp_dropout_l2': 0.2895881718761887, 'mlp_n_units_l3': 51, 'mlp_dropout_l3': 0.1981561671334762, 'lr': 0.00044906459537022, 'criterion': 'MSELoss', 'batch_size': 128, 'no_epochs': 56}. Best is trial 0 with value: 11.639521207561222.[0m
epoch 55 -8.920477919975438 37.13267148804194
Trial Id: 13 | Model params: 7190 | Timestamp: 2021-08-22 04:08:37.846621

[32m[I 2021-08-22 04:08:47,305][0m Trial 13 pruned. [0m
epoch 0 -0.013267171082795182 11.872561675432067
Trial Id: 14 | Model params: 5231 | Timestamp: 2021-08-22 04:08:47.305438

[32m[I 2021-08-22 04:08:50,220][0m Trial 14 pruned. [0m
epoch 0 -0.056391416088904966 12.117201495867695
Trial Id: 15 | Model params: 6475 | Timestamp: 2021-08-22 04:08:50.220778

[32m[I 2021-08-22 04:08:59,918][0m Trial 15 pruned. [0m
epoch 0 -0.030418093069848773 11.972619657190627
Trial Id: 16 | Model params: 9279 | Timestamp: 2021-08-22 04:08:59.918526

[32m[I 2021-08-22 04:09:02,797][0m Trial 16 pruned. [0m
epoch 0 -0.005130675782330396 11.81955597569229
Trial Id: 17 | Model params: 7627 | Timestamp: 2021-08-22 04:09:02.797448

[32m[I 2021-08-22 04:09:20,980][0m Trial 17 pruned. [0m
epoch 0 -0.016701712787728917 11.891806515497638
Trial Id: 18 | Model params: 6190 | Timestamp: 2021-08-22 04:09:20.980588

[32m[I 2021-08-22 04:09:30,532][0m Trial 18 pruned. [0m
epoch 0 -8.910028093687087 37.12956755688094
Trial Id: 19 | Model params: 7404 | Timestamp: 2021-08-22 04:09:30.533139

[32m[I 2021-08-22 04:09:33,357][0m Trial 19 pruned. [0m
epoch 0 -0.018729403919459653 11.89924259468382
Trial Id: 20 | Model params: 6969 | Timestamp: 2021-08-22 04:09:33.357966

[32m[I 2021-08-22 04:09:42,891][0m Trial 20 pruned. [0m
epoch 0 -8.910028093687087 37.12956755688094
Trial Id: 21 | Model params: 761 | Timestamp: 2021-08-22 04:09:42.891212

[32m[I 2021-08-22 04:09:50,743][0m Trial 21 pruned. [0m
epoch 0 -8.910028093687087 37.12956755688094
Trial Id: 22 | Model params: 1166 | Timestamp: 2021-08-22 04:09:50.743706

[32m[I 2021-08-22 04:09:58,433][0m Trial 22 pruned. [0m
epoch 0 -0.03817341437900601 12.017590459989544
Trial Id: 23 | Model params: 749 | Timestamp: 2021-08-22 04:09:58.433255

[32m[I 2021-08-22 04:10:06,139][0m Trial 23 pruned. [0m
epoch 0 -8.910028093687087 37.12956755688094
Trial Id: 24 | Model params: 2319 | Timestamp: 2021-08-22 04:10:06.139801

[32m[I 2021-08-22 04:10:13,587][0m Trial 24 pruned. [0m
epoch 0 -0.04018290186876694 12.029215455802785
Trial Id: 25 | Model params: 5605 | Timestamp: 2021-08-22 04:10:13.587851

epoch 0 -8.920477919975438 37.13267148804194
epoch 5 -8.920477919975438 37.13267148804194
epoch 10 -8.920477919975438 37.13267148804194
epoch 15 -8.920477919975438 37.13267148804194
epoch 20 -8.920477919975438 37.13267148804194
epoch 25 -8.920477919975438 37.13267148804194
epoch 30 -8.920477919975438 37.13267148804194
epoch 35 -8.920477919975438 37.13267148804194
epoch 40 -8.920477919975438 37.13267148804194
epoch 45 -8.920477919975438 37.13267148804194
epoch 50 -8.920477919975438 37.13267148804194
epoch 55 -8.920477919975438 37.13267148804194
epoch 60 -8.920477919975438 37.13267148804194
[32m[I 2021-08-22 04:13:17,350][0m Trial 25 finished with value: 37.13267148804194 and parameters: {'n_layers_mlp': 4, 'mlp_n_units_l0': 39, 'mlp_dropout_l0': 0.1422518202120441, 'mlp_n_units_l1': 19, 'mlp_dropout_l1': 0.028073065056249458, 'mlp_n_units_l2': 69, 'mlp_dropout_l2': 0.09546828517971931, 'mlp_n_units_l3': 40, 'mlp_dropout_l3': 0.10594391509039539, 'lr': 0.0003905809608715221, 'criterion': 'MSELoss', 'batch_size': 128, 'no_epochs': 65}. Best is trial 0 with value: 11.639521207561222.[0m
Trial Id: 26 | Model params: 7179 | Timestamp: 2021-08-22 04:13:17.350330

[32m[I 2021-08-22 04:13:26,937][0m Trial 26 pruned. [0m
epoch 0 -8.910028093687087 37.12956755688094
Trial Id: 27 | Model params: 729 | Timestamp: 2021-08-22 04:13:26.938011

[32m[I 2021-08-22 04:13:34,605][0m Trial 27 pruned. [0m
epoch 0 -0.030031936584847818 11.970376034922438
Trial Id: 28 | Model params: 2375 | Timestamp: 2021-08-22 04:13:34.605688

[32m[I 2021-08-22 04:13:37,445][0m Trial 28 pruned. [0m
epoch 0 -0.06685129861996408 12.177043096798666
Trial Id: 29 | Model params: 8670 | Timestamp: 2021-08-22 04:13:37.446124

[32m[I 2021-08-22 04:13:55,499][0m Trial 29 pruned. [0m
epoch 0 -0.04479733725727075 12.054996410500252
Trial Id: 30 | Model params: 1217 | Timestamp: 2021-08-22 04:13:55.499624

[32m[I 2021-08-22 04:13:56,916][0m Trial 30 pruned. [0m
epoch 0 -2.9415275982942126 23.393440469676975
Trial Id: 31 | Model params: 1238 | Timestamp: 2021-08-22 04:13:56.917060

[32m[I 2021-08-22 04:14:04,788][0m Trial 31 pruned. [0m
epoch 0 -0.07393317002113342 12.222810439938272
Trial Id: 32 | Model params: 1499 | Timestamp: 2021-08-22 04:14:04.788622

[32m[I 2021-08-22 04:14:12,549][0m Trial 32 pruned. [0m
epoch 0 -0.023997266960334773 11.935258978035954
Trial Id: 33 | Model params: 1184 | Timestamp: 2021-08-22 04:14:12.549578

[32m[I 2021-08-22 04:14:20,168][0m Trial 33 pruned. [0m
epoch 0 -0.07491503552901557 12.228396641432257
Trial Id: 34 | Model params: 1805 | Timestamp: 2021-08-22 04:14:20.168558

[32m[I 2021-08-22 04:14:27,809][0m Trial 34 pruned. [0m
epoch 0 -8.910028093687087 37.12956755688094
Trial Id: 35 | Model params: 3269 | Timestamp: 2021-08-22 04:14:27.809251

[32m[I 2021-08-22 04:14:35,406][0m Trial 35 pruned. [0m
epoch 0 -6.95019270998916 33.256096846301205
Trial Id: 36 | Model params: 2621 | Timestamp: 2021-08-22 04:14:35.406744

[32m[I 2021-08-22 04:14:36,877][0m Trial 36 pruned. [0m
epoch 0 -0.024895914513529016 11.928935577982987
Trial Id: 37 | Model params: 585 | Timestamp: 2021-08-22 04:14:36.877594

[32m[I 2021-08-22 04:14:51,576][0m Trial 37 pruned. [0m
epoch 0 -8.911176614126058 37.129035220569044
Trial Id: 38 | Model params: 1621 | Timestamp: 2021-08-22 04:14:51.577196

[32m[I 2021-08-22 04:14:59,086][0m Trial 38 pruned. [0m
epoch 0 -6.407713941914762 32.10144262461666
Trial Id: 39 | Model params: 6494 | Timestamp: 2021-08-22 04:14:59.086953

[32m[I 2021-08-22 04:15:00,834][0m Trial 39 pruned. [0m
epoch 0 -0.06888814429815748 12.182262189637388
Trial Id: 40 | Model params: 2314 | Timestamp: 2021-08-22 04:15:00.834558

[32m[I 2021-08-22 04:15:03,177][0m Trial 40 pruned. [0m
epoch 0 -0.0029937893949860683 11.806985228846703
Trial Id: 41 | Model params: 839 | Timestamp: 2021-08-22 04:15:03.177593

[32m[I 2021-08-22 04:15:04,667][0m Trial 41 pruned. [0m
epoch 0 -8.856630832420521 36.993554114655986
Trial Id: 42 | Model params: 1295 | Timestamp: 2021-08-22 04:15:04.667391

[32m[I 2021-08-22 04:15:06,133][0m Trial 42 pruned. [0m
epoch 0 -8.852895971674805 36.9865446777433
Trial Id: 43 | Model params: 1494 | Timestamp: 2021-08-22 04:15:06.133816

[32m[I 2021-08-22 04:15:07,680][0m Trial 43 pruned. [0m
epoch 0 -8.65439609629375 36.61207713491734
Trial Id: 44 | Model params: 1796 | Timestamp: 2021-08-22 04:15:07.680836

[32m[I 2021-08-22 04:15:09,195][0m Trial 44 pruned. [0m
epoch 0 -0.04866463862664405 12.066466848909961
Trial Id: 45 | Model params: 4995 | Timestamp: 2021-08-22 04:15:09.195825

[32m[I 2021-08-22 04:15:12,014][0m Trial 45 pruned. [0m
epoch 0 -8.387518695058068 36.12146079982676
Trial Id: 46 | Model params: 3108 | Timestamp: 2021-08-22 04:15:12.015162

