[32m[I 2021-08-23 00:48:06,077][0m Trial 58 pruned. [0m
epoch 0 -0.017061123210231788 27.958981766857082
Trial Id: 59 | Model params: 4173 | Timestamp: 2021-08-23 00:48:06.077676

[32m[I 2021-08-23 00:48:40,484][0m Trial 59 pruned. [0m
epoch 0 -0.018839396393989905 27.985598894486326
Study statistics: 
  Number of finished trials:  60
  Number of pruned trials:  45
  Number of complete trials:  15

Best trial:
  Value:  25.162935124976194
  Params: 
    n_layers_mlp: 4
    mlp_n_units_l0: 29
    mlp_dropout_l0: 0.0602878544505272
    mlp_n_units_l1: 62
    mlp_dropout_l1: 0.23450836286106047
    mlp_n_units_l2: 22
    mlp_dropout_l2: 0.2889133262483633
    mlp_n_units_l3: 34
    mlp_dropout_l3: 0.19359215951852965
    lr: 0.0011912772207786039
    weight_decay: 0.15312074922163604
    batch_size: 32
Target 37144 0 344.0 1.0 158.8293667887142
[166. 176. 138. ... 178. 189. 186.]
Prediction 37144 0 213.19525146484375 17.839147567749023 159.17827307045678
[157.2646637  160.45678711 167.19464111 ... 167.94673157 161.14173889
 157.94119263]

 XXXXXX======== TRIAL south - qso ended

Test Set - R-squared:  0.17131921479608947
Test Set - RMSE:  25.61891755249509
Test Set - MAE:  19.446385982759086



