[32m[I 2021-08-22 23:48:12,138][0m Trial 6 finished with value: 25.162935124976194 and parameters: {'n_layers_mlp': 4, 'mlp_n_units_l0': 29, 'mlp_dropout_l0': 0.0602878544505272, 'mlp_n_units_l1': 62, 'mlp_dropout_l1': 0.23450836286106047, 'mlp_n_units_l2': 22, 'mlp_dropout_l2': 0.2889133262483633, 'mlp_n_units_l3': 34, 'mlp_dropout_l3': 0.19359215951852965, 'lr': 0.0011912772207786039, 'weight_decay': 0.15312074922163604, 'batch_size': 32}. Best is trial 6 with value: 25.162935124976194.[0m
Trial Id: 7 | Model params: 8009 | Timestamp: 2021-08-22 23:48:12.139111

epoch 0 -19.09612673040655 124.28078974830339
epoch 5 -0.05263562645722186 28.443750222141276
epoch 10 0.0064929145292176305 27.633335399429207
epoch 15 0.021454824654064675 27.42447130722834
epoch 20 0.043651793701857455 27.11164366042539
epoch 25 0.055682297637003164 26.940576782995617
epoch 30 0.07083075976733111 26.72361682622847
epoch 35 0.07969483394532317 26.595842590492648
epoch 40 0.08240645748680586 26.556632165130697
epoch 45 0.09020782850771503 26.443499078670715
epoch 50 0.10023206755478298 26.297416172407864
epoch 55 0.10386937699624654 26.244208728221928
epoch 60 0.10469024081912948 26.232186007096796
epoch 65 0.11146056483357147 26.132814015614713
epoch 70 0.11497635034301745 26.08106142542437
epoch 75 0.11673609334793522 26.055119292395887
epoch 80 0.12187618636157149 25.979195693840143
epoch 85 0.12420671796821947 25.94469853022218
epoch 90 0.12337792257958458 25.95697183838435
epoch 95 0.12675433757448862 25.90693541758618
[32m[I 2021-08-22 23:53:12,471][0m Trial 7 finished with value: 25.880454917738614 and parameters: {'n_layers_mlp': 4, 'mlp_n_units_l0': 29, 'mlp_dropout_l0': 0.29668191899379104, 'mlp_n_units_l1': 40, 'mlp_dropout_l1': 0.07553338149722923, 'mlp_n_units_l2': 61, 'mlp_dropout_l2': 0.22028421648186217, 'mlp_n_units_l3': 61, 'mlp_dropout_l3': 0.03471069201035669, 'lr': 7.910469265959763e-05, 'weight_decay': 0.1632031311935168, 'batch_size': 256}. Best is trial 6 with value: 25.162935124976194.[0m
Trial Id: 8 | Model params: 3389 | Timestamp: 2021-08-22 23:53:12.471964

[32m[I 2021-08-22 23:53:40,077][0m Trial 8 pruned. [0m
epoch 0 -0.14264150229266725 29.637170419421842
Trial Id: 9 | Model params: 5357 | Timestamp: 2021-08-22 23:53:40.077638

[32m[I 2021-08-22 23:53:57,641][0m Trial 9 pruned. [0m
epoch 0 0.006909116958979777 27.627546680722784
Trial Id: 10 | Model params: 7477 | Timestamp: 2021-08-22 23:53:57.641592

[32m[I 2021-08-22 23:54:15,750][0m Trial 10 pruned. [0m
epoch 0 0.03627788194129811 27.21596496163115
Trial Id: 11 | Model params: 9375 | Timestamp: 2021-08-22 23:54:15.751028

[32m[I 2021-08-22 23:54:18,674][0m Trial 11 pruned. [0m
epoch 0 -0.016091426260929076 27.94565011742255
Trial Id: 12 | Model params: 8086 | Timestamp: 2021-08-22 23:54:18.674808

epoch 0 -32.79744155873155 161.1720525691853
epoch 5 -32.79744155873155 161.1720525691853
epoch 10 -32.79744155873155 161.1720525691853
epoch 15 -32.79744155873155 161.1720525691853
epoch 20 -32.79744155873155 161.1720525691853
epoch 25 -32.79744155873155 161.1720525691853
epoch 30 -0.09196037949320379 28.970184717037167
epoch 35 -0.0006684373934968679 27.732749240005276
epoch 40 0.020709387479596275 27.434915039968146
epoch 45 0.012223951078328188 27.553518806188443
epoch 50 0.026819813813299342 27.349189032672335
epoch 55 0.033437298457759446 27.256045154577563
epoch 60 0.03285463268690847 27.264259195878342
epoch 65 0.03539481438937653 27.228431227624448
epoch 70 0.04659948134238445 27.069829218821845
epoch 75 0.04356710004337727 27.11284412979363
epoch 80 0.04587180510125932 27.08015767680906
epoch 85 0.048231666883391755 27.04664803259127
epoch 90 0.05308083149782761 26.977660063242013
epoch 95 0.05295022098707092 26.97952054119107
[32m[I 2021-08-22 23:59:18,184][0m Trial 12 finished with value: 26.981062391693428 and parameters: {'n_layers_mlp': 4, 'mlp_n_units_l0': 36, 'mlp_dropout_l0': 0.01866768397120755, 'mlp_n_units_l1': 67, 'mlp_dropout_l1': 0.18278506424376528, 'mlp_n_units_l2': 39, 'mlp_dropout_l2': 0.23909488326553668, 'mlp_n_units_l3': 58, 'mlp_dropout_l3': 0.14730145606764086, 'lr': 4.134140780811212e-05, 'weight_decay': 0.1961774672956898, 'batch_size': 256}. Best is trial 6 with value: 25.162935124976194.[0m
Trial Id: 13 | Model params: 8297 | Timestamp: 2021-08-22 23:59:18.184670

[32m[I 2021-08-22 23:59:35,909][0m Trial 13 pruned. [0m
epoch 0 -0.033520820154082864 28.18431206648417
Trial Id: 14 | Model params: 7064 | Timestamp: 2021-08-22 23:59:35.909244

[32m[I 2021-08-22 23:59:38,854][0m Trial 14 pruned. [0m
epoch 0 -0.04665819929293602 28.362875845758058
Trial Id: 15 | Model params: 6389 | Timestamp: 2021-08-22 23:59:38.854460

epoch 0 -32.79744155873155 161.1720525691853
epoch 5 -31.909568932178736 159.0409351849562
epoch 10 -12.4250865347688 101.57957016979135
epoch 15 -0.21950713703858304 30.615404165026465
epoch 20 -0.18096474710413757 30.127721687439273
epoch 25 -0.13765885635884256 29.570171949697077
epoch 30 -0.09483147627719779 29.008245439565492
epoch 35 -0.05535647422458534 28.48048713604684
epoch 40 -0.041174486144998745 28.2884780474725
epoch 45 -0.025151973034585495 28.0699700900053
epoch 50 -0.013501038400942411 27.910005554830025
epoch 55 -0.0047963489334461595 27.78989130326833
epoch 60 -0.0013413708659053558 27.742072587319544
epoch 65 0.008587134839663113 27.60419578806415
epoch 70 0.008381562861416225 27.607057539813965
epoch 75 0.010214712655228442 27.581527920469817
epoch 80 0.014230828710119381 27.525514150742623
epoch 85 0.015042751596729409 27.514176203039707
epoch 90 0.013893507200812727 27.530223241915905
epoch 95 0.018149044105091328 27.47075575453116
[32m[I 2021-08-23 00:04:36,522][0m Trial 15 finished with value: 27.441225478602053 and parameters: {'n_layers_mlp': 4, 'mlp_n_units_l0': 50, 'mlp_dropout_l0': 0.286088837978234, 'mlp_n_units_l1': 40, 'mlp_dropout_l1': 0.005346516899448539, 'mlp_n_units_l2': 28, 'mlp_dropout_l2': 0.20004582730903558, 'mlp_n_units_l3': 80, 'mlp_dropout_l3': 0.009205336117335261, 'lr': 1.237734490058673e-05, 'weight_decay': 0.11093656886566966, 'batch_size': 256}. Best is trial 6 with value: 25.162935124976194.[0m
Trial Id: 16 | Model params: 1691 | Timestamp: 2021-08-23 00:04:36.522224

[32m[I 2021-08-23 00:04:54,429][0m Trial 16 pruned. [0m
epoch 0 -0.17903175350048062 30.103055183499205
Trial Id: 17 | Model params: 10943 | Timestamp: 2021-08-23 00:04:54.429336

epoch 0 -32.79744155873155 161.1720525691853
epoch 5 0.03861398795743998 27.182958582051988
epoch 10 0.024853690020998354 27.376801986816734
epoch 15 0.0768057661756133 26.63755537563828
epoch 20 0.09499906356207632 26.37377751455683
epoch 25 0.11474410022081183 26.08448332966551
epoch 30 0.12242891369564057 25.971018218370908
epoch 35 0.12550590930432903 25.92544761896836
epoch 40 0.12625147594351238 25.914393644634956
epoch 45 0.13351744800287113 25.806418439926855
epoch 50 0.14162248807248778 25.685438808371273
epoch 55 0.14067855583630684 25.699557684713298
epoch 60 0.1407444472644006 25.698572364824322
epoch 65 0.1448364592756154 25.63730749179377
epoch 70 0.14741605806122637 25.598610849150305
epoch 75 0.1441727794364458 25.647253930876683
epoch 80 0.1561055791659186 25.467826453383847
epoch 85 0.15091235436458406 25.546069234793517
epoch 90 0.15253841151219416 25.52159633415191
epoch 95 0.156693203150028 25.458957979203053
[32m[I 2021-08-23 00:13:23,926][0m Trial 17 finished with value: 25.456868745049317 and parameters: {'n_layers_mlp': 4, 'mlp_n_units_l0': 29, 'mlp_dropout_l0': 0.12517436865665185, 'mlp_n_units_l1': 68, 'mlp_dropout_l1': 0.18253389649175658, 'mlp_n_units_l2': 65, 'mlp_dropout_l2': 0.2995089698962755, 'mlp_n_units_l3': 59, 'mlp_dropout_l3': 0.18367020741110202, 'lr': 0.0006218553560226107, 'weight_decay': 0.055925329209710536, 'batch_size': 128}. Best is trial 6 with value: 25.162935124976194.[0m
Trial Id: 18 | Model params: 4681 | Timestamp: 2021-08-23 00:13:23.927071

[32m[I 2021-08-23 00:13:29,100][0m Trial 18 pruned. [0m
epoch 0 -2.6402644882211304 52.894960048460206
Trial Id: 19 | Model params: 1375 | Timestamp: 2021-08-23 00:13:29.100780

[32m[I 2021-08-23 00:13:33,067][0m Trial 19 pruned. [0m
epoch 0 -0.18300567457669525 30.153743612335983
Trial Id: 20 | Model params: 15395 | Timestamp: 2021-08-23 00:13:33.067725

[32m[I 2021-08-23 00:13:38,098][0m Trial 20 pruned. [0m
epoch 0 0.008472165000625642 27.60579631094154
Trial Id: 21 | Model params: 9263 | Timestamp: 2021-08-23 00:13:38.098333

[32m[I 2021-08-23 00:13:55,889][0m Trial 21 pruned. [0m
epoch 0 0.04128588620184226 27.145158659694424
Trial Id: 22 | Model params: 9629 | Timestamp: 2021-08-23 00:13:55.889804

epoch 0 -32.79744155873155 161.1720525691853
epoch 5 -0.026116881338125175 28.08317719373667
epoch 10 0.01852397258001548 27.465510278152422
epoch 15 0.0325973585150513 27.26788529156344
epoch 20 0.025333487546962075 27.370066106336104
epoch 25 0.016348872603735853 27.495927306869653
epoch 30 0.030708780431216942 27.294488703258494
epoch 35 0.043879625532485256 27.108414050492684
epoch 40 0.05852496520585515 26.899996782794016
epoch 45 0.0629186949343784 26.83715415319507
epoch 50 0.0712836597715516 26.717103157431996
epoch 55 0.08712896660978198 26.488205507225732
epoch 60 0.09371213025894853 26.39252292877843
epoch 65 0.09777395259566923 26.33331319670478
epoch 70 0.10070380681645141 26.290521533417785
epoch 75 0.09859106588384003 26.321385933984555
epoch 80 0.10284786040508331 26.259162607883628
epoch 85 0.10404348696601917 26.241659099719268
epoch 90 0.10679954497645239 26.201266938851887
epoch 95 0.1083935334595223 26.177877358611347
[32m[I 2021-08-23 00:19:01,317][0m Trial 22 finished with value: 26.15484581492247 and parameters: {'n_layers_mlp': 4, 'mlp_n_units_l0': 27, 'mlp_dropout_l0': 0.13819423456219104, 'mlp_n_units_l1': 63, 'mlp_dropout_l1': 0.2048554981539399, 'mlp_n_units_l2': 61, 'mlp_dropout_l2': 0.21319677428825468, 'mlp_n_units_l3': 56, 'mlp_dropout_l3': 0.12025649269685236, 'lr': 0.00010467758000383211, 'weight_decay': 0.13740494974832787, 'batch_size': 256}. Best is trial 6 with value: 25.162935124976194.[0m
Trial Id: 23 | Model params: 9230 | Timestamp: 2021-08-23 00:19:01.317435

[32m[I 2021-08-23 00:19:06,482][0m Trial 23 pruned. [0m
epoch 0 -0.037078258797248465 28.23277641693512
Trial Id: 24 | Model params: 12008 | Timestamp: 2021-08-23 00:19:06.482418

[32m[I 2021-08-23 00:19:11,536][0m Trial 24 pruned. [0m
epoch 0 0.0016004117491676961 27.701291702003946
Trial Id: 25 | Model params: 9519 | Timestamp: 2021-08-23 00:19:11.536595

epoch 0 -32.26848311872297 159.90583948807665
epoch 5 -0.11392177266576664 29.260057166820435
epoch 10 -0.057611342560811574 28.510896520896893
epoch 15 -0.005295061221512576 27.796786949850414
epoch 20 0.016593669192641824 27.49250570349294
epoch 25 0.018902854278756487 27.46020847587957
epoch 30 0.026631774221488103 27.35183113431867
epoch 35 0.03528304299979734 27.23000869760093
epoch 40 0.04147966286177052 27.1424152120263
epoch 45 0.042167977647400545 27.132667958798663
epoch 50 0.04983814527030739 27.02381253570458
epoch 55 0.04716458756625408 27.06180552042425
epoch 60 0.05729940183753335 26.917499598869878
epoch 65 0.06109016791493482 26.863325065889263
epoch 70 0.0641012532802463 26.8202151110243
epoch 75 0.07426164928035683 26.674233697127615
epoch 80 0.07505793937654959 26.66275907384592
epoch 85 0.08022442739446889 26.58818914496774
epoch 90 0.08547820689797703 26.512144218875395
epoch 95 0.08468857217584591 26.523587572511907
[32m[I 2021-08-23 00:24:10,767][0m Trial 25 finished with value: 26.416378466514864 and parameters: {'n_layers_mlp': 4, 'mlp_n_units_l0': 25, 'mlp_dropout_l0': 0.000957346087961386, 'mlp_n_units_l1': 65, 'mlp_dropout_l1': 0.20940949481395826, 'mlp_n_units_l2': 58, 'mlp_dropout_l2': 0.1987116848372687, 'mlp_n_units_l3': 60, 'mlp_dropout_l3': 0.14138984333753418, 'lr': 3.397781064765769e-05, 'weight_decay': 0.13025830199400343, 'batch_size': 256}. Best is trial 6 with value: 25.162935124976194.[0m
Trial Id: 26 | Model params: 4854 | Timestamp: 2021-08-23 00:24:10.767668

[32m[I 2021-08-23 00:24:28,840][0m Trial 26 pruned. [0m
epoch 0 -0.06525473818461913 28.613735692644422
Trial Id: 27 | Model params: 9759 | Timestamp: 2021-08-23 00:24:28.840463

[32m[I 2021-08-23 00:24:31,771][0m Trial 27 pruned. [0m
epoch 0 0.02434025671070028 27.384008245099498
Trial Id: 28 | Model params: 5421 | Timestamp: 2021-08-23 00:24:31.771547

[32m[I 2021-08-23 00:24:49,728][0m Trial 28 pruned. [0m
epoch 0 -0.07778215787487475 28.781493014533424
Trial Id: 29 | Model params: 10080 | Timestamp: 2021-08-23 00:24:49.728796

[32m[I 2021-08-23 00:24:54,800][0m Trial 29 pruned. [0m
epoch 0 -0.021365880695153106 28.01808812160686
Trial Id: 30 | Model params: 1737 | Timestamp: 2021-08-23 00:24:54.800923

[32m[I 2021-08-23 00:25:21,732][0m Trial 30 pruned. [0m
epoch 0 0.01139525139325026 27.567227255309426
Trial Id: 31 | Model params: 3649 | Timestamp: 2021-08-23 00:25:21.732771

[32m[I 2021-08-23 00:25:35,803][0m Trial 31 pruned. [0m
epoch 0 0.017201696483892692 27.48400526074664
Trial Id: 32 | Model params: 4209 | Timestamp: 2021-08-23 00:25:35.803599

[32m[I 2021-08-23 00:25:49,583][0m Trial 32 pruned. [0m
epoch 0 0.04093276167627469 27.15015740677991
Trial Id: 33 | Model params: 3373 | Timestamp: 2021-08-23 00:25:49.583789

[32m[I 2021-08-23 00:26:03,530][0m Trial 33 pruned. [0m
epoch 0 0.04581917925360934 27.080904482431976
Trial Id: 34 | Model params: 2306 | Timestamp: 2021-08-23 00:26:03.531083

[32m[I 2021-08-23 00:26:17,340][0m Trial 34 pruned. [0m
epoch 0 -29.561318151016856 153.2617799082421
Trial Id: 35 | Model params: 1139 | Timestamp: 2021-08-23 00:26:17.340396

[32m[I 2021-08-23 00:26:44,542][0m Trial 35 pruned. [0m
epoch 0 -0.06532058238967497 28.61685475595612
Trial Id: 36 | Model params: 2635 | Timestamp: 2021-08-23 00:26:44.542857

[32m[I 2021-08-23 00:26:58,320][0m Trial 36 pruned. [0m
epoch 0 0.04216381353685528 27.132726937462632
Trial Id: 37 | Model params: 8700 | Timestamp: 2021-08-23 00:26:58.320872

[32m[I 2021-08-23 00:27:03,487][0m Trial 37 pruned. [0m
epoch 0 -0.09370002619223206 28.993252325715922
Trial Id: 38 | Model params: 7568 | Timestamp: 2021-08-23 00:27:03.488003

[32m[I 2021-08-23 00:27:06,494][0m Trial 38 pruned. [0m
epoch 0 0.024893195154971237 27.376247436605613
Trial Id: 39 | Model params: 5237 | Timestamp: 2021-08-23 00:27:06.494655

[32m[I 2021-08-23 00:27:40,224][0m Trial 39 pruned. [0m
epoch 0 0.060605781480052356 26.872352134118206
Trial Id: 40 | Model params: 809 | Timestamp: 2021-08-23 00:27:40.224580

[32m[I 2021-08-23 00:27:54,269][0m Trial 40 pruned. [0m
epoch 0 -0.049582508805323444 28.402470421463203
Trial Id: 41 | Model params: 9165 | Timestamp: 2021-08-23 00:27:54.269415

[32m[I 2021-08-23 00:27:57,183][0m Trial 41 pruned. [0m
epoch 0 -20.93798391732236 129.8512637936974
Trial Id: 42 | Model params: 9798 | Timestamp: 2021-08-23 00:27:57.183758

epoch 0 -32.79744155873155 161.1720525691853
epoch 5 -32.79744155873155 161.1720525691853
epoch 10 -0.12513963497657432 29.40702127772188
epoch 15 0.008260892236101935 27.608737248172044
epoch 20 0.02857815634601435 27.324470596889373
epoch 25 0.035664563943901606 27.224623778282254
epoch 30 0.03986458192014675 27.165272706665558
epoch 35 0.03560383537585088 27.22548099369073
epoch 40 0.03462471727792993 27.23929803258133
epoch 45 0.029959297542768715 27.305039092509414
epoch 50 0.04112431406960637 27.147445950727253
epoch 55 0.041559075759059816 27.14129082144512
epoch 60 0.04320190369279797 27.1180199067526
epoch 65 0.041911469398472234 27.136300791638792
epoch 70 0.03785656870005527 27.1936643976389
epoch 75 0.04210416436753961 27.133571768473203
epoch 80 0.044472555125320556 27.10000722534342
epoch 85 0.04437934750078365 27.10132893814016
epoch 90 0.04330377941148866 27.116576163646677
epoch 95 0.03916900463799178 27.175110967595547
[32m[I 2021-08-23 00:32:57,143][0m Trial 42 finished with value: 27.126726507509147 and parameters: {'n_layers_mlp': 4, 'mlp_n_units_l0': 27, 'mlp_dropout_l0': 0.1370904916434779, 'mlp_n_units_l1': 67, 'mlp_dropout_l1': 0.21950230958038022, 'mlp_n_units_l2': 59, 'mlp_dropout_l2': 0.20832176499983782, 'mlp_n_units_l3': 57, 'mlp_dropout_l3': 0.04161362480274547, 'lr': 8.79201470403131e-05, 'weight_decay': 0.02388434071015748, 'batch_size': 256}. Best is trial 6 with value: 25.162935124976194.[0m
Trial Id: 43 | Model params: 5729 | Timestamp: 2021-08-23 00:32:57.144214

[32m[I 2021-08-23 00:33:00,223][0m Trial 43 pruned. [0m
epoch 0 -8.67012800923105 86.21124869081372
Trial Id: 44 | Model params: 10033 | Timestamp: 2021-08-23 00:33:00.223456

[32m[I 2021-08-23 00:33:03,209][0m Trial 44 pruned. [0m
epoch 0 -0.09679594570686523 29.03425869956619
Trial Id: 45 | Model params: 12711 | Timestamp: 2021-08-23 00:33:03.209533

epoch 0 -32.79744155873155 161.1720525691853
epoch 5 -32.79744155873155 161.1720525691853
epoch 10 -32.79744155873155 161.1720525691853
epoch 15 -32.79744155873155 161.1720525691853
epoch 20 -0.1428831535167976 29.63798947595646
epoch 25 -0.01809967835699844 27.973253050501288
epoch 30 0.02238195105193297 27.41147651798874
epoch 35 0.030027011084865163 27.3040860638497
epoch 40 0.03415269671011323 27.245956550707728
epoch 45 0.03746202446168989 27.1992394520274
epoch 50 0.04165637415535295 27.139913130327844
epoch 55 0.04144165815021594 27.14295329629864
epoch 60 0.04052642392456929 27.15590828909648
epoch 65 0.04581814801864503 27.08091911632914
epoch 70 0.046591774614921144 27.06993862686736
epoch 75 0.05478977036135113 26.953305296190603
epoch 80 0.057939831615689386 26.908354756306665
epoch 85 0.05984363223066447 26.881151584016287
epoch 90 0.06313530735728257 26.834052182781388
epoch 95 0.06851729391497141 26.75686466598786
[32m[I 2021-08-23 00:38:04,429][0m Trial 45 finished with value: 26.75045210904554 and parameters: {'n_layers_mlp': 4, 'mlp_n_units_l0': 38, 'mlp_dropout_l0': 0.16933981826032318, 'mlp_n_units_l1': 68, 'mlp_dropout_l1': 0.14490976348887535, 'mlp_n_units_l2': 66, 'mlp_dropout_l2': 0.18366844051776068, 'mlp_n_units_l3': 72, 'mlp_dropout_l3': 0.07109224436166112, 'lr': 5.3530260410916014e-05, 'weight_decay': 0.18018749774314863, 'batch_size': 256}. Best is trial 6 with value: 25.162935124976194.[0m
Trial Id: 46 | Model params: 8882 | Timestamp: 2021-08-23 00:38:04.429671

[32m[I 2021-08-23 00:38:07,548][0m Trial 46 pruned. [0m
epoch 0 -0.11496226238253593 29.273719563592106
Trial Id: 47 | Model params: 8985 | Timestamp: 2021-08-23 00:38:07.548452

[32m[I 2021-08-23 00:38:25,740][0m Trial 47 pruned. [0m
epoch 0 0.01863580463344383 27.463945486029893
Trial Id: 48 | Model params: 4502 | Timestamp: 2021-08-23 00:38:25.740823

[32m[I 2021-08-23 00:38:30,816][0m Trial 48 pruned. [0m
epoch 0 -1.441901466495827 43.32233853670255
Trial Id: 49 | Model params: 4863 | Timestamp: 2021-08-23 00:38:30.816559

[32m[I 2021-08-23 00:38:33,848][0m Trial 49 pruned. [0m
epoch 0 -0.009285941367865203 27.8519069686861
Trial Id: 50 | Model params: 7750 | Timestamp: 2021-08-23 00:38:33.848649

[32m[I 2021-08-23 00:38:51,924][0m Trial 50 pruned. [0m
epoch 0 -0.12996498515445998 29.470012286440102
Trial Id: 51 | Model params: 9135 | Timestamp: 2021-08-23 00:38:51.925086

[32m[I 2021-08-23 00:38:56,892][0m Trial 51 pruned. [0m
epoch 0 -0.40100208313445784 32.814607536002136
Trial Id: 52 | Model params: 7735 | Timestamp: 2021-08-23 00:38:56.893006

epoch 0 -32.79744155873155 161.1720525691853
epoch 5 -32.79744155873155 161.1720525691853
epoch 10 0.009452372804939824 27.592147623046884
epoch 15 0.009717132019023689 27.588459883389984
epoch 20 0.0177041307467094 27.476979062593866
epoch 25 0.040288048771016216 27.15928143660016
epoch 30 0.05009357274432136 27.020179950318152
epoch 35 0.059940702352397124 26.879763823371984
epoch 40 0.0602708264126911 26.875043676472334
epoch 45 0.07082286185137432 26.723730401033848
epoch 50 0.06576432625393713 26.796375028018797
epoch 55 0.07336146201853488 26.68719954808616
epoch 60 0.07355773816247402 26.684373020907685
epoch 65 0.07794962020200158 26.621048059106553
epoch 70 0.07613149797687613 26.6472811611385
epoch 75 0.07653825298899963 26.641414466672206
epoch 80 0.0734612196229546 26.685762999398772
epoch 85 0.07676729939633364 26.6381103240187
epoch 90 0.0784905914380446 26.613237567117945
epoch 95 0.07733731456089588 26.62988570672002
[32m[I 2021-08-23 00:47:24,435][0m Trial 52 finished with value: 26.64379851229576 and parameters: {'n_layers_mlp': 4, 'mlp_n_units_l0': 68, 'mlp_dropout_l0': 0.14674517811721274, 'mlp_n_units_l1': 57, 'mlp_dropout_l1': 0.22438526126896186, 'mlp_n_units_l2': 21, 'mlp_dropout_l2': 0.18915066454459784, 'mlp_n_units_l3': 65, 'mlp_dropout_l3': 0.2135224299403145, 'lr': 0.00010332174899226375, 'weight_decay': 0.15996658760304075, 'batch_size': 128}. Best is trial 6 with value: 25.162935124976194.[0m
Trial Id: 53 | Model params: 8985 | Timestamp: 2021-08-23 00:47:24.435298

[32m[I 2021-08-23 00:47:29,640][0m Trial 53 pruned. [0m
epoch 0 -0.2331926914935567 30.786711008580586
Trial Id: 54 | Model params: 5388 | Timestamp: 2021-08-23 00:47:29.640750

[32m[I 2021-08-23 00:47:34,770][0m Trial 54 pruned. [0m
epoch 0 -0.08473717117974955 28.874208302977085
Trial Id: 55 | Model params: 6759 | Timestamp: 2021-08-23 00:47:34.770753

[32m[I 2021-08-23 00:47:39,864][0m Trial 55 pruned. [0m
epoch 0 -0.35483780649069896 32.269443616803315
Trial Id: 56 | Model params: 12766 | Timestamp: 2021-08-23 00:47:39.864223

[32m[I 2021-08-23 00:47:42,886][0m Trial 56 pruned. [0m
epoch 0 0.03812472772408326 27.189874560052136
Trial Id: 57 | Model params: 7693 | Timestamp: 2021-08-23 00:47:42.886270

[32m[I 2021-08-23 00:47:47,948][0m Trial 57 pruned. [0m
epoch 0 -0.24444739694974538 30.92687903881709
Trial Id: 58 | Model params: 6059 | Timestamp: 2021-08-23 00:47:47.948615

