[32m[I 2021-08-19 11:30:20,668][0m A new study created in memory with name: NeuralNetwork[0m
++++++++ Session Characteristics +++++++

Area: south
Gal Type: lrg
Training Samples: 118859
Validation Samples: 29715
Test Samples: 37144
Number of features: 15
Device: cuda:0
Number of Workers: 8
Number of Trials: 20

+++++++++++++++++++++++++++++++++++++++
Trial Id: 0 | Model params: 12804 | Timestamp: 2021-08-19 11:30:20.669545

epoch 0 -7.085026078490486e-06 11.761762685863522
epoch 5 -0.0017326026620967383 11.771905804825032
epoch 10 -0.0025346035691928837 11.776617236897938
epoch 15 -0.00045570871928357626 11.764400674047849
epoch 20 -0.0002561063838917299 11.76322704938685
epoch 25 -0.00013728737442275651 11.76252836007755
epoch 30 -0.00036700826237479056 11.763879146289879
epoch 35 -6.746756810671606e-05 11.762117780552222
epoch 40 -0.0010335090651842904 11.767797372949305
epoch 45 -0.0006105207747459929 11.765310859567629
epoch 50 -0.0004265846385420602 11.764229437157653
epoch 55 -0.000588964436032624 11.765184127744089
epoch 60 -0.0011382592499022959 11.768413059982533
epoch 65 -4.193141708097592e-05 11.761967610117141
epoch 70 -1.0593950292792087e-05 11.761783321266163
[32m[I 2021-08-19 11:52:22,245][0m Trial 0 finished with value: -4.943776888088891e-06 and parameters: {'n_layers_mlp': 4, 'mlp_n_units_l0': 162, 'mlp_dropout_l0': 0.21103692383729517, 'mlp_n_units_l1': 23, 'mlp_dropout_l1': 0.3024091309950581, 'mlp_n_units_l2': 68, 'mlp_dropout_l2': 0.24528788757095854, 'mlp_n_units_l3': 69, 'mlp_dropout_l3': 0.3557901900567589, 'lr': 0.07851548909857536, 'criterion': 'MSELoss', 'batch_size': 32, 'no_epochs': 75}. Best is trial 0 with value: -4.943776888088891e-06.[0m
Trial Id: 1 | Model params: 78802 | Timestamp: 2021-08-19 11:52:22.245601

epoch 0 -8.316115461123516 35.89949217640421
epoch 5 -8.316115461123516 35.89949217640421
epoch 10 -8.316115461123516 35.89949217640421
epoch 15 -8.316115461123516 35.89949217640421
epoch 20 -8.316115461123516 35.89949217640421
epoch 25 -8.316115461123516 35.89949217640421
epoch 30 -8.316115461123516 35.89949217640421
epoch 35 -8.316115461123516 35.89949217640421
epoch 40 -8.316115461123516 35.89949217640421
epoch 45 -8.316115461123516 35.89949217640421
epoch 50 -8.316115461123516 35.89949217640421
epoch 55 -8.316115461123516 35.89949217640421
[32m[I 2021-08-19 11:55:44,037][0m Trial 1 finished with value: -8.316115461123516 and parameters: {'n_layers_mlp': 6, 'mlp_n_units_l0': 126, 'mlp_dropout_l0': 0.18975084957732402, 'mlp_n_units_l1': 62, 'mlp_dropout_l1': 0.04805351706740435, 'mlp_n_units_l2': 156, 'mlp_dropout_l2': 0.35014835472114647, 'mlp_n_units_l3': 215, 'mlp_dropout_l3': 0.12207872239071549, 'mlp_n_units_l4': 68, 'mlp_dropout_l4': 0.39781236250783497, 'mlp_n_units_l5': 152, 'mlp_dropout_l5': 0.008691250978366816, 'lr': 0.0151869644901888, 'criterion': 'L1Loss', 'batch_size': 256, 'no_epochs': 58}. Best is trial 0 with value: -4.943776888088891e-06.[0m
Trial Id: 2 | Model params: 42011 | Timestamp: 2021-08-19 11:55:44.037419

epoch 0 -8.316115461123516 35.89949217640421
epoch 5 -8.316115461123516 35.89949217640421
epoch 10 -8.316115461123516 35.89949217640421
epoch 15 -8.316115461123516 35.89949217640421
epoch 20 -8.316115461123516 35.89949217640421
epoch 25 -8.316115461123516 35.89949217640421
epoch 30 -8.316115461123516 35.89949217640421
epoch 35 -8.316115461123516 35.89949217640421
epoch 40 -8.316115461123516 35.89949217640421
epoch 45 -8.316115461123516 35.89949217640421
epoch 50 -8.316115461123516 35.89949217640421
epoch 55 -8.316115461123516 35.89949217640421
epoch 60 -8.316115461123516 35.89949217640421
epoch 65 -8.316115461123516 35.89949217640421
epoch 70 -8.316115461123516 35.89949217640421
epoch 75 -8.316115461123516 35.89949217640421
epoch 80 -8.316115461123516 35.89949217640421
epoch 85 -8.316115461123516 35.89949217640421
epoch 90 -8.316115461123516 35.89949217640421
[32m[I 2021-08-19 12:22:47,928][0m Trial 2 finished with value: -8.316115461123516 and parameters: {'n_layers_mlp': 4, 'mlp_n_units_l0': 240, 'mlp_dropout_l0': 0.2709263427266315, 'mlp_n_units_l1': 123, 'mlp_dropout_l1': 0.33998095900986647, 'mlp_n_units_l2': 63, 'mlp_dropout_l2': 0.11452277952882267, 'mlp_n_units_l3': 11, 'mlp_dropout_l3': 0.17816782336490433, 'lr': 0.0001810441492282386, 'criterion': 'MSELoss', 'batch_size': 32, 'no_epochs': 92}. Best is trial 0 with value: -4.943776888088891e-06.[0m
Trial Id: 3 | Model params: 43089 | Timestamp: 2021-08-19 12:22:47.928762

epoch 0 -0.059715330346325146 12.107806802923852
epoch 5 -0.01900139237959908 11.87293971661708
epoch 10 -0.0001236052548103661 11.762447902688143
epoch 15 0.0015101371446101242 11.75283675860842
epoch 20 -0.0056230111971544705 11.794742808983989
epoch 25 0.0049805910076129445 11.732394297230083
epoch 30 0.0020747393516160617 11.749513431987484
epoch 35 -0.0029267938624759626 11.778920510687659
epoch 40 0.003603088897680462 11.740512635512136
epoch 45 0.010707780231284714 11.698580579580916
epoch 50 0.007700530700675112 11.716347754618415
epoch 55 0.00747586933416855 11.717673998262107
epoch 60 0.011168145976395483 11.695858303820632
epoch 65 0.004374611221922287 11.73596634396018
epoch 70 0.011757398863737722 11.692372956298708
epoch 75 0.012667570801786932 11.68698737526388
[32m[I 2021-08-19 12:29:19,334][0m Trial 3 finished with value: 0.01038999969090526 and parameters: {'n_layers_mlp': 4, 'mlp_n_units_l0': 55, 'mlp_dropout_l0': 0.3128300956105696, 'mlp_n_units_l1': 153, 'mlp_dropout_l1': 0.26044046579856994, 'mlp_n_units_l2': 136, 'mlp_dropout_l2': 0.4359712143245965, 'mlp_n_units_l3': 92, 'mlp_dropout_l3': 0.23189157940210336, 'lr': 0.011897040248963889, 'criterion': 'L1Loss', 'batch_size': 128, 'no_epochs': 77}. Best is trial 3 with value: 0.01038999969090526.[0m
Trial Id: 4 | Model params: 26693 | Timestamp: 2021-08-19 12:29:19.334328

epoch 0 0.00532578476856449 11.730359009983157
epoch 5 0.02334435933375556 11.623625401271704
epoch 10 0.023293649656010884 11.623927156886946
epoch 15 0.031110041448909942 11.57732170689348
epoch 20 0.013283110794483077 11.68334375459328
epoch 25 0.02643369570687737 11.605227037959551
epoch 30 0.02341619756609803 11.623197903583117
epoch 35 0.028642032066581335 11.592057521752178
epoch 40 0.01860087110909281 11.6518184215595
epoch 45 0.025921601061303368 11.608278804083126
epoch 50 0.023860819120220422 11.620551682821905
epoch 55 0.02766363561725671 11.597894079323632
epoch 60 0.02257993665937763 11.628173383433978
epoch 65 0.024478359183206955 11.61687531592144
epoch 70 0.020772346417413545 11.638920688841473
epoch 75 0.02143052725230421 11.6350085228702
epoch 80 0.018117924319968837 11.654685000513515
[32m[I 2021-08-19 12:34:51,983][0m Trial 4 finished with value: 0.019056864183092603 and parameters: {'n_layers_mlp': 2, 'mlp_n_units_l0': 100, 'mlp_dropout_l0': 0.46580075263373716, 'mlp_n_units_l1': 246, 'mlp_dropout_l1': 0.15342924012108822, 'lr': 0.012411209232720597, 'criterion': 'MSELoss', 'batch_size': 128, 'no_epochs': 83}. Best is trial 4 with value: 0.019056864183092603.[0m
Trial Id: 5 | Model params: 21381 | Timestamp: 2021-08-19 12:34:51.983678

epoch 0 0.017113763694683204 11.660643040392909
epoch 5 0.025313079658726756 11.61190417100564
epoch 10 0.024533990472334843 11.616544072135392
epoch 15 0.024994859950357662 11.613799566917006
epoch 20 0.02095271602981774 11.637848719373709
epoch 25 0.029648679331945926 11.586049367076114
epoch 30 0.02902495581659359 11.58977241582989
epoch 35 0.028918070011541896 11.590410304554611
epoch 40 0.02697774755204252 11.601983947332995
epoch 45 0.023782333231407216 11.621018845196252
epoch 50 0.021503121049585183 11.63457695151089
epoch 55 0.018824791570009713 11.6504890799509
epoch 60 0.024799372173139655 11.614963787483337
epoch 65 0.018088997865764456 11.654856673995162
epoch 70 0.02014104706467168 11.642671838644155
[32m[I 2021-08-19 12:52:08,264][0m Trial 5 finished with value: 0.016927458099492587 and parameters: {'n_layers_mlp': 2, 'mlp_n_units_l0': 99, 'mlp_dropout_l0': 0.38515984246177004, 'mlp_n_units_l1': 196, 'mlp_dropout_l1': 0.1972861501115506, 'lr': 0.007755610631792633, 'criterion': 'MSELoss', 'batch_size': 32, 'no_epochs': 75}. Best is trial 4 with value: 0.019056864183092603.[0m
Trial Id: 6 | Model params: 49723 | Timestamp: 2021-08-19 12:52:08.265180

epoch 0 -0.015461836041444021 11.852301130235169
[32m[I 2021-08-19 12:52:20,037][0m Trial 6 pruned. [0m
Trial Id: 7 | Model params: 71800 | Timestamp: 2021-08-19 12:52:20.038152

epoch 0 0.0166433996552664 11.663432829755243
epoch 5 0.017182264976331574 11.66023669483559
epoch 10 0.03696626735920716 11.542280487344184
epoch 15 0.034042793908162006 11.559786613801336
epoch 20 0.03933358979966872 11.528085183766507
epoch 25 0.03853357135405444 11.532884332246963
epoch 30 0.04299534076073808 11.506093533508333
epoch 35 0.04133692449984372 11.516058810437425
epoch 40 0.04079162005506942 11.51933361336909
epoch 45 0.042760621703292645 11.507504463866415
epoch 50 0.04116385558374447 11.517098269410047
[32m[I 2021-08-19 12:55:03,253][0m Trial 7 finished with value: 0.04202614693575002 and parameters: {'n_layers_mlp': 4, 'mlp_n_units_l0': 186, 'mlp_dropout_l0': 0.3630751453966143, 'mlp_n_units_l1': 181, 'mlp_dropout_l1': 0.3934389279055159, 'mlp_n_units_l2': 112, 'mlp_dropout_l2': 0.488779745411012, 'mlp_n_units_l3': 128, 'mlp_dropout_l3': 0.0977688550984192, 'lr': 0.0018000453315226842, 'criterion': 'MSELoss', 'batch_size': 256, 'no_epochs': 55}. Best is trial 7 with value: 0.04202614693575002.[0m
Trial Id: 8 | Model params: 135954 | Timestamp: 2021-08-19 12:55:03.254051

[32m[I 2021-08-19 12:55:44,781][0m Trial 8 pruned. [0m
epoch 0 -8.314560456379642 35.89836742890005
Trial Id: 9 | Model params: 5261 | Timestamp: 2021-08-19 12:55:44.782072

[32m[I 2021-08-19 12:55:48,808][0m Trial 9 pruned. [0m
epoch 0 -0.046339849455140136 12.031153195488518
Trial Id: 10 | Model params: 140820 | Timestamp: 2021-08-19 12:55:48.808451

[32m[I 2021-08-19 12:55:51,697][0m Trial 10 pruned. [0m
epoch 0 -5.494585463198311 29.974130381718016
Trial Id: 11 | Model params: 21569 | Timestamp: 2021-08-19 12:55:51.697231

[32m[I 2021-08-19 12:55:54,101][0m Trial 11 pruned. [0m
epoch 0 -0.027374823625595956 11.921621614835278
Trial Id: 12 | Model params: 39983 | Timestamp: 2021-08-19 12:55:54.101528

epoch 0 0.016299921933757733 11.666077799791562
epoch 5 0.027622308173429033 11.59874522167946
epoch 10 0.015260925460802155 11.67223710335091
epoch 15 0.03264612815204493 11.568743779351253
epoch 20 0.029171901306237702 11.589499584701224
epoch 25 0.03349759905945926 11.563651218287886
epoch 30 0.034521395179388015 11.557525026539913
epoch 35 0.03073069539378892 11.580191602689426
epoch 40 0.03625953450741237 11.547116904526256
epoch 45 0.04023415273049524 11.523281234705516
epoch 50 0.038844962063430466 11.53161777135407
epoch 55 0.039508153623262765 11.527638709213642
epoch 60 0.03685752664947484 11.543533908435682
epoch 65 0.03254798332325559 11.569330629527363
epoch 70 0.0382874349216491 11.534961798896212
epoch 75 0.03459840618821841 11.55706407670276
epoch 80 0.032226643254024245 11.571251851864048
epoch 85 0.03776604187786825 11.538088218433776
[32m[I 2021-08-19 13:35:43,788][0m Trial 12 finished with value: 0.02981669925632835 and parameters: {'n_layers_mlp': 2, 'mlp_n_units_l0': 169, 'mlp_dropout_l0': 0.38984830138360993, 'mlp_n_units_l1': 218, 'mlp_dropout_l1': 0.004681771411102376, 'lr': 0.002769053481715514, 'criterion': 'MSELoss', 'batch_size': 16, 'no_epochs': 89}. Best is trial 7 with value: 0.04202614693575002.[0m
Trial Id: 13 | Model params: 43825 | Timestamp: 2021-08-19 13:35:43.789254

[32m[I 2021-08-19 13:36:16,921][0m Trial 13 pruned. [0m
epoch 0 -0.1618158159692067 12.67833309146071
Trial Id: 14 | Model params: 60621 | Timestamp: 2021-08-19 13:36:16.921597

[32m[I 2021-08-19 13:36:43,548][0m Trial 14 pruned. [0m
epoch 0 -0.005567392302168628 11.79503153709212
Trial Id: 15 | Model params: 84340 | Timestamp: 2021-08-19 13:36:43.549128

epoch 0 0.01931245972178741 11.647593430644928
epoch 5 0.024669330986256566 11.615738178559257
epoch 10 0.03192801869963169 11.572433646448548
epoch 15 0.037418330449851434 11.539571105891136
epoch 20 0.031576722507008714 11.574533171697569
epoch 25 0.033457963316372075 11.563285471638386
epoch 30 0.03540605798288765 11.551626518380434
epoch 35 0.03561505695945821 11.550375002688323
epoch 40 0.03667591858924346 11.544020319641044
epoch 45 0.032763144414742484 11.567440979418926
epoch 50 0.035773662069449985 11.549425162150659
epoch 55 0.032629654506229344 11.56823917241356
epoch 60 0.035640431682009366 11.55022304599763
epoch 65 0.038836554595666706 11.531067032181443
[32m[I 2021-08-19 13:40:05,332][0m Trial 15 finished with value: 0.03736407093167682 and parameters: {'n_layers_mlp': 4, 'mlp_n_units_l0': 214, 'mlp_dropout_l0': 0.4280882290210073, 'mlp_n_units_l1': 106, 'mlp_dropout_l1': 0.39581569212600526, 'mlp_n_units_l2': 255, 'mlp_dropout_l2': 0.3047132153621357, 'mlp_n_units_l3': 120, 'mlp_dropout_l3': 0.08839987105987315, 'lr': 0.003951293632968173, 'criterion': 'MSELoss', 'batch_size': 256, 'no_epochs': 68}. Best is trial 7 with value: 0.04202614693575002.[0m
Trial Id: 16 | Model params: 74940 | Timestamp: 2021-08-19 13:40:05.332802

[32m[I 2021-08-19 13:40:08,365][0m Trial 16 pruned. [0m
epoch 0 -0.020938785878165334 11.884221169846773
Trial Id: 17 | Model params: 78284 | Timestamp: 2021-08-19 13:40:08.365726

[32m[I 2021-08-19 13:40:11,854][0m Trial 17 pruned. [0m
epoch 0 -0.16651491041854682 12.703284401014933
Trial Id: 18 | Model params: 71349 | Timestamp: 2021-08-19 13:40:11.854904

epoch 0 0.01500873407557779 11.67312305572741
[32m[I 2021-08-19 13:40:23,913][0m Trial 18 pruned. [0m
Trial Id: 19 | Model params: 60202 | Timestamp: 2021-08-19 13:40:23.913750

[32m[I 2021-08-19 13:40:26,929][0m Trial 19 pruned. [0m
epoch 0 -0.011143912193260164 11.827075242053809
Study statistics: 
  Number of finished trials:  20
  Number of pruned trials:  11
  Number of complete trials:  9

Best trial:
  Value:  0.04202614693575002
  Params: 
    n_layers_mlp: 4
    mlp_n_units_l0: 186
    mlp_dropout_l0: 0.3630751453966143
    mlp_n_units_l1: 181
    mlp_dropout_l1: 0.3934389279055159
    mlp_n_units_l2: 112
    mlp_dropout_l2: 0.488779745411012
    mlp_n_units_l3: 128
    mlp_dropout_l3: 0.0977688550984192
    lr: 0.0018000453315226842
    criterion: MSELoss
    batch_size: 256
    no_epochs: 55
Target 37144 0 129.0 1.0 33.86479646780099
[51. 35. 31. ... 28. 22. 36.]
Prediction 37144 0 42.31845474243164 6.007158279418945 34.1691002748199
[34.19924164 34.16418076 34.74111938 ... 33.98199844 34.17029953
 34.11621857]

 XXXXXX======== TRIAL south - lrg ended

Test Set - R-squared:  0.04170246170864167
Test Set - RMSE:  11.568444973117172
Test Set - MAE:  8.449081444108689



[32m[I 2021-08-19 13:40:40,939][0m A new study created in memory with name: NeuralNetwork[0m
++++++++ Session Characteristics +++++++

Area: south
Gal Type: elg
Training Samples: 118859
Validation Samples: 29715
Test Samples: 37144
Number of features: 15
Device: cuda:0
Number of Workers: 8
Number of Trials: 20

+++++++++++++++++++++++++++++++++++++++
Trial Id: 0 | Model params: 89356 | Timestamp: 2021-08-19 13:40:40.940298

epoch 0 -0.0030386306344269975 23.20834371533117
epoch 5 -5.179402750421502e-05 23.17376318663878
epoch 10 -0.00012983556470902435 23.174667380217084
epoch 15 -2.4018310174067636e-06 23.17319090768047
epoch 20 -1.9576174086877174e-05 23.173389898513477
epoch 25 -2.5589452578245186e-05 23.17345957106834
epoch 30 -9.838710619547442e-07 23.173174478385732
epoch 35 -0.00021827990827838484 23.175692058643072
epoch 40 -0.0004605763512073313 23.178498969809024
[32m[I 2021-08-19 13:55:14,336][0m Trial 0 finished with value: -0.0003965007119377528 and parameters: {'n_layers_mlp': 6, 'mlp_n_units_l0': 253, 'mlp_dropout_l0': 0.28947531512747987, 'mlp_n_units_l1': 44, 'mlp_dropout_l1': 0.3105203219820052, 'mlp_n_units_l2': 239, 'mlp_dropout_l2': 0.09135364355934089, 'mlp_n_units_l3': 158, 'mlp_dropout_l3': 0.16481417040397534, 'mlp_n_units_l4': 96, 'mlp_dropout_l4': 0.3179087795480912, 'mlp_n_units_l5': 104, 'mlp_dropout_l5': 0.4281903353092919, 'lr': 0.02279858534020668, 'criterion': 'MSELoss', 'batch_size': 32, 'no_epochs': 42}. Best is trial 0 with value: -0.0003965007119377528.[0m
Trial Id: 1 | Model params: 45273 | Timestamp: 2021-08-19 13:55:14.336747

epoch 0 0.07337711472756359 22.306777167676344
epoch 5 0.05091604105819725 22.57551334529504
epoch 10 0.06502801742805431 22.4070465519069
epoch 15 0.07362415249348031 22.303803474809698
epoch 20 0.06829377563768124 22.367879599078833
epoch 25 0.06227209408773149 22.440045756989694
epoch 30 0.061034631359743075 22.454847260138287
epoch 35 0.006476814675291487 23.09799703048207
epoch 40 0.06185510219467516 22.445034558683748
epoch 45 0.012015528826580302 23.03352344555079
epoch 50 0.06797366937120719 22.371721734800985
[32m[I 2021-08-19 13:59:59,174][0m Trial 1 finished with value: 0.05405133381892013 and parameters: {'n_layers_mlp': 4, 'mlp_n_units_l0': 119, 'mlp_dropout_l0': 0.4561284032216352, 'mlp_n_units_l1': 45, 'mlp_dropout_l1': 0.09879058034293248, 'mlp_n_units_l2': 171, 'mlp_dropout_l2': 0.278154442714575, 'mlp_n_units_l3': 174, 'mlp_dropout_l3': 0.3057569981886567, 'lr': 0.01928457117576143, 'criterion': 'L1Loss', 'batch_size': 128, 'no_epochs': 56}. Best is trial 1 with value: 0.05405133381892013.[0m
epoch 55 0.05405133381892013 22.53819346665652
Trial Id: 2 | Model params: 54800 | Timestamp: 2021-08-19 13:59:59.174457

epoch 0 -0.0024631255882134884 23.20168473185403
epoch 5 0.18352405469176591 20.939051982667863
epoch 10 0.17098710661178362 21.0991986215938
epoch 15 0.19127028070265983 20.839486786463382
epoch 20 0.18797317356522847 20.88192379011985
epoch 25 0.189630319987233 20.860605480818155
epoch 30 0.19738766878383318 20.76052021821533
epoch 35 0.1866652507369554 20.898734168188124
epoch 40 0.1945356083310249 20.797373471737732
epoch 45 0.2006003575577331 20.718928552364343
epoch 50 0.2022533032402518 20.69749685314849
epoch 55 0.1998740548325283 20.728338612721977
epoch 60 0.19874545859310422 20.742952362934197
epoch 65 0.1935242989796564 20.810425557413723
epoch 70 0.19505268218509897 20.790696885790528
epoch 75 0.18878057465675457 20.871539723603703
epoch 80 0.18441114791705715 20.927673852444137
epoch 85 0.19597326514401103 20.77880478041048
epoch 90 0.20100298615387258 20.713710208914424
epoch 95 0.19855902292811645 20.745365454522247
[32m[I 2021-08-19 14:04:45,747][0m Trial 2 finished with value: 0.19759668259111107 and parameters: {'n_layers_mlp': 4, 'mlp_n_units_l0': 251, 'mlp_dropout_l0': 0.3642320381028665, 'mlp_n_units_l1': 32, 'mlp_dropout_l1': 0.24378387277989638, 'mlp_n_units_l2': 213, 'mlp_dropout_l2': 0.2247223762216352, 'mlp_n_units_l3': 166, 'mlp_dropout_l3': 0.1334440754509768, 'lr': 0.00799730131168632, 'criterion': 'MSELoss', 'batch_size': 256, 'no_epochs': 97}. Best is trial 2 with value: 0.19759668259111107.[0m
Trial Id: 3 | Model params: 11189 | Timestamp: 2021-08-19 14:04:45.747353

epoch 0 -0.3412055956129776 26.836940065496695
epoch 5 0.041889486137512755 22.682614974023696
epoch 10 0.06089697878496547 22.456493143132995
epoch 15 0.06766756109538119 22.375395239906727
epoch 20 0.07844726092745369 22.24566613927831
epoch 25 0.08395979960192157 22.17903184518517
epoch 30 0.08512059920449155 22.16497483512588
epoch 35 0.07296798294836371 22.311701179592166
epoch 40 0.07862582887878333 22.243510779466312
epoch 45 0.08523250161551854 22.163619252099814
epoch 50 0.08606536342795679 22.153527378668528
epoch 55 0.08591382545020543 22.155363922255678
[32m[I 2021-08-19 14:07:16,610][0m Trial 3 finished with value: 0.08697997095648669 and parameters: {'n_layers_mlp': 2, 'mlp_n_units_l0': 53, 'mlp_dropout_l0': 0.11258698181457805, 'mlp_n_units_l1': 188, 'mlp_dropout_l1': 0.2913841082187185, 'lr': 0.00042603949144814934, 'criterion': 'L1Loss', 'batch_size': 256, 'no_epochs': 61}. Best is trial 2 with value: 0.19759668259111107.[0m
epoch 60 0.08697997095648669 22.142439684961413
Trial Id: 4 | Model params: 94275 | Timestamp: 2021-08-19 14:07:16.611198

epoch 0 -0.00617495523620426 23.244599591434078
epoch 5 0.08973813988277901 22.10896901567675
epoch 10 0.11419040925234936 21.809992036588216
epoch 15 0.13505255694048468 21.55163273343567
epoch 20 0.14782975034840562 21.391857756618617
epoch 25 0.16178827771361382 21.21593533356766
epoch 30 0.17429030751301688 21.057121799918747
epoch 35 0.18017650732892032 20.981933079663385
epoch 40 0.1818560678135538 20.96042936962316
epoch 45 0.18749649209219177 20.888052014875985
epoch 50 0.190963036516276 20.843444971134183
epoch 55 0.1932139025046432 20.81442993182718
epoch 60 0.19704748096264657 20.764919432920063
epoch 65 0.1994262936509551 20.734137729296858
epoch 70 0.20132700588878572 20.70950973546972
epoch 75 0.20588633677191504 20.650313638664414
epoch 80 0.205016588951077 20.66161910475289
[32m[I 2021-08-19 14:14:29,674][0m Trial 4 finished with value: 0.21073521056214017 and parameters: {'n_layers_mlp': 4, 'mlp_n_units_l0': 227, 'mlp_dropout_l0': 0.449773281951709, 'mlp_n_units_l1': 137, 'mlp_dropout_l1': 0.4246129217172515, 'mlp_n_units_l2': 201, 'mlp_dropout_l2': 0.15652437069113362, 'mlp_n_units_l3': 156, 'mlp_dropout_l3': 0.13452429254836362, 'lr': 0.00010955793098182398, 'criterion': 'MSELoss', 'batch_size': 128, 'no_epochs': 86}. Best is trial 4 with value: 0.21073521056214017.[0m
epoch 85 0.21073521056214017 20.587171491792645
Trial Id: 5 | Model params: 174429 | Timestamp: 2021-08-19 14:14:29.674409

