[32m[I 2021-08-22 01:28:25,033][0m Trial 1 finished with value: 26.173488415661065 and parameters: {'n_layers_mlp': 2, 'mlp_n_units_l0': 44, 'mlp_dropout_l0': 0.16797327405141624, 'mlp_n_units_l1': 24, 'mlp_dropout_l1': 0.16701368402825267, 'lr': 1.758547956409121e-05, 'criterion': 'L1Loss', 'batch_size': 128, 'no_epochs': 52}. Best is trial 1 with value: 26.173488415661065.[0m
Trial Id: 2 | Model params: 8632 | Timestamp: 2021-08-22 01:28:25.034144

epoch 0 -0.05691428457213532 25.43259312066297
epoch 5 -0.001080502377831749 24.751713017543587
epoch 10 0.01271318531311283 24.580597082412577
epoch 15 0.023289406096174137 24.448583873112547
epoch 20 0.03199615959890434 24.33936814628384
epoch 25 0.03651629377789589 24.282474806361897
epoch 30 0.05164397601449855 24.091090724596157
epoch 35 0.051787704015035296 24.0892650940233
epoch 40 0.056369407650430525 24.03099569479551
epoch 45 0.053327280140481825 24.06970073902571
epoch 50 0.058945791016524196 23.99816750122499
epoch 55 0.060014129310783426 23.98454159014728
epoch 60 0.06248496796237857 23.95299806945812
[32m[I 2021-08-22 01:37:01,158][0m Trial 2 finished with value: 24.080821930159964 and parameters: {'n_layers_mlp': 4, 'mlp_n_units_l0': 17, 'mlp_dropout_l0': 0.0008526025063186893, 'mlp_n_units_l1': 46, 'mlp_dropout_l1': 0.22295744505363885, 'mlp_n_units_l2': 59, 'mlp_dropout_l2': 0.17305319637218802, 'mlp_n_units_l3': 78, 'mlp_dropout_l3': 0.030134693536798762, 'lr': 0.00011377624891759982, 'criterion': 'MSELoss', 'batch_size': 32, 'no_epochs': 62}. Best is trial 2 with value: 24.080821930159964.[0m
Trial Id: 3 | Model params: 5463 | Timestamp: 2021-08-22 01:37:01.159164

epoch 0 -45.140352916652155 168.03943612425067
epoch 5 -0.02320289481607185 25.02370661503643
epoch 10 0.0012597221269755599 24.722765067117805
epoch 15 0.010159072663520674 24.612371568514668
epoch 20 0.023886311782870484 24.441111992915207
epoch 25 0.014680538627987127 24.556094155092488
epoch 30 0.03215563893710971 24.33736309937666
epoch 35 0.01939041412517517 24.49733418305243
epoch 40 0.029807255633234386 24.36687137161868
[32m[I 2021-08-22 01:46:11,070][0m Trial 3 finished with value: 24.527501281415145 and parameters: {'n_layers_mlp': 2, 'mlp_n_units_l0': 65, 'mlp_dropout_l0': 0.112878831803736, 'mlp_n_units_l1': 66, 'mlp_dropout_l1': 0.19586701853048694, 'lr': 6.895386603243429e-05, 'criterion': 'L1Loss', 'batch_size': 16, 'no_epochs': 43}. Best is trial 2 with value: 24.080821930159964.[0m
Trial Id: 4 | Model params: 6285 | Timestamp: 2021-08-22 01:46:11.070238

epoch 0 -0.03830702857803625 25.207725241251683
epoch 5 0.0376486761370699 24.268201015325904
epoch 10 -0.2583846277219377 27.750924873152314
epoch 15 -0.06359292760465651 25.512820878455194
epoch 20 -0.1518483601546481 26.55023770676357
epoch 25 -0.09342915586135936 25.868192524845465
epoch 30 -0.002923390733048148 24.774485247096173
epoch 35 0.001032490950532372 24.725577341547673
epoch 40 -0.12403570679753395 26.22773658855696
[32m[I 2021-08-22 01:52:31,659][0m Trial 4 finished with value: 25.83486666816084 and parameters: {'n_layers_mlp': 4, 'mlp_n_units_l0': 39, 'mlp_dropout_l0': 0.09373713185248347, 'mlp_n_units_l1': 51, 'mlp_dropout_l1': 0.020973312504961115, 'mlp_n_units_l2': 36, 'mlp_dropout_l2': 0.031005226925291906, 'mlp_n_units_l3': 46, 'mlp_dropout_l3': 0.035283278861662055, 'lr': 0.0004493791070477072, 'criterion': 'L1Loss', 'batch_size': 32, 'no_epochs': 45}. Best is trial 2 with value: 24.080821930159964.[0m
Trial Id: 5 | Model params: 3807 | Timestamp: 2021-08-22 01:52:31.659559

[32m[I 2021-08-22 01:52:46,927][0m Trial 5 pruned. [0m
epoch 0 -0.013774574161330877 24.908149110032806
Trial Id: 6 | Model params: 7386 | Timestamp: 2021-08-22 01:52:46.927348

[32m[I 2021-08-22 01:52:49,427][0m Trial 6 pruned. [0m
epoch 0 0.009074053504385837 24.631997459542255
Trial Id: 7 | Model params: 3081 | Timestamp: 2021-08-22 01:52:49.427214

epoch 0 -45.05545060335862 167.92662086759788
epoch 5 -22.34526901798005 119.55795348267341
epoch 10 -0.18648042765221762 26.953137090260235
epoch 15 -0.17226035038872367 26.79113230054897
epoch 20 -0.11325386247205849 26.108152231859638
epoch 25 -0.08031631261552574 25.719024844964025
epoch 30 -0.06706728813447005 25.560828958568013
epoch 35 -0.06990602243286137 25.59480629457272
epoch 40 -0.07729613981187722 25.68304914835644
epoch 45 -0.05899269586615152 25.463934785394805
epoch 50 -0.05897457544003992 25.463716927743643
epoch 55 -0.07416994648957198 25.64575740157982
epoch 60 -0.07005785701331013 25.596622360062607
epoch 65 -0.09593050846311257 25.90422117464028
epoch 70 -0.07896705061414067 25.702958927749428
epoch 75 -0.06768273169373806 25.568199149785368
[32m[I 2021-08-22 01:56:08,246][0m Trial 7 finished with value: 25.690295062906724 and parameters: {'n_layers_mlp': 4, 'mlp_n_units_l0': 25, 'mlp_dropout_l0': 0.19167257657652734, 'mlp_n_units_l1': 33, 'mlp_dropout_l1': 0.23694414407382836, 'mlp_n_units_l2': 40, 'mlp_dropout_l2': 0.036851842959798875, 'mlp_n_units_l3': 11, 'mlp_dropout_l3': 0.17172483411794365, 'lr': 2.346507364062436e-05, 'criterion': 'L1Loss', 'batch_size': 128, 'no_epochs': 78}. Best is trial 2 with value: 24.080821930159964.[0m
Trial Id: 8 | Model params: 5008 | Timestamp: 2021-08-22 01:56:08.246979

epoch 0 -45.140352916652155 168.03943612425067
epoch 5 -45.140352916652155 168.03943612425067
epoch 10 -45.140352916652155 168.03943612425067
epoch 15 -45.140352916652155 168.03943612425067
epoch 20 -45.140352916652155 168.03943612425067
epoch 25 -45.140352916652155 168.03943612425067
epoch 30 -45.140352916652155 168.03943612425067
epoch 35 -45.140352916652155 168.03943612425067
epoch 40 -45.140352916652155 168.03943612425067
epoch 45 -45.140352916652155 168.03943612425067
epoch 50 -45.140352916652155 168.03943612425067
epoch 55 -45.140352916652155 168.03943612425067
[32m[I 2021-08-22 02:04:01,752][0m Trial 8 finished with value: 168.03943612425067 and parameters: {'n_layers_mlp': 4, 'mlp_n_units_l0': 54, 'mlp_dropout_l0': 0.21265210894727551, 'mlp_n_units_l1': 23, 'mlp_dropout_l1': 0.035997718223886775, 'mlp_n_units_l2': 75, 'mlp_dropout_l2': 0.23026944447306258, 'mlp_n_units_l3': 14, 'mlp_dropout_l3': 0.17920243955182327, 'lr': 0.0003426606992580154, 'criterion': 'MSELoss', 'batch_size': 32, 'no_epochs': 57}. Best is trial 2 with value: 24.080821930159964.[0m
Trial Id: 9 | Model params: 4071 | Timestamp: 2021-08-22 02:04:01.752688

[32m[I 2021-08-22 02:04:03,355][0m Trial 9 pruned. [0m
epoch 0 -0.19322279038794332 27.029611332725622
Trial Id: 10 | Model params: 307 | Timestamp: 2021-08-22 02:04:03.355642

epoch 0 -45.140352916652155 168.03943612425067
epoch 5 -45.140352916652155 168.03943612425067
epoch 10 -45.140352916652155 168.03943612425067
epoch 15 -45.140352916652155 168.03943612425067
epoch 20 -45.140352916652155 168.03943612425067
epoch 25 -45.140352916652155 168.03943612425067
epoch 30 -45.140352916652155 168.03943612425067
epoch 35 -45.140352916652155 168.03943612425067
epoch 40 -45.140352916652155 168.03943612425067
epoch 45 -45.140352916652155 168.03943612425067
epoch 50 -45.140352916652155 168.03943612425067
epoch 55 -45.140352916652155 168.03943612425067
epoch 60 -45.140352916652155 168.03943612425067
epoch 65 -45.140352916652155 168.03943612425067
[32m[I 2021-08-22 02:11:41,831][0m Trial 10 finished with value: 168.03943612425067 and parameters: {'n_layers_mlp': 2, 'mlp_n_units_l0': 11, 'mlp_dropout_l0': 0.013369204542028527, 'mlp_n_units_l1': 10, 'mlp_dropout_l1': 0.11462897796544491, 'lr': 0.001615431003400398, 'criterion': 'MSELoss', 'batch_size': 32, 'no_epochs': 70}. Best is trial 2 with value: 24.080821930159964.[0m
Trial Id: 11 | Model params: 7158 | Timestamp: 2021-08-22 02:11:41.832038

[32m[I 2021-08-22 02:11:54,565][0m Trial 11 pruned. [0m
epoch 0 -0.06837248771672955 25.570081213512275
Trial Id: 12 | Model params: 6437 | Timestamp: 2021-08-22 02:11:54.565741

[32m[I 2021-08-22 02:11:55,842][0m Trial 12 pruned. [0m
epoch 0 -43.86450138991283 165.7411904099524
Trial Id: 13 | Model params: 2543 | Timestamp: 2021-08-22 02:11:55.842816

[32m[I 2021-08-22 02:12:02,553][0m Trial 13 pruned. [0m
epoch 0 -0.10542090723635056 26.009655303332814
Trial Id: 14 | Model params: 12035 | Timestamp: 2021-08-22 02:12:02.553246

[32m[I 2021-08-22 02:12:18,549][0m Trial 14 pruned. [0m
epoch 0 -0.24130706014676417 27.56197740145027
Trial Id: 15 | Model params: 5294 | Timestamp: 2021-08-22 02:12:18.549842

[32m[I 2021-08-22 02:12:31,389][0m Trial 15 pruned. [0m
epoch 0 -43.3514354536889 164.74968761760374
Trial Id: 16 | Model params: 2135 | Timestamp: 2021-08-22 02:12:31.389989

[32m[I 2021-08-22 02:12:37,983][0m Trial 16 pruned. [0m
epoch 0 -0.05103545329461778 25.361763151225855
Trial Id: 17 | Model params: 14195 | Timestamp: 2021-08-22 02:12:37.983385

[32m[I 2021-08-22 02:12:39,549][0m Trial 17 pruned. [0m
epoch 0 -44.764486550481166 167.3953262451635
Trial Id: 18 | Model params: 8244 | Timestamp: 2021-08-22 02:12:39.549639

[32m[I 2021-08-22 02:12:48,173][0m Trial 18 pruned. [0m
epoch 0 -44.2648266330417 166.43750246089527
Trial Id: 19 | Model params: 1109 | Timestamp: 2021-08-22 02:12:48.173670

[32m[I 2021-08-22 02:13:00,746][0m Trial 19 pruned. [0m
epoch 0 0.015977320473183898 24.539929660885207
Trial Id: 20 | Model params: 5315 | Timestamp: 2021-08-22 02:13:00.746902

[32m[I 2021-08-22 02:13:07,426][0m Trial 20 pruned. [0m
epoch 0 -0.04557678857163405 25.29581790542621
Trial Id: 21 | Model params: 3343 | Timestamp: 2021-08-22 02:13:07.426781

epoch 0 -45.128089050508606 168.0589952442985
epoch 5 -45.128089050508606 168.0589952442985
epoch 10 -45.128089050508606 168.0589952442985
epoch 15 -45.128089050508606 168.0589952442985
epoch 20 -45.128089050508606 168.0589952442985
epoch 25 -45.128089050508606 168.0589952442985
epoch 30 -45.128089050508606 168.0589952442985
epoch 35 -45.128089050508606 168.0589952442985
epoch 40 -45.128089050508606 168.0589952442985
epoch 45 -45.128089050508606 168.0589952442985
epoch 50 -45.128089050508606 168.0589952442985
epoch 55 -45.128089050508606 168.0589952442985
epoch 60 -45.128089050508606 168.0589952442985
epoch 65 -45.128089050508606 168.0589952442985
epoch 70 -45.128089050508606 168.0589952442985
epoch 75 -45.128089050508606 168.0589952442985
[32m[I 2021-08-22 02:16:29,955][0m Trial 21 finished with value: 168.0589952442985 and parameters: {'n_layers_mlp': 4, 'mlp_n_units_l0': 23, 'mlp_dropout_l0': 0.18940499530789232, 'mlp_n_units_l1': 33, 'mlp_dropout_l1': 0.22569138144555617, 'mlp_n_units_l2': 48, 'mlp_dropout_l2': 0.003960094907261152, 'mlp_n_units_l3': 11, 'mlp_dropout_l3': 0.12110825817096152, 'lr': 2.9470703926126777e-05, 'criterion': 'L1Loss', 'batch_size': 128, 'no_epochs': 80}. Best is trial 2 with value: 24.080821930159964.[0m
Trial Id: 22 | Model params: 3241 | Timestamp: 2021-08-22 02:16:29.956032

[32m[I 2021-08-22 02:16:32,582][0m Trial 22 pruned. [0m
epoch 0 -45.083297898233056 167.97738136828565
Trial Id: 23 | Model params: 5271 | Timestamp: 2021-08-22 02:16:32.582428

[32m[I 2021-08-22 02:16:35,127][0m Trial 23 pruned. [0m
epoch 0 -35.221642209471945 148.9234536233459
Trial Id: 24 | Model params: 9238 | Timestamp: 2021-08-22 02:16:35.127620

[32m[I 2021-08-22 02:16:37,699][0m Trial 24 pruned. [0m
epoch 0 -44.769207097013584 167.40395932629806
Trial Id: 25 | Model params: 4040 | Timestamp: 2021-08-22 02:16:37.699258

[32m[I 2021-08-22 02:16:53,311][0m Trial 25 pruned. [0m
epoch 0 -33.67226648127938 145.66723458795306
Trial Id: 26 | Model params: 7403 | Timestamp: 2021-08-22 02:16:53.311445

[32m[I 2021-08-22 02:16:55,900][0m Trial 26 pruned. [0m
epoch 0 -36.59486590862005 151.72016316753405
Trial Id: 27 | Model params: 4914 | Timestamp: 2021-08-22 02:16:55.900949

[32m[I 2021-08-22 02:16:58,431][0m Trial 27 pruned. [0m
epoch 0 -0.06501511537436144 25.536237968795763
Trial Id: 28 | Model params: 7970 | Timestamp: 2021-08-22 02:16:58.431965

epoch 0 -45.140352916652155 168.03943612425067
epoch 5 -45.140352916652155 168.03943612425067
epoch 10 -45.140352916652155 168.03943612425067
epoch 15 -45.140352916652155 168.03943612425067
epoch 20 -45.140352916652155 168.03943612425067
epoch 25 -45.140352916652155 168.03943612425067
epoch 30 -45.140352916652155 168.03943612425067
epoch 35 -45.140352916652155 168.03943612425067
epoch 40 -45.140352916652155 168.03943612425067
epoch 45 -45.140352916652155 168.03943612425067
epoch 50 -45.140352916652155 168.03943612425067
epoch 55 -45.140352916652155 168.03943612425067
epoch 60 -45.140352916652155 168.03943612425067
epoch 65 -45.140352916652155 168.03943612425067
epoch 70 -45.140352916652155 168.03943612425067
epoch 75 -45.140352916652155 168.03943612425067
[32m[I 2021-08-22 02:27:50,817][0m Trial 28 finished with value: 168.03943612425067 and parameters: {'n_layers_mlp': 4, 'mlp_n_units_l0': 45, 'mlp_dropout_l0': 0.07942161079390372, 'mlp_n_units_l1': 57, 'mlp_dropout_l1': 0.23601181438304142, 'mlp_n_units_l2': 49, 'mlp_dropout_l2': 0.13450645857530175, 'mlp_n_units_l3': 35, 'mlp_dropout_l3': 0.13248018677960197, 'lr': 2.7054776833447018e-05, 'criterion': 'L1Loss', 'batch_size': 32, 'no_epochs': 77}. Best is trial 2 with value: 24.080821930159964.[0m
Trial Id: 29 | Model params: 1175 | Timestamp: 2021-08-22 02:27:50.817414

[32m[I 2021-08-22 02:28:04,011][0m Trial 29 pruned. [0m
epoch 0 -22.31031997207856 119.43864753786397
Trial Id: 30 | Model params: 11925 | Timestamp: 2021-08-22 02:28:04.011330

epoch 0 -45.128089050508606 168.0589952442985
epoch 5 -45.128089050508606 168.0589952442985
epoch 10 -45.128089050508606 168.0589952442985
epoch 15 -45.128089050508606 168.0589952442985
epoch 20 -45.128089050508606 168.0589952442985
epoch 25 -45.128089050508606 168.0589952442985
epoch 30 -45.128089050508606 168.0589952442985
epoch 35 -45.128089050508606 168.0589952442985
epoch 40 -45.128089050508606 168.0589952442985
epoch 45 -45.128089050508606 168.0589952442985
[32m[I 2021-08-22 02:29:18,379][0m Trial 30 finished with value: 168.0589952442985 and parameters: {'n_layers_mlp': 4, 'mlp_n_units_l0': 23, 'mlp_dropout_l0': 0.26433079692533223, 'mlp_n_units_l1': 80, 'mlp_dropout_l1': 0.2602969092359637, 'mlp_n_units_l2': 69, 'mlp_dropout_l2': 0.001936214959323057, 'mlp_n_units_l3': 57, 'mlp_dropout_l3': 0.23567314339397347, 'lr': 0.00011064988933864806, 'criterion': 'MSELoss', 'batch_size': 256, 'no_epochs': 47}. Best is trial 2 with value: 24.080821930159964.[0m
Trial Id: 31 | Model params: 5991 | Timestamp: 2021-08-22 02:29:18.380057

[32m[I 2021-08-22 02:29:26,898][0m Trial 31 pruned. [0m
epoch 0 -0.02061602251541128 24.992053997369002
Trial Id: 32 | Model params: 5757 | Timestamp: 2021-08-22 02:29:26.898763

[32m[I 2021-08-22 02:29:35,361][0m Trial 32 pruned. [0m
epoch 0 0.028305231681240772 24.38572611465106
Trial Id: 33 | Model params: 3151 | Timestamp: 2021-08-22 02:29:35.361609

[32m[I 2021-08-22 02:29:43,747][0m Trial 33 pruned. [0m
epoch 0 -0.00918489208390283 24.85170156559898
Trial Id: 34 | Model params: 5814 | Timestamp: 2021-08-22 02:29:43.747463

epoch 0 -45.140352916652155 168.03943612425067
epoch 5 -45.140352916652155 168.03943612425067
epoch 10 -45.140352916652155 168.03943612425067
epoch 15 -45.140352916652155 168.03943612425067
epoch 20 -45.140352916652155 168.03943612425067
epoch 25 -45.140352916652155 168.03943612425067
epoch 30 -45.140352916652155 168.03943612425067
epoch 35 -45.140352916652155 168.03943612425067
epoch 40 -45.140352916652155 168.03943612425067
epoch 45 -45.140352916652155 168.03943612425067
epoch 50 -45.140352916652155 168.03943612425067
[32m[I 2021-08-22 02:37:11,879][0m Trial 34 finished with value: 168.03943612425067 and parameters: {'n_layers_mlp': 4, 'mlp_n_units_l0': 44, 'mlp_dropout_l0': 0.1463191204752564, 'mlp_n_units_l1': 29, 'mlp_dropout_l1': 0.15680470320962875, 'mlp_n_units_l2': 44, 'mlp_dropout_l2': 0.01904846366952093, 'mlp_n_units_l3': 54, 'mlp_dropout_l3': 0.023807408025255772, 'lr': 0.0005296776555536842, 'criterion': 'L1Loss', 'batch_size': 32, 'no_epochs': 53}. Best is trial 2 with value: 24.080821930159964.[0m
Trial Id: 35 | Model params: 7282 | Timestamp: 2021-08-22 02:37:11.880118

[32m[I 2021-08-22 02:37:27,928][0m Trial 35 pruned. [0m
epoch 0 -0.04126150521880989 25.243563740340843
Trial Id: 36 | Model params: 7454 | Timestamp: 2021-08-22 02:37:27.929044

epoch 0 -45.128089050508606 168.0589952442985
epoch 5 -45.128089050508606 168.0589952442985
epoch 10 -45.128089050508606 168.0589952442985
epoch 15 -45.128089050508606 168.0589952442985
epoch 20 -45.128089050508606 168.0589952442985
epoch 25 -45.128089050508606 168.0589952442985
epoch 30 -45.128089050508606 168.0589952442985
epoch 35 -45.128089050508606 168.0589952442985
epoch 40 -45.128089050508606 168.0589952442985
epoch 45 -45.128089050508606 168.0589952442985
[32m[I 2021-08-22 02:39:30,303][0m Trial 36 finished with value: 168.0589952442985 and parameters: {'n_layers_mlp': 4, 'mlp_n_units_l0': 50, 'mlp_dropout_l0': 0.21400502137909572, 'mlp_n_units_l1': 55, 'mlp_dropout_l1': 0.12760727942575112, 'mlp_n_units_l2': 34, 'mlp_dropout_l2': 0.08709364074398482, 'mlp_n_units_l3': 54, 'mlp_dropout_l3': 0.12189265379088463, 'lr': 0.00022689706979336832, 'criterion': 'L1Loss', 'batch_size': 128, 'no_epochs': 48}. Best is trial 2 with value: 24.080821930159964.[0m
Trial Id: 37 | Model params: 11255 | Timestamp: 2021-08-22 02:39:30.303530

[32m[I 2021-08-22 02:39:38,818][0m Trial 37 pruned. [0m
epoch 0 -0.03927046164913062 25.21941750780869
Trial Id: 38 | Model params: 4015 | Timestamp: 2021-08-22 02:39:38.819093

[32m[I 2021-08-22 02:39:54,506][0m Trial 38 pruned. [0m
epoch 0 -40.46588388815433 159.30016409306117
Trial Id: 39 | Model params: 1740 | Timestamp: 2021-08-22 02:39:54.506717

epoch 0 -45.140352916652155 168.03943612425067
epoch 5 -45.140352916652155 168.03943612425067
epoch 10 -45.140352916652155 168.03943612425067
epoch 15 -0.04779952613827665 25.322691165766713
epoch 20 -0.021093382670189342 24.997897926836487
epoch 25 -0.049824517222880615 25.347148836933847
epoch 30 -0.13799318719620124 26.39007294012359
epoch 35 -0.22636962331669785 27.395640079966917
epoch 40 -0.22257104334128508 27.35317929337651
[32m[I 2021-08-22 02:44:36,443][0m Trial 39 finished with value: 28.41328751609517 and parameters: {'n_layers_mlp': 2, 'mlp_n_units_l0': 21, 'mlp_dropout_l0': 0.20990085557812982, 'mlp_n_units_l1': 61, 'mlp_dropout_l1': 0.21398211053552949, 'lr': 0.0001324636751033495, 'criterion': 'L1Loss', 'batch_size': 32, 'no_epochs': 42}. Best is trial 2 with value: 24.080821930159964.[0m
Trial Id: 40 | Model params: 6849 | Timestamp: 2021-08-22 02:44:36.443814

[32m[I 2021-08-22 02:44:38,986][0m Trial 40 pruned. [0m
epoch 0 -0.27822135618960697 27.97577108795359
Trial Id: 41 | Model params: 2211 | Timestamp: 2021-08-22 02:44:38.986860

[32m[I 2021-08-22 02:44:41,085][0m Trial 41 pruned. [0m
epoch 0 -45.019007864939994 167.86016926505764
Trial Id: 42 | Model params: 1425 | Timestamp: 2021-08-22 02:44:41.085329

[32m[I 2021-08-22 02:44:43,167][0m Trial 42 pruned. [0m
epoch 0 -44.990261939681176 167.8077338707149
Trial Id: 43 | Model params: 2037 | Timestamp: 2021-08-22 02:44:43.167200

[32m[I 2021-08-22 02:44:45,279][0m Trial 43 pruned. [0m
epoch 0 -44.5046195834922 166.91938466043703
Trial Id: 44 | Model params: 1601 | Timestamp: 2021-08-22 02:44:45.279405

[32m[I 2021-08-22 02:44:46,648][0m Trial 44 pruned. [0m
epoch 0 -41.39389787809385 161.11304495621064
Trial Id: 45 | Model params: 2569 | Timestamp: 2021-08-22 02:44:46.648484

[32m[I 2021-08-22 02:44:59,447][0m Trial 45 pruned. [0m
epoch 0 -0.3087804923539448 28.301155403836727
Trial Id: 46 | Model params: 1313 | Timestamp: 2021-08-22 02:44:59.447961

epoch 0 -45.140352916652155 168.03943612425067
epoch 5 -45.140352916652155 168.03943612425067
epoch 10 -45.140352916652155 168.03943612425067
epoch 15 -45.140352916652155 168.03943612425067
epoch 20 -45.140352916652155 168.03943612425067
epoch 25 -45.140352916652155 168.03943612425067
epoch 30 -45.140352916652155 168.03943612425067
epoch 35 -45.140352916652155 168.03943612425067
epoch 40 -45.140352916652155 168.03943612425067
epoch 45 -45.140352916652155 168.03943612425067
epoch 50 -45.140352916652155 168.03943612425067
epoch 55 -45.140352916652155 168.03943612425067
epoch 60 -45.140352916652155 168.03943612425067
[32m[I 2021-08-22 02:52:22,649][0m Trial 46 finished with value: 168.03943612425067 and parameters: {'n_layers_mlp': 2, 'mlp_n_units_l0': 30, 'mlp_dropout_l0': 0.02688560600659013, 'mlp_n_units_l1': 26, 'mlp_dropout_l1': 0.13677150899303844, 'lr': 1.0046328098776336e-05, 'criterion': 'L1Loss', 'batch_size': 32, 'no_epochs': 66}. Best is trial 2 with value: 24.080821930159964.[0m
epoch 65 -45.140352916652155 168.03943612425067
Trial Id: 47 | Model params: 945 | Timestamp: 2021-08-22 02:52:22.650009

epoch 0 -45.128089050508606 168.0589952442985
epoch 5 -0.08841760271163879 25.815278191739353
epoch 10 -0.025846157416520965 25.062255263228767
epoch 15 0.007917169326899898 24.6463719220603
epoch 20 -0.005541740548220542 24.812988974328487
epoch 25 0.008166194119486048 24.643278459163465
epoch 30 0.0009814637285842087 24.732373943028698
epoch 35 -0.012704699507300798 24.901209589588312
epoch 40 -0.03129660957122016 25.12874654873103
epoch 45 -0.06544613827685586 25.541404839125647
[32m[I 2021-08-22 02:54:03,621][0m Trial 47 pruned. [0m
Trial Id: 48 | Model params: 4319 | Timestamp: 2021-08-22 02:54:03.621484

