[32m[I 2021-08-22 09:43:34,117][0m Trial 41 finished with value: 28.076463371630062 and parameters: {'n_layers_mlp': 4, 'mlp_n_units_l0': 28, 'mlp_dropout_l0': 0.24347103369074327, 'mlp_n_units_l1': 74, 'mlp_dropout_l1': 0.1711052379421384, 'mlp_n_units_l2': 26, 'mlp_dropout_l2': 0.07625606936545143, 'mlp_n_units_l3': 47, 'mlp_dropout_l3': 0.025455321730842806, 'lr': 4.959538363363184e-05, 'criterion': 'L1Loss', 'batch_size': 256, 'no_epochs': 48}. Best is trial 2 with value: 26.45581733714406.[0m
Trial Id: 42 | Model params: 6035 | Timestamp: 2021-08-22 09:43:34.117348

epoch 0 -28.441178999543123 155.37618823797487
epoch 5 -15.073497548042834 114.80533183528073
epoch 10 -0.23499581951399073 31.822889281369676
epoch 15 -0.15815297984978072 30.81696240255594
epoch 20 -0.09759355971696859 30.000441020453056
epoch 25 -0.06296239726399011 29.523362212598904
epoch 30 -0.03672931154255865 29.156779523812894
epoch 35 -0.020483721227107843 28.927433552832376
epoch 40 -0.002303718552985945 28.668603280010384
[32m[I 2021-08-22 09:44:49,667][0m Trial 42 finished with value: 28.758675479753755 and parameters: {'n_layers_mlp': 4, 'mlp_n_units_l0': 39, 'mlp_dropout_l0': 0.25143209432715175, 'mlp_n_units_l1': 77, 'mlp_dropout_l1': 0.18426051884540326, 'mlp_n_units_l2': 20, 'mlp_dropout_l2': 0.10856165631344034, 'mlp_n_units_l3': 35, 'mlp_dropout_l3': 0.0701286832346576, 'lr': 2.8761317477989178e-05, 'criterion': 'L1Loss', 'batch_size': 256, 'no_epochs': 43}. Best is trial 2 with value: 26.45581733714406.[0m
Trial Id: 43 | Model params: 5837 | Timestamp: 2021-08-22 09:44:49.668227

epoch 0 -28.433509017199757 155.35594770603657
epoch 5 -0.3098333719757149 32.77290127029608
epoch 10 -0.19474754795290083 31.300043274384237
epoch 15 -0.1084730855380509 30.148759013301518
epoch 20 -0.04265452875533127 29.2399806587552
epoch 25 -0.02228279667611499 28.9529213275547
epoch 30 0.002606721130469336 28.598291113953035
epoch 35 0.022379989197913508 28.313392228110438
[32m[I 2021-08-22 09:45:59,843][0m Trial 43 finished with value: 28.216168458307287 and parameters: {'n_layers_mlp': 4, 'mlp_n_units_l0': 32, 'mlp_dropout_l0': 0.2766360953845571, 'mlp_n_units_l1': 65, 'mlp_dropout_l1': 0.2061490366485083, 'mlp_n_units_l2': 41, 'mlp_dropout_l2': 0.036386503932773456, 'mlp_n_units_l3': 11, 'mlp_dropout_l3': 0.009303945017233254, 'lr': 5.372842225017325e-05, 'criterion': 'L1Loss', 'batch_size': 256, 'no_epochs': 40}. Best is trial 2 with value: 26.45581733714406.[0m
Trial Id: 44 | Model params: 9459 | Timestamp: 2021-08-22 09:45:59.843987

[32m[I 2021-08-22 09:46:01,608][0m Trial 44 pruned. [0m
epoch 0 -25.309564349324912 146.8803478788274
Trial Id: 45 | Model params: 4757 | Timestamp: 2021-08-22 09:46:01.608273

epoch 0 -28.465503571446167 155.44036160088996
epoch 5 -27.806325800299632 153.69183581748536
epoch 10 -21.76704733744001 136.63445200423695
epoch 15 -5.393004851500493 72.40347006971197
epoch 20 -0.3642375582044244 33.446591419969494
epoch 25 -0.3122791326716947 32.80348427940833
epoch 30 -0.2892189277532309 32.51398496412336
epoch 35 -0.2698664691821304 32.269028599570824
epoch 40 -0.22742688126492494 31.725222688361104
epoch 45 -0.19724152615488943 31.332694913121564
epoch 50 -0.1858363731850745 31.183097148289846
epoch 55 -0.18199159449473568 31.132504398711127
epoch 60 -0.15634985701377158 30.792963667339894
[32m[I 2021-08-22 09:47:53,296][0m Trial 45 finished with value: 30.916751785396993 and parameters: {'n_layers_mlp': 4, 'mlp_n_units_l0': 12, 'mlp_dropout_l0': 0.29994151699811133, 'mlp_n_units_l1': 75, 'mlp_dropout_l1': 0.12918638174158364, 'mlp_n_units_l2': 27, 'mlp_dropout_l2': 0.10832777175306058, 'mlp_n_units_l3': 53, 'mlp_dropout_l3': 0.26468512968721386, 'lr': 1.7578943660480266e-05, 'criterion': 'L1Loss', 'batch_size': 256, 'no_epochs': 63}. Best is trial 2 with value: 26.45581733714406.[0m
Trial Id: 46 | Model params: 7229 | Timestamp: 2021-08-22 09:47:53.296757

[32m[I 2021-08-22 09:48:03,056][0m Trial 46 pruned. [0m
epoch 0 0.07293538854183901 27.626695531629146
Trial Id: 47 | Model params: 6095 | Timestamp: 2021-08-22 09:48:03.056904

[32m[I 2021-08-22 09:48:21,269][0m Trial 47 pruned. [0m
epoch 0 -0.17800810847896886 31.136591371083483
Trial Id: 48 | Model params: 9727 | Timestamp: 2021-08-22 09:48:21.269738

[32m[I 2021-08-22 09:48:24,133][0m Trial 48 pruned. [0m
epoch 0 -0.0347056961803045 29.13427834754099
Trial Id: 49 | Model params: 8381 | Timestamp: 2021-08-22 09:48:24.133570

[32m[I 2021-08-22 09:48:25,922][0m Trial 49 pruned. [0m
epoch 0 0.031350866725911364 28.183187576902103
Trial Id: 50 | Model params: 5315 | Timestamp: 2021-08-22 09:48:25.922545

[32m[I 2021-08-22 09:48:33,640][0m Trial 50 pruned. [0m
epoch 0 0.08484632120860858 27.448647803683404
Trial Id: 51 | Model params: 5853 | Timestamp: 2021-08-22 09:48:33.640375

epoch 0 -28.421056536638318 155.3230808878781
epoch 5 -0.1472888241379391 30.672081223582953
epoch 10 -0.09828233004687359 30.009852597615122
epoch 15 -0.06799757524655647 29.593204643980883
epoch 20 -0.051371113858572404 29.36194929945425
epoch 25 -0.026484567174580143 29.01236123141968
epoch 30 -0.0008437389456208422 28.647715983846975
epoch 35 -0.0009021199901757537 28.648551508479407
epoch 40 0.01780524649653037 28.37956073311411
epoch 45 0.028077344888291167 28.230769545543353
[32m[I 2021-08-22 09:49:59,055][0m Trial 51 finished with value: 28.209281437956925 and parameters: {'n_layers_mlp': 4, 'mlp_n_units_l0': 26, 'mlp_dropout_l0': 0.24581241194835146, 'mlp_n_units_l1': 76, 'mlp_dropout_l1': 0.1638083434005821, 'mlp_n_units_l2': 27, 'mlp_dropout_l2': 0.07714320616054803, 'mlp_n_units_l3': 45, 'mlp_dropout_l3': 0.034213747088654316, 'lr': 5.188280812444727e-05, 'criterion': 'L1Loss', 'batch_size': 256, 'no_epochs': 48}. Best is trial 2 with value: 26.45581733714406.[0m
Trial Id: 52 | Model params: 3333 | Timestamp: 2021-08-22 09:49:59.055411

epoch 0 -28.4824957332816 155.48517480240145
epoch 5 -28.4824957332816 155.48517480240145
epoch 10 -28.4824957332816 155.48517480240145
epoch 15 -28.4824957332816 155.48517480240145
epoch 20 -28.4824957332816 155.48517480240145
epoch 25 -28.4824957332816 155.48517480240145
epoch 30 -28.4824957332816 155.48517480240145
epoch 35 -28.4824957332816 155.48517480240145
epoch 40 -28.4824957332816 155.48517480240145
epoch 45 -28.4824957332816 155.48517480240145
epoch 50 -28.4824957332816 155.48517480240145
[32m[I 2021-08-22 09:51:30,999][0m Trial 52 finished with value: 155.48517480240145 and parameters: {'n_layers_mlp': 4, 'mlp_n_units_l0': 29, 'mlp_dropout_l0': 0.20342653559705579, 'mlp_n_units_l1': 59, 'mlp_dropout_l1': 0.17118529076360994, 'mlp_n_units_l2': 12, 'mlp_dropout_l2': 0.08563532460072745, 'mlp_n_units_l3': 27, 'mlp_dropout_l3': 2.253011875308006e-05, 'lr': 0.00020829890508407113, 'criterion': 'L1Loss', 'batch_size': 256, 'no_epochs': 52}. Best is trial 2 with value: 26.45581733714406.[0m
Trial Id: 53 | Model params: 4613 | Timestamp: 2021-08-22 09:51:30.999871

epoch 0 -28.4824957332816 155.48517480240145
epoch 5 -28.4824957332816 155.48517480240145
epoch 10 -28.4824957332816 155.48517480240145
epoch 15 -28.4824957332816 155.48517480240145
epoch 20 -28.4824957332816 155.48517480240145
epoch 25 -28.4824957332816 155.48517480240145
epoch 30 -28.4824957332816 155.48517480240145
epoch 35 -28.4824957332816 155.48517480240145
epoch 40 -28.4824957332816 155.48517480240145
[32m[I 2021-08-22 09:52:46,948][0m Trial 53 finished with value: 155.48517480240145 and parameters: {'n_layers_mlp': 4, 'mlp_n_units_l0': 21, 'mlp_dropout_l0': 0.23558085734867396, 'mlp_n_units_l1': 69, 'mlp_dropout_l1': 0.1834434563615871, 'mlp_n_units_l2': 21, 'mlp_dropout_l2': 0.05397964703822464, 'mlp_n_units_l3': 56, 'mlp_dropout_l3': 0.07123351957560846, 'lr': 0.004033244050020319, 'criterion': 'L1Loss', 'batch_size': 256, 'no_epochs': 43}. Best is trial 2 with value: 26.45581733714406.[0m
Trial Id: 54 | Model params: 8100 | Timestamp: 2021-08-22 09:52:46.948310

[32m[I 2021-08-22 09:52:48,859][0m Trial 54 pruned. [0m
epoch 0 -27.503435698447984 152.88168819221795
Trial Id: 55 | Model params: 6063 | Timestamp: 2021-08-22 09:52:48.859315

[32m[I 2021-08-22 09:53:07,118][0m Trial 55 pruned. [0m
epoch 0 -28.36976701056943 155.47020738590203
Trial Id: 56 | Model params: 5991 | Timestamp: 2021-08-22 09:53:07.118518

[32m[I 2021-08-22 09:53:16,652][0m Trial 56 pruned. [0m
epoch 0 -0.164093079671904 30.957636289202217
Trial Id: 57 | Model params: 4803 | Timestamp: 2021-08-22 09:53:16.652778

epoch 0 -28.423133039463377 155.32856204939137
epoch 5 -0.3309696034080851 33.036264354305864
epoch 10 -0.21622627350588108 31.580140260801045
epoch 15 -0.15228322678408168 30.73876991006616
epoch 20 -0.12925476641997657 30.430061509779517
epoch 25 -0.1448924066613364 30.6400310838218
epoch 30 -0.1655913576661363 30.91576684775214
epoch 35 -0.23215009873051873 31.786204426442673
epoch 40 -0.20335163290272207 31.412546165795966
epoch 45 -0.24806353454124852 31.9908081403139
epoch 50 -0.23891800767985139 31.87338192897001
epoch 55 -0.2684739676789709 32.251331071043786
epoch 60 -0.26779007517752573 32.242635812900936
epoch 65 -0.2819666695835781 32.42240534337081
[32m[I 2021-08-22 09:55:17,033][0m Trial 57 finished with value: 31.941260218754426 and parameters: {'n_layers_mlp': 4, 'mlp_n_units_l0': 49, 'mlp_dropout_l0': 0.2943333177178792, 'mlp_n_units_l1': 63, 'mlp_dropout_l1': 0.1769211349262991, 'mlp_n_units_l2': 10, 'mlp_dropout_l2': 0.08806135014507344, 'mlp_n_units_l3': 19, 'mlp_dropout_l3': 0.020049170936952448, 'lr': 5.834338220607915e-05, 'criterion': 'L1Loss', 'batch_size': 256, 'no_epochs': 68}. Best is trial 2 with value: 26.45581733714406.[0m
Trial Id: 58 | Model params: 4839 | Timestamp: 2021-08-22 09:55:17.033918

[32m[I 2021-08-22 09:55:26,806][0m Trial 58 pruned. [0m
epoch 0 -0.11478532962066801 30.294902719058
Trial Id: 59 | Model params: 1985 | Timestamp: 2021-08-22 09:55:26.807128

[32m[I 2021-08-22 09:55:41,629][0m Trial 59 pruned. [0m
epoch 0 -26.177040159162395 149.55399037601225
Study statistics: 
  Number of finished trials:  60
  Number of pruned trials:  36
  Number of complete trials:  24

Best trial:
  Value:  26.45581733714406
  Params: 
    n_layers_mlp: 2
    mlp_n_units_l0: 21
    mlp_dropout_l0: 0.2481551783553626
    mlp_n_units_l1: 77
    mlp_dropout_l1: 0.015155537552589504
    lr: 0.0059739578840763
    criterion: L1Loss
    batch_size: 16
    no_epochs: 73
Target 19508 0 314.0 1.0 153.39173672339552
[166. 146. 114. ... 168. 134. 150.]
Prediction 19508 0 180.23289489746094 119.33216857910156 154.23096290699448
[150.93081665 145.20433044 161.0690155  ... 151.14424133 145.70628357
 133.93768311]

 XXXXXX======== TRIAL north - qso ended

Test Set - R-squared:  0.15546346573314485
Test Set - RMSE:  26.69862786563255
Test Set - MAE:  20.79260383044351



[32m[I 2021-08-22 09:55:53,295][0m A new study created in memory with name: NeuralNetwork[0m
++++++++ Session Characteristics +++++++

Area: south
Gal Type: lrg
Training Samples: 118859
Validation Samples: 29715
Test Samples: 37144
Number of features: 15
Device: cuda:0
Number of Workers: 8
Number of Trials: 60

+++++++++++++++++++++++++++++++++++++++
Trial Id: 0 | Model params: 2153 | Timestamp: 2021-08-22 09:55:53.296470

epoch 0 -0.01186667303652622 11.831918282272463
epoch 5 -0.0028809430933851576 11.779265341266482
epoch 10 -0.008335709761456922 11.811256182966988
epoch 15 0.004159389336571118 11.73784666551813
epoch 20 0.0014430087445158613 11.753844579802099
epoch 25 0.012232862992822557 11.690169332754197
epoch 30 0.005416452551415429 11.730435903958805
epoch 35 0.009948292890003652 11.703680405238766
epoch 40 0.01291605753992664 11.686125848654733
epoch 45 0.016555889535392776 11.664559891893743
epoch 50 0.01638125884976871 11.665595486926765
epoch 55 0.012461487447959163 11.688816375583162
[32m[I 2021-08-22 10:22:28,014][0m Trial 0 finished with value: 11.721862336800566 and parameters: {'n_layers_mlp': 2, 'mlp_n_units_l0': 40, 'mlp_dropout_l0': 0.2878293643301778, 'mlp_n_units_l1': 36, 'mlp_dropout_l1': 0.18685630118440408, 'lr': 0.0003350524741961583, 'criterion': 'L1Loss', 'batch_size': 16, 'no_epochs': 59}. Best is trial 0 with value: 11.721862336800566.[0m
Trial Id: 1 | Model params: 7592 | Timestamp: 2021-08-22 10:22:28.015189

epoch 0 -0.061955413890460775 12.12059711550911
epoch 5 -0.007220357703830338 11.804106564287855
epoch 10 0.0038299390970697456 11.73917607514611
epoch 15 0.008563996729730738 11.711249056927352
epoch 20 0.008531222992147702 11.711442623748693
epoch 25 0.011292031889861165 11.695125622389654
epoch 30 0.014032445442078822 11.678906617083491
epoch 35 0.013003376513039733 11.68499975146668
epoch 40 0.01503595912799649 11.672961732681154
[32m[I 2021-08-22 10:26:02,322][0m Trial 1 finished with value: 11.695439324660832 and parameters: {'n_layers_mlp': 4, 'mlp_n_units_l0': 61, 'mlp_dropout_l0': 0.22517316480087435, 'mlp_n_units_l1': 48, 'mlp_dropout_l1': 0.11490311147562104, 'mlp_n_units_l2': 35, 'mlp_dropout_l2': 0.20090589760935196, 'mlp_n_units_l3': 52, 'mlp_dropout_l3': 0.2608411840583007, 'lr': 4.8538834002443876e-05, 'criterion': 'MSELoss', 'batch_size': 128, 'no_epochs': 43}. Best is trial 1 with value: 11.695439324660832.[0m
Trial Id: 2 | Model params: 2926 | Timestamp: 2021-08-22 10:26:02.322828

epoch 0 -0.11709633536751562 12.431937811826865
epoch 5 -0.2986642343382917 13.404232601689342
epoch 10 -0.13464685329343373 12.529215294611944
epoch 15 -0.09790730104713496 12.324699865139284
epoch 20 -0.07457631501699624 12.193044179959811
epoch 25 -0.03151843795188802 11.946261388706043
epoch 30 -0.03814167314719952 11.984552655658819
epoch 35 -0.01701507073732489 11.861980608802986
epoch 40 -0.018180314895963612 11.86877409058732
epoch 45 -0.019456120114254905 11.876207697024995
epoch 50 -0.002002793394253244 11.774107090059765
epoch 55 -0.020155129351389967 11.880278571765396
epoch 60 -0.02020871468725427 11.880590583311287
epoch 65 -0.014034884520524704 11.844588119953142
epoch 70 -0.00535686512008704 11.793796759216944
[32m[I 2021-08-22 11:06:29,135][0m Trial 2 finished with value: 11.787361497577141 and parameters: {'n_layers_mlp': 4, 'mlp_n_units_l0': 28, 'mlp_dropout_l0': 0.2286349213295926, 'mlp_n_units_l1': 37, 'mlp_dropout_l1': 0.18723582512186027, 'mlp_n_units_l2': 18, 'mlp_dropout_l2': 0.22448544055922381, 'mlp_n_units_l3': 36, 'mlp_dropout_l3': 0.08010593381468388, 'lr': 0.0001308440288718875, 'criterion': 'L1Loss', 'batch_size': 16, 'no_epochs': 72}. Best is trial 1 with value: 11.695439324660832.[0m
Trial Id: 3 | Model params: 1601 | Timestamp: 2021-08-22 11:06:29.135468

epoch 0 -0.034187835787379495 11.961085275090248
epoch 5 -0.00011832894529084648 11.76241687532444
epoch 10 -0.002364095852668724 11.775615730569776
epoch 15 0.010828933326333723 11.697864227722475
epoch 20 -0.01910524536956837 11.873544725051488
epoch 25 -0.014758966845316746 11.848198534196742
epoch 30 -0.03489434950413561 11.965170233222926
epoch 35 -0.013122343163468608 11.838640172152523
epoch 40 0.0068315603031010586 11.721476716041456
[32m[I 2021-08-22 11:17:03,513][0m Trial 3 finished with value: 11.76176596304977 and parameters: {'n_layers_mlp': 2, 'mlp_n_units_l0': 30, 'mlp_dropout_l0': 0.21058450206190518, 'mlp_n_units_l1': 35, 'mlp_dropout_l1': 0.08300267017953117, 'lr': 0.004608653455345569, 'criterion': 'L1Loss', 'batch_size': 32, 'no_epochs': 45}. Best is trial 1 with value: 11.695439324660832.[0m
Trial Id: 4 | Model params: 8538 | Timestamp: 2021-08-22 11:17:03.513848

epoch 0 -0.06044675357047424 12.111984530307677
epoch 5 -0.016723526898515972 11.859661967113464
epoch 10 -0.01617205043977643 11.856445157760655
epoch 15 -0.01916465760813124 11.873890824531337
epoch 20 -0.0200325769922165 11.87894564409022
epoch 25 -0.004018965041733269 11.785332293259373
epoch 30 -0.020483767642240025 11.881572558550369
epoch 35 -0.010341881162196698 11.822383742172386
epoch 40 -0.006722011994170662 11.801186024791765
epoch 45 -0.0027403055063295323 11.777825349176943
epoch 50 0.0013085286420820852 11.754023226449775
epoch 55 -0.0012664519427474374 11.769166490518295
epoch 60 -0.003219660468266383 11.780640177912014
[32m[I 2021-08-22 11:22:30,340][0m Trial 4 finished with value: 11.791215161256742 and parameters: {'n_layers_mlp': 4, 'mlp_n_units_l0': 34, 'mlp_dropout_l0': 0.0478932969409502, 'mlp_n_units_l1': 34, 'mlp_dropout_l1': 0.2248965178122869, 'mlp_n_units_l2': 77, 'mlp_dropout_l2': 0.2519927407641407, 'mlp_n_units_l3': 52, 'mlp_dropout_l3': 0.2239661133502255, 'lr': 6.183128161640034e-05, 'criterion': 'L1Loss', 'batch_size': 128, 'no_epochs': 65}. Best is trial 1 with value: 11.695439324660832.[0m
Trial Id: 5 | Model params: 9754 | Timestamp: 2021-08-22 11:22:30.340448

epoch 0 -8.316115461123516 35.89949217640421
epoch 5 -8.316115461123516 35.89949217640421
epoch 10 -8.316115461123516 35.89949217640421
epoch 15 -8.316115461123516 35.89949217640421
epoch 20 -8.316115461123516 35.89949217640421
epoch 25 -8.316115461123516 35.89949217640421
epoch 30 -8.316115461123516 35.89949217640421
epoch 35 -8.316115461123516 35.89949217640421
epoch 40 -8.316115461123516 35.89949217640421
epoch 45 -8.316115461123516 35.89949217640421
epoch 50 -8.316115461123516 35.89949217640421
epoch 55 -8.316115461123516 35.89949217640421
[32m[I 2021-08-22 11:27:19,762][0m Trial 5 finished with value: 35.89949217640421 and parameters: {'n_layers_mlp': 4, 'mlp_n_units_l0': 57, 'mlp_dropout_l0': 0.04592146184338355, 'mlp_n_units_l1': 31, 'mlp_dropout_l1': 0.15807362235818662, 'mlp_n_units_l2': 67, 'mlp_dropout_l2': 0.03289467150161798, 'mlp_n_units_l3': 71, 'mlp_dropout_l3': 0.056417338941340156, 'lr': 0.009655962320459377, 'criterion': 'MSELoss', 'batch_size': 128, 'no_epochs': 58}. Best is trial 1 with value: 11.695439324660832.[0m
Trial Id: 6 | Model params: 1565 | Timestamp: 2021-08-22 11:27:19.762463

[32m[I 2021-08-22 11:27:23,727][0m Trial 6 pruned. [0m
epoch 0 -0.018294732498290944 11.868822163225644
Trial Id: 7 | Model params: 12477 | Timestamp: 2021-08-22 11:27:23.727730

[32m[I 2021-08-22 11:27:41,157][0m Trial 7 pruned. [0m
epoch 0 -0.019352008341262383 11.874982149622387
Trial Id: 8 | Model params: 6846 | Timestamp: 2021-08-22 11:27:41.158001

epoch 0 -8.316115461123516 35.89949217640421
epoch 5 -8.316115461123516 35.89949217640421
epoch 10 -8.316115461123516 35.89949217640421
epoch 15 -8.316115461123516 35.89949217640421
epoch 20 -8.316115461123516 35.89949217640421
epoch 25 -8.316115461123516 35.89949217640421
epoch 30 -8.316115461123516 35.89949217640421
epoch 35 -8.316115461123516 35.89949217640421
epoch 40 -8.316115461123516 35.89949217640421
epoch 45 -8.316115461123516 35.89949217640421
epoch 50 -8.316115461123516 35.89949217640421
epoch 55 -8.316115461123516 35.89949217640421
epoch 60 -8.316115461123516 35.89949217640421
epoch 65 -8.316115461123516 35.89949217640421
[32m[I 2021-08-22 11:31:06,526][0m Trial 8 finished with value: 35.89949217640421 and parameters: {'n_layers_mlp': 4, 'mlp_n_units_l0': 74, 'mlp_dropout_l0': 0.13981948548021803, 'mlp_n_units_l1': 27, 'mlp_dropout_l1': 0.12117337979463687, 'mlp_n_units_l2': 50, 'mlp_dropout_l2': 0.15381500283845698, 'mlp_n_units_l3': 43, 'mlp_dropout_l3': 0.07442039853835378, 'lr': 0.002148622181591183, 'criterion': 'L1Loss', 'batch_size': 256, 'no_epochs': 69}. Best is trial 1 with value: 11.695439324660832.[0m
Trial Id: 9 | Model params: 3702 | Timestamp: 2021-08-22 11:31:06.526821

epoch 0 -7.192518813074965 33.66507588023179
epoch 5 -0.02929081379585563 11.932732978297397
epoch 10 -0.018842633902325323 11.872014789886306
epoch 15 -0.013601559884378167 11.841439737102277
epoch 20 -0.015057366383783855 11.849940443958737
epoch 25 -0.024699550551049887 11.906089609233108
epoch 30 -0.035181911160650836 11.966832473041311
epoch 35 -0.04601630950393565 12.029292968301336
epoch 40 -0.04455340607057057 12.020878256727018
epoch 45 -0.06342735767001084 12.128994200460534
epoch 50 -0.06849174402583103 12.157841001036443
epoch 55 -0.06697017932289784 12.14918134957371
epoch 60 -0.06616732238518575 12.144609576946817
epoch 65 -0.06923612064985418 12.162075211099943
epoch 70 -0.07681655856610092 12.205111088293114
[32m[I 2021-08-22 11:52:27,387][0m Trial 9 finished with value: 12.157692331509496 and parameters: {'n_layers_mlp': 4, 'mlp_n_units_l0': 31, 'mlp_dropout_l0': 0.11594169106618823, 'mlp_n_units_l1': 64, 'mlp_dropout_l1': 0.17044844149284696, 'mlp_n_units_l2': 11, 'mlp_dropout_l2': 0.12093798756310108, 'mlp_n_units_l3': 34, 'mlp_dropout_l3': 0.13136808127356484, 'lr': 1.1809208061351842e-05, 'criterion': 'MSELoss', 'batch_size': 32, 'no_epochs': 73}. Best is trial 1 with value: 11.695439324660832.[0m
Trial Id: 10 | Model params: 2101 | Timestamp: 2021-08-22 11:52:27.387810

epoch 0 -8.05576435607076 35.39430838670881
epoch 5 -4.3448151861043565 27.191753860576725
epoch 10 -0.2612065527839049 13.208818822958431
epoch 15 -0.06321741837092576 12.127796902775456
epoch 20 -0.05462991052287158 12.078720062808602
epoch 25 -0.04585196539230885 12.028347944258197
epoch 30 -0.04203795344928807 12.006395428008284
epoch 35 -0.03880060774088734 11.987730518314654
[32m[I 2021-08-22 11:55:11,068][0m Trial 10 finished with value: 11.949716588418857 and parameters: {'n_layers_mlp': 2, 'mlp_n_units_l0': 80, 'mlp_dropout_l0': 0.2876753012274106, 'mlp_n_units_l1': 10, 'mlp_dropout_l1': 0.29294889181662, 'lr': 1.6329135147996827e-05, 'criterion': 'MSELoss', 'batch_size': 128, 'no_epochs': 41}. Best is trial 1 with value: 11.695439324660832.[0m
epoch 40 -0.03222283517586444 11.949716588418857
Trial Id: 11 | Model params: 3252 | Timestamp: 2021-08-22 11:55:11.068967

[32m[I 2021-08-22 11:55:37,996][0m Trial 11 pruned. [0m
epoch 0 0.007249215873564863 11.719622822337062
Trial Id: 12 | Model params: 4193 | Timestamp: 2021-08-22 11:55:37.996830

