[32m[I 2022-02-27 17:24:44,031][0m Trial 18 pruned. [0m
epoch 0 0.008554827495328876 4.484108247081302
Trial Id: 19 | Model params: 2895 | Timestamp: 2022-02-27 17:24:44.032048

epoch 0 -3.7624848249260125 9.82853210824372
epoch 5 -3.7624848249260125 9.82853210824372
epoch 10 -0.03304513326547931 4.577533237210139
epoch 15 0.008794855561730985 4.483876394532713
epoch 20 0.015899564670092348 4.467777846095134
epoch 25 0.018292038845518555 4.4623436712631985
epoch 30 0.01930338358054451 4.460044550313821
epoch 35 0.019774943710222703 4.458972132995189
epoch 40 0.02045555160606205 4.457423846404727
epoch 45 0.02068408496627927 4.456903844748075
epoch 50 0.020796182863968338 4.4566487565577555
epoch 55 0.021014292427431136 4.456152388063189
epoch 60 0.021178887929153456 4.455777768973249
epoch 65 0.021416393226939667 4.455237151787711
epoch 70 0.021577340143075108 4.454870761955949
epoch 75 0.02151048580731385 4.455022957091316
epoch 80 0.02143247757051181 4.455200537716616
epoch 85 0.021765029221626264 4.454443456495389
epoch 90 0.02144306452351974 4.455176437628872
epoch 95 0.02176992607102579 4.454432307453128
[32m[I 2022-02-27 17:33:22,432][0m Trial 19 finished with value: 4.454940110360205 and parameters: {'n_layers_mlp': 2, 'mlp_n_units_l0': 46, 'mlp_dropout_l0': 0.13003763158234966, 'mlp_n_units_l1': 44, 'mlp_dropout_l1': 0.20189772787936633, 'lr': 2.1369623397971314e-05, 'weight_decay': 0.10157963400977937, 'criterion': 'MSELoss', 'batch_size': 256}. Best is trial 16 with value: 4.437446227089091.[0m
Trial Id: 20 | Model params: 2911 | Timestamp: 2022-02-27 17:33:22.432765

[32m[I 2022-02-27 17:33:27,560][0m Trial 20 pruned. [0m
epoch 0 -0.014697394356831817 4.536700725492762
Trial Id: 21 | Model params: 3615 | Timestamp: 2022-02-27 17:33:27.560574

epoch 0 -3.7624848249260125 9.82853210824372
epoch 5 -3.3491089243666634 9.392300968711853
epoch 10 -0.00394970218360613 4.5126103583994714
epoch 15 0.013660049542029262 4.472858613119467
epoch 20 0.01758478701927091 4.463950784896275
epoch 25 0.019763337353459143 4.458998531151331
epoch 30 0.020904629907414263 4.456401962297311
epoch 35 0.02169770586133901 4.454596734057104
epoch 40 0.022237033301544362 4.4533686793568465
epoch 45 0.02263267500772792 4.452467583326315
epoch 50 0.022887310942341088 4.451887539329418
epoch 55 0.02310178288007969 4.45139892764856
epoch 60 0.02325131971714378 4.451058219896391
epoch 65 0.023222674859565196 4.451123486938251
epoch 70 0.023472863128339294 4.4505534029644735
epoch 75 0.023610601396996556 4.45023951863149
epoch 80 0.023605422759774397 4.450251320349889
epoch 85 0.023727994051559786 4.449971981348102
epoch 90 0.023772105143310185 4.449871448229002
epoch 95 0.023825063696479742 4.449750747954492
[32m[I 2022-02-27 17:42:07,596][0m Trial 21 finished with value: 4.449811512101853 and parameters: {'n_layers_mlp': 2, 'mlp_n_units_l0': 62, 'mlp_dropout_l0': 0.14300599408050596, 'mlp_n_units_l1': 40, 'mlp_dropout_l1': 0.004867789969331043, 'lr': 1.8412250854490757e-05, 'weight_decay': 0.04465961501130844, 'criterion': 'MSELoss', 'batch_size': 256}. Best is trial 16 with value: 4.437446227089091.[0m
Trial Id: 22 | Model params: 3743 | Timestamp: 2022-02-27 17:42:07.596846

[32m[I 2022-02-27 17:42:12,689][0m Trial 22 pruned. [0m
epoch 0 -1.2805732946318593 6.8013304428698795
Trial Id: 23 | Model params: 3607 | Timestamp: 2022-02-27 17:42:12.689297

[32m[I 2022-02-27 17:42:17,794][0m Trial 23 pruned. [0m
epoch 0 -0.03577017509535807 4.583566736518565
Trial Id: 24 | Model params: 2112 | Timestamp: 2022-02-27 17:42:17.794847

epoch 0 -3.1028265643186597 9.122490877028339
epoch 5 -0.015561999999838427 4.538633135027608
epoch 10 0.007329479260885341 4.487189603503085
epoch 15 0.013529645368247634 4.473154282048836
epoch 20 0.01644662660677243 4.466535853467118
epoch 25 0.01814903088281916 4.462668680056019
epoch 30 0.01900672194534192 4.460719083110603
epoch 35 0.019638270789958612 4.459282979722406
epoch 40 0.02002364239404686 4.458406441044421
epoch 45 0.020327361010020417 4.457715502963762
epoch 50 0.02029980218693872 4.457778201728665
epoch 55 0.02075613578047575 4.456739888739309
epoch 60 0.020858888535365216 4.45650605816257
epoch 65 0.020906178703416822 4.456398437584354
epoch 70 0.021143106746417062 4.455859209565208
epoch 75 0.021369139335212672 4.455344717840885
epoch 80 0.021387772182770326 4.455302303403821
epoch 85 0.021174117625621047 4.455788626619387
epoch 90 0.020940326755649608 4.4563207235541915
epoch 95 0.021560706001072405 4.454908630374653
[32m[I 2022-02-27 17:50:55,476][0m Trial 24 finished with value: 4.455145266476448 and parameters: {'n_layers_mlp': 2, 'mlp_n_units_l0': 37, 'mlp_dropout_l0': 0.12425861429094727, 'mlp_n_units_l1': 38, 'mlp_dropout_l1': 0.18885898058980854, 'lr': 1.6197850217998074e-05, 'weight_decay': 0.1015070158418207, 'criterion': 'MSELoss', 'batch_size': 256}. Best is trial 16 with value: 4.437446227089091.[0m
Study statistics: 
  Number of finished trials:  25
  Number of pruned trials:  11
  Number of complete trials:  14

Best trial:
  Value:  4.437446227089091
  Params: 
    n_layers_mlp: 2
    mlp_n_units_l0: 76
    mlp_dropout_l0: 0.12144529351085986
    mlp_n_units_l1: 40
    mlp_dropout_l1: 0.2508589801947412
    lr: 1.5826524687950403e-05
    weight_decay: 0.0022033649115401513
    criterion: MSELoss
    batch_size: 256
Target: 132570, NaN: 0, Max: 83.0, Min: 0.0, Mean: 8.78101380402806
Prediction: 132570, NaN: 0, Max: 12.21622085571289, Min: 4.750660419464111, Mean: 8.700465864799606

 XXXXXX======== TRIAL south - rlbg ended

Test Set - R-squared:  0.029890169553491774
Test Set - RMSE:  4.465878498196764
Test Set - MAE:  3.454425729467578



