[32m[I 2022-02-26 18:40:53,471][0m A new study created in memory with name: NeuralNetwork[0m
++++++++ Session Characteristics +++++++

Area: south
Gal Type: lrg
Training Samples: 424221
Validation Samples: 106056
Test Samples: 132570
Number of features: 16
Device: cuda:0
Number of Workers: 8
Number of Trials: 25

+++++++++++++++++++++++++++++++++++++++
Trial Id: 0 | Model params: 4179 | Timestamp: 2022-02-26 18:40:53.472038

epoch 0 -3.047301819359464 9.887798034436523
epoch 5 -1.733242091543152 8.125607513480091
epoch 10 -1.7190835661610837 8.104534371700083
epoch 15 -1.7395385332633122 8.13496142016177
epoch 20 -1.7301269986648795 8.120975790890474
epoch 25 -1.7274303696345252 8.116964133301707
epoch 30 -1.740024030379229 8.135682221364952
epoch 35 -1.7381210740445034 8.132856600707596
epoch 40 -1.7362666063405605 8.13010203397022
epoch 45 -1.732745929675421 8.124869964546363
epoch 50 -1.735538782246763 8.12902069239498
epoch 55 -1.7415893172180663 8.138005715238972
epoch 60 -1.7271806062517943 8.116592470864985
epoch 65 -1.7196343650626975 8.105355189170414
epoch 70 -1.7295642804116245 8.120138823083726
epoch 75 -1.7348625012274401 8.128015800369441
epoch 80 -1.7323857344386857 8.124334489244847
epoch 85 -1.7431908537112109 8.140382331279115
epoch 90 -1.7387296744661014 8.133760392909123
epoch 95 -1.7237270541673397 8.111451638853376
[32m[I 2022-02-26 18:48:15,903][0m Trial 0 finished with value: 8.125575741889353 and parameters: {'n_layers_mlp': 2, 'mlp_n_units_l0': 79, 'mlp_dropout_l0': 0.1526796189360985, 'mlp_n_units_l1': 35, 'mlp_dropout_l1': 0.26463151444653393, 'lr': 0.0002884846727754153, 'weight_decay': 0.2687415014002344, 'criterion': 'PoissonNLLLoss', 'batch_size': 256}. Best is trial 0 with value: 8.125575741889353.[0m
Trial Id: 1 | Model params: 5015 | Timestamp: 2022-02-26 18:48:15.904023

epoch 0 -0.004593743601605249 4.926199836813848
epoch 5 0.002918698055737412 4.9077459912181585
epoch 10 0.0013077901042726214 4.911708926012061
epoch 15 0.002686022674667665 4.90831858497562
epoch 20 0.003484714395482924 4.906352795518535
epoch 25 -0.0028547583781395325 4.921934282079208
epoch 30 0.001694524445600143 4.910757826951404
epoch 35 0.0021518641704050268 4.909632849694428
epoch 40 0.0031216350775757906 4.907246526412237
epoch 45 -0.0022070381695022956 4.9203445447772225
epoch 50 0.003783485603745751 4.905617238892427
epoch 55 0.0013232887415478567 4.911670813623861
epoch 60 0.0018599814809037163 4.910350860787167
epoch 65 0.0036161502278706514 4.906029222042915
epoch 70 0.003723688228288058 4.905764465238225
epoch 75 0.0041390457746369735 4.904741727524689
epoch 80 -0.002679261249289633 4.921503600008318
epoch 85 0.004077148963842703 4.904894149985002
epoch 90 0.0038996636159557285 4.905331185876711
epoch 95 0.00340932328304977 4.906538386449635
[32m[I 2022-02-26 19:02:19,191][0m Trial 1 finished with value: 4.920747755765854 and parameters: {'n_layers_mlp': 4, 'mlp_n_units_l0': 16, 'mlp_dropout_l0': 0.2671016967277888, 'mlp_n_units_l1': 64, 'mlp_dropout_l1': 0.14451847434710616, 'mlp_n_units_l2': 41, 'mlp_dropout_l2': 0.2505956742854305, 'mlp_n_units_l3': 23, 'mlp_dropout_l3': 0.1257008256401596, 'lr': 0.00037223311562420707, 'weight_decay': 0.2982514430247208, 'criterion': 'MSELoss', 'batch_size': 128}. Best is trial 1 with value: 4.920747755765854.[0m
Trial Id: 2 | Model params: 5264 | Timestamp: 2022-02-26 19:02:19.191325

epoch 0 -1.7081380468524543 8.087598388511543
epoch 5 -1.7512335568077586 8.151694732542232
epoch 10 -1.7154741536214475 8.098545274831617
epoch 15 -1.73312029428594 8.124816313543636
epoch 20 -1.7181922047951437 8.102597376547918
epoch 25 -1.7320813488879212 8.123271917037483
epoch 30 -1.7061372190231343 8.084610194846563
epoch 35 -1.7360157857234477 8.129118924862677
epoch 40 -1.7344240461083071 8.126753930625844
epoch 45 -1.7245038723577482 8.111999075211765
epoch 50 -1.7161580405015275 8.099565012063012
epoch 55 -1.7402065672084128 8.135342267197332
epoch 60 -1.7295518912739896 8.119510639924336
epoch 65 -1.7342901350457818 8.126554935232411
epoch 70 -1.739434726857283 8.134196436124286
epoch 75 -1.7508699528071285 8.151156049312984
epoch 80 -1.7280674493630719 8.117302478743195
epoch 85 -1.745393632432314 8.143038511786923
epoch 90 -1.7092849660179588 8.089310790085076
epoch 95 -1.7163757792341396 8.099889653275227
[32m[I 2022-02-26 19:51:44,472][0m Trial 2 finished with value: 8.08930567699231 and parameters: {'n_layers_mlp': 4, 'mlp_n_units_l0': 20, 'mlp_dropout_l0': 0.09959434865630185, 'mlp_n_units_l1': 21, 'mlp_dropout_l1': 0.01676895244161971, 'mlp_n_units_l2': 71, 'mlp_dropout_l2': 0.23283965934802806, 'mlp_n_units_l3': 40, 'mlp_dropout_l3': 0.05559618223833263, 'lr': 0.0010291003081709601, 'weight_decay': 0.17494380242101842, 'criterion': 'PoissonNLLLoss', 'batch_size': 32}. Best is trial 1 with value: 4.920747755765854.[0m
Trial Id: 3 | Model params: 2592 | Timestamp: 2022-02-26 19:51:44.472366

epoch 0 -1.741517277002698 8.137898794130832
epoch 5 -1.711862385722359 8.093765446863978
epoch 10 -1.706408325282315 8.085622315429767
epoch 15 -1.7031768600711512 8.080793736718816
epoch 20 -1.7010162375683606 8.077563641927162
epoch 25 -1.7090698992216429 8.089597176326365
epoch 30 -1.7046661710975846 8.083019480473883
epoch 35 -1.7151784382030115 8.098712444061158
epoch 40 -1.7085636182803978 8.088841234177659
epoch 45 -1.7170708794151568 8.101534296825733
epoch 50 -1.7049646181301124 8.08346542952655
epoch 55 -1.7092354206552978 8.08984430565854
epoch 60 -1.7075747352057697 8.087364501572887
epoch 65 -1.71608246026654 8.100060570084015
epoch 70 -1.7081861124002673 8.088277523671755
epoch 75 -1.7056850015493081 8.084541748006071
epoch 80 -1.7079817161431476 8.08797229264656
epoch 85 -1.7070459860017846 8.086574791823358
epoch 90 -1.7140714183313208 8.097061291137424
epoch 95 -1.7058720271151446 8.084821157816553
[32m[I 2022-02-26 20:06:04,911][0m Trial 3 finished with value: 8.097087627702297 and parameters: {'n_layers_mlp': 4, 'mlp_n_units_l0': 28, 'mlp_dropout_l0': 0.17115147525219362, 'mlp_n_units_l1': 20, 'mlp_dropout_l1': 0.12853434104612857, 'mlp_n_units_l2': 17, 'mlp_dropout_l2': 0.1506259644242825, 'mlp_n_units_l3': 62, 'mlp_dropout_l3': 0.139959425937742, 'lr': 0.004075367608445874, 'weight_decay': 0.0006379727925752032, 'criterion': 'PoissonNLLLoss', 'batch_size': 128}. Best is trial 1 with value: 4.920747755765854.[0m
Trial Id: 4 | Model params: 9853 | Timestamp: 2022-02-26 20:06:04.911735

epoch 0 -1.6916418781691718 8.063534144524173
epoch 5 -1.7330716739589471 8.125354193806665
epoch 10 -1.7182074808512913 8.103228631117066
epoch 15 -1.7272203679967064 8.116651639792469
epoch 20 -1.7260448445798295 8.114902176756882
epoch 25 -1.7233727550445876 8.11092405778403
epoch 30 -1.717205512527169 8.10173501320589
epoch 35 -1.7249285890304717 8.113240569448871
epoch 40 -1.7197888453924053 8.105585385585409
epoch 45 -1.6911245594849778 8.06275922395292
epoch 50 -1.7352761966281474 8.128630528825008
epoch 55 -1.704775615532823 8.083183018688402
epoch 60 -1.7489866750158258 8.148977305076816
epoch 65 -1.7166094291973675 8.10084631081543
epoch 70 -1.7238326931304684 8.11160893747677
epoch 75 -1.7103086505530696 8.09144649257789
epoch 80 -1.723211262681097 8.110683570742282
epoch 85 -1.7145185534075322 8.097728246875864
epoch 90 -1.7104436527214752 8.091648010072833
epoch 95 -1.7331572479378679 8.125481397467752
[32m[I 2022-02-26 20:20:25,200][0m Trial 4 finished with value: 8.093425051655322 and parameters: {'n_layers_mlp': 4, 'mlp_n_units_l0': 76, 'mlp_dropout_l0': 0.255105664109455, 'mlp_n_units_l1': 38, 'mlp_dropout_l1': 0.046263228505194716, 'mlp_n_units_l2': 49, 'mlp_dropout_l2': 0.22062307593155853, 'mlp_n_units_l3': 73, 'mlp_dropout_l3': 0.2628780402877318, 'lr': 0.0030084456570852788, 'weight_decay': 0.13208798956755233, 'criterion': 'PoissonNLLLoss', 'batch_size': 128}. Best is trial 1 with value: 4.920747755765854.[0m
Trial Id: 5 | Model params: 4584 | Timestamp: 2022-02-26 20:20:25.200187

[32m[I 2022-02-26 20:20:54,897][0m Trial 5 pruned. [0m
epoch 0 -1.6936925451665856 8.06599948435179
Trial Id: 6 | Model params: 5238 | Timestamp: 2022-02-26 20:20:54.897823

epoch 0 -1.7416220808409668 8.137443240393365
epoch 5 -1.725080342590061 8.11285722753489
epoch 10 -1.7278212946811387 8.116936256660795
epoch 15 -1.7258873588146249 8.114058425651983
epoch 20 -1.718857043494317 8.103588217250014
epoch 25 -1.722727665664086 8.109354385229206
epoch 30 -1.7247325885184948 8.11233956038539
epoch 35 -1.7296535904459964 8.119661899151248
epoch 40 -1.722037505305627 8.10832653552668
epoch 45 -1.723381790234205 8.110328446913444
epoch 50 -1.7212054220398532 8.107087148029871
epoch 55 -1.7241667507312242 8.111497182931059
epoch 60 -1.7259666431718301 8.114176426351232
epoch 65 -1.7231571119552496 8.109993890034868
epoch 70 -1.7252484341668328 8.1131074370266
epoch 75 -1.7176667336296476 8.101814156165396
epoch 80 -1.7249893548115884 8.112721786203773
epoch 85 -1.7211925655376397 8.107067996791576
epoch 90 -1.718022804054257 8.102344891204496
epoch 95 -1.7231504890082734 8.10998402793548
[32m[I 2022-02-26 21:10:21,173][0m Trial 6 finished with value: 8.108649863855373 and parameters: {'n_layers_mlp': 4, 'mlp_n_units_l0': 42, 'mlp_dropout_l0': 0.275339568570802, 'mlp_n_units_l1': 59, 'mlp_dropout_l1': 0.1790357066409849, 'mlp_n_units_l2': 16, 'mlp_dropout_l2': 0.13845753529942048, 'mlp_n_units_l3': 57, 'mlp_dropout_l3': 0.14609907812484393, 'lr': 2.8653142988426866e-05, 'weight_decay': 0.1580763813888626, 'criterion': 'PoissonNLLLoss', 'batch_size': 32}. Best is trial 1 with value: 4.920747755765854.[0m
Trial Id: 7 | Model params: 2880 | Timestamp: 2022-02-26 21:10:21.173194

epoch 0 -3.047301819359464 9.887798034436523
epoch 5 0.004409325393474495 4.904076101626993
epoch 10 0.0038609386836270243 4.905426536096507
epoch 15 0.004352855817773449 4.904215178446905
epoch 20 0.0034487749699529946 4.906441268778123
epoch 25 0.0039048247584357876 4.905318477746299
epoch 30 0.004177913310167591 4.904646012815387
epoch 35 0.003458588687058173 4.906417110188008
epoch 40 0.00385259028957341 4.905447091634138
epoch 45 0.00446470712987157 4.903939700175078
epoch 50 0.002760589780459677 4.90813508912526
epoch 55 0.001687761756004158 4.910774460073947
epoch 60 0.004399254213370951 4.9041009058512675
epoch 65 0.004285621892329727 4.904380761240617
epoch 70 0.0027895017353668505 4.908063940308108
epoch 75 0.003551824054538466 4.906187585204269
epoch 80 0.0038541513416434636 4.905443247995505
epoch 85 0.004318061780793414 4.904300869424135
epoch 90 0.004332819217533923 4.904264524897215
epoch 95 0.004184205336563385 4.904630517973821
[32m[I 2022-02-26 21:18:54,893][0m Trial 7 finished with value: 4.90840826581756 and parameters: {'n_layers_mlp': 4, 'mlp_n_units_l0': 50, 'mlp_dropout_l0': 0.024534269997177702, 'mlp_n_units_l1': 16, 'mlp_dropout_l1': 0.05946254603447346, 'mlp_n_units_l2': 27, 'mlp_dropout_l2': 0.20077824910332265, 'mlp_n_units_l3': 26, 'mlp_dropout_l3': 0.02382053328038449, 'lr': 0.0002815437868934242, 'weight_decay': 0.17666424867450684, 'criterion': 'MSELoss', 'batch_size': 256}. Best is trial 7 with value: 4.90840826581756.[0m
Trial Id: 8 | Model params: 2432 | Timestamp: 2022-02-26 21:18:54.894049

epoch 0 -1.7608183597155387 8.165881906085783
epoch 5 -1.75524438264146 8.15763445374208
epoch 10 -1.6736705123991253 8.035966560374463
epoch 15 -1.7485829604189367 8.147767029058087
epoch 20 -1.7637270298404233 8.170182370835624
epoch 25 -1.7929469267217089 8.213259018950495
epoch 30 -1.837280568988052 8.278188657736816
epoch 35 -1.7600144251937615 8.16469289045893
epoch 40 -1.7340042256686923 8.126130049999759
epoch 45 -1.7532239636228906 8.154642911042666
epoch 50 -1.710918762054649 8.091749494798927
epoch 55 -1.7425019606263916 8.138748926812516
epoch 60 -1.7210140246064527 8.106802034869107
epoch 65 -1.7246976755630525 8.11228758709119
epoch 70 -1.7595148534230707 8.163953938764465
epoch 75 -1.7069845255180645 8.085875763820392
epoch 80 -1.8023185280257734 8.227027080175482
epoch 85 -1.7199730953857846 8.105251250078261
epoch 90 -1.7376918938608776 8.131608529701063
epoch 95 -1.7135754448182605 8.095713454823917
[32m[I 2022-02-26 21:58:06,263][0m Trial 8 finished with value: 8.168989585377439 and parameters: {'n_layers_mlp': 2, 'mlp_n_units_l0': 27, 'mlp_dropout_l0': 0.14926864763405728, 'mlp_n_units_l1': 68, 'mlp_dropout_l1': 0.24261646127478265, 'lr': 0.00649984843708664, 'weight_decay': 0.2527343971480736, 'criterion': 'PoissonNLLLoss', 'batch_size': 32}. Best is trial 7 with value: 4.90840826581756.[0m
Trial Id: 9 | Model params: 5572 | Timestamp: 2022-02-26 21:58:06.263497

epoch 0 -1.7768822476398443 8.190219157880897
epoch 5 -1.722073557213664 8.108989149683904
epoch 10 -1.707650557506779 8.087477739129122
epoch 15 -1.715663387248458 8.099435653899176
epoch 20 -1.714862044671917 8.098240568098447
epoch 25 -1.7096249152725642 8.090425805063534
epoch 30 -1.714967171138774 8.098397358970933
epoch 35 -1.7115128865094533 8.093243876187083
epoch 40 -1.7107017174112285 8.092033208807603
epoch 45 -1.7095937916480861 8.090379340311848
epoch 50 -1.7141335878770394 8.09715402777951
epoch 55 -1.702730372357812 8.080126350842827
epoch 60 -1.7050531506464979 8.083597712898236
epoch 65 -1.7069994252900242 8.08650524769685
epoch 70 -1.7098582127696127 8.090774088594177
epoch 75 -1.7139214139207222 8.096837529212584
epoch 80 -1.7141300592529514 8.097148764254133
epoch 85 -1.7155678217038006 8.099293141061791
epoch 90 -1.7088375708100454 8.089250289086628
epoch 95 -1.710344742549212 8.091500367527393
[32m[I 2022-02-26 22:12:31,069][0m Trial 9 finished with value: 8.097177063916844 and parameters: {'n_layers_mlp': 4, 'mlp_n_units_l0': 61, 'mlp_dropout_l0': 0.2821654829332663, 'mlp_n_units_l1': 27, 'mlp_dropout_l1': 0.18566955725437992, 'mlp_n_units_l2': 25, 'mlp_dropout_l2': 0.06354861633700734, 'mlp_n_units_l3': 80, 'mlp_dropout_l3': 0.03622398181683566, 'lr': 0.00010086290360960687, 'weight_decay': 0.002221207160217542, 'criterion': 'PoissonNLLLoss', 'batch_size': 128}. Best is trial 7 with value: 4.90840826581756.[0m
Trial Id: 10 | Model params: 1614 | Timestamp: 2022-02-26 22:12:31.069600

epoch 0 -2.7436636197745674 9.509664612167361
epoch 5 -0.030789930320573422 4.990015269772294
epoch 10 -0.0066964944886023225 4.931352743814535
epoch 15 -0.0009379614675959491 4.917228286159382
epoch 20 0.00043324683881085235 4.9138590188793705
epoch 25 0.0012016371838767803 4.9119699565814665
epoch 30 0.0015952070484339664 4.911002096650216
epoch 35 0.001870024907391743 4.910326156401488
epoch 40 0.002318524575810943 4.9092228296020775
epoch 45 0.0023648700217335783 4.909108803848822
epoch 50 0.002505237257248716 4.9087634359628325
epoch 55 0.0027527281104370305 4.908154435564066
epoch 60 0.0026648431959780394 4.908370702502963
epoch 65 0.0028238425396205358 4.907979430410542
epoch 70 0.0029816096643991985 4.907591159779121
epoch 75 0.00312631821195275 4.907234999769318
epoch 80 0.0030049048596436645 4.907533826853695
epoch 85 0.0029073830736726647 4.907773837944508
epoch 90 0.003117682689218526 4.907256254442003
epoch 95 0.0032996102386617654 4.906808455426661
[32m[I 2022-02-26 22:19:37,993][0m Trial 10 finished with value: 4.907374134912512 and parameters: {'n_layers_mlp': 2, 'mlp_n_units_l0': 59, 'mlp_dropout_l0': 0.005748536424542271, 'mlp_n_units_l1': 10, 'mlp_dropout_l1': 0.07907484115952304, 'lr': 1.6076187562388235e-05, 'weight_decay': 0.06882532195329223, 'criterion': 'MSELoss', 'batch_size': 256}. Best is trial 10 with value: 4.907374134912512.[0m
Trial Id: 11 | Model params: 1479 | Timestamp: 2022-02-26 22:19:37.994010

epoch 0 -2.857735536674854 9.65346034221272
epoch 5 -0.6190624537293561 6.2538662912086975
epoch 10 -0.012531092215577022 4.945622630660956
epoch 15 -0.005994009395675848 4.929631864502361
epoch 20 -0.0024906358054970212 4.921040658118563
epoch 25 -0.0008485072447137476 4.917008553928108
epoch 30 0.00014547553117871814 4.91456630824721
epoch 35 0.0006620814983188117 4.913296512365385
epoch 40 0.0010447924870760072 4.912355613098494
epoch 45 0.0013221404873318132 4.911673637282926
epoch 50 0.001427226297836648 4.911415215220799
epoch 55 0.0019139371020616691 4.910218141626327
epoch 60 0.002047957384748722 4.90988846518846
epoch 65 0.0018656442585879285 4.910336931747054
epoch 70 0.002131389697997199 4.909683218895444
epoch 75 0.0022972700612912123 4.9092751221397055
epoch 80 0.002252238173704235 4.909385912370243
epoch 85 0.0024537857252494577 4.908890033190039
epoch 90 0.0025169174543341333 4.90873469621684
epoch 95 0.00249547068368694 4.9087874670072225
[32m[I 2022-02-26 22:26:43,156][0m Trial 11 finished with value: 4.90829714078802 and parameters: {'n_layers_mlp': 2, 'mlp_n_units_l0': 54, 'mlp_dropout_l0': 0.0046577409443847445, 'mlp_n_units_l1': 10, 'mlp_dropout_l1': 0.08130134706720363, 'lr': 1.1306557047133611e-05, 'weight_decay': 0.073749556826016, 'criterion': 'MSELoss', 'batch_size': 256}. Best is trial 10 with value: 4.907374134912512.[0m
Trial Id: 12 | Model params: 1843 | Timestamp: 2022-02-26 22:26:43.156756

epoch 0 -2.723592940022525 9.484138555434265
epoch 5 -0.19770261942497935 5.37887300371647
epoch 10 -0.012359849861541816 4.945204403567208
epoch 15 -0.004033392710841799 4.924825756235724
epoch 20 -0.0007587629586900402 4.916788099328165
epoch 25 0.0008067534901355922 4.912940855831509
epoch 30 0.0008806321739174283 4.912759225143633
epoch 35 0.0014750491743884542 4.911297606959321
epoch 40 0.0016616750824438586 4.9108386208287165
epoch 45 0.001948272518404237 4.91013368205892
epoch 50 0.002075867405503695 4.909819806554951
epoch 55 0.0023040851840328003 4.909258354936078
epoch 60 0.0023884430855541927 4.909050804979662
epoch 65 0.002714673108011545 4.908248082371817
epoch 70 0.0027626239893905336 4.90813008321734
epoch 75 0.002622077346561058 4.908475937132823
epoch 80 0.0028268154470146856 4.907972114261281
epoch 85 0.002786157268789613 4.908072170687789
epoch 90 0.003034358627320821 4.907461335810618
epoch 95 0.0029958432757551945 4.907556128833228
[32m[I 2022-02-26 22:33:49,042][0m Trial 12 finished with value: 4.907328556490011 and parameters: {'n_layers_mlp': 2, 'mlp_n_units_l0': 65, 'mlp_dropout_l0': 0.06050777881353821, 'mlp_n_units_l1': 11, 'mlp_dropout_l1': 0.09250473397587579, 'lr': 1.1446507328697949e-05, 'weight_decay': 0.06799003657060866, 'criterion': 'MSELoss', 'batch_size': 256}. Best is trial 12 with value: 4.907328556490011.[0m
Trial Id: 13 | Model params: 1871 | Timestamp: 2022-02-26 22:33:49.042318

epoch 0 -3.047301819359464 9.887798034436523
epoch 5 -3.047301819359464 9.887798034436523
epoch 10 -3.047301819359464 9.887798034436523
epoch 15 -1.3777296625272806 7.578757809952289
epoch 20 -0.015733822999170144 4.953438189255273
epoch 25 -0.00667947556882087 4.931311059626733
epoch 30 -0.0022776285838266297 4.92051782386577
epoch 35 -0.0006604424884422144 4.916546566198481
epoch 40 0.00034748997950750926 4.914069804240746
epoch 45 0.0005300664175202918 4.9136210311313
epoch 50 0.0010848758705505057 4.912257057223531
epoch 55 0.0015010657911329606 4.911233624492102
epoch 60 0.001439362223553009 4.911385370249615
epoch 65 0.0018520651643127994 4.910370332912416
epoch 70 0.0017210008490139428 4.910692706569637
epoch 75 0.0021040254017788973 4.909750536928852
epoch 80 0.0017996143146562504 4.910499346710724
epoch 85 0.002253965087331 4.909381663756804
epoch 90 0.0022174024799670455 4.909471615579948
epoch 95 0.002227279550874539 4.90944731603845
[32m[I 2022-02-26 22:40:55,119][0m Trial 13 finished with value: 4.908539520042807 and parameters: {'n_layers_mlp': 2, 'mlp_n_units_l0': 66, 'mlp_dropout_l0': 0.051738646785726594, 'mlp_n_units_l1': 11, 'mlp_dropout_l1': 0.10528766083726182, 'lr': 1.0104951847747155e-05, 'weight_decay': 0.05506678995327625, 'criterion': 'MSELoss', 'batch_size': 256}. Best is trial 12 with value: 4.907328556490011.[0m
Trial Id: 14 | Model params: 6854 | Timestamp: 2022-02-26 22:40:55.119967

epoch 0 -3.047301819359464 9.887798034436523
epoch 5 -3.047301819359464 9.887798034436523
epoch 10 -0.000697914196118532 4.916638620237587
epoch 15 0.0017959912342125905 4.910508258307164
epoch 20 0.002120369819823553 4.909710328657698
epoch 25 0.0027274369261280906 4.908216673012551
epoch 30 0.003011745999558668 4.907516989667984
epoch 35 0.0031098689087428744 4.907275486475367
epoch 40 0.003326368271370117 4.906742589383202
epoch 45 0.003523813926057384 4.906256541112969
epoch 50 0.0035434304989312437 4.906208248733287
epoch 55 0.003693762766905584 4.90583814267134
epoch 60 0.0038022636352277317 4.9055710048320025
epoch 65 0.003757483678992757 4.905681258438459
epoch 70 0.0038774986656768817 4.905385761612224
epoch 75 0.0039898246738898635 4.905109180200455
epoch 80 0.003955666495200294 4.905193289862944
epoch 85 0.0038650464629612635 4.905416421830685
epoch 90 0.004059298771993514 4.904938105653445
epoch 95 0.0037978499462679727 4.905581871972036
