[32m[I 2022-02-27 14:39:29,337][0m Trial 21 pruned. [0m
epoch 0 -3.7254646057012293 18.1770126509654
Trial Id: 22 | Model params: 4027 | Timestamp: 2022-02-27 14:39:29.337238

epoch 0 -5.667749038900556 21.591851015575177
epoch 5 0.006146685977064248 8.336070853104475
epoch 10 0.018984752167858665 8.282055395350914
epoch 15 0.024777965682614256 8.25756507309292
epoch 20 0.0284228744019559 8.242119233291914
epoch 25 0.029788170432384242 8.23632613235629
epoch 30 0.03134300690518643 8.22972382413095
epoch 35 0.033193626655804054 8.221858619631089
epoch 40 0.03448520157388957 8.21636491602269
epoch 45 0.03516850244828318 8.213457014972333
epoch 50 0.03537389280394887 8.21258274073359
epoch 55 0.0365108700097071 8.207741345504683
epoch 60 0.03659131042093078 8.207398711711738
epoch 65 0.037284804809696426 8.204444197356354
epoch 70 0.03809583123797955 8.200987607549287
epoch 75 0.03696616914337725 8.205801822270086
epoch 80 0.038614090595070816 8.198778026102236
epoch 85 0.03860943387195459 8.198797882536864
epoch 90 0.03910821583109392 8.196670784995918
epoch 95 0.03858888974430941 8.198885482860987
[32m[I 2022-02-27 14:53:14,916][0m Trial 22 finished with value: 8.194187142496421 and parameters: {'n_layers_mlp': 2, 'mlp_n_units_l0': 56, 'mlp_dropout_l0': 0.27636815160961464, 'mlp_n_units_l1': 53, 'mlp_dropout_l1': 0.15937491524955652, 'lr': 1.0350932012978698e-05, 'weight_decay': 0.12995398766440305, 'criterion': 'MSELoss', 'batch_size': 128}. Best is trial 3 with value: 8.191656361524407.[0m
Trial Id: 23 | Model params: 4038 | Timestamp: 2022-02-27 14:53:14.916712

epoch 0 -6.654633588734017 23.134624539454315
epoch 5 0.01936210997962795 8.280462352373057
epoch 10 0.029018275745220867 8.23959338084194
epoch 15 0.03398161563721558 8.218507351565444
epoch 20 0.03648658687278028 8.207844776070191
epoch 25 0.036850675801470945 8.206293854342453
epoch 30 0.03796655889728562 8.20153866309179
epoch 35 0.039359141416953625 8.195600483040717
epoch 40 0.039784111174413495 8.193787491435003
epoch 45 0.03983881132393141 8.193554102366246
epoch 50 0.04065537685429699 8.190069272408138
epoch 55 0.040446291098427345 8.190961722049781
epoch 60 0.04071204807285067 8.189827363479248
epoch 65 0.04048830374937129 8.190782405467834
epoch 70 0.03921877773651772 8.196199209723378
epoch 75 0.0403486646659208 8.191378391812938
epoch 80 0.04081458732080845 8.189389642365652
epoch 85 0.04006515975850067 8.192588271066176
epoch 90 0.03976019258617747 8.19388954276061
epoch 95 0.04136876189688532 8.187023568415233
[32m[I 2022-02-27 15:06:56,502][0m Trial 23 finished with value: 8.190511665950083 and parameters: {'n_layers_mlp': 2, 'mlp_n_units_l0': 57, 'mlp_dropout_l0': 0.2657330014117767, 'mlp_n_units_l1': 52, 'mlp_dropout_l1': 0.12424663708767891, 'lr': 4.14887200030186e-05, 'weight_decay': 0.20390301143329556, 'criterion': 'MSELoss', 'batch_size': 128}. Best is trial 23 with value: 8.190511665950083.[0m
Trial Id: 24 | Model params: 3729 | Timestamp: 2022-02-27 15:06:56.502928

[32m[I 2022-02-27 15:07:04,683][0m Trial 24 pruned. [0m
epoch 0 -0.010623199323640753 8.406106421946456
Study statistics: 
  Number of finished trials:  25
  Number of pruned trials:  13
  Number of complete trials:  12

Best trial:
  Value:  8.190511665950083
  Params: 
    n_layers_mlp: 2
    mlp_n_units_l0: 57
    mlp_dropout_l0: 0.2657330014117767
    mlp_n_units_l1: 52
    mlp_dropout_l1: 0.12424663708767891
    lr: 4.14887200030186e-05
    weight_decay: 0.20390301143329556
    criterion: MSELoss
    batch_size: 128
Target: 132570, NaN: 0, Max: 159.0, Min: 0.0, Mean: 21.532646903522668
Prediction: 132570, NaN: 0, Max: 29.895963668823242, Min: 18.319242477416992, Mean: 21.316619468960024

 XXXXXX======== TRIAL south - glbg ended

Test Set - R-squared:  0.043316749833489654
Test Set - RMSE:  8.198997372600676
Test Set - MAE:  6.296192462061059



[32m[I 2022-02-27 15:07:14,813][0m A new study created in memory with name: NeuralNetwork[0m
++++++++ Session Characteristics +++++++

Area: south
Gal Type: rlbg
Training Samples: 424221
Validation Samples: 106056
Test Samples: 132570
Number of features: 16
Device: cuda:0
Number of Workers: 8
Number of Trials: 25

+++++++++++++++++++++++++++++++++++++++
Trial Id: 0 | Model params: 7198 | Timestamp: 2022-02-27 15:07:14.813712

epoch 0 -2.1157583136241245 7.949754909603055
epoch 5 -2.2000252126996376 8.056539827898822
epoch 10 -2.120973626076945 7.956405476890894
epoch 15 -2.128422918103244 7.965895185910117
epoch 20 -2.1308794491765117 7.969022101553189
epoch 25 -2.166411899550874 8.01411486525502
epoch 30 -2.1384204173306505 7.978613336382521
epoch 35 -2.149120966279944 7.992203436228624
epoch 40 -2.189775828315866 8.043627304749133
epoch 45 -2.169619886528527 8.018173507742551
epoch 50 -2.162197331539807 8.00877960252272
epoch 55 -2.125449599001822 7.9621088086637535
epoch 60 -2.179961484287401 8.031243402774278
epoch 65 -2.120127188617032 7.9553264776534
epoch 70 -2.1167138606763047 7.9509738395997065
epoch 75 -2.168027132535659 8.016158663202088
epoch 80 -2.1542009886295337 7.998647172742035
epoch 85 -2.135612790136573 7.975043708829843
epoch 90 -2.141679358543248 7.982754764518362
epoch 95 -2.112659046203359 7.945800086416233
[32m[I 2022-02-27 15:24:20,124][0m Trial 0 finished with value: 7.9975566307240635 and parameters: {'n_layers_mlp': 4, 'mlp_n_units_l0': 57, 'mlp_dropout_l0': 0.16205584962873174, 'mlp_n_units_l1': 50, 'mlp_dropout_l1': 0.059058514173538953, 'mlp_n_units_l2': 33, 'mlp_dropout_l2': 0.21788378547630807, 'mlp_n_units_l3': 47, 'mlp_dropout_l3': 0.1402619173963933, 'lr': 0.0027387718155952394, 'weight_decay': 0.1925986719973948, 'criterion': 'PoissonNLLLoss', 'batch_size': 128}. Best is trial 0 with value: 7.9975566307240635.[0m
Trial Id: 1 | Model params: 3078 | Timestamp: 2022-02-27 15:24:20.124228

epoch 0 -2.1606131192347395 8.006773213398835
epoch 5 -2.135579215021009 7.975001011636526
epoch 10 -2.1229806197300567 7.958963314738458
epoch 15 -2.128934379034095 7.966546325120539
epoch 20 -2.130914996533889 7.969067340738715
epoch 25 -2.1244900757965257 7.96088651817785
epoch 30 -2.1286777912852832 7.966219670763439
epoch 35 -2.125717106441821 7.962449540085555
epoch 40 -2.131851389769015 7.9702589449331835
epoch 45 -2.135601649976805 7.97502954200729
epoch 50 -2.134056698513398 7.973064599869494
epoch 55 -2.122377326840779 7.9581945270846495
epoch 60 -2.1324264971255023 7.970990707646433
epoch 65 -2.1279919854382228 7.96534652565006
epoch 70 -2.1275529114771543 7.964787461079844
epoch 75 -2.1335277658307334 7.972391767052045
epoch 80 -2.1333873467631723 7.972213136377046
epoch 85 -2.125249095230106 7.961853412055877
epoch 90 -2.1313766754477648 7.96965487101954
epoch 95 -2.1290494700735567 7.966692839804969
[32m[I 2022-02-27 15:41:32,438][0m Trial 1 finished with value: 7.963927957404439 and parameters: {'n_layers_mlp': 4, 'mlp_n_units_l0': 30, 'mlp_dropout_l0': 0.19135040052775273, 'mlp_n_units_l1': 29, 'mlp_dropout_l1': 0.1434131723046822, 'mlp_n_units_l2': 34, 'mlp_dropout_l2': 0.08205299003508584, 'mlp_n_units_l3': 18, 'mlp_dropout_l3': 0.0706873848761555, 'lr': 0.00032032154392146287, 'weight_decay': 0.034942435463560635, 'criterion': 'PoissonNLLLoss', 'batch_size': 128}. Best is trial 1 with value: 7.963927957404439.[0m
Trial Id: 2 | Model params: 2067 | Timestamp: 2022-02-27 15:41:32.438221

epoch 0 -2.711146206274045 8.676126800210591
epoch 5 -0.018140700899544004 4.544391698881466
epoch 10 0.005112305007029638 4.492197978351666
epoch 15 0.010846223041624858 4.479234145540837
epoch 20 0.013699093255050698 4.472770084445222
epoch 25 0.014231143371512878 4.471563526260964
epoch 30 0.01606345435662604 4.467405804191383
epoch 35 0.016243626011742562 4.466996765238779
epoch 40 0.017071018838903163 4.465117875996738
epoch 45 0.016583443364144412 4.466225184914826
epoch 50 0.01838403818563672 4.4621345753263455
epoch 55 0.017318864182291005 4.464554901222266
epoch 60 0.018210927656508002 4.462528012502832
epoch 65 0.017758872782261403 4.4635552572734
epoch 70 0.01763327437920892 4.46384062380739
epoch 75 0.01853887908630325 4.461782631077182
epoch 80 0.018972380519663767 4.460797160155402
epoch 85 0.019047450101622232 4.460626483724999
epoch 90 0.017794826562564592 4.463473564932675
epoch 95 0.01872833519181405 4.461351970737974
[32m[I 2022-02-27 15:55:12,329][0m Trial 2 finished with value: 4.461880166216217 and parameters: {'n_layers_mlp': 2, 'mlp_n_units_l0': 68, 'mlp_dropout_l0': 0.20723645358504175, 'mlp_n_units_l1': 13, 'mlp_dropout_l1': 0.2926547687743924, 'lr': 1.1351310863726237e-05, 'weight_decay': 0.07346676417829812, 'criterion': 'MSELoss', 'batch_size': 128}. Best is trial 2 with value: 4.461880166216217.[0m
Trial Id: 3 | Model params: 5362 | Timestamp: 2022-02-27 15:55:12.329329

epoch 0 0.011987598909736219 4.476649125119218
epoch 5 0.007161675178732008 4.487568851651782
epoch 10 0.009403804890547707 4.482498842655406
epoch 15 0.011613134887503596 4.477497386350078
epoch 20 -0.00291107950479752 4.510275524160108
epoch 25 0.0004451577258640649 4.502722391774583
epoch 30 0.01004879411125037 4.481039300300616
epoch 35 0.009701498736010339 4.481825252047163
epoch 40 0.012366643763772278 4.4757903233520855
epoch 45 0.007840852906090379 4.486033668048238
epoch 50 -0.006483946908169447 4.518302302490923
epoch 55 0.01152492005826411 4.477697193160818
epoch 60 0.004006029953944501 4.494694856064063
epoch 65 0.01142566900648112 4.477921986385151
epoch 70 -7.638600581594268e-05 4.503896944830188
epoch 75 -0.015269011155628842 4.537978391742766
epoch 80 -0.008488837513295433 4.5228002357050405
epoch 85 0.01111089538378962 4.478634840996388
epoch 90 -0.021520351782378322 4.551927854329761
epoch 95 0.01006965500125745 4.480992086377411
[32m[I 2022-02-27 16:05:21,809][0m Trial 3 finished with value: 4.495172631151368 and parameters: {'n_layers_mlp': 4, 'mlp_n_units_l0': 73, 'mlp_dropout_l0': 0.16919833516541952, 'mlp_n_units_l1': 30, 'mlp_dropout_l1': 0.1591130228102668, 'mlp_n_units_l2': 16, 'mlp_dropout_l2': 0.1400244484770735, 'mlp_n_units_l3': 78, 'mlp_dropout_l3': 0.22835810841635737, 'lr': 0.0052163553815514465, 'weight_decay': 0.21509172573425142, 'criterion': 'MSELoss', 'batch_size': 256}. Best is trial 2 with value: 4.461880166216217.[0m
Trial Id: 4 | Model params: 8859 | Timestamp: 2022-02-27 16:05:21.809581

epoch 0 -2.125773604684214 7.962521501551677
epoch 5 -2.134660411436526 7.973832488076064
epoch 10 -2.18719741367105 8.040375665693462
epoch 15 -2.1262943191849626 7.963184701813583
epoch 20 -2.157555128967193 8.002898876535559
epoch 25 -2.172556045817277 8.02188644270695
epoch 30 -2.1736125252074108 8.023221998665518
epoch 35 -2.168268931533026 8.016464573167935
epoch 40 -2.182682977145382 8.034679340163727
epoch 45 -2.1492412581960574 7.992356080140175
epoch 50 -2.144965746253465 7.986928896732847
epoch 55 -2.1750699172655055 8.025064006443506
epoch 60 -2.182915267710994 8.034972543440379
epoch 65 -2.1537071667309915 7.998021013889384
epoch 70 -2.1946056270505445 8.04971463005838
epoch 75 -2.173335309132336 8.02287157550157
epoch 80 -2.2006637862804412 8.057343639823904
epoch 85 -2.0885797991874298 7.915006423493309
epoch 90 -2.1530397114400763 7.997174612552355
epoch 95 -2.145344271936341 7.987409532611719
[32m[I 2022-02-27 16:22:26,573][0m Trial 4 finished with value: 7.983971934111584 and parameters: {'n_layers_mlp': 4, 'mlp_n_units_l0': 39, 'mlp_dropout_l0': 0.027800421849168967, 'mlp_n_units_l1': 35, 'mlp_dropout_l1': 0.050587736999624364, 'mlp_n_units_l2': 61, 'mlp_dropout_l2': 0.0925366888503504, 'mlp_n_units_l3': 73, 'mlp_dropout_l3': 0.27055793905798253, 'lr': 0.008682601519485985, 'weight_decay': 0.2618743749307557, 'criterion': 'PoissonNLLLoss', 'batch_size': 128}. Best is trial 2 with value: 4.461880166216217.[0m
Trial Id: 5 | Model params: 2229 | Timestamp: 2022-02-27 16:22:26.574022

[32m[I 2022-02-27 16:22:34,904][0m Trial 5 pruned. [0m
epoch 0 0.014832391633106679 4.4701996518319875
Trial Id: 6 | Model params: 5231 | Timestamp: 2022-02-27 16:22:34.904409

[32m[I 2022-02-27 16:23:02,449][0m Trial 6 pruned. [0m
epoch 0 0.016329173013178377 4.46649274140428
Trial Id: 7 | Model params: 9001 | Timestamp: 2022-02-27 16:23:02.449801

epoch 0 -2.1456466746149387 7.987793489942845
epoch 5 -2.16190807906694 8.00841330465461
epoch 10 -2.1365596551565225 7.976247735035197
epoch 15 -2.130544082182456 7.968595285605297
epoch 20 -2.1326466662760226 7.971270831604286
epoch 25 -2.1381343078701307 7.978249648845127
epoch 30 -2.129754296743673 7.967590048601007
epoch 35 -2.126477116982312 7.963417506405376
epoch 40 -2.1388188039936593 7.979119717277266
epoch 45 -2.138165735625039 7.978289598991008
epoch 50 -2.1310531703825264 7.9692431846305745
epoch 55 -2.1386627273783065 7.97892133540843
epoch 60 -2.1312673950709162 7.969515805270419
epoch 65 -2.129528560293201 7.967302708484499
epoch 70 -2.1297479617451516 7.967581984917419
epoch 75 -2.1301456943144794 7.968088234337529
epoch 80 -2.1314318576926587 7.96972509277101
epoch 85 -2.1365757501165175 7.976268199690366
epoch 90 -2.135131159480733 7.974431201276169
epoch 95 -2.130249537368654 7.968220404504124
[32m[I 2022-02-27 16:40:12,466][0m Trial 7 finished with value: 7.967920269569214 and parameters: {'n_layers_mlp': 4, 'mlp_n_units_l0': 79, 'mlp_dropout_l0': 0.28952931736952875, 'mlp_n_units_l1': 23, 'mlp_dropout_l1': 0.07108286976544531, 'mlp_n_units_l2': 67, 'mlp_dropout_l2': 0.11771509440970257, 'mlp_n_units_l3': 61, 'mlp_dropout_l3': 0.1654771828547327, 'lr': 0.00015018251786445928, 'weight_decay': 0.07219910517202885, 'criterion': 'PoissonNLLLoss', 'batch_size': 128}. Best is trial 2 with value: 4.461880166216217.[0m
Trial Id: 8 | Model params: 11890 | Timestamp: 2022-02-27 16:40:12.467062

[32m[I 2022-02-27 16:40:18,748][0m Trial 8 pruned. [0m
epoch 0 0.017861316327029586 4.463322486351168
Trial Id: 9 | Model params: 3131 | Timestamp: 2022-02-27 16:40:18.748522

[32m[I 2022-02-27 16:40:53,196][0m Trial 9 pruned. [0m
epoch 0 0.002429396470707945 4.497938967225937
Trial Id: 10 | Model params: 1955 | Timestamp: 2022-02-27 16:40:53.196736

epoch 0 -3.3125890291595645 9.352783799132338
epoch 5 -0.04511934637837922 4.604206587677876
epoch 10 -0.01265514683616309 4.5321329930685135
epoch 15 -0.0005416148213970295 4.504944414324666
epoch 20 0.007637057389448643 4.4864943736765985
epoch 25 0.011801381529928046 4.477070977412376
epoch 30 0.013780590486378363 4.47258528997427
epoch 35 0.014712258000159073 4.470472196802612
epoch 40 0.016211566467196237 4.46706955191586
epoch 45 0.017062074299133645 4.465138191978016
epoch 50 0.017360548567764145 4.46446020916281
epoch 55 0.01823992029509347 4.462462121864676
epoch 60 0.018532058149863473 4.4617981352485705
epoch 65 0.01851574811156309 4.461835208184446
epoch 70 0.019685230238733475 4.459176178338734
epoch 75 0.01953132462888596 4.459526201268168
epoch 80 0.01898468890140137 4.46076917655666
epoch 85 0.01930049938264078 4.460051108734371
epoch 90 0.02107387554578577 4.456016780621165
epoch 95 0.01980779433470481 4.458897414824368
[32m[I 2022-02-27 16:49:30,095][0m Trial 10 finished with value: 4.457925858455435 and parameters: {'n_layers_mlp': 2, 'mlp_n_units_l0': 69, 'mlp_dropout_l0': 0.10690761480343546, 'mlp_n_units_l1': 11, 'mlp_dropout_l1': 0.29511720740419534, 'lr': 1.0375949990897567e-05, 'weight_decay': 0.01108160421246563, 'criterion': 'MSELoss', 'batch_size': 256}. Best is trial 10 with value: 4.457925858455435.[0m
Trial Id: 11 | Model params: 1911 | Timestamp: 2022-02-27 16:49:30.095699

epoch 0 -3.508682879055102 9.563056096784871
epoch 5 -0.1995616114557408 4.932682221933387
epoch 10 -0.027428104736428427 4.565071447896471
epoch 15 -0.009635605758946841 4.525370978134089
epoch 20 -0.0009342056624919159 4.505828148911249
epoch 25 0.008407514297442575 4.484752409311062
epoch 30 0.012977446982123775 4.474406079931967
epoch 35 0.014792543526509827 4.470290056342609
epoch 40 0.016181693885617854 4.467137372334397
epoch 45 0.017104890725758493 4.465040941002771
epoch 50 0.017515353117595667 4.46410853084698
epoch 55 0.01888799246358297 4.460989015052494
epoch 60 0.01923350653000022 4.460203442065821
epoch 65 0.01818619914324937 4.462584211431594
epoch 70 0.019472716391467415 4.459659485008505
epoch 75 0.019654808272210222 4.4592453682867825
epoch 80 0.019416892913781014 4.459786432092307
epoch 85 0.020746403778583056 4.456762034853701
epoch 90 0.02146642889407535 4.455123250629347
epoch 95 0.020429194981015586 4.457483814004421
[32m[I 2022-02-27 16:58:05,773][0m Trial 11 finished with value: 4.4565461397850115 and parameters: {'n_layers_mlp': 2, 'mlp_n_units_l0': 70, 'mlp_dropout_l0': 0.08679378782177397, 'mlp_n_units_l1': 10, 'mlp_dropout_l1': 0.2934497065148688, 'lr': 1.1071055559215633e-05, 'weight_decay': 0.0021865056582654856, 'criterion': 'MSELoss', 'batch_size': 256}. Best is trial 11 with value: 4.4565461397850115.[0m
Trial Id: 12 | Model params: 1884 | Timestamp: 2022-02-27 16:58:05.773953

epoch 0 -3.377484976331216 9.422891500171724
epoch 5 -0.0949953432196986 4.712788982625395
epoch 10 -0.037658986217359525 4.587744086244909
epoch 15 -0.02505224934874062 4.559790189320293
epoch 20 -0.0018747195919963655 4.507944571292139
epoch 25 0.009933125699887246 4.481301080656366
epoch 30 0.013336407305366893 4.473592380030109
epoch 35 0.015232371007896317 4.469292106169231
epoch 40 0.016077703081007977 4.467373457052362
epoch 45 0.018458397384374936 4.461965564710964
epoch 50 0.018406888268640564 4.462082640179225
epoch 55 0.017830466962942104 4.4633925831620855
epoch 60 0.018884180501234304 4.460997681293207
epoch 65 0.019291930586956108 4.4600705933895535
epoch 70 0.020081576040609783 4.458274654415855
epoch 75 0.02000854252887696 4.458440789361236
epoch 80 0.02087315906367193 4.456473582288136
epoch 85 0.0205319157581646 4.457250095214845
epoch 90 0.020719484960489365 4.456823290662464
epoch 95 0.021389259783931025 4.455298917121079
[32m[I 2022-02-27 17:06:42,791][0m Trial 12 finished with value: 4.454975132981475 and parameters: {'n_layers_mlp': 2, 'mlp_n_units_l0': 69, 'mlp_dropout_l0': 0.0916870320408153, 'mlp_n_units_l1': 10, 'mlp_dropout_l1': 0.29857190934243494, 'lr': 1.2761280693060605e-05, 'weight_decay': 0.0023760849769934866, 'criterion': 'MSELoss', 'batch_size': 256}. Best is trial 12 with value: 4.454975132981475.[0m
Trial Id: 13 | Model params: 4712 | Timestamp: 2022-02-27 17:06:42.791983

[32m[I 2022-02-27 17:06:47,577][0m Trial 13 pruned. [0m
epoch 0 -0.1789279609108403 4.89007468871906
Trial Id: 14 | Model params: 2181 | Timestamp: 2022-02-27 17:06:47.578059

epoch 0 -3.7624848249260125 9.82853210824372
epoch 5 -3.7624848249260125 9.82853210824372
epoch 10 -0.016403976364289807 4.5405141772949005
epoch 15 0.008378941341428137 4.484817023410136
epoch 20 0.013913260781569181 4.472284444562865
epoch 25 0.01300061054926982 4.474353576666748
epoch 30 0.013722598474355308 4.472716787288442
epoch 35 0.01398712359808929 4.472116943217196
epoch 40 0.015385519680972348 4.4689445659225795
epoch 45 0.01569383094031984 4.468244833270465
epoch 50 0.01655976588646413 4.466278950691852
epoch 55 0.015385391359460487 4.468944857133869
epoch 60 0.01599002744393374 4.467572492631712
epoch 65 0.015106234545293695 4.469578327318835
epoch 70 0.01678042579390715 4.465777860765888
epoch 75 0.017096953293254447 4.4650589698286405
epoch 80 0.016818246551523086 4.465691969104081
epoch 85 0.01689633126856549 4.465514631996075
epoch 90 0.016945615866747032 4.465402698809557
epoch 95 0.01695916425822286 4.465371927759
[32m[I 2022-02-27 17:15:25,572][0m Trial 14 finished with value: 4.466257857585636 and parameters: {'n_layers_mlp': 2, 'mlp_n_units_l0': 80, 'mlp_dropout_l0': 0.1070847029686536, 'mlp_n_units_l1': 10, 'mlp_dropout_l1': 0.2495404732862751, 'lr': 2.502717031903431e-05, 'weight_decay': 0.12819985105367812, 'criterion': 'MSELoss', 'batch_size': 256}. Best is trial 12 with value: 4.454975132981475.[0m
Trial Id: 15 | Model params: 3807 | Timestamp: 2022-02-27 17:15:25.572606

[32m[I 2022-02-27 17:15:30,874][0m Trial 15 pruned. [0m
epoch 0 -0.45247665986856833 5.427832530258468
Trial Id: 16 | Model params: 4413 | Timestamp: 2022-02-27 17:15:30.874716

epoch 0 -2.5237899330074387 8.45428460052595
epoch 5 -0.009407686764596468 4.5248601620475
epoch 10 0.013226580126554088 4.4738413546361375
epoch 15 0.01755222914486143 4.464024753388917
epoch 20 0.020729577205298777 4.456800325093907
epoch 25 0.021903826137974924 4.454127435822236
epoch 30 0.02350227206620714 4.450486386376294
epoch 35 0.023931908080114472 4.4495072240387215
epoch 40 0.024794213467635773 4.44754133566053
epoch 45 0.024945826888521094 4.447195596752861
epoch 50 0.025028213708934932 4.447007710758982
epoch 55 0.025498293457850263 4.445935525730597
epoch 60 0.025611699470360794 4.445676824034101
epoch 65 0.025764392618604415 4.445328476775555
epoch 70 0.026271251022006892 4.444171957135313
epoch 75 0.026612317885294168 4.443393561434746
epoch 80 0.027055462062838043 4.442381997295727
epoch 85 0.027837486080829366 4.4405963108312365
epoch 90 0.02825818450897266 4.439635384024604
epoch 95 0.028794170125254093 4.438410825768747
[32m[I 2022-02-27 17:24:11,238][0m Trial 16 finished with value: 4.437446227089091 and parameters: {'n_layers_mlp': 2, 'mlp_n_units_l0': 76, 'mlp_dropout_l0': 0.12144529351085986, 'mlp_n_units_l1': 40, 'mlp_dropout_l1': 0.2508589801947412, 'lr': 1.5826524687950403e-05, 'weight_decay': 0.0022033649115401513, 'criterion': 'MSELoss', 'batch_size': 256}. Best is trial 16 with value: 4.437446227089091.[0m
Trial Id: 17 | Model params: 4723 | Timestamp: 2022-02-27 17:24:11.238794

[32m[I 2022-02-27 17:24:16,347][0m Trial 17 pruned. [0m
epoch 0 0.00795694672154812 4.485771202090985
Trial Id: 18 | Model params: 1046 | Timestamp: 2022-02-27 17:24:16.347742

