[32m[I 2022-02-26 22:48:00,843][0m Trial 14 finished with value: 4.905228734360763 and parameters: {'n_layers_mlp': 2, 'mlp_n_units_l0': 69, 'mlp_dropout_l0': 0.07492300992020853, 'mlp_n_units_l1': 80, 'mlp_dropout_l1': 0.023174877703148383, 'lr': 3.4513435083068545e-05, 'weight_decay': 0.04563568646025404, 'criterion': 'MSELoss', 'batch_size': 256}. Best is trial 14 with value: 4.905228734360763.[0m
Trial Id: 15 | Model params: 4712 | Timestamp: 2022-02-26 22:48:00.844183

epoch 0 -3.047301819359464 9.887798034436523
epoch 5 -0.008851236822608133 4.936627478935437
epoch 10 0.001236117366639089 4.911885171158376
epoch 15 0.002134701793663263 4.909675070851786
epoch 20 0.002081898624412104 4.909804969634072
epoch 25 0.0029732825296830967 4.907611653928369
epoch 30 0.0032159767905631798 4.907014317040755
epoch 35 0.00339875129324807 4.906564411044
epoch 40 0.003551434261008457 4.906188544812625
epoch 45 0.003494194754154245 4.9063294571435145
epoch 50 0.003709370338939033 4.905799716473045
epoch 55 0.003698245286661739 4.90582710663628
epoch 60 0.003931380463644385 4.90525308988834
epoch 65 0.003779986725730211 4.905625853556504
epoch 70 0.0037647023613999187 4.905663485346785
epoch 75 0.004104637717389892 4.904826458819615
epoch 80 0.003918311637466143 4.9052852692424835
epoch 85 0.00408034265213697 4.904886285562786
epoch 90 0.004171437267849631 4.90466196076629
epoch 95 0.004243973702830028 4.904483329029109
[32m[I 2022-02-26 22:55:31,653][0m Trial 15 finished with value: 4.904769389501027 and parameters: {'n_layers_mlp': 2, 'mlp_n_units_l0': 71, 'mlp_dropout_l0': 0.07909282242036907, 'mlp_n_units_l1': 48, 'mlp_dropout_l1': 0.0006721308486280012, 'lr': 4.516806586921439e-05, 'weight_decay': 0.03771983383247016, 'criterion': 'MSELoss', 'batch_size': 256}. Best is trial 15 with value: 4.904769389501027.[0m
Trial Id: 16 | Model params: 7205 | Timestamp: 2022-02-26 22:55:31.653940

[32m[I 2022-02-26 22:55:36,978][0m Trial 16 pruned. [0m
epoch 0 -0.010420449988464364 4.940465314748597
Trial Id: 17 | Model params: 6902 | Timestamp: 2022-02-26 22:55:36.978297

[32m[I 2022-02-26 22:55:42,130][0m Trial 17 pruned. [0m
epoch 0 -0.006666522156110188 4.9312793327889475
Trial Id: 18 | Model params: 2871 | Timestamp: 2022-02-26 22:55:42.130529

[32m[I 2022-02-26 22:55:47,349][0m Trial 18 pruned. [0m
epoch 0 -0.2316061054257379 5.454471884785453
Trial Id: 19 | Model params: 7265 | Timestamp: 2022-02-26 22:55:47.349322

[32m[I 2022-02-26 22:55:52,549][0m Trial 19 pruned. [0m
epoch 0 -0.006045138868636002 4.92975713675759
Trial Id: 20 | Model params: 5295 | Timestamp: 2022-02-26 22:55:52.549385

[32m[I 2022-02-26 22:55:57,611][0m Trial 20 pruned. [0m
epoch 0 -0.736346409720072 6.476419587769234
Trial Id: 21 | Model params: 3615 | Timestamp: 2022-02-26 22:55:57.611484

[32m[I 2022-02-26 22:56:02,578][0m Trial 21 pruned. [0m
epoch 0 -0.012717204258902992 4.946077134057471
Trial Id: 22 | Model params: 3162 | Timestamp: 2022-02-26 22:56:02.578833

epoch 0 -3.047301819359464 9.887798034436523
epoch 5 -3.047301819359464 9.887798034436523
epoch 10 -0.07876416022222954 5.104815445651621
epoch 15 -0.004058883688361492 4.924888272994006
epoch 20 -9.329438466298967e-05 4.915153083876614
epoch 25 0.0008903736642134064 4.912735275196052
epoch 30 0.0015605810377897766 4.911087255965216
epoch 35 0.001838023843332648 4.910404870800584
epoch 40 0.0020732082951007147 4.90982634800625
epoch 45 0.0023351284551859086 4.909181978646719
epoch 50 0.0024075554457421156 4.909003780666496
epoch 55 0.0026276733480153913 4.908462167088195
epoch 60 0.002594938518569956 4.908542716923599
epoch 65 0.002841958055661009 4.907934849027783
epoch 70 0.0028724702494773435 4.907859759122954
epoch 75 0.0030217388960352976 4.907492395380176
epoch 80 0.003037065676815276 4.907454673219053
epoch 85 0.0031616371430441825 4.907148068078195
epoch 90 0.0032049802813897132 4.90704138402712
epoch 95 0.0032416484155521896 4.906951127904733
[32m[I 2022-02-26 23:04:37,907][0m Trial 22 finished with value: 4.906906284735694 and parameters: {'n_layers_mlp': 2, 'mlp_n_units_l0': 69, 'mlp_dropout_l0': 0.037752161991454106, 'mlp_n_units_l1': 28, 'mlp_dropout_l1': 0.060881365224247766, 'lr': 1.6713133827615416e-05, 'weight_decay': 0.044009971798674954, 'criterion': 'MSELoss', 'batch_size': 256}. Best is trial 15 with value: 4.904769389501027.[0m
Trial Id: 23 | Model params: 2867 | Timestamp: 2022-02-26 23:04:37.908046

[32m[I 2022-02-26 23:04:42,734][0m Trial 23 pruned. [0m
epoch 0 -2.017917864152762 8.538282086086527
Trial Id: 24 | Model params: 3117 | Timestamp: 2022-02-26 23:04:42.734419

[32m[I 2022-02-26 23:04:47,918][0m Trial 24 pruned. [0m
epoch 0 -0.0035740015240495193 4.923698960844815
Study statistics: 
  Number of finished trials:  25
  Number of pruned trials:  9
  Number of complete trials:  16

Best trial:
  Value:  4.904769389501027
  Params: 
    n_layers_mlp: 2
    mlp_n_units_l0: 71
    mlp_dropout_l0: 0.07909282242036907
    mlp_n_units_l1: 48
    mlp_dropout_l1: 0.0006721308486280012
    lr: 4.516806586921439e-05
    weight_decay: 0.03771983383247016
    criterion: MSELoss
    batch_size: 256
Target: 132570, NaN: 0, Max: 227.0, Min: 0.0, Mean: 8.573847778532096
Prediction: 132570, NaN: 0, Max: 10.818527221679688, Min: 7.860657691955566, Mean: 8.52092527720942

 XXXXXX======== TRIAL south - lrg ended

Test Set - R-squared:  0.005957407056329189
Test Set - RMSE:  4.887865148583709
Test Set - MAE:  3.303358746391441



[32m[I 2022-02-26 23:05:10,764][0m A new study created in memory with name: NeuralNetwork[0m
++++++++ Session Characteristics +++++++

Area: south
Gal Type: elg
Training Samples: 424221
Validation Samples: 106056
Test Samples: 132570
Number of features: 16
Device: cuda:0
Number of Workers: 8
Number of Trials: 25

+++++++++++++++++++++++++++++++++++++++
Trial Id: 0 | Model params: 7663 | Timestamp: 2022-02-26 23:05:10.764657

epoch 0 0.06865739732113907 7.636681850501883
epoch 5 0.07242474148944378 7.621220750630814
epoch 10 0.07211898480788581 7.622476738836181
epoch 15 0.07238550815430633 7.621381925017178
epoch 20 0.0635548966733196 7.65757263181336
epoch 25 0.0700944561085084 7.630787887663462
epoch 30 0.0703834038800607 7.629602245488591
epoch 35 0.06495573064345406 7.651842983338318
epoch 40 0.06733308529494042 7.642109368259007
epoch 45 0.06904671472011426 7.635085550776952
epoch 50 0.07147026204220397 7.6251408790207575
epoch 55 0.06605684213713381 7.647336237252143
epoch 60 0.06788347283468943 7.639854145937895
epoch 65 0.054280325861456924 7.695399578215118
epoch 70 0.07280276483191217 7.619667619008702
epoch 75 0.07625070021474278 7.605486929932347
epoch 80 0.07268870657031667 7.620136267578713
epoch 85 0.05840136164836962 7.678614667584167
epoch 90 0.07397772921650958 7.614838184751804
epoch 95 0.07157031271203085 7.624730056958013
[32m[I 2022-02-27 00:02:06,382][0m Trial 0 finished with value: 7.653217949682243 and parameters: {'n_layers_mlp': 4, 'mlp_n_units_l0': 34, 'mlp_dropout_l0': 0.04296055374336226, 'mlp_n_units_l1': 42, 'mlp_dropout_l1': 0.09580383130513768, 'mlp_n_units_l2': 74, 'mlp_dropout_l2': 0.09700583155823904, 'mlp_n_units_l3': 32, 'mlp_dropout_l3': 0.2607400779179504, 'lr': 0.0007799100498793051, 'weight_decay': 0.1692518266032292, 'criterion': 'MSELoss', 'batch_size': 32}. Best is trial 0 with value: 7.653217949682243.[0m
Trial Id: 1 | Model params: 4562 | Timestamp: 2022-02-27 00:02:06.383085

epoch 0 -13.852691205182854 30.49667834668326
epoch 5 -13.812017738092896 30.45489278774689
epoch 10 -13.818534072157409 30.461591147039965
epoch 15 -13.824889728097705 30.46812292127459
epoch 20 -13.809900159644785 30.452715740336334
epoch 25 -13.812125905563084 30.45500398875784
epoch 30 -13.811956824093212 30.454830165244346
epoch 35 -13.827342546217276 30.470643333716513
epoch 40 -13.80651855154965 30.44923884217884
epoch 45 -13.817118418323036 30.460136074019147
epoch 50 -13.809872616070825 30.452687422217736
epoch 55 -13.821438405452712 30.464576134572418
epoch 60 -13.825840177701794 30.46909958794025
epoch 65 -13.817737309962215 30.46077220738076
epoch 70 -13.815552771719524 30.45852675069833
epoch 75 -13.81550484059066 30.458477481097187
epoch 80 -13.817627776556268 30.460659623447608
epoch 85 -13.816161101121073 30.459152060716814
epoch 90 -13.820201590348642 30.463305008485936
epoch 95 -13.813451943278244 30.456367182007728
[32m[I 2022-02-27 01:00:19,907][0m Trial 1 finished with value: 30.4671126423446 and parameters: {'n_layers_mlp': 4, 'mlp_n_units_l0': 40, 'mlp_dropout_l0': 0.07601678139153807, 'mlp_n_units_l1': 22, 'mlp_dropout_l1': 0.13192269185904848, 'mlp_n_units_l2': 53, 'mlp_dropout_l2': 0.11261030084192146, 'mlp_n_units_l3': 32, 'mlp_dropout_l3': 0.2763550142353546, 'lr': 0.00027161718385468304, 'weight_decay': 0.14685049050291762, 'criterion': 'PoissonNLLLoss', 'batch_size': 32}. Best is trial 0 with value: 7.653217949682243.[0m
Trial Id: 2 | Model params: 2986 | Timestamp: 2022-02-27 01:00:19.907206

epoch 0 -13.852378118341388 30.494533779833485
epoch 5 -13.789349936818788 30.42976104043191
epoch 10 -13.804932887568922 30.44578813519331
epoch 15 -13.828853129469804 30.47037374778479
epoch 20 -13.800824317860643 30.44156328245402
epoch 25 -13.799301362778582 30.4399970748843
epoch 30 -13.81844749974739 30.459681111424967
epoch 35 -13.816081114133702 30.457248932580583
epoch 40 -13.801690713756432 30.44245424835443
epoch 45 -13.82605719237805 30.467501062232827
epoch 50 -13.832170436096392 30.47378176320802
epoch 55 -13.792322096681168 30.432818563963252
epoch 60 -13.838685410504205 30.480473774751548
epoch 65 -13.835004648120227 30.47669317234665
epoch 70 -13.791527833311731 30.432001518561755
epoch 75 -13.81439179468983 30.455512525728224
epoch 80 -13.801483626992901 30.442241291216746
epoch 85 -13.799539102105387 30.44024157140383
epoch 90 -13.79868642884052 30.43936465375618
epoch 95 -13.803848762218244 30.44467338326347
[32m[I 2022-02-27 01:17:19,142][0m Trial 2 finished with value: 30.44286082411923 and parameters: {'n_layers_mlp': 4, 'mlp_n_units_l0': 23, 'mlp_dropout_l0': 0.04712606408416352, 'mlp_n_units_l1': 32, 'mlp_dropout_l1': 0.22383574603717366, 'mlp_n_units_l2': 20, 'mlp_dropout_l2': 0.08320789951738052, 'mlp_n_units_l3': 53, 'mlp_dropout_l3': 0.08549664361067337, 'lr': 0.002033963262582512, 'weight_decay': 0.17101086169896448, 'criterion': 'PoissonNLLLoss', 'batch_size': 128}. Best is trial 0 with value: 7.653217949682243.[0m
Trial Id: 3 | Model params: 3071 | Timestamp: 2022-02-27 01:17:19.142315

epoch 0 0.00827631498706538 7.880346356047853
epoch 5 0.06233644672351624 7.662552814789467
epoch 10 0.06291774568439723 7.660177269461175
epoch 15 0.03707591364017182 7.765080963783456
epoch 20 0.053439072736157334 7.698821490698941
epoch 25 0.05636642456370089 7.6869075133647495
epoch 30 0.06442919466340558 7.653997107877768
epoch 35 0.059039813548142805 7.676010979968219
epoch 40 0.0567209229249771 7.685463493056883
epoch 45 0.016659650616255517 7.846968210295892
epoch 50 0.04794835935917585 7.721118469310683
epoch 55 0.03903399210296765 7.757181911599606
epoch 60 0.06347976136029942 7.657879826850343
epoch 65 0.06302268588245374 7.659748340718438
epoch 70 0.007493257521808738 7.883456872878166
epoch 75 0.06151300303145946 7.665916652541712
epoch 80 0.05932453706003127 7.674849556674359
epoch 85 0.06136133141781752 7.666536083060929
epoch 90 0.0632682311786853 7.658744613955096
epoch 95 0.0422645439012751 7.744131983325044
[32m[I 2022-02-27 02:02:32,724][0m Trial 3 finished with value: 7.662102792030933 and parameters: {'n_layers_mlp': 2, 'mlp_n_units_l0': 30, 'mlp_dropout_l0': 0.11510038897343854, 'mlp_n_units_l1': 80, 'mlp_dropout_l1': 0.20104128046901493, 'lr': 0.008675316713631323, 'weight_decay': 0.03708620612700388, 'criterion': 'MSELoss', 'batch_size': 32}. Best is trial 0 with value: 7.653217949682243.[0m
Trial Id: 4 | Model params: 2931 | Timestamp: 2022-02-27 02:02:32.724174

epoch 0 -14.07095377588756 30.718101303766627
epoch 5 -0.09579039574220749 8.28300158040903
epoch 10 0.019887537580882908 7.833610160644662
epoch 15 0.03261062284935978 7.782599045452299
epoch 20 0.037955843274986245 7.761068247458835
epoch 25 0.03949854978632161 7.75484303721287
epoch 30 0.04261356468159416 7.742257908415767
epoch 35 0.04451624048520375 7.734560738027895
epoch 40 0.04510145389169984 7.732191748560234
epoch 45 0.04678526420923257 7.725371501094424
epoch 50 0.04732963901836951 7.723165231046777
epoch 55 0.04808027131037862 7.720121996021974
epoch 60 0.049352256020358864 7.714962338415455
epoch 65 0.0502726804072291 7.711226591301045
epoch 70 0.0495479343144416 7.714168285953716
epoch 75 0.05088261714013276 7.708750030055058
epoch 80 0.05177400330721693 7.705129251739672
epoch 85 0.05187745827092449 7.704708911222943
epoch 90 0.052269494028292285 7.7031158504312
epoch 95 0.05251505081359309 7.702117847890289
[32m[I 2022-02-27 02:16:05,608][0m Trial 4 finished with value: 7.7011680132264075 and parameters: {'n_layers_mlp': 2, 'mlp_n_units_l0': 36, 'mlp_dropout_l0': 0.08291997943976954, 'mlp_n_units_l1': 61, 'mlp_dropout_l1': 0.26383989396367236, 'lr': 1.456890043253145e-05, 'weight_decay': 0.17313889627812767, 'criterion': 'MSELoss', 'batch_size': 128}. Best is trial 0 with value: 7.653217949682243.[0m
Trial Id: 5 | Model params: 4477 | Timestamp: 2022-02-27 02:16:05.609092

epoch 0 -13.95337309736769 30.598038313287873
epoch 5 -13.821319683448074 30.462632890307255
epoch 10 -13.819368896332533 30.46062807330826
epoch 15 -13.816548129914116 30.457728948304155
epoch 20 -13.806586002321932 30.447487871930544
epoch 25 -13.812404481886288 30.453469692625053
epoch 30 -13.815456127760365 30.45660653712689
epoch 35 -13.812221905877767 30.453282009049364
epoch 40 -13.812745361884696 30.45382010565182
epoch 45 -13.807016321196178 30.44793031131219
epoch 50 -13.80652634723021 30.447426536065855
epoch 55 -13.80484419946304 30.445696943178255
epoch 60 -13.800225309534436 30.440947271684045
epoch 65 -13.81330774432798 30.454398206833755
epoch 70 -13.799175880161949 30.43986802492152
epoch 75 -13.806958730554552 30.44787109892565
epoch 80 -13.811110272890936 30.45213925314724
epoch 85 -13.81693004598435 30.45812148984243
epoch 90 -13.807598227834514 30.448528597905376
epoch 95 -13.81542680402716 30.456576396244333
[32m[I 2022-02-27 02:30:02,668][0m Trial 5 finished with value: 30.448423073850627 and parameters: {'n_layers_mlp': 2, 'mlp_n_units_l0': 53, 'mlp_dropout_l0': 0.10696667122219497, 'mlp_n_units_l1': 65, 'mlp_dropout_l1': 0.02798629222333012, 'lr': 1.4515286337940884e-05, 'weight_decay': 0.1725206280400498, 'criterion': 'PoissonNLLLoss', 'batch_size': 128}. Best is trial 0 with value: 7.653217949682243.[0m
Trial Id: 6 | Model params: 8988 | Timestamp: 2022-02-27 02:30:02.668550

epoch 0 -14.039205841796765 30.685729417711528
epoch 5 -13.8502715740401 30.4923711509346
epoch 10 -13.825949860201398 30.46739077838992
epoch 15 -13.82610267983539 30.467547800488113
epoch 20 -13.82075897581967 30.462056666578338
epoch 25 -13.81502006969092 30.456158324575824
epoch 30 -13.811027350808505 30.452054007737235
epoch 35 -13.817157879584917 30.45835565970043
epoch 40 -13.81562080802582 30.456775805898253
epoch 45 -13.817329467054478 30.458532017983398
epoch 50 -13.819620911494248 30.460887075817997
epoch 55 -13.821121687662977 30.46242941675741
epoch 60 -13.816465044411816 30.457643550570687
epoch 65 -13.823105597297788 30.464468151956666
epoch 70 -13.816443988587373 30.45762190873434
epoch 75 -13.822043386977992 30.46337660430551
epoch 80 -13.813802953835378 30.45490724849259
epoch 85 -13.818699068937114 30.459939663637503
epoch 90 -13.814925771533545 30.456061397127623
epoch 95 -13.8179674412989 30.459187721490395
[32m[I 2022-02-27 02:47:04,024][0m Trial 6 finished with value: 30.458837537011405 and parameters: {'n_layers_mlp': 4, 'mlp_n_units_l0': 77, 'mlp_dropout_l0': 0.10715754514129854, 'mlp_n_units_l1': 72, 'mlp_dropout_l1': 0.21212327425098265, 'mlp_n_units_l2': 22, 'mlp_dropout_l2': 0.16602389033467513, 'mlp_n_units_l3': 19, 'mlp_dropout_l3': 0.2028586616034785, 'lr': 0.00013658422736312123, 'weight_decay': 0.182511035184581, 'criterion': 'PoissonNLLLoss', 'batch_size': 128}. Best is trial 0 with value: 7.653217949682243.[0m
Trial Id: 7 | Model params: 4774 | Timestamp: 2022-02-27 02:47:04.024164

epoch 0 -13.968177109373585 30.615011003671505
epoch 5 -13.813195285849742 30.45610333780817
epoch 10 -13.816014617043933 30.45900148892639
epoch 15 -13.810897345092423 30.453740949605024
epoch 20 -13.81585155922918 30.45883388002428
epoch 25 -13.812287149783181 30.45516975429458
epoch 30 -13.809319287163865 30.4521185277351
epoch 35 -13.819726234368488 30.462816451355216
epoch 40 -13.813330333047606 30.456242166803538
epoch 45 -13.813721592918197 30.45664437975689
epoch 50 -13.812128369009358 30.455006521286375
epoch 55 -13.809583970025226 30.452390657658704
epoch 60 -13.817802044633234 30.460838744729646
epoch 65 -13.82694123442313 30.4702309769085
epoch 70 -13.812970656566627 30.455872416711703
epoch 75 -13.824324671942238 30.467542263854142
epoch 80 -13.815171116811323 30.45813443590336
epoch 85 -13.816129295643826 30.459119367754678
epoch 90 -13.81891084541185 30.4619783999161
epoch 95 -13.815310877151848 30.458278100433716
[32m[I 2022-02-27 03:45:22,297][0m Trial 7 finished with value: 30.45025667569791 and parameters: {'n_layers_mlp': 4, 'mlp_n_units_l0': 53, 'mlp_dropout_l0': 0.08923179683416418, 'mlp_n_units_l1': 28, 'mlp_dropout_l1': 0.1289693390377229, 'mlp_n_units_l2': 24, 'mlp_dropout_l2': 0.22775540532301497, 'mlp_n_units_l3': 64, 'mlp_dropout_l3': 0.10353234826396873, 'lr': 4.054087826057627e-05, 'weight_decay': 0.2410811664764345, 'criterion': 'PoissonNLLLoss', 'batch_size': 32}. Best is trial 0 with value: 7.653217949682243.[0m
Trial Id: 8 | Model params: 1074 | Timestamp: 2022-02-27 03:45:22.298162

[32m[I 2022-02-27 03:45:28,226][0m Trial 8 pruned. [0m
epoch 0 -13.81074028995587 30.451758902112967
Trial Id: 9 | Model params: 2415 | Timestamp: 2022-02-27 03:45:28.226177

epoch 0 -17.276792325794972 33.827818202550496
epoch 5 -17.276792325794972 33.827818202550496
epoch 10 -13.894385268089854 30.537627348987176
epoch 15 -13.879320044380881 30.522179494933493
epoch 20 -13.871235084565889 30.51388596656917
epoch 25 -13.866993361246159 30.50953391740525
epoch 30 -13.85575658715379 30.49800187674051
epoch 35 -13.84809259497138 30.49013399737121
epoch 40 -13.85118855223232 30.493312561588784
epoch 45 -13.844972290435992 30.486930100924006
epoch 50 -13.846261700838555 30.48825409501702
epoch 55 -13.836366773273523 30.478092299562068
epoch 60 -13.83495152246624 30.476638602235482
epoch 65 -13.833702386774494 30.475355475074544
epoch 70 -13.831248458197814 30.47283461288955
epoch 75 -13.824852052554052 30.46626275778777
epoch 80 -13.833629334340095 30.475280433065826
epoch 85 -13.832897943583973 30.474529112783568
epoch 90 -13.827479225044554 30.468962163534847
epoch 95 -13.829075180536348 30.470601882543455
[32m[I 2022-02-27 03:59:29,219][0m Trial 9 finished with value: 30.465387184554498 and parameters: {'n_layers_mlp': 2, 'mlp_n_units_l0': 70, 'mlp_dropout_l0': 0.08944428442911057, 'mlp_n_units_l1': 17, 'mlp_dropout_l1': 0.12424556777905764, 'lr': 1.285547927683392e-05, 'weight_decay': 0.19767525503046748, 'criterion': 'PoissonNLLLoss', 'batch_size': 128}. Best is trial 0 with value: 7.653217949682243.[0m
Trial Id: 10 | Model params: 6558 | Timestamp: 2022-02-27 03:59:29.219250

[32m[I 2022-02-27 04:00:03,734][0m Trial 10 pruned. [0m
epoch 0 0.05207372575660629 7.704371991755591
Trial Id: 11 | Model params: 1843 | Timestamp: 2022-02-27 04:00:03.734478

[32m[I 2022-02-27 04:00:30,847][0m Trial 11 pruned. [0m
epoch 0 0.05877559416589673 7.677088607137488
Trial Id: 12 | Model params: 2044 | Timestamp: 2022-02-27 04:00:30.847500

[32m[I 2022-02-27 04:00:59,198][0m Trial 12 pruned. [0m
epoch 0 0.06032092638345654 7.670783773869091
Trial Id: 13 | Model params: 8597 | Timestamp: 2022-02-27 04:00:59.199118

[32m[I 2022-02-27 04:01:05,369][0m Trial 13 pruned. [0m
epoch 0 0.06366158691258639 7.65667864127759
Trial Id: 14 | Model params: 10054 | Timestamp: 2022-02-27 04:01:05.369874

[32m[I 2022-02-27 04:01:39,516][0m Trial 14 pruned. [0m
epoch 0 0.06863981609939773 7.636753930079783
Trial Id: 15 | Model params: 1542 | Timestamp: 2022-02-27 04:01:39.516816

[32m[I 2022-02-27 04:02:06,864][0m Trial 15 pruned. [0m
epoch 0 0.024957085851453176 7.813791679810535
Trial Id: 16 | Model params: 2177 | Timestamp: 2022-02-27 04:02:06.864643

[32m[I 2022-02-27 04:02:34,153][0m Trial 16 pruned. [0m
epoch 0 0.0450509264169765 7.732858603377233
Trial Id: 17 | Model params: 11287 | Timestamp: 2022-02-27 04:02:34.153499

[32m[I 2022-02-27 04:02:40,001][0m Trial 17 pruned. [0m
epoch 0 0.06451617837615076 7.653183737184627
Trial Id: 18 | Model params: 6594 | Timestamp: 2022-02-27 04:02:40.001589

[32m[I 2022-02-27 04:03:13,442][0m Trial 18 pruned. [0m
epoch 0 0.007902402946243448 7.881831789313377
Trial Id: 19 | Model params: 975 | Timestamp: 2022-02-27 04:03:13.442310

[32m[I 2022-02-27 04:03:39,430][0m Trial 19 pruned. [0m
epoch 0 0.042935539982470905 7.741418711806927
Trial Id: 20 | Model params: 2751 | Timestamp: 2022-02-27 04:03:39.430786

[32m[I 2022-02-27 04:04:06,727][0m Trial 20 pruned. [0m
epoch 0 0.05124993222935492 7.707718999655061
Trial Id: 21 | Model params: 2890 | Timestamp: 2022-02-27 04:04:06.727950

[32m[I 2022-02-27 04:04:14,968][0m Trial 21 pruned. [0m
epoch 0 -7.26269972122196 22.74494989521131
Trial Id: 22 | Model params: 3615 | Timestamp: 2022-02-27 04:04:14.969127

[32m[I 2022-02-27 04:04:23,170][0m Trial 22 pruned. [0m
epoch 0 0.026548131270243025 7.806947178883962
Trial Id: 23 | Model params: 1945 | Timestamp: 2022-02-27 04:04:23.170536

