[32m[I 2022-02-27 04:04:31,354][0m Trial 23 pruned. [0m
epoch 0 -0.291932960789246 8.993815799113316
Trial Id: 24 | Model params: 2303 | Timestamp: 2022-02-27 04:04:31.354289

[32m[I 2022-02-27 04:04:39,615][0m Trial 24 pruned. [0m
epoch 0 0.0483515004228936 7.719022076065407
Study statistics: 
  Number of finished trials:  25
  Number of pruned trials:  16
  Number of complete trials:  9

Best trial:
  Value:  7.653217949682243
  Params: 
    n_layers_mlp: 4
    mlp_n_units_l0: 34
    mlp_dropout_l0: 0.04296055374336226
    mlp_n_units_l1: 42
    mlp_dropout_l1: 0.09580383130513768
    mlp_n_units_l2: 74
    mlp_dropout_l2: 0.09700583155823904
    mlp_n_units_l3: 32
    mlp_dropout_l3: 0.2607400779179504
    lr: 0.0007799100498793051
    weight_decay: 0.1692518266032292
    criterion: MSELoss
    batch_size: 32
Target: 132570, NaN: 0, Max: 365.0, Min: 0.0, Mean: 32.88295994568907
Prediction: 132570, NaN: 0, Max: 40.28871154785156, Min: 28.66080093383789, Mean: 32.20981181076302

 XXXXXX======== TRIAL south - elg ended

Test Set - R-squared:  0.06550550067759942
Test Set - RMSE:  7.659031608868678
Test Set - MAE:  5.961437495927191



[32m[I 2022-02-27 04:04:50,684][0m A new study created in memory with name: NeuralNetwork[0m
++++++++ Session Characteristics +++++++

Area: south
Gal Type: qso
Training Samples: 424221
Validation Samples: 106056
Test Samples: 132570
Number of features: 16
Device: cuda:0
Number of Workers: 8
Number of Trials: 25

+++++++++++++++++++++++++++++++++++++++
Trial Id: 0 | Model params: 7020 | Timestamp: 2022-02-27 04:04:50.685430

epoch 0 -1.3956775386096756 3.620403309673808
epoch 5 -1.3895967069439594 3.615805643579018
epoch 10 -1.383586939728509 3.6112559574259278
epoch 15 -1.3829178874403216 3.610749097661131
epoch 20 -1.3909349544908731 3.6168179829693923
epoch 25 -1.397521860953213 3.621796632854352
epoch 30 -1.383620630388072 3.6112814788707537
epoch 35 -1.3961814112014377 3.620784021614242
epoch 40 -1.395290543362667 3.620110879779281
epoch 45 -1.3957792933128559 3.620480195887939
epoch 50 -1.4024681778458885 3.625530764296099
epoch 55 -1.3906034273300105 3.6165672201948187
epoch 60 -1.3896174938301407 3.6158213703283675
epoch 65 -1.4023315372715288 3.6254276616505234
epoch 70 -1.3927079367290172 3.6181587483620294
epoch 75 -1.3962158570557324 3.62081004646988
epoch 80 -1.388971610990228 3.6153326823250413
epoch 85 -1.380427837083595 3.608862063041563
epoch 90 -1.394210636134476 3.6192947314734587
epoch 95 -1.3937458666672136 3.618943421671844
[32m[I 2022-02-27 04:22:21,349][0m Trial 0 finished with value: 3.6299886700982547 and parameters: {'n_layers_mlp': 4, 'mlp_n_units_l0': 12, 'mlp_dropout_l0': 0.10518153631152254, 'mlp_n_units_l1': 65, 'mlp_dropout_l1': 0.2806636192415332, 'mlp_n_units_l2': 52, 'mlp_dropout_l2': 0.18401298087672288, 'mlp_n_units_l3': 47, 'mlp_dropout_l3': 0.29615280661036475, 'lr': 0.00033734308333083034, 'weight_decay': 0.27426765562658495, 'criterion': 'PoissonNLLLoss', 'batch_size': 128}. Best is trial 0 with value: 3.6299886700982547.[0m
Trial Id: 1 | Model params: 1857 | Timestamp: 2022-02-27 04:22:21.349810

epoch 0 0.06533589854038302 2.2613388243380883
epoch 5 0.04648494996025643 2.284029105682663
epoch 10 0.0527234891527012 2.2765450138994248
epoch 15 0.06575454789834323 2.2608323246874584
epoch 20 0.06305196511657618 2.2641000280884844
epoch 25 0.04729683092079329 2.2830565176563558
epoch 30 0.06833891029287642 2.2577031382926336
epoch 35 0.06604740654866403 2.2604779444775027
epoch 40 0.0626346647129058 2.2646041674022133
epoch 45 0.04659718564892712 2.2838946782692684
epoch 50 0.05634012731095206 2.2721950098669814
epoch 55 0.06425526047754371 2.2626457017906225
epoch 60 0.06554750962524125 2.261082822503285
epoch 65 0.06868078726925853 2.257288863427539
epoch 70 0.06677058734506303 2.2596026051791407
epoch 75 0.04516156191999077 2.2856135634944303
epoch 80 0.06569940269668251 2.260899048167071
epoch 85 0.060695610225863006 2.2669452622370327
epoch 90 0.05836929563571891 2.269750724832348
epoch 95 0.06530772404794583 2.261372906953104
[32m[I 2022-02-27 05:08:45,277][0m Trial 1 finished with value: 2.2631650617677956 and parameters: {'n_layers_mlp': 2, 'mlp_n_units_l0': 19, 'mlp_dropout_l0': 0.14691926122178647, 'mlp_n_units_l1': 73, 'mlp_dropout_l1': 0.0747276399747106, 'lr': 0.0006807632986946536, 'weight_decay': 0.27309147165247644, 'criterion': 'MSELoss', 'batch_size': 32}. Best is trial 1 with value: 2.2631650617677956.[0m
Trial Id: 2 | Model params: 6573 | Timestamp: 2022-02-27 05:08:45.277591

epoch 0 0.054256296188815556 2.2747024067368353
epoch 5 0.07594249648707785 2.2484713425870257
epoch 10 0.07790332277532863 2.246084476478697
epoch 15 0.0781321671723394 2.2458057444566317
epoch 20 0.07887972555827427 2.244894978644004
epoch 25 0.0789108505288506 2.244857050437255
epoch 30 0.07951127405302638 2.2441252620378545
epoch 35 0.07970995795172053 2.243883056128017
epoch 40 0.07897450262118677 2.2447794833977164
epoch 45 0.07773641160707268 2.246287752138131
epoch 50 0.07863314887888617 2.2451954289354736
epoch 55 0.0790347922015946 2.2447060114751807
epoch 60 0.07991336649074776 2.2436350635514177
epoch 65 0.07953144512878885 2.244100673649429
epoch 70 0.07846492593838184 2.245400383204441
epoch 75 0.07879905423833111 2.244993279963128
epoch 80 0.07937648878593251 2.2442895573423063
epoch 85 0.07913534808039036 2.244583463660491
epoch 90 0.07837132655718282 2.245514411826877
epoch 95 0.07981944284588893 2.2437495772274096
[32m[I 2022-02-27 06:07:46,033][0m Trial 2 finished with value: 2.244730581430907 and parameters: {'n_layers_mlp': 4, 'mlp_n_units_l0': 74, 'mlp_dropout_l0': 0.21573664603265905, 'mlp_n_units_l1': 16, 'mlp_dropout_l1': 0.2094921181664971, 'mlp_n_units_l2': 59, 'mlp_dropout_l2': 0.07107823601079569, 'mlp_n_units_l3': 51, 'mlp_dropout_l3': 0.2759229424305936, 'lr': 1.6248916110045934e-05, 'weight_decay': 0.10138138234839701, 'criterion': 'MSELoss', 'batch_size': 32}. Best is trial 2 with value: 2.244730581430907.[0m
Trial Id: 3 | Model params: 1221 | Timestamp: 2022-02-27 06:07:46.034186

epoch 0 -1.3667530783009187 3.5984405583491625
epoch 5 -1.3342185170145604 3.5736219970999827
epoch 10 -1.2641580752432269 3.5195831510615734
epoch 15 -1.3622931662650477 3.595048506978036
epoch 20 -1.3532019596842666 3.5881241262658308
epoch 25 -1.2528592940356114 3.510790316169183
epoch 30 -1.3312149855370592 3.5713220964903263
epoch 35 -1.3508680955707137 3.586344365826335
epoch 40 -1.304468669574537 3.5507758855702205
epoch 45 -1.2928537185044346 3.5418162960902357
epoch 50 -1.314525074664441 3.5585150164171098
epoch 55 -1.364127354327986 3.5964439128661003
epoch 60 -1.2725185888853932 3.526075279308691
epoch 65 -1.3539714053793799 3.5887106974698506
epoch 70 -1.2689555179623566 3.5233099367389844
epoch 75 -1.2739464035937633 3.527182815154032
epoch 80 -1.3720190269671408 3.602441540708013
epoch 85 -1.2034370173766726 3.472067649777301
epoch 90 -1.294206358560528 3.5428608669223705
epoch 95 -1.327309808517628 3.5683295602575553
[32m[I 2022-02-27 06:55:31,388][0m Trial 3 finished with value: 3.5788074211145138 and parameters: {'n_layers_mlp': 2, 'mlp_n_units_l0': 36, 'mlp_dropout_l0': 0.23963888745194095, 'mlp_n_units_l1': 16, 'mlp_dropout_l1': 0.039369633457712536, 'lr': 0.0013207577777067812, 'weight_decay': 0.05719687803424774, 'criterion': 'PoissonNLLLoss', 'batch_size': 32}. Best is trial 2 with value: 2.244730581430907.[0m
Trial Id: 4 | Model params: 6514 | Timestamp: 2022-02-27 06:55:31.388447

epoch 0 0.06587933096258991 2.260706919452377
epoch 5 0.06078133468973501 2.2668674691373254
epoch 10 0.06472295457376509 2.2621057855906623
epoch 15 0.05201580494114055 2.2774210008861115
epoch 20 0.054179517754552875 2.2748204828494565
epoch 25 0.033402653887882994 2.2996702764018027
epoch 30 0.0522575711725195 2.2771305748403177
epoch 35 0.06907283618417881 2.2568392390726726
epoch 40 0.05989464576602377 2.267937258408645
epoch 45 0.06396679627372293 2.2630200411487262
epoch 50 0.04086468587495873 2.2907764694521053
epoch 55 0.06214187030893614 2.2652250019610456
epoch 60 0.04904434865497298 2.2809874961336205
epoch 65 0.06805786133603509 2.2580692015941803
epoch 70 0.055939002898548806 2.2727036033274213
epoch 75 0.06389561601979121 2.2631060847197753
epoch 80 0.06710731874848708 2.2592204768848205
epoch 85 0.05951602114035104 2.268393914915094
epoch 90 0.06385363703765068 2.263156827898889
epoch 95 0.03628815025100063 2.296235211178471
[32m[I 2022-02-27 07:05:46,320][0m Trial 4 finished with value: 2.2599174706813665 and parameters: {'n_layers_mlp': 4, 'mlp_n_units_l0': 59, 'mlp_dropout_l0': 0.21221026072528518, 'mlp_n_units_l1': 48, 'mlp_dropout_l1': 0.0112240169253234, 'mlp_n_units_l2': 20, 'mlp_dropout_l2': 0.1424879556937994, 'mlp_n_units_l3': 75, 'mlp_dropout_l3': 0.17125694844377462, 'lr': 0.0037127702720749227, 'weight_decay': 0.2053454059844884, 'criterion': 'MSELoss', 'batch_size': 256}. Best is trial 2 with value: 2.244730581430907.[0m
Trial Id: 5 | Model params: 2172 | Timestamp: 2022-02-27 07:05:46.320148

epoch 0 -1.3216847189066065 3.5640146390735046
epoch 5 -1.322097014269445 3.564331082013782
epoch 10 -1.334491601216734 3.5738310330500154
epoch 15 -1.3260532801770113 3.567366149077153
epoch 20 -1.3004990830873466 3.547716354469936
epoch 25 -1.322263911456464 3.5644591701468262
epoch 30 -1.314698245695542 3.558648136640187
epoch 35 -1.3306759459621413 3.570909179781145
epoch 40 -1.2994857192279463 3.546934888491149
epoch 45 -1.330276854315633 3.5706034356387346
epoch 50 -1.305429326450283 3.5515159090507846
epoch 55 -1.3207445691619473 3.5632929547927765
epoch 60 -1.3069136864523903 3.552659054021432
epoch 65 -1.3053596290613498 3.5514622242004976
epoch 70 -1.3039791192134276 3.5503987105693335
epoch 75 -1.3318924891037365 3.571841012099208
epoch 80 -1.2944772375711522 3.543070015135376
epoch 85 -1.3102851670172977 3.5552541549902377
epoch 90 -1.323442388804077 3.5653634820081637
epoch 95 -1.3052039882758821 3.5513423379812465
[32m[I 2022-02-27 07:53:44,406][0m Trial 5 finished with value: 3.541063687176735 and parameters: {'n_layers_mlp': 2, 'mlp_n_units_l0': 43, 'mlp_dropout_l0': 0.03997069793976261, 'mlp_n_units_l1': 32, 'mlp_dropout_l1': 0.0755960386419644, 'lr': 4.572827703678262e-05, 'weight_decay': 0.06357843216843924, 'criterion': 'PoissonNLLLoss', 'batch_size': 32}. Best is trial 2 with value: 2.244730581430907.[0m
Trial Id: 6 | Model params: 7314 | Timestamp: 2022-02-27 07:53:44.406428

[32m[I 2022-02-27 07:53:54,696][0m Trial 6 pruned. [0m
epoch 0 0.06886425151783404 2.2570920599764803
Trial Id: 7 | Model params: 7890 | Timestamp: 2022-02-27 07:53:54.697138

epoch 0 -3.079316197738904 4.724289007609024
epoch 5 -1.3378449903534841 3.5764374080849035
epoch 10 -1.3159247096482893 3.5596310873748793
epoch 15 -1.3122377287676552 3.5567964703043216
epoch 20 -1.3039911615831286 3.5504481697137003
epoch 25 -1.3129183874510195 3.5573199429196953
epoch 30 -1.3090385769423305 3.554335073205535
epoch 35 -1.3088825615937272 3.5542149928832787
epoch 40 -1.308149880392417 3.5536510159235855
epoch 45 -1.3079832298282121 3.5535227251566215
epoch 50 -1.312579823321998 3.5570595738093775
epoch 55 -1.3113767310423863 3.556134194369703
epoch 60 -1.3078617896611764 3.5534292352940176
epoch 65 -1.3041118779909722 3.5505411804297444
epoch 70 -1.2968579231301147 3.5449477522349007
epoch 75 -1.313860061588524 3.558044027114854
epoch 80 -1.3106446155896845 3.5555709571106506
epoch 85 -1.3106011384954028 3.555537506137735
epoch 90 -1.3094107833259363 3.554621532883606
epoch 95 -1.3055756005189392 3.5516687693403086
[32m[I 2022-02-27 08:11:28,125][0m Trial 7 finished with value: 3.5603983375278987 and parameters: {'n_layers_mlp': 4, 'mlp_n_units_l0': 39, 'mlp_dropout_l0': 0.12084335840264279, 'mlp_n_units_l1': 76, 'mlp_dropout_l1': 0.14354008986763045, 'mlp_n_units_l2': 33, 'mlp_dropout_l2': 0.05154436134171336, 'mlp_n_units_l3': 47, 'mlp_dropout_l3': 0.07897490561114516, 'lr': 1.645661663165079e-05, 'weight_decay': 0.01852384721739828, 'criterion': 'PoissonNLLLoss', 'batch_size': 128}. Best is trial 2 with value: 2.244730581430907.[0m
Trial Id: 8 | Model params: 3531 | Timestamp: 2022-02-27 08:11:28.125557

[32m[I 2022-02-27 08:11:34,045][0m Trial 8 pruned. [0m
epoch 0 0.06868050780977908 2.257314748240476
Trial Id: 9 | Model params: 3586 | Timestamp: 2022-02-27 08:11:34.045836

epoch 0 -1.3360822558036873 3.5750888373668563
epoch 5 -1.3025807062080412 3.549361248150592
epoch 10 -1.3312852527816297 3.571416337193085
epoch 15 -1.3164650677883611 3.560046334779315
epoch 20 -1.3092553509186118 3.554501910882467
epoch 25 -1.2973138373769393 3.545299561542468
epoch 30 -1.320774457570006 3.563356226868071
epoch 35 -1.3206622523474172 3.563270084931671
epoch 40 -1.3255316204480843 3.5670064712831904
epoch 45 -1.3177254491645969 3.561014708096146
epoch 50 -1.3196985676344637 3.5625301613454092
epoch 55 -1.3204492757240471 3.5631065732783584
epoch 60 -1.3375833812241553 3.5762372975437016
epoch 65 -1.3336516231379907 3.573228459971169
epoch 70 -1.3459008287782206 3.5825940234702602
epoch 75 -1.3275065636813292 3.5685207788533537
epoch 80 -1.3043740162437936 3.55074314679251
epoch 85 -1.336679935161087 3.57554614578151
epoch 90 -1.3115493699292418 3.5562669973821484
epoch 95 -1.330448919964136 3.5707756690006978
[32m[I 2022-02-27 08:25:56,623][0m Trial 9 finished with value: 3.5688263134875537 and parameters: {'n_layers_mlp': 2, 'mlp_n_units_l0': 45, 'mlp_dropout_l0': 0.23812276488198703, 'mlp_n_units_l1': 60, 'mlp_dropout_l1': 0.19081568420471137, 'lr': 0.0001501085612529104, 'weight_decay': 0.053304058125061546, 'criterion': 'PoissonNLLLoss', 'batch_size': 128}. Best is trial 2 with value: 2.244730581430907.[0m
Trial Id: 10 | Model params: 7804 | Timestamp: 2022-02-27 08:25:56.623567

epoch 0 -3.0794043771746127 4.724286602401409
epoch 5 0.06098568969712337 2.2665951919785394
epoch 10 0.06403178862926295 2.2629158649080336
epoch 15 0.06685785987399262 2.2594969474267845
epoch 20 0.06846920994152972 2.257545254586107
epoch 25 0.06808738940939041 2.258007874195598
epoch 30 0.06496266616499358 2.2617902809731207
epoch 35 0.06907221484418224 2.256814451457746
epoch 40 0.06985724459670661 2.255862691193722
epoch 45 0.07002682596951937 2.255657040110639
epoch 50 0.06971230612465651 2.2560384430090283
epoch 55 0.07028370717034782 2.2553454849365755
epoch 60 0.07076818525168616 2.2547577745529477
epoch 65 0.07234424327547073 2.2528448303763193
epoch 70 0.06993779723617155 2.2557650074632316
epoch 75 0.07175434476557818 2.253561011241573
epoch 80 0.07031839267696993 2.2553034137526065
epoch 85 0.0712582692804945 2.254163107810939
epoch 90 0.06988342733445518 2.2558309406497554
epoch 95 0.07108808438935088 2.254369627512796
[32m[I 2022-02-27 09:25:06,065][0m Trial 10 finished with value: 2.2540397025789285 and parameters: {'n_layers_mlp': 4, 'mlp_n_units_l0': 80, 'mlp_dropout_l0': 0.2961903280944418, 'mlp_n_units_l1': 35, 'mlp_dropout_l1': 0.29391576073153947, 'mlp_n_units_l2': 78, 'mlp_dropout_l2': 0.2788106552055858, 'mlp_n_units_l3': 10, 'mlp_dropout_l3': 0.2107105937341707, 'lr': 1.0693538820146074e-05, 'weight_decay': 0.1369611739954646, 'criterion': 'MSELoss', 'batch_size': 32}. Best is trial 2 with value: 2.244730581430907.[0m
Trial Id: 11 | Model params: 7223 | Timestamp: 2022-02-27 09:25:06.066077

[32m[I 2022-02-27 09:25:41,794][0m Trial 11 pruned. [0m
epoch 0 0.03564261180517969 2.296978149012153
Trial Id: 12 | Model params: 8312 | Timestamp: 2022-02-27 09:25:41.794830

[32m[I 2022-02-27 09:26:17,129][0m Trial 12 pruned. [0m
epoch 0 0.06019416989454418 2.2675502770365905
Trial Id: 13 | Model params: 6460 | Timestamp: 2022-02-27 09:26:17.129511

[32m[I 2022-02-27 09:26:52,842][0m Trial 13 pruned. [0m
epoch 0 0.032386950961636796 2.300852169668029
Trial Id: 14 | Model params: 5482 | Timestamp: 2022-02-27 09:26:52.842782

[32m[I 2022-02-27 09:27:28,344][0m Trial 14 pruned. [0m
epoch 0 0.05169141634112906 2.277784842272589
Trial Id: 15 | Model params: 9428 | Timestamp: 2022-02-27 09:27:28.344343

[32m[I 2022-02-27 09:28:03,887][0m Trial 15 pruned. [0m
epoch 0 0.07358691040430787 2.2513353941579486
Trial Id: 16 | Model params: 9445 | Timestamp: 2022-02-27 09:28:03.887650

epoch 0 -3.079316197738904 4.724289007609024
epoch 5 0.0484391877604774 2.2817131582059305
epoch 10 0.0650571693596873 2.261701575545583
epoch 15 0.06784345486551746 2.258328937035221
epoch 20 0.06859128327734854 2.2574228760263426
epoch 25 0.06955534325252555 2.256254294264099
epoch 30 0.07073941793115324 2.254818193763768
epoch 35 0.0711846585543432 2.2542779486693956
epoch 40 0.0699442142719705 2.2557827543423743
epoch 45 0.07051424225489233 2.2550913676545083
epoch 50 0.0721211246427671 2.2531412387454957
epoch 55 0.07162243318124029 2.25374663638638
epoch 60 0.07115232334823729 2.254317187850985
epoch 65 0.0702580819936357 2.2554020905431575
epoch 70 0.0710424614924775 2.2544505015003207
epoch 75 0.07201049815052951 2.2532755502862534
epoch 80 0.07089534203821402 2.254629013640495
epoch 85 0.07064116140617549 2.2549373986177548
epoch 90 0.07178388623160092 2.25355065465233
epoch 95 0.07093872823518566 2.2545763710670026
[32m[I 2022-02-27 09:38:20,639][0m Trial 16 finished with value: 2.253536079631558 and parameters: {'n_layers_mlp': 4, 'mlp_n_units_l0': 70, 'mlp_dropout_l0': 0.2003220845612553, 'mlp_n_units_l1': 41, 'mlp_dropout_l1': 0.21507226169087484, 'mlp_n_units_l2': 79, 'mlp_dropout_l2': 0.07130117620519498, 'mlp_n_units_l3': 25, 'mlp_dropout_l3': 0.2022812933830636, 'lr': 2.2164778752942408e-05, 'weight_decay': 0.1712941829040856, 'criterion': 'MSELoss', 'batch_size': 256}. Best is trial 2 with value: 2.244730581430907.[0m
Trial Id: 17 | Model params: 3589 | Timestamp: 2022-02-27 09:38:20.640139

epoch 0 -3.079316197738904 4.724289007609024
epoch 5 0.04650583173517753 2.2840299441517713
epoch 10 0.06623836449161669 2.2602724212031093
epoch 15 0.06943290415569747 2.2564027419167356
epoch 20 0.06976740080236266 2.2559971682661746
epoch 25 0.0696929474298571 2.256087448501956
epoch 30 0.06975073686907152 2.256017374834935
epoch 35 0.06903427897499392 2.256885975554867
epoch 40 0.07001149361056036 2.2557011622922936
epoch 45 0.07006856671913797 2.255631945387078
epoch 50 0.07023216048395942 2.255433530999101
epoch 55 0.06804647240880368 2.258082999074831
epoch 60 0.07006945646996887 2.2556308663016713
epoch 65 0.06862716832322546 2.257379388939368
epoch 70 0.07032848311590723 2.2553166981126394
epoch 75 0.07004979993602212 2.25565470552854
epoch 80 0.06905167396350309 2.256864890627618
epoch 85 0.06844001285279411 2.2576061830143623
epoch 90 0.06974464360276589 2.256024763441779
epoch 95 0.06978365900095973 2.25597745351403
[32m[I 2022-02-27 09:48:37,920][0m Trial 17 finished with value: 2.2551671786818814 and parameters: {'n_layers_mlp': 4, 'mlp_n_units_l0': 70, 'mlp_dropout_l0': 0.19309825868704827, 'mlp_n_units_l1': 10, 'mlp_dropout_l1': 0.1833694247974167, 'mlp_n_units_l2': 43, 'mlp_dropout_l2': 0.08713470743762292, 'mlp_n_units_l3': 27, 'mlp_dropout_l3': 0.013700813083125596, 'lr': 6.528234356350275e-05, 'weight_decay': 0.17963357479362727, 'criterion': 'MSELoss', 'batch_size': 256}. Best is trial 2 with value: 2.244730581430907.[0m
Trial Id: 18 | Model params: 10740 | Timestamp: 2022-02-27 09:48:37.920882

[32m[I 2022-02-27 09:48:43,990][0m Trial 18 pruned. [0m
epoch 0 0.043113741679120965 2.2880890968583447
Trial Id: 19 | Model params: 1145 | Timestamp: 2022-02-27 09:48:43.990490

[32m[I 2022-02-27 09:48:49,180][0m Trial 19 pruned. [0m
epoch 0 0.06399324563397213 2.262988068001343
Trial Id: 20 | Model params: 5898 | Timestamp: 2022-02-27 09:48:49.181102

epoch 0 -1.9094076912282856 3.9897443099186503
epoch 5 0.05558328148512348 2.2731317394325754
epoch 10 0.06391572564185488 2.2630817762915427
epoch 15 0.06522448858858998 2.261499187183581
epoch 20 0.06671611074979944 2.25969412862454
epoch 25 0.06833509040944108 2.257733317547121
epoch 30 0.06766729028547502 2.2585423232825232
epoch 35 0.0691096000699728 2.2567946754363106
epoch 40 0.06982193519416335 2.2559310389793876
epoch 45 0.0694370251507136 2.2563977456973388
epoch 50 0.07014782262984343 2.255535822185465
epoch 55 0.06913549272978525 2.2567632889147906
epoch 60 0.06931141972737997 2.2565500224580988
epoch 65 0.0695823732060723 2.2562215212822507
epoch 70 0.06940707259388756 2.2564340593803927
epoch 75 0.06869104994069497 2.2573019722945533
epoch 80 0.06975219460578386 2.256015607200834
epoch 85 0.067940673419151 2.2582111686202375
epoch 90 0.06962574727666504 2.2561689305696135
epoch 95 0.06896456983519272 2.2569704698769857
[32m[I 2022-02-27 09:59:04,861][0m Trial 20 finished with value: 2.25729399096835 and parameters: {'n_layers_mlp': 4, 'mlp_n_units_l0': 72, 'mlp_dropout_l0': 0.20754971252546456, 'mlp_n_units_l1': 25, 'mlp_dropout_l1': 0.1270363346164105, 'mlp_n_units_l2': 56, 'mlp_dropout_l2': 0.005189600253953874, 'mlp_n_units_l3': 24, 'mlp_dropout_l3': 0.2654667717279523, 'lr': 2.2531025151824662e-05, 'weight_decay': 0.18476299439001062, 'criterion': 'MSELoss', 'batch_size': 256}. Best is trial 2 with value: 2.244730581430907.[0m
Trial Id: 21 | Model params: 8224 | Timestamp: 2022-02-27 09:59:04.861158

