[32m[I 2022-02-27 09:59:40,429][0m Trial 21 pruned. [0m
epoch 0 0.04595985232291955 2.284657922823241
Trial Id: 22 | Model params: 9938 | Timestamp: 2022-02-27 09:59:40.429342

epoch 0 -3.0794043771746127 4.724286602401409
epoch 5 0.06924024419061958 2.256610768542443
epoch 10 0.07210156087193442 2.25313949250823
epoch 15 0.07074968304737717 2.2547802220093773
epoch 20 0.07184465246893001 2.253451385697798
epoch 25 0.07278411858352463 2.2523106406680484
epoch 30 0.07191927135375364 2.2533608009645487
epoch 35 0.07391283996673104 2.2509393282351966
epoch 40 0.07323696606797936 2.2517605650094654
epoch 45 0.07287693584055477 2.25219790611948
epoch 50 0.07365037328197366 2.2512582802487833
epoch 55 0.07341984308325467 2.2515383854700723
epoch 60 0.07341707992103375 2.2515417426330337
epoch 65 0.07342052683886102 2.2515375547258207
epoch 70 0.0736200945522143 2.251295072342241
epoch 75 0.07176268426357224 2.2535508880540105
epoch 80 0.07301212444111504 2.2520336978310485
epoch 85 0.0730643747705938 2.2519702281978478
epoch 90 0.07408549983513957 2.250729485673113
epoch 95 0.07314165174048204 2.251876354870523
[32m[I 2022-02-27 10:58:49,573][0m Trial 22 finished with value: 2.2522088954088537 and parameters: {'n_layers_mlp': 4, 'mlp_n_units_l0': 75, 'mlp_dropout_l0': 0.1666661233019565, 'mlp_n_units_l1': 38, 'mlp_dropout_l1': 0.27008767966455255, 'mlp_n_units_l2': 75, 'mlp_dropout_l2': 0.12744693554183198, 'mlp_n_units_l3': 37, 'mlp_dropout_l3': 0.1951234829260078, 'lr': 1.0923147456307202e-05, 'weight_decay': 0.15143016184332772, 'criterion': 'MSELoss', 'batch_size': 32}. Best is trial 2 with value: 2.244730581430907.[0m
Trial Id: 23 | Model params: 10718 | Timestamp: 2022-02-27 10:58:49.574114

epoch 0 -3.079316197738904 4.724289007609024
epoch 5 0.06703851356090373 2.2593037893738748
epoch 10 0.07165629647343241 2.2537055324327913
epoch 15 0.07310242511122989 2.2519494919036513
epoch 20 0.0714559502030857 2.2539487059137078
epoch 25 0.07309639089624165 2.2519568221231
epoch 30 0.07361257743774574 2.251329684805545
epoch 35 0.07231342362291049 2.2529077496420906
epoch 40 0.07337661251237071 2.251616390455928
epoch 45 0.07372082430779348 2.251198148849164
epoch 50 0.07189107082072888 2.2534205379311967
epoch 55 0.07298249394554857 2.252095176928152
epoch 60 0.0715814380944394 2.253796396054401
epoch 65 0.07171983345596522 2.2536284079267084
epoch 70 0.07249579064479672 2.252686297547643
epoch 75 0.07252868385590638 2.252646352314958
epoch 80 0.0719851894565019 2.253306276427299
epoch 85 0.0708754452893623 2.254653154918169
epoch 90 0.0723569469404699 2.252854900343621
epoch 95 0.07164649135632073 2.253717434160701
[32m[I 2022-02-27 11:09:06,996][0m Trial 23 finished with value: 2.251999817119793 and parameters: {'n_layers_mlp': 4, 'mlp_n_units_l0': 52, 'mlp_dropout_l0': 0.2180079138524909, 'mlp_n_units_l1': 55, 'mlp_dropout_l1': 0.2612953666603954, 'mlp_n_units_l2': 72, 'mlp_dropout_l2': 0.12352794074349221, 'mlp_n_units_l3': 39, 'mlp_dropout_l3': 0.18535059221245606, 'lr': 6.466928884612764e-05, 'weight_decay': 0.16025260426021706, 'criterion': 'MSELoss', 'batch_size': 256}. Best is trial 2 with value: 2.244730581430907.[0m
Trial Id: 24 | Model params: 10302 | Timestamp: 2022-02-27 11:09:06.996719

[32m[I 2022-02-27 11:09:42,385][0m Trial 24 pruned. [0m
epoch 0 0.06810419571205828 2.257987513415829
Study statistics: 
  Number of finished trials:  25
  Number of pruned trials:  11
  Number of complete trials:  14

Best trial:
  Value:  2.244730581430907
  Params: 
    n_layers_mlp: 4
    mlp_n_units_l0: 74
    mlp_dropout_l0: 0.21573664603265905
    mlp_n_units_l1: 16
    mlp_dropout_l1: 0.2094921181664971
    mlp_n_units_l2: 59
    mlp_dropout_l2: 0.07107823601079569
    mlp_n_units_l3: 51
    mlp_dropout_l3: 0.2759229424305936
    lr: 1.6248916110045934e-05
    weight_decay: 0.10138138234839701
    criterion: MSELoss
    batch_size: 32
Target: 132570, NaN: 0, Max: 87.0, Min: 0.0, Mean: 4.115938749339971
Prediction: 132570, NaN: 0, Max: 6.86093282699585, Min: 3.2802226543426514, Mean: 4.079663303898877

 XXXXXX======== TRIAL south - qso ended

Test Set - R-squared:  0.08027265177168885
Test Set - RMSE:  2.286526402702937
Test Set - MAE:  1.7434212701878342



[32m[I 2022-02-27 11:09:52,444][0m A new study created in memory with name: NeuralNetwork[0m
++++++++ Session Characteristics +++++++

Area: south
Gal Type: glbg
Training Samples: 424221
Validation Samples: 106056
Test Samples: 132570
Number of features: 16
Device: cuda:0
Number of Workers: 8
Number of Trials: 25

+++++++++++++++++++++++++++++++++++++++
Trial Id: 0 | Model params: 939 | Timestamp: 2022-02-27 11:09:52.444538

epoch 0 -0.021926737092202275 8.452985677986389
epoch 5 0.037047274636495264 8.205456273860918
epoch 10 0.03556239327422783 8.211780278860953
epoch 15 0.04186002195416272 8.184925538999785
epoch 20 0.038132325388493205 8.200832035443149
epoch 25 0.042069675369866166 8.184030006240096
epoch 30 0.03849827405725581 8.1992718577051
epoch 35 0.03914292404050601 8.196522748380431
epoch 40 0.039069538684605276 8.196835746676204
epoch 45 0.04116274763220029 8.187903235677387
epoch 50 0.04208955216617383 8.18394509759012
epoch 55 0.04157594930459496 8.186138796573719
epoch 60 0.04179931825926009 8.18518481601812
epoch 65 0.03995355662675415 8.193064497105926
epoch 70 0.04120934024564238 8.187704296574832
epoch 75 0.04275572251967086 8.181098876521165
epoch 80 0.04257276850451863 8.181880648432625
epoch 85 0.04224265785954151 8.18329103923659
epoch 90 0.04108325541292557 8.188242636919988
epoch 95 0.040861997847901343 8.189187247671018
[32m[I 2022-02-27 11:18:23,597][0m Trial 0 finished with value: 8.200902288583402 and parameters: {'n_layers_mlp': 2, 'mlp_n_units_l0': 10, 'mlp_dropout_l0': 0.2712370292405505, 'mlp_n_units_l1': 64, 'mlp_dropout_l1': 0.21846243231762127, 'lr': 0.0007376287982411595, 'weight_decay': 0.20734422072421638, 'criterion': 'MSELoss', 'batch_size': 256}. Best is trial 0 with value: 8.200902288583402.[0m
Trial Id: 1 | Model params: 2891 | Timestamp: 2022-02-27 11:18:23.597611

epoch 0 -4.914417620886937 20.33556511479004
epoch 5 -4.895122129175263 20.302366133055973
epoch 10 -4.897925198761687 20.307192341953545
epoch 15 -4.904170533774205 20.31794117810403
epoch 20 -4.887923326319903 20.289966273155446
epoch 25 -4.8920580923014905 20.297089288711884
epoch 30 -4.888902902307621 20.291654027567642
epoch 35 -4.903975077201196 20.31760486430701
epoch 40 -4.898279002174601 20.30780142446723
epoch 45 -4.898084098901157 20.307465895267036
epoch 50 -4.889991121037491 20.293528802742536
epoch 55 -4.878039007328269 20.27292828474433
epoch 60 -4.892491046462514 20.29783499994726
epoch 65 -4.892463484195156 20.29778752808817
epoch 70 -4.8953294799477085 20.30272318030548
epoch 75 -4.899391058235165 20.30971574127717
epoch 80 -4.896837668263967 20.305320013261262
epoch 85 -4.893371409372446 20.29935123421488
epoch 90 -4.89647553234282 20.304696509692135
epoch 95 -4.903112091614765 20.316119895222936
[32m[I 2022-02-27 11:27:05,189][0m Trial 1 finished with value: 20.292038831197843 and parameters: {'n_layers_mlp': 2, 'mlp_n_units_l0': 41, 'mlp_dropout_l0': 0.15929102700632955, 'mlp_n_units_l1': 51, 'mlp_dropout_l1': 0.08239593224695471, 'lr': 0.0007155654992852034, 'weight_decay': 0.003683620507949903, 'criterion': 'PoissonNLLLoss', 'batch_size': 256}. Best is trial 0 with value: 8.200902288583402.[0m
Trial Id: 2 | Model params: 1267 | Timestamp: 2022-02-27 11:27:05.189853

epoch 0 -4.938705609852524 20.37727707882977
epoch 5 -4.9043745331710085 20.318292185236917
epoch 10 -4.909384488942963 20.326910554582472
epoch 15 -4.906516052554836 20.321976578187833
epoch 20 -4.905088353317686 20.3195203566455
epoch 25 -4.901783625991659 20.313833746402
epoch 30 -4.905411798004631 20.320076838658387
epoch 35 -4.901893881317693 20.3140234939465
epoch 40 -4.904294656718267 20.318154748275102
epoch 45 -4.895951277597322 20.303793845883828
epoch 50 -4.9048028962247425 20.319029219090552
epoch 55 -4.906196423082405 20.32142671169525
epoch 60 -4.89607443877313 20.304005908869662
epoch 65 -4.902170909088027 20.31450024621553
epoch 70 -4.905955572858731 20.321012361264195
epoch 75 -4.906360938848094 20.321709734097084
epoch 80 -4.905348969998858 20.319968745154984
epoch 85 -4.908701827001249 20.3257364213852
epoch 90 -4.90429620306128 20.318157408951475
epoch 95 -4.910145417086512 20.328219220523653
[32m[I 2022-02-27 11:41:06,519][0m Trial 2 finished with value: 20.324923058018 and parameters: {'n_layers_mlp': 2, 'mlp_n_units_l0': 23, 'mlp_dropout_l0': 0.07334676210871878, 'mlp_n_units_l1': 35, 'mlp_dropout_l1': 0.08343301860705406, 'lr': 6.828061343870726e-05, 'weight_decay': 0.2550947760208623, 'criterion': 'PoissonNLLLoss', 'batch_size': 128}. Best is trial 0 with value: 8.200902288583402.[0m
Trial Id: 3 | Model params: 3106 | Timestamp: 2022-02-27 11:41:06.519272

epoch 0 -0.03318911459916052 8.499437078299383
epoch 5 0.025136086280089454 8.256048764206714
epoch 10 0.03158562859028813 8.228693100912048
epoch 15 0.03468905259986488 8.215497501645938
epoch 20 0.03604066292640595 8.2097438939765
epoch 25 0.03590992416492522 8.210300605923162
epoch 30 0.03694563448625576 8.205889307477351
epoch 35 0.03936366157061777 8.195581201424282
epoch 40 0.03908345177928296 8.196776406396548
epoch 45 0.03968095080010492 8.194227627602695
epoch 50 0.03926295099233945 8.19601079171643
epoch 55 0.03837032276410046 8.199817396266704
epoch 60 0.04008475027822167 8.192504672745626
epoch 65 0.03863362192818498 8.198694743272466
epoch 70 0.040400766995955406 8.191156021626092
epoch 75 0.039641627181765116 8.194395396523594
epoch 80 0.038684016784087616 8.198479852537588
epoch 85 0.040729342031024074 8.189753540405615
epoch 90 0.040863008579367754 8.189182932821959
epoch 95 0.04013046858358282 8.192309576412798
[32m[I 2022-02-27 11:54:45,213][0m Trial 3 finished with value: 8.191656361524407 and parameters: {'n_layers_mlp': 2, 'mlp_n_units_l0': 71, 'mlp_dropout_l0': 0.2649019400423125, 'mlp_n_units_l1': 26, 'mlp_dropout_l1': 0.18311049443421484, 'lr': 4.321187141621179e-05, 'weight_decay': 0.1738148405983877, 'criterion': 'MSELoss', 'batch_size': 128}. Best is trial 3 with value: 8.191656361524407.[0m
Trial Id: 4 | Model params: 3327 | Timestamp: 2022-02-27 11:54:45.213794

epoch 0 -4.884232840475981 20.282705069784228
epoch 5 -4.906387975287994 20.320853107677575
epoch 10 -4.919276880385935 20.343013082371776
epoch 15 -4.883606669546959 20.281625848540063
epoch 20 -4.853011880785259 20.228824831729476
epoch 25 -4.908939029341566 20.3252410685219
epoch 30 -4.899675294613099 20.30930237838886
epoch 35 -4.911259208111753 20.32923108807253
epoch 40 -4.901010744371916 20.311600853893548
epoch 45 -4.911921265636976 20.330369487110513
epoch 50 -4.90046434662307 20.31066046669706
epoch 55 -4.913443629832312 20.332986930152465
epoch 60 -4.868396527398586 20.25539312596725
epoch 65 -4.918892882927259 20.342353222039367
epoch 70 -4.865837573368109 20.250976393784953
epoch 75 -4.906314039824801 20.32072592026666
epoch 80 -4.884145142437866 20.282553923482055
epoch 85 -4.914933369074626 20.335547954060914
epoch 90 -4.905264532501283 20.318920420422472
epoch 95 -4.90466609705225 20.31789084162251
[32m[I 2022-02-27 12:41:27,199][0m Trial 4 finished with value: 20.332493645523193 and parameters: {'n_layers_mlp': 2, 'mlp_n_units_l0': 54, 'mlp_dropout_l0': 0.012218003989240145, 'mlp_n_units_l1': 43, 'mlp_dropout_l1': 0.2733977002344107, 'lr': 0.0011683572731339834, 'weight_decay': 0.1331592595590507, 'criterion': 'PoissonNLLLoss', 'batch_size': 32}. Best is trial 3 with value: 8.191656361524407.[0m
Trial Id: 5 | Model params: 2706 | Timestamp: 2022-02-27 12:41:27.199645

[32m[I 2022-02-27 12:41:35,398][0m Trial 5 pruned. [0m
epoch 0 0.037451229063845015 8.203735016942442
Trial Id: 6 | Model params: 9750 | Timestamp: 2022-02-27 12:41:35.398696

epoch 0 -4.9794631775385305 20.446173829438116
epoch 5 -4.915871729434537 20.337160932108105
epoch 10 -4.872215922971692 20.261983578295293
epoch 15 -4.888326340756273 20.289758905535592
epoch 20 -4.902028439086591 20.313352258743638
epoch 25 -4.901937277425111 20.31319537995934
epoch 30 -4.893582163269361 20.298812037100586
epoch 35 -4.924747621937941 20.352411668257467
epoch 40 -4.89914172812384 20.30838397121818
epoch 45 -4.884412889186611 20.283015377606834
epoch 50 -4.899412234376238 20.308849588261985
epoch 55 -4.879563212050327 20.274655465292668
epoch 60 -4.884864109227731 20.283793019128996
epoch 65 -4.898488782299073 20.30726002454244
epoch 70 -4.8934364559615835 20.29856111130944
epoch 75 -4.911331886857552 20.329356061316393
epoch 80 -4.903125349521768 20.315239821053844
epoch 85 -4.908713326724601 20.324852885137012
epoch 90 -4.911329611963177 20.329352149580167
epoch 95 -4.9395823526238205 20.377875519931056
[32m[I 2022-02-27 13:39:56,675][0m Trial 6 finished with value: 20.39689929666811 and parameters: {'n_layers_mlp': 4, 'mlp_n_units_l0': 15, 'mlp_dropout_l0': 0.19238888092628076, 'mlp_n_units_l1': 44, 'mlp_dropout_l1': 0.040077207228356004, 'mlp_n_units_l2': 78, 'mlp_dropout_l2': 0.26785759597647907, 'mlp_n_units_l3': 66, 'mlp_dropout_l3': 0.1591779790894097, 'lr': 0.004614011428035877, 'weight_decay': 0.0791610240034528, 'criterion': 'PoissonNLLLoss', 'batch_size': 32}. Best is trial 3 with value: 8.191656361524407.[0m
Trial Id: 7 | Model params: 5824 | Timestamp: 2022-02-27 13:39:56.675342

[32m[I 2022-02-27 13:40:02,731][0m Trial 7 pruned. [0m
epoch 0 0.029236679905113472 8.23866665759317
Trial Id: 8 | Model params: 2571 | Timestamp: 2022-02-27 13:40:02.731926

[32m[I 2022-02-27 13:40:31,077][0m Trial 8 pruned. [0m
epoch 0 -4.881775254370911 20.27846902905766
Trial Id: 9 | Model params: 2487 | Timestamp: 2022-02-27 13:40:31.077689

[32m[I 2022-02-27 13:40:36,266][0m Trial 9 pruned. [0m
epoch 0 0.0393251755530033 8.195745369752505
Trial Id: 10 | Model params: 4624 | Timestamp: 2022-02-27 13:40:36.266627

epoch 0 -6.654633588734017 23.134624539454315
epoch 5 -0.07522157706742028 8.670601722492464
epoch 10 -0.010541412864988331 8.405766275596298
epoch 15 0.00020000898802174927 8.36097291269286
epoch 20 0.008624773870113844 8.325671728314342
epoch 25 0.010138644153078635 8.319312480039622
epoch 30 0.006719713463451571 8.33366733620726
epoch 35 0.00935271538481297 8.322614502919754
epoch 40 0.008983824571080157 8.324163919310383
epoch 45 0.008694171064319023 8.325380320805762
epoch 50 0.013309981228439294 8.305975001138867
epoch 55 0.010601695208846018 8.31736639080883
epoch 60 0.010874027204315184 8.316221634009183
epoch 65 0.012447673301568818 8.309603670616658
epoch 70 0.015606144898460461 8.296304797564117
epoch 75 0.01660167637390486 8.292108651001753
epoch 80 0.018546716039658073 8.283904211976289
epoch 85 0.020492508026182743 8.27568846104186
epoch 90 0.024147363137636102 8.260234413948977
epoch 95 0.022554603289815178 8.266972729315533
[32m[I 2022-02-27 13:57:20,813][0m Trial 10 finished with value: 8.261587568136985 and parameters: {'n_layers_mlp': 4, 'mlp_n_units_l0': 76, 'mlp_dropout_l0': 0.29885349361842434, 'mlp_n_units_l1': 16, 'mlp_dropout_l1': 0.17915913421529914, 'mlp_n_units_l2': 77, 'mlp_dropout_l2': 0.007620054801455167, 'mlp_n_units_l3': 10, 'mlp_dropout_l3': 0.2940621649272994, 'lr': 1.1887681311799578e-05, 'weight_decay': 0.1607225931604425, 'criterion': 'MSELoss', 'batch_size': 128}. Best is trial 3 with value: 8.191656361524407.[0m
Trial Id: 11 | Model params: 1095 | Timestamp: 2022-02-27 13:57:20.813246

[32m[I 2022-02-27 13:57:25,946][0m Trial 11 pruned. [0m
epoch 0 -0.02914945960927562 8.482804876120747
Trial Id: 12 | Model params: 5505 | Timestamp: 2022-02-27 13:57:25.947027

epoch 0 -6.654633588734017 23.134624539454315
epoch 5 -1.1381994191473677 12.227125104210751
epoch 10 0.01532921778636942 8.29747166291976
epoch 15 0.02422983322202188 8.259885367076171
epoch 20 0.029156812078104832 8.239005561451757
epoch 25 0.02945333408328432 8.237747256788388
epoch 30 0.03242063609413959 8.225144773641992
epoch 35 0.03263069294991161 8.224251905369105
epoch 40 0.03417084314729468 8.217702375245407
epoch 45 0.034524025686720305 8.216199721099793
epoch 50 0.03524489614197024 8.213131844856294
epoch 55 0.03637911187962484 8.20830253485745
epoch 60 0.03692479766974499 8.205978079041593
epoch 65 0.036199393690730886 8.209067935705763
epoch 70 0.0363925938878058 8.208245113525903
epoch 75 0.03742582460705712 8.203843276421287
epoch 80 0.03741798445227518 8.203876686454388
epoch 85 0.03766203654802913 8.202836619120047
epoch 90 0.038568050862612724 8.19897433906255
epoch 95 0.03902675838299452 8.197018204833608
[32m[I 2022-02-27 14:11:07,284][0m Trial 12 finished with value: 8.196746378649594 and parameters: {'n_layers_mlp': 2, 'mlp_n_units_l0': 69, 'mlp_dropout_l0': 0.26228452760222326, 'mlp_n_units_l1': 61, 'mlp_dropout_l1': 0.21550530295458536, 'lr': 1.4642600334359018e-05, 'weight_decay': 0.20388188476748578, 'criterion': 'MSELoss', 'batch_size': 128}. Best is trial 3 with value: 8.191656361524407.[0m
Trial Id: 13 | Model params: 5369 | Timestamp: 2022-02-27 14:11:07.284474

epoch 0 -5.1001562930186894 20.65240976554397
epoch 5 0.005278308340512683 8.339711871783493
epoch 10 0.01773851386583225 8.287314303807982
epoch 15 0.023976412249837153 8.260957900526522
epoch 20 0.027243922709496937 8.24711838064749
epoch 25 0.02922092146594224 8.238733526621807
epoch 30 0.03158526490735558 8.228694646033148
epoch 35 0.032799461707027744 8.223534466173202
epoch 40 0.03425612879087625 8.217339543214822
epoch 45 0.03457327165091262 8.215990176870989
epoch 50 0.03547297075724232 8.21216096758341
epoch 55 0.036129200998943345 8.2093668596122
epoch 60 0.036940973329148585 8.205909165594585
epoch 65 0.03713007228118237 8.205103501061249
epoch 70 0.037328786455906315 8.204256785188543
epoch 75 0.03803117779786058 8.201263213565525
epoch 80 0.037539844420227175 8.203357377046741
epoch 85 0.03829476538657672 8.20013952886296
epoch 90 0.038744134212407855 8.198223496022486
epoch 95 0.03901624124843328 8.197063059832612
[32m[I 2022-02-27 14:24:47,700][0m Trial 13 finished with value: 8.199755822987122 and parameters: {'n_layers_mlp': 2, 'mlp_n_units_l0': 71, 'mlp_dropout_l0': 0.22475841928334794, 'mlp_n_units_l1': 57, 'mlp_dropout_l1': 0.171533808939604, 'lr': 1.0111085872499736e-05, 'weight_decay': 0.12498991687787908, 'criterion': 'MSELoss', 'batch_size': 128}. Best is trial 3 with value: 8.191656361524407.[0m
Trial Id: 14 | Model params: 1857 | Timestamp: 2022-02-27 14:24:47.700220

[32m[I 2022-02-27 14:24:56,015][0m Trial 14 pruned. [0m
epoch 0 -0.7065017932397777 10.923294096701794
Trial Id: 15 | Model params: 5827 | Timestamp: 2022-02-27 14:24:56.015204

[32m[I 2022-02-27 14:25:05,879][0m Trial 15 pruned. [0m
epoch 0 -0.017476250377349123 8.434559235486972
Trial Id: 16 | Model params: 7101 | Timestamp: 2022-02-27 14:25:05.879869

[32m[I 2022-02-27 14:25:14,052][0m Trial 16 pruned. [0m
epoch 0 0.017150083963326734 8.28979621596188
Trial Id: 17 | Model params: 4785 | Timestamp: 2022-02-27 14:25:14.052941

[32m[I 2022-02-27 14:25:22,325][0m Trial 17 pruned. [0m
epoch 0 -0.08590262578669017 8.713561360468104
Trial Id: 18 | Model params: 2882 | Timestamp: 2022-02-27 14:25:22.325435

[32m[I 2022-02-27 14:25:30,525][0m Trial 18 pruned. [0m
epoch 0 0.0203972011143011 8.27609106701082
Trial Id: 19 | Model params: 3758 | Timestamp: 2022-02-27 14:25:30.525716

[32m[I 2022-02-27 14:25:40,618][0m Trial 19 pruned. [0m
epoch 0 -0.0360857728152284 8.511343287848455
Trial Id: 20 | Model params: 4999 | Timestamp: 2022-02-27 14:25:40.618362

epoch 0 -5.088549168206929 20.632752135075354
epoch 5 0.009433597934964677 8.322274741212405
epoch 10 0.021333384911124464 8.272135487063364
epoch 15 0.026271425676723803 8.251239811909699
epoch 20 0.028663080976538025 8.241100305632807
epoch 25 0.030846312647317964 8.23183351452085
epoch 30 0.032183241117763606 8.226153728756668
epoch 35 0.03315828048256775 8.22200891269441
epoch 40 0.03397508101206703 8.2185351485385
epoch 45 0.03463659880718528 8.215720708556587
epoch 50 0.034998164950099775 8.214182010983883
epoch 55 0.03542464322155714 8.21236669978115
epoch 60 0.036189737694373614 8.209109057557642
epoch 65 0.03644732519285088 8.208012002850507
epoch 70 0.03622968663150572 8.208938926260647
epoch 75 0.036753921602884265 8.206706030017571
epoch 80 0.03689232205825177 8.206116433714632
epoch 85 0.03759143530598619 8.203137511246357
epoch 90 0.03788562187087896 8.2018836584744
epoch 95 0.0377456565777855 8.202480228553924
[32m[I 2022-02-27 14:39:21,107][0m Trial 20 finished with value: 8.20191440228859 and parameters: {'n_layers_mlp': 2, 'mlp_n_units_l0': 72, 'mlp_dropout_l0': 0.1965817944354428, 'mlp_n_units_l1': 51, 'mlp_dropout_l1': 0.002454509736342536, 'lr': 1.1960994819988401e-05, 'weight_decay': 0.24016140738389524, 'criterion': 'MSELoss', 'batch_size': 128}. Best is trial 3 with value: 8.191656361524407.[0m
Trial Id: 21 | Model params: 5511 | Timestamp: 2022-02-27 14:39:21.107693

