[32m[I 2022-02-21 15:12:39,748][0m A new study created in memory with name: DeepSet[0m
Starting Loading south
Finished Loading south
Finished south setup

++++++++ Session Characteristics +++++++

Area: south
Gal Type: elg
Training Set: 232361
Validation Set: 58091
Test Samples: 132567
Number of features: 5
Device: cuda:0
Number of Workers: 8
Number of Trials: 25

+++++++++++++++++++++++++++++++++++++++

Trial Id: 0 | Model params: 132631 | Timestamp: 2022-02-21 15:12:39.794899

epoch 0 -13.927984141341918 30.508286473478996
epoch 5 -13.901667595836877 30.481383079825775
epoch 10 -13.898472570164564 30.478115189785367
epoch 15 -13.879033857774452 30.458225610851166
epoch 20 -13.878294602807262 30.457468953044117
epoch 25 -13.863784131797326 30.442613082757553
epoch 30 -13.895606567944935 30.475183528615123
epoch 35 -13.8874165323116 30.466804307679407
epoch 40 -13.862262160907536 30.441054463612286
epoch 45 -13.866986187004862 30.445891981238724
epoch 50 -13.870088980378679 30.449068898951186
epoch 55 -13.88843081514765 30.467842144912286
epoch 60 -13.906495615687192 30.486320540801653
epoch 65 -13.882399673977787 30.461670424314494
epoch 70 -13.860102225398958 30.438842380996352
epoch 75 -13.879864474487508 30.459075758730915
epoch 80 -13.867659924912298 30.44658184261699
epoch 85 -13.891221353021354 30.470697304229024
epoch 90 -13.856844092150405 30.435505282786732
epoch 95 -13.897775571570653 30.47740224918711
[32m[I 2022-02-21 16:17:51,978][0m Trial 0 finished with value: 30.47885737696068 and parameters: {'n_layers_fe': 2, 'fe_n_units_l0': 220, 'fe_dropout_l0': 0.4951299487872328, 'fe_n_units_l1': 189, 'fe_dropout_l1': 0.4047709038297272, 'n_units_l(Invariant)': 386, 'n_layers_mlp': 4, 'mlp_n_units_l0': 103, 'mlp_dropout_l0': 0.11643584425846054, 'mlp_n_units_l1': 16, 'mlp_dropout_l1': 0.04538173917797017, 'mlp_n_units_l2': 83, 'mlp_dropout_l2': 0.2627669503149981, 'mlp_n_units_l3': 122, 'mlp_dropout_l3': 0.4357075142352258, 'reduction': 'sum', 'lr': 0.001948882987880247, 'weight_decay': 0.2826530011861369, 'criterion': 'PoissonNLLLoss', 'batch_size': 128}. Best is trial 0 with value: 30.47885737696068.[0m

Trial Id: 1 | Model params: 29352 | Timestamp: 2022-02-21 16:17:51.979827

[32m[I 2022-02-21 16:18:14,316][0m Trial 1 pruned. [0m
++++++++++++++++++++
        NaN         
++++++++++++++++++++

Trial Id: 2 | Model params: 95717 | Timestamp: 2022-02-21 16:18:14.317383

[32m[I 2022-02-21 16:18:43,986][0m Trial 2 pruned. [0m
++++++++++++++++++++
        NaN         
++++++++++++++++++++

Trial Id: 3 | Model params: 51205 | Timestamp: 2022-02-21 16:18:43.987035

[32m[I 2022-02-21 16:19:06,696][0m Trial 3 pruned. [0m
++++++++++++++++++++
        NaN         
++++++++++++++++++++

Trial Id: 4 | Model params: 158067 | Timestamp: 2022-02-21 16:19:06.696968

epoch 0 -13.929856722960317 30.510199908824397
epoch 5 -13.838697908494712 30.416912605576876
epoch 10 -13.880067182934889 30.459283230073755
epoch 15 -13.844810776845293 30.423177152450595
epoch 20 -13.881543107040363 30.46079379031161
epoch 25 -13.893176854592792 30.472697930604756
epoch 30 -13.892956718743084 30.472472721500424
epoch 35 -13.913353019826605 30.493332013805546
epoch 40 -13.913459789505087 30.49344116958773
epoch 45 -13.881504408028572 30.46075418409013
epoch 50 -13.863783682096443 30.442612622239896
epoch 55 -13.894204403381666 30.47374913828475
epoch 60 -13.85699762698653 30.435662546947757
epoch 65 -13.836330905101669 30.414486523208517
epoch 70 -13.844390822211146 30.42274681875407
epoch 75 -13.915712409857594 30.495744040736238
epoch 80 -13.87315343347526 30.452206235141183
epoch 85 -13.896072546144223 30.47566020138505
epoch 90 -13.856174438440418 30.43481935384477
epoch 95 -13.86038505113833 30.439132044116075
[32m[I 2022-02-21 17:25:30,695][0m Trial 4 finished with value: 30.440678682756154 and parameters: {'n_layers_fe': 2, 'fe_n_units_l0': 150, 'fe_dropout_l0': 0.08298618430978821, 'fe_n_units_l1': 188, 'fe_dropout_l1': 0.14725127371352614, 'n_units_l(Invariant)': 366, 'n_layers_mlp': 4, 'mlp_n_units_l0': 59, 'mlp_dropout_l0': 0.1257012488141792, 'mlp_n_units_l1': 53, 'mlp_dropout_l1': 0.12125350769278703, 'mlp_n_units_l2': 219, 'mlp_dropout_l2': 0.41804746867835363, 'mlp_n_units_l3': 194, 'mlp_dropout_l3': 0.44592250394067245, 'reduction': 'sum', 'lr': 0.0010196056070927457, 'weight_decay': 0.2517146291004617, 'criterion': 'PoissonNLLLoss', 'batch_size': 32}. Best is trial 4 with value: 30.440678682756154.[0m

Trial Id: 5 | Model params: 64900 | Timestamp: 2022-02-21 17:25:30.696036

[32m[I 2022-02-21 17:25:47,843][0m Trial 5 pruned. [0m
++++++++++++++++++++
        NaN         
++++++++++++++++++++

Trial Id: 6 | Model params: 109548 | Timestamp: 2022-02-21 17:25:47.843574

[32m[I 2022-02-21 17:26:36,442][0m Trial 6 pruned. [0m
++++++++++++++++++++
        NaN         
++++++++++++++++++++

Trial Id: 7 | Model params: 223590 | Timestamp: 2022-02-21 17:26:36.442525

epoch 0 0.04343997841996228 7.722774364226848
epoch 5 0.0525494351229987 7.685913859754656
epoch 10 -0.008323277929972006 7.928976486023611
epoch 15 0.05367955751761477 7.681328599360126
epoch 20 0.008115478238315155 7.864077591707261
epoch 25 0.06706466157253455 7.626811367806623
epoch 30 0.05913565676718269 7.659152878938124
epoch 35 0.0633675090979825 7.641908664720984
epoch 40 0.0484079595999477 7.702693793371986
epoch 45 0.04876662721686098 7.7012420330148
epoch 50 0.06045047882210186 7.653799320841114
epoch 55 0.052983462308027085 7.684153199192702
epoch 60 0.020171617898834704 7.816138401231816
epoch 65 0.0432684954302871 7.7234665660014015
epoch 70 0.04502562152718548 7.716370875374853
epoch 75 0.03155987466462695 7.770583308451081
epoch 80 0.04832482678089178 7.70303024672454
epoch 85 0.04195186336933421 7.7287791680664855
epoch 90 -0.047602737037453435 8.08193857697003
epoch 95 0.05453957041664659 7.677837422930801
[32m[I 2022-02-21 18:58:28,257][0m Trial 7 finished with value: 7.760116949838537 and parameters: {'n_layers_fe': 4, 'fe_n_units_l0': 57, 'fe_dropout_l0': 0.13483231898344233, 'fe_n_units_l1': 207, 'fe_dropout_l1': 0.451207727459395, 'fe_n_units_l2': 213, 'fe_dropout_l2': 0.41198470873799253, 'fe_n_units_l3': 221, 'fe_dropout_l3': 0.07006607416608684, 'n_units_l(Invariant)': 456, 'n_layers_mlp': 2, 'mlp_n_units_l0': 238, 'mlp_dropout_l0': 0.476899594378988, 'mlp_n_units_l1': 52, 'mlp_dropout_l1': 0.1038072181201235, 'reduction': 'sum', 'lr': 0.004725752937692391, 'weight_decay': 0.24956132431943534, 'criterion': 'MSELoss', 'batch_size': 256}. Best is trial 7 with value: 7.760116949838537.[0m

Trial Id: 8 | Model params: 110915 | Timestamp: 2022-02-21 18:58:28.257487

[32m[I 2022-02-21 18:59:15,916][0m Trial 8 pruned. [0m
++++++++++++++++++++
        NaN         
++++++++++++++++++++

Trial Id: 9 | Model params: 129097 | Timestamp: 2022-02-21 18:59:15.917006

[32m[I 2022-02-21 18:59:50,087][0m Trial 9 pruned. [0m
++++++++++++++++++++
        NaN         
++++++++++++++++++++

Trial Id: 10 | Model params: 244080 | Timestamp: 2022-02-21 18:59:50.087927

epoch 0 -0.13176399485622836 8.40030722810776
epoch 5 0.05042672095829859 7.694518989572302
epoch 10 0.07718677626030435 7.585324032832597
epoch 15 0.07814619489905417 7.581379901127743
epoch 20 0.080198263981896 7.572937031598856
epoch 25 0.07523720455928473 7.593332333124628
epoch 30 0.08217188472041914 7.564808034295386
epoch 35 0.08287935127946977 7.5618919760888055
epoch 40 0.08263014586804718 7.56291928716648
epoch 45 0.08278075266189266 7.562298450448413
epoch 50 0.08311515009239134 7.5609198031364935
epoch 55 0.07706621953821013 7.585819491671626
epoch 60 0.08492514387912797 7.553453228444986
epoch 65 0.08543381191580424 7.551353545400919
epoch 70 0.08673472488432199 7.5459809710839805
epoch 75 0.08841840129022993 7.53902195734888
epoch 80 0.08930268129099472 7.535364454898113
epoch 85 0.09207726008574535 7.523876877879888
epoch 90 0.09269980608084705 7.5212969432589665
epoch 95 0.09325864794408034 7.51898025521199
[32m[I 2022-02-21 20:33:37,248][0m Trial 10 finished with value: 7.5169118730604065 and parameters: {'n_layers_fe': 4, 'fe_n_units_l0': 69, 'fe_dropout_l0': 0.14888726026463395, 'fe_n_units_l1': 255, 'fe_dropout_l1': 0.4924521433988181, 'fe_n_units_l2': 242, 'fe_dropout_l2': 0.45242535350230867, 'fe_n_units_l3': 239, 'fe_dropout_l3': 0.00048478538383353587, 'n_units_l(Invariant)': 291, 'n_layers_mlp': 2, 'mlp_n_units_l0': 253, 'mlp_dropout_l0': 0.48940751928009935, 'mlp_n_units_l1': 117, 'mlp_dropout_l1': 0.2886548497946372, 'reduction': 'sum', 'lr': 0.00043559821628051085, 'weight_decay': 0.022771176983960223, 'criterion': 'MSELoss', 'batch_size': 256}. Best is trial 10 with value: 7.5169118730604065.[0m

Trial Id: 11 | Model params: 256140 | Timestamp: 2022-02-21 20:33:37.248455

epoch 0 -0.26915853158583314 8.895598440400462
epoch 5 0.05751300058691733 7.665754690302515
epoch 10 0.07200926693281362 7.606573269841827
epoch 15 0.07621687133515409 7.589309189766289
epoch 20 0.07565211648498427 7.5916286975408
epoch 25 0.07897727405437038 7.577961708631259
epoch 30 0.0821925446958297 7.564722893284296
epoch 35 0.08205729186049482 7.56528026102114
epoch 40 0.08416501546226318 7.556589803859232
epoch 45 0.08384905108621166 7.557893208580491
epoch 50 0.08526022556625168 7.55207014181596
epoch 55 0.08488261811868814 7.55362874010313
epoch 60 0.08666106564885379 7.5462852747716225
epoch 65 0.08730262606048433 7.543634425128342
epoch 70 0.0864165141795582 7.54729548662515
epoch 75 0.08381521969229278 7.558032755290633
epoch 80 0.08920992994869359 7.535748170408717
epoch 85 0.08913552441523598 7.536055974550488
epoch 90 0.08719864550513501 7.544064123394041
epoch 95 0.09251876196041309 7.522047311591984
[32m[I 2022-02-21 22:10:20,417][0m Trial 11 finished with value: 7.518953671292029 and parameters: {'n_layers_fe': 4, 'fe_n_units_l0': 72, 'fe_dropout_l0': 0.15432872618291418, 'fe_n_units_l1': 255, 'fe_dropout_l1': 0.4961504991241487, 'fe_n_units_l2': 253, 'fe_dropout_l2': 0.4831621672386679, 'fe_n_units_l3': 253, 'fe_dropout_l3': 0.02322515601680699, 'n_units_l(Invariant)': 291, 'n_layers_mlp': 2, 'mlp_n_units_l0': 251, 'mlp_dropout_l0': 0.4986779701145137, 'mlp_n_units_l1': 111, 'mlp_dropout_l1': 0.3080880607058302, 'reduction': 'sum', 'lr': 0.0003872755906012736, 'weight_decay': 0.0038922834123180823, 'criterion': 'MSELoss', 'batch_size': 256}. Best is trial 10 with value: 7.5169118730604065.[0m

Trial Id: 12 | Model params: 257682 | Timestamp: 2022-02-21 22:10:20.417966

epoch 0 -0.8618641330102899 10.774353642650691
epoch 5 0.0548645406846936 7.676517810156347
epoch 10 0.07846015505248727 7.580088777805521
epoch 15 0.07912402164524135 7.577357981984454
epoch 20 0.08253485767480073 7.563312061246866
epoch 25 0.08063386044986764 7.571143636816904
epoch 30 0.08326555586535 7.560299631133422
epoch 35 0.0785310050206508 7.579797385428784
epoch 40 0.0843768967698526 7.5557156328725394
epoch 45 0.08372989071772374 7.558384706219732
epoch 50 0.08189807220972156 7.565936341755958
epoch 55 0.08139627601071775 7.568003671844785
epoch 60 0.08561586082277384 7.550601940927244
epoch 65 0.08683242128599977 7.545577345256406
epoch 70 0.08327332328911452 7.560267602133209
epoch 75 0.0869919943861267 7.544918033754451
epoch 80 0.07861923047528474 7.579434515336802
epoch 85 0.08924181074215398 7.535616280667446
epoch 90 0.08896112114059973 7.5367774045591025
epoch 95 0.09080900090059152 7.529130020866656
[32m[I 2022-02-21 23:46:14,371][0m Trial 12 finished with value: 7.5179124121368766 and parameters: {'n_layers_fe': 4, 'fe_n_units_l0': 83, 'fe_dropout_l0': 0.16568266584310587, 'fe_n_units_l1': 255, 'fe_dropout_l1': 0.4972851877412959, 'fe_n_units_l2': 251, 'fe_dropout_l2': 0.4842514572255143, 'fe_n_units_l3': 254, 'fe_dropout_l3': 0.010355723924523497, 'n_units_l(Invariant)': 279, 'n_layers_mlp': 2, 'mlp_n_units_l0': 256, 'mlp_dropout_l0': 0.38169899309788685, 'mlp_n_units_l1': 117, 'mlp_dropout_l1': 0.31949342286914123, 'reduction': 'sum', 'lr': 0.00033644849372999514, 'weight_decay': 0.008467810063080172, 'criterion': 'MSELoss', 'batch_size': 256}. Best is trial 10 with value: 7.5169118730604065.[0m

Trial Id: 13 | Model params: 120856 | Timestamp: 2022-02-21 23:46:14.371981

epoch 0 -0.969370061474885 11.08104960382785
epoch 5 -0.12563616131309874 8.377535010791183
epoch 10 0.03359239969607131 7.762424724203993
epoch 15 0.0724994093104373 7.6045642000282285
epoch 20 0.07900243983767186 7.577858178805356
epoch 25 0.08012929488967568 7.57322094539332
epoch 30 0.08090927995345953 7.570009487576753
epoch 35 0.07948468183564605 7.575874004191106
epoch 40 0.07653523655970051 7.588001317681486
epoch 45 0.07964761197571735 7.575203514079616
epoch 50 0.07927142250283625 7.576751519339402
epoch 55 0.07823898984586952 7.580998315975167
epoch 60 0.08154185344231457 7.56740397136391
epoch 65 0.08187677270423521 7.5660241042162575
epoch 70 0.08342776985520173 7.559630712979517
epoch 75 0.08000957827004784 7.573713737972467
epoch 80 0.07402822858109992 7.598294231463362
epoch 85 0.07861092010460702 7.57946869651922
epoch 90 0.07288924948935271 7.602965885011223
epoch 95 0.07570800512835929 7.591399188580998
[32m[I 2022-02-22 00:50:21,881][0m Trial 13 finished with value: 7.584465511536019 and parameters: {'n_layers_fe': 4, 'fe_n_units_l0': 95, 'fe_dropout_l0': 0.16797360295819352, 'fe_n_units_l1': 249, 'fe_dropout_l1': 0.48457358720812166, 'fe_n_units_l2': 11, 'fe_dropout_l2': 0.49624892486443545, 'fe_n_units_l3': 190, 'fe_dropout_l3': 0.4346903408318212, 'n_units_l(Invariant)': 289, 'n_layers_mlp': 2, 'mlp_n_units_l0': 189, 'mlp_dropout_l0': 0.37433286417025, 'mlp_n_units_l1': 165, 'mlp_dropout_l1': 0.3150567403793787, 'reduction': 'sum', 'lr': 0.00019772074910619206, 'weight_decay': 0.0017813677717773112, 'criterion': 'MSELoss', 'batch_size': 256}. Best is trial 10 with value: 7.5169118730604065.[0m

Trial Id: 14 | Model params: 174100 | Timestamp: 2022-02-22 00:50:21.881257

[32m[I 2022-02-22 00:51:03,500][0m Trial 14 pruned. [0m
epoch 0 -0.08194264195540502 8.213331505323366

Trial Id: 15 | Model params: 148809 | Timestamp: 2022-02-22 00:51:03.500333

epoch 0 -1.3036493136524316 11.984651690008796
epoch 5 -0.09900931254770717 8.277856996148666
epoch 10 0.047061919294743015 7.70813965251474
epoch 15 0.06596633580004263 7.631299492093464
epoch 20 0.07089905259556006 7.611122023460664
epoch 25 0.06627008130038625 7.630058551080416
epoch 30 0.06867611465417767 7.620221650395203
epoch 35 0.0719490556037744 7.606820036560898
epoch 40 0.06830407971484198 7.621743519252056
epoch 45 0.07321495270191802 7.601630268991924
epoch 50 0.07378802242075666 7.599279703584797
epoch 55 0.06567194542509258 7.632502020552811
epoch 60 0.06753317427363936 7.62489606533299
epoch 65 0.07377280350441484 7.599342136553592
epoch 70 0.0737509030775726 7.599431978362037
epoch 75 0.07423187281901966 7.597458658516915
epoch 80 0.06556601742195034 7.632934669866865
epoch 85 0.0727324611790684 7.603608745521269
epoch 90 0.07333018695009941 7.601157669988414
epoch 95 0.07048062423587698 7.612835696677842
[32m[I 2022-02-22 01:58:11,068][0m Trial 15 finished with value: 7.622151468787756 and parameters: {'n_layers_fe': 4, 'fe_n_units_l0': 90, 'fe_dropout_l0': 0.08272012412000372, 'fe_n_units_l1': 164, 'fe_dropout_l1': 0.49842101861130444, 'fe_n_units_l2': 168, 'fe_dropout_l2': 0.39736420794764743, 'fe_n_units_l3': 251, 'fe_dropout_l3': 0.10866725071580749, 'n_units_l(Invariant)': 138, 'n_layers_mlp': 2, 'mlp_n_units_l0': 251, 'mlp_dropout_l0': 0.39037714333155904, 'mlp_n_units_l1': 89, 'mlp_dropout_l1': 0.2223958395447468, 'reduction': 'sum', 'lr': 0.00010726991032522372, 'weight_decay': 0.046718711489666, 'criterion': 'MSELoss', 'batch_size': 256}. Best is trial 10 with value: 7.5169118730604065.[0m

Trial Id: 16 | Model params: 80300 | Timestamp: 2022-02-22 01:58:11.068400

epoch 0 -15.084035018494404 31.66756992954169
epoch 5 -14.746751202751035 31.333774680920616
epoch 10 -14.591828135625951 31.17925635433607
epoch 15 -14.442086344163071 31.029174480163142
epoch 20 -14.334946269853424 30.92134401860281
epoch 25 -14.27285267316211 30.85867783808336
epoch 30 -14.240544594708437 30.82602145038146
epoch 35 -14.19880384957832 30.783779412760655
epoch 40 -14.14266237019501 30.726872111295055
epoch 45 -14.099549187478907 30.683099177346502
epoch 50 -14.08276306874116 30.666039284890672
epoch 55 -14.036631827813874 30.619106710333725
epoch 60 -14.014811596409816 30.596882366489652
epoch 65 -13.98713564780733 30.568670613318112
epoch 70 -13.98558462600072 30.567088793329795
epoch 75 -13.955634909592979 30.53652830698696
epoch 80 -13.95674140088373 30.537657907230976
epoch 85 -13.950759741953801 30.531550824267725
epoch 90 -13.948751145282479 30.529499837151132
epoch 95 -13.938140356565045 30.518662825614243
[32m[I 2022-02-22 02:47:39,448][0m Trial 16 finished with value: 30.525148553089384 and parameters: {'n_layers_fe': 4, 'fe_n_units_l0': 41, 'fe_dropout_l0': 0.014280544157163844, 'fe_n_units_l1': 20, 'fe_dropout_l1': 0.40702495275936185, 'fe_n_units_l2': 192, 'fe_dropout_l2': 0.49140802297388436, 'fe_n_units_l3': 98, 'fe_dropout_l3': 0.37516097840529955, 'n_units_l(Invariant)': 263, 'n_layers_mlp': 2, 'mlp_n_units_l0': 162, 'mlp_dropout_l0': 0.42610993084749843, 'mlp_n_units_l1': 160, 'mlp_dropout_l1': 0.38440844086636977, 'reduction': 'sum', 'lr': 1.0942758852307133e-05, 'weight_decay': 0.000827448578854903, 'criterion': 'PoissonNLLLoss', 'batch_size': 256}. Best is trial 10 with value: 7.5169118730604065.[0m

Trial Id: 17 | Model params: 139596 | Timestamp: 2022-02-22 02:47:39.448892

[32m[I 2022-02-22 02:48:21,631][0m Trial 17 pruned. [0m
epoch 0 0.04480003866218718 7.71728219734613

Trial Id: 18 | Model params: 161344 | Timestamp: 2022-02-22 02:48:21.631934

[32m[I 2022-02-22 02:48:59,036][0m Trial 18 pruned. [0m
epoch 0 -0.618220873324117 10.0446806235471

Trial Id: 19 | Model params: 177331 | Timestamp: 2022-02-22 02:48:59.036517

[32m[I 2022-02-22 02:49:47,522][0m Trial 19 pruned. [0m
epoch 0 0.010472055745613607 7.85473006757832

Trial Id: 20 | Model params: 95855 | Timestamp: 2022-02-22 02:49:47.522770

[32m[I 2022-02-22 02:50:23,026][0m Trial 20 pruned. [0m
++++++++++++++++++++
        NaN         
++++++++++++++++++++

Trial Id: 21 | Model params: 242597 | Timestamp: 2022-02-22 02:50:23.027094

[32m[I 2022-02-22 02:51:17,471][0m Trial 21 pruned. [0m
epoch 0 -0.6823095859581443 10.241656201019772

Trial Id: 22 | Model params: 234495 | Timestamp: 2022-02-22 02:51:17.471918

[32m[I 2022-02-22 02:52:12,057][0m Trial 22 pruned. [0m
epoch 0 -0.2535345468798258 8.840674218241245

Trial Id: 23 | Model params: 275825 | Timestamp: 2022-02-22 02:52:12.057870

epoch 0 -1.2202514744344737 11.765714797565836
epoch 5 -0.002214286579061975 7.904920888386304
epoch 10 0.07447513868072275 7.59646039356108
epoch 15 0.0690361614817121 7.61874853137879
epoch 20 0.0803363680082626 7.572368489316865
epoch 25 0.07991830819146839 7.57408941378828
epoch 30 0.08117511164617852 7.5689146587841725
epoch 35 0.06447669157136571 7.637382459312825
epoch 40 0.08284554639521369 7.562031339719861
epoch 45 0.08292852969394116 7.561689229130834
epoch 50 0.08362509093355286 7.558816944720838
epoch 55 0.0841311353856129 7.556729575476596
epoch 60 0.08439769708622824 7.555629810350354
epoch 65 0.08400404549964313 7.557253859368494
epoch 70 0.08457380034088857 7.554903165724355
epoch 75 0.0852439316360073 7.5521374026695725
epoch 80 0.08419046248106965 7.556484820962827
epoch 85 0.0838828703329757 7.557753709399356
epoch 90 0.07811065748438206 7.581526030613425
epoch 95 0.083799636405397 7.558097031894275
[32m[I 2022-02-22 04:30:47,714][0m Trial 23 finished with value: 7.554774188812197 and parameters: {'n_layers_fe': 4, 'fe_n_units_l0': 82, 'fe_dropout_l0': 0.18249389811313116, 'fe_n_units_l1': 185, 'fe_dropout_l1': 0.49172751532058, 'fe_n_units_l2': 254, 'fe_dropout_l2': 0.4920547750019553, 'fe_n_units_l3': 255, 'fe_dropout_l3': 0.0003564458069724892, 'n_units_l(Invariant)': 423, 'n_layers_mlp': 2, 'mlp_n_units_l0': 239, 'mlp_dropout_l0': 0.4831124309725972, 'mlp_n_units_l1': 139, 'mlp_dropout_l1': 0.23199411989350877, 'reduction': 'sum', 'lr': 0.00017568542190752885, 'weight_decay': 0.001545880522863488, 'criterion': 'MSELoss', 'batch_size': 256}. Best is trial 10 with value: 7.5169118730604065.[0m

Trial Id: 24 | Model params: 217546 | Timestamp: 2022-02-22 04:30:47.714460

[32m[I 2022-02-22 04:31:38,958][0m Trial 24 pruned. [0m
epoch 0 0.020621424839933233 7.814344129421583

Study statistics: 
  Number of finished trials:  25
  Number of pruned trials:  15
  Number of complete trials:  10

Best trial:
  Value:  7.5169118730604065
  Params: 
    n_layers_fe: 4
    fe_n_units_l0: 69
    fe_dropout_l0: 0.14888726026463395
    fe_n_units_l1: 255
    fe_dropout_l1: 0.4924521433988181
    fe_n_units_l2: 242
    fe_dropout_l2: 0.45242535350230867
    fe_n_units_l3: 239
    fe_dropout_l3: 0.00048478538383353587
    n_units_l(Invariant): 291
    n_layers_mlp: 2
    mlp_n_units_l0: 253
    mlp_dropout_l0: 0.48940751928009935
    mlp_n_units_l1: 117
    mlp_dropout_l1: 0.2886548497946372
    reduction: sum
    lr: 0.00043559821628051085
    weight_decay: 0.022771176983960223
    criterion: MSELoss
    batch_size: 256
Target: 132567, NaN: 0, Max: 365.0, Min: 0.0, Mean: 32.88284414673335
Prediction: 132567, NaN: 0, Max: 41.7061653137207, Min: 27.134571075439453, Mean: 32.72609608703939

 XXXXXX======== TRIAL south - elg ended

Test Set - R-squared:  0.0968311539466602
Test Set - RMSE:  7.529598762585652
Test Set - MAE:  5.885275255772558



./hp_optim.sh: line 11: one: command not found
