[32m[I 2022-02-26 18:38:19,940][0m A new study created in memory with name: DeepSet[0m
Starting Loading south
Finished Loading south
Finished south setup

++++++++ Session Characteristics +++++++

Area: south
Gal Type: elg
Training Set: 216650
Validation Set: 54162
Test Samples: 132567
Number of features: 5
Device: cuda:0
Number of Workers: 8
Number of Trials: 30

+++++++++++++++++++++++++++++++++++++++

Trial Id: 0 | Model params: 150212 | Timestamp: 2022-02-26 18:38:19.941633

[32m[I 2022-02-26 18:39:39,854][0m Trial 0 pruned. [0m
++++++++++++++++++++
        NaN         
++++++++++++++++++++

Trial Id: 1 | Model params: 78658 | Timestamp: 2022-02-26 18:39:39.855133

epoch 0 -13.902148512427205 30.412542387392588
epoch 5 -13.987642532902642 30.499656402577173
epoch 10 -13.941937829248628 30.453116657949572
epoch 15 -13.918273364393452 30.428991866360505
epoch 20 -13.924222953582882 30.435058987869493
epoch 25 -13.940272123146762 30.45141917544728
epoch 30 -13.926676278822695 30.437560425643785
epoch 35 -13.924249510610181 30.435086066811404
epoch 40 -13.933310951917525 30.444324182835615
epoch 45 -13.919520101789876 30.430263332856416
epoch 50 -13.921183430055864 30.4319595706086
epoch 55 -13.968339072614478 30.4800089297314
epoch 60 -13.94630967995359 30.457571459726246
epoch 65 -13.957058296245373 30.46852124997007
epoch 70 -13.948343673812788 30.459643824314057
epoch 75 -13.953340695214571 30.46473451453769
epoch 80 -13.9251987071679 30.436053901729416
epoch 85 -13.93451420709449 30.445550687557706
epoch 90 -13.947348207758514 30.458629596686666
epoch 95 -13.925084267092075 30.435937216147487
[32m[I 2022-02-26 20:11:41,134][0m Trial 1 finished with value: 30.453118801196037 and parameters: {'n_layers_fe': 2, 'fe_n_units_l0': 184, 'fe_dropout_l0': 0.07503048435935583, 'fe_n_units_l1': 218, 'fe_dropout_l1': 0.08758166737423878, 'n_units_l(Invariant)': 107, 'n_layers_mlp': 2, 'mlp_n_units_l0': 174, 'mlp_dropout_l0': 0.22545120044599404, 'mlp_n_units_l1': 55, 'mlp_dropout_l1': 0.2355464194934221, 'reduction': 'sum', 'lr': 0.0010174413664058924, 'weight_decay': 0.196271364375167, 'criterion': 'PoissonNLLLoss', 'batch_size': 32}. Best is trial 1 with value: 30.453118801196037.[0m

Trial Id: 2 | Model params: 237128 | Timestamp: 2022-02-26 20:11:41.135100

epoch 0 -14.209067700503974 30.72412902027946
epoch 5 -13.99727225075277 30.509453004122673
epoch 10 -13.956561068419662 30.46801480270669
epoch 15 -13.945576830843262 30.45682475106569
epoch 20 -13.94947358003038 30.460794984982897
epoch 25 -13.93738636839117 30.4484781456345
epoch 30 -13.945825687524579 30.457078316146053
epoch 35 -13.942233867943816 30.45341833422373
epoch 40 -13.944345689718462 30.455570285542738
epoch 45 -13.938220400977986 30.449328182846223
epoch 50 -13.940761292355207 30.451917686269713
epoch 55 -13.942873454615958 30.45407009058877
epoch 60 -13.938644318733793 30.449760226253932
epoch 65 -13.951583689255111 30.462944670595256
epoch 70 -13.93784710560544 30.448947727075243
epoch 75 -13.934667518615251 30.445706957846536
epoch 80 -13.930389928648307 30.4413465133565
epoch 85 -13.937602613403621 30.44869854254811
epoch 90 -13.931771816167654 30.44275523555648
epoch 95 -13.93189719925056 30.442883050210284
[32m[I 2022-02-26 22:10:35,999][0m Trial 2 finished with value: 30.449775426083328 and parameters: {'n_layers_fe': 4, 'fe_n_units_l0': 87, 'fe_dropout_l0': 0.19544348739824857, 'fe_n_units_l1': 215, 'fe_dropout_l1': 0.07474658611152912, 'fe_n_units_l2': 82, 'fe_dropout_l2': 0.27996639470319695, 'fe_n_units_l3': 156, 'fe_dropout_l3': 0.29696631789639305, 'n_units_l(Invariant)': 436, 'n_layers_mlp': 4, 'mlp_n_units_l0': 116, 'mlp_dropout_l0': 0.282110096062869, 'mlp_n_units_l1': 219, 'mlp_dropout_l1': 0.18477894843357356, 'mlp_n_units_l2': 193, 'mlp_dropout_l2': 0.46975334996448004, 'mlp_n_units_l3': 243, 'mlp_dropout_l3': 0.4065285812843249, 'reduction': 'sum', 'lr': 1.719886717630539e-05, 'weight_decay': 0.15792540310941208, 'criterion': 'PoissonNLLLoss', 'batch_size': 32}. Best is trial 2 with value: 30.449775426083328.[0m

Trial Id: 3 | Model params: 125162 | Timestamp: 2022-02-26 22:10:35.999448

[32m[I 2022-02-26 22:11:46,092][0m Trial 3 pruned. [0m
++++++++++++++++++++
        NaN         
++++++++++++++++++++

Trial Id: 4 | Model params: 8600 | Timestamp: 2022-02-26 22:11:46.092260

epoch 0 0.005814832124201197 7.85528458471144
epoch 5 0.07265334389305889 7.586637594623961
epoch 10 0.059833275536370856 7.638898186485442
epoch 15 0.07821692362160337 7.56384549143657
epoch 20 0.07953636877992998 7.55843008866409
epoch 25 0.07069535164188845 7.594642554167867
epoch 30 0.06780174638824343 7.606457203676287
epoch 35 0.07899734500915445 7.560642874191216
epoch 40 0.078903050297778 7.561029903689355
epoch 45 0.06315780442197294 7.62538025009269
epoch 50 0.07723580917028927 7.567869770410208
epoch 55 0.07253590408671717 7.587117967868127
epoch 60 0.0733513260384131 7.583781955726943
epoch 65 0.06671925085660635 7.610872341182018
epoch 70 0.07346245765747006 7.5833271861570966
epoch 75 0.07759559841026265 7.566394256078949
epoch 80 0.06933854544647577 7.600184708532586
epoch 85 0.07237210126604654 7.587787932592767
epoch 90 0.08136641921033005 7.550912577976113
epoch 95 0.07887476259411552 7.5611460057626765
[32m[I 2022-02-26 23:42:21,891][0m Trial 4 finished with value: 7.578497550959513 and parameters: {'n_layers_fe': 2, 'fe_n_units_l0': 18, 'fe_dropout_l0': 0.1581451129257066, 'fe_n_units_l1': 124, 'fe_dropout_l1': 0.009087615904969149, 'n_units_l(Invariant)': 21, 'n_layers_mlp': 2, 'mlp_n_units_l0': 29, 'mlp_dropout_l0': 0.3708278856653391, 'mlp_n_units_l1': 91, 'mlp_dropout_l1': 0.11107527777089726, 'reduction': 'sum', 'lr': 0.0030497797731918637, 'weight_decay': 0.0968694298899699, 'criterion': 'MSELoss', 'batch_size': 32}. Best is trial 4 with value: 7.578497550959513.[0m

Trial Id: 5 | Model params: 115789 | Timestamp: 2022-02-26 23:42:21.891714

[32m[I 2022-02-26 23:43:32,204][0m Trial 5 pruned. [0m
++++++++++++++++++++
        NaN         
++++++++++++++++++++

Trial Id: 6 | Model params: 130538 | Timestamp: 2022-02-26 23:43:32.204932

[32m[I 2022-02-26 23:44:05,036][0m Trial 6 pruned. [0m
++++++++++++++++++++
        NaN         
++++++++++++++++++++

Trial Id: 7 | Model params: 236148 | Timestamp: 2022-02-26 23:44:05.036387

[32m[I 2022-02-26 23:45:29,216][0m Trial 7 pruned. [0m
++++++++++++++++++++
        NaN         
++++++++++++++++++++

Trial Id: 8 | Model params: 52981 | Timestamp: 2022-02-26 23:45:29.216846

[32m[I 2022-02-26 23:46:32,509][0m Trial 8 pruned. [0m
++++++++++++++++++++
        NaN         
++++++++++++++++++++

Trial Id: 9 | Model params: 115202 | Timestamp: 2022-02-26 23:46:32.509256

epoch 0 -1.1516350275372091 11.556134463701769
epoch 5 -0.1482696985062626 8.442095016476985
epoch 10 0.031065471753896956 7.754887463178947
epoch 15 0.06996998238122965 7.59760597724224
epoch 20 0.08027633302451687 7.55539135235489
epoch 25 0.07792051815773637 7.565061496041252
epoch 30 0.07956463004680858 7.558314053417103
epoch 35 0.08100250455801683 7.552408068503786
epoch 40 0.07457013381198907 7.578792894600437
epoch 45 0.08151536064754628 7.550300424564497
epoch 50 0.08211559042968608 7.547832960423847
epoch 55 0.08139765714452118 7.55078419331852
epoch 60 0.08346733648033522 7.542273157689437
epoch 65 0.08500291499172519 7.535952265812648
epoch 70 0.08249751723776788 7.5462624905183056
epoch 75 0.07943359964465968 7.55885202366376
epoch 80 0.08456943027648167 7.5377371530875275
epoch 85 0.0854860363862191 7.533962499648403
epoch 90 0.08470085459373433 7.537196053877051
epoch 95 0.0840612995076131 7.539828859954876
[32m[I 2022-02-27 00:49:59,859][0m Trial 9 finished with value: 7.545352788513843 and parameters: {'n_layers_fe': 4, 'fe_n_units_l0': 187, 'fe_dropout_l0': 0.222804288940959, 'fe_n_units_l1': 142, 'fe_dropout_l1': 0.246416829384017, 'fe_n_units_l2': 94, 'fe_dropout_l2': 0.32098047378083455, 'fe_n_units_l3': 250, 'fe_dropout_l3': 0.30659806991943034, 'n_units_l(Invariant)': 133, 'n_layers_mlp': 2, 'mlp_n_units_l0': 174, 'mlp_dropout_l0': 0.4716626774752141, 'mlp_n_units_l1': 72, 'mlp_dropout_l1': 0.3107500117526633, 'reduction': 'sum', 'lr': 7.036439214832173e-05, 'weight_decay': 0.055852723877402775, 'criterion': 'MSELoss', 'batch_size': 128}. Best is trial 9 with value: 7.545352788513843.[0m

Trial Id: 10 | Model params: 90295 | Timestamp: 2022-02-27 00:49:59.859897

epoch 0 -1.739710936463522 13.040091996813189
epoch 5 -0.9135012350550777 10.897895950200468
epoch 10 -0.24178239275350588 8.779120952821186
epoch 15 -0.23372105884202665 8.750578650362486
epoch 20 -0.0584286599215218 8.105113095146772
epoch 25 0.0025284702510012247 7.868257021899577
epoch 30 -0.006655140118568825 7.904395119939578
epoch 35 0.026274488328565715 7.774036189005463
epoch 40 0.006702822162274913 7.851775694737719
epoch 45 -0.017712744398724833 7.947689470547494
epoch 50 -0.004552786728391212 7.8961368214005745
epoch 55 0.03622711684063107 7.7342042143736
epoch 60 0.029161476860979252 7.762503054959942
epoch 65 0.035012302191980704 7.739077076984214
epoch 70 0.0735778512671067 7.582854946930612
epoch 75 0.025412290922336322 7.777477236125547
epoch 80 0.06501946651993562 7.6178000296059425
epoch 85 0.06299775241238748 7.626031589943063
epoch 90 0.04734303844244403 7.689472646105228
epoch 95 0.06306212275907219 7.625769638208345
[32m[I 2022-02-27 01:46:22,248][0m Trial 10 finished with value: 7.706446974031172 and parameters: {'n_layers_fe': 4, 'fe_n_units_l0': 143, 'fe_dropout_l0': 0.011015781487050402, 'fe_n_units_l1': 71, 'fe_dropout_l1': 0.26001710929881566, 'fe_n_units_l2': 23, 'fe_dropout_l2': 0.4811520325016022, 'fe_n_units_l3': 256, 'fe_dropout_l3': 0.013945788238588441, 'n_units_l(Invariant)': 249, 'n_layers_mlp': 2, 'mlp_n_units_l0': 193, 'mlp_dropout_l0': 0.4796756468270923, 'mlp_n_units_l1': 14, 'mlp_dropout_l1': 0.490734291069576, 'reduction': 'sum', 'lr': 7.138072062938071e-05, 'weight_decay': 0.002022170269800831, 'criterion': 'MSELoss', 'batch_size': 128}. Best is trial 9 with value: 7.545352788513843.[0m

Trial Id: 11 | Model params: 24690 | Timestamp: 2022-02-27 01:46:22.249112

[32m[I 2022-02-27 01:46:38,265][0m Trial 11 pruned. [0m
epoch 0 0.03821003103006071 7.726243749791332

Trial Id: 12 | Model params: 30114 | Timestamp: 2022-02-27 01:46:38.265640

[32m[I 2022-02-27 01:46:57,955][0m Trial 12 pruned. [0m
epoch 0 0.05427700132547808 7.66143742714997

Trial Id: 13 | Model params: 71818 | Timestamp: 2022-02-27 01:46:57.955758

[32m[I 2022-02-27 01:47:18,523][0m Trial 13 pruned. [0m
epoch 0 -0.9172211874932672 10.908483863645062

Trial Id: 14 | Model params: 74600 | Timestamp: 2022-02-27 01:47:18.523430

[32m[I 2022-02-27 01:47:48,529][0m Trial 14 pruned. [0m
epoch 0 0.06171903859005223 7.631233385007585

Trial Id: 15 | Model params: 23814 | Timestamp: 2022-02-27 01:47:48.529647

[32m[I 2022-02-27 01:48:04,923][0m Trial 15 pruned. [0m
epoch 0 0.011614097558193315 7.8323404145453335

Trial Id: 16 | Model params: 65901 | Timestamp: 2022-02-27 01:48:04.923966

epoch 0 -2.6616322417993983 15.075288961663924
epoch 5 -1.3137532559490883 11.983586225187885
epoch 10 -0.22800529987484341 8.730284653125633
epoch 15 -0.3330364438206932 9.095975774296521
epoch 20 -0.4213494577911394 9.392446235103511
epoch 25 -0.5574677926809242 9.831908335589612
epoch 30 -0.5342957368603993 9.758494525114363
epoch 35 -0.6344921528684739 10.072092453547128
epoch 40 -0.6261566968240415 10.046377189331581
epoch 45 -0.5953320395961383 9.95070445120545
epoch 50 -0.6457127960649309 10.106605332147165
epoch 55 -0.6598041847195635 10.14978192511076
epoch 60 -0.7428433866205466 10.400577752321869
epoch 65 -0.741250128088838 10.395822707135336
epoch 70 -0.7432889673349969 10.401907189244989
epoch 75 -0.5938445940873398 9.9460644822419
epoch 80 -0.6451157112224424 10.104771765465797
epoch 85 -0.6068863951271761 9.986673938104001
epoch 90 -0.7995162243690577 10.568325160134181
epoch 95 -0.7506273645645907 10.423777678141086
[32m[I 2022-02-27 02:28:07,569][0m Trial 16 finished with value: 10.43763754530039 and parameters: {'n_layers_fe': 2, 'fe_n_units_l0': 120, 'fe_dropout_l0': 0.49781528491867505, 'fe_n_units_l1': 179, 'fe_dropout_l1': 0.010016299553798375, 'n_units_l(Invariant)': 226, 'n_layers_mlp': 2, 'mlp_n_units_l0': 18, 'mlp_dropout_l0': 0.3031894167850817, 'mlp_n_units_l1': 110, 'mlp_dropout_l1': 0.28439069605096734, 'reduction': 'sum', 'lr': 0.0001452215053949672, 'weight_decay': 0.2857142637066672, 'criterion': 'MSELoss', 'batch_size': 256}. Best is trial 9 with value: 7.545352788513843.[0m

Trial Id: 17 | Model params: 170634 | Timestamp: 2022-02-27 02:28:07.569395

[32m[I 2022-02-27 02:28:55,534][0m Trial 17 pruned. [0m
epoch 0 -0.9545294805297215 11.01410966453898

Trial Id: 18 | Model params: 48597 | Timestamp: 2022-02-27 02:28:55.534998

[32m[I 2022-02-27 02:29:24,175][0m Trial 18 pruned. [0m
epoch 0 -1.0586461823604205 11.303661386157524

Trial Id: 19 | Model params: 50347 | Timestamp: 2022-02-27 02:29:24.175251

[32m[I 2022-02-27 02:29:47,643][0m Trial 19 pruned. [0m
++++++++++++++++++++
        NaN         
++++++++++++++++++++

Trial Id: 20 | Model params: 58126 | Timestamp: 2022-02-27 02:29:47.643646

[32m[I 2022-02-27 02:30:43,935][0m Trial 20 pruned. [0m
++++++++++++++++++++
        NaN         
++++++++++++++++++++

Trial Id: 21 | Model params: 91979 | Timestamp: 2022-02-27 02:30:43.935286

epoch 0 -17.42769238090879 33.81923352338798
epoch 5 -0.7788035392027617 10.50732767426217
epoch 10 -0.06590430571835659 8.133685801619126
epoch 15 0.01078739962819053 7.835615262061821
epoch 20 0.02959449190111807 7.760771739516427
epoch 25 0.02831659147632659 7.765880032157528
epoch 30 0.052579663011420585 7.668309535458732
epoch 35 0.05697974732250677 7.650481928063456
epoch 40 0.014975766201880458 7.819009508447483
epoch 45 0.05121977020003432 7.673810968807421
epoch 50 0.059819761070489474 7.638953089118793
epoch 55 0.0670887189371282 7.609365692322895
epoch 60 0.05186531054287924 7.671199933440195
epoch 65 0.06121294526566223 7.633291188470373
epoch 70 0.07316572363899765 7.584541411652519
epoch 75 0.07691038334163947 7.569204110873533
epoch 80 0.04493457347743357 7.69918660177743
epoch 85 0.07476883984834304 7.577979200986953
epoch 90 0.07109548612565986 7.593007350056271
epoch 95 0.07675536783317327 7.569839636800072
[32m[I 2022-02-27 03:28:30,381][0m Trial 21 finished with value: 7.55780704319288 and parameters: {'n_layers_fe': 4, 'fe_n_units_l0': 146, 'fe_dropout_l0': 0.007656623612438296, 'fe_n_units_l1': 65, 'fe_dropout_l1': 0.28651404681409653, 'fe_n_units_l2': 18, 'fe_dropout_l2': 0.47707558775563874, 'fe_n_units_l3': 252, 'fe_dropout_l3': 0.044896843202396064, 'n_units_l(Invariant)': 266, 'n_layers_mlp': 2, 'mlp_n_units_l0': 181, 'mlp_dropout_l0': 0.47058851492149956, 'mlp_n_units_l1': 21, 'mlp_dropout_l1': 0.49625116870835784, 'reduction': 'sum', 'lr': 6.890847045436519e-05, 'weight_decay': 0.0005688001431767911, 'criterion': 'MSELoss', 'batch_size': 128}. Best is trial 9 with value: 7.545352788513843.[0m

Trial Id: 22 | Model params: 93597 | Timestamp: 2022-02-27 03:28:30.381370

[32m[I 2022-02-27 03:29:04,652][0m Trial 22 pruned. [0m
epoch 0 -0.8643505164062084 10.757022259816162

Trial Id: 23 | Model params: 147173 | Timestamp: 2022-02-27 03:29:04.652628

[32m[I 2022-02-27 03:29:48,383][0m Trial 23 pruned. [0m
epoch 0 -0.8813164455719116 10.805856841153883

Trial Id: 24 | Model params: 69551 | Timestamp: 2022-02-27 03:29:48.383611

[32m[I 2022-02-27 03:30:22,800][0m Trial 24 pruned. [0m
epoch 0 0.021666918471172414 7.792407455285837

Trial Id: 25 | Model params: 104062 | Timestamp: 2022-02-27 03:30:22.800289

[32m[I 2022-02-27 03:30:50,148][0m Trial 25 pruned. [0m
epoch 0 -0.7529443434129119 10.430673402184562

Trial Id: 26 | Model params: 87994 | Timestamp: 2022-02-27 03:30:50.148309

[32m[I 2022-02-27 03:31:30,436][0m Trial 26 pruned. [0m
epoch 0 -1.1390765317898 11.522360135946334

Trial Id: 27 | Model params: 105503 | Timestamp: 2022-02-27 03:31:30.436798

[32m[I 2022-02-27 03:32:06,085][0m Trial 27 pruned. [0m
epoch 0 -0.5894582811853988 9.932369104435397

Trial Id: 28 | Model params: 165631 | Timestamp: 2022-02-27 03:32:06.086076

[32m[I 2022-02-27 03:33:06,602][0m Trial 28 pruned. [0m
epoch 0 -0.9919769336513271 11.119120485331141

Trial Id: 29 | Model params: 150407 | Timestamp: 2022-02-27 03:33:06.602903

[32m[I 2022-02-27 03:34:14,946][0m Trial 29 pruned. [0m
++++++++++++++++++++
        NaN         
++++++++++++++++++++

Study statistics: 
  Number of finished trials:  30
  Number of pruned trials:  23
  Number of complete trials:  7

Best trial:
  Value:  7.545352788513843
  Params: 
    n_layers_fe: 4
    fe_n_units_l0: 187
    fe_dropout_l0: 0.222804288940959
    fe_n_units_l1: 142
    fe_dropout_l1: 0.246416829384017
    fe_n_units_l2: 94
    fe_dropout_l2: 0.32098047378083455
    fe_n_units_l3: 250
    fe_dropout_l3: 0.30659806991943034
    n_units_l(Invariant): 133
    n_layers_mlp: 2
    mlp_n_units_l0: 174
    mlp_dropout_l0: 0.4716626774752141
    mlp_n_units_l1: 72
    mlp_dropout_l1: 0.3107500117526633
    reduction: sum
    lr: 7.036439214832173e-05
    weight_decay: 0.055852723877402775
    criterion: MSELoss
    batch_size: 128
Target: 132567, NaN: 0, Max: 365.0, Min: 0.0, Mean: 32.88284414673335
Prediction: 132567, NaN: 0, Max: 40.646488189697266, Min: 25.673324584960938, Mean: 32.34010073906764

 XXXXXX======== TRIAL south - elg ended

Test Set - R-squared:  0.08510314376047212
Test Set - RMSE:  7.578328510933715
Test Set - MAE:  5.906042080150994



