[32m[I 2022-03-04 12:36:33,377][0m A new study created in memory with name: DeepSet[0m
Starting Loading south
Finished Loading south
Finished south setup

++++++++ Session Characteristics +++++++

Area: south
Gal Type: elg
Training Set: 530265
Validation Set: 132567
Test Samples: 132567
Number of features: 5
Device: cuda:0
Number of Workers: 8
Number of Trials: 15

+++++++++++++++++++++++++++++++++++++++

Trial Id: 0 | Model params: 385404 | Timestamp: 2022-03-04 12:36:33.377813

epoch 0 -49.5045032842482 56.30570646246479
epoch 5 -58.90398755357908 61.32184683577807
epoch 10 -17.150036214904397 33.75406697492609
epoch 15 -15.598430658778437 32.27905962435393
epoch 20 -17.052501156470477 33.66325063411118
[32m[I 2022-03-04 13:58:27,568][0m Trial 0 pruned. [0m
++++++++++++++++++++
        NaN         
++++++++++++++++++++

Trial Id: 1 | Model params: 309810 | Timestamp: 2022-03-04 13:58:27.568256

epoch 0 0.026751990465502473 7.816262242414807
epoch 5 0.07382923377912742 7.624877911227709
epoch 10 0.0609991969671162 7.677509131541739
epoch 15 0.08665000345855356 7.571919280177346
epoch 20 0.08850994093448539 7.56420565803335
epoch 25 0.08674752091144278 7.571515046315772
epoch 30 0.08781785196505187 7.5670768412557035
epoch 35 0.0844968276435688 7.580839232041107
epoch 40 0.08743017869467085 7.568684657091657
epoch 45 0.08321719360564295 7.586135397481407
[32m[I 2022-03-04 14:58:22,923][0m Trial 1 finished with value: 7.5632158549586475 and parameters: {'n_layers_fe': 2, 'fe_neurons': 256, 'fe_dropout': 0.07489091466503517, 'n_units_l(Invariant)': 24, 'n_layers_mlp': 4, 'initialiser': 'uniform', 'lr': 0.0033863034929727583, 'weight_decay': 0.19920023829513325, 'criterion': 'MSELoss', 'batch_size': 256, 'epochs': 50}. Best is trial 1 with value: 7.5632158549586475.[0m

Trial Id: 2 | Model params: 419202 | Timestamp: 2022-03-04 14:58:22.924126

epoch 0 0.06864632105926416 7.646182806864051
epoch 5 0.07908649519065292 7.603206408886414
epoch 10 0.0926485481747793 7.547013538282822
epoch 15 0.09390061132199912 7.541804641794461
epoch 20 0.0833993943127681 7.585381528677774
epoch 25 0.10167130390856449 7.509395815123499
epoch 30 0.1019298415880977 7.508315140819788
epoch 35 0.09428763990291744 7.540193777830174
epoch 40 0.10127711164792863 7.5110432193886965
epoch 45 0.09897718149410395 7.5206478689733585
[32m[I 2022-03-04 17:47:49,893][0m Trial 2 finished with value: 7.505256535285676 and parameters: {'n_layers_fe': 4, 'fe_neurons': 256, 'fe_dropout': 0.34871788089305367, 'n_units_l(Invariant)': 448, 'n_layers_mlp': 2, 'initialiser': 'uniform', 'lr': 0.0005128669363635782, 'weight_decay': 0.06584407868485413, 'criterion': 'MSELoss', 'batch_size': 128, 'epochs': 50}. Best is trial 2 with value: 7.505256535285676.[0m

Trial Id: 3 | Model params: 242468 | Timestamp: 2022-03-04 17:47:49.893788

[32m[I 2022-03-04 17:50:16,544][0m Trial 3 pruned. [0m
++++++++++++++++++++
        NaN         
++++++++++++++++++++

Trial Id: 4 | Model params: 105122 | Timestamp: 2022-03-04 17:50:16.544616

epoch 0 -13.88587174467675 30.56852589325627
epoch 5 -13.874727793989873 30.55708155427221
epoch 10 -13.746203264900181 30.424781490762733
epoch 15 -13.81401682622787 30.4946586705349
epoch 20 -13.774567162977219 30.454028030094054
epoch 25 -13.758681367361122 30.437651354795296
epoch 30 -13.771480210216682 30.450846378275735
epoch 35 -13.802839368778965 30.48315209966537
epoch 40 -13.79051273220576 30.470457474482803
epoch 45 -13.75157634675526 30.430323932766115
epoch 50 -13.793574149241104 30.473610777980024
epoch 55 -13.774597813235626 30.454059618949902
epoch 60 -13.768489805002353 30.447763918778477
epoch 65 -13.767292170669814 30.44652932989337
epoch 70 -13.781484682178597 30.46115655265493
[32m[I 2022-03-04 19:06:13,295][0m Trial 4 finished with value: 30.4716622053689 and parameters: {'n_layers_fe': 2, 'fe_neurons': 128, 'fe_dropout': 0.11282101228617808, 'n_units_l(Invariant)': 208, 'n_layers_mlp': 4, 'initialiser': 'xavier', 'lr': 0.0010706605500666274, 'weight_decay': 0.2761528932196098, 'criterion': 'PoissonNLLLoss', 'batch_size': 256, 'epochs': 75}. Best is trial 2 with value: 7.505256535285676.[0m

Trial Id: 5 | Model params: 27870 | Timestamp: 2022-03-04 19:06:13.295860

epoch 0 -15.526094401905766 32.208646466341946
[32m[I 2022-03-04 19:07:47,089][0m Trial 5 pruned. [0m
++++++++++++++++++++
        NaN         
++++++++++++++++++++

Trial Id: 6 | Model params: 71838 | Timestamp: 2022-03-04 19:07:47.089984

epoch 0 -16.06580959898479 32.730361935235976
epoch 5 -20.302542399765066 36.568157517789395
[32m[I 2022-03-04 19:18:31,292][0m Trial 6 pruned. [0m
++++++++++++++++++++
        NaN         
++++++++++++++++++++

Trial Id: 7 | Model params: 130602 | Timestamp: 2022-03-04 19:18:31.293080

epoch 0 0.06260803234844825 7.67092918848783
epoch 5 0.08354910436355212 7.584762036272445
epoch 10 0.08865345268004099 7.563610152311898
epoch 15 0.09031793084880879 7.556699928314558
epoch 20 0.08951082997267967 7.560051465695066
[32m[I 2022-03-04 20:26:23,967][0m Trial 7 finished with value: 7.563082927596412 and parameters: {'n_layers_fe': 4, 'fe_neurons': 128, 'fe_dropout': 0.42107487030386703, 'n_units_l(Invariant)': 404, 'n_layers_mlp': 2, 'initialiser': 'xavier', 'lr': 3.540736616787841e-05, 'weight_decay': 0.12855979301976053, 'criterion': 'MSELoss', 'batch_size': 32, 'epochs': 25}. Best is trial 2 with value: 7.505256535285676.[0m

Trial Id: 8 | Model params: 113312 | Timestamp: 2022-03-04 20:26:23.967687

epoch 0 -13.773433024317294 30.452859137868177
epoch 5 -13.736865967371052 30.41514747796371
epoch 10 -13.75740379566896 30.436333922622527
epoch 15 -13.754367449591028 30.43320261312777
epoch 20 -13.77419417835136 30.453643621000538
epoch 25 -13.730189176692493 30.40825664443946
epoch 30 -13.768920952350735 30.448208357480148
epoch 35 -13.767268723193268 30.44650515841503
epoch 40 -13.784171875492289 30.463925262906802
epoch 45 -13.745251219005093 30.42379933097065
epoch 50 -13.765538283007663 30.444721233419894
epoch 55 -13.79658474049416 30.476711412012012
epoch 60 -13.772407010081842 30.451801644682767
epoch 65 -13.765881051043156 30.445074604103933
epoch 70 -13.770542827768207 30.449880173759034
[32m[I 2022-03-04 23:50:34,500][0m Trial 8 finished with value: 30.415417645175292 and parameters: {'n_layers_fe': 4, 'fe_neurons': 128, 'fe_dropout': 0.4357454805036962, 'n_units_l(Invariant)': 271, 'n_layers_mlp': 2, 'initialiser': 'kaiming_he', 'lr': 0.000266420309419964, 'weight_decay': 0.19115544555787214, 'criterion': 'PoissonNLLLoss', 'batch_size': 32, 'epochs': 75}. Best is trial 2 with value: 7.505256535285676.[0m

Trial Id: 9 | Model params: 68718 | Timestamp: 2022-03-04 23:50:34.500646

[32m[I 2022-03-04 23:52:57,338][0m Trial 9 pruned. [0m
++++++++++++++++++++
        NaN         
++++++++++++++++++++

Trial Id: 10 | Model params: 567040 | Timestamp: 2022-03-04 23:52:57.338579

[32m[I 2022-03-04 23:56:37,470][0m Trial 10 pruned. [0m
epoch 0 0.06678637008463328 7.653813867075584

Trial Id: 11 | Model params: 50508 | Timestamp: 2022-03-04 23:56:37.470327

[32m[I 2022-03-04 23:59:18,975][0m Trial 11 pruned. [0m
epoch 0 0.04846763094264539 7.728569970102754

Trial Id: 12 | Model params: 129042 | Timestamp: 2022-03-04 23:59:18.976037

epoch 0 -0.2021425280985547 8.686910369453482
epoch 5 0.08179161057118522 7.592031267773947
epoch 10 0.07611327179397165 7.615470217722278
epoch 15 0.08544472100052936 7.576913692325021
epoch 20 0.0792577683738942 7.6024993468708795
[32m[I 2022-03-05 00:49:10,722][0m Trial 12 finished with value: 7.571869485766318 and parameters: {'n_layers_fe': 4, 'fe_neurons': 128, 'fe_dropout': 0.46638425363437885, 'n_units_l(Invariant)': 392, 'n_layers_mlp': 2, 'initialiser': 'kaiming_he', 'lr': 8.234592143604561e-05, 'weight_decay': 0.1750993313435785, 'criterion': 'MSELoss', 'batch_size': 128, 'epochs': 25}. Best is trial 2 with value: 7.505256535285676.[0m

Trial Id: 13 | Model params: 406302 | Timestamp: 2022-03-05 00:49:10.723000

epoch 0 -0.1278436871617321 8.414180347373042
epoch 5 0.08127063540874513 7.594184754330786
epoch 10 0.08694367852913776 7.570701859300936
epoch 15 0.07232305445829879 7.631075347231639
epoch 20 0.08867236715276505 7.563531662718318
[32m[I 2022-03-05 02:21:23,355][0m Trial 13 finished with value: 7.568449317975106 and parameters: {'n_layers_fe': 4, 'fe_neurons': 256, 'fe_dropout': 0.29609867644726284, 'n_units_l(Invariant)': 398, 'n_layers_mlp': 2, 'initialiser': 'xavier', 'lr': 1.6813621153282845e-05, 'weight_decay': 0.2559895750234668, 'criterion': 'MSELoss', 'batch_size': 32, 'epochs': 25}. Best is trial 2 with value: 7.505256535285676.[0m

Trial Id: 14 | Model params: 141002 | Timestamp: 2022-03-05 02:21:23.356115

[32m[I 2022-03-05 02:23:30,966][0m Trial 14 pruned. [0m
epoch 0 0.06723799991390256 7.651961606854653

Study statistics: 
  Number of finished trials:  15
  Number of pruned trials:  8
  Number of complete trials:  7

Best trial:
  Value:  7.505256535285676
  Params: 
    n_layers_fe: 4
    fe_neurons: 256
    fe_dropout: 0.34871788089305367
    n_units_l(Invariant): 448
    n_layers_mlp: 2
    initialiser: uniform
    lr: 0.0005128669363635782
    weight_decay: 0.06584407868485413
    criterion: MSELoss
    batch_size: 128
    epochs: 50
Target: 132567, NaN: 0, Max: 365.0, Min: 0.0, Mean: 32.88284414673335
Prediction: 132567, NaN: 0, Max: 41.13748550415039, Min: 26.639984130859375, Mean: 32.93675886738593

 XXXXXX======== TRIAL south - elg ended

Test Set - R-squared:  0.10266137265061637
Test Set - RMSE:  7.505256535285676
Test Set - MAE:  5.8744385811302156



[32m[I 2022-03-05 02:24:30,088][0m A new study created in memory with name: DeepSet[0m
Starting Loading south
Finished Loading south
Finished south setup

++++++++ Session Characteristics +++++++

Area: south
Gal Type: elg
Training Set: 530265
Validation Set: 132567
Test Samples: 132567
Number of features: 5
Device: cuda:0
Number of Workers: 8
Number of Trials: 15

+++++++++++++++++++++++++++++++++++++++

Previous best Test-set performance: 0.10441788660780649

Trial Id: 0 | Model params: 359088 | Timestamp: 2022-03-05 02:24:30.089519

epoch 0 -2019.4249602963987 356.1301334071979
epoch 1 -2863.7013512188623 424.0597336931128
epoch 2 -7.164138787487376 22.638234240426783
epoch 3 -1328.2934814840978 288.866911031197
epoch 4 -1912.0155394792387 346.53460412909294
epoch 5 -5962.500738277764 611.8401863024266
epoch 6 -5.163437178196566 19.669750297037453
epoch 7 -900.2464114831334 237.85327416362884
epoch 8 -272.74549793507293 131.08737066871495
[32m[I 2022-03-05 02:53:24,286][0m Trial 0 finished with value: 245.36917068847498 and parameters: {'lr': 0.0014978703795445723, 'weight_decay': 0.18754169207356866, 'criterion': 'PoissonNLLLoss', 'batch_size': 256, 'epochs': 10}. Best is trial 0 with value: 245.36917068847498.[0m
epoch 9 -958.1030464754369 245.36917068847498

Previous best Test-set performance: 0.10441788660780649

Trial Id: 1 | Model params: 359088 | Timestamp: 2022-03-05 02:53:24.286905

epoch 0 0.10312084224449714 7.50333480885427
epoch 1 0.1032491446060243 7.502798097749512
epoch 2 0.10224657472882615 7.506991000421669
epoch 3 0.10200967005709449 7.507981430464917
[32m[I 2022-03-05 03:09:31,890][0m Trial 1 finished with value: 7.506155834519421 and parameters: {'lr': 1.3445718821024441e-05, 'weight_decay': 0.1553385119395761, 'criterion': 'MSELoss', 'batch_size': 32, 'epochs': 5}. Best is trial 1 with value: 7.506155834519421.[0m
epoch 4 0.10244631690051331 7.506155834519421

Previous best Test-set performance: 0.10441788660780649

Trial Id: 2 | Model params: 359088 | Timestamp: 2022-03-05 03:09:31.890833

epoch 0 -15.61540999096933 32.295565304786535
epoch 1 -58.28807540152628 61.00578728668448
epoch 2 -114.75954255955291 85.24438086233813
epoch 3 -344.95513364930616 147.36598441997478
epoch 4 -1110.5533775483984 264.15115936144673
epoch 5 -1870.2487091288306 342.7307858061263
epoch 6 -2491.3018452872475 395.5375137462288
epoch 7 -62.443937486238724 63.10771042743521
epoch 8 -48.41443903461605 55.694754582201135
epoch 9 -657.1772533713125 203.26321678477228
epoch 10 -1262.373298027513 281.61332910256255
epoch 11 -37.55408932909778 49.19518345691396
epoch 12 -25.403958457643814 40.711947724500995
epoch 13 -25.23784959663896 40.58368504624386
epoch 14 -19.045655090298546 35.47296468858898
epoch 15 -16.78681320952463 33.414612720957024
epoch 16 -15.428573971081395 32.11347429543876
epoch 17 -14.006839968683984 30.69248027933428
epoch 18 -14.580929146032211 31.274043516879885
[32m[I 2022-03-05 04:08:08,893][0m Trial 2 finished with value: 30.78954489672589 and parameters: {'lr': 0.00014016204932366865, 'weight_decay': 0.09741161143337763, 'criterion': 'PoissonNLLLoss', 'batch_size': 128, 'epochs': 20}. Best is trial 1 with value: 7.506155834519421.[0m
epoch 19 -14.10190797618383 30.78954489672589

Previous best Test-set performance: 0.10441788660780649

Trial Id: 3 | Model params: 359088 | Timestamp: 2022-03-05 04:08:08.893891

epoch 0 -0.9286554391753421 11.003090449086727
epoch 1 -2.4996360735453256 14.82172673717708
epoch 2 -5.121309549994843 19.602412809880462
epoch 3 -9.237654891575888 25.350562634702325
epoch 4 -19.0030758394182 35.435270355803
epoch 5 -32.52898739092316 45.877271263231854
epoch 6 -58.63369591136738 61.18334585819245
epoch 7 -76.48069581332865 69.74034893017597
epoch 8 -127.73663398446195 89.89559984004453
[32m[I 2022-03-05 04:37:08,239][0m Trial 3 finished with value: 109.78584693477167 and parameters: {'lr': 2.792785960693971e-05, 'weight_decay': 0.05963451661922578, 'criterion': 'PoissonNLLLoss', 'batch_size': 256, 'epochs': 10}. Best is trial 1 with value: 7.506155834519421.[0m
epoch 9 -191.00741178610284 109.78584693477167

Previous best Test-set performance: 0.10441788660780649

Trial Id: 4 | Model params: 359088 | Timestamp: 2022-03-05 04:37:08.239943

epoch 0 -89.95069501678555 75.5597253940223
epoch 1 -66.98973014037698 65.32945249560676
epoch 2 -35.456582561252745 47.838255890957484
epoch 3 -33.71896224116103 46.68428670824297
[32m[I 2022-03-05 04:51:29,795][0m Trial 4 finished with value: 34.31716965459513 and parameters: {'lr': 0.0032066440297057516, 'weight_decay': 0.017596811027226843, 'criterion': 'PoissonNLLLoss', 'batch_size': 256, 'epochs': 5}. Best is trial 1 with value: 7.506155834519421.[0m
epoch 4 -17.760663933739988 34.31716965459513

Previous best Test-set performance: 0.10441788660780649

Trial Id: 5 | Model params: 359088 | Timestamp: 2022-03-05 04:51:29.795496

[32m[I 2022-03-05 04:54:23,558][0m Trial 5 pruned. [0m
epoch 0 -15.070875445515888 31.761947781964203

Previous best Test-set performance: 0.10441788660780649

Trial Id: 6 | Model params: 359088 | Timestamp: 2022-03-05 04:54:23.558483

[32m[I 2022-03-05 04:57:15,908][0m Trial 6 pruned. [0m
epoch 0 0.0943043762344985 7.540124111249593

Previous best Test-set performance: 0.10441788660780649

Trial Id: 7 | Model params: 359088 | Timestamp: 2022-03-05 04:57:15.908819

[32m[I 2022-03-05 05:00:08,353][0m Trial 7 pruned. [0m
epoch 0 0.09171482218541205 7.550895733369108

Previous best Test-set performance: 0.10441788660780649

Trial Id: 8 | Model params: 359088 | Timestamp: 2022-03-05 05:00:08.353875

[32m[I 2022-03-05 05:03:03,047][0m Trial 8 pruned. [0m
epoch 0 0.10023764235542065 7.515385627173593

Previous best Test-set performance: 0.10441788660780649

Trial Id: 9 | Model params: 359088 | Timestamp: 2022-03-05 05:03:03.047830

[32m[I 2022-03-05 05:05:57,409][0m Trial 9 pruned. [0m
epoch 0 -12.93555812075857 29.576688220890798

Previous best Test-set performance: 0.10441788660780649

Trial Id: 10 | Model params: 359088 | Timestamp: 2022-03-05 05:05:57.409750

[32m[I 2022-03-05 05:09:10,790][0m Trial 10 pruned. [0m
epoch 0 0.10293490807657013 7.5041125357102505

Previous best Test-set performance: 0.10441788660780649

Trial Id: 11 | Model params: 359088 | Timestamp: 2022-03-05 05:09:10.790188

[32m[I 2022-03-05 05:12:24,113][0m Trial 11 pruned. [0m
epoch 0 0.10296719386540631 7.503977496249425

Previous best Test-set performance: 0.10441788660780649

Trial Id: 12 | Model params: 359088 | Timestamp: 2022-03-05 05:12:24.113639

[32m[I 2022-03-05 05:15:19,654][0m Trial 12 pruned. [0m
epoch 0 -5.87617176277504 20.775941708329213

Previous best Test-set performance: 0.10441788660780649

Trial Id: 13 | Model params: 359088 | Timestamp: 2022-03-05 05:15:19.655067

[32m[I 2022-03-05 05:18:32,757][0m Trial 13 pruned. [0m
epoch 0 0.10470300016646772 7.496713682333361

Previous best Test-set performance: 0.10441788660780649

Trial Id: 14 | Model params: 359088 | Timestamp: 2022-03-05 05:18:32.757547

epoch 0 -139.11280034142885 93.7834632474604
epoch 1 -606.4304499888342 195.27005082480864
epoch 2 -2175.7257030610776 369.6487250115495
epoch 3 -1325.2317093490228 288.53404453266944
epoch 4 -1891.5138609181495 344.672706422809
epoch 5 -5.113024075223966 19.58914193280485
epoch 6 -11.299057222520094 27.78582338482905
epoch 7 -18.841986731349177 35.2922979682752
epoch 8 -19.895268244780908 36.216905109238276
epoch 9 -15.477721081052 32.161473161121485
epoch 10 -15.02163652971371 31.713253371148692
epoch 11 -14.446582639732082 31.138921449245608
epoch 12 -13.845610285182534 30.52715892465412
epoch 13 -13.68627730971943 30.362898097540377
epoch 14 -13.70124627783526 30.37836782790435
epoch 15 -13.762446457562278 30.441533584921505
epoch 16 -13.733964897894355 30.41215359856246
epoch 17 -13.760136506445459 30.439151825038874
epoch 18 -13.735433518326111 30.413669239380635
[32m[I 2022-03-05 06:16:59,917][0m Trial 14 finished with value: 30.414992840930157 and parameters: {'lr': 0.00046717788585780783, 'weight_decay': 0.04563063900518969, 'criterion': 'PoissonNLLLoss', 'batch_size': 128, 'epochs': 20}. Best is trial 1 with value: 7.506155834519421.[0m
epoch 19 -13.736716117073891 30.414992840930157

Study statistics: 
  Number of finished trials:  15
  Number of pruned trials:  9
  Number of complete trials:  6

Best trial:
  Value:  7.506155834519421
  Params: 
    lr: 1.3445718821024441e-05
    weight_decay: 0.1553385119395761
    criterion: MSELoss
    batch_size: 32
    epochs: 5
Target: 132567, NaN: 0, Max: 365.0, Min: 0.0, Mean: 32.88284414673335
Prediction: 132567, NaN: 0, Max: 40.47773361206055, Min: 26.9897403717041, Mean: 33.062949613136524

 XXXXXX======== TRIAL south - elg ended

Test Set - R-squared:  0.10244631690051331
Test Set - RMSE:  7.506155834519421
Test Set - MAE:  5.880911851179788



