[32m[I 2022-02-24 12:44:28,545][0m A new study created in memory with name: DeepSet[0m
Starting Loading south
Finished Loading south
Finished south setup

++++++++ Session Characteristics +++++++

Area: south
Gal Type: elg
Training Set: 216650
Validation Set: 54162
Test Samples: 132567
Number of features: 5
Device: cuda:0
Number of Workers: 8
Number of Trials: 20

+++++++++++++++++++++++++++++++++++++++

Trial Id: 0 | Model params: 31489 | Timestamp: 2022-02-24 12:44:28.545764

[32m[I 2022-02-24 12:44:39,813][0m Trial 0 pruned. [0m
++++++++++++++++++++
        NaN         
++++++++++++++++++++

Trial Id: 1 | Model params: 199647 | Timestamp: 2022-02-24 12:44:39.813429

[32m[I 2022-02-24 12:45:49,800][0m Trial 1 pruned. [0m
++++++++++++++++++++
        NaN         
++++++++++++++++++++

Trial Id: 2 | Model params: 124121 | Timestamp: 2022-02-24 12:45:49.800177

epoch 0 -14.027708493205024 30.5403960461942
epoch 5 -13.955373506352295 30.46680518718267
epoch 10 -13.9358083682333 30.44686979959744
epoch 15 -13.911301436640882 30.42188067058195
epoch 20 -13.922616857709098 30.43342128324656
epoch 25 -13.927178666356781 30.438072640217747
epoch 30 -13.905952837364978 30.41642410317827
epoch 35 -13.912026107947737 30.422619894997474
epoch 40 -13.915522432569748 30.426186181703
epoch 45 -13.928712150169309 30.43963606670335
epoch 50 -13.9170792657662 30.427774032913902
epoch 55 -13.928302993632512 30.439218928865635
epoch 60 -13.90844862246735 30.418970390611626
epoch 65 -13.905692542973213 30.416158529441994
epoch 70 -13.936570140841743 30.447646232152195
epoch 75 -13.912367161992337 30.42296779199557
epoch 80 -13.915085849808893 30.425740885682337
epoch 85 -13.912818962770919 30.423428651639057
epoch 90 -13.912876274681015 30.423487112186887
epoch 95 -13.924792398124197 30.435639618195854
[32m[I 2022-02-24 14:29:57,962][0m Trial 2 finished with value: 30.422665935283767 and parameters: {'n_layers_fe': 4, 'fe_n_units_l0': 30, 'fe_dropout_l0': 0.2543978748623217, 'fe_n_units_l1': 198, 'fe_dropout_l1': 0.12272312423794501, 'fe_n_units_l2': 142, 'fe_dropout_l2': 0.043347780605947905, 'fe_n_units_l3': 158, 'fe_dropout_l3': 0.1518311569944938, 'n_units_l(Invariant)': 320, 'n_layers_mlp': 2, 'mlp_n_units_l0': 133, 'mlp_dropout_l0': 0.3991972481547481, 'mlp_n_units_l1': 94, 'mlp_dropout_l1': 0.22265482394763475, 'reduction': 'sum', 'lr': 8.432777486309798e-05, 'weight_decay': 0.0043372546865112155, 'criterion': 'PoissonNLLLoss', 'batch_size': 32}. Best is trial 2 with value: 30.422665935283767.[0m

Trial Id: 3 | Model params: 59217 | Timestamp: 2022-02-24 14:29:57.962420

epoch 0 0.04140877459561454 7.713384988342914
epoch 5 0.07851045089240982 7.5626411019465385
epoch 10 0.032184847723208954 7.750406694367918
epoch 15 0.08028515369111111 7.555355122044477
epoch 20 0.06641918438080008 7.61209575873605
epoch 25 0.028362708891949584 7.765695740358595
epoch 30 0.06292118838412919 7.626343151506919
epoch 35 0.08032088682296701 7.5552083487678265
epoch 40 0.06875605985080946 7.602562751383694
epoch 45 0.07291597583711662 7.585563220516024
epoch 50 0.07800441497830113 7.564717328831706
epoch 55 0.07192638338962387 7.589610649745113
epoch 60 0.04916445631960886 7.682118244451319
epoch 65 0.0798324765164159 7.557214239620925
epoch 70 0.05292958111475088 7.666893306553473
epoch 75 0.0762743214400976 7.571811470546295
epoch 80 0.07315868385853119 7.584570215833833
epoch 85 0.07359564580741706 7.582782121563604
epoch 90 0.0752234038473032 7.576117450176753
epoch 95 0.07613251987823766 7.572392624407701
[32m[I 2022-02-24 15:57:28,340][0m Trial 3 finished with value: 7.637503607917371 and parameters: {'n_layers_fe': 2, 'fe_n_units_l0': 168, 'fe_dropout_l0': 0.48697293038089406, 'fe_n_units_l1': 85, 'fe_dropout_l1': 0.023348811933605773, 'n_units_l(Invariant)': 253, 'n_layers_mlp': 2, 'mlp_n_units_l0': 129, 'mlp_dropout_l0': 0.37836951212503594, 'mlp_n_units_l1': 144, 'mlp_dropout_l1': 0.010506320629193822, 'reduction': 'sum', 'lr': 0.000941846866384463, 'weight_decay': 0.12959584229245105, 'criterion': 'MSELoss', 'batch_size': 32}. Best is trial 3 with value: 7.637503607917371.[0m

Trial Id: 4 | Model params: 170800 | Timestamp: 2022-02-24 15:57:28.341052

epoch 0 -13.950826194491158 30.46217298600855
epoch 5 -13.927871022938348 30.438778525637705
epoch 10 -13.91526525719866 30.42592387444936
epoch 15 -13.952356566144553 30.46373200530699
epoch 20 -13.944660533925788 30.455891099500782
epoch 25 -13.91541755977222 30.42607921646305
epoch 30 -13.896875406749384 30.40716119222912
epoch 35 -13.941059545915179 30.45222163154245
epoch 40 -13.947587374719397 30.45887327431538
epoch 45 -13.93421734804096 30.445248097123574
epoch 50 -13.93855899492561 30.449673267452482
epoch 55 -13.987244316572177 30.499251217375342
epoch 60 -13.908271301901872 30.418789488989788
epoch 65 -13.92685979083228 30.437747528271604
epoch 70 -13.940875505686213 30.452034079545786
epoch 75 -13.916730195766938 30.42741801532467
epoch 80 -13.929961445973078 30.440909696795153
epoch 85 -13.952217091432844 30.463589923016194
epoch 90 -13.928303298663991 30.439219239849407
epoch 95 -13.925537579410298 30.43639942058966
[32m[I 2022-02-24 17:29:55,495][0m Trial 4 finished with value: 30.452591952659226 and parameters: {'n_layers_fe': 2, 'fe_n_units_l0': 142, 'fe_dropout_l0': 0.24609641335046023, 'fe_n_units_l1': 195, 'fe_dropout_l1': 0.28771567843613305, 'n_units_l(Invariant)': 456, 'n_layers_mlp': 2, 'mlp_n_units_l0': 203, 'mlp_dropout_l0': 0.4571592655350718, 'mlp_n_units_l1': 232, 'mlp_dropout_l1': 0.0925474829984913, 'reduction': 'sum', 'lr': 0.0006752568623913629, 'weight_decay': 0.14704604947975702, 'criterion': 'PoissonNLLLoss', 'batch_size': 32}. Best is trial 3 with value: 7.637503607917371.[0m

Trial Id: 5 | Model params: 70141 | Timestamp: 2022-02-24 17:29:55.495521

epoch 0 -0.6250621544935397 10.042995585304958
epoch 5 -0.021851713652742077 7.9638344312419065
epoch 10 -0.8908429236459758 10.833181263396822
epoch 15 -0.831960780724839 10.663170895903814
epoch 20 -0.35072036943819773 9.1561101411055
epoch 25 -0.07380012816858406 8.163755876232413
epoch 30 0.0034809263160326953 7.864499541739529
epoch 35 0.06779900561275143 7.606468385619656
epoch 40 0.08592903468487245 7.532137521035475
epoch 45 0.08461217678361366 7.537561161752312
epoch 50 0.08487734695605031 7.536469339733208
epoch 55 0.08679485909046247 7.528569388038273
epoch 60 0.08985834276697513 7.515930921868993
epoch 65 0.08999881757284667 7.515350880470504
epoch 70 0.08952225956921978 7.517318477823968
epoch 75 0.0916233978972274 7.508639490728239
epoch 80 0.0920925484653754 7.506700241393958
epoch 85 0.09231074611566703 7.505798143512131
epoch 90 0.09136676886980388 7.509700063385034
epoch 95 0.09144659418506551 7.50937018477111
[32m[I 2022-02-24 17:48:24,592][0m Trial 5 finished with value: 7.504510882925383 and parameters: {'n_layers_fe': 4, 'fe_n_units_l0': 161, 'fe_dropout_l0': 0.40540171879710557, 'fe_n_units_l1': 48, 'fe_dropout_l1': 0.01522193637022079, 'fe_n_units_l2': 61, 'fe_dropout_l2': 0.4588770025677974, 'fe_n_units_l3': 126, 'fe_dropout_l3': 0.43209256511122757, 'n_units_l(Invariant)': 38, 'n_layers_mlp': 4, 'mlp_n_units_l0': 212, 'mlp_dropout_l0': 0.32768372392450235, 'mlp_n_units_l1': 82, 'mlp_dropout_l1': 0.1726152600752583, 'mlp_n_units_l2': 76, 'mlp_dropout_l2': 0.4684722728097917, 'mlp_n_units_l3': 219, 'mlp_dropout_l3': 0.22789553422208514, 'reduction': 'sum', 'lr': 0.00011286211567184864, 'weight_decay': 0.07522234614900278, 'criterion': 'MSELoss', 'batch_size': 256}. Best is trial 5 with value: 7.504510882925383.[0m

Trial Id: 6 | Model params: 110300 | Timestamp: 2022-02-24 17:48:24.592758

epoch 0 -2.3452156904312957 14.409215819174074
epoch 5 0.04730482860943175 7.689626851937735
epoch 10 0.08290873730604564 7.544571202254943
epoch 15 0.08579321646457738 7.532697085639221
epoch 20 0.08670955463889651 7.528921009736869
epoch 25 0.0912351598660256 7.510243906777564
epoch 30 0.09062882089802626 7.512748952094089
epoch 35 0.08797307856513747 7.523711131310389
epoch 40 0.07743019683284902 7.567072612256053
epoch 45 0.08664490793096358 7.529187470065726
epoch 50 0.09290399248580306 7.503344927676322
epoch 55 0.08687306956606267 7.528246993006942
epoch 60 0.09235945859763117 7.505596735948516
epoch 65 0.07691706266448228 7.569176726073366
epoch 70 0.09205842316826574 7.506841316328704
epoch 75 0.09333951649509831 7.501543420897668
epoch 80 0.0955012053609402 7.4925953745216995
epoch 85 0.09518257478171166 7.493914978153972
epoch 90 0.09594159699338733 7.490771116672676
epoch 95 0.09657132301883031 7.488161796727984
[32m[I 2022-02-24 18:14:01,147][0m Trial 6 finished with value: 7.484010472797433 and parameters: {'n_layers_fe': 2, 'fe_n_units_l0': 229, 'fe_dropout_l0': 0.36522965790703854, 'fe_n_units_l1': 80, 'fe_dropout_l1': 0.1378367386778166, 'n_units_l(Invariant)': 509, 'n_layers_mlp': 4, 'mlp_n_units_l0': 222, 'mlp_dropout_l0': 0.23996772735272476, 'mlp_n_units_l1': 60, 'mlp_dropout_l1': 0.39785323995669575, 'mlp_n_units_l2': 104, 'mlp_dropout_l2': 0.3307074283353605, 'mlp_n_units_l3': 226, 'mlp_dropout_l3': 0.475507877196231, 'reduction': 'sum', 'lr': 0.00018641861416175164, 'weight_decay': 0.07947795784779363, 'criterion': 'MSELoss', 'batch_size': 256}. Best is trial 6 with value: 7.484010472797433.[0m

Trial Id: 7 | Model params: 123925 | Timestamp: 2022-02-24 18:14:01.147970

epoch 0 -14.112903694083307 30.626843621430915
epoch 5 -13.962857443305836 30.474427301433305
epoch 10 -13.943706386425445 30.454918850042876
epoch 15 -13.930038243163295 30.440987988133497
epoch 20 -13.936496664152743 30.447571342302545
epoch 25 -13.9306699779718 30.441632006185632
epoch 30 -13.943691642802175 30.454903826462065
epoch 35 -13.925571429862364 30.436433934766786
epoch 40 -13.92910192409081 30.440033438518057
epoch 45 -13.94871700195771 30.46002417987631
epoch 50 -13.931076306201403 30.442046227727705
epoch 55 -13.943919236917958 30.45513574139588
epoch 60 -13.936144111398574 30.447212006418145
epoch 65 -13.947015148131266 30.45829025233641
epoch 70 -13.945099283104739 30.4563381621527
epoch 75 -13.931712412217891 30.44269467939062
epoch 80 -13.946838272427708 30.458110037510842
epoch 85 -13.922137322762758 30.432932293734005
epoch 90 -13.941625175836206 30.452798047312903
epoch 95 -13.93507598318785 30.44612330148573
[32m[I 2022-02-24 18:45:41,122][0m Trial 7 finished with value: 30.46883332967489 and parameters: {'n_layers_fe': 4, 'fe_n_units_l0': 35, 'fe_dropout_l0': 0.1812019270506357, 'fe_n_units_l1': 141, 'fe_dropout_l1': 0.35182867064728107, 'fe_n_units_l2': 248, 'fe_dropout_l2': 0.08306897920993261, 'fe_n_units_l3': 127, 'fe_dropout_l3': 0.21352074093978046, 'n_units_l(Invariant)': 250, 'n_layers_mlp': 2, 'mlp_n_units_l0': 200, 'mlp_dropout_l0': 0.33346761390533586, 'mlp_n_units_l1': 74, 'mlp_dropout_l1': 0.0764701173414915, 'reduction': 'sum', 'lr': 4.111373086496376e-05, 'weight_decay': 0.2931106306692104, 'criterion': 'PoissonNLLLoss', 'batch_size': 128}. Best is trial 6 with value: 7.484010472797433.[0m

Trial Id: 8 | Model params: 183251 | Timestamp: 2022-02-24 18:45:41.122201

[32m[I 2022-02-24 18:45:57,303][0m Trial 8 pruned. [0m
epoch 0 0.048726036777800186 7.68388910936959

Trial Id: 9 | Model params: 177720 | Timestamp: 2022-02-24 18:45:57.303624

epoch 0 -17.42769238090879 33.81923352338798
epoch 5 -17.42769238090879 33.81923352338798
epoch 10 -17.42769238090879 33.81923352338798
epoch 15 -14.31052857654843 30.826440202127355
epoch 20 -13.941240327080228 30.452405861162692
epoch 25 -13.927032708750481 30.43792382847032
epoch 30 -13.947111914348783 30.458388844889516
epoch 35 -13.970761119553247 30.482474835461318
epoch 40 -13.926371574653734 30.43724975705579
epoch 45 -13.904812230481555 30.415260345088203
epoch 50 -13.900627539078155 30.410990334453533
epoch 55 -13.926260868412237 30.437136883014258
epoch 60 -13.953694892022611 30.46509531845587
epoch 65 -13.924148385114233 30.434982953807825
epoch 70 -13.948424340184939 30.459726009528122
epoch 75 -13.938955447395635 30.450077314726723
epoch 80 -13.906936094250016 30.417427281759366
epoch 85 -13.951825413281723 30.463190918619528
epoch 90 -13.936733333916633 30.447812563223952
epoch 95 -13.907418504557882 30.417919454049272
[32m[I 2022-02-24 19:18:14,872][0m Trial 9 finished with value: 30.41052857053877 and parameters: {'n_layers_fe': 2, 'fe_n_units_l0': 233, 'fe_dropout_l0': 0.26099279642565326, 'fe_n_units_l1': 174, 'fe_dropout_l1': 0.3088882516364242, 'n_units_l(Invariant)': 509, 'n_layers_mlp': 4, 'mlp_n_units_l0': 160, 'mlp_dropout_l0': 0.027122963941814626, 'mlp_n_units_l1': 172, 'mlp_dropout_l1': 0.34211217665814186, 'mlp_n_units_l2': 49, 'mlp_dropout_l2': 0.15557767894209823, 'mlp_n_units_l3': 121, 'mlp_dropout_l3': 0.03928648530975587, 'reduction': 'sum', 'lr': 0.0029100840669084014, 'weight_decay': 0.05729426338794103, 'criterion': 'PoissonNLLLoss', 'batch_size': 256}. Best is trial 6 with value: 7.484010472797433.[0m

Trial Id: 10 | Model params: 85844 | Timestamp: 2022-02-24 19:18:14.872988

[32m[I 2022-02-24 19:18:33,924][0m Trial 10 pruned. [0m
++++++++++++++++++++
        NaN         
++++++++++++++++++++

Trial Id: 11 | Model params: 54605 | Timestamp: 2022-02-24 19:18:33.924484

[32m[I 2022-02-24 19:18:45,803][0m Trial 11 pruned. [0m
++++++++++++++++++++
        NaN         
++++++++++++++++++++

Trial Id: 12 | Model params: 59615 | Timestamp: 2022-02-24 19:18:45.804120

[32m[I 2022-02-24 19:18:55,729][0m Trial 12 pruned. [0m
epoch 0 -1.3947609413045758 12.191562424459988

Trial Id: 13 | Model params: 117791 | Timestamp: 2022-02-24 19:18:55.730162

[32m[I 2022-02-24 19:19:11,509][0m Trial 13 pruned. [0m
epoch 0 -4.749406428159148 18.890340611142364

Trial Id: 14 | Model params: 56183 | Timestamp: 2022-02-24 19:19:11.509636

[32m[I 2022-02-24 19:19:25,301][0m Trial 14 pruned. [0m
epoch 0 -1.3765457047894651 12.145107663766792

Trial Id: 15 | Model params: 101021 | Timestamp: 2022-02-24 19:19:25.301240

[32m[I 2022-02-24 19:19:35,983][0m Trial 15 pruned. [0m
++++++++++++++++++++
        NaN         
++++++++++++++++++++

Trial Id: 16 | Model params: 58725 | Timestamp: 2022-02-24 19:19:35.983574

[32m[I 2022-02-24 19:19:50,185][0m Trial 16 pruned. [0m
++++++++++++++++++++
        NaN         
++++++++++++++++++++

Trial Id: 17 | Model params: 114222 | Timestamp: 2022-02-24 19:19:50.186104

[32m[I 2022-02-24 19:20:10,804][0m Trial 17 pruned. [0m
epoch 0 0.061061809341964146 7.633905607938692

Trial Id: 18 | Model params: 99854 | Timestamp: 2022-02-24 19:20:10.805089

[32m[I 2022-02-24 19:20:21,845][0m Trial 18 pruned. [0m
epoch 0 0.020850421374316586 7.795658470323298

Trial Id: 19 | Model params: 63883 | Timestamp: 2022-02-24 19:20:21.845887

[32m[I 2022-02-24 19:20:32,339][0m Trial 19 pruned. [0m
++++++++++++++++++++
        NaN         
++++++++++++++++++++

Study statistics: 
  Number of finished trials:  20
  Number of pruned trials:  13
  Number of complete trials:  7

Best trial:
  Value:  7.484010472797433
  Params: 
    n_layers_fe: 2
    fe_n_units_l0: 229
    fe_dropout_l0: 0.36522965790703854
    fe_n_units_l1: 80
    fe_dropout_l1: 0.1378367386778166
    n_units_l(Invariant): 509
    n_layers_mlp: 4
    mlp_n_units_l0: 222
    mlp_dropout_l0: 0.23996772735272476
    mlp_n_units_l1: 60
    mlp_dropout_l1: 0.39785323995669575
    mlp_n_units_l2: 104
    mlp_dropout_l2: 0.3307074283353605
    mlp_n_units_l3: 226
    mlp_dropout_l3: 0.475507877196231
    reduction: sum
    lr: 0.00018641861416175164
    weight_decay: 0.07947795784779363
    criterion: MSELoss
    batch_size: 256
Target: 132567, NaN: 0, Max: 365.0, Min: 0.0, Mean: 32.88284414673335
Prediction: 132567, NaN: 0, Max: 41.43158721923828, Min: 27.97707748413086, Mean: 33.08183292794163

 XXXXXX======== TRIAL south - elg ended

Test Set - R-squared:  0.10082237171112007
Test Set - RMSE:  7.512943215158175
Test Set - MAE:  5.887571824168241



