[32m[I 2022-03-06 23:13:24,710][0m A new study created in memory with name: DeepSet[0m
Starting Loading south
Finished Loading south
Finished south setup

++++++++ Session Characteristics +++++++

Area: south
Gal Type: glbg
Training Set: 530265
Validation Set: 132567
Test Samples: 132567
Number of features: 5
Device: cuda:0
Number of Workers: 8
Number of Trials: 15

+++++++++++++++++++++++++++++++++++++++

Trial Id: 0 | Model params: 31566 | Timestamp: 2022-03-06 23:13:24.754643

epoch 0 -4.961030690153429 20.46617107147137
epoch 5 -4.856153204216183 20.28533274866517
epoch 10 -4.860416731376608 20.292715695139066
epoch 15 -4.850904473921059 20.27624008111875
epoch 20 -4.854142266248 20.28184957063626
epoch 25 -4.865456194966709 20.301438831337048
epoch 30 -4.861714723684267 20.29496283316507
epoch 35 -4.864596757043078 20.29995143930479
epoch 40 -4.847046651742965 20.26955436036315
epoch 45 -4.859665196959057 20.29141449388206
[32m[I 2022-03-06 23:52:36,755][0m Trial 0 finished with value: 20.29140037323635 and parameters: {'n_layers_fe': 4, 'fe_neurons': 64, 'fe_dropout': 0.14291752028813814, 'n_units_l(Invariant)': 166, 'n_layers_mlp': 2, 'initialiser': 'uniform', 'lr': 0.00010543745206737663, 'weight_decay': 0.19963759093500008, 'criterion': 'PoissonNLLLoss', 'batch_size': 256, 'epochs': 50}. Best is trial 0 with value: 20.29140037323635.[0m

Trial Id: 1 | Model params: 42654 | Timestamp: 2022-03-06 23:52:36.755771

epoch 0 -6.719105574169512 23.28945960181197
[32m[I 2022-03-06 23:54:36,951][0m Trial 1 pruned. [0m
++++++++++++++++++++
        NaN         
++++++++++++++++++++

Trial Id: 2 | Model params: 69628 | Timestamp: 2022-03-06 23:54:36.951393

epoch 0 0.09313578330919936 7.982649373605163
epoch 5 0.1153984125738644 7.884057413676427
epoch 10 0.12246958004871744 7.852483115875881
epoch 15 0.12605288361411915 7.8364343195185056
epoch 20 0.11974805469145378 7.864650322600659
epoch 25 0.10816526033980778 7.916224713430259
epoch 30 0.1260908971355068 7.836263889467658
epoch 35 0.12802531500527048 7.827586209701305
epoch 40 0.12892996012562374 7.823524724104916
epoch 45 0.11670250192979559 7.878243888368957
epoch 50 0.1284107479425044 7.825856031597027
epoch 55 0.1325661772624428 7.807178285788509
epoch 60 0.13237826768432237 7.808023862763856
epoch 65 0.1307870657300656 7.815180467522142
epoch 70 0.13121038896323012 7.813277164983732
[32m[I 2022-03-07 00:58:55,196][0m Trial 2 finished with value: 7.803418561596761 and parameters: {'n_layers_fe': 2, 'fe_neurons': 128, 'fe_dropout': 0.1745952742161505, 'n_units_l(Invariant)': 189, 'n_layers_mlp': 2, 'initialiser': 'normal', 'lr': 0.0007059227404394557, 'weight_decay': 0.2901343014054404, 'criterion': 'MSELoss', 'batch_size': 256, 'epochs': 75}. Best is trial 2 with value: 7.803418561596761.[0m

Trial Id: 3 | Model params: 78342 | Timestamp: 2022-03-07 00:58:55.196191

epoch 0 -4.858132107337946 20.28875985484165
epoch 5 -4.8595315078644195 20.29118301680833
epoch 10 -4.8658213847908005 20.302070816576876
epoch 15 -4.846856631328714 20.269224992338636
epoch 20 -4.846005824946007 20.267750198745418
epoch 25 -4.840558377575966 20.258305011903442
epoch 30 -4.840530092997819 20.25825595851951
epoch 35 -4.85391378732843 20.281453780776594
epoch 40 -4.8713398990612555 20.31161857823182
epoch 45 -4.85216301963169 20.2784207014796
[32m[I 2022-03-07 03:11:15,245][0m Trial 3 finished with value: 20.268766097758466 and parameters: {'n_layers_fe': 2, 'fe_neurons': 128, 'fe_dropout': 0.04521330900607995, 'n_units_l(Invariant)': 2, 'n_layers_mlp': 4, 'initialiser': 'normal', 'lr': 0.0008246483670989636, 'weight_decay': 0.07233477227300886, 'criterion': 'PoissonNLLLoss', 'batch_size': 32, 'epochs': 50}. Best is trial 2 with value: 7.803418561596761.[0m

Trial Id: 4 | Model params: 137626 | Timestamp: 2022-03-07 03:11:15.245255

epoch 0 -5.978261961139025 22.14366769153447
epoch 5 -5.983708369371952 22.15230737371212
epoch 10 -5.9674880275684234 22.126566974864303
epoch 15 -6.022068225859229 22.213062748856427
epoch 20 -6.025292585713169 22.21816200775549
[32m[I 2022-03-07 03:46:08,474][0m Trial 4 finished with value: 22.124957725908995 and parameters: {'n_layers_fe': 4, 'fe_neurons': 128, 'fe_dropout': 0.49548195673700596, 'n_units_l(Invariant)': 204, 'n_layers_mlp': 4, 'initialiser': 'xavier', 'lr': 3.698022179685753e-05, 'weight_decay': 0.20591064732743028, 'criterion': 'PoissonNLLLoss', 'batch_size': 128, 'epochs': 25}. Best is trial 2 with value: 7.803418561596761.[0m

Trial Id: 5 | Model params: 103822 | Timestamp: 2022-03-07 03:46:08.474582

epoch 0 -5.097063159501187 20.698375813496668
epoch 5 -5.035714019703891 20.593978174247603
epoch 10 -4.911088370270285 20.380256570025566
epoch 15 -4.868763177167567 20.3071610662583
epoch 20 -4.861849230695656 20.295195683044817
[32m[I 2022-03-07 04:19:57,853][0m Trial 5 finished with value: 20.238793313576462 and parameters: {'n_layers_fe': 4, 'fe_neurons': 128, 'fe_dropout': 0.02453428349287834, 'n_units_l(Invariant)': 198, 'n_layers_mlp': 2, 'initialiser': 'uniform', 'lr': 2.4050924385540672e-05, 'weight_decay': 0.0344900735488171, 'criterion': 'PoissonNLLLoss', 'batch_size': 256, 'epochs': 25}. Best is trial 2 with value: 7.803418561596761.[0m

Trial Id: 6 | Model params: 378438 | Timestamp: 2022-03-07 04:19:57.853934

[32m[I 2022-03-07 04:21:30,351][0m Trial 6 pruned. [0m
epoch 0 0.09910740945759966 7.956323419255291

Trial Id: 7 | Model params: 317550 | Timestamp: 2022-03-07 04:21:30.351740

[32m[I 2022-03-07 04:23:33,671][0m Trial 7 pruned. [0m
epoch 0 0.04101573882012677 8.208837543465606

Trial Id: 8 | Model params: 13610 | Timestamp: 2022-03-07 04:23:33.671745

epoch 0 -5.008076987396547 20.546775021132028
epoch 5 -4.979254084974858 20.497430640907055
epoch 10 -4.8882459036149255 20.340840313664906
epoch 15 -4.855909878090966 20.284911311373637
epoch 20 -4.836569926225424 20.25138674675667
[32m[I 2022-03-07 04:41:00,706][0m Trial 8 finished with value: 20.274959643996315 and parameters: {'n_layers_fe': 2, 'fe_neurons': 64, 'fe_dropout': 0.05937560203086906, 'n_units_l(Invariant)': 20, 'n_layers_mlp': 2, 'initialiser': 'uniform', 'lr': 4.643966824553675e-05, 'weight_decay': 0.010760982115171468, 'criterion': 'PoissonNLLLoss', 'batch_size': 128, 'epochs': 25}. Best is trial 2 with value: 7.803418561596761.[0m

Trial Id: 9 | Model params: 57772 | Timestamp: 2022-03-07 04:41:00.706847

[32m[I 2022-03-07 04:42:05,045][0m Trial 9 pruned. [0m
epoch 0 0.09285650855518335 7.983878433474158

Trial Id: 10 | Model params: 60528 | Timestamp: 2022-03-07 04:42:05.046011

[32m[I 2022-03-07 04:44:26,029][0m Trial 10 pruned. [0m
epoch 0 0.06437434112032403 8.108247238564106

Trial Id: 11 | Model params: 75868 | Timestamp: 2022-03-07 04:44:26.029495

[32m[I 2022-03-07 04:45:20,801][0m Trial 11 pruned. [0m
epoch 0 -0.4225638511888097 9.997969450152063

Trial Id: 12 | Model params: 94588 | Timestamp: 2022-03-07 04:45:20.801398

[32m[I 2022-03-07 04:46:26,786][0m Trial 12 pruned. [0m
epoch 0 0.08205818537520781 8.031256524780218

Trial Id: 13 | Model params: 93682 | Timestamp: 2022-03-07 04:46:26.787064

epoch 0 -8.192083681787256 25.414578173469092
epoch 5 -6.462601824998236 22.89923932692074
epoch 10 -7.528265806380112 24.479710923329247
epoch 15 -7.633761248012215 24.630653714999987
epoch 20 -7.264483592302547 24.09815436287302
epoch 25 -7.322777038082595 24.182993059339466
epoch 30 -8.444213803266116 25.760769175760085
[32m[I 2022-03-07 05:30:07,255][0m Trial 13 pruned. [0m
++++++++++++++++++++
        NaN         
++++++++++++++++++++

Trial Id: 14 | Model params: 112662 | Timestamp: 2022-03-07 05:30:07.255353

[32m[I 2022-03-07 05:31:33,858][0m Trial 14 pruned. [0m
epoch 0 -0.3163600892677294 9.61752390153826

Study statistics: 
  Number of finished trials:  15
  Number of pruned trials:  9
  Number of complete trials:  6

Best trial:
  Value:  7.803418561596761
  Params: 
    n_layers_fe: 2
    fe_neurons: 128
    fe_dropout: 0.1745952742161505
    n_units_l(Invariant): 189
    n_layers_mlp: 2
    initialiser: normal
    lr: 0.0007059227404394557
    weight_decay: 0.2901343014054404
    criterion: MSELoss
    batch_size: 256
    epochs: 75
Target: 132567, NaN: 0, Max: 159.0, Min: 0.0, Mean: 21.53262878393567
Prediction: 132567, NaN: 0, Max: 38.837242126464844, Min: 12.983022689819336, Mean: 21.47477254844749

 XXXXXX======== TRIAL south - glbg ended

Test Set - R-squared:  0.13340144104899454
Test Set - RMSE:  7.803418561596761
Test Set - MAE:  5.997056894300138



[32m[I 2022-03-07 05:35:13,658][0m A new study created in memory with name: DeepSet[0m
Starting Loading south
Finished Loading south
Finished south setup

++++++++ Session Characteristics +++++++

Area: south
Gal Type: glbg
Training Set: 530265
Validation Set: 132567
Test Samples: 132567
Number of features: 5
Device: cuda:0
Number of Workers: 8
Number of Trials: 15

+++++++++++++++++++++++++++++++++++++++

Previous best Test-set performance: 0.14031004514856982

Trial Id: 0 | Model params: 555688 | Timestamp: 2022-03-07 05:35:13.659829

epoch 0 0.07450858268261795 8.064215388033343
epoch 1 0.0728088384183857 8.071617302194893
epoch 2 0.01598855901201479 8.31526309867593
epoch 3 0.019211520507202873 8.301634317442367
epoch 4 0.005104391492464777 8.361124263920214
epoch 5 0.03610019319993851 8.229849014482086
epoch 6 -6.203044006403147e-05 8.382805514037296
epoch 7 -0.00012883349011616474 8.383085490482658
epoch 8 -5.55842809628615e-05 8.382778497220594
epoch 9 -0.01755890958268913 8.455819458247555
epoch 10 -0.010169457637174029 8.425060686808044
epoch 11 -2.4342963031321716 15.53441139281363
epoch 12 -1.5989143608880054 13.513626317616428
epoch 13 -0.7997940187634758 11.245721478063782
epoch 14 -0.27975787812783603 9.482870656050535
epoch 15 -0.0133822070031413 8.438447609582502
epoch 16 -0.001409004479406617 8.388448974913722
epoch 17 -0.05138881888555824 8.595231893419149
epoch 18 -0.37993349081407435 9.847024049281156
[32m[I 2022-03-07 06:30:40,279][0m Trial 0 finished with value: 8.460219517332778 and parameters: {'lr': 0.008552759995618182, 'weight_decay': 0.18439731839579082, 'criterion': 'MSELoss', 'batch_size': 256, 'epochs': 20}. Best is trial 0 with value: 8.460219517332778.[0m
epoch 19 -0.01861817634044516 8.460219517332778

Previous best Test-set performance: 0.14031004514856982

Trial Id: 1 | Model params: 555688 | Timestamp: 2022-03-07 06:30:40.279230

epoch 0 0.13978057200460403 7.774644584075736
epoch 1 0.14005500553164874 7.773404323007764
epoch 2 0.12924038292385287 7.822130567071592
epoch 3 0.14004672660756345 7.773441741255325
[32m[I 2022-03-07 06:46:33,744][0m Trial 1 finished with value: 7.776068116372847 and parameters: {'lr': 3.838353290097276e-05, 'weight_decay': 0.13759378947274312, 'criterion': 'MSELoss', 'batch_size': 32, 'epochs': 5}. Best is trial 1 with value: 7.776068116372847.[0m
epoch 4 0.13946553194527478 7.776068116372847

Previous best Test-set performance: 0.14031004514856982

Trial Id: 2 | Model params: 555688 | Timestamp: 2022-03-07 06:46:33.744282

epoch 0 -4.842452767531106 20.261590144559694
epoch 1 -4.852264476477298 20.27859648056115
epoch 2 -4.862998759897212 20.297185565035395
epoch 3 -4.866016758095848 20.302408914976667
epoch 4 -4.834739503100156 20.248210950540575
epoch 5 -4.861708288477982 20.294951692883227
epoch 6 -4.845343665245006 20.266602332333747
epoch 7 -4.847406927683408 20.270178822652134
epoch 8 -4.8884594091668125 20.341209085880013
epoch 9 -4.873345272164975 20.315087028093256
epoch 10 -4.855259753501605 20.28378526213813
epoch 11 -4.818806715285524 20.220546391912233
epoch 12 -4.8887345997738745 20.341684392228295
epoch 13 -4.851965293333242 20.278078126356643
epoch 14 -4.869824120464739 20.308996527338547
epoch 15 -4.867705765076553 20.305331549176277
epoch 16 -4.841658286227596 20.260212469593643
epoch 17 -4.8438802624831165 20.264065265223792
epoch 18 -4.864390648980394 20.29959472079552
[32m[I 2022-03-07 07:50:22,659][0m Trial 2 finished with value: 20.32027896277144 and parameters: {'lr': 0.004952701615208998, 'weight_decay': 0.290099185000671, 'criterion': 'PoissonNLLLoss', 'batch_size': 32, 'epochs': 20}. Best is trial 1 with value: 7.776068116372847.[0m
epoch 19 -4.876347762052243 20.32027896277144

Previous best Test-set performance: 0.14031004514856982

Trial Id: 3 | Model params: 555688 | Timestamp: 2022-03-07 07:50:22.659702

epoch 0 0.1385355961543232 7.780268582343824
epoch 1 0.13914030517300469 7.777537404777275
epoch 2 0.139949878447585 7.773879452441192
epoch 3 0.13930799285637896 7.776779870910118
epoch 4 0.13907787903146696 7.777819397796612
epoch 5 0.13796871837068836 7.782828024187447
epoch 6 0.13856933941493232 7.78011620564661
epoch 7 0.1339663054234994 7.800874943438154
epoch 8 0.13521063777001685 7.795268712211063
[32m[I 2022-03-07 08:22:10,878][0m Trial 3 finished with value: 7.779651537555203 and parameters: {'lr': 1.28140699205071e-05, 'weight_decay': 0.21087798888913867, 'criterion': 'MSELoss', 'batch_size': 32, 'epochs': 10}. Best is trial 1 with value: 7.776068116372847.[0m
epoch 9 0.1386722343787078 7.779651537555203

Previous best Test-set performance: 0.14031004514856982

Trial Id: 4 | Model params: 555688 | Timestamp: 2022-03-07 08:22:10.878383

epoch 0 0.07628736690664217 8.056461994556953
epoch 1 0.10230078565929523 7.9422095895287255
epoch 2 0.0887306535633674 8.00201390778081
epoch 3 0.10625664725750272 7.924690931626081
epoch 4 0.09278881880194578 7.984176300727269
epoch 5 0.11132915181857428 7.902170355719604
epoch 6 0.1137356803012407 7.891463528804681
epoch 7 0.11094741671513686 7.903867391213712
epoch 8 0.10937274781358408 7.910863866050052
epoch 9 0.10839814961517602 7.915191044226612
epoch 10 0.1041045303614897 7.934226446824686
epoch 11 0.11194136169820457 7.899447964041454
epoch 12 0.102019619399494 7.943453272547498
epoch 13 0.11363620533973307 7.891906388224397
epoch 14 0.11299125176837443 7.894777098688558
epoch 15 0.09693105522144307 7.965927967685396
epoch 16 0.11120286900628329 7.902731796915091
epoch 17 0.11614762125949041 7.880718025871547
epoch 18 0.11340597877784908 7.892931254378323
[32m[I 2022-03-07 09:18:25,737][0m Trial 4 finished with value: 7.898657202037377 and parameters: {'lr': 0.002800612511084799, 'weight_decay': 0.2267329874122707, 'criterion': 'MSELoss', 'batch_size': 128, 'epochs': 20}. Best is trial 1 with value: 7.776068116372847.[0m
epoch 19 0.11211914826842628 7.898657202037377

Previous best Test-set performance: 0.14031004514856982

Trial Id: 5 | Model params: 555688 | Timestamp: 2022-03-07 09:18:25.737874

epoch 0 0.027146350302704292 8.26798494816724
epoch 1 0.017098519521342448 8.310571985600733
epoch 2 0.03658423523293952 8.227782361362928
epoch 3 0.04201361203007836 8.204565569774298
epoch 4 0.007879552065870099 8.349454865773179
epoch 5 0.04419853573994259 8.195203963438514
epoch 6 0.036793009833935186 8.226890822573152
epoch 7 0.044415358785178216 8.194274371922768
epoch 8 0.045249575821242116 8.190696826023101
epoch 9 0.03957420579203286 8.215004937102002
[32m[I 2022-03-07 09:49:23,169][0m Trial 5 pruned. [0m
epoch 10 0.015612216862471717 8.316853062319472

Previous best Test-set performance: 0.14031004514856982

Trial Id: 6 | Model params: 555688 | Timestamp: 2022-03-07 09:49:23.169622

[32m[I 2022-03-07 09:52:08,797][0m Trial 6 pruned. [0m
epoch 0 0.12323836723674497 7.8490426589664795

Previous best Test-set performance: 0.14031004514856982

Trial Id: 7 | Model params: 555688 | Timestamp: 2022-03-07 09:52:08.797576

[32m[I 2022-03-07 09:54:57,427][0m Trial 7 pruned. [0m
++++++++++++++++++++
        NaN         
++++++++++++++++++++

Previous best Test-set performance: 0.14031004514856982

Trial Id: 8 | Model params: 555688 | Timestamp: 2022-03-07 09:54:57.428170

epoch 0 -4.803287889709434 20.193564172547187
epoch 1 -4.838486166395884 20.25471090260531
epoch 2 -4.849204579469712 20.27329438511314
epoch 3 -4.8433692146055165 20.26317919864676
epoch 4 -4.851890364801857 20.277948305740765
epoch 5 -4.8932703009212055 20.3495168085431
[32m[I 2022-03-07 10:14:44,304][0m Trial 8 pruned. [0m
++++++++++++++++++++
        NaN         
++++++++++++++++++++

Previous best Test-set performance: 0.14031004514856982

Trial Id: 9 | Model params: 555688 | Timestamp: 2022-03-07 10:14:44.304229

epoch 0 -4.8126183036031325 20.209791063569742
epoch 1 -4.816062715034277 20.21577808373619
epoch 2 -4.837831632151429 20.253575524949046
epoch 3 -4.84104410926573 20.259147388223386
epoch 4 -4.851062294213773 20.276513541451283
epoch 5 -4.83975054748374 20.256903961415368
epoch 6 -4.8453748438377 20.26665638247459
epoch 7 -4.855539021926816 20.2842689770768
epoch 8 -4.833248188798852 20.24562314209673
epoch 9 -4.834259590965821 20.24737821739524
epoch 10 -4.859974424468596 20.291949898259123
epoch 11 -4.8330095798494135 20.245209064372435
epoch 12 -4.8606738273713646 20.293160810132512
epoch 13 -4.868832099909287 20.307280309535436
epoch 14 -4.878598540068015 20.324170160188952
