[32m[I 2022-03-15 12:00:48,116][0m A new study created in memory with name: DeepSet[0m
Starting Loading south
Finished Loading south
Finished south setup

++++++++ Session Characteristics +++++++

Area: south
Gal Type: lrg
Training Set: 530265
Validation Set: 132567
Test Samples: 132567
Number of features: 5
Device: cuda:0
Number of Workers: 8
Number of Trials: 20

+++++++++++++++++++++++++++++++++++++++

Trial Id: 0 | Model params: 85752 | Timestamp: 2022-03-15 12:00:48.117299

epoch 0 -1.7273161684903307 8.096321097118343
epoch 5 -1.7332223968414278 8.105082981952714
epoch 10 -1.726328559917921 8.094855055114072
epoch 15 -1.7172403132184977 8.081351647419181
epoch 20 -1.7271083216120777 8.096012583725727
[32m[I 2022-03-15 13:05:39,557][0m Trial 0 finished with value: 8.08645166941664 and parameters: {'n_layers_fe': 2, 'fe_neurons': 128, 'fe_dropout': 0.24951986108209917, 'n_units_l(Invariant)': 59, 'n_layers_mlp': 4, 'initialiser': 'uniform', 'lr': 0.00014857879085921868, 'weight_decay': 0.10919879723361307, 'criterion': 'PoissonNLLLoss', 'batch_size': 32, 'epochs': 25}. Best is trial 0 with value: 8.08645166941664.[0m

Trial Id: 1 | Model params: 467710 | Timestamp: 2022-03-15 13:05:39.557446

epoch 0 0.0009946157666677058 4.900088170869482
epoch 5 -0.0013903883667827355 4.9059338669373584
epoch 10 -0.0014590951563451249 4.9061021655290915
epoch 15 -0.0006779699391707972 4.904188443984223
epoch 20 -0.009986227468325337 4.9269449071140485
epoch 25 -8.274006812580836e-06 4.9025471243810905
epoch 30 -0.0010815905528942515 4.905177389504039
epoch 35 -3.203091620274101e-05 4.9026053582373095
epoch 40 -0.0007431220024201046 4.904348092145105
epoch 45 -0.0009556175442706483 4.904868753624642
epoch 50 -0.005670221121589991 4.916406401049352
epoch 55 -0.00218630211589943 4.907883119046279
epoch 60 -0.0020516429939110292 4.907553383231715
epoch 65 -0.011975450307878388 4.931794463484496
epoch 70 -0.001092467955702503 4.90520403840353
[32m[I 2022-03-15 16:52:24,152][0m Trial 1 finished with value: 4.907286536643648 and parameters: {'n_layers_fe': 4, 'fe_neurons': 256, 'fe_dropout': 0.49628968614555924, 'n_units_l(Invariant)': 126, 'n_layers_mlp': 4, 'initialiser': 'kaiming_he', 'lr': 0.00013978713389453936, 'weight_decay': 0.2946844959112445, 'criterion': 'MSELoss', 'batch_size': 32, 'epochs': 75}. Best is trial 1 with value: 4.907286536643648.[0m

Trial Id: 2 | Model params: 558526 | Timestamp: 2022-03-15 16:52:24.152377

epoch 0 -2.458158559580329 9.11680007878928
[32m[I 2022-03-15 17:08:20,326][0m Trial 2 pruned. [0m
++++++++++++++++++++
        NaN         
++++++++++++++++++++

Trial Id: 3 | Model params: 89648 | Timestamp: 2022-03-15 17:08:20.326806

epoch 0 -1.7595721489035445 8.144057978675672
epoch 5 -1.733023099837375 8.104787479434387
epoch 10 -1.7160943469481609 8.079647357041507
epoch 15 -1.7239663222352677 8.091347386266014
epoch 20 -1.7281790073242922 8.09760170915341
[32m[I 2022-03-15 17:39:27,370][0m Trial 3 finished with value: 8.106994226307055 and parameters: {'n_layers_fe': 2, 'fe_neurons': 128, 'fe_dropout': 0.0846423533147233, 'n_units_l(Invariant)': 343, 'n_layers_mlp': 2, 'initialiser': 'uniform', 'lr': 0.0016400909888167046, 'weight_decay': 0.175520568914024, 'criterion': 'PoissonNLLLoss', 'batch_size': 128, 'epochs': 25}. Best is trial 1 with value: 4.907286536643648.[0m

Trial Id: 4 | Model params: 139576 | Timestamp: 2022-03-15 17:39:27.370900

epoch 0 0.005897690092389829 4.888048672150753
epoch 5 0.005344515162227559 4.889408476822406
epoch 10 0.004784116752650558 4.890785652611774
epoch 15 0.00471223012983335 4.890962285501557
epoch 20 0.003981595737342469 4.892757168240542
[32m[I 2022-03-15 18:53:09,856][0m Trial 4 finished with value: 4.890257573186763 and parameters: {'n_layers_fe': 4, 'fe_neurons': 128, 'fe_dropout': 0.38794301548348686, 'n_units_l(Invariant)': 219, 'n_layers_mlp': 4, 'initialiser': 'kaiming_he', 'lr': 2.7352910341981012e-05, 'weight_decay': 0.15504579195380627, 'criterion': 'MSELoss', 'batch_size': 32, 'epochs': 25}. Best is trial 4 with value: 4.890257573186763.[0m

Trial Id: 5 | Model params: 400884 | Timestamp: 2022-03-15 18:53:09.856629

epoch 0 0.0014922150809221213 4.8988676648284715
epoch 5 0.005591471401470871 4.888801460168954
epoch 10 0.005286312685523709 4.889551527116918
epoch 15 -0.002287877771984359 4.908131829697981
epoch 20 -0.004683639716634103 4.913994265734775
epoch 25 0.00516646003231469 4.8898460882954575
epoch 30 0.004917905250908738 4.8904569034072285
epoch 35 -0.0009417413171421973 4.904834755459514
epoch 40 -0.002335349441115797 4.9082480610006956
epoch 45 -0.0026198754870769836 4.908944646890233
[32m[I 2022-03-15 21:42:16,518][0m Trial 5 finished with value: 4.893274620091063 and parameters: {'n_layers_fe': 4, 'fe_neurons': 256, 'fe_dropout': 0.2971495731002536, 'n_units_l(Invariant)': 377, 'n_layers_mlp': 2, 'initialiser': 'xavier', 'lr': 0.000352998339220346, 'weight_decay': 0.2620013222807404, 'criterion': 'MSELoss', 'batch_size': 32, 'epochs': 50}. Best is trial 4 with value: 4.890257573186763.[0m

Trial Id: 6 | Model params: 143476 | Timestamp: 2022-03-15 21:42:16.518679

epoch 0 -1.7170081645720514 8.081006423091798
epoch 5 -1.7226121842338515 8.089335951150497
epoch 10 -1.7180742142254086 8.082591605894985
epoch 15 -1.7245985576647058 8.092286336877487
epoch 20 -1.7189212161421752 8.083850849902618
[32m[I 2022-03-15 22:24:00,154][0m Trial 6 finished with value: 8.065641513242037 and parameters: {'n_layers_fe': 4, 'fe_neurons': 128, 'fe_dropout': 0.18383495812512163, 'n_units_l(Invariant)': 249, 'n_layers_mlp': 4, 'initialiser': 'kaiming_he', 'lr': 0.0008249446563947803, 'weight_decay': 0.0029771847627825918, 'criterion': 'PoissonNLLLoss', 'batch_size': 256, 'epochs': 25}. Best is trial 4 with value: 4.890257573186763.[0m

Trial Id: 7 | Model params: 330708 | Timestamp: 2022-03-15 22:24:00.154913

[32m[I 2022-03-15 22:26:51,941][0m Trial 7 pruned. [0m
epoch 0 0.004173618880237373 4.892285506325446

Trial Id: 8 | Model params: 31896 | Timestamp: 2022-03-15 22:26:51.941659

epoch 0 -1.717092959903113 8.081132522504678
epoch 5 -1.7186024065039693 8.083376896280464
epoch 10 -1.709117583344438 8.069263690664378
epoch 15 -1.7384864707709502 8.112884255772796
epoch 20 -1.6838703051750508 8.031575436962024
epoch 25 -1.7156583939832055 8.078998909836983
epoch 30 -1.7177490392715704 8.082108113768335
epoch 35 -1.7136393294325747 8.07599502440302
epoch 40 -1.7165508116224206 8.080326258100751
epoch 45 -1.7237652293407222 8.09104871471411
epoch 50 -1.7285718931688545 8.098184757140064
epoch 55 -1.7132765342090766 8.075455153403464
epoch 60 -1.715687693300329 8.07904249199613
epoch 65 -1.710373109888093 8.071133303352182
epoch 70 -1.714326759917673 8.0770178820775
[32m[I 2022-03-16 01:41:44,466][0m Trial 8 finished with value: 8.057864622724326 and parameters: {'n_layers_fe': 2, 'fe_neurons': 64, 'fe_dropout': 0.12512979685784287, 'n_units_l(Invariant)': 171, 'n_layers_mlp': 4, 'initialiser': 'kaiming_he', 'lr': 0.0010500894085428729, 'weight_decay': 0.0026796381007872403, 'criterion': 'PoissonNLLLoss', 'batch_size': 32, 'epochs': 75}. Best is trial 4 with value: 4.890257573186763.[0m

Trial Id: 9 | Model params: 399336 | Timestamp: 2022-03-16 01:41:44.466603

epoch 0 -1.7951600231802853 8.196403279075302
epoch 5 -1.7282694075607874 8.097735868063738
epoch 10 -1.7358690333082851 8.10900619321626
epoch 15 -1.7282149369795916 8.09765503099913
epoch 20 -1.7336903206131846 8.105776741578227
epoch 25 -1.7371874040173099 8.110959756875348
epoch 30 -1.723099428824388 8.090059761335004
epoch 35 -1.7357544717422284 8.108836413493151
epoch 40 -1.7344343392885437 8.106879726604683
epoch 45 -1.738055781963733 8.112246263605599
[32m[I 2022-03-16 03:21:24,169][0m Trial 9 finished with value: 8.102015205805397 and parameters: {'n_layers_fe': 2, 'fe_neurons': 256, 'fe_dropout': 0.1578096317915182, 'n_units_l(Invariant)': 371, 'n_layers_mlp': 4, 'initialiser': 'kaiming_he', 'lr': 4.3783110977633276e-05, 'weight_decay': 0.27787666708907865, 'criterion': 'PoissonNLLLoss', 'batch_size': 128, 'epochs': 50}. Best is trial 4 with value: 4.890257573186763.[0m

Trial Id: 10 | Model params: 78992 | Timestamp: 2022-03-16 03:21:24.169348

[32m[I 2022-03-16 03:24:02,083][0m Trial 10 pruned. [0m
epoch 0 -0.008569418031471931 4.923487933323054

Trial Id: 11 | Model params: 44700 | Timestamp: 2022-03-16 03:24:02.083329

[32m[I 2022-03-16 03:26:41,660][0m Trial 11 pruned. [0m
epoch 0 -0.012621866647293034 4.933369345360055

Trial Id: 12 | Model params: 111102 | Timestamp: 2022-03-16 03:26:41.660236

[32m[I 2022-03-16 03:29:20,721][0m Trial 12 pruned. [0m
epoch 0 -0.04072781191274766 5.001365114863056

Trial Id: 13 | Model params: 434940 | Timestamp: 2022-03-16 03:29:20.721573

[32m[I 2022-03-16 03:32:54,221][0m Trial 13 pruned. [0m
epoch 0 0.003978249555319446 4.892765386985426

Trial Id: 14 | Model params: 58036 | Timestamp: 2022-03-16 03:32:54.221677

[32m[I 2022-03-16 03:34:13,897][0m Trial 14 pruned. [0m
epoch 0 -0.3922600364749409 5.784690914930734

Trial Id: 15 | Model params: 354960 | Timestamp: 2022-03-16 03:34:13.898138

[32m[I 2022-03-16 03:36:54,951][0m Trial 15 pruned. [0m
epoch 0 -0.0020001609517403818 4.907427314821384

Trial Id: 16 | Model params: 116432 | Timestamp: 2022-03-16 03:36:54.951731

[32m[I 2022-03-16 03:39:34,863][0m Trial 16 pruned. [0m
epoch 0 0.0001171922800494718 4.902239565086524

Trial Id: 17 | Model params: 543562 | Timestamp: 2022-03-16 03:39:34.863954

[32m[I 2022-03-16 03:43:09,622][0m Trial 17 pruned. [0m
epoch 0 0.005670312148665757 4.888607654309001

Trial Id: 18 | Model params: 150756 | Timestamp: 2022-03-16 03:43:09.622975

[32m[I 2022-03-16 03:46:07,413][0m Trial 18 pruned. [0m
epoch 0 -0.000548299476017089 4.90387068492053

Trial Id: 19 | Model params: 39416 | Timestamp: 2022-03-16 03:46:07.413246

[32m[I 2022-03-16 03:48:27,647][0m Trial 19 pruned. [0m
epoch 0 0.004712666499180562 4.890961213316045

Study statistics: 
  Number of finished trials:  20
  Number of pruned trials:  12
  Number of complete trials:  8

Best trial:
  Value:  4.890257573186763
  Params: 
    n_layers_fe: 4
    fe_neurons: 128
    fe_dropout: 0.38794301548348686
    n_units_l(Invariant): 219
    n_layers_mlp: 4
    initialiser: kaiming_he
    lr: 2.7352910341981012e-05
    weight_decay: 0.15504579195380627
    criterion: MSELoss
    batch_size: 32
    epochs: 25
Target: 132567, NaN: 0, Max: 227.0, Min: 0.0, Mean: 8.573823047968197
Prediction: 132567, NaN: 0, Max: 9.596036911010742, Min: 8.201252937316895, Mean: 8.512356280787735

 XXXXXX======== TRIAL south - lrg ended

Test Set - R-squared:  0.0049990207356052085
Test Set - RMSE:  4.890257573186763
Test Set - MAE:  3.302143143648237



[32m[I 2022-03-16 03:49:18,063][0m A new study created in memory with name: DeepSet[0m
Starting Loading south
Finished Loading south
Finished south setup

++++++++ Session Characteristics +++++++

Area: south
Gal Type: lrg
Training Set: 530265
Validation Set: 132567
Test Samples: 132567
Number of features: 5
Device: cuda:0
Number of Workers: 8
Number of Trials: 20

+++++++++++++++++++++++++++++++++++++++

Previous best Test-set performance: 0.006369378186776742

Trial Id: 0 | Model params: 363990 | Timestamp: 2022-03-16 03:49:18.063732

epoch 0 0.004022566324906163 4.892656536968763
epoch 1 -0.07883382497206215 5.09210391198364
epoch 2 -0.07786527283269518 5.089817611965674
epoch 3 0.002249129520935589 4.8970105302570275
epoch 4 -0.008203069652651163 4.9225936589116275
epoch 5 0.0007845675133613117 4.900603283641223
epoch 6 -0.00653658034743132 4.918523624475834
epoch 7 -0.00343683049309762 4.91094419347718
epoch 8 -0.015719190212264866 4.940908474715207
[32m[I 2022-03-16 04:19:47,087][0m Trial 0 finished with value: 4.894018775875691 and parameters: {'lr': 0.007365650719650691, 'weight_decay': 0.19954854211407144, 'criterion': 'MSELoss', 'batch_size': 32, 'epochs': 10}. Best is trial 0 with value: 4.894018775875691.[0m
epoch 9 0.003467878670744051 4.894018775875691

Previous best Test-set performance: 0.006369378186776742

Trial Id: 1 | Model params: 363990 | Timestamp: 2022-03-16 04:19:47.087326

epoch 0 0.004784079342695646 4.890785744533573
epoch 1 0.006364722868348771 4.886900325996252
epoch 2 0.006326237038731253 4.886994965647494
epoch 3 0.005382839303387232 4.889314281300184
epoch 4 -0.004045783977295603 4.91243411437155
epoch 5 0.0034323560652683716 4.894106001738869
epoch 6 0.005110297754383986 4.889984111898508
epoch 7 0.006378323567311273 4.886866880380357
epoch 8 0.0058459255970846336 4.888175934745468
[32m[I 2022-03-16 04:47:27,917][0m Trial 1 finished with value: 4.889048905192307 and parameters: {'lr': 0.001179532716943458, 'weight_decay': 0.1698605073597023, 'criterion': 'MSELoss', 'batch_size': 128, 'epochs': 10}. Best is trial 1 with value: 4.889048905192307.[0m
epoch 9 0.00549080555494641 4.889048905192307

Previous best Test-set performance: 0.006369378186776742

Trial Id: 2 | Model params: 363990 | Timestamp: 2022-03-16 04:47:27.917350

epoch 0 -1.7190171231729203 8.08399342323107
epoch 1 -1.7365067905086136 8.109951281536167
epoch 2 -1.6959326857020125 8.049603750155045
epoch 3 -1.7113247774913365 8.07255014923481
epoch 4 -1.7172408973908246 8.081352516113371
epoch 5 -1.7214466683283742 8.087604294505617
epoch 6 -1.7287274444684817 8.098415585804348
epoch 7 -1.7190732057313105 8.084076793190665
epoch 8 -1.726046784754947 8.094436729151017
epoch 9 -1.7198098795736403 8.085171821560683
epoch 10 -1.7222949302162966 8.088864630058358
epoch 11 -1.729313957803261 8.09928587674095
epoch 12 -1.7273184691187815 8.096324511944784
epoch 13 -1.7281930854292695 8.097622601979644
epoch 14 -1.7252180773888988 8.093206297367589
epoch 15 -1.724395699700588 8.09198507868229
epoch 16 -1.7114824085891187 8.072784806930208
epoch 17 -1.7198411768619413 8.085218340111007
epoch 18 -1.7391746207111511 8.113903528679709
[32m[I 2022-03-16 05:41:52,995][0m Trial 2 finished with value: 8.08698579743938 and parameters: {'lr': 0.000657413902766706, 'weight_decay': 0.15904514640627052, 'criterion': 'PoissonNLLLoss', 'batch_size': 256, 'epochs': 20}. Best is trial 1 with value: 4.889048905192307.[0m
epoch 19 -1.721030440640266 8.08698579743938

Previous best Test-set performance: 0.006369378186776742

Trial Id: 3 | Model params: 363990 | Timestamp: 2022-03-16 05:41:52.995994

epoch 0 0.00032618449721311116 4.9017272133141825
epoch 1 0.004331249687206218 4.891898287505518
epoch 2 0.005510061310142422 4.889001573913175
epoch 3 0.0014466310662388793 4.898979485442367
epoch 4 0.002956093619800315 4.8952753154779325
epoch 5 0.005081404082616814 4.890055119051229
epoch 6 0.006019578356581734 4.887748997748052
epoch 7 0.0041567898949896875 4.892326844782798
epoch 8 0.004474259503966738 4.8915469585117455
[32m[I 2022-03-16 06:12:41,860][0m Trial 3 finished with value: 4.9512525498187285 and parameters: {'lr': 0.0014618166953685406, 'weight_decay': 0.2266200635872109, 'criterion': 'MSELoss', 'batch_size': 32, 'epochs': 10}. Best is trial 1 with value: 4.889048905192307.[0m
epoch 9 -0.019976574782433865 4.9512525498187285

Previous best Test-set performance: 0.006369378186776742

Trial Id: 4 | Model params: 363990 | Timestamp: 2022-03-16 06:12:41.860874

epoch 0 -1.7463501958086258 8.124524217811727
epoch 1 -1.706399262119576 8.065214335996478
epoch 2 -1.7250534313260033 8.092961815156983
epoch 3 -1.7374981099316567 8.111420092848556
[32m[I 2022-03-16 06:28:08,219][0m Trial 4 finished with value: 8.109234468510056 and parameters: {'lr': 0.00019139823908524825, 'weight_decay': 0.1349025052552769, 'criterion': 'PoissonNLLLoss', 'batch_size': 32, 'epochs': 5}. Best is trial 1 with value: 4.889048905192307.[0m
epoch 4 -1.7360230694707992 8.109234468510056

Previous best Test-set performance: 0.006369378186776742

Trial Id: 5 | Model params: 363990 | Timestamp: 2022-03-16 06:28:08.220009

[32m[I 2022-03-16 06:30:50,588][0m Trial 5 pruned. [0m
epoch 0 0.006361937345066515 4.886907175876389

Previous best Test-set performance: 0.006369378186776742

Trial Id: 6 | Model params: 363990 | Timestamp: 2022-03-16 06:30:50.588658

[32m[I 2022-03-16 06:33:32,460][0m Trial 6 pruned. [0m
epoch 0 0.006353367023855583 4.886928251092551

Previous best Test-set performance: 0.006369378186776742

Trial Id: 7 | Model params: 363990 | Timestamp: 2022-03-16 06:33:32.460236

[32m[I 2022-03-16 06:36:08,045][0m Trial 7 pruned. [0m
epoch 0 0.005473912960989424 4.889090427366131

Previous best Test-set performance: 0.006369378186776742

Trial Id: 8 | Model params: 363990 | Timestamp: 2022-03-16 06:36:08.045903

[32m[I 2022-03-16 06:39:07,058][0m Trial 8 pruned. [0m
epoch 0 0.006370521056173306 4.886886067642126

Previous best Test-set performance: 0.006369378186776742

Trial Id: 9 | Model params: 363990 | Timestamp: 2022-03-16 06:39:07.059172

epoch 0 -1.7450828973807346 8.122649477866167
epoch 1 -1.7033690908754497 8.060698035427077
epoch 2 -1.7330265168510648 8.104792546014528
epoch 3 -1.7190101356923115 8.083983035877658
[32m[I 2022-03-16 06:52:42,308][0m Trial 9 finished with value: 8.110872021704651 and parameters: {'lr': 0.008034590368259905, 'weight_decay': 0.17432340184973602, 'criterion': 'PoissonNLLLoss', 'batch_size': 256, 'epochs': 5}. Best is trial 1 with value: 4.889048905192307.[0m
epoch 4 -1.7371281887548764 8.110872021704651

Previous best Test-set performance: 0.006369378186776742

Trial Id: 10 | Model params: 363990 | Timestamp: 2022-03-16 06:52:42.308850

[32m[I 2022-03-16 06:55:26,775][0m Trial 10 pruned. [0m
epoch 0 -0.047727216958681096 5.018155248563544

Previous best Test-set performance: 0.006369378186776742

Trial Id: 11 | Model params: 363990 | Timestamp: 2022-03-16 06:55:26.775809

[32m[I 2022-03-16 06:58:11,106][0m Trial 11 pruned. [0m
epoch 0 0.005402541564277885 4.889265855118529

Previous best Test-set performance: 0.006369378186776742

Trial Id: 12 | Model params: 363990 | Timestamp: 2022-03-16 06:58:11.106250

[32m[I 2022-03-16 07:00:55,863][0m Trial 12 pruned. [0m
epoch 0 0.0037558482229347323 4.893311608392655

Previous best Test-set performance: 0.006369378186776742

Trial Id: 13 | Model params: 363990 | Timestamp: 2022-03-16 07:00:55.863642

[32m[I 2022-03-16 07:03:54,926][0m Trial 13 pruned. [0m
epoch 0 -0.010935913969202016 4.929260757337625

Previous best Test-set performance: 0.006369378186776742

Trial Id: 14 | Model params: 363990 | Timestamp: 2022-03-16 07:03:54.926413

[32m[I 2022-03-16 07:06:51,367][0m Trial 14 pruned. [0m
epoch 0 0.0030251829452098145 4.89510570553082

Previous best Test-set performance: 0.006369378186776742

Trial Id: 15 | Model params: 363990 | Timestamp: 2022-03-16 07:06:51.368049

[32m[I 2022-03-16 07:09:28,929][0m Trial 15 pruned. [0m
epoch 0 -0.013891825163108829 4.936461916987512

Previous best Test-set performance: 0.006369378186776742

Trial Id: 16 | Model params: 363990 | Timestamp: 2022-03-16 07:09:28.929526

[32m[I 2022-03-16 07:12:25,550][0m Trial 16 pruned. [0m
epoch 0 -0.252613538489892 5.486918770922235

Previous best Test-set performance: 0.006369378186776742

Trial Id: 17 | Model params: 363990 | Timestamp: 2022-03-16 07:12:25.550589

epoch 0 -1.7237931776264466 8.091090225333083
epoch 1 -1.734055934666408 8.106318772031166
epoch 2 -1.6836016846251631 8.031173498725298
epoch 3 -1.7353873619926325 8.108292334554834
epoch 4 -1.720431802853072 8.086096163587916
epoch 5 -1.6948984994085747 8.048059648473433
epoch 6 -1.734838755855511 8.107479198899002
epoch 7 -1.7327957627836401 8.104450388096904
epoch 8 -1.7207848236393022 8.086620798578156
[32m[I 2022-03-16 07:38:24,685][0m Trial 17 finished with value: 8.130909894619432 and parameters: {'lr': 0.0032870343491378266, 'weight_decay': 0.20048184087592563, 'criterion': 'PoissonNLLLoss', 'batch_size': 128, 'epochs': 10}. Best is trial 1 with value: 4.889048905192307.[0m
epoch 9 -1.7506690202041502 8.130909894619432

Previous best Test-set performance: 0.006369378186776742

Trial Id: 18 | Model params: 363990 | Timestamp: 2022-03-16 07:38:24.685693

[32m[I 2022-03-16 07:41:08,441][0m Trial 18 pruned. [0m
epoch 0 0.0019455957659525458 4.897755352941527

Previous best Test-set performance: 0.006369378186776742

Trial Id: 19 | Model params: 363990 | Timestamp: 2022-03-16 07:41:08.441951

[32m[I 2022-03-16 07:44:11,748][0m Trial 19 pruned. [0m
epoch 0 0.006348995613243424 4.8869390007624105

Study statistics: 
  Number of finished trials:  20
  Number of pruned trials:  13
  Number of complete trials:  7

Best trial:
  Value:  4.889048905192307
  Params: 
    lr: 0.001179532716943458
    weight_decay: 0.1698605073597023
    criterion: MSELoss
    batch_size: 128
    epochs: 10
Target: 132567, NaN: 0, Max: 227.0, Min: 0.0, Mean: 8.573823047968197
Prediction: 132567, NaN: 0, Max: 10.448097229003906, Min: 8.239008903503418, Mean: 8.717023264666045

 XXXXXX======== TRIAL south - lrg ended

Test Set - R-squared:  0.00549080555494641
Test Set - RMSE:  4.889048905192307
Test Set - MAE:  3.331808262144275



