[32m[I 2022-03-06 23:12:19,251][0m A new study created in memory with name: DeepSet[0m
Starting Loading south
Finished Loading south
Finished south setup

++++++++ Session Characteristics +++++++

Area: south
Gal Type: lrg
Training Set: 530265
Validation Set: 132567
Test Samples: 132567
Number of features: 5
Device: cuda:0
Number of Workers: 8
Number of Trials: 15

+++++++++++++++++++++++++++++++++++++++

Trial Id: 0 | Model params: 328902 | Timestamp: 2022-03-06 23:12:19.271355

epoch 0 0.004348832280477666 4.891855094105296
epoch 5 0.004534463082522033 4.891399050189556
epoch 10 0.005853826167134146 4.888156511471899
epoch 15 0.006052804787397337 4.887667304081061
epoch 20 0.004661251891192597 4.891087540456718
epoch 25 0.006083586410473352 4.887591620232741
epoch 30 0.00528305920317651 4.889559523416142
epoch 35 0.005478622761123653 4.88907885066326
epoch 40 0.00534710501379676 4.889402111376957
epoch 45 0.005829170936785033 4.888217125233098
[32m[I 2022-03-07 00:11:02,291][0m Trial 0 finished with value: 4.889392462286477 and parameters: {'n_layers_fe': 2, 'fe_neurons': 256, 'fe_dropout': 0.3414127951384781, 'n_units_l(Invariant)': 98, 'n_layers_mlp': 4, 'initialiser': 'normal', 'lr': 0.00015625984035072353, 'weight_decay': 0.044306924503157416, 'criterion': 'MSELoss', 'batch_size': 128, 'epochs': 50}. Best is trial 0 with value: 4.889392462286477.[0m

Trial Id: 1 | Model params: 336126 | Timestamp: 2022-03-07 00:11:02.291424

epoch 0 0.003047407340668218 4.895051144788942
epoch 5 0.0019493002143519123 4.897746263507756
epoch 10 0.005367338955525769 4.889352379263849
epoch 15 0.004967177469856643 4.890335824630151
epoch 20 0.005623769289764047 4.888722066619402
[32m[I 2022-03-07 01:16:16,523][0m Trial 1 finished with value: 4.8894759765038875 and parameters: {'n_layers_fe': 2, 'fe_neurons': 256, 'fe_dropout': 0.49770894899209506, 'n_units_l(Invariant)': 126, 'n_layers_mlp': 4, 'initialiser': 'uniform', 'lr': 3.019755479188084e-05, 'weight_decay': 0.09444813904364874, 'criterion': 'MSELoss', 'batch_size': 32, 'epochs': 25}. Best is trial 0 with value: 4.889392462286477.[0m

Trial Id: 2 | Model params: 353928 | Timestamp: 2022-03-07 01:16:16.523814

[32m[I 2022-03-07 01:17:33,339][0m Trial 2 pruned. [0m
++++++++++++++++++++
        NaN         
++++++++++++++++++++

Trial Id: 3 | Model params: 152056 | Timestamp: 2022-03-07 01:17:33.339704

epoch 0 -2.9208944258339633 9.707615234185655
epoch 5 -2.7165795545228852 9.451303228088149
epoch 10 -2.7374306645777464 9.477778449197219
epoch 15 -2.749858377715748 9.493523136962484
[32m[I 2022-03-07 01:48:58,846][0m Trial 3 pruned. [0m
++++++++++++++++++++
        NaN         
++++++++++++++++++++

Trial Id: 4 | Model params: 73528 | Timestamp: 2022-03-07 01:48:58.846657

epoch 0 -1.7232773772439312 8.09032409061641
epoch 5 -1.7213082589457551 8.08739862915794
epoch 10 -1.7242483202388863 8.091766202890085
epoch 15 -1.7401460729832237 8.115342204990808
epoch 20 -1.7205573252797866 8.086282710206046
[32m[I 2022-03-07 02:10:20,272][0m Trial 4 finished with value: 8.10459537318125 and parameters: {'n_layers_fe': 2, 'fe_neurons': 128, 'fe_dropout': 0.17877672933739047, 'n_units_l(Invariant)': 219, 'n_layers_mlp': 2, 'initialiser': 'xavier', 'lr': 7.42004646396872e-05, 'weight_decay': 0.26422551602829486, 'criterion': 'PoissonNLLLoss', 'batch_size': 256, 'epochs': 25}. Best is trial 0 with value: 4.889392462286477.[0m

Trial Id: 5 | Model params: 115002 | Timestamp: 2022-03-07 02:10:20.272934

epoch 0 -0.03906646695780247 4.997371606075725
epoch 5 0.005323164416433879 4.889460953262168
epoch 10 0.005695650378149342 4.888545366391195
epoch 15 0.005839672422481956 4.888191307900561
epoch 20 0.004828209249734705 4.890677309615877
epoch 25 -6.372720189373737e-05 4.90268305232308
epoch 30 0.005668450328786601 4.88861223111223
epoch 35 0.0040683281905515845 4.8925441349928676
epoch 40 0.004656354548136066 4.89109957319642
epoch 45 0.005332982673023734 4.889436821755847
[32m[I 2022-03-07 03:19:27,294][0m Trial 5 finished with value: 4.888580145229205 and parameters: {'n_layers_fe': 4, 'fe_neurons': 128, 'fe_dropout': 0.35350119731076735, 'n_units_l(Invariant)': 284, 'n_layers_mlp': 2, 'initialiser': 'uniform', 'lr': 7.736121294234126e-05, 'weight_decay': 0.22853173557406486, 'criterion': 'MSELoss', 'batch_size': 256, 'epochs': 50}. Best is trial 5 with value: 4.888580145229205.[0m

Trial Id: 6 | Model params: 89262 | Timestamp: 2022-03-07 03:19:27.294792

epoch 0 0.004816208652789089 4.89070679742431
epoch 5 0.003910824836689031 4.8929309896676125
epoch 10 0.005687067498691745 4.888566465416395
epoch 15 0.005695291941001157 4.888546247527893
epoch 20 0.005436963254505045 4.889181248904511
[32m[I 2022-03-07 04:23:53,736][0m Trial 6 finished with value: 4.888234240181846 and parameters: {'n_layers_fe': 2, 'fe_neurons': 128, 'fe_dropout': 0.35790542179383084, 'n_units_l(Invariant)': 86, 'n_layers_mlp': 4, 'initialiser': 'xavier', 'lr': 3.1404339683265314e-05, 'weight_decay': 0.08270643262057592, 'criterion': 'MSELoss', 'batch_size': 32, 'epochs': 25}. Best is trial 6 with value: 4.888234240181846.[0m

Trial Id: 7 | Model params: 49188 | Timestamp: 2022-03-07 04:23:53.736863

epoch 0 -2.3823508231453645 9.016319770804902
epoch 5 -2.1300985529665253 8.67359193495999
epoch 10 -1.7813038233511231 8.176062386319423
epoch 15 -1.7269805630407564 8.095822941989237
epoch 20 -1.7232672092367864 8.090308987022734
[32m[I 2022-03-07 04:49:24,503][0m Trial 7 finished with value: 8.094172403232518 and parameters: {'n_layers_fe': 4, 'fe_neurons': 64, 'fe_dropout': 0.08153616627219823, 'n_units_l(Invariant)': 433, 'n_layers_mlp': 2, 'initialiser': 'normal', 'lr': 0.00018271158568737607, 'weight_decay': 0.0831658796973453, 'criterion': 'PoissonNLLLoss', 'batch_size': 256, 'epochs': 25}. Best is trial 6 with value: 4.888234240181846.[0m

Trial Id: 8 | Model params: 315744 | Timestamp: 2022-03-07 04:49:24.503801

epoch 0 -0.36164564846292 5.7207376468229
epoch 5 0.0046368651345708445 4.891147458264146
epoch 10 0.004736885036359828 4.8909017065572495
epoch 15 0.003731020761422621 4.893372581271899
epoch 20 0.004910545533506672 4.890474988505139
epoch 25 0.004986078275875272 4.89028937805792
epoch 30 0.004587101660156856 4.8912697239181195
epoch 35 0.005011835143675425 4.890226082786661
epoch 40 0.004959879222895536 4.890353759120511
epoch 45 0.003625285259809208 4.893632244820489
[32m[I 2022-03-07 06:58:58,600][0m Trial 8 finished with value: 4.894093799647321 and parameters: {'n_layers_fe': 2, 'fe_neurons': 256, 'fe_dropout': 0.4534212525435195, 'n_units_l(Invariant)': 47, 'n_layers_mlp': 4, 'initialiser': 'kaiming_he', 'lr': 1.4170546514098324e-05, 'weight_decay': 0.24621080727056935, 'criterion': 'MSELoss', 'batch_size': 32, 'epochs': 50}. Best is trial 6 with value: 4.888234240181846.[0m

Trial Id: 9 | Model params: 45822 | Timestamp: 2022-03-07 06:58:58.600842

epoch 0 -1.8985826170943252 8.34666190241046
epoch 5 -1.7325296197682003 8.104055738154145
epoch 10 -1.7328930696504021 8.104594674703474
epoch 15 -1.726035795350621 8.094420413743638
epoch 20 -1.7255957367951682 8.0937670542528
epoch 25 -1.7326178007136965 8.104186499322642
epoch 30 -1.7216515175509217 8.087908674579616
epoch 35 -1.7272884292846857 8.096279923658233
epoch 40 -1.722193056770637 8.08871327830517
epoch 45 -1.7280668733998388 8.09743529316927
[32m[I 2022-03-07 07:40:59,498][0m Trial 9 finished with value: 8.094527981955194 and parameters: {'n_layers_fe': 2, 'fe_neurons': 64, 'fe_dropout': 0.13652509447275063, 'n_units_l(Invariant)': 382, 'n_layers_mlp': 4, 'initialiser': 'uniform', 'lr': 3.60001220604203e-05, 'weight_decay': 0.1493009372044042, 'criterion': 'PoissonNLLLoss', 'batch_size': 128, 'epochs': 50}. Best is trial 6 with value: 4.888234240181846.[0m

Trial Id: 10 | Model params: 82502 | Timestamp: 2022-03-07 07:40:59.499257

[32m[I 2022-03-07 07:43:37,100][0m Trial 10 pruned. [0m
epoch 0 -0.026422241634687538 4.966872449417875

Trial Id: 11 | Model params: 117212 | Timestamp: 2022-03-07 07:43:37.100798

[32m[I 2022-03-07 07:45:02,426][0m Trial 11 pruned. [0m
epoch 0 0.005720818502500946 4.888483495850091

Trial Id: 12 | Model params: 100442 | Timestamp: 2022-03-07 07:45:02.426962

[32m[I 2022-03-07 07:47:38,590][0m Trial 12 pruned. [0m
epoch 0 -0.0026662395953602758 4.909058147637415

Trial Id: 13 | Model params: 114092 | Timestamp: 2022-03-07 07:47:38.591070

[32m[I 2022-03-07 07:50:18,925][0m Trial 13 pruned. [0m
epoch 0 0.0031853217528317046 4.894712552234332

Trial Id: 14 | Model params: 174416 | Timestamp: 2022-03-07 07:50:18.925340

[32m[I 2022-03-07 07:52:01,565][0m Trial 14 pruned. [0m
epoch 0 -0.12162736943289798 5.192114716105674

Study statistics: 
  Number of finished trials:  15
  Number of pruned trials:  7
  Number of complete trials:  8

Best trial:
  Value:  4.888234240181846
  Params: 
    n_layers_fe: 2
    fe_neurons: 128
    fe_dropout: 0.35790542179383084
    n_units_l(Invariant): 86
    n_layers_mlp: 4
    initialiser: xavier
    lr: 3.1404339683265314e-05
    weight_decay: 0.08270643262057592
    criterion: MSELoss
    batch_size: 32
    epochs: 25
Target: 132567, NaN: 0, Max: 227.0, Min: 0.0, Mean: 8.573823047968197
Prediction: 132567, NaN: 0, Max: 9.934069633483887, Min: 8.190690994262695, Mean: 8.53715264826256

 XXXXXX======== TRIAL south - lrg ended

Test Set - R-squared:  0.005822209211420515
Test Set - RMSE:  4.888234240181846
Test Set - MAE:  3.3050774608788944



[32m[I 2022-03-07 07:54:46,058][0m A new study created in memory with name: DeepSet[0m
Starting Loading south
Finished Loading south
Finished south setup

++++++++ Session Characteristics +++++++

Area: south
Gal Type: lrg
Training Set: 530265
Validation Set: 132567
Test Samples: 132567
Number of features: 5
Device: cuda:0
Number of Workers: 8
Number of Trials: 15

+++++++++++++++++++++++++++++++++++++++

Previous best Test-set performance: 0.005822209211420515

Trial Id: 0 | Model params: 89262 | Timestamp: 2022-03-07 07:54:46.058942

epoch 0 -1.7426211187269893 8.119006482194555
epoch 1 -1.740110982133595 8.115290241490117
epoch 2 -1.7100016122189245 8.070580148889773
epoch 3 -1.7250550680349375 8.092964245535185
epoch 4 -1.74951856018615 8.12920935104603
epoch 5 -1.7270697192024063 8.09595528370982
epoch 6 -1.7201021623664219 8.085606244042282
epoch 7 -1.726177893602542 8.09463137722484
epoch 8 -1.7245992959212542 8.092287433219362
[32m[I 2022-03-07 08:21:11,072][0m Trial 0 finished with value: 8.089516980270236 and parameters: {'lr': 0.006933940659895778, 'weight_decay': 0.07080356073272666, 'criterion': 'PoissonNLLLoss', 'batch_size': 32, 'epochs': 10}. Best is trial 0 with value: 8.089516980270236.[0m
epoch 9 -1.722734042840047 8.089516980270236

Previous best Test-set performance: 0.005822209211420515

Trial Id: 1 | Model params: 89262 | Timestamp: 2022-03-07 08:21:11.072637

epoch 0 -1.7219684048986021 8.08837950659346
epoch 1 -1.71610778454576 8.07966734362919
epoch 2 -1.724801626781339 8.092587897416582
epoch 3 -1.7171709769980663 8.081248540242566
epoch 4 -1.732763114381266 8.104401976475522
epoch 5 -1.7239412917658377 8.09131021056986
epoch 6 -1.7190431637084318 8.084032134096843
epoch 7 -1.7204867885307635 8.086177881723676
epoch 8 -1.6953793462392284 8.0487776182535
epoch 9 -1.733559182896729 8.105582318348896
epoch 10 -1.7346842598315506 8.10725019252917
epoch 11 -1.701592849275984 8.05804947000326
epoch 12 -1.738842676382311 8.113411875857743
epoch 13 -1.7026509020326004 8.059627244177213
epoch 14 -1.7214293362555062 8.087578540708607
epoch 15 -1.741289136138919 8.117034702618373
epoch 16 -1.7270408315886439 8.095912403719078
epoch 17 -1.7134926857419472 8.075776810120983
epoch 18 -1.7170867302757649 8.081123258472536
[32m[I 2022-03-07 08:35:26,899][0m Trial 1 finished with value: 8.119601148543099 and parameters: {'lr': 0.0053971763991944085, 'weight_decay': 0.05393825709817922, 'criterion': 'PoissonNLLLoss', 'batch_size': 256, 'epochs': 20}. Best is trial 0 with value: 8.089516980270236.[0m
epoch 19 -1.7430228930617977 8.119601148543099

Previous best Test-set performance: 0.005822209211420515

Trial Id: 2 | Model params: 89262 | Timestamp: 2022-03-07 08:35:26.899605

epoch 0 -0.9644817850046454 6.871380267269784
epoch 1 -1.529178039584722 7.796679489471367
epoch 2 -1.5556602906132957 7.837391521376553
epoch 3 -1.5507187039105266 7.829810723271781
epoch 4 -1.5503956589265413 7.829314890241163
epoch 5 -1.5741390641081714 7.865674727566769
epoch 6 -1.6315254441687053 7.95286786849888
epoch 7 -1.712832444622971 8.074794260154032
epoch 8 -1.712544016402608 8.074364992867194
[32m[I 2022-03-07 08:42:36,465][0m Trial 2 finished with value: 8.08242535925124 and parameters: {'lr': 1.1439056935637643e-05, 'weight_decay': 0.023775215123525106, 'criterion': 'PoissonNLLLoss', 'batch_size': 256, 'epochs': 10}. Best is trial 2 with value: 8.08242535925124.[0m
epoch 9 -1.7179624020516777 8.08242535925124

Previous best Test-set performance: 0.005822209211420515

Trial Id: 3 | Model params: 89262 | Timestamp: 2022-03-07 08:42:36.465415

epoch 0 -1.7003486625932411 8.056193736557987
epoch 1 -1.717661458861341 8.081977888343443
epoch 2 -1.7342739692136417 8.106641995540336
epoch 3 -1.722775277683478 8.089578236474097
epoch 4 -1.7256350893409578 8.093825483532065
epoch 5 -1.7114691752686317 8.072765107396371
epoch 6 -1.7244041294185162 8.091997597623452
epoch 7 -1.729613286961384 8.099729996763994
epoch 8 -1.7210705073723647 8.087045336997598
epoch 9 -1.7233814740592255 8.09047871477106
epoch 10 -1.716879499780926 8.080815081503893
epoch 11 -1.7308041333008073 8.101496635664823
epoch 12 -1.727131841172509 8.096047495108813
epoch 13 -1.7353013883224104 8.10816491107937
epoch 14 -1.729110102312954 8.0989833987647
epoch 15 -1.7375598324747257 8.111511536684107
epoch 16 -1.7386742793370171 8.113162446490945
epoch 17 -1.7409540383731548 8.116538570472633
epoch 18 -1.7138010648272286 8.076235689174975
[32m[I 2022-03-07 08:58:37,733][0m Trial 3 finished with value: 8.103920527238287 and parameters: {'lr': 0.0008618351257734204, 'weight_decay': 0.14929695367617182, 'criterion': 'PoissonNLLLoss', 'batch_size': 128, 'epochs': 20}. Best is trial 2 with value: 8.08242535925124.[0m
epoch 19 -1.732438439558618 8.103920527238287

Previous best Test-set performance: 0.005822209211420515

Trial Id: 4 | Model params: 89262 | Timestamp: 2022-03-07 08:58:37.733899

epoch 0 -0.008284821430249556 4.922793233102839
epoch 1 -0.004100829841069187 4.9125687723110785
epoch 2 -1.863252999356746e-05 4.902572515679266
epoch 3 -0.01302348258015873 4.93434756012275
epoch 4 -0.0009477202558436648 4.904849404495187
epoch 5 -0.003356492282779344 4.910747596963702
epoch 6 -1.66117103084229e-05 4.902567562161535
epoch 7 -0.007822868658988291 4.921665397762459
epoch 8 -0.005898279293989672 4.916963821899877
epoch 9 -0.001281487062822828 4.905667099287337
epoch 10 -0.0036587771812808256 4.9114872807456535
epoch 11 -0.0006769168142031212 4.904185863371473
epoch 12 -0.00026680710191628876 4.903180813524164
epoch 13 -0.002793092929670893 4.9093686750465695
epoch 14 -3.2721227451348867e-05 4.9026070503446295
epoch 15 -0.002471028386009655 4.908580246922308
epoch 16 -0.0007183642328236761 4.904287426491554
epoch 17 -0.014670607273599146 4.938357429990253
epoch 18 -0.012590821098842131 4.933293719731175
[32m[I 2022-03-07 09:50:40,578][0m Trial 4 finished with value: 4.9569172942102915 and parameters: {'lr': 0.004425995167278122, 'weight_decay': 0.2560259962411263, 'criterion': 'MSELoss', 'batch_size': 32, 'epochs': 20}. Best is trial 4 with value: 4.9569172942102915.[0m
epoch 19 -0.022311827038041576 4.9569172942102915

Previous best Test-set performance: 0.005822209211420515

Trial Id: 5 | Model params: 89262 | Timestamp: 2022-03-07 09:50:40.579127

[32m[I 2022-03-07 09:53:16,062][0m Trial 5 pruned. [0m
epoch 0 -0.02159065369533586 4.955168597194323

Previous best Test-set performance: 0.005822209211420515

Trial Id: 6 | Model params: 89262 | Timestamp: 2022-03-07 09:53:16.062465

epoch 0 -1.7120987918051913 8.073702320960937
epoch 1 -1.7193653055912592 8.084511002589585
epoch 2 -1.7290154595932865 8.09884296535743
epoch 3 -1.7231720765669998 8.090167675253461
epoch 4 -1.731586184896134 8.102656611721528
epoch 5 -1.7438598468940456 8.120839784395137
epoch 6 -1.7364381809701355 8.109849614786407
epoch 7 -1.7329779593194186 8.104720546993265
epoch 8 -1.7382904466365123 8.112593885600933
epoch 9 -1.7396212820401926 8.114565045323353
epoch 10 -1.737799848829888 8.111867118457885
epoch 11 -1.698332695709499 8.053185967162364
epoch 12 -1.7311504102521593 8.102010270567273
epoch 13 -1.7290067628246675 8.098830060736606
epoch 14 -1.7162823482714478 8.079926978791823
epoch 15 -1.7221518288956061 8.088652025903906
epoch 16 -1.7347529238817523 8.10735197267763
epoch 17 -1.7430648836564249 8.119663296324735
epoch 18 -1.7291438673695443 8.09903349967245
[32m[I 2022-03-07 10:07:33,409][0m Trial 6 finished with value: 8.095935171839379 and parameters: {'lr': 0.0028461231334659986, 'weight_decay': 0.25710316627676694, 'criterion': 'PoissonNLLLoss', 'batch_size': 256, 'epochs': 20}. Best is trial 4 with value: 4.9569172942102915.[0m
epoch 19 -1.7270561701145404 8.095935171839379

Previous best Test-set performance: 0.005822209211420515

Trial Id: 7 | Model params: 89262 | Timestamp: 2022-03-07 10:07:33.410061

[32m[I 2022-03-07 10:08:16,436][0m Trial 7 pruned. [0m
epoch 0 -1.589145616667182 7.888568815112892

Previous best Test-set performance: 0.005822209211420515

Trial Id: 8 | Model params: 89262 | Timestamp: 2022-03-07 10:08:16.436503

[32m[I 2022-03-07 10:09:03,719][0m Trial 8 pruned. [0m
epoch 0 -0.00039156211550817055 4.903486570604636

Previous best Test-set performance: 0.005822209211420515

Trial Id: 9 | Model params: 89262 | Timestamp: 2022-03-07 10:09:03.720027

[32m[I 2022-03-07 10:11:40,158][0m Trial 9 pruned. [0m
epoch 0 -0.005930507941671603 4.917042590215051

Previous best Test-set performance: 0.005822209211420515

Trial Id: 10 | Model params: 89262 | Timestamp: 2022-03-07 10:11:40.158951

[32m[I 2022-03-07 10:14:17,276][0m Trial 10 pruned. [0m
epoch 0 0.003414661372513117 4.894149450529392

Previous best Test-set performance: 0.005822209211420515

Trial Id: 11 | Model params: 89262 | Timestamp: 2022-03-07 10:14:17.276599

[32m[I 2022-03-07 10:14:59,919][0m Trial 11 pruned. [0m
epoch 0 0.006134536544568525 4.887466344788806

Previous best Test-set performance: 0.005822209211420515

Trial Id: 12 | Model params: 89262 | Timestamp: 2022-03-07 10:14:59.919800

[32m[I 2022-03-07 10:17:35,960][0m Trial 12 pruned. [0m
epoch 0 -0.00021957081137102819 4.90306503900967

Previous best Test-set performance: 0.005822209211420515

Trial Id: 13 | Model params: 89262 | Timestamp: 2022-03-07 10:17:35.960651

[32m[I 2022-03-07 10:18:18,612][0m Trial 13 pruned. [0m
epoch 0 -0.9681964593600936 6.877873808024784

Previous best Test-set performance: 0.005822209211420515

Trial Id: 14 | Model params: 89262 | Timestamp: 2022-03-07 10:18:18.612496

epoch 0 -1.7581429154009571 8.141948726337944
epoch 1 -1.7438924712275181 8.12088806240722
epoch 2 -1.7378469052617103 8.111936830252557
epoch 3 -1.72508828248231 8.093013566101051
epoch 4 -1.7408269894364339 8.11635045904672
epoch 5 -1.7422761356685967 8.118495837878285
epoch 6 -1.737900373424751 8.112016039985319
epoch 7 -1.7496159495011523 8.129353320090505
epoch 8 -1.7464333536081846 8.124647219685851
[32m[I 2022-03-07 10:44:39,975][0m Trial 14 finished with value: 8.107262725119625 and parameters: {'lr': 0.0011755129899433672, 'weight_decay': 0.21121980713792948, 'criterion': 'PoissonNLLLoss', 'batch_size': 32, 'epochs': 10}. Best is trial 4 with value: 4.9569172942102915.[0m
epoch 9 -1.7346927146598912 8.107262725119625

Study statistics: 
  Number of finished trials:  15
  Number of pruned trials:  8
  Number of complete trials:  7

Best trial:
  Value:  4.9569172942102915
  Params: 
    lr: 0.004425995167278122
    weight_decay: 0.2560259962411263
    criterion: MSELoss
    batch_size: 32
    epochs: 20
Target: 132567, NaN: 0, Max: 227.0, Min: 0.0, Mean: 8.573823047968197
Prediction: 132567, NaN: 0, Max: 7.841525554656982, Min: 7.841525554656982, Mean: 7.841525554656982

 XXXXXX======== TRIAL south - lrg ended

Test Set - R-squared:  -0.022311827038041576
Test Set - RMSE:  4.9569172942102915
Test Set - MAE:  3.2594935320748197



