[32m[I 2022-03-06 23:12:23,601][0m A new study created in memory with name: DeepSet[0m
Starting Loading south
Finished Loading south
Finished south setup

++++++++ Session Characteristics +++++++

Area: south
Gal Type: qso
Training Set: 530265
Validation Set: 132567
Test Samples: 132567
Number of features: 5
Device: cuda:0
Number of Workers: 8
Number of Trials: 15

+++++++++++++++++++++++++++++++++++++++

Trial Id: 0 | Model params: 386436 | Timestamp: 2022-03-06 23:12:23.602858

epoch 0 0.05939663461757183 2.3122651782533126
epoch 5 0.0639218189030284 2.306696390430272
epoch 10 0.0634788716019391 2.3072420842188373
epoch 15 0.051312575500020996 2.322180354718948
epoch 20 0.06346574660783644 2.307258251730563
epoch 25 0.02946050104872766 2.348772656014094
epoch 30 0.05681297945157915 2.315438672680596
epoch 35 0.06161363866083347 2.3095385637849857
epoch 40 0.06164390872470549 2.309501313433472
epoch 45 0.04787165555782269 2.3263878545775296
epoch 50 0.06306882846799078 2.3077471263439477
epoch 55 0.06082825784868029 2.310504843762042
epoch 60 0.05320099797711042 2.3198679797878508
epoch 65 0.061311204927368745 2.3099107058629054
epoch 70 0.05967978621843262 2.3119171192885193
[32m[I 2022-03-07 02:18:15,923][0m Trial 0 finished with value: 2.311612224201458 and parameters: {'n_layers_fe': 4, 'fe_neurons': 256, 'fe_dropout': 0.047903400523510664, 'n_units_l(Invariant)': 321, 'n_layers_mlp': 2, 'initialiser': 'normal', 'lr': 0.00029328815273022674, 'weight_decay': 0.23006979042103887, 'criterion': 'MSELoss', 'batch_size': 32, 'epochs': 75}. Best is trial 0 with value: 2.311612224201458.[0m

Trial Id: 1 | Model params: 105898 | Timestamp: 2022-03-07 02:18:15.923259

epoch 0 -1.2993640583672814 3.615249244957513
epoch 5 -1.3414142754912626 3.6481568794045516
epoch 10 -1.3411070200651753 3.6479175042576557
epoch 15 -1.3235288775761225 3.6341965519948145
epoch 20 -1.326162329168747 3.636255439785525
epoch 25 -1.327673206188548 3.6374361490818488
epoch 30 -1.3465989049593095 3.6521937307333396
epoch 35 -1.3417066235360937 3.6483846259961092
epoch 40 -1.3399570646012071 3.647021462791516
epoch 45 -1.3156400973647426 3.6280219453683564
epoch 50 -1.3268207842515434 3.636770051649504
epoch 55 -1.33274395969765 3.641396006462081
epoch 60 -1.2970768074079846 3.613450695560298
epoch 65 -1.315260802326701 3.6277248035374936
epoch 70 -1.347576874061848 3.652954696008677
[32m[I 2022-03-07 02:59:02,188][0m Trial 1 finished with value: 3.6550105944939517 and parameters: {'n_layers_fe': 2, 'fe_neurons': 128, 'fe_dropout': 0.03866580723070134, 'n_units_l(Invariant)': 468, 'n_layers_mlp': 2, 'initialiser': 'uniform', 'lr': 0.008966681440613909, 'weight_decay': 0.18953502824619073, 'criterion': 'PoissonNLLLoss', 'batch_size': 256, 'epochs': 75}. Best is trial 0 with value: 2.311612224201458.[0m

Trial Id: 2 | Model params: 154786 | Timestamp: 2022-03-07 02:59:02.188642

epoch 0 -0.04166276495292598 2.4333128239256476
epoch 5 0.08869885614479966 2.2759637073840473
epoch 10 0.0904950301091052 2.2737196395780197
epoch 15 0.09151479849057131 2.2724445955812
epoch 20 0.09195553405297696 2.2718933105160115
epoch 25 0.09310637208689942 2.2704531772011443
epoch 30 0.09324146179923098 2.270284069005903
epoch 35 0.09403260379854106 2.2692934474962496
epoch 40 0.09334440793523602 2.2701551903702697
epoch 45 0.09360437898233354 2.2698296991146787
[32m[I 2022-03-07 03:31:23,153][0m Trial 2 finished with value: 2.2685811249783385 and parameters: {'n_layers_fe': 4, 'fe_neurons': 128, 'fe_dropout': 0.23979525200052593, 'n_units_l(Invariant)': 336, 'n_layers_mlp': 4, 'initialiser': 'kaiming_he', 'lr': 2.1002453012160407e-05, 'weight_decay': 0.05800797358666787, 'criterion': 'MSELoss', 'batch_size': 256, 'epochs': 50}. Best is trial 2 with value: 2.2685811249783385.[0m

Trial Id: 3 | Model params: 109152 | Timestamp: 2022-03-07 03:31:23.153515

[32m[I 2022-03-07 03:31:58,008][0m Trial 3 pruned. [0m
++++++++++++++++++++
        NaN         
++++++++++++++++++++

Trial Id: 4 | Model params: 513634 | Timestamp: 2022-03-07 03:31:58.008249

epoch 0 -1.9003527255203805 4.060315524694543
epoch 5 -1.6552265980586092 3.8849476384525663
epoch 10 -1.9008121581997517 4.0606371007145645
epoch 15 -1.7933584044673032 3.984719046749207
epoch 20 -1.6339831509492972 3.8693754429460063
epoch 25 -1.4252736930815328 3.712912826732905
epoch 30 -1.3910396853573346 3.686614840386328
epoch 35 -1.30729730482178 3.6214805260130856
epoch 40 -1.2467895004285299 3.5736792265488986
epoch 45 -1.2573704196588342 3.582084196689092
epoch 50 -1.258329540714365 3.5828451013870333
epoch 55 -1.2573096144281677 3.582035952298027
epoch 60 -1.2710361253403804 3.5929104760578388
epoch 65 -1.2726931488970115 3.5942209905957907
epoch 70 -1.2624859870798142 3.5861406916469294
[32m[I 2022-03-07 04:57:51,301][0m Trial 4 finished with value: 3.57120409904656 and parameters: {'n_layers_fe': 4, 'fe_neurons': 256, 'fe_dropout': 0.03239754274787804, 'n_units_l(Invariant)': 304, 'n_layers_mlp': 4, 'initialiser': 'normal', 'lr': 1.1711342392804405e-05, 'weight_decay': 0.005525684283274601, 'criterion': 'PoissonNLLLoss', 'batch_size': 256, 'epochs': 75}. Best is trial 2 with value: 2.2685811249783385.[0m

Trial Id: 5 | Model params: 21930 | Timestamp: 2022-03-07 04:57:51.301444

epoch 0 0.06780365772327368 2.3019085820076994
epoch 5 0.061519149760283054 2.309654837995422
epoch 10 0.06719741520075906 2.3026569694379027
epoch 15 0.06902931182978655 2.300394806654815
epoch 20 0.0663318530311735 2.3037250575058494
[32m[I 2022-03-07 05:14:10,260][0m Trial 5 finished with value: 2.3111168137101004 and parameters: {'n_layers_fe': 2, 'fe_neurons': 64, 'fe_dropout': 0.03213372526996355, 'n_units_l(Invariant)': 20, 'n_layers_mlp': 4, 'initialiser': 'kaiming_he', 'lr': 0.00029563306005715083, 'weight_decay': 0.24395162765730477, 'criterion': 'MSELoss', 'batch_size': 128, 'epochs': 25}. Best is trial 2 with value: 2.2685811249783385.[0m

Trial Id: 6 | Model params: 111488 | Timestamp: 2022-03-07 05:14:10.260231

[32m[I 2022-03-07 05:16:20,476][0m Trial 6 pruned. [0m
epoch 0 0.056865006829713516 2.3153748105503618

Trial Id: 7 | Model params: 174676 | Timestamp: 2022-03-07 05:16:20.476826

[32m[I 2022-03-07 05:19:03,254][0m Trial 7 pruned. [0m
epoch 0 0.06267325127643941 2.308234246325743

Trial Id: 8 | Model params: 40018 | Timestamp: 2022-03-07 05:19:03.254905

epoch 0 -1.2961793937390165 3.6127447816754845
epoch 5 -1.2752551871590438 3.5962463273510488
epoch 10 -1.2945413583125438 3.6114559320903235
epoch 15 -1.3133573543398684 3.6262332641625714
epoch 20 -1.3119163839244687 3.6251037134698247
epoch 25 -1.301981586218853 3.617306405932595
epoch 30 -1.2723848018583594 3.5939771598365065
epoch 35 -1.296988429668132 3.613381182935334
epoch 40 -1.289232857950974 3.6072758992638936
epoch 45 -1.2838766823730174 3.6030534109696055
epoch 50 -1.284593693397889 3.6036189463829555
epoch 55 -1.2915278459153594 3.609083618587174
epoch 60 -1.289104781372631 3.6071749890364955
epoch 65 -1.2943045941825835 3.61126960176394
epoch 70 -1.2939362363506741 3.6109796897700965
[32m[I 2022-03-07 06:17:02,113][0m Trial 8 finished with value: 3.587291141653145 and parameters: {'n_layers_fe': 4, 'fe_neurons': 64, 'fe_dropout': 0.12928736564084192, 'n_units_l(Invariant)': 168, 'n_layers_mlp': 4, 'initialiser': 'normal', 'lr': 0.00309583024109451, 'weight_decay': 0.030978619619606827, 'criterion': 'PoissonNLLLoss', 'batch_size': 128, 'epochs': 75}. Best is trial 2 with value: 2.2685811249783385.[0m

Trial Id: 9 | Model params: 36322 | Timestamp: 2022-03-07 06:17:02.113284

epoch 0 -1.4600262950983884 3.7394200253622123
epoch 5 -1.3425224442217427 3.6490200959616845
epoch 10 -1.4342009983890192 3.7197400685479125
epoch 15 -1.2636268132593984 3.5870447077624825
epoch 20 -1.3413958527762966 3.648142527162992
epoch 25 -1.321395565907609 3.6325278285398928
epoch 30 -1.3364376959097175 3.644277813533812
epoch 35 -1.3683149061479782 3.669053961177892
epoch 40 -1.2445112360431874 3.571866895862651
epoch 45 -1.3629375933844057 3.6648862589581768
epoch 50 -1.3266909135919045 3.636668557731409
epoch 55 -1.2809444979930027 3.600739754953059
epoch 60 -1.345748119828766 3.6515315992960646
epoch 65 -1.3252898427981359 3.635573440765763
epoch 70 -1.423641249375343 3.711663041715552
[32m[I 2022-03-07 09:42:26,950][0m Trial 9 finished with value: 3.6248437340161734 and parameters: {'n_layers_fe': 4, 'fe_neurons': 64, 'fe_dropout': 0.14878441066575349, 'n_units_l(Invariant)': 112, 'n_layers_mlp': 4, 'initialiser': 'xavier', 'lr': 0.009907064511605574, 'weight_decay': 0.27409916542330703, 'criterion': 'PoissonNLLLoss', 'batch_size': 32, 'epochs': 75}. Best is trial 2 with value: 2.2685811249783385.[0m

Trial Id: 10 | Model params: 128782 | Timestamp: 2022-03-07 09:42:26.951053

[32m[I 2022-03-07 09:42:57,364][0m Trial 10 pruned. [0m
epoch 0 -0.32270731759291094 2.7419924390210757

Trial Id: 11 | Model params: 20808 | Timestamp: 2022-03-07 09:42:57.364768

[32m[I 2022-03-07 09:43:35,901][0m Trial 11 pruned. [0m
epoch 0 -0.01074328119571355 2.396926993588796

Trial Id: 12 | Model params: 21336 | Timestamp: 2022-03-07 09:43:35.901655

[32m[I 2022-03-07 09:44:15,499][0m Trial 12 pruned. [0m
epoch 0 0.03344170150002157 2.3439503154576715

Trial Id: 13 | Model params: 46944 | Timestamp: 2022-03-07 09:44:15.499211

[32m[I 2022-03-07 09:44:54,820][0m Trial 13 pruned. [0m
epoch 0 0.03155210343499104 2.3462403797990317

Trial Id: 14 | Model params: 123976 | Timestamp: 2022-03-07 09:44:54.820500

[32m[I 2022-03-07 09:45:40,237][0m Trial 14 pruned. [0m
epoch 0 -0.38833943079395583 2.8091970520972738

Study statistics: 
  Number of finished trials:  15
  Number of pruned trials:  8
  Number of complete trials:  7

Best trial:
  Value:  2.2685811249783385
  Params: 
    n_layers_fe: 4
    fe_neurons: 128
    fe_dropout: 0.23979525200052593
    n_units_l(Invariant): 336
    n_layers_mlp: 4
    initialiser: kaiming_he
    lr: 2.1002453012160407e-05
    weight_decay: 0.05800797358666787
    criterion: MSELoss
    batch_size: 256
    epochs: 50
Target: 132567, NaN: 0, Max: 87.0, Min: 0.0, Mean: 4.115865939487203
Prediction: 132567, NaN: 0, Max: 7.652644634246826, Min: 3.1555168628692627, Mean: 4.131438560894526

 XXXXXX======== TRIAL south - qso ended

Test Set - R-squared:  0.09460127392138429
Test Set - RMSE:  2.2685811249783385
Test Set - MAE:  1.7348684435148216



[32m[I 2022-03-07 09:46:22,721][0m A new study created in memory with name: DeepSet[0m
Starting Loading south
Finished Loading south
Finished south setup

++++++++ Session Characteristics +++++++

Area: south
Gal Type: qso
Training Set: 530265
Validation Set: 132567
Test Samples: 132567
Number of features: 5
Device: cuda:0
Number of Workers: 8
Number of Trials: 15

+++++++++++++++++++++++++++++++++++++++

Previous best Test-set performance: 0.100764047862966

Trial Id: 0 | Model params: 91862 | Timestamp: 2022-03-07 09:46:22.721662

epoch 0 -1.264114366936672 3.587430986690348
epoch 1 -1.2996367395091037 3.615463604459104
epoch 2 -1.277891513267734 3.5983291999379863
epoch 3 -1.3042764676954892 3.6191090314673198
epoch 4 -1.274160465669214 3.5953810701648887
epoch 5 -1.2795685256864222 3.599653523873114
epoch 6 -1.265439527656108 3.588480674660127
epoch 7 -1.2955083224797188 3.6122168206722103
epoch 8 -1.2951636926943744 3.611945655409401
[32m[I 2022-03-07 09:53:26,403][0m Trial 0 finished with value: 3.5867794524761645 and parameters: {'lr': 0.002332606947988316, 'weight_decay': 0.020692172338262593, 'criterion': 'PoissonNLLLoss', 'batch_size': 128, 'epochs': 10}. Best is trial 0 with value: 3.5867794524761645.[0m
epoch 9 -1.2632920436500346 3.5867794524761645

Previous best Test-set performance: 0.100764047862966

Trial Id: 1 | Model params: 91862 | Timestamp: 2022-03-07 09:53:26.403770

epoch 0 0.05708600228328964 2.315103525268655
epoch 1 0.058796165007527046 2.3130031213120743
epoch 2 0.02751450624956242 2.351126197799189
epoch 3 0.061786971267694946 2.3093252524858463
epoch 4 0.05841589701489236 2.31347032735099
epoch 5 0.0541663826384835 2.318684974666149
epoch 6 0.0571687597863777 2.3150019272482116
epoch 7 0.059274642980604364 2.312415118110627
epoch 8 0.052539644355068416 2.32067807002692
epoch 9 0.055212184092239935 2.317402743448173
epoch 10 0.06041936396647285 2.3110077594933367
epoch 11 0.04524751777680114 2.3295914992268436
epoch 12 0.05516432280899963 2.3174614404712393
epoch 13 0.04232709135175161 2.333151692066998
epoch 14 0.05260703689630175 2.320595534028027
epoch 15 0.061143425467166 2.310117131175102
epoch 16 0.059517489901322884 2.3121166254990424
epoch 17 0.06435410588439361 2.3061637052393253
epoch 18 0.058478633106413436 2.313393254839155
[32m[I 2022-03-07 10:41:16,739][0m Trial 1 finished with value: 2.3198337303091914 and parameters: {'lr': 0.0004870028618577182, 'weight_decay': 0.22758204209192823, 'criterion': 'MSELoss', 'batch_size': 32, 'epochs': 20}. Best is trial 1 with value: 2.3198337303091914.[0m
epoch 19 0.05322895399281935 2.3198337303091914

Previous best Test-set performance: 0.100764047862966

Trial Id: 2 | Model params: 91862 | Timestamp: 2022-03-07 10:41:16.739219

epoch 0 0.07594259720717744 2.2918376522114174
epoch 1 0.07301105261236729 2.2954701668355892
epoch 2 0.07406636528077937 2.294163177905878
epoch 3 0.07325341643226091 2.295170068712254
[32m[I 2022-03-07 10:53:15,358][0m Trial 2 finished with value: 2.294283720354433 and parameters: {'lr': 3.505955570656602e-05, 'weight_decay': 0.23585518596366523, 'criterion': 'MSELoss', 'batch_size': 32, 'epochs': 5}. Best is trial 2 with value: 2.294283720354433.[0m
epoch 4 0.07396905987470859 2.294283720354433

Previous best Test-set performance: 0.100764047862966

Trial Id: 3 | Model params: 91862 | Timestamp: 2022-03-07 10:53:15.358699

epoch 0 -1.3064604370561477 3.620823702297309
epoch 1 -1.293490249994056 3.6106286499431315
epoch 2 -1.3315415137763487 3.640457380910489
epoch 3 -1.2955266478701408 3.6122312390802747
epoch 4 -1.2990452446716847 3.6149986037153377
epoch 5 -1.3160613200002342 3.6283519049931527
epoch 6 -1.2861123501696836 3.6048164790475656
epoch 7 -1.3140151451004582 3.6267487775125793
epoch 8 -1.3016437405365493 3.617040952854937
[32m[I 2022-03-07 11:00:16,159][0m Trial 3 finished with value: 3.6230986295590677 and parameters: {'lr': 0.0024374825824345636, 'weight_decay': 0.08269794806761797, 'criterion': 'PoissonNLLLoss', 'batch_size': 128, 'epochs': 10}. Best is trial 2 with value: 2.294283720354433.[0m
epoch 9 -1.3093595995042975 3.6230986295590677

Previous best Test-set performance: 0.100764047862966

Trial Id: 4 | Model params: 91862 | Timestamp: 2022-03-07 11:00:16.160065

epoch 0 0.0778384579827146 2.28948539789594
epoch 1 0.07935687183322515 2.2875997095443292
epoch 2 0.07716085181431465 2.290326402684532
epoch 3 0.0752212708988873 2.2927319907535026
epoch 4 0.07450464894301723 2.293620151270052
epoch 5 0.06885478563645608 2.3006104204972346
epoch 6 0.0806436074734167 2.2860005202312466
epoch 7 0.07688957175441424 2.2906630129326255
