[32m[I 2022-03-03 15:10:53,380][0m A new study created in memory with name: DeepSet[0m
Starting Loading south
Finished Loading south
Finished south setup

++++++++ Session Characteristics +++++++

Area: south
Gal Type: qso
Training Set: 530265
Validation Set: 132567
Test Samples: 132567
Number of features: 5
Device: cuda:0
Number of Workers: 8
Number of Trials: 20

+++++++++++++++++++++++++++++++++++++++

Trial Id: 0 | Model params: 482932 | Timestamp: 2022-03-03 15:10:53.381076

epoch 0 -1.3225338750089635 3.633418334401006
epoch 5 -1.296458019138682 3.612963965753007
epoch 10 -1.3110983492125938 3.624462314183276
epoch 15 -1.3114936492673408 3.6247722726259877
epoch 20 -1.3060377824272384 3.620491932458795
epoch 25 -1.3113909250703069 3.6246917281784112
epoch 30 -1.312907804015519 3.6258809075450613
epoch 35 -1.3121255430804117 3.6252676913908757
epoch 40 -1.3106376227370689 3.62410102082224
epoch 45 -1.3136747100847948 3.6264819863263384
epoch 50 -1.312073194454805 3.625226651479382
epoch 55 -1.3123569433876727 3.6254490974291467
epoch 60 -1.3126665018352366 3.6256917612703554
epoch 65 -1.3127725987325918 3.625774927225014
epoch 70 -1.3120790363721992 3.62523123140819
[32m[I 2022-03-03 16:40:14,020][0m Trial 0 finished with value: 3.6263918017080203 and parameters: {'n_layers_fe': 4, 'fe_neurons': 256, 'fe_dropout': 0.16900054626967775, 'n_units_l(Invariant)': 185, 'n_layers_mlp': 4, 'initialiser': 'xavier', 'lr': 1.1351207608657884e-05, 'weight_decay': 0.12490845642423978, 'criterion': 'PoissonNLLLoss', 'batch_size': 256, 'epochs': 75}. Best is trial 0 with value: 3.6263918017080203.[0m

Trial Id: 1 | Model params: 89518 | Timestamp: 2022-03-03 16:40:14.020679

epoch 0 0.05720507563379862 2.3149573423518057
epoch 5 0.061630672960158006 2.3095176014440146
epoch 10 0.06775332475788631 2.3019707257406288
epoch 15 0.0686322990742726 2.300885256432414
epoch 20 0.05243585298147113 2.3208051781254
epoch 25 0.0626422529690781 2.308272413786113
epoch 30 0.06003548340605347 2.3114798107061008
epoch 35 0.01640825334121876 2.3645135807270927
epoch 40 0.04620374515297676 2.328424611864446
epoch 45 0.06623644603323309 2.3038427577176224
[32m[I 2022-03-03 17:15:52,914][0m Trial 1 finished with value: 2.307706212497118 and parameters: {'n_layers_fe': 2, 'fe_neurons': 128, 'fe_dropout': 0.1309041500393665, 'n_units_l(Invariant)': 342, 'n_layers_mlp': 2, 'initialiser': 'kaiming_he', 'lr': 0.004932136197800165, 'weight_decay': 0.20450693215766505, 'criterion': 'MSELoss', 'batch_size': 128, 'epochs': 50}. Best is trial 1 with value: 2.307706212497118.[0m

Trial Id: 2 | Model params: 179258 | Timestamp: 2022-03-03 17:15:52.915063

epoch 0 -1.3603666319899541 3.6628919520721324
epoch 5 -1.3655214649120442 3.6668894874707747
epoch 10 -1.337283000244415 3.644936989094374
epoch 15 -1.3640869539160145 3.6657774724058267
epoch 20 -1.3370223548046538 3.6447337482604736
epoch 25 -1.3446456551893222 3.650673417305584
epoch 30 -1.3520943370634382 3.6564677133498087
epoch 35 -1.3333224068597245 3.6418474543408528
epoch 40 -1.3460866168845529 3.6517950521573557
epoch 45 -1.3497880713084545 3.654674661457127
epoch 50 -1.34416689738408 3.650300679186446
epoch 55 -1.353709498803136 3.6577229294237283
epoch 60 -1.344492475883997 3.650554163304331
epoch 65 -1.3382946005777079 3.645725687038144
epoch 70 -1.3522132952686965 3.656560175911873
[32m[I 2022-03-03 18:17:49,981][0m Trial 2 finished with value: 3.6495737001703796 and parameters: {'n_layers_fe': 2, 'fe_neurons': 256, 'fe_dropout': 0.45321494563888176, 'n_units_l(Invariant)': 28, 'n_layers_mlp': 2, 'initialiser': 'xavier', 'lr': 0.000684218031306335, 'weight_decay': 0.26690687239612293, 'criterion': 'PoissonNLLLoss', 'batch_size': 128, 'epochs': 75}. Best is trial 1 with value: 2.307706212497118.[0m

Trial Id: 3 | Model params: 43574 | Timestamp: 2022-03-03 18:17:49.981312

epoch 0 -1.3042081759107793 3.619055401347508
epoch 5 -1.2790541726548188 3.5992473950082515
epoch 10 -1.241147413802679 3.569189335104833
epoch 15 -1.3036686788263938 3.6186317017537157
epoch 20 -1.2617834420179923 3.585583865867435
[32m[I 2022-03-03 19:38:18,574][0m Trial 3 finished with value: 3.5868622735250804 and parameters: {'n_layers_fe': 2, 'fe_neurons': 64, 'fe_dropout': 0.31004040760299784, 'n_units_l(Invariant)': 474, 'n_layers_mlp': 2, 'initialiser': 'xavier', 'lr': 0.001003889635393851, 'weight_decay': 0.02567182444116558, 'criterion': 'PoissonNLLLoss', 'batch_size': 32, 'epochs': 25}. Best is trial 1 with value: 2.307706212497118.[0m

Trial Id: 4 | Model params: 272912 | Timestamp: 2022-03-03 19:38:18.574372

epoch 0 -0.037185166588702856 2.4280773813166645
epoch 5 0.09443971861295364 2.2687835136967194
epoch 10 0.09797583220043349 2.2643495054802614
epoch 15 0.09832653425262483 2.263909279348629
epoch 20 0.09768788006452933 2.2647108994827034
epoch 25 0.09409986553212213 2.269209206360709
epoch 30 0.09920441573224703 2.2628069246217604
epoch 35 0.09728639439709674 2.265214687377364
epoch 40 0.09804004415859524 2.264268908469343
epoch 45 0.09712588023688495 2.265416070667297
[32m[I 2022-03-03 20:19:45,501][0m Trial 4 finished with value: 2.2641285378407736 and parameters: {'n_layers_fe': 2, 'fe_neurons': 256, 'fe_dropout': 0.46384981619974097, 'n_units_l(Invariant)': 391, 'n_layers_mlp': 2, 'initialiser': 'normal', 'lr': 0.00015250412520408395, 'weight_decay': 0.033705210005719466, 'criterion': 'MSELoss', 'batch_size': 128, 'epochs': 50}. Best is trial 4 with value: 2.2641285378407736.[0m

Trial Id: 5 | Model params: 390048 | Timestamp: 2022-03-03 20:19:45.501774

epoch 0 -1.324069419993486 3.634619254542362
epoch 5 -1.3395570346781578 3.646709709192435
epoch 10 -1.3393161889857752 3.6465219991009574
epoch 15 -1.3337809820277111 3.642205308608171
epoch 20 -1.327497492016887 3.637298852931153
epoch 25 -1.3431880804851213 3.6495385002966256
epoch 30 -1.3441864912713841 3.6503159348047114
epoch 35 -1.3441071890815528 3.6502541904647168
epoch 40 -1.3490062802865306 3.6540666428947786
epoch 45 -1.3240604445696684 3.6346122361892443
epoch 50 -1.3272858438944293 3.637133472522086
epoch 55 -1.3306376709292507 3.6397516846373077
epoch 60 -1.3384257919518352 3.645827958380256
epoch 65 -1.330211238446089 3.639418690072895
epoch 70 -1.3337549966889033 3.642185031597789
[32m[I 2022-03-03 22:19:56,281][0m Trial 5 finished with value: 3.6525885582203093 and parameters: {'n_layers_fe': 4, 'fe_neurons': 256, 'fe_dropout': 0.2067057980433491, 'n_units_l(Invariant)': 335, 'n_layers_mlp': 2, 'initialiser': 'xavier', 'lr': 0.0009306293768008805, 'weight_decay': 0.22137751164704794, 'criterion': 'PoissonNLLLoss', 'batch_size': 128, 'epochs': 75}. Best is trial 4 with value: 2.2641285378407736.[0m

Trial Id: 6 | Model params: 37044 | Timestamp: 2022-03-03 22:19:56.281587

[32m[I 2022-03-03 22:22:22,245][0m Trial 6 pruned. [0m
epoch 0 0.05149295443607882 2.3219595800341577

Trial Id: 7 | Model params: 20940 | Timestamp: 2022-03-03 22:22:22.246096

epoch 0 -1.3362305139504205 3.6441162330736097
epoch 5 -1.346113650263066 3.651816091464431
epoch 10 -1.3424545493714977 3.6489672146181644
epoch 15 -1.3585396717344924 3.661474110168486
epoch 20 -1.3418443532045399 3.6484919159980786
epoch 25 -1.3394388659695897 3.646617612181755
epoch 30 -1.3452784094694388 3.6511659913959007
epoch 35 -1.365717207515543 3.667041198553894
epoch 40 -1.3500777283491736 3.6548999093505095
epoch 45 -1.348150867855237 3.6534012511767084
epoch 50 -1.339464675144685 3.646637727247434
epoch 55 -1.3445466268442217 3.6505963216549926
epoch 60 -1.3591388456242326 3.661939169203595
epoch 65 -1.3652854238355268 3.6667065345473553
epoch 70 -1.3437613707677167 3.6499849256215446
[32m[I 2022-03-04 01:26:58,795][0m Trial 7 finished with value: 3.6592900005480615 and parameters: {'n_layers_fe': 4, 'fe_neurons': 64, 'fe_dropout': 0.14553347616118278, 'n_units_l(Invariant)': 5, 'n_layers_mlp': 2, 'initialiser': 'xavier', 'lr': 0.00019490079629375448, 'weight_decay': 0.27823054504869255, 'criterion': 'PoissonNLLLoss', 'batch_size': 32, 'epochs': 75}. Best is trial 4 with value: 2.2641285378407736.[0m

Trial Id: 8 | Model params: 70798 | Timestamp: 2022-03-04 01:26:58.795349

[32m[I 2022-03-04 01:29:10,886][0m Trial 8 pruned. [0m
epoch 0 -1.308875507783811 3.6227188697387347

Trial Id: 9 | Model params: 486028 | Timestamp: 2022-03-04 01:29:10.886297

[32m[I 2022-03-04 01:30:13,993][0m Trial 9 pruned. [0m
epoch 0 0.06030194379430587 2.311152159261241

Trial Id: 10 | Model params: 428748 | Timestamp: 2022-03-04 01:30:13.993517

[32m[I 2022-03-04 01:31:07,248][0m Trial 10 pruned. [0m
epoch 0 -0.7769517596701601 3.1781339213558835

Trial Id: 11 | Model params: 93158 | Timestamp: 2022-03-04 01:31:07.248428

[32m[I 2022-03-04 01:31:43,625][0m Trial 11 pruned. [0m
epoch 0 0.07660562953697303 2.291015281690112

Trial Id: 12 | Model params: 94328 | Timestamp: 2022-03-04 01:31:43.625503

[32m[I 2022-03-04 01:32:19,339][0m Trial 12 pruned. [0m
epoch 0 0.055838942485717524 2.316633950413495

Trial Id: 13 | Model params: 100178 | Timestamp: 2022-03-04 01:32:19.339746

[32m[I 2022-03-04 01:32:55,080][0m Trial 13 pruned. [0m
epoch 0 0.052490864950647476 2.320737808588247

Trial Id: 14 | Model params: 83408 | Timestamp: 2022-03-04 01:32:55.080537

[32m[I 2022-03-04 01:33:31,165][0m Trial 14 pruned. [0m
epoch 0 0.08709849337380338 2.2779612742121667

Trial Id: 15 | Model params: 134762 | Timestamp: 2022-03-04 01:33:31.165236

[32m[I 2022-03-04 01:34:09,907][0m Trial 15 pruned. [0m
epoch 0 0.0463027202557168 2.328303798827643

Trial Id: 16 | Model params: 200672 | Timestamp: 2022-03-04 01:34:09.907890

[32m[I 2022-03-04 01:34:46,211][0m Trial 16 pruned. [0m
epoch 0 -0.27070646150829925 2.6875527303327322

Trial Id: 17 | Model params: 248144 | Timestamp: 2022-03-04 01:34:46.211791

[32m[I 2022-03-04 01:35:28,249][0m Trial 17 pruned. [0m
epoch 0 0.07841444879957282 2.2887702690977827

Trial Id: 18 | Model params: 97188 | Timestamp: 2022-03-04 01:35:28.249965

[32m[I 2022-03-04 01:36:04,734][0m Trial 18 pruned. [0m
epoch 0 0.056796857566109415 2.315458461480041

Trial Id: 19 | Model params: 120462 | Timestamp: 2022-03-04 01:36:04.734588

[32m[I 2022-03-04 01:36:45,141][0m Trial 19 pruned. [0m
epoch 0 0.0399658863843666 2.336026190115837

Study statistics: 
  Number of finished trials:  20
  Number of pruned trials:  13
  Number of complete trials:  7

Best trial:
  Value:  2.2641285378407736
  Params: 
    n_layers_fe: 2
    fe_neurons: 256
    fe_dropout: 0.46384981619974097
    n_units_l(Invariant): 391
    n_layers_mlp: 2
    initialiser: normal
    lr: 0.00015250412520408395
    weight_decay: 0.033705210005719466
    criterion: MSELoss
    batch_size: 128
    epochs: 50
Target: 132567, NaN: 0, Max: 87.0, Min: 0.0, Mean: 4.115865939487203
Prediction: 132567, NaN: 0, Max: 7.825417518615723, Min: 3.303968906402588, Mean: 4.084372730933224

 XXXXXX======== TRIAL south - qso ended

Test Set - R-squared:  0.0981518725381626
Test Set - RMSE:  2.2641285378407736
Test Set - MAE:  1.7285757378977138



