[32m[I 2022-03-02 11:42:58,888][0m A new study created in memory with name: DeepSet[0m
Starting Loading north
Finished Loading north
Finished north setup

++++++++ Session Characteristics +++++++

Area: north
Gal Type: glbg
Training Set: 290439
Validation Set: 72610
Test Samples: 72610
Number of features: 5
Device: cuda:0
Number of Workers: 8
Number of Trials: 10

+++++++++++++++++++++++++++++++++++++++

Trial Id: 0 | Model params: 82112 | Timestamp: 2022-03-02 11:42:58.889186

epoch 0 -6.860823144835143 31.679885809299073
[32m[I 2022-03-02 11:45:09,030][0m Trial 0 pruned. [0m
++++++++++++++++++++
        NaN         
++++++++++++++++++++

Trial Id: 1 | Model params: 29982 | Timestamp: 2022-03-02 11:45:09.030326

epoch 0 0.17506260301310295 10.262663537231612
epoch 5 0.19704243368463892 10.125020056373776
epoch 10 0.20852161630822608 10.052385240984497
epoch 15 0.19966674419381814 10.1084606864255
epoch 20 0.21441094265521743 10.014915918371809
epoch 25 0.2154577711919763 10.0082410579213
epoch 30 0.204885453769449 10.075449813672034
epoch 35 0.21769381016358702 9.993968540420537
epoch 40 0.21522281733679238 10.009739574320996
epoch 45 0.2050467533800373 10.074427792021707
[32m[I 2022-03-02 12:19:02,587][0m Trial 1 finished with value: 10.001257287228427 and parameters: {'n_layers_fe': 4, 'fe_neurons': 64, 'fe_dropout': 0.02859619477914821, 'n_units_l(Invariant)': 142, 'n_layers_mlp': 2, 'initialiser': 'normal', 'lr': 0.0010096387853654077, 'weight_decay': 0.11519287433907355, 'criterion': 'MSELoss', 'batch_size': 128, 'epochs': 50}. Best is trial 1 with value: 10.001257287228427.[0m

Trial Id: 2 | Model params: 328386 | Timestamp: 2022-03-02 12:19:02.587478

epoch 0 -6.970457009037113 31.900038452959166
[32m[I 2022-03-02 12:22:56,858][0m Trial 2 pruned. [0m
++++++++++++++++++++
        NaN         
++++++++++++++++++++

Trial Id: 3 | Model params: 175846 | Timestamp: 2022-03-02 12:22:56.858875

epoch 0 -0.1356114598263607 12.041053277214406
epoch 5 0.12876245213099813 10.546731425377324
epoch 10 0.18549846698997963 10.197543058496397
epoch 15 0.19237144409363893 10.154427141362888
epoch 20 0.1967755238372758 10.12670273745665
epoch 25 0.19943232845074066 10.109940950315643
epoch 30 0.19920861370916687 10.111353438554437
epoch 35 0.20183358338241764 10.094767481667237
epoch 40 0.20344874563536597 10.084548469748515
epoch 45 0.20528884596664632 10.072893657776358
epoch 50 0.1953783357183495 10.135506478875863
epoch 55 0.20535401194382608 10.072480662808443
epoch 60 0.2074696188410765 10.059063611728469
epoch 65 0.2075679215427928 10.058439746815507
epoch 70 0.21014179907466624 10.042091185541912
[32m[I 2022-03-02 14:28:54,707][0m Trial 3 finished with value: 10.03780971769813 and parameters: {'n_layers_fe': 4, 'fe_neurons': 128, 'fe_dropout': 0.07717661775024764, 'n_units_l(Invariant)': 498, 'n_layers_mlp': 4, 'initialiser': 'uniform', 'lr': 3.9459482209839905e-05, 'weight_decay': 0.15335292200201694, 'criterion': 'MSELoss', 'batch_size': 256, 'epochs': 75}. Best is trial 1 with value: 10.001257287228427.[0m

Trial Id: 4 | Model params: 160246 | Timestamp: 2022-03-02 14:28:54.707430

epoch 0 0.07014391777700535 10.895758352198124
epoch 5 0.06438726490470337 10.929433627830257
epoch 10 0.0751306612634347 10.866502536852336
epoch 15 0.06862293581523737 10.904665902993353
epoch 20 0.05739188028817266 10.97021610656408
epoch 25 0.07526394585908802 10.865719512958842
epoch 30 0.07815240592791606 10.848736427105607
epoch 35 0.06947001919368234 10.899705901918429
epoch 40 0.07225637906667692 10.883374739524411
epoch 45 0.07371469629402416 10.874817604514986
[32m[I 2022-03-02 15:44:24,510][0m Trial 4 finished with value: 10.897445025744464 and parameters: {'n_layers_fe': 4, 'fe_neurons': 128, 'fe_dropout': 0.4135328177545149, 'n_units_l(Invariant)': 378, 'n_layers_mlp': 4, 'initialiser': 'xavier', 'lr': 0.00821200227888434, 'weight_decay': 0.19633341738071364, 'criterion': 'MSELoss', 'batch_size': 256, 'epochs': 50}. Best is trial 1 with value: 10.001257287228427.[0m

Trial Id: 5 | Model params: 559816 | Timestamp: 2022-03-02 15:44:24.510201

[32m[I 2022-03-02 15:46:54,486][0m Trial 5 pruned. [0m
++++++++++++++++++++
        NaN         
++++++++++++++++++++

Trial Id: 6 | Model params: 401142 | Timestamp: 2022-03-02 15:46:54.486648

[32m[I 2022-03-02 15:48:28,759][0m Trial 6 pruned. [0m
++++++++++++++++++++
        NaN         
++++++++++++++++++++

Trial Id: 7 | Model params: 51568 | Timestamp: 2022-03-02 15:48:28.759621

epoch 0 -1.1480408226905432 16.560401432808163
epoch 5 -0.06810317411216826 11.677669979887845
epoch 10 0.09755808772243346 10.733941481738865
epoch 15 0.043156448374979006 11.05274274790172
epoch 20 0.12765630235239278 10.553424527647278
epoch 25 0.13010853086941032 10.538580824681887
epoch 30 0.1576047867498419 10.370687310956205
epoch 35 0.1577374973799226 10.369870381660139
epoch 40 0.15909112844133977 10.361534130799756
epoch 45 0.14653180177427716 10.43862428306798
[32m[I 2022-03-02 16:28:30,195][0m Trial 7 finished with value: 10.363771445580307 and parameters: {'n_layers_fe': 4, 'fe_neurons': 64, 'fe_dropout': 0.3491572252751787, 'n_units_l(Invariant)': 343, 'n_layers_mlp': 4, 'initialiser': 'kaiming_he', 'lr': 6.907012615588272e-05, 'weight_decay': 0.17818535116036618, 'criterion': 'MSELoss', 'batch_size': 256, 'epochs': 50}. Best is trial 1 with value: 10.001257287228427.[0m

Trial Id: 8 | Model params: 347220 | Timestamp: 2022-03-02 16:28:30.195586

epoch 0 -7.476481606827784 32.897084225505346
[32m[I 2022-03-02 16:31:41,838][0m Trial 8 pruned. [0m
++++++++++++++++++++
        NaN         
++++++++++++++++++++

Trial Id: 9 | Model params: 79772 | Timestamp: 2022-03-02 16:31:41.838216

[32m[I 2022-03-02 16:33:10,320][0m Trial 9 pruned. [0m
++++++++++++++++++++
        NaN         
++++++++++++++++++++

Study statistics: 
  Number of finished trials:  10
  Number of pruned trials:  6
  Number of complete trials:  4

Best trial:
  Value:  10.001257287228427
  Params: 
    n_layers_fe: 4
    fe_neurons: 64
    fe_dropout: 0.02859619477914821
    n_units_l(Invariant): 142
    n_layers_mlp: 2
    initialiser: normal
    lr: 0.0010096387853654077
    weight_decay: 0.11519287433907355
    criterion: MSELoss
    batch_size: 128
    epochs: 50
Traceback (most recent call last):
  File "hp_optim.py", line 432, in <module>
    main()
  File "hp_optim.py", line 76, in main
    model = torch.load(f"trained_models/{area}/{gal}/{trial.number}.pt")
  File "/vol/bitbucket/ele20/venv/lib/python3.8/site-packages/torch/serialization.py", line 594, in load
    with _open_file_like(f, 'rb') as opened_file:
  File "/vol/bitbucket/ele20/venv/lib/python3.8/site-packages/torch/serialization.py", line 230, in _open_file_like
    return _open_file(name_or_buffer, mode)
  File "/vol/bitbucket/ele20/venv/lib/python3.8/site-packages/torch/serialization.py", line 211, in __init__
    super(_open_file, self).__init__(open(name, mode))
FileNotFoundError: [Errno 2] No such file or directory: 'trained_models/north/glbg/1.pt'
[32m[I 2022-03-02 16:36:10,526][0m A new study created in memory with name: DeepSet[0m
Starting Loading south
Finished Loading south
Finished south setup

++++++++ Session Characteristics +++++++

Area: south
Gal Type: glbg
Training Set: 530265
Validation Set: 132567
Test Samples: 132567
Number of features: 5
Device: cuda:0
Number of Workers: 8
Number of Trials: 10

+++++++++++++++++++++++++++++++++++++++

Trial Id: 0 | Model params: 45756 | Timestamp: 2022-03-02 16:36:10.527252

epoch 0 0.033453880316919093 8.241138480372536
epoch 5 0.036424909492516866 8.228462671656505
epoch 10 0.037541668125544936 8.223693001460079
epoch 15 0.03698774623805756 8.22605914457697
epoch 20 0.03185692689315134 8.24794378557681
[32m[I 2022-03-02 17:09:58,828][0m Trial 0 finished with value: 8.213870100489935 and parameters: {'n_layers_fe': 4, 'fe_neurons': 64, 'fe_dropout': 0.47739976381333116, 'n_units_l(Invariant)': 381, 'n_layers_mlp': 2, 'initialiser': 'kaiming_he', 'lr': 0.005797989803802434, 'weight_decay': 0.16360082994418157, 'criterion': 'MSELoss', 'batch_size': 128, 'epochs': 25}. Best is trial 0 with value: 8.213870100489935.[0m

Trial Id: 1 | Model params: 428490 | Timestamp: 2022-03-02 17:09:58.829034

epoch 0 0.09426898195275879 7.97766033834318
epoch 5 0.10788581403619135 7.917464845920477
epoch 10 0.09404223882761442 7.9786588502659495
epoch 15 0.11099010137301435 7.903677651072695
epoch 20 0.11801658558034545 7.872381466703959
[32m[I 2022-03-02 18:35:31,101][0m Trial 1 finished with value: 7.898588421452029 and parameters: {'n_layers_fe': 4, 'fe_neurons': 256, 'fe_dropout': 0.4224233615365673, 'n_units_l(Invariant)': 484, 'n_layers_mlp': 2, 'initialiser': 'kaiming_he', 'lr': 0.00021408108080597283, 'weight_decay': 0.2979235710944155, 'criterion': 'MSELoss', 'batch_size': 256, 'epochs': 25}. Best is trial 1 with value: 7.898588421452029.[0m

Trial Id: 2 | Model params: 97842 | Timestamp: 2022-03-02 18:35:31.101214

epoch 0 -4.989905832699373 20.515680100289085
epoch 5 -4.863558734086271 20.298154832565245
epoch 10 -4.8655578817287655 20.301614809007326
epoch 15 -4.863436691085252 20.297943590490796
epoch 20 -4.850088096643343 20.2748254588833
epoch 25 -4.859500910746953 20.291130038808298
epoch 30 -4.863247140104394 20.297615495687758
epoch 35 -4.85057180056998 20.275663635147822
epoch 40 -4.8465985262996405 20.268777602657888
epoch 45 -4.848282657108867 20.271696634538877
[32m[I 2022-03-02 20:48:44,499][0m Trial 2 finished with value: 20.281157437580006 and parameters: {'n_layers_fe': 2, 'fe_neurons': 128, 'fe_dropout': 0.08345379191231928, 'n_units_l(Invariant)': 152, 'n_layers_mlp': 4, 'initialiser': 'uniform', 'lr': 3.065681951780502e-05, 'weight_decay': 0.18695218004813277, 'criterion': 'PoissonNLLLoss', 'batch_size': 32, 'epochs': 50}. Best is trial 1 with value: 7.898588421452029.[0m

Trial Id: 3 | Model params: 30576 | Timestamp: 2022-03-02 20:48:44.499710

epoch 0 -4.860474945784748 20.29281648366267
epoch 5 -4.870255077742849 20.309742047906468
epoch 10 -4.861633032987934 20.29482141418612
epoch 15 -4.858958329504191 20.290190552527733
epoch 20 -4.868082785317719 20.305983882331233
epoch 25 -4.858321866523744 20.28908845338666
epoch 30 -4.860618395002198 20.293064839884494
epoch 35 -4.843078664893205 20.262675419589012
epoch 40 -4.86083598767785 20.29344155621314
epoch 45 -4.856229456076174 20.285464813970123
[32m[I 2022-03-02 21:30:23,362][0m Trial 3 finished with value: 20.25657383299107 and parameters: {'n_layers_fe': 2, 'fe_neurons': 64, 'fe_dropout': 0.3021160863143444, 'n_units_l(Invariant)': 151, 'n_layers_mlp': 4, 'initialiser': 'uniform', 'lr': 0.006199265933454467, 'weight_decay': 0.15818708492160238, 'criterion': 'PoissonNLLLoss', 'batch_size': 128, 'epochs': 50}. Best is trial 1 with value: 7.898588421452029.[0m

Trial Id: 4 | Model params: 35126 | Timestamp: 2022-03-02 21:30:23.362599

epoch 0 -4.877608570318319 20.322458769229236
epoch 5 -4.876773285451161 20.321014674644942
epoch 10 -4.857501886750424 20.287668488358992
epoch 15 -4.8415563048074395 20.26003562132927
epoch 20 -4.8727460923128625 20.314050761643728
epoch 25 -4.859116510666688 20.290464449702437
epoch 30 -4.867690963872202 20.305305939205084
epoch 35 -4.856389872578141 20.285742646408753
epoch 40 -4.847838600563033 20.270927011130183
epoch 45 -4.869028123397869 20.307619446064052
epoch 50 -4.865939752452595 20.302275655453773
epoch 55 -4.875960178346699 20.319608823834248
epoch 60 -4.865402441357518 20.301345805485955
epoch 65 -4.861121042455339 20.29393505851748
epoch 70 -4.862293493921943 20.295964743961257
[32m[I 2022-03-03 00:31:42,235][0m Trial 4 finished with value: 20.287252846231993 and parameters: {'n_layers_fe': 2, 'fe_neurons': 64, 'fe_dropout': 0.3969135508350138, 'n_units_l(Invariant)': 346, 'n_layers_mlp': 2, 'initialiser': 'kaiming_he', 'lr': 0.0009923340988877182, 'weight_decay': 0.28873541817994636, 'criterion': 'PoissonNLLLoss', 'batch_size': 32, 'epochs': 75}. Best is trial 1 with value: 7.898588421452029.[0m

Trial Id: 5 | Model params: 126832 | Timestamp: 2022-03-03 00:31:42.235308

[32m[I 2022-03-03 00:33:06,803][0m Trial 5 pruned. [0m
epoch 0 0.12225464219646476 7.853444730698581

Trial Id: 6 | Model params: 206606 | Timestamp: 2022-03-03 00:33:06.803969

[32m[I 2022-03-03 00:34:40,755][0m Trial 6 pruned. [0m
epoch 0 0.10064237279163069 7.949542438177269

Trial Id: 7 | Model params: 493252 | Timestamp: 2022-03-03 00:34:40.755880

[32m[I 2022-03-03 00:37:37,760][0m Trial 7 pruned. [0m
epoch 0 0.09912909397002301 7.956227664204108

Trial Id: 8 | Model params: 95888 | Timestamp: 2022-03-03 00:37:37.760740

epoch 0 -5.807497428986789 21.871051542370935
epoch 5 -5.592043120833166 21.522164219817245
epoch 10 -5.891961391694129 22.00631570059739
epoch 15 -5.974269316167193 22.13733198402707
epoch 20 -6.045018550786051 22.24933277119461
epoch 25 -5.122096939720773 20.740824759240105
epoch 30 -6.255727994959559 22.57960902983349
epoch 35 -6.215156699522001 22.516392204354464
epoch 40 -6.049158020830905 22.255868376521676
epoch 45 -5.752580210805026 21.78265419037446
[32m[I 2022-03-03 01:48:42,589][0m Trial 8 finished with value: 21.98869934467373 and parameters: {'n_layers_fe': 2, 'fe_neurons': 128, 'fe_dropout': 0.42328636520561885, 'n_units_l(Invariant)': 391, 'n_layers_mlp': 2, 'initialiser': 'uniform', 'lr': 1.1401340396236082e-05, 'weight_decay': 0.07241289702987284, 'criterion': 'PoissonNLLLoss', 'batch_size': 256, 'epochs': 50}. Best is trial 1 with value: 7.898588421452029.[0m

Trial Id: 9 | Model params: 39684 | Timestamp: 2022-03-03 01:48:42.589537

[32m[I 2022-03-03 01:49:41,688][0m Trial 9 pruned. [0m
epoch 0 0.07906616215812268 8.044334781101009

Study statistics: 
  Number of finished trials:  10
  Number of pruned trials:  4
  Number of complete trials:  6

Best trial:
  Value:  7.898588421452029
  Params: 
    n_layers_fe: 4
    fe_neurons: 256
    fe_dropout: 0.4224233615365673
    n_units_l(Invariant): 484
    n_layers_mlp: 2
    initialiser: kaiming_he
    lr: 0.00021408108080597283
    weight_decay: 0.2979235710944155
    criterion: MSELoss
    batch_size: 256
    epochs: 25
Target: 132567, NaN: 0, Max: 159.0, Min: 0.0, Mean: 21.53262878393567
Prediction: 132567, NaN: 0, Max: 44.22597885131836, Min: 11.916438102722168, Mean: 20.8256312982667

 XXXXXX======== TRIAL south - glbg ended

Test Set - R-squared:  0.11213461132682945
Test Set - RMSE:  7.898588421452029
Test Set - MAE:  6.003216125203518



[32m[I 2022-03-03 01:52:47,277][0m A new study created in memory with name: DeepSet[0m
Starting Loading des
Finished Loading des
Finished des setup

++++++++ Session Characteristics +++++++

Area: des
Gal Type: glbg
Training Set: 270781
Validation Set: 67698
Test Samples: 67698
Number of features: 5
Device: cuda:0
Number of Workers: 8
Number of Trials: 10

+++++++++++++++++++++++++++++++++++++++

Trial Id: 0 | Model params: 42786 | Timestamp: 2022-03-03 01:52:47.278230

epoch 0 -7.674793393727262 28.047826716626716
epoch 5 -7.577995143466213 27.890900966247866
epoch 10 -7.571849865171613 27.88090865139246
epoch 15 -7.573520803075761 27.883625975988128
epoch 20 -7.572182386762854 27.881449428141163
epoch 25 -7.57212353498719 27.881353718813642
epoch 30 -7.5755096272602245 27.886859910755877
epoch 35 -7.5813296665532555 27.896321452920116
epoch 40 -7.589042697834499 27.908855458815697
epoch 45 -7.577431092465165 27.889983960061084
epoch 50 -7.583070041134365 27.89915012803791
epoch 55 -7.5920080035796484 27.913672709739295
epoch 60 -7.5737353890529615 27.88397492234436
epoch 65 -7.574603479567273 27.88538651252965
epoch 70 -7.581367153371666 27.896382384223024
[32m[I 2022-03-03 03:41:24,377][0m Trial 0 finished with value: 27.883456164541272 and parameters: {'n_layers_fe': 4, 'fe_neurons': 64, 'fe_dropout': 0.2348614546089398, 'n_units_l(Invariant)': 336, 'n_layers_mlp': 2, 'initialiser': 'uniform', 'lr': 7.103566354599899e-05, 'weight_decay': 0.02634128103181942, 'criterion': 'PoissonNLLLoss', 'batch_size': 32, 'epochs': 75}. Best is trial 0 with value: 27.883456164541272.[0m

Trial Id: 1 | Model params: 27144 | Timestamp: 2022-03-03 03:41:24.377598

epoch 0 -7.670545020086571 28.04095783601682
epoch 5 -7.599864594957859 27.92643202102948
epoch 10 -7.576381837702552 27.88827805341045
epoch 15 -7.568096423174367 27.874803736258816
epoch 20 -7.592070113637256 27.913773600979514
epoch 25 -7.586595912582418 27.9048799377762
epoch 30 -7.594554450632536 27.917808845537945
epoch 35 -7.588324856461911 27.907689173443305
epoch 40 -7.564171030198251 27.868417714869132
epoch 45 -7.567675457244961 27.874118958321098
epoch 50 -7.579512565353216 27.8933677659698
epoch 55 -7.5930242101783385 27.91532338439539
epoch 60 -7.585492907597192 27.90308759710308
epoch 65 -7.596465743746318 27.920912912763217
epoch 70 -7.570835040432138 27.879258186568965
[32m[I 2022-03-03 04:37:15,040][0m Trial 1 finished with value: 27.90144648795904 and parameters: {'n_layers_fe': 4, 'fe_neurons': 64, 'fe_dropout': 0.3713639642574307, 'n_units_l(Invariant)': 99, 'n_layers_mlp': 2, 'initialiser': 'uniform', 'lr': 0.0020382663296104895, 'weight_decay': 0.13396702889569392, 'criterion': 'PoissonNLLLoss', 'batch_size': 256, 'epochs': 75}. Best is trial 0 with value: 27.883456164541272.[0m

Trial Id: 2 | Model params: 385404 | Timestamp: 2022-03-03 04:37:15.040357

epoch 0 -7.520631005717659 27.797486288410912
epoch 5 -7.582211039145998 27.897754006080987
epoch 10 -7.56773527416806 27.87421626249235
epoch 15 -7.573520392687199 27.883625308635615
epoch 20 -7.585542563615732 27.90316828869799
epoch 25 -7.583628088662142 27.900057076171006
epoch 30 -7.583880846738994 27.90046785310499
epoch 35 -7.588621702679921 27.90817146891651
epoch 40 -7.590227654335241 27.910780565042508
epoch 45 -7.574987207332761 27.88601046425927
[32m[I 2022-03-03 06:08:14,612][0m Trial 2 finished with value: 27.929171547265632 and parameters: {'n_layers_fe': 2, 'fe_neurons': 256, 'fe_dropout': 0.17823301183841506, 'n_units_l(Invariant)': 317, 'n_layers_mlp': 4, 'initialiser': 'xavier', 'lr': 0.000641150244027106, 'weight_decay': 0.11870843322934496, 'criterion': 'PoissonNLLLoss', 'batch_size': 32, 'epochs': 50}. Best is trial 0 with value: 27.883456164541272.[0m

Trial Id: 3 | Model params: 40670 | Timestamp: 2022-03-03 06:08:14.613189

epoch 0 -0.022309337826853737 9.62854821412536
epoch 5 0.09934854561966444 9.03749401980613
epoch 10 0.10143092306341595 9.027040273118056
epoch 15 0.09369553944902365 9.065811907829142
epoch 20 0.08896473161197282 9.089442372560224
[32m[I 2022-03-03 06:28:51,859][0m Trial 3 finished with value: 9.083745552367265 and parameters: {'n_layers_fe': 2, 'fe_neurons': 64, 'fe_dropout': 0.4648637243366894, 'n_units_l(Invariant)': 430, 'n_layers_mlp': 2, 'initialiser': 'kaiming_he', 'lr': 0.0034429256984508383, 'weight_decay': 0.0988618746777185, 'criterion': 'MSELoss', 'batch_size': 256, 'epochs': 25}. Best is trial 3 with value: 9.083745552367265.[0m

Trial Id: 4 | Model params: 49608 | Timestamp: 2022-03-03 06:28:51.859509

epoch 0 -8.113103834781368 28.74768019793659
epoch 5 -8.279447758868269 29.00886327806511
epoch 10 -7.940892655712217 28.474760896715065
epoch 15 -7.801999354840316 28.252723018221342
epoch 20 -7.485074670438445 27.73942662033468
epoch 25 -7.641319818223286 27.993660095350737
epoch 30 -7.612319291754879 27.946646839555548
epoch 35 -7.584385283201366 27.90128763420359
epoch 40 -7.599682385282007 27.926136173750532
epoch 45 -7.579572302185749 27.89346487279993
epoch 50 -7.563142016125147 27.866743422320333
epoch 55 -7.573500473851519 27.883592917642893
epoch 60 -7.596854745182345 27.92154463472158
epoch 65 -7.575048514182944 27.88611014956309
epoch 70 -7.57097507219437 27.879485933672328
[32m[I 2022-03-03 07:20:42,071][0m Trial 4 finished with value: 27.92340839552554 and parameters: {'n_layers_fe': 2, 'fe_neurons': 128, 'fe_dropout': 0.28626432938337765, 'n_units_l(Invariant)': 35, 'n_layers_mlp': 2, 'initialiser': 'normal', 'lr': 0.00016911807457215653, 'weight_decay': 0.06146198030274158, 'criterion': 'PoissonNLLLoss', 'batch_size': 128, 'epochs': 75}. Best is trial 3 with value: 9.083745552367265.[0m

Trial Id: 5 | Model params: 556204 | Timestamp: 2022-03-03 07:20:42.072058

[32m[I 2022-03-03 07:23:32,033][0m Trial 5 pruned. [0m
epoch 0 0.03460886731000845 9.35666969134671

Trial Id: 6 | Model params: 114612 | Timestamp: 2022-03-03 07:23:32.033380

[32m[I 2022-03-03 07:24:30,417][0m Trial 6 pruned. [0m
epoch 0 -7.582816556317418 27.89873815055522

Trial Id: 7 | Model params: 449650 | Timestamp: 2022-03-03 07:24:30.417615

[32m[I 2022-03-03 07:26:44,093][0m Trial 7 pruned. [0m
epoch 0 -5.166329808299816 23.647379455830663

Trial Id: 8 | Model params: 420492 | Timestamp: 2022-03-03 07:26:44.093709

[32m[I 2022-03-03 07:29:43,456][0m Trial 8 pruned. [0m
epoch 0 -7.594026013978652 27.916950568337484

Trial Id: 9 | Model params: 308262 | Timestamp: 2022-03-03 07:29:43.456824

epoch 0 -8.979861015251467 30.083744540153532
epoch 5 -7.645798757571184 28.00091394462717
epoch 10 -7.603755895508652 27.93274943736857
epoch 15 -7.564897530552578 27.869599731547353
epoch 20 -7.579582050881017 27.893480720024137
epoch 25 -7.572990836389023 27.882764158446477
epoch 30 -7.5735395469049305 27.88365645621021
epoch 35 -7.584386237630056 27.901289185263327
epoch 40 -7.587860583434875 27.906934837606112
epoch 45 -7.581239987872204 27.896175688105842
