[32m[I 2022-03-15 00:29:02,066][0m Trial 17 pruned. [0m
epoch 0 0.11878073323251859 4.256363387184374

Previous best Test-set performance: 0.1563574296419069

Trial Id: 18 | Model params: 392112 | Timestamp: 2022-03-15 00:29:02.066859

[32m[I 2022-03-15 00:29:48,452][0m Trial 18 pruned. [0m
epoch 0 0.03739320590805917 4.448577573657763

Previous best Test-set performance: 0.1563574296419069

Trial Id: 19 | Model params: 392112 | Timestamp: 2022-03-15 00:29:48.452476

[32m[I 2022-03-15 00:30:33,536][0m Trial 19 pruned. [0m
epoch 0 0.15640824103807016 4.164500044544494

Study statistics: 
  Number of finished trials:  20
  Number of pruned trials:  14
  Number of complete trials:  6

Best trial:
  Value:  4.181212539223515
  Params: 
    lr: 1.4989888391590217e-05
    weight_decay: 0.22051488365833258
    criterion: MSELoss
    batch_size: 128
    epochs: 20
Target: 132567, NaN: 0, Max: 83.0, Min: 0.0, Mean: 8.78098621828962
Prediction: 132567, NaN: 0, Max: 20.410541534423828, Min: 3.573784589767456, Mean: 8.955989503917666

 XXXXXX======== TRIAL south - rlbg ended

Test Set - R-squared:  0.14962384342953117
Test Set - RMSE:  4.181212539223515
Test Set - MAE:  3.24763701163442



