[32m[I 2022-03-14 10:03:16,962][0m A new study created in memory with name: DeepSet[0m
Starting Loading south
Finished Loading south
Finished south setup

++++++++ Session Characteristics +++++++

Area: south
Gal Type: rlbg
Training Set: 530265
Validation Set: 132567
Test Samples: 132567
Number of features: 5
Device: cuda:0
Number of Workers: 8
Number of Trials: 20

+++++++++++++++++++++++++++++++++++++++

Trial Id: 0 | Model params: 105122 | Timestamp: 2022-03-14 10:03:16.963659

epoch 0 0.04978127564307977 4.419859854177456
epoch 5 0.13717067433808128 4.211716745899587
epoch 10 0.1374651297337297 4.210998024068585
epoch 15 0.13974740209685388 4.205423171025904
epoch 20 0.14113338298290568 4.202034058504564
epoch 25 0.11981956221444012 4.253853831563579
epoch 30 0.14176311200466762 4.200493290726026
epoch 35 0.13825120368712707 4.209078733322875
epoch 40 0.1365776273479522 4.213163913270781
epoch 45 0.13520181679395293 4.216519286203623
epoch 50 0.12597209305818013 4.238960372019159
epoch 55 0.1399597106285101 4.204904194206995
epoch 60 0.1403013945963708 4.2040688315521875
epoch 65 0.09837934854271202 4.305351678108141
epoch 70 0.12131827827513142 4.250230690801897
[32m[I 2022-03-14 10:45:46,156][0m Trial 0 finished with value: 4.249941969457645 and parameters: {'n_layers_fe': 4, 'fe_neurons': 128, 'fe_dropout': 0.15762726890434975, 'n_units_l(Invariant)': 208, 'n_layers_mlp': 2, 'initialiser': 'uniform', 'lr': 0.0021837973909995417, 'weight_decay': 0.05485799184290411, 'criterion': 'MSELoss', 'batch_size': 256, 'epochs': 75}. Best is trial 0 with value: 4.249941969457645.[0m

Trial Id: 1 | Model params: 444490 | Timestamp: 2022-03-14 10:45:46.156704

epoch 0 -2.1462200234863875 8.042503381715301
epoch 5 -2.1573448125302317 8.056709667607837
epoch 10 -2.1383513280085356 8.032439936152295
epoch 15 -2.119393290450619 8.008142152047878
epoch 20 -2.143096367652485 8.038509978365
[32m[I 2022-03-14 11:10:34,114][0m Trial 1 finished with value: 8.026375972971712 and parameters: {'n_layers_fe': 4, 'fe_neurons': 256, 'fe_dropout': 0.15822817814073187, 'n_units_l(Invariant)': 36, 'n_layers_mlp': 4, 'initialiser': 'kaiming_he', 'lr': 0.0010016252730526338, 'weight_decay': 0.07004983905222767, 'criterion': 'PoissonNLLLoss', 'batch_size': 128, 'epochs': 25}. Best is trial 0 with value: 4.249941969457645.[0m

Trial Id: 2 | Model params: 53676 | Timestamp: 2022-03-14 11:10:34.114586

epoch 0 -2.146180518080495 8.042452888845208
epoch 5 -2.140943076194524 8.03575597109887
epoch 10 -2.142022664965154 8.037136856770656
epoch 15 -2.161972933703893 8.062612376464768
epoch 20 -2.1460636480132673 8.042303512365809
epoch 25 -2.143811241040744 8.039424075401712
epoch 30 -2.1427412078264285 8.03805580258951
epoch 35 -2.149684391351278 8.046930046788384
epoch 40 -2.158694748376728 8.058431823336013
epoch 45 -2.1381052796887245 8.032125056318538
[32m[I 2022-03-14 11:45:27,886][0m Trial 2 finished with value: 8.042447260531253 and parameters: {'n_layers_fe': 2, 'fe_neurons': 64, 'fe_dropout': 0.4517644607855165, 'n_units_l(Invariant)': 501, 'n_layers_mlp': 4, 'initialiser': 'uniform', 'lr': 0.000291605641838453, 'weight_decay': 0.2741026468532817, 'criterion': 'PoissonNLLLoss', 'batch_size': 128, 'epochs': 50}. Best is trial 0 with value: 4.249941969457645.[0m

Trial Id: 3 | Model params: 100832 | Timestamp: 2022-03-14 11:45:27.886377

epoch 0 -2.1499667772922226 8.047290763720795
epoch 5 -2.1513496747116614 8.049057029410124
epoch 10 -2.1478950618648924 8.044643999528605
epoch 15 -2.145109187873013 8.041083473409083
epoch 20 -2.1538716442666503 8.052277144466442
epoch 25 -2.1424615223023777 8.03769812473432
epoch 30 -2.142503065555073 8.037751253629985
epoch 35 -2.142712112812129 8.038018594961784
epoch 40 -2.1402393900440386 8.034855769026441
epoch 45 -2.132911585191231 8.025475553691662
epoch 50 -2.1514445404168225 8.049178179679584
epoch 55 -2.1405602453648305 8.035266240977096
epoch 60 -2.141591412405936 8.03658527660286
epoch 65 -2.156559887246478 8.055708144400466
epoch 70 -2.1338175524485417 8.0266358629304
[32m[I 2022-03-14 14:54:46,534][0m Trial 3 finished with value: 8.066100617666924 and parameters: {'n_layers_fe': 4, 'fe_neurons': 128, 'fe_dropout': 0.3453040327083635, 'n_units_l(Invariant)': 175, 'n_layers_mlp': 2, 'initialiser': 'uniform', 'lr': 0.0019130886346828027, 'weight_decay': 0.2867230087225292, 'criterion': 'PoissonNLLLoss', 'batch_size': 32, 'epochs': 75}. Best is trial 0 with value: 4.249941969457645.[0m

Trial Id: 4 | Model params: 46284 | Timestamp: 2022-03-14 14:54:46.534407

epoch 0 -2.034977124114131 7.8990419053180805
epoch 5 -2.091459285334995 7.972205269094623
epoch 10 -2.1176251608576426 8.00587224908423
epoch 15 -2.0500470809432514 7.918628678542792
epoch 20 -2.1140965844496096 8.00134038135314
epoch 25 -2.10735624618861 7.992676399014861
epoch 30 -2.0898348079771703 7.970110405874923
epoch 35 -2.085985148584798 7.9651438340233325
epoch 40 -2.1266530623271787 8.017455421217624
epoch 45 -2.1193319842544285 8.008063458677022
epoch 50 -2.0958649268239276 7.977883845232837
epoch 55 -2.117243126503409 8.005381713535451
epoch 60 -2.0816465494582794 7.959542750557612
epoch 65 -2.0860854797193387 7.96527331381403
epoch 70 -2.1281844506231002 8.019418596239413
[32m[I 2022-03-14 17:56:19,401][0m Trial 4 finished with value: 7.994408952060265 and parameters: {'n_layers_fe': 2, 'fe_neurons': 64, 'fe_dropout': 0.008447146588160037, 'n_units_l(Invariant)': 389, 'n_layers_mlp': 4, 'initialiser': 'normal', 'lr': 0.0010943455023959693, 'weight_decay': 0.005324180375077447, 'criterion': 'PoissonNLLLoss', 'batch_size': 32, 'epochs': 75}. Best is trial 0 with value: 4.249941969457645.[0m

Trial Id: 5 | Model params: 21402 | Timestamp: 2022-03-14 17:56:19.401393

[32m[I 2022-03-14 17:56:59,236][0m Trial 5 pruned. [0m
epoch 0 -0.19655655729809074 4.959790385460298

Trial Id: 6 | Model params: 45026 | Timestamp: 2022-03-14 17:56:59.236937

epoch 0 -2.3416474911605385 8.288520654692443
epoch 5 -2.134455532676885 8.027452849608398
epoch 10 -2.145140052270321 8.04112292873025
epoch 15 -2.144582291770528 8.040409889003783
epoch 20 -2.1401119967134075 8.034692788232327
epoch 25 -2.1418673466590037 8.036938206085535
epoch 30 -2.1442164855495465 8.03994220884369
epoch 35 -2.1430615392277486 8.03846544116623
epoch 40 -2.145477718056436 8.041554569162267
epoch 45 -2.135044246611738 8.028206672947402
epoch 50 -2.1388831236396384 8.033120458355993
epoch 55 -2.1395242010693853 8.033940748422898
epoch 60 -2.1489347906603635 8.045972436039579
epoch 65 -2.148230213939187 8.045072239242701
epoch 70 -2.1406495178235767 8.035380443988727
[32m[I 2022-03-14 20:41:52,562][0m Trial 6 finished with value: 8.035329869082924 and parameters: {'n_layers_fe': 2, 'fe_neurons': 64, 'fe_dropout': 0.28251540734771324, 'n_units_l(Invariant)': 496, 'n_layers_mlp': 2, 'initialiser': 'kaiming_he', 'lr': 1.3771275322716556e-05, 'weight_decay': 0.2449272724857242, 'criterion': 'PoissonNLLLoss', 'batch_size': 32, 'epochs': 75}. Best is trial 0 with value: 4.249941969457645.[0m

Trial Id: 7 | Model params: 111622 | Timestamp: 2022-03-14 20:41:52.562978

[32m[I 2022-03-14 20:42:33,314][0m Trial 7 pruned. [0m
epoch 0 0.10844882152542668 4.28124267749343

Trial Id: 8 | Model params: 165056 | Timestamp: 2022-03-14 20:42:33.314402

[32m[I 2022-03-14 20:43:22,139][0m Trial 8 pruned. [0m
epoch 0 -2.1446426251460604 8.040487022100873

Trial Id: 9 | Model params: 441136 | Timestamp: 2022-03-14 20:43:22.139539

epoch 0 -2.7920898112153685 8.829498032167846
epoch 5 -2.693566640687738 8.714042553284017
epoch 10 -2.6711581353400873 8.687568719322849
epoch 15 -2.6387677708700745 8.64915891255737
epoch 20 -2.666163265762567 8.681656682705245
epoch 25 -2.531439832717038 8.520647767080415
epoch 30 -2.4185943567681134 8.383405872689753
epoch 35 -2.261071236608622 8.187981443913463
epoch 40 -2.1448515636896293 8.040754133493767
epoch 45 -2.17030980677927 8.073234340916875
[32m[I 2022-03-14 21:29:52,426][0m Trial 9 finished with value: 8.059354254049046 and parameters: {'n_layers_fe': 4, 'fe_neurons': 256, 'fe_dropout': 0.3680534946582316, 'n_units_l(Invariant)': 23, 'n_layers_mlp': 4, 'initialiser': 'kaiming_he', 'lr': 1.1298356577406342e-05, 'weight_decay': 0.0004662438322274642, 'criterion': 'PoissonNLLLoss', 'batch_size': 256, 'epochs': 50}. Best is trial 0 with value: 4.249941969457645.[0m

Trial Id: 10 | Model params: 99662 | Timestamp: 2022-03-14 21:29:52.426524

[32m[I 2022-03-14 21:30:25,026][0m Trial 10 pruned. [0m
epoch 0 -0.007964044237682044 4.552177910346289

Trial Id: 11 | Model params: 34730 | Timestamp: 2022-03-14 21:30:25.026934

[32m[I 2022-03-14 21:30:46,144][0m Trial 11 pruned. [0m
epoch 0 0.14774691836035336 4.185824320125266

Trial Id: 12 | Model params: 31562 | Timestamp: 2022-03-14 21:30:46.145039

[32m[I 2022-03-14 21:32:52,426][0m Trial 12 pruned. [0m
epoch 0 0.14577194373679814 4.190671538159692

Trial Id: 13 | Model params: 100702 | Timestamp: 2022-03-14 21:32:52.426254

[32m[I 2022-03-14 21:33:24,520][0m Trial 13 pruned. [0m
epoch 0 0.09397229612938618 4.315860965584689

Trial Id: 14 | Model params: 162586 | Timestamp: 2022-03-14 21:33:24.521134

[32m[I 2022-03-14 21:36:07,316][0m Trial 14 pruned. [0m
epoch 0 0.12199377786994803 4.248596662781705

Trial Id: 15 | Model params: 20936 | Timestamp: 2022-03-14 21:36:07.316903

epoch 0 -2.146779535440916 8.043218474224775
[32m[I 2022-03-14 21:36:47,861][0m Trial 15 pruned. [0m

Trial Id: 16 | Model params: 276524 | Timestamp: 2022-03-14 21:36:47.862090

[32m[I 2022-03-14 21:38:57,778][0m Trial 16 pruned. [0m
epoch 0 -0.8986245771317125 6.247643729438531

Trial Id: 17 | Model params: 50842 | Timestamp: 2022-03-14 21:38:57.778467

[32m[I 2022-03-14 21:41:47,269][0m Trial 17 pruned. [0m
epoch 0 -2.12946767044501 8.021063259772058

Trial Id: 18 | Model params: 122936 | Timestamp: 2022-03-14 21:41:47.269801

epoch 0 -2.799876967061359 8.838559185572223
epoch 5 -2.2202297117958216 8.136546920641358
epoch 10 -5.181579640500404 11.273179994268535
epoch 15 -2.1756688456278606 8.080054890173102
epoch 20 -2.1061592132751845 7.991136759278317
epoch 25 -2.0903982371816396 7.970837044764884
epoch 30 -2.072515754228304 7.947742099762388
epoch 35 -2.1129971702074277 7.999927842614475
epoch 40 -2.1237429422382643 8.013723445022691
epoch 45 -2.082919093486472 7.961185999221369
epoch 50 -2.062420504724092 7.934674558335289
epoch 55 -2.1086411845691195 7.994328773954235
epoch 60 -2.126964726506357 8.01785500047177
epoch 65 -2.131385343945585 8.023520454795491
epoch 70 -2.0941234182346866 7.975639640786836
[32m[I 2022-03-14 22:19:15,510][0m Trial 18 finished with value: 7.93628509975959 and parameters: {'n_layers_fe': 4, 'fe_neurons': 128, 'fe_dropout': 0.0036802741197145064, 'n_units_l(Invariant)': 91, 'n_layers_mlp': 4, 'initialiser': 'normal', 'lr': 0.00013577603114233466, 'weight_decay': 0.000991537990630835, 'criterion': 'PoissonNLLLoss', 'batch_size': 256, 'epochs': 75}. Best is trial 0 with value: 4.249941969457645.[0m

Trial Id: 19 | Model params: 90822 | Timestamp: 2022-03-14 22:19:15.510644

[32m[I 2022-03-14 22:19:45,433][0m Trial 19 pruned. [0m
epoch 0 0.03715092849135704 4.449137367168864

Study statistics: 
  Number of finished trials:  20
  Number of pruned trials:  12
  Number of complete trials:  8

Best trial:
  Value:  4.249941969457645
  Params: 
    n_layers_fe: 4
    fe_neurons: 128
    fe_dropout: 0.15762726890434975
    n_units_l(Invariant): 208
    n_layers_mlp: 2
    initialiser: uniform
    lr: 0.0021837973909995417
    weight_decay: 0.05485799184290411
    criterion: MSELoss
    batch_size: 256
    epochs: 75
Target: 132567, NaN: 0, Max: 83.0, Min: 0.0, Mean: 8.78098621828962
Prediction: 132567, NaN: 0, Max: 22.27498435974121, Min: 4.505741596221924, Mean: 9.426171764823916

 XXXXXX======== TRIAL south - rlbg ended

Test Set - R-squared:  0.12143765323122402
Test Set - RMSE:  4.249941969457645
Test Set - MAE:  3.3455576917421896



[32m[I 2022-03-14 22:21:08,636][0m A new study created in memory with name: DeepSet[0m
Starting Loading south
Finished Loading south
Finished south setup

++++++++ Session Characteristics +++++++

Area: south
Gal Type: rlbg
Training Set: 530265
Validation Set: 132567
Test Samples: 132567
Number of features: 5
Device: cuda:0
Number of Workers: 8
Number of Trials: 20

+++++++++++++++++++++++++++++++++++++++

Previous best Test-set performance: 0.1563574296419069

Trial Id: 0 | Model params: 392112 | Timestamp: 2022-03-14 22:21:08.637067

epoch 0 0.15287715723229733 4.173206769376312
epoch 1 0.15361550911398092 4.171387690358588
epoch 2 0.15333754676751687 4.172072599841925
epoch 3 0.1531453582827036 4.172546093623885
epoch 4 0.15302200816736666 4.172849962361272
epoch 5 0.12907534183733838 4.231428435325026
epoch 6 0.1425168730379458 4.198648308473459
epoch 7 0.14014936633803854 4.20444053682468
epoch 8 0.14591262917264947 4.1903264366824535
epoch 9 0.151853776855414 4.17572676330986
epoch 10 0.1428269380954268 4.1978891262827265
epoch 11 0.14999040073724046 4.180311279705047
epoch 12 0.14472456560955882 4.1932398646638775
epoch 13 0.14525705970758118 4.191934306802178
epoch 14 0.1508077889429158 4.178300855949242
epoch 15 0.1407182002254701 4.203049583653575
epoch 16 0.15062731386654982 4.178744830290515
epoch 17 0.15079495511437413 4.178332429127542
epoch 18 0.15007744314907256 4.180097238774293
[32m[I 2022-03-14 22:36:56,612][0m Trial 0 finished with value: 4.181212539223515 and parameters: {'lr': 1.4989888391590217e-05, 'weight_decay': 0.22051488365833258, 'criterion': 'MSELoss', 'batch_size': 128, 'epochs': 20}. Best is trial 0 with value: 4.181212539223515.[0m
epoch 19 0.14962384342953117 4.181212539223515

Previous best Test-set performance: 0.1563574296419069

Trial Id: 1 | Model params: 392112 | Timestamp: 2022-03-14 22:36:56.612781

epoch 0 -2.1065303616984226 7.991614167069179
epoch 1 -2.1672179410754393 8.069296642899802
epoch 2 -2.137188625533539 8.030951861365235
epoch 3 -2.1579971311013835 8.05754189693743
epoch 4 -2.1428281546892687 8.038166991970911
epoch 5 -2.1314908220278115 8.02365558642745
epoch 6 -2.1179824163027776 8.006330941097175
epoch 7 -2.1094083938220534 7.995315208905163
epoch 8 -2.1445111410284468 8.040318925512732
[32m[I 2022-03-14 22:44:24,903][0m Trial 1 finished with value: 8.032924862386082 and parameters: {'lr': 0.0009956018856146424, 'weight_decay': 0.08104920570276399, 'criterion': 'PoissonNLLLoss', 'batch_size': 256, 'epochs': 10}. Best is trial 0 with value: 4.181212539223515.[0m
epoch 9 -2.1387302701083817 8.032924862386082

Previous best Test-set performance: 0.1563574296419069

Trial Id: 2 | Model params: 392112 | Timestamp: 2022-03-14 22:44:24.903199

epoch 0 0.11640845785438858 4.2620886816831405
epoch 1 0.1204953037491786 4.2522206109665746
epoch 2 0.09410996287313123 4.315533065513657
epoch 3 0.057129668043720105 4.402736480119341
epoch 4 0.1226185175537754 4.247084862982568
epoch 5 0.005421727644676966 4.521850403939724
epoch 6 0.07008580759966432 4.372382473912999
epoch 7 0.018713255175266008 4.491533808751327
epoch 8 0.07917874385887214 4.350952828034182
[32m[I 2022-03-14 22:51:49,078][0m Trial 2 finished with value: 4.248508074186531 and parameters: {'lr': 0.0027749925178405755, 'weight_decay': 0.2759473395083161, 'criterion': 'MSELoss', 'batch_size': 256, 'epochs': 10}. Best is trial 0 with value: 4.181212539223515.[0m
epoch 9 0.1220303925608811 4.248508074186531

Previous best Test-set performance: 0.1563574296419069

Trial Id: 3 | Model params: 392112 | Timestamp: 2022-03-14 22:51:49.078509

epoch 0 -2.1262238222012546 8.01690506727252
epoch 1 -2.101890073635682 7.985643317614967
epoch 2 -2.1086236345905567 7.994306207744709
epoch 3 -2.120788281344467 8.009932570194898
epoch 4 -2.0968196934570447 7.979113942523204
epoch 5 -2.1351271847183493 8.028312866003205
epoch 6 -2.130420509208523 8.022284265888205
epoch 7 -2.08099736437089 7.958704320754654
epoch 8 -2.1678950372768515 8.070159134560829
epoch 9 -2.1178095644617683 8.006109014216484
epoch 10 -2.0988239732278693 7.9816955894213155
epoch 11 -2.0838159590445042 7.962343926836781
epoch 12 -2.1189945751084918 8.0076303423982
epoch 13 -2.0900621999527895 7.970403674920167
epoch 14 -2.108749424660875 7.994467950413735
epoch 15 -2.13646875536993 8.030030403492514
epoch 16 -2.1331214494339767 8.025744350320457
epoch 17 -2.098545535770096 7.981336993229298
epoch 18 -2.1093978236409106 7.995301619181465
[32m[I 2022-03-14 23:43:29,543][0m Trial 3 finished with value: 8.002759532713435 and parameters: {'lr': 1.1875407523257587e-05, 'weight_decay': 0.03822006608218068, 'criterion': 'PoissonNLLLoss', 'batch_size': 32, 'epochs': 20}. Best is trial 0 with value: 4.181212539223515.[0m
epoch 19 -2.115201340931068 8.002759532713435

Previous best Test-set performance: 0.1563574296419069

Trial Id: 4 | Model params: 392112 | Timestamp: 2022-03-14 23:43:29.543411

epoch 0 -2.104629649052716 7.98916898152595
epoch 1 -2.17254903661417 8.07608495131134
epoch 2 -2.168450661272981 8.070866824907057
epoch 3 -2.1497611794574687 8.04702813673584
[32m[I 2022-03-14 23:56:16,966][0m Trial 4 finished with value: 8.016236651959185 and parameters: {'lr': 0.002403627999014447, 'weight_decay': 0.18173177971424356, 'criterion': 'PoissonNLLLoss', 'batch_size': 32, 'epochs': 5}. Best is trial 0 with value: 4.181212539223515.[0m
epoch 4 -2.125702541545811 8.016236651959185

Previous best Test-set performance: 0.1563574296419069

Trial Id: 5 | Model params: 392112 | Timestamp: 2022-03-14 23:56:16.966394

[32m[I 2022-03-14 23:57:00,292][0m Trial 5 pruned. [0m
epoch 0 0.13939931341263 4.206273916591392

Previous best Test-set performance: 0.1563574296419069

Trial Id: 6 | Model params: 392112 | Timestamp: 2022-03-14 23:57:00.292310

epoch 0 -2.126733276388623 8.017558264181693
epoch 1 -2.123687754843383 8.013652655191105
epoch 2 -2.1298113830333807 8.021503728409154
epoch 3 -2.1449041756746237 8.04082139235447
epoch 4 -2.13746285276077 8.031302853574994
epoch 5 -2.1178648486382707 8.00617999500807
epoch 6 -2.1537193186343155 8.052082687754716
epoch 7 -2.1579719904509957 8.057509824038283
epoch 8 -2.155181130858881 8.053948622552952
epoch 9 -2.1598570076917065 8.059914259403518
epoch 10 -2.116640962127332 8.004608468024779
epoch 11 -2.1385054229775977 8.032637132587745
epoch 12 -2.1551840642435725 8.053952366446428
epoch 13 -2.1480914246881118 8.044894904394027
epoch 14 -2.136548890846884 8.030132984811882
epoch 15 -2.147560618379229 8.044216642486433
epoch 16 -2.1465059819418904 8.042868863082337
epoch 17 -2.162299528172452 8.063028752042339
epoch 18 -2.147527175462845 8.044173907363625
[32m[I 2022-03-15 00:12:49,061][0m Trial 6 finished with value: 8.033011260988586 and parameters: {'lr': 0.00015251008128486836, 'weight_decay': 0.21376088148265054, 'criterion': 'PoissonNLLLoss', 'batch_size': 128, 'epochs': 20}. Best is trial 0 with value: 4.181212539223515.[0m
epoch 19 -2.1387977880727536 8.033011260988586

Previous best Test-set performance: 0.1563574296419069

Trial Id: 7 | Model params: 392112 | Timestamp: 2022-03-15 00:12:49.062084

[32m[I 2022-03-15 00:13:36,308][0m Trial 7 pruned. [0m
epoch 0 0.13316670903117211 4.22147768506745

Previous best Test-set performance: 0.1563574296419069

Trial Id: 8 | Model params: 392112 | Timestamp: 2022-03-15 00:13:36.308368

[32m[I 2022-03-15 00:14:21,139][0m Trial 8 pruned. [0m
epoch 0 0.10727819017013152 4.284052450490302

Previous best Test-set performance: 0.1563574296419069

Trial Id: 9 | Model params: 392112 | Timestamp: 2022-03-15 00:14:21.139383

epoch 0 -2.107151301358458 7.9924128172772715
epoch 1 -2.124096065006839 8.014176386940772
epoch 2 -2.1307661761209227 8.02272717151025
epoch 3 -2.137951508785777 8.03192826205206
epoch 4 -2.136368312508797 8.029901824866506
epoch 5 -2.115680029669815 8.003374369973663
epoch 6 -2.127433200695235 8.018455585667374
epoch 7 -2.1368460415453994 8.03051335559459
[32m[I 2022-03-15 00:21:05,449][0m Trial 9 pruned. [0m
epoch 8 -2.1405947110469716 8.03531033186387

Previous best Test-set performance: 0.1563574296419069

Trial Id: 10 | Model params: 392112 | Timestamp: 2022-03-15 00:21:05.449432

[32m[I 2022-03-15 00:21:52,932][0m Trial 10 pruned. [0m
epoch 0 0.15269157771026354 4.173663857337911

Previous best Test-set performance: 0.1563574296419069

Trial Id: 11 | Model params: 392112 | Timestamp: 2022-03-15 00:21:52.932959

[32m[I 2022-03-15 00:22:40,428][0m Trial 11 pruned. [0m
epoch 0 0.13266075566617597 4.2227095016617415

Previous best Test-set performance: 0.1563574296419069

Trial Id: 12 | Model params: 392112 | Timestamp: 2022-03-15 00:22:40.428447

[32m[I 2022-03-15 00:23:27,412][0m Trial 12 pruned. [0m
epoch 0 0.045637298736299514 4.4294870436724825

Previous best Test-set performance: 0.1563574296419069

Trial Id: 13 | Model params: 392112 | Timestamp: 2022-03-15 00:23:27.413176

[32m[I 2022-03-15 00:24:11,949][0m Trial 13 pruned. [0m
epoch 0 0.028809215939100685 4.468368516026415

Previous best Test-set performance: 0.1563574296419069

Trial Id: 14 | Model params: 392112 | Timestamp: 2022-03-15 00:24:11.949620

[32m[I 2022-03-15 00:24:59,464][0m Trial 14 pruned. [0m
epoch 0 0.13957346735373855 4.205848297454158

Previous best Test-set performance: 0.1563574296419069

Trial Id: 15 | Model params: 392112 | Timestamp: 2022-03-15 00:24:59.464430

[32m[I 2022-03-15 00:25:44,137][0m Trial 15 pruned. [0m
epoch 0 0.09380566437241389 4.316257822341675

Previous best Test-set performance: 0.1563574296419069

Trial Id: 16 | Model params: 392112 | Timestamp: 2022-03-15 00:25:44.138033

[32m[I 2022-03-15 00:28:18,429][0m Trial 16 pruned. [0m
epoch 0 0.138518601433802 4.208425651185247

Previous best Test-set performance: 0.1563574296419069

Trial Id: 17 | Model params: 392112 | Timestamp: 2022-03-15 00:28:18.429669

