[32m[I 2022-03-04 12:37:29,688][0m A new study created in memory with name: DeepSet[0m
Starting Loading south
Finished Loading south
Finished south setup

++++++++ Session Characteristics +++++++

Area: south
Gal Type: rlbg
Training Set: 530265
Validation Set: 132567
Test Samples: 132567
Number of features: 5
Device: cuda:0
Number of Workers: 8
Number of Trials: 15

+++++++++++++++++++++++++++++++++++++++

Trial Id: 0 | Model params: 36322 | Timestamp: 2022-03-04 12:37:29.704466

epoch 0 -2.1518199675315985 8.049657608987138
epoch 5 -2.1455156855323154 8.041603101791518
epoch 10 -2.1402863761464257 8.034915879912388
epoch 15 -2.1385933918564817 8.032749704821407
epoch 20 -2.148153233053976 8.04497387912822
epoch 25 -2.1366039228885247 8.030203430497538
epoch 30 -2.1407553494043094 8.035515828380625
epoch 35 -2.1378284922504105 8.031770823406463
epoch 40 -2.135078660285907 8.028250736014568
epoch 45 -2.1407222672574475 8.03547350849493
[32m[I 2022-03-04 15:58:47,982][0m Trial 0 finished with value: 8.031922945867366 and parameters: {'n_layers_fe': 4, 'fe_neurons': 64, 'fe_dropout': 0.2278273433559469, 'n_units_l(Invariant)': 112, 'n_layers_mlp': 4, 'initialiser': 'uniform', 'lr': 2.624342294343727e-05, 'weight_decay': 0.16798088323574115, 'criterion': 'PoissonNLLLoss', 'batch_size': 32, 'epochs': 50}. Best is trial 0 with value: 8.031922945867366.[0m

Trial Id: 1 | Model params: 347736 | Timestamp: 2022-03-04 15:58:47.982825

epoch 0 0.10964166373007989 4.278377695434574
epoch 5 0.1033316683691049 4.293511422909927
epoch 10 0.13250823237561893 4.223080771173693
epoch 15 0.13180041579046387 4.224803298827155
epoch 20 0.1295915728593714 4.230174183079841
epoch 25 0.13274488345625568 4.222504705305768
epoch 30 0.13286876851073148 4.222203107830101
epoch 35 0.1272596406553168 4.235836973612132
epoch 40 0.13061589018848552 4.227684365574206
epoch 45 0.13244626695814543 4.223231596979693
[32m[I 2022-03-04 18:20:29,200][0m Trial 1 finished with value: 4.243853274562494 and parameters: {'n_layers_fe': 4, 'fe_neurons': 256, 'fe_dropout': 0.07543656277261779, 'n_units_l(Invariant)': 171, 'n_layers_mlp': 2, 'initialiser': 'uniform', 'lr': 8.716588742921114e-05, 'weight_decay': 0.2868480853441755, 'criterion': 'MSELoss', 'batch_size': 256, 'epochs': 50}. Best is trial 1 with value: 4.243853274562494.[0m

Trial Id: 2 | Model params: 51168 | Timestamp: 2022-03-04 18:20:29.200970

epoch 0 0.13110813967808566 4.226487328436172
epoch 5 0.14418684318980224 4.194557828855428
epoch 10 0.14998334528343293 4.180328628880844
epoch 15 0.14647430747241008 4.188948356060116
epoch 20 0.13793916368082215 4.209840719928317
[32m[I 2022-03-04 18:40:49,964][0m Trial 2 finished with value: 4.180028551205816 and parameters: {'n_layers_fe': 2, 'fe_neurons': 128, 'fe_dropout': 0.010273504107139897, 'n_units_l(Invariant)': 47, 'n_layers_mlp': 2, 'initialiser': 'uniform', 'lr': 0.00014838184527530052, 'weight_decay': 0.04377232439717508, 'criterion': 'MSELoss', 'batch_size': 256, 'epochs': 25}. Best is trial 2 with value: 4.180028551205816.[0m

Trial Id: 3 | Model params: 397530 | Timestamp: 2022-03-04 18:40:49.964671

epoch 0 -2.1588364885033307 8.058612624335257
epoch 5 -2.136186895607329 8.029669584767536
epoch 10 -2.137752686372102 8.03167380422258
epoch 15 -2.1488632452816483 8.045881031254602
epoch 20 -2.1352393988862755 8.028456541575817
epoch 25 -2.148247565740466 8.045094409842202
epoch 30 -2.147893366463584 8.044641833175925
epoch 35 -2.1160906498661833 8.003901741021568
epoch 40 -2.137182417085823 8.03094391479661
epoch 45 -2.146612296785334 8.04300473905495
epoch 50 -2.140278068028236 8.034905251092763
epoch 55 -2.1344876982949192 8.027494038152474
epoch 60 -2.14247166316628 8.037711093729552
epoch 65 -2.1459494898124056 8.042157599356548
epoch 70 -2.143599830573505 8.039153759081149
[32m[I 2022-03-04 23:06:08,200][0m Trial 3 finished with value: 8.040446905672576 and parameters: {'n_layers_fe': 4, 'fe_neurons': 256, 'fe_dropout': 0.3750989498518389, 'n_units_l(Invariant)': 364, 'n_layers_mlp': 2, 'initialiser': 'kaiming_he', 'lr': 0.00013216836386891395, 'weight_decay': 0.14938125349052675, 'criterion': 'PoissonNLLLoss', 'batch_size': 32, 'epochs': 75}. Best is trial 2 with value: 4.180028551205816.[0m

Trial Id: 4 | Model params: 110318 | Timestamp: 2022-03-04 23:06:08.200705

epoch 0 -2.126911526628249 8.017786795237576
epoch 5 -2.1427376671527583 8.038051274672847
epoch 10 -2.1399752942789734 8.034517894148998
epoch 15 -2.1303208669712084 8.02215658899762
epoch 20 -2.1288570775960824 8.02028072368284
[32m[I 2022-03-04 23:46:40,954][0m Trial 4 finished with value: 8.026024612993641 and parameters: {'n_layers_fe': 2, 'fe_neurons': 128, 'fe_dropout': 0.16496400021600882, 'n_units_l(Invariant)': 502, 'n_layers_mlp': 2, 'initialiser': 'xavier', 'lr': 0.0008346688198757547, 'weight_decay': 0.10812992725864004, 'criterion': 'PoissonNLLLoss', 'batch_size': 128, 'epochs': 25}. Best is trial 2 with value: 4.180028551205816.[0m

Trial Id: 5 | Model params: 81202 | Timestamp: 2022-03-04 23:46:40.954999

[32m[I 2022-03-04 23:48:01,121][0m Trial 5 pruned. [0m
epoch 0 0.08926229134844654 4.3270644727235625

Trial Id: 6 | Model params: 334320 | Timestamp: 2022-03-04 23:48:01.122269

[32m[I 2022-03-04 23:51:00,091][0m Trial 6 pruned. [0m
epoch 0 0.0903688189815276 4.324435026515676

Trial Id: 7 | Model params: 45690 | Timestamp: 2022-03-04 23:51:00.091466

[32m[I 2022-03-04 23:53:42,311][0m Trial 7 pruned. [0m
epoch 0 0.13960846661305681 4.205762756698162

Trial Id: 8 | Model params: 95242 | Timestamp: 2022-03-04 23:53:42.311509

[32m[I 2022-03-04 23:54:40,733][0m Trial 8 pruned. [0m
epoch 0 -0.4401333892928081 5.441242312824083

Trial Id: 9 | Model params: 80682 | Timestamp: 2022-03-04 23:54:40.733389

[32m[I 2022-03-04 23:57:16,127][0m Trial 9 pruned. [0m
epoch 0 0.03407265574513929 4.456243740201449

Trial Id: 10 | Model params: 114742 | Timestamp: 2022-03-04 23:57:16.127274

[32m[I 2022-03-04 23:58:27,602][0m Trial 10 pruned. [0m
epoch 0 0.04761245212614962 4.4249010263608275

Trial Id: 11 | Model params: 227504 | Timestamp: 2022-03-04 23:58:27.602858

[32m[I 2022-03-05 00:00:08,609][0m Trial 11 pruned. [0m
epoch 0 0.1274550730810059 4.235362682355717

Trial Id: 12 | Model params: 222344 | Timestamp: 2022-03-05 00:00:08.610150

[32m[I 2022-03-05 00:01:48,169][0m Trial 12 pruned. [0m
epoch 0 0.02357742107577454 4.480387878567294

Trial Id: 13 | Model params: 305166 | Timestamp: 2022-03-05 00:01:48.170108

[32m[I 2022-03-05 00:04:08,834][0m Trial 13 pruned. [0m
epoch 0 0.12529592943350965 4.2405997228108685

Trial Id: 14 | Model params: 323226 | Timestamp: 2022-03-05 00:04:08.834565

[32m[I 2022-03-05 00:06:41,023][0m Trial 14 pruned. [0m
epoch 0 0.1228943620990447 4.24641717890675

Study statistics: 
  Number of finished trials:  15
  Number of pruned trials:  10
  Number of complete trials:  5

Best trial:
  Value:  4.180028551205816
  Params: 
    n_layers_fe: 2
    fe_neurons: 128
    fe_dropout: 0.010273504107139897
    n_units_l(Invariant): 47
    n_layers_mlp: 2
    initialiser: uniform
    lr: 0.00014838184527530052
    weight_decay: 0.04377232439717508
    criterion: MSELoss
    batch_size: 256
    epochs: 25
Target: 132567, NaN: 0, Max: 83.0, Min: 0.0, Mean: 8.78098621828962
Prediction: 132567, NaN: 0, Max: 20.84872055053711, Min: 0.13811634480953217, Mean: 8.542495853860201

 XXXXXX======== TRIAL south - rlbg ended

Test Set - R-squared:  0.15010537486015252
Test Set - RMSE:  4.180028551205816
Test Set - MAE:  3.2077970385301464



[32m[I 2022-03-05 00:11:14,965][0m A new study created in memory with name: DeepSet[0m
Starting Loading south
Finished Loading south
Finished south setup

++++++++ Session Characteristics +++++++

Area: south
Gal Type: rlbg
Training Set: 530265
Validation Set: 132567
Test Samples: 132567
Number of features: 5
Device: cuda:0
Number of Workers: 8
Number of Trials: 15

+++++++++++++++++++++++++++++++++++++++

Previous best Test-set performance: 0.15010537486015252

Trial Id: 0 | Model params: 51168 | Timestamp: 2022-03-05 00:11:14.977837

epoch 0 0.1253288811719553 4.240519846396852
epoch 1 0.13030571858252316 4.228438457290332
epoch 2 0.13268911943786765 4.222640455467752
epoch 3 0.1241406974155812 4.243399103942144
[32m[I 2022-03-05 00:23:08,213][0m Trial 0 finished with value: 4.206045102465905 and parameters: {'lr': 0.0016309463920672245, 'weight_decay': 0.07579773110037773, 'criterion': 'MSELoss', 'batch_size': 32, 'epochs': 5}. Best is trial 0 with value: 4.206045102465905.[0m
epoch 4 0.13949294128442757 4.206045102465905

Previous best Test-set performance: 0.15010537486015252

Trial Id: 1 | Model params: 51168 | Timestamp: 2022-03-05 00:23:08.213349

epoch 0 -2.1318708656348764 8.024142454611239
epoch 1 -2.14694243053776 8.043426652758116
epoch 2 -2.1597006541387156 8.059714849775553
epoch 3 -2.1375315967946724 8.031390838860771
epoch 4 -2.135673699967692 8.029012583104706
epoch 5 -2.1483886062182718 8.045274616644205
epoch 6 -2.153988026421593 8.052425713087281
epoch 7 -2.134598170932205 8.02763549837004
epoch 8 -2.150748445081276 8.048289173900255
[32m[I 2022-03-05 00:31:32,498][0m Trial 1 finished with value: 8.047565246565153 and parameters: {'lr': 0.0008469782325908427, 'weight_decay': 0.2814129753260785, 'criterion': 'PoissonNLLLoss', 'batch_size': 128, 'epochs': 10}. Best is trial 0 with value: 4.206045102465905.[0m
epoch 9 -2.1501816636711175 8.047565246565153

Previous best Test-set performance: 0.15010537486015252

Trial Id: 2 | Model params: 51168 | Timestamp: 2022-03-05 00:31:32.498380

epoch 0 0.140485893058376 4.203617693299724
epoch 1 0.13953891641211846 4.205932740782374
epoch 2 0.13841851967014185 4.208670098964431
epoch 3 0.13902332079863822 4.207192667439959
epoch 4 0.1258480686983917 4.239261115103596
epoch 5 0.13341622467820746 4.220870070802343
epoch 6 0.13692144040500442 4.212324993038347
epoch 7 0.11603750647331257 4.262983247613501
epoch 8 0.11232151970808935 4.271934179419839
[32m[I 2022-03-05 00:39:32,953][0m Trial 2 finished with value: 4.223813666378302 and parameters: {'lr': 0.0001750899243582526, 'weight_decay': 0.23562574793370503, 'criterion': 'MSELoss', 'batch_size': 256, 'epochs': 10}. Best is trial 0 with value: 4.206045102465905.[0m
epoch 9 0.13220710826301074 4.223813666378302

Previous best Test-set performance: 0.15010537486015252

Trial Id: 3 | Model params: 51168 | Timestamp: 2022-03-05 00:39:32.954018

epoch 0 0.12518063664274037 4.240879185593504
epoch 1 0.13684582517683364 4.212509512127522
epoch 2 0.12645711943135762 4.237784040648954
epoch 3 0.13792478593103585 4.209875826374165
epoch 4 0.13768040234444057 4.2104724980065065
epoch 5 0.12255121498157995 4.247247753503943
epoch 6 0.13884770828545834 4.207621713908095
epoch 7 0.1403332157736974 4.203991025413563
epoch 8 0.14179537775988305 4.200414330380656
epoch 9 0.14253041119912357 4.198615163680225
epoch 10 0.1418702540716429 4.2002310883046015
epoch 11 0.14014777537737477 4.204444426509791
epoch 12 0.14252044034272127 4.198639574847532
epoch 13 0.14124067341877955 4.201771589258804
epoch 14 0.14054014322286845 4.203485030817502
epoch 15 0.1374546489174565 4.211023608287883
epoch 16 0.13352086447411593 4.220615228553351
epoch 17 0.14219993830132838 4.1994241689637395
epoch 18 0.1442176264894719 4.194482389788652
[32m[I 2022-03-05 00:55:35,858][0m Trial 3 finished with value: 4.2270472921578355 and parameters: {'lr': 0.0006424487016785876, 'weight_decay': 0.12299662161708182, 'criterion': 'MSELoss', 'batch_size': 256, 'epochs': 20}. Best is trial 0 with value: 4.206045102465905.[0m
epoch 19 0.13087788693476599 4.2270472921578355

Previous best Test-set performance: 0.15010537486015252

Trial Id: 4 | Model params: 51168 | Timestamp: 2022-03-05 00:55:35.858608

epoch 0 0.11410344752350943 4.267644280219581
epoch 1 0.11954419517459525 4.254519194871402
epoch 2 0.12889624443836212 4.231863489530395
epoch 3 0.13212729799493161 4.22400789241645
[32m[I 2022-03-05 01:07:18,190][0m Trial 4 finished with value: 4.290692694120317 and parameters: {'lr': 0.0012353671395753422, 'weight_decay': 0.18074055751549836, 'criterion': 'MSELoss', 'batch_size': 32, 'epochs': 5}. Best is trial 0 with value: 4.206045102465905.[0m
epoch 4 0.10450862351865453 4.290692694120317

Previous best Test-set performance: 0.15010537486015252

Trial Id: 5 | Model params: 51168 | Timestamp: 2022-03-05 01:07:18.190582

epoch 0 -2.141329942437219 8.036250833139439
epoch 1 -2.1879581608570158 8.09567403448796
epoch 2 -2.1463913497562612 8.042722354536163
epoch 3 -2.1027864305396746 7.986797044747838
epoch 4 -2.171531518735525 8.074789743619684
epoch 5 -2.163048619530952 8.063983688072545
epoch 6 -2.1270531010113785 8.017968300272472
epoch 7 -2.146038844151382 8.042271809164433
epoch 8 -2.168733760394791 8.071227380351866
[32m[I 2022-03-05 01:30:58,520][0m Trial 5 finished with value: 8.03056530549198 and parameters: {'lr': 0.009522190056038307, 'weight_decay': 0.16806495723129475, 'criterion': 'PoissonNLLLoss', 'batch_size': 32, 'epochs': 10}. Best is trial 0 with value: 4.206045102465905.[0m
epoch 9 -2.136886626586446 8.03056530549198

Previous best Test-set performance: 0.15010537486015252

Trial Id: 6 | Model params: 51168 | Timestamp: 2022-03-05 01:30:58.520972

[32m[I 2022-03-05 01:33:17,736][0m Trial 6 pruned. [0m
epoch 0 0.15352775377793815 4.171603934893083

Previous best Test-set performance: 0.15010537486015252

Trial Id: 7 | Model params: 51168 | Timestamp: 2022-03-05 01:33:17.736897

epoch 0 -2.1363084055274113 8.029825135933903
epoch 1 -2.116060212445912 8.003862650580471
epoch 2 -2.186288318036423 8.09355351201187
epoch 3 -2.145837503265756 8.042014459507191
epoch 4 -2.1251214494918806 8.015491477414178
epoch 5 -2.103869488413107 7.988190857840067
epoch 6 -2.0857507328023708 7.9648413065007775
epoch 7 -2.1582995764545068 8.057927728155464
epoch 8 -2.145024627617192 8.040975375310511
[32m[I 2022-03-05 01:41:18,538][0m Trial 7 finished with value: 8.05074091598598 and parameters: {'lr': 0.006893187259976302, 'weight_decay': 0.2371019547422546, 'criterion': 'PoissonNLLLoss', 'batch_size': 256, 'epochs': 10}. Best is trial 0 with value: 4.206045102465905.[0m
epoch 9 -2.152668356008877 8.05074091598598

Previous best Test-set performance: 0.15010537486015252

Trial Id: 8 | Model params: 51168 | Timestamp: 2022-03-05 01:41:18.538960

[32m[I 2022-03-05 01:42:08,886][0m Trial 8 pruned. [0m
epoch 0 0.1375207090218038 4.2108623495290765

Previous best Test-set performance: 0.15010537486015252

Trial Id: 9 | Model params: 51168 | Timestamp: 2022-03-05 01:42:08.886507

epoch 0 0.10597364932451547 4.287181466229341
epoch 1 0.12237016752906027 4.247685906555106
epoch 2 0.12681482080284834 4.236916300547725
epoch 3 0.12915913349808772 4.231224877565442
[32m[I 2022-03-05 01:46:20,594][0m Trial 9 pruned. [0m
epoch 4 0.1312861035464037 4.226054477936264

Previous best Test-set performance: 0.15010537486015252

Trial Id: 10 | Model params: 51168 | Timestamp: 2022-03-05 01:46:20.594639

[32m[I 2022-03-05 01:48:42,109][0m Trial 10 pruned. [0m
epoch 0 0.13453304413785694 4.218149347351092

Previous best Test-set performance: 0.15010537486015252

Trial Id: 11 | Model params: 51168 | Timestamp: 2022-03-05 01:48:42.109904

[32m[I 2022-03-05 01:49:30,137][0m Trial 11 pruned. [0m
epoch 0 0.14660283357444137 4.18863295285781

Previous best Test-set performance: 0.15010537486015252

Trial Id: 12 | Model params: 51168 | Timestamp: 2022-03-05 01:49:30.137861

[32m[I 2022-03-05 01:50:18,204][0m Trial 12 pruned. [0m
epoch 0 0.15176723637893086 4.17593979271228

Previous best Test-set performance: 0.15010537486015252

Trial Id: 13 | Model params: 51168 | Timestamp: 2022-03-05 01:50:18.204429

[32m[I 2022-03-05 01:52:38,319][0m Trial 13 pruned. [0m
epoch 0 0.1529189084987247 4.173103927848617

Previous best Test-set performance: 0.15010537486015252

Trial Id: 14 | Model params: 51168 | Timestamp: 2022-03-05 01:52:38.319394

[32m[I 2022-03-05 01:53:26,298][0m Trial 14 pruned. [0m
epoch 0 0.12391724798373382 4.243940357913238

Study statistics: 
  Number of finished trials:  15
  Number of pruned trials:  8
  Number of complete trials:  7

Best trial:
  Value:  4.206045102465905
  Params: 
    lr: 0.0016309463920672245
    weight_decay: 0.07579773110037773
    criterion: MSELoss
    batch_size: 32
    epochs: 5
Target: 132567, NaN: 0, Max: 83.0, Min: 0.0, Mean: 8.78098621828962
Prediction: 132567, NaN: 0, Max: 20.712316513061523, Min: 5.15671443939209, Mean: 8.835599187822048

 XXXXXX======== TRIAL south - rlbg ended

Test Set - R-squared:  0.13949294128442757
Test Set - RMSE:  4.206045102465905
Test Set - MAE:  3.2582657717692305



