[32m[I 2022-03-06 23:18:00,940][0m A new study created in memory with name: DeepSet[0m
Starting Loading south
Finished Loading south
Finished south setup

++++++++ Session Characteristics +++++++

Area: south
Gal Type: rlbg
Training Set: 530265
Validation Set: 132567
Test Samples: 132567
Number of features: 5
Device: cuda:0
Number of Workers: 8
Number of Trials: 15

+++++++++++++++++++++++++++++++++++++++

Trial Id: 0 | Model params: 40274 | Timestamp: 2022-03-06 23:18:01.158203

epoch 0 0.1365148846025065 4.213316990534672
epoch 5 0.14622684360675064 4.189555565799978
epoch 10 0.1455019826834395 4.191333673245367
epoch 15 0.13988158404420692 4.205095177900313
epoch 20 0.14833472423972516 4.184380572608694
[32m[I 2022-03-07 00:17:40,699][0m Trial 0 finished with value: 4.2054403706124495 and parameters: {'n_layers_fe': 2, 'fe_neurons': 64, 'fe_dropout': 0.0546669781399583, 'n_units_l(Invariant)': 424, 'n_layers_mlp': 2, 'initialiser': 'xavier', 'lr': 0.0003046508787060096, 'weight_decay': 0.03834844486060698, 'criterion': 'MSELoss', 'batch_size': 32, 'epochs': 25}. Best is trial 0 with value: 4.2054403706124495.[0m

Trial Id: 1 | Model params: 70278 | Timestamp: 2022-03-07 00:17:40.700087

epoch 0 -2.266238091706525 8.194465412885988
epoch 5 -2.2110428398105744 8.124932407037328
epoch 10 -2.1698660270114387 8.072669275723491
epoch 15 -2.1681961648101544 8.070542684100454
epoch 20 -2.1458166985034595 8.041987866831048
epoch 25 -2.1136364729131847 8.000749255658514
epoch 30 -2.126121302305605 8.016773614910827
epoch 35 -2.1277235927883873 8.018827846544328
epoch 40 -2.126019944662217 8.016643650685339
epoch 45 -2.1360915989227505 8.029547588418446
epoch 50 -2.133488657690397 8.026214653385606
epoch 55 -2.1293281731840383 8.020884486743869
epoch 60 -2.129362241400339 8.020928147310734
epoch 65 -2.1330103439927344 8.02560204626567
epoch 70 -2.1345474668633555 8.027570572116844
[32m[I 2022-03-07 01:49:17,245][0m Trial 1 finished with value: 8.025027624052264 and parameters: {'n_layers_fe': 2, 'fe_neurons': 128, 'fe_dropout': 0.28598681111400276, 'n_units_l(Invariant)': 194, 'n_layers_mlp': 2, 'initialiser': 'xavier', 'lr': 0.00026008797440915996, 'weight_decay': 0.06269482111210896, 'criterion': 'PoissonNLLLoss', 'batch_size': 128, 'epochs': 75}. Best is trial 0 with value: 4.2054403706124495.[0m

Trial Id: 2 | Model params: 100958 | Timestamp: 2022-03-07 01:49:17.245554

epoch 0 0.1220879396848199 4.248368836207752
epoch 5 0.1333558205215114 4.221017173518596
epoch 10 0.1286295913710387 4.232511146614586
epoch 15 0.1320510808503369 4.224193365903281
epoch 20 0.1389150901876991 4.2074570954637265
epoch 25 0.13362671743335475 4.220357416080461
epoch 30 0.14149486250527799 4.201149690028872
epoch 35 0.1292477252714579 4.231009648087891
epoch 40 0.13081566612256257 4.227198597483463
epoch 45 0.12958633620819138 4.230186908090663
epoch 50 0.13047689073822877 4.228022318792653
epoch 55 0.14282293981301042 4.197898916794966
epoch 60 0.13796344037437747 4.209781442364423
epoch 65 0.14278946799014502 4.197980877666179
epoch 70 0.14163758175141217 4.200800472644184
[32m[I 2022-03-07 04:49:48,703][0m Trial 2 finished with value: 4.24572043926252 and parameters: {'n_layers_fe': 2, 'fe_neurons': 128, 'fe_dropout': 0.052531823252261856, 'n_units_l(Invariant)': 430, 'n_layers_mlp': 2, 'initialiser': 'uniform', 'lr': 0.0027291572910283597, 'weight_decay': 0.017372536124895043, 'criterion': 'MSELoss', 'batch_size': 32, 'epochs': 75}. Best is trial 0 with value: 4.2054403706124495.[0m

Trial Id: 3 | Model params: 46482 | Timestamp: 2022-03-07 04:49:48.703287

epoch 0 -2.1324537612708765 8.024889136101557
epoch 5 -2.1066021948804527 7.991706562714774
epoch 10 -2.146425862350304 8.042766464505267
epoch 15 -2.13385902667483 8.026688976649549
epoch 20 -2.1534728506991723 8.051768040386142
epoch 25 -2.1246166501357115 8.014844082039062
epoch 30 -2.13754711005539 8.031410694104002
epoch 35 -2.1447917490723603 8.040677666145745
epoch 40 -2.148264829462852 8.045116467841638
epoch 45 -2.152129022945 8.05005225863447
[32m[I 2022-03-07 07:08:50,041][0m Trial 3 finished with value: 7.997088654334591 and parameters: {'n_layers_fe': 4, 'fe_neurons': 64, 'fe_dropout': 0.05655356956926033, 'n_units_l(Invariant)': 392, 'n_layers_mlp': 2, 'initialiser': 'normal', 'lr': 0.002231702666825801, 'weight_decay': 0.1038688843496287, 'criterion': 'PoissonNLLLoss', 'batch_size': 32, 'epochs': 50}. Best is trial 0 with value: 4.2054403706124495.[0m

Trial Id: 4 | Model params: 140746 | Timestamp: 2022-03-07 07:08:50.041702

epoch 0 0.10855190596166209 4.280995163802559
epoch 5 0.1235489921969839 4.244832220806466
epoch 10 0.12148617487308899 4.249824608970794
epoch 15 0.13304169236243246 4.221782089648878
epoch 20 0.07550074976867471 4.359633574012076
epoch 25 0.1351001293239611 4.216767179054975
epoch 30 0.13087518527518383 4.227053862025162
epoch 35 0.12756581739385753 4.235093895500597
epoch 40 0.1357472671735218 4.215189343070073
epoch 45 0.1306062853621215 4.227707718923803
[32m[I 2022-03-07 08:41:38,670][0m Trial 4 finished with value: 4.254756555471187 and parameters: {'n_layers_fe': 4, 'fe_neurons': 128, 'fe_dropout': 0.1251114568430685, 'n_units_l(Invariant)': 228, 'n_layers_mlp': 4, 'initialiser': 'normal', 'lr': 0.0008034680078935162, 'weight_decay': 0.2191099288797726, 'criterion': 'MSELoss', 'batch_size': 256, 'epochs': 50}. Best is trial 0 with value: 4.2054403706124495.[0m

Trial Id: 5 | Model params: 129042 | Timestamp: 2022-03-07 08:41:38.670638

epoch 0 -10.06642023448467 15.08343603292948
[32m[I 2022-03-07 08:45:53,456][0m Trial 5 pruned. [0m
++++++++++++++++++++
        NaN         
++++++++++++++++++++

Trial Id: 6 | Model params: 512602 | Timestamp: 2022-03-07 08:45:53.456401

[32m[I 2022-03-07 08:49:12,691][0m Trial 6 pruned. [0m
epoch 0 0.12163506608361685 4.249464461910518

Trial Id: 7 | Model params: 121246 | Timestamp: 2022-03-07 08:49:12.691891

[32m[I 2022-03-07 08:50:54,459][0m Trial 7 pruned. [0m
++++++++++++++++++++
        NaN         
++++++++++++++++++++

Trial Id: 8 | Model params: 53016 | Timestamp: 2022-03-07 08:50:54.460006

epoch 0 -2.6208290239363765 8.62781284431176
epoch 5 -2.6998200159921133 8.721416067677591
epoch 10 -2.190282614985851 8.098624919194204
epoch 15 -2.149783844569874 8.047057089164095
epoch 20 -2.14128700686993 8.036195913380336
epoch 25 -2.1392407569563128 8.033578078084398
epoch 30 -2.142713652225926 8.038020563617321
epoch 35 -2.142743824847982 8.038059149311291
epoch 40 -2.144035289001786 8.039710540514207
epoch 45 -2.1462154014695174 8.04249747421365
[32m[I 2022-03-07 09:51:49,471][0m Trial 8 finished with value: 8.036219141070681 and parameters: {'n_layers_fe': 2, 'fe_neurons': 64, 'fe_dropout': 0.27220424140763144, 'n_units_l(Invariant)': 491, 'n_layers_mlp': 4, 'initialiser': 'uniform', 'lr': 4.346122798190839e-05, 'weight_decay': 0.2445692590088536, 'criterion': 'PoissonNLLLoss', 'batch_size': 256, 'epochs': 50}. Best is trial 0 with value: 4.2054403706124495.[0m

Trial Id: 9 | Model params: 567040 | Timestamp: 2022-03-07 09:51:49.471472

[32m[I 2022-03-07 09:55:33,975][0m Trial 9 pruned. [0m
epoch 0 0.12256832490362757 4.247206343433359

Trial Id: 10 | Model params: 32882 | Timestamp: 2022-03-07 09:55:33.976035

[32m[I 2022-03-07 09:57:57,379][0m Trial 10 pruned. [0m
epoch 0 -0.019619077584049904 4.578420560422216

Trial Id: 11 | Model params: 40406 | Timestamp: 2022-03-07 09:57:57.379530

[32m[I 2022-03-07 10:00:20,123][0m Trial 11 pruned. [0m
epoch 0 0.14203367427023028 4.199831128226213

Trial Id: 12 | Model params: 44564 | Timestamp: 2022-03-07 10:00:20.123433

[32m[I 2022-03-07 10:02:44,804][0m Trial 12 pruned. [0m
epoch 0 -0.012593967003688977 4.562620785321514

Trial Id: 13 | Model params: 99788 | Timestamp: 2022-03-07 10:02:44.804648

[32m[I 2022-03-07 10:05:10,044][0m Trial 13 pruned. [0m
epoch 0 0.12868893486510402 4.23236701945913

Trial Id: 14 | Model params: 86918 | Timestamp: 2022-03-07 10:05:10.044586

[32m[I 2022-03-07 10:07:34,500][0m Trial 14 pruned. [0m
epoch 0 0.12520441596665766 4.240821547451635

Study statistics: 
  Number of finished trials:  15
  Number of pruned trials:  9
  Number of complete trials:  6

Best trial:
  Value:  4.2054403706124495
  Params: 
    n_layers_fe: 2
    fe_neurons: 64
    fe_dropout: 0.0546669781399583
    n_units_l(Invariant): 424
    n_layers_mlp: 2
    initialiser: xavier
    lr: 0.0003046508787060096
    weight_decay: 0.03834844486060698
    criterion: MSELoss
    batch_size: 32
    epochs: 25
Target: 132567, NaN: 0, Max: 83.0, Min: 0.0, Mean: 8.78098621828962
Prediction: 132567, NaN: 0, Max: 16.95086669921875, Min: 3.8380916118621826, Mean: 8.456663827398588

 XXXXXX======== TRIAL south - rlbg ended

Test Set - R-squared:  0.13974036545932034
Test Set - RMSE:  4.2054403706124495
Test Set - MAE:  3.2184917968512976



[32m[I 2022-03-07 10:11:21,717][0m A new study created in memory with name: DeepSet[0m
Starting Loading south
Finished Loading south
Finished south setup

++++++++ Session Characteristics +++++++

Area: south
Gal Type: rlbg
Training Set: 530265
Validation Set: 132567
Test Samples: 132567
Number of features: 5
Device: cuda:0
Number of Workers: 8
Number of Trials: 15

+++++++++++++++++++++++++++++++++++++++

Previous best Test-set performance: 0.15010537486015252

Trial Id: 0 | Model params: 51168 | Timestamp: 2022-03-07 10:11:21.738889

epoch 0 -2.11467094127648 8.002078221761337
epoch 1 -2.100791409759939 7.98422896787245
epoch 2 -2.1064594798938336 7.9915229940885455
epoch 3 -2.1454138347671607 8.041472908503506
epoch 4 -2.130348568967517 8.022192085240656
epoch 5 -2.1333351256569957 8.026018020130183
epoch 6 -2.1219997630069747 8.011487136538245
epoch 7 -2.1957580392185854 8.105571701399258
epoch 8 -2.125381516480221 8.015824987870598
epoch 9 -2.104783362672136 7.989366755337813
epoch 10 -2.092894742656565 7.974055921368265
epoch 11 -2.106691473628449 7.991821396283003
epoch 12 -2.130279103403419 8.02210307451584
epoch 13 -2.142020618719695 8.03713423967345
epoch 14 -2.150853345067841 8.048423151336708
epoch 15 -2.0869076989777375 7.966334328649118
epoch 16 -2.1477744456537753 8.044489876891909
epoch 17 -2.113287070940508 8.000300334272483
epoch 18 -2.1296081827641875 8.021243329622383
[32m[I 2022-03-07 10:58:08,805][0m Trial 0 finished with value: 8.009411538982022 and parameters: {'lr': 7.228889504251093e-05, 'weight_decay': 0.13572531163069365, 'criterion': 'PoissonNLLLoss', 'batch_size': 32, 'epochs': 20}. Best is trial 0 with value: 8.009411538982022.[0m
epoch 19 -2.120382291605089 8.009411538982022

Previous best Test-set performance: 0.15010537486015252

Trial Id: 1 | Model params: 51168 | Timestamp: 2022-03-07 10:58:08.806052

epoch 0 0.13219252651722746 4.223849153139588
epoch 1 0.12922492148334463 4.231065049847174
epoch 2 0.13340131062853067 4.220906391581052
epoch 3 0.11257070844530104 4.271334529532238
epoch 4 0.11450933441127631 4.266666525366702
epoch 5 0.13062299481704165 4.22766709116805
epoch 6 0.1354176047786746 4.215993191802093
epoch 7 0.12714776883020884 4.236108449328403
epoch 8 0.13380775187134442 4.2199164572208305
[32m[I 2022-03-07 11:07:57,662][0m Trial 1 finished with value: 4.213907538695274 and parameters: {'lr': 0.003526174335730479, 'weight_decay': 0.11634146806968862, 'criterion': 'MSELoss', 'batch_size': 128, 'epochs': 10}. Best is trial 1 with value: 4.213907538695274.[0m
epoch 9 0.13627281153551563 4.213907538695274

Previous best Test-set performance: 0.15010537486015252

Trial Id: 2 | Model params: 51168 | Timestamp: 2022-03-07 11:07:57.662945

epoch 0 0.15150411941826647 4.176587418835198
epoch 1 0.14764784357484217 4.186067614989077
epoch 2 0.147721238401747 4.1858873829571115
epoch 3 0.14593581208160789 4.190269566262153
epoch 4 0.147275850254739 4.1869809812039716
epoch 5 0.14713763939131663 4.187320283667744
epoch 6 0.1414272622821725 4.201315089776365
epoch 7 0.144667079892012 4.19338078263162
epoch 8 0.14535856046513573 4.191685403231276
[32m[I 2022-03-07 11:17:15,613][0m Trial 2 finished with value: 4.191421206737352 and parameters: {'lr': 5.416030981214594e-05, 'weight_decay': 0.16795664398799498, 'criterion': 'MSELoss', 'batch_size': 256, 'epochs': 10}. Best is trial 2 with value: 4.191421206737352.[0m
epoch 9 0.14546629095272667 4.191421206737352

Previous best Test-set performance: 0.15010537486015252

Trial Id: 3 | Model params: 51168 | Timestamp: 2022-03-07 11:17:15.613424

epoch 0 0.10499855580063466 4.28951879310716
epoch 1 0.11554688053472151 4.2641661258675265
epoch 2 0.12825702455420274 4.233415885098785
epoch 3 0.10346876423944351 4.293183182709167
[32m[I 2022-03-07 11:21:53,885][0m Trial 3 finished with value: 4.301633712490143 and parameters: {'lr': 0.0043729358975143715, 'weight_decay': 0.2868833920253571, 'criterion': 'MSELoss', 'batch_size': 256, 'epochs': 5}. Best is trial 2 with value: 4.191421206737352.[0m
epoch 4 0.09993589834792005 4.301633712490143

Previous best Test-set performance: 0.15010537486015252

Trial Id: 4 | Model params: 51168 | Timestamp: 2022-03-07 11:21:53.885825

epoch 0 -2.1427337641689057 8.03804628342041
epoch 1 -2.133381921799463 8.026077953917238
epoch 2 -2.1239979276909335 8.014050511180224
epoch 3 -2.1230378734922715 8.012818994030297
epoch 4 -2.112865828278367 7.999759076473534
epoch 5 -2.1150277530468533 8.002536561339204
epoch 6 -2.1203541548709897 8.009375428151726
epoch 7 -2.1216115212315527 8.010988979758707
epoch 8 -2.126370812399637 8.017093536282081
epoch 9 -2.1145326537412084 8.001900578604442
epoch 10 -2.113186982541204 8.00017173326783
epoch 11 -2.1227813063962975 8.012489848498292
epoch 12 -2.141016713956276 8.03585016758718
epoch 13 -2.1283459157138873 8.019625559649606
epoch 14 -2.1192262257180747 8.007927703929953
epoch 15 -2.126706225122313 8.017523581726604
epoch 16 -2.119646000847498 8.008466525989792
epoch 17 -2.131111817233892 8.023170019628166
epoch 18 -2.1365363273308513 8.030116902358039
[32m[I 2022-03-07 11:41:39,737][0m Trial 4 finished with value: 7.994814714352971 and parameters: {'lr': 2.3654604592058754e-05, 'weight_decay': 0.18530620756384852, 'criterion': 'PoissonNLLLoss', 'batch_size': 128, 'epochs': 20}. Best is trial 2 with value: 4.191421206737352.[0m
epoch 19 -2.109019117549187 7.994814714352971

Previous best Test-set performance: 0.15010537486015252

Trial Id: 5 | Model params: 51168 | Timestamp: 2022-03-07 11:41:39.737983

epoch 0 -2.099339835617168 7.982359919704129
epoch 1 -2.1540242509736247 8.052471955285133
epoch 2 -2.1411990582381644 8.036083415321308
epoch 3 -2.1642499406908655 8.06551488720338
epoch 4 -2.176213931080526 8.080748308097572
epoch 5 -2.105021849020566 7.9896735912896
epoch 6 -2.1513506002196756 8.049058211358654
epoch 7 -2.147855143048094 8.04459299184223
epoch 8 -2.1813202460111967 8.087241301903013
epoch 9 -2.155925193806012 8.054898218034326
epoch 10 -2.143241087940967 8.038695038248019
epoch 11 -2.118801288683298 8.007382219135128
epoch 12 -2.143752420767175 8.039348866793576
epoch 13 -2.1548107684834528 8.053475913228327
epoch 14 -2.1347908518859464 8.027882220375671
epoch 15 -2.143626006103771 8.039187228461133
epoch 16 -2.1752242377026603 8.079489248356579
epoch 17 -2.144539170205357 8.04035475986174
epoch 18 -2.1422192209513526 8.037388243031069
[32m[I 2022-03-07 12:01:25,296][0m Trial 5 finished with value: 8.036796544099486 and parameters: {'lr': 0.004834042603019669, 'weight_decay': 0.23276427948353506, 'criterion': 'PoissonNLLLoss', 'batch_size': 128, 'epochs': 20}. Best is trial 2 with value: 4.191421206737352.[0m
epoch 19 -2.1417565882497143 8.036796544099486

Previous best Test-set performance: 0.15010537486015252

Trial Id: 6 | Model params: 51168 | Timestamp: 2022-03-07 12:01:25.297130

[32m[I 2022-03-07 12:02:24,848][0m Trial 6 pruned. [0m
epoch 0 0.154497086786626 4.169214706113179

Previous best Test-set performance: 0.15010537486015252

Trial Id: 7 | Model params: 51168 | Timestamp: 2022-03-07 12:02:24.848271

[32m[I 2022-03-07 12:04:43,823][0m Trial 7 pruned. [0m
epoch 0 0.09696614827855388 4.308724461242094

Previous best Test-set performance: 0.15010537486015252

Trial Id: 8 | Model params: 51168 | Timestamp: 2022-03-07 12:04:43.824006

epoch 0 -2.1169220535403155 8.004969429714228
epoch 1 -2.1196357155902485 8.008453324298596
epoch 2 -2.1193689485853713 8.008110906629412
epoch 3 -2.155188985464609 8.053958647421412
epoch 4 -2.1535358167451766 8.05184842564552
epoch 5 -2.1500074349041496 8.04734269800968
epoch 6 -2.1495289689969987 8.04673150495271
epoch 7 -2.126253998978553 8.016943759923588
epoch 8 -2.145567135874718 8.04166886867723
[32m[I 2022-03-07 12:28:12,658][0m Trial 8 finished with value: 7.999635088536661 and parameters: {'lr': 0.0007033834529600689, 'weight_decay': 0.19734744002894827, 'criterion': 'PoissonNLLLoss', 'batch_size': 32, 'epochs': 10}. Best is trial 2 with value: 4.191421206737352.[0m
epoch 9 -2.1127693366672697 7.999635088536661

Previous best Test-set performance: 0.15010537486015252

Trial Id: 9 | Model params: 51168 | Timestamp: 2022-03-07 12:28:12.658996

epoch 0 -2.1346038645661043 8.027642789000986
epoch 1 -2.138285180859844 8.03235528568729
epoch 2 -2.10603741216698 7.990980080436669
epoch 3 -2.103577404455557 7.987814991956914
epoch 4 -2.1338624530346344 8.026693364580966
epoch 5 -2.1505819196351728 8.048076484331766
epoch 6 -2.12949930507279 8.021103800646113
epoch 7 -2.114450129268728 8.001794566391402
epoch 8 -2.1252650667709485 8.015675654232528
epoch 9 -2.0935618430840415 7.974915829278078
epoch 10 -2.1358423517042024 8.029228499816242
epoch 11 -2.089025068715002 7.969065991755751
epoch 12 -2.151951995303924 8.049826204789484
epoch 13 -2.120107439073745 8.009058784846617
epoch 14 -2.042867884694284 7.9093037599059555
epoch 15 -2.118396980384509 8.006863180614829
epoch 16 -2.1255640724781633 8.016059089780114
epoch 17 -2.1292788882131886 8.020821324526178
epoch 18 -2.1549583930372167 8.053664336079558
[32m[I 2022-03-07 12:46:50,003][0m Trial 9 finished with value: 7.992490323633891 and parameters: {'lr': 0.0006080071605763052, 'weight_decay': 0.04152830756326476, 'criterion': 'PoissonNLLLoss', 'batch_size': 256, 'epochs': 20}. Best is trial 2 with value: 4.191421206737352.[0m
epoch 19 -2.1072115647983063 7.992490323633891

Previous best Test-set performance: 0.15010537486015252

Trial Id: 10 | Model params: 51168 | Timestamp: 2022-03-07 12:46:50.003515

[32m[I 2022-03-07 12:47:45,959][0m Trial 10 pruned. [0m
epoch 0 0.15044689100201314 4.17918862904409

Previous best Test-set performance: 0.15010537486015252

Trial Id: 11 | Model params: 51168 | Timestamp: 2022-03-07 12:47:45.959849

[32m[I 2022-03-07 12:48:45,144][0m Trial 11 pruned. [0m
epoch 0 0.14905221476379105 4.182617622962577

Previous best Test-set performance: 0.15010537486015252

Trial Id: 12 | Model params: 51168 | Timestamp: 2022-03-07 12:48:45.145158

[32m[I 2022-03-07 12:49:40,856][0m Trial 12 pruned. [0m
epoch 0 0.12340563278525651 4.245179366147381

Previous best Test-set performance: 0.15010537486015252

Trial Id: 13 | Model params: 51168 | Timestamp: 2022-03-07 12:49:40.856205

[32m[I 2022-03-07 12:50:36,669][0m Trial 13 pruned. [0m
epoch 0 0.1549184470957925 4.168175702879285

Previous best Test-set performance: 0.15010537486015252

Trial Id: 14 | Model params: 51168 | Timestamp: 2022-03-07 12:50:36.670029

[32m[I 2022-03-07 12:51:35,534][0m Trial 14 pruned. [0m
epoch 0 0.09508817063269803 4.313202413890974

Study statistics: 
  Number of finished trials:  15
  Number of pruned trials:  7
  Number of complete trials:  8

Best trial:
  Value:  4.191421206737352
  Params: 
    lr: 5.416030981214594e-05
    weight_decay: 0.16795664398799498
    criterion: MSELoss
    batch_size: 256
    epochs: 10
Target: 132567, NaN: 0, Max: 83.0, Min: 0.0, Mean: 8.78098621828962
Prediction: 132567, NaN: 0, Max: 20.73102378845215, Min: 0.045396897941827774, Mean: 8.812693695723375

 XXXXXX======== TRIAL south - rlbg ended

Test Set - R-squared:  0.14546629095272667
Test Set - RMSE:  4.191421206737352
Test Set - MAE:  3.2423487842158343



