[32m[I 2022-03-01 19:49:28,115][0m A new study created in memory with name: DeepSet[0m
Starting Loading south
Finished Loading south
Finished south setup

++++++++ Session Characteristics +++++++

Area: south
Gal Type: rlbg
Training Set: 530265
Validation Set: 132567
Test Samples: 132567
Number of features: 5
Device: cuda:0
Number of Workers: 8
Number of Trials: 35

+++++++++++++++++++++++++++++++++++++++

Trial Id: 0 | Model params: 61270 | Timestamp: 2022-03-01 19:49:28.116187

epoch 0 -0.015053448014976656 4.568158480464265
epoch 5 -0.0024247901685123807 4.539652459275941
epoch 10 -0.0033624540889618526 4.541775148884211
epoch 15 -0.001070244744618476 4.5365842768926985
[32m[I 2022-03-01 19:59:48,327][0m Trial 0 finished with value: 4.535875324363844 and parameters: {'n_layers_fe': 4, 'fe_neurons': 64, 'fe_dropout': 0.43727598749262026, 'n_units_l(Invariant)': 490, 'n_layers_mlp': 4, 'lr': 0.0077767637319574945, 'weight_decay': 0.2738899226176884, 'criterion': 'MSELoss', 'batch_size': 256, 'epochs': 20}. Best is trial 0 with value: 4.535875324363844.[0m

Trial Id: 1 | Model params: 407850 | Timestamp: 2022-03-01 19:59:48.327293

epoch 0 0.03319483263207723 4.458268170626637
epoch 5 0.13706567933611757 4.211972993423234
epoch 10 0.14147189942716876 4.201205875297415
epoch 15 0.13570978227295327 4.215280753970007
epoch 20 0.1418713292889996 4.200228456906025
epoch 25 0.12312305298537773 4.245863551056599
epoch 30 0.13504829311412136 4.216893539319776
epoch 35 0.14058154564600822 4.2033837831789365
epoch 40 0.12404402637249634 4.243633275399766
epoch 45 0.13462898023507808 4.217915552173732
epoch 50 0.14006501972585328 4.2046467479997025
epoch 55 0.13457799559014905 4.218039802786745
[32m[I 2022-03-01 20:48:46,815][0m Trial 1 finished with value: 4.1985269218541355 and parameters: {'n_layers_fe': 2, 'fe_neurons': 256, 'fe_dropout': 0.2628651090649593, 'n_units_l(Invariant)': 404, 'n_layers_mlp': 4, 'lr': 9.036624248042155e-05, 'weight_decay': 0.18814414275357788, 'criterion': 'MSELoss', 'batch_size': 128, 'epochs': 60}. Best is trial 1 with value: 4.1985269218541355.[0m

Trial Id: 2 | Model params: 32886 | Timestamp: 2022-03-01 20:48:46.815623

epoch 0 0.09082571954154395 4.323348825316366
epoch 5 0.11429067149850314 4.267193297797672
epoch 10 0.09407949209246347 4.315605644165789
epoch 15 0.09559534695974492 4.3119935332642285
epoch 20 0.12831769933612291 4.233268556090984
epoch 25 0.12534032601964806 4.240492103247745
epoch 30 0.12926209516522524 4.230974736086063
epoch 35 0.12570261120801463 4.239613803584427
epoch 40 0.12379754979802526 4.24423027037272
epoch 45 0.12573164494621192 4.239543408281445
epoch 50 0.1205705596404324 4.252038683855248
epoch 55 0.12651651662897578 4.237639962561481
[32m[I 2022-03-01 21:42:24,346][0m Trial 2 finished with value: 4.239121524016661 and parameters: {'n_layers_fe': 2, 'fe_neurons': 64, 'fe_dropout': 0.37619752428499953, 'n_units_l(Invariant)': 186, 'n_layers_mlp': 4, 'lr': 0.0005230353299857308, 'weight_decay': 0.26607578499944073, 'criterion': 'MSELoss', 'batch_size': 256, 'epochs': 60}. Best is trial 1 with value: 4.1985269218541355.[0m

Trial Id: 3 | Model params: 50518 | Timestamp: 2022-03-01 21:42:24.346849

epoch 0 0.11948537823981209 4.254661299448167
epoch 5 0.1090253013781809 4.279858321048591
epoch 10 0.1296794415095267 4.229960657414682
epoch 15 0.13078224428741148 4.227279868723098
[32m[I 2022-03-01 22:06:00,606][0m Trial 3 finished with value: 4.229533060605548 and parameters: {'n_layers_fe': 2, 'fe_neurons': 128, 'fe_dropout': 0.2111756158906577, 'n_units_l(Invariant)': 42, 'n_layers_mlp': 2, 'lr': 0.0005104133193320152, 'weight_decay': 0.2660920959274688, 'criterion': 'MSELoss', 'batch_size': 128, 'epochs': 20}. Best is trial 1 with value: 4.1985269218541355.[0m

Trial Id: 4 | Model params: 270074 | Timestamp: 2022-03-01 22:06:00.606605

epoch 0 -0.13557376894086826 4.83174919364309
epoch 5 -0.7446844292072701 5.989011532943626
epoch 10 -0.5342998402034629 5.616319769737404
epoch 15 -0.427354025025489 5.417046440920912
epoch 20 -0.17425988268692283 4.913362634992878
epoch 25 -0.049508802887624936 4.645043117193293
epoch 30 0.024419427499469903 4.47845565726134
epoch 35 0.07699582488055867 4.356107007084246
[32m[I 2022-03-01 22:36:48,962][0m Trial 4 finished with value: 4.366936995644635 and parameters: {'n_layers_fe': 2, 'fe_neurons': 256, 'fe_dropout': 0.4591735521338177, 'n_units_l(Invariant)': 380, 'n_layers_mlp': 2, 'lr': 1.1296388126980401e-05, 'weight_decay': 0.20927027349874863, 'criterion': 'MSELoss', 'batch_size': 128, 'epochs': 40}. Best is trial 1 with value: 4.1985269218541355.[0m

Trial Id: 5 | Model params: 567040 | Timestamp: 2022-03-01 22:36:48.962911

epoch 0 -0.0002027153548127547 4.534618144528933
epoch 5 -1.0728283287887206 6.527973376469421
epoch 10 -0.6099234768543926 5.753065566444561
epoch 15 -0.6496317748323379 5.823582247661492
epoch 20 -0.2967392992594511 5.163248686914512
epoch 25 -10.421072110499528 15.32322376497534
epoch 30 -17.58292073527567 19.545810956922317
epoch 35 -37.28234896026516 28.0540777125309
epoch 40 -0.027790101563699432 4.596729227840198
epoch 45 -2018178101795.6106 6441343.3820630135
epoch 50 -27.448346403325505 24.183837756376317
epoch 55 -217.41302567149083 67.00943782103346
[32m[I 2022-03-02 01:43:41,813][0m Trial 5 finished with value: 255.20191422458333 and parameters: {'n_layers_fe': 4, 'fe_neurons': 256, 'fe_dropout': 0.07453685960011552, 'n_units_l(Invariant)': 511, 'n_layers_mlp': 4, 'lr': 0.007866022136794987, 'weight_decay': 0.23188717412123364, 'criterion': 'MSELoss', 'batch_size': 32, 'epochs': 60}. Best is trial 1 with value: 4.1985269218541355.[0m

Trial Id: 6 | Model params: 82242 | Timestamp: 2022-03-02 01:43:41.813674

epoch 0 -2.3929819827387337 8.35194226648789
epoch 5 -2.180858196164253 8.086653991603356
epoch 10 -2.148203659149053 8.045038309758372
epoch 15 -2.13524514645475 8.028463900516668
[32m[I 2022-03-02 01:52:40,322][0m Trial 6 finished with value: 8.032928836149889 and parameters: {'n_layers_fe': 4, 'fe_neurons': 128, 'fe_dropout': 0.40791040685770696, 'n_units_l(Invariant)': 32, 'n_layers_mlp': 2, 'lr': 1.7123211374639206e-05, 'weight_decay': 0.21412848562558726, 'criterion': 'PoissonNLLLoss', 'batch_size': 256, 'epochs': 20}. Best is trial 1 with value: 4.1985269218541355.[0m

Trial Id: 7 | Model params: 129432 | Timestamp: 2022-03-02 01:52:40.322478

[32m[I 2022-03-02 01:53:24,931][0m Trial 7 pruned. [0m
epoch 0 0.11638899866945351 4.262135613048647

Trial Id: 8 | Model params: 171946 | Timestamp: 2022-03-02 01:53:24.931523

epoch 0 -2.2560068090830665 8.181621026156723
epoch 5 -2.1484370080612707 8.045336458537149
epoch 10 -2.1218355016198838 8.01127637494314
epoch 15 -2.1616924409113065 8.06225475878996
[32m[I 2022-03-02 02:50:05,355][0m Trial 8 finished with value: 8.029939949373418 and parameters: {'n_layers_fe': 4, 'fe_neurons': 128, 'fe_dropout': 0.32339028122949387, 'n_units_l(Invariant)': 468, 'n_layers_mlp': 4, 'lr': 0.007283062428362311, 'weight_decay': 0.14436300177991737, 'criterion': 'PoissonNLLLoss', 'batch_size': 32, 'epochs': 20}. Best is trial 1 with value: 4.1985269218541355.[0m

Trial Id: 9 | Model params: 132942 | Timestamp: 2022-03-02 02:50:05.355675

[32m[I 2022-03-02 02:50:46,770][0m Trial 9 pruned. [0m
epoch 0 0.08421343253642255 4.339041874707429

Trial Id: 10 | Model params: 374826 | Timestamp: 2022-03-02 02:50:46.770532

epoch 0 -2.1579699000938297 8.057507157283124
epoch 5 -2.12228973304706 8.011859179696962
epoch 10 -2.1358871783642552 8.029285888257657
epoch 15 -2.1416825228195697 8.036701811696686
epoch 20 -2.1328799459965615 8.025435029052275
epoch 25 -2.119934538450723 8.008836870943723
epoch 30 -2.140255297712895 8.034876120287466
epoch 35 -2.1339879183194763 8.026854038717914
epoch 40 -2.1317048543987425 8.023929783732063
epoch 45 -2.152057283688726 8.04996065260507
epoch 50 -2.1349687898674263 8.028110057726739
epoch 55 -2.125656236405133 8.016177274213591
[32m[I 2022-03-02 03:35:55,681][0m Trial 10 finished with value: 8.036329571451102 and parameters: {'n_layers_fe': 2, 'fe_neurons': 256, 'fe_dropout': 0.0794269360146318, 'n_units_l(Invariant)': 276, 'n_layers_mlp': 4, 'lr': 7.110594936349792e-05, 'weight_decay': 0.13528120968830037, 'criterion': 'PoissonNLLLoss', 'batch_size': 128, 'epochs': 60}. Best is trial 1 with value: 4.1985269218541355.[0m

Trial Id: 11 | Model params: 181838 | Timestamp: 2022-03-02 03:35:55.681290

[32m[I 2022-03-02 03:36:32,764][0m Trial 11 pruned. [0m
epoch 0 0.13429612318162942 4.2187266655175515

Trial Id: 12 | Model params: 210218 | Timestamp: 2022-03-02 03:36:32.764269

[32m[I 2022-03-02 03:37:10,403][0m Trial 12 pruned. [0m
epoch 0 0.03501554913503102 4.454068220125562

Trial Id: 13 | Model params: 114482 | Timestamp: 2022-03-02 03:37:10.404072

[32m[I 2022-03-02 03:37:52,143][0m Trial 13 pruned. [0m
epoch 0 0.04311054276489856 4.435346888424298

Trial Id: 14 | Model params: 98492 | Timestamp: 2022-03-02 03:37:52.143461

[32m[I 2022-03-02 03:38:30,456][0m Trial 14 pruned. [0m
epoch 0 0.05345282902850501 4.411312633959477

Trial Id: 15 | Model params: 255110 | Timestamp: 2022-03-02 03:38:30.456733

[32m[I 2022-03-02 03:39:14,510][0m Trial 15 pruned. [0m
epoch 0 0.07751456608381135 4.354882738638261

Trial Id: 16 | Model params: 17438 | Timestamp: 2022-03-02 03:39:14.510954

epoch 0 -0.09484498093065952 4.744309606926045
[32m[I 2022-03-02 03:42:09,608][0m Trial 16 pruned. [0m

Trial Id: 17 | Model params: 122282 | Timestamp: 2022-03-02 03:42:09.608623

epoch 0 -2.11355512019588 8.000644733671171
epoch 5 -2.1325373054794037 8.024996149419604
epoch 10 -2.127535832897035 8.018587154424791
epoch 15 -2.123873565456674 8.01389099520597
epoch 20 -2.1506514356538746 8.048165272238826
epoch 25 -2.129586453892724 8.02121548382546
epoch 30 -2.124101780399742 8.014183717724613
epoch 35 -2.1406134826512813 8.03533434569796
epoch 40 -2.1398017628835575 8.034295876420387
epoch 45 -2.154494465001403 8.053072179611057
epoch 50 -2.151327616829563 8.049028859660655
epoch 55 -2.1372030186419333 8.030970283947022
[32m[I 2022-03-02 06:10:50,156][0m Trial 17 finished with value: 8.070750454658665 and parameters: {'n_layers_fe': 2, 'fe_neurons': 128, 'fe_dropout': 0.14000198269365938, 'n_units_l(Invariant)': 340, 'n_layers_mlp': 4, 'lr': 0.001191484992666538, 'weight_decay': 0.17906947224976605, 'criterion': 'PoissonNLLLoss', 'batch_size': 32, 'epochs': 60}. Best is trial 1 with value: 4.1985269218541355.[0m

Trial Id: 18 | Model params: 352122 | Timestamp: 2022-03-02 06:10:50.156695

[32m[I 2022-03-02 06:11:32,838][0m Trial 18 pruned. [0m
epoch 0 0.11304944930462513 4.2701822471802116

Trial Id: 19 | Model params: 57018 | Timestamp: 2022-03-02 06:11:32.839033

[32m[I 2022-03-02 06:12:06,930][0m Trial 19 pruned. [0m
epoch 0 0.11280792719590638 4.270763606095546

Trial Id: 20 | Model params: 229826 | Timestamp: 2022-03-02 06:12:06.930714

[32m[I 2022-03-02 06:12:46,180][0m Trial 20 pruned. [0m
epoch 0 -0.045881924027678433 4.637010031257745

Trial Id: 21 | Model params: 28266 | Timestamp: 2022-03-02 06:12:46.181166

[32m[I 2022-03-02 06:13:08,497][0m Trial 21 pruned. [0m
epoch 0 0.10577902434313657 4.287648089616106

Trial Id: 22 | Model params: 36384 | Timestamp: 2022-03-02 06:13:08.497921

[32m[I 2022-03-02 06:13:30,468][0m Trial 22 pruned. [0m
epoch 0 0.04973769564375663 4.41996120730598

Trial Id: 23 | Model params: 32952 | Timestamp: 2022-03-02 06:13:30.468631

[32m[I 2022-03-02 06:13:52,756][0m Trial 23 pruned. [0m
epoch 0 0.08492748445317877 4.337349938255941

Trial Id: 24 | Model params: 21336 | Timestamp: 2022-03-02 06:13:52.757129

[32m[I 2022-03-02 06:14:14,924][0m Trial 24 pruned. [0m
epoch 0 0.07647144981814413 4.357344222261033

Trial Id: 25 | Model params: 41862 | Timestamp: 2022-03-02 06:14:14.924333

[32m[I 2022-03-02 06:16:39,356][0m Trial 25 pruned. [0m
epoch 0 0.09843662636666095 4.3052149215400215

Trial Id: 26 | Model params: 25296 | Timestamp: 2022-03-02 06:16:39.356256

epoch 0 -2.1421625302211114 8.037315738945285
epoch 5 -2.141615728847004 8.036616378797332
epoch 10 -2.1295743298489667 8.021199946682911
epoch 15 -2.1546264482583783 8.053240647108684
epoch 20 -2.136049177010037 8.029493280387557
epoch 25 -2.115238166693608 8.002806834126574
epoch 30 -2.144735071544528 8.040605208599755
epoch 35 -2.123654098312575 8.013609483066496
[32m[I 2022-03-02 06:31:41,486][0m Trial 26 finished with value: 8.032110690063828 and parameters: {'n_layers_fe': 2, 'fe_neurons': 64, 'fe_dropout': 0.18467587816239506, 'n_units_l(Invariant)': 71, 'n_layers_mlp': 4, 'lr': 0.0007400848405492153, 'weight_decay': 0.16121620394121094, 'criterion': 'PoissonNLLLoss', 'batch_size': 256, 'epochs': 40}. Best is trial 1 with value: 4.1985269218541355.[0m

Trial Id: 27 | Model params: 51168 | Timestamp: 2022-03-02 06:31:41.486598

[32m[I 2022-03-02 06:32:23,094][0m Trial 27 pruned. [0m
epoch 0 0.10993167633809542 4.277680849862286

Trial Id: 28 | Model params: 355992 | Timestamp: 2022-03-02 06:32:23.094508

[32m[I 2022-03-02 06:32:59,848][0m Trial 28 pruned. [0m
epoch 0 0.04823757023990882 4.4234486030107245

Trial Id: 29 | Model params: 95632 | Timestamp: 2022-03-02 06:32:59.848822

epoch 0 -0.6883396005638827 5.891509880824269
[32m[I 2022-03-02 06:34:32,658][0m Trial 29 pruned. [0m

Trial Id: 30 | Model params: 12488 | Timestamp: 2022-03-02 06:34:32.658665

[32m[I 2022-03-02 06:35:07,047][0m Trial 30 pruned. [0m
epoch 0 0.10082087620669844 4.299518426031007

Trial Id: 31 | Model params: 267752 | Timestamp: 2022-03-02 06:35:07.047474

[32m[I 2022-03-02 06:35:52,296][0m Trial 31 pruned. [0m
epoch 0 0.04354535021476613 4.434339070340635

Trial Id: 32 | Model params: 285038 | Timestamp: 2022-03-02 06:35:52.296200

[32m[I 2022-03-02 06:36:41,666][0m Trial 32 pruned. [0m
epoch 0 -0.11332380451015234 4.784179373848153

Trial Id: 33 | Model params: 271880 | Timestamp: 2022-03-02 06:36:41.667169

epoch 0 -0.23329781554215834 5.035361882266809
[32m[I 2022-03-02 06:38:17,506][0m Trial 33 pruned. [0m

Trial Id: 34 | Model params: 394950 | Timestamp: 2022-03-02 06:38:17.506313

[32m[I 2022-03-02 06:39:29,255][0m Trial 34 pruned. [0m
epoch 0 0.09463068139649156 4.314292572223291

Study statistics: 
  Number of finished trials:  35
  Number of pruned trials:  24
  Number of complete trials:  11

Best trial:
  Value:  4.1985269218541355
  Params: 
    n_layers_fe: 2
    fe_neurons: 256
    fe_dropout: 0.2628651090649593
    n_units_l(Invariant): 404
    n_layers_mlp: 4
    lr: 9.036624248042155e-05
    weight_decay: 0.18814414275357788
    criterion: MSELoss
    batch_size: 128
    epochs: 60
Target: 132567, NaN: 0, Max: 83.0, Min: 0.0, Mean: 8.78098621828962
Prediction: 132567, NaN: 0, Max: 21.001068115234375, Min: 5.364616394042969, Mean: 8.64957828692296

 XXXXXX======== TRIAL south - rlbg ended

Test Set - R-squared:  0.1425664535055814
Test Set - RMSE:  4.1985269218541355
Test Set - MAE:  3.2335200728007014



