[32m[I 2022-03-03 08:17:35,178][0m Trial 9 finished with value: 27.91073462208238 and parameters: {'n_layers_fe': 2, 'fe_neurons': 256, 'fe_dropout': 0.49362918570569564, 'n_units_l(Invariant)': 18, 'n_layers_mlp': 4, 'initialiser': 'xavier', 'lr': 0.0006390860259944528, 'weight_decay': 0.175164140376502, 'criterion': 'PoissonNLLLoss', 'batch_size': 128, 'epochs': 50}. Best is trial 3 with value: 9.083745552367265.[0m

Study statistics: 
  Number of finished trials:  10
  Number of pruned trials:  4
  Number of complete trials:  6

Best trial:
  Value:  9.083745552367265
  Params: 
    n_layers_fe: 2
    fe_neurons: 64
    fe_dropout: 0.4648637243366894
    n_units_l(Invariant): 430
    n_layers_mlp: 2
    initialiser: kaiming_he
    lr: 0.0034429256984508383
    weight_decay: 0.0988618746777185
    criterion: MSELoss
    batch_size: 256
    epochs: 25
Target: 67698, NaN: 0, Max: 122.0, Min: 3.0, Mean: 29.60905787467872
Prediction: 67698, NaN: 0, Max: 38.7537841796875, Min: 26.383024215698242, Mean: 28.59712419056562

 XXXXXX======== TRIAL des - glbg ended

Test Set - R-squared:  0.09010635889333296
Test Set - RMSE:  9.083745552367265
Test Set - MAE:  6.977350340582897



./hp_optim.sh: line 11: area: command not found
./hp_optim.sh: line 12: syntax error near unexpected token `done'
./hp_optim.sh: line 12: `    done'
