[32m[I 2022-02-24 12:48:37,004][0m A new study created in memory with name: DeepSet[0m
Starting Loading south
Finished Loading south
Finished south setup

++++++++ Session Characteristics +++++++

Area: south
Gal Type: rlbg
Training Set: 216650
Validation Set: 54162
Test Samples: 132567
Number of features: 5
Device: cuda:0
Number of Workers: 8
Number of Trials: 20

+++++++++++++++++++++++++++++++++++++++

Trial Id: 0 | Model params: 78484 | Timestamp: 2022-02-24 12:48:37.004959

[32m[I 2022-02-24 12:49:49,800][0m Trial 0 pruned. [0m
++++++++++++++++++++
        NaN         
++++++++++++++++++++

Trial Id: 1 | Model params: 93197 | Timestamp: 2022-02-24 12:49:49.800379

[32m[I 2022-02-24 12:52:37,399][0m Trial 1 pruned. [0m
++++++++++++++++++++
        NaN         
++++++++++++++++++++

Trial Id: 2 | Model params: 157191 | Timestamp: 2022-02-24 12:52:37.399189

[32m[I 2022-02-24 12:54:23,483][0m Trial 2 pruned. [0m
++++++++++++++++++++
        NaN         
++++++++++++++++++++

Trial Id: 3 | Model params: 44442 | Timestamp: 2022-02-24 12:54:23.483797

[32m[I 2022-02-24 12:55:09,033][0m Trial 3 pruned. [0m
++++++++++++++++++++
        NaN         
++++++++++++++++++++

Trial Id: 4 | Model params: 99758 | Timestamp: 2022-02-24 12:55:09.033811

epoch 0 -2.22873929644788 8.092813455656946
epoch 5 -2.1478195183555204 7.990757516559171
epoch 10 -2.1352120335942004 7.974739376292518
epoch 15 -2.157127238587573 8.002562646443867
epoch 20 -2.1559428171111903 8.001061393011556
epoch 25 -2.155462642277653 8.000452691477292
epoch 30 -2.137781756368587 7.978006886071486
epoch 35 -2.142603061406423 7.98413376863717
epoch 40 -2.145221211003531 7.987458926830344
epoch 45 -2.152685393431438 7.996931157285492
epoch 50 -2.141336648807474 7.982524875267123
epoch 55 -2.152416356654894 7.9965899379417325
epoch 60 -2.152010658624249 7.99607536359512
epoch 65 -2.1457942267195484 7.988186495854004
epoch 70 -2.15579109536004 8.000869065440007
epoch 75 -2.15223649040538 7.996361805456161
epoch 80 -2.1452449365226625 7.987489052891357
epoch 85 -2.141110924862249 7.982238073886262
epoch 90 -2.1465622963282702 7.9891616246090305
epoch 95 -2.1587879662260416 8.004667143458539
[32m[I 2022-02-24 14:45:07,047][0m Trial 4 finished with value: 7.992215364929693 and parameters: {'n_layers_fe': 2, 'fe_n_units_l0': 162, 'fe_dropout_l0': 0.07358349298772032, 'fe_n_units_l1': 225, 'fe_dropout_l1': 0.14817366662514103, 'n_units_l(Invariant)': 154, 'n_layers_mlp': 4, 'mlp_n_units_l0': 85, 'mlp_dropout_l0': 0.4866445321839578, 'mlp_n_units_l1': 12, 'mlp_dropout_l1': 0.4068501769560715, 'mlp_n_units_l2': 116, 'mlp_dropout_l2': 0.29593086997476464, 'mlp_n_units_l3': 192, 'mlp_dropout_l3': 0.1165649163206316, 'reduction': 'sum', 'lr': 0.0001599828337219196, 'weight_decay': 0.2327224021161097, 'criterion': 'PoissonNLLLoss', 'batch_size': 256}. Best is trial 4 with value: 7.992215364929693.[0m

Trial Id: 5 | Model params: 86997 | Timestamp: 2022-02-24 14:45:07.047357

epoch 0 0.10738444116819101 4.255153842094255
epoch 5 0.13266348380402615 4.1944677119041005
epoch 10 0.13849511507125645 4.180342949908926
epoch 15 0.14145587024012307 4.173153423426062
epoch 20 0.14477168670668694 4.16508697889451
epoch 25 0.14062388877998977 4.17517495349314
epoch 30 0.1286612605031059 4.204134015011221
epoch 35 0.10492107515011329 4.261021306197907
epoch 40 0.13770161725610675 4.182267680456808
epoch 45 0.13965878413684973 4.1775187177713216
epoch 50 0.13381661482014973 4.19167849490149
epoch 55 0.13849131075621368 4.180352179876329
epoch 60 0.1220077011788866 4.220154913182965
epoch 65 0.09457727693563867 4.285571397528633
epoch 70 0.14145224651063537 4.173162230406762
epoch 75 0.13682582293827394 4.184391003880668
epoch 80 0.1228322366614959 4.2181728429482614
epoch 85 0.1386297054460911 4.180016395811099
epoch 90 0.13154945702804244 4.197160582417011
epoch 95 0.11051269771836703 4.2476910011027265
[32m[I 2022-02-24 17:08:32,117][0m Trial 5 finished with value: 4.268699711964605 and parameters: {'n_layers_fe': 4, 'fe_n_units_l0': 57, 'fe_dropout_l0': 0.10437837787755588, 'fe_n_units_l1': 53, 'fe_dropout_l1': 0.43079081273835296, 'fe_n_units_l2': 94, 'fe_dropout_l2': 0.2215642450118444, 'fe_n_units_l3': 151, 'fe_dropout_l3': 0.2058083818572372, 'n_units_l(Invariant)': 358, 'n_layers_mlp': 2, 'mlp_n_units_l0': 39, 'mlp_dropout_l0': 0.3244354650402852, 'mlp_n_units_l1': 207, 'mlp_dropout_l1': 0.19629001706577426, 'reduction': 'sum', 'lr': 0.0005351076099867252, 'weight_decay': 0.025201711923230664, 'criterion': 'MSELoss', 'batch_size': 32}. Best is trial 5 with value: 4.268699711964605.[0m

Trial Id: 6 | Model params: 154496 | Timestamp: 2022-02-24 17:08:32.117408

[32m[I 2022-02-24 17:09:12,167][0m Trial 6 pruned. [0m
++++++++++++++++++++
        NaN         
++++++++++++++++++++

Trial Id: 7 | Model params: 19381 | Timestamp: 2022-02-24 17:09:12.167674

[32m[I 2022-02-24 17:09:34,550][0m Trial 7 pruned. [0m
++++++++++++++++++++
        NaN         
++++++++++++++++++++

Trial Id: 8 | Model params: 111855 | Timestamp: 2022-02-24 17:09:34.550653

[32m[I 2022-02-24 17:10:52,987][0m Trial 8 pruned. [0m
++++++++++++++++++++
        NaN         
++++++++++++++++++++

Trial Id: 9 | Model params: 6752 | Timestamp: 2022-02-24 17:10:52.987929

[32m[I 2022-02-24 17:11:09,560][0m Trial 9 pruned. [0m
++++++++++++++++++++
        NaN         
++++++++++++++++++++

Trial Id: 10 | Model params: 66674 | Timestamp: 2022-02-24 17:11:09.560338

epoch 0 0.10465696969512961 4.261649896559371
epoch 5 0.09233998203927907 4.290862943151329
epoch 10 0.10357596049933482 4.264221811936392
epoch 15 0.10393964678309398 4.263356710017895
epoch 20 0.11243850625607976 4.243090220357235
epoch 25 0.07757554756761731 4.325620786728822
epoch 30 0.10921146868632103 4.250796834583292
epoch 35 0.11289361680779564 4.242002226592721
epoch 40 0.10203927220947473 4.267875202282941
epoch 45 0.1087501710624339 4.2518973363375965
epoch 50 0.11136423947120078 4.245657272042604
epoch 55 0.1085976280549078 4.252261190240185
epoch 60 0.10820438429192603 4.253199033162835
epoch 65 0.10914144408141979 4.250963908197778
epoch 70 0.10957568777619364 4.249927728398934
epoch 75 0.1083606955037616 4.252826272959759
epoch 80 0.05269655307258603 4.383566494833192
epoch 85 0.10501805722590174 4.2607904584625125
epoch 90 0.1139647993071824 4.239440340458283
epoch 95 0.10863554948204523 4.252170740891511
[32m[I 2022-02-24 18:56:38,065][0m Trial 10 finished with value: 4.247118742358311 and parameters: {'n_layers_fe': 4, 'fe_n_units_l0': 34, 'fe_dropout_l0': 0.006504073741182587, 'fe_n_units_l1': 17, 'fe_dropout_l1': 0.3612347062030012, 'fe_n_units_l2': 131, 'fe_dropout_l2': 0.48842729110407535, 'fe_n_units_l3': 40, 'fe_dropout_l3': 0.09096966972467796, 'n_units_l(Invariant)': 237, 'n_layers_mlp': 2, 'mlp_n_units_l0': 179, 'mlp_dropout_l0': 0.007599891018240629, 'mlp_n_units_l1': 244, 'mlp_dropout_l1': 0.07048271455387708, 'reduction': 'sum', 'lr': 0.001191008645931476, 'weight_decay': 0.03713114412107882, 'criterion': 'MSELoss', 'batch_size': 32}. Best is trial 10 with value: 4.247118742358311.[0m

Trial Id: 11 | Model params: 63190 | Timestamp: 2022-02-24 18:56:38.065291

epoch 0 0.06735391797650758 4.349521431429686
epoch 5 0.11975105927967955 4.2255748166063105
epoch 10 0.08309272131245105 4.312665257457474
epoch 15 0.12548416851317468 4.211791637977421
epoch 20 0.11404514460971227 4.239248120759452
epoch 25 0.09447917745871737 4.285803554793274
epoch 30 0.1382050893658281 4.181046547132884
epoch 35 0.1340341583218042 4.191152088083384
epoch 40 0.14556251052754643 4.163160819674745
epoch 45 0.14125924312757898 4.173631271974035
epoch 50 0.13242055537680286 4.195055075681931
epoch 55 0.14134162676843798 4.173431067672554
epoch 60 0.13023374668008414 4.200338747065666
epoch 65 0.14340887401923352 4.168404206476221
epoch 70 0.12278124404382607 4.218295449226145
epoch 75 0.14214644672961319 4.171474731970161
epoch 80 0.13876194273108988 4.1796955261228765
epoch 85 0.14614328027815326 4.161745708038352
epoch 90 0.1402807224061856 4.1760084864620675
epoch 95 0.1405191452739345 4.175429387571864
[32m[I 2022-02-24 20:42:07,715][0m Trial 11 finished with value: 4.195756115531679 and parameters: {'n_layers_fe': 4, 'fe_n_units_l0': 38, 'fe_dropout_l0': 0.008391355210808221, 'fe_n_units_l1': 21, 'fe_dropout_l1': 0.35808531999910925, 'fe_n_units_l2': 130, 'fe_dropout_l2': 0.47953627032988483, 'fe_n_units_l3': 15, 'fe_dropout_l3': 0.0961712618173337, 'n_units_l(Invariant)': 256, 'n_layers_mlp': 2, 'mlp_n_units_l0': 188, 'mlp_dropout_l0': 0.07126458544144335, 'mlp_n_units_l1': 256, 'mlp_dropout_l1': 0.07709388883863737, 'reduction': 'sum', 'lr': 0.0008877069920932969, 'weight_decay': 0.005691226309674224, 'criterion': 'MSELoss', 'batch_size': 32}. Best is trial 11 with value: 4.195756115531679.[0m

Trial Id: 12 | Model params: 61067 | Timestamp: 2022-02-24 20:42:07.715395

epoch 0 0.09136318782357078 4.293171165940785
epoch 5 0.10648960876225289 4.257286168667558
epoch 10 0.0999668648929769 4.2727972875023585
epoch 15 0.10372865084068505 4.263858628228755
epoch 20 0.09424641470292427 4.286354349056252
epoch 25 0.09813243702873986 4.27714943204082
epoch 30 0.08873503788147541 4.29937548781224
epoch 35 0.10333065214120618 4.264805228741206
epoch 40 0.10494651880564232 4.2609607435336665
epoch 45 0.070053260479779 4.34322249555882
epoch 50 0.09559546088763826 4.283161071758357
epoch 55 0.10439469056363349 4.262274048393235
epoch 60 0.10529955842013738 4.260120326544759
epoch 65 0.1051420902783422 4.260495202696734
epoch 70 0.10313655943382782 4.265266782827752
epoch 75 0.10071283784787533 4.271026212739798
epoch 80 0.10168715245695936 4.268711906950421
epoch 85 0.10506628436522059 4.2606756580997835
epoch 90 0.10219328343733025 4.2675091902369315
epoch 95 0.10186827129789056 4.268281554023016
[32m[I 2022-02-24 22:27:25,074][0m Trial 12 finished with value: 4.338562624289376 and parameters: {'n_layers_fe': 4, 'fe_n_units_l0': 8, 'fe_dropout_l0': 0.03804985352814369, 'fe_n_units_l1': 12, 'fe_dropout_l1': 0.34527698722254196, 'fe_n_units_l2': 172, 'fe_dropout_l2': 0.493667861565514, 'fe_n_units_l3': 19, 'fe_dropout_l3': 0.07196487476096271, 'n_units_l(Invariant)': 242, 'n_layers_mlp': 2, 'mlp_n_units_l0': 188, 'mlp_dropout_l0': 0.007498448348018698, 'mlp_n_units_l1': 242, 'mlp_dropout_l1': 0.015915506485619624, 'reduction': 'sum', 'lr': 0.001134962502987854, 'weight_decay': 0.06888427091703866, 'criterion': 'MSELoss', 'batch_size': 32}. Best is trial 11 with value: 4.195756115531679.[0m

Trial Id: 13 | Model params: 58517 | Timestamp: 2022-02-24 22:27:25.075067

epoch 0 0.005719108204290557 4.4909434515721705
epoch 5 0.012035183763847157 4.476656579133815
epoch 10 0.014062589023850713 4.472060940731661
epoch 15 0.014865615862012849 4.470239366434537
epoch 20 0.014859050729029932 4.470254261695268
epoch 25 0.014424372048730039 4.471240369281284
epoch 30 0.015769827476936338 4.468187377208023
epoch 35 0.017321364932427308 4.464664169659758
epoch 40 0.016024339271334176 4.467609626217553
epoch 45 0.015016809281617527 4.4698963184598455
epoch 50 0.013636340024682836 4.4730275363269
epoch 55 0.014164102284066393 4.471830710512718
epoch 60 0.01282310300635725 4.47487111706923
epoch 65 0.016494625153544384 4.466541863606571
epoch 70 0.01550082372369388 4.468797944274248
epoch 75 0.015434685306424 4.468948048137472
epoch 80 0.01587528167027652 4.467948001434633
epoch 85 0.013475831016426354 4.473391464985856
epoch 90 0.015925604535418025 4.467833766513541
epoch 95 0.017169090324543834 4.465010075547087
[32m[I 2022-02-25 00:12:08,731][0m Trial 13 finished with value: 4.464189291020394 and parameters: {'n_layers_fe': 4, 'fe_n_units_l0': 39, 'fe_dropout_l0': 0.013998344179200237, 'fe_n_units_l1': 11, 'fe_dropout_l1': 0.33409968339681995, 'fe_n_units_l2': 146, 'fe_dropout_l2': 0.497257386639926, 'fe_n_units_l3': 13, 'fe_dropout_l3': 0.13779987548107178, 'n_units_l(Invariant)': 254, 'n_layers_mlp': 2, 'mlp_n_units_l0': 180, 'mlp_dropout_l0': 0.010651117816213583, 'mlp_n_units_l1': 254, 'mlp_dropout_l1': 0.07376640660049669, 'reduction': 'sum', 'lr': 0.0016477223824468484, 'weight_decay': 0.0012718846279801063, 'criterion': 'MSELoss', 'batch_size': 32}. Best is trial 11 with value: 4.195756115531679.[0m

Trial Id: 14 | Model params: 84902 | Timestamp: 2022-02-25 00:12:08.731848

[32m[I 2022-02-25 00:13:12,427][0m Trial 14 pruned. [0m
epoch 0 0.08733917087102694 4.302667099040407

Trial Id: 15 | Model params: 42575 | Timestamp: 2022-02-25 00:13:12.427292

[32m[I 2022-02-25 00:14:15,732][0m Trial 15 pruned. [0m
epoch 0 0.09340459504828535 4.2883457843518595

Trial Id: 16 | Model params: 139142 | Timestamp: 2022-02-25 00:14:15.733153

[32m[I 2022-02-25 00:15:19,432][0m Trial 16 pruned. [0m
epoch 0 0.10298173046475712 4.2656349316061

Trial Id: 17 | Model params: 59843 | Timestamp: 2022-02-25 00:15:19.432962

epoch 0 -0.041696815015783706 4.596779884468087
epoch 5 0.11802008002464548 4.229727499825158
epoch 10 0.13259927477420608 4.194622967513111
epoch 15 0.13551453969633276 4.187568137578768
epoch 20 0.13770430548527934 4.182261161308116
epoch 25 0.1356132951435398 4.187328945021895
epoch 30 0.1320385922888505 4.195978437729673
epoch 35 0.1323387352719333 4.195252885667014
epoch 40 0.1334394406689553 4.192591015699362
epoch 45 0.135274971492789 4.18814833165304
epoch 50 0.13725500408892233 4.183350608395977
epoch 55 0.13641116183646784 4.1853959550817645
epoch 60 0.13807361554873177 4.181365461284381
epoch 65 0.13455108763293255 4.189900969000059
epoch 70 0.1370042322000583 4.183958546151344
epoch 75 0.12854266752086707 4.204420105715316
epoch 80 0.1369508006476685 4.184088067029893
epoch 85 0.13718900083907226 4.183510626394327
epoch 90 0.13640189102840217 4.185418420575021
epoch 95 0.07964098612181181 4.32077523497701
[32m[I 2022-02-25 01:10:15,182][0m Trial 17 finished with value: 4.182113442724249 and parameters: {'n_layers_fe': 4, 'fe_n_units_l0': 245, 'fe_dropout_l0': 0.00159525758263491, 'fe_n_units_l1': 53, 'fe_dropout_l1': 0.47899611765578193, 'fe_n_units_l2': 96, 'fe_dropout_l2': 0.48439451337220923, 'fe_n_units_l3': 10, 'fe_dropout_l3': 0.1296540989356825, 'n_units_l(Invariant)': 292, 'n_layers_mlp': 2, 'mlp_n_units_l0': 145, 'mlp_dropout_l0': 9.61269381477732e-06, 'mlp_n_units_l1': 220, 'mlp_dropout_l1': 0.05874393597132972, 'reduction': 'sum', 'lr': 0.00023951669569601602, 'weight_decay': 0.12288462842525326, 'criterion': 'MSELoss', 'batch_size': 256}. Best is trial 17 with value: 4.182113442724249.[0m

Trial Id: 18 | Model params: 103107 | Timestamp: 2022-02-25 01:10:15.182337

[32m[I 2022-02-25 01:11:04,590][0m Trial 18 pruned. [0m
++++++++++++++++++++
        NaN         
++++++++++++++++++++

Trial Id: 19 | Model params: 133918 | Timestamp: 2022-02-25 01:11:04.590674

epoch 0 -0.2843778865845963 5.104220763124321
epoch 5 -0.11488851149067703 4.755528186683373
epoch 10 -0.03584958863809007 4.583860464563474
epoch 15 -0.012262990900262505 4.531372028821757
epoch 20 -0.014657372196257956 4.536728059875706
epoch 25 -0.024381742439850695 4.558415983950665
epoch 30 -0.020559091762370807 4.549902791106529
epoch 35 -0.016758665376207516 4.541423273025611
epoch 40 -0.013790360778382471 4.534789358323183
epoch 45 -0.014387906834270492 4.536125604170826
epoch 50 -0.04318645206593019 4.600065431311795
epoch 55 -0.025177140262268027 4.5601853685713225
epoch 60 -0.012062745869615199 4.5309238105139125
epoch 65 -0.02782789800103913 4.566077103005506
epoch 70 -0.019531377730730437 4.547611313441378
epoch 75 -0.013327930406431321 4.5337549908644
epoch 80 -0.01445355327174136 4.5362723802050455
epoch 85 -0.022071465150833136 4.553272808843729
epoch 90 -0.032050948060222684 4.575447838105467
epoch 95 -0.009235766007777757 4.524591304148318
[32m[I 2022-02-25 02:08:22,595][0m Trial 19 finished with value: 4.566682480349405 and parameters: {'n_layers_fe': 4, 'fe_n_units_l0': 252, 'fe_dropout_l0': 0.1652071011955148, 'fe_n_units_l1': 130, 'fe_dropout_l1': 0.4618194852710672, 'fe_n_units_l2': 29, 'fe_dropout_l2': 0.44396656391450023, 'fe_n_units_l3': 10, 'fe_dropout_l3': 0.08948867500419204, 'n_units_l(Invariant)': 296, 'n_layers_mlp': 4, 'mlp_n_units_l0': 154, 'mlp_dropout_l0': 0.36201466066926413, 'mlp_n_units_l1': 221, 'mlp_dropout_l1': 0.1541082779092644, 'mlp_n_units_l2': 235, 'mlp_dropout_l2': 0.46337876120567517, 'mlp_n_units_l3': 8, 'mlp_dropout_l3': 0.4914849189689138, 'reduction': 'sum', 'lr': 0.0002050112249222767, 'weight_decay': 0.29932772358283977, 'criterion': 'MSELoss', 'batch_size': 256}. Best is trial 17 with value: 4.182113442724249.[0m

Study statistics: 
  Number of finished trials:  20
  Number of pruned trials:  12
  Number of complete trials:  8

Best trial:
  Value:  4.182113442724249
  Params: 
    n_layers_fe: 4
    fe_n_units_l0: 245
    fe_dropout_l0: 0.00159525758263491
    fe_n_units_l1: 53
    fe_dropout_l1: 0.47899611765578193
    fe_n_units_l2: 96
    fe_dropout_l2: 0.48439451337220923
    fe_n_units_l3: 10
    fe_dropout_l3: 0.1296540989356825
    n_units_l(Invariant): 292
    n_layers_mlp: 2
    mlp_n_units_l0: 145
    mlp_dropout_l0: 9.61269381477732e-06
    mlp_n_units_l1: 220
    mlp_dropout_l1: 0.05874393597132972
    reduction: sum
    lr: 0.00023951669569601602
    weight_decay: 0.12288462842525326
    criterion: MSELoss
    batch_size: 256
Target: 132567, NaN: 0, Max: 83.0, Min: 0.0, Mean: 8.78098621828962
Prediction: 132567, NaN: 0, Max: 20.482656478881836, Min: 0.6585876941680908, Mean: 8.622803026780684

 XXXXXX======== TRIAL south - rlbg ended

Test Set - R-squared:  0.1400721895813224
Test Set - RMSE:  4.2046292194812604
Test Set - MAE:  3.2333503452401042



