[32m[I 2022-02-17 07:00:55,415][0m Trial 12 finished with value: 3.624974163789177 and parameters: {'n_layers_fe': 4, 'fe_n_units_l0': 139, 'fe_dropout_l0': 0.46287688566743707, 'fe_n_units_l1': 132, 'fe_dropout_l1': 0.4971705197536374, 'fe_n_units_l2': 10, 'fe_dropout_l2': 0.008753912392084721, 'fe_n_units_l3': 10, 'fe_dropout_l3': 0.027590640305256126, 'n_units_l(Invariant)': 94, 'n_layers_mlp': 4, 'mlp_n_units_l0': 196, 'mlp_dropout_l0': 0.48847202712397647, 'mlp_n_units_l1': 104, 'mlp_dropout_l1': 0.48960730066477653, 'mlp_n_units_l2': 256, 'mlp_dropout_l2': 0.2414093988853176, 'mlp_n_units_l3': 17, 'mlp_dropout_l3': 0.2047261977563112, 'reduction': 'sum', 'lr': 5.902841850970976e-05, 'weight_decay': 0.2992383051055592, 'criterion': 'PoissonNLLLoss', 'batch_size': 256}. Best is trial 4 with value: 3.5941212437180696.[0m

Trial Id: 13 | Model params: 143745 | Timestamp: 2022-02-17 07:00:55.415853

epoch 0 -1.3768028613672412 3.6157944438910667
epoch 5 -1.3778041287623024 3.616555970212235
epoch 10 -1.3893773123530733 3.625346488385741
epoch 15 -1.3874240328392897 3.6238643526849215
epoch 20 -1.3647976631140657 3.606651219933524
epoch 25 -1.3763550850623263 3.615453830169016
epoch 30 -1.375799146760166 3.615030895304138
epoch 35 -1.3654833457845257 3.6071740636082796
epoch 40 -1.3783878027438674 3.6169998167163
epoch 45 -1.3877469891438623 3.624109451638172
epoch 50 -1.376755353838056 3.6157583074656943
epoch 55 -1.3676072864723787 3.608793120612163
epoch 60 -1.3597621780676907 3.6028092598390042
epoch 65 -1.3716759305627906 3.6118925772452632
epoch 70 -1.369672439757181 3.6103666684203706
epoch 75 -1.3750163490432143 3.614435291278992
epoch 80 -1.380988926551359 3.618977142153452
epoch 85 -1.3676487763703569 3.608824740679245
epoch 90 -1.3739508814686658 3.6136244556793367
epoch 95 -1.3742690483333533 3.6138666041272423
[32m[I 2022-02-17 08:00:54,211][0m Trial 13 finished with value: 3.6076952417406196 and parameters: {'n_layers_fe': 4, 'fe_n_units_l0': 238, 'fe_dropout_l0': 0.3408426515567895, 'fe_n_units_l1': 159, 'fe_dropout_l1': 0.45550385464851884, 'fe_n_units_l2': 72, 'fe_dropout_l2': 0.1477278880509191, 'fe_n_units_l3': 78, 'fe_dropout_l3': 0.1952666400535048, 'n_units_l(Invariant)': 1, 'n_layers_mlp': 4, 'mlp_n_units_l0': 144, 'mlp_dropout_l0': 0.4326294223509354, 'mlp_n_units_l1': 170, 'mlp_dropout_l1': 0.39369405946423824, 'mlp_n_units_l2': 178, 'mlp_dropout_l2': 0.17027903326879731, 'mlp_n_units_l3': 159, 'mlp_dropout_l3': 0.18706339593620863, 'reduction': 'sum', 'lr': 0.00028071650448558436, 'weight_decay': 0.26126354960815545, 'criterion': 'PoissonNLLLoss', 'batch_size': 256}. Best is trial 4 with value: 3.5941212437180696.[0m

Trial Id: 14 | Model params: 162287 | Timestamp: 2022-02-17 08:00:54.211366

[32m[I 2022-02-17 08:01:38,692][0m Trial 14 pruned. [0m
epoch 0 -1.362190958057755 3.6046628747259546

Trial Id: 15 | Model params: 98256 | Timestamp: 2022-02-17 08:01:38.692738

[32m[I 2022-02-17 08:01:57,414][0m Trial 15 pruned. [0m
epoch 0 -1.3852730585695006 3.6222315058646544

Trial Id: 16 | Model params: 81364 | Timestamp: 2022-02-17 08:01:57.414661

[32m[I 2022-02-17 08:02:29,164][0m Trial 16 pruned. [0m
epoch 0 -1.26676869862104 3.5311060074311995

Trial Id: 17 | Model params: 155459 | Timestamp: 2022-02-17 08:02:29.164399

[32m[I 2022-02-17 08:03:10,204][0m Trial 17 pruned. [0m
epoch 0 -1.3860547384494857 3.6228249795435676

Trial Id: 18 | Model params: 156046 | Timestamp: 2022-02-17 08:03:10.205090

[32m[I 2022-02-17 08:04:04,484][0m Trial 18 pruned. [0m
epoch 0 -1.7071649652482566 3.858908782348799

Trial Id: 19 | Model params: 74922 | Timestamp: 2022-02-17 08:04:04.484776

[32m[I 2022-02-17 08:04:33,989][0m Trial 19 pruned. [0m
++++++++++++++++++++
        NaN         
++++++++++++++++++++

Trial Id: 20 | Model params: 192639 | Timestamp: 2022-02-17 08:04:33.989333

[32m[I 2022-02-17 08:05:35,173][0m Trial 20 pruned. [0m
epoch 0 -1.3624180196275448 3.604836116592852

Trial Id: 21 | Model params: 134566 | Timestamp: 2022-02-17 08:05:35.173446

epoch 0 -3.051918952842837 4.721038338316858
epoch 5 -3.051918952842837 4.721038338316858
epoch 10 -1.3746887989432661 3.6141860404761794
epoch 15 -1.3786527701765992 3.617201289424706
epoch 20 -1.3752429631199456 3.614607724277056
epoch 25 -1.3787670004787507 3.6172881430085537
epoch 30 -1.3713259222772223 3.6116260486361775
epoch 35 -1.3724285996108065 3.612465662306767
epoch 40 -1.384019414693154 3.621279500569924
epoch 45 -1.37503291829825 3.6144478992755062
epoch 50 -1.3786675709102338 3.6172125430953086
epoch 55 -1.3730393646214667 3.6129306342861005
epoch 60 -1.3856090163296608 3.6224865865004894
epoch 65 -1.3784133435404962 3.6170192376048127
epoch 70 -1.3699303811407653 3.610563159213193
epoch 75 -1.3764141198553324 3.6154987384919046
epoch 80 -1.3744833252759645 3.614029675540032
epoch 85 -1.3794834051579126 3.617832804815818
epoch 90 -1.3762203235111055 3.61535131369803
epoch 95 -1.374719907374054 3.61420971332294
[32m[I 2022-02-17 08:59:30,609][0m Trial 21 finished with value: 3.6179282016288683 and parameters: {'n_layers_fe': 4, 'fe_n_units_l0': 250, 'fe_dropout_l0': 0.36124018722062456, 'fe_n_units_l1': 156, 'fe_dropout_l1': 0.4943935405835276, 'fe_n_units_l2': 42, 'fe_dropout_l2': 0.1050186051194951, 'fe_n_units_l3': 49, 'fe_dropout_l3': 0.11354814346811085, 'n_units_l(Invariant)': 2, 'n_layers_mlp': 4, 'mlp_n_units_l0': 255, 'mlp_dropout_l0': 0.48979517856937344, 'mlp_n_units_l1': 131, 'mlp_dropout_l1': 0.4958031328060485, 'mlp_n_units_l2': 206, 'mlp_dropout_l2': 0.10737419551815403, 'mlp_n_units_l3': 89, 'mlp_dropout_l3': 0.11587923379970647, 'reduction': 'sum', 'lr': 0.00011349285773335522, 'weight_decay': 0.2812138594761367, 'criterion': 'PoissonNLLLoss', 'batch_size': 256}. Best is trial 4 with value: 3.5941212437180696.[0m

Trial Id: 22 | Model params: 120675 | Timestamp: 2022-02-17 08:59:30.609957

[32m[I 2022-02-17 09:00:00,684][0m Trial 22 pruned. [0m
epoch 0 -1.4240259986108161 3.651537701464349

Trial Id: 23 | Model params: 102635 | Timestamp: 2022-02-17 09:00:00.684927

epoch 0 -3.051918952842837 4.721038338316858
epoch 5 -1.389494502488715 3.6254353922259304
epoch 10 -1.3767084778771124 3.615722651086369
epoch 15 -1.373244611208376 3.613086873929446
epoch 20 -1.3664523605456633 3.6079128231987942
epoch 25 -1.3699451349799778 3.6105743978524867
epoch 30 -1.3715559226908014 3.6118011943923483
epoch 35 -1.3673160427273063 3.608571151632304
epoch 40 -1.3621474154401647 3.6046296519291547
epoch 45 -1.375061765728673 3.6144698499644585
epoch 50 -1.3651628719268336 3.6069297067528594
epoch 55 -1.3737395055745645 3.6134635740642502
epoch 60 -1.3741979044551007 3.61381245979766
