[32m[I 2022-02-15 19:32:55,430][0m A new study created in memory with name: DeepSet[0m
Starting Loading south
Finished Loading south
Finished south setup

++++++++ Session Characteristics +++++++

Area: south
Gal Type: lrg
Training Set: 232361
Validation Set: 58091
Test Samples: 132567
Number of features: 5
Device: cuda:0
Number of Workers: 8
Number of Trials: 50

+++++++++++++++++++++++++++++++++++++++

Trial Id: 0 | Model params: 202508 | Timestamp: 2022-02-15 19:32:55.430900

[32m[I 2022-02-15 19:34:27,343][0m Trial 0 pruned. [0m
++++++++++++++++++++
        NaN         
++++++++++++++++++++

Trial Id: 1 | Model params: 18086 | Timestamp: 2022-02-15 19:34:27.343591

[32m[I 2022-02-15 19:35:26,632][0m Trial 1 pruned. [0m
++++++++++++++++++++
        NaN         
++++++++++++++++++++

Trial Id: 2 | Model params: 149290 | Timestamp: 2022-02-15 19:35:26.632515

[32m[I 2022-02-15 19:36:43,408][0m Trial 2 pruned. [0m
++++++++++++++++++++
        NaN         
++++++++++++++++++++

Trial Id: 3 | Model params: 81415 | Timestamp: 2022-02-15 19:36:43.408716

epoch 0 -0.009365874649663652 4.920628375948519
epoch 5 0.000591914978637198 4.8962962527828315
epoch 10 -0.004358922051910907 4.908408831469914
epoch 15 -0.0003947442653755573 4.898712575145181
epoch 20 -0.0010296913841774114 4.900266926597966
epoch 25 -0.004893215393084738 4.909714232064156
epoch 30 -7.806964232770497e-05 4.897937170859925
epoch 35 -0.00036712000622696195 4.898644939723942
epoch 40 -0.0017139046392879997 4.901941329908372
epoch 45 -4.901629120590556e-06 4.897757995404748
epoch 50 -0.001037399702074282 4.9002857935421025
epoch 55 -0.007577161729911186 4.91626648171937
epoch 60 -0.000644709210346095 4.8993245485412436
epoch 65 -0.00036776714220398965 4.898646524186688
epoch 70 -6.329128416382446e-05 4.8979009818165995
epoch 75 -4.169875157167269e-06 4.897756203436292
epoch 80 -0.0018651582466300276 4.902311399805349
epoch 85 -0.0014816246626669916 4.9013729596249105
epoch 90 -0.0012529741671425398 4.900813406007987
epoch 95 -0.0017513331846663593 4.902032908361487
[32m[I 2022-02-15 20:44:56,579][0m Trial 3 finished with value: 4.897746485323997 and parameters: {'n_layers_fe': 4, 'fe_n_units_l0': 120, 'fe_dropout_l0': 0.3222122362711264, 'fe_n_units_l1': 129, 'fe_dropout_l1': 0.10912598240063909, 'fe_n_units_l2': 124, 'fe_dropout_l2': 0.2391831387170384, 'fe_n_units_l3': 197, 'fe_dropout_l3': 0.4585184396736359, 'n_units_l(Invariant)': 56, 'n_layers_mlp': 4, 'mlp_n_units_l0': 71, 'mlp_dropout_l0': 0.06944005318571306, 'mlp_n_units_l1': 134, 'mlp_dropout_l1': 0.0026908773294503363, 'mlp_n_units_l2': 10, 'mlp_dropout_l2': 0.2207440036104532, 'mlp_n_units_l3': 47, 'mlp_dropout_l3': 0.060094626598376555, 'reduction': 'sum', 'lr': 0.008191827059880861, 'weight_decay': 0.11633493760255359, 'criterion': 'MSELoss', 'batch_size': 256}. Best is trial 3 with value: 4.897746485323997.[0m

Trial Id: 4 | Model params: 179763 | Timestamp: 2022-02-15 20:44:56.579619

epoch 0 -0.38306060311668877 5.759925459256405
epoch 5 0.0035729658965009126 4.888988422628647
epoch 10 0.003825662315844136 4.888368453396937
epoch 15 0.0022791938686712587 4.8921613516999924
epoch 20 0.0023938208403987415 4.891880316291549
epoch 25 0.0037910131414758963 4.888453466858787
epoch 30 0.0037511290850559265 4.88855132253216
epoch 35 0.003908060712698003 4.88816627891896
epoch 40 0.003692635549777945 4.88869483308481
epoch 45 0.004410904208896005 4.8869323100399304
epoch 50 0.002642588989403394 4.891270346189039
epoch 55 0.0029858147595238638 4.890428644672532
epoch 60 0.004127754346412993 4.88762719302247
epoch 65 0.004440040501215714 4.886860800553385
epoch 70 0.0030144291580779248 4.890358466293692
epoch 75 0.004087755364740486 4.887725347252771
epoch 80 0.002900169680542408 4.890638687899266
epoch 85 0.0038783313051029555 4.888239224596792
epoch 90 0.004169155731538643 4.887525595332698
epoch 95 0.0031688692347033864 4.889979676163889
[32m[I 2022-02-15 22:15:50,244][0m Trial 4 finished with value: 4.890050257959846 and parameters: {'n_layers_fe': 4, 'fe_n_units_l0': 189, 'fe_dropout_l0': 0.09399047965412916, 'fe_n_units_l1': 153, 'fe_dropout_l1': 0.3126286800455139, 'fe_n_units_l2': 129, 'fe_dropout_l2': 0.3398160231777748, 'fe_n_units_l3': 61, 'fe_dropout_l3': 0.1456751818343674, 'n_units_l(Invariant)': 472, 'n_layers_mlp': 4, 'mlp_n_units_l0': 78, 'mlp_dropout_l0': 0.4673429180293241, 'mlp_n_units_l1': 208, 'mlp_dropout_l1': 0.42577591787964786, 'mlp_n_units_l2': 171, 'mlp_dropout_l2': 0.43058766734921433, 'mlp_n_units_l3': 220, 'mlp_dropout_l3': 0.06025824617756126, 'reduction': 'sum', 'lr': 4.393392530880667e-05, 'weight_decay': 0.27383509749731216, 'criterion': 'MSELoss', 'batch_size': 256}. Best is trial 4 with value: 4.890050257959846.[0m

Trial Id: 5 | Model params: 190223 | Timestamp: 2022-02-15 22:15:50.244770

epoch 0 -1.882708353076323 8.315657836539899
epoch 5 -1.762082664298581 8.13981611515191
epoch 10 -1.7398675344873702 8.107016203576501
epoch 15 -1.740847472162962 8.108465846724949
epoch 20 -1.7467208146825701 8.117148984301062
epoch 25 -1.7520827859928665 8.125068008925352
epoch 30 -1.7519403017018038 8.124857675583316
epoch 35 -1.7391342918187647 8.105931332157658
epoch 40 -1.7422290330993273 8.110509179756926
epoch 45 -1.7438267400262855 8.112871551686307
epoch 50 -1.7438048839066025 8.112839239834738
epoch 55 -1.7474481315317325 8.118223601791133
epoch 60 -1.7414367496305756 8.109337452947798
epoch 65 -1.7422513933721544 8.110542246438474
epoch 70 -1.737875115650012 8.104067975389873
epoch 75 -1.7368278398935821 8.102517867124597
epoch 80 -1.7448831967027454 8.114433252419053
epoch 85 -1.7432388581198976 8.11200238858996
epoch 90 -1.7410838393251078 8.108815471022186
epoch 95 -1.740387630474522 8.107785625175381
[32m[I 2022-02-15 23:52:04,297][0m Trial 5 finished with value: 8.116195124522346 and parameters: {'n_layers_fe': 4, 'fe_n_units_l0': 38, 'fe_dropout_l0': 0.28537225313195014, 'fe_n_units_l1': 145, 'fe_dropout_l1': 0.2428488741691769, 'fe_n_units_l2': 96, 'fe_dropout_l2': 0.2855577098217964, 'fe_n_units_l3': 212, 'fe_dropout_l3': 0.23517579923004928, 'n_units_l(Invariant)': 448, 'n_layers_mlp': 4, 'mlp_n_units_l0': 92, 'mlp_dropout_l0': 0.25690444547166597, 'mlp_n_units_l1': 242, 'mlp_dropout_l1': 0.16696992397162908, 'mlp_n_units_l2': 83, 'mlp_dropout_l2': 0.2028874981453198, 'mlp_n_units_l3': 107, 'mlp_dropout_l3': 0.09724288686135996, 'reduction': 'sum', 'lr': 1.9825638436604596e-05, 'weight_decay': 0.2085220236049185, 'criterion': 'PoissonNLLLoss', 'batch_size': 128}. Best is trial 4 with value: 4.890050257959846.[0m

Trial Id: 6 | Model params: 70688 | Timestamp: 2022-02-15 23:52:04.297897

epoch 0 0.0014861978729563408 4.894105128850767
epoch 5 -0.0019912272000492948 4.902619829448466
epoch 10 -0.004371699406079621 4.908440053514743
epoch 15 0.004141267249138991 4.887594033018688
epoch 20 -0.011580996782320385 4.926024743888157
epoch 25 0.0045343128884668404 4.886629419742965
epoch 30 -0.003007273523388365 4.905104894470268
epoch 35 -0.0017705936734464522 4.902080033377885
epoch 40 0.0040733068692622165 4.887760802194623
epoch 45 0.002214038595787171 4.89232108822255
epoch 50 0.004692843919273493 4.886240298724421
epoch 55 0.0032217438955585154 4.88984998546819
epoch 60 0.004550619596696892 4.886589395678078
epoch 65 0.004231649721497477 4.887372233057658
epoch 70 -0.004051353878282926 4.907657214741019
epoch 75 0.004089276120692986 4.887721615478062
epoch 80 -0.0023664143043988783 4.903537615718913
epoch 85 0.0011546001682930518 4.894917706158386
epoch 90 0.003726553593607518 4.888611617611955
epoch 95 0.003557185156862208 4.889027136726763
[32m[I 2022-02-16 00:41:43,390][0m Trial 6 finished with value: 4.88624705994685 and parameters: {'n_layers_fe': 2, 'fe_n_units_l0': 242, 'fe_dropout_l0': 0.17999225566897487, 'fe_n_units_l1': 104, 'fe_dropout_l1': 0.4798197051105028, 'n_units_l(Invariant)': 156, 'n_layers_mlp': 2, 'mlp_n_units_l0': 99, 'mlp_dropout_l0': 0.0578668535559555, 'mlp_n_units_l1': 249, 'mlp_dropout_l1': 0.35358443032233555, 'reduction': 'sum', 'lr': 0.003711155095942949, 'weight_decay': 0.29138245448911465, 'criterion': 'MSELoss', 'batch_size': 128}. Best is trial 6 with value: 4.88624705994685.[0m

Trial Id: 7 | Model params: 230550 | Timestamp: 2022-02-16 00:41:43.391085

[32m[I 2022-02-16 00:42:51,464][0m Trial 7 pruned. [0m
++++++++++++++++++++
        NaN         
++++++++++++++++++++

Trial Id: 8 | Model params: 233774 | Timestamp: 2022-02-16 00:42:51.464458

[32m[I 2022-02-16 00:43:59,298][0m Trial 8 pruned. [0m
++++++++++++++++++++
        NaN         
++++++++++++++++++++

Trial Id: 9 | Model params: 139251 | Timestamp: 2022-02-16 00:43:59.299134

[32m[I 2022-02-16 00:44:35,587][0m Trial 9 pruned. [0m
++++++++++++++++++++
        NaN         
++++++++++++++++++++

Trial Id: 10 | Model params: 65737 | Timestamp: 2022-02-16 00:44:35.587454

[32m[I 2022-02-16 00:44:59,687][0m Trial 10 pruned. [0m
++++++++++++++++++++
        NaN         
++++++++++++++++++++

Trial Id: 11 | Model params: 50192 | Timestamp: 2022-02-16 00:44:59.687636

epoch 0 -0.683574112806123 6.354953506036765
epoch 5 -0.37699422121176607 5.747279481444587
epoch 10 -0.3066613825939861 5.5985786791807435
epoch 15 -0.22284788131213085 5.416047637824438
epoch 20 -0.1920645971239887 5.347442864208948
epoch 25 -0.1349860861992489 5.2178492381278145
epoch 30 -0.1282367170019949 5.20231173343282
epoch 35 -0.11331021120529261 5.167784013244763
epoch 40 -0.08897504299760262 5.1109922364999
epoch 45 -0.1019713632252055 5.141400225319336
epoch 50 -0.08112862706574409 5.092545775625766
epoch 55 -0.07513217132525929 5.078403292515528
epoch 60 -0.08620353667518255 5.104484203252685
epoch 65 -0.0762084089793098 5.080944469255742
epoch 70 -0.07440518633265136 5.076686039794148
epoch 75 -0.06634648992622427 5.057611077946986
epoch 80 -0.061559538298496586 5.046246211113703
epoch 85 -0.0636939800889047 5.051316821694252
epoch 90 -0.050254753194492574 5.019304990728141
epoch 95 -0.06434028503526656 5.052851189355061
[32m[I 2022-02-16 01:38:31,438][0m Trial 11 finished with value: 5.037939605799483 and parameters: {'n_layers_fe': 2, 'fe_n_units_l0': 193, 'fe_dropout_l0': 0.07941211569861914, 'fe_n_units_l1': 103, 'fe_dropout_l1': 0.4757431923839994, 'n_units_l(Invariant)': 249, 'n_layers_mlp': 2, 'mlp_n_units_l0': 11, 'mlp_dropout_l0': 0.49576112727789134, 'mlp_n_units_l1': 204, 'mlp_dropout_l1': 0.4937632536063147, 'reduction': 'sum', 'lr': 9.389564383585409e-05, 'weight_decay': 0.29260069962185287, 'criterion': 'MSELoss', 'batch_size': 128}. Best is trial 6 with value: 4.88624705994685.[0m

Trial Id: 12 | Model params: 53224 | Timestamp: 2022-02-16 01:38:31.438782

[32m[I 2022-02-16 01:38:57,312][0m Trial 12 pruned. [0m
epoch 0 -0.2002387544573161 5.365745631675133

Trial Id: 13 | Model params: 195947 | Timestamp: 2022-02-16 01:38:57.312525

[32m[I 2022-02-16 01:39:45,347][0m Trial 13 pruned. [0m
epoch 0 -0.24456480572586936 5.463928602159071

Trial Id: 14 | Model params: 116138 | Timestamp: 2022-02-16 01:39:45.348102

[32m[I 2022-02-16 01:40:22,133][0m Trial 14 pruned. [0m
++++++++++++++++++++
        NaN         
++++++++++++++++++++

Trial Id: 15 | Model params: 94076 | Timestamp: 2022-02-16 01:40:22.134061

[32m[I 2022-02-16 01:40:56,703][0m Trial 15 pruned. [0m
epoch 0 -0.13327776433028982 5.213920942119879

Trial Id: 16 | Model params: 56420 | Timestamp: 2022-02-16 01:40:56.703523

[32m[I 2022-02-16 01:41:27,392][0m Trial 16 pruned. [0m
epoch 0 -0.00010178376071290351 4.8979952411130885

Trial Id: 17 | Model params: 191164 | Timestamp: 2022-02-16 01:41:27.392230

[32m[I 2022-02-16 01:42:13,016][0m Trial 17 pruned. [0m
epoch 0 0.0040791557069125295 4.88774644985244

Trial Id: 18 | Model params: 180467 | Timestamp: 2022-02-16 01:42:13.016893

[32m[I 2022-02-16 01:43:16,253][0m Trial 18 pruned. [0m
++++++++++++++++++++
        NaN         
++++++++++++++++++++

Trial Id: 19 | Model params: 72638 | Timestamp: 2022-02-16 01:43:16.253621

[32m[I 2022-02-16 01:43:41,158][0m Trial 19 pruned. [0m
epoch 0 -0.14316378838152266 5.236613094666308

Trial Id: 20 | Model params: 36632 | Timestamp: 2022-02-16 01:43:41.158604

[32m[I 2022-02-16 01:43:57,524][0m Trial 20 pruned. [0m
epoch 0 -0.016967314586606497 4.939122018675861

Trial Id: 21 | Model params: 68117 | Timestamp: 2022-02-16 01:43:57.524189

[32m[I 2022-02-16 01:44:35,888][0m Trial 21 pruned. [0m
epoch 0 0.0026756582093614423 4.891189255983074

Trial Id: 22 | Model params: 63857 | Timestamp: 2022-02-16 01:44:35.888252

[32m[I 2022-02-16 01:45:11,390][0m Trial 22 pruned. [0m
epoch 0 0.0001422147533790552 4.897397713700071

Trial Id: 23 | Model params: 78154 | Timestamp: 2022-02-16 01:45:11.390936

[32m[I 2022-02-16 01:45:39,887][0m Trial 23 pruned. [0m
epoch 0 0.0013055080685497877 4.894547924380525

Trial Id: 24 | Model params: 103987 | Timestamp: 2022-02-16 01:45:39.887635

[32m[I 2022-02-16 01:46:23,857][0m Trial 24 pruned. [0m
epoch 0 -0.03319519148200256 4.978373153950552

Trial Id: 25 | Model params: 135186 | Timestamp: 2022-02-16 01:46:23.858065

[32m[I 2022-02-16 01:46:59,280][0m Trial 25 pruned. [0m
epoch 0 0.0016567152233917248 4.893687225027608

Trial Id: 26 | Model params: 145138 | Timestamp: 2022-02-16 01:46:59.280965

[32m[I 2022-02-16 01:47:54,818][0m Trial 26 pruned. [0m
epoch 0 0.0033662240915421915 4.8894955876457225

Trial Id: 27 | Model params: 87424 | Timestamp: 2022-02-16 01:47:54.818680

[32m[I 2022-02-16 01:48:41,090][0m Trial 27 pruned. [0m
++++++++++++++++++++
        NaN         
++++++++++++++++++++

Trial Id: 28 | Model params: 145996 | Timestamp: 2022-02-16 01:48:41.090705

[32m[I 2022-02-16 01:49:24,276][0m Trial 28 pruned. [0m
epoch 0 -0.0009044296936193685 4.899960324841782

Trial Id: 29 | Model params: 72452 | Timestamp: 2022-02-16 01:49:24.276749

epoch 0 -1.7907410387164187 8.18193504380443
epoch 5 -1.7571176494412795 8.132496912396322
epoch 10 -1.754964845612386 8.129321297202532
epoch 15 -1.7488418169082882 8.120282387709521
epoch 20 -1.7671141484330595 8.147226595981122
epoch 25 -1.753289339936106 8.126848888964457
epoch 30 -1.7245292349938617 8.084292046200497
epoch 35 -1.7653524103692142 8.144632636400614
epoch 40 -1.7159881468232032 8.071610433139606
epoch 45 -1.7491256137056443 8.120701555273733
epoch 50 -1.7330120241193043 8.096867438680542
epoch 55 -1.777523462392118 8.162536306385737
epoch 60 -1.7570614705335021 8.132414058274831
epoch 65 -1.7363617955089774 8.101827963713841
epoch 70 -1.7658935597334424 8.145429505391796
epoch 75 -1.7184699819778793 8.075297458118317
epoch 80 -1.725722385689132 8.086062025898485
epoch 85 -1.7409027088641564 8.108547551864165
epoch 90 -1.7425380220577704 8.110966104974189
epoch 95 -1.7111867324761172 8.064472646198338
[32m[I 2022-02-16 03:42:32,858][0m Trial 29 finished with value: 8.120446386951732 and parameters: {'n_layers_fe': 4, 'fe_n_units_l0': 61, 'fe_dropout_l0': 0.48133988303199426, 'fe_n_units_l1': 197, 'fe_dropout_l1': 0.14170170434353963, 'fe_n_units_l2': 211, 'fe_dropout_l2': 0.3324403832319839, 'fe_n_units_l3': 26, 'fe_dropout_l3': 0.1852404626129336, 'n_units_l(Invariant)': 177, 'n_layers_mlp': 2, 'mlp_n_units_l0': 63, 'mlp_dropout_l0': 0.3756626666490315, 'mlp_n_units_l1': 95, 'mlp_dropout_l1': 0.23663496214638652, 'reduction': 'sum', 'lr': 0.0028579032745450414, 'weight_decay': 0.06224082007336963, 'criterion': 'PoissonNLLLoss', 'batch_size': 32}. Best is trial 6 with value: 4.88624705994685.[0m

Trial Id: 30 | Model params: 95633 | Timestamp: 2022-02-16 03:42:32.858620

epoch 0 -3.0764760013906596 9.888688643543524
epoch 5 0.0012537359474095178 4.894674788925256
epoch 10 0.0030083617196329238 4.890373347102748
epoch 15 0.004173755161288595 4.887514308347206
epoch 20 0.004378111487020386 4.887012792285638
epoch 25 0.004565778661232978 4.886552188157793
epoch 30 0.002129988560025331 4.892527139980734
epoch 35 0.004209850867578746 4.887425728697611
epoch 40 0.004647824128775735 4.886350804825867
epoch 45 0.0046669274717112685 4.886303913843317
epoch 50 0.004707886251045235 4.886203375084844
epoch 55 0.0036340543778791146 4.888838554426726
epoch 60 0.004380074474291451 4.88700797461904
epoch 65 0.0027041162556151743 4.891119471923257
epoch 70 0.003630071521666167 4.888848325696828
epoch 75 0.0009536700770826911 4.895410017983464
epoch 80 0.003726253691545778 4.888612353406229
epoch 85 0.004105240751424932 4.887682439786128
epoch 90 0.00451310844325592 4.886681464587579
epoch 95 0.0035372477227025856 4.889076047797028
[32m[I 2022-02-16 04:45:00,558][0m Trial 30 finished with value: 4.886763336028969 and parameters: {'n_layers_fe': 2, 'fe_n_units_l0': 234, 'fe_dropout_l0': 0.19380476591854737, 'fe_n_units_l1': 59, 'fe_dropout_l1': 0.2894373210190646, 'n_units_l(Invariant)': 501, 'n_layers_mlp': 4, 'mlp_n_units_l0': 143, 'mlp_dropout_l0': 0.07248656736138881, 'mlp_n_units_l1': 143, 'mlp_dropout_l1': 0.31906885464181006, 'mlp_n_units_l2': 110, 'mlp_dropout_l2': 0.24757254114486912, 'mlp_n_units_l3': 90, 'mlp_dropout_l3': 0.11272590717201636, 'reduction': 'sum', 'lr': 4.256113992578161e-05, 'weight_decay': 0.26760170376747683, 'criterion': 'MSELoss', 'batch_size': 256}. Best is trial 6 with value: 4.88624705994685.[0m

Trial Id: 31 | Model params: 90478 | Timestamp: 2022-02-16 04:45:00.558837

epoch 0 -3.0764760013906596 9.888688643543524
epoch 5 -3.0764760013906596 9.888688643543524
epoch 10 -0.0013805412001817174 4.901125595998864
epoch 15 0.0031307688051585014 4.890073126568949
epoch 20 0.0011679670501664186 4.894884953339146
epoch 25 0.001761920269513162 4.893429370759339
epoch 30 0.0034060866621717922 4.889397803576539
epoch 35 0.001620376051861827 4.8937762880402875
epoch 40 0.004579430093905157 4.88651868083733
epoch 45 0.003878690810778629 4.888238342500781
epoch 50 0.004682686707258243 4.886265230953507
epoch 55 0.0047760423987728284 4.886036072191594
epoch 60 0.004809047512689069 4.885955052480918
epoch 65 0.0038598273016287044 4.888284626468061
epoch 70 0.0022834520438937966 4.8921509120547775
epoch 75 0.0030862638732370717 4.890182283284695
epoch 80 0.00478627626393302 4.886010950628506
epoch 85 0.004276797796255893 4.8872614352259784
epoch 90 0.0036277234767875255 4.888854086222203
epoch 95 0.004782272125708031 4.886020779795382
[32m[I 2022-02-16 05:46:08,447][0m Trial 31 finished with value: 4.88681048303989 and parameters: {'n_layers_fe': 2, 'fe_n_units_l0': 231, 'fe_dropout_l0': 0.20300825515325338, 'fe_n_units_l1': 54, 'fe_dropout_l1': 0.2897169302758955, 'n_units_l(Invariant)': 495, 'n_layers_mlp': 4, 'mlp_n_units_l0': 148, 'mlp_dropout_l0': 0.06977158872644106, 'mlp_n_units_l1': 140, 'mlp_dropout_l1': 0.3241992176232508, 'mlp_n_units_l2': 111, 'mlp_dropout_l2': 0.24585772695970312, 'mlp_n_units_l3': 79, 'mlp_dropout_l3': 0.12239448521485558, 'reduction': 'sum', 'lr': 4.0590010388479745e-05, 'weight_decay': 0.2624092289400029, 'criterion': 'MSELoss', 'batch_size': 256}. Best is trial 6 with value: 4.88624705994685.[0m

Trial Id: 32 | Model params: 61146 | Timestamp: 2022-02-16 05:46:08.447355

[32m[I 2022-02-16 05:46:41,710][0m Trial 32 pruned. [0m
epoch 0 -0.1467206122238227 5.244753330146343

Trial Id: 33 | Model params: 97463 | Timestamp: 2022-02-16 05:46:41.710806

[32m[I 2022-02-16 05:47:19,497][0m Trial 33 pruned. [0m
epoch 0 -0.1522181739180335 5.257310390410334

Trial Id: 34 | Model params: 89687 | Timestamp: 2022-02-16 05:47:19.497326

epoch 0 -1.8378970832136083 8.250771860012497
epoch 5 -1.7559576342271899 8.130785920367812
epoch 10 -1.7537671750715638 8.12755406829504
epoch 15 -1.747842102106441 8.118805637632487
epoch 20 -1.750992888734829 8.123458979154378
epoch 25 -1.7484289573287857 8.119672555917168
epoch 30 -1.7536918797508685 8.127442953060092
epoch 35 -1.75210344802885 8.125098509485387
epoch 40 -1.7481312051347717 8.119232719952956
epoch 45 -1.7523318140964155 8.125435607697742
epoch 50 -1.746548768297234 8.116894763339879
epoch 55 -1.7493584213354954 8.12104539573866
epoch 60 -1.7474938200603312 8.118291102273663
epoch 65 -1.7463489555341312 8.116599503942332
epoch 70 -1.7489553958082027 8.120450146219325
epoch 75 -1.7505755053549437 8.122842706136208
epoch 80 -1.7472709171723828 8.117961779014957
epoch 85 -1.7531444901093005 8.126635110463218
epoch 90 -1.7491728693109434 8.120771349650617
epoch 95 -1.7480707051944662 8.119143347255338
[32m[I 2022-02-16 07:38:31,733][0m Trial 34 finished with value: 8.125899416137779 and parameters: {'n_layers_fe': 2, 'fe_n_units_l0': 202, 'fe_dropout_l0': 0.1677935703906333, 'fe_n_units_l1': 30, 'fe_dropout_l1': 0.21963950667326637, 'n_units_l(Invariant)': 456, 'n_layers_mlp': 4, 'mlp_n_units_l0': 172, 'mlp_dropout_l0': 0.22174250133960238, 'mlp_n_units_l1': 163, 'mlp_dropout_l1': 0.32901386965637525, 'mlp_n_units_l2': 160, 'mlp_dropout_l2': 0.3375894172795019, 'mlp_n_units_l3': 58, 'mlp_dropout_l3': 0.2121900016496197, 'reduction': 'sum', 'lr': 2.4277908508310803e-05, 'weight_decay': 0.2711324946277996, 'criterion': 'PoissonNLLLoss', 'batch_size': 32}. Best is trial 6 with value: 4.88624705994685.[0m

Trial Id: 35 | Model params: 88434 | Timestamp: 2022-02-16 07:38:31.733236

[32m[I 2022-02-16 07:39:05,892][0m Trial 35 pruned. [0m
epoch 0 -0.16336374274611298 5.282676547710101

Trial Id: 36 | Model params: 102966 | Timestamp: 2022-02-16 07:39:05.892428

[32m[I 2022-02-16 07:39:47,695][0m Trial 36 pruned. [0m
++++++++++++++++++++
        NaN         
++++++++++++++++++++

Trial Id: 37 | Model params: 80665 | Timestamp: 2022-02-16 07:39:47.695736

[32m[I 2022-02-16 07:40:54,773][0m Trial 37 pruned. [0m
epoch 0 -1.766108115208024 8.145745427274676

Trial Id: 38 | Model params: 102317 | Timestamp: 2022-02-16 07:40:54.773233

[32m[I 2022-02-16 07:41:34,279][0m Trial 38 pruned. [0m
epoch 0 -0.14764270687276637 5.246861597458161

Trial Id: 39 | Model params: 35849 | Timestamp: 2022-02-16 07:41:34.279625

