[32m[I 2022-02-16 07:42:02,188][0m Trial 39 pruned. [0m
++++++++++++++++++++
        NaN         
++++++++++++++++++++

Trial Id: 40 | Model params: 66582 | Timestamp: 2022-02-16 07:42:02.188594

[32m[I 2022-02-16 07:42:36,043][0m Trial 40 pruned. [0m
epoch 0 -0.16663230608751145 5.290092393328518

Trial Id: 41 | Model params: 139952 | Timestamp: 2022-02-16 07:42:36.043635

[32m[I 2022-02-16 07:43:18,767][0m Trial 41 pruned. [0m
epoch 0 -0.20192215840450678 5.369507196753368

Trial Id: 42 | Model params: 114079 | Timestamp: 2022-02-16 07:43:18.767861

epoch 0 -3.0764760013906596 9.888688643543524
epoch 5 -3.0764760013906596 9.888688643543524
epoch 10 -3.0764760013906596 9.888688643543524
epoch 15 -0.0006074182295572328 4.899233256238319
epoch 20 0.002823332689530278 4.890827121750258
epoch 25 0.0032563049877060157 4.889765212340445
epoch 30 0.0036464306866610396 4.888808191103042
epoch 35 0.004299174210005696 4.88720652036704
epoch 40 0.00450917678174545 4.8866911145179905
epoch 45 0.0028956942621353177 4.890649663545425
epoch 50 0.0022922138921211976 4.892129430814443
epoch 55 0.004546314000891782 4.886599963596682
epoch 60 0.0030524384790501236 4.890265244795954
epoch 65 0.004457598071334723 4.886817708332446
epoch 70 0.004611012525118308 4.88644116115926
epoch 75 0.003935282102163984 4.888099486094971
epoch 80 0.004632562997305523 4.886388264409526
epoch 85 0.004625339026513298 4.88640599608365
epoch 90 0.004031625151784235 4.887863082881879
epoch 95 0.0026058526395489334 4.891360427117941
[32m[I 2022-02-16 08:51:16,546][0m Trial 42 finished with value: 4.886326762300521 and parameters: {'n_layers_fe': 2, 'fe_n_units_l0': 150, 'fe_dropout_l0': 0.2632193724049121, 'fe_n_units_l1': 111, 'fe_dropout_l1': 0.45798365159616816, 'n_units_l(Invariant)': 469, 'n_layers_mlp': 4, 'mlp_n_units_l0': 55, 'mlp_dropout_l0': 0.032742301120875256, 'mlp_n_units_l1': 139, 'mlp_dropout_l1': 0.37174331803150706, 'mlp_n_units_l2': 173, 'mlp_dropout_l2': 0.19793844449836737, 'mlp_n_units_l3': 58, 'mlp_dropout_l3': 0.13848278285174576, 'reduction': 'sum', 'lr': 3.05685870467229e-05, 'weight_decay': 0.29807672703508875, 'criterion': 'MSELoss', 'batch_size': 256}. Best is trial 6 with value: 4.88624705994685.[0m

Trial Id: 43 | Model params: 124143 | Timestamp: 2022-02-16 08:51:16.547041

[32m[I 2022-02-16 08:51:58,600][0m Trial 43 pruned. [0m
epoch 0 -0.1673024232116862 5.291611497748509

Trial Id: 44 | Model params: 131001 | Timestamp: 2022-02-16 08:51:58.600941

epoch 0 -3.0764760013906596 9.888688643543524
epoch 5 0.002380135218095658 4.8919138707132
epoch 10 0.004550519932040142 4.886589640301387
epoch 15 0.004684335256852967 4.886261184377709
epoch 20 0.003940170355278716 4.888087491745394
epoch 25 0.003797391036636233 4.888437818488806
epoch 30 0.004560492265136995 4.886565163508429
epoch 35 0.00435510622120816 4.887069252664911
epoch 40 0.0038163797143012657 4.888391228863601
epoch 45 0.004233006603584055 4.8873689031717005
epoch 50 0.004657055413845423 4.886328145809837
epoch 55 0.0021179837118004974 4.892556569600038
epoch 60 0.004445187644037452 4.886848167761777
epoch 65 0.0037892157481363986 4.888457876811847
epoch 70 0.003940250443025151 4.8880872952331424
epoch 75 -0.000758912226457964 4.899604119137958
epoch 80 0.00339033992730009 4.889436431018337
epoch 85 0.004629549125419685 4.8863956621485505
epoch 90 0.0044193069323760215 4.8869116872610725
epoch 95 -0.0028580243133176086 4.904739936864291
[32m[I 2022-02-16 10:06:55,843][0m Trial 44 finished with value: 4.886981813469147 and parameters: {'n_layers_fe': 2, 'fe_n_units_l0': 190, 'fe_dropout_l0': 0.20183190229760883, 'fe_n_units_l1': 90, 'fe_dropout_l1': 0.45790902023799723, 'n_units_l(Invariant)': 512, 'n_layers_mlp': 4, 'mlp_n_units_l0': 161, 'mlp_dropout_l0': 0.03325871895494504, 'mlp_n_units_l1': 134, 'mlp_dropout_l1': 0.44805360785566056, 'mlp_n_units_l2': 161, 'mlp_dropout_l2': 0.18655784179112145, 'mlp_n_units_l3': 113, 'mlp_dropout_l3': 0.11517390720761915, 'reduction': 'sum', 'lr': 0.0001968402225626583, 'weight_decay': 0.2823145074387976, 'criterion': 'MSELoss', 'batch_size': 256}. Best is trial 6 with value: 4.88624705994685.[0m

Trial Id: 45 | Model params: 124727 | Timestamp: 2022-02-16 10:06:55.843849

[32m[I 2022-02-16 10:07:32,488][0m Trial 45 pruned. [0m
epoch 0 -0.07386088772972466 5.07539994065323

Trial Id: 46 | Model params: 113345 | Timestamp: 2022-02-16 10:07:32.489273

[32m[I 2022-02-16 10:08:16,084][0m Trial 46 pruned. [0m
++++++++++++++++++++
        NaN         
++++++++++++++++++++

Trial Id: 47 | Model params: 101301 | Timestamp: 2022-02-16 10:08:16.085207

[32m[I 2022-02-16 10:09:00,314][0m Trial 47 pruned. [0m
epoch 0 -1.7579942606260266 8.133789652150234

Trial Id: 48 | Model params: 114422 | Timestamp: 2022-02-16 10:09:00.314799

[32m[I 2022-02-16 10:09:47,411][0m Trial 48 pruned. [0m
++++++++++++++++++++
        NaN         
++++++++++++++++++++

Trial Id: 49 | Model params: 81993 | Timestamp: 2022-02-16 10:09:47.411695

[32m[I 2022-02-16 10:11:06,468][0m Trial 49 pruned. [0m
epoch 0 -0.12775156188425196 5.201193085408157

Study statistics: 
  Number of finished trials:  50
  Number of pruned trials:  39
  Number of complete trials:  11

Best trial:
  Value:  4.88624705994685
  Params: 
    n_layers_fe: 2
    fe_n_units_l0: 242
    fe_dropout_l0: 0.17999225566897487
    fe_n_units_l1: 104
    fe_dropout_l1: 0.4798197051105028
    n_units_l(Invariant): 156
    n_layers_mlp: 2
    mlp_n_units_l0: 99
    mlp_dropout_l0: 0.0578668535559555
    mlp_n_units_l1: 249
    mlp_dropout_l1: 0.35358443032233555
    reduction: sum
    lr: 0.003711155095942949
    weight_decay: 0.29138245448911465
    criterion: MSELoss
    batch_size: 128
Target: 132567, NaN: 0, Max: 227.0, Min: 0.0, Mean: 8.573823047968197
Prediction: 132567, NaN: 0, Max: 9.832650184631348, Min: 8.206441879272461, Mean: 8.566607104211982

 XXXXXX======== TRIAL south - lrg ended

Test Set - R-squared:  0.005613048201920656
Test Set - RMSE:  4.888748420968906
Test Set - MAE:  3.309265291114325



[32m[I 2022-02-16 10:11:58,780][0m A new study created in memory with name: DeepSet[0m
Starting Loading south
Finished Loading south
Finished south setup

++++++++ Session Characteristics +++++++

Area: south
Gal Type: elg
Training Set: 232361
Validation Set: 58091
Test Samples: 132567
Number of features: 5
Device: cuda:0
Number of Workers: 8
Number of Trials: 50

+++++++++++++++++++++++++++++++++++++++

Trial Id: 0 | Model params: 192110 | Timestamp: 2022-02-16 10:11:58.781728

[32m[I 2022-02-16 10:13:14,890][0m Trial 0 pruned. [0m
++++++++++++++++++++
        NaN         
++++++++++++++++++++

Trial Id: 1 | Model params: 51050 | Timestamp: 2022-02-16 10:13:14.891230

epoch 0 -14.041015526490057 30.623569649830774
epoch 5 -13.882788402538157 30.4620682514199
epoch 10 -13.88807306289011 30.46747608871321
epoch 15 -13.883278383550943 30.462569693481772
epoch 20 -13.862420493638185 30.441216612630658
epoch 25 -13.870623975787383 30.449616641656803
epoch 30 -13.87464999753763 30.45373827511193
epoch 35 -13.846056492435753 30.424453619750143
epoch 40 -13.875840641480853 30.45495708810787
epoch 45 -13.854163722111124 30.43275967625781
epoch 50 -13.906460127553169 30.486284251143072
epoch 55 -13.887884601562844 30.467283251160318
epoch 60 -13.893386671226885 30.472912581127456
epoch 65 -13.856341096790134 30.43499006409603
epoch 70 -13.881031390402706 30.46027007348785
epoch 75 -13.853596323721042 30.43217843640924
epoch 80 -13.876672618525456 30.455808719674057
epoch 85 -13.858184322139977 30.43687803923456
epoch 90 -13.849351673409002 30.427829887324723
epoch 95 -13.883336415898192 30.462629082705494
[32m[I 2022-02-16 11:12:34,099][0m Trial 1 finished with value: 30.47258224135451 and parameters: {'n_layers_fe': 4, 'fe_n_units_l0': 51, 'fe_dropout_l0': 0.2472795429200631, 'fe_n_units_l1': 14, 'fe_dropout_l1': 0.07640695278600468, 'fe_n_units_l2': 23, 'fe_dropout_l2': 0.22768141769598849, 'fe_n_units_l3': 66, 'fe_dropout_l3': 0.46944063997180424, 'n_units_l(Invariant)': 395, 'n_layers_mlp': 2, 'mlp_n_units_l0': 237, 'mlp_dropout_l0': 0.2579132591960545, 'mlp_n_units_l1': 66, 'mlp_dropout_l1': 0.3198014690535183, 'reduction': 'sum', 'lr': 0.0025495600504183685, 'weight_decay': 0.2529513114819819, 'criterion': 'PoissonNLLLoss', 'batch_size': 128}. Best is trial 1 with value: 30.47258224135451.[0m

Trial Id: 2 | Model params: 49405 | Timestamp: 2022-02-16 11:12:34.099923

[32m[I 2022-02-16 11:14:11,712][0m Trial 2 pruned. [0m
++++++++++++++++++++
        NaN         
++++++++++++++++++++

Trial Id: 3 | Model params: 188950 | Timestamp: 2022-02-16 11:14:11.713053

epoch 0 -17.34435901560765 33.819602899398745
epoch 5 0.05232780368364198 7.686812767100018
epoch 10 0.06534066999145371 7.633854990915398
epoch 15 0.071154291657337 7.61007650247189
epoch 20 0.07303586645750026 7.602364679663549
epoch 25 0.07188974422606564 7.607063107143803
epoch 30 0.07538660996751168 7.592718915960573
epoch 35 0.07861072696613514 7.579469490910514
epoch 40 0.07698255836762602 7.586163299738132
epoch 45 0.0802158026253349 7.57286483143314
epoch 50 0.07868251751688538 7.579174205896559
epoch 55 0.08095378660862318 7.569826197791883
epoch 60 0.08089012818896923 7.570088358073692
epoch 65 0.08025668034280031 7.572696550183374
epoch 70 0.07668217309167269 7.587397613567791
epoch 75 0.08203851727195977 7.565357626578132
epoch 80 0.08238647044108527 7.56392366681493
epoch 85 0.08351677485675879 7.559263659922254
epoch 90 0.0838732014463266 7.557793592329585
epoch 95 0.08241260013412521 7.563815972015186
[32m[I 2022-02-16 13:02:23,692][0m Trial 3 finished with value: 7.553339873511836 and parameters: {'n_layers_fe': 4, 'fe_n_units_l0': 183, 'fe_dropout_l0': 0.44069889477390023, 'fe_n_units_l1': 232, 'fe_dropout_l1': 0.4175991160029714, 'fe_n_units_l2': 232, 'fe_dropout_l2': 0.12196527937482526, 'fe_n_units_l3': 101, 'fe_dropout_l3': 0.1697912432830686, 'n_units_l(Invariant)': 220, 'n_layers_mlp': 4, 'mlp_n_units_l0': 223, 'mlp_dropout_l0': 0.39352694054007714, 'mlp_n_units_l1': 43, 'mlp_dropout_l1': 0.23490420116804023, 'mlp_n_units_l2': 138, 'mlp_dropout_l2': 0.19812385858975895, 'mlp_n_units_l3': 172, 'mlp_dropout_l3': 0.18860190833620055, 'reduction': 'sum', 'lr': 4.1666689967487594e-05, 'weight_decay': 0.09461892932574688, 'criterion': 'MSELoss', 'batch_size': 128}. Best is trial 3 with value: 7.553339873511836.[0m

Trial Id: 4 | Model params: 41714 | Timestamp: 2022-02-16 13:02:23.692276

epoch 0 -0.9092326008100642 10.910550253875895
epoch 5 -0.06292442869953341 8.140825158227374
epoch 10 -0.013225074032563677 7.94822582099736
epoch 15 0.00585072319147284 7.873050437924727
epoch 20 0.05625628317489406 7.670863767742186
epoch 25 0.07093142354077053 7.6109894321847795
epoch 30 0.06024194878284794 7.654648641971758
epoch 35 0.058655889793835514 7.661105413488113
epoch 40 0.06495325046470868 7.635436956655435
epoch 45 0.06935095363736443 7.6174603368495095
epoch 50 0.06898969972256641 7.618938644049219
epoch 55 0.05710513884186896 7.667413190581151
epoch 60 0.06891221759052746 7.619255675626611
epoch 65 0.07104515410540446 7.610523573883545
epoch 70 0.0724778620215285 7.6046525324734215
epoch 75 0.07109788710344633 7.610307561543406
epoch 80 0.06306317880104284 7.643150067017449
epoch 85 0.06819954134281803 7.622171095617745
epoch 90 0.07238941633524065 7.6050151020829215
epoch 95 0.07243762474317739 7.6048174812060045
[32m[I 2022-02-16 13:40:36,767][0m Trial 4 finished with value: 7.6428913161431105 and parameters: {'n_layers_fe': 2, 'fe_n_units_l0': 104, 'fe_dropout_l0': 0.18595786291908295, 'fe_n_units_l1': 118, 'fe_dropout_l1': 0.20485422339312215, 'n_units_l(Invariant)': 81, 'n_layers_mlp': 2, 'mlp_n_units_l0': 80, 'mlp_dropout_l0': 0.24902126112511314, 'mlp_n_units_l1': 209, 'mlp_dropout_l1': 0.24573560861141253, 'reduction': 'sum', 'lr': 6.80436430178349e-05, 'weight_decay': 0.22548884106739703, 'criterion': 'MSELoss', 'batch_size': 128}. Best is trial 3 with value: 7.553339873511836.[0m

Trial Id: 5 | Model params: 110625 | Timestamp: 2022-02-16 13:40:36.767228

[32m[I 2022-02-16 13:40:52,400][0m Trial 5 pruned. [0m
++++++++++++++++++++
        NaN         
++++++++++++++++++++

Trial Id: 6 | Model params: 33988 | Timestamp: 2022-02-16 13:40:52.400315

[32m[I 2022-02-16 13:41:15,451][0m Trial 6 pruned. [0m
++++++++++++++++++++
        NaN         
++++++++++++++++++++

Trial Id: 7 | Model params: 138340 | Timestamp: 2022-02-16 13:41:15.451733

[32m[I 2022-02-16 13:42:02,042][0m Trial 7 pruned. [0m
++++++++++++++++++++
        NaN         
++++++++++++++++++++

Trial Id: 8 | Model params: 68428 | Timestamp: 2022-02-16 13:42:02.043057

epoch 0 -0.10511857133259861 8.300832909256089
epoch 5 0.05771751624500088 7.664922927145527
epoch 10 0.07915647548811722 7.577224458818559
epoch 15 0.08002109805126123 7.573666320197077
epoch 20 0.08174325503572277 7.566574227088681
epoch 25 0.08495961131981522 7.5533109719667175
epoch 30 0.08257495425553396 7.563146787247789
epoch 35 0.08437695111785148 7.555715408632877
epoch 40 0.0864986661313939 7.546956142162302
epoch 45 0.08558008550090457 7.5507496483081225
epoch 50 0.08700799658513791 7.544851913956929
epoch 55 0.08767282034241719 7.54210440343644
epoch 60 0.08847615616191962 7.538783129501063
epoch 65 0.09012204058678919 7.5319738880515565
epoch 70 0.09350302888714479 7.5179669456796745
epoch 75 0.09509499208703043 7.511362629106344
epoch 80 0.09371974160470287 7.517068246354228
epoch 85 0.09600910966961662 7.507567753673108
epoch 90 0.09258245788928599 7.521783321451941
epoch 95 0.09418746238110243 7.515128259960184
[32m[I 2022-02-16 15:46:59,588][0m Trial 8 finished with value: 7.515034511885051 and parameters: {'n_layers_fe': 4, 'fe_n_units_l0': 33, 'fe_dropout_l0': 0.3557684640363649, 'fe_n_units_l1': 176, 'fe_dropout_l1': 0.48835018778365025, 'fe_n_units_l2': 172, 'fe_dropout_l2': 0.39032118780804775, 'fe_n_units_l3': 70, 'fe_dropout_l3': 0.2655593924859925, 'n_units_l(Invariant)': 131, 'n_layers_mlp': 4, 'mlp_n_units_l0': 22, 'mlp_dropout_l0': 0.3750635015131034, 'mlp_n_units_l1': 212, 'mlp_dropout_l1': 0.3797109250734603, 'mlp_n_units_l2': 20, 'mlp_dropout_l2': 0.1924715324396163, 'mlp_n_units_l3': 28, 'mlp_dropout_l3': 0.2786072992560561, 'reduction': 'sum', 'lr': 0.00032053895132660195, 'weight_decay': 0.019453572616387547, 'criterion': 'MSELoss', 'batch_size': 32}. Best is trial 8 with value: 7.515034511885051.[0m

Trial Id: 9 | Model params: 161442 | Timestamp: 2022-02-16 15:46:59.589102

[32m[I 2022-02-16 15:47:49,272][0m Trial 9 pruned. [0m
++++++++++++++++++++
        NaN         
++++++++++++++++++++

Trial Id: 10 | Model params: 41984 | Timestamp: 2022-02-16 15:47:49.272626

epoch 0 -1.3877754578827406 12.20152110080179
epoch 5 0.06783039504903787 7.623680763040577
epoch 10 0.0665723249675313 7.628823545388593
epoch 15 0.0779002712264385 7.5823910790664035
epoch 20 0.07699692312474404 7.586104268449919
epoch 25 0.07705357882398567 7.585871440061668
epoch 30 0.07426612930534249 7.597318091652132
epoch 35 0.07879888934653789 7.578695527135109
epoch 40 0.07326197743610208 7.601437414576367
epoch 45 0.07093610595062294 7.610970252859534
epoch 50 0.06499010399684246 7.635286485251677
epoch 55 0.07564686378094343 7.591650267624313
epoch 60 0.07226413774087093 7.6055286330046235
epoch 65 0.07606383727414134 7.589937786821792
epoch 70 0.06343424570671907 7.641636410577372
epoch 75 0.06721624914359148 7.626191723159425
epoch 80 0.07114705127298326 7.610106162818581
epoch 85 0.07321115386187971 7.60164584830447
epoch 90 0.06893100972477795 7.619178785562796
epoch 95 0.07538420297986381 7.592728798776974
[32m[I 2022-02-16 17:55:20,293][0m Trial 10 finished with value: 7.586769201471519 and parameters: {'n_layers_fe': 4, 'fe_n_units_l0': 77, 'fe_dropout_l0': 0.01686415619055831, 'fe_n_units_l1': 168, 'fe_dropout_l1': 0.23371362904888027, 'fe_n_units_l2': 109, 'fe_dropout_l2': 0.45949491129809916, 'fe_n_units_l3': 10, 'fe_dropout_l3': 0.36413373744131566, 'n_units_l(Invariant)': 285, 'n_layers_mlp': 4, 'mlp_n_units_l0': 16, 'mlp_dropout_l0': 0.49283544210950914, 'mlp_n_units_l1': 125, 'mlp_dropout_l1': 0.4840171471392854, 'mlp_n_units_l2': 20, 'mlp_dropout_l2': 0.4403574086517299, 'mlp_n_units_l3': 21, 'mlp_dropout_l3': 0.07018543596188939, 'reduction': 'sum', 'lr': 0.0004797835188929896, 'weight_decay': 0.018047208299486, 'criterion': 'MSELoss', 'batch_size': 32}. Best is trial 8 with value: 7.515034511885051.[0m

Trial Id: 11 | Model params: 210151 | Timestamp: 2022-02-16 17:55:20.293213

epoch 0 -5.795688663874609 20.584198925805094
epoch 5 -4.644053145150408 18.759133776864253
epoch 10 -0.024344176254563532 7.991718622820916
epoch 15 0.01205290615055954 7.848453278430702
epoch 20 0.032324892842752084 7.7675135203537655
epoch 25 0.025659724002260798 7.794218219976984
epoch 30 0.022703427165731593 7.806033687041211
epoch 35 0.021971708766108877 7.80895539468964
epoch 40 0.018608854931606134 7.822369035749282
epoch 45 0.028568559647461855 7.7825749331266385
epoch 50 0.040006250586754555 7.7366230249065175
epoch 55 0.044047403274979025 7.720321956673948
epoch 60 0.031610281147306685 7.7703810797021955
epoch 65 0.041029666940073484 7.73249805124205
epoch 70 0.030039899012771487 7.776678918467429
epoch 75 0.04294259274857504 7.724781921528661
epoch 80 0.042428834826245376 7.726855013183459
epoch 85 0.037979584108958964 7.744785207158017
epoch 90 0.04797488056314314 7.704446380408258
epoch 95 0.047298679337069216 7.707182038963192
[32m[I 2022-02-16 20:09:12,601][0m Trial 11 finished with value: 7.673407708675409 and parameters: {'n_layers_fe': 4, 'fe_n_units_l0': 253, 'fe_dropout_l0': 0.49498764035338405, 'fe_n_units_l1': 251, 'fe_dropout_l1': 0.49136981301367794, 'fe_n_units_l2': 255, 'fe_dropout_l2': 0.0437778616760551, 'fe_n_units_l3': 97, 'fe_dropout_l3': 0.0912335262830149, 'n_units_l(Invariant)': 208, 'n_layers_mlp': 4, 'mlp_n_units_l0': 10, 'mlp_dropout_l0': 0.37343025865516444, 'mlp_n_units_l1': 125, 'mlp_dropout_l1': 0.3895728950029153, 'mlp_n_units_l2': 142, 'mlp_dropout_l2': 0.012592826998430479, 'mlp_n_units_l3': 109, 'mlp_dropout_l3': 0.2125665259672105, 'reduction': 'sum', 'lr': 1.1753326202558359e-05, 'weight_decay': 0.007311407193111415, 'criterion': 'MSELoss', 'batch_size': 32}. Best is trial 8 with value: 7.515034511885051.[0m

Trial Id: 12 | Model params: 140274 | Timestamp: 2022-02-16 20:09:12.602140

epoch 0 -3.7686291464760524 17.243046830831453
[32m[I 2022-02-16 20:11:44,444][0m Trial 12 pruned. [0m

Trial Id: 13 | Model params: 189397 | Timestamp: 2022-02-16 20:11:44.444800

[32m[I 2022-02-16 20:13:00,125][0m Trial 13 pruned. [0m
epoch 0 0.06685446289202357 7.62767051384247

Trial Id: 14 | Model params: 154877 | Timestamp: 2022-02-16 20:13:00.125768

[32m[I 2022-02-16 20:13:36,085][0m Trial 14 pruned. [0m
epoch 0 -0.881177329036066 10.8300908891746

Trial Id: 15 | Model params: 187707 | Timestamp: 2022-02-16 20:13:36.085742

[32m[I 2022-02-16 20:14:51,809][0m Trial 15 pruned. [0m
epoch 0 0.040090437621305486 7.73628378434873

Trial Id: 16 | Model params: 100071 | Timestamp: 2022-02-16 20:14:51.809392

[32m[I 2022-02-16 20:15:47,121][0m Trial 16 pruned. [0m
++++++++++++++++++++
        NaN         
++++++++++++++++++++

Trial Id: 17 | Model params: 87005 | Timestamp: 2022-02-16 20:15:47.121855

epoch 0 -6.368026174169372 21.43348608047991
epoch 5 -1.7050893953297632 12.986976186099076
epoch 10 -0.08221050677067887 8.214348161052804
epoch 15 -0.01960394240422625 7.9732060252403425
epoch 20 0.028465624696071168 7.782987251340124
epoch 25 0.04284148748408645 7.725189940675411
epoch 30 0.05178654081029932 7.689007614891963
epoch 35 0.03279032082138633 7.765645303995599
epoch 40 0.04797939100851123 7.704428129563327
epoch 45 0.04038150229209514 7.735110793838959
epoch 50 0.05830616667373123 7.66252838775396
epoch 55 0.04564654052868944 7.713861896877597
epoch 60 0.045469941466185215 7.714575572587283
epoch 65 0.06203637524363592 7.647337043390132
epoch 70 0.044582700503935535 7.718160110123986
epoch 75 0.04853139494085512 7.702194201410002
epoch 80 0.055158539644724947 7.6753237676686386
epoch 85 0.053449926781761414 7.682260504700462
epoch 90 0.0631954340259997 7.642610605773551
epoch 95 0.05369412093912973 7.681269493135869
[32m[I 2022-02-16 21:23:32,924][0m Trial 17 finished with value: 7.663900704117618 and parameters: {'n_layers_fe': 4, 'fe_n_units_l0': 130, 'fe_dropout_l0': 0.4149159148278429, 'fe_n_units_l1': 89, 'fe_dropout_l1': 0.3801030362271349, 'fe_n_units_l2': 81, 'fe_dropout_l2': 0.32023543437270174, 'fe_n_units_l3': 115, 'fe_dropout_l3': 0.230045569151848, 'n_units_l(Invariant)': 184, 'n_layers_mlp': 4, 'mlp_n_units_l0': 144, 'mlp_dropout_l0': 0.35072185698555824, 'mlp_n_units_l1': 8, 'mlp_dropout_l1': 0.43600442665425515, 'mlp_n_units_l2': 176, 'mlp_dropout_l2': 0.34355537465318897, 'mlp_n_units_l3': 170, 'mlp_dropout_l3': 0.018951892264300163, 'reduction': 'sum', 'lr': 4.989625878038336e-05, 'weight_decay': 0.10669600660747565, 'criterion': 'MSELoss', 'batch_size': 128}. Best is trial 8 with value: 7.515034511885051.[0m

Trial Id: 18 | Model params: 224501 | Timestamp: 2022-02-16 21:23:32.924450

[32m[I 2022-02-16 21:24:50,077][0m Trial 18 pruned. [0m
epoch 0 0.06340756910424683 7.641745239799582

Trial Id: 19 | Model params: 126406 | Timestamp: 2022-02-16 21:24:50.077662

[32m[I 2022-02-16 21:26:06,104][0m Trial 19 pruned. [0m
epoch 0 0.005319455112437144 7.875153815066332

Trial Id: 20 | Model params: 151796 | Timestamp: 2022-02-16 21:26:06.104787

[32m[I 2022-02-16 21:26:56,554][0m Trial 20 pruned. [0m
++++++++++++++++++++
        NaN         
++++++++++++++++++++

Trial Id: 21 | Model params: 36029 | Timestamp: 2022-02-16 21:26:56.554723

