[32m[I 2022-02-16 21:28:11,856][0m Trial 21 pruned. [0m
epoch 0 -3.3348680018630015 16.440127148194147

Trial Id: 22 | Model params: 118747 | Timestamp: 2022-02-16 21:28:11.857142

[32m[I 2022-02-16 21:29:28,129][0m Trial 22 pruned. [0m
epoch 0 -0.2103979477165996 8.687230053779603

Trial Id: 23 | Model params: 76463 | Timestamp: 2022-02-16 21:29:28.130064

[32m[I 2022-02-16 21:30:43,429][0m Trial 23 pruned. [0m
epoch 0 0.03519266089699813 7.755995214706103

Trial Id: 24 | Model params: 38591 | Timestamp: 2022-02-16 21:30:43.429900

[32m[I 2022-02-16 21:31:57,448][0m Trial 24 pruned. [0m
epoch 0 -0.026571694656855493 8.000403219958024

Trial Id: 25 | Model params: 120618 | Timestamp: 2022-02-16 21:31:57.449005

epoch 0 -5.80192781181483 20.593645974123152
epoch 5 -0.035465049819618955 8.034982877010334
epoch 10 0.02309368527307809 7.80447496259662
epoch 15 0.05226987756413615 7.6870476903322835
epoch 20 0.054184510415040577 7.6792789624124875
epoch 25 0.05659060462466148 7.669504944678232
epoch 30 0.06369846500341092 7.640558424215408
epoch 35 0.05746211012333269 7.665961647291928
epoch 40 0.07178814839988168 7.607479450303257
epoch 45 0.06575729196536051 7.632153415737672
epoch 50 0.06881829345114732 7.619639964841339
epoch 55 0.07336307348096638 7.601022790271441
epoch 60 0.07443371163533818 7.596630402710045
epoch 65 0.07004362703477751 7.614625006864793
epoch 70 0.07557650595921195 7.591939184160469
epoch 75 0.07993906008243057 7.574003998783656
epoch 80 0.07324810299598805 7.601494315928684
epoch 85 0.08021358238130794 7.572873971401955
epoch 90 0.07723909880037672 7.585108989833463
epoch 95 0.07692444508613738 7.58640210882477
[32m[I 2022-02-16 23:00:04,543][0m Trial 25 finished with value: 7.5746071402310475 and parameters: {'n_layers_fe': 4, 'fe_n_units_l0': 29, 'fe_dropout_l0': 0.43709093920526415, 'fe_n_units_l1': 185, 'fe_dropout_l1': 0.11589698369417223, 'fe_n_units_l2': 168, 'fe_dropout_l2': 0.3938780087906555, 'fe_n_units_l3': 109, 'fe_dropout_l3': 0.19827808321586926, 'n_units_l(Invariant)': 393, 'n_layers_mlp': 4, 'mlp_n_units_l0': 31, 'mlp_dropout_l0': 0.40318969739276117, 'mlp_n_units_l1': 113, 'mlp_dropout_l1': 0.27315576218522686, 'mlp_n_units_l2': 55, 'mlp_dropout_l2': 0.2868335426025566, 'mlp_n_units_l3': 193, 'mlp_dropout_l3': 0.06616631539614351, 'reduction': 'sum', 'lr': 0.00011165393976002651, 'weight_decay': 0.11387240606232846, 'criterion': 'MSELoss', 'batch_size': 256}. Best is trial 8 with value: 7.515034511885051.[0m

Trial Id: 26 | Model params: 118931 | Timestamp: 2022-02-16 23:00:04.543428

[32m[I 2022-02-16 23:00:58,003][0m Trial 26 pruned. [0m
epoch 0 -4.401435716878153 18.35151145725717

Trial Id: 27 | Model params: 188279 | Timestamp: 2022-02-16 23:00:58.003440

[32m[I 2022-02-16 23:01:52,539][0m Trial 27 pruned. [0m
epoch 0 -2.449219404209667 14.664850622405007

Trial Id: 28 | Model params: 180411 | Timestamp: 2022-02-16 23:01:52.539719

[32m[I 2022-02-16 23:02:51,574][0m Trial 28 pruned. [0m
epoch 0 -1.0930047007336507 11.423582832683023

Trial Id: 29 | Model params: 181100 | Timestamp: 2022-02-16 23:02:51.574258

[32m[I 2022-02-16 23:04:07,148][0m Trial 29 pruned. [0m
++++++++++++++++++++
        NaN         
++++++++++++++++++++

Trial Id: 30 | Model params: 114375 | Timestamp: 2022-02-16 23:04:07.148628

[32m[I 2022-02-16 23:04:36,802][0m Trial 30 pruned. [0m
epoch 0 -1.0929608668726853 11.42346320983573

Trial Id: 31 | Model params: 53304 | Timestamp: 2022-02-16 23:04:36.802886

[32m[I 2022-02-16 23:05:52,272][0m Trial 31 pruned. [0m
epoch 0 0.03981133656340141 7.737408394491467

Trial Id: 32 | Model params: 55534 | Timestamp: 2022-02-16 23:05:52.272548

[32m[I 2022-02-16 23:06:32,884][0m Trial 32 pruned. [0m
epoch 0 -1.9652765231519167 13.597210871895792

Trial Id: 33 | Model params: 112824 | Timestamp: 2022-02-16 23:06:32.884163

epoch 0 -5.851174042306566 20.668060937107576
epoch 5 -1.0792380732926934 11.385951846458802
epoch 10 0.046509889985051345 7.710371960697697
epoch 15 0.027435084343574778 7.787114000121389
epoch 20 0.0023772176660903366 7.886792457938545
epoch 25 -0.00020280643930914444 7.8969841737198365
epoch 30 -0.0158130496681006 7.958370011666036
epoch 35 0.00838615769890283 7.863004488197081
epoch 40 0.011478351090714045 7.850735138025939
epoch 45 0.03608272417200664 7.75241682185637
epoch 50 -0.0008271538978292803 7.899448520341761
epoch 55 0.017056292825111452 7.828554089673084
epoch 60 0.021172284303749622 7.812146199536863
epoch 65 0.05240482512895861 7.686500390382837
epoch 70 0.034375536059054856 7.759278914344244
epoch 75 0.03965942363616215 7.738020443933383
epoch 80 0.026635690770582365 7.7903136272957045
epoch 85 0.05621248017109026 7.671041783749093
epoch 90 0.04906507753153533 7.700033802476195
epoch 95 0.045273926045590884 7.7153676367751185
[32m[I 2022-02-17 00:38:02,514][0m Trial 33 finished with value: 7.6572170769831995 and parameters: {'n_layers_fe': 4, 'fe_n_units_l0': 89, 'fe_dropout_l0': 0.09621509987566187, 'fe_n_units_l1': 118, 'fe_dropout_l1': 0.056490372552369515, 'fe_n_units_l2': 238, 'fe_dropout_l2': 0.356285260524102, 'fe_n_units_l3': 98, 'fe_dropout_l3': 0.2110926967558485, 'n_units_l(Invariant)': 360, 'n_layers_mlp': 4, 'mlp_n_units_l0': 47, 'mlp_dropout_l0': 0.4750946543271557, 'mlp_n_units_l1': 71, 'mlp_dropout_l1': 0.26007420474794046, 'mlp_n_units_l2': 29, 'mlp_dropout_l2': 0.2489244322693622, 'mlp_n_units_l3': 237, 'mlp_dropout_l3': 0.06642360126184119, 'reduction': 'sum', 'lr': 4.4161722596138205e-05, 'weight_decay': 0.1504764786021654, 'criterion': 'MSELoss', 'batch_size': 128}. Best is trial 8 with value: 7.515034511885051.[0m

Trial Id: 34 | Model params: 63109 | Timestamp: 2022-02-17 00:38:02.514940

[32m[I 2022-02-17 00:39:17,527][0m Trial 34 pruned. [0m
epoch 0 -0.5431211291957565 9.808830779070423

Trial Id: 35 | Model params: 171663 | Timestamp: 2022-02-17 00:39:17.527191

[32m[I 2022-02-17 00:40:23,795][0m Trial 35 pruned. [0m
epoch 0 -5.680297117752531 20.408689705734332

Trial Id: 36 | Model params: 95935 | Timestamp: 2022-02-17 00:40:23.795213

[32m[I 2022-02-17 00:41:13,878][0m Trial 36 pruned. [0m
++++++++++++++++++++
        NaN         
++++++++++++++++++++

Trial Id: 37 | Model params: 54199 | Timestamp: 2022-02-17 00:41:13.879078

[32m[I 2022-02-17 00:42:20,757][0m Trial 37 pruned. [0m
++++++++++++++++++++
        NaN         
++++++++++++++++++++

Trial Id: 38 | Model params: 72085 | Timestamp: 2022-02-17 00:42:20.757363

epoch 0 -13.933546475117279 30.5139698084103
epoch 5 -13.845330120663755 30.423709323289316
epoch 10 -13.845354385374643 30.423734187074867
epoch 15 -13.904550973580374 30.484331913904327
epoch 20 -13.883222195927525 30.462512192003746
epoch 25 -13.869694649083689 30.448665165645057
epoch 30 -13.849227601591583 30.427702769181007
epoch 35 -13.85946813118079 30.438192947379676
epoch 40 -13.874121550862126 30.45319731046108
epoch 45 -13.851871311606457 30.430411275125085
epoch 50 -13.892021578953043 30.471516011908882
epoch 55 -13.865348736538492 30.444215279175754
epoch 60 -13.858215127181476 30.436909591165296
epoch 65 -13.853875335788368 30.432464256252477
epoch 70 -13.846466008519572 30.424873233443055
epoch 75 -13.835964121741194 30.414110567839465
epoch 80 -13.852940345173144 30.43150644168842
epoch 85 -13.865523496133315 30.444394232363614
epoch 90 -13.861126306392121 30.439891206315036
epoch 95 -13.900596209647563 30.48028729911313
[32m[I 2022-02-17 01:43:49,692][0m Trial 38 finished with value: 30.447190133961435 and parameters: {'n_layers_fe': 4, 'fe_n_units_l0': 88, 'fe_dropout_l0': 0.3206682029671386, 'fe_n_units_l1': 157, 'fe_dropout_l1': 0.3804393747335826, 'fe_n_units_l2': 131, 'fe_dropout_l2': 0.37086384803696637, 'fe_n_units_l3': 74, 'fe_dropout_l3': 0.11935408537224611, 'n_units_l(Invariant)': 63, 'n_layers_mlp': 2, 'mlp_n_units_l0': 97, 'mlp_dropout_l0': 0.4571980563890029, 'mlp_n_units_l1': 203, 'mlp_dropout_l1': 0.20251006977271108, 'reduction': 'sum', 'lr': 0.0022697443289431737, 'weight_decay': 0.1955041125506613, 'criterion': 'PoissonNLLLoss', 'batch_size': 128}. Best is trial 8 with value: 7.515034511885051.[0m

Trial Id: 39 | Model params: 148891 | Timestamp: 2022-02-17 01:43:49.693131

[32m[I 2022-02-17 01:44:27,840][0m Trial 39 pruned. [0m
++++++++++++++++++++
        NaN         
++++++++++++++++++++

Trial Id: 40 | Model params: 66659 | Timestamp: 2022-02-17 01:44:27.840739

[32m[I 2022-02-17 01:45:27,548][0m Trial 40 pruned. [0m
epoch 0 0.050485104460218255 7.694282441282939

Trial Id: 41 | Model params: 42542 | Timestamp: 2022-02-17 01:45:27.548642

[32m[I 2022-02-17 01:45:47,447][0m Trial 41 pruned. [0m
epoch 0 -0.8926733939232541 10.863132376389569

Trial Id: 42 | Model params: 26312 | Timestamp: 2022-02-17 01:45:47.447244

[32m[I 2022-02-17 01:46:05,001][0m Trial 42 pruned. [0m
epoch 0 -0.9568267978553886 11.045704659356517

Trial Id: 43 | Model params: 34638 | Timestamp: 2022-02-17 01:46:05.001929

[32m[I 2022-02-17 01:46:28,589][0m Trial 43 pruned. [0m
epoch 0 -1.6099120587153033 12.756459960742475

Trial Id: 44 | Model params: 83938 | Timestamp: 2022-02-17 01:46:28.589304

[32m[I 2022-02-17 01:47:02,644][0m Trial 44 pruned. [0m
epoch 0 -1.1321760007423745 11.529985433307566

Trial Id: 45 | Model params: 101490 | Timestamp: 2022-02-17 01:47:02.644363

[32m[I 2022-02-17 01:47:36,436][0m Trial 45 pruned. [0m
++++++++++++++++++++
        NaN         
++++++++++++++++++++

Trial Id: 46 | Model params: 195298 | Timestamp: 2022-02-17 01:47:36.436599

[32m[I 2022-02-17 01:48:29,778][0m Trial 46 pruned. [0m
epoch 0 0.013467617745447025 7.842831886519763

Trial Id: 47 | Model params: 82757 | Timestamp: 2022-02-17 01:48:29.779155

epoch 0 -15.389160481716448 31.96653673208849
epoch 5 -14.002574463829193 30.58441153317811
epoch 10 -13.867066522962764 30.44597424056693
epoch 15 -13.885082352858065 30.464415787945253
epoch 20 -13.860930574354342 30.439690747701373
epoch 25 -13.867818092131738 30.44674379272912
epoch 30 -13.869829721655368 30.448803459344603
epoch 35 -13.867306862343417 30.446220332726682
epoch 40 -13.85496981477862 30.433585414147856
epoch 45 -13.8605907820181 30.43934274685761
epoch 50 -13.867328596601764 30.44624258711958
epoch 55 -13.873126997143507 30.452179171445916
epoch 60 -13.8669449004425 30.44584970612409
epoch 65 -13.872442009022926 30.451477919410628
epoch 70 -13.857755442849124 30.436438758075226
epoch 75 -13.859640473369932 30.43836946007682
epoch 80 -13.85441536722225 30.433017456598037
epoch 85 -13.872998860189691 30.45204799331904
epoch 90 -13.857509659094209 30.436187010320634
epoch 95 -13.84610590462091 30.4245042506192
[32m[I 2022-02-17 03:41:19,593][0m Trial 47 finished with value: 30.44453526752232 and parameters: {'n_layers_fe': 2, 'fe_n_units_l0': 124, 'fe_dropout_l0': 0.48393899898300347, 'fe_n_units_l1': 128, 'fe_dropout_l1': 0.23091254996749103, 'n_units_l(Invariant)': 302, 'n_layers_mlp': 4, 'mlp_n_units_l0': 143, 'mlp_dropout_l0': 0.3113256981601524, 'mlp_n_units_l1': 114, 'mlp_dropout_l1': 0.18992109349180414, 'mlp_n_units_l2': 32, 'mlp_dropout_l2': 0.3694489038578205, 'mlp_n_units_l3': 99, 'mlp_dropout_l3': 0.18063442905234306, 'reduction': 'sum', 'lr': 1.8804929859767972e-05, 'weight_decay': 0.04252684892589155, 'criterion': 'PoissonNLLLoss', 'batch_size': 32}. Best is trial 8 with value: 7.515034511885051.[0m

Trial Id: 48 | Model params: 66153 | Timestamp: 2022-02-17 03:41:19.593884

[32m[I 2022-02-17 03:41:57,624][0m Trial 48 pruned. [0m
epoch 0 0.029422279338713886 7.779154414912069

Trial Id: 49 | Model params: 158647 | Timestamp: 2022-02-17 03:41:57.624720

[32m[I 2022-02-17 03:43:13,513][0m Trial 49 pruned. [0m
epoch 0 -0.1304828778376277 8.395551455785379

Study statistics: 
  Number of finished trials:  50
  Number of pruned trials:  39
  Number of complete trials:  11

Best trial:
  Value:  7.515034511885051
  Params: 
    n_layers_fe: 4
    fe_n_units_l0: 33
    fe_dropout_l0: 0.3557684640363649
    fe_n_units_l1: 176
    fe_dropout_l1: 0.48835018778365025
    fe_n_units_l2: 172
    fe_dropout_l2: 0.39032118780804775
    fe_n_units_l3: 70
    fe_dropout_l3: 0.2655593924859925
    n_units_l(Invariant): 131
    n_layers_mlp: 4
    mlp_n_units_l0: 22
    mlp_dropout_l0: 0.3750635015131034
    mlp_n_units_l1: 212
    mlp_dropout_l1: 0.3797109250734603
    mlp_n_units_l2: 20
    mlp_dropout_l2: 0.1924715324396163
    mlp_n_units_l3: 28
    mlp_dropout_l3: 0.2786072992560561
    reduction: sum
    lr: 0.00032053895132660195
    weight_decay: 0.019453572616387547
    criterion: MSELoss
    batch_size: 32
Target: 132567, NaN: 0, Max: 365.0, Min: 0.0, Mean: 32.88284414673335
Prediction: 132567, NaN: 0, Max: 39.10346984863281, Min: 27.992740631103516, Mean: 33.24047291669558

 XXXXXX======== TRIAL south - elg ended

Test Set - R-squared:  0.09795814301084105
Test Set - RMSE:  7.5248995170758475
Test Set - MAE:  5.904436010692371



[32m[I 2022-02-17 03:43:51,566][0m A new study created in memory with name: DeepSet[0m
Starting Loading south
Finished Loading south
Finished south setup

++++++++ Session Characteristics +++++++

Area: south
Gal Type: qso
Training Set: 232361
Validation Set: 58091
Test Samples: 132567
Number of features: 5
Device: cuda:0
Number of Workers: 8
Number of Trials: 50

+++++++++++++++++++++++++++++++++++++++

Trial Id: 0 | Model params: 143738 | Timestamp: 2022-02-17 03:43:51.566923

[32m[I 2022-02-17 03:45:01,987][0m Trial 0 pruned. [0m
++++++++++++++++++++
        NaN         
++++++++++++++++++++

Trial Id: 1 | Model params: 12266 | Timestamp: 2022-02-17 03:45:01.987934

[32m[I 2022-02-17 03:45:54,140][0m Trial 1 pruned. [0m
++++++++++++++++++++
        NaN         
++++++++++++++++++++

Trial Id: 2 | Model params: 139597 | Timestamp: 2022-02-17 03:45:54.140280

[32m[I 2022-02-17 03:47:19,330][0m Trial 2 pruned. [0m
++++++++++++++++++++
        NaN         
++++++++++++++++++++

Trial Id: 3 | Model params: 53487 | Timestamp: 2022-02-17 03:47:19.330990

[32m[I 2022-02-17 03:47:40,735][0m Trial 3 pruned. [0m
++++++++++++++++++++
        NaN         
++++++++++++++++++++

Trial Id: 4 | Model params: 65389 | Timestamp: 2022-02-17 03:47:40.736116

epoch 0 -1.7152829071718063 3.8646902822594327
epoch 5 -1.3921233348637174 3.6274291281487887
epoch 10 -1.345445890260736 3.591863808838579
epoch 15 -1.3291410274086997 3.579357235178104
epoch 20 -1.3355822076008046 3.584303128740184
epoch 25 -1.3471940643984435 3.593202154316996
epoch 30 -1.3389169534939915 3.5868610512594863
epoch 35 -1.347759901379228 3.5936352340035707
epoch 40 -1.3501126791647815 3.5954354410710994
epoch 45 -1.339960430170556 3.587661077204361
epoch 50 -1.3339317535085193 3.583036469571927
epoch 55 -1.3433873443103748 3.590287213140463
epoch 60 -1.3405536772381206 3.5881158358623395
epoch 65 -1.3440688514527763 3.590809241330751
epoch 70 -1.3413667002647363 3.5887389720747316
epoch 75 -1.3432123669446026 3.5901531698445615
epoch 80 -1.3340954761798738 3.583162140344879
epoch 85 -1.3515163387975595 3.596509009646271
epoch 90 -1.3456574672303443 3.592025811834557
epoch 95 -1.3507922126871428 3.5959552123874072
[32m[I 2022-02-17 04:37:37,323][0m Trial 4 finished with value: 3.5941212437180696 and parameters: {'n_layers_fe': 2, 'fe_n_units_l0': 175, 'fe_dropout_l0': 0.3171608275910323, 'fe_n_units_l1': 161, 'fe_dropout_l1': 0.4992808445709886, 'n_units_l(Invariant)': 135, 'n_layers_mlp': 2, 'mlp_n_units_l0': 116, 'mlp_dropout_l0': 0.4864169633632447, 'mlp_n_units_l1': 96, 'mlp_dropout_l1': 0.40017260165427976, 'reduction': 'sum', 'lr': 2.585257350327242e-05, 'weight_decay': 0.1797583063285462, 'criterion': 'PoissonNLLLoss', 'batch_size': 256}. Best is trial 4 with value: 3.5941212437180696.[0m

Trial Id: 5 | Model params: 107165 | Timestamp: 2022-02-17 04:37:37.323745

[32m[I 2022-02-17 04:38:16,883][0m Trial 5 pruned. [0m
++++++++++++++++++++
        NaN         
++++++++++++++++++++

Trial Id: 6 | Model params: 36292 | Timestamp: 2022-02-17 04:38:16.883634

[32m[I 2022-02-17 04:38:43,656][0m Trial 6 pruned. [0m
++++++++++++++++++++
        NaN         
++++++++++++++++++++

Trial Id: 7 | Model params: 12369 | Timestamp: 2022-02-17 04:38:43.656451

[32m[I 2022-02-17 04:39:42,128][0m Trial 7 pruned. [0m
++++++++++++++++++++
        NaN         
++++++++++++++++++++

Trial Id: 8 | Model params: 177658 | Timestamp: 2022-02-17 04:39:42.128933

[32m[I 2022-02-17 04:40:56,897][0m Trial 8 pruned. [0m
++++++++++++++++++++
        NaN         
++++++++++++++++++++

Trial Id: 9 | Model params: 161181 | Timestamp: 2022-02-17 04:40:56.897502

[32m[I 2022-02-17 04:41:42,729][0m Trial 9 pruned. [0m
++++++++++++++++++++
        NaN         
++++++++++++++++++++

Trial Id: 10 | Model params: 114896 | Timestamp: 2022-02-17 04:41:42.730022

epoch 0 -1.4336353572982339 3.658768281766707
epoch 5 -1.3827208578657038 3.620293124848678
epoch 10 -1.3805937761094405 3.6186768258145983
epoch 15 -1.3819496836867002 3.619707218508602
epoch 20 -1.386138687336441 3.6228887101539207
epoch 25 -1.384270450784812 3.621470155041334
epoch 30 -1.3820794670665375 3.6198058292057818
epoch 35 -1.3786022811749539 3.6171629000781675
epoch 40 -1.3843404196404925 3.621523292524872
epoch 45 -1.3867414817448136 3.623346294443197
epoch 50 -1.3838543819290603 3.6211541576081854
epoch 55 -1.3787903961923904 3.6173059313899807
epoch 60 -1.3810702810455209 3.6190389688878346
epoch 65 -1.3811332398391416 3.6190868147710944
epoch 70 -1.3809647954294624 3.6189588030929762
epoch 75 -1.3892609658908235 3.625258222423946
epoch 80 -1.3767984136300697 3.6157910607516537
epoch 85 -1.3806251901729696 3.6187007015740456
epoch 90 -1.378428142988878 3.6170304908645496
epoch 95 -1.3835595000573413 3.6209301829921348
[32m[I 2022-02-17 05:31:03,374][0m Trial 10 finished with value: 3.6212463479598993 and parameters: {'n_layers_fe': 4, 'fe_n_units_l0': 256, 'fe_dropout_l0': 0.34818784306146583, 'fe_n_units_l1': 147, 'fe_dropout_l1': 0.4884869252928959, 'fe_n_units_l2': 9, 'fe_dropout_l2': 0.006461555839710503, 'fe_n_units_l3': 23, 'fe_dropout_l3': 0.01403765676191851, 'n_units_l(Invariant)': 33, 'n_layers_mlp': 4, 'mlp_n_units_l0': 216, 'mlp_dropout_l0': 0.493767174889222, 'mlp_n_units_l1': 138, 'mlp_dropout_l1': 0.4610898118160086, 'mlp_n_units_l2': 250, 'mlp_dropout_l2': 0.0010926196013842926, 'mlp_n_units_l3': 14, 'mlp_dropout_l3': 0.03606492719752244, 'reduction': 'sum', 'lr': 0.00011531108479460262, 'weight_decay': 0.2968715846185297, 'criterion': 'PoissonNLLLoss', 'batch_size': 256}. Best is trial 4 with value: 3.5941212437180696.[0m

Trial Id: 11 | Model params: 110898 | Timestamp: 2022-02-17 05:31:03.374405

epoch 0 -3.051918952842837 4.721038338316858
epoch 5 -3.051918952842837 4.721038338316858
epoch 10 -1.405149848450947 3.6372924573014362
epoch 15 -1.3732488997510375 3.6130901384202043
epoch 20 -1.3759076544247293 3.6151134473333353
epoch 25 -1.3782011472834776 3.6168578831737896
epoch 30 -1.3815539178614524 3.619406495127501
epoch 35 -1.3797465673434188 3.61803285884079
epoch 40 -1.3740208273545678 3.6136776910482857
epoch 45 -1.3835574673229947 3.620928639000739
epoch 50 -1.3745777173043074 3.614101508472641
epoch 55 -1.377541509830666 3.6163562476447204
epoch 60 -1.3757654029411124 3.615005222809534
epoch 65 -1.3782686950508638 3.616909247403532
epoch 70 -1.3846765340038343 3.6217785419621547
epoch 75 -1.3787027826523244 3.617239316042767
epoch 80 -1.3843034615117773 3.6214952249633883
epoch 85 -1.3767905411524208 3.615785072600173
epoch 90 -1.3788562872281274 3.6173560296214764
epoch 95 -1.3811717087267112 3.619116049103543
[32m[I 2022-02-17 06:17:48,414][0m Trial 11 finished with value: 3.6198582226044875 and parameters: {'n_layers_fe': 4, 'fe_n_units_l0': 255, 'fe_dropout_l0': 0.3542874652121241, 'fe_n_units_l1': 146, 'fe_dropout_l1': 0.47804554821003326, 'fe_n_units_l2': 11, 'fe_dropout_l2': 0.018516512867073814, 'fe_n_units_l3': 11, 'fe_dropout_l3': 0.012710018910304403, 'n_units_l(Invariant)': 6, 'n_layers_mlp': 4, 'mlp_n_units_l0': 231, 'mlp_dropout_l0': 0.482926636644793, 'mlp_n_units_l1': 127, 'mlp_dropout_l1': 0.49636451350020183, 'mlp_n_units_l2': 249, 'mlp_dropout_l2': 0.021790122419253714, 'mlp_n_units_l3': 14, 'mlp_dropout_l3': 0.0005129421124743794, 'reduction': 'sum', 'lr': 0.0001076073751713945, 'weight_decay': 0.2886560276601586, 'criterion': 'PoissonNLLLoss', 'batch_size': 256}. Best is trial 4 with value: 3.5941212437180696.[0m

Trial Id: 12 | Model params: 78146 | Timestamp: 2022-02-17 06:17:48.414411

epoch 0 -3.051918952842837 4.721038338316858
epoch 5 -3.051918952842837 4.721038338316858
epoch 10 -2.9381648650343837 4.654297062665056
epoch 15 -1.3969210112891104 3.631064917670434
epoch 20 -1.3971168147728297 3.6312132247356064
epoch 25 -1.4013200615323123 3.6343954226730153
epoch 30 -1.3874073890945158 3.6238517209157695
epoch 35 -1.386391232188923 3.623080425265039
epoch 40 -1.3887435168115032 3.6248656348971333
epoch 45 -1.3891903935310959 3.6252046818270234
epoch 50 -1.3867356159574262 3.6233418419727026
epoch 55 -1.386548994627049 3.6232001827773956
epoch 60 -1.3902591156548296 3.6260153964714315
epoch 65 -1.3878292609939575 3.6241718869846675
epoch 70 -1.3897439973348074 3.6256246590006254
epoch 75 -1.389036794014535 3.625088148913214
epoch 80 -1.3889292075230255 3.62500652294008
epoch 85 -1.3860249898182624 3.622802395313103
epoch 90 -1.3888298913983035 3.624931170070532
epoch 95 -1.3865199072507628 3.6231781028392844
