[32m[I 2022-02-21 01:16:20,568][0m Trial 32 finished with value: 1.9558956281490434 and parameters: {'n_layers_fe': 2, 'fe_n_units_l0': 116, 'fe_dropout_l0': 0.2739956371960588, 'fe_n_units_l1': 11, 'fe_dropout_l1': 0.4863280983033175, 'n_units_l(Invariant)': 41, 'n_layers_mlp': 2, 'mlp_n_units_l0': 168, 'mlp_dropout_l0': 0.3145996492294349, 'mlp_n_units_l1': 240, 'mlp_dropout_l1': 0.04417331739623212, 'reduction': 'sum', 'lr': 1.5397545667939844e-05, 'weight_decay': 0.027291738783967165, 'criterion': 'MSELoss', 'batch_size': 256}. Best is trial 31 with value: 1.9556633508598416.[0m

Trial Id: 33 | Model params: 46641 | Timestamp: 2022-02-21 01:16:20.569019

epoch 0 -0.07167093959909487 2.0555020311761765
epoch 5 -0.032922085694555125 2.0179990848416027
epoch 10 -0.009076253424126879 1.9945695114308937
epoch 15 0.007324155976193736 1.9782943474588643
epoch 20 0.018200420467301526 1.9674268955578245
epoch 25 0.024999931157744237 1.960602293685691
epoch 30 0.02468960439971357 1.9609142828678379
epoch 35 0.026590796122160087 1.9590021261868742
epoch 40 0.027556386661806487 1.9580302516424852
epoch 45 0.028005831358772104 1.9575777174249058
epoch 50 0.028174379317094433 1.9574079838797283
epoch 55 0.028602073414809137 1.9569772152559948
epoch 60 0.028914351519941484 1.956662632404592
epoch 65 0.029169466819419565 1.9564055967027214
epoch 70 0.029608510108488195 1.9559631693933597
epoch 75 0.029726823136588476 1.9558439273235382
epoch 80 0.02981006566514477 1.9557600267839914
epoch 85 0.03003823651450921 1.9555300338459822
epoch 90 0.02951703268568695 1.9560553601509596
epoch 95 0.03012191191493674 1.955445683465435
[32m[I 2022-02-21 02:22:43,540][0m Trial 33 finished with value: 1.955384391621987 and parameters: {'n_layers_fe': 2, 'fe_n_units_l0': 114, 'fe_dropout_l0': 0.28395172560762044, 'fe_n_units_l1': 12, 'fe_dropout_l1': 0.49311121443114914, 'n_units_l(Invariant)': 50, 'n_layers_mlp': 2, 'mlp_n_units_l0': 165, 'mlp_dropout_l0': 0.32587118906131013, 'mlp_n_units_l1': 240, 'mlp_dropout_l1': 0.0506072361263428, 'reduction': 'sum', 'lr': 1.6323043031597324e-05, 'weight_decay': 0.022444958683856875, 'criterion': 'MSELoss', 'batch_size': 256}. Best is trial 33 with value: 1.955384391621987.[0m

Trial Id: 34 | Model params: 47817 | Timestamp: 2022-02-21 02:22:43.540549

[32m[I 2022-02-21 02:23:32,480][0m Trial 34 pruned. [0m
++++++++++++++++++++
        NaN         
++++++++++++++++++++

Trial Id: 35 | Model params: 48794 | Timestamp: 2022-02-21 02:23:32.480307

[32m[I 2022-02-21 02:24:33,089][0m Trial 35 pruned. [0m
epoch 0 -0.05673969812887392 2.041132484560224

Trial Id: 36 | Model params: 60307 | Timestamp: 2022-02-21 02:24:33.089448

[32m[I 2022-02-21 02:25:32,430][0m Trial 36 pruned. [0m
++++++++++++++++++++
        NaN         
++++++++++++++++++++

Trial Id: 37 | Model params: 48822 | Timestamp: 2022-02-21 02:25:32.430778

epoch 0 -0.13686113798194977 2.117097667578674
epoch 5 -0.21299362009164113 2.186837142135147
epoch 10 -0.10211875394112613 2.0844975041152027
epoch 15 -0.04153849683700406 2.0263984592764963
epoch 20 0.0015043488546651052 1.9840849920125896
epoch 25 0.015411726885756871 1.9702190439797393
epoch 30 0.025807226060588606 1.9597904414311405
epoch 35 0.02836336126653427 1.9572176551036622
epoch 40 0.028535109713948126 1.957044666593336
epoch 45 0.030070464801405294 1.9554975460156083
epoch 50 0.03055933126067556 1.9550046763711448
epoch 55 0.030888733795514822 1.9546725063734056
epoch 60 0.03151319547080089 1.9540426433200606
epoch 65 0.031591422574529515 1.9539637252683837
epoch 70 0.032020037245651056 1.953531268231144
epoch 75 0.0322675311394125 1.9532815120443916
epoch 80 0.03216915123444086 1.9533807950446622
epoch 85 0.03257548967770896 1.9529706939195255
epoch 90 0.03277579362302707 1.952768503473796
epoch 95 0.0328559124192509 1.9526876242418605
[32m[I 2022-02-21 03:58:17,704][0m Trial 37 finished with value: 1.9528000358185926 and parameters: {'n_layers_fe': 2, 'fe_n_units_l0': 112, 'fe_dropout_l0': 0.36770576072036953, 'fe_n_units_l1': 52, 'fe_dropout_l1': 0.4928185444162925, 'n_units_l(Invariant)': 92, 'n_layers_mlp': 2, 'mlp_n_units_l0': 164, 'mlp_dropout_l0': 0.305614207043966, 'mlp_n_units_l1': 202, 'mlp_dropout_l1': 0.04430217467331492, 'reduction': 'sum', 'lr': 1.3670673260201514e-05, 'weight_decay': 0.001820225037729984, 'criterion': 'MSELoss', 'batch_size': 256}. Best is trial 37 with value: 1.9528000358185926.[0m

Trial Id: 38 | Model params: 42352 | Timestamp: 2022-02-21 03:58:17.704717

epoch 0 -1.262696896478218 2.9867603256434783
epoch 5 -1.1950561382683444 2.941778699622029
epoch 10 -1.2136757571230339 2.954229208311761
epoch 15 -1.2086727971316797 2.95088900578596
epoch 20 -1.1811666291231755 2.9324566819981612
epoch 25 -1.1811786211365427 2.9324647432831004
epoch 30 -1.1867092537533255 2.9361801926075684
epoch 35 -1.1695783634695327 2.924656419849622
epoch 40 -1.1864637796765587 2.936015384151796
epoch 45 -1.1878493071094542 2.93694549002741
epoch 50 -1.1660324927950918 2.9222654727571684
epoch 55 -1.1914318693546568 2.9393491030662675
epoch 60 -1.196374068453221 2.942661701450048
epoch 65 -1.188185776213884 2.93717131760727
epoch 70 -1.1784475661319105 2.930628297854554
epoch 75 -1.1961556931482265 2.9425154101990776
epoch 80 -1.1782942472346507 2.930525167393221
epoch 85 -1.1857705871064765 2.9355499327216403
epoch 90 -1.1789741287928357 2.9309824643304663
epoch 95 -1.1770048115955132 2.929657680605335
[32m[I 2022-02-21 05:33:51,809][0m Trial 38 finished with value: 2.9307536927529445 and parameters: {'n_layers_fe': 2, 'fe_n_units_l0': 110, 'fe_dropout_l0': 0.3666905438178223, 'fe_n_units_l1': 20, 'fe_dropout_l1': 0.498446573503096, 'n_units_l(Invariant)': 104, 'n_layers_mlp': 2, 'mlp_n_units_l0': 162, 'mlp_dropout_l0': 0.35386005532753584, 'mlp_n_units_l1': 204, 'mlp_dropout_l1': 0.10908493298025576, 'reduction': 'sum', 'lr': 6.295481295420189e-05, 'weight_decay': 0.0025131934672439037, 'criterion': 'PoissonNLLLoss', 'batch_size': 256}. Best is trial 37 with value: 1.9528000358185926.[0m

Trial Id: 39 | Model params: 62703 | Timestamp: 2022-02-21 05:33:51.809801

[32m[I 2022-02-21 05:35:08,452][0m Trial 39 pruned. [0m
++++++++++++++++++++
        NaN         
++++++++++++++++++++

Trial Id: 40 | Model params: 77418 | Timestamp: 2022-02-21 05:35:08.453155

[32m[I 2022-02-21 05:37:14,494][0m Trial 40 pruned. [0m
++++++++++++++++++++
        NaN         
++++++++++++++++++++

Trial Id: 41 | Model params: 54700 | Timestamp: 2022-02-21 05:37:14.494429

epoch 0 -0.07335170129994895 2.0571132792892204
epoch 5 -0.09765252753297693 2.080269607291933
epoch 10 -0.4188253298404372 2.3651116634135176
epoch 15 -0.2419130171205761 2.2127521570410478
epoch 20 -0.14892316274788064 2.128299170336317
epoch 25 -0.11849383834475491 2.09992595369277
epoch 30 -0.1393985065940493 2.119458933594208
epoch 35 -0.0626814287171189 2.0468627790072844
epoch 40 -0.049622672503329746 2.034247471144263
epoch 45 -0.02033463469312946 2.005665469711308
epoch 50 -0.02899555522190944 2.0141598409910437
epoch 55 -0.014267613974981108 1.9996936266504135
epoch 60 -0.030016905019663698 2.0151591900746655
epoch 65 -0.005465796880878893 1.9909980471313409
epoch 70 -0.015163535389683513 2.0005766149572093
epoch 75 0.016247322691415156 1.9693828283464454
epoch 80 0.0057013753594781225 1.9799106992538165
epoch 85 0.001896718058684299 1.9836951203379036
epoch 90 0.011280271123037977 1.9743483597211549
epoch 95 0.01353155194286304 1.9720993170855026
[32m[I 2022-02-21 07:24:56,456][0m Trial 41 finished with value: 1.9631113351344527 and parameters: {'n_layers_fe': 2, 'fe_n_units_l0': 106, 'fe_dropout_l0': 0.26060951453548936, 'fe_n_units_l1': 65, 'fe_dropout_l1': 0.4964096725884141, 'n_units_l(Invariant)': 50, 'n_layers_mlp': 2, 'mlp_n_units_l0': 155, 'mlp_dropout_l0': 0.29980230452997225, 'mlp_n_units_l1': 256, 'mlp_dropout_l1': 0.03528908148187178, 'reduction': 'sum', 'lr': 1.4087855774964744e-05, 'weight_decay': 0.027341970969014806, 'criterion': 'MSELoss', 'batch_size': 256}. Best is trial 37 with value: 1.9528000358185926.[0m

Trial Id: 42 | Model params: 48928 | Timestamp: 2022-02-21 07:24:56.457165

epoch 0 -0.17428476891982414 2.1516612429040247
epoch 5 -0.30924001853559857 2.271939796743137
epoch 10 -0.6055911710456063 2.51596542637669
epoch 15 -0.4465072013286686 2.3880723666392636
epoch 20 -0.23478208890303276 2.2063903216598875
epoch 25 -0.09343738547193192 2.0762714994658245
epoch 30 -0.031096650320599384 2.0162151381505438
epoch 35 -0.022449242899297728 2.0077427301304596
epoch 40 0.0058919228436197235 1.9797209750251887
epoch 45 0.017201351532831866 1.9684276574980348
epoch 50 0.02562997564969227 1.9599687212700685
epoch 55 0.02768374646225613 1.9579020269802507
epoch 60 0.023667186874525292 1.9619418265019062
epoch 65 0.028985897533401972 1.9565905512293307
epoch 70 0.030067720811767673 1.9555003121243888
epoch 75 0.030267756616156327 1.955298653587594
epoch 80 0.030265122853338933 1.9553013088511626
epoch 85 0.030440718632858133 1.95512427169915
epoch 90 0.030509860616313444 1.9550545577668679
epoch 95 0.03056816561549003 1.9549957685313566
[32m[I 2022-02-21 09:43:20,675][0m Trial 42 finished with value: 1.9546107382947506 and parameters: {'n_layers_fe': 2, 'fe_n_units_l0': 186, 'fe_dropout_l0': 0.33722410795397106, 'fe_n_units_l1': 50, 'fe_dropout_l1': 0.44302534857364684, 'n_units_l(Invariant)': 83, 'n_layers_mlp': 2, 'mlp_n_units_l0': 128, 'mlp_dropout_l0': 0.3657893040738264, 'mlp_n_units_l1': 240, 'mlp_dropout_l1': 0.00026068063054573293, 'reduction': 'sum', 'lr': 1.4586353150024168e-05, 'weight_decay': 0.014336636631653648, 'criterion': 'MSELoss', 'batch_size': 256}. Best is trial 37 with value: 1.9528000358185926.[0m

Trial Id: 43 | Model params: 37672 | Timestamp: 2022-02-21 09:43:20.675777

epoch 0 -0.3321450038898863 2.2917272740868864
epoch 5 -0.07945866660935952 2.062957077176171
epoch 10 -0.004944986539293428 1.9904823325797516
epoch 15 0.024608870697968688 1.960995440924569
epoch 20 0.03287237483936445 1.9526710051562302
epoch 25 0.032339946440772094 1.953208428769773
epoch 30 0.03270015496264578 1.9528448569733683
epoch 35 0.03292822944876683 1.9526146179493031
epoch 40 0.032671459517475854 1.952873822829827
epoch 45 0.03318097784493723 1.9523594391310495
