[32m[I 2022-02-16 13:21:12,503][0m A new study created in memory with name: DeepSet[0m
Starting Loading des
Finished Loading des
Finished des setup

++++++++ Session Characteristics +++++++

Area: des
Gal Type: lrg
Training Set: 216623
Validation Set: 54158
Test Samples: 67698
Number of features: 5
Device: cuda:0
Number of Workers: 8
Number of Trials: 50

+++++++++++++++++++++++++++++++++++++++

Trial Id: 0 | Model params: 74355 | Timestamp: 2022-02-16 13:21:12.504060

epoch 0 -0.11702746471133518 4.551419733136591
epoch 5 -0.02973523538466516 4.369962893077027
epoch 10 -0.008257638841247417 4.32414972308435
epoch 15 -0.012832985361421967 4.333949841890214
epoch 20 -0.020177287587013204 4.349634730062903
epoch 25 -0.0011099089316373156 4.308795102370807
epoch 30 -0.0013637275466593657 4.309341287701673
epoch 35 -6.743651677298956e-06 4.306420426371662
epoch 40 0.00044122458721285174 4.305455755042277
epoch 45 -0.0004402941357846135 4.3073538442473485
epoch 50 0.00030979706306077937 4.305738798323434
epoch 55 0.0007114669220457115 4.3048737006911155
epoch 60 2.2988335664275716e-05 4.306356407108725
epoch 65 0.0005611897044429659 4.305197381039924
epoch 70 0.00046807191524111946 4.305397934150708
epoch 75 -0.00031932880206264613 4.307093430782767
epoch 80 -2.875363572529821e-05 4.3064678179137434
epoch 85 0.0003102026781360845 4.305737924816452
epoch 90 0.0006737176783172538 4.304955010636386
epoch 95 0.00029874516662009576 4.305762598920679
[32m[I 2022-02-16 14:33:23,079][0m Trial 0 finished with value: 4.305132022865892 and parameters: {'n_layers_fe': 2, 'fe_n_units_l0': 96, 'fe_dropout_l0': 0.2838724051845542, 'fe_n_units_l1': 145, 'fe_dropout_l1': 0.4772503499769233, 'n_units_l(Invariant)': 135, 'n_layers_mlp': 2, 'mlp_n_units_l0': 165, 'mlp_dropout_l0': 0.18195019996347034, 'mlp_n_units_l1': 216, 'mlp_dropout_l1': 0.3553848621174259, 'reduction': 'sum', 'lr': 3.383992282726804e-05, 'weight_decay': 0.29583493596508853, 'criterion': 'MSELoss', 'batch_size': 256}. Best is trial 0 with value: 4.305132022865892.[0m

Trial Id: 1 | Model params: 74826 | Timestamp: 2022-02-16 14:33:23.079654

[32m[I 2022-02-16 14:34:27,590][0m Trial 1 pruned. [0m
++++++++++++++++++++
        NaN         
++++++++++++++++++++

Trial Id: 2 | Model params: 132423 | Timestamp: 2022-02-16 14:34:27.590426

epoch 0 -0.005383776768009163 4.317982709165279
epoch 5 -0.0007382135194955453 4.307995136231827
epoch 10 0.001969655512524371 4.302162747459545
epoch 15 -0.010148323217809674 4.3282021462330755
epoch 20 0.0029809280500491253 4.299982572419042
epoch 25 0.0028701104564199387 4.300221534989803
epoch 30 0.0019062576888947413 4.30229938830684
epoch 35 -0.008407388036942631 4.324470828462782
epoch 40 0.0023728098410638054 4.301293730432667
epoch 45 -0.00033072354966057205 4.307117962000624
epoch 50 -0.0028840411455934856 4.312611360881081
epoch 55 0.001691758473127969 4.302761664658936
epoch 60 -0.0013389141773436641 4.309287895544378
epoch 65 -0.0059363275362105394 4.3191691103136485
epoch 70 -0.004569963192344817 4.316234747625205
epoch 75 -0.0038352668327146233 4.314656110950818
epoch 80 0.001896469793392419 4.302320483696885
epoch 85 0.0021316757864683344 4.30181352667567
epoch 90 0.003017123618984985 4.2999045188829506
epoch 95 -0.00015910291397802645 4.306748473184321
[32m[I 2022-02-16 16:28:54,082][0m Trial 2 finished with value: 4.301571261967166 and parameters: {'n_layers_fe': 2, 'fe_n_units_l0': 138, 'fe_dropout_l0': 0.373371363156492, 'fe_n_units_l1': 157, 'fe_dropout_l1': 0.3007561877656321, 'n_units_l(Invariant)': 412, 'n_layers_mlp': 2, 'mlp_n_units_l0': 207, 'mlp_dropout_l0': 0.12354086190820157, 'mlp_n_units_l1': 189, 'mlp_dropout_l1': 0.08046308478156722, 'reduction': 'sum', 'lr': 0.0015812974339312804, 'weight_decay': 0.08368402280602463, 'criterion': 'MSELoss', 'batch_size': 128}. Best is trial 2 with value: 4.301571261967166.[0m

Trial Id: 3 | Model params: 107963 | Timestamp: 2022-02-16 16:28:54.082494

[32m[I 2022-02-16 16:30:14,600][0m Trial 3 pruned. [0m
++++++++++++++++++++
        NaN         
++++++++++++++++++++

Trial Id: 4 | Model params: 83374 | Timestamp: 2022-02-16 16:30:14.600745

[32m[I 2022-02-16 16:31:49,518][0m Trial 4 pruned. [0m
++++++++++++++++++++
        NaN         
++++++++++++++++++++

Trial Id: 5 | Model params: 144735 | Timestamp: 2022-02-16 16:31:49.518775

[32m[I 2022-02-16 16:33:13,259][0m Trial 5 pruned. [0m
++++++++++++++++++++
        NaN         
++++++++++++++++++++

Trial Id: 6 | Model params: 93093 | Timestamp: 2022-02-16 16:33:13.259286

epoch 0 -0.012060022438776352 4.332295757761991
epoch 5 -5.615835022187987e-05 4.306526824573345
epoch 10 -0.001015673972327047 4.3085923031161295
epoch 15 -6.689779437074606e-07 4.306407346390479
epoch 20 -2.970243540234563e-06 4.306412301477849
epoch 25 -2.2552926561836273e-06 4.306410762045505
epoch 30 -0.0004962298783357522 4.3074742570643245
epoch 35 -6.589387571231953e-05 4.306547786495977
epoch 40 -2.496764095649695e-05 4.306459666008109
epoch 45 -4.189661398212863e-05 4.306496116913508
epoch 50 -2.663933535984597e-07 4.3064064795443535
epoch 55 -4.545012507062296e-05 4.306503768177001
epoch 60 -1.0671463712697005e-10 4.306405906175215
epoch 65 -0.000222029823806702 4.306883954683909
epoch 70 -0.00025385622212570347 4.306952475227246
epoch 75 -0.00010514657334015354 4.306632301906614
epoch 80 -4.757564021917737e-05 4.306508344736063
epoch 85 -0.00021026628773479494 4.3068586281402945
epoch 90 -0.00016255022008082598 4.306755895337186
epoch 95 -0.00020687429381571754 4.3068513252505145
[32m[I 2022-02-16 19:06:50,166][0m Trial 6 finished with value: 4.306516344371007 and parameters: {'n_layers_fe': 2, 'fe_n_units_l0': 223, 'fe_dropout_l0': 0.45933983820438085, 'fe_n_units_l1': 95, 'fe_dropout_l1': 0.039699287027479824, 'n_units_l(Invariant)': 396, 'n_layers_mlp': 4, 'mlp_n_units_l0': 160, 'mlp_dropout_l0': 0.15517606451619614, 'mlp_n_units_l1': 155, 'mlp_dropout_l1': 0.23156750965617506, 'mlp_n_units_l2': 19, 'mlp_dropout_l2': 0.3669452171036207, 'mlp_n_units_l3': 22, 'mlp_dropout_l3': 0.21999066478081714, 'reduction': 'sum', 'lr': 0.0005133303370465135, 'weight_decay': 0.019650499755356297, 'criterion': 'MSELoss', 'batch_size': 32}. Best is trial 2 with value: 4.301571261967166.[0m

Trial Id: 7 | Model params: 153231 | Timestamp: 2022-02-16 19:06:50.166254

[32m[I 2022-02-16 19:08:17,388][0m Trial 7 pruned. [0m
++++++++++++++++++++
        NaN         
++++++++++++++++++++

Trial Id: 8 | Model params: 104805 | Timestamp: 2022-02-16 19:08:17.388751

[32m[I 2022-02-16 19:09:20,477][0m Trial 8 pruned. [0m
++++++++++++++++++++
        NaN         
++++++++++++++++++++

Trial Id: 9 | Model params: 230871 | Timestamp: 2022-02-16 19:09:20.477482

epoch 0 -2.266489693038785 7.783153728930371
epoch 5 -2.2053500253860108 7.7099700888977285
epoch 10 -2.0853012223163216 7.564212972485987
epoch 15 -2.042333808177414 7.5113568370610775
epoch 20 -2.0144658048474278 7.476875399400538
epoch 25 -1.994220291448888 7.451725305141392
epoch 30 -1.9897932755806491 7.44621450338418
epoch 35 -1.992484494821718 7.449565050793855
epoch 40 -1.9925906860658205 7.449697227178429
epoch 45 -1.9868316164948499 7.442525517069917
epoch 50 -1.9878887167757742 7.443842430915682
epoch 55 -1.9913260739314245 7.44812301038912
epoch 60 -1.994378355625631 7.45192198994859
epoch 65 -1.985197185890454 7.440488918156967
epoch 70 -1.9885684719438248 7.4446891328988425
epoch 75 -1.9893565308617798 7.445670617346892
epoch 80 -1.9867498879332568 7.442423691599941
epoch 85 -1.9886033702642996 7.44473259959388
epoch 90 -1.9860068956565895 7.44149793493024
epoch 95 -1.9884412946342858 7.444530728362355
[32m[I 2022-02-16 23:13:25,403][0m Trial 9 finished with value: 7.445515605961144 and parameters: {'n_layers_fe': 4, 'fe_n_units_l0': 47, 'fe_dropout_l0': 0.1668912093668029, 'fe_n_units_l1': 249, 'fe_dropout_l1': 0.4675443766032362, 'fe_n_units_l2': 248, 'fe_dropout_l2': 0.037135194639509705, 'fe_n_units_l3': 226, 'fe_dropout_l3': 0.40222858728599475, 'n_units_l(Invariant)': 207, 'n_layers_mlp': 4, 'mlp_n_units_l0': 148, 'mlp_dropout_l0': 0.00036914413678079683, 'mlp_n_units_l1': 253, 'mlp_dropout_l1': 0.33570465493690627, 'mlp_n_units_l2': 26, 'mlp_dropout_l2': 0.1786786826735446, 'mlp_n_units_l3': 195, 'mlp_dropout_l3': 0.16989045864186236, 'reduction': 'sum', 'lr': 1.2940342805315628e-05, 'weight_decay': 0.16583737360359166, 'criterion': 'PoissonNLLLoss', 'batch_size': 256}. Best is trial 2 with value: 4.301571261967166.[0m

Trial Id: 10 | Model params: 109651 | Timestamp: 2022-02-16 23:13:25.404087

epoch 0 -0.00032992091384698163 4.307116234048187
epoch 5 0.0014206156760601107 4.3033459449333185
epoch 10 -0.0007067412400507678 4.307927394493306
epoch 15 0.003014020318397148 4.299911211016865
epoch 20 0.0033367924420064643 4.2992151110459895
epoch 25 0.002941341245380147 4.300067937325952
epoch 30 0.0020536738946022037 4.301981656592361
epoch 35 -0.00106055707625341 4.3086888954240665
epoch 40 0.001727331563828094 4.3026850030186985
epoch 45 0.0032781413832509987 4.29934160804449
epoch 50 0.002856776185863108 4.300250287575754
epoch 55 -0.0018625787243222724 4.3104145502192726
epoch 60 -0.0011823820072083269 4.308951062260396
epoch 65 0.0008486456343208548 4.3045782118111235
epoch 70 0.002903847099958612 4.300148788063995
epoch 75 0.002466990556898585 4.301090694424924
epoch 80 0.003338285577729083 4.299211890643141
epoch 85 0.0033438883326208924 4.299199806570905
epoch 90 0.002563262950701195 4.3008831392441165
epoch 95 -0.004158248146958643 4.315350169663578
[32m[I 2022-02-17 02:36:38,298][0m Trial 10 finished with value: 4.300128796747935 and parameters: {'n_layers_fe': 4, 'fe_n_units_l0': 11, 'fe_dropout_l0': 0.3827299179933738, 'fe_n_units_l1': 60, 'fe_dropout_l1': 0.19272193603716384, 'fe_n_units_l2': 13, 'fe_dropout_l2': 0.49507853088570614, 'fe_n_units_l3': 255, 'fe_dropout_l3': 0.011990066122195053, 'n_units_l(Invariant)': 328, 'n_layers_mlp': 2, 'mlp_n_units_l0': 73, 'mlp_dropout_l0': 0.054482111668440025, 'mlp_n_units_l1': 247, 'mlp_dropout_l1': 0.06665852975854414, 'reduction': 'sum', 'lr': 0.00232797977299328, 'weight_decay': 0.09525722755930557, 'criterion': 'MSELoss', 'batch_size': 128}. Best is trial 10 with value: 4.300128796747935.[0m

Trial Id: 11 | Model params: 108682 | Timestamp: 2022-02-17 02:36:38.298533

[32m[I 2022-02-17 02:38:57,471][0m Trial 11 pruned. [0m
epoch 0 0.0017466161542444292 4.302643443271882

Trial Id: 12 | Model params: 75761 | Timestamp: 2022-02-17 02:38:57.471207

[32m[I 2022-02-17 02:41:17,368][0m Trial 12 pruned. [0m
epoch 0 0.0005492788438885565 4.305223034662916

Trial Id: 13 | Model params: 97607 | Timestamp: 2022-02-17 02:41:17.368186

[32m[I 2022-02-17 02:43:10,208][0m Trial 13 pruned. [0m
epoch 0 -0.00020587295536045325 4.306849169388041

Trial Id: 14 | Model params: 169483 | Timestamp: 2022-02-17 02:43:10.209096

[32m[I 2022-02-17 02:46:05,053][0m Trial 14 pruned. [0m
epoch 0 0.0006489935810697345 4.30500826424829

Trial Id: 15 | Model params: 118290 | Timestamp: 2022-02-17 02:46:05.053546

epoch 0 -0.5353325111070601 5.336004480544742
epoch 5 -4.954035994741979e-05 4.306512575073676
epoch 10 0.00208726120041991 4.301909261321426
epoch 15 0.0026748944041934397 4.300642458681412
epoch 20 0.002823307033999245 4.300322456005921
epoch 25 0.0028995633079912375 4.300158025349184
epoch 30 0.003047194244254925 4.299839672336665
epoch 35 0.0030871685576501218 4.299753467222124
epoch 40 0.003319928369456271 4.299251483397402
epoch 45 0.00313579208567194 4.299648607636632
epoch 50 0.003205502859394027 4.299498267666032
epoch 55 0.0031192335952288097 4.299684317312115
epoch 60 0.0031659475322755037 4.299583574303338
epoch 65 0.002658792530232379 4.3006771756071815
epoch 70 0.0031953812717954166 4.299520096457222
epoch 75 0.00312385733128806 4.299674345894698
epoch 80 0.0031386878413979247 4.2996423626831985
epoch 85 0.0031563466697466236 4.299604279661132
epoch 90 0.003284489773493271 4.2993279161897675
epoch 95 0.00227098384218849 4.301513237458639
[32m[I 2022-02-17 05:22:06,506][0m Trial 15 finished with value: 4.3008868868859675 and parameters: {'n_layers_fe': 2, 'fe_n_units_l0': 160, 'fe_dropout_l0': 0.3296361488407925, 'fe_n_units_l1': 194, 'fe_dropout_l1': 0.3347610884084701, 'n_units_l(Invariant)': 420, 'n_layers_mlp': 2, 'mlp_n_units_l0': 18, 'mlp_dropout_l0': 0.27344970940847463, 'mlp_n_units_l1': 168, 'mlp_dropout_l1': 0.16855275721216628, 'reduction': 'sum', 'lr': 0.0002329518077193599, 'weight_decay': 0.045587465346690156, 'criterion': 'MSELoss', 'batch_size': 128}. Best is trial 10 with value: 4.300128796747935.[0m

Trial Id: 16 | Model params: 99620 | Timestamp: 2022-02-17 05:22:06.506225

[32m[I 2022-02-17 05:23:16,363][0m Trial 16 pruned. [0m
++++++++++++++++++++
        NaN         
++++++++++++++++++++

Trial Id: 17 | Model params: 119316 | Timestamp: 2022-02-17 05:23:16.364207

epoch 0 -0.7572665690015778 5.7086548482891795
epoch 5 -0.933019392862924 5.987328240904273
epoch 10 -0.6241782545629178 5.488223741888543
epoch 15 -0.012661367937362833 4.333582647679315
epoch 20 0.0016384972634456707 4.302876442452577
epoch 25 0.0015809666881865247 4.303000417280435
epoch 30 0.0020471909096647645 4.301995630107898
epoch 35 0.0020094761800861782 4.302076920058415
epoch 40 0.0020501031368094225 4.301989353058786
epoch 45 0.0021159419894265508 4.301847440766587
epoch 50 0.002075718890625411 4.301934140162978
epoch 55 0.001706677337613538 4.302729513988759
epoch 60 0.0022208630932287754 4.301621278998026
epoch 65 0.0021776342207959765 4.301714462056565
epoch 70 0.002177865107756194 4.301713964367865
epoch 75 0.0012957622944017588 4.303614962353847
epoch 80 0.0021746977228482844 4.301720791823681
epoch 85 0.0022437216864824583 4.3015720047795725
epoch 90 0.0022586383295617463 4.301539850006162
epoch 95 0.0016388696675515568 4.302875639933149
[32m[I 2022-02-17 07:52:43,937][0m Trial 17 finished with value: 4.3018828496917605 and parameters: {'n_layers_fe': 4, 'fe_n_units_l0': 45, 'fe_dropout_l0': 0.3183655683762415, 'fe_n_units_l1': 117, 'fe_dropout_l1': 0.05579825972248345, 'fe_n_units_l2': 19, 'fe_dropout_l2': 0.18765622292430675, 'fe_n_units_l3': 195, 'fe_dropout_l3': 0.4985460327487223, 'n_units_l(Invariant)': 509, 'n_layers_mlp': 2, 'mlp_n_units_l0': 37, 'mlp_dropout_l0': 0.4949643626777393, 'mlp_n_units_l1': 164, 'mlp_dropout_l1': 0.2845833531112565, 'reduction': 'sum', 'lr': 4.608606544278746e-05, 'weight_decay': 0.12314920537638534, 'criterion': 'MSELoss', 'batch_size': 128}. Best is trial 10 with value: 4.300128796747935.[0m

Trial Id: 18 | Model params: 88934 | Timestamp: 2022-02-17 07:52:43.938126

epoch 0 -3.5819484878775123 9.218071312976488
epoch 5 0.0025324927846307466 4.300949478222273
epoch 10 -0.0025935547620108412 4.311986739511516
epoch 15 0.001937956206894631 4.30223106927445
epoch 20 0.0019293852191012428 4.302249542219616
epoch 25 0.0025710894742365653 4.300866265477644
epoch 30 0.0018990727138148422 4.302314873755225
epoch 35 0.002231634197215393 4.3015980607659365
epoch 40 0.001686290632860743 4.302773447984114
epoch 45 0.003362159748496407 4.299160398380506
epoch 50 0.0006783544864831237 4.30494502327087
epoch 55 0.002332992020019131 4.301379567324847
epoch 60 0.003316214323823341 4.299259493791999
epoch 65 0.003405933623892299 4.299065984456792
epoch 70 0.0032134823161459325 4.299481058637872
epoch 75 0.002744159608510821 4.3004931141751905
epoch 80 0.0010061019072021837 4.304239019183473
epoch 85 0.0031137847347200154 4.299696068139723
epoch 90 0.002711162601241157 4.30056426052651
epoch 95 0.002976021603253498 4.299993152763165
[32m[I 2022-02-17 11:03:15,817][0m Trial 18 finished with value: 4.302233377223318 and parameters: {'n_layers_fe': 4, 'fe_n_units_l0': 154, 'fe_dropout_l0': 0.20897143593536438, 'fe_n_units_l1': 188, 'fe_dropout_l1': 0.3604326118663477, 'fe_n_units_l2': 76, 'fe_dropout_l2': 0.40308965008488085, 'fe_n_units_l3': 110, 'fe_dropout_l3': 0.13390987675852256, 'n_units_l(Invariant)': 263, 'n_layers_mlp': 2, 'mlp_n_units_l0': 94, 'mlp_dropout_l0': 0.24782531636747823, 'mlp_n_units_l1': 46, 'mlp_dropout_l1': 0.15579497960934588, 'reduction': 'sum', 'lr': 0.00030219290418127327, 'weight_decay': 0.047134915115825245, 'criterion': 'MSELoss', 'batch_size': 128}. Best is trial 10 with value: 4.300128796747935.[0m

Trial Id: 19 | Model params: 86896 | Timestamp: 2022-02-17 11:03:15.818055

epoch 0 -0.5171575433446425 5.304327162166034
epoch 5 -0.009490592584454172 4.326792821173036
epoch 10 -0.017516723453579353 4.343959227753098
epoch 15 0.0003702507167564484 4.305608607201836
epoch 20 -0.004353365780408236 4.315769406380457
epoch 25 -0.0008961281974830815 4.308335019739962
epoch 30 -0.0027313278958640552 4.312282998905875
epoch 35 -0.0017055851624820928 4.310076812359814
epoch 40 -0.008086358802992244 4.323782420145783
epoch 45 0.00032079902859583065 4.305715105123251
epoch 50 -0.0022982969205425086 4.311351765529024
epoch 55 -0.006752085029462673 4.320920056392923
epoch 60 -0.0022679552865523256 4.311286508285902
epoch 65 -0.0019305925306212224 4.31056085906995
epoch 70 -0.006397559703486433 4.320159188598549
epoch 75 -0.0019202784950873575 4.3105386722075965
epoch 80 0.0007009463855386366 4.304896361544425
epoch 85 0.0007121628836543881 4.304872201610896
epoch 90 -0.00030792799318302144 4.3070688863760305
epoch 95 -0.0063182987050482975 4.319989063547235
[32m[I 2022-02-17 12:32:19,520][0m Trial 19 finished with value: 4.310786079402214 and parameters: {'n_layers_fe': 2, 'fe_n_units_l0': 88, 'fe_dropout_l0': 0.4265319613781987, 'fe_n_units_l1': 15, 'fe_dropout_l1': 0.19372413644225947, 'n_units_l(Invariant)': 463, 'n_layers_mlp': 4, 'mlp_n_units_l0': 54, 'mlp_dropout_l0': 0.3205381060657104, 'mlp_n_units_l1': 220, 'mlp_dropout_l1': 0.27472099130611705, 'mlp_n_units_l2': 253, 'mlp_dropout_l2': 0.4828666935200688, 'mlp_n_units_l3': 31, 'mlp_dropout_l3': 0.4749121858660094, 'reduction': 'sum', 'lr': 9.4180909822333e-05, 'weight_decay': 0.21803148266597452, 'criterion': 'MSELoss', 'batch_size': 128}. Best is trial 10 with value: 4.300128796747935.[0m

Trial Id: 20 | Model params: 34850 | Timestamp: 2022-02-17 12:32:19.520823

[32m[I 2022-02-17 12:34:13,704][0m Trial 20 pruned. [0m
++++++++++++++++++++
        NaN         
++++++++++++++++++++

Trial Id: 21 | Model params: 122193 | Timestamp: 2022-02-17 12:34:13.705160

[32m[I 2022-02-17 12:35:39,018][0m Trial 21 pruned. [0m
epoch 0 0.0008493311860289232 4.304576735052152

Trial Id: 22 | Model params: 153840 | Timestamp: 2022-02-17 12:35:39.019096

epoch 0 -3.5819484878775123 9.218071312976488
epoch 5 1.20221213751881e-05 4.306380019800388
epoch 10 0.00034968877064267545 4.305652889215738
epoch 15 -0.0024159911090999575 4.311604886857361
epoch 20 0.0025294269257278845 4.300956088008566
epoch 25 -0.00015503864133492584 4.306739722667662
epoch 30 -3.897995292412304e-05 4.306489836877281
epoch 35 -0.008581870839595052 4.324844939740877
epoch 40 -0.004647680689238598 4.31640170487321
epoch 45 0.002275750948798838 4.301502961223133
epoch 50 0.003049089969850649 4.299835584219378
epoch 55 0.0024349529596895403 4.301159762567804
epoch 60 -0.0008847021345532724 4.308310428053489
epoch 65 0.002174058789185973 4.301722169075678
epoch 70 -0.0014276235376549096 4.309478772829324
epoch 75 -0.00030400446206546583 4.307060439509372
epoch 80 -0.00020377088318213055 4.30684464366348
epoch 85 0.0036136221730316276 4.298618002008407
epoch 90 0.0024355939601296006 4.301158380680101
epoch 95 -0.007657280676162781 4.322862142878916
[32m[I 2022-02-17 15:31:39,938][0m Trial 22 finished with value: 4.309018020592721 and parameters: {'n_layers_fe': 2, 'fe_n_units_l0': 164, 'fe_dropout_l0': 0.4252988115028413, 'fe_n_units_l1': 223, 'fe_dropout_l1': 0.30370585765407376, 'n_units_l(Invariant)': 451, 'n_layers_mlp': 2, 'mlp_n_units_l0': 75, 'mlp_dropout_l0': 0.03934780024706325, 'mlp_n_units_l1': 167, 'mlp_dropout_l1': 0.05635047989312974, 'reduction': 'sum', 'lr': 0.004209839768969473, 'weight_decay': 0.05963299978106307, 'criterion': 'MSELoss', 'batch_size': 128}. Best is trial 10 with value: 4.300128796747935.[0m

Trial Id: 23 | Model params: 105462 | Timestamp: 2022-02-17 15:31:39.939294

[32m[I 2022-02-17 15:33:09,931][0m Trial 23 pruned. [0m
epoch 0 0.0022806047254047 4.301492498131825

Trial Id: 24 | Model params: 88737 | Timestamp: 2022-02-17 15:33:09.931342

[32m[I 2022-02-17 15:34:27,636][0m Trial 24 pruned. [0m
epoch 0 0.0011989770935506572 4.303823490630694

Trial Id: 25 | Model params: 113722 | Timestamp: 2022-02-17 15:34:27.636442

[32m[I 2022-02-17 15:35:44,818][0m Trial 25 pruned. [0m
epoch 0 -0.03655178703128237 4.384402985100775

Trial Id: 26 | Model params: 94517 | Timestamp: 2022-02-17 15:35:44.819080

[32m[I 2022-02-17 15:37:03,935][0m Trial 26 pruned. [0m
epoch 0 -0.23871417797171413 4.792923713785171

Trial Id: 27 | Model params: 168202 | Timestamp: 2022-02-17 15:37:03.935525

[32m[I 2022-02-17 15:38:46,342][0m Trial 27 pruned. [0m
epoch 0 -0.00394914619008313 4.314900840513022

Trial Id: 28 | Model params: 103266 | Timestamp: 2022-02-17 15:38:46.342734

[32m[I 2022-02-17 15:40:14,682][0m Trial 28 pruned. [0m
epoch 0 -0.017129627406608394 4.343132858336318

Trial Id: 29 | Model params: 53952 | Timestamp: 2022-02-17 15:40:14.682698

[32m[I 2022-02-17 15:41:01,007][0m Trial 29 pruned. [0m
epoch 0 -0.1950423389707059 4.707676466663084

Trial Id: 30 | Model params: 124744 | Timestamp: 2022-02-17 15:41:01.007520

[32m[I 2022-02-17 15:42:32,953][0m Trial 30 pruned. [0m
epoch 0 -0.17959126905874 4.677143956133006

Trial Id: 31 | Model params: 118121 | Timestamp: 2022-02-17 15:42:32.954118

[32m[I 2022-02-17 15:44:13,699][0m Trial 31 pruned. [0m
epoch 0 -0.14582200076557084 4.60970932426345

Trial Id: 32 | Model params: 140718 | Timestamp: 2022-02-17 15:44:13.699624

