[32m[I 2022-02-20 07:44:19,823][0m Trial 15 finished with value: 1.969758570868133 and parameters: {'n_layers_fe': 2, 'fe_n_units_l0': 54, 'fe_dropout_l0': 0.08049927214388655, 'fe_n_units_l1': 191, 'fe_dropout_l1': 0.08420852858314364, 'n_units_l(Invariant)': 406, 'n_layers_mlp': 2, 'mlp_n_units_l0': 255, 'mlp_dropout_l0': 0.15974617404356986, 'mlp_n_units_l1': 186, 'mlp_dropout_l1': 0.15390269749685404, 'reduction': 'sum', 'lr': 0.0006101706860606966, 'weight_decay': 0.11668822598926765, 'criterion': 'MSELoss', 'batch_size': 128}. Best is trial 15 with value: 1.969758570868133.[0m

Trial Id: 16 | Model params: 142399 | Timestamp: 2022-02-20 07:44:19.824039

epoch 0 -0.048791870750978905 2.0334422337143865
epoch 5 0.018096534537564102 1.9675309812440074
epoch 10 0.01734885118171159 1.9682799399145128
epoch 15 0.01296772230787302 1.9726628268466349
epoch 20 0.018990637559731738 1.9666349786791129
epoch 25 0.018916990342806916 1.966708797788388
epoch 30 0.013628206845891055 1.9720027008490884
epoch 35 0.016782571627834808 1.9688469957586336
epoch 40 0.015524361344838589 1.970106346667912
epoch 45 0.018535623311766503 1.9670910106150026
epoch 50 0.015434938131928089 1.9701958203084766
epoch 55 0.016711409363483143 1.9689182440254407
epoch 60 0.01788164402018233 1.9677462674891293
epoch 65 0.01043049322899714 1.9751966270310108
epoch 70 0.01540937810086529 1.9702213940066948
epoch 75 0.01863763358247328 1.9669887813820242
epoch 80 0.013418059902165935 1.972212757682248
epoch 85 0.01603787843927007 1.9695924613015283
epoch 90 0.01847654765935791 1.9671502106425052
epoch 95 0.01766913897505673 1.9679591407083954
[32m[I 2022-02-20 09:39:05,241][0m Trial 16 finished with value: 1.966982423578803 and parameters: {'n_layers_fe': 2, 'fe_n_units_l0': 33, 'fe_dropout_l0': 0.10116308560483325, 'fe_n_units_l1': 185, 'fe_dropout_l1': 0.10273737624558679, 'n_units_l(Invariant)': 435, 'n_layers_mlp': 2, 'mlp_n_units_l0': 252, 'mlp_dropout_l0': 0.11028577782216074, 'mlp_n_units_l1': 192, 'mlp_dropout_l1': 0.46306554363395136, 'reduction': 'sum', 'lr': 0.0002700833448744848, 'weight_decay': 0.11271272397596312, 'criterion': 'MSELoss', 'batch_size': 128}. Best is trial 16 with value: 1.966982423578803.[0m

Trial Id: 17 | Model params: 164452 | Timestamp: 2022-02-20 09:39:05.241978

[32m[I 2022-02-20 09:40:25,840][0m Trial 17 pruned. [0m
epoch 0 -0.013067851725387492 1.9985105725960721

Trial Id: 18 | Model params: 101714 | Timestamp: 2022-02-20 09:40:25.840884

epoch 0 -0.05957789821707804 2.0438716916731994
epoch 5 -0.0007842715082031493 1.986357519850265
epoch 10 -0.0023716642822946277 1.987932224969518
epoch 15 0.001467124459532121 1.9841219754863273
epoch 20 0.006383683531668294 1.9792312549441264
epoch 25 0.005319334442831614 1.9802910348163838
epoch 30 0.003613119294349376 1.9819887429210417
epoch 35 0.003913010299500308 1.9816904524986685
epoch 40 0.004390470491709264 1.981215447943038
epoch 45 0.002518879125642748 1.9830767623563001
epoch 50 0.005887582006618652 1.9797252973100974
epoch 55 0.006281131135957407 1.9793333917883198
epoch 60 0.00551891804414073 1.9800923512297601
epoch 65 0.003954678099583164 1.9816490035358734
epoch 70 0.005609849904446351 1.98000182281228
epoch 75 0.006069577264469106 1.979544071776001
epoch 80 -0.001710737870623813 1.9872767327949665
epoch 85 0.006142375387231946 1.9794715768971598
epoch 90 0.004605394439190613 1.9810015922019757
epoch 95 0.006495833092412195 1.9791195537894815
[32m[I 2022-02-20 11:05:37,546][0m Trial 18 finished with value: 1.9797030451806437 and parameters: {'n_layers_fe': 2, 'fe_n_units_l0': 32, 'fe_dropout_l0': 0.09953230459147745, 'fe_n_units_l1': 184, 'fe_dropout_l1': 0.00029556116490975226, 'n_units_l(Invariant)': 293, 'n_layers_mlp': 2, 'mlp_n_units_l0': 146, 'mlp_dropout_l0': 0.00652220251531288, 'mlp_n_units_l1': 254, 'mlp_dropout_l1': 0.11791635927906863, 'reduction': 'sum', 'lr': 0.00035229832556700366, 'weight_decay': 0.20096148214780338, 'criterion': 'MSELoss', 'batch_size': 128}. Best is trial 16 with value: 1.966982423578803.[0m

Trial Id: 19 | Model params: 154406 | Timestamp: 2022-02-20 11:05:37.547178

[32m[I 2022-02-20 11:06:53,055][0m Trial 19 pruned. [0m
epoch 0 -0.005479235727110732 1.9910113527192985

Trial Id: 20 | Model params: 45634 | Timestamp: 2022-02-20 11:06:53.055905

epoch 0 -0.10373529892818922 2.0860256739488667
epoch 5 0.004978528410131133 1.9806302579232793
epoch 10 0.016043930082006663 1.9695864045194744
epoch 15 0.015782092449425078 1.9698484474871518
epoch 20 0.016218879658249308 1.9694112983153267
epoch 25 0.016823538758276912 1.9688059779483464
epoch 30 0.01748501125570745 1.9681435688193094
epoch 35 0.01713227579056431 1.9684968314904254
epoch 40 0.016905786363291986 1.968723626015858
epoch 45 0.017372238313374755 1.9682565172094884
epoch 50 0.011367485032800051 1.9742612802222788
epoch 55 0.016353614189550725 1.9692764325466203
epoch 60 0.010639243935471332 1.9749882811615105
epoch 65 0.016648895259482765 1.9689808315530377
epoch 70 0.014978237379318249 1.9706527152505846
epoch 75 0.017241322329136777 1.9683876287388073
epoch 80 0.013402068030502479 1.9722287417805902
epoch 85 0.015892443047174187 1.9697380146016465
epoch 90 0.0164876906809025 1.9691422162894796
epoch 95 0.01439553565145979 1.971235510988109
[32m[I 2022-02-20 12:07:29,161][0m Trial 20 finished with value: 1.9689604547904602 and parameters: {'n_layers_fe': 2, 'fe_n_units_l0': 8, 'fe_dropout_l0': 0.10241326034992382, 'fe_n_units_l1': 143, 'fe_dropout_l1': 0.2564276647017404, 'n_units_l(Invariant)': 183, 'n_layers_mlp': 2, 'mlp_n_units_l0': 110, 'mlp_dropout_l0': 0.214559551699995, 'mlp_n_units_l1': 136, 'mlp_dropout_l1': 0.009435049480467056, 'reduction': 'sum', 'lr': 0.0001978157938520985, 'weight_decay': 0.12280961794826016, 'criterion': 'MSELoss', 'batch_size': 256}. Best is trial 16 with value: 1.966982423578803.[0m

Trial Id: 21 | Model params: 43691 | Timestamp: 2022-02-20 12:07:29.162045

epoch 0 -0.0876282883153221 2.0707488581302895
epoch 5 -0.02078088573034509 2.006104018215432
epoch 10 0.01173796189294829 1.9738913315081332
epoch 15 0.01626649916278955 1.9693636334825584
epoch 20 0.017554715727607806 1.9680737526623284
epoch 25 0.01733646673885092 1.9682923430820438
epoch 30 0.01771910104895058 1.9679090941435666
epoch 35 0.01837452351554736 1.9672524453881133
epoch 40 0.018229612113138782 1.967397646789921
epoch 45 0.01799998023329119 1.9676277162702775
epoch 50 0.018004613385117607 1.9676230745551468
epoch 55 0.01707390367430439 1.9685552847375312
epoch 60 0.008653583895736117 1.9769692014443876
epoch 65 0.017589180437306395 1.968039231815968
epoch 70 0.017665031926901387 1.967963254645375
epoch 75 0.016400014586115064 1.969229984815839
epoch 80 0.018129286374803488 1.9674981670244354
epoch 85 0.01782875240779591 1.9677992528910406
epoch 90 0.015804701710169677 1.9698258218711115
epoch 95 0.018329810027002513 1.9672972495013552
[32m[I 2022-02-20 13:21:51,557][0m Trial 21 finished with value: 1.968222709257326 and parameters: {'n_layers_fe': 2, 'fe_n_units_l0': 8, 'fe_dropout_l0': 0.10239704698541281, 'fe_n_units_l1': 137, 'fe_dropout_l1': 0.24091303913852533, 'n_units_l(Invariant)': 178, 'n_layers_mlp': 2, 'mlp_n_units_l0': 106, 'mlp_dropout_l0': 0.2223197117168636, 'mlp_n_units_l1': 141, 'mlp_dropout_l1': 0.001491080460848367, 'reduction': 'sum', 'lr': 0.00018747341968207494, 'weight_decay': 0.11750962079614885, 'criterion': 'MSELoss', 'batch_size': 256}. Best is trial 16 with value: 1.966982423578803.[0m

Trial Id: 22 | Model params: 44071 | Timestamp: 2022-02-20 13:21:51.557992

epoch 0 -0.04721247562170161 2.0319105576660883
epoch 5 0.01742073156264623 1.968207949310604
epoch 10 0.02260987571188222 1.9630038729991932
epoch 15 0.01985484191095266 1.9657685501621898
epoch 20 0.021210334467278158 1.9644087992619492
epoch 25 0.023337375751953715 1.9622731764220818
epoch 30 0.02318631225395218 1.9624249260545719
epoch 35 0.024120202966682047 1.9614866055308873
epoch 40 0.02231562056666314 1.963299343818229
epoch 45 0.024223141873995546 1.9613831508772546
epoch 50 0.02277794795479282 1.9628350864316002
epoch 55 0.02416860267509613 1.9614379640090591
epoch 60 0.024596262910607902 1.9610081146781524
epoch 65 0.02430469553352743 1.9613011847418853
epoch 70 0.024774155592628633 1.9608292836532089
epoch 75 0.01986462798449895 1.965758736715954
epoch 80 0.02436676901309487 1.9612387950158796
epoch 85 0.020667685158546445 1.9649532662744567
epoch 90 0.022154789282815 1.9634608207610689
epoch 95 0.02453974799164671 1.9610649242869316
[32m[I 2022-02-20 15:52:42,676][0m Trial 22 finished with value: 1.961104724053294 and parameters: {'n_layers_fe': 2, 'fe_n_units_l0': 9, 'fe_dropout_l0': 0.11253583199808509, 'fe_n_units_l1': 134, 'fe_dropout_l1': 0.266501474525971, 'n_units_l(Invariant)': 187, 'n_layers_mlp': 2, 'mlp_n_units_l0': 111, 'mlp_dropout_l0': 0.24169653234181526, 'mlp_n_units_l1': 130, 'mlp_dropout_l1': 0.00424916675660314, 'reduction': 'sum', 'lr': 0.00017860518103844105, 'weight_decay': 0.06561155359206204, 'criterion': 'MSELoss', 'batch_size': 256}. Best is trial 22 with value: 1.961104724053294.[0m

Trial Id: 23 | Model params: 36258 | Timestamp: 2022-02-20 15:52:42.676597

[32m[I 2022-02-20 15:53:46,347][0m Trial 23 pruned. [0m
epoch 0 -0.04547914548175935 2.0302282675486665

Trial Id: 24 | Model params: 25084 | Timestamp: 2022-02-20 15:53:46.347195

epoch 0 -0.09704673166648958 2.0796954763056914
epoch 5 0.020156930540422113 1.9654655939696257
epoch 10 0.022156669872959056 1.963458932698008
epoch 15 0.02238583115883075 1.9632288472002608
epoch 20 0.021874142172288447 1.963742562731956
epoch 25 0.023430592356247115 1.9621795305701577
epoch 30 0.02308904667029421 1.9625226272113279
epoch 35 0.019566745317372902 1.966057430645203
epoch 40 0.02271682123671348 1.9628964746240347
epoch 45 0.022737429710928403 1.9628757782099735
epoch 50 0.02261522423044171 1.9629985019724403
epoch 55 0.022139152181573918 1.963476519929279
epoch 60 0.022894881660591393 1.9627176471829892
epoch 65 0.023099888437552285 1.9625117371335146
epoch 70 0.02288005035548224 1.9627325429978102
epoch 75 0.02304916402885615 1.9625626870484865
epoch 80 0.023223672620344415 1.9623873970885934
epoch 85 0.021649315782888756 1.9639682370555833
epoch 90 0.023056937651567355 1.9625548789522838
epoch 95 0.022747359649287202 1.9628658058209814
[32m[I 2022-02-20 17:14:21,995][0m Trial 24 finished with value: 1.9623335191121376 and parameters: {'n_layers_fe': 2, 'fe_n_units_l0': 31, 'fe_dropout_l0': 0.12094641947145594, 'fe_n_units_l1': 134, 'fe_dropout_l1': 0.41354346864740166, 'n_units_l(Invariant)': 24, 'n_layers_mlp': 2, 'mlp_n_units_l0': 92, 'mlp_dropout_l0': 0.23266369574062856, 'mlp_n_units_l1': 162, 'mlp_dropout_l1': 0.018955968043083055, 'reduction': 'sum', 'lr': 0.00017768736059454687, 'weight_decay': 0.08067926807042006, 'criterion': 'MSELoss', 'batch_size': 256}. Best is trial 22 with value: 1.961104724053294.[0m

Trial Id: 25 | Model params: 19785 | Timestamp: 2022-02-20 17:14:21.995555

[32m[I 2022-02-20 17:15:20,020][0m Trial 25 pruned. [0m
epoch 0 -0.027760696584799627 2.012950919673998

Trial Id: 26 | Model params: 42934 | Timestamp: 2022-02-20 17:15:20.021091

epoch 0 -0.12627044701195667 2.1072134392979525
epoch 5 -0.06287001523234181 2.0470443920401635
epoch 10 -0.0151435622045768 2.0005569343431007
epoch 15 0.012283570816819411 1.9733463741127142
epoch 20 0.015616015220002666 1.9700146368901668
epoch 25 0.0232763618227233 1.962334468890907
epoch 30 0.023161145660741345 1.9624502058148474
epoch 35 0.025539360516369514 1.9600598564104836
epoch 40 0.02520500262701575 1.9603960963993652
epoch 45 0.02551135437952945 1.9600880224070985
epoch 50 0.02577005120512177 1.9598278335332675
epoch 55 0.026520175761439724 1.9590731872201579
epoch 60 0.0272902683697821 1.9582981499634107
epoch 65 0.025874128265807705 1.9597231464578373
epoch 70 0.027592570488704227 1.9579938229561404
epoch 75 0.02767461516412484 1.9579112205657128
epoch 80 0.027682362954264517 1.9579034199283414
epoch 85 0.02768144654636817 1.9579043425886238
epoch 90 0.02791128183403835 1.9576729255794143
epoch 95 0.027731788755053666 1.9578536562654545
[32m[I 2022-02-20 19:02:36,345][0m Trial 26 finished with value: 1.9581135594852626 and parameters: {'n_layers_fe': 2, 'fe_n_units_l0': 79, 'fe_dropout_l0': 0.12689766119633553, 'fe_n_units_l1': 124, 'fe_dropout_l1': 0.3891204074200031, 'n_units_l(Invariant)': 2, 'n_layers_mlp': 2, 'mlp_n_units_l0': 135, 'mlp_dropout_l0': 0.267892922728704, 'mlp_n_units_l1': 213, 'mlp_dropout_l1': 0.4506708357283882, 'reduction': 'sum', 'lr': 2.181493371289924e-05, 'weight_decay': 0.044485276742027235, 'criterion': 'MSELoss', 'batch_size': 256}. Best is trial 26 with value: 1.9581135594852626.[0m

Trial Id: 27 | Model params: 44126 | Timestamp: 2022-02-20 19:02:36.345324

epoch 0 -0.07244049962018995 2.056239920137267
epoch 5 -0.06547739350347492 2.049553706269343
epoch 10 -0.03058364914892131 2.0157135123275767
epoch 15 -0.024240904672672814 2.0095010674962728
epoch 20 -0.009029936484774792 1.9945237351999594
epoch 25 0.02345339051625217 1.9621566267480481
epoch 30 0.024311609670918055 1.9612942354771825
epoch 35 0.024633372463749637 1.9609708107268509
epoch 40 0.025568778302723194 1.9600302702707555
epoch 45 0.02569670612991337 1.959901605138566
epoch 50 0.0263996688222915 1.9591944401736328
epoch 55 0.02666216411819755 1.9589303102341642
epoch 60 0.026878993059063716 1.9587121041669837
epoch 65 0.026699488027979168 1.9588927510042609
epoch 70 0.027173084615078613 1.9584161059226894
epoch 75 0.027324898412260823 1.9582632903596078
epoch 80 0.027411924232551232 1.9581756849089476
epoch 85 0.027617642555918143 1.9579685808263076
epoch 90 0.027737486700123437 1.9578479192893796
epoch 95 0.027422556487749383 1.9581649815695665
[32m[I 2022-02-20 20:27:45,481][0m Trial 27 finished with value: 1.9578941626980841 and parameters: {'n_layers_fe': 2, 'fe_n_units_l0': 84, 'fe_dropout_l0': 0.14024059926986243, 'fe_n_units_l1': 89, 'fe_dropout_l1': 0.39307948297529455, 'n_units_l(Invariant)': 7, 'n_layers_mlp': 2, 'mlp_n_units_l0': 141, 'mlp_dropout_l0': 0.2824209381386699, 'mlp_n_units_l1': 225, 'mlp_dropout_l1': 0.027848311848587368, 'reduction': 'sum', 'lr': 1.1264317160055002e-05, 'weight_decay': 0.03447436540140723, 'criterion': 'MSELoss', 'batch_size': 256}. Best is trial 27 with value: 1.9578941626980841.[0m

Trial Id: 28 | Model params: 56294 | Timestamp: 2022-02-20 20:27:45.481672

epoch 0 -0.12651627772504104 2.1074433971735083
epoch 5 -0.16004756386011998 2.1385779337934383
epoch 10 -0.12756627647975005 2.1084253170973986
epoch 15 -0.04576849126345062 2.0305091901039165
epoch 20 -0.006285773550284368 1.9918097302536066
epoch 25 0.010806580449030379 1.9748212532969094
epoch 30 0.018927810460794725 1.9666979525899169
epoch 35 0.02197059560502823 1.963645737574257
epoch 40 0.02409951123051124 1.9615074002785238
epoch 45 0.025097133459498266 1.9605045604588296
epoch 50 0.02600711420552826 1.959589372924514
epoch 55 0.026538540967063207 1.9590547076632578
epoch 60 0.027020857242739393 1.958569325817905
epoch 65 0.027223635683388814 1.9583652226098904
epoch 70 0.02714416558435595 1.9584452144278859
epoch 75 0.027366679163413288 1.9582212318193408
epoch 80 0.028274647537241848 1.9573070033780997
epoch 85 0.028519490987618523 1.9570603987224693
epoch 90 0.02874908144814281 1.956829128540345
epoch 95 0.028818245050818536 1.956759453567949
[32m[I 2022-02-20 21:57:57,500][0m Trial 28 finished with value: 1.9566245248376273 and parameters: {'n_layers_fe': 2, 'fe_n_units_l0': 155, 'fe_dropout_l0': 0.20066810553082912, 'fe_n_units_l1': 85, 'fe_dropout_l1': 0.38796268615649776, 'n_units_l(Invariant)': 28, 'n_layers_mlp': 2, 'mlp_n_units_l0': 144, 'mlp_dropout_l0': 0.30272059617807706, 'mlp_n_units_l1': 249, 'mlp_dropout_l1': 0.04251357822410395, 'reduction': 'sum', 'lr': 1.2631543172064806e-05, 'weight_decay': 0.031116934435627564, 'criterion': 'MSELoss', 'batch_size': 256}. Best is trial 28 with value: 1.9566245248376273.[0m

Trial Id: 29 | Model params: 75400 | Timestamp: 2022-02-20 21:57:57.500485

[32m[I 2022-02-20 21:59:16,655][0m Trial 29 pruned. [0m
++++++++++++++++++++
        NaN         
++++++++++++++++++++

Trial Id: 30 | Model params: 45226 | Timestamp: 2022-02-20 21:59:16.655431

epoch 0 -0.12853038801181893 2.1093265159314902
epoch 5 -0.13614565763766517 2.1164313680117766
epoch 10 -0.03335263584132386 2.0184196196006954
epoch 15 0.0033636506278450495 1.9822368459186182
epoch 20 0.014535373310967992 1.9710956664823878
epoch 25 0.021766666090441755 1.963850447395958
epoch 30 0.023388919002770958 1.962221396375182
epoch 35 0.025628252361733495 1.9599704544868748
epoch 40 0.026057827919206966 1.959538356459471
epoch 45 0.026475968699954278 1.9591176688229075
epoch 50 0.026807132682986734 1.9587844236365173
epoch 55 0.02686442993348659 1.9587267605475458
epoch 60 0.027583639670731408 1.9580028142728172
epoch 65 0.027702589443211467 1.9578830553291986
epoch 70 0.027973172969467996 1.9576106038352605
epoch 75 0.027936427588995172 1.9576476051116907
epoch 80 0.027959539757638985 1.9576243320707984
epoch 85 0.02734587444894032 1.9582421749717462
epoch 90 0.02815799621276316 1.9574244828705887
epoch 95 0.02822986941493244 1.9573521002372625
[32m[I 2022-02-20 23:06:31,681][0m Trial 30 finished with value: 1.9571910554084266 and parameters: {'n_layers_fe': 2, 'fe_n_units_l0': 118, 'fe_dropout_l0': 0.2769301342214202, 'fe_n_units_l1': 8, 'fe_dropout_l1': 0.40367356660684023, 'n_units_l(Invariant)': 43, 'n_layers_mlp': 2, 'mlp_n_units_l0': 168, 'mlp_dropout_l0': 0.31090570860294275, 'mlp_n_units_l1': 231, 'mlp_dropout_l1': 0.1081044833583623, 'reduction': 'sum', 'lr': 1.8266207837607883e-05, 'weight_decay': 0.038941771089836374, 'criterion': 'MSELoss', 'batch_size': 256}. Best is trial 28 with value: 1.9566245248376273.[0m

Trial Id: 31 | Model params: 38275 | Timestamp: 2022-02-20 23:06:31.681494

epoch 0 -0.1153709476067224 2.096992355428026
epoch 5 -0.1928849568836375 2.1686350073607343
epoch 10 -0.08269766298051695 2.0660497873495296
epoch 15 -0.0074333490250049206 1.9929451436501595
epoch 20 0.01848508616855382 1.9671416542668767
epoch 25 0.02347082740969908 1.9621391088597957
epoch 30 0.02513827048912598 1.9604631972688416
epoch 35 0.026260814180903536 1.9593341451088586
epoch 40 0.026859928180291703 1.9587312911055306
epoch 45 0.027249095676655455 1.9583395947814117
epoch 50 0.027822523335789495 1.9577622981538987
epoch 55 0.028198396034497475 1.9573837970277679
epoch 60 0.028546026979287986 1.9570336699859714
epoch 65 0.028452299975256556 1.957128076146054
epoch 70 0.02909635725529014 1.9564792600573695
epoch 75 0.029240366935476603 1.9563341568830452
epoch 80 0.029369331747152283 1.9562042036806782
epoch 85 0.02919383781143914 1.9563810404888475
epoch 90 0.02974355064828471 1.9558270678740761
epoch 95 0.02972216824793472 1.955848618901644
[32m[I 2022-02-21 00:12:50,489][0m Trial 31 finished with value: 1.9556633508598416 and parameters: {'n_layers_fe': 2, 'fe_n_units_l0': 148, 'fe_dropout_l0': 0.27716693487580235, 'fe_n_units_l1': 9, 'fe_dropout_l1': 0.385779518773688, 'n_units_l(Invariant)': 46, 'n_layers_mlp': 2, 'mlp_n_units_l0': 137, 'mlp_dropout_l0': 0.3194665718972432, 'mlp_n_units_l1': 233, 'mlp_dropout_l1': 0.044769510012621944, 'reduction': 'sum', 'lr': 1.920808009769594e-05, 'weight_decay': 0.027589086344317587, 'criterion': 'MSELoss', 'batch_size': 256}. Best is trial 31 with value: 1.9556633508598416.[0m

Trial Id: 32 | Model params: 47182 | Timestamp: 2022-02-21 00:12:50.490330

epoch 0 -0.10162703194412237 2.084032441877023
epoch 5 -0.04394670574883364 2.0287397905204743
epoch 10 -0.01423285574009081 1.9996593623126215
epoch 15 0.013738886527298932 1.9718920596308278
epoch 20 0.021330871828475595 1.9642878376540902
epoch 25 0.024045690663438535 1.9615614877527725
epoch 30 0.025912675825919274 1.9596843715441796
epoch 35 0.02648346923345657 1.9591101217796187
epoch 40 0.027203478936873027 1.9583855119941427
epoch 45 0.027520912440337386 1.9580659652635048
epoch 50 0.028011124799663167 1.9575723869731503
epoch 55 0.02830463914962944 1.9572767977002392
epoch 60 0.028446048829496307 1.9571343724263066
epoch 65 0.02840148849625601 1.957179253907037
epoch 70 0.028670834526634548 1.95690795099938
epoch 75 0.02923186383843379 1.9563427248447685
epoch 80 0.02939894310384661 1.9561743641628604
epoch 85 0.02941952141630466 1.956153627022523
epoch 90 0.029591017686789622 1.955980798555793
epoch 95 0.029692311445440378 1.9558787107654343
