[32m[I 2022-02-18 19:10:55,382][0m Trial 16 finished with value: 7.198238470372109 and parameters: {'n_layers_fe': 2, 'fe_n_units_l0': 63, 'fe_dropout_l0': 0.49048997101370706, 'fe_n_units_l1': 256, 'fe_dropout_l1': 0.23175674613989303, 'n_units_l(Invariant)': 317, 'n_layers_mlp': 2, 'mlp_n_units_l0': 201, 'mlp_dropout_l0': 0.18175083699920744, 'mlp_n_units_l1': 84, 'mlp_dropout_l1': 0.3640341186429992, 'reduction': 'sum', 'lr': 3.198466184041791e-05, 'weight_decay': 0.2995157910387775, 'criterion': 'MSELoss', 'batch_size': 32}. Best is trial 6 with value: 7.136441404801938.[0m

Trial Id: 17 | Model params: 55604 | Timestamp: 2022-02-18 19:10:55.382240

epoch 0 -14.782542885401767 28.61218636704308
epoch 5 -14.747429848056411 28.580340415757025
epoch 10 -14.773363434507942 28.603864439374412
epoch 15 -14.760472044237522 28.592173243817186
epoch 20 -14.780962552334014 28.610753837553055
epoch 25 -14.73741083110243 28.57124710725547
epoch 30 -14.761026441593565 28.59267612487965
epoch 35 -14.79600401928309 28.624385617308068
epoch 40 -14.786260698159118 28.61555618166872
epoch 45 -14.74080885158962 28.574331491463884
epoch 50 -14.744081159308683 28.577301451499896
epoch 55 -14.759366561824562 28.591170459799343
epoch 60 -14.774143104785201 28.604571368731243
epoch 65 -14.767825005959873 28.59884222680517
epoch 70 -14.804170478740847 28.63178399727113
epoch 75 -14.803658906833398 28.63132059633195
epoch 80 -14.816125240316799 28.642610932071776
epoch 85 -14.743404772814406 28.57668758562368
epoch 90 -14.791492657694036 28.620297742449782
epoch 95 -14.7998495722979 28.6278697229567
[32m[I 2022-02-18 20:55:15,732][0m Trial 17 finished with value: 28.614215071685333 and parameters: {'n_layers_fe': 2, 'fe_n_units_l0': 143, 'fe_dropout_l0': 0.41236940786341314, 'fe_n_units_l1': 140, 'fe_dropout_l1': 0.2731109811929734, 'n_units_l(Invariant)': 165, 'n_layers_mlp': 2, 'mlp_n_units_l0': 62, 'mlp_dropout_l0': 0.00022098178583068728, 'mlp_n_units_l1': 152, 'mlp_dropout_l1': 0.49933503598238105, 'reduction': 'sum', 'lr': 0.0007617013452078092, 'weight_decay': 0.15173286777408704, 'criterion': 'PoissonNLLLoss', 'batch_size': 32}. Best is trial 6 with value: 7.136441404801938.[0m

Trial Id: 18 | Model params: 148914 | Timestamp: 2022-02-18 20:55:15.732954

[32m[I 2022-02-18 20:56:46,779][0m Trial 18 pruned. [0m
++++++++++++++++++++
        NaN         
++++++++++++++++++++

Trial Id: 19 | Model params: 157315 | Timestamp: 2022-02-18 20:56:46.779890

[32m[I 2022-02-18 20:58:08,542][0m Trial 19 pruned. [0m
epoch 0 -0.015185486221180433 7.256634616941389

Trial Id: 20 | Model params: 139334 | Timestamp: 2022-02-18 20:58:08.543071

[32m[I 2022-02-18 20:59:30,764][0m Trial 20 pruned. [0m
epoch 0 -0.0061120376755752215 7.2241329293918035

Trial Id: 21 | Model params: 115836 | Timestamp: 2022-02-18 20:59:30.764729

[32m[I 2022-02-18 21:00:45,088][0m Trial 21 pruned. [0m
epoch 0 -0.7936014882755855 9.645517513960732

Trial Id: 22 | Model params: 90096 | Timestamp: 2022-02-18 21:00:45.088867

[32m[I 2022-02-18 21:01:47,877][0m Trial 22 pruned. [0m
epoch 0 -0.8024027741783415 9.669154054516078

Trial Id: 23 | Model params: 141954 | Timestamp: 2022-02-18 21:01:47.877520

[32m[I 2022-02-18 21:03:08,981][0m Trial 23 pruned. [0m
epoch 0 -0.06692818576911352 7.439267072110449

Trial Id: 24 | Model params: 66879 | Timestamp: 2022-02-18 21:03:08.982163

epoch 0 -1.3802657223141783 11.11156618315965
epoch 5 -1.0733842701956702 10.370565906493777
epoch 10 -0.933285953235129 10.014069562161296
epoch 15 -0.18632353627482745 7.844479447785622
epoch 20 -0.08185486146905041 7.491125218674329
epoch 25 -0.0399088378959751 7.344465425759795
epoch 30 -0.061217536660550076 7.41933131454364
epoch 35 -0.08903234885902012 7.515933801710848
epoch 40 -0.0610213856758719 7.418645603863575
epoch 45 -0.07599210672902501 7.470799806345967
epoch 50 -0.07615915228498737 7.471379696973014
epoch 55 -0.0609771986843024 7.418491124864283
epoch 60 -0.08913427394994788 7.516285510415092
epoch 65 -0.07415054373394336 7.464403922903097
epoch 70 -0.06839112499556554 7.444365572478326
epoch 75 -0.06327292588324007 7.426512800098241
epoch 80 -0.06323371489791407 7.426375862740913
epoch 85 -0.058234302657639514 7.4088955755117905
epoch 90 -0.04469887597301514 7.361361065491138
epoch 95 -0.04619785748941263 7.366640380443493
[32m[I 2022-02-18 22:42:44,259][0m Trial 24 finished with value: 7.462637041246124 and parameters: {'n_layers_fe': 2, 'fe_n_units_l0': 30, 'fe_dropout_l0': 0.48926959500812933, 'fe_n_units_l1': 151, 'fe_dropout_l1': 0.0692961705957349, 'n_units_l(Invariant)': 286, 'n_layers_mlp': 2, 'mlp_n_units_l0': 126, 'mlp_dropout_l0': 0.28565537522383144, 'mlp_n_units_l1': 120, 'mlp_dropout_l1': 0.2792234877100712, 'reduction': 'sum', 'lr': 1.9747813317507833e-05, 'weight_decay': 0.05453235813394061, 'criterion': 'MSELoss', 'batch_size': 32}. Best is trial 6 with value: 7.136441404801938.[0m

Trial Id: 25 | Model params: 30175 | Timestamp: 2022-02-18 22:42:44.259559

[32m[I 2022-02-18 22:43:42,864][0m Trial 25 pruned. [0m
epoch 0 -0.8134476661240524 9.698734472527676

Trial Id: 26 | Model params: 113431 | Timestamp: 2022-02-18 22:43:42.864305

[32m[I 2022-02-18 22:45:04,206][0m Trial 26 pruned. [0m
epoch 0 -0.1605798568994341 7.7588984980005

Trial Id: 27 | Model params: 121493 | Timestamp: 2022-02-18 22:45:04.206792

[32m[I 2022-02-18 22:46:10,964][0m Trial 27 pruned. [0m
++++++++++++++++++++
        NaN         
++++++++++++++++++++

Trial Id: 28 | Model params: 11668 | Timestamp: 2022-02-18 22:46:10.964222

[32m[I 2022-02-18 22:47:08,291][0m Trial 28 pruned. [0m
epoch 0 -0.8750681371793578 9.862138177942816

Trial Id: 29 | Model params: 89938 | Timestamp: 2022-02-18 22:47:08.291740

[32m[I 2022-02-18 22:48:19,492][0m Trial 29 pruned. [0m
++++++++++++++++++++
        NaN         
++++++++++++++++++++

Trial Id: 30 | Model params: 177954 | Timestamp: 2022-02-18 22:48:19.492941

[32m[I 2022-02-18 22:50:02,162][0m Trial 30 pruned. [0m
epoch 0 -0.5486721521701525 8.96277100776513

Trial Id: 31 | Model params: 93853 | Timestamp: 2022-02-18 22:50:02.162780

[32m[I 2022-02-18 22:51:13,457][0m Trial 31 pruned. [0m
epoch 0 -0.7582205024149664 9.54990884339237

Trial Id: 32 | Model params: 88510 | Timestamp: 2022-02-18 22:51:13.457552

epoch 0 -1.3240870500914457 10.979656453517281
epoch 5 -0.6874881035995304 9.355842800357332
epoch 10 -0.43191823359919446 8.618301153479958
epoch 15 -0.057921641485625175 7.407800995087969
epoch 20 -0.013307998279321387 7.249921287608621
epoch 25 -0.0336741134248868 7.3224156281285175
epoch 30 -0.005204936657683179 7.2208755903534465
epoch 35 -0.006598911284988462 7.225880654363475
epoch 40 0.00041015787090148415 7.200679370265838
epoch 45 -0.011137024821044728 7.2421507844558635
epoch 50 -0.019169103300305412 7.2708582986609605
epoch 55 -0.03880799849022698 7.340576999441402
epoch 60 -0.02562395322452149 7.293846742195189
epoch 65 -0.030281904708048923 7.310390767498784
epoch 70 -0.0384947963590192 7.339470318666748
epoch 75 -0.04123153977544458 7.349134801936567
epoch 80 -0.016012540164292544 7.2595899420998204
epoch 85 -0.027155485148455893 7.299290546415026
epoch 90 -0.030041081628061406 7.3095363345022895
epoch 95 -0.04081254279004809 7.34765598812327
[32m[I 2022-02-19 00:44:15,600][0m Trial 32 finished with value: 7.311504040776195 and parameters: {'n_layers_fe': 2, 'fe_n_units_l0': 21, 'fe_dropout_l0': 0.456513201708849, 'fe_n_units_l1': 190, 'fe_dropout_l1': 0.09180394220035733, 'n_units_l(Invariant)': 422, 'n_layers_mlp': 2, 'mlp_n_units_l0': 102, 'mlp_dropout_l0': 0.07256396815607448, 'mlp_n_units_l1': 8, 'mlp_dropout_l1': 0.21865370326419098, 'reduction': 'sum', 'lr': 2.8431752233857658e-05, 'weight_decay': 0.18508136092929894, 'criterion': 'MSELoss', 'batch_size': 32}. Best is trial 6 with value: 7.136441404801938.[0m

Trial Id: 33 | Model params: 100030 | Timestamp: 2022-02-19 00:44:15.601042

[32m[I 2022-02-19 00:45:28,313][0m Trial 33 pruned. [0m
epoch 0 -0.645487967807854 9.238679721434892

Trial Id: 34 | Model params: 149003 | Timestamp: 2022-02-19 00:45:28.313512

[32m[I 2022-02-19 00:46:56,332][0m Trial 34 pruned. [0m
epoch 0 -0.885646304878358 9.889917603229248

Trial Id: 35 | Model params: 110778 | Timestamp: 2022-02-19 00:46:56.332538

[32m[I 2022-02-19 00:48:16,742][0m Trial 35 pruned. [0m
epoch 0 -0.9104673268141736 9.954795974046727

Trial Id: 36 | Model params: 130645 | Timestamp: 2022-02-19 00:48:16.743128

epoch 0 -2.8799566633959097 14.186523883742824
epoch 5 -0.07849065613766948 7.479468707707821
epoch 10 -0.033209323570981164 7.320769186995178
epoch 15 -0.018356465985027715 7.267959001075273
epoch 20 -0.009547843771039899 7.236457384745586
epoch 25 -0.013280985287638991 7.249824651951452
epoch 30 -0.002448833966242514 7.210969582991329
epoch 35 -0.005486319900610992 7.221886175929246
epoch 40 0.0006539057067219689 7.199801381640203
epoch 45 0.008862191751570214 7.1701720654162155
epoch 50 0.017801132374489326 7.137765415994098
epoch 55 0.014189260936103176 7.150877339824669
epoch 60 0.017015953474855294 7.140617844036129
epoch 65 0.021115725611409064 7.125711450328889
epoch 70 0.021358239148191127 7.124828716498545
epoch 75 0.01927888390614163 7.132393889662492
epoch 80 0.020819598627282776 7.126789185427709
epoch 85 0.021741411363740637 7.123433771079158
epoch 90 0.025689369301657106 7.109045219503361
epoch 95 0.02619674445908926 7.107193950242332
[32m[I 2022-02-19 02:51:20,628][0m Trial 36 finished with value: 7.121007069229825 and parameters: {'n_layers_fe': 2, 'fe_n_units_l0': 60, 'fe_dropout_l0': 0.35265171316177163, 'fe_n_units_l1': 238, 'fe_dropout_l1': 0.3073093781758458, 'n_units_l(Invariant)': 405, 'n_layers_mlp': 4, 'mlp_n_units_l0': 45, 'mlp_dropout_l0': 0.23994507403475118, 'mlp_n_units_l1': 93, 'mlp_dropout_l1': 0.30007533295077155, 'mlp_n_units_l2': 126, 'mlp_dropout_l2': 0.4990114485359812, 'mlp_n_units_l3': 11, 'mlp_dropout_l3': 0.18314681558519413, 'reduction': 'sum', 'lr': 0.00020144682939683762, 'weight_decay': 0.09474743219922378, 'criterion': 'MSELoss', 'batch_size': 256}. Best is trial 36 with value: 7.121007069229825.[0m

Trial Id: 37 | Model params: 120722 | Timestamp: 2022-02-19 02:51:20.628993

[32m[I 2022-02-19 02:52:38,388][0m Trial 37 pruned. [0m
++++++++++++++++++++
        NaN         
++++++++++++++++++++

Trial Id: 38 | Model params: 179035 | Timestamp: 2022-02-19 02:52:38.388703

epoch 0 -2.766719981642967 13.977973863759765
epoch 5 0.0033469053571605345 7.190093962673721
epoch 10 0.003432991087703008 7.189783434436221
epoch 15 0.00583511296909911 7.181113091223372
epoch 20 0.011774283992319723 7.159630866187699
epoch 25 0.019715692264155704 7.130805346193969
epoch 30 0.023076452308231854 7.118571394860809
epoch 35 0.01630113548446921 7.143213671766932
epoch 40 0.027001883563557372 7.104255233914283
epoch 45 0.026102873190814058 7.107536496454287
epoch 50 0.02818478913211797 7.099935483115022
epoch 55 0.0278828956053655 7.101038191789143
epoch 60 0.026267387629164807 7.106936154936126
epoch 65 0.02611143133083227 7.1075052675778085
epoch 70 0.029124841064550044 7.096500713408836
epoch 75 0.02873359813928167 7.09793044204866
epoch 80 0.02539229941972787 7.110128920225851
epoch 85 0.027997089264708674 7.100621103483778
epoch 90 0.02804219755778814 7.100456340286888
epoch 95 0.029507163460000374 7.095103304955407
[32m[I 2022-02-19 04:57:42,351][0m Trial 38 finished with value: 7.099709675922483 and parameters: {'n_layers_fe': 2, 'fe_n_units_l0': 139, 'fe_dropout_l0': 0.3347004722213295, 'fe_n_units_l1': 221, 'fe_dropout_l1': 0.3355941678542747, 'n_units_l(Invariant)': 370, 'n_layers_mlp': 4, 'mlp_n_units_l0': 248, 'mlp_dropout_l0': 0.32901290984810594, 'mlp_n_units_l1': 96, 'mlp_dropout_l1': 0.33654467425845086, 'mlp_n_units_l2': 183, 'mlp_dropout_l2': 0.2616829609706729, 'mlp_n_units_l3': 94, 'mlp_dropout_l3': 0.18595336712686292, 'reduction': 'sum', 'lr': 0.00021217863084381576, 'weight_decay': 0.09945475299084883, 'criterion': 'MSELoss', 'batch_size': 256}. Best is trial 38 with value: 7.099709675922483.[0m

Trial Id: 39 | Model params: 128969 | Timestamp: 2022-02-19 04:57:42.351291

[32m[I 2022-02-19 04:59:10,580][0m Trial 39 pruned. [0m
++++++++++++++++++++
        NaN         
++++++++++++++++++++

Trial Id: 40 | Model params: 165466 | Timestamp: 2022-02-19 04:59:10.580530

epoch 0 -3.9572651085826998 16.035541447669857
epoch 5 -0.014236532309046757 7.253242221220569
epoch 10 -0.005585823652303867 7.222243508981437
epoch 15 0.00840382965073172 7.171829834506742
epoch 20 0.014933431053416157 7.1481777983880495
epoch 25 0.02128128060472101 7.125108852541788
epoch 30 0.025406984393176346 7.110075353827976
epoch 35 0.024740754899190698 7.112505154044749
epoch 40 0.027189704768165956 7.103569521294632
epoch 45 0.025863145699642653 7.10841121258472
epoch 50 0.02806321170372894 7.100379582411232
epoch 55 0.02834522379617299 7.099349403185929
epoch 60 0.028088095808510904 7.100288687755031
epoch 65 0.028278678276388636 7.099592504861138
epoch 70 0.027720207961173915 7.101632360351549
epoch 75 0.027656371016458015 7.101865492354803
epoch 80 0.02786021381462478 7.101121033312087
epoch 85 0.028929811495515323 7.097213450759315
epoch 90 0.02544296214819952 7.109944116015872
epoch 95 0.026591055554018306 7.105754886878917
[32m[I 2022-02-19 07:00:22,145][0m Trial 40 finished with value: 7.096149053865113 and parameters: {'n_layers_fe': 2, 'fe_n_units_l0': 144, 'fe_dropout_l0': 0.3459953982148952, 'fe_n_units_l1': 209, 'fe_dropout_l1': 0.3651382226538769, 'n_units_l(Invariant)': 374, 'n_layers_mlp': 4, 'mlp_n_units_l0': 25, 'mlp_dropout_l0': 0.32415018016039054, 'mlp_n_units_l1': 130, 'mlp_dropout_l1': 0.2706614832407767, 'mlp_n_units_l2': 180, 'mlp_dropout_l2': 0.3503727415274258, 'mlp_n_units_l3': 153, 'mlp_dropout_l3': 0.2439381564414505, 'reduction': 'sum', 'lr': 0.00036675964416720843, 'weight_decay': 0.06235478545110059, 'criterion': 'MSELoss', 'batch_size': 256}. Best is trial 40 with value: 7.096149053865113.[0m

Trial Id: 41 | Model params: 162017 | Timestamp: 2022-02-19 07:00:22.146054

epoch 0 -1.9721592057313306 12.416482781968043
epoch 5 0.0018844379918787624 7.195367323677952
epoch 10 0.004110444920315204 7.187339256398325
epoch 15 0.019408634395595925 7.131922062252075
epoch 20 0.02107119529960122 7.1258735259452
epoch 25 0.022490347293935065 7.120706467152057
epoch 30 0.023713880615917282 7.116248634115811
epoch 35 0.026455163492431155 7.106250866491366
epoch 40 0.02635821953679718 7.1066046719318905
epoch 45 0.017469469717130592 7.138970431857474
epoch 50 0.027527673508627726 7.102335471342173
epoch 55 0.02574591929709935 7.108838908345694
epoch 60 0.028310897895872156 7.099474802357313
epoch 65 0.027278835568861792 7.10324409230527
epoch 70 0.02704556470370012 7.104095765233837
epoch 75 0.02814801386357435 7.1000698191292235
epoch 80 0.026876144710867855 7.10471425435318
epoch 85 0.0295282955963857 7.0950260578592586
epoch 90 0.026121779620170482 7.107467506216431
epoch 95 0.02844038475030064 7.099001750181313
[32m[I 2022-02-19 08:58:58,198][0m Trial 41 finished with value: 7.100097499908119 and parameters: {'n_layers_fe': 2, 'fe_n_units_l0': 144, 'fe_dropout_l0': 0.3455398339789516, 'fe_n_units_l1': 207, 'fe_dropout_l1': 0.3693954385084096, 'n_units_l(Invariant)': 372, 'n_layers_mlp': 4, 'mlp_n_units_l0': 22, 'mlp_dropout_l0': 0.33179246955118064, 'mlp_n_units_l1': 128, 'mlp_dropout_l1': 0.2632872435415574, 'mlp_n_units_l2': 176, 'mlp_dropout_l2': 0.31250756301563704, 'mlp_n_units_l3': 153, 'mlp_dropout_l3': 0.24618695850545738, 'reduction': 'sum', 'lr': 0.00045868533775186827, 'weight_decay': 0.06272321828953652, 'criterion': 'MSELoss', 'batch_size': 256}. Best is trial 40 with value: 7.096149053865113.[0m

Trial Id: 42 | Model params: 162899 | Timestamp: 2022-02-19 08:58:58.198282

[32m[I 2022-02-19 09:00:12,841][0m Trial 42 pruned. [0m
epoch 0 -0.010570856693528086 7.240122944025807

Trial Id: 43 | Model params: 174360 | Timestamp: 2022-02-19 09:00:12.841347

[32m[I 2022-02-19 09:01:28,853][0m Trial 43 pruned. [0m
epoch 0 0.0008472100822798367 7.19910501607342

Trial Id: 44 | Model params: 139347 | Timestamp: 2022-02-19 09:01:28.853460

epoch 0 -5.767505857908917 18.7359999391283
epoch 5 -0.009559990830165122 7.236500919785476
epoch 10 -0.003714907777038201 7.215521804818082
epoch 15 0.0023990429992412077 7.193512203096605
epoch 20 0.004375948748329694 7.186381121392885
epoch 25 0.007749569163688297 7.174195450310804
epoch 30 0.012160944972375742 7.158230062359536
epoch 35 0.01884445554430525 7.133973426945164
epoch 40 0.021507468272482178 7.1242854776303
epoch 45 0.01799764604455789 7.137051335225403
epoch 50 0.01838855588422561 7.13563065568815
epoch 55 0.023369641805666475 7.117503119359633
epoch 60 0.02269685955512546 7.119954254186979
epoch 65 0.023690592001548327 7.1163335101468155
epoch 70 0.025482669652753143 7.109799270202257
epoch 75 0.024849602571081486 7.112108233311227
epoch 80 0.025137401568380624 7.111058647180877
epoch 85 0.02601830130498728 7.107845094097447
epoch 90 0.026345568415211296 7.106650842006718
epoch 95 0.02512598698227142 7.111100278459882
[32m[I 2022-02-19 10:48:14,365][0m Trial 44 finished with value: 7.104973586871865 and parameters: {'n_layers_fe': 2, 'fe_n_units_l0': 155, 'fe_dropout_l0': 0.2970762645860485, 'fe_n_units_l1': 176, 'fe_dropout_l1': 0.34941004406789056, 'n_units_l(Invariant)': 384, 'n_layers_mlp': 4, 'mlp_n_units_l0': 11, 'mlp_dropout_l0': 0.3974861437223295, 'mlp_n_units_l1': 128, 'mlp_dropout_l1': 0.22482781201810134, 'mlp_n_units_l2': 161, 'mlp_dropout_l2': 0.21989884161442583, 'mlp_n_units_l3': 123, 'mlp_dropout_l3': 0.3258200198402203, 'reduction': 'sum', 'lr': 0.00022050097403853233, 'weight_decay': 0.025938073601689787, 'criterion': 'MSELoss', 'batch_size': 256}. Best is trial 40 with value: 7.096149053865113.[0m

Trial Id: 45 | Model params: 134375 | Timestamp: 2022-02-19 10:48:14.366069

epoch 0 -5.588172043472463 18.486088253076975
epoch 5 -0.004234868198931929 7.217390512739313
epoch 10 -0.00454793970620071 7.218515440443097
epoch 15 -0.002703461166343457 7.211885336669835
epoch 20 -0.001584957589594982 7.207861828903865
epoch 25 -0.006615994158723826 7.2259419688958815
epoch 30 0.0014226499968066353 7.197031634976972
epoch 35 0.004239111873313828 7.1868749464207715
epoch 40 0.011724906949475922 7.159809730681132
epoch 45 0.015068862120852011 7.147686400823474
epoch 50 0.01832475165195191 7.135862558056672
epoch 55 0.019011367560167414 7.133366593228226
epoch 60 0.016002581246589376 7.144297578133284
epoch 65 0.019671412765677188 7.130966393818864
epoch 70 0.021010103871959784 7.126095872551599
epoch 75 0.021245145881998884 7.125240382393662
epoch 80 0.015635187482798685 7.145631181947101
epoch 85 0.012611431401603923 7.156597684489912
epoch 90 0.01751164097735891 7.138817224093907
epoch 95 0.019602972637240645 7.131215308185183
[32m[I 2022-02-19 12:45:18,055][0m Trial 45 finished with value: 7.121412572658226 and parameters: {'n_layers_fe': 2, 'fe_n_units_l0': 132, 'fe_dropout_l0': 0.28935611662197924, 'fe_n_units_l1': 164, 'fe_dropout_l1': 0.34163416638331623, 'n_units_l(Invariant)': 385, 'n_layers_mlp': 4, 'mlp_n_units_l0': 11, 'mlp_dropout_l0': 0.41107012476160293, 'mlp_n_units_l1': 160, 'mlp_dropout_l1': 0.21956808174095063, 'mlp_n_units_l2': 160, 'mlp_dropout_l2': 0.21469141944306186, 'mlp_n_units_l3': 123, 'mlp_dropout_l3': 0.33315815500773505, 'reduction': 'sum', 'lr': 0.00022632521116725153, 'weight_decay': 0.02460251635650104, 'criterion': 'MSELoss', 'batch_size': 256}. Best is trial 40 with value: 7.096149053865113.[0m

Trial Id: 46 | Model params: 159301 | Timestamp: 2022-02-19 12:45:18.055774

epoch 0 -5.823320804116299 18.813103786217468
epoch 5 0.0009519959749322293 7.198727504028963
epoch 10 -0.005534140164085377 7.222057907949261
epoch 15 -0.0018469948559356464 7.208804637039182
epoch 20 0.012364873665230092 7.157491154620227
epoch 25 0.019037064641844736 7.133273163040369
epoch 30 0.012340226114822106 7.157580465702166
epoch 35 0.02304850916555712 7.118673201104611
epoch 40 0.024160638136646706 7.114620217338758
epoch 45 0.023626923731610905 7.116565545837879
epoch 50 0.024070260740961857 7.1149496701075545
epoch 55 0.023379414377769026 7.117467508913038
epoch 60 0.023941398921906276 7.1154193837851984
epoch 65 0.02256839988374959 7.120422172938335
epoch 70 0.02490288180192135 7.111913938752498
epoch 75 0.0255773705854635 7.109453806371304
epoch 80 0.025917518410198293 7.108212827225868
epoch 85 0.026641179888857947 7.105571934059076
epoch 90 0.024790672247625878 7.112323129653312
epoch 95 0.02532831980523964 7.110362294044642
