[32m[I 2022-02-17 15:46:11,059][0m Trial 32 pruned. [0m
epoch 0 -0.42132325432056916 5.134065359908944

Trial Id: 33 | Model params: 100967 | Timestamp: 2022-02-17 15:46:11.059653

[32m[I 2022-02-17 15:47:44,603][0m Trial 33 pruned. [0m
epoch 0 -0.23074380985632814 4.777479063141625

Trial Id: 34 | Model params: 113939 | Timestamp: 2022-02-17 15:47:44.604111

[32m[I 2022-02-17 15:49:50,922][0m Trial 34 pruned. [0m
++++++++++++++++++++
        NaN         
++++++++++++++++++++

Trial Id: 35 | Model params: 150175 | Timestamp: 2022-02-17 15:49:50.922890

[32m[I 2022-02-17 15:51:55,073][0m Trial 35 pruned. [0m
epoch 0 -0.000679726565287142 4.307869246567395

Trial Id: 36 | Model params: 61871 | Timestamp: 2022-02-17 15:51:55.073570

[32m[I 2022-02-17 15:53:28,671][0m Trial 36 pruned. [0m
++++++++++++++++++++
        NaN         
++++++++++++++++++++

Trial Id: 37 | Model params: 38006 | Timestamp: 2022-02-17 15:53:28.671440

[32m[I 2022-02-17 15:54:22,750][0m Trial 37 pruned. [0m
++++++++++++++++++++
        NaN         
++++++++++++++++++++

Trial Id: 38 | Model params: 271099 | Timestamp: 2022-02-17 15:54:22.750502

epoch 0 -1.9857345953096872 7.441158624148612
epoch 5 -1.980531989053508 7.434672733273313
epoch 10 -1.9744420809025498 7.427073481621498
epoch 15 -1.9834645139138476 7.438329295681787
epoch 20 -1.9813084012330817 7.435641015884223
epoch 25 -1.992374506569023 7.449428145795061
epoch 30 -1.9748989149857619 7.427643808752639
epoch 35 -1.9974693293132884 7.455767154276615
epoch 40 -1.985420683732149 7.440767442821597
epoch 45 -2.0010337964511313 7.460198882855166
epoch 50 -2.001710820090208 7.461040333920597
epoch 55 -1.9804437912731743 7.4345627316887
epoch 60 -1.9806569652429338 7.434828602650216
epoch 65 -1.972568773862175 7.4247343235559295
epoch 70 -1.9921850834804329 7.4491923604653065
epoch 75 -1.9498225999669079 7.396272641131298
epoch 80 -1.9731334878353874 7.425439547290596
epoch 85 -1.9718547153895614 7.4238425001398625
epoch 90 -1.975766671790462 7.428727025139512
epoch 95 -1.9998825553535982 7.458767824100395
[32m[I 2022-02-17 19:20:29,114][0m Trial 38 finished with value: 7.450539033008981 and parameters: {'n_layers_fe': 4, 'fe_n_units_l0': 40, 'fe_dropout_l0': 0.39944580516038314, 'fe_n_units_l1': 134, 'fe_dropout_l1': 0.2662082538095256, 'fe_n_units_l2': 121, 'fe_dropout_l2': 0.11526209114706559, 'fe_n_units_l3': 207, 'fe_dropout_l3': 0.06068122001657533, 'n_units_l(Invariant)': 375, 'n_layers_mlp': 4, 'mlp_n_units_l0': 222, 'mlp_dropout_l0': 0.19287590135356822, 'mlp_n_units_l1': 159, 'mlp_dropout_l1': 0.30488059499167397, 'mlp_n_units_l2': 252, 'mlp_dropout_l2': 0.00024238458157083143, 'mlp_n_units_l3': 254, 'mlp_dropout_l3': 0.484805419192985, 'reduction': 'sum', 'lr': 0.0007558266071579086, 'weight_decay': 0.0674187757875335, 'criterion': 'PoissonNLLLoss', 'batch_size': 128}. Best is trial 10 with value: 4.300128796747935.[0m

Trial Id: 39 | Model params: 77257 | Timestamp: 2022-02-17 19:20:29.114329

[32m[I 2022-02-17 19:21:47,602][0m Trial 39 pruned. [0m
++++++++++++++++++++
        NaN         
++++++++++++++++++++

Trial Id: 40 | Model params: 121180 | Timestamp: 2022-02-17 19:21:47.602573

[32m[I 2022-02-17 19:24:09,935][0m Trial 40 pruned. [0m
epoch 0 -0.41638060338138505 5.125130730681522

Trial Id: 41 | Model params: 89578 | Timestamp: 2022-02-17 19:24:09.935692

[32m[I 2022-02-17 19:25:56,586][0m Trial 41 pruned. [0m
epoch 0 -0.0760521319737748 4.467161138790683

Trial Id: 42 | Model params: 90527 | Timestamp: 2022-02-17 19:25:56.586352

[32m[I 2022-02-17 19:27:35,731][0m Trial 42 pruned. [0m
epoch 0 -0.04966253294171863 4.412043749445012

Trial Id: 43 | Model params: 109838 | Timestamp: 2022-02-17 19:27:35.731456

[32m[I 2022-02-17 19:29:21,526][0m Trial 43 pruned. [0m
epoch 0 -0.0817694447519699 4.479012944733262

Trial Id: 44 | Model params: 58598 | Timestamp: 2022-02-17 19:29:21.527029

[32m[I 2022-02-17 19:30:43,212][0m Trial 44 pruned. [0m
epoch 0 0.0026891506937516407 4.300611720749047

Trial Id: 45 | Model params: 85213 | Timestamp: 2022-02-17 19:30:43.212628

epoch 0 -3.5819484878775123 9.218071312976488
epoch 5 -1.9841618961267264 7.439198596358978
epoch 10 -1.995990181587465 7.453927345314239
epoch 15 -1.9794604135203193 7.433336138057552
epoch 20 -1.9652272037472849 7.415559951196772
epoch 25 -1.991495508670249 7.448333945752931
epoch 30 -1.9602831955896183 7.409375284513328
epoch 35 -1.9855141923376607 7.4408839708444585
epoch 40 -1.9667290214740922 7.4174376166919584
epoch 45 -1.9868240997224644 7.4425161519947025
epoch 50 -1.9866999238986964 7.442361440811684
epoch 55 -1.9828788058444853 7.437599120525359
epoch 60 -1.964382381491367 7.4145034931333935
epoch 65 -2.0161179099917566 7.478924003214246
epoch 70 -2.003817686575653 7.4636582840523955
epoch 75 -1.9797432655995606 7.4336889678308005
epoch 80 -2.015854737739781 7.478597708243717
epoch 85 -2.0059413082375634 7.466296124905189
epoch 90 -2.042274350585968 7.511283437921427
epoch 95 -1.9922102753787798 7.44922371863609
[32m[I 2022-02-17 22:17:02,843][0m Trial 45 finished with value: 7.460831589210884 and parameters: {'n_layers_fe': 4, 'fe_n_units_l0': 222, 'fe_dropout_l0': 0.3740834143522855, 'fe_n_units_l1': 171, 'fe_dropout_l1': 0.32425213441761036, 'fe_n_units_l2': 27, 'fe_dropout_l2': 0.2190690544200168, 'fe_n_units_l3': 111, 'fe_dropout_l3': 0.14965612213519394, 'n_units_l(Invariant)': 310, 'n_layers_mlp': 2, 'mlp_n_units_l0': 68, 'mlp_dropout_l0': 0.3881138959986211, 'mlp_n_units_l1': 20, 'mlp_dropout_l1': 0.03435073647942668, 'reduction': 'sum', 'lr': 0.0006435866850184141, 'weight_decay': 0.11567326151280559, 'criterion': 'PoissonNLLLoss', 'batch_size': 128}. Best is trial 10 with value: 4.300128796747935.[0m

Trial Id: 46 | Model params: 149917 | Timestamp: 2022-02-17 22:17:02.844127

[32m[I 2022-02-17 22:19:01,327][0m Trial 46 pruned. [0m
epoch 0 0.0021280200813379446 4.301821406546688

Trial Id: 47 | Model params: 130764 | Timestamp: 2022-02-17 22:19:01.327704

[32m[I 2022-02-17 22:20:54,312][0m Trial 47 pruned. [0m
++++++++++++++++++++
        NaN         
++++++++++++++++++++

Trial Id: 48 | Model params: 73736 | Timestamp: 2022-02-17 22:20:54.312601

[32m[I 2022-02-17 22:22:15,324][0m Trial 48 pruned. [0m
epoch 0 -0.05425335057805336 4.4216815088012895

Trial Id: 49 | Model params: 109729 | Timestamp: 2022-02-17 22:22:15.324518

[32m[I 2022-02-17 22:24:11,827][0m Trial 49 pruned. [0m
epoch 0 0.002101352964461789 4.301878887070304

Study statistics: 
  Number of finished trials:  50
  Number of pruned trials:  38
  Number of complete trials:  12

Best trial:
  Value:  4.300128796747935
  Params: 
    n_layers_fe: 4
    fe_n_units_l0: 11
    fe_dropout_l0: 0.3827299179933738
    fe_n_units_l1: 60
    fe_dropout_l1: 0.19272193603716384
    fe_n_units_l2: 13
    fe_dropout_l2: 0.49507853088570614
    fe_n_units_l3: 255
    fe_dropout_l3: 0.011990066122195053
    n_units_l(Invariant): 328
    n_layers_mlp: 2
    mlp_n_units_l0: 73
    mlp_dropout_l0: 0.054482111668440025
    mlp_n_units_l1: 247
    mlp_dropout_l1: 0.06665852975854414
    reduction: sum
    lr: 0.00232797977299328
    weight_decay: 0.09525722755930557
    criterion: MSELoss
    batch_size: 128
Target: 67698, NaN: 0, Max: 143.0, Min: 0.0, Mean: 8.148734083724777
Prediction: 67698, NaN: 0, Max: 9.571785926818848, Min: 7.8074798583984375, Mean: 8.254246282226744

 XXXXXX======== TRIAL des - lrg ended

Test Set - R-squared:  0.0018953728571996509
Test Set - RMSE:  4.206070172287601
Test Set - MAE:  3.123773749975085



[32m[I 2022-02-17 22:26:25,218][0m A new study created in memory with name: DeepSet[0m
Starting Loading des
Finished Loading des
Finished des setup

++++++++ Session Characteristics +++++++

Area: des
Gal Type: elg
Training Set: 216623
Validation Set: 54158
Test Samples: 67698
Number of features: 5
Device: cuda:0
Number of Workers: 8
Number of Trials: 50

+++++++++++++++++++++++++++++++++++++++

Trial Id: 0 | Model params: 161786 | Timestamp: 2022-02-17 22:26:25.218965

[32m[I 2022-02-17 22:28:43,039][0m Trial 0 pruned. [0m
++++++++++++++++++++
        NaN         
++++++++++++++++++++

Trial Id: 1 | Model params: 111235 | Timestamp: 2022-02-17 22:28:43.039894

[32m[I 2022-02-17 22:30:08,578][0m Trial 1 pruned. [0m
++++++++++++++++++++
        NaN         
++++++++++++++++++++

Trial Id: 2 | Model params: 148914 | Timestamp: 2022-02-17 22:30:08.578857

[32m[I 2022-02-17 22:32:53,114][0m Trial 2 pruned. [0m
++++++++++++++++++++
        NaN         
++++++++++++++++++++

Trial Id: 3 | Model params: 64263 | Timestamp: 2022-02-17 22:32:53.114951

[32m[I 2022-02-17 22:33:59,333][0m Trial 3 pruned. [0m
++++++++++++++++++++
        NaN         
++++++++++++++++++++

Trial Id: 4 | Model params: 249709 | Timestamp: 2022-02-17 22:33:59.333444

[32m[I 2022-02-17 22:36:20,662][0m Trial 4 pruned. [0m
++++++++++++++++++++
        NaN         
++++++++++++++++++++

Trial Id: 5 | Model params: 196223 | Timestamp: 2022-02-17 22:36:20.662983

epoch 0 -0.7827712335675863 9.61635228838104
epoch 5 -0.7612165547233303 9.558042023464232
epoch 10 -0.032366515310738864 7.3177827333492464
epoch 15 -0.0007370127492856149 7.204810084101415
epoch 20 0.0008418637256198958 7.199124276857131
epoch 25 -0.0008217654004654129 7.20511516616599
epoch 30 -0.002535022643396223 7.211279569172137
epoch 35 -0.013240183465545563 7.249678686006259
epoch 40 0.003913764533858055 7.188048942963501
epoch 45 0.0030502911241498953 7.191163806114676
epoch 50 -0.0020815988161981824 7.20964863573777
epoch 55 -8.890394116045641e-05 7.202476675278343
epoch 60 0.003274672996906536 7.190354508720488
epoch 65 -0.011191640695957128 7.242346371725748
epoch 70 0.004276055547074331 7.186741625244347
epoch 75 0.0015660132992069142 7.196514986337674
epoch 80 0.002572034411825186 7.192888471843576
epoch 85 0.0016733323521200827 7.196128208674975
epoch 90 0.0038482164139698183 7.188285446253103
epoch 95 0.0024883555225573284 7.193190188015241
[32m[I 2022-02-18 02:32:01,282][0m Trial 5 finished with value: 7.206460143834987 and parameters: {'n_layers_fe': 4, 'fe_n_units_l0': 162, 'fe_dropout_l0': 0.31512945779066154, 'fe_n_units_l1': 231, 'fe_dropout_l1': 0.22913341871644782, 'fe_n_units_l2': 167, 'fe_dropout_l2': 0.09438635896365544, 'fe_n_units_l3': 179, 'fe_dropout_l3': 0.16749948353570226, 'n_units_l(Invariant)': 414, 'n_layers_mlp': 2, 'mlp_n_units_l0': 149, 'mlp_dropout_l0': 0.4629796786792113, 'mlp_n_units_l1': 69, 'mlp_dropout_l1': 0.42118315520947214, 'reduction': 'sum', 'lr': 9.504929589896943e-05, 'weight_decay': 0.26598786004983765, 'criterion': 'MSELoss', 'batch_size': 256}. Best is trial 5 with value: 7.206460143834987.[0m

Trial Id: 6 | Model params: 119906 | Timestamp: 2022-02-18 02:32:01.282942

epoch 0 -0.9732115271643074 10.116944745592455
epoch 5 0.0066066375916967734 7.17832608829801
epoch 10 0.005821937137954758 7.18116067730354
epoch 15 0.005553205467560329 7.1821311648774975
epoch 20 0.009584623356181599 7.167558451487764
epoch 25 0.010387070968691847 7.164654237872777
epoch 30 0.012625089081962249 7.156548188848209
epoch 35 0.008656750811379066 7.170915135932543
epoch 40 0.01485644336810743 7.148457125150356
epoch 45 0.009350203224912979 7.168406641359502
epoch 50 0.014507661289555385 7.149722439772659
epoch 55 0.015696826045241585 7.14540745730592
epoch 60 0.015753101449091367 7.145203192782251
epoch 65 0.009447086996329013 7.168056104139478
epoch 70 0.017494203035397504 7.138880576360079
epoch 75 0.01788321991544739 7.137467139406281
epoch 80 0.017893515206291455 7.137429729144001
epoch 85 0.01708942633652155 7.140350977329169
epoch 90 0.01797934257609879 7.137117848398599
epoch 95 0.017529173688542565 7.138753526963133
[32m[I 2022-02-18 05:38:56,377][0m Trial 6 finished with value: 7.136441404801938 and parameters: {'n_layers_fe': 2, 'fe_n_units_l0': 169, 'fe_dropout_l0': 0.3941203689250778, 'fe_n_units_l1': 197, 'fe_dropout_l1': 0.11751477654301834, 'n_units_l(Invariant)': 358, 'n_layers_mlp': 2, 'mlp_n_units_l0': 104, 'mlp_dropout_l0': 0.05475074349063963, 'mlp_n_units_l1': 111, 'mlp_dropout_l1': 0.24899136164726637, 'reduction': 'sum', 'lr': 0.00011255833726493625, 'weight_decay': 0.0698219755201175, 'criterion': 'MSELoss', 'batch_size': 32}. Best is trial 6 with value: 7.136441404801938.[0m

Trial Id: 7 | Model params: 79709 | Timestamp: 2022-02-18 05:38:56.377944

[32m[I 2022-02-18 05:39:55,207][0m Trial 7 pruned. [0m
++++++++++++++++++++
        NaN         
++++++++++++++++++++

Trial Id: 8 | Model params: 192809 | Timestamp: 2022-02-18 05:39:55.207178

[32m[I 2022-02-18 05:42:04,137][0m Trial 8 pruned. [0m
++++++++++++++++++++
        NaN         
++++++++++++++++++++

Trial Id: 9 | Model params: 93397 | Timestamp: 2022-02-18 05:42:04.137357

epoch 0 -0.00103076600320251 7.205867445370577
epoch 5 -0.002303588039090476 7.210447161363193
epoch 10 -0.0026296110473402745 7.211619750473145
epoch 15 0.0007812785410102885 7.199342537433675
epoch 20 -18.641872343238894 31.91934701111094
epoch 25 -18.641872343238894 31.91934701111094
epoch 30 0.005789385066737873 7.181278241625794
epoch 35 -0.0001133043279373247 7.2025645385392965
epoch 40 -2.1052532722221073e-05 7.202232343762418
epoch 45 -0.053022077270941326 7.390627172288005
epoch 50 -18.641872343238894 31.91934701111094
epoch 55 -18.641872343238894 31.91934701111094
epoch 60 -0.7731179381117246 9.590281783078835
epoch 65 -4.124892199519614e-05 7.2023050714081345
epoch 70 -18.641872343238894 31.91934701111094
epoch 75 -0.01640345299817092 7.260986378584936
epoch 80 -0.0003134140842036004 7.203285072572152
epoch 85 0.0017164859881758643 7.195972677192293
epoch 90 -0.10485360879857097 7.570331988426346
epoch 95 -4.159737465658786e-05 7.202306326187451
[32m[I 2022-02-18 08:02:17,122][0m Trial 9 finished with value: 7.213503375306636 and parameters: {'n_layers_fe': 4, 'fe_n_units_l0': 96, 'fe_dropout_l0': 0.3477206876490808, 'fe_n_units_l1': 177, 'fe_dropout_l1': 0.09666315189528196, 'fe_n_units_l2': 144, 'fe_dropout_l2': 0.2248654258741013, 'fe_n_units_l3': 60, 'fe_dropout_l3': 0.30784610644146293, 'n_units_l(Invariant)': 252, 'n_layers_mlp': 2, 'mlp_n_units_l0': 115, 'mlp_dropout_l0': 0.32554253269584665, 'mlp_n_units_l1': 197, 'mlp_dropout_l1': 0.017014580808846602, 'reduction': 'sum', 'lr': 0.004706476897403668, 'weight_decay': 0.08125884525546122, 'criterion': 'MSELoss', 'batch_size': 32}. Best is trial 6 with value: 7.136441404801938.[0m

Trial Id: 10 | Model params: 18579 | Timestamp: 2022-02-18 08:02:17.122274

epoch 0 -15.487880090453991 29.24455156572784
epoch 5 -14.912352666063995 28.729611543790426
epoch 10 -14.804365059623072 28.631960253932284
epoch 15 -14.769993574481635 28.600808776305914
epoch 20 -14.774023315904063 28.60446275693274
epoch 25 -14.75376311416777 28.586087026714292
epoch 30 -14.754759192117321 28.58699073209159
epoch 35 -14.751443453592309 28.583982372107833
epoch 40 -14.754605359522394 28.586851167225927
epoch 45 -14.757382603814566 28.589370721631415
epoch 50 -14.758044243654922 28.589970937688687
epoch 55 -14.755816107722433 28.58794960202815
epoch 60 -14.754798808313218 28.5870266738378
epoch 65 -14.752461547640165 28.584906119578328
epoch 70 -14.753620107936392 28.585957280004784
epoch 75 -14.758538037865838 28.59041888196799
epoch 80 -14.752561864547058 28.584997138521356
epoch 85 -14.755640659094649 28.58779043126677
epoch 90 -14.762207141704916 28.593747081260005
epoch 95 -14.749770831217862 28.582464686509734
[32m[I 2022-02-18 08:51:25,154][0m Trial 10 finished with value: 28.58272172367715 and parameters: {'n_layers_fe': 2, 'fe_n_units_l0': 94, 'fe_dropout_l0': 0.16938526116429498, 'fe_n_units_l1': 12, 'fe_dropout_l1': 0.44931648161726856, 'n_units_l(Invariant)': 215, 'n_layers_mlp': 4, 'mlp_n_units_l0': 55, 'mlp_dropout_l0': 0.18020156011941968, 'mlp_n_units_l1': 114, 'mlp_dropout_l1': 0.19063770557973764, 'mlp_n_units_l2': 16, 'mlp_dropout_l2': 0.004568482326558709, 'mlp_n_units_l3': 243, 'mlp_dropout_l3': 0.013799805604227888, 'reduction': 'sum', 'lr': 1.1538882808482748e-05, 'weight_decay': 0.004478610525089466, 'criterion': 'PoissonNLLLoss', 'batch_size': 128}. Best is trial 6 with value: 7.136441404801938.[0m

Trial Id: 11 | Model params: 160394 | Timestamp: 2022-02-18 08:51:25.155200

epoch 0 -1.0995897610269423 10.435896884050335
epoch 5 -0.010977432450871127 7.241579231051106
epoch 10 0.002709934470820241 7.192391225894423
epoch 15 -0.004450186703351511 7.2181642134385475
epoch 20 -0.005383420022259111 7.221516628274565
epoch 25 0.0012877102122375028 7.197517893298208
epoch 30 0.0029215665362006815 7.191628047044248
epoch 35 -0.0059823784086270315 7.22366742161307
epoch 40 0.002801171316577422 7.192062221264476
epoch 45 0.0021162200016340282 7.194531822461764
epoch 50 0.0026783360423339175 7.192505167899599
epoch 55 -0.0019290234236415404 7.209099749875119
epoch 60 0.0024872866112900516 7.193194042045429
epoch 65 0.002802322257695833 7.1920580708171
epoch 70 -0.0006559941839847649 7.204518431457553
epoch 75 -0.010113915570919563 7.238485906928891
epoch 80 0.0031539355271951175 7.190789994253603
epoch 85 0.002097647648672152 7.194598773526289
epoch 90 0.0006203804688091896 7.199922147124401
epoch 95 0.0003273209713010594 7.200977727437786
[32m[I 2022-02-18 13:36:45,492][0m Trial 11 finished with value: 7.192102293839797 and parameters: {'n_layers_fe': 2, 'fe_n_units_l0': 114, 'fe_dropout_l0': 0.39593559390518307, 'fe_n_units_l1': 244, 'fe_dropout_l1': 0.17374227397874442, 'n_units_l(Invariant)': 493, 'n_layers_mlp': 2, 'mlp_n_units_l0': 91, 'mlp_dropout_l0': 0.15626387854251955, 'mlp_n_units_l1': 89, 'mlp_dropout_l1': 0.4327628607139723, 'reduction': 'sum', 'lr': 0.00012867057970578264, 'weight_decay': 0.20673494549040214, 'criterion': 'MSELoss', 'batch_size': 32}. Best is trial 6 with value: 7.136441404801938.[0m

Trial Id: 12 | Model params: 167133 | Timestamp: 2022-02-18 13:36:45.497597

[32m[I 2022-02-18 13:40:06,181][0m Trial 12 pruned. [0m
epoch 0 -0.020055180156927754 7.274018294166165

Trial Id: 13 | Model params: 91601 | Timestamp: 2022-02-18 13:40:06.181763

epoch 0 -18.641872343238894 31.91934701111094
epoch 5 -0.5586379158605581 8.99156264790352
epoch 10 -0.35888708653691004 8.395648387985403
epoch 15 -0.016651891890702597 7.261873723659612
epoch 20 -0.00629481859134895 7.224789105651274
epoch 25 -0.01704955560600352 7.263293826928914
epoch 30 -0.012772817680737347 7.248006504706493
epoch 35 -0.009339574579701138 7.235710907560237
epoch 40 -0.007862230813470594 7.230413608677153
epoch 45 -0.011528524144186258 7.243552682846504
epoch 50 -0.005141062489974146 7.2206461671140305
epoch 55 -0.0184891626208894 7.268432510266662
epoch 60 -0.010603103701072758 7.2402384581608015
epoch 65 -0.005444729098129875 7.2217368118147585
epoch 70 -0.007262226803603999 7.228261070915875
epoch 75 -0.011143290357977342 7.242173222509166
epoch 80 -0.012021508694967764 7.245317598266665
epoch 85 -0.0006376229026232583 7.204452296420416
epoch 90 -0.0049835175224424155 7.220080265924834
epoch 95 -0.006195020447466115 7.224430841648095
[32m[I 2022-02-18 16:56:19,921][0m Trial 13 finished with value: 7.205229145473733 and parameters: {'n_layers_fe': 2, 'fe_n_units_l0': 12, 'fe_dropout_l0': 0.40374295076390343, 'fe_n_units_l1': 189, 'fe_dropout_l1': 0.17132050843048552, 'n_units_l(Invariant)': 452, 'n_layers_mlp': 2, 'mlp_n_units_l0': 85, 'mlp_dropout_l0': 0.12390893594550835, 'mlp_n_units_l1': 9, 'mlp_dropout_l1': 0.19768079571171004, 'reduction': 'sum', 'lr': 3.3468066456063585e-05, 'weight_decay': 0.20875227706222643, 'criterion': 'MSELoss', 'batch_size': 32}. Best is trial 6 with value: 7.136441404801938.[0m

Trial Id: 14 | Model params: 86197 | Timestamp: 2022-02-18 16:56:19.921573

[32m[I 2022-02-18 16:57:31,356][0m Trial 14 pruned. [0m
++++++++++++++++++++
        NaN         
++++++++++++++++++++

Trial Id: 15 | Model params: 81453 | Timestamp: 2022-02-18 16:57:31.356388

[32m[I 2022-02-18 16:58:55,604][0m Trial 15 pruned. [0m
epoch 0 -0.017901193416311356 7.266334190715923

Trial Id: 16 | Model params: 120225 | Timestamp: 2022-02-18 16:58:55.605006

epoch 0 -1.1242029637074644 10.496887951005808
epoch 5 -0.16962076716866537 7.789060757864147
epoch 10 0.00040250939182573386 7.200706918635089
epoch 15 -0.010874559899056502 7.241210786285346
epoch 20 -0.012640865136671842 7.247534323761884
epoch 25 -0.003732865057941126 7.215586350323673
epoch 30 -0.005302278292781626 7.2212252080261266
epoch 35 0.0013148207756766839 7.19742020245587
epoch 40 -0.004047878848783437 7.216718539462278
epoch 45 0.0006911575832747596 7.199667189585377
epoch 50 0.00283558902948855 7.191938105360224
epoch 55 0.0007313818023111374 7.199522287483021
epoch 60 -4.916876438776363e-05 7.2023335907357895
epoch 65 -0.0019267229770394412 7.209091473760666
epoch 70 -0.003783821978186941 7.215769506322897
epoch 75 -3.7025820875946636e-05 7.202289863988065
epoch 80 0.0029119259441493517 7.191662814311432
epoch 85 0.003009393691469797 7.191311304588726
epoch 90 0.0029606625707305767 7.191487051669549
epoch 95 0.001225674596803561 7.1977414289066095
