[32m[I 2022-02-19 14:54:47,476][0m Trial 46 finished with value: 7.111600004433126 and parameters: {'n_layers_fe': 2, 'fe_n_units_l0': 153, 'fe_dropout_l0': 0.3109469418681095, 'fe_n_units_l1': 178, 'fe_dropout_l1': 0.4067474175856287, 'n_units_l(Invariant)': 409, 'n_layers_mlp': 4, 'mlp_n_units_l0': 22, 'mlp_dropout_l0': 0.35340711192294805, 'mlp_n_units_l1': 129, 'mlp_dropout_l1': 0.2589214874958775, 'mlp_n_units_l2': 200, 'mlp_dropout_l2': 0.15521926233919695, 'mlp_n_units_l3': 138, 'mlp_dropout_l3': 0.1652973823040034, 'reduction': 'sum', 'lr': 0.0003590405839346317, 'weight_decay': 0.09410175454661956, 'criterion': 'MSELoss', 'batch_size': 256}. Best is trial 40 with value: 7.096149053865113.[0m

Trial Id: 47 | Model params: 175052 | Timestamp: 2022-02-19 14:54:47.476219

epoch 0 -3.0830228858482194 14.553031294274815
epoch 5 -0.001686414064928865 7.208226883177206
epoch 10 0.01335282331141363 7.153910373660044
epoch 15 0.014894962881383034 7.148317369995407
epoch 20 0.00954560676821481 7.167699630091862
epoch 25 0.023494174131138967 7.117049320506879
epoch 30 0.026699767622381354 7.105358084032245
epoch 35 0.024665186906545178 7.11278070504755
epoch 40 0.015468060359284053 7.146237754878553
epoch 45 0.02575170406348981 7.108817803464405
epoch 50 0.028204705457930856 7.099862729904719
epoch 55 0.02880002496779943 7.097687717153995
epoch 60 0.023606300993287754 7.116640702710601
epoch 65 0.029555331356441727 7.094927229239534
epoch 70 0.021861157272932363 7.122997777892698
epoch 75 0.028864556502665062 7.097451909749345
epoch 80 0.029178846407420522 7.096303337731631
epoch 85 0.02785978980759607 7.10112258191906
epoch 90 0.028341065666517173 7.099364593757946
epoch 95 0.029174369588102045 7.096319699566728
[32m[I 2022-02-19 17:06:49,227][0m Trial 47 finished with value: 7.10314267251732 and parameters: {'n_layers_fe': 2, 'fe_n_units_l0': 152, 'fe_dropout_l0': 0.23715882131350421, 'fe_n_units_l1': 175, 'fe_dropout_l1': 0.41269656159464807, 'n_units_l(Invariant)': 441, 'n_layers_mlp': 4, 'mlp_n_units_l0': 26, 'mlp_dropout_l0': 0.3602695912472176, 'mlp_n_units_l1': 177, 'mlp_dropout_l1': 0.231353396307371, 'mlp_n_units_l2': 213, 'mlp_dropout_l2': 0.15493167321363457, 'mlp_n_units_l3': 121, 'mlp_dropout_l3': 0.30663075712917637, 'reduction': 'sum', 'lr': 0.0003555486600462631, 'weight_decay': 0.041102115992737186, 'criterion': 'MSELoss', 'batch_size': 256}. Best is trial 40 with value: 7.096149053865113.[0m

Trial Id: 48 | Model params: 285203 | Timestamp: 2022-02-19 17:06:49.227738

[33m[W 2022-02-19 17:06:52,281][0m Trial 48 failed because of the following error: RuntimeError('CUDA out of memory. Tried to allocate 346.00 MiB (GPU 0; 11.93 GiB total capacity; 1.74 GiB already allocated; 19.94 MiB free; 2.10 GiB reserved in total by PyTorch)')
Traceback (most recent call last):
  File "/vol/bitbucket/ele20/venv/lib/python3.8/site-packages/optuna/_optimize.py", line 216, in _run_trial
    value_or_values = func(trial)
  File "hp_optim.py", line 251, in objective
    train_loop(criterion, model, optimiser, trainloader)
  File "hp_optim.py", line 320, in train_loop
    predictions = model(X1, X2, mask=mask)
  File "/vol/bitbucket/ele20/venv/lib/python3.8/site-packages/torch/nn/modules/module.py", line 1051, in _call_impl
    return forward_call(*input, **kwargs)
  File "/vol/bitbucket/ele20/astrostatistics/models/deep_set/models.py", line 94, in forward
    y = self.adder(y, mask=mask)
  File "/vol/bitbucket/ele20/venv/lib/python3.8/site-packages/torch/nn/modules/module.py", line 1051, in _call_impl
    return forward_call(*input, **kwargs)
  File "/vol/bitbucket/ele20/astrostatistics/models/deep_set/deepset_layers.py", line 85, in forward
    Z = X.clone()
RuntimeError: CUDA out of memory. Tried to allocate 346.00 MiB (GPU 0; 11.93 GiB total capacity; 1.74 GiB already allocated; 19.94 MiB free; 2.10 GiB reserved in total by PyTorch)[0m
Traceback (most recent call last):
  File "hp_optim.py", line 337, in <module>
    main()
  File "hp_optim.py", line 45, in main
    study.optimize(objective, n_trials=args['trials'], timeout=None)
  File "/vol/bitbucket/ele20/venv/lib/python3.8/site-packages/optuna/study.py", line 401, in optimize
    _optimize(
  File "/vol/bitbucket/ele20/venv/lib/python3.8/site-packages/optuna/_optimize.py", line 65, in _optimize
    _optimize_sequential(
  File "/vol/bitbucket/ele20/venv/lib/python3.8/site-packages/optuna/_optimize.py", line 162, in _optimize_sequential
    trial = _run_trial(study, func, catch)
  File "/vol/bitbucket/ele20/venv/lib/python3.8/site-packages/optuna/_optimize.py", line 267, in _run_trial
    raise func_err
  File "/vol/bitbucket/ele20/venv/lib/python3.8/site-packages/optuna/_optimize.py", line 216, in _run_trial
    value_or_values = func(trial)
  File "hp_optim.py", line 251, in objective
    train_loop(criterion, model, optimiser, trainloader)
  File "hp_optim.py", line 320, in train_loop
    predictions = model(X1, X2, mask=mask)
  File "/vol/bitbucket/ele20/venv/lib/python3.8/site-packages/torch/nn/modules/module.py", line 1051, in _call_impl
    return forward_call(*input, **kwargs)
  File "/vol/bitbucket/ele20/astrostatistics/models/deep_set/models.py", line 94, in forward
    y = self.adder(y, mask=mask)
  File "/vol/bitbucket/ele20/venv/lib/python3.8/site-packages/torch/nn/modules/module.py", line 1051, in _call_impl
    return forward_call(*input, **kwargs)
  File "/vol/bitbucket/ele20/astrostatistics/models/deep_set/deepset_layers.py", line 85, in forward
    Z = X.clone()
RuntimeError: CUDA out of memory. Tried to allocate 346.00 MiB (GPU 0; 11.93 GiB total capacity; 1.74 GiB already allocated; 19.94 MiB free; 2.10 GiB reserved in total by PyTorch)
[32m[I 2022-02-19 17:09:36,241][0m A new study created in memory with name: DeepSet[0m
Starting Loading des
Finished Loading des
Finished des setup

++++++++ Session Characteristics +++++++

Area: des
Gal Type: qso
Training Set: 216623
Validation Set: 54158
Test Samples: 67698
Number of features: 5
Device: cuda:0
Number of Workers: 8
Number of Trials: 50

+++++++++++++++++++++++++++++++++++++++

Trial Id: 0 | Model params: 130662 | Timestamp: 2022-02-19 17:09:36.242522

[32m[I 2022-02-19 17:10:59,444][0m Trial 0 pruned. [0m
++++++++++++++++++++
        NaN         
++++++++++++++++++++

Trial Id: 1 | Model params: 18946 | Timestamp: 2022-02-19 17:10:59.444662

[32m[I 2022-02-19 17:11:42,299][0m Trial 1 pruned. [0m
++++++++++++++++++++
        NaN         
++++++++++++++++++++

Trial Id: 2 | Model params: 39978 | Timestamp: 2022-02-19 17:11:42.299225

[32m[I 2022-02-19 17:12:26,292][0m Trial 2 pruned. [0m
++++++++++++++++++++
        NaN         
++++++++++++++++++++

Trial Id: 3 | Model params: 79345 | Timestamp: 2022-02-19 17:12:26.292717

epoch 0 -0.012898641768734453 1.998343662744586
epoch 5 -0.007488514802314272 1.992999708482193
epoch 10 0.02334250791103254 1.9622680207464793
epoch 15 -2.9165091586330134 3.929495144111461
epoch 20 0.020847888116322877 1.96477247642647
epoch 25 0.005325705709717687 1.9802846925885031
epoch 30 0.01730944518091937 1.9683194052239399
epoch 35 0.021859320918368397 1.963757440682819
epoch 40 0.007312363155922985 1.9783060983242324
epoch 45 -0.008581077253499547 1.9940800615572118
epoch 50 -0.03241806558645122 2.017506677796748
epoch 55 0.001721603537059968 1.9838691296780282
epoch 60 0.014099964416359856 1.9715310640525032
epoch 65 0.0034764469420837107 1.982124670932752
epoch 70 -7.50960934414735e-05 1.9856536091272257
epoch 75 0.0025301865625658726 1.9830655222543656
epoch 80 0.021694087430411457 1.9639232986193613
epoch 85 0.01158332578464305 1.9740457555994415
epoch 90 0.004516855763764482 1.9810896936222093
epoch 95 -2.9165091586330134 3.929495144111461
[32m[I 2022-02-19 18:42:40,135][0m Trial 3 finished with value: 1.972551050778862 and parameters: {'n_layers_fe': 2, 'fe_n_units_l0': 53, 'fe_dropout_l0': 0.2667047529688444, 'fe_n_units_l1': 113, 'fe_dropout_l1': 0.20593712143412962, 'n_units_l(Invariant)': 381, 'n_layers_mlp': 2, 'mlp_n_units_l0': 224, 'mlp_dropout_l0': 0.16399526007443788, 'mlp_n_units_l1': 106, 'mlp_dropout_l1': 0.3815136744104959, 'reduction': 'sum', 'lr': 0.008426192500909806, 'weight_decay': 0.10328932856310226, 'criterion': 'MSELoss', 'batch_size': 128}. Best is trial 3 with value: 1.972551050778862.[0m

Trial Id: 4 | Model params: 167514 | Timestamp: 2022-02-19 18:42:40.135984

[32m[I 2022-02-19 18:44:23,034][0m Trial 4 pruned. [0m
++++++++++++++++++++
        NaN         
++++++++++++++++++++

Trial Id: 5 | Model params: 21572 | Timestamp: 2022-02-19 18:44:23.034299

[32m[I 2022-02-19 18:45:09,405][0m Trial 5 pruned. [0m
++++++++++++++++++++
        NaN         
++++++++++++++++++++

Trial Id: 6 | Model params: 136348 | Timestamp: 2022-02-19 18:45:09.405394

[32m[I 2022-02-19 18:46:43,654][0m Trial 6 pruned. [0m
++++++++++++++++++++
        NaN         
++++++++++++++++++++

Trial Id: 7 | Model params: 89274 | Timestamp: 2022-02-19 18:46:43.654906

epoch 0 0.002278063631832139 1.9833161286861365
epoch 5 -0.0002608479147312437 1.985838006104285
epoch 10 -0.0007369253269347009 1.9863105329230044
epoch 15 -0.0004331435778273107 1.9860090297648099
epoch 20 -2.722073801741942e-05 1.985606080191447
epoch 25 -0.0032057971582128975 1.988759191081456
epoch 30 -0.006232155104207049 1.991756664231954
epoch 35 -0.013054058912906008 1.9984969677939124
epoch 40 -0.005039970186235143 1.9905763968352466
epoch 45 -0.00014513132660298744 1.9857231355455065
epoch 50 -6.252598894018746e-05 1.9856411300884518
epoch 55 -0.0030053984981863735 1.9885605456074789
epoch 60 -0.007898399962216862 1.9934050818052582
epoch 65 -0.006898852284740853 1.9924163920406406
epoch 70 -0.0026815179319605864 1.988239456549583
epoch 75 -8.442924618523584e-05 1.98566287461402
epoch 80 -0.0013398325102198516 1.9869087823434808
epoch 85 -7.726311189748536e-05 1.985655760438514
epoch 90 -2.323555467209637e-05 1.9856021237930608
epoch 95 -6.0470373621779316e-05 1.98563908935784
[32m[I 2022-02-19 20:22:03,138][0m Trial 7 finished with value: 1.9866190175150469 and parameters: {'n_layers_fe': 4, 'fe_n_units_l0': 89, 'fe_dropout_l0': 0.4998924760289149, 'fe_n_units_l1': 66, 'fe_dropout_l1': 0.4568258420821041, 'fe_n_units_l2': 46, 'fe_dropout_l2': 0.18527856698407963, 'fe_n_units_l3': 172, 'fe_dropout_l3': 0.10013029138190493, 'n_units_l(Invariant)': 77, 'n_layers_mlp': 4, 'mlp_n_units_l0': 83, 'mlp_dropout_l0': 0.16592452231357374, 'mlp_n_units_l1': 104, 'mlp_dropout_l1': 0.29509024082186386, 'mlp_n_units_l2': 139, 'mlp_dropout_l2': 0.268585186480391, 'mlp_n_units_l3': 234, 'mlp_dropout_l3': 0.07900772496191033, 'reduction': 'sum', 'lr': 0.003194553052132779, 'weight_decay': 0.10118833283772258, 'criterion': 'MSELoss', 'batch_size': 256}. Best is trial 3 with value: 1.972551050778862.[0m

Trial Id: 8 | Model params: 84619 | Timestamp: 2022-02-19 20:22:03.138781

[32m[I 2022-02-19 20:23:40,839][0m Trial 8 pruned. [0m
++++++++++++++++++++
        NaN         
++++++++++++++++++++

Trial Id: 9 | Model params: 184522 | Timestamp: 2022-02-19 20:23:40.839507

[32m[I 2022-02-19 20:25:44,008][0m Trial 9 pruned. [0m
++++++++++++++++++++
        NaN         
++++++++++++++++++++

Trial Id: 10 | Model params: 89176 | Timestamp: 2022-02-19 20:25:44.008799

epoch 0 0.029303091260984737 1.95627095291446
epoch 5 0.029153194020917317 1.9564219930044286
epoch 10 0.03071456976794862 1.9548481406654903
epoch 15 0.029166560906589756 1.9564085246801979
epoch 20 0.02470598968254689 1.9608978110501325
epoch 25 -0.00010326843208674497 1.9856815770829164
epoch 30 -0.00010110786818340323 1.9856794322072864
epoch 35 -5.734197242501793e-05 1.9856359836053652
epoch 40 -3.4477368215934945e-06 1.9855824787857654
epoch 45 -0.0005832374404750595 1.9861580035312427
epoch 50 -0.00027436892070564767 1.9858514278216617
epoch 55 -0.00037009284272704335 1.9859464462213483
epoch 60 -0.0001916920800260069 1.9857693566819954
epoch 65 -0.00031790828235367385 1.9858946468450256
epoch 70 -1.564392714459295e-05 1.985594586978008
epoch 75 -0.0004514741063865735 1.986027224098293
epoch 80 -4.099568209348092e-06 1.9855831259159202
epoch 85 -4.784760878617789e-07 1.9855795309376967
epoch 90 0.027114382669904957 1.9584751920246726
epoch 95 0.02987477801248417 1.9556948004153196
[32m[I 2022-02-19 22:33:41,393][0m Trial 10 finished with value: 1.9857983913232335 and parameters: {'n_layers_fe': 2, 'fe_n_units_l0': 9, 'fe_dropout_l0': 0.1668041547153596, 'fe_n_units_l1': 224, 'fe_dropout_l1': 0.3238105445683832, 'n_units_l(Invariant)': 350, 'n_layers_mlp': 2, 'mlp_n_units_l0': 180, 'mlp_dropout_l0': 0.4817724941002478, 'mlp_n_units_l1': 20, 'mlp_dropout_l1': 0.20196821466430442, 'reduction': 'sum', 'lr': 0.008558142632320792, 'weight_decay': 0.0015298454876450929, 'criterion': 'MSELoss', 'batch_size': 128}. Best is trial 3 with value: 1.972551050778862.[0m

Trial Id: 11 | Model params: 102241 | Timestamp: 2022-02-19 22:33:41.393774

epoch 0 -0.019054919486322985 2.004407310961678
epoch 5 0.021951079572208543 1.9636653292058144
epoch 10 0.02529524718850784 1.9603053495339486
epoch 15 0.02559746153364062 1.9600014224601954
epoch 20 0.022784159516895053 1.9628288481915885
epoch 25 0.023573186729606954 1.9620362709243129
epoch 30 0.004302845909863295 1.9813026303928079
epoch 35 0.017370147362546717 1.9682586113521359
epoch 40 -0.00012113986360873241 1.98569931865767
epoch 45 -6.541073675148112e-05 1.9856439939442732
epoch 50 -0.00012476930089388993 1.9857029217035003
epoch 55 -9.885550155663836e-05 1.9856771961930635
epoch 60 -0.00041558495935767326 1.9859916014498524
epoch 65 -0.0022157235293136512 1.9877775858686626
epoch 70 -0.0005078057680059089 1.9860831361748217
epoch 75 -4.472757209494915e-06 1.9855834964132573
epoch 80 0.009956351931865615 1.975669767184488
epoch 85 0.025417863973151267 1.96018204352866
epoch 90 0.02292580541281075 1.9626865885623315
epoch 95 0.024184663157092334 1.9614218230195344
[32m[I 2022-02-20 00:56:36,242][0m Trial 11 finished with value: 1.9855825813632435 and parameters: {'n_layers_fe': 2, 'fe_n_units_l0': 14, 'fe_dropout_l0': 0.15608250487423456, 'fe_n_units_l1': 255, 'fe_dropout_l1': 0.3411589274186158, 'n_units_l(Invariant)': 360, 'n_layers_mlp': 2, 'mlp_n_units_l0': 181, 'mlp_dropout_l0': 0.4509446862546622, 'mlp_n_units_l1': 9, 'mlp_dropout_l1': 0.19845686653333974, 'reduction': 'sum', 'lr': 0.009818654249392059, 'weight_decay': 0.01395261828396513, 'criterion': 'MSELoss', 'batch_size': 128}. Best is trial 3 with value: 1.972551050778862.[0m

Trial Id: 12 | Model params: 52757 | Timestamp: 2022-02-20 00:56:36.242467

epoch 0 0.024946337361028248 1.9606561781315544
epoch 5 0.025546576272824417 1.9600525994007234
epoch 10 0.016890189322496085 1.9687392431054997
epoch 15 0.027998971679452866 1.9575846250443778
epoch 20 -2.5388275802562532e-05 1.9856042609660767
epoch 25 -1.061087997245025e-06 1.9855801093484766
epoch 30 -0.0002364105479988332 1.9858137479579565
epoch 35 -0.0003898768879686543 1.9859660838836322
epoch 40 -0.00033653405921962865 1.9859131352965893
epoch 45 -1.2985251381048002e-05 1.985591947491443
epoch 50 -0.0005475443510578604 1.9861225778191198
epoch 55 -0.0006632302672675561 1.9862373948361887
epoch 60 -4.2392918776723576e-05 1.9856211427114843
epoch 65 -0.00015223780795259323 1.9857301902613267
epoch 70 -0.0012394404945077486 1.9868091784073023
epoch 75 0.023892878418491414 1.9617150496967408
epoch 80 0.01673653590651203 1.968893087410434
epoch 85 -0.0005853652435727774 1.986160115374989
epoch 90 -0.00048394736892354295 1.986059455676633
epoch 95 -6.927839021786397e-06 1.9855859337858242
[32m[I 2022-02-20 02:23:44,749][0m Trial 12 finished with value: 1.9855962180999658 and parameters: {'n_layers_fe': 2, 'fe_n_units_l0': 53, 'fe_dropout_l0': 0.13741288171813085, 'fe_n_units_l1': 111, 'fe_dropout_l1': 0.3159119749806007, 'n_units_l(Invariant)': 353, 'n_layers_mlp': 2, 'mlp_n_units_l0': 198, 'mlp_dropout_l0': 0.4528775266883204, 'mlp_n_units_l1': 10, 'mlp_dropout_l1': 0.23207461941100085, 'reduction': 'sum', 'lr': 0.00882098920319476, 'weight_decay': 0.011086857984534897, 'criterion': 'MSELoss', 'batch_size': 128}. Best is trial 3 with value: 1.972551050778862.[0m

Trial Id: 13 | Model params: 141448 | Timestamp: 2022-02-20 02:23:44.750332

epoch 0 -0.056618435074840656 2.0410153691247515
epoch 5 0.01252316960972133 1.9731070138711528
epoch 10 0.003152288006461834 1.9824470271773924
epoch 15 0.012785822955191595 1.972844588663829
epoch 20 0.011253295671400099 1.9743752928215446
epoch 25 0.013214702484710017 1.9724160066024607
epoch 30 0.012307600208613767 1.9733223699551579
epoch 35 0.01194769394805073 1.973681867703826
epoch 40 0.008232148071792511 1.9773893760180217
epoch 45 0.01031743278996633 1.975309459034251
epoch 50 0.013183696964884417 1.9724469937398699
epoch 55 0.012627457150152455 1.9730028210919914
epoch 60 0.0034594325457025787 1.98214159201343
epoch 65 0.01351520119881533 1.9721156608203774
epoch 70 0.012749404903739436 1.9728809771673648
epoch 75 0.005859188243583224 1.9797535694896697
epoch 80 0.011450595735581826 1.9741782940324748
epoch 85 0.012257966670417675 1.9733719510498469
epoch 90 0.009242231934524003 1.9763821655562839
epoch 95 0.010784129546064669 1.9748436636101463
[32m[I 2022-02-20 04:15:55,133][0m Trial 13 finished with value: 1.974457822721665 and parameters: {'n_layers_fe': 2, 'fe_n_units_l0': 64, 'fe_dropout_l0': 0.18859093932501103, 'fe_n_units_l1': 212, 'fe_dropout_l1': 0.035549636631094644, 'n_units_l(Invariant)': 363, 'n_layers_mlp': 2, 'mlp_n_units_l0': 204, 'mlp_dropout_l0': 0.17755456216609228, 'mlp_n_units_l1': 218, 'mlp_dropout_l1': 0.17012962395014203, 'reduction': 'sum', 'lr': 0.0005968576168165152, 'weight_decay': 0.16154250953974625, 'criterion': 'MSELoss', 'batch_size': 128}. Best is trial 3 with value: 1.972551050778862.[0m

Trial Id: 14 | Model params: 119725 | Timestamp: 2022-02-20 04:15:55.133678

epoch 0 -0.09970614881927742 2.0822147080969526
epoch 5 -0.07584376159768857 2.0594999518883306
epoch 10 -0.0664230883419179 2.0504630744436105
epoch 15 -0.06151481727249819 2.045738947727166
epoch 20 -0.05721063021319761 2.0415872454196036
epoch 25 -0.05248415701093667 2.0370184696608873
epoch 30 -0.04815958968363776 2.0328291946083925
epoch 35 -0.04278960035599866 2.0276151561976894
epoch 40 -0.037755595533123465 2.0227151395758955
epoch 45 -0.03362947690291396 2.0186899745553712
epoch 50 -0.02825936822554942 2.0134392044513185
epoch 55 -0.02398000190381233 2.0092451131685998
epoch 60 -0.02039371333651485 2.005723534132454
epoch 65 -0.017570535681835198 2.0029469411804777
epoch 70 -0.014827336715146355 2.0002453151820037
epoch 75 -0.012682956147508584 1.998130888769031
epoch 80 -0.010817932244101325 1.9962900958537786
epoch 85 -0.009353979785572397 1.9948439735546029
epoch 90 -0.008129697391115798 1.9936337968330384
epoch 95 -0.00724586856659748 1.9927596943326713
[32m[I 2022-02-20 05:49:38,692][0m Trial 14 finished with value: 1.992764610083002 and parameters: {'n_layers_fe': 2, 'fe_n_units_l0': 73, 'fe_dropout_l0': 0.22779050575223742, 'fe_n_units_l1': 213, 'fe_dropout_l1': 0.029553578277877357, 'n_units_l(Invariant)': 237, 'n_layers_mlp': 2, 'mlp_n_units_l0': 220, 'mlp_dropout_l0': 0.17211658645297076, 'mlp_n_units_l1': 214, 'mlp_dropout_l1': 0.28978173227686965, 'reduction': 'sum', 'lr': 1.0619569527862823e-05, 'weight_decay': 0.17225515557172053, 'criterion': 'MSELoss', 'batch_size': 128}. Best is trial 3 with value: 1.972551050778862.[0m

Trial Id: 15 | Model params: 142856 | Timestamp: 2022-02-20 05:49:38.692859

epoch 0 -0.027022536554761833 2.012227917320474
epoch 5 0.01826235105217655 1.9673648432701794
epoch 10 0.016104906116380713 1.9695253756622653
epoch 15 0.018294198946989026 1.9673329320274913
epoch 20 0.0160423721345081 1.9695879637918299
epoch 25 0.018992527723304065 1.9666330840674355
epoch 30 0.016187293067396857 1.9694429143365617
epoch 35 0.01601420000159315 1.9696161596689519
epoch 40 0.01704118418300571 1.9685880489462244
epoch 45 0.018283314278184082 1.9673438384049493
epoch 50 0.011135827598166115 1.9744925721876285
epoch 55 0.017884232952866563 1.967743673929019
epoch 60 0.018109828889119384 1.9675176616367247
epoch 65 0.015170948146458807 1.9704599354627594
epoch 70 0.010574841565352155 1.975052560978368
epoch 75 0.016428689804064645 1.9692012797978393
epoch 80 0.018120357355895456 1.9675071131046835
epoch 85 0.018170503523900372 1.9674568705913904
epoch 90 0.016515409632758438 1.969114467301306
epoch 95 0.014890727512229196 1.9707402502339384
