[32m[I 2022-03-23 18:59:36,909][0m Trial 19 pruned. [0m
epoch 0 -0.008869834890908868 7.958018203891062

Study statistics: 
  Number of finished trials:  20
  Number of pruned trials:  10
  Number of complete trials:  10

Best trial:
  Value:  7.465325986203802
  Params: 
    lr: 7.926044919367361e-05
    weight_decay: 0.12113088879809447
    criterion: MSELoss
    batch_size: 256
    epochs: 10
Target: 132567, NaN: 0, Max: 365.0, Min: 0.0, Mean: 32.88284414673335
Prediction: 132567, NaN: 0, Max: 40.74932098388672, Min: 26.849964141845703, Mean: 32.98755451903568

 XXXXXX======== TRIAL south - elg ended

Test Set - R-squared:  0.1121842734893449
Test Set - RMSE:  7.465325986203802
Test Set - MAE:  5.846754225744183



[32m[I 2022-03-23 19:04:54,669][0m A new study created in memory with name: DeepSet[0m
Starting Loading des
Finished Loading des
Finished des setup

++++++++ Session Characteristics +++++++

Area: des
Gal Type: elg
Training Set: 270781
Validation Set: 67698
Test Samples: 67698
Number of features: 5
Device: cuda:0
Number of Workers: 8
Number of Trials: 20

+++++++++++++++++++++++++++++++++++++++

Trial Id: 0 | Model params: 99272 | Timestamp: 2022-03-23 19:04:54.670248

epoch 0 -18.310052245087054 31.693250172222225
epoch 5 -18.1350894644713 31.549341780378455
epoch 10 -18.021881096154246 31.455876110741432
epoch 15 -17.94488052169845 31.39214485624459
epoch 20 -17.955641674474748 31.401059341298442
epoch 25 -17.893158954382763 31.34926359783892
epoch 30 -17.91157719531105 31.364540493533315
epoch 35 -17.91224255482024 31.36509223259512
epoch 40 -17.8978004915552 31.35311419362537
epoch 45 -17.902842563923986 31.35729653557806
epoch 50 -17.919874071329254 31.37141985546274
epoch 55 -17.890620460130332 31.347157475751757
epoch 60 -17.87882619661373 31.337370228100298
epoch 65 -17.867515678757115 31.327981535569982
epoch 70 -17.88690046570563 31.344070838319546
[32m[I 2022-03-23 20:39:21,503][0m Trial 0 finished with value: 31.350461665438065 and parameters: {'n_layers_fe': 4, 'fe_neurons': 128, 'fe_dropout': 0.4688195405632221, 'n_units_l(Invariant)': 163, 'n_layers_mlp': 2, 'initialiser': 'normal', 'lr': 1.4269866946101611e-05, 'weight_decay': 0.03347680478993261, 'criterion': 'PoissonNLLLoss', 'batch_size': 128, 'epochs': 75}. Best is trial 0 with value: 31.350461665438065.[0m

Trial Id: 1 | Model params: 80548 | Timestamp: 2022-03-23 20:39:21.503257

epoch 0 -15.096350413434692 28.936017829563248
epoch 5 -14.862136513259156 28.72472608269003
epoch 10 -14.75941707294038 28.631567757495016
epoch 15 -14.7652879153009 28.63690030781199
epoch 20 -14.763273307389527 28.635070529331912
epoch 25 -14.751508381760308 28.624382636295262
epoch 30 -14.76568561813917 28.63726150973763
epoch 35 -14.76675409251438 28.638231897655793
epoch 40 -14.760718556886916 28.63274999527425
epoch 45 -14.740990403824364 28.61482415802046
epoch 50 -14.761111752390217 28.63310715533292
epoch 55 -14.754425019254539 28.627032639115722
epoch 60 -14.751833574841095 28.62467811285872
epoch 65 -14.748512758780459 28.62166061331174
epoch 70 -14.756987266784037 28.629360447381572
[32m[I 2022-03-23 21:46:08,162][0m Trial 1 finished with value: 28.6380288489589 and parameters: {'n_layers_fe': 2, 'fe_neurons': 128, 'fe_dropout': 0.07472235507847513, 'n_units_l(Invariant)': 273, 'n_layers_mlp': 2, 'initialiser': 'uniform', 'lr': 2.725124978407432e-05, 'weight_decay': 0.2806078330219279, 'criterion': 'PoissonNLLLoss', 'batch_size': 256, 'epochs': 75}. Best is trial 1 with value: 28.6380288489589.[0m

Trial Id: 2 | Model params: 120852 | Timestamp: 2022-03-23 21:46:08.163024

epoch 0 -0.31138150880749604 8.259230414823493
epoch 5 0.030523586507277267 7.101395132726286
epoch 10 0.021433682061742676 7.134609143090786
epoch 15 0.03763805412936827 7.075290486775525
epoch 20 0.03943926876544335 7.068666115568136
[32m[I 2022-03-23 22:09:46,342][0m Trial 2 finished with value: 7.081096820788327 and parameters: {'n_layers_fe': 2, 'fe_neurons': 128, 'fe_dropout': 0.06525542379182542, 'n_units_l(Invariant)': 329, 'n_layers_mlp': 4, 'initialiser': 'normal', 'lr': 0.0002914572374372423, 'weight_decay': 0.04640569514858248, 'criterion': 'MSELoss', 'batch_size': 256, 'epochs': 25}. Best is trial 2 with value: 7.081096820788327.[0m

Trial Id: 3 | Model params: 63778 | Timestamp: 2022-03-23 22:09:46.342160

epoch 0 -27.89430326720619 38.76869369178028
epoch 5 -15.978466729509208 29.718322297431744
epoch 10 -15.474309157628717 29.273770263847176
epoch 15 -15.022996852075739 28.870009584240936
epoch 20 -15.045563251187492 28.89033234095154
[32m[I 2022-03-23 22:27:14,868][0m Trial 3 finished with value: 28.830611224829603 and parameters: {'n_layers_fe': 2, 'fe_neurons': 128, 'fe_dropout': 0.32196582137671514, 'n_units_l(Invariant)': 144, 'n_layers_mlp': 2, 'initialiser': 'xavier', 'lr': 0.0030041729835057368, 'weight_decay': 0.05203713194426296, 'criterion': 'PoissonNLLLoss', 'batch_size': 256, 'epochs': 25}. Best is trial 2 with value: 7.081096820788327.[0m

Trial Id: 4 | Model params: 145426 | Timestamp: 2022-03-23 22:27:14.869039

epoch 0 -15.414731534552509 29.220789550177926
epoch 5 -14.778747947246979 28.649122455525063
epoch 10 -14.750154847160372 28.62315275647292
epoch 15 -14.757530560611022 28.629854006856664
epoch 20 -14.76328202131843 28.635078444056518
[32m[I 2022-03-23 22:59:25,486][0m Trial 4 finished with value: 28.64153761094749 and parameters: {'n_layers_fe': 4, 'fe_neurons': 128, 'fe_dropout': 0.2892214293140061, 'n_units_l(Invariant)': 264, 'n_layers_mlp': 4, 'initialiser': 'kaiming_he', 'lr': 6.961408986940021e-05, 'weight_decay': 0.1770084034671771, 'criterion': 'PoissonNLLLoss', 'batch_size': 256, 'epochs': 25}. Best is trial 2 with value: 7.081096820788327.[0m

Trial Id: 5 | Model params: 62868 | Timestamp: 2022-03-23 22:59:25.487173

[32m[I 2022-03-23 23:00:10,785][0m Trial 5 pruned. [0m
epoch 0 -0.3454290101822559 8.365760905555225

Trial Id: 6 | Model params: 437266 | Timestamp: 2022-03-23 23:00:10.785902

[32m[I 2022-03-23 23:01:50,815][0m Trial 6 pruned. [0m
epoch 0 0.016248909774763343 7.153484948621202

Trial Id: 7 | Model params: 99528 | Timestamp: 2022-03-23 23:01:50.815221

epoch 0 -15.885731270930311 29.637051243797604
epoch 5 -14.882083115080974 28.742781048428732
epoch 10 -14.751037523410822 28.623954800117215
epoch 15 -14.75609980832515 28.628554210585566
epoch 20 -14.757729682686326 28.63003489871386
[32m[I 2022-03-23 23:28:47,989][0m Trial 7 finished with value: 28.630267317039856 and parameters: {'n_layers_fe': 2, 'fe_neurons': 128, 'fe_dropout': 0.36669610114886503, 'n_units_l(Invariant)': 419, 'n_layers_mlp': 2, 'initialiser': 'uniform', 'lr': 1.9838208275605593e-05, 'weight_decay': 0.16610976739745684, 'criterion': 'PoissonNLLLoss', 'batch_size': 128, 'epochs': 25}. Best is trial 2 with value: 7.081096820788327.[0m

Trial Id: 8 | Model params: 173376 | Timestamp: 2022-03-23 23:28:47.989628

[32m[I 2022-03-23 23:30:22,834][0m Trial 8 pruned. [0m
epoch 0 -14.761426472471971 28.63339302884811

Trial Id: 9 | Model params: 82632 | Timestamp: 2022-03-23 23:30:22.834552

[32m[I 2022-03-23 23:31:43,404][0m Trial 9 pruned. [0m
epoch 0 0.01880916812722755 7.1441702441373485

Trial Id: 10 | Model params: 44238 | Timestamp: 2022-03-23 23:31:43.405161

[32m[I 2022-03-23 23:33:05,754][0m Trial 10 pruned. [0m
epoch 0 -0.005247777199135939 7.2312206752660675

Trial Id: 11 | Model params: 288392 | Timestamp: 2022-03-23 23:33:05.754255

[32m[I 2022-03-23 23:34:47,998][0m Trial 11 pruned. [0m
epoch 0 -0.08065429610770192 7.497534045804515

Trial Id: 12 | Model params: 37568 | Timestamp: 2022-03-23 23:34:47.998455

epoch 0 -16.440258921168564 30.119760797694692
epoch 5 -16.014884694446216 29.75017738477948
epoch 10 -15.207463199974601 29.03571844521282
epoch 15 -14.81652981535469 28.68340179720774
epoch 20 -14.777080515579632 28.647608656195246
[32m[I 2022-03-23 23:53:32,198][0m Trial 12 finished with value: 28.636949203412197 and parameters: {'n_layers_fe': 2, 'fe_neurons': 64, 'fe_dropout': 0.3907714492119479, 'n_units_l(Invariant)': 383, 'n_layers_mlp': 2, 'initialiser': 'uniform', 'lr': 1.1147295191778243e-05, 'weight_decay': 0.22932108693792475, 'criterion': 'PoissonNLLLoss', 'batch_size': 128, 'epochs': 25}. Best is trial 2 with value: 7.081096820788327.[0m

Trial Id: 13 | Model params: 125142 | Timestamp: 2022-03-23 23:53:32.198469

[32m[I 2022-03-23 23:54:32,405][0m Trial 13 pruned. [0m
epoch 0 -4.7762249302087945 17.33393256535773

Trial Id: 14 | Model params: 132422 | Timestamp: 2022-03-23 23:54:32.405649

epoch 0 -21.322541995413346 34.075864192003095
epoch 5 -18.08662930575541 31.509366651768055
epoch 10 -17.439098874539916 30.97026353622177
epoch 15 -16.82254406371873 30.448079362950057
epoch 20 -18.00149606861098 31.439016558708886
[32m[I 2022-03-24 00:20:52,513][0m Trial 14 finished with value: 31.18649244871766 and parameters: {'n_layers_fe': 2, 'fe_neurons': 128, 'fe_dropout': 0.4627448890927568, 'n_units_l(Invariant)': 418, 'n_layers_mlp': 4, 'initialiser': 'normal', 'lr': 0.00019696250247737532, 'weight_decay': 0.20009882058737316, 'criterion': 'PoissonNLLLoss', 'batch_size': 256, 'epochs': 25}. Best is trial 2 with value: 7.081096820788327.[0m

Trial Id: 15 | Model params: 250724 | Timestamp: 2022-03-24 00:20:52.513412

[32m[I 2022-03-24 00:22:26,405][0m Trial 15 pruned. [0m
epoch 0 0.0007330601249722069 7.20967709370569

Trial Id: 16 | Model params: 26348 | Timestamp: 2022-03-24 00:22:26.405866

epoch 0 -135583.75358431382 2655.7089821226496
epoch 5 -367622557.429074 138285.33653690922
[32m[I 2022-03-24 00:27:06,532][0m Trial 16 pruned. [0m
++++++++++++++++++++
        NaN         
++++++++++++++++++++

Trial Id: 17 | Model params: 144512 | Timestamp: 2022-03-24 00:27:06.532706

[32m[I 2022-03-24 00:28:15,026][0m Trial 17 pruned. [0m
epoch 0 -0.061785998995695035 7.431792091591468

Trial Id: 18 | Model params: 120202 | Timestamp: 2022-03-24 00:28:15.026211

[32m[I 2022-03-24 00:29:11,618][0m Trial 18 pruned. [0m
epoch 0 -0.9987453421008672 10.196562526159125

Trial Id: 19 | Model params: 136842 | Timestamp: 2022-03-24 00:29:11.619121

[32m[I 2022-03-24 00:30:54,371][0m Trial 19 pruned. [0m
epoch 0 -14.757912120660919 28.63020063294609

Study statistics: 
  Number of finished trials:  20
  Number of pruned trials:  12
  Number of complete trials:  8

Best trial:
  Value:  7.081096820788327
  Params: 
    n_layers_fe: 2
    fe_neurons: 128
    fe_dropout: 0.06525542379182542
    n_units_l(Invariant): 329
    n_layers_mlp: 4
    initialiser: normal
    lr: 0.0002914572374372423
    weight_decay: 0.04640569514858248
    criterion: MSELoss
    batch_size: 256
    epochs: 25
Target: 67698, NaN: 0, Max: 114.0, Min: 8.0, Mean: 31.138955360571952
Prediction: 67698, NaN: 0, Max: 36.2719841003418, Min: 28.321420669555664, Mean: 30.504420474099

 XXXXXX======== TRIAL des - elg ended

Test Set - R-squared:  0.036057882200006275
Test Set - RMSE:  7.081096820788327
Test Set - MAE:  5.596697177586624



[32m[I 2022-03-24 00:32:18,414][0m A new study created in memory with name: DeepSet[0m
Starting Loading des
Finished Loading des
Finished des setup

++++++++ Session Characteristics +++++++

Area: des
Gal Type: elg
Training Set: 270781
Validation Set: 67698
Test Samples: 67698
Number of features: 5
Device: cuda:0
Number of Workers: 8
Number of Trials: 20

+++++++++++++++++++++++++++++++++++++++

Previous best Test-set performance: 0.04756083163409808

Trial Id: 0 | Model params: 89650 | Timestamp: 2022-03-24 00:32:18.417552

epoch 0 0.04276151710389553 7.056431488265786
epoch 1 0.04096048534436636 7.063066660783363
epoch 2 0.03601155591305827 7.081266974667858
epoch 3 0.04050947041937991 7.064727267044328
epoch 4 0.03902417158413496 7.07019327900424
epoch 5 0.03865829420300071 7.071539086852708
epoch 6 0.03605622813736031 7.081102896138964
epoch 7 0.03936253358141639 7.068948453032688
epoch 8 0.039415712345526877 7.068752789653903
[32m[I 2022-03-24 00:48:17,964][0m Trial 0 finished with value: 7.071184811842353 and parameters: {'lr': 2.111485672222782e-05, 'weight_decay': 0.2142148197544027, 'criterion': 'MSELoss', 'batch_size': 32, 'epochs': 10}. Best is trial 0 with value: 7.071184811842353.[0m
epoch 9 0.03875461575543748 7.071184811842353

Previous best Test-set performance: 0.04756083163409808

Trial Id: 1 | Model params: 89650 | Timestamp: 2022-03-24 00:48:17.964615

epoch 0 -0.01530590365303186 7.267307053488146
epoch 1 -0.022939539880552084 7.294575728636997
epoch 2 -0.00056863110524219 7.214371394497817
epoch 3 -0.00013072431122140848 7.212792508307333
epoch 4 -0.011195789063946249 7.252582547787301
epoch 5 -0.0060217475170616375 7.234003906142146
epoch 6 -0.0161158388926419 7.270205133103401
epoch 7 -0.0008047632335690391 7.2152226326450855
epoch 8 -0.010375176795824004 7.2496391187151135
[32m[I 2022-03-24 01:01:48,263][0m Trial 1 finished with value: 7.212324893341738 and parameters: {'lr': 0.00865266693933992, 'weight_decay': 0.2578261379857008, 'criterion': 'MSELoss', 'batch_size': 256, 'epochs': 10}. Best is trial 0 with value: 7.071184811842353.[0m
epoch 9 -1.048895307942388e-06 7.212324893341738

Previous best Test-set performance: 0.04756083163409808

Trial Id: 2 | Model params: 89650 | Timestamp: 2022-03-24 01:01:48.263263

epoch 0 0.04474525054084988 7.049115997354064
epoch 1 0.046315639240282924 7.043319425592959
epoch 2 0.04663366136887925 7.042144970870228
epoch 3 0.04572163020066944 7.045512574765781
epoch 4 0.04529836004942822 7.0470749200190435
epoch 5 0.045818765050737786 7.045153988505567
epoch 6 0.046019962255089086 7.044411184117987
epoch 7 0.04658063815383584 7.042340799042663
epoch 8 0.047038021236449845 7.040651388237351
[32m[I 2022-03-24 01:15:11,908][0m Trial 2 finished with value: 7.043196113640819 and parameters: {'lr': 0.00011107404195596915, 'weight_decay': 0.03822498335946477, 'criterion': 'MSELoss', 'batch_size': 256, 'epochs': 10}. Best is trial 2 with value: 7.043196113640819.[0m
epoch 9 0.046349032486759145 7.043196113640819

Previous best Test-set performance: 0.04756083163409808

Trial Id: 3 | Model params: 89650 | Timestamp: 2022-03-24 01:15:11.908290

epoch 0 -0.0016100661615741085 7.218124932746612
epoch 1 -0.001020143388468231 7.215998973958387
epoch 2 -0.00013921437386921198 7.21282312277043
epoch 3 -0.004293725125846137 7.227788387767734
epoch 4 -0.012853468030379789 7.258524784952354
epoch 5 -1.8477803094052447e-05 7.212387744474704
epoch 6 -0.010576517078605407 7.250361410648911
epoch 7 -0.004391552812532451 7.228140406595477
epoch 8 -3.927779307466572e-05 7.212462751495115
epoch 9 -0.004077121395787975 7.227008909459148
epoch 10 -0.00539415232125906 7.231747128696261
epoch 11 -7.606784391270848 21.159018396889564
epoch 12 -0.0028509223978332443 7.22259467768145
epoch 13 -0.00017712146839432563 7.2129598110300615
epoch 14 -0.0027705307532279733 7.222305179068866
epoch 15 -0.003477376891138695 7.224850207593719
epoch 16 -0.008430941263349645 7.242660625240493
epoch 17 -0.00012199520530731256 7.212761031738524
epoch 18 -0.00026130822819947497 7.213263368732273
[32m[I 2022-03-24 01:42:03,353][0m Trial 3 finished with value: 7.2371745009563595 and parameters: {'lr': 0.009562778542795537, 'weight_decay': 0.24761475427565302, 'criterion': 'MSELoss', 'batch_size': 256, 'epochs': 20}. Best is trial 2 with value: 7.043196113640819.[0m
epoch 19 -0.006903800217558764 7.2371745009563595

Previous best Test-set performance: 0.04756083163409808

Trial Id: 4 | Model params: 89650 | Timestamp: 2022-03-24 01:42:03.353778

epoch 0 -0.3068149280725496 8.244837450525667
epoch 1 -0.536014011666321 8.938664625721458
epoch 2 -0.7754922320582269 9.61024462614122
epoch 3 -1.0402203216332255 10.301811260247128
epoch 4 -1.3366167909703757 11.024751292168352
epoch 5 -1.667357559868551 11.779196664989717
epoch 6 -2.034143221224666 12.562992279576413
epoch 7 -2.434054142847727 13.365297291789725
epoch 8 -2.8699943324762534 14.18829530136938
epoch 9 -3.340186671418677 15.025511278930162
epoch 10 -3.8457332453458175 15.876501391239813
epoch 11 -4.385229939566235 16.736983199334475
epoch 12 -4.956712980754557 17.602663691377316
epoch 13 -5.5611780279050445 18.474213797724577
epoch 14 -6.197701708317394 19.349599330277634
epoch 15 -6.864860611174767 20.226492109270843
epoch 16 -7.5615158132684 21.10330063833696
epoch 17 -8.284876674911557 21.976732611735997
epoch 18 -9.0340146301318 22.84611819681093
[32m[I 2022-03-24 02:09:26,236][0m Trial 4 finished with value: 23.708524996495 and parameters: {'lr': 3.3283600046592654e-05, 'weight_decay': 0.13447003661098927, 'criterion': 'PoissonNLLLoss', 'batch_size': 128, 'epochs': 20}. Best is trial 2 with value: 7.043196113640819.[0m
epoch 19 -9.805850691781652 23.708524996495

Previous best Test-set performance: 0.04756083163409808

Trial Id: 5 | Model params: 89650 | Timestamp: 2022-03-24 02:09:26.237149

epoch 0 -0.3392084363025072 8.346399005293765
epoch 1 -0.5861653614729834 9.083417690025694
epoch 2 -0.8388582332315038 9.78023248925291
epoch 3 -1.116004039942415 10.491396501599436
[32m[I 2022-03-24 02:16:17,036][0m Trial 5 finished with value: 11.233127293168293 and parameters: {'lr': 5.760768133902095e-05, 'weight_decay': 0.07533909723159583, 'criterion': 'PoissonNLLLoss', 'batch_size': 128, 'epochs': 5}. Best is trial 2 with value: 7.043196113640819.[0m
epoch 4 -1.4257791107916788 11.233127293168293

Previous best Test-set performance: 0.04756083163409808

Trial Id: 6 | Model params: 89650 | Timestamp: 2022-03-24 02:16:17.036760

epoch 0 -1.3704991944662792 11.104396496276133
epoch 1 -2.946212506064598 14.327330811469965
epoch 2 -5.084984957237077 17.791182262351604
epoch 3 -7.768797926125071 21.357237903128038
[32m[I 2022-03-24 02:24:21,386][0m Trial 6 finished with value: 24.901627133197003 and parameters: {'lr': 8.560969377843005e-05, 'weight_decay': 0.16857279323079902, 'criterion': 'PoissonNLLLoss', 'batch_size': 32, 'epochs': 5}. Best is trial 2 with value: 7.043196113640819.[0m
epoch 4 -10.920798389219621 24.901627133197003

Previous best Test-set performance: 0.04756083163409808

Trial Id: 7 | Model params: 89650 | Timestamp: 2022-03-24 02:24:21.386626

[32m[I 2022-03-24 02:25:43,961][0m Trial 7 pruned. [0m
epoch 0 0.04689131461988105 7.041193314576526

Previous best Test-set performance: 0.04756083163409808

Trial Id: 8 | Model params: 89650 | Timestamp: 2022-03-24 02:25:43.962110

epoch 0 -1.4817880371783807 11.362068357419012
epoch 1 -3.108571602298899 14.619094868612024
epoch 2 -5.295503887651653 18.096321469118497
epoch 3 -8.025586437169625 21.667697770880302
epoch 4 -11.199947484479937 25.191500413923105
epoch 5 -14.276347084773805 28.189333843191633
epoch 6 -14.766926768049599 28.638388718408248
epoch 7 -14.772300477919693 28.64326859398523
epoch 8 -14.774741036245047 28.645484594869032
epoch 9 -14.779730272364533 28.65001423460273
epoch 10 -14.76675787623904 28.6382353339743
epoch 11 -14.74952183661445 28.622577557696033
epoch 12 -14.771657844644736 28.642685061322116
epoch 13 -14.781725846779151 28.65182578102708
epoch 14 -14.761937720560402 28.63385741095117
epoch 15 -14.757549101257734 28.629870850100293
epoch 16 -14.742904096990886 28.61656351265453
epoch 17 -14.772946936882924 28.64385558850809
epoch 18 -14.748165467455776 28.621345024488143
[32m[I 2022-03-24 02:57:59,441][0m Trial 8 finished with value: 28.63661212385516 and parameters: {'lr': 8.132318299910451e-05, 'weight_decay': 0.25041312337265703, 'criterion': 'PoissonNLLLoss', 'batch_size': 32, 'epochs': 20}. Best is trial 2 with value: 7.043196113640819.[0m
epoch 19 -14.764970612789616 28.63661212385516

Previous best Test-set performance: 0.04756083163409808

Trial Id: 9 | Model params: 89650 | Timestamp: 2022-03-24 02:57:59.442156

[32m[I 2022-03-24 02:59:21,836][0m Trial 9 pruned. [0m
epoch 0 0.04522856418885446 7.047332512364502

Previous best Test-set performance: 0.04756083163409808

Trial Id: 10 | Model params: 89650 | Timestamp: 2022-03-24 02:59:21.836874

[32m[I 2022-03-24 03:00:42,488][0m Trial 10 pruned. [0m
epoch 0 0.036432208932668964 7.07972178946221

Previous best Test-set performance: 0.04756083163409808

Trial Id: 11 | Model params: 89650 | Timestamp: 2022-03-24 03:00:42.488497

[32m[I 2022-03-24 03:02:17,313][0m Trial 11 pruned. [0m
epoch 0 0.02262984938272028 7.130247253803956

Previous best Test-set performance: 0.04756083163409808

Trial Id: 12 | Model params: 89650 | Timestamp: 2022-03-24 03:02:17.314077

[32m[I 2022-03-24 03:03:52,419][0m Trial 12 pruned. [0m
epoch 0 0.04701257449110219 7.040745390134036

Previous best Test-set performance: 0.04756083163409808

Trial Id: 13 | Model params: 89650 | Timestamp: 2022-03-24 03:03:52.419485

[32m[I 2022-03-24 03:05:10,712][0m Trial 13 pruned. [0m
epoch 0 0.03436400431212294 7.087315684151359

Previous best Test-set performance: 0.04756083163409808

Trial Id: 14 | Model params: 89650 | Timestamp: 2022-03-24 03:05:10.712826

[32m[I 2022-03-24 03:06:45,895][0m Trial 14 pruned. [0m
epoch 0 0.04495849713165989 7.0483291476384755

Previous best Test-set performance: 0.04756083163409808

Trial Id: 15 | Model params: 89650 | Timestamp: 2022-03-24 03:06:45.895206

[32m[I 2022-03-24 03:08:06,701][0m Trial 15 pruned. [0m
epoch 0 0.04342720446182957 7.053977452897365

Previous best Test-set performance: 0.04756083163409808

Trial Id: 16 | Model params: 89650 | Timestamp: 2022-03-24 03:08:06.701566

[32m[I 2022-03-24 03:09:42,888][0m Trial 16 pruned. [0m
epoch 0 -0.0008383325924534724 7.215343639446733

Previous best Test-set performance: 0.04756083163409808

Trial Id: 17 | Model params: 89650 | Timestamp: 2022-03-24 03:09:42.888573

[32m[I 2022-03-24 03:11:00,457][0m Trial 17 pruned. [0m
epoch 0 0.042365892052094845 7.057889543249578

Previous best Test-set performance: 0.04756083163409808

Trial Id: 18 | Model params: 89650 | Timestamp: 2022-03-24 03:11:00.457425

