[32m[I 2022-03-22 21:37:12,294][0m A new study created in memory with name: DeepSet[0m
Starting Loading north
Finished Loading north
Finished north setup

++++++++ Session Characteristics +++++++

Area: north
Gal Type: elg
Training Set: 290439
Validation Set: 72610
Test Samples: 72610
Number of features: 5
Device: cuda:0
Number of Workers: 8
Number of Trials: 20

+++++++++++++++++++++++++++++++++++++++

Trial Id: 0 | Model params: 300518 | Timestamp: 2022-03-22 21:37:12.294868

[32m[I 2022-03-22 21:38:56,211][0m Trial 0 pruned. [0m
++++++++++++++++++++
        NaN         
++++++++++++++++++++

Trial Id: 1 | Model params: 51172 | Timestamp: 2022-03-22 21:38:56.211707

epoch 0 0.060826045539270734 7.537731792861379
epoch 5 0.11080050837638733 7.334445117897923
epoch 10 0.11943885679181021 7.298732029626643
epoch 15 0.12192204675044838 7.288433520641209
epoch 20 0.12110366227541403 7.29182920530357
[32m[I 2022-03-22 21:57:53,359][0m Trial 1 finished with value: 7.29225116721967 and parameters: {'n_layers_fe': 4, 'fe_neurons': 64, 'fe_dropout': 0.19378989775460598, 'n_units_l(Invariant)': 337, 'n_layers_mlp': 4, 'initialiser': 'xavier', 'lr': 0.0002985909914895583, 'weight_decay': 0.23435180800500105, 'criterion': 'MSELoss', 'batch_size': 128, 'epochs': 25}. Best is trial 1 with value: 7.29225116721967.[0m

Trial Id: 2 | Model params: 417912 | Timestamp: 2022-03-22 21:57:53.359997

epoch 0 -0.015333482220726724 7.837400031410795
epoch 5 0.12037219669439825 7.294862903684833
epoch 10 0.10881003887960061 7.342649592038517
epoch 15 0.10858398260493662 7.3435807890002
epoch 20 0.11733635775880003 7.3074403561220995
epoch 25 0.10914294541673208 7.341278030150484
epoch 30 0.040828078486708885 7.617560089801767
epoch 35 0.08883103185750862 7.424498443882519
epoch 40 0.11294100614970537 7.325611991624783
epoch 45 0.11840003561848089 7.303036013826536
[32m[I 2022-03-22 23:13:23,287][0m Trial 2 finished with value: 7.33338858280147 and parameters: {'n_layers_fe': 2, 'fe_neurons': 256, 'fe_dropout': 0.37589724336007707, 'n_units_l(Invariant)': 443, 'n_layers_mlp': 4, 'initialiser': 'uniform', 'lr': 0.00021239822397385775, 'weight_decay': 0.19828127551859828, 'criterion': 'MSELoss', 'batch_size': 32, 'epochs': 50}. Best is trial 1 with value: 7.29225116721967.[0m

Trial Id: 3 | Model params: 38430 | Timestamp: 2022-03-22 23:13:23.287445

epoch 0 -23.935836837214772 38.840036923671946
[32m[I 2022-03-22 23:16:14,565][0m Trial 3 pruned. [0m
++++++++++++++++++++
        NaN         
++++++++++++++++++++

Trial Id: 4 | Model params: 38958 | Timestamp: 2022-03-22 23:16:14.565979

[32m[I 2022-03-22 23:16:57,568][0m Trial 4 pruned. [0m
++++++++++++++++++++
        NaN         
++++++++++++++++++++

Trial Id: 5 | Model params: 25890 | Timestamp: 2022-03-22 23:16:57.568619

epoch 0 -15.019180718750327 31.130622906007257
epoch 5 -14.931840806015686 31.045641590844703
epoch 10 -14.932709467858267 31.04648793989395
[32m[I 2022-03-22 23:36:54,815][0m Trial 5 pruned. [0m
++++++++++++++++++++
        NaN         
++++++++++++++++++++

Trial Id: 6 | Model params: 106812 | Timestamp: 2022-03-22 23:36:54.815208

epoch 0 -16.09131324639424 32.1555081649075
[32m[I 2022-03-22 23:38:13,481][0m Trial 6 pruned. [0m
++++++++++++++++++++
        NaN         
++++++++++++++++++++

Trial Id: 7 | Model params: 105508 | Timestamp: 2022-03-22 23:38:13.481211

epoch 0 -13.664383589126365 29.785134562678437
epoch 5 -14.460235002898816 30.582691643644797
epoch 10 -15.890135131378926 31.965700233116902
epoch 15 -15.977327045693045 32.04810226255732
[32m[I 2022-03-23 00:03:18,945][0m Trial 7 pruned. [0m
++++++++++++++++++++
        NaN         
++++++++++++++++++++

Trial Id: 8 | Model params: 26088 | Timestamp: 2022-03-23 00:03:18.945720

[32m[I 2022-03-23 00:03:38,794][0m Trial 8 pruned. [0m
++++++++++++++++++++
        NaN         
++++++++++++++++++++

Trial Id: 9 | Model params: 42786 | Timestamp: 2022-03-23 00:03:38.794875

epoch 0 -12.84704391808286 28.943176641962967
[32m[I 2022-03-23 00:07:01,305][0m Trial 9 pruned. [0m
++++++++++++++++++++
        NaN         
++++++++++++++++++++

Trial Id: 10 | Model params: 159596 | Timestamp: 2022-03-23 00:07:01.305977

epoch 0 -0.14371191250020443 8.318135346819359
epoch 5 0.11723146955702302 7.307874520096463
epoch 10 0.11884735246772149 7.3011830273926615
epoch 15 0.11709796992298904 7.3084270781332545
epoch 20 0.12089325228117986 7.292701994197398
[32m[I 2022-03-23 00:37:05,161][0m Trial 10 finished with value: 7.291983059809511 and parameters: {'n_layers_fe': 4, 'fe_neurons': 128, 'fe_dropout': 0.41082922723823634, 'n_units_l(Invariant)': 373, 'n_layers_mlp': 4, 'initialiser': 'xavier', 'lr': 0.00011434645935512873, 'weight_decay': 0.2988492487349938, 'criterion': 'MSELoss', 'batch_size': 128, 'epochs': 25}. Best is trial 10 with value: 7.291983059809511.[0m

Trial Id: 11 | Model params: 160116 | Timestamp: 2022-03-23 00:37:05.161288

epoch 0 -4.457466756275362 18.170346525279495
epoch 5 0.06966114115406352 7.502193144542658
epoch 10 0.10581458775757757 7.354979228814567
epoch 15 0.11337695022452499 7.32381168881053
epoch 20 0.10859540279744406 7.343533748463977
[32m[I 2022-03-23 01:07:16,860][0m Trial 11 finished with value: 7.313781716131111 and parameters: {'n_layers_fe': 4, 'fe_neurons': 128, 'fe_dropout': 0.4800541843773074, 'n_units_l(Invariant)': 377, 'n_layers_mlp': 4, 'initialiser': 'xavier', 'lr': 6.843080695210755e-05, 'weight_decay': 0.2995583292130072, 'criterion': 'MSELoss', 'batch_size': 128, 'epochs': 25}. Best is trial 10 with value: 7.291983059809511.[0m

Trial Id: 12 | Model params: 133726 | Timestamp: 2022-03-23 01:07:16.860491

epoch 0 -4.355963702304676 18.000578925164607
epoch 5 0.060330363603271375 7.539720681398666
epoch 10 0.10868176063942359 7.343178024986029
epoch 15 0.11126234140641511 7.332540186000385
epoch 20 0.11252548415157992 7.327327546379151
[32m[I 2022-03-23 01:32:52,591][0m Trial 12 finished with value: 7.296343154007134 and parameters: {'n_layers_fe': 4, 'fe_neurons': 128, 'fe_dropout': 0.4998844056121813, 'n_units_l(Invariant)': 174, 'n_layers_mlp': 4, 'initialiser': 'xavier', 'lr': 8.399318371877411e-05, 'weight_decay': 0.2949570949542063, 'criterion': 'MSELoss', 'batch_size': 128, 'epochs': 25}. Best is trial 10 with value: 7.291983059809511.[0m

Trial Id: 13 | Model params: 159986 | Timestamp: 2022-03-23 01:32:52.592024

[32m[I 2022-03-23 01:34:02,953][0m Trial 13 pruned. [0m
epoch 0 0.10905666510329004 7.341633526259799

Trial Id: 14 | Model params: 524212 | Timestamp: 2022-03-23 01:34:02.953809

[32m[I 2022-03-23 01:36:00,908][0m Trial 14 pruned. [0m
epoch 0 -0.06827404828984207 8.03912903276743

Trial Id: 15 | Model params: 58102 | Timestamp: 2022-03-23 01:36:00.908474

[32m[I 2022-03-23 01:36:48,400][0m Trial 15 pruned. [0m
epoch 0 0.07324557952902433 7.487726855980838

Trial Id: 16 | Model params: 131256 | Timestamp: 2022-03-23 01:36:48.400397

epoch 0 -3.009288475325155 15.574040980512049
epoch 5 0.0078120770017804375 7.747554296584182
epoch 10 0.09685997558225967 7.3917148536328146
epoch 15 0.10479226110978179 7.359182519990067
epoch 20 0.12019736412977333 7.295587821780162
[32m[I 2022-03-23 02:02:09,616][0m Trial 16 finished with value: 7.286271898995285 and parameters: {'n_layers_fe': 4, 'fe_neurons': 128, 'fe_dropout': 0.42934484925641747, 'n_units_l(Invariant)': 155, 'n_layers_mlp': 4, 'initialiser': 'xavier', 'lr': 4.0587590120116594e-05, 'weight_decay': 0.09290718118159626, 'criterion': 'MSELoss', 'batch_size': 128, 'epochs': 25}. Best is trial 16 with value: 7.286271898995285.[0m

Trial Id: 17 | Model params: 111366 | Timestamp: 2022-03-23 02:02:09.616411

epoch 0 -5.397505791663989 19.673109271523636
epoch 5 0.04447668916242131 7.603058001131515
epoch 10 0.06239940584537684 7.531415317051108
epoch 15 0.06585803940453616 7.517511490485081
epoch 20 0.06428140000563232 7.523852822107184
[32m[I 2022-03-23 02:22:36,369][0m Trial 17 finished with value: 7.4930217788040245 and parameters: {'n_layers_fe': 4, 'fe_neurons': 128, 'fe_dropout': 0.4273147587630534, 'n_units_l(Invariant)': 2, 'n_layers_mlp': 4, 'initialiser': 'xavier', 'lr': 4.1938522520863977e-05, 'weight_decay': 0.07655078803346108, 'criterion': 'MSELoss', 'batch_size': 128, 'epochs': 25}. Best is trial 16 with value: 7.286271898995285.[0m

Trial Id: 18 | Model params: 130606 | Timestamp: 2022-03-23 02:22:36.369374

epoch 0 -6.065724122310803 20.675022870306012
epoch 5 -2.4804850412483015 14.51067269147778
epoch 10 -1.076193707703203 11.207315436318925
epoch 15 -0.2278602627410844 8.618707313853767
epoch 20 -0.04992795056655397 7.969799743069946
epoch 25 0.027804418300113598 7.6691014323913675
epoch 30 0.05903032944186437 7.544934485369499
epoch 35 0.06562500875244914 7.51844908960852
epoch 40 0.08284131024893704 7.448861561858066
epoch 45 0.08625563809155945 7.434983609361112
[32m[I 2022-03-23 03:13:05,314][0m Trial 18 finished with value: 7.414987935484914 and parameters: {'n_layers_fe': 4, 'fe_neurons': 128, 'fe_dropout': 0.45643143198601793, 'n_units_l(Invariant)': 150, 'n_layers_mlp': 4, 'initialiser': 'xavier', 'lr': 1.2409094554388136e-05, 'weight_decay': 0.09173155065137206, 'criterion': 'MSELoss', 'batch_size': 128, 'epochs': 50}. Best is trial 16 with value: 7.286271898995285.[0m

Trial Id: 19 | Model params: 89652 | Timestamp: 2022-03-23 03:13:05.314555

[32m[I 2022-03-23 03:14:02,583][0m Trial 19 pruned. [0m
epoch 0 -1.2337136744630555 11.624690844597003

Study statistics: 
  Number of finished trials:  20
  Number of pruned trials:  12
  Number of complete trials:  8

Best trial:
  Value:  7.286271898995285
  Params: 
    n_layers_fe: 4
    fe_neurons: 128
    fe_dropout: 0.42934484925641747
    n_units_l(Invariant): 155
    n_layers_mlp: 4
    initialiser: xavier
    lr: 4.0587590120116594e-05
    weight_decay: 0.09290718118159626
    criterion: MSELoss
    batch_size: 128
    epochs: 25
Target: 72610, NaN: 0, Max: 175.0, Min: 6.0, Mean: 31.337543038149015
Prediction: 72610, NaN: 0, Max: 43.15549087524414, Min: 25.605287551879883, Mean: 31.538725174006935

 XXXXXX======== TRIAL north - elg ended

Test Set - R-squared:  0.12244281457735862
Test Set - RMSE:  7.286271898995285
Test Set - MAE:  5.7310065142987865



[32m[I 2022-03-23 03:14:37,689][0m A new study created in memory with name: DeepSet[0m
Starting Loading north
Finished Loading north
Finished north setup

++++++++ Session Characteristics +++++++

Area: north
Gal Type: elg
Training Set: 290439
Validation Set: 72610
Test Samples: 72610
Number of features: 5
Device: cuda:0
Number of Workers: 8
Number of Trials: 20

+++++++++++++++++++++++++++++++++++++++

Previous best Test-set performance: 0.14253656231312106

Trial Id: 0 | Model params: 518278 | Timestamp: 2022-03-23 03:14:37.690556

epoch 0 -0.907952908251088 10.74364095256073
epoch 1 -1.4255347849451319 12.113549378598409
epoch 2 -1.8693556326841327 13.175279882567379
epoch 3 -2.234713933381881 13.988965527019882
epoch 4 -2.47659395561998 14.502559158602669
epoch 5 -2.728720157619846 15.019226112998838
epoch 6 -2.903697025469661 15.367588123230956
epoch 7 -3.063665924005572 15.679299608073146
epoch 8 -3.208364873986506 15.956011984343819
epoch 9 -3.2322613480396694 16.001249587700038
epoch 10 -3.249578258560577 16.03395188586072
epoch 11 -3.253111045747639 16.040615226161588
epoch 12 -3.2572661883505543 16.04844887686946
epoch 13 -3.2796873156184114 16.090653402451924
epoch 14 -5.045295874272276 19.123898983628084
epoch 15 -8.737152966912904 24.27077569667518
epoch 16 -11.482749275606293 27.48038317660892
epoch 17 -11.751114690210187 27.774211373408317
epoch 18 -11.771778001171038 27.796706459635594
[32m[I 2022-03-23 03:52:55,741][0m Trial 0 finished with value: 27.84424526129305 and parameters: {'lr': 1.61648417184736e-05, 'weight_decay': 0.14692419978662447, 'criterion': 'PoissonNLLLoss', 'batch_size': 256, 'epochs': 20}. Best is trial 0 with value: 27.84424526129305.[0m
epoch 19 -11.815500750116135 27.84424526129305

Previous best Test-set performance: 0.14253656231312106

Trial Id: 1 | Model params: 518278 | Timestamp: 2022-03-23 03:52:55.741846

epoch 0 0.019916639333631525 7.700149698063408
epoch 1 0.03984818400889967 7.621450163861737
epoch 2 0.009538573753094082 7.740810638956602
epoch 3 0.03129559716132868 7.6553190797062305
[32m[I 2022-03-23 04:02:26,688][0m Trial 1 finished with value: 7.667921485408245 and parameters: {'lr': 0.004479357379873319, 'weight_decay': 0.2754336350866737, 'criterion': 'MSELoss', 'batch_size': 128, 'epochs': 5}. Best is trial 1 with value: 7.667921485408245.[0m
epoch 4 0.028103553995707298 7.667921485408245

Previous best Test-set performance: 0.14253656231312106

Trial Id: 2 | Model params: 518278 | Timestamp: 2022-03-23 04:02:26.688747

epoch 0 -12.860266091053532 28.956991878565553
epoch 1 -12.765581243975062 28.85791416435676
epoch 2 -12.768001294479886 28.86045072780922
epoch 3 -12.772327348841863 28.864984503997157
epoch 4 -12.655524385922327 28.742322061005343
epoch 5 -12.793248508901096 28.886900182513656
epoch 6 -12.834622510933956 28.930192078443557
epoch 7 -12.876966981939484 28.974432451706914
epoch 8 -12.865219826420082 28.962166110398215
[32m[I 2022-03-23 04:23:34,132][0m Trial 2 finished with value: 28.960354097567954 and parameters: {'lr': 0.0002625436409387345, 'weight_decay': 0.22774830753124278, 'criterion': 'PoissonNLLLoss', 'batch_size': 32, 'epochs': 10}. Best is trial 1 with value: 7.667921485408245.[0m
epoch 9 -12.863484930612485 28.960354097567954

Previous best Test-set performance: 0.14253656231312106

Trial Id: 3 | Model params: 518278 | Timestamp: 2022-03-23 04:23:34.132616

epoch 0 -13.02665946494996 29.13028858322121
epoch 1 -12.698171785468775 28.78716946821815
epoch 2 -12.837002712349753 28.932680643728734
epoch 3 -12.835576041945966 28.931189046738012
[32m[I 2022-03-23 04:34:07,913][0m Trial 3 finished with value: 28.936784667882666 and parameters: {'lr': 0.00035402952906910575, 'weight_decay': 0.16094786809422273, 'criterion': 'PoissonNLLLoss', 'batch_size': 32, 'epochs': 5}. Best is trial 1 with value: 7.667921485408245.[0m
epoch 4 -12.840928475165823 28.936784667882666

Previous best Test-set performance: 0.14253656231312106

Trial Id: 4 | Model params: 518278 | Timestamp: 2022-03-23 04:34:07.913453

epoch 0 0.12818634573728038 7.262388766512344
epoch 1 0.13490362344901796 7.234356506262424
epoch 2 0.13576711596766877 7.230745132734538
epoch 3 0.13666457032037727 7.226989808581564
epoch 4 0.13576240062219302 7.230764858560454
epoch 5 0.13315584956124438 7.241660686427809
epoch 6 0.1368762874440792 7.226103611131516
epoch 7 0.1388845324463065 7.217692164839083
epoch 8 0.13685787441510444 7.226180687999887
[32m[I 2022-03-23 04:53:02,242][0m Trial 4 finished with value: 7.2150559698134735 and parameters: {'lr': 0.00038604724804793466, 'weight_decay': 0.039063815822792, 'criterion': 'MSELoss', 'batch_size': 128, 'epochs': 10}. Best is trial 4 with value: 7.2150559698134735.[0m
epoch 9 0.13951344642587848 7.2150559698134735

Previous best Test-set performance: 0.14253656231312106

Trial Id: 5 | Model params: 518278 | Timestamp: 2022-03-23 04:53:02.242855

[32m[I 2022-03-23 04:55:07,298][0m Trial 5 pruned. [0m
epoch 0 0.01685492100372965 7.712167709429678

Previous best Test-set performance: 0.14253656231312106

Trial Id: 6 | Model params: 518278 | Timestamp: 2022-03-23 04:55:07.299090

epoch 0 -13.209945638646376 29.31999342470228
epoch 1 -13.209945638646376 29.31999342470228
epoch 2 -13.209945638646376 29.31999342470228
epoch 3 -13.209945638646376 29.31999342470228
[32m[I 2022-03-23 05:04:34,089][0m Trial 6 pruned. [0m
++++++++++++++++++++
        NaN         
++++++++++++++++++++

Previous best Test-set performance: 0.14253656231312106

Trial Id: 7 | Model params: 518278 | Timestamp: 2022-03-23 05:04:34.089664

[32m[I 2022-03-23 05:06:23,499][0m Trial 7 pruned. [0m
epoch 0 0.1386665011848608 7.218605853529319

Previous best Test-set performance: 0.14253656231312106

Trial Id: 8 | Model params: 518278 | Timestamp: 2022-03-23 05:06:23.500048

[32m[I 2022-03-23 05:08:12,837][0m Trial 8 pruned. [0m
epoch 0 0.1375907469398271 7.223112251323501

Previous best Test-set performance: 0.14253656231312106

Trial Id: 9 | Model params: 518278 | Timestamp: 2022-03-23 05:08:12.837517

epoch 0 -2.105859494115668 13.707509726663622
epoch 1 -2.985829160640784 15.528410397071912
epoch 2 -3.243230698582681 16.021972520008024
epoch 3 -3.292934726185223 16.11553778964082
epoch 4 -3.3190855128377272 16.164547868323783
epoch 5 -3.3346402924158136 16.193629256537324
epoch 6 -3.8280377908941787 17.09043003576825
epoch 7 -6.72556682277758 21.61886238307187
epoch 8 -9.92240716030834 25.705546493092246
[32m[I 2022-03-23 05:26:52,294][0m Trial 9 finished with value: 27.81246215548338 and parameters: {'lr': 3.800588324543661e-05, 'weight_decay': 0.2010192387899878, 'criterion': 'PoissonNLLLoss', 'batch_size': 256, 'epochs': 10}. Best is trial 4 with value: 7.2150559698134735.[0m
epoch 9 -11.78626067233871 27.81246215548338

Previous best Test-set performance: 0.14253656231312106

Trial Id: 10 | Model params: 518278 | Timestamp: 2022-03-23 05:26:52.295120

[32m[I 2022-03-23 05:28:46,504][0m Trial 10 pruned. [0m
epoch 0 0.0966962187117778 7.392384954168117

Previous best Test-set performance: 0.14253656231312106

Trial Id: 11 | Model params: 518278 | Timestamp: 2022-03-23 05:28:46.504526

[32m[I 2022-03-23 05:30:39,707][0m Trial 11 pruned. [0m
epoch 0 0.08629622532299874 7.434818481802381

Previous best Test-set performance: 0.14253656231312106

Trial Id: 12 | Model params: 518278 | Timestamp: 2022-03-23 05:30:39.707788

[32m[I 2022-03-23 05:32:31,077][0m Trial 12 pruned. [0m
epoch 0 0.060466610661019216 7.539174052052053

Previous best Test-set performance: 0.14253656231312106

Trial Id: 13 | Model params: 518278 | Timestamp: 2022-03-23 05:32:31.077857

[32m[I 2022-03-23 05:34:23,833][0m Trial 13 pruned. [0m
epoch 0 0.11992526046593688 7.296715917234545

Previous best Test-set performance: 0.14253656231312106

Trial Id: 14 | Model params: 518278 | Timestamp: 2022-03-23 05:34:23.833385

[32m[I 2022-03-23 05:36:12,742][0m Trial 14 pruned. [0m
epoch 0 0.0428340774168674 7.6095902905739825

Previous best Test-set performance: 0.14253656231312106

Trial Id: 15 | Model params: 518278 | Timestamp: 2022-03-23 05:36:12.742867

[32m[I 2022-03-23 05:38:01,016][0m Trial 15 pruned. [0m
epoch 0 0.07707127225256238 7.472256001195791

Previous best Test-set performance: 0.14253656231312106

Trial Id: 16 | Model params: 518278 | Timestamp: 2022-03-23 05:38:01.016892

[32m[I 2022-03-23 05:39:51,743][0m Trial 16 pruned. [0m
epoch 0 0.1288346145438345 7.259688157501202

Previous best Test-set performance: 0.14253656231312106

Trial Id: 17 | Model params: 518278 | Timestamp: 2022-03-23 05:39:51.744114

[32m[I 2022-03-23 05:41:46,164][0m Trial 17 pruned. [0m
epoch 0 0.0847950567015352 7.440923488741453

Previous best Test-set performance: 0.14253656231312106

Trial Id: 18 | Model params: 518278 | Timestamp: 2022-03-23 05:41:46.164230

[32m[I 2022-03-23 05:43:40,002][0m Trial 18 pruned. [0m
epoch 0 0.13963460129648353 7.214548018852328

Previous best Test-set performance: 0.14253656231312106

Trial Id: 19 | Model params: 518278 | Timestamp: 2022-03-23 05:43:40.003032

[32m[I 2022-03-23 05:45:33,967][0m Trial 19 pruned. [0m
epoch 0 0.11946392549987828 7.29862813503273

Study statistics: 
  Number of finished trials:  20
  Number of pruned trials:  14
  Number of complete trials:  6

Best trial:
  Value:  7.2150559698134735
  Params: 
    lr: 0.00038604724804793466
    weight_decay: 0.039063815822792
    criterion: MSELoss
    batch_size: 128
    epochs: 10
Target: 72610, NaN: 0, Max: 175.0, Min: 6.0, Mean: 31.337543038149015
Prediction: 72610, NaN: 0, Max: 46.51988983154297, Min: 22.31908416748047, Mean: 31.245500518447884

 XXXXXX======== TRIAL north - elg ended

Test Set - R-squared:  0.13951344642587848
Test Set - RMSE:  7.2150559698134735
Test Set - MAE:  5.65945784686075



[32m[I 2022-03-23 05:48:32,804][0m A new study created in memory with name: DeepSet[0m
Starting Loading south
Finished Loading south
Finished south setup

++++++++ Session Characteristics +++++++

Area: south
Gal Type: elg
Training Set: 530265
Validation Set: 132567
Test Samples: 132567
Number of features: 5
Device: cuda:0
Number of Workers: 8
Number of Trials: 20

+++++++++++++++++++++++++++++++++++++++

Trial Id: 0 | Model params: 60398 | Timestamp: 2022-03-23 05:48:32.805175

epoch 0 0.06501157162422844 7.661088473991972
epoch 5 0.10508993202789829 7.495093532339584
epoch 10 0.10500019146192374 7.49546932265545
epoch 15 0.11023813989530873 7.473503679036456
epoch 20 0.10942710880408513 7.476909007763494
epoch 25 0.10291946830128107 7.5041771136956195
epoch 30 0.09803777610377884 7.52456735718565
epoch 35 0.10697460676368631 7.487197063751351
epoch 40 0.10522491284870106 7.494528262115818
epoch 45 0.10969344307530349 7.475790903879431
epoch 50 0.10850544940351703 7.480776957000075
epoch 55 0.10739272009994882 7.485444110544894
epoch 60 0.10335811531421812 7.502342224160756
epoch 65 0.10798527761455567 7.482959091299356
epoch 70 0.10602450461631552 7.491178871549147
