[32m[I 2022-03-24 03:12:36,274][0m Trial 18 pruned. [0m
epoch 0 0.04525889472101641 7.047220574032985

Previous best Test-set performance: 0.04756083163409808

Trial Id: 19 | Model params: 89650 | Timestamp: 2022-03-24 03:12:36.274629

[32m[I 2022-03-24 03:13:55,606][0m Trial 19 pruned. [0m
epoch 0 0.04140394921018742 7.061433476243462

Study statistics: 
  Number of finished trials:  20
  Number of pruned trials:  12
  Number of complete trials:  8

Best trial:
  Value:  7.043196113640819
  Params: 
    lr: 0.00011107404195596915
    weight_decay: 0.03822498335946477
    criterion: MSELoss
    batch_size: 256
    epochs: 10
Target: 67698, NaN: 0, Max: 114.0, Min: 8.0, Mean: 31.138955360571952
Prediction: 67698, NaN: 0, Max: 34.79501724243164, Min: 29.02196502685547, Mean: 31.026355273825946

 XXXXXX======== TRIAL des - elg ended

Test Set - R-squared:  0.046349032486759145
Test Set - RMSE:  7.043196113640819
Test Set - MAE:  5.589584599506514



