[32m[I 2022-03-23 08:40:29,741][0m Trial 0 finished with value: 7.512270195873373 and parameters: {'n_layers_fe': 2, 'fe_neurons': 128, 'fe_dropout': 0.02588778646859008, 'n_units_l(Invariant)': 118, 'n_layers_mlp': 2, 'initialiser': 'xavier', 'lr': 0.0008931659606229025, 'weight_decay': 0.02411503610889122, 'criterion': 'MSELoss', 'batch_size': 32, 'epochs': 75}. Best is trial 0 with value: 7.512270195873373.[0m

Trial Id: 1 | Model params: 90432 | Timestamp: 2022-03-23 08:40:29.741287

epoch 0 -14.986244544535605 31.678206529251085
epoch 5 -17.03689499577229 33.64869675916402
epoch 10 -16.783673334150553 33.41166327888931
epoch 15 -18.828369157118175 35.28018532097668
epoch 20 -19.32574578196121 35.71993044611858
[32m[I 2022-03-23 09:03:33,905][0m Trial 1 finished with value: 37.78820280555445 and parameters: {'n_layers_fe': 2, 'fe_neurons': 128, 'fe_dropout': 0.29286009965575804, 'n_units_l(Invariant)': 95, 'n_layers_mlp': 4, 'initialiser': 'normal', 'lr': 0.00011772018293806151, 'weight_decay': 0.12803737403823734, 'criterion': 'PoissonNLLLoss', 'batch_size': 128, 'epochs': 25}. Best is trial 0 with value: 7.512270195873373.[0m

Trial Id: 2 | Model params: 136066 | Timestamp: 2022-03-23 09:03:33.905240

epoch 0 -13.811626950186483 30.49219879099905
epoch 5 -13.766916566828545 30.44614212599859
epoch 10 -13.76898468459293 30.448274053901105
epoch 15 -13.772847552195604 30.452255707485097
epoch 20 -13.75692832302152 30.43584360057682
epoch 25 -13.758215023893515 30.43717046793097
epoch 30 -13.777118867018617 30.456657762340683
epoch 35 -13.772067162816684 30.451451362530968
epoch 40 -13.758623101900337 30.43759127268201
epoch 45 -13.784877814995712 30.464652575594226
epoch 50 -13.755289451481067 30.43415348520273
epoch 55 -13.763944519741592 30.443078117306484
epoch 60 -13.761761575803217 30.440827431881473
epoch 65 -13.771224706599718 30.45058302162755
epoch 70 -13.765608022717862 30.444793130681212
[32m[I 2022-03-23 10:56:35,662][0m Trial 2 finished with value: 30.4705062806354 and parameters: {'n_layers_fe': 4, 'fe_neurons': 128, 'fe_dropout': 0.406147334477743, 'n_units_l(Invariant)': 192, 'n_layers_mlp': 4, 'initialiser': 'kaiming_he', 'lr': 0.00018611295175836542, 'weight_decay': 0.28712610155733453, 'criterion': 'PoissonNLLLoss', 'batch_size': 256, 'epochs': 75}. Best is trial 0 with value: 7.512270195873373.[0m

Trial Id: 3 | Model params: 356250 | Timestamp: 2022-03-23 10:56:35.662758

epoch 0 0.03539916476286331 7.781461564288266
epoch 5 0.08584269293526126 7.575264952668472
epoch 10 0.08801504698275553 7.566258873863556
epoch 15 0.08556056790972011 7.576433792503242
epoch 20 0.08957772780990325 7.559773724674463
[32m[I 2022-03-23 12:00:43,461][0m Trial 3 finished with value: 7.5698439281125935 and parameters: {'n_layers_fe': 4, 'fe_neurons': 256, 'fe_dropout': 0.4129554766508478, 'n_units_l(Invariant)': 204, 'n_layers_mlp': 2, 'initialiser': 'xavier', 'lr': 4.768928479987555e-05, 'weight_decay': 0.26106518285562497, 'criterion': 'MSELoss', 'batch_size': 128, 'epochs': 25}. Best is trial 0 with value: 7.512270195873373.[0m

Trial Id: 4 | Model params: 118516 | Timestamp: 2022-03-23 12:00:43.461580

epoch 0 0.06977261320742878 7.6415581186191535
epoch 5 0.0881863149929698 7.565548380262168
epoch 10 0.0895523596897917 7.55987904718129
epoch 15 0.08789818457497178 7.566743631261658
epoch 20 0.09230545211556962 7.548440276437918
[32m[I 2022-03-23 12:37:10,835][0m Trial 4 finished with value: 7.546535371804485 and parameters: {'n_layers_fe': 4, 'fe_neurons': 128, 'fe_dropout': 0.3739407059065903, 'n_units_l(Invariant)': 57, 'n_layers_mlp': 4, 'initialiser': 'kaiming_he', 'lr': 0.0005132040080123359, 'weight_decay': 0.12343771142423682, 'criterion': 'MSELoss', 'batch_size': 128, 'epochs': 25}. Best is trial 0 with value: 7.512270195873373.[0m

Trial Id: 5 | Model params: 38096 | Timestamp: 2022-03-23 12:37:10.835538

epoch 0 -14.27180288841078 30.962250133587563
epoch 5 -13.790719366856278 30.470670321408893
epoch 10 -13.772587531639411 30.45198770745053
epoch 15 -13.761885673844676 30.44095538541554
epoch 20 -13.755785220264626 30.434664765464778
epoch 25 -13.76820902667972 30.44747448117084
epoch 30 -13.756356484459385 30.43525389256742
epoch 35 -13.762883694660804 30.441984393305578
epoch 40 -13.758610536865097 30.437578315867352
epoch 45 -13.762162304668042 30.44124060870231
epoch 50 -13.767254751717688 30.446490755524692
epoch 55 -13.760029356949785 30.43904134009571
epoch 60 -13.766533086155544 30.445746796925626
epoch 65 -13.75636200915594 30.4352595899605
epoch 70 -13.72641661181596 30.404362449136876
[32m[I 2022-03-23 13:46:55,912][0m Trial 5 finished with value: 30.459920007179292 and parameters: {'n_layers_fe': 2, 'fe_neurons': 64, 'fe_dropout': 0.10771477203716895, 'n_units_l(Invariant)': 391, 'n_layers_mlp': 2, 'initialiser': 'xavier', 'lr': 0.0007702461586718297, 'weight_decay': 0.0458252580301794, 'criterion': 'PoissonNLLLoss', 'batch_size': 256, 'epochs': 75}. Best is trial 0 with value: 7.512270195873373.[0m

Trial Id: 6 | Model params: 182612 | Timestamp: 2022-03-23 13:46:55.912501

[32m[I 2022-03-23 13:48:06,884][0m Trial 6 pruned. [0m
++++++++++++++++++++
        NaN         
++++++++++++++++++++

Trial Id: 7 | Model params: 53218 | Timestamp: 2022-03-23 13:48:06.884364

[32m[I 2022-03-23 13:49:13,282][0m Trial 7 pruned. [0m
epoch 0 0.07242932778485245 7.630638232245799

Trial Id: 8 | Model params: 522406 | Timestamp: 2022-03-23 13:49:13.282704

[32m[I 2022-03-23 13:52:05,095][0m Trial 8 pruned. [0m
epoch 0 -0.6695683364864571 10.237394981862268

Trial Id: 9 | Model params: 124102 | Timestamp: 2022-03-23 13:52:05.095165

[32m[I 2022-03-23 13:54:45,115][0m Trial 9 pruned. [0m
epoch 0 0.022127736322408498 7.834809185553854

Trial Id: 10 | Model params: 64168 | Timestamp: 2022-03-23 13:54:45.116044

[32m[I 2022-03-23 13:57:03,144][0m Trial 10 pruned. [0m
epoch 0 0.08712234251663942 7.569961117505639

Trial Id: 11 | Model params: 79382 | Timestamp: 2022-03-23 13:57:03.144248

[32m[I 2022-03-23 13:57:48,274][0m Trial 11 pruned. [0m
epoch 0 0.06218589350783754 7.6726562315929625

Trial Id: 12 | Model params: 56108 | Timestamp: 2022-03-23 13:57:48.274676

[32m[I 2022-03-23 14:00:06,911][0m Trial 12 pruned. [0m
epoch 0 0.09009520329630694 7.557624967032807

Trial Id: 13 | Model params: 145296 | Timestamp: 2022-03-23 14:00:06.911992

[32m[I 2022-03-23 14:01:52,007][0m Trial 13 pruned. [0m
epoch 0 0.07998121832621852 7.5995120240335465

Trial Id: 14 | Model params: 112146 | Timestamp: 2022-03-23 14:01:52.007504

[32m[I 2022-03-23 14:04:45,461][0m Trial 14 pruned. [0m
epoch 0 0.04385617450162671 7.747275002287385

Trial Id: 15 | Model params: 44828 | Timestamp: 2022-03-23 14:04:45.461676

[32m[I 2022-03-23 14:07:06,822][0m Trial 15 pruned. [0m
epoch 0 0.0809762500093758 7.595401346582426

Trial Id: 16 | Model params: 60268 | Timestamp: 2022-03-23 14:07:06.823056

[32m[I 2022-03-23 14:08:03,742][0m Trial 16 pruned. [0m
epoch 0 0.030532201148802396 7.801067829107205

Trial Id: 17 | Model params: 117476 | Timestamp: 2022-03-23 14:08:03.742892

[32m[I 2022-03-23 14:09:30,429][0m Trial 17 pruned. [0m
epoch 0 0.06794462459445372 7.649062641545277

Trial Id: 18 | Model params: 136326 | Timestamp: 2022-03-23 14:09:30.429365

[32m[I 2022-03-23 14:12:25,880][0m Trial 18 pruned. [0m
epoch 0 -0.009189167333119475 7.959277559776053

Trial Id: 19 | Model params: 79768 | Timestamp: 2022-03-23 14:12:25.880299

[32m[I 2022-03-23 14:14:47,436][0m Trial 19 pruned. [0m
epoch 0 0.052448492755797105 7.712386277172078

Study statistics: 
  Number of finished trials:  20
  Number of pruned trials:  14
  Number of complete trials:  6

Best trial:
  Value:  7.512270195873373
  Params: 
    n_layers_fe: 2
    fe_neurons: 128
    fe_dropout: 0.02588778646859008
    n_units_l(Invariant): 118
    n_layers_mlp: 2
    initialiser: xavier
    lr: 0.0008931659606229025
    weight_decay: 0.02411503610889122
    criterion: MSELoss
    batch_size: 32
    epochs: 75
Target: 132567, NaN: 0, Max: 365.0, Min: 0.0, Mean: 32.88284414673335
Prediction: 132567, NaN: 0, Max: 40.28274917602539, Min: 26.806896209716797, Mean: 32.10441756746113

 XXXXXX======== TRIAL south - elg ended

Test Set - R-squared:  0.10098346351263787
Test Set - RMSE:  7.512270195873373
Test Set - MAE:  5.843052823191749



[32m[I 2022-03-23 14:16:11,695][0m A new study created in memory with name: DeepSet[0m
Starting Loading south
Finished Loading south
Finished south setup

++++++++ Session Characteristics +++++++

Area: south
Gal Type: elg
Training Set: 530265
Validation Set: 132567
Test Samples: 132567
Number of features: 5
Device: cuda:0
Number of Workers: 8
Number of Trials: 20

+++++++++++++++++++++++++++++++++++++++

Previous best Test-set performance: 0.12684238675681014

Trial Id: 0 | Model params: 453262 | Timestamp: 2022-03-23 14:16:11.696726

epoch 0 -3.428793423588763 16.673626607643563
epoch 1 -5.333076805898553 19.938603514086758
epoch 2 -11.300771556722971 27.787759814863303
epoch 3 -20.77892283984643 36.97477653703907
epoch 4 -34.701847150274055 47.34048500546778
epoch 5 -62.00240493209884 62.88773072119863
epoch 6 -80.70213554095943 71.61501116805006
epoch 7 -98.12213917292272 78.88105179945552
epoch 8 -77.33665588751867 70.1245155253897
epoch 9 -54.03751181403938 58.77826406922489
epoch 10 -18.969392870804203 35.40542324653291
epoch 11 -15.846916000214613 32.519777466607046
epoch 12 -14.257944969248092 30.94819908330103
epoch 13 -13.881648116724477 30.56418892051572
epoch 14 -13.786843237861298 30.46667741258473
epoch 15 -13.883495695544086 30.56608615646207
epoch 16 -13.759101921411661 30.438085017737766
epoch 17 -13.768429383934778 30.447701634539968
epoch 18 -13.763012059471963 30.442116741130175
[32m[I 2022-03-23 15:03:49,374][0m Trial 0 finished with value: 30.447312946955538 and parameters: {'lr': 2.9818271473684107e-05, 'weight_decay': 0.06406726631095877, 'criterion': 'PoissonNLLLoss', 'batch_size': 128, 'epochs': 20}. Best is trial 0 with value: 30.447312946955538.[0m
epoch 19 -13.768052326344533 30.447312946955538

Previous best Test-set performance: 0.12684238675681014

Trial Id: 1 | Model params: 453262 | Timestamp: 2022-03-23 15:03:49.374265

epoch 0 -136.12647985008013 92.77864458164295
epoch 1 -668.3854465026623 204.98660975277284
epoch 2 -1865.9687719339809 342.33861293544186
epoch 3 -2801.0954583463576 419.4003831916438
epoch 4 -1020.4944097422167 253.2242869850463
epoch 5 -367.9236630923212 152.17931184907673
epoch 6 -208.62440003234678 114.71184796268027
epoch 7 -3677.9085206818986 480.5591538458387
epoch 8 -72.15294961814095 67.7646626872833
epoch 9 -60.101201160295076 61.93159053849879
epoch 10 -43.10875955562362 52.61987136798738
epoch 11 -68.64701080723304 66.1208762967156
epoch 12 -83.38866363083774 72.78290984116975
epoch 13 -133.168181162002 91.77240773900928
epoch 14 -55.463874870114765 59.53504676602121
epoch 15 -43.66360537269446 52.949790806227
epoch 16 -38.830497808039304 50.00290394923633
epoch 17 -45.697042396936546 54.14171984786917
epoch 18 -36.98428209929318 48.830291981411776
[32m[I 2022-03-23 15:50:21,334][0m Trial 1 finished with value: 44.245281353465444 and parameters: {'lr': 0.00047438695262747265, 'weight_decay': 0.011018400009621565, 'criterion': 'PoissonNLLLoss', 'batch_size': 256, 'epochs': 20}. Best is trial 0 with value: 30.447312946955538.[0m
epoch 19 -30.18596610691604 44.245281353465444

Previous best Test-set performance: 0.12684238675681014

Trial Id: 2 | Model params: 453262 | Timestamp: 2022-03-23 15:50:21.334410

epoch 0 0.11776918541405179 7.441808175619993
epoch 1 0.11433332973691379 7.456285187843584
epoch 2 0.11056596231761484 7.47212678938908
epoch 3 0.10695883197977663 7.487263191990865
epoch 4 0.11197572427411873 7.466202742726169
epoch 5 0.1092595911774571 7.477612181624744
epoch 6 0.1112737239370779 7.469153248450862
epoch 7 0.11149420083456463 7.468226710142099
epoch 8 0.11309171793986672 7.46150982235572
[32m[I 2022-03-23 16:13:32,318][0m Trial 2 finished with value: 7.465325986203802 and parameters: {'lr': 7.926044919367361e-05, 'weight_decay': 0.12113088879809447, 'criterion': 'MSELoss', 'batch_size': 256, 'epochs': 10}. Best is trial 2 with value: 7.465325986203802.[0m
epoch 9 0.1121842734893449 7.465325986203802

Previous best Test-set performance: 0.12684238675681014

Trial Id: 3 | Model params: 453262 | Timestamp: 2022-03-23 16:13:32.318798

epoch 0 -13.7260305224733 30.403963883838788
epoch 1 -27.997833770187643 42.664841620519496
epoch 2 -65.71503445253941 64.71414492109794
epoch 3 -295.1547575503767 136.347354746597
[32m[I 2022-03-23 16:25:24,786][0m Trial 3 finished with value: 117.86191484389522 and parameters: {'lr': 0.00015659033785282836, 'weight_decay': 0.09763560399645212, 'criterion': 'PoissonNLLLoss', 'batch_size': 128, 'epochs': 5}. Best is trial 2 with value: 7.465325986203802.[0m
epoch 4 -220.29533836749337 117.86191484389522

Previous best Test-set performance: 0.12684238675681014

Trial Id: 4 | Model params: 453262 | Timestamp: 2022-03-23 16:25:24.786806

epoch 0 -18.655844929814947 35.12636569875176
epoch 1 -52.3444077104865 57.86711202426037
epoch 2 -90.32430850629935 75.71476104626349
epoch 3 -187.245314650534 108.70498178948945
[32m[I 2022-03-23 16:37:17,614][0m Trial 4 finished with value: 105.11745714859175 and parameters: {'lr': 0.0001378107667906212, 'weight_decay': 0.22191147158187796, 'criterion': 'PoissonNLLLoss', 'batch_size': 128, 'epochs': 5}. Best is trial 2 with value: 7.465325986203802.[0m
epoch 4 -175.0252514501843 105.11745714859175

Previous best Test-set performance: 0.12684238675681014

Trial Id: 5 | Model params: 453262 | Timestamp: 2022-03-23 16:37:17.615175

epoch 0 -37.568577656302296 49.20442617250856
epoch 1 -149.9790519376495 97.35218576000437
epoch 2 -1613.1277647208412 318.3144205002676
epoch 3 -1508.9477914268066 307.87067610058654
epoch 4 -198.7988890715111 111.99119901758603
epoch 5 -92.0335613970116 76.42002633705118
epoch 6 -57.2235671461886 60.45563185850229
epoch 7 -49.20909851265997 56.140796736050866
epoch 8 -35.252884778602045 47.70442276928379
epoch 9 -19.073460269263155 35.49755830577563
epoch 10 -16.337473875665783 32.98984459051885
epoch 11 -15.279945947447295 31.96788020771521
epoch 12 -14.729309780918054 31.422605475121927
epoch 13 -14.531515870175115 31.224412968447883
epoch 14 -14.296175120013418 30.98694657260716
epoch 15 -14.176053525914211 30.865035771998365
epoch 16 -14.083171056490913 30.77043869232163
epoch 17 -13.783860897292856 30.463604863951605
epoch 18 -13.775956971185572 30.45546036521273
[32m[I 2022-03-23 17:24:47,863][0m Trial 5 finished with value: 30.447663549305776 and parameters: {'lr': 0.0001950224174047714, 'weight_decay': 0.2893202901331292, 'criterion': 'PoissonNLLLoss', 'batch_size': 128, 'epochs': 20}. Best is trial 2 with value: 7.465325986203802.[0m
epoch 19 -13.768392438043314 30.447663549305776

Previous best Test-set performance: 0.12684238675681014

Trial Id: 6 | Model params: 453262 | Timestamp: 2022-03-23 17:24:47.864369

epoch 0 -922.2382901490935 240.73778694438144
epoch 1 -186.71069274160615 108.55050945510816
epoch 2 -280.17608060352586 132.85458473660742
epoch 3 -124.2630019072055 88.67450390549745
epoch 4 -100.22938892469756 79.71511325070978
epoch 5 -52.71578147506214 58.0681926518591
epoch 6 -24.646971425833506 40.12410920874157
epoch 7 -16.371726169608646 33.02241624168615
epoch 8 -19.26260912079477 35.66440994462238
[32m[I 2022-03-23 17:48:02,809][0m Trial 6 finished with value: 32.30905356806647 and parameters: {'lr': 0.0014815686223353089, 'weight_decay': 0.1867358617198437, 'criterion': 'PoissonNLLLoss', 'batch_size': 256, 'epochs': 10}. Best is trial 2 with value: 7.465325986203802.[0m
epoch 9 -15.629291762216862 32.30905356806647

Previous best Test-set performance: 0.12684238675681014

Trial Id: 7 | Model params: 453262 | Timestamp: 2022-03-23 17:48:02.809571

[32m[I 2022-03-23 17:50:20,924][0m Trial 7 pruned. [0m
epoch 0 0.06474190293364546 7.662193197157864

Previous best Test-set performance: 0.12684238675681014

Trial Id: 8 | Model params: 453262 | Timestamp: 2022-03-23 17:50:20.924951

[32m[I 2022-03-23 17:52:34,489][0m Trial 8 pruned. [0m
epoch 0 0.07351638961821971 7.626165577183477

Previous best Test-set performance: 0.12684238675681014

Trial Id: 9 | Model params: 453262 | Timestamp: 2022-03-23 17:52:34.490137

[32m[I 2022-03-23 17:55:34,421][0m Trial 9 pruned. [0m
epoch 0 0.10432575107843023 7.498292951862267

Previous best Test-set performance: 0.12684238675681014

Trial Id: 10 | Model params: 453262 | Timestamp: 2022-03-23 17:55:34.421495

[32m[I 2022-03-23 17:58:34,878][0m Trial 10 pruned. [0m
epoch 0 0.1243293961213986 7.414088148652745

Previous best Test-set performance: 0.12684238675681014

Trial Id: 11 | Model params: 453262 | Timestamp: 2022-03-23 17:58:34.879104

[32m[I 2022-03-23 18:00:58,792][0m Trial 11 pruned. [0m
epoch 0 0.12657348464626517 7.404581980896033

Previous best Test-set performance: 0.12684238675681014

Trial Id: 12 | Model params: 453262 | Timestamp: 2022-03-23 18:00:58.793062

[32m[I 2022-03-23 18:03:13,428][0m Trial 12 pruned. [0m
epoch 0 0.12284541490373824 7.420367741734463

Previous best Test-set performance: 0.12684238675681014

Trial Id: 13 | Model params: 453262 | Timestamp: 2022-03-23 18:03:13.428760

[32m[I 2022-03-23 18:05:34,548][0m Trial 13 pruned. [0m
epoch 0 -1.0290645744878746 11.285876515087361

Previous best Test-set performance: 0.12684238675681014

Trial Id: 14 | Model params: 453262 | Timestamp: 2022-03-23 18:05:34.549033

[32m[I 2022-03-23 18:07:51,902][0m Trial 14 pruned. [0m
epoch 0 0.12277795486025334 7.420653078387096

Previous best Test-set performance: 0.12684238675681014

Trial Id: 15 | Model params: 453262 | Timestamp: 2022-03-23 18:07:51.902683

epoch 0 -4913.339661399741 555.4179930657732
epoch 1 -14.758222949995645 31.45147228471923
epoch 2 -13.813329576052428 30.49395130997102
epoch 3 -13.764172045850344 30.443312694468673
[32m[I 2022-03-23 18:23:00,033][0m Trial 15 finished with value: 30.423981630153527 and parameters: {'lr': 0.0006595650357616755, 'weight_decay': 0.13966948581663313, 'criterion': 'PoissonNLLLoss', 'batch_size': 32, 'epochs': 5}. Best is trial 2 with value: 7.465325986203802.[0m
epoch 4 -13.745427926409235 30.423981630153527

Previous best Test-set performance: 0.12684238675681014

Trial Id: 16 | Model params: 453262 | Timestamp: 2022-03-23 18:23:00.033941

epoch 0 -250.64673641247524 125.68487311688807
epoch 1 -13.474354133845733 30.14303354264468
epoch 2 -13.710730379101268 30.388165128742855
epoch 3 -13.81788375194714 30.49863844479373
[32m[I 2022-03-23 18:38:13,140][0m Trial 16 finished with value: 30.458468138644083 and parameters: {'lr': 0.0006517743091151153, 'weight_decay': 0.14601658435933715, 'criterion': 'PoissonNLLLoss', 'batch_size': 32, 'epochs': 5}. Best is trial 2 with value: 7.465325986203802.[0m
epoch 4 -13.778875654721732 30.458468138644083

Previous best Test-set performance: 0.12684238675681014

Trial Id: 17 | Model params: 453262 | Timestamp: 2022-03-23 18:38:13.141179

[32m[I 2022-03-23 18:41:14,141][0m Trial 17 pruned. [0m
epoch 0 0.024484913472931247 7.825360519973683

Previous best Test-set performance: 0.12684238675681014

Trial Id: 18 | Model params: 453262 | Timestamp: 2022-03-23 18:41:14.141455

epoch 0 -1162.2357401651207 270.2223263324496
epoch 1 -18.487891144663887 34.97597117593578
epoch 2 -13.94580476394941 30.63000108719932
epoch 3 -13.759106418746468 30.438089655223486
[32m[I 2022-03-23 18:56:35,354][0m Trial 18 finished with value: 30.43240030272489 and parameters: {'lr': 0.0009036356330633397, 'weight_decay': 0.19346749139977976, 'criterion': 'PoissonNLLLoss', 'batch_size': 32, 'epochs': 5}. Best is trial 2 with value: 7.465325986203802.[0m
epoch 4 -13.753589521181317 30.43240030272489

Previous best Test-set performance: 0.12684238675681014

Trial Id: 19 | Model params: 453262 | Timestamp: 2022-03-23 18:56:35.354744

