[32m[I 2022-03-04 10:50:12,334][0m Trial 3 finished with value: 8.047953518670361 and parameters: {'lr': 0.00045224443443638756, 'weight_decay': 0.231271929301379, 'criterion': 'PoissonNLLLoss', 'batch_size': 32, 'epochs': 10}. Best is trial 0 with value: 4.214966550070135.[0m
epoch 9 -2.150485645592377 8.047953518670361

Previous best Test-set performance: 0.1425664535055814

Trial Id: 4 | Model params: 407850 | Timestamp: 2022-03-04 10:50:12.334821

epoch 0 -2.1076259938470323 7.993023311113764
epoch 1 -2.120108400027795 8.009060018191468
epoch 2 -2.1343713083836775 8.027344998168594
epoch 3 -2.134655723591971 8.027709193566155
epoch 4 -2.135488457945183 8.02877541995596
epoch 5 -2.140356537684298 8.035005639067842
epoch 6 -2.148213825750947 8.045051299806751
epoch 7 -2.129320891298312 8.020875154517428
epoch 8 -2.1233154322576033 8.01317505419098
epoch 9 -2.1220549816402117 8.011557985584908
epoch 10 -2.13387915133549 8.026714749048878
epoch 11 -2.126078521160481 8.016718759725173
epoch 12 -2.1252919460040838 8.01571012406897
epoch 13 -2.1229284968392768 8.012678678249348
epoch 14 -2.1276634596338306 8.018750761770427
epoch 15 -2.127821771193448 8.01895369998487
epoch 16 -2.1377565304512305 8.031678724046298
epoch 17 -2.121881305553025 8.011335145916386
epoch 18 -2.1284369718192364 8.019742271575952
[32m[I 2022-03-04 11:28:36,326][0m Trial 4 finished with value: 8.036220912675471 and parameters: {'lr': 0.00022122652470737178, 'weight_decay': 0.11294491046850219, 'criterion': 'PoissonNLLLoss', 'batch_size': 256, 'epochs': 20}. Best is trial 0 with value: 4.214966550070135.[0m
epoch 19 -2.141306550963674 8.036220912675471

Previous best Test-set performance: 0.1425664535055814

Trial Id: 5 | Model params: 407850 | Timestamp: 2022-03-04 11:28:36.327069

[32m[I 2022-03-04 11:30:32,821][0m Trial 5 pruned. [0m
epoch 0 0.1429641774610736 4.197553057215564

Previous best Test-set performance: 0.1425664535055814

Trial Id: 6 | Model params: 407850 | Timestamp: 2022-03-04 11:30:32.821373

[32m[I 2022-03-04 11:32:44,026][0m Trial 6 pruned. [0m
epoch 0 0.11965079089495845 4.254261642326853

Previous best Test-set performance: 0.1425664535055814

Trial Id: 7 | Model params: 407850 | Timestamp: 2022-03-04 11:32:44.026572

[32m[I 2022-03-04 11:36:23,857][0m Trial 7 pruned. [0m
epoch 0 0.13535550970972543 4.216144587255557

Previous best Test-set performance: 0.1425664535055814

Trial Id: 8 | Model params: 407850 | Timestamp: 2022-03-04 11:36:23.857541

[32m[I 2022-03-04 11:40:31,775][0m Trial 8 pruned. [0m
epoch 0 -0.0009948844770748533 4.536413517327623

Previous best Test-set performance: 0.1425664535055814

Trial Id: 9 | Model params: 407850 | Timestamp: 2022-03-04 11:40:31.775861

epoch 0 -2.119344795680442 8.008079903641471
[32m[I 2022-03-04 11:48:54,923][0m Trial 9 pruned. [0m
epoch 1 -2.1086220339055814 7.99430414954002

Study statistics: 
  Number of finished trials:  10
  Number of pruned trials:  5
  Number of complete trials:  5

Best trial:
  Value:  4.214966550070135
  Params: 
    lr: 0.00027745685699679317
    weight_decay: 0.09837028494372427
    criterion: MSELoss
    batch_size: 128
    epochs: 5
Target: 132567, NaN: 0, Max: 83.0, Min: 0.0, Mean: 8.78098621828962
Prediction: 132567, NaN: 0, Max: 19.11618995666504, Min: 6.153881072998047, Mean: 8.413857064443562

 XXXXXX======== TRIAL south - rlbg ended

Test Set - R-squared:  0.13583862457400797
Test Set - RMSE:  4.214966550070135
Test Set - MAE:  3.22586737397964



[32m[I 2022-03-04 11:51:47,254][0m A new study created in memory with name: DeepSet[0m
Starting Loading des
Finished Loading des
Finished des setup

++++++++ Session Characteristics +++++++

Area: des
Gal Type: lrg
Training Set: 270781
Validation Set: 67698
Test Samples: 67698
Number of features: 5
Device: cuda:0
Number of Workers: 8
Number of Trials: 10

+++++++++++++++++++++++++++++++++++++++

Previous best Test-set performance: 0.022507213205469112

Trial Id: 0 | Model params: 525502 | Timestamp: 2022-03-04 11:51:47.255347

epoch 0 -2.0538136769568895 7.357152316725843
epoch 1 -1.997756842756706 7.289314375679671
epoch 2 -2.061099125614668 7.365923026221132
epoch 3 -2.0758547488219308 7.3836549119027515
[32m[I 2022-03-04 12:12:48,384][0m Trial 0 finished with value: 7.414175981735654 and parameters: {'lr': 0.002416802751875733, 'weight_decay': 0.02193763852408054, 'criterion': 'PoissonNLLLoss', 'batch_size': 256, 'epochs': 5}. Best is trial 0 with value: 7.414175981735654.[0m
epoch 4 -2.1013360061393485 7.414175981735654

Previous best Test-set performance: 0.022507213205469112

Trial Id: 1 | Model params: 525502 | Timestamp: 2022-03-04 12:12:48.385051

epoch 0 -2.0971496403021903 7.409170246394953
epoch 1 -2.096188964502327 7.408021066759346
epoch 2 -2.0358024219497053 7.335424155540663
epoch 3 -2.037852027832809 7.337899974058622
epoch 4 -2.0501673956740447 7.352758751481537
epoch 5 -2.0815420138440466 7.390477959878487
