[32m[I 2022-03-03 19:41:10,302][0m Trial 3 pruned. [0m
++++++++++++++++++++
        NaN         
++++++++++++++++++++

Previous best Test-set performance: 0.2756196891324698

Trial Id: 4 | Model params: 222860 | Timestamp: 2022-03-03 19:41:10.302988

epoch 0 0.28159201212846596 8.294298414642407
epoch 1 0.2782857471076863 8.313362560504148
epoch 2 0.276701387220631 8.32248260860918
epoch 3 0.27620231565400144 8.32535334424493
[32m[I 2022-03-03 19:45:52,485][0m Trial 4 finished with value: 8.328478008908755 and parameters: {'lr': 6.589482469029883e-05, 'weight_decay': 0.08288919036684635, 'criterion': 'MSELoss', 'batch_size': 128, 'epochs': 5}. Best is trial 4 with value: 8.328478008908755.[0m
epoch 4 0.2756589034118746 8.328478008908755

Previous best Test-set performance: 0.2756196891324698

Trial Id: 5 | Model params: 222860 | Timestamp: 2022-03-03 19:45:52.485329

epoch 0 0.21637793509309822 8.662582989904813
epoch 1 0.1812632072464878 8.85454468307247
epoch 2 0.20682075431502456 8.715248026654791
epoch 3 0.1612442249048981 8.962142436473538
epoch 4 0.193034787246273 8.790660077697465
epoch 5 0.20898464255728055 8.70335178586551
epoch 6 0.19917594536071814 8.757146901416897
epoch 7 -861194.7741839236 9081.237320434924
epoch 8 -8.176795747848713 29.644191694200497
epoch 9 -8282.253324716545 890.6243237952087
epoch 10 -36897058.55613056 59441.527176557596
epoch 11 -0.003154733905201157 9.801172745105303
epoch 12 -47079357.95768272 67144.33093051754
epoch 13 -170.93964717523244 128.31637905840336
epoch 14 -13.228923436740612 36.91306449270007
epoch 15 -10.302569631054629 32.89899837308023
epoch 16 -6.826178747286553 27.37593503695174
epoch 17 -459806.2030660998 6635.626996990807
epoch 18 -61504.53427596042 2426.896067304854
[32m[I 2022-03-03 20:08:57,507][0m Trial 5 finished with value: 2383.597528730278 and parameters: {'lr': 0.007245733275067896, 'weight_decay': 0.09651517633969217, 'criterion': 'MSELoss', 'batch_size': 128, 'epochs': 20}. Best is trial 4 with value: 8.328478008908755.[0m
epoch 19 -59329.45686261719 2383.597528730278

Previous best Test-set performance: 0.2756196891324698

Trial Id: 6 | Model params: 222860 | Timestamp: 2022-03-03 20:08:57.507795

epoch 0 0.2579252083331782 8.429812590829233
epoch 1 0.2500374892024616 8.47449557775316
epoch 2 0.2434053800705711 8.511884159862666
epoch 3 0.22036598144407804 8.64051185988268
epoch 4 0.2519092189544241 8.463913798944862
epoch 5 0.25872033617733936 8.425295138380514
epoch 6 0.24367265200662624 8.510380588037028
epoch 7 0.25776367736203165 8.43073001973068
epoch 8 0.23807465007087114 8.541817569134874
epoch 9 0.2598086336569999 8.419108137848005
epoch 10 0.25297647783556 8.45787415009154
epoch 11 0.24487699616026792 8.503602100801553
epoch 12 0.25878715845268707 8.4249153828662
epoch 13 0.2565423138541365 8.437663629141037
epoch 14 0.2577402603237289 8.43086301050778
epoch 15 0.2551992204940515 8.445281719995998
epoch 16 0.2576720683362945 8.431250276628939
epoch 17 0.2538246736788683 8.453071107735283
epoch 18 0.2596991401253791 8.419730817222964
[32m[I 2022-03-03 20:31:03,314][0m Trial 6 finished with value: 8.612196965228424 and parameters: {'lr': 0.0002730528634231168, 'weight_decay': 0.2953225299752125, 'criterion': 'MSELoss', 'batch_size': 256, 'epochs': 20}. Best is trial 4 with value: 8.328478008908755.[0m
epoch 19 0.22546731924357377 8.612196965228424

Previous best Test-set performance: 0.2756196891324698

Trial Id: 7 | Model params: 222860 | Timestamp: 2022-03-03 20:31:03.315064

epoch 0 -877.0796331921165 289.97531720082236
epoch 1 -98.31512527308372 97.52181548167981
epoch 2 -83.71149362304617 90.06690720628617
[32m[I 2022-03-03 20:36:33,478][0m Trial 7 pruned. [0m
++++++++++++++++++++
        NaN         
++++++++++++++++++++

Previous best Test-set performance: 0.2756196891324698

Trial Id: 8 | Model params: 222860 | Timestamp: 2022-03-03 20:36:33.478467

[32m[I 2022-03-03 20:37:32,117][0m Trial 8 pruned. [0m
++++++++++++++++++++
        NaN         
++++++++++++++++++++

Previous best Test-set performance: 0.2756196891324698

Trial Id: 9 | Model params: 222860 | Timestamp: 2022-03-03 20:37:32.117479

[32m[I 2022-03-03 20:39:31,606][0m Trial 9 pruned. [0m
epoch 0 0.26770692118077366 8.374069191094

Study statistics: 
  Number of finished trials:  10
  Number of pruned trials:  5
  Number of complete trials:  5

Best trial:
  Value:  8.328478008908755
  Params: 
    lr: 6.589482469029883e-05
    weight_decay: 0.08288919036684635
    criterion: MSELoss
    batch_size: 128
    epochs: 5
Target: 72610, NaN: 0, Max: 105.0, Min: 1.0, Mean: 25.195950970940643
Prediction: 72610, NaN: 0, Max: 46.086952209472656, Min: 14.400879859924316, Mean: 25.115254336883666

 XXXXXX======== TRIAL north - rlbg ended

Test Set - R-squared:  0.2756589034118746
Test Set - RMSE:  8.328478008908755
Test Set - MAE:  6.467986169864186



[32m[I 2022-03-03 20:42:11,527][0m A new study created in memory with name: DeepSet[0m
Starting Loading south
Finished Loading south
Finished south setup

++++++++ Session Characteristics +++++++

Area: south
Gal Type: lrg
Training Set: 530265
Validation Set: 132567
Test Samples: 132567
Number of features: 5
Device: cuda:0
Number of Workers: 8
Number of Trials: 10

+++++++++++++++++++++++++++++++++++++++

Previous best Test-set performance: 0.00577963225697431

Trial Id: 0 | Model params: 24742 | Timestamp: 2022-03-03 20:42:11.528349

epoch 0 -1.71481514259344 8.077744489175904
epoch 1 -1.7221999494047036 8.088723518670978
epoch 2 -1.7715669096144455 8.161738274916717
epoch 3 -1.7671824236540328 8.155279980421042
epoch 4 -1.713688379739629 8.076068012777226
epoch 5 -1.7347016819245855 8.107276017273222
epoch 6 -1.7011370159580106 8.057369633591222
epoch 7 -1.7146710929293492 8.077530181432127
epoch 8 -1.6661943578428344 8.00508380223446
[32m[I 2022-03-03 21:20:32,694][0m Trial 0 finished with value: 8.100645743858998 and parameters: {'lr': 0.003992617927627407, 'weight_decay': 0.23213684412253544, 'criterion': 'PoissonNLLLoss', 'batch_size': 32, 'epochs': 10}. Best is trial 0 with value: 8.100645743858998.[0m
epoch 9 -1.730230536361578 8.100645743858998

Previous best Test-set performance: 0.00577963225697431

Trial Id: 1 | Model params: 24742 | Timestamp: 2022-03-03 21:20:32.694848

epoch 0 -1.7347840316484455 8.107398083039973
epoch 1 -1.739020829581381 8.113675747672852
epoch 2 -1.7383618750393102 8.112699693559634
epoch 3 -1.7272132661049966 8.096168357472376
[32m[I 2022-03-03 21:35:35,400][0m Trial 1 finished with value: 8.101280254087753 and parameters: {'lr': 5.24787919547272e-05, 'weight_decay': 0.2667918178078589, 'criterion': 'PoissonNLLLoss', 'batch_size': 32, 'epochs': 5}. Best is trial 0 with value: 8.100645743858998.[0m
epoch 4 -1.7306582620277484 8.101280254087753

Previous best Test-set performance: 0.00577963225697431

Trial Id: 2 | Model params: 24742 | Timestamp: 2022-03-03 21:35:35.400467

epoch 0 0.002947886151818402 4.895295463904934
epoch 1 -0.007629079502541769 4.921192193954283
epoch 2 0.0031010925781803644 4.8949193453818465
epoch 3 0.0037729260952723553 4.893269667012651
epoch 4 0.0028307221491762347 4.895583079544125
epoch 5 0.0039150358099521165 4.89292064720839
epoch 6 0.002244416105580793 4.897022097080996
epoch 7 -0.001488640045393952 4.906174534523385
epoch 8 0.003905050327412618 4.892945172250429
epoch 9 0.000932309029855527 4.900240974722473
epoch 10 0.00031629711856739906 4.901751453777615
epoch 11 0.00371040110640819 4.893423219771398
epoch 12 0.004104501355922441 4.892455283307493
epoch 13 0.0029563758700273945 4.8952746225833375
epoch 14 -0.01502476348773274 4.9392191861966825
epoch 15 0.003752057632126604 4.893320917618876
epoch 16 0.004624981025121655 4.891176657034017
epoch 17 0.004321955364616437 4.89192111978515
epoch 18 0.004022748112826324 4.8926560904597025
[32m[I 2022-03-03 21:54:25,992][0m Trial 2 finished with value: 4.891161761835481 and parameters: {'lr': 0.0004737241298266888, 'weight_decay': 0.23724969741226318, 'criterion': 'MSELoss', 'batch_size': 128, 'epochs': 20}. Best is trial 2 with value: 4.891161761835481.[0m
epoch 19 0.00463104348697474 4.891161761835481

Previous best Test-set performance: 0.00577963225697431

Trial Id: 3 | Model params: 24742 | Timestamp: 2022-03-03 21:54:25.993032

epoch 0 -0.0027078171721355293 4.909159928578115
epoch 1 0.0031211862132204393 4.894870013790763
epoch 2 0.0036575719649754035 4.893552957109188
epoch 3 0.0015183566201554255 4.898803536745846
epoch 4 0.0006597885915246016 4.900909260152939
epoch 5 0.0021701151538221497 4.897204429625586
epoch 6 0.002505338898826648 4.896381745750783
epoch 7 0.00024677694369357184 4.9019218900331
epoch 8 0.0031717857293740437 4.894745785452326
[32m[I 2022-03-03 22:07:12,863][0m Trial 3 finished with value: 4.893049818593489 and parameters: {'lr': 0.0005996009726339094, 'weight_decay': 0.25096924467317755, 'criterion': 'MSELoss', 'batch_size': 128, 'epochs': 10}. Best is trial 2 with value: 4.891161761835481.[0m
epoch 9 0.0038624425299287335 4.893049818593489

Previous best Test-set performance: 0.00577963225697431

Trial Id: 4 | Model params: 24742 | Timestamp: 2022-03-03 22:07:12.863521

epoch 0 0.00019210419483273178 4.902055922049377
epoch 1 0.0028644360702205773 4.895500319926394
epoch 2 0.0016301272172936088 4.898529341659687
epoch 3 -0.002200764370431152 4.907918531024402
epoch 4 0.0025506477269057193 4.896270541226748
epoch 5 0.00391582076624597 4.892918719295737
epoch 6 -0.004234319063371794 4.912895309831784
epoch 7 0.003143043622919839 4.894816351417613
epoch 8 0.003095103175872138 4.894934049780142
[32m[I 2022-03-03 22:37:10,636][0m Trial 4 finished with value: 4.896395929912348 and parameters: {'lr': 0.00031476779235963307, 'weight_decay': 0.253615895394645, 'criterion': 'MSELoss', 'batch_size': 32, 'epochs': 10}. Best is trial 2 with value: 4.891161761835481.[0m
epoch 9 0.0024995596738146553 4.896395929912348

Previous best Test-set performance: 0.00577963225697431

Trial Id: 5 | Model params: 24742 | Timestamp: 2022-03-03 22:37:10.636872

[32m[I 2022-03-03 22:38:31,628][0m Trial 5 pruned. [0m
epoch 0 0.0054268025039069245 4.889206223502693

Previous best Test-set performance: 0.00577963225697431

Trial Id: 6 | Model params: 24742 | Timestamp: 2022-03-03 22:38:31.628623

[32m[I 2022-03-03 22:40:15,798][0m Trial 6 pruned. [0m
epoch 0 -0.0017772883374171933 4.9068815105272945

Previous best Test-set performance: 0.00577963225697431

Trial Id: 7 | Model params: 24742 | Timestamp: 2022-03-03 22:40:15.799118

[32m[I 2022-03-03 22:41:59,842][0m Trial 7 pruned. [0m
epoch 0 0.004871792511097817 4.890570215542678

Previous best Test-set performance: 0.00577963225697431

Trial Id: 8 | Model params: 24742 | Timestamp: 2022-03-03 22:41:59.843233

[32m[I 2022-03-03 22:43:49,593][0m Trial 8 pruned. [0m
epoch 0 0.0049431177518027836 4.890394948001373

Previous best Test-set performance: 0.00577963225697431

Trial Id: 9 | Model params: 24742 | Timestamp: 2022-03-03 22:43:49.593817

epoch 0 -1.7232637343425892 8.090303825396173
epoch 1 -1.7196839342897396 8.084984620783018
epoch 2 -1.7276694835575417 8.09684550635769
epoch 3 -1.719577005924394 8.084825682702746
epoch 4 -1.7113367418805896 8.072567960274364
epoch 5 -1.7182687413131736 8.08288082810757
epoch 6 -1.7141662303770167 8.076779034794829
epoch 7 -1.7202009357657286 8.085753046536542
epoch 8 -1.7167459227492063 8.080616429969965
[32m[I 2022-03-03 23:18:01,968][0m Trial 9 finished with value: 8.087014927963335 and parameters: {'lr': 2.1670412963220048e-05, 'weight_decay': 0.002340476168943617, 'criterion': 'PoissonNLLLoss', 'batch_size': 32, 'epochs': 10}. Best is trial 2 with value: 4.891161761835481.[0m
epoch 9 -1.7210500437871432 8.087014927963335

Study statistics: 
  Number of finished trials:  10
  Number of pruned trials:  4
  Number of complete trials:  6

Best trial:
  Value:  4.891161761835481
  Params: 
    lr: 0.0004737241298266888
    weight_decay: 0.23724969741226318
    criterion: MSELoss
    batch_size: 128
    epochs: 20
Target: 132567, NaN: 0, Max: 227.0, Min: 0.0, Mean: 8.573823047968197
Prediction: 132567, NaN: 0, Max: 9.509623527526855, Min: 8.315400123596191, Mean: 8.579535193025585

 XXXXXX======== TRIAL south - lrg ended

Test Set - R-squared:  0.00463104348697474
Test Set - RMSE:  4.891161761835481
Test Set - MAE:  3.3116198913838493



[32m[I 2022-03-03 23:19:40,622][0m A new study created in memory with name: DeepSet[0m
Starting Loading south
Finished Loading south
Finished south setup

++++++++ Session Characteristics +++++++

Area: south
Gal Type: elg
Training Set: 530265
Validation Set: 132567
Test Samples: 132567
Number of features: 5
Device: cuda:0
Number of Workers: 8
Number of Trials: 10

+++++++++++++++++++++++++++++++++++++++

Previous best Test-set performance: 0.10130102992857382

Trial Id: 0 | Model params: 359088 | Timestamp: 2022-03-03 23:19:40.622782

epoch 0 0.10609875312886774 7.490867777765977
epoch 1 0.10612177800559841 7.490771303228964
epoch 2 0.10527965682801388 7.49429899412342
epoch 3 0.10502343332612718 7.495371998717792
[32m[I 2022-03-03 23:33:30,880][0m Trial 0 finished with value: 7.497907277629154 and parameters: {'lr': 2.1705615628191034e-05, 'weight_decay': 0.14227242498808068, 'criterion': 'MSELoss', 'batch_size': 256, 'epochs': 5}. Best is trial 0 with value: 7.497907277629154.[0m
epoch 4 0.10441788660780649 7.497907277629154

Previous best Test-set performance: 0.10130102992857382

Trial Id: 1 | Model params: 359088 | Timestamp: 2022-03-03 23:33:30.880502

epoch 0 0.0981314252783615 7.524176715651268
epoch 1 0.09077798811725968 7.554788846132853
epoch 2 0.0979790455590479 7.524812331273495
epoch 3 0.09420438390562869 7.540540329315207
[32m[I 2022-03-03 23:46:35,178][0m Trial 1 finished with value: 7.512316347615907 and parameters: {'lr': 0.0038304018639326734, 'weight_decay': 0.048118911662297134, 'criterion': 'MSELoss', 'batch_size': 256, 'epochs': 5}. Best is trial 0 with value: 7.497907277629154.[0m
epoch 4 0.10097241723605443 7.512316347615907

Previous best Test-set performance: 0.10130102992857382

Trial Id: 2 | Model params: 359088 | Timestamp: 2022-03-03 23:46:35.178835

epoch 0 -54.04802469330542 58.78387750693286
epoch 1 -173.4261546105093 104.63889939851353
epoch 2 -740.5805792526642 215.75781421479587
epoch 3 -2789.690857252555 418.54602778181277
epoch 4 -6382.552339109979 633.0216616563171
epoch 5 -1211.751652089138 275.91372042921876
epoch 6 -45.685997109046774 54.13531637756305
epoch 7 -516.172225753204 180.1793253942206
epoch 8 -128.25218677638856 90.07542285635856
[32m[I 2022-03-04 00:14:28,369][0m Trial 2 finished with value: 45.638048905436015 and parameters: {'lr': 0.0002613875742118393, 'weight_decay': 0.03252025212214597, 'criterion': 'PoissonNLLLoss', 'batch_size': 128, 'epochs': 10}. Best is trial 0 with value: 7.497907277629154.[0m
epoch 9 -32.18023206358531 45.638048905436015

Previous best Test-set performance: 0.10130102992857382

Trial Id: 3 | Model params: 359088 | Timestamp: 2022-03-04 00:14:28.370172

epoch 0 0.0731780372876033 7.627557990026096
epoch 1 0.08018683666263526 7.598662755318289
epoch 2 0.07518298978222537 7.61930334587631
epoch 3 0.06731513967279734 7.651645190299427
[32m[I 2022-03-04 00:27:48,655][0m Trial 3 finished with value: 7.647403285782157 and parameters: {'lr': 0.005591223261691725, 'weight_decay': 0.19109140376878997, 'criterion': 'MSELoss', 'batch_size': 128, 'epochs': 5}. Best is trial 0 with value: 7.497907277629154.[0m
epoch 4 0.0683489731462894 7.647403285782157

Previous best Test-set performance: 0.10130102992857382

Trial Id: 4 | Model params: 359088 | Timestamp: 2022-03-04 00:27:48.655983

epoch 0 0.09952232882444001 7.518372409713025
epoch 1 0.10048243707045235 7.51436321730275
epoch 2 0.09995565269476892 7.516563213124008
epoch 3 0.09948892530136211 7.518511856700633
epoch 4 0.09777006954682244 7.5256839375254705
epoch 5 0.09443786909971286 7.539568411388834
epoch 6 0.09223878612230241 7.548717470473225
epoch 7 0.09744944918901133 7.527020998661395
epoch 8 0.09816313403964283 7.524044443373955
[32m[I 2022-03-04 00:54:21,750][0m Trial 4 finished with value: 7.529692691900555 and parameters: {'lr': 0.00044077027556652115, 'weight_decay': 0.1274962675293353, 'criterion': 'MSELoss', 'batch_size': 128, 'epochs': 10}. Best is trial 0 with value: 7.497907277629154.[0m
epoch 9 0.09680862032627346 7.529692691900555

Previous best Test-set performance: 0.10130102992857382

Trial Id: 5 | Model params: 359088 | Timestamp: 2022-03-04 00:54:21.750661

epoch 0 0.06213915203609166 7.672847435144642
epoch 1 0.0690144150485118 7.644671677342649
epoch 2 0.02070509871228776 7.840506270775683
epoch 3 -0.07326298239255702 8.20805834901993
[32m[I 2022-03-04 01:09:23,555][0m Trial 5 finished with value: 7.615524826684029 and parameters: {'lr': 0.0028947378563671648, 'weight_decay': 0.2795161507861794, 'criterion': 'MSELoss', 'batch_size': 32, 'epochs': 5}. Best is trial 0 with value: 7.497907277629154.[0m
epoch 4 0.07610002174520158 7.615524826684029

Previous best Test-set performance: 0.10130102992857382

Trial Id: 6 | Model params: 359088 | Timestamp: 2022-03-04 01:09:23.555940

epoch 0 -59.72971520914604 61.743036210455514
epoch 1 -146.74533144619738 96.3039816318296
[32m[I 2022-03-04 01:18:30,507][0m Trial 6 pruned. [0m
++++++++++++++++++++
        NaN         
++++++++++++++++++++

Previous best Test-set performance: 0.10130102992857382

Trial Id: 7 | Model params: 359088 | Timestamp: 2022-03-04 01:18:30.507256

epoch 0 -5.045835968981002 19.481192593107046
epoch 1 -14.66808724365435 31.36139340455287
epoch 2 -26.983695832142367 41.912145742421195
epoch 3 -58.257515397705355 60.99006256139399
[32m[I 2022-03-04 01:31:24,956][0m Trial 7 finished with value: 101.63508369849878 and parameters: {'lr': 2.8123820659197016e-05, 'weight_decay': 0.09897369557654254, 'criterion': 'PoissonNLLLoss', 'batch_size': 128, 'epochs': 5}. Best is trial 0 with value: 7.497907277629154.[0m
epoch 4 -163.5555667637689 101.63508369849878

Previous best Test-set performance: 0.10130102992857382

Trial Id: 8 | Model params: 359088 | Timestamp: 2022-03-04 01:31:24.956522

[32m[I 2022-03-04 01:34:02,854][0m Trial 8 pruned. [0m
epoch 0 0.09630570888726042 7.531788726963313

Previous best Test-set performance: 0.10130102992857382

Trial Id: 9 | Model params: 359088 | Timestamp: 2022-03-04 01:34:02.854497

epoch 0 -26.047792837899788 41.205318514020625
epoch 1 -5632.381465797808 594.6644002493609
epoch 2 -4664.563862660115 541.17712241263
epoch 3 -2201.446949373694 371.82628540708026
[32m[I 2022-03-04 01:47:14,156][0m Trial 9 finished with value: 21.06756146884204 and parameters: {'lr': 0.0026472502753374424, 'weight_decay': 0.09913245511461534, 'criterion': 'PoissonNLLLoss', 'batch_size': 256, 'epochs': 5}. Best is trial 0 with value: 7.497907277629154.[0m
epoch 4 -6.070560127468389 21.06756146884204

Study statistics: 
  Number of finished trials:  10
  Number of pruned trials:  2
  Number of complete trials:  8

Best trial:
  Value:  7.497907277629154
  Params: 
    lr: 2.1705615628191034e-05
    weight_decay: 0.14227242498808068
    criterion: MSELoss
    batch_size: 256
    epochs: 5
Target: 132567, NaN: 0, Max: 365.0, Min: 0.0, Mean: 32.88284414673335
Prediction: 132567, NaN: 0, Max: 40.64485549926758, Min: 27.340248107910156, Mean: 33.09726120111716

 XXXXXX======== TRIAL south - elg ended

Test Set - R-squared:  0.10441788660780649
Test Set - RMSE:  7.497907277629154
Test Set - MAE:  5.875616433116574



[32m[I 2022-03-04 01:50:09,005][0m A new study created in memory with name: DeepSet[0m
Starting Loading south
Finished Loading south
Finished south setup

++++++++ Session Characteristics +++++++

Area: south
Gal Type: qso
Training Set: 530265
Validation Set: 132567
Test Samples: 132567
Number of features: 5
Device: cuda:0
Number of Workers: 8
Number of Trials: 10

+++++++++++++++++++++++++++++++++++++++

Previous best Test-set performance: 0.09970063323141287

Trial Id: 0 | Model params: 91862 | Timestamp: 2022-03-04 01:50:09.006081

epoch 0 -0.004798279573056785 2.389867460992391
epoch 1 -0.005270346710755325 2.3904287902849086
epoch 2 -0.004039763584772205 2.3889652426297454
epoch 3 -0.0008158609010464613 2.385126757261386
epoch 4 -0.004978774575420175 2.3900821009713487
epoch 5 -0.0009282931729077681 2.385260726805352
epoch 6 -9.446196549411923e-07 2.3841555124371254
epoch 7 -0.00947456544389258 2.3954221733324292
epoch 8 -0.0027727803177794996 2.387457466462528
epoch 9 -8.055808465790015e-05 2.3842504158993427
epoch 10 -0.00257555903144957 2.3872226771883795
epoch 11 -0.00018291684719984325 2.384372427409253
epoch 12 -0.019926586598431495 2.4077912461354254
epoch 13 -0.00229034296020858 2.386883090461837
epoch 14 -0.00035062372631222694 2.384572320294196
epoch 15 -0.0008419447870038343 2.3851578383879977
epoch 16 -0.0005536047714711501 2.384814234688798
epoch 17 -0.0010809188547340476 2.3854425770788747
epoch 18 -0.005773917520454752 2.3910274349451606
