[32m[I 2022-03-04 02:09:16,717][0m Trial 0 finished with value: 2.3847709666739334 and parameters: {'lr': 0.005908923511645565, 'weight_decay': 0.09922968747237688, 'criterion': 'MSELoss', 'batch_size': 128, 'epochs': 20}. Best is trial 0 with value: 2.3847709666739334.[0m
epoch 19 -0.0005172987356476533 2.3847709666739334

Previous best Test-set performance: 0.09970063323141287

Trial Id: 1 | Model params: 91862 | Timestamp: 2022-03-04 02:09:16.718150

epoch 0 0.08289769426358895 2.2831963814105594
epoch 1 0.08634059613895007 2.278906667749723
epoch 2 0.08852796771361515 2.2761770932874197
epoch 3 0.0991303785985378 2.262899913696924
epoch 4 0.09812510946334929 2.2641621325171135
epoch 5 0.09862716765981683 2.2635318347819235
epoch 6 0.10242265501479575 2.2587611842972355
epoch 7 0.09837570719642086 2.263847547133043
epoch 8 0.10192167893172954 2.2593914516968026
epoch 9 0.10111786939070899 2.2604023402647084
epoch 10 0.09527164559237533 2.2677411226209534
epoch 11 0.10114988584143059 2.260362084316734
epoch 12 0.10095030728484311 2.2606130131181175
epoch 13 0.10176434131507417 2.25958935854376
epoch 14 0.09947082010460817 2.262472294742471
epoch 15 0.10160424689805514 2.2597907152368717
epoch 16 0.10043573192030142 2.261259856876373
epoch 17 0.10243673202754988 2.2587434717653587
epoch 18 0.1019475981511152 2.2593588475887416
[32m[I 2022-03-04 02:28:19,345][0m Trial 1 finished with value: 2.2608471707349995 and parameters: {'lr': 0.0002050628966266063, 'weight_decay': 0.02519834737055553, 'criterion': 'MSELoss', 'batch_size': 128, 'epochs': 20}. Best is trial 1 with value: 2.2608471707349995.[0m
epoch 19 0.100764047862966 2.2608471707349995

Previous best Test-set performance: 0.09970063323141287

Trial Id: 2 | Model params: 91862 | Timestamp: 2022-03-04 02:28:19.345907

epoch 0 -1.2996830251850935 3.6154999891915343
epoch 1 -1.3044783924756356 3.619267600067189
epoch 2 -1.2967244532671773 3.6131735469816846
epoch 3 -1.3125118326147471 3.6255705176119006
epoch 4 -1.275124080325972 3.5961427127626773
epoch 5 -1.303062735861475 3.618155759043504
epoch 6 -1.288319429601923 3.6065561566638262
epoch 7 -1.3006447223974043 3.6162558874583834
epoch 8 -1.3003032871493971 3.6159875359333076
epoch 9 -1.2840517519427417 3.6031915035661863
epoch 10 -1.3233996838009379 3.6340955155705257
epoch 11 -1.2969437863875162 3.6133460687023127
epoch 12 -1.2971172389499777 3.6134824961383627
epoch 13 -1.285275078949656 3.604156300318642
epoch 14 -1.3142504951534533 3.6269332045282994
epoch 15 -1.3048284857601216 3.6195425067805713
epoch 16 -1.330687966092348 3.6397909573477953
epoch 17 -1.3219390710945067 3.632953043052872
epoch 18 -1.3052186123950293 3.619848824625468
[32m[I 2022-03-04 02:46:19,261][0m Trial 2 finished with value: 3.634265920172052 and parameters: {'lr': 0.0037292810730111905, 'weight_decay': 0.10650017145561476, 'criterion': 'PoissonNLLLoss', 'batch_size': 256, 'epochs': 20}. Best is trial 1 with value: 2.2608471707349995.[0m
epoch 19 -1.323617579713693 3.634265920172052

Previous best Test-set performance: 0.09970063323141287

Trial Id: 3 | Model params: 91862 | Timestamp: 2022-03-04 02:46:19.261451

epoch 0 -1.3843507218046573 3.6814545532056555
epoch 1 -1.345031946970019 3.650974138024601
epoch 2 -1.3405940410152088 3.647517819886091
epoch 3 -1.3119641477173363 3.625141160284467
epoch 4 -1.3474503425205469 3.652856249772165
epoch 5 -1.3679668580388475 3.6687843487604423
epoch 6 -1.293842733224821 3.6109060954557215
epoch 7 -1.3393882899663732 3.646578194109418
epoch 8 -1.3321755636528358 3.640952348431484
epoch 9 -1.3292945881430316 3.638702788797939
epoch 10 -1.32119400936707 3.632370126930024
epoch 11 -1.3873052091222187 3.683734721841572
epoch 12 -1.3445252910038001 3.650579711041053
epoch 13 -1.3690382025621188 3.669614193048902
epoch 14 -1.3438044941901595 3.650018503937114
epoch 15 -1.3496842066786776 3.6545938891462018
epoch 16 -1.348067733354056 3.6533365776535733
epoch 17 -1.3398208208524127 3.6469152875294775
epoch 18 -1.3650579322662093 3.6665301996168638
[32m[I 2022-03-04 03:41:32,409][0m Trial 3 finished with value: 3.653149065368113 and parameters: {'lr': 0.0033855644895867663, 'weight_decay': 0.22098181719956733, 'criterion': 'PoissonNLLLoss', 'batch_size': 32, 'epochs': 20}. Best is trial 1 with value: 2.2608471707349995.[0m
epoch 19 -1.3478267042353491 3.653149065368113

Previous best Test-set performance: 0.09970063323141287

Trial Id: 4 | Model params: 91862 | Timestamp: 2022-03-04 03:41:32.409227

epoch 0 0.07338086037462566 2.2950122501758843
epoch 1 0.06809715271978034 2.30154618419205
epoch 2 0.06332915711457576 2.3074264974430956
epoch 3 0.06040506328047124 2.311025346525942
epoch 4 0.06128101617223336 2.3099478495725103
epoch 5 0.06010200097633944 2.311398022118183
epoch 6 0.06002761376784971 2.3114894868542053
epoch 7 0.061339881990446155 2.3098754215592616
epoch 8 0.0627810095240483 2.308101561311178
[32m[I 2022-03-04 03:51:06,446][0m Trial 4 finished with value: 2.3114317362746153 and parameters: {'lr': 3.252437537107693e-05, 'weight_decay': 0.2595008208423733, 'criterion': 'MSELoss', 'batch_size': 128, 'epochs': 10}. Best is trial 1 with value: 2.2608471707349995.[0m
epoch 9 0.06007458198664828 2.3114317362746153

Previous best Test-set performance: 0.09970063323141287

Trial Id: 5 | Model params: 91862 | Timestamp: 2022-03-04 03:51:06.447162

epoch 0 -1.3491361371655866 3.65416764286579
epoch 1 -1.345944261039473 3.6516842586655174
epoch 2 -1.353804558875228 3.6577967915326477
epoch 3 -1.33698361863124 3.644703542382626
[32m[I 2022-03-04 04:04:56,862][0m Trial 5 finished with value: 3.651599291591663 and parameters: {'lr': 8.909097853443935e-05, 'weight_decay': 0.26332227514309914, 'criterion': 'PoissonNLLLoss', 'batch_size': 32, 'epochs': 5}. Best is trial 1 with value: 2.2608471707349995.[0m
epoch 4 -1.3458350918527664 3.651599291591663

Previous best Test-set performance: 0.09970063323141287

Trial Id: 6 | Model params: 91862 | Timestamp: 2022-03-04 04:04:56.862508

epoch 0 -1.2850574297759274 3.603984666643907
epoch 1 -1.3085629542161419 3.622473656857841
epoch 2 -1.294903380301545 3.611740820155023
epoch 3 -1.3068952780635859 3.621165006314099
epoch 4 -1.3110233496993233 3.6244035033769486
epoch 5 -1.317815762440513 3.62972590347993
epoch 6 -1.3132107807911808 3.6261183838791085
epoch 7 -1.3141013497854699 3.626816331051491
epoch 8 -1.3111447240307208 3.624498678481121
epoch 9 -1.3229621054390668 3.633753285076666
epoch 10 -1.315218598095453 3.6276917390045273
epoch 11 -1.3266990320346816 3.6366749023772877
epoch 12 -1.317399653742969 3.629400073373839
epoch 13 -1.3142859198550965 3.626960963523111
epoch 14 -1.3156787525146707 3.628052226660156
epoch 15 -1.3225513951690644 3.633432038819177
epoch 16 -1.310065147825577 3.6236520461729835
epoch 17 -1.3185640050301344 3.6303117344159994
epoch 18 -1.3181019685672588 3.629949997590699
[32m[I 2022-03-04 04:22:56,724][0m Trial 6 finished with value: 3.6253715050889537 and parameters: {'lr': 0.00014703161257481647, 'weight_decay': 0.12944588575841562, 'criterion': 'PoissonNLLLoss', 'batch_size': 256, 'epochs': 20}. Best is trial 1 with value: 2.2608471707349995.[0m
epoch 19 -1.3122579657097195 3.6253715050889537

Previous best Test-set performance: 0.09970063323141287

Trial Id: 7 | Model params: 91862 | Timestamp: 2022-03-04 04:22:56.724731

epoch 0 -1.3453419714608068 3.6512154682102267
epoch 1 -1.337785976659215 3.6453291578472045
epoch 2 -1.3536808767179322 3.6577006896410227
epoch 3 -1.3520389878153272 3.6564246912808986
epoch 4 -1.3569471412751826 3.6602377532501404
epoch 5 -1.3520108485059406 3.6564028188600104
epoch 6 -1.3510675372004624 3.6556695161161743
epoch 7 -1.3537453350112014 3.657750774495748
epoch 8 -1.350275498418906 3.65505369460503
[32m[I 2022-03-04 04:50:46,533][0m Trial 7 finished with value: 3.657797062754173 and parameters: {'lr': 2.398858150735637e-05, 'weight_decay': 0.28556203012216547, 'criterion': 'PoissonNLLLoss', 'batch_size': 32, 'epochs': 10}. Best is trial 1 with value: 2.2608471707349995.[0m
epoch 9 -1.3538049079391712 3.657797062754173

Previous best Test-set performance: 0.09970063323141287

Trial Id: 8 | Model params: 91862 | Timestamp: 2022-03-04 04:50:46.533270

[32m[I 2022-03-04 04:53:33,384][0m Trial 8 pruned. [0m
epoch 0 -1.2527612122798546 3.5784252921953454

Previous best Test-set performance: 0.09970063323141287

Trial Id: 9 | Model params: 91862 | Timestamp: 2022-03-04 04:53:33.385040

[32m[I 2022-03-04 04:56:18,879][0m Trial 9 pruned. [0m
epoch 0 0.08459086492663426 2.281087768744323

Study statistics: 
  Number of finished trials:  10
  Number of pruned trials:  2
  Number of complete trials:  8

Best trial:
  Value:  2.2608471707349995
  Params: 
    lr: 0.0002050628966266063
    weight_decay: 0.02519834737055553
    criterion: MSELoss
    batch_size: 128
    epochs: 20
Target: 132567, NaN: 0, Max: 87.0, Min: 0.0, Mean: 4.115865939487203
Prediction: 132567, NaN: 0, Max: 8.314305305480957, Min: 3.2513413429260254, Mean: 4.181970514026002

 XXXXXX======== TRIAL south - qso ended

Test Set - R-squared:  0.100764047862966
Test Set - RMSE:  2.2608471707349995
Test Set - MAE:  1.7331185170961327



[32m[I 2022-03-04 04:57:06,979][0m A new study created in memory with name: DeepSet[0m
Starting Loading south
Finished Loading south
Finished south setup

++++++++ Session Characteristics +++++++

Area: south
Gal Type: glbg
Training Set: 530265
Validation Set: 132567
Test Samples: 132567
Number of features: 5
Device: cuda:0
Number of Workers: 8
Number of Trials: 10

+++++++++++++++++++++++++++++++++++++++

Previous best Test-set performance: 0.1358706409894661

Trial Id: 0 | Model params: 555688 | Timestamp: 2022-03-04 04:57:06.980128

epoch 0 -4.831953798938787 20.243376779317973
epoch 1 -4.797561400632981 20.183598548929428
epoch 2 -4.807365965258153 20.200658118218627
epoch 3 -4.79860043939776 20.18540711983626
[32m[I 2022-03-04 05:13:35,867][0m Trial 0 finished with value: 20.232022351529945 and parameters: {'lr': 0.000145862687719927, 'weight_decay': 0.22734626986591386, 'criterion': 'PoissonNLLLoss', 'batch_size': 128, 'epochs': 5}. Best is trial 0 with value: 20.232022351529945.[0m
epoch 4 -4.82541339531428 20.232022351529945

Previous best Test-set performance: 0.1358706409894661

Trial Id: 1 | Model params: 555688 | Timestamp: 2022-03-04 05:13:35.867565

epoch 0 0.1340633908079456 7.800437678598315
epoch 1 0.13857116542716452 7.78010795971601
epoch 2 0.13988335127605622 7.774180111785341
epoch 3 0.13599759931615374 7.791721043123305
[32m[I 2022-03-04 05:31:29,003][0m Trial 1 finished with value: 7.772251532371148 and parameters: {'lr': 4.433038421222801e-05, 'weight_decay': 0.05327988341679407, 'criterion': 'MSELoss', 'batch_size': 32, 'epochs': 5}. Best is trial 1 with value: 7.772251532371148.[0m
epoch 4 0.14031004514856982 7.772251532371148

Previous best Test-set performance: 0.1358706409894661

Trial Id: 2 | Model params: 555688 | Timestamp: 2022-03-04 05:31:29.003329

epoch 0 -4.857992388502569 20.288517905808348
epoch 1 -4.8630770469847295 20.297321076085577
epoch 2 -4.865708802853343 20.301875988156088
epoch 3 -4.859411852046527 20.29097583552669
[32m[I 2022-03-04 05:47:42,669][0m Trial 2 finished with value: 20.2912877061595 and parameters: {'lr': 0.006191910546441605, 'weight_decay': 0.29044625604986335, 'criterion': 'PoissonNLLLoss', 'batch_size': 128, 'epochs': 5}. Best is trial 1 with value: 7.772251532371148.[0m
epoch 4 -4.859591970788999 20.2912877061595

Previous best Test-set performance: 0.1358706409894661

Trial Id: 3 | Model params: 555688 | Timestamp: 2022-03-04 05:47:42.669373

epoch 0 0.12960271697505432 7.820502954179196
epoch 1 0.13689330745644224 7.787681171415885
epoch 2 0.1363114701097019 7.7903056443863825
epoch 3 0.13552653260227188 7.793844833675859
epoch 4 0.13767112420105376 7.784171319048961
epoch 5 0.13136274230827238 7.812592056018158
epoch 6 0.1347940343193289 7.797146131709806
epoch 7 0.13441863608379423 7.798837473186441
epoch 8 0.13686065928944002 7.787828459760024
epoch 9 0.1353102544564988 7.794819723568691
epoch 10 0.13676030970351527 7.788281157610168
epoch 11 0.13660745545234476 7.788970664361854
epoch 12 0.13733684818197434 7.785679913828914
epoch 13 0.13728449891838979 7.7859161406957265
epoch 14 0.13028465284337432 7.817438763508871
epoch 15 0.13715539791523057 7.786498680351729
epoch 16 0.13605854860982003 7.791446212712443
epoch 17 0.13742108338728687 7.785299786107499
epoch 18 0.1342939463372549 7.799399176620862
[32m[I 2022-03-04 06:51:11,580][0m Trial 3 finished with value: 7.787700213152442 and parameters: {'lr': 5.853104437273252e-05, 'weight_decay': 0.18658149474809319, 'criterion': 'MSELoss', 'batch_size': 128, 'epochs': 20}. Best is trial 1 with value: 7.772251532371148.[0m
epoch 19 0.1368890866697945 7.787700213152442

Previous best Test-set performance: 0.1358706409894661

Trial Id: 4 | Model params: 555688 | Timestamp: 2022-03-04 06:51:11.580432

epoch 0 0.13686738051765823 7.787798137961542
epoch 1 0.13304314934634565 7.805031540966123
epoch 2 0.13935115151512534 7.776584888504419
epoch 3 0.1394521376401353 7.776128633776687
epoch 4 0.13626845416583844 7.790499639771458
epoch 5 0.13793287762769646 7.782989816134889
epoch 6 0.13591817378020044 7.792079171409418
epoch 7 0.12457721753620343 7.843047467350582
epoch 8 0.1389523540701677 7.778386391529544
[32m[I 2022-03-04 07:22:36,946][0m Trial 4 finished with value: 7.777659100591883 and parameters: {'lr': 0.00019370981330885448, 'weight_decay': 0.09713871729707825, 'criterion': 'MSELoss', 'batch_size': 128, 'epochs': 10}. Best is trial 1 with value: 7.772251532371148.[0m
epoch 9 0.13911336506690408 7.777659100591883

Previous best Test-set performance: 0.1358706409894661

Trial Id: 5 | Model params: 555688 | Timestamp: 2022-03-04 07:22:36.946646

[32m[I 2022-03-04 07:26:08,983][0m Trial 5 pruned. [0m
epoch 0 0.13750679332597826 7.784912984313889

Previous best Test-set performance: 0.1358706409894661

Trial Id: 6 | Model params: 555688 | Timestamp: 2022-03-04 07:26:08.983361

[32m[I 2022-03-04 07:29:14,240][0m Trial 6 pruned. [0m
epoch 0 0.13759411374874397 7.784518894775449

Previous best Test-set performance: 0.1358706409894661

Trial Id: 7 | Model params: 555688 | Timestamp: 2022-03-04 07:29:14.240589

[32m[I 2022-03-04 07:32:44,411][0m Trial 7 pruned. [0m
epoch 0 0.1325803426000377 7.8071145392728205

Previous best Test-set performance: 0.1358706409894661

Trial Id: 8 | Model params: 555688 | Timestamp: 2022-03-04 07:32:44.411487

epoch 0 -4.879866511219947 20.32636193020002
epoch 1 -4.829027160074165 20.23829679327458
epoch 2 -4.822214317958108 20.22646629151026
epoch 3 -4.819351364754291 20.22149270725577
epoch 4 -4.822378275853738 20.226751085690026
epoch 5 -4.802194017765133 20.191660922637094
epoch 6 -4.820021448543191 20.222656900956988
epoch 7 -4.8403488398495265 20.257941611953246
epoch 8 -4.842284964198455 20.26129917200933
epoch 9 -4.8288024891768355 20.237906762486354
epoch 10 -4.840217504763741 20.257713835023306
epoch 11 -4.849323213297742 20.27349997600093
epoch 12 -4.848008085593343 20.27122076015617
epoch 13 -4.854948003017179 20.283245272084752
epoch 14 -4.8581190420996 20.288737230084628
epoch 15 -4.836263786728506 20.25085562738962
epoch 16 -4.855316784776059 20.283884045740916
epoch 17 -4.855950418500088 20.284981527377415
epoch 18 -4.864220400031178 20.299300060193882
[32m[I 2022-03-04 08:37:00,359][0m Trial 8 finished with value: 20.284177357637642 and parameters: {'lr': 9.24547438980415e-05, 'weight_decay': 0.165564338291696, 'criterion': 'PoissonNLLLoss', 'batch_size': 128, 'epochs': 20}. Best is trial 1 with value: 7.772251532371148.[0m
epoch 19 -4.855486125764753 20.284177357637642

Previous best Test-set performance: 0.1358706409894661

Trial Id: 9 | Model params: 555688 | Timestamp: 2022-03-04 08:37:00.359982

epoch 0 -4.7970214742456605 20.182658678660633
epoch 1 -4.833141662043263 20.245438278507446
epoch 2 -4.858124540244551 20.288746751092244
epoch 3 -4.859169489946361 20.29055618467296
epoch 4 -4.857306696553665 20.287330461409052
epoch 5 -4.862554451126797 20.296416471539786
epoch 6 -4.8564408079316905 20.28583086280567
epoch 7 -4.852119539548775 20.27834536958537
epoch 8 -4.856517527536521 20.285963734961438
[32m[I 2022-03-04 09:12:48,595][0m Trial 9 finished with value: 20.275322155066586 and parameters: {'lr': 0.00022494943688653252, 'weight_decay': 0.1512580298693992, 'criterion': 'PoissonNLLLoss', 'batch_size': 32, 'epochs': 10}. Best is trial 1 with value: 7.772251532371148.[0m
epoch 9 -4.8503747330958 20.275322155066586

Study statistics: 
  Number of finished trials:  10
  Number of pruned trials:  3
  Number of complete trials:  7

Best trial:
  Value:  7.772251532371148
  Params: 
    lr: 4.433038421222801e-05
    weight_decay: 0.05327988341679407
    criterion: MSELoss
    batch_size: 32
    epochs: 5
Target: 132567, NaN: 0, Max: 159.0, Min: 0.0, Mean: 21.53262878393567
Prediction: 132567, NaN: 0, Max: 37.79081726074219, Min: 15.080109596252441, Mean: 21.606810901308652

 XXXXXX======== TRIAL south - glbg ended

Test Set - R-squared:  0.14031004514856982
Test Set - RMSE:  7.772251532371148
Test Set - MAE:  5.987677700777625



[32m[I 2022-03-04 09:13:45,976][0m A new study created in memory with name: DeepSet[0m
Starting Loading south
Finished Loading south
Finished south setup

++++++++ Session Characteristics +++++++

Area: south
Gal Type: rlbg
Training Set: 530265
Validation Set: 132567
Test Samples: 132567
Number of features: 5
Device: cuda:0
Number of Workers: 8
Number of Trials: 10

+++++++++++++++++++++++++++++++++++++++

Previous best Test-set performance: 0.1425664535055814

Trial Id: 0 | Model params: 407850 | Timestamp: 2022-03-04 09:13:45.976606

epoch 0 0.14040084651469142 4.203825656327817
epoch 1 0.10981171707383297 4.277969103103704
epoch 2 0.1279049766947561 4.234270617860757
epoch 3 0.12512783951887685 4.241007156495175
[32m[I 2022-03-04 09:23:34,482][0m Trial 0 finished with value: 4.214966550070135 and parameters: {'lr': 0.00027745685699679317, 'weight_decay': 0.09837028494372427, 'criterion': 'MSELoss', 'batch_size': 128, 'epochs': 5}. Best is trial 0 with value: 4.214966550070135.[0m
epoch 4 0.13583862457400797 4.214966550070135

Previous best Test-set performance: 0.1425664535055814

Trial Id: 1 | Model params: 407850 | Timestamp: 2022-03-04 09:23:34.482910

epoch 0 -2.0542120530534898 7.9240334502070775
epoch 1 -2.142461488036444 8.037698080912106
epoch 2 -2.155674584829289 8.054578395834492
epoch 3 -2.1352448258481873 8.028463490025915
epoch 4 -2.1218599920499726 8.011307798639086
epoch 5 -2.1207887340008416 8.009933151097313
epoch 6 -2.1254881192217794 8.015961691442406
epoch 7 -2.1295557332125936 8.021176114758093
epoch 8 -2.12831035020224 8.019579972795627
[32m[I 2022-03-04 09:42:47,239][0m Trial 1 finished with value: 8.01222751623194 and parameters: {'lr': 1.75331401824296e-05, 'weight_decay': 0.028619865448988077, 'criterion': 'PoissonNLLLoss', 'batch_size': 256, 'epochs': 10}. Best is trial 0 with value: 4.214966550070135.[0m
epoch 9 -2.122576827413524 8.01222751623194

Previous best Test-set performance: 0.1425664535055814

Trial Id: 2 | Model params: 407850 | Timestamp: 2022-03-04 09:42:47.239268

epoch 0 -2.117762257944371 8.006048275649198
epoch 1 -2.1339335622317215 8.026784429280074
epoch 2 -2.134300217902032 8.027253963794877
epoch 3 -2.131523823673707 8.023697865513972
epoch 4 -2.117478245484214 8.005683611979478
epoch 5 -2.1601741162869414 8.060318677065732
epoch 6 -2.1048953744491907 7.989510870883413
epoch 7 -2.1565579575610454 8.055705682070336
epoch 8 -2.132344068327997 8.024748626220287
epoch 9 -2.121129230197826 8.010370104319733
epoch 10 -2.1129175424843303 7.999825526409568
epoch 11 -2.115644385969887 8.003328590129836
epoch 12 -2.1369742780211314 8.0306775004383
epoch 13 -2.1585022061994317 8.058186213712748
epoch 14 -2.1377548111965745 8.03167652366797
epoch 15 -2.1200316104751358 8.00896146137208
epoch 16 -2.132942383272572 8.025515000805749
epoch 17 -2.1213761797716373 8.010686995773131
epoch 18 -2.1026442596571306 7.98661406357633
[32m[I 2022-03-04 10:22:05,904][0m Trial 2 finished with value: 8.062703528715549 and parameters: {'lr': 3.985909510734947e-05, 'weight_decay': 0.053920779176761136, 'criterion': 'PoissonNLLLoss', 'batch_size': 128, 'epochs': 20}. Best is trial 0 with value: 4.214966550070135.[0m
epoch 19 -2.1620444297812447 8.062703528715549

Previous best Test-set performance: 0.1425664535055814

Trial Id: 3 | Model params: 407850 | Timestamp: 2022-03-04 10:22:05.904843

epoch 0 -2.1311960057498207 8.023277881352067
epoch 1 -2.1317215908844793 8.0239512244829
epoch 2 -2.1472409948872904 8.043808201442676
epoch 3 -2.1675935783110987 8.06977514461206
epoch 4 -2.125354498701338 8.015790340859667
epoch 5 -2.1553173037685487 8.054122418880281
epoch 6 -2.147505445412509 8.044146139437268
epoch 7 -2.1336118544233793 8.026372431793753
epoch 8 -2.1619927266058845 8.062637611065155
