[32m[I 2022-03-03 06:37:32,440][0m Trial 1 pruned. [0m
++++++++++++++++++++
        NaN         
++++++++++++++++++++

Previous best Test-set performance: 0.1390606825230084

Trial Id: 2 | Model params: 100568 | Timestamp: 2022-03-03 06:37:32.440237

epoch 0 0.11293579277397803 7.325633518440865
epoch 1 0.10649622631845856 7.352175339828122
epoch 2 0.10087548093870469 7.375264172964448
epoch 3 0.11709716261246772 7.308430419482875
epoch 4 0.11084139375637325 7.33427649711847
epoch 5 0.11564389975773881 7.314442804432755
epoch 6 0.11011966711655408 7.337252495429579
epoch 7 0.11413066846955999 7.32069804082304
epoch 8 0.11763591832926035 7.306200242302247
epoch 9 0.11280869581894504 7.326158301403774
epoch 10 0.08073338147889464 7.457416601587484
epoch 11 0.1157013523667958 7.314205207469162
epoch 12 0.03074852138606421 7.657480445173478
epoch 13 0.10560030368202622 7.355860455734832
epoch 14 0.09253544439168238 7.409390699206892
epoch 15 0.10931160342590618 7.340583067956924
epoch 16 0.11224471454267093 7.328486525123144
epoch 17 0.115501124859691 7.315033220826544
epoch 18 0.1029908241294496 7.36658328313522
epoch 19 0.10733553336015278 7.348721419147085
epoch 20 0.09515405605720861 7.3986925766007925
epoch 21 0.10167232470240262 7.371995306520569
epoch 22 0.10908098574585845 7.341533320973782
epoch 23 0.10137763088424867 7.373204388331231
epoch 24 0.1063096454067537 7.352942938137421
epoch 25 0.11494761839987355 7.3173216832627155
epoch 26 0.09990688845556406 7.379235648791547
epoch 27 0.11421338361540534 7.3203562597498335
epoch 28 0.10245185324177741 7.368796068586074
epoch 29 0.1135084040083485 7.323268741925558
epoch 30 0.11589635880374527 7.313398695018679
epoch 31 0.1168845339945529 7.309310407542562
epoch 32 0.1082816765834197 7.344825898165082
epoch 33 0.11652233787820854 7.310809154055565
epoch 34 0.11551826297744794 7.314962352162072
epoch 35 0.11108898310983162 7.333255298430735
epoch 36 0.10430999674727381 7.361164514478115
epoch 37 0.11208541946378436 7.329143992048426
epoch 38 0.11491450004858517 7.317458587794034
epoch 39 0.11229362072162152 7.328284660253628
epoch 40 0.11233334791492045 7.328120678420587
epoch 41 0.09405013224556902 7.403204451434873
epoch 42 0.0991407096742053 7.382375663448823
epoch 43 0.06479144407529802 7.521801981398323
epoch 44 0.10089440279992501 7.37518656721774
epoch 45 0.11412464439623293 7.3207229318229095
epoch 46 0.10254169651889344 7.368427256418363
epoch 47 0.10080732591528097 7.375543695859522
epoch 48 0.11725464275185327 7.307778601457779
epoch 49 0.11798869770613707 7.304739544558458
epoch 50 0.07144855071236555 7.494982901450072
epoch 51 0.07580193781069933 7.4773926562100215
epoch 52 0.10947658293664397 7.339903199502076
epoch 53 0.11124684714165234 7.33260410352585
epoch 54 0.10551636117700569 7.356205634108969
epoch 55 0.10777817228505959 7.346899215167202
epoch 56 0.10906818658499506 7.341586055917685
epoch 57 0.10812116013334017 7.345486932203318
epoch 58 0.11363542383943881 7.3227440704645606
[32m[I 2022-03-03 07:57:35,385][0m Trial 2 finished with value: 7.31524204008838 and parameters: {'lr': 0.0013895810499373097, 'weight_decay': 0.29646023934140475, 'criterion': 'MSELoss', 'batch_size': 32, 'epochs': 60}. Best is trial 0 with value: 7.249575084721092.[0m
epoch 59 0.11545062528356909 7.31524204008838

Previous best Test-set performance: 0.1390606825230084

Trial Id: 3 | Model params: 100568 | Timestamp: 2022-03-03 07:57:35.386016

epoch 0 0.1286501216945305 7.260456834535231
epoch 1 0.13156669088855044 7.248295603629844
epoch 2 0.1316943419517712 7.2477628703538
epoch 3 0.1298803082445309 7.255329806184346
epoch 4 0.13092676085368626 7.250965669275303
epoch 5 0.11863530366266684 7.3020614869922715
epoch 6 0.11839588273570112 7.303053214721506
epoch 7 0.12667844840344533 7.268666602081838
epoch 8 0.12988778311126625 7.255298642230461
epoch 9 0.12963392208133628 7.256356955875252
epoch 10 0.12803284905676993 7.263028067984406
epoch 11 0.1287538150847788 7.260024813023422
epoch 12 0.1282745333635147 7.262021446604058
epoch 13 0.113820903635108 7.321977855200038
epoch 14 0.12850400099666026 7.261065578836875
epoch 15 0.1282466458391538 7.262137605984543
epoch 16 0.12650551327156245 7.269386237130999
epoch 17 0.11998045982962025 7.296487084174502
epoch 18 0.12333188961529395 7.282580011918946
epoch 19 0.12694587896292042 7.26755360286129
epoch 20 0.12530882854078274 7.274364051087858
epoch 21 0.12466567267720507 7.277037960653648
epoch 22 0.128359254234227 7.261668548958585
epoch 23 0.12742177262598575 7.2655725950056285
epoch 24 0.10886984406826394 7.342403215883763
epoch 25 0.12623046533006388 7.270530647530482
epoch 26 0.1263804219163458 7.269906735448996
epoch 27 0.1253828097022428 7.274056412632762
epoch 28 0.12235837757765589 7.28662242665889
epoch 29 0.12749623767950724 7.265262569624262
epoch 30 0.12532711505546823 7.274288010843799
epoch 31 0.12720128647156226 7.266490482323106
epoch 32 0.1118475661956374 7.330125586539341
epoch 33 0.12184479752509947 7.288754114877083
epoch 34 0.12685341561052288 7.26793843844166
epoch 35 0.1270575839317053 7.267088655844797
epoch 36 0.127083595291817 7.266980385090245
epoch 37 0.12089028518540179 7.29271430107998
epoch 38 0.126414382287536 7.269765431878865
[32m[I 2022-03-03 08:50:49,232][0m Trial 3 finished with value: 7.269109947465629 and parameters: {'lr': 9.324957825294836e-05, 'weight_decay': 0.2851381148435463, 'criterion': 'MSELoss', 'batch_size': 32, 'epochs': 40}. Best is trial 0 with value: 7.249575084721092.[0m
epoch 39 0.12657191032497994 7.269109947465629

Previous best Test-set performance: 0.1390606825230084

Trial Id: 4 | Model params: 100568 | Timestamp: 2022-03-03 08:50:49.233020

epoch 0 -7.850657134348404 23.13957716880394
[32m[I 2022-03-03 08:52:38,095][0m Trial 4 pruned. [0m
++++++++++++++++++++
        NaN         
++++++++++++++++++++

Previous best Test-set performance: 0.1390606825230084

Trial Id: 5 | Model params: 100568 | Timestamp: 2022-03-03 08:52:38.095275

epoch 0 0.14046776538568795 7.21105394629975
epoch 1 0.13946728786573237 7.215249483661805
epoch 2 0.14023773881441115 7.212018786817483
epoch 3 0.1392368444367652 7.216215510582454
epoch 4 0.13932091210818853 7.215863110945217
epoch 5 0.1378330879838141 7.222097315812016
epoch 6 0.13756325339714237 7.223227386545885
epoch 7 0.1366105046847338 7.22721609703634
epoch 8 0.13905320473169647 7.216985242074008
epoch 9 0.13832954713700496 7.220017676376749
epoch 10 0.13739963515361486 7.22391253576607
epoch 11 0.13672199020647968 7.226749473355224
epoch 12 0.13436785409803997 7.2365963414244385
epoch 13 0.13853111103542026 7.2191731655657625
epoch 14 0.1359376709824237 7.230031609379847
epoch 15 0.13681963633256744 7.226340749839757
epoch 16 0.1351237622509066 7.233435993852715
epoch 17 0.13740261906915452 7.223900041241147
epoch 18 0.13596184082022922 7.229930488252639
epoch 19 0.1361673669265061 7.229070556419425
epoch 20 0.13662906303102684 7.227138422996671
epoch 21 0.13723861482201527 7.224586742827282
epoch 22 0.13695373345691053 7.225779413418582
epoch 23 0.13695091768341527 7.2257912008176755
epoch 24 0.13574709752653524 7.2308288760231045
epoch 25 0.1365069262406814 7.227649598574283
epoch 26 0.13589561020204488 7.230207578786672
epoch 27 0.1360130166071568 7.229716375683068
epoch 28 0.13393884056316374 7.238389373962354
epoch 29 0.1358742933481868 7.230296760330946
epoch 30 0.13547277292696946 7.231976362395949
epoch 31 0.13551923394655896 7.231782031032287
epoch 32 0.1362464921303359 7.228739465211183
epoch 33 0.1343733315653277 7.236573445854636
epoch 34 0.13632386506824656 7.228415691512634
epoch 35 0.13668186295122542 7.226917429823309
epoch 36 0.1341266373233544 7.237604544994573
epoch 37 0.13677682650589607 7.226519944462568
epoch 38 0.1357568219285712 7.230788195983362
epoch 39 0.13370201871695486 7.239378964331431
epoch 40 0.13612886030470983 7.2292316778989285
epoch 41 0.13371473230757003 7.239325842403333
epoch 42 0.13329289689296575 7.241088213565592
epoch 43 0.13495019662097552 7.234161769887664
epoch 44 0.13399974011341198 7.238134875534531
epoch 45 0.13496603337747315 7.234095550473291
epoch 46 0.13599603122463866 7.229787440928821
epoch 47 0.13349299893995603 7.240252267828657
epoch 48 0.13520989774330727 7.233075785618503
epoch 49 0.1347264452142518 7.235097293605808
epoch 50 0.13380625358106457 7.238943422289948
epoch 51 0.13613186243006492 7.229219116373502
epoch 52 0.13509383177735623 7.233561155281708
epoch 53 0.13463292030571794 7.2354882933799605
epoch 54 0.13098268605289953 7.250732364298694
epoch 55 0.13129994109241738 7.249408718997509
epoch 56 0.13396246361669928 7.238290654591405
epoch 57 0.13024650569498875 7.253802911146577
epoch 58 0.1343517819250668 7.236663521974988
[32m[I 2022-03-03 09:51:38,994][0m Trial 5 finished with value: 7.2347079252116355 and parameters: {'lr': 1.0262044090988565e-05, 'weight_decay': 0.16341936998024312, 'criterion': 'MSELoss', 'batch_size': 128, 'epochs': 60}. Best is trial 5 with value: 7.2347079252116355.[0m
epoch 59 0.13481957488347218 7.2347079252116355

Previous best Test-set performance: 0.1390606825230084

Trial Id: 6 | Model params: 100568 | Timestamp: 2022-03-03 09:51:38.995109

epoch 0 -41.6801949328261 50.81370447641006
epoch 1 -53.78724241007589 57.57147829354499
epoch 2 -59.10514378308334 60.300856461190776
epoch 3 -52.77630106868695 57.037846960612576
epoch 4 -52.08715962395131 56.67119950796923
epoch 5 -55.27044661318822 58.3455638736404
epoch 6 -52.26749532174985 56.767373196277774
epoch 7 -48.45059062321145 54.69572733036529
epoch 8 -46.5353468362656 53.626072851615724
epoch 9 -53.801544366288454 57.57899218726592
epoch 10 -50.09935759658141 55.60007539665078
epoch 11 -44.34838332706629 52.37795821385329
epoch 12 -42.90139484093297 51.53553866535908
epoch 13 -45.22008684454498 52.87897629758323
epoch 14 -60.965464374365474 61.22693434068909
epoch 15 -48.423165101194996 54.68055797750461
epoch 16 -48.180059329209506 54.54590911024533
epoch 17 -60.544092178443464 61.0184041748511
epoch 18 -54.96584607776198 58.187432855108284
epoch 19 -57.76612069345619 59.62538162316139
[32m[I 2022-03-03 10:10:01,052][0m Trial 6 pruned. [0m
++++++++++++++++++++
        NaN         
++++++++++++++++++++

Previous best Test-set performance: 0.1390606825230084

Trial Id: 7 | Model params: 100568 | Timestamp: 2022-03-03 10:10:01.052797

epoch 0 -45.03434325219163 52.77261757610474
epoch 1 -41.801585948327286 50.88591533948707
epoch 2 -55.43798935625073 58.432359969824724
epoch 3 -44.532826221923365 52.484367068050055
epoch 4 -59.21983577956085 60.35836176817591
epoch 5 -180.1451064641705 104.68415781073475
epoch 6 -113.04879690511963 83.06403317664378
epoch 7 -100.63509665543776 78.41326049343519
epoch 8 -37.20486860828752 48.075854877401184
[32m[I 2022-03-03 10:19:01,329][0m Trial 7 pruned. [0m
++++++++++++++++++++
        NaN         
++++++++++++++++++++

Previous best Test-set performance: 0.1390606825230084

Trial Id: 8 | Model params: 100568 | Timestamp: 2022-03-03 10:19:01.329492

epoch 0 0.13542484486262962 7.232176824459916
epoch 1 0.13729155205660182 7.22436509665922
epoch 2 0.1351351388545805 7.233388419297229
epoch 3 0.1334095657748896 7.240600829710664
epoch 4 0.1348583819100635 7.234545669661783
epoch 5 0.13565591565907753 7.231210305514997
epoch 6 0.1342668398666741 7.23701856343641
epoch 7 0.13012094244917127 7.254326495227431
epoch 8 0.1337340763653031 7.239245015264726
[32m[I 2022-03-03 10:27:40,551][0m Trial 8 finished with value: 7.236680373466198 and parameters: {'lr': 4.083322810334138e-05, 'weight_decay': 0.2781368532702673, 'criterion': 'MSELoss', 'batch_size': 256, 'epochs': 10}. Best is trial 5 with value: 7.2347079252116355.[0m
epoch 9 0.13434775037647306 7.236680373466198

Previous best Test-set performance: 0.1390606825230084

Trial Id: 9 | Model params: 100568 | Timestamp: 2022-03-03 10:27:40.551277

epoch 0 -0.8796358616432429 10.663616586500424
epoch 1 -1.7880553379538684 12.987284522648162
epoch 2 -1.895438349269102 13.235026689548011
epoch 3 -1.9367374708152525 13.329081474502223
epoch 4 -1.9609179630870455 13.38384343849191
epoch 5 -1.9920376320965372 13.453992649977453
epoch 6 -2.0955537298738918 13.684748918412609
epoch 7 -3.0014413332976515 15.558792443235285
epoch 8 -10.06102182764859 25.868144901607014
epoch 9 -24.600215048651222 39.35405308257392
epoch 10 -55.878190664957756 58.65979578109251
epoch 11 -59.03897905154916 60.26765723447545
epoch 12 -72.82378622199683 66.82913162156086
epoch 13 -94.88871455987129 76.16429187910494
epoch 14 -112.96838832327722 83.03474641978168
epoch 15 -114.10871640778268 83.44912088515247
epoch 16 -100.07414172123168 78.1965677940409
epoch 17 -112.93804330354888 83.02369134214236
epoch 18 -103.54492833680197 79.52783229201653
epoch 19 -99.35208189815229 77.91675437676012
epoch 20 -98.48014414441431 77.57751487603115
epoch 21 -95.98835324406797 76.5997677927519
epoch 22 -97.11236452384622 77.04235178333579
epoch 23 -95.05747821456953 76.23128679944247
epoch 24 -96.26490430521199 76.70889774031035
epoch 25 -98.08024973950162 77.42143320801586
epoch 26 -95.28010538450161 76.3195742188822
[32m[I 2022-03-03 10:53:34,219][0m Trial 9 pruned. [0m
++++++++++++++++++++
        NaN         
++++++++++++++++++++

Study statistics: 
  Number of finished trials:  10
  Number of pruned trials:  5
  Number of complete trials:  5

Best trial:
  Value:  7.2347079252116355
  Params: 
    lr: 1.0262044090988565e-05
    weight_decay: 0.16341936998024312
    criterion: MSELoss
    batch_size: 128
    epochs: 60
Target: 72610, NaN: 0, Max: 175.0, Min: 6.0, Mean: 31.337543038149015
Prediction: 72610, NaN: 0, Max: 49.63609313964844, Min: 20.022031784057617, Mean: 31.664461998255877

 XXXXXX======== TRIAL north - elg ended

Test Set - R-squared:  0.13481957488347218
Test Set - RMSE:  7.2347079252116355
Test Set - MAE:  5.695482140023458



[32m[I 2022-03-03 10:55:41,875][0m A new study created in memory with name: DeepSet[0m
Starting Loading north
Finished Loading north
Finished north setup

++++++++ Session Characteristics +++++++

Area: north
Gal Type: qso
Training Set: 290439
Validation Set: 72610
Test Samples: 72610
Number of features: 5
Device: cuda:0
Number of Workers: 8
Number of Trials: 10

+++++++++++++++++++++++++++++++++++++++

Previous best Test-set performance: 0.12876160874765996

Trial Id: 0 | Model params: 161571 | Timestamp: 2022-03-03 10:55:41.876278

epoch 0 -0.9736905943994694 3.4771625269337556
epoch 1 -1.265090335693975 3.7250166512105194
epoch 2 -1.4224988481387362 3.852274664842551
epoch 3 -1.4382127739638721 3.864748666438521
epoch 4 -1.4385564736422398 3.865021051621658
epoch 5 -1.4311756917704934 3.8591674870369483
epoch 6 -1.4408818855437913 3.866863458058383
epoch 7 -1.432047380298723 3.859859269732015
epoch 8 -1.436291008071572 3.863225295238363
epoch 9 -1.433090228146923 3.8606867237031723
epoch 10 -1.4396562418168983 3.86589249914641
epoch 11 -1.430328000815281 3.8584946301560787
epoch 12 -1.437747718373119 3.864380075004415
epoch 13 -1.4376317549733222 3.864288159836637
epoch 14 -1.4328368890196872 3.8604857265402464
epoch 15 -1.4401279639011304 3.866266227766881
epoch 16 -1.4438528979242071 3.8692160924658774
epoch 17 -1.4291910353274782 3.8575919765984334
epoch 18 -1.4428637632652141 3.868432992329535
epoch 19 -1.430142180701234 3.85834711928152
epoch 20 -1.4402481896761214 3.866361472593189
epoch 21 -1.4453161004860196 3.8703742226750957
epoch 22 -1.4305078419419623 3.8586373893195747
epoch 23 -1.4290004527038462 3.857440649590895
epoch 24 -1.4215801693313965 3.851544150835692
epoch 25 -1.4213541486658334 3.8513644027320963
epoch 26 -1.4456869393513117 3.8706676879601365
epoch 27 -1.4370551259736004 3.8638310784085883
epoch 28 -1.4462532494825413 3.871115797530887
epoch 29 -1.4354334937480924 3.8625453554099005
epoch 30 -1.448788350170601 3.8731211351049564
epoch 31 -1.4412885833613989 3.8671855915126754
epoch 32 -1.4306570460752872 3.8587558246116096
epoch 33 -1.4265891551968606 3.855525510676549
epoch 34 -1.4461201467870968 3.871010480766115
epoch 35 -1.4339581160798884 3.8613752194769324
epoch 36 -1.442688237984651 3.8682940120077447
epoch 37 -1.4403367437926633 3.8664316251128725
epoch 38 -1.444973215311252 3.8701028588897683
epoch 39 -1.4324336912749724 3.8601658112095656
epoch 40 -1.4430950749131823 3.868616136482471
epoch 41 -1.4487568129327406 3.8730961946204574
epoch 42 -1.433410249265357 3.860940610847525
epoch 43 -1.431689705790005 3.859575429860676
epoch 44 -1.4301647595624418 3.858365043517072
epoch 45 -1.4277847081249138 3.8564751805420094
epoch 46 -1.426433260432587 3.8554016607258306
epoch 47 -1.4162241404408822 3.84728238792013
epoch 48 -1.4364569076069564 3.8633568263996954
epoch 49 -1.443003890318988 3.8685439408713145
epoch 50 -1.4443892114361678 3.8696406268225356
epoch 51 -1.4327786599323367 3.860439526586049
epoch 52 -1.4342680820432783 3.8616210858248623
epoch 53 -1.441526708034845 3.8673741906520616
epoch 54 -1.4560435943186567 3.8788545126555105
epoch 55 -1.4315182038582224 3.8594393236148923
epoch 56 -1.4388586166816841 3.8652604869289675
epoch 57 -1.4448064773442222 3.8699708934185604
epoch 58 -1.4388297297422818 3.865237595918533
[32m[I 2022-03-03 11:47:34,667][0m Trial 0 finished with value: 3.8609727249702352 and parameters: {'lr': 0.0002984628120619587, 'weight_decay': 0.05107982611163969, 'criterion': 'PoissonNLLLoss', 'batch_size': 128, 'epochs': 60}. Best is trial 0 with value: 3.8609727249702352.[0m
epoch 59 -1.4334507301575674 3.8609727249702352

Previous best Test-set performance: 0.12876160874765996

Trial Id: 1 | Model params: 161571 | Timestamp: 2022-03-03 11:47:34.667872

epoch 0 0.0943352564808666 2.3554244867533454
epoch 1 0.0897553904733025 2.361372562516823
epoch 2 0.09553762604454596 2.353860424921882
epoch 3 0.09212412904330858 2.358298049391783
epoch 4 0.06339535900559068 2.39532036898799
epoch 5 0.0923836910242275 2.3579609062366553
epoch 6 0.09630455800280024 2.352862244297335
epoch 7 0.09797162352572009 2.350691055898381
epoch 8 0.09523347847858887 2.3542561631875634
epoch 9 0.09075619868285378 2.360074048369005
epoch 10 0.08887095581548954 2.3625194919484938
epoch 11 0.09426313518910434 2.3555182702841835
epoch 12 0.09878417248020432 2.3496320637712924
epoch 13 0.09307899595067093 2.3570575421525315
epoch 14 0.08977470264830512 2.3613475123920633
epoch 15 0.08076551882484151 2.373004753765801
epoch 16 0.04375510646539027 2.420304561830411
epoch 17 0.0983305699902266 2.3502233011006997
epoch 18 0.09155936975897183 2.359031444615483
epoch 19 0.08880840907263732 2.362600581100575
epoch 20 0.08701584110031069 2.364923386372798
epoch 21 0.0975180346533987 2.351282009201486
epoch 22 0.09591185624474818 2.3533734080922906
epoch 23 0.09938923630175012 2.3488431761285824
epoch 24 0.09482768742877223 2.354784050196737
epoch 25 0.08900109540941725 2.362350762662086
epoch 26 0.07621129567485196 2.378875856714627
epoch 27 0.09425630034668608 2.3555271578355486
epoch 28 0.09699464377741496 2.3519637187664983
epoch 29 0.0830356306453941 2.3700727944849906
epoch 30 0.09810943596515376 2.350511479040461
epoch 31 0.059926722554773826 2.399751703693027
epoch 32 0.09549649648572889 2.3539139440858543
epoch 33 0.09318448486072028 2.3569204570808315
epoch 34 0.0849028333422227 2.367658490501331
epoch 35 0.08749396952651534 2.364304051871809
epoch 36 0.05314861066724719 2.408387504376908
epoch 37 0.09504402777080045 2.354502631276439
epoch 38 0.07547682021067259 2.3798213536598385
epoch 39 0.09319858351079136 2.35690213498258
epoch 40 0.09585704102517967 2.3534447499883773
epoch 41 0.1000510383866633 2.34798000912619
epoch 42 0.09216344057775439 2.3582469910249015
epoch 43 0.051105933741404375 2.410983955737769
epoch 44 0.09304218034266765 2.3571053829377218
epoch 45 0.09742105081987806 2.351408344256164
epoch 46 0.09512285565344103 2.3544000823653675
epoch 47 0.10154651465663711 2.346028338264091
epoch 48 0.09849748660723678 2.3500057549211033
epoch 49 0.08968634754647176 2.3614621170057233
epoch 50 0.08980859456410462 2.361303550014678
epoch 51 0.08564787265505402 2.366694462903267
epoch 52 0.09258450503804583 2.357700037307879
epoch 53 0.09336563256833585 2.35668503319636
epoch 54 0.08888380727885581 2.3625028302363242
epoch 55 0.09661393552026432 2.3524594620338277
epoch 56 0.09310115933899432 2.357028741021815
epoch 57 0.09095927415578142 2.359810477742138
epoch 58 0.09003135463107081 2.361014579847929
[32m[I 2022-03-03 13:16:09,769][0m Trial 1 finished with value: 2.352849042238151 and parameters: {'lr': 0.0007769664639854358, 'weight_decay': 0.14360729700165992, 'criterion': 'MSELoss', 'batch_size': 32, 'epochs': 60}. Best is trial 1 with value: 2.352849042238151.[0m
epoch 59 0.09631469935915571 2.352849042238151

Previous best Test-set performance: 0.12876160874765996

Trial Id: 2 | Model params: 161571 | Timestamp: 2022-03-03 13:16:09.769184

epoch 0 -1.4081310922309687 3.840833822680919
epoch 1 -1.4902089685684117 3.905740196379451
epoch 2 -1.4661353378584696 3.8868153397610357
epoch 3 -1.4092442136798082 3.841721403217513
epoch 4 -1.4354426112100356 3.8625525854528093
epoch 5 -1.4277199059666268 3.85642371189615
epoch 6 -1.3968308586716875 3.8318116070894166
epoch 7 -1.4234096682151836 3.852998793021843
epoch 8 -1.421864328527326 3.8517701230330514
epoch 9 -1.459019018931424 3.8812033605873464
epoch 10 -1.4443351472618127 3.869597832884202
epoch 11 -1.4678825185871767 3.888191940303065
epoch 12 -1.4245879069777772 3.853935324910705
epoch 13 -1.4303539221253208 3.858515207001853
epoch 14 -1.4692277686100423 3.8892515283606164
epoch 15 -1.4408045304138377 3.8668021842833142
epoch 16 -1.3978488478820248 3.8326252499800018
epoch 17 -1.4661658972867961 3.886839421668668
epoch 18 -1.4200310021614744 3.8503119718630816
