[32m[I 2022-03-03 14:10:03,082][0m Trial 2 finished with value: 3.857544612170012 and parameters: {'lr': 0.0033545389699807626, 'weight_decay': 0.061144626306941126, 'criterion': 'PoissonNLLLoss', 'batch_size': 32, 'epochs': 20}. Best is trial 1 with value: 2.352849042238151.[0m
epoch 19 -1.429131383327337 3.857544612170012

Previous best Test-set performance: 0.12876160874765996

Trial Id: 3 | Model params: 161571 | Timestamp: 2022-03-03 14:10:03.082345

epoch 0 0.12756561206710615 2.3118084275387565
epoch 1 0.12823908556642405 2.3109159579626426
epoch 2 0.12791085980429495 2.311350957259291
epoch 3 0.1277336853359794 2.311585733477082
epoch 4 0.12759639591824767 2.311767641093797
epoch 5 0.12757709164833364 2.3117932179824314
epoch 6 0.12691089837640313 2.3126757069537556
epoch 7 0.12636171310037658 2.3134029453199276
epoch 8 0.12762241653220563 2.3117331650430244
epoch 9 0.12756797745709425 2.311805293588346
epoch 10 0.12586254876648328 2.3140637470251475
epoch 11 0.12775579346316668 2.3115564390091166
epoch 12 0.1279649794771226 2.311279237814238
epoch 13 0.12695921850483394 2.3126117098581753
epoch 14 0.12762500144876976 2.3117297401259416
epoch 15 0.12790539405216117 2.311358200355811
epoch 16 0.1276092154305909 2.3117506559262995
epoch 17 0.12805088932981612 2.311165385420227
epoch 18 0.12787073743315291 2.3114041260295783
[32m[I 2022-03-03 14:42:28,384][0m Trial 3 finished with value: 2.3114661523520046 and parameters: {'lr': 8.727813952437168e-05, 'weight_decay': 0.02347448384944235, 'criterion': 'MSELoss', 'batch_size': 128, 'epochs': 20}. Best is trial 3 with value: 2.3114661523520046.[0m
epoch 19 0.127823929784032 2.3114661523520046

Previous best Test-set performance: 0.12876160874765996

Trial Id: 4 | Model params: 161571 | Timestamp: 2022-03-03 14:42:28.384991

epoch 0 -0.7186986201238608 3.2447804675511978
epoch 1 -0.7296674164753725 3.255118152683373
epoch 2 -0.7455200157575199 3.2700008946449586
epoch 3 -0.7648201650050332 3.288029335227564
epoch 4 -0.7858282270481212 3.307541457775252
epoch 5 -0.8077778097819064 3.327805847019299
epoch 6 -0.8302794228500268 3.348452583877153
epoch 7 -0.8534680062669495 3.3695973021870236
epoch 8 -0.8764932904736171 3.3904626372204123
[32m[I 2022-03-03 14:56:47,002][0m Trial 4 finished with value: 3.411475358310023 and parameters: {'lr': 2.854108765005849e-05, 'weight_decay': 0.236718067198466, 'criterion': 'PoissonNLLLoss', 'batch_size': 256, 'epochs': 10}. Best is trial 3 with value: 2.3114661523520046.[0m
epoch 9 -0.8998248653703127 3.411475358310023

Previous best Test-set performance: 0.12876160874765996

Trial Id: 5 | Model params: 161571 | Timestamp: 2022-03-03 14:56:47.002724

[32m[I 2022-03-03 14:58:11,829][0m Trial 5 pruned. [0m
epoch 0 0.0911842827910726 2.3595184057912144

Previous best Test-set performance: 0.12876160874765996

Trial Id: 6 | Model params: 161571 | Timestamp: 2022-03-03 14:58:11.829303

[32m[I 2022-03-03 14:59:49,851][0m Trial 6 pruned. [0m
epoch 0 0.1011198057173045 2.3465853801404526

Previous best Test-set performance: 0.12876160874765996

Trial Id: 7 | Model params: 161571 | Timestamp: 2022-03-03 14:59:49.851479

epoch 0 -1.2236119739546583 3.690752791318115
epoch 1 -1.4807934702794823 3.89834938749025
epoch 2 -1.4898244671352803 3.905438651268899
epoch 3 -1.5022171103929134 3.915145888486529
epoch 4 -1.486318506292688 3.9026880279513283
epoch 5 -1.504192277468154 3.9166908267268985
epoch 6 -1.456850618604562 3.8794917311267496
epoch 7 -1.4671000963454133 3.887575531499867
epoch 8 -1.4810208858986487 3.8985280652467247
epoch 9 -1.4656014157369062 3.8863945662137156
epoch 10 -1.4900662151513884 3.9056282447808246
epoch 11 -1.484964278969802 3.9016250413292255
epoch 12 -1.481936351718519 3.8992472530710285
epoch 13 -1.492116805428152 3.907236072535755
epoch 14 -1.4837927729379086 3.900705246194728
epoch 15 -1.4946938913041192 3.909255777444977
epoch 16 -1.4885688923787814 3.9044538050276625
epoch 17 -1.4662861552289086 3.8869341877208163
epoch 18 -1.4771262872323865 3.895466993602085
epoch 19 -1.4569280544691905 3.879552868223804
epoch 20 -1.4773129103704639 3.8956137302836984
epoch 21 -1.4687147639125548 3.888847493550546
epoch 22 -1.4720267029304157 3.891455188275144
epoch 23 -1.4795397157259051 3.897364180330405
epoch 24 -1.482431252479235 3.899635990727807
epoch 25 -1.4650140737991544 3.8859316409297198
epoch 26 -1.4741372419939602 3.8931160352053005
epoch 27 -1.467040358431417 3.8875284646907526
epoch 28 -1.4901160722399336 3.9056673446002077
epoch 29 -1.4768425115285155 3.8952438579156117
epoch 30 -1.4747129570742294 3.893568959805134
epoch 31 -1.458050873131834 3.880439246803524
epoch 32 -1.4892972987320365 3.9050251817904833
epoch 33 -1.4749272706268486 3.8937375503740985
epoch 34 -1.4815108265963555 3.8989129780226732
epoch 35 -1.4826911671014416 3.8998401345253395
epoch 36 -1.4672063908363775 3.8876592782866215
epoch 37 -1.471815521824385 3.8912889644714546
epoch 38 -1.4712760094627813 3.8908642739859585
epoch 39 -1.4731445671828172 3.892334957689412
epoch 40 -1.4797571920002897 3.8975350922243037
epoch 41 -1.461650758871353 3.883279714275464
epoch 42 -1.4827586125696857 3.899893106228203
epoch 43 -1.4817052308789345 3.899065697593313
epoch 44 -1.4838036854569179 3.9007138150402976
epoch 45 -1.484719541307146 3.901432906151832
epoch 46 -1.4823889129502286 3.8996027351331164
epoch 47 -1.4867966369686827 3.9030632624916772
epoch 48 -1.4648902537765536 3.885834042666265
epoch 49 -1.4704696714095293 3.890229458637348
epoch 50 -1.4539727675515492 3.87721892898113
epoch 51 -1.490849444066562 3.9062424373767546
epoch 52 -1.479026085228082 3.8969604947654144
epoch 53 -1.4984060326798612 3.9121632114538802
epoch 54 -1.4607790699896577 3.8825921042526392
epoch 55 -1.4753196732343317 3.894046216456425
epoch 56 -1.4771169212625974 3.895459629249922
epoch 57 -1.47047013865242 3.8902298265192115
epoch 58 -1.477056277326803 3.8954119452977642
[32m[I 2022-03-03 16:41:37,862][0m Trial 7 finished with value: 3.8918140531209238 and parameters: {'lr': 0.0006289870034782976, 'weight_decay': 0.22948559216597503, 'criterion': 'PoissonNLLLoss', 'batch_size': 128, 'epochs': 60}. Best is trial 3 with value: 2.3114661523520046.[0m
epoch 59 -1.472482658013162 3.8918140531209238

Previous best Test-set performance: 0.12876160874765996

Trial Id: 8 | Model params: 161571 | Timestamp: 2022-03-03 16:41:37.862539

[32m[I 2022-03-03 16:42:25,716][0m Trial 8 pruned. [0m
epoch 0 -0.716113650693714 3.2423394303593462

Previous best Test-set performance: 0.12876160874765996

Trial Id: 9 | Model params: 161571 | Timestamp: 2022-03-03 16:42:25.716731

epoch 0 -1.5108619488771668 3.921903219989077
epoch 1 -1.4730190010984914 3.8922361459438743
epoch 2 -1.4740243813301666 3.893027239672191
epoch 3 -1.4736986885122634 3.8927709825485026
epoch 4 -1.4865018334808657 3.902831906467397
epoch 5 -1.5061378869019197 3.918212049982067
epoch 6 -1.4900368186740276 3.9056051907651455
epoch 7 -1.4984857443426516 3.9122256197540723
epoch 8 -1.4924791252566005 3.9075200916574544
[32m[I 2022-03-03 17:11:29,520][0m Trial 9 finished with value: 3.8738621564560543 and parameters: {'lr': 0.00038202644392377485, 'weight_decay': 0.26595950122903533, 'criterion': 'PoissonNLLLoss', 'batch_size': 32, 'epochs': 10}. Best is trial 3 with value: 2.3114661523520046.[0m
epoch 9 -1.4497254641813733 3.8738621564560543

Study statistics: 
  Number of finished trials:  10
  Number of pruned trials:  3
  Number of complete trials:  7

Best trial:
  Value:  2.3114661523520046
  Params: 
    lr: 8.727813952437168e-05
    weight_decay: 0.02347448384944235
    criterion: MSELoss
    batch_size: 128
    epochs: 20
Target: 72610, NaN: 0, Max: 64.0, Min: 0.0, Mean: 4.437694532433549
Prediction: 72610, NaN: 0, Max: 8.02098274230957, Min: 3.145054817199707, Mean: 4.416496503298941

 XXXXXX======== TRIAL north - qso ended

Test Set - R-squared:  0.127823929784032
Test Set - RMSE:  2.3114661523520046
Test Set - MAE:  1.7963615099599974



[32m[I 2022-03-03 17:12:08,576][0m A new study created in memory with name: DeepSet[0m
Starting Loading north
Finished Loading north
Finished north setup

++++++++ Session Characteristics +++++++

Area: north
Gal Type: glbg
Training Set: 290439
Validation Set: 72610
Test Samples: 72610
Number of features: 5
Device: cuda:0
Number of Workers: 8
Number of Trials: 10

+++++++++++++++++++++++++++++++++++++++

Previous best Test-set performance: 0.20492117730992876

Trial Id: 0 | Model params: 96441 | Timestamp: 2022-03-03 17:12:08.577299

epoch 0 0.20072626143373307 10.101767452537496
epoch 1 0.2082264650625778 10.054259390382482
epoch 2 0.20714894490769442 10.061098456917552
epoch 3 0.2058462658668726 10.069360414111593
epoch 4 0.20057086778455335 10.102749390353123
epoch 5 0.20535058475950974 10.072502383304775
epoch 6 0.20656261703025902 10.064817952681937
epoch 7 0.20284554936442956 10.088366058910433
epoch 8 0.20447033479692367 10.078079601183838
epoch 9 0.19410491734185065 10.143523686320362
epoch 10 0.2073070243015359 10.06009541125115
epoch 11 0.20719548095610996 10.060803186682143
epoch 12 0.20087782665105658 10.100809614755331
epoch 13 0.20688387259640428 10.062780169854568
epoch 14 0.202792569681707 10.088701294793745
epoch 15 0.20221684160006081 10.092343571653313
epoch 16 0.20260239412386272 10.0899045638015
epoch 17 0.20402544863542593 10.080897202887913
epoch 18 0.20756801019566062 10.058439184174507
[32m[I 2022-03-03 17:27:52,571][0m Trial 0 finished with value: 10.076560350065778 and parameters: {'lr': 0.0007438710379560334, 'weight_decay': 0.1861564493014536, 'criterion': 'MSELoss', 'batch_size': 256, 'epochs': 20}. Best is trial 0 with value: 10.076560350065778.[0m
epoch 19 0.2047101658527135 10.076560350065778

Previous best Test-set performance: 0.20492117730992876

Trial Id: 1 | Model params: 96441 | Timestamp: 2022-03-03 17:27:52.571248

epoch 0 -6.554139169862663 31.055754545335883
epoch 1 -6.570538195041455 31.08944521425177
epoch 2 -6.584546489730979 31.118195404897076
epoch 3 -6.580737468991092 31.110380518585366
epoch 4 -6.582611464340385 31.114225600019413
epoch 5 -6.593173737480113 31.13588849188626
epoch 6 -6.592504174932384 31.134515687500077
epoch 7 -6.593418251640075 31.136389804288292
epoch 8 -6.594720789807185 31.139060182483064
epoch 9 -6.594301590717623 31.13820079303547
epoch 10 -6.5974357057767214 31.144625388910427
epoch 11 -6.582065328639422 31.113105082670565
epoch 12 -6.583460640843579 31.115967791988854
epoch 13 -6.5991098344778525 31.14805662816396
epoch 14 -6.598109998298984 31.146007442203004
epoch 15 -6.572418991812145 31.09330684835269
epoch 16 -6.596545549578925 31.142800800029388
epoch 17 -6.6106389250508535 31.17167601717292
epoch 18 -6.628407944375503 31.208044001231414
[32m[I 2022-03-03 17:40:19,483][0m Trial 1 finished with value: 31.288455236017374 and parameters: {'lr': 0.00023227024764663808, 'weight_decay': 0.16696121597101163, 'criterion': 'PoissonNLLLoss', 'batch_size': 128, 'epochs': 20}. Best is trial 0 with value: 10.076560350065778.[0m
epoch 19 -6.667769588683504 31.288455236017374

Previous best Test-set performance: 0.20492117730992876

Trial Id: 2 | Model params: 96441 | Timestamp: 2022-03-03 17:40:19.483473

epoch 0 0.20811831830571137 10.054946012485317
epoch 1 0.20371571213292816 10.082858395076437
epoch 2 0.2078621065395414 10.056572509971687
epoch 3 0.20545029812417548 10.071870409887902
epoch 4 0.20857220115241737 10.052064002605364
epoch 5 0.2083742469027965 10.053321049918159
epoch 6 0.2030075138795242 10.08734113813119
epoch 7 0.20533603987681048 10.072594564015203
epoch 8 0.2033066064992386 10.085448189044707
[32m[I 2022-03-03 18:01:48,136][0m Trial 2 finished with value: 10.051557180572061 and parameters: {'lr': 4.1463279632585864e-05, 'weight_decay': 0.23221605867432982, 'criterion': 'MSELoss', 'batch_size': 32, 'epochs': 10}. Best is trial 2 with value: 10.051557180572061.[0m
epoch 9 0.20865200624202307 10.051557180572061

Previous best Test-set performance: 0.20492117730992876

Trial Id: 3 | Model params: 96441 | Timestamp: 2022-03-03 18:01:48.136556

epoch 0 -6.633905587810908 31.219287487337137
epoch 1 -6.624702446498143 31.200463429489005
epoch 2 -6.554893002220474 31.057304043440816
epoch 3 -6.558595513055644 31.064913411273047
epoch 4 -6.581007585779157 31.110934776085976
epoch 5 -6.4875835156637525 30.918643693949246
epoch 6 -6.058045772335849 30.0186965013476
epoch 7 -6.082522873434731 30.0707034416615
epoch 8 -5.8937293895844824 29.667210317306683
epoch 9 -6.041384361470644 29.983244099208722
epoch 10 -5.924547710395447 29.733449793576057
epoch 11 -5.889583745281639 29.658288571872948
epoch 12 -5.854532614820224 29.582748295809388
epoch 13 -5.825779933913627 29.52063777491144
epoch 14 -5.8457977966606745 29.5638934508024
epoch 15 -5.862668736450436 29.600300000031023
[32m[I 2022-03-03 18:26:05,603][0m Trial 3 pruned. [0m
++++++++++++++++++++
        NaN         
++++++++++++++++++++

Previous best Test-set performance: 0.20492117730992876

Trial Id: 4 | Model params: 96441 | Timestamp: 2022-03-03 18:26:05.604161

epoch 0 0.2082804926605374 10.053916352425874
epoch 1 0.20673345136341992 10.063734370623836
epoch 2 0.20943107804704297 10.046608148567131
epoch 3 0.2087889208715017 10.050687610693252
epoch 4 0.20529933224050456 10.072827201259834
epoch 5 0.2073664760529743 10.059718152006559
epoch 6 0.20915036154068645 10.048391673286922
epoch 7 0.20736983153987365 10.059696858882324
epoch 8 0.21003927931382016 10.042742871744103
[32m[I 2022-03-03 18:30:26,109][0m Trial 4 finished with value: 10.04913396362203 and parameters: {'lr': 1.7932792679176954e-05, 'weight_decay': 0.06267986039273248, 'criterion': 'MSELoss', 'batch_size': 128, 'epochs': 10}. Best is trial 4 with value: 10.04913396362203.[0m
epoch 9 0.20903351463721753 10.04913396362203

Previous best Test-set performance: 0.20492117730992876

Trial Id: 5 | Model params: 96441 | Timestamp: 2022-03-03 18:30:26.109503

epoch 0 0.20615050751018993 10.067431434813326
epoch 1 0.20642202744567717 10.065709608362178
epoch 2 0.2079924896299754 10.055744837811766
epoch 3 0.20682600039502852 10.063147294287745
[32m[I 2022-03-03 18:32:35,168][0m Trial 5 finished with value: 10.045511029638535 and parameters: {'lr': 3.448829504175935e-05, 'weight_decay': 0.1938595380383327, 'criterion': 'MSELoss', 'batch_size': 128, 'epochs': 5}. Best is trial 5 with value: 10.045511029638535.[0m
epoch 4 0.2096037334860399 10.045511029638535

Previous best Test-set performance: 0.20492117730992876

Trial Id: 6 | Model params: 96441 | Timestamp: 2022-03-03 18:32:35.168384

epoch 0 0.2055164139879967 10.071451352235284
epoch 1 0.20223042950115966 10.092257624520446
epoch 2 0.20399146140737956 10.081112422139737
epoch 3 0.20318876071187764 10.086194074252449
[32m[I 2022-03-03 18:34:45,262][0m Trial 6 finished with value: 10.124757680275819 and parameters: {'lr': 0.0009486807281701121, 'weight_decay': 0.2033505424291079, 'criterion': 'MSELoss', 'batch_size': 128, 'epochs': 5}. Best is trial 5 with value: 10.045511029638535.[0m
epoch 4 0.19708404824781034 10.124757680275819

Previous best Test-set performance: 0.20492117730992876

Trial Id: 7 | Model params: 96441 | Timestamp: 2022-03-03 18:34:45.263019

epoch 0 -0.5147511449334734 13.906576829034627
epoch 1 -0.8512531025862684 15.373844867841903
epoch 2 -1.1756640092601756 16.666542285041277
epoch 3 -1.3935627233924346 17.48123057308267
epoch 4 -1.60383912551992 18.232938579291915
epoch 5 -1.7980565927971446 18.900697953739638
epoch 6 -1.9731272034024019 19.483022858345674
epoch 7 -2.1206523565534328 19.960540174255353
epoch 8 -2.227969397436095 20.300853592608885
[32m[I 2022-03-03 18:49:02,599][0m Trial 7 finished with value: 20.56463762871261 and parameters: {'lr': 1.138518451189119e-05, 'weight_decay': 0.20612376737698734, 'criterion': 'PoissonNLLLoss', 'batch_size': 32, 'epochs': 10}. Best is trial 5 with value: 10.045511029638535.[0m
epoch 9 -2.31240119648959 20.56463762871261

Previous best Test-set performance: 0.20492117730992876

Trial Id: 8 | Model params: 96441 | Timestamp: 2022-03-03 18:49:02.599346

epoch 0 -7.396353157063421 32.741226427879155
epoch 1 -7.396353157063421 32.741226427879155
epoch 2 -7.396353157063421 32.741226427879155
epoch 3 -7.396353157063421 32.741226427879155
epoch 4 -7.396353157063421 32.741226427879155
epoch 5 -7.396353157063421 32.741226427879155
epoch 6 -7.396353157063421 32.741226427879155
epoch 7 -7.396353157063421 32.741226427879155
epoch 8 -7.396353157063421 32.741226427879155
epoch 9 -7.396353157063421 32.741226427879155
epoch 10 -7.396353157063421 32.741226427879155
epoch 11 -7.396353157063421 32.741226427879155
epoch 12 -6.568640998799847 31.085549422904684
[32m[I 2022-03-03 18:55:12,328][0m Trial 8 pruned. [0m
++++++++++++++++++++
        NaN         
++++++++++++++++++++

Previous best Test-set performance: 0.20492117730992876

Trial Id: 9 | Model params: 96441 | Timestamp: 2022-03-03 18:55:12.328415

epoch 0 0.026963581453495644 11.145874337631628
epoch 1 -0.16170378212820835 12.178598033336879
epoch 2 -0.27186371512331053 12.742947197103842
epoch 3 -0.32817814584856264 13.02200206076585
[32m[I 2022-03-03 18:56:55,682][0m Trial 9 finished with value: 13.254855456044176 and parameters: {'lr': 1.4525292047432054e-05, 'weight_decay': 0.23606181181840127, 'criterion': 'PoissonNLLLoss', 'batch_size': 256, 'epochs': 5}. Best is trial 5 with value: 10.045511029638535.[0m
epoch 4 -0.37610255988090024 13.254855456044176

Study statistics: 
  Number of finished trials:  10
  Number of pruned trials:  2
  Number of complete trials:  8

Best trial:
  Value:  10.045511029638535
  Params: 
    lr: 3.448829504175935e-05
    weight_decay: 0.1938595380383327
    criterion: MSELoss
    batch_size: 128
    epochs: 5
Target: 72610, NaN: 0, Max: 135.0, Min: 0.0, Mean: 30.72970665197631
Prediction: 72610, NaN: 0, Max: 55.812042236328125, Min: 12.26174545288086, Mean: 30.394357941922628

 XXXXXX======== TRIAL north - glbg ended

Test Set - R-squared:  0.2096037334860399
Test Set - RMSE:  10.045511029638535
Test Set - MAE:  7.7638916794614445



[32m[I 2022-03-03 18:57:25,981][0m A new study created in memory with name: DeepSet[0m
Starting Loading north
Finished Loading north
Finished north setup

++++++++ Session Characteristics +++++++

Area: north
Gal Type: rlbg
Training Set: 290439
Validation Set: 72610
Test Samples: 72610
Number of features: 5
Device: cuda:0
Number of Workers: 8
Number of Trials: 10

+++++++++++++++++++++++++++++++++++++++

Previous best Test-set performance: 0.2756196891324698

Trial Id: 0 | Model params: 222860 | Timestamp: 2022-03-03 18:57:25.981846

epoch 0 0.25322721262732684 8.456454608919138
epoch 1 0.2525737866148827 8.460153497856341
epoch 2 0.22551877542973098 8.611910884226475
epoch 3 0.24259193936667678 8.516458639264231
[32m[I 2022-03-03 19:04:10,388][0m Trial 0 finished with value: 8.437726019139376 and parameters: {'lr': 0.00047590743739445813, 'weight_decay': 0.03704408237013239, 'criterion': 'MSELoss', 'batch_size': 32, 'epochs': 5}. Best is trial 0 with value: 8.437726019139376.[0m
epoch 4 0.25653131922402794 8.437726019139376

Previous best Test-set performance: 0.2756196891324698

Trial Id: 1 | Model params: 222860 | Timestamp: 2022-03-03 19:04:10.388503

epoch 0 -62.67348570489876 78.0860389150496
epoch 1 -106.68221888277681 101.54676164723017
epoch 2 -46.211448831758396 67.23845789144984
epoch 3 -50.42466490861894 70.1745789337215
epoch 4 -168.6895823861231 127.4740167034339
epoch 5 -40.23433952105243 62.83818051120998
epoch 6 -18.18791998819987 42.86551339886533
epoch 7 -18.093639106282556 42.76007270881208
epoch 8 -23.15895381521223 48.098678233805444
epoch 9 -11.659264255555028 34.817558424832086
epoch 10 -34.711495307404206 58.47875228622943
epoch 11 -28.477559378553792 53.1300031481142
epoch 12 -9.040321941140615 31.0075819030374
epoch 13 -7.627009324223286 28.742478417516246
epoch 14 -7.400154767129456 28.362056906366686
[32m[I 2022-03-03 19:20:19,713][0m Trial 1 pruned. [0m
++++++++++++++++++++
        NaN         
++++++++++++++++++++

Previous best Test-set performance: 0.2756196891324698

Trial Id: 2 | Model params: 222860 | Timestamp: 2022-03-03 19:20:19.713951

epoch 0 0.28310839292234036 8.285540188858786
epoch 1 0.2827618540281629 8.287542524361612
epoch 2 0.28277239698722756 8.287481613251988
epoch 3 0.2818981651518615 8.292530898708936
epoch 4 0.28241749838741514 8.28953176571059
epoch 5 0.2801704565672134 8.302500563847815
epoch 6 0.2800149752434229 8.303397174782203
epoch 7 0.2799795458215648 8.303601471352433
epoch 8 0.27971083664106255 8.305150764708184
epoch 9 0.27819485010449174 8.31388606128622
epoch 10 0.278525935120169 8.311979093167587
epoch 11 0.27588149342635104 8.327198239962785
epoch 12 0.27631735186998985 8.32469172621082
epoch 13 0.27701238305211195 8.320693212341565
epoch 14 0.2777829769880882 8.316257738612553
epoch 15 0.274755054110398 8.333672621105096
epoch 16 0.2737629342330141 8.33937081771083
epoch 17 0.2747521093036138 8.333689540237659
epoch 18 0.2753751940041682 8.330108895412268
[32m[I 2022-03-03 19:39:09,267][0m Trial 2 finished with value: 8.339882551923797 and parameters: {'lr': 1.6686454260888344e-05, 'weight_decay': 0.08518558595227728, 'criterion': 'MSELoss', 'batch_size': 128, 'epochs': 20}. Best is trial 2 with value: 8.339882551923797.[0m
epoch 19 0.2736738023874574 8.339882551923797

Previous best Test-set performance: 0.2756196891324698

Trial Id: 3 | Model params: 222860 | Timestamp: 2022-03-03 19:39:09.267667

epoch 0 -459.350149005146 209.96080259882584
