./hp_optim.sh: line 2: 0: command not found
./hp_optim.sh: line 2: 95: command not found
./hp_optim.sh: line 2: 0c#!/bin/bash: No such file or directory
[32m[I 2022-03-02 19:46:43,174][0m A new study created in memory with name: DeepSet[0m
Starting Loading north
Finished Loading north
Finished north setup

++++++++ Session Characteristics +++++++

Area: north
Gal Type: lrg
Training Set: 290439
Validation Set: 72610
Test Samples: 72610
Number of features: 5
Device: cuda:0
Number of Workers: 8
Number of Trials: 10

+++++++++++++++++++++++++++++++++++++++

Previous best Test-set performance: 0.009440638187017236

Trial Id: 0 | Model params: 525502 | Timestamp: 2022-03-02 19:46:43.175422

epoch 0 -1.671021020095906 7.958601939569409
epoch 1 -1.7127596463604964 8.020543318228496
epoch 2 -1.7164264536817564 8.02596212772181
epoch 3 -1.7189249928714014 8.029652375221266
epoch 4 -1.6717128457758368 7.959632558324473
epoch 5 -1.6608679870669354 7.943461496713277
epoch 6 -1.6882690791739234 7.984256837608561
epoch 7 -1.668697196360879 7.955139141581822
epoch 8 -1.7219505920076936 8.03411880118489
epoch 9 -1.6982477458750598 7.999061613089327
epoch 10 -1.689594195046427 7.98622441631438
epoch 11 -1.7008360788857528 8.002897300977969
epoch 12 -1.691111851052343 7.988477290032237
epoch 13 -1.7079622378801127 8.013448172650326
epoch 14 -1.6996708553364979 8.001170767020982
epoch 15 -1.695308966708013 7.994704363110631
epoch 16 -1.7008787321604815 8.002960494081798
epoch 17 -1.7087516533476204 8.01461611341505
epoch 18 -1.7175399136854175 8.027606875405192
[32m[I 2022-03-02 20:29:58,961][0m Trial 0 finished with value: 7.997349939629155 and parameters: {'lr': 0.001292416624310243, 'weight_decay': 0.032386600239261897, 'criterion': 'PoissonNLLLoss', 'batch_size': 32, 'epochs': 20}. Best is trial 0 with value: 7.997349939629155.[0m
epoch 19 -1.6970931042098965 7.997349939629155

Previous best Test-set performance: 0.009440638187017236

Trial Id: 1 | Model params: 525502 | Timestamp: 2022-03-02 20:29:58.961919

epoch 0 -1.7417278511196521 8.063253288601647
epoch 1 -1.71300787293151 8.020910263089707
epoch 2 -1.7046509498364713 8.008547263879617
epoch 3 -1.6834045577493688 7.977029663982869
epoch 4 -1.6889730287342481 7.985302147067242
epoch 5 -1.6964022337189086 7.9963255984714525
epoch 6 -1.7099885047104788 8.016445693753298
epoch 7 -1.6908447772033988 7.988080880215068
epoch 8 -1.6905384006500634 7.9876261103271915
epoch 9 -1.70884419891278 8.014753023500859
epoch 10 -1.6917338271700997 7.989400394553478
epoch 11 -1.7009041455933884 8.00299814520229
epoch 12 -1.69906107887144 8.000267101088957
epoch 13 -1.6985629483272784 7.9995288144814864
epoch 14 -1.6996321746180563 8.001113446673646
epoch 15 -1.7087183733974163 8.01456687914064
epoch 16 -1.699636132031085 8.001119311120531
epoch 17 -1.6917068266515294 7.989360324006289
epoch 18 -1.7054689963524168 8.00975830164444
epoch 19 -1.697260853727271 7.997598639003173
epoch 20 -1.7025580869563055 8.005448151417442
epoch 21 -1.6942212183017173 7.993090985089699
epoch 22 -1.7000188739362034 8.00168647183483
epoch 23 -1.6960871637756174 7.995858406406674
epoch 24 -1.6990178102170348 8.000202974681741
epoch 25 -1.699396780660095 8.000764611221582
epoch 26 -1.7049097063660237 8.008930347385343
epoch 27 -1.7031029343361404 8.006255077206776
epoch 28 -1.7039667675828412 8.007534258397756
epoch 29 -1.7012423283397604 8.003499160979093
epoch 30 -1.7028439165158225 8.0058714787146
epoch 31 -1.6977425896768703 7.998312800326991
epoch 32 -1.6975450900826523 7.998020019901781
epoch 33 -1.7044286164763913 8.008218089459415
epoch 34 -1.6926614003230291 7.990776852157054
epoch 35 -1.7027581779065004 8.005744498069062
epoch 36 -1.6986988644819805 7.999730264573021
epoch 37 -1.6968955148423457 7.997056990850987
epoch 38 -1.7002169004201795 8.001979898817984
epoch 39 -1.6994972423563581 8.00091348946575
epoch 40 -1.6977679796699472 7.998350438578615
epoch 41 -1.6983865844845316 7.999267406702473
epoch 42 -1.696182426444396 7.995999666691736
epoch 43 -1.7000214273958028 8.001690255508066
epoch 44 -1.701997997040913 8.00461856645263
epoch 45 -1.6975790265339903 7.998070329267238
epoch 46 -1.6969938616306801 7.997202802525347
epoch 47 -1.7021961387569595 8.004912056637487
epoch 48 -1.708700325559953 8.014540179088923
epoch 49 -1.6980356706462612 7.998747254232012
epoch 50 -1.6978345814584812 7.998449168558503
epoch 51 -1.694346254004317 7.993276458009525
epoch 52 -1.7057806478679258 8.01021962303331
epoch 53 -1.69324645493599 7.991644912831203
epoch 54 -1.6954638778261741 7.994934105009059
epoch 55 -1.6978828111553224 7.998520663129961
epoch 56 -1.6988790734390378 7.999997356059396
epoch 57 -1.7037448773926043 8.007205698562244
epoch 58 -1.6980675704061055 7.998794539997179
[32m[I 2022-03-02 22:31:12,207][0m Trial 1 finished with value: 7.999042320097928 and parameters: {'lr': 2.764040604038224e-05, 'weight_decay': 0.06967204585328764, 'criterion': 'PoissonNLLLoss', 'batch_size': 128, 'epochs': 60}. Best is trial 0 with value: 7.997349939629155.[0m
epoch 59 -1.6982347300463805 7.999042320097928

Previous best Test-set performance: 0.009440638187017236

Trial Id: 2 | Model params: 525502 | Timestamp: 2022-03-02 22:31:12.207545

epoch 0 0.008097163475852986 4.849899024308597
epoch 1 0.007718107065825763 4.8508256320588385
epoch 2 0.006178552125047698 4.854587273844828
epoch 3 0.005930341083095758 4.855193462683567
epoch 4 0.007596214633007636 4.851123561903442
epoch 5 0.007540977863916942 4.851258565753405
epoch 6 0.00796637035260006 4.850218769604174
epoch 7 0.0069339004205791754 4.852742072552411
epoch 8 0.006706558440811916 4.853297508317071
epoch 9 0.006792769063757809 4.853086888341611
epoch 10 0.0073168422999407845 4.85180633556883
epoch 11 0.007917596598159271 4.850337999670863
epoch 12 0.004935431936666901 4.8576225018891765
epoch 13 -0.001856901982474124 4.874173427844862
epoch 14 0.006810016631773275 4.853044749950459
epoch 15 0.006305055100910284 4.854278295163586
epoch 16 0.008292076541317805 4.849422488152506
epoch 17 0.003065960806254431 4.862183474120841
epoch 18 0.007488732898670913 4.851386253896706
epoch 19 0.007713957832998775 4.850835773926817
epoch 20 0.004289633014184835 4.859198549643154
epoch 21 0.0067662879284524635 4.853151585008088
epoch 22 0.007557410098541939 4.851218404221706
epoch 23 0.008117987666409476 4.849848114205396
epoch 24 0.0071782405131852745 4.852145036568451
epoch 25 0.007623338919256706 4.851057266225624
epoch 26 0.007754984204716542 4.850735493241488
epoch 27 0.004062973885566312 4.859751581465596
epoch 28 0.003348695435917537 4.861493957527024
epoch 29 0.003157503068033307 4.861960236939163
epoch 30 0.004484817475955305 4.858722263280612
epoch 31 0.006060903143004226 4.854874609336714
epoch 32 0.006104696544422805 4.8547676541846
epoch 33 0.00661527966811104 4.853520500257114
epoch 34 0.008072836046608134 4.84995849830524
epoch 35 0.006183041138416612 4.854576309937866
epoch 36 0.0031020247980526605 4.862095528818604
epoch 37 0.004808018488343446 4.8579334900612405
epoch 38 0.0064820925660072914 4.853845854901395
epoch 39 0.005421138843607953 4.856436815623499
epoch 40 0.006523234460544369 4.853745354205744
epoch 41 0.0068821757037343945 4.852868450565587
epoch 42 0.007797088825694964 4.850632574837842
epoch 43 0.007742655680375687 4.8507656280488645
epoch 44 0.007719645828204391 4.850821870894328
epoch 45 0.006717693006629832 4.8532703061280085
epoch 46 0.0076011108748483824 4.851111594847388
epoch 47 0.008361291994897324 4.849253254436574
epoch 48 -0.0009370354011817295 4.871935274433688
epoch 49 0.007920528406202942 4.850330832791166
epoch 50 0.006634762647576231 4.853472904646893
epoch 51 0.006745983832042279 4.85320118982561
epoch 52 0.007350520864854215 4.851724031734368
epoch 53 0.007492481727864431 4.851377091766162
epoch 54 0.007121194519668861 4.852284432918151
epoch 55 0.005632506218072431 4.855920744509252
epoch 56 0.006378530226176515 4.854098825950711
epoch 57 0.0031557188443736006 4.861964588088233
epoch 58 0.008050601080691666 4.8500128561560505
[32m[I 2022-03-03 00:31:46,761][0m Trial 2 finished with value: 4.856674940881015 and parameters: {'lr': 0.00015721867918863143, 'weight_decay': 0.22792176039037093, 'criterion': 'MSELoss', 'batch_size': 128, 'epochs': 60}. Best is trial 2 with value: 4.856674940881015.[0m
epoch 59 0.005323602249284076 4.856674940881015

Previous best Test-set performance: 0.009440638187017236

Trial Id: 3 | Model params: 525502 | Timestamp: 2022-03-03 00:31:46.761427

epoch 0 -0.03499509768169995 4.9541286114329
epoch 1 -7.243638380227679e-07 4.869656053119566
epoch 2 -7.86277467168528e-05 4.869845730628109
epoch 3 -0.006126787294131075 4.884549177817698
epoch 4 -0.004038619691803191 4.879477721988723
epoch 5 -0.0020626990654915023 4.874674017881346
epoch 6 -0.0003672709059354684 4.8705484484982655
epoch 7 -0.0002834581881989706 4.870344412208392
epoch 8 -0.0019663674833139133 4.874439703028886
epoch 9 -0.0005730989982863921 4.871049486548895
epoch 10 -0.0022885182050829123 4.875223251319192
epoch 11 -0.0010780982591580557 4.872278565208955
epoch 12 -0.0004800392403796483 4.870822961756834
epoch 13 -0.0005307894839454708 4.870946498612771
epoch 14 -0.000242001597342556 4.87024348583296
epoch 15 -0.0001419286274269016 4.869999848833061
epoch 16 -0.006582582635451084 4.8856554512512345
epoch 17 -0.0002191346983457798 4.870187815304122
epoch 18 -0.0011253401614672587 4.872393527764278
[32m[I 2022-03-03 01:11:50,375][0m Trial 3 finished with value: 4.874276642835955 and parameters: {'lr': 0.0025281380354890584, 'weight_decay': 0.27640277442014843, 'criterion': 'MSELoss', 'batch_size': 256, 'epochs': 20}. Best is trial 2 with value: 4.856674940881015.[0m
epoch 19 -0.0018993328674683507 4.874276642835955

Previous best Test-set performance: 0.009440638187017236

Trial Id: 4 | Model params: 525502 | Timestamp: 2022-03-03 01:11:50.376255

epoch 0 -1.6778670119508572 7.968794606814316
epoch 1 -1.6847251414070383 7.978992290012189
epoch 2 -1.7065581743269025 8.011370438850788
epoch 3 -1.7081343630248789 8.01370284643971
epoch 4 -1.7109256637256887 8.017831683942616
epoch 5 -1.712945213253497 8.020817637011941
epoch 6 -1.714023827539605 8.022411939158957
epoch 7 -1.703878316535607 8.00740328774536
epoch 8 -1.7071108259021583 8.012188317170503
epoch 9 -1.7048372125277842 8.008823023656591
epoch 10 -1.7398120856114963 8.060435721953368
epoch 11 -1.716507917251763 8.02608247307939
epoch 12 -1.711837599772672 8.019180141229246
epoch 13 -1.687302516745799 7.982821345800075
epoch 14 -1.700895716996608 8.002985657884452
epoch 15 -1.7159736284490212 8.025293140413693
epoch 16 -1.7159089806548367 8.025197627596274
epoch 17 -1.7255244446609233 8.039391369004194
epoch 18 -1.7100877269201087 8.016592447544538
epoch 19 -1.7123943088812 8.02000322177276
epoch 20 -1.6992760263120772 8.000585656811086
epoch 21 -1.6983199718699247 7.999168670774768
epoch 22 -1.704171543122846 8.007837464067212
epoch 23 -1.7065645702453933 8.011379904755225
epoch 24 -1.7069896698560072 8.012009023454556
epoch 25 -1.7104890606175451 8.017186009434079
epoch 26 -1.7008824356137597 8.002965980922017
epoch 27 -1.7047772496534561 8.008734250345608
epoch 28 -1.702555531592365 8.00544436669983
epoch 29 -1.6882202228399121 7.984184284735367
epoch 30 -1.7123175558025996 8.019889749279038
epoch 31 -1.7042066962162794 8.007889513158634
epoch 32 -1.708911401619881 8.01485244039601
epoch 33 -1.7210833678139728 8.032838848259336
epoch 34 -1.7051132599146 8.009231691182412
epoch 35 -1.692712231850701 7.99085227595109
epoch 36 -1.71146275299117 8.018625892009208
epoch 37 -1.7163641064916026 8.025870021591425
epoch 38 -1.7062146032015182 8.010861940097803
[32m[I 2022-03-03 02:39:12,922][0m Trial 4 finished with value: 8.031593330799364 and parameters: {'lr': 0.0003517065476309259, 'weight_decay': 0.1909730958296955, 'criterion': 'PoissonNLLLoss', 'batch_size': 32, 'epochs': 40}. Best is trial 2 with value: 4.856674940881015.[0m
epoch 39 -1.720239607803634 8.031593330799364

Previous best Test-set performance: 0.009440638187017236

Trial Id: 5 | Model params: 525502 | Timestamp: 2022-03-03 02:39:12.922537

[32m[I 2022-03-03 02:41:12,954][0m Trial 5 pruned. [0m
epoch 0 -1.6653935781569702 7.950213726873312

Previous best Test-set performance: 0.009440638187017236

Trial Id: 6 | Model params: 525502 | Timestamp: 2022-03-03 02:41:12.954561

epoch 0 -1.7098082066352038 8.016179018494798
epoch 1 -1.6794069970859509 7.971085620776953
epoch 2 -1.7054712440361945 8.009761628867944
epoch 3 -1.7282928472222898 8.043473266520769
epoch 4 -1.6899367131559373 7.986732920424606
epoch 5 -1.691643888469894 7.989266918820844
epoch 6 -1.6965814168232063 7.996591282615889
epoch 7 -1.706843240799646 8.011792323923027
epoch 8 -1.6850145644650811 7.979422360502195
epoch 9 -1.685306229974104 7.979855739731514
epoch 10 -1.6921881665037186 7.990074633895863
epoch 11 -1.6929591889323983 7.9912187006084405
epoch 12 -1.6959742481378193 7.9956909661775075
epoch 13 -1.700480417762341 8.002370350605483
epoch 14 -1.6900316899215975 7.986873917675878
epoch 15 -1.685050451706951 7.979475685818783
epoch 16 -1.6933382688858734 7.991781131005899
epoch 17 -1.6950343622997228 7.994297093107693
epoch 18 -1.6858208253536988 7.980620308058103
epoch 19 -1.6893730205915682 7.985896042400275
epoch 20 -1.6953706313402672 7.99479581601843
epoch 21 -1.6921778860566485 7.990059378346715
epoch 22 -1.6975963824864024 7.998096058616291
epoch 23 -1.688662094686701 7.984840451454928
epoch 24 -1.6921966163763829 7.990087172963729
epoch 25 -1.6973745618781217 7.997767214201813
epoch 26 -1.6928369466429656 7.9910373246783175
epoch 27 -1.693456905455342 7.991957140656786
epoch 28 -1.6902050484346565 7.98713126971467
epoch 29 -1.6992977266678362 8.000617816398398
epoch 30 -1.6978525117169472 7.998475748027759
epoch 31 -1.7015542828140036 8.00396129191545
epoch 32 -1.692475945503984 7.990501668357024
epoch 33 -1.694596168204019 7.9936471577600745
epoch 34 -1.7024350491590434 8.005265919641882
epoch 35 -1.6946555400147782 7.993735221919312
epoch 36 -1.6902635900011633 7.987218173245123
epoch 37 -1.6947969918542185 7.993945028645213
epoch 38 -1.6932355085942068 7.991628672326113
[32m[I 2022-03-03 04:05:23,608][0m Trial 6 finished with value: 8.002608442591333 and parameters: {'lr': 2.131768768507149e-05, 'weight_decay': 0.009606052408431775, 'criterion': 'PoissonNLLLoss', 'batch_size': 32, 'epochs': 40}. Best is trial 2 with value: 4.856674940881015.[0m
epoch 39 -1.7006411132268533 8.002608442591333

Previous best Test-set performance: 0.009440638187017236

Trial Id: 7 | Model params: 525502 | Timestamp: 2022-03-03 04:05:23.608266

[32m[I 2022-03-03 04:07:34,270][0m Trial 7 pruned. [0m
epoch 0 0.010011657390358919 4.845216314217968

Previous best Test-set performance: 0.009440638187017236

Trial Id: 8 | Model params: 525502 | Timestamp: 2022-03-03 04:07:34.270373

[32m[I 2022-03-03 04:09:44,903][0m Trial 8 pruned. [0m
epoch 0 0.007872631228459825 4.850447917339676

Previous best Test-set performance: 0.009440638187017236

Trial Id: 9 | Model params: 525502 | Timestamp: 2022-03-03 04:09:44.903422

epoch 0 -1.6960125623486526 7.995747781909562
epoch 1 -1.712467860189851 8.020111959232418
epoch 2 -1.7121853241493499 8.01969425295824
epoch 3 -1.740901450062129 8.062037999630142
epoch 4 -1.6955398697356467 7.995046802870031
epoch 5 -1.7362333947078863 8.055169807227266
epoch 6 -1.7332857658868148 8.05082989077802
epoch 7 -1.7226969650833301 8.035220224364492
epoch 8 -1.7188660665422777 8.029565362798428
epoch 9 -1.7110128885649756 8.017960670964285
epoch 10 -1.7466813042403628 8.070533902393585
epoch 11 -1.686782204038531 7.982048495621913
epoch 12 -1.7248182254639648 8.038349745554653
epoch 13 -1.6885459450864406 7.984667977932709
epoch 14 -1.7347210276201759 8.052943378453419
epoch 15 -1.6797802399863833 7.971640789797018
epoch 16 -1.73704054385581 8.05635779872884
epoch 17 -1.7015653446807413 8.003977678530946
epoch 18 -1.681626790028091 7.974386816973347
epoch 19 -1.7059848928840378 8.010521941804843
epoch 20 -1.7081832507068682 8.013775178446865
epoch 21 -1.7209626161427316 8.032660612361004
epoch 22 -1.7022749642966413 8.005028811099224
epoch 23 -1.6917377753771916 7.989406253935898
epoch 24 -1.6986493469809387 7.999656872081173
epoch 25 -1.7106527322272052 8.017428062787078
epoch 26 -1.706548580471638 8.011356240006423
epoch 27 -1.7078282550160964 8.013249928006687
epoch 28 -1.69942435307905 8.000805472178387
epoch 29 -1.7153346436118637 8.024349032888182
epoch 30 -1.6854703955582448 7.980099659334231
epoch 31 -1.693989130619943 7.992746704171547
epoch 32 -1.7483876464383137 8.073040373461003
epoch 33 -1.6905843307383934 7.987694288281277
epoch 34 -1.7374621941673234 8.05697832935355
epoch 35 -1.7004100863039588 8.002266142843387
epoch 36 -1.6909561202269425 7.988246145763747
epoch 37 -1.7346237860323872 8.052800203344527
epoch 38 -1.7115560124695421 8.018763789245131
epoch 39 -1.7005702103506017 8.002503391298593
epoch 40 -1.695422185002021 7.9948722728558845
epoch 41 -1.7267060869126802 8.041133906137267
epoch 42 -1.6989685433344635 8.000129957961052
epoch 43 -1.6917896119428053 7.989483182192329
epoch 44 -1.7029766814529208 8.00606810234584
epoch 45 -1.6914625581679443 7.988997804360966
epoch 46 -1.713693990609686 8.021924440099859
epoch 47 -1.7140820298101844 8.022497959053547
epoch 48 -1.6948909332603344 7.994084363054094
epoch 49 -1.7147839962381912 8.023535355876641
epoch 50 -1.7106883363216085 8.017480716586084
epoch 51 -1.7039234365083975 8.007470097762111
epoch 52 -1.7095105241433592 8.015738702888997
epoch 53 -1.6751571500188982 7.964761583721081
epoch 54 -1.7013502524922686 8.003659043383475
epoch 55 -1.6881718761219697 7.98411248800571
epoch 56 -1.6989590984696608 8.000115959981686
epoch 57 -1.7277150160393373 8.042621448910024
epoch 58 -1.6655551145411556 7.950454634882556
[32m[I 2022-03-03 06:09:41,656][0m Trial 9 finished with value: 7.989170935574914 and parameters: {'lr': 0.009115186237457213, 'weight_decay': 0.1835002462536398, 'criterion': 'PoissonNLLLoss', 'batch_size': 128, 'epochs': 60}. Best is trial 2 with value: 4.856674940881015.[0m
epoch 59 -1.691579213908886 7.989170935574914

Study statistics: 
  Number of finished trials:  10
  Number of pruned trials:  3
  Number of complete trials:  7

Best trial:
  Value:  4.856674940881015
  Params: 
    lr: 0.00015721867918863143
    weight_decay: 0.22792176039037093
    criterion: MSELoss
    batch_size: 128
    epochs: 60
Target: 72610, NaN: 0, Max: 178.0, Min: 0.0, Mean: 8.480057843272277
Prediction: 72610, NaN: 0, Max: 11.189361572265625, Min: 7.391180992126465, Mean: 8.489814213021303

 XXXXXX======== TRIAL north - lrg ended

Test Set - R-squared:  0.014333634977770293
Test Set - RMSE:  4.8346284008037745
Test Set - MAE:  3.2686688608217627



[32m[I 2022-03-03 06:10:34,031][0m A new study created in memory with name: DeepSet[0m
Starting Loading north
Finished Loading north
Finished north setup

++++++++ Session Characteristics +++++++

Area: north
Gal Type: elg
Training Set: 290439
Validation Set: 72610
Test Samples: 72610
Number of features: 5
Device: cuda:0
Number of Workers: 8
Number of Trials: 10

+++++++++++++++++++++++++++++++++++++++

Previous best Test-set performance: 0.1390606825230084

Trial Id: 0 | Model params: 100568 | Timestamp: 2022-03-03 06:10:34.032229

epoch 0 0.1381830844004278 7.220631262819013
epoch 1 0.13634635345535684 7.228321584206748
epoch 2 0.13548064234720192 7.231943447532869
epoch 3 0.13523682300851914 7.232963183728607
epoch 4 0.1324854451389158 7.244460441749417
epoch 5 0.13407638833371505 7.2378145509003184
epoch 6 0.13389141147245442 7.2385875733171705
epoch 7 0.12914290361390623 7.258403510184321
epoch 8 0.13355959550025776 7.239974032822425
[32m[I 2022-03-03 06:19:33,493][0m Trial 0 finished with value: 7.249575084721092 and parameters: {'lr': 7.715523613684366e-05, 'weight_decay': 0.2702115997715808, 'criterion': 'MSELoss', 'batch_size': 128, 'epochs': 10}. Best is trial 0 with value: 7.249575084721092.[0m
epoch 9 0.13126006926899425 7.249575084721092

Previous best Test-set performance: 0.1390606825230084

Trial Id: 1 | Model params: 100568 | Timestamp: 2022-03-03 06:19:33.493611

epoch 0 -0.06782962665259307 8.037456646101486
epoch 1 -0.1513753211553317 8.345956533750051
epoch 2 -0.2326482413398414 8.635495069274743
epoch 3 -0.2767749820626926 8.788704092943963
epoch 4 -0.3462957487358467 9.02480646910362
epoch 5 -0.40994355643194313 9.235672491200983
epoch 6 -0.5398179479493987 9.651667432945185
epoch 7 -0.728437828540242 10.225735185596802
epoch 8 -0.8428321227534386 10.558702349980562
epoch 9 -1.1251261219420279 11.338615155902653
epoch 10 -1.3441246374101996 11.908526023323567
epoch 11 -1.561300836493098 12.447953462002236
epoch 12 -1.6327264598659448 12.62032472135988
epoch 13 -1.814937893134613 13.049746310250862
epoch 14 -2.0195297692495373 13.515661867690321
epoch 15 -2.2828646663523133 14.092698157117399
epoch 16 -2.351421416198192 14.239088214983395
epoch 17 -2.4432412297048267 14.432826313810857
epoch 18 -2.500576318872034 14.552494223627479
