[32m[I 2022-02-17 11:34:58,370][0m A new study created in memory with name: DeepSet[0m
Starting Loading north
Finished Loading north
Finished north setup

++++++++ Session Characteristics +++++++

Area: north
Gal Type: glbg
Training Set: 232352
Validation Set: 58087
Test Samples: 72610
Number of features: 5
Device: cuda:0
Number of Workers: 8
Number of Trials: 25

+++++++++++++++++++++++++++++++++++++++

Trial Id: 0 | Model params: 67202 | Timestamp: 2022-02-17 11:34:58.370931

[32m[I 2022-02-17 11:36:12,690][0m Trial 0 pruned. [0m
++++++++++++++++++++
        NaN         
++++++++++++++++++++

Trial Id: 1 | Model params: 31790 | Timestamp: 2022-02-17 11:36:12.690888

epoch 0 -0.8337108800201161 15.34359723620749
epoch 5 -0.19892227293127474 12.406728346893322
epoch 10 0.09380086762947959 10.78632694352052
epoch 15 0.11286818333415272 10.672246228636011
epoch 20 0.10208112401781855 10.736934647118185
epoch 25 0.10463156515997052 10.721675254802182
epoch 30 0.1151906359023378 10.658267455497286
epoch 35 0.11119114414103448 10.682328904253497
epoch 40 0.12387933920850669 10.605807006755676
epoch 45 0.1272838558425723 10.585180400182553
epoch 50 0.12137218771198766 10.620971224529825
epoch 55 0.13033329480490896 10.566670883503548
epoch 60 0.13337179431692514 10.548195462131961
epoch 65 0.13259489424666437 10.552922436144602
epoch 70 0.1356460512331752 10.534345771139954
epoch 75 0.13696632440820677 10.526297257387657
epoch 80 0.12460075354438216 10.60143959639696
epoch 85 0.1361847251511752 10.531062705384912
epoch 90 0.13896721127928058 10.514087912360676
epoch 95 0.12740116605696683 10.584468948055669
[32m[I 2022-02-17 12:25:24,199][0m Trial 1 finished with value: 10.504609812598487 and parameters: {'n_layers_fe': 4, 'fe_n_units_l0': 31, 'fe_dropout_l0': 0.43738804108634616, 'fe_n_units_l1': 48, 'fe_dropout_l1': 0.30059285237118943, 'fe_n_units_l2': 203, 'fe_dropout_l2': 0.3812465798320422, 'fe_n_units_l3': 60, 'fe_dropout_l3': 0.020349759462326644, 'n_units_l(Invariant)': 100, 'n_layers_mlp': 2, 'mlp_n_units_l0': 23, 'mlp_dropout_l0': 0.14975574625798488, 'mlp_n_units_l1': 46, 'mlp_dropout_l1': 0.2946551997941653, 'reduction': 'sum', 'lr': 7.548754584495688e-05, 'weight_decay': 0.14327203029942448, 'criterion': 'MSELoss', 'batch_size': 128}. Best is trial 1 with value: 10.504609812598487.[0m

Trial Id: 2 | Model params: 98370 | Timestamp: 2022-02-17 12:25:24.199516

[32m[I 2022-02-17 12:26:08,220][0m Trial 2 pruned. [0m
++++++++++++++++++++
        NaN         
++++++++++++++++++++

Trial Id: 3 | Model params: 89105 | Timestamp: 2022-02-17 12:26:08.220373

epoch 0 -5.943413738824426 29.857145271732577
epoch 5 -5.9106481559039095 29.786614862816545
epoch 10 -5.893666778477644 29.749995369696865
epoch 15 -5.913994582130822 29.793825955228236
epoch 20 -5.8535404915336215 29.66328541529922
epoch 25 -5.846444400368844 29.64792489530569
epoch 30 -5.824841662696969 29.601113562846326
epoch 35 -5.848244808581233 29.651822893710193
epoch 40 -5.866257688756602 29.690793753358918
epoch 45 -5.828740949102238 29.60956846507786
epoch 50 -5.856039073672576 29.668692066164404
epoch 55 -5.869002490118556 29.696727639907404
epoch 60 -5.831023650718349 29.6145169733592
epoch 65 -5.843852208001255 29.642311733493507
epoch 70 -5.8341342007464485 29.621258785211648
epoch 75 -5.821479308125181 29.593820961339645
epoch 80 -5.845756185533955 29.646434730971265
epoch 85 -5.836702733600422 29.62682467159328
epoch 90 -5.840103077018938 29.634191443192755
epoch 95 -5.859603168053809 29.676402661064518
[32m[I 2022-02-17 13:40:10,181][0m Trial 3 finished with value: 29.616521764382313 and parameters: {'n_layers_fe': 4, 'fe_n_units_l0': 93, 'fe_dropout_l0': 0.24868252934596846, 'fe_n_units_l1': 175, 'fe_dropout_l1': 0.33252293727216653, 'fe_n_units_l2': 123, 'fe_dropout_l2': 0.13738869820317223, 'fe_n_units_l3': 114, 'fe_dropout_l3': 0.22670528765642117, 'n_units_l(Invariant)': 201, 'n_layers_mlp': 2, 'mlp_n_units_l0': 61, 'mlp_dropout_l0': 0.47641840789725565, 'mlp_n_units_l1': 184, 'mlp_dropout_l1': 0.4516104451375184, 'reduction': 'sum', 'lr': 0.003984133478416007, 'weight_decay': 0.25868004472946393, 'criterion': 'PoissonNLLLoss', 'batch_size': 256}. Best is trial 1 with value: 10.504609812598487.[0m

Trial Id: 4 | Model params: 74291 | Timestamp: 2022-02-17 13:40:10.182396

epoch 0 -6.344689272572845 30.70778367765949
epoch 5 -5.7920688785193 29.52995599075439
epoch 10 -5.813300919740899 29.57607537144726
epoch 15 -5.8454257074194045 29.64571913317362
epoch 20 -5.813780313727811 29.577115861472475
epoch 25 -5.825049396137296 29.601564056401408
epoch 30 -5.798426896288895 29.54377417122626
epoch 35 -5.791728241902898 29.529215486602116
epoch 40 -5.818698415967027 29.587788133993868
epoch 45 -5.821723668299589 29.59435101399858
epoch 50 -5.816076024670868 29.582098029013434
epoch 55 -5.82823713104737 29.608476161938317
epoch 60 -5.841543813651904 29.637312216135225
epoch 65 -5.834408155333928 29.62185248136764
epoch 70 -5.8402273802873905 29.63446070888054
epoch 75 -5.860724592887553 29.678828347656584
epoch 80 -5.853636841264306 29.663493923552707
epoch 85 -5.845524647914023 29.645933374890728
epoch 90 -5.8489467071776975 29.653342410038384
epoch 95 -5.852738988021855 29.66155084302862
[32m[I 2022-02-17 14:59:00,140][0m Trial 4 finished with value: 29.65118326104031 and parameters: {'n_layers_fe': 4, 'fe_n_units_l0': 206, 'fe_dropout_l0': 0.3961889674775664, 'fe_n_units_l1': 119, 'fe_dropout_l1': 0.4007798302552708, 'fe_n_units_l2': 20, 'fe_dropout_l2': 0.3864425031858336, 'fe_n_units_l3': 71, 'fe_dropout_l3': 0.02576835822629625, 'n_units_l(Invariant)': 497, 'n_layers_mlp': 2, 'mlp_n_units_l0': 141, 'mlp_dropout_l0': 0.47422804701084437, 'mlp_n_units_l1': 35, 'mlp_dropout_l1': 0.263432234521556, 'reduction': 'sum', 'lr': 2.5617324211628433e-05, 'weight_decay': 0.048817419803391444, 'criterion': 'PoissonNLLLoss', 'batch_size': 256}. Best is trial 1 with value: 10.504609812598487.[0m

Trial Id: 5 | Model params: 113091 | Timestamp: 2022-02-17 14:59:00.141063

epoch 0 -5.94151996594141 29.85307331878934
epoch 5 -5.846839040877783 29.648779360987767
epoch 10 -5.826088634330922 29.603817659503918
epoch 15 -5.823619005455266 29.598461952836413
epoch 20 -5.831135260854046 29.6147589039194
epoch 25 -5.8583402686070425 29.67367072185855
epoch 30 -5.853484831261806 29.66316496150724
epoch 35 -5.856050270112519 29.668716291784307
epoch 40 -5.843500671245799 29.64155043009382
epoch 45 -5.831380684987421 29.615290888061224
epoch 50 -5.86955067903891 29.69791260761558
epoch 55 -5.842885547531852 29.640218244184705
epoch 60 -5.841091754933312 29.636333049219687
epoch 65 -5.851750111103412 29.65941062717563
epoch 70 -5.835245108880629 29.623666197709696
epoch 75 -5.830492110292355 29.61336475811278
epoch 80 -5.82916408374638 29.610485811352344
epoch 85 -5.843185415750549 29.640867682350304
epoch 90 -5.833476423632889 29.619833245824633
epoch 95 -5.817787495620606 29.585811729057298
[32m[I 2022-02-17 15:50:58,814][0m Trial 5 finished with value: 29.655410955519 and parameters: {'n_layers_fe': 2, 'fe_n_units_l0': 207, 'fe_dropout_l0': 0.05422579893744145, 'fe_n_units_l1': 252, 'fe_dropout_l1': 0.1181824892187538, 'n_units_l(Invariant)': 63, 'n_layers_mlp': 2, 'mlp_n_units_l0': 183, 'mlp_dropout_l0': 0.35898627198242183, 'mlp_n_units_l1': 212, 'mlp_dropout_l1': 0.13248794760743415, 'reduction': 'sum', 'lr': 0.00019881618939604278, 'weight_decay': 0.28391728048108394, 'criterion': 'PoissonNLLLoss', 'batch_size': 256}. Best is trial 1 with value: 10.504609812598487.[0m

Trial Id: 6 | Model params: 284802 | Timestamp: 2022-02-17 15:50:58.814959

epoch 0 0.1106572494289142 10.68553678335553
epoch 5 0.12444584647869505 10.602377548572546
epoch 10 0.12421689076584341 10.603763708540804
epoch 15 0.11419045343742995 10.664289770467846
epoch 20 0.12013651726665142 10.628437075834645
epoch 25 0.12289282579547045 10.611776405560395
epoch 30 0.1146603816514099 10.661460654720848
epoch 35 0.12741553622826018 10.584381793883484
epoch 40 0.11688600659184734 10.648051481829969
epoch 45 0.11475505649249429 10.660890591516663
epoch 50 0.12265047259258588 10.613242372575135
epoch 55 0.12929126675158653 10.572999440837663
epoch 60 0.12914516677718413 10.57388644822344
epoch 65 0.13246890968003766 10.553688777660863
epoch 70 0.1305564138425156 10.56531532012516
epoch 75 0.125118372442952 10.598304845634694
epoch 80 0.11908284856314089 10.634799142780933
epoch 85 0.13909813579548014 10.51328852108128
epoch 90 0.13912192350122266 10.513143272968984
epoch 95 0.14333101964738337 10.487410794910481
[32m[I 2022-02-17 17:57:42,940][0m Trial 6 finished with value: 10.472377864103965 and parameters: {'n_layers_fe': 4, 'fe_n_units_l0': 173, 'fe_dropout_l0': 0.06198838033302506, 'fe_n_units_l1': 249, 'fe_dropout_l1': 0.3042777875730589, 'fe_n_units_l2': 208, 'fe_dropout_l2': 0.3027453516358713, 'fe_n_units_l3': 225, 'fe_dropout_l3': 0.08695131010942758, 'n_units_l(Invariant)': 404, 'n_layers_mlp': 4, 'mlp_n_units_l0': 98, 'mlp_dropout_l0': 0.09439225272239504, 'mlp_n_units_l1': 156, 'mlp_dropout_l1': 0.3446135275478453, 'mlp_n_units_l2': 79, 'mlp_dropout_l2': 0.4550445058821128, 'mlp_n_units_l3': 242, 'mlp_dropout_l3': 0.35119583872207827, 'reduction': 'sum', 'lr': 0.0007926479908382963, 'weight_decay': 0.15209062219210137, 'criterion': 'MSELoss', 'batch_size': 128}. Best is trial 6 with value: 10.472377864103965.[0m

Trial Id: 7 | Model params: 122056 | Timestamp: 2022-02-17 17:57:42.940955

[32m[I 2022-02-17 17:58:36,532][0m Trial 7 pruned. [0m
++++++++++++++++++++
        NaN         
++++++++++++++++++++

Trial Id: 8 | Model params: 87667 | Timestamp: 2022-02-17 17:58:36.532434

epoch 0 -6.019033184964988 30.019289344704294
epoch 5 -5.878878026280129 29.718067403224815
epoch 10 -5.8600566637083125 29.67738361410896
epoch 15 -5.844215360084718 29.643098171024675
epoch 20 -5.83791719779052 29.629455992661363
epoch 25 -5.837740850133477 29.629073923188937
epoch 30 -5.842301838443689 29.63895403819907
epoch 35 -5.839485841543285 29.63285435172611
epoch 40 -5.84042087427204 29.63487985060027
epoch 45 -5.840189218816222 29.634378043778025
epoch 50 -5.842555515200318 29.639503461786372
epoch 55 -5.836947956875832 29.627356003883282
epoch 60 -5.84229287225924 29.638934618680455
epoch 65 -5.841643655688249 29.637528471332036
epoch 70 -5.844115618867315 29.642882174791687
epoch 75 -5.843043851714857 29.64056109248778
epoch 80 -5.843078314142719 29.640635729187068
epoch 85 -5.842932857321567 29.64032070608172
epoch 90 -5.843124098553648 29.640734886080665
epoch 95 -5.841730979240933 29.637717610532423
[32m[I 2022-02-17 19:09:02,982][0m Trial 8 finished with value: 29.646907601982868 and parameters: {'n_layers_fe': 4, 'fe_n_units_l0': 55, 'fe_dropout_l0': 0.18255007206561874, 'fe_n_units_l1': 249, 'fe_dropout_l1': 0.2374221652712888, 'fe_n_units_l2': 122, 'fe_dropout_l2': 0.16771669867229938, 'fe_n_units_l3': 116, 'fe_dropout_l3': 0.30621284622453326, 'n_units_l(Invariant)': 130, 'n_layers_mlp': 4, 'mlp_n_units_l0': 78, 'mlp_dropout_l0': 0.47287335312434, 'mlp_n_units_l1': 79, 'mlp_dropout_l1': 0.3089606734803566, 'mlp_n_units_l2': 30, 'mlp_dropout_l2': 0.17914625318166183, 'mlp_n_units_l3': 89, 'mlp_dropout_l3': 0.4467615607162718, 'reduction': 'sum', 'lr': 0.0002278721201414928, 'weight_decay': 0.050520347204117085, 'criterion': 'PoissonNLLLoss', 'batch_size': 256}. Best is trial 6 with value: 10.472377864103965.[0m

Trial Id: 9 | Model params: 71301 | Timestamp: 2022-02-17 19:09:02.982422

[32m[I 2022-02-17 19:10:15,319][0m Trial 9 pruned. [0m
++++++++++++++++++++
        NaN         
++++++++++++++++++++

Trial Id: 10 | Model params: 340137 | Timestamp: 2022-02-17 19:10:15.319402

[32m[I 2022-02-17 19:11:30,759][0m Trial 10 pruned. [0m
++++++++++++++++++++
        NaN         
++++++++++++++++++++

Trial Id: 11 | Model params: 117144 | Timestamp: 2022-02-17 19:11:30.759875

[32m[I 2022-02-17 19:12:15,629][0m Trial 11 pruned. [0m
epoch 0 0.06711497609014638 10.943993327510492

Trial Id: 12 | Model params: 124537 | Timestamp: 2022-02-17 19:12:15.629479

[32m[I 2022-02-17 19:12:50,261][0m Trial 12 pruned. [0m
epoch 0 0.07143169584904674 10.918643510279257

Trial Id: 13 | Model params: 114477 | Timestamp: 2022-02-17 19:12:50.261896

[32m[I 2022-02-17 19:13:35,607][0m Trial 13 pruned. [0m
epoch 0 0.0776197597318472 10.882201277023697

Trial Id: 14 | Model params: 82448 | Timestamp: 2022-02-17 19:13:35.608117

[32m[I 2022-02-17 19:14:09,898][0m Trial 14 pruned. [0m
epoch 0 -0.04091880120763003 11.5603287717777

Trial Id: 15 | Model params: 99010 | Timestamp: 2022-02-17 19:14:09.898219

[32m[I 2022-02-17 19:15:05,960][0m Trial 15 pruned. [0m
++++++++++++++++++++
        NaN         
++++++++++++++++++++

Trial Id: 16 | Model params: 118639 | Timestamp: 2022-02-17 19:15:05.960647

[32m[I 2022-02-17 19:15:49,846][0m Trial 16 pruned. [0m
epoch 0 0.10300875582371749 10.731387099311366

Trial Id: 17 | Model params: 156862 | Timestamp: 2022-02-17 19:15:49.846402

[32m[I 2022-02-17 19:17:09,645][0m Trial 17 pruned. [0m
epoch 0 0.06120769303845963 10.97858882599003

Trial Id: 18 | Model params: 96957 | Timestamp: 2022-02-17 19:17:09.645936

[32m[I 2022-02-17 19:17:47,234][0m Trial 18 pruned. [0m
epoch 0 0.09943595812240069 10.752737905274179

Trial Id: 19 | Model params: 74506 | Timestamp: 2022-02-17 19:17:47.234774

[32m[I 2022-02-17 19:18:20,206][0m Trial 19 pruned. [0m
epoch 0 -0.32936852157829755 13.064249153241501

Trial Id: 20 | Model params: 152081 | Timestamp: 2022-02-17 19:18:20.206952

[32m[I 2022-02-17 19:19:18,925][0m Trial 20 pruned. [0m
++++++++++++++++++++
        NaN         
++++++++++++++++++++

Trial Id: 21 | Model params: 70298 | Timestamp: 2022-02-17 19:19:18.925317

[32m[I 2022-02-17 19:19:56,608][0m Trial 21 pruned. [0m
epoch 0 -5.853982775352417 29.664242539541124

Trial Id: 22 | Model params: 79203 | Timestamp: 2022-02-17 19:19:56.608862

[32m[I 2022-02-17 19:20:39,806][0m Trial 22 pruned. [0m
epoch 0 -5.872405230310384 29.70408225489544

Trial Id: 23 | Model params: 145498 | Timestamp: 2022-02-17 19:20:39.806292

[32m[I 2022-02-17 19:21:34,620][0m Trial 23 pruned. [0m
epoch 0 0.05881606302947251 10.992564239358442

Trial Id: 24 | Model params: 58388 | Timestamp: 2022-02-17 19:21:34.620367

[32m[I 2022-02-17 19:22:46,724][0m Trial 24 pruned. [0m
epoch 0 -5.834155664222153 29.621305299857863

Study statistics: 
  Number of finished trials:  25
  Number of pruned trials:  19
  Number of complete trials:  6

Best trial:
  Value:  10.472377864103965
  Params: 
    n_layers_fe: 4
    fe_n_units_l0: 173
    fe_dropout_l0: 0.06198838033302506
    fe_n_units_l1: 249
    fe_dropout_l1: 0.3042777875730589
    fe_n_units_l2: 208
    fe_dropout_l2: 0.3027453516358713
    fe_n_units_l3: 225
    fe_dropout_l3: 0.08695131010942758
    n_units_l(Invariant): 404
    n_layers_mlp: 4
    mlp_n_units_l0: 98
    mlp_dropout_l0: 0.09439225272239504
    mlp_n_units_l1: 156
    mlp_dropout_l1: 0.3446135275478453
    mlp_n_units_l2: 79
    mlp_dropout_l2: 0.4550445058821128
    mlp_n_units_l3: 242
    mlp_dropout_l3: 0.35119583872207827
    reduction: sum
    lr: 0.0007926479908382963
    weight_decay: 0.15209062219210137
    criterion: MSELoss
    batch_size: 128
Target: 72610, NaN: 0, Max: 135.0, Min: 0.0, Mean: 30.72970665197631
Prediction: 72610, NaN: 0, Max: 3.7934746742248535, Min: 3.268498420715332, Mean: 3.411728983519081

 XXXXXX======== TRIAL north - glbg ended

Test Set - R-squared:  -5.84167336307247
Test Set - RMSE:  29.554986330701205
Test Set - MAE:  27.318323051993502



[32m[I 2022-02-17 19:24:40,611][0m A new study created in memory with name: DeepSet[0m
Starting Loading south
Finished Loading south
Finished south setup

++++++++ Session Characteristics +++++++

Area: south
Gal Type: glbg
Training Set: 232361
Validation Set: 58091
Test Samples: 132567
Number of features: 5
Device: cuda:0
Number of Workers: 8
Number of Trials: 25

+++++++++++++++++++++++++++++++++++++++

Trial Id: 0 | Model params: 82803 | Timestamp: 2022-02-17 19:24:40.611680

[32m[I 2022-02-17 19:25:12,440][0m Trial 0 pruned. [0m
++++++++++++++++++++
        NaN         
++++++++++++++++++++

Trial Id: 1 | Model params: 92905 | Timestamp: 2022-02-17 19:25:12.440817

[32m[I 2022-02-17 19:26:28,992][0m Trial 1 pruned. [0m
++++++++++++++++++++
        NaN         
++++++++++++++++++++

Trial Id: 2 | Model params: 51602 | Timestamp: 2022-02-17 19:26:28.992584

[32m[I 2022-02-17 19:26:58,082][0m Trial 2 pruned. [0m
++++++++++++++++++++
        NaN         
++++++++++++++++++++

Trial Id: 3 | Model params: 71550 | Timestamp: 2022-02-17 19:26:58.083108

[32m[I 2022-02-17 19:27:15,807][0m Trial 3 pruned. [0m
++++++++++++++++++++
        NaN         
++++++++++++++++++++

Trial Id: 4 | Model params: 64767 | Timestamp: 2022-02-17 19:27:15.807433

[32m[I 2022-02-17 19:27:48,132][0m Trial 4 pruned. [0m
++++++++++++++++++++
        NaN         
++++++++++++++++++++

Trial Id: 5 | Model params: 106355 | Timestamp: 2022-02-17 19:27:48.132708

epoch 0 0.07078898144904033 7.975835998173202
epoch 5 0.0846099713412175 7.916297892356277
epoch 10 0.09518233644384666 7.870450192403229
epoch 15 0.09869676055886434 7.855150418663599
epoch 20 0.09465705091953558 7.872734428151179
epoch 25 0.10137441312599771 7.843473433690312
epoch 30 0.09687247384842645 7.863096025658843
epoch 35 0.0949084174796111 7.871641428225043
epoch 40 0.1013523502863034 7.843569718637785
epoch 45 0.07867377481470483 7.941924542790337
epoch 50 0.0319061258286818 8.141000394748806
epoch 55 0.09384329645086098 7.8762717804237425
epoch 60 0.05164913740906807 8.057560249063958
epoch 65 0.10070736548881032 7.846383989509153
epoch 70 0.09839659263082312 7.856458340260201
epoch 75 0.09855319260033568 7.85577601444215
epoch 80 0.0677067784738643 7.989053014035475
epoch 85 0.08597310666786095 7.910401495593179
epoch 90 0.1034878876216313 7.834244484717171
epoch 95 0.09203694845113464 7.884118218324406
[32m[I 2022-02-17 21:24:28,345][0m Trial 5 finished with value: 7.844568947224226 and parameters: {'n_layers_fe': 2, 'fe_n_units_l0': 114, 'fe_dropout_l0': 0.30294385672237856, 'fe_n_units_l1': 66, 'fe_dropout_l1': 0.35867334036653453, 'n_units_l(Invariant)': 294, 'n_layers_mlp': 4, 'mlp_n_units_l0': 179, 'mlp_dropout_l0': 0.4364738693318318, 'mlp_n_units_l1': 214, 'mlp_dropout_l1': 0.32574059668921274, 'mlp_n_units_l2': 128, 'mlp_dropout_l2': 0.2650730550485282, 'mlp_n_units_l3': 61, 'mlp_dropout_l3': 0.033984985582764526, 'reduction': 'sum', 'lr': 0.0004793891806244102, 'weight_decay': 0.2025301198774541, 'criterion': 'MSELoss', 'batch_size': 32}. Best is trial 5 with value: 7.844568947224226.[0m

Trial Id: 6 | Model params: 140679 | Timestamp: 2022-02-17 21:24:28.345479

[32m[I 2022-02-17 21:25:53,810][0m Trial 6 pruned. [0m
++++++++++++++++++++
        NaN         
++++++++++++++++++++

Trial Id: 7 | Model params: 186379 | Timestamp: 2022-02-17 21:25:53.810763

[32m[I 2022-02-17 21:26:27,475][0m Trial 7 pruned. [0m
++++++++++++++++++++
        NaN         
++++++++++++++++++++

Trial Id: 8 | Model params: 200448 | Timestamp: 2022-02-17 21:26:27.475426

[32m[I 2022-02-17 21:27:23,664][0m Trial 8 pruned. [0m
++++++++++++++++++++
        NaN         
++++++++++++++++++++

Trial Id: 9 | Model params: 70242 | Timestamp: 2022-02-17 21:27:23.664950

epoch 0 0.03842426241321739 8.113547595188777
epoch 5 0.022308747085657887 8.181254535122182
epoch 10 0.011861065451287844 8.224851123537661
epoch 15 0.03647940274570394 8.121748582383857
epoch 20 0.0373411010325736 8.118116038207635
epoch 25 0.033247375247820954 8.135358949768213
epoch 30 0.03286745947936043 8.136957314994087
epoch 35 0.03297952360276346 8.13648587629933
epoch 40 0.03712232519694547 8.119038455652847
epoch 45 0.024729258220486883 8.171120922132497
epoch 50 -0.04242787041330609 8.447769332354454
epoch 55 0.013577561973634023 8.217704322489672
epoch 60 0.02758451745297419 8.159151030824603
epoch 65 0.027185886298286777 8.160823237094684
epoch 70 0.007045927519185979 8.244866357101682
epoch 75 0.03500498351844905 8.127960325390072
epoch 80 0.036634062636059395 8.121096723378937
epoch 85 0.03470577883897996 8.129220298365095
epoch 90 -0.042125253294682086 8.446543048384383
epoch 95 0.013238316967507657 8.219117294961933
