[32m[I 2022-02-17 23:22:25,530][0m Trial 9 finished with value: 8.122333644806819 and parameters: {'n_layers_fe': 4, 'fe_n_units_l0': 254, 'fe_dropout_l0': 0.32982990516833915, 'fe_n_units_l1': 27, 'fe_dropout_l1': 0.16051484048390746, 'fe_n_units_l2': 30, 'fe_dropout_l2': 0.029579388521782546, 'fe_n_units_l3': 169, 'fe_dropout_l3': 0.2661271215960133, 'n_units_l(Invariant)': 243, 'n_layers_mlp': 2, 'mlp_n_units_l0': 53, 'mlp_dropout_l0': 0.10420615989415222, 'mlp_n_units_l1': 236, 'mlp_dropout_l1': 0.03635525809175766, 'reduction': 'sum', 'lr': 0.00520468850022962, 'weight_decay': 0.27847354502786653, 'criterion': 'MSELoss', 'batch_size': 32}. Best is trial 5 with value: 7.844568947224226.[0m

Trial Id: 10 | Model params: 76788 | Timestamp: 2022-02-17 23:22:25.531168

epoch 0 0.036702337435326804 8.120808942769631
epoch 5 0.03743158852172612 8.117734488106715
epoch 10 0.03126012876425577 8.143716136198353
epoch 15 0.03509337371472643 8.127588070379192
epoch 20 0.021393640926049784 8.18508241296626
epoch 25 0.038047894284044315 8.115135292267617
epoch 30 0.03793049662955328 8.115630467016045
epoch 35 0.021375852505074566 8.185156803975822
epoch 40 0.03286285992834215 8.136976664103043
epoch 45 0.03584600527218029 8.124417674195803
epoch 50 0.03427295870967495 8.131042590359304
epoch 55 0.03357279543126246 8.133989606278076
epoch 60 0.03869732659121483 8.112395488064566
epoch 65 0.018144384329443985 8.198659574618612
epoch 70 -0.06086503039309843 8.522148679072378
epoch 75 0.03856597991794131 8.112949683842059
epoch 80 0.02356466123547052 8.175998144031476
epoch 85 0.038081123672104256 8.114995127644557
epoch 90 0.03388764443963255 8.132664526040987
epoch 95 0.03212205526763401 8.140092435444606
[32m[I 2022-02-18 01:16:56,754][0m Trial 10 finished with value: 8.163361274823197 and parameters: {'n_layers_fe': 2, 'fe_n_units_l0': 24, 'fe_dropout_l0': 0.48922133398347845, 'fe_n_units_l1': 12, 'fe_dropout_l1': 0.48291255785832204, 'n_units_l(Invariant)': 403, 'n_layers_mlp': 4, 'mlp_n_units_l0': 122, 'mlp_dropout_l0': 0.3624419410415113, 'mlp_n_units_l1': 180, 'mlp_dropout_l1': 0.3459749398173384, 'mlp_n_units_l2': 242, 'mlp_dropout_l2': 0.42777494755161616, 'mlp_n_units_l3': 8, 'mlp_dropout_l3': 0.009181866622594605, 'reduction': 'sum', 'lr': 0.001941779954129872, 'weight_decay': 0.29588933292505304, 'criterion': 'MSELoss', 'batch_size': 32}. Best is trial 5 with value: 7.844568947224226.[0m

Trial Id: 11 | Model params: 17743 | Timestamp: 2022-02-18 01:16:56.754981

epoch 0 -0.49697459515671905 10.123396680951455
epoch 5 0.028223937396014365 8.156468030654406
epoch 10 0.03104261638393202 8.144630344291699
epoch 15 0.028700604141808528 8.15446736707235
epoch 20 -0.038444390075622614 8.431612946808842
epoch 25 0.009811987362384533 8.233374537394223
epoch 30 -0.02729235667281249 8.386216464847582
epoch 35 0.033558429647339794 8.13405006127268
epoch 40 0.017159600934345876 8.202770097694579
epoch 45 0.03564526210294461 8.125263408631247
epoch 50 0.02439121151579804 8.172536929537127
epoch 55 0.027148872260443935 8.160978488823998
epoch 60 0.02476015433615275 8.170991492485031
epoch 65 0.005811669525647045 8.249989016914826
epoch 70 0.036046955695432814 8.123570978410893
epoch 75 -0.03895351360003052 8.433679598867837
epoch 80 0.024952003886226093 8.170187752691787
epoch 85 0.028073315811224075 8.157100116886653
epoch 90 0.014803102815929337 8.212597857981327
epoch 95 0.02609997395443331 8.165376762218026
[32m[I 2022-02-18 02:56:18,281][0m Trial 11 finished with value: 8.12386749219979 and parameters: {'n_layers_fe': 2, 'fe_n_units_l0': 245, 'fe_dropout_l0': 0.3843053332771962, 'fe_n_units_l1': 14, 'fe_dropout_l1': 0.16325603633954688, 'n_units_l(Invariant)': 264, 'n_layers_mlp': 2, 'mlp_n_units_l0': 29, 'mlp_dropout_l0': 0.008705354909579799, 'mlp_n_units_l1': 256, 'mlp_dropout_l1': 0.026086038361692022, 'reduction': 'sum', 'lr': 0.005992690245609666, 'weight_decay': 0.28624059534203056, 'criterion': 'MSELoss', 'batch_size': 32}. Best is trial 5 with value: 7.844568947224226.[0m

Trial Id: 12 | Model params: 92266 | Timestamp: 2022-02-18 02:56:18.281915

epoch 0 -0.016972075315453194 8.343985750595257
epoch 5 0.07652609010852729 7.951175783458867
epoch 10 0.04408482424013582 8.089631107754812
epoch 15 0.05682028201050093 8.035562185816053
epoch 20 0.03659034849210907 8.121280974632944
epoch 25 0.08153654159615686 7.929576274610518
epoch 30 0.06263668057107719 8.010747025739064
epoch 35 0.04932237792789751 8.067438723406761
epoch 40 0.08273113395529774 7.924417825863095
epoch 45 0.08133436517827097 7.930448974061496
epoch 50 0.0736776541744788 7.963428959655666
epoch 55 0.07644538347928931 7.951523220765512
epoch 60 0.05729515724189549 8.033539045469793
epoch 65 0.048858243994457484 8.069407800556869
epoch 70 0.08363981329752768 7.920491747447406
epoch 75 0.08403673073811702 7.91877619833212
epoch 80 0.07783511024103962 7.945538406975194
epoch 85 0.0823087348980488 7.92624219899969
epoch 90 0.06744846165720941 7.990159727976709
epoch 95 0.06031599798814091 8.020657222037764
[32m[I 2022-02-18 04:36:42,845][0m Trial 12 finished with value: 7.927091221126949 and parameters: {'n_layers_fe': 2, 'fe_n_units_l0': 110, 'fe_dropout_l0': 0.21786080296302973, 'fe_n_units_l1': 46, 'fe_dropout_l1': 0.17466037792288214, 'n_units_l(Invariant)': 331, 'n_layers_mlp': 2, 'mlp_n_units_l0': 254, 'mlp_dropout_l0': 0.002918602472358478, 'mlp_n_units_l1': 253, 'mlp_dropout_l1': 0.34819738270058187, 'reduction': 'sum', 'lr': 0.003252967861587109, 'weight_decay': 0.24875512031794472, 'criterion': 'MSELoss', 'batch_size': 32}. Best is trial 5 with value: 7.844568947224226.[0m

Trial Id: 13 | Model params: 153022 | Timestamp: 2022-02-18 04:36:42.845775

[32m[I 2022-02-18 04:37:44,298][0m Trial 13 pruned. [0m
epoch 0 0.06380986386174614 8.005732418911089

Trial Id: 14 | Model params: 84884 | Timestamp: 2022-02-18 04:37:44.299098

epoch 0 0.03173582914401818 8.14171640197182
epoch 5 0.03831567112469103 8.114005716000367
epoch 10 0.040278971946287045 8.105719019209428
epoch 15 0.03402257516141982 8.132096587640373
epoch 20 0.03783872567239721 8.116017529184196
epoch 25 0.03983179612590659 8.107607203025527
epoch 30 0.03928277608762687 8.109924819189583
[32m[I 2022-02-18 05:15:01,516][0m Trial 14 pruned. [0m

Trial Id: 15 | Model params: 107465 | Timestamp: 2022-02-18 05:15:01.516556

[32m[I 2022-02-18 05:16:00,344][0m Trial 15 pruned. [0m
epoch 0 0.08967136215113958 7.894382088574769

Trial Id: 16 | Model params: 27212 | Timestamp: 2022-02-18 05:16:00.345027

epoch 0 -0.10411080112892979 8.694114770888667
epoch 5 0.092872008627495 7.880491844097363
epoch 10 0.06034033308232545 8.020553365468858
epoch 15 0.0854574478265614 7.912632553206474
epoch 20 0.0785451170546636 7.942479044835818
epoch 25 0.027579062518168884 8.159173915885217
epoch 30 0.08812173668870915 7.901098417876891
epoch 35 0.09160639103749901 7.885987326991043
epoch 40 0.08634104001359888 7.908809204672866
epoch 45 0.06148501505501658 8.015666606508919
epoch 50 0.08681463139945944 7.9067591895285485
epoch 55 0.08143129033896346 7.930030606220272
epoch 60 0.07465735408346708 7.9592166924103855
epoch 65 0.076648665359897 7.950648075148451
epoch 70 0.09565249713081969 7.868405107940395
epoch 75 0.0889858888521412 7.897353746064487
epoch 80 0.08899910099156805 7.897296479488796
epoch 85 0.0952205802188365 7.870283861152774
epoch 90 0.07769422639833712 7.946145324048688
epoch 95 0.08986007990364397 7.893563764728116
[32m[I 2022-02-18 06:56:02,045][0m Trial 16 finished with value: 7.941578807697355 and parameters: {'n_layers_fe': 2, 'fe_n_units_l0': 123, 'fe_dropout_l0': 0.25183432696419794, 'fe_n_units_l1': 46, 'fe_dropout_l1': 0.35363731329348447, 'n_units_l(Invariant)': 228, 'n_layers_mlp': 2, 'mlp_n_units_l0': 208, 'mlp_dropout_l0': 0.4902285233182952, 'mlp_n_units_l1': 24, 'mlp_dropout_l1': 0.41082316302281013, 'reduction': 'sum', 'lr': 0.00012417849325329359, 'weight_decay': 0.2395346677178733, 'criterion': 'MSELoss', 'batch_size': 32}. Best is trial 5 with value: 7.844568947224226.[0m

Trial Id: 17 | Model params: 120147 | Timestamp: 2022-02-18 06:56:02.045754

[32m[I 2022-02-18 06:57:10,019][0m Trial 17 pruned. [0m
epoch 0 0.027119117096721546 8.161103291780686

Trial Id: 18 | Model params: 123075 | Timestamp: 2022-02-18 06:57:10.019778

epoch 0 -0.3711723336238326 9.688690006419113
epoch 5 -0.03381309508703012 8.412790117727488
epoch 10 0.01765972691307416 8.200682810456998
epoch 15 0.06506768539790497 8.000352546352405
epoch 20 0.09309067202587928 7.87954198972212
epoch 25 0.09610336215530191 7.86644345551932
epoch 30 0.09720722554573802 7.861638629765146
epoch 35 0.09657883470342499 7.8643742090161775
epoch 40 0.09630740267190041 7.865555542173085
epoch 45 0.09833081481943473 7.85674492480801
epoch 50 0.09792756698046601 7.858501589734707
epoch 55 0.09891387814021091 7.854204236564197
epoch 60 0.09924931998454967 7.852742182088517
epoch 65 0.09942510298590257 7.851975906818003
epoch 70 0.0978553712816077 7.858816053763445
epoch 75 0.09951023981354523 7.851604750503543
epoch 80 0.09989449002472206 7.849929382925043
epoch 85 0.0974574821971903 7.860548920267537
epoch 90 0.09997426410507604 7.849581515499427
epoch 95 0.09849650800836729 7.856023003201886
[32m[I 2022-02-18 08:50:37,117][0m Trial 18 finished with value: 7.849117862952852 and parameters: {'n_layers_fe': 2, 'fe_n_units_l0': 144, 'fe_dropout_l0': 0.28421294296252536, 'fe_n_units_l1': 50, 'fe_dropout_l1': 0.2020053889790405, 'n_units_l(Invariant)': 427, 'n_layers_mlp': 4, 'mlp_n_units_l0': 172, 'mlp_dropout_l0': 0.05464243784470423, 'mlp_n_units_l1': 219, 'mlp_dropout_l1': 0.20885571330517272, 'mlp_n_units_l2': 129, 'mlp_dropout_l2': 0.49403487000162893, 'mlp_n_units_l3': 172, 'mlp_dropout_l3': 0.4922078938414324, 'reduction': 'sum', 'lr': 1.076609528968547e-05, 'weight_decay': 0.218072880995822, 'criterion': 'MSELoss', 'batch_size': 32}. Best is trial 5 with value: 7.844568947224226.[0m

Trial Id: 19 | Model params: 189998 | Timestamp: 2022-02-18 08:50:37.117763

epoch 0 -0.43372537835139835 9.907224998200155
epoch 5 -0.522506453363681 10.209362180914429
epoch 10 -0.17947779098876437 8.985948466953989
epoch 15 -0.05231413411109176 8.487733628700932
epoch 20 0.016119017937154534 8.207111293382079
epoch 25 0.04638659634705666 8.079885624885716
epoch 30 0.05958757469763287 8.023765342277608
epoch 35 0.07947721803709495 7.938460906896208
epoch 40 0.08967984955756136 7.8943452870381465
epoch 45 0.08922289736604416 7.896326395441947
epoch 50 0.0918692346543789 7.88484633955304
epoch 55 0.09580632526037824 7.8677358776323905
epoch 60 0.09647691215533238 7.864817819639329
epoch 65 0.09559940582733806 7.868636068799612
epoch 70 0.09720167666284829 7.861662789930292
epoch 75 0.09601811093482004 7.866814409489936
epoch 80 0.09835312584688671 7.856647720013303
epoch 85 0.09850539152897708 7.855984296022818
epoch 90 0.09881404456588705 7.854639317932183
epoch 95 0.0981028801017082 7.857737923018376
[32m[I 2022-02-18 09:58:47,634][0m Trial 19 finished with value: 7.858095622448316 and parameters: {'n_layers_fe': 2, 'fe_n_units_l0': 205, 'fe_dropout_l0': 0.2932123224788741, 'fe_n_units_l1': 165, 'fe_dropout_l1': 0.22742374957417225, 'n_units_l(Invariant)': 437, 'n_layers_mlp': 4, 'mlp_n_units_l0': 165, 'mlp_dropout_l0': 0.07721988349516462, 'mlp_n_units_l1': 176, 'mlp_dropout_l1': 0.24435971568755288, 'mlp_n_units_l2': 133, 'mlp_dropout_l2': 0.4887086506368609, 'mlp_n_units_l3': 187, 'mlp_dropout_l3': 0.4981707139111623, 'reduction': 'sum', 'lr': 1.2455941054141868e-05, 'weight_decay': 0.150423637499834, 'criterion': 'MSELoss', 'batch_size': 128}. Best is trial 5 with value: 7.844568947224226.[0m

Trial Id: 20 | Model params: 139076 | Timestamp: 2022-02-18 09:58:47.635343

epoch 0 -0.6377963123487287 10.588854584834676
epoch 5 0.07444490534756343 7.9601303153202885
epoch 10 0.07979189375576512 7.937103931022339
epoch 15 0.06833014914450963 7.986381658081213
epoch 20 0.08725279742073933 7.904862045193786
epoch 25 0.07668476400743207 7.950492657358392
epoch 30 0.0740492253552757 7.9618316336789245
epoch 35 0.09454356550601861 7.873227839253785
epoch 40 0.09879255963824607 7.854732947526923
epoch 45 0.08813250858646304 7.901051750421884
epoch 50 0.09736218626086368 7.860963891630439
epoch 55 0.09882403891686942 7.854595762970322
epoch 60 0.10006513388054727 7.8491852447671695
epoch 65 0.09688538494421606 7.863039820114283
epoch 70 0.09995846755770676 7.849650400053072
epoch 75 0.09785098323654917 7.858835166440016
epoch 80 0.09909351150559964 7.853421321686497
epoch 85 0.09811296653223134 7.857693984110337
epoch 90 0.10033418446356634 7.848011834439929
epoch 95 0.09845786927916877 7.856191357232479
[32m[I 2022-02-18 10:50:51,425][0m Trial 20 finished with value: 7.846169733625607 and parameters: {'n_layers_fe': 2, 'fe_n_units_l0': 153, 'fe_dropout_l0': 0.4018936186623785, 'fe_n_units_l1': 78, 'fe_dropout_l1': 0.3243301387948853, 'n_units_l(Invariant)': 499, 'n_layers_mlp': 4, 'mlp_n_units_l0': 131, 'mlp_dropout_l0': 0.3195197959126823, 'mlp_n_units_l1': 221, 'mlp_dropout_l1': 0.1658533449436262, 'mlp_n_units_l2': 141, 'mlp_dropout_l2': 0.02019346002332459, 'mlp_n_units_l3': 159, 'mlp_dropout_l3': 0.4832352053979063, 'reduction': 'sum', 'lr': 5.283891526769333e-05, 'weight_decay': 0.20778309445497345, 'criterion': 'MSELoss', 'batch_size': 256}. Best is trial 5 with value: 7.844568947224226.[0m

Trial Id: 21 | Model params: 140197 | Timestamp: 2022-02-18 10:50:51.425725

epoch 0 -0.8572492505793465 11.275975813877293
epoch 5 -0.26702422021507544 9.313469533196855
epoch 10 -0.04485135495630099 8.45758351404777
epoch 15 0.05713683078217335 8.034213630100297
epoch 20 0.07190165852431407 7.971059263948446
epoch 25 0.07621677824967077 7.952507270483142
epoch 30 0.0739614632197666 7.962208938180274
epoch 35 0.10205368336411702 7.840508436169386
epoch 40 0.10322101291837926 7.835410451172782
epoch 45 0.09288755672851667 7.8804243083088705
epoch 50 0.102984936894014 7.836441714647366
epoch 55 0.10429316760754803 7.830725191710612
epoch 60 0.10418071799148187 7.831216722183611
epoch 65 0.10066633771600919 7.846562972398418
epoch 70 0.1051345994561993 7.827046214670414
epoch 75 0.10364376620561888 7.833563376226025
epoch 80 0.09942909741087924 7.851958493405992
epoch 85 0.10535276492207835 7.826092051467815
epoch 90 0.09936924724878593 7.852219401891738
epoch 95 0.1054075616605239 7.825852375498778
[32m[I 2022-02-18 11:43:16,405][0m Trial 21 finished with value: 7.828903375198209 and parameters: {'n_layers_fe': 2, 'fe_n_units_l0': 161, 'fe_dropout_l0': 0.4027666617485306, 'fe_n_units_l1': 79, 'fe_dropout_l1': 0.3165587516485809, 'n_units_l(Invariant)': 468, 'n_layers_mlp': 4, 'mlp_n_units_l0': 140, 'mlp_dropout_l0': 0.42403176807123705, 'mlp_n_units_l1': 219, 'mlp_dropout_l1': 0.18517876671947361, 'mlp_n_units_l2': 142, 'mlp_dropout_l2': 0.00029839705233726185, 'mlp_n_units_l3': 161, 'mlp_dropout_l3': 0.4829203917337979, 'reduction': 'sum', 'lr': 3.257675342919579e-05, 'weight_decay': 0.21913862224227204, 'criterion': 'MSELoss', 'batch_size': 256}. Best is trial 21 with value: 7.828903375198209.[0m

Trial Id: 22 | Model params: 160468 | Timestamp: 2022-02-18 11:43:16.405834

epoch 0 -1.4208704819479947 12.87374247515969
epoch 5 0.04294776911158027 8.09444096068481
epoch 10 0.09417642549323413 7.874823876293567
epoch 15 0.08755143517174635 7.903568760840742
epoch 20 0.09863396608317154 7.8554240510213305
epoch 25 0.10124206059675045 7.844051018694113
epoch 30 0.10228698959954285 7.839489801587455
epoch 35 0.10128206242787241 7.843876455621085
epoch 40 0.10508029575746569 7.8272836979340115
epoch 45 0.10579107954953126 7.82417469748679
epoch 50 0.1064348432178267 7.821357779556659
epoch 55 0.10398479769477731 7.832073039107255
epoch 60 0.10274434469663651 7.837492566748047
epoch 65 0.10662013272400495 7.820546819860731
epoch 70 0.10573546818602075 7.82441798865094
epoch 75 0.10644316480556593 7.821321360127118
epoch 80 0.10615707512294847 7.822573334362734
epoch 85 0.1051504845381881 7.826976743986582
epoch 90 0.10423759527824294 7.830968108741993
epoch 95 0.10647311971681861 7.821190261051189
[32m[I 2022-02-18 12:38:56,886][0m Trial 22 finished with value: 7.820470235629149 and parameters: {'n_layers_fe': 2, 'fe_n_units_l0': 182, 'fe_dropout_l0': 0.4233556227577563, 'fe_n_units_l1': 83, 'fe_dropout_l1': 0.32086989019959394, 'n_units_l(Invariant)': 499, 'n_layers_mlp': 4, 'mlp_n_units_l0': 128, 'mlp_dropout_l0': 0.4400093207752771, 'mlp_n_units_l1': 190, 'mlp_dropout_l1': 0.14647849119383785, 'mlp_n_units_l2': 167, 'mlp_dropout_l2': 0.0023129683142501553, 'mlp_n_units_l3': 251, 'mlp_dropout_l3': 0.4400761508787657, 'reduction': 'sum', 'lr': 5.1134498925799115e-05, 'weight_decay': 0.1767203522822288, 'criterion': 'MSELoss', 'batch_size': 256}. Best is trial 22 with value: 7.820470235629149.[0m

Trial Id: 23 | Model params: 165701 | Timestamp: 2022-02-18 12:38:56.886880

epoch 0 -1.1882070717253512 12.239487930489299
epoch 5 0.08741431738422811 7.904162591108518
epoch 10 0.09214746581052058 7.883638375867514
epoch 15 0.0968202909533834 7.863323188033939
epoch 20 0.09834504909944175 7.856682908965381
epoch 25 0.09930651468756779 7.852492866491634
epoch 30 0.09518233179356939 7.8704502126281755
epoch 35 0.10081714046051127 7.845905078176852
epoch 40 0.10070245685333967 7.846405403554333
epoch 45 0.1014418577716194 7.843179089627524
epoch 50 0.10165365121622116 7.842254702137542
epoch 55 0.10195666888277488 7.840931970573042
epoch 60 0.09692948487388997 7.862847837983465
epoch 65 0.10226146192112706 7.839601264020104
epoch 70 0.10204587513968177 7.840542525243161
epoch 75 0.10223269246265043 7.839726879255801
epoch 80 0.09887845183114807 7.854358629537975
epoch 85 0.08673077991965794 7.907122192628711
epoch 90 0.1012134299575197 7.84417595689853
epoch 95 0.09600101601954714 7.866888792556478
[32m[I 2022-02-18 13:36:11,274][0m Trial 23 finished with value: 7.8678851808412 and parameters: {'n_layers_fe': 2, 'fe_n_units_l0': 182, 'fe_dropout_l0': 0.44872369063361967, 'fe_n_units_l1': 98, 'fe_dropout_l1': 0.41735443453974597, 'n_units_l(Invariant)': 470, 'n_layers_mlp': 4, 'mlp_n_units_l0': 89, 'mlp_dropout_l0': 0.41501369674727184, 'mlp_n_units_l1': 181, 'mlp_dropout_l1': 0.07716002763257217, 'mlp_n_units_l2': 188, 'mlp_dropout_l2': 0.01577182595937283, 'mlp_n_units_l3': 248, 'mlp_dropout_l3': 0.4099652962344088, 'reduction': 'sum', 'lr': 8.370128781225228e-05, 'weight_decay': 0.17132537513819723, 'criterion': 'MSELoss', 'batch_size': 256}. Best is trial 22 with value: 7.820470235629149.[0m

Trial Id: 24 | Model params: 183473 | Timestamp: 2022-02-18 13:36:11.274294

epoch 0 -0.908963150346392 11.431884087555412
epoch 5 -1.363519872730596 12.720338513533706
epoch 10 -0.4822100415174184 10.073349803333523
epoch 15 -0.2561144526349983 9.273285826487943
epoch 20 -0.05607727072401292 8.502896399880804
epoch 25 -0.01205532953897781 8.323791015638616
epoch 30 0.0350634317882198 8.127714172610325
epoch 35 0.03567121754547897 8.125154062859272
epoch 40 0.061590094514783145 8.015217862744713
epoch 45 0.08367426242825982 7.920342866786691
epoch 50 0.08383335218096599 7.919655283740378
epoch 55 0.08219726697455565 7.926723567279457
epoch 60 0.09328747831385531 7.878686982775974
epoch 65 0.09244919558334463 7.8823281817526665
epoch 70 0.09176500931452336 7.88529879488372
epoch 75 0.08537947005078894 7.912969878317201
epoch 80 0.0747414070372393 7.958855198822951
epoch 85 0.08951169296673456 7.895074384867718
epoch 90 0.07777359900132164 7.945803398503946
epoch 95 0.08522711395117133 7.913628916128759
[32m[I 2022-02-18 14:40:28,483][0m Trial 24 finished with value: 7.895209629607023 and parameters: {'n_layers_fe': 2, 'fe_n_units_l0': 213, 'fe_dropout_l0': 0.36003100802365634, 'fe_n_units_l1': 127, 'fe_dropout_l1': 0.40679285116150377, 'n_units_l(Invariant)': 382, 'n_layers_mlp': 4, 'mlp_n_units_l0': 143, 'mlp_dropout_l0': 0.47219904818299707, 'mlp_n_units_l1': 191, 'mlp_dropout_l1': 0.14184214084272634, 'mlp_n_units_l2': 174, 'mlp_dropout_l2': 0.1769994571544906, 'mlp_n_units_l3': 236, 'mlp_dropout_l3': 0.13454028279387054, 'reduction': 'sum', 'lr': 1.762741038497126e-05, 'weight_decay': 0.12267692305869474, 'criterion': 'MSELoss', 'batch_size': 256}. Best is trial 22 with value: 7.820470235629149.[0m

Study statistics: 
  Number of finished trials:  25
  Number of pruned trials:  12
  Number of complete trials:  13

Best trial:
  Value:  7.820470235629149
  Params: 
    n_layers_fe: 2
    fe_n_units_l0: 182
    fe_dropout_l0: 0.4233556227577563
    fe_n_units_l1: 83
    fe_dropout_l1: 0.32086989019959394
    n_units_l(Invariant): 499
    n_layers_mlp: 4
    mlp_n_units_l0: 128
    mlp_dropout_l0: 0.4400093207752771
    mlp_n_units_l1: 190
    mlp_dropout_l1: 0.14647849119383785
    mlp_n_units_l2: 167
    mlp_dropout_l2: 0.0023129683142501553
    mlp_n_units_l3: 251
    mlp_dropout_l3: 0.4400761508787657
    reduction: sum
    lr: 5.1134498925799115e-05
    weight_decay: 0.1767203522822288
    criterion: MSELoss
    batch_size: 256
Target: 132567, NaN: 0, Max: 159.0, Min: 0.0, Mean: 21.53262878393567
Prediction: 132567, NaN: 0, Max: 35.846439361572266, Min: 8.779212951660156, Mean: 21.36156271014891

 XXXXXX======== TRIAL south - glbg ended

Test Set - R-squared:  0.10853444019032099
Test Set - RMSE:  7.914586061650801
Test Set - MAE:  6.069316463629732



[32m[I 2022-02-18 14:43:07,497][0m A new study created in memory with name: DeepSet[0m
Starting Loading des
Finished Loading des
Finished des setup

++++++++ Session Characteristics +++++++

Area: des
Gal Type: glbg
Training Set: 216623
Validation Set: 54158
Test Samples: 67698
Number of features: 5
Device: cuda:0
Number of Workers: 8
Number of Trials: 25

+++++++++++++++++++++++++++++++++++++++

Trial Id: 0 | Model params: 95886 | Timestamp: 2022-02-18 14:43:07.498007

