[32m[I 2022-02-18 14:44:14,425][0m Trial 0 pruned. [0m
++++++++++++++++++++
        NaN         
++++++++++++++++++++

Trial Id: 1 | Model params: 98232 | Timestamp: 2022-02-18 14:44:14.425769

[32m[I 2022-02-18 14:45:33,490][0m Trial 1 pruned. [0m
++++++++++++++++++++
        NaN         
++++++++++++++++++++

Trial Id: 2 | Model params: 180803 | Timestamp: 2022-02-18 14:45:33.490311

[32m[I 2022-02-18 14:46:46,438][0m Trial 2 pruned. [0m
++++++++++++++++++++
        NaN         
++++++++++++++++++++

Trial Id: 3 | Model params: 36930 | Timestamp: 2022-02-18 14:46:46.439082

[32m[I 2022-02-18 14:47:53,875][0m Trial 3 pruned. [0m
++++++++++++++++++++
        NaN         
++++++++++++++++++++

Trial Id: 4 | Model params: 77382 | Timestamp: 2022-02-18 14:47:53.876110

[32m[I 2022-02-18 14:48:33,576][0m Trial 4 pruned. [0m
++++++++++++++++++++
        NaN         
++++++++++++++++++++

Trial Id: 5 | Model params: 98827 | Timestamp: 2022-02-18 14:48:33.576404

[32m[I 2022-02-18 14:49:42,253][0m Trial 5 pruned. [0m
++++++++++++++++++++
        NaN         
++++++++++++++++++++

Trial Id: 6 | Model params: 251218 | Timestamp: 2022-02-18 14:49:42.253806

epoch 0 -7.832680712135874 28.341082705870264
epoch 5 -7.524885415978023 27.842898665720686
epoch 10 -7.545574042885061 27.87666347617172
epoch 15 -7.5292423887898945 27.85001285262126
epoch 20 -7.528079606263015 27.848114406626895
epoch 25 -7.5374031882220525 27.863333146475462
epoch 30 -7.540237485923864 27.867957879896686
epoch 35 -7.536459135567181 27.861792562045572
epoch 40 -7.537162399072159 27.862940214604915
epoch 45 -7.547652646092999 27.880053593599598
epoch 50 -7.5321161844619695 27.854704271989622
epoch 55 -7.539075776805829 27.866062407911603
epoch 60 -7.5412605945028215 27.869627101212853
epoch 65 -7.533511359314716 27.85698158476473
epoch 70 -7.533365605121034 27.856743682156058
epoch 75 -7.540209475337788 27.867912178680868
epoch 80 -7.538699314929536 27.865448136177786
epoch 85 -7.544625766905492 27.87511673960264
epoch 90 -7.544447629065006 27.87482616871541
epoch 95 -7.5222437262179636 27.838584355575602
[32m[I 2022-02-18 17:29:54,256][0m Trial 6 finished with value: 27.846747984161606 and parameters: {'n_layers_fe': 4, 'fe_n_units_l0': 15, 'fe_dropout_l0': 0.2461797445775608, 'fe_n_units_l1': 109, 'fe_dropout_l1': 0.12148420793867554, 'fe_n_units_l2': 233, 'fe_dropout_l2': 0.13244441840641874, 'fe_n_units_l3': 217, 'fe_dropout_l3': 0.2990234587424216, 'n_units_l(Invariant)': 463, 'n_layers_mlp': 4, 'mlp_n_units_l0': 253, 'mlp_dropout_l0': 0.20882191110134363, 'mlp_n_units_l1': 80, 'mlp_dropout_l1': 0.31321857095664496, 'mlp_n_units_l2': 148, 'mlp_dropout_l2': 0.21181477010466765, 'mlp_n_units_l3': 223, 'mlp_dropout_l3': 0.06434751902470565, 'reduction': 'sum', 'lr': 5.635422618155183e-05, 'weight_decay': 0.2254971790491006, 'criterion': 'PoissonNLLLoss', 'batch_size': 128}. Best is trial 6 with value: 27.846747984161606.[0m

Trial Id: 7 | Model params: 138011 | Timestamp: 2022-02-18 17:29:54.256849

epoch 0 -0.43871344714615024 11.438190439704671
epoch 5 0.054797898370731124 9.271126587044199
epoch 10 0.06679127472755719 9.212119583961758
epoch 15 0.07064902386147343 9.19305908400548
epoch 20 0.06987221622187467 9.19690033831351
epoch 25 0.05241320083493062 9.282814513563983
epoch 30 0.07367679326867715 9.178071651095816
epoch 35 0.023476487162813142 9.42348457476129
epoch 40 0.017304008036933327 9.453219975424124
epoch 45 0.0572821435789328 9.258935064676873
epoch 50 0.028537904433160177 9.399031424816929
epoch 55 0.021662259253229954 9.432234192808755
epoch 60 0.03232166951376636 9.380709338905325
epoch 65 -0.00046587623481197937 9.53830733567034
epoch 70 -0.010939400292160562 9.58810393528816
epoch 75 -0.00849538220470114 9.576506959435568
epoch 80 -0.0018849939910645652 9.545069777536554
epoch 85 -0.03968841500558917 9.72348109177973
epoch 90 -0.011130504111060535 9.589010140295102
epoch 95 -0.02026117012170947 9.632207966570956
[32m[I 2022-02-18 19:41:52,743][0m Trial 7 finished with value: 9.733513606043184 and parameters: {'n_layers_fe': 4, 'fe_n_units_l0': 11, 'fe_dropout_l0': 0.286643186634318, 'fe_n_units_l1': 210, 'fe_dropout_l1': 0.1365939574727953, 'fe_n_units_l2': 163, 'fe_dropout_l2': 0.0071590250898953545, 'fe_n_units_l3': 176, 'fe_dropout_l3': 0.18055670808764646, 'n_units_l(Invariant)': 237, 'n_layers_mlp': 4, 'mlp_n_units_l0': 98, 'mlp_dropout_l0': 0.058376572852585906, 'mlp_n_units_l1': 51, 'mlp_dropout_l1': 0.04163921402918819, 'mlp_n_units_l2': 207, 'mlp_dropout_l2': 0.19386049577781145, 'mlp_n_units_l3': 57, 'mlp_dropout_l3': 0.4492916624184594, 'reduction': 'sum', 'lr': 2.5993909991520956e-05, 'weight_decay': 0.08970153745463998, 'criterion': 'MSELoss', 'batch_size': 32}. Best is trial 7 with value: 9.733513606043184.[0m

Trial Id: 8 | Model params: 26829 | Timestamp: 2022-02-18 19:41:52.743769

[32m[I 2022-02-18 19:42:29,277][0m Trial 8 pruned. [0m
++++++++++++++++++++
        NaN         
++++++++++++++++++++

Trial Id: 9 | Model params: 133157 | Timestamp: 2022-02-18 19:42:29.278000

epoch 0 -9.605839336017988 31.05579802448533
epoch 5 -9.605839336017988 31.05579802448533
epoch 10 -9.605839336017988 31.05579802448533
epoch 15 -9.605839336017988 31.05579802448533
epoch 20 -9.605839336017988 31.05579802448533
epoch 25 -9.605839336017988 31.05579802448533
epoch 30 -9.605839336017988 31.05579802448533
epoch 35 -9.605839336017988 31.05579802448533
epoch 40 -9.605839336017988 31.05579802448533
epoch 45 -9.605839336017988 31.05579802448533
epoch 50 -7.55588073023382 27.893469221090236
epoch 55 -7.5445831894354765 27.87504728931552
epoch 60 -7.535651308459224 27.86047421427036
epoch 65 -7.5402431155087175 27.867967064946164
epoch 70 -7.538203283782607 27.86463874294154
epoch 75 -7.541284487546994 27.869666081979116
epoch 80 -7.515766623316965 27.828003359836952
epoch 85 -7.5344743056859595 27.858553272051324
epoch 90 -7.548671861321036 27.881715741638338
epoch 95 -7.548411796226226 27.881291633875534
[32m[I 2022-02-18 21:07:15,034][0m Trial 9 finished with value: 27.88280323581319 and parameters: {'n_layers_fe': 2, 'fe_n_units_l0': 240, 'fe_dropout_l0': 0.4585975709271055, 'fe_n_units_l1': 137, 'fe_dropout_l1': 0.07259775380878819, 'n_units_l(Invariant)': 241, 'n_layers_mlp': 4, 'mlp_n_units_l0': 236, 'mlp_dropout_l0': 0.35092409021867743, 'mlp_n_units_l1': 77, 'mlp_dropout_l1': 0.19935391782488743, 'mlp_n_units_l2': 227, 'mlp_dropout_l2': 0.3705003247922451, 'mlp_n_units_l3': 104, 'mlp_dropout_l3': 0.05676739393403035, 'reduction': 'sum', 'lr': 0.0034102711813509645, 'weight_decay': 0.16807872476492267, 'criterion': 'PoissonNLLLoss', 'batch_size': 256}. Best is trial 7 with value: 9.733513606043184.[0m

Trial Id: 10 | Model params: 195066 | Timestamp: 2022-02-18 21:07:15.034774

epoch 0 -0.16433133416116874 10.289836266242265
epoch 5 0.019222407467898384 9.443988274399134
epoch 10 0.04596357506091253 9.314352072728845
epoch 15 0.05004992918285833 9.294382926753977
epoch 20 0.0714866671439277 9.18891520277919
epoch 25 0.06545391379159748 9.218718063937587
epoch 30 0.05008496181022304 9.294211544243636
epoch 35 0.02473995733787593 9.41738633684556
epoch 40 0.023304295317727486 9.424315366672642
epoch 45 0.061799963489738374 9.236722460218392
epoch 50 0.04982232574880463 9.295496304624983
epoch 55 0.07842163572585426 9.154535366245353
epoch 60 0.05972482117945355 9.246931864240958
epoch 65 0.011241849561978934 9.48233315456567
epoch 70 0.032045866437792836 9.38204606624816
epoch 75 0.04373306993741033 9.325234037203149
epoch 80 -0.019192524996175964 9.627162146346159
epoch 85 -0.024888805725601593 9.65402782984013
epoch 90 0.05401270692406601 9.27497660922257
epoch 95 -0.021173601353551508 9.636514100897598
[32m[I 2022-02-18 23:51:56,471][0m Trial 10 finished with value: 9.4543271130416 and parameters: {'n_layers_fe': 4, 'fe_n_units_l0': 8, 'fe_dropout_l0': 0.351580532122599, 'fe_n_units_l1': 254, 'fe_dropout_l1': 0.2684951581318782, 'fe_n_units_l2': 204, 'fe_dropout_l2': 0.0003014157192497424, 'fe_n_units_l3': 238, 'fe_dropout_l3': 0.027209784388810998, 'n_units_l(Invariant)': 357, 'n_layers_mlp': 4, 'mlp_n_units_l0': 10, 'mlp_dropout_l0': 0.012182382189048407, 'mlp_n_units_l1': 12, 'mlp_dropout_l1': 0.007834585862430403, 'mlp_n_units_l2': 244, 'mlp_dropout_l2': 0.018248656933259833, 'mlp_n_units_l3': 11, 'mlp_dropout_l3': 0.49703896482082965, 'reduction': 'sum', 'lr': 0.00035917098369155553, 'weight_decay': 0.004056405538509597, 'criterion': 'MSELoss', 'batch_size': 32}. Best is trial 10 with value: 9.4543271130416.[0m

Trial Id: 11 | Model params: 204789 | Timestamp: 2022-02-18 23:51:56.471389

epoch 0 0.025117685170735538 9.415562436922032
epoch 5 0.025870352482352477 9.411927047120288
epoch 10 0.04746363158544953 9.307026591902213
epoch 15 0.05833043947002836 9.253785696125199
epoch 20 0.06322093556931685 9.229724966231228
epoch 25 0.07241554183169363 9.184317807042197
epoch 30 0.07516355782776707 9.170703212456466
epoch 35 0.0759577237666531 9.166764881323049
epoch 40 0.0770394992590897 9.161397548126509
epoch 45 0.07839813316972799 9.15465209728954
epoch 50 0.08189648979506425 9.137260266115279
epoch 55 0.08105034703518466 9.141469838344342
epoch 60 0.08079351730465967 9.142747186460522
epoch 65 0.07859518632939044 9.153673339745149
epoch 70 0.08262841272518029 9.133617374188209
epoch 75 0.08276369447453324 9.132943897208055
epoch 80 0.08382119805888855 9.127677584577318
epoch 85 0.08275126816634815 9.133005761522872
epoch 90 0.04110854656629237 9.338022059129955
epoch 95 0.08497779022953955 9.12191433491174
[32m[I 2022-02-19 02:37:28,013][0m Trial 11 finished with value: 9.168701577390122 and parameters: {'n_layers_fe': 4, 'fe_n_units_l0': 8, 'fe_dropout_l0': 0.3576219427636114, 'fe_n_units_l1': 256, 'fe_dropout_l1': 0.24161933888933365, 'fe_n_units_l2': 202, 'fe_dropout_l2': 0.010201676931934333, 'fe_n_units_l3': 252, 'fe_dropout_l3': 0.014189205051106546, 'n_units_l(Invariant)': 360, 'n_layers_mlp': 4, 'mlp_n_units_l0': 15, 'mlp_dropout_l0': 0.006355466788939272, 'mlp_n_units_l1': 8, 'mlp_dropout_l1': 0.016892265488039987, 'mlp_n_units_l2': 247, 'mlp_dropout_l2': 0.0001772516092712305, 'mlp_n_units_l3': 21, 'mlp_dropout_l3': 0.4988402038779662, 'reduction': 'sum', 'lr': 0.00038077153445449614, 'weight_decay': 0.01978195330724139, 'criterion': 'MSELoss', 'batch_size': 32}. Best is trial 11 with value: 9.168701577390122.[0m

Trial Id: 12 | Model params: 238834 | Timestamp: 2022-02-19 02:37:28.013309

[32m[I 2022-02-19 02:39:21,663][0m Trial 12 pruned. [0m
epoch 0 -0.07850995202209998 9.903352784872215

Trial Id: 13 | Model params: 225719 | Timestamp: 2022-02-19 02:39:21.664153

[32m[I 2022-02-19 02:41:11,353][0m Trial 13 pruned. [0m
epoch 0 -0.11811228731145129 10.083536662694872

Trial Id: 14 | Model params: 94823 | Timestamp: 2022-02-19 02:41:11.353560

[32m[I 2022-02-19 02:42:33,619][0m Trial 14 pruned. [0m
epoch 0 -0.001980609340435757 9.545525235704481

Trial Id: 15 | Model params: 165631 | Timestamp: 2022-02-19 02:42:33.619767

[32m[I 2022-02-19 02:44:02,398][0m Trial 15 pruned. [0m
epoch 0 -0.14821911682279887 10.218391978243272

Trial Id: 16 | Model params: 189457 | Timestamp: 2022-02-19 02:44:02.398310

[32m[I 2022-02-19 02:45:35,178][0m Trial 16 pruned. [0m
epoch 0 0.020386417617879626 9.438382435783645

Trial Id: 17 | Model params: 283031 | Timestamp: 2022-02-19 02:45:35.179169

[32m[I 2022-02-19 02:47:23,537][0m Trial 17 pruned. [0m
++++++++++++++++++++
        NaN         
++++++++++++++++++++

Trial Id: 18 | Model params: 154019 | Timestamp: 2022-02-19 02:47:23.537887

[32m[I 2022-02-19 02:48:47,646][0m Trial 18 pruned. [0m
epoch 0 -0.18289330182005958 10.371533105218125

Trial Id: 19 | Model params: 101982 | Timestamp: 2022-02-19 02:48:47.646953

epoch 0 -1.34521165108844 14.603642513062795
epoch 5 0.032871747237159576 9.378042723046718
epoch 10 0.07493765959634491 9.171823150563268
epoch 15 0.08220061925141553 9.13574674387144
epoch 20 0.07819023312672102 9.155684617572312
epoch 25 0.08291364875000651 9.132197317534153
epoch 30 0.08505251057579044 9.121541881377
epoch 35 0.08515581196593602 9.12102693676788
epoch 40 0.09153424013484635 9.089174749787778
epoch 45 0.09286094621132934 9.082535496179188
epoch 50 0.09211215336567857 9.086283286940425
epoch 55 0.09280819766923176 9.082799559080906
epoch 60 0.09573083272282834 9.068157052986773
epoch 65 0.09674374313351253 9.063076815458603
epoch 70 0.09715059685337535 9.061035444693575
epoch 75 0.0984348048509005 9.054588968168973
epoch 80 0.08722398152083999 9.110711243776818
epoch 85 0.09887663649465828 9.052369997086917
epoch 90 0.09869443812444023 9.053285101369987
epoch 95 0.0862220102081761 9.1157103713367
[32m[I 2022-02-19 04:36:27,199][0m Trial 19 finished with value: 9.11683818958922 and parameters: {'n_layers_fe': 2, 'fe_n_units_l0': 27, 'fe_dropout_l0': 0.4975557917424174, 'fe_n_units_l1': 176, 'fe_dropout_l1': 0.21694454026202287, 'n_units_l(Invariant)': 511, 'n_layers_mlp': 2, 'mlp_n_units_l0': 120, 'mlp_dropout_l0': 0.04057315765073904, 'mlp_n_units_l1': 26, 'mlp_dropout_l1': 0.005247318521350927, 'reduction': 'sum', 'lr': 0.00019043054991945972, 'weight_decay': 0.030562879467934713, 'criterion': 'MSELoss', 'batch_size': 32}. Best is trial 19 with value: 9.11683818958922.[0m

Trial Id: 20 | Model params: 102926 | Timestamp: 2022-02-19 04:36:27.199833

[32m[I 2022-02-19 04:37:27,072][0m Trial 20 pruned. [0m
epoch 0 -0.7560059973380722 12.636685269506374

Trial Id: 21 | Model params: 104628 | Timestamp: 2022-02-19 04:37:27.072291

[32m[I 2022-02-19 04:38:31,679][0m Trial 21 pruned. [0m
epoch 0 0.00460766108474675 9.514091384017132

Trial Id: 22 | Model params: 39426 | Timestamp: 2022-02-19 04:38:31.679676

epoch 0 -1.6656216074645327 15.569311998243553
epoch 5 -0.0017437269750943951 9.544396820526629
epoch 10 0.060692991507034444 9.242170007822988
epoch 15 0.06103554596670058 9.240484597609255
epoch 20 0.06519968069207394 9.219971904667617
epoch 25 0.06811780481056928 9.20556987050204
epoch 30 0.05051006620034837 9.292131646511917
epoch 35 0.06085856920080224 9.24135538351685
epoch 40 0.0523541005461059 9.28310399019314
epoch 45 0.035358343161154715 9.36597896043388
epoch 50 0.05556555601868973 9.267360991911158
epoch 55 0.03934335055098448 9.346613156835177
epoch 60 0.03087633257136224 9.387712299701196
epoch 65 0.0604878814526113 9.243179027505455
epoch 70 0.0014575005501770155 9.529134316798231
epoch 75 0.050559277952547554 9.291890839322152
epoch 80 0.02444040262192837 9.418832518262365
epoch 85 0.06434242325509665 9.224198517607434
epoch 90 0.0413801590072328 9.336699436747088
epoch 95 0.040144088784451415 9.342716993340588
[32m[I 2022-02-19 06:19:09,978][0m Trial 22 finished with value: 9.486200247945135 and parameters: {'n_layers_fe': 2, 'fe_n_units_l0': 30, 'fe_dropout_l0': 0.493986593066886, 'fe_n_units_l1': 94, 'fe_dropout_l1': 0.2142050830400283, 'n_units_l(Invariant)': 335, 'n_layers_mlp': 2, 'mlp_n_units_l0': 122, 'mlp_dropout_l0': 0.04183419664542283, 'mlp_n_units_l1': 11, 'mlp_dropout_l1': 0.0026217097518038126, 'reduction': 'sum', 'lr': 0.0002619482096663222, 'weight_decay': 0.027692515427355006, 'criterion': 'MSELoss', 'batch_size': 32}. Best is trial 19 with value: 9.11683818958922.[0m

Trial Id: 23 | Model params: 102961 | Timestamp: 2022-02-19 06:19:09.978676

[32m[I 2022-02-19 06:20:15,974][0m Trial 23 pruned. [0m
epoch 0 -0.9102660689222501 13.180051354275438

Trial Id: 24 | Model params: 82874 | Timestamp: 2022-02-19 06:20:15.974565

epoch 0 -9.605839336017988 31.05579802448533
epoch 5 0.048001715915594434 9.304397467818038
epoch 10 0.008621479174871105 9.494889705662565
epoch 15 0.003926167122536128 9.517347731378873
epoch 20 0.019298900492336735 9.443619988399687
epoch 25 0.03616196585184328 9.362076847457683
epoch 30 0.013403526277943612 9.4719620874019
epoch 35 -0.000541875680232895 9.538669613044714
epoch 40 0.0015993072546960363 9.528457659012439
epoch 45 0.028214959949203977 9.400593561490236
epoch 50 0.04266165093446983 9.330456656336397
epoch 55 0.026848508048155084 9.407200447788846
epoch 60 -0.02272894527259739 9.643849969578017
epoch 65 0.02891869769099209 9.397189130292983
epoch 70 -0.021445470667958322 9.637796790798708
epoch 75 -0.000936315629004314 9.540549625118953
epoch 80 0.010004531146616591 9.488264330555543
epoch 85 0.013318959416921738 9.472368026891164
epoch 90 -0.009168315127611848 9.579701457036212
epoch 95 -0.040851171358694094 9.728916797291664
[32m[I 2022-02-19 08:02:10,134][0m Trial 24 finished with value: 9.428291012112746 and parameters: {'n_layers_fe': 2, 'fe_n_units_l0': 11, 'fe_dropout_l0': 0.32837754122939433, 'fe_n_units_l1': 256, 'fe_dropout_l1': 0.23167008852183063, 'n_units_l(Invariant)': 290, 'n_layers_mlp': 2, 'mlp_n_units_l0': 158, 'mlp_dropout_l0': 0.027929684184920485, 'mlp_n_units_l1': 8, 'mlp_dropout_l1': 0.0045398890578247815, 'reduction': 'sum', 'lr': 0.0002502515045756153, 'weight_decay': 0.1227699865625896, 'criterion': 'MSELoss', 'batch_size': 32}. Best is trial 19 with value: 9.11683818958922.[0m

Study statistics: 
  Number of finished trials:  25
  Number of pruned trials:  17
  Number of complete trials:  8

Best trial:
  Value:  9.11683818958922
  Params: 
    n_layers_fe: 2
    fe_n_units_l0: 27
    fe_dropout_l0: 0.4975557917424174
    fe_n_units_l1: 176
    fe_dropout_l1: 0.21694454026202287
    n_units_l(Invariant): 511
    n_layers_mlp: 2
    mlp_n_units_l0: 120
    mlp_dropout_l0: 0.04057315765073904
    mlp_n_units_l1: 26
    mlp_dropout_l1: 0.005247318521350927
    reduction: sum
    lr: 0.00019043054991945972
    weight_decay: 0.030562879467934713
    criterion: MSELoss
    batch_size: 32
Target: 67698, NaN: 0, Max: 122.0, Min: 3.0, Mean: 29.60905787467872
Prediction: 67698, NaN: 0, Max: 43.40789794921875, Min: 19.761886596679688, Mean: 28.490187221751256

 XXXXXX======== TRIAL des - glbg ended

Test Set - R-squared:  0.08593505945647051
Test Set - RMSE:  9.104543420123958
Test Set - MAE:  6.9898626658338125



