[32m[I 2022-03-12 08:20:28,001][0m Trial 2 pruned. [0m
++++++++++++++++++++
        NaN         
++++++++++++++++++++

Trial Id: 3 | Model params: 347478 | Timestamp: 2022-03-12 08:20:28.001525

epoch 0 0.005311428017532593 4.8567046621579495
epoch 5 0.0007557704281635491 4.867813771247455
epoch 10 0.003499730526529521 4.861125581949279
epoch 15 0.008306732016383434 4.849386655599771
epoch 20 0.008721135335837293 4.848373332238353
epoch 25 0.008421608219861376 4.849105774767004
epoch 30 0.003181648402003412 4.8619013538333
epoch 35 0.0056198143558929825 4.855951734299531
epoch 40 0.007313057357608566 4.851815585141335
epoch 45 0.004873483517618293 4.857773706826325
[32m[I 2022-03-12 08:41:15,320][0m Trial 3 finished with value: 4.847452978104824 and parameters: {'n_layers_fe': 2, 'fe_neurons': 256, 'fe_dropout': 0.37227451445057513, 'n_units_l(Invariant)': 170, 'n_layers_mlp': 4, 'initialiser': 'xavier', 'lr': 0.0014381255254128577, 'weight_decay': 0.14081052582309558, 'criterion': 'MSELoss', 'batch_size': 128, 'epochs': 50}. Best is trial 3 with value: 4.847452978104824.[0m

Trial Id: 4 | Model params: 124622 | Timestamp: 2022-03-12 08:41:15.321145

epoch 0 -0.2040307098729408 5.34339048257996
epoch 5 0.009569892809603964 4.846297239179934
epoch 10 0.009693656007272455 4.845994435389245
epoch 15 0.010242470369002166 4.8446514570608175
epoch 20 0.010240478377896545 4.844656332243611
[32m[I 2022-03-12 08:51:59,112][0m Trial 4 finished with value: 4.845579539012782 and parameters: {'n_layers_fe': 4, 'fe_neurons': 128, 'fe_dropout': 0.15675342497359612, 'n_units_l(Invariant)': 358, 'n_layers_mlp': 2, 'initialiser': 'normal', 'lr': 0.00010134440370506605, 'weight_decay': 0.03868280812377981, 'criterion': 'MSELoss', 'batch_size': 256, 'epochs': 25}. Best is trial 4 with value: 4.845579539012782.[0m

Trial Id: 5 | Model params: 135412 | Timestamp: 2022-03-12 08:51:59.113074

epoch 0 0.00850294008246788 4.848906902496592
epoch 5 0.00951414612207202 4.8464336249856785
epoch 10 0.008671180272162737 4.848495496523218
epoch 15 0.00884494373188871 4.848070547577373
epoch 20 0.009639089511423227 4.846127942204786
epoch 25 0.010307706814231765 4.84449179520529
epoch 30 0.008949322862754405 4.847815264253937
epoch 35 0.00871561249320063 4.848386838410337
epoch 40 0.009671280531966642 4.846049181487256
epoch 45 0.007348329031985457 4.851729388188261
[32m[I 2022-03-12 09:09:16,057][0m Trial 5 finished with value: 4.847843662404964 and parameters: {'n_layers_fe': 2, 'fe_neurons': 128, 'fe_dropout': 0.2018896613084648, 'n_units_l(Invariant)': 441, 'n_layers_mlp': 4, 'initialiser': 'kaiming_he', 'lr': 0.0010920169916387337, 'weight_decay': 0.055284124607618286, 'criterion': 'MSELoss', 'batch_size': 256, 'epochs': 50}. Best is trial 4 with value: 4.845579539012782.[0m

Trial Id: 6 | Model params: 428490 | Timestamp: 2022-03-12 09:09:16.057175

epoch 0 -0.04985041976906812 4.989555337668285
epoch 5 0.008578357331909814 4.848722485320576
epoch 10 0.007756227626345202 4.850732453915908
epoch 15 0.0073242205969308305 4.851788304571566
epoch 20 0.006937841655473065 4.852732442873495
epoch 25 0.00835098529333178 4.849278454983829
epoch 30 0.0033578721619250684 4.8614715762285075
epoch 35 0.006000507511589093 4.8550221076916635
epoch 40 0.00895327071094365 4.847805608613608
epoch 45 0.008798537466153888 4.8481840405244885
epoch 50 0.00950003101415875 4.846468157376843
epoch 55 0.009523806848964367 4.846409990026312
epoch 60 0.009593899628742908 4.8462385046536465
epoch 65 0.0027616279462207016 4.862925553954359
epoch 70 0.009059229059512286 4.847546448681117
[32m[I 2022-03-12 10:13:23,838][0m Trial 6 finished with value: 4.846838072794641 and parameters: {'n_layers_fe': 4, 'fe_neurons': 256, 'fe_dropout': 0.4928605331187465, 'n_units_l(Invariant)': 484, 'n_layers_mlp': 2, 'initialiser': 'normal', 'lr': 0.0006374212588465203, 'weight_decay': 0.28077788542077325, 'criterion': 'MSELoss', 'batch_size': 128, 'epochs': 75}. Best is trial 4 with value: 4.845579539012782.[0m

Trial Id: 7 | Model params: 546142 | Timestamp: 2022-03-12 10:13:23.838895

epoch 0 -0.08504915833677806 5.072509133817671
epoch 5 -0.052194336812289466 4.995122122788366
epoch 10 -0.0343850543186528 4.9526683732366905
epoch 15 -0.004557028851641665 4.880737254969882
epoch 20 0.0049110405244198185 4.85768203749657
epoch 25 0.0067450621087533635 4.85320344167028
epoch 30 0.008394889777443404 4.849171104791207
epoch 35 0.007900507530068102 4.850379774123829
epoch 40 0.008565203552225342 4.848754650654189
epoch 45 0.008588419177730011 4.848697880641922
epoch 50 0.008642972867730747 4.848564475906132
epoch 55 0.00868675055358481 4.848457419986813
epoch 60 0.008880689690109689 4.847983124076537
epoch 65 0.00895669994380588 4.8477972213861475
epoch 70 0.008884338254524726 4.847974200733602
[32m[I 2022-03-12 11:14:22,564][0m Trial 7 finished with value: 4.847798299423699 and parameters: {'n_layers_fe': 4, 'fe_neurons': 256, 'fe_dropout': 0.02380003045632101, 'n_units_l(Invariant)': 430, 'n_layers_mlp': 4, 'initialiser': 'normal', 'lr': 1.6312211274230684e-05, 'weight_decay': 0.2781681667831237, 'criterion': 'MSELoss', 'batch_size': 256, 'epochs': 75}. Best is trial 4 with value: 4.845579539012782.[0m

Trial Id: 8 | Model params: 48664 | Timestamp: 2022-03-12 11:14:22.564909

epoch 0 -2.141846313344726 8.631585944274674
epoch 5 -1.8632179234191764 8.239964345945687
epoch 10 -1.7530436024719651 8.079875620212798
epoch 15 -1.7399290118615056 8.060607716681057
epoch 20 -1.7093493689555794 8.015500320887362
epoch 25 -1.7231388095843703 8.035872183412799
epoch 30 -1.7106033896068675 8.01735509093336
epoch 35 -1.71744366815753 8.027464719608604
epoch 40 -1.70507208792765 8.009170740455822
epoch 45 -1.7075786027831321 8.012880522774541
epoch 50 -1.7139325519599264 8.022277036795641
epoch 55 -1.7146443607815272 8.023329007152025
epoch 60 -1.7125414130780685 8.02022069755299
epoch 65 -1.7113523309052003 8.018462614381395
epoch 70 -1.7097279240446563 8.01606027127442
[32m[I 2022-03-12 11:34:19,013][0m Trial 8 finished with value: 8.018312787084211 and parameters: {'n_layers_fe': 4, 'fe_neurons': 64, 'fe_dropout': 0.22481541525772114, 'n_units_l(Invariant)': 299, 'n_layers_mlp': 4, 'initialiser': 'uniform', 'lr': 7.956264934000892e-05, 'weight_decay': 0.25524728609347463, 'criterion': 'PoissonNLLLoss', 'batch_size': 256, 'epochs': 75}. Best is trial 4 with value: 4.845579539012782.[0m

Trial Id: 9 | Model params: 47938 | Timestamp: 2022-03-12 11:34:19.013438

epoch 0 -2.0379545636528333 8.487675505649532
epoch 5 -2.0588989491302807 8.516883283411866
[32m[I 2022-03-12 11:39:05,340][0m Trial 9 pruned. [0m
++++++++++++++++++++
        NaN         
++++++++++++++++++++

Trial Id: 10 | Model params: 46878 | Timestamp: 2022-03-12 11:39:05.341104

epoch 0 -0.09003328979484881 5.084145973313993
epoch 5 0.009121429530796421 4.847394308202996
epoch 10 0.010772253189001768 4.843354696702524
epoch 15 0.010967445553353383 4.842876832784086
epoch 20 0.010870792377277283 4.843113461998123
[32m[I 2022-03-12 11:43:49,468][0m Trial 10 finished with value: 4.842668277962739 and parameters: {'n_layers_fe': 2, 'fe_neurons': 128, 'fe_dropout': 0.050593072612247714, 'n_units_l(Invariant)': 14, 'n_layers_mlp': 2, 'initialiser': 'normal', 'lr': 0.00011799509944503978, 'weight_decay': 0.018286638759253848, 'criterion': 'MSELoss', 'batch_size': 256, 'epochs': 25}. Best is trial 10 with value: 4.842668277962739.[0m

Trial Id: 11 | Model params: 45448 | Timestamp: 2022-03-12 11:43:49.468808

[32m[I 2022-03-12 11:44:00,930][0m Trial 11 pruned. [0m
epoch 0 -0.028610749685536785 4.938825250236725

Trial Id: 12 | Model params: 50908 | Timestamp: 2022-03-12 11:44:00.930237

epoch 0 -0.10443438192526244 5.117620643421431
epoch 5 -0.09294338364487431 5.090928096547335
epoch 10 -0.020513461068008443 4.919347470178924
epoch 15 -0.006547516778022455 4.885570350836958
epoch 20 -0.004995539023874951 4.881802410733817
[32m[I 2022-03-12 11:48:45,708][0m Trial 12 finished with value: 4.906562884771944 and parameters: {'n_layers_fe': 2, 'fe_neurons': 128, 'fe_dropout': 0.10115264224120155, 'n_units_l(Invariant)': 45, 'n_layers_mlp': 2, 'initialiser': 'normal', 'lr': 2.7755738811689166e-05, 'weight_decay': 0.06713289540652946, 'criterion': 'MSELoss', 'batch_size': 256, 'epochs': 25}. Best is trial 10 with value: 4.842668277962739.[0m

Trial Id: 13 | Model params: 89388 | Timestamp: 2022-03-12 11:48:45.708909

[32m[I 2022-03-12 11:49:57,706][0m Trial 13 pruned. [0m
epoch 0 -0.033301798863507814 4.950074363217785

Trial Id: 14 | Model params: 125922 | Timestamp: 2022-03-12 11:49:57.706373

[32m[I 2022-03-12 11:50:23,315][0m Trial 14 pruned. [0m
epoch 0 -0.06738708115879466 5.03105542251807

Study statistics: 
  Number of finished trials:  15
  Number of pruned trials:  5
  Number of complete trials:  10

Best trial:
  Value:  4.842668277962739
  Params: 
    n_layers_fe: 2
    fe_neurons: 128
    fe_dropout: 0.050593072612247714
    n_units_l(Invariant): 14
    n_layers_mlp: 2
    initialiser: normal
    lr: 0.00011799509944503978
    weight_decay: 0.018286638759253848
    criterion: MSELoss
    batch_size: 256
    epochs: 25
Target: 72610, NaN: 0, Max: 178.0, Min: 0.0, Mean: 8.480057843272277
Prediction: 72610, NaN: 0, Max: 10.800793647766113, Min: 7.690536022186279, Mean: 8.595131012540007

 XXXXXX======== TRIAL north - lrg ended

Test Set - R-squared:  0.011052627594294595
Test Set - RMSE:  4.842668277962739
Test Set - MAE:  3.295208450710621



[32m[I 2022-03-12 11:50:50,975][0m A new study created in memory with name: DeepSet[0m
Starting Loading north
Finished Loading north
Finished north setup

++++++++ Session Characteristics +++++++

Area: north
Gal Type: lrg
Training Set: 290439
Validation Set: 72610
Test Samples: 72610
Number of features: 5
Device: cuda:0
Number of Workers: 8
Number of Trials: 15

+++++++++++++++++++++++++++++++++++++++

Previous best Test-set performance: 0.014333634977770293

Trial Id: 0 | Model params: 41198 | Timestamp: 2022-03-12 11:50:50.975914

epoch 0 0.008233996994451043 4.849564489708802
epoch 1 0.007004829207101437 4.852568768251269
epoch 2 0.006671506763297086 4.853383139969951
epoch 3 0.00837889878101572 4.849210204410801
epoch 4 0.009214024992620362 4.847167813648357
epoch 5 0.004847700346948036 4.857836637516653
epoch 6 0.008741485104466817 4.848323566332198
epoch 7 0.00837914883319868 4.8492095930101
epoch 8 0.008973060194695459 4.847757207238369
epoch 9 0.009523770708021573 4.8464100784453095
epoch 10 0.008257762239865962 4.849506385387652
epoch 11 0.004158140963882229 4.859519388367009
epoch 12 0.005733709115505636 4.855673629757007
epoch 13 0.009607463850008546 4.846205318430121
epoch 14 0.0073820199762861805 4.851647052794914
epoch 15 0.008386226310456046 4.8491922878920155
epoch 16 0.0065961818556496965 4.853567154477226
epoch 17 0.00907192218145636 4.847515402075181
epoch 18 0.00904324456932426 4.847585545491161
[32m[I 2022-03-12 12:14:49,046][0m Trial 0 finished with value: 4.848049925173566 and parameters: {'lr': 0.0004618840655416772, 'weight_decay': 0.19679660762496148, 'criterion': 'MSELoss', 'batch_size': 32, 'epochs': 20}. Best is trial 0 with value: 4.848049925173566.[0m
epoch 19 0.008853375934403718 4.848049925173566

Previous best Test-set performance: 0.014333634977770293

Trial Id: 1 | Model params: 41198 | Timestamp: 2022-03-12 12:14:49.047270

epoch 0 0.014053532556098758 4.8353152939441
epoch 1 0.013841961903541922 4.835834062442535
epoch 2 0.013523714565676137 4.836614295992166
epoch 3 0.013408024792057938 4.83689789652919
[32m[I 2022-03-12 12:16:07,719][0m Trial 1 finished with value: 4.837071516167264 and parameters: {'lr': 0.00011683357862067958, 'weight_decay': 0.018461880035941423, 'criterion': 'MSELoss', 'batch_size': 256, 'epochs': 5}. Best is trial 1 with value: 4.837071516167264.[0m
epoch 4 0.013337196414212937 4.837071516167264

Previous best Test-set performance: 0.014333634977770293

Trial Id: 2 | Model params: 41198 | Timestamp: 2022-03-12 12:16:07.719256

epoch 0 0.00020501268564654396 4.869155093380435
epoch 1 -0.0025266913266830393 4.8758024648623595
epoch 2 0.005662099686613131 4.8558484852047705
epoch 3 0.007563734670442468 4.8512029464366435
epoch 4 0.006909905069149236 4.8528007003457105
epoch 5 0.0010874688338927685 4.867005770542064
epoch 6 0.006443958083762635 4.853939007284983
epoch 7 0.005322913016226893 4.856676623528932
epoch 8 0.006100568842119514 4.854777735233757
[32m[I 2022-03-12 12:18:45,380][0m Trial 2 finished with value: 4.854280012841599 and parameters: {'lr': 0.007822254534633278, 'weight_decay': 0.10093814470189306, 'criterion': 'MSELoss', 'batch_size': 256, 'epochs': 10}. Best is trial 1 with value: 4.837071516167264.[0m
epoch 9 0.00630435186629652 4.854280012841599

Previous best Test-set performance: 0.014333634977770293

Trial Id: 3 | Model params: 41198 | Timestamp: 2022-03-12 12:18:45.380579

epoch 0 -1.7585748910767975 8.087988404567028
epoch 1 -1.695559647920517 7.995076134141557
epoch 2 -1.697042079385135 7.997274290533358
epoch 3 -1.6997913649161687 8.001349345636225
epoch 4 -1.7038182427115154 8.007314334406466
epoch 5 -1.6965540656940266 7.9965507282394475
epoch 6 -1.700271931103976 8.002061438967944
epoch 7 -1.7033711733520276 8.006652312672704
epoch 8 -1.7020328722126314 8.004670224808143
[32m[I 2022-03-12 12:31:04,142][0m Trial 3 finished with value: 7.998006213228826 and parameters: {'lr': 0.00014030961892812108, 'weight_decay': 0.058089307537854934, 'criterion': 'PoissonNLLLoss', 'batch_size': 32, 'epochs': 10}. Best is trial 1 with value: 4.837071516167264.[0m
epoch 9 -1.6975357767549535 7.998006213228826

Previous best Test-set performance: 0.014333634977770293

Trial Id: 4 | Model params: 41198 | Timestamp: 2022-03-12 12:31:04.142850

epoch 0 -1.9012539013238525 8.29451504524669
epoch 1 -1.7944020090718036 8.140340531798545
epoch 2 -1.7503059238780496 8.075857230455904
epoch 3 -1.7875840101730631 8.130403749658148
[32m[I 2022-03-12 12:32:22,962][0m Trial 4 finished with value: 8.05790738751324 and parameters: {'lr': 0.0001266249451336091, 'weight_decay': 0.15170174735347644, 'criterion': 'PoissonNLLLoss', 'batch_size': 256, 'epochs': 5}. Best is trial 1 with value: 4.837071516167264.[0m
epoch 4 -1.7380935495259635 8.05790738751324

Previous best Test-set performance: 0.014333634977770293

Trial Id: 5 | Model params: 41198 | Timestamp: 2022-03-12 12:32:22.963050

epoch 0 -1.7436845043505338 8.066129973965625
epoch 1 -1.7093653441194174 8.015523951789966
epoch 2 -1.7174600938701094 8.027488980760824
epoch 3 -1.7031272142732763 8.006291034204747
epoch 4 -1.72070699626223 8.032283290754261
epoch 5 -1.7146252559132837 8.023300774187982
epoch 6 -1.7059395560844246 8.010454836302848
epoch 7 -1.6978271811952443 7.998438198525291
epoch 8 -1.7222676008965827 8.034586629831574
[32m[I 2022-03-12 12:44:47,512][0m Trial 5 finished with value: 8.001483290127805 and parameters: {'lr': 0.00024064047436016242, 'weight_decay': 0.23747529829603395, 'criterion': 'PoissonNLLLoss', 'batch_size': 32, 'epochs': 10}. Best is trial 1 with value: 4.837071516167264.[0m
epoch 9 -1.6998817559722132 8.001483290127805

Previous best Test-set performance: 0.014333634977770293

Trial Id: 6 | Model params: 41198 | Timestamp: 2022-03-12 12:44:47.512579

epoch 0 -1.704099698398351 8.007731086811077
epoch 1 -1.7313732305538392 8.04801273363225
epoch 2 -1.7268832809785417 8.041395177066017
epoch 3 -1.6697729849059564 7.956742393026348
epoch 4 -1.6788850322363316 7.970309174876707
epoch 5 -1.702614375119221 8.005531518658584
epoch 6 -1.70681478764214 8.011750215576203
epoch 7 -1.6936337316549621 7.992219473462737
epoch 8 -1.6854680885754298 7.9800962316374
[32m[I 2022-03-12 12:48:20,095][0m Trial 6 finished with value: 7.9894654149394295 and parameters: {'lr': 0.0004190628569820367, 'weight_decay': 0.07729142665115092, 'criterion': 'PoissonNLLLoss', 'batch_size': 128, 'epochs': 10}. Best is trial 1 with value: 4.837071516167264.[0m
epoch 9 -1.6917776397907853 7.9894654149394295

Previous best Test-set performance: 0.014333634977770293

Trial Id: 7 | Model params: 41198 | Timestamp: 2022-03-12 12:48:20.095973

epoch 0 -1.7104684658699179 8.01715555141848
epoch 1 -1.7751897315306668 8.112308734146906
epoch 2 -1.7574434872075035 8.086329627806101
epoch 3 -1.743289609451522 8.065549479342838
epoch 4 -1.7153122721595389 8.024315976794709
epoch 5 -1.6857316692145128 7.9804878481424755
epoch 6 -1.7016436110611286 8.004093618318555
epoch 7 -1.7033371085104374 8.006601867102262
epoch 8 -1.6957115209023566 7.995301359903273
[32m[I 2022-03-12 12:51:51,224][0m Trial 7 finished with value: 8.009306986711472 and parameters: {'lr': 0.0002524552972008687, 'weight_decay': 0.09980433583764488, 'criterion': 'PoissonNLLLoss', 'batch_size': 128, 'epochs': 10}. Best is trial 1 with value: 4.837071516167264.[0m
epoch 9 -1.7051641221943652 8.009306986711472

Previous best Test-set performance: 0.014333634977770293

Trial Id: 8 | Model params: 41198 | Timestamp: 2022-03-12 12:51:51.225133

[32m[I 2022-03-12 12:53:00,843][0m Trial 8 pruned. [0m
epoch 0 0.006983187079814934 4.852621648336601

Previous best Test-set performance: 0.014333634977770293

Trial Id: 9 | Model params: 41198 | Timestamp: 2022-03-12 12:53:00.843890

epoch 0 -1.7156937590644277 8.024879643814742
epoch 1 -1.7592257978783024 8.088942559584783
epoch 2 -1.6775213686012571 7.968280307610359
epoch 3 -1.70423040216839 8.007924612958796
[32m[I 2022-03-12 12:54:48,518][0m Trial 9 finished with value: 8.001243824390848 and parameters: {'lr': 0.002152173730555501, 'weight_decay': 0.18794131788788068, 'criterion': 'PoissonNLLLoss', 'batch_size': 128, 'epochs': 5}. Best is trial 1 with value: 4.837071516167264.[0m
epoch 4 -1.6997201560596986 8.001243824390848

Previous best Test-set performance: 0.014333634977770293

Trial Id: 10 | Model params: 41198 | Timestamp: 2022-03-12 12:54:48.518509

[32m[I 2022-03-12 12:55:04,348][0m Trial 10 pruned. [0m
epoch 0 0.014465034854258874 4.834306136206571

Previous best Test-set performance: 0.014333634977770293

Trial Id: 11 | Model params: 41198 | Timestamp: 2022-03-12 12:55:04.348310

[32m[I 2022-03-12 12:55:20,093][0m Trial 11 pruned. [0m
epoch 0 0.00941784880046026 4.846669209993178

Previous best Test-set performance: 0.014333634977770293

Trial Id: 12 | Model params: 41198 | Timestamp: 2022-03-12 12:55:20.094082

[32m[I 2022-03-12 12:56:32,753][0m Trial 12 pruned. [0m
epoch 0 0.007515914675940039 4.851319821298984

Previous best Test-set performance: 0.014333634977770293

Trial Id: 13 | Model params: 41198 | Timestamp: 2022-03-12 12:56:32.753568

[32m[I 2022-03-12 12:57:46,020][0m Trial 13 pruned. [0m
epoch 0 0.0076572298822452645 4.85097443053812

Previous best Test-set performance: 0.014333634977770293

Trial Id: 14 | Model params: 41198 | Timestamp: 2022-03-12 12:57:46.021098

[32m[I 2022-03-12 12:58:01,893][0m Trial 14 pruned. [0m
epoch 0 0.011866235484374377 4.8406758343147445

Study statistics: 
  Number of finished trials:  15
  Number of pruned trials:  6
  Number of complete trials:  9

Best trial:
  Value:  4.837071516167264
  Params: 
    lr: 0.00011683357862067958
    weight_decay: 0.018461880035941423
    criterion: MSELoss
    batch_size: 256
    epochs: 5
Target: 72610, NaN: 0, Max: 178.0, Min: 0.0, Mean: 8.480057843272277
Prediction: 72610, NaN: 0, Max: 11.100215911865234, Min: 7.660604476928711, Mean: 8.47715397271846

 XXXXXX======== TRIAL north - lrg ended

Test Set - R-squared:  0.013337196414212937
Test Set - RMSE:  4.837071516167264
Test Set - MAE:  3.269639525520557



[32m[I 2022-03-12 13:00:39,761][0m A new study created in memory with name: DeepSet[0m
Starting Loading des
Finished Loading des
Finished des setup

++++++++ Session Characteristics +++++++

Area: des
Gal Type: lrg
Training Set: 270781
Validation Set: 67698
Test Samples: 67698
Number of features: 5
Device: cuda:0
Number of Workers: 8
Number of Trials: 15

+++++++++++++++++++++++++++++++++++++++

Trial Id: 0 | Model params: 81072 | Timestamp: 2022-03-12 13:00:39.761572

epoch 0 -2.1639902625394103 7.488693373387963
epoch 5 -2.05443383962087 7.357899317041446
epoch 10 -2.09341186225908 7.404698038451279
epoch 15 -2.0884708790443165 7.398782060954314
epoch 20 -2.099088681313705 7.411489223308154
[32m[I 2022-03-12 13:05:51,746][0m Trial 0 finished with value: 7.385844586175059 and parameters: {'n_layers_fe': 2, 'fe_neurons': 128, 'fe_dropout': 0.00952166393327658, 'n_units_l(Invariant)': 23, 'n_layers_mlp': 4, 'initialiser': 'uniform', 'lr': 0.005886889566003391, 'weight_decay': 0.18640393041569786, 'criterion': 'PoissonNLLLoss', 'batch_size': 256, 'epochs': 25}. Best is trial 0 with value: 7.385844586175059.[0m

Trial Id: 1 | Model params: 21666 | Timestamp: 2022-03-12 13:05:51.747114

epoch 0 0.010064706218695485 4.188821786142636
epoch 5 0.004534613215508965 4.200505536119492
epoch 10 0.007761661346746052 4.193691518662569
epoch 15 0.0013831772243403373 4.207149244762823
epoch 20 0.012464415695984776 4.183741628605244
