[32m[I 2022-03-12 13:14:32,219][0m Trial 1 finished with value: 4.200338096638097 and parameters: {'n_layers_fe': 2, 'fe_neurons': 64, 'fe_dropout': 0.16517732416307784, 'n_units_l(Invariant)': 16, 'n_layers_mlp': 4, 'initialiser': 'uniform', 'lr': 0.0019273132716856635, 'weight_decay': 0.08227215957046748, 'criterion': 'MSELoss', 'batch_size': 128, 'epochs': 25}. Best is trial 1 with value: 4.200338096638097.[0m

Trial Id: 2 | Model params: 147896 | Timestamp: 2022-03-12 13:14:32.219304

epoch 0 0.0021488064771669757 4.205536146477604
epoch 5 -0.0022597578083689562 4.2148160589412305
epoch 10 -0.0004317824918955715 4.210970700553211
epoch 15 -1.1520682203336463e-05 4.210086134462675
epoch 20 -0.0035862266277086885 4.217604245051853
epoch 25 -0.0001803365256118905 4.210441479993302
epoch 30 -0.001931545667571033 4.214125885030725
epoch 35 -0.0009757511907171335 4.212115368787119
epoch 40 -0.0008793239301825295 4.211912480491472
epoch 45 -0.00023496482540297237 4.2105564623172
[32m[I 2022-03-12 13:40:00,758][0m Trial 2 finished with value: 4.2128737408784405 and parameters: {'n_layers_fe': 4, 'fe_neurons': 128, 'fe_dropout': 0.2093409487159838, 'n_units_l(Invariant)': 283, 'n_layers_mlp': 4, 'initialiser': 'normal', 'lr': 0.0006406421043021198, 'weight_decay': 0.28290906548827044, 'criterion': 'MSELoss', 'batch_size': 128, 'epochs': 50}. Best is trial 1 with value: 4.200338096638097.[0m

Trial Id: 3 | Model params: 260270 | Timestamp: 2022-03-12 13:40:00.758193

[32m[I 2022-03-12 13:41:09,843][0m Trial 3 pruned. [0m
++++++++++++++++++++
        NaN         
++++++++++++++++++++

Trial Id: 4 | Model params: 48528 | Timestamp: 2022-03-12 13:41:09.843330

epoch 0 -0.11165269951203416 4.438876304767979
epoch 5 -0.044409754653255806 4.302530317436376
epoch 10 -0.026710277575965113 4.265917323191619
epoch 15 0.00017465600206889587 4.209694210796784
epoch 20 0.002976447708557095 4.203791699422056
epoch 25 0.009842788520633583 4.189291272180512
epoch 30 0.00668219048244445 4.1959720882910165
epoch 35 0.009271842704288047 4.190498915571779
epoch 40 0.009235161382886159 4.190576490643033
epoch 45 0.010946306338369016 4.186956165045872
[32m[I 2022-03-12 14:00:28,185][0m Trial 4 finished with value: 4.188087586072738 and parameters: {'n_layers_fe': 4, 'fe_neurons': 64, 'fe_dropout': 0.2665113389744793, 'n_units_l(Invariant)': 423, 'n_layers_mlp': 2, 'initialiser': 'xavier', 'lr': 1.1958104325681714e-05, 'weight_decay': 0.2513003149041995, 'criterion': 'MSELoss', 'batch_size': 128, 'epochs': 50}. Best is trial 4 with value: 4.188087586072738.[0m

Trial Id: 5 | Model params: 92248 | Timestamp: 2022-03-12 14:00:28.185346

[32m[I 2022-03-12 14:00:50,495][0m Trial 5 pruned. [0m
++++++++++++++++++++
        NaN         
++++++++++++++++++++

Trial Id: 6 | Model params: 120986 | Timestamp: 2022-03-12 14:00:50.495678

epoch 0 -2.0942669774236355 7.40572141205018
epoch 5 -2.075567135062172 7.38330969235087
epoch 10 -2.074080123116412 7.38152459116084
epoch 15 -2.0827831095085427 7.391966073095974
epoch 20 -2.0813771259349836 7.3902802314759475
[32m[I 2022-03-12 14:11:21,130][0m Trial 6 finished with value: 7.3894625580251185 and parameters: {'n_layers_fe': 4, 'fe_neurons': 128, 'fe_dropout': 0.03893789024170358, 'n_units_l(Invariant)': 76, 'n_layers_mlp': 4, 'initialiser': 'uniform', 'lr': 5.4160033509167714e-05, 'weight_decay': 0.20835553138363117, 'criterion': 'PoissonNLLLoss', 'batch_size': 128, 'epochs': 25}. Best is trial 4 with value: 4.188087586072738.[0m

Trial Id: 7 | Model params: 44040 | Timestamp: 2022-03-12 14:11:21.130238

[32m[I 2022-03-12 14:11:37,490][0m Trial 7 pruned. [0m
epoch 0 -0.004670728204805963 4.219882456582445

Trial Id: 8 | Model params: 477772 | Timestamp: 2022-03-12 14:11:37.490294

epoch 0 -2.1279935859220362 7.445972131841967
epoch 5 -2.080458846855595 7.389178963256663
epoch 10 -2.077439371272089 7.385556626992825
epoch 15 -2.0720863563127674 7.379130472409053
epoch 20 -2.084881772497666 7.3944817554725555
[32m[I 2022-03-12 14:31:39,880][0m Trial 8 finished with value: 7.396896106884723 and parameters: {'n_layers_fe': 4, 'fe_neurons': 256, 'fe_dropout': 0.08311977342425164, 'n_units_l(Invariant)': 165, 'n_layers_mlp': 4, 'initialiser': 'kaiming_he', 'lr': 3.864029106280311e-05, 'weight_decay': 0.17815869255018435, 'criterion': 'PoissonNLLLoss', 'batch_size': 256, 'epochs': 25}. Best is trial 4 with value: 4.188087586072738.[0m

Trial Id: 9 | Model params: 34866 | Timestamp: 2022-03-12 14:31:39.880450

[32m[I 2022-03-12 14:32:53,348][0m Trial 9 pruned. [0m
epoch 0 -0.15217165028644275 4.519049224920048

Trial Id: 10 | Model params: 54072 | Timestamp: 2022-03-12 14:32:53.348286

[32m[I 2022-03-12 14:33:18,100][0m Trial 10 pruned. [0m
epoch 0 -0.24884492269800518 4.704817001474432

Trial Id: 11 | Model params: 53214 | Timestamp: 2022-03-12 14:33:18.100637

[32m[I 2022-03-12 14:33:42,417][0m Trial 11 pruned. [0m
epoch 0 -0.003000938775748585 4.216374219930256

Trial Id: 12 | Model params: 41066 | Timestamp: 2022-03-12 14:33:42.417541

[32m[I 2022-03-12 14:34:02,192][0m Trial 12 pruned. [0m
epoch 0 -0.10785427657221658 4.431286183693991

Trial Id: 13 | Model params: 28332 | Timestamp: 2022-03-12 14:34:02.193109

[32m[I 2022-03-12 14:34:23,943][0m Trial 13 pruned. [0m
epoch 0 -0.15377264678673574 4.522187850314973

Trial Id: 14 | Model params: 58696 | Timestamp: 2022-03-12 14:34:23.943631

[32m[I 2022-03-12 14:34:48,961][0m Trial 14 pruned. [0m
epoch 0 -0.006910282894629027 4.2245831990377765

Study statistics: 
  Number of finished trials:  15
  Number of pruned trials:  9
  Number of complete trials:  6

Best trial:
  Value:  4.188087586072738
  Params: 
    n_layers_fe: 4
    fe_neurons: 64
    fe_dropout: 0.2665113389744793
    n_units_l(Invariant): 423
    n_layers_mlp: 2
    initialiser: xavier
    lr: 1.1958104325681714e-05
    weight_decay: 0.2513003149041995
    criterion: MSELoss
    batch_size: 128
    epochs: 50
Target: 67698, NaN: 0, Max: 143.0, Min: 0.0, Mean: 8.148734083724777
Prediction: 67698, NaN: 0, Max: 10.683308601379395, Min: 6.407287120819092, Mean: 8.018198283145711

 XXXXXX======== TRIAL des - lrg ended

Test Set - R-squared:  0.010411699670676233
Test Set - RMSE:  4.188087586072738
Test Set - MAE:  3.0806696477001565



[32m[I 2022-03-12 14:35:19,057][0m A new study created in memory with name: DeepSet[0m
Starting Loading des
Finished Loading des
Finished des setup

++++++++ Session Characteristics +++++++

Area: des
Gal Type: lrg
Training Set: 270781
Validation Set: 67698
Test Samples: 67698
Number of features: 5
Device: cuda:0
Number of Workers: 8
Number of Trials: 15

+++++++++++++++++++++++++++++++++++++++

Previous best Test-set performance: 0.025305062865661365

Trial Id: 0 | Model params: 152316 | Timestamp: 2022-03-12 14:35:19.057624

epoch 0 0.01154919976192037 4.185679857626918
epoch 1 0.007915942560070333 4.193365471510864
epoch 2 0.006977881642708628 4.195347512656233
epoch 3 0.006798186888616553 4.195727085187211
[32m[I 2022-03-12 14:37:50,604][0m Trial 0 finished with value: 4.196581663142398 and parameters: {'lr': 0.00021448361880057292, 'weight_decay': 0.14251474025087366, 'criterion': 'MSELoss', 'batch_size': 256, 'epochs': 5}. Best is trial 0 with value: 4.196581663142398.[0m
epoch 4 0.0063935586584717985 4.196581663142398

Previous best Test-set performance: 0.025305062865661365

Trial Id: 1 | Model params: 152316 | Timestamp: 2022-03-12 14:37:50.604541

epoch 0 -0.0015930161814721178 4.2134138970705575
epoch 1 -0.001021909888973882 4.212212485785572
epoch 2 -0.01380356364583113 4.239019225571712
epoch 3 -0.000668355545786703 4.211468557243518
epoch 4 -0.006354899217428489 4.22341795710193
epoch 5 -0.005804706020239303 4.222263288147857
epoch 6 -0.005942616672319323 4.222552745495239
epoch 7 -1.4740455051898138e-05 4.2100929121396495
epoch 8 -0.0011722091084942488 4.212528696889726
epoch 9 -1.3086020356212202e-06 4.210064637786891
epoch 10 -0.0021474342842173755 4.214579874531647
epoch 11 -0.00010685161167112156 4.2102868030806375
epoch 12 -8.43275493211948e-05 4.210239391498432
epoch 13 -0.0002559628370590872 4.210600658357516
epoch 14 -0.004249476232833116 4.218997679046334
epoch 15 -7.87924988039368e-05 4.210227740520948
epoch 16 -0.002422337757018278 4.21515789487068
epoch 17 -0.0014386566530084632 4.21308921147871
epoch 18 -0.0020689528360582354 4.214414842523021
[32m[I 2022-03-12 14:47:50,797][0m Trial 1 finished with value: 4.21122978013812 and parameters: {'lr': 0.0009147721638462227, 'weight_decay': 0.1598509226708645, 'criterion': 'MSELoss', 'batch_size': 256, 'epochs': 20}. Best is trial 0 with value: 4.196581663142398.[0m
epoch 19 -0.0005548892255844429 4.21122978013812

Previous best Test-set performance: 0.025305062865661365

Trial Id: 2 | Model params: 152316 | Timestamp: 2022-03-12 14:47:50.797185

epoch 0 -0.002473240769492513 4.215264916383968
epoch 1 -0.00021980744144434183 4.210524559181932
epoch 2 -0.00018120147683209353 4.210443300577839
epoch 3 -0.0015549035662998367 4.213333731899928
epoch 4 -0.0006108412660015272 4.211347526604291
epoch 5 -1.804145857486894e-05 4.210099860797256
epoch 6 -0.0005566728762576023 4.211233533735031
epoch 7 -0.013054480013565017 4.237452863601262
epoch 8 -0.005850739563490137 4.222359909049833
epoch 9 -0.002430438983696215 4.215174927552072
epoch 10 -6.921275760962686e-06 4.210076452614439
epoch 11 -0.006567766142644871 4.223864607910235
epoch 12 -0.00015046529043583057 4.2103786053185415
epoch 13 -0.017002894724508888 4.245702642176113
epoch 14 -0.0019172462328678197 4.214095813199376
epoch 15 -0.9555124335520597 5.8873352938805406
epoch 16 -96276.19671252965 1306.3218701514577
epoch 17 -2.883861717298649 8.29698603036359
epoch 18 -1.0470794535836432 6.023595902300608
[32m[I 2022-03-12 14:58:18,386][0m Trial 2 finished with value: 5.987826738518924 and parameters: {'lr': 0.008851134725832483, 'weight_decay': 0.16219248228119462, 'criterion': 'MSELoss', 'batch_size': 128, 'epochs': 20}. Best is trial 0 with value: 4.196581663142398.[0m
epoch 19 -1.02283980737404 5.987826738518924

Previous best Test-set performance: 0.025305062865661365

Trial Id: 3 | Model params: 152316 | Timestamp: 2022-03-12 14:58:18.386940

epoch 0 0.02356283005239479 4.160165720988972
epoch 1 0.024338063987479064 4.158513929080865
epoch 2 0.022726009884054155 4.161947999010893
epoch 3 0.009839152031455356 4.189298965048984
epoch 4 0.020102581015841836 4.167530495273834
epoch 5 0.021869473373522408 4.163771479265391
epoch 6 0.02359680177468515 4.1600933511385705
epoch 7 0.018973694464567092 4.169930396946488
epoch 8 0.01705696410992863 4.174002016600879
[32m[I 2022-03-12 15:13:05,082][0m Trial 3 finished with value: 4.160342719179394 and parameters: {'lr': 0.00010814540853024001, 'weight_decay': 0.017231218941290736, 'criterion': 'MSELoss', 'batch_size': 32, 'epochs': 10}. Best is trial 3 with value: 4.160342719179394.[0m
epoch 9 0.023479741396657983 4.160342719179394

Previous best Test-set performance: 0.025305062865661365

Trial Id: 4 | Model params: 152316 | Timestamp: 2022-03-12 15:13:05.082855

epoch 0 -1.5262286865066912 6.691520468391347
epoch 1 -1.844907796316317 7.101050108256678
epoch 2 -2.0063136186826145 7.299710246185889
epoch 3 -2.0659842845470635 7.371798262236198
epoch 4 -2.079736683908584 7.388312776707248
epoch 5 -2.083371604631135 7.392671592790082
epoch 6 -2.0593475079910504 7.3638152658519545
epoch 7 -2.0757508910991755 7.383530254511432
epoch 8 -2.0724442095579403 7.379560240420942
epoch 9 -2.0704051363257596 7.377111056616124
epoch 10 -2.0573344022499 7.361392105653587
epoch 11 -2.061046230558935 7.3658593852581715
epoch 12 -2.069306697203516 7.375791355810492
epoch 13 -2.077401008352823 7.385510593202808
epoch 14 -2.081327125265605 7.390220271198058
epoch 15 -2.065952242733444 7.371759741751229
epoch 16 -2.0774352900936277 7.385551729774557
epoch 17 -2.079861032843061 7.388461932242621
epoch 18 -2.083490611658495 7.392814256648739
[32m[I 2022-03-12 15:23:03,940][0m Trial 4 finished with value: 7.379867506186691 and parameters: {'lr': 0.000497656214705494, 'weight_decay': 0.07055725254416831, 'criterion': 'PoissonNLLLoss', 'batch_size': 256, 'epochs': 20}. Best is trial 3 with value: 4.160342719179394.[0m
epoch 19 -2.072700072115072 7.379867506186691

Previous best Test-set performance: 0.025305062865661365

Trial Id: 5 | Model params: 152316 | Timestamp: 2022-03-12 15:23:03.940524

epoch 0 -1.8636930914382197 7.124456110995822
epoch 1 -2.0755414108377384 7.383278815068015
epoch 2 -2.069059380848127 7.3754941892572585
epoch 3 -2.065643268886645 7.371388284831578
epoch 4 -2.0608831441312776 7.365663163508473
epoch 5 -2.0640497671472766 7.369472235598943
epoch 6 -2.070388513357341 7.3770910869957245
epoch 7 -2.0627722852026213 7.36793581323045
epoch 8 -2.0682583923877145 7.374531667762601
[32m[I 2022-03-12 15:38:15,448][0m Trial 5 finished with value: 7.368347884787672 and parameters: {'lr': 4.008393786044512e-05, 'weight_decay': 0.024512316882543815, 'criterion': 'PoissonNLLLoss', 'batch_size': 32, 'epochs': 10}. Best is trial 3 with value: 4.160342719179394.[0m
epoch 9 -2.063114882279907 7.368347884787672

Previous best Test-set performance: 0.025305062865661365

Trial Id: 6 | Model params: 152316 | Timestamp: 2022-03-12 15:38:15.448271

[32m[I 2022-03-12 15:38:45,127][0m Trial 6 pruned. [0m
epoch 0 0.02355342766449131 4.160185750643153

Previous best Test-set performance: 0.025305062865661365

Trial Id: 7 | Model params: 152316 | Timestamp: 2022-03-12 15:38:45.127576

epoch 0 -1.8029104492335546 7.04844135801742
epoch 1 -1.96867003604457 7.25386458659631
epoch 2 -2.051300052502749 7.354123820725892
epoch 3 -2.0735437821929383 7.380880628372521
epoch 4 -2.0622981166904486 7.367365451142428
epoch 5 -2.0732185862090806 7.380490151385656
epoch 6 -2.0688376140912843 7.3752277120126175
epoch 7 -2.0623648171750557 7.367445685683827
epoch 8 -2.0738989061113693 7.381307017538846
epoch 9 -2.0799307806066207 7.388545592799522
epoch 10 -2.0647809341241934 7.3703514630484905
epoch 11 -2.075159107199993 7.382819913415422
epoch 12 -2.071586515752692 7.378530141181113
epoch 13 -2.07242010599939 7.379531293758438
epoch 14 -2.075091234192838 7.382738438451636
epoch 15 -2.089789038959926 7.40036079326541
epoch 16 -2.0584671969379014 7.362755740194184
epoch 17 -2.075461286077457 7.383182638944986
epoch 18 -2.0387552547034877 7.3389907605408125
[32m[I 2022-03-12 15:48:44,814][0m Trial 7 finished with value: 7.38817862610491 and parameters: {'lr': 0.000914380315205403, 'weight_decay': 0.057432211515146714, 'criterion': 'PoissonNLLLoss', 'batch_size': 256, 'epochs': 20}. Best is trial 3 with value: 4.160342719179394.[0m
epoch 19 -2.0796248465262543 7.38817862610491

Previous best Test-set performance: 0.025305062865661365

Trial Id: 8 | Model params: 152316 | Timestamp: 2022-03-12 15:48:44.814172

epoch 0 -2.006924475941259 7.300451827914652
epoch 1 -2.0732523773649865 7.3805307268606555
epoch 2 -2.0626534203300926 7.367792838636341
epoch 3 -2.075330099580289 7.383025169201861
epoch 4 -2.0717785543407823 7.3787607940304545
epoch 5 -2.069365188542144 7.375861635176004
epoch 6 -2.059310496219651 7.363770722257143
epoch 7 -2.081275491217771 7.390158351679283
epoch 8 -2.0901662938765377 7.40081256153267
[32m[I 2022-03-12 15:53:59,499][0m Trial 8 finished with value: 7.3610748806805155 and parameters: {'lr': 0.0010959950922430069, 'weight_decay': 0.04777454693856043, 'criterion': 'PoissonNLLLoss', 'batch_size': 128, 'epochs': 10}. Best is trial 3 with value: 4.160342719179394.[0m
epoch 9 -2.0570709080867524 7.3610748806805155

Previous best Test-set performance: 0.025305062865661365

Trial Id: 9 | Model params: 152316 | Timestamp: 2022-03-12 15:53:59.499203

[32m[I 2022-03-12 15:54:29,536][0m Trial 9 pruned. [0m
epoch 0 -6.0984561611521215e-05 4.210190255572013

Previous best Test-set performance: 0.025305062865661365

Trial Id: 10 | Model params: 152316 | Timestamp: 2022-03-12 15:54:29.536230

[32m[I 2022-03-12 15:55:59,656][0m Trial 10 pruned. [0m
epoch 0 -0.001483562675872463 4.21318367106359

Previous best Test-set performance: 0.025305062865661365

Trial Id: 11 | Model params: 152316 | Timestamp: 2022-03-12 15:55:59.657112

[32m[I 2022-03-12 15:57:27,369][0m Trial 11 pruned. [0m
epoch 0 -0.00018561703516017936 4.210452594612477

Previous best Test-set performance: 0.025305062865661365

Trial Id: 12 | Model params: 152316 | Timestamp: 2022-03-12 15:57:27.369967

[32m[I 2022-03-12 15:58:59,311][0m Trial 12 pruned. [0m
epoch 0 0.01192266834053457 4.184889040525448

Previous best Test-set performance: 0.025305062865661365

Trial Id: 13 | Model params: 152316 | Timestamp: 2022-03-12 15:58:59.311814

[32m[I 2022-03-12 16:00:30,423][0m Trial 13 pruned. [0m
epoch 0 0.00745898664526945 4.194331096622016

Previous best Test-set performance: 0.025305062865661365

Trial Id: 14 | Model params: 152316 | Timestamp: 2022-03-12 16:00:30.423961

[32m[I 2022-03-12 16:01:01,585][0m Trial 14 pruned. [0m
epoch 0 -0.0002141304704577074 4.210512610278552

Study statistics: 
  Number of finished trials:  15
  Number of pruned trials:  7
  Number of complete trials:  8

Best trial:
  Value:  4.160342719179394
  Params: 
    lr: 0.00010814540853024001
    weight_decay: 0.017231218941290736
    criterion: MSELoss
    batch_size: 32
    epochs: 10
Target: 67698, NaN: 0, Max: 143.0, Min: 0.0, Mean: 8.148734083724777
Prediction: 67698, NaN: 0, Max: 11.25465202331543, Min: 7.106932640075684, Mean: 8.305685660586146

 XXXXXX======== TRIAL des - lrg ended

Test Set - R-squared:  0.023479741396657983
Test Set - RMSE:  4.160342719179394
Test Set - MAE:  3.0927045893297933



