[32m[I 2022-03-11 18:06:08,172][0m A new study created in memory with name: DeepSet[0m
Starting Loading south
Finished Loading south
Finished south setup

++++++++ Session Characteristics +++++++

Area: south
Gal Type: lrg
Training Set: 530265
Validation Set: 132567
Test Samples: 132567
Number of features: 5
Device: cuda:0
Number of Workers: 8
Number of Trials: 15

+++++++++++++++++++++++++++++++++++++++

Trial Id: 0 | Model params: 502282 | Timestamp: 2022-03-11 18:06:08.173766

epoch 0 -0.001270914103125964 4.90564119869988
epoch 5 0.004562627382314277 4.891329854522517
epoch 10 -0.0014702559359969225 4.906129503526683
epoch 15 0.003911114264418369 4.892930278812578
epoch 20 -0.0052759489606537535 4.915442570083917
epoch 25 0.00223285547258556 4.897050467010546
epoch 30 0.004636865596335027 4.891147457129607
epoch 35 0.005302895706507771 4.8895107697238345
epoch 40 0.004795143787211464 4.890758557479592
epoch 45 0.0036296612155628516 4.8936214986918625
[32m[I 2022-03-11 20:29:51,278][0m Trial 0 finished with value: 4.8995620795295265 and parameters: {'n_layers_fe': 4, 'fe_neurons': 256, 'fe_dropout': 0.13477668551185307, 'n_units_l(Invariant)': 260, 'n_layers_mlp': 4, 'initialiser': 'normal', 'lr': 4.518622655741006e-05, 'weight_decay': 0.2578210074686954, 'criterion': 'MSELoss', 'batch_size': 32, 'epochs': 50}. Best is trial 0 with value: 4.8995620795295265.[0m

Trial Id: 1 | Model params: 363990 | Timestamp: 2022-03-11 20:29:51.278658

epoch 0 0.003663074413716383 4.893539444404757
epoch 5 0.005784913790051749 4.888325927527752
epoch 10 0.005733925280092422 4.888451275283531
epoch 15 0.0031807093380504803 4.894723876515014
epoch 20 0.004051282468100159 4.892586003624485
epoch 25 0.006144946656388761 4.887440748163171
epoch 30 -0.0011146556971468602 4.90525839641709
epoch 35 0.0025702972929939616 4.896222313181284
epoch 40 0.00565102809362239 4.88865505896923
epoch 45 0.006185191148935232 4.887341792805786
epoch 50 0.004105864393419201 4.892451935264303
epoch 55 0.0032757014442095223 4.89449064908247
epoch 60 0.006262934724308722 4.887150626980542
epoch 65 0.006385419763354827 4.886849429962275
epoch 70 0.006372091400845603 4.886882205992138
[32m[I 2022-03-11 23:42:55,806][0m Trial 1 finished with value: 4.888024826433092 and parameters: {'n_layers_fe': 4, 'fe_neurons': 256, 'fe_dropout': 0.057642225911646305, 'n_units_l(Invariant)': 234, 'n_layers_mlp': 2, 'initialiser': 'xavier', 'lr': 0.0003119988182577341, 'weight_decay': 0.1568129383103816, 'criterion': 'MSELoss', 'batch_size': 32, 'epochs': 75}. Best is trial 1 with value: 4.888024826433092.[0m

Trial Id: 2 | Model params: 289940 | Timestamp: 2022-03-11 23:42:55.806411

epoch 0 -1.7069469177714627 8.066030316264024
epoch 5 -1.6961645622693138 8.049949915020866
epoch 10 -1.701334908318053 8.057664780168388
epoch 15 -1.708498972548412 8.068342354016536
epoch 20 -1.7120598977715251 8.073644428531525
epoch 25 -1.709436383890535 8.069738459646521
epoch 30 -1.719362043562516 8.084506153679598
epoch 35 -1.7109920604222482 8.072054827233629
epoch 40 -1.726505971740496 8.09511843122495
epoch 45 -1.7117556038597286 8.073191483195801
epoch 50 -1.7173117437705976 8.081457867618665
epoch 55 -1.7333150184910626 8.105220310659908
epoch 60 -1.6867486656920496 8.03588107994459
epoch 65 -1.7207412087568308 8.086555983009847
epoch 70 -1.7211457037897713 8.087157078430582
[32m[I 2022-03-12 00:44:26,836][0m Trial 2 finished with value: 8.08259894976817 and parameters: {'n_layers_fe': 2, 'fe_neurons': 256, 'fe_dropout': 0.04551432434627012, 'n_units_l(Invariant)': 457, 'n_layers_mlp': 2, 'initialiser': 'xavier', 'lr': 0.00029730250971529443, 'weight_decay': 0.024013433507979152, 'criterion': 'PoissonNLLLoss', 'batch_size': 256, 'epochs': 75}. Best is trial 1 with value: 4.888024826433092.[0m

Trial Id: 3 | Model params: 110968 | Timestamp: 2022-03-12 00:44:26.836291

[32m[I 2022-03-12 00:46:41,477][0m Trial 3 pruned. [0m
++++++++++++++++++++
        NaN         
++++++++++++++++++++

Trial Id: 4 | Model params: 107072 | Timestamp: 2022-03-12 00:46:41.477331

epoch 0 0.004971423824077115 4.890325389738028
epoch 5 0.005242928488578991 4.889658154258068
epoch 10 0.005076485575747247 4.89006720634162
epoch 15 0.00507403025409392 4.890073240313235
epoch 20 0.00399050130112677 4.892735294719804
[32m[I 2022-03-12 01:03:40,844][0m Trial 4 finished with value: 4.890712389907103 and parameters: {'n_layers_fe': 2, 'fe_neurons': 128, 'fe_dropout': 0.2284960477147674, 'n_units_l(Invariant)': 223, 'n_layers_mlp': 4, 'initialiser': 'normal', 'lr': 0.00010177196658110705, 'weight_decay': 0.2226224804077791, 'criterion': 'MSELoss', 'batch_size': 128, 'epochs': 25}. Best is trial 1 with value: 4.888024826433092.[0m

Trial Id: 5 | Model params: 102648 | Timestamp: 2022-03-12 01:03:40.844208

epoch 0 -1.7395150723958883 8.114407751060464
epoch 5 -1.7270833961657557 8.095975585344222
epoch 10 -1.7375362420182845 8.111476586823002
epoch 15 -1.7117659193199284 8.07320683830489
epoch 20 -1.748409130902378 8.12756911973596
epoch 25 -1.7256529770101072 8.093852042376174
epoch 30 -1.712171629908426 8.07381073685208
epoch 35 -1.731395614728894 8.102373964304677
epoch 40 -1.7387028793265795 8.113204809278892
epoch 45 -1.7406854444143156 8.116140879266172
[32m[I 2022-03-12 02:56:18,390][0m Trial 5 finished with value: 8.07990309973446 and parameters: {'n_layers_fe': 2, 'fe_neurons': 128, 'fe_dropout': 0.11203024265708622, 'n_units_l(Invariant)': 443, 'n_layers_mlp': 2, 'initialiser': 'kaiming_he', 'lr': 0.00432263718492129, 'weight_decay': 0.22226710234285907, 'criterion': 'PoissonNLLLoss', 'batch_size': 32, 'epochs': 50}. Best is trial 1 with value: 4.888024826433092.[0m

Trial Id: 6 | Model params: 83668 | Timestamp: 2022-03-12 02:56:18.390738

[32m[I 2022-03-12 02:56:55,674][0m Trial 6 pruned. [0m
epoch 0 0.002813606460268736 4.895625093933919

Trial Id: 7 | Model params: 362700 | Timestamp: 2022-03-12 02:56:55.674915

epoch 0 -1.7681980029250792 8.156776371379005
epoch 5 -1.7225825122210439 8.089291870775165
epoch 10 -1.7340737732080944 8.10634521711366
epoch 15 -1.72958872719088 8.099693557910497
epoch 20 -1.7226915318927216 8.089453827871367
epoch 25 -1.7270537415100664 8.095931566884525
epoch 30 -1.7270669071231954 8.09595110954565
epoch 35 -1.7296432194174431 8.099774406744839
epoch 40 -1.730457379196726 8.100982260364693
epoch 45 -1.7261727820532178 8.094623788555179
[32m[I 2022-03-12 03:28:36,111][0m Trial 7 finished with value: 8.090784450619996 and parameters: {'n_layers_fe': 2, 'fe_neurons': 256, 'fe_dropout': 0.4675649416903235, 'n_units_l(Invariant)': 229, 'n_layers_mlp': 4, 'initialiser': 'kaiming_he', 'lr': 0.00013791013083645738, 'weight_decay': 0.18512441447123734, 'criterion': 'PoissonNLLLoss', 'batch_size': 256, 'epochs': 50}. Best is trial 1 with value: 4.888024826433092.[0m

Trial Id: 8 | Model params: 19088 | Timestamp: 2022-03-12 03:28:36.111916

[32m[I 2022-03-12 03:29:11,664][0m Trial 8 pruned. [0m
epoch 0 -0.6219429125496498 6.243638678905686

Trial Id: 9 | Model params: 65858 | Timestamp: 2022-03-12 03:29:11.664217

[32m[I 2022-03-12 03:29:33,109][0m Trial 9 pruned. [0m
epoch 0 -4.3711059797946206e-05 4.902633988803931

Trial Id: 10 | Model params: 437524 | Timestamp: 2022-03-12 03:29:33.109373

[32m[I 2022-03-12 03:32:23,734][0m Trial 10 pruned. [0m
epoch 0 0.002443121248620561 4.8965344466264575

Trial Id: 11 | Model params: 51964 | Timestamp: 2022-03-12 03:32:23.734190

[32m[I 2022-03-12 03:33:10,770][0m Trial 11 pruned. [0m
epoch 0 -0.20328648193841503 5.377798170923263

Trial Id: 12 | Model params: 475192 | Timestamp: 2022-03-12 03:33:10.771166

[32m[I 2022-03-12 03:34:14,266][0m Trial 12 pruned. [0m
epoch 0 -0.004037870579451264 4.912414755631765

Trial Id: 13 | Model params: 156476 | Timestamp: 2022-03-12 03:34:14.267161

[32m[I 2022-03-12 03:35:01,102][0m Trial 13 pruned. [0m
epoch 0 -0.0036734081266116547 4.911523079486046

Trial Id: 14 | Model params: 450940 | Timestamp: 2022-03-12 03:35:01.102746

[32m[I 2022-03-12 03:37:50,855][0m Trial 14 pruned. [0m
epoch 0 -0.0002482505303640359 4.903135332335074

Study statistics: 
  Number of finished trials:  15
  Number of pruned trials:  9
  Number of complete trials:  6

Best trial:
  Value:  4.888024826433092
  Params: 
    n_layers_fe: 4
    fe_neurons: 256
    fe_dropout: 0.057642225911646305
    n_units_l(Invariant): 234
    n_layers_mlp: 2
    initialiser: xavier
    lr: 0.0003119988182577341
    weight_decay: 0.1568129383103816
    criterion: MSELoss
    batch_size: 32
    epochs: 75
Target: 132567, NaN: 0, Max: 227.0, Min: 0.0, Mean: 8.573823047968197
Prediction: 132567, NaN: 0, Max: 10.102831840515137, Min: 8.02344036102295, Mean: 8.48377403458347

 XXXXXX======== TRIAL south - lrg ended

Test Set - R-squared:  0.0059073892732609545
Test Set - RMSE:  4.888024826424138
Test Set - MAE:  3.2971109092733295



[32m[I 2022-03-12 03:38:34,585][0m A new study created in memory with name: DeepSet[0m
Starting Loading south
Finished Loading south
Finished south setup

++++++++ Session Characteristics +++++++

Area: south
Gal Type: lrg
Training Set: 530265
Validation Set: 132567
Test Samples: 132567
Number of features: 5
Device: cuda:0
Number of Workers: 8
Number of Trials: 15

+++++++++++++++++++++++++++++++++++++++

Previous best Test-set performance: 0.0059073892732609545

Trial Id: 0 | Model params: 363990 | Timestamp: 2022-03-12 03:38:34.585770

epoch 0 -1.7161982221396888 8.07980185588898
epoch 1 -1.712251613908979 8.073929787378654
epoch 2 -1.7268506675276916 8.095630123673578
epoch 3 -1.7220421152659444 8.088489021712627
epoch 4 -1.7242383021198124 8.091751324592966
epoch 5 -1.7288911950402057 8.09865857458112
epoch 6 -1.7269409633518151 8.095764160265883
epoch 7 -1.7300544252065664 8.100384477078471
epoch 8 -1.7277459628898253 8.096959016627371
[32m[I 2022-03-12 03:49:21,562][0m Trial 0 finished with value: 8.11434846265234 and parameters: {'lr': 0.0004211293172718525, 'weight_decay': 0.27062161090109454, 'criterion': 'PoissonNLLLoss', 'batch_size': 256, 'epochs': 10}. Best is trial 0 with value: 8.11434846265234.[0m
epoch 9 -1.7394750396789513 8.11434846265234

Previous best Test-set performance: 0.0059073892732609545

Trial Id: 1 | Model params: 363990 | Timestamp: 2022-03-12 03:49:21.562742

epoch 0 0.006359674853896324 4.8869127395612235
epoch 1 0.0058157179439845 4.888250198486408
epoch 2 0.0060553508286707025 4.8876610440852
epoch 3 0.0059885413905096385 4.887825306955113
epoch 4 0.005521728502455359 4.888972895348083
epoch 5 0.006061070985904471 4.887646979806105
epoch 6 0.00303003832795834 4.895093785650635
epoch 7 0.005522024479005183 4.888972167820152
epoch 8 0.006325163458004712 4.886997605639806
[32m[I 2022-03-12 04:15:04,289][0m Trial 1 finished with value: 4.8868888780835125 and parameters: {'lr': 6.499002391715602e-05, 'weight_decay': 0.2453814057812171, 'criterion': 'MSELoss', 'batch_size': 32, 'epochs': 10}. Best is trial 1 with value: 4.8868888780835125.[0m
epoch 9 0.006369378185979713 4.8868888780835125

Previous best Test-set performance: 0.0059073892732609545

Trial Id: 2 | Model params: 363990 | Timestamp: 2022-03-12 04:15:04.289549

epoch 0 -1.7204120197570214 8.086066762316447
epoch 1 -1.7182111841672425 8.082795253416768
epoch 2 -1.7206172624447786 8.086371785004625
epoch 3 -1.7128741453169636 8.074856321346047
epoch 4 -1.7179944827234692 8.082473058378705
epoch 5 -1.7180032691229372 8.082486122382337
epoch 6 -1.7166259999218156 8.080438080376165
epoch 7 -1.7191675954649708 8.084217107035792
epoch 8 -1.71426247561813 8.076922236166533
[32m[I 2022-03-12 04:26:11,130][0m Trial 2 finished with value: 8.078070622292612 and parameters: {'lr': 2.347411613594314e-05, 'weight_decay': 0.030406184551084868, 'criterion': 'PoissonNLLLoss', 'batch_size': 128, 'epochs': 10}. Best is trial 1 with value: 4.8868888780835125.[0m
epoch 9 -1.715034364431527 8.078070622292612

Previous best Test-set performance: 0.0059073892732609545

Trial Id: 3 | Model params: 363990 | Timestamp: 2022-03-12 04:26:11.130778

epoch 0 -1.720617448039245 8.08637206082178
epoch 1 -1.7221618321467123 8.08866688781244
epoch 2 -1.7235603657735523 8.09074443146443
epoch 3 -1.7271990773209054 8.096147296608594
epoch 4 -1.7259431130338818 8.09428281173295
epoch 5 -1.7264837058497515 8.09508537694368
epoch 6 -1.7288960088313905 8.098665717635072
epoch 7 -1.7214868807324724 8.087664045963269
epoch 8 -1.7284100632662405 8.097944604427557
[32m[I 2022-03-12 04:52:37,764][0m Trial 3 finished with value: 8.100345106504555 and parameters: {'lr': 1.3438337586961982e-05, 'weight_decay': 0.19700289887555036, 'criterion': 'PoissonNLLLoss', 'batch_size': 32, 'epochs': 10}. Best is trial 1 with value: 4.8868888780835125.[0m
epoch 9 -1.7300278873184842 8.100345106504555

Previous best Test-set performance: 0.0059073892732609545

Trial Id: 4 | Model params: 363990 | Timestamp: 2022-03-12 04:52:37.765369

epoch 0 0.0031867700635739293 4.8947089963741
epoch 1 0.0044636716752853856 4.8915729702567825
epoch 2 0.005805984912638507 4.88827412633199
epoch 3 0.006058702715286524 4.8876528027311865
[32m[I 2022-03-12 05:05:27,831][0m Trial 4 finished with value: 4.895763673733464 and parameters: {'lr': 0.00025978734549005495, 'weight_decay': 0.14528711616007253, 'criterion': 'MSELoss', 'batch_size': 32, 'epochs': 5}. Best is trial 1 with value: 4.8868888780835125.[0m
epoch 4 0.002757151219626164 4.895763673733464

Previous best Test-set performance: 0.0059073892732609545

Trial Id: 5 | Model params: 363990 | Timestamp: 2022-03-12 05:05:27.831504

epoch 0 -1.7171346975763822 8.081194590011856
epoch 1 -1.7160204330821829 8.079537419396013
[32m[I 2022-03-12 05:08:48,683][0m Trial 5 pruned. [0m
epoch 2 -1.7064268689044604 8.065255470738226

Previous best Test-set performance: 0.0059073892732609545

Trial Id: 6 | Model params: 363990 | Timestamp: 2022-03-12 05:08:48.683563

epoch 0 -1.7222042248136011 8.088729870626668
epoch 1 -1.7169569088171324 8.080930199537601
epoch 2 -1.7055517075272273 8.06395135813366
epoch 3 -1.714771287922586 8.077679245644056
epoch 4 -1.7138262517507492 8.07627316706186
epoch 5 -1.7242157888209437 8.09171788911998
epoch 6 -1.7252535865393601 8.093259023779904
epoch 7 -1.7254499035184208 8.093550522442193
epoch 8 -1.7149629987435033 8.07796445404962
[32m[I 2022-03-12 05:19:58,483][0m Trial 6 finished with value: 8.098320763194625 and parameters: {'lr': 0.00019408185156201722, 'weight_decay': 0.12904326788965562, 'criterion': 'PoissonNLLLoss', 'batch_size': 128, 'epochs': 10}. Best is trial 1 with value: 4.8868888780835125.[0m
epoch 9 -1.7286635446747587 8.098320763194625

Previous best Test-set performance: 0.0059073892732609545

Trial Id: 7 | Model params: 363990 | Timestamp: 2022-03-12 05:19:58.483881

epoch 0 -1.734363730006998 8.106775056940434
epoch 1 -1.699177742621 8.054446891586485
epoch 2 -1.7140932993486522 8.076670520483628
epoch 3 -1.7023991120034165 8.059251801487784
epoch 4 -1.7269989066320552 8.095850171046083
epoch 5 -1.7358052166674978 8.108911617681606
epoch 6 -1.734775726796017 8.107385772964479
epoch 7 -1.7430672449257516 8.119666791084898
epoch 8 -1.7147801166984018 8.077692380445045
epoch 9 -1.7051984479638929 8.063424892326303
epoch 10 -1.717002586624341 8.080998128038622
epoch 11 -1.7307869867095418 8.10147120116591
epoch 12 -1.7242521422131984 8.091771879045135
epoch 13 -1.7172302440849023 8.0813366740868
epoch 14 -1.7294858850334638 8.099540971222646
epoch 15 -1.7266014117519415 8.095260112820872
epoch 16 -1.7251553510911215 8.093113156236313
epoch 17 -1.717959896830188 8.082421634352333
epoch 18 -1.7211687605276746 8.08719134029791
[32m[I 2022-03-12 06:12:56,753][0m Trial 7 finished with value: 8.098895153199255 and parameters: {'lr': 0.0018427052521078637, 'weight_decay': 0.11802813240776486, 'criterion': 'PoissonNLLLoss', 'batch_size': 32, 'epochs': 20}. Best is trial 1 with value: 4.8868888780835125.[0m
epoch 19 -1.729050630515014 8.098895153199255

Previous best Test-set performance: 0.0059073892732609545

Trial Id: 8 | Model params: 363990 | Timestamp: 2022-03-12 06:12:56.753704

epoch 0 -1.7461036752849712 8.124159568956056
epoch 1 -1.7197635978814847 8.085103030534523
epoch 2 -1.741767261347937 8.117742542891746
epoch 3 -1.7762451107164137 8.16862357763742
epoch 4 -1.7508208678919979 8.131134320535361
epoch 5 -1.7134401090860312 8.07569857158406
epoch 6 -1.741219020473347 8.116930894719664
epoch 7 -1.6974399091785957 8.051853594251996
epoch 8 -1.735126650960213 8.107905922804312
[32m[I 2022-03-12 06:39:25,001][0m Trial 8 finished with value: 8.077153871879299 and parameters: {'lr': 0.00814496333501063, 'weight_decay': 0.27417087370221693, 'criterion': 'PoissonNLLLoss', 'batch_size': 32, 'epochs': 10}. Best is trial 1 with value: 4.8868888780835125.[0m
epoch 9 -1.7144181609448501 8.077153871879299

Previous best Test-set performance: 0.0059073892732609545

Trial Id: 9 | Model params: 363990 | Timestamp: 2022-03-12 06:39:25.001916

[32m[I 2022-03-12 06:40:29,352][0m Trial 9 pruned. [0m
epoch 0 0.006399877638130325 4.886813876078744

Previous best Test-set performance: 0.0059073892732609545

Trial Id: 10 | Model params: 363990 | Timestamp: 2022-03-12 06:40:29.353120

[32m[I 2022-03-12 06:43:06,729][0m Trial 10 pruned. [0m
epoch 0 0.006061902586309009 4.887644935128138

Previous best Test-set performance: 0.0059073892732609545

Trial Id: 11 | Model params: 363990 | Timestamp: 2022-03-12 06:43:06.729975

[32m[I 2022-03-12 06:45:42,143][0m Trial 11 pruned. [0m
epoch 0 0.006323726414056652 4.887001139405347

Previous best Test-set performance: 0.0059073892732609545

Trial Id: 12 | Model params: 363990 | Timestamp: 2022-03-12 06:45:42.143758

[32m[I 2022-03-12 06:48:14,336][0m Trial 12 pruned. [0m
epoch 0 0.0062298773600492074 4.887231913560545

Previous best Test-set performance: 0.0059073892732609545

Trial Id: 13 | Model params: 363990 | Timestamp: 2022-03-12 06:48:14.336700

[32m[I 2022-03-12 06:50:45,314][0m Trial 13 pruned. [0m
epoch 0 0.004026548206768954 4.892646756626791

Previous best Test-set performance: 0.0059073892732609545

Trial Id: 14 | Model params: 363990 | Timestamp: 2022-03-12 06:50:45.315132

[32m[I 2022-03-12 06:53:14,253][0m Trial 14 pruned. [0m
epoch 0 0.006301412982090637 4.88705600896306

Study statistics: 
  Number of finished trials:  15
  Number of pruned trials:  7
  Number of complete trials:  8

Best trial:
  Value:  4.8868888780835125
  Params: 
    lr: 6.499002391715602e-05
    weight_decay: 0.2453814057812171
    criterion: MSELoss
    batch_size: 32
    epochs: 10
Target: 132567, NaN: 0, Max: 227.0, Min: 0.0, Mean: 8.573823047968197
Prediction: 132567, NaN: 0, Max: 10.429011344909668, Min: 8.031254768371582, Mean: 8.574740147525352

 XXXXXX======== TRIAL south - lrg ended

Test Set - R-squared:  0.006369378186776742
Test Set - RMSE:  4.886888878081553
Test Set - MAE:  3.3104429061766374



[32m[I 2022-03-12 06:54:57,684][0m A new study created in memory with name: DeepSet[0m
Starting Loading north
Finished Loading north
Finished north setup

++++++++ Session Characteristics +++++++

Area: north
Gal Type: lrg
Training Set: 290439
Validation Set: 72610
Test Samples: 72610
Number of features: 5
Device: cuda:0
Number of Workers: 8
Number of Trials: 15

+++++++++++++++++++++++++++++++++++++++

Trial Id: 0 | Model params: 354186 | Timestamp: 2022-03-12 06:54:57.685270

epoch 0 0.00998567065392808 4.845279906145074
epoch 5 0.009691878582838487 4.845998784238014
epoch 10 0.008794782144733504 4.848193224566694
epoch 15 -0.0055117934197908 4.883056112011005
epoch 20 0.009866520826198433 4.845571466014399
[32m[I 2022-03-12 07:12:40,110][0m Trial 0 finished with value: 4.862113531397285 and parameters: {'n_layers_fe': 4, 'fe_neurons': 256, 'fe_dropout': 0.3718272714764822, 'n_units_l(Invariant)': 196, 'n_layers_mlp': 2, 'initialiser': 'xavier', 'lr': 0.0008687556865182999, 'weight_decay': 0.20927336065175814, 'criterion': 'MSELoss', 'batch_size': 128, 'epochs': 25}. Best is trial 0 with value: 4.862113531397285.[0m

Trial Id: 1 | Model params: 428748 | Timestamp: 2022-03-12 07:12:40.110573

epoch 0 -0.008114834283851735 4.889372586356451
epoch 5 0.006986341772423965 4.852613940238608
epoch 10 0.00881993280630633 4.848131715588365
epoch 15 0.008874958827974067 4.84799714008978
epoch 20 0.00040526176644495315 4.868667447076996
epoch 25 0.007801572716487515 4.850621614513564
epoch 30 -0.010760184420989471 4.895783378144802
epoch 35 0.008725043002378308 4.848363775974422
epoch 40 -0.015183333752342598 4.906483810520806
epoch 45 0.0015777644180196004 4.865811189311151
epoch 50 0.007923078881132195 4.850324598081401
epoch 55 0.0021727730355699526 4.864361085856851
epoch 60 0.0011445032532757526 4.86686682403673
epoch 65 0.007810134803599045 4.850600685466881
epoch 70 0.009436887414900341 4.846622634194458
[32m[I 2022-03-12 08:16:49,360][0m Trial 1 finished with value: 4.858162861610638 and parameters: {'n_layers_fe': 4, 'fe_neurons': 256, 'fe_dropout': 0.48794492543457657, 'n_units_l(Invariant)': 485, 'n_layers_mlp': 2, 'initialiser': 'xavier', 'lr': 0.0012150750980148546, 'weight_decay': 0.2262539395794549, 'criterion': 'MSELoss', 'batch_size': 128, 'epochs': 75}. Best is trial 1 with value: 4.858162861610638.[0m

Trial Id: 2 | Model params: 68718 | Timestamp: 2022-03-12 08:16:49.360469

epoch 0 -4.112011931454409 11.010170893944178
