[32m[I 2021-08-21 00:06:34,436][0m Trial 24 pruned. [0m

Trial Id: 25 | Model params: 67137 | Timestamp: 2021-08-21 00:06:34.436842

epoch 0 0.003224535516385907 10.149748246851829
epoch 5 -0.03309489329299686 10.333006626909466
epoch 10 -0.0010065253555298082 10.171266998480625
epoch 15 -0.0031955929140123907 10.18238252588999
epoch 20 -0.0036342202094208353 10.184608304616184
epoch 25 -0.00021232790192771134 10.167231261924826
epoch 30 -0.004582614689472075 10.189419193549403
epoch 35 -0.0005885862641077377 10.169143428959373
epoch 40 -5.627646685990584e-06 10.166180646057969
epoch 45 -7.687938968259367e-05 10.166542816613921
epoch 50 -0.0006601723745780497 10.16950719305527
[32m[I 2021-08-21 00:56:53,627][0m Trial 25 finished with value: -0.000200278050068059 and parameters: {'n_layers_fe': 4, 'fe_n_units_l0': 115, 'fe_dropout_l0': 0.07120927047341924, 'fe_n_units_l1': 95, 'fe_dropout_l1': 0.26733912918490604, 'fe_n_units_l2': 127, 'fe_dropout_l2': 0.4352329736236614, 'fe_n_units_l3': 38, 'fe_dropout_l3': 0.06288790806147027, 'n_units_l(Invariant)': 255, 'n_layers_mlp': 2, 'mlp_n_units_l0': 172, 'mlp_dropout_l0': 0.4042393398623952, 'mlp_n_units_l1': 95, 'mlp_dropout_l1': 0.2708493079195523, 'reduction': 'sum', 'lr': 0.009073686451903118, 'criterion': 'MSELoss', 'batch_size': 32, 'no_epochs': 52}. Best is trial 22 with value: 0.0033112985317766963.[0m

Trial Id: 26 | Model params: 115281 | Timestamp: 2021-08-21 00:56:53.627923

[32m[I 2021-08-21 00:58:03,078][0m Trial 26 pruned. [0m
epoch 0 -0.3284640061431472 11.717406494588186

Trial Id: 27 | Model params: 60680 | Timestamp: 2021-08-21 00:58:03.079181

[32m[I 2021-08-21 00:58:48,609][0m Trial 27 pruned. [0m
epoch 0 -0.4327382955826571 12.16858374136059

Trial Id: 28 | Model params: 109115 | Timestamp: 2021-08-21 00:58:48.609840

[32m[I 2021-08-21 00:59:54,407][0m Trial 28 pruned. [0m
epoch 0 -0.4144758165010791 12.090781250026286

Trial Id: 29 | Model params: 62118 | Timestamp: 2021-08-21 00:59:54.407575

epoch 0 -0.15196223822036958 10.911280538676735
epoch 5 0.00429105854392553 10.144316814315658
epoch 10 -0.016785861310582684 10.251120765039111
epoch 15 0.004570145966112049 10.14289503857104
epoch 20 -0.001093562278180693 10.171709181680171
epoch 25 -0.010840568771586012 10.221106941377688
epoch 30 0.004079559905539987 10.145394134797776
epoch 35 -0.004809534690059403 10.19056994631903
epoch 40 0.0035630395369573575 10.14802467797697
[32m[I 2021-08-21 01:39:01,576][0m Trial 29 finished with value: 0.001591239437872094 and parameters: {'n_layers_fe': 4, 'fe_n_units_l0': 150, 'fe_dropout_l0': 0.15636780892286445, 'fe_n_units_l1': 36, 'fe_dropout_l1': 0.12972800946443067, 'fe_n_units_l2': 182, 'fe_dropout_l2': 0.4662766510777509, 'fe_n_units_l3': 37, 'fe_dropout_l3': 0.07563690745333396, 'n_units_l(Invariant)': 196, 'n_layers_mlp': 2, 'mlp_n_units_l0': 213, 'mlp_dropout_l0': 0.3499191090977718, 'mlp_n_units_l1': 94, 'mlp_dropout_l1': 0.281576917173555, 'reduction': 'sum', 'lr': 0.000647418451724594, 'criterion': 'MSELoss', 'batch_size': 32, 'no_epochs': 44}. Best is trial 22 with value: 0.0033112985317766963.[0m

Study statistics: 
  Number of finished trials:  30
  Number of pruned trials:  15
  Number of complete trials:  15

Best trial:
  Value:  0.0033112985317766963
  Params: 
    n_layers_fe: 4
    fe_n_units_l0: 156
    fe_dropout_l0: 0.1534943152514781
    fe_n_units_l1: 10
    fe_dropout_l1: 0.4574354327980903
    fe_n_units_l2: 146
    fe_dropout_l2: 0.3802389474503816
    fe_n_units_l3: 94
    fe_dropout_l3: 0.05627571089172668
    n_units_l(Invariant): 157
    n_layers_mlp: 2
    mlp_n_units_l0: 187
    mlp_dropout_l0: 0.4217877524488634
    mlp_n_units_l1: 151
    mlp_dropout_l1: 0.21808807890469853
    reduction: sum
    lr: 0.00471120213385988
    criterion: MSELoss
    batch_size: 128
    no_epochs: 45
Target 17317 0 105.0 4.0 32.608765952532195
[26. 33. 36. ... 29. 25. 29.]
Prediction 17317 0 37.22126770019531 31.98766326904297 32.287692835997746
[32.21341705 32.01544189 32.1586113  ... 32.84783173 31.98766327
 32.08890533]

 XXXXXX======== TRIAL des - lrg ended

Test Set - R-squared:  0.003216345139268495
Test Set - RMSE:  10.17921241701079
Test Set - MAE:  7.709397448095692



[32m[I 2021-08-21 01:41:26,891][0m A new study created in memory with name: DeepSet[0m
Starting Loading des
Finished Loading des
Finished des setup

++++++++ Session Characteristics +++++++

Area: des
Gal Type: elg
Training Set: 55414
Validation Set: 13858
Test Samples: 17317
Number of features: 6
Device: cuda:0
Number of Workers: 8
Number of Trials: 30

+++++++++++++++++++++++++++++++++++++++

Trial Id: 0 | Model params: 125069 | Timestamp: 2021-08-21 01:41:26.892191

[32m[I 2021-08-21 01:42:39,824][0m Trial 0 pruned. [0m
++++++++++++++++++++
        NaN         
++++++++++++++++++++

Trial Id: 1 | Model params: 97149 | Timestamp: 2021-08-21 01:42:39.824909

epoch 0 -7.287435285273425 53.184161556612366
epoch 5 -0.009448601633571307 18.561554605750477
epoch 10 -0.0063326687900668865 18.532884865387388
epoch 15 -0.0032358232148170796 18.504346735098363
epoch 20 -0.011307386232616956 18.578636239992132
epoch 25 -0.006807424997765876 18.537255966976257
epoch 30 -0.0021234642975451745 18.494085347207964
epoch 35 -0.009609096745491374 18.56303012435389
[32m[I 2021-08-21 02:22:35,803][0m Trial 1 finished with value: -0.005892182969178261 and parameters: {'n_layers_fe': 4, 'fe_n_units_l0': 140, 'fe_dropout_l0': 0.18834924545760356, 'fe_n_units_l1': 153, 'fe_dropout_l1': 0.3183198275901038, 'fe_n_units_l2': 175, 'fe_dropout_l2': 0.0730573021321691, 'fe_n_units_l3': 51, 'fe_dropout_l3': 0.12837999233257197, 'n_units_l(Invariant)': 86, 'n_layers_mlp': 4, 'mlp_n_units_l0': 122, 'mlp_dropout_l0': 0.24036415646761433, 'mlp_n_units_l1': 47, 'mlp_dropout_l1': 0.08497517953331357, 'mlp_n_units_l2': 75, 'mlp_dropout_l2': 0.3269320997954261, 'mlp_n_units_l3': 215, 'mlp_dropout_l3': 0.3146246702882979, 'reduction': 'sum', 'lr': 0.005469900631923101, 'criterion': 'L1Loss', 'batch_size': 256, 'no_epochs': 41}. Best is trial 1 with value: -0.005892182969178261.[0m
epoch 40 -0.005892182969178261 18.52882837056784

Trial Id: 2 | Model params: 44771 | Timestamp: 2021-08-21 02:22:35.803212

[32m[I 2021-08-21 02:23:26,261][0m Trial 2 pruned. [0m
++++++++++++++++++++
        NaN         
++++++++++++++++++++

Trial Id: 3 | Model params: 196601 | Timestamp: 2021-08-21 02:23:26.262088

[33m[W 2021-08-21 02:23:29,317][0m Trial 3 failed because of the following error: RuntimeError('CUDA out of memory. Tried to allocate 680.00 MiB (GPU 0; 7.93 GiB total capacity; 5.32 GiB already allocated; 318.06 MiB free; 5.60 GiB reserved in total by PyTorch)')
Traceback (most recent call last):
  File "/vol/bitbucket/ele20/venv/lib/python3.8/site-packages/optuna/_optimize.py", line 216, in _run_trial
    value_or_values = func(trial)
  File "hp_optim.py", line 260, in objective
    predictions = model(X1, X2, mask=mask)
  File "/vol/bitbucket/ele20/venv/lib/python3.8/site-packages/torch/nn/modules/module.py", line 1051, in _call_impl
    return forward_call(*input, **kwargs)
  File "/vol/bitbucket/ele20/astrostatistics/models/deep_set/models.py", line 95, in forward
    y = self.feature_extractor(X1)
  File "/vol/bitbucket/ele20/venv/lib/python3.8/site-packages/torch/nn/modules/module.py", line 1051, in _call_impl
    return forward_call(*input, **kwargs)
  File "/vol/bitbucket/ele20/venv/lib/python3.8/site-packages/torch/nn/modules/container.py", line 139, in forward
    input = module(input)
  File "/vol/bitbucket/ele20/venv/lib/python3.8/site-packages/torch/nn/modules/module.py", line 1051, in _call_impl
    return forward_call(*input, **kwargs)
  File "/vol/bitbucket/ele20/venv/lib/python3.8/site-packages/torch/nn/modules/activation.py", line 102, in forward
    return F.relu(input, inplace=self.inplace)
  File "/vol/bitbucket/ele20/venv/lib/python3.8/site-packages/torch/nn/functional.py", line 1298, in relu
    result = torch.relu(input)
RuntimeError: CUDA out of memory. Tried to allocate 680.00 MiB (GPU 0; 7.93 GiB total capacity; 5.32 GiB already allocated; 318.06 MiB free; 5.60 GiB reserved in total by PyTorch)[0m
Traceback (most recent call last):
  File "hp_optim.py", line 325, in <module>
    main()
  File "hp_optim.py", line 42, in main
    study.optimize(objective, n_trials=args['trials'], timeout=None)
  File "/vol/bitbucket/ele20/venv/lib/python3.8/site-packages/optuna/study.py", line 401, in optimize
    _optimize(
  File "/vol/bitbucket/ele20/venv/lib/python3.8/site-packages/optuna/_optimize.py", line 65, in _optimize
    _optimize_sequential(
  File "/vol/bitbucket/ele20/venv/lib/python3.8/site-packages/optuna/_optimize.py", line 162, in _optimize_sequential
    trial = _run_trial(study, func, catch)
  File "/vol/bitbucket/ele20/venv/lib/python3.8/site-packages/optuna/_optimize.py", line 267, in _run_trial
    raise func_err
  File "/vol/bitbucket/ele20/venv/lib/python3.8/site-packages/optuna/_optimize.py", line 216, in _run_trial
    value_or_values = func(trial)
  File "hp_optim.py", line 260, in objective
    predictions = model(X1, X2, mask=mask)
  File "/vol/bitbucket/ele20/venv/lib/python3.8/site-packages/torch/nn/modules/module.py", line 1051, in _call_impl
    return forward_call(*input, **kwargs)
  File "/vol/bitbucket/ele20/astrostatistics/models/deep_set/models.py", line 95, in forward
    y = self.feature_extractor(X1)
  File "/vol/bitbucket/ele20/venv/lib/python3.8/site-packages/torch/nn/modules/module.py", line 1051, in _call_impl
    return forward_call(*input, **kwargs)
  File "/vol/bitbucket/ele20/venv/lib/python3.8/site-packages/torch/nn/modules/container.py", line 139, in forward
    input = module(input)
  File "/vol/bitbucket/ele20/venv/lib/python3.8/site-packages/torch/nn/modules/module.py", line 1051, in _call_impl
    return forward_call(*input, **kwargs)
  File "/vol/bitbucket/ele20/venv/lib/python3.8/site-packages/torch/nn/modules/activation.py", line 102, in forward
    return F.relu(input, inplace=self.inplace)
  File "/vol/bitbucket/ele20/venv/lib/python3.8/site-packages/torch/nn/functional.py", line 1298, in relu
    result = torch.relu(input)
RuntimeError: CUDA out of memory. Tried to allocate 680.00 MiB (GPU 0; 7.93 GiB total capacity; 5.32 GiB already allocated; 318.06 MiB free; 5.60 GiB reserved in total by PyTorch)
[32m[I 2021-08-21 02:24:28,897][0m A new study created in memory with name: DeepSet[0m
Starting Loading des
Finished Loading des
Finished des setup

++++++++ Session Characteristics +++++++

Area: des
Gal Type: qso
Training Set: 55414
Validation Set: 13858
Test Samples: 17317
Number of features: 6
Device: cuda:0
Number of Workers: 8
Number of Trials: 30

+++++++++++++++++++++++++++++++++++++++

Trial Id: 0 | Model params: 179463 | Timestamp: 2021-08-21 02:24:28.898511

epoch 0 -2.3234498482463137 45.086345009298604
epoch 5 -0.0012025676102545013 24.746366610756912
epoch 10 -0.0012387465128924635 24.746813717231355
epoch 15 -0.013520630368645037 24.898131816727943
epoch 20 -0.03174934186981404 25.121037134926063
epoch 25 -0.014183061596695357 24.906267125196436
epoch 30 -0.02683590439991801 25.061149552422187
epoch 35 -0.005630815760408803 24.80103194692839
epoch 40 -0.0021362169518366336 24.757902260868466
epoch 45 -0.008247809727342181 24.83328134657786
[32m[I 2021-08-21 03:14:03,148][0m Trial 0 finished with value: 0.009935854782797349 and parameters: {'n_layers_fe': 4, 'fe_n_units_l0': 98, 'fe_dropout_l0': 0.01856315271117842, 'fe_n_units_l1': 12, 'fe_dropout_l1': 0.38414312248078136, 'fe_n_units_l2': 252, 'fe_dropout_l2': 0.11102661522603663, 'fe_n_units_l3': 233, 'fe_dropout_l3': 0.17507638636949624, 'n_units_l(Invariant)': 55, 'n_layers_mlp': 4, 'mlp_n_units_l0': 230, 'mlp_dropout_l0': 0.4932403295701788, 'mlp_n_units_l1': 256, 'mlp_dropout_l1': 0.14657311195781575, 'mlp_n_units_l2': 93, 'mlp_dropout_l2': 0.20930877776178441, 'mlp_n_units_l3': 42, 'mlp_dropout_l3': 0.171971684946657, 'reduction': 'sum', 'lr': 0.0001886738494646323, 'criterion': 'L1Loss', 'batch_size': 32, 'no_epochs': 48}. Best is trial 0 with value: 0.009935854782797349.[0m

Trial Id: 1 | Model params: 127205 | Timestamp: 2021-08-21 03:14:03.148908

[32m[I 2021-08-21 03:14:53,510][0m Trial 1 pruned. [0m
++++++++++++++++++++
        NaN         
++++++++++++++++++++

Trial Id: 2 | Model params: 104492 | Timestamp: 2021-08-21 03:14:53.511151

[32m[I 2021-08-21 03:15:38,270][0m Trial 2 pruned. [0m
++++++++++++++++++++
        NaN         
++++++++++++++++++++

Trial Id: 3 | Model params: 50298 | Timestamp: 2021-08-21 03:15:38.270874

[32m[I 2021-08-21 03:16:14,682][0m Trial 3 pruned. [0m
++++++++++++++++++++
        NaN         
++++++++++++++++++++

Trial Id: 4 | Model params: 162502 | Timestamp: 2021-08-21 03:16:14.683154

epoch 0 -2.1941216538971213 44.20039920112898
epoch 5 -0.4470173811223963 29.750025281358116
epoch 10 -0.011067288945306064 24.86797918535653
epoch 15 -0.005507766668049863 24.799514572072
epoch 20 -1.7351458003744824e-07 24.73150257376539
epoch 25 -0.0020589963951023194 24.756948370671456
epoch 30 -0.0029392652288227072 24.767819979143834
epoch 35 -0.003447767763296028 24.774097978062837
epoch 40 -1.078233820672736e-05 24.731633759469116
epoch 45 -4.786087641983627e-06 24.731559611621
epoch 50 -0.01749586852878826 24.946911851148926
epoch 55 -0.00011247289213023315 24.732891200712512
epoch 60 -0.00010905747244915887 24.732848968824708
[32m[I 2021-08-21 04:26:46,192][0m Trial 4 finished with value: -0.006492092193268073 and parameters: {'n_layers_fe': 4, 'fe_n_units_l0': 180, 'fe_dropout_l0': 0.13652975108521326, 'fe_n_units_l1': 239, 'fe_dropout_l1': 0.018932293970351177, 'fe_n_units_l2': 26, 'fe_dropout_l2': 0.13871212939589156, 'fe_n_units_l3': 146, 'fe_dropout_l3': 0.43916103960378955, 'n_units_l(Invariant)': 242, 'n_layers_mlp': 4, 'mlp_n_units_l0': 254, 'mlp_dropout_l0': 0.2813764057472502, 'mlp_n_units_l1': 121, 'mlp_dropout_l1': 0.14555007895357092, 'mlp_n_units_l2': 80, 'mlp_dropout_l2': 0.3603055853176366, 'mlp_n_units_l3': 175, 'mlp_dropout_l3': 0.4256889732295499, 'reduction': 'sum', 'lr': 0.005889565771105937, 'criterion': 'MSELoss', 'batch_size': 128, 'no_epochs': 62}. Best is trial 0 with value: 0.009935854782797349.[0m

Trial Id: 5 | Model params: 73344 | Timestamp: 2021-08-21 04:26:46.193075

epoch 0 -1.5493544737103964 39.48804002411144
epoch 5 -1.1140361158651686 35.958922230070264
epoch 10 -3.7035409159086567 53.636808481665234
epoch 15 -5.641637653700683 63.73647699167715
epoch 20 -5.154351734019181 61.35382199279875
epoch 25 -2.4322790081556076 45.818593909161514
epoch 30 -3.858351555295207 54.5123536898502
epoch 35 -1.6708176234554784 40.41779174911828
epoch 40 -1.5547257975493158 39.529617499631605
epoch 45 -0.9944599353522867 34.92714792683443
epoch 50 -0.5184993768552721 30.475986622149314
epoch 55 -0.40374948153880474 29.301865441591204
epoch 60 -0.4954554276693035 30.243858807894867
epoch 65 -0.15065047938615095 26.529079220344713
epoch 70 -0.26046690145936124 27.76618342241562
epoch 75 -0.31499565105332694 28.36041773555411
epoch 80 -0.21680454761048162 27.28103717145218
epoch 85 -0.12444655383873071 26.22526432388821
[32m[I 2021-08-21 05:28:08,001][0m Trial 5 finished with value: -0.25169326580442464 and parameters: {'n_layers_fe': 2, 'fe_n_units_l0': 199, 'fe_dropout_l0': 0.3791829682919363, 'fe_n_units_l1': 143, 'fe_dropout_l1': 0.41388791447329437, 'n_units_l(Invariant)': 79, 'n_layers_mlp': 2, 'mlp_n_units_l0': 202, 'mlp_dropout_l0': 0.4095562438360884, 'mlp_n_units_l1': 90, 'mlp_dropout_l1': 0.14060784988578262, 'reduction': 'sum', 'lr': 3.4537686310735177e-05, 'criterion': 'MSELoss', 'batch_size': 32, 'no_epochs': 88}. Best is trial 0 with value: 0.009935854782797349.[0m

Trial Id: 6 | Model params: 98259 | Timestamp: 2021-08-21 05:28:08.001497

epoch 0 -0.9553404974827737 34.58292022156632
epoch 5 -0.011319318164492387 24.871078418672155
epoch 10 -0.06735683981127072 25.550845975555585
epoch 15 -0.14448735215511976 26.45793614964677
epoch 20 -0.023466516361279277 25.019998809372947
epoch 25 0.011084002712243968 24.59405650075475
epoch 30 -0.008352403612360781 24.834569394014977
epoch 35 -0.03206871557863877 25.124924890264673
epoch 40 0.009958008486805281 24.608054093732022
[32m[I 2021-08-21 06:04:31,440][0m Trial 6 finished with value: -0.03643001518291489 and parameters: {'n_layers_fe': 4, 'fe_n_units_l0': 188, 'fe_dropout_l0': 0.3291181137059717, 'fe_n_units_l1': 49, 'fe_dropout_l1': 0.29211898032848704, 'fe_n_units_l2': 97, 'fe_dropout_l2': 0.0630162301060081, 'fe_n_units_l3': 54, 'fe_dropout_l3': 0.30899626309758643, 'n_units_l(Invariant)': 67, 'n_layers_mlp': 2, 'mlp_n_units_l0': 229, 'mlp_dropout_l0': 0.3718422732373016, 'mlp_n_units_l1': 253, 'mlp_dropout_l1': 0.08610565176316048, 'reduction': 'sum', 'lr': 0.00015318043664587502, 'criterion': 'L1Loss', 'batch_size': 32, 'no_epochs': 43}. Best is trial 0 with value: 0.009935854782797349.[0m

Trial Id: 7 | Model params: 155996 | Timestamp: 2021-08-21 06:04:31.440754

[32m[I 2021-08-21 06:05:30,902][0m Trial 7 pruned. [0m
++++++++++++++++++++
        NaN         
++++++++++++++++++++

Trial Id: 8 | Model params: 90754 | Timestamp: 2021-08-21 06:05:30.902560

[32m[I 2021-08-21 06:06:13,184][0m Trial 8 pruned. [0m
++++++++++++++++++++
        NaN         
++++++++++++++++++++

Trial Id: 9 | Model params: 19092 | Timestamp: 2021-08-21 06:06:13.185035

[32m[I 2021-08-21 06:06:47,585][0m Trial 9 pruned. [0m
++++++++++++++++++++
        NaN         
++++++++++++++++++++

Trial Id: 10 | Model params: 58212 | Timestamp: 2021-08-21 06:06:47.585791

epoch 0 -6.814571153806578 69.13580757387281
epoch 5 -20.127109936622023 113.67645230116305
epoch 10 -21.20353380035524 116.53637782621523
epoch 15 -23.208472035773987 121.68418977478804
epoch 20 -17.938225190716942 107.62671959751685
epoch 25 -14.882626075921804 98.5624796409343
epoch 30 -13.726160789078437 94.90634192978847
epoch 35 -13.873675428675627 95.38050451738916
epoch 40 -13.545272546194258 94.32165163355141
epoch 45 -13.133861289465868 92.97814506254657
epoch 50 -13.15158985541737 93.0364395570971
[32m[I 2021-08-21 06:32:21,918][0m Trial 10 finished with value: -12.82750839349922 and parameters: {'n_layers_fe': 2, 'fe_n_units_l0': 52, 'fe_dropout_l0': 0.4698031380213378, 'fe_n_units_l1': 223, 'fe_dropout_l1': 0.4846212811120172, 'n_units_l(Invariant)': 18, 'n_layers_mlp': 4, 'mlp_n_units_l0': 150, 'mlp_dropout_l0': 0.31527931063799386, 'mlp_n_units_l1': 187, 'mlp_dropout_l1': 0.495309108407065, 'mlp_n_units_l2': 17, 'mlp_dropout_l2': 0.4906524255341772, 'mlp_n_units_l3': 26, 'mlp_dropout_l3': 0.01658831477416217, 'reduction': 'sum', 'lr': 0.0003321003972986103, 'criterion': 'L1Loss', 'batch_size': 256, 'no_epochs': 55}. Best is trial 0 with value: 0.009935854782797349.[0m

Trial Id: 11 | Model params: 256958 | Timestamp: 2021-08-21 06:32:21.918777

[32m[I 2021-08-21 06:33:56,296][0m Trial 11 pruned. [0m
epoch 0 -2.679182615643279 47.43797452070513

Trial Id: 12 | Model params: 209594 | Timestamp: 2021-08-21 06:33:56.296375

epoch 0 -1.9748912630672981 42.656578083722856
[32m[I 2021-08-21 06:38:20,188][0m Trial 12 pruned. [0m

Trial Id: 13 | Model params: 133892 | Timestamp: 2021-08-21 06:38:20.188570

[32m[I 2021-08-21 06:39:12,253][0m Trial 13 pruned. [0m
epoch 0 -2.417970811428696 45.72299181578453

Trial Id: 14 | Model params: 203723 | Timestamp: 2021-08-21 06:39:12.253199

epoch 0 -1.09026023930365 35.75614131418832
epoch 5 -0.008854802645669402 24.840755381120296
