[32m[I 2021-08-22 02:06:48,090][0m Trial 36 pruned. [0m
++++++++++++++++++++
        NaN         
++++++++++++++++++++

Trial Id: 37 | Model params: 94134 | Timestamp: 2021-08-22 02:06:48.091034

epoch 0 -4.182464051889267 50.984926879599314
epoch 5 -2.3984485088108927 41.28706383212273
epoch 10 -1.9479761731300003 38.45347885315368
epoch 15 -1.48963720805844 35.3379770719328
epoch 20 -0.9764619735489455 31.48602842487747
epoch 25 -0.6829294818874956 29.05404540624589
epoch 30 -0.8231543145824296 30.240249248949105
epoch 35 -1.1447097791513943 32.79879721012358
epoch 40 -0.8870971174316069 30.765981691630238
epoch 45 -0.37260030153026147 26.238904364813322
epoch 50 -0.19275441572101681 24.45958972952603
[32m[I 2021-08-22 02:24:13,447][0m Trial 37 finished with value: 24.73166281519359 and parameters: {'n_layers_fe': 4, 'fe_n_units_l0': 156, 'fe_dropout_l0': 0.4048482380432513, 'fe_n_units_l1': 49, 'fe_dropout_l1': 0.49157404316528786, 'fe_n_units_l2': 90, 'fe_dropout_l2': 0.22973715471261763, 'fe_n_units_l3': 122, 'fe_dropout_l3': 0.20526899661655842, 'n_units_l(Invariant)': 203, 'n_layers_mlp': 2, 'mlp_n_units_l0': 245, 'mlp_dropout_l0': 0.3510137607473458, 'mlp_n_units_l1': 114, 'mlp_dropout_l1': 0.12488742620856058, 'reduction': 'sum', 'lr': 1.725441200932755e-05, 'criterion': 'MSELoss', 'batch_size': 256, 'no_epochs': 52}. Best is trial 8 with value: 19.896305142112624.[0m

Trial Id: 38 | Model params: 121334 | Timestamp: 2021-08-22 02:24:13.447197

[32m[I 2021-08-22 02:24:41,209][0m Trial 38 pruned. [0m
epoch 0 -0.8304893363543429 30.301020361373666

Trial Id: 39 | Model params: 86396 | Timestamp: 2021-08-22 02:24:41.210126

[32m[I 2021-08-22 02:24:58,028][0m Trial 39 pruned. [0m
++++++++++++++++++++
        NaN         
++++++++++++++++++++

Study statistics: 
  Number of finished trials:  40
  Number of pruned trials:  27
  Number of complete trials:  13

Best trial:
  Value:  19.896305142112624
  Params: 
    n_layers_fe: 2
    fe_n_units_l0: 41
    fe_dropout_l0: 0.04275293862568813
    fe_n_units_l1: 151
    fe_dropout_l1: 0.4437053570557745
    n_units_l(Invariant): 149
    n_layers_mlp: 2
    mlp_n_units_l0: 224
    mlp_dropout_l0: 0.37997226467814804
    mlp_n_units_l1: 111
    mlp_dropout_l1: 0.07985581665989028
    reduction: sum
    lr: 0.0003419430347455254
    criterion: MSELoss
    batch_size: 32
    no_epochs: 47
Target 19505 0 285.0 1.0 125.01307357087926
[ 63. 156.  95. ... 132. 139. 111.]
Prediction 19505 0 173.38246154785156 96.79360961914062 126.44176772644934
[ 99.06619263 134.52233887 119.28012085 ... 138.57098389 167.2364502
 125.2902298 ]

 XXXXXX======== TRIAL north - elg ended

Test Set - R-squared:  0.21078094648808732
Test Set - RMSE:  19.896305118928797
Test Set - MAE:  15.365866423692193



[32m[I 2021-08-22 02:25:45,676][0m A new study created in memory with name: DeepSet[0m
Starting Loading north
Finished Loading north
Finished north setup

++++++++ Session Characteristics +++++++

Area: north
Gal Type: qso
Training Set: 78007
Validation Set: 19505
Test Samples: 19505
Number of features: 6
Device: cuda:0
Number of Workers: 8
Number of Trials: 40

+++++++++++++++++++++++++++++++++++++++

Trial Id: 0 | Model params: 69514 | Timestamp: 2021-08-22 02:25:45.676919

epoch 0 -1.1662798402573564 42.757778202907936
epoch 5 -0.93442330804942 40.404860276625
epoch 10 -0.2614237402674644 32.6278420471657
epoch 15 -0.3420369776383907 33.65426361212159
epoch 20 -0.15366301522568593 31.203070768450463
epoch 25 -0.08039775325575782 30.196018812134245
epoch 30 0.1447832727896422 26.865562891582314
epoch 35 0.10078396253946298 27.54798723230359
epoch 40 0.04189106517459862 28.43578986206152
epoch 45 0.10692723510087088 27.453724661589956
epoch 50 0.0919443252169807 27.683059712173808
epoch 55 0.11565719317007028 27.319212413742292
epoch 60 0.11926813512114454 27.263380560238556
epoch 65 0.15529218156195435 26.699990574128286
epoch 70 0.14013950998122393 26.938403143857933
epoch 75 0.1539257561174766 26.721577212363066
epoch 80 0.10752854383118193 27.444480765317866
[32m[I 2021-08-22 02:52:48,427][0m Trial 0 finished with value: 26.764834950982202 and parameters: {'n_layers_fe': 4, 'fe_n_units_l0': 91, 'fe_dropout_l0': 0.2934155665528105, 'fe_n_units_l1': 186, 'fe_dropout_l1': 0.01714856983586638, 'fe_n_units_l2': 59, 'fe_dropout_l2': 0.04224732386162339, 'fe_n_units_l3': 74, 'fe_dropout_l3': 0.27485012381096846, 'n_units_l(Invariant)': 166, 'n_layers_mlp': 2, 'mlp_n_units_l0': 122, 'mlp_dropout_l0': 0.3397244130035021, 'mlp_n_units_l1': 125, 'mlp_dropout_l1': 0.29105268446736116, 'reduction': 'sum', 'lr': 0.00019858518809244725, 'criterion': 'MSELoss', 'batch_size': 128, 'no_epochs': 86}. Best is trial 0 with value: 26.764834950982202.[0m
epoch 85 0.15118423511931933 26.764834950982202

Trial Id: 1 | Model params: 44806 | Timestamp: 2021-08-22 02:52:48.428074

epoch 0 -1.96473921228369 50.020853735340296
epoch 5 -2.2981839998661924 52.758846452183256
epoch 10 -0.8530620663616884 39.54602476339371
epoch 15 -0.049535064149234476 29.761603561085046
epoch 20 0.04810923665348976 28.343364858974073
epoch 25 0.07312663747823511 27.968427654505113
epoch 30 0.08959586582299106 27.71883425939012
epoch 35 0.09274905013627 27.670790538399288
epoch 40 0.09046092954584883 27.70566194620714
epoch 45 0.044238024392712516 28.400940714667044
epoch 50 0.11123839675769964 27.38738033146951
[32m[I 2021-08-22 03:13:11,528][0m Trial 1 finished with value: 27.280858488574605 and parameters: {'n_layers_fe': 2, 'fe_n_units_l0': 45, 'fe_dropout_l0': 0.44609447952038883, 'fe_n_units_l1': 34, 'fe_dropout_l1': 0.14785679642655936, 'n_units_l(Invariant)': 43, 'n_layers_mlp': 4, 'mlp_n_units_l0': 115, 'mlp_dropout_l0': 0.3324485863025217, 'mlp_n_units_l1': 231, 'mlp_dropout_l1': 0.46540943326689294, 'mlp_n_units_l2': 18, 'mlp_dropout_l2': 0.023058803075593104, 'mlp_n_units_l3': 135, 'mlp_dropout_l3': 0.06948338662877701, 'reduction': 'sum', 'lr': 4.929241646625239e-05, 'criterion': 'L1Loss', 'batch_size': 32, 'no_epochs': 53}. Best is trial 0 with value: 26.764834950982202.[0m

Trial Id: 2 | Model params: 47380 | Timestamp: 2021-08-22 03:13:11.528194

[32m[I 2021-08-22 03:13:20,657][0m Trial 2 pruned. [0m
++++++++++++++++++++
        NaN         
++++++++++++++++++++

Trial Id: 3 | Model params: 49149 | Timestamp: 2021-08-22 03:13:20.657410

epoch 0 -2.179773856979536 51.80312608823533
epoch 5 -0.5160618310060179 35.76978321015345
epoch 10 -0.4585779573270208 35.08509639622966
epoch 15 -0.3870681159609377 34.21422802884086
epoch 20 -0.37324368378433115 34.043300329894194
epoch 25 -0.4263850784219507 34.69574718176994
epoch 30 -0.6405893582149811 37.20983944847489
epoch 35 -0.6671676400698761 37.51003652771486
epoch 40 -1.1047987520109959 42.146657681639354
epoch 45 -0.6625266720658856 37.457790972249484
epoch 50 -0.7717657603295969 38.66882746501061
epoch 55 -0.48531890427346425 35.40525326198086
epoch 60 -0.2911623672155845 33.010209514477445
epoch 65 -0.19221429291348002 31.720133986462557
[32m[I 2021-08-22 03:29:48,124][0m Trial 3 finished with value: 32.244349271239024 and parameters: {'n_layers_fe': 2, 'fe_n_units_l0': 137, 'fe_dropout_l0': 0.37461301123311447, 'fe_n_units_l1': 87, 'fe_dropout_l1': 0.2061326484032488, 'n_units_l(Invariant)': 202, 'n_layers_mlp': 2, 'mlp_n_units_l0': 104, 'mlp_dropout_l0': 0.12936785964148717, 'mlp_n_units_l1': 106, 'mlp_dropout_l1': 0.31071427130096774, 'reduction': 'sum', 'lr': 0.00017068353419782042, 'criterion': 'MSELoss', 'batch_size': 256, 'no_epochs': 68}. Best is trial 0 with value: 26.764834950982202.[0m

Trial Id: 4 | Model params: 57202 | Timestamp: 2021-08-22 03:29:48.124373

[32m[I 2021-08-22 03:30:15,142][0m Trial 4 pruned. [0m
++++++++++++++++++++
        NaN         
++++++++++++++++++++

Trial Id: 5 | Model params: 99810 | Timestamp: 2021-08-22 03:30:15.142550

[32m[I 2021-08-22 03:30:41,992][0m Trial 5 pruned. [0m
++++++++++++++++++++
        NaN         
++++++++++++++++++++

Trial Id: 6 | Model params: 115567 | Timestamp: 2021-08-22 03:30:41.992541

[32m[I 2021-08-22 03:31:03,562][0m Trial 6 pruned. [0m
++++++++++++++++++++
        NaN         
++++++++++++++++++++

Trial Id: 7 | Model params: 65798 | Timestamp: 2021-08-22 03:31:03.562386

[32m[I 2021-08-22 03:31:17,883][0m Trial 7 pruned. [0m
++++++++++++++++++++
        NaN         
++++++++++++++++++++

Trial Id: 8 | Model params: 42917 | Timestamp: 2021-08-22 03:31:17.883802

epoch 0 -2.5801683832778664 54.96795469139741
epoch 5 -4.48447199979804 68.03388363670598
epoch 10 -7.349424432718626 83.94331584797705
epoch 15 -8.003833163016628 87.17090817617682
epoch 20 -8.014849976689915 87.224221695705
epoch 25 -8.422288445556163 89.1735484451249
epoch 30 -8.025951615766818 87.27791276614921
epoch 35 -7.7584784949377035 85.97500011194609
epoch 40 -7.658302458520094 85.48191198127303
epoch 45 -7.6197095117213305 85.29118849372377
epoch 50 -7.478843753067192 84.59139114355075
epoch 55 -7.062624204833819 82.48900404976361
epoch 60 -7.515986936170654 84.77647298450968
epoch 65 -7.3572088716070585 83.98243826773233
[32m[I 2021-08-22 03:48:47,876][0m Trial 8 finished with value: 82.2830567370532 and parameters: {'n_layers_fe': 4, 'fe_n_units_l0': 108, 'fe_dropout_l0': 0.4395931098888974, 'fe_n_units_l1': 217, 'fe_dropout_l1': 0.3200243652957311, 'fe_n_units_l2': 37, 'fe_dropout_l2': 0.25815002469310183, 'fe_n_units_l3': 19, 'fe_dropout_l3': 0.08594841624631783, 'n_units_l(Invariant)': 52, 'n_layers_mlp': 2, 'mlp_n_units_l0': 28, 'mlp_dropout_l0': 0.4219502153121513, 'mlp_n_units_l1': 225, 'mlp_dropout_l1': 0.3359064684171351, 'reduction': 'sum', 'lr': 2.0239281867053363e-05, 'criterion': 'L1Loss', 'batch_size': 128, 'no_epochs': 68}. Best is trial 0 with value: 26.764834950982202.[0m

Trial Id: 9 | Model params: 244122 | Timestamp: 2021-08-22 03:48:47.877114

epoch 0 0.09842093990589473 27.584159745046207
epoch 5 0.07526572844489077 27.936135449712197
epoch 10 0.13053494964021328 27.088435054277944
epoch 15 0.1662407885164645 26.526391413500374
epoch 20 0.16823539327013193 26.494642829748976
epoch 25 0.1523032582916003 26.747186628784753
epoch 30 0.1653823953154987 26.54004296662811
epoch 35 0.1506979632397074 26.77250040893907
epoch 40 0.15428394021551517 26.715920346368055
epoch 45 0.1556488261330432 26.694353469909558
epoch 50 0.16010352174474385 26.623842239703855
epoch 55 0.16448667807072592 26.554280624257782
epoch 60 0.19120380170976703 26.126269456101628
epoch 65 0.1827637483159733 26.262233760692546
epoch 70 0.18226072652239156 26.270314926765323
[32m[I 2021-08-22 04:24:34,185][0m Trial 9 finished with value: 26.26079674610733 and parameters: {'n_layers_fe': 4, 'fe_n_units_l0': 152, 'fe_dropout_l0': 0.418137124036141, 'fe_n_units_l1': 230, 'fe_dropout_l1': 0.01408189247959557, 'fe_n_units_l2': 21, 'fe_dropout_l2': 0.13183919605745437, 'fe_n_units_l3': 244, 'fe_dropout_l3': 0.025963488771021004, 'n_units_l(Invariant)': 220, 'n_layers_mlp': 4, 'mlp_n_units_l0': 179, 'mlp_dropout_l0': 0.2208762560524729, 'mlp_n_units_l1': 202, 'mlp_dropout_l1': 0.405170473478561, 'mlp_n_units_l2': 234, 'mlp_dropout_l2': 0.3490590875000104, 'mlp_n_units_l3': 202, 'mlp_dropout_l3': 0.10307616487995147, 'reduction': 'sum', 'lr': 0.0017803215352862516, 'criterion': 'L1Loss', 'batch_size': 128, 'no_epochs': 75}. Best is trial 9 with value: 26.26079674610733.[0m

Trial Id: 10 | Model params: 306578 | Timestamp: 2021-08-22 04:24:34.185753

epoch 0 -27.87840710876053 156.11494066486776
epoch 5 -27.87840710876053 156.11494066486776
epoch 10 -27.87840710876053 156.11494066486776
epoch 15 -27.87840710876053 156.11494066486776
epoch 20 -27.87840710876053 156.11494066486776
epoch 25 -27.87840710876053 156.11494066486776
epoch 30 -27.87840710876053 156.11494066486776
epoch 35 -27.87840710876053 156.11494066486776
epoch 40 -27.87840710876053 156.11494066486776
epoch 45 -27.87840710876053 156.11494066486776
epoch 50 -27.87840710876053 156.11494066486776
epoch 55 -27.87840710876053 156.11494066486776
epoch 60 -27.87840710876053 156.11494066486776
epoch 65 -27.87840710876053 156.11494066486776
epoch 70 -27.87840710876053 156.11494066486776
epoch 75 -27.87840710876053 156.11494066486776
epoch 80 -27.87840710876053 156.11494066486776
epoch 85 -27.87840710876053 156.11494066486776
epoch 90 -27.87840710876053 156.11494066486776
[32m[I 2021-08-22 05:27:15,888][0m Trial 10 finished with value: 156.11494066486776 and parameters: {'n_layers_fe': 4, 'fe_n_units_l0': 252, 'fe_dropout_l0': 0.1967681436422362, 'fe_n_units_l1': 155, 'fe_dropout_l1': 0.497014532122785, 'fe_n_units_l2': 219, 'fe_dropout_l2': 0.06058062648015808, 'fe_n_units_l3': 253, 'fe_dropout_l3': 0.0077014053382167755, 'n_units_l(Invariant)': 256, 'n_layers_mlp': 4, 'mlp_n_units_l0': 227, 'mlp_dropout_l0': 0.18004954680585838, 'mlp_n_units_l1': 75, 'mlp_dropout_l1': 0.49331252783889334, 'mlp_n_units_l2': 254, 'mlp_dropout_l2': 0.4639589795488521, 'mlp_n_units_l3': 230, 'mlp_dropout_l3': 0.01491861816233972, 'reduction': 'sum', 'lr': 0.0005072638423555484, 'criterion': 'L1Loss', 'batch_size': 128, 'no_epochs': 95}. Best is trial 9 with value: 26.26079674610733.[0m

Trial Id: 11 | Model params: 232218 | Timestamp: 2021-08-22 05:27:15.889186

[32m[I 2021-08-22 05:27:45,694][0m Trial 11 pruned. [0m
epoch 0 -1.5169938390411488 46.08917426165136

Trial Id: 12 | Model params: 117080 | Timestamp: 2021-08-22 05:27:45.694931

[32m[I 2021-08-22 05:28:11,894][0m Trial 12 pruned. [0m
epoch 0 -1.484846565937457 45.79390086480428

Trial Id: 13 | Model params: 154780 | Timestamp: 2021-08-22 05:28:11.894651

[32m[I 2021-08-22 05:28:33,522][0m Trial 13 pruned. [0m
epoch 0 -1.5984501750245848 46.829017693634505

Trial Id: 14 | Model params: 163748 | Timestamp: 2021-08-22 05:28:33.523002

[32m[I 2021-08-22 05:29:01,011][0m Trial 14 pruned. [0m
epoch 0 -0.24220273791857494 32.378303687003836

Trial Id: 15 | Model params: 102661 | Timestamp: 2021-08-22 05:29:01.011447

[32m[I 2021-08-22 05:29:24,990][0m Trial 15 pruned. [0m
epoch 0 -0.6956930126681655 37.82957536413495

Trial Id: 16 | Model params: 189476 | Timestamp: 2021-08-22 05:29:24.990588

[32m[I 2021-08-22 05:29:56,240][0m Trial 16 pruned. [0m
epoch 0 -0.6104637295999498 36.86662022688257

Trial Id: 17 | Model params: 105790 | Timestamp: 2021-08-22 05:29:56.241200

epoch 0 -27.87840710876053 156.11494066486776
epoch 5 -27.87840710876053 156.11494066486776
epoch 10 -27.87840710876053 156.11494066486776
epoch 15 -27.87840710876053 156.11494066486776
epoch 20 -27.87840710876053 156.11494066486776
epoch 25 -27.87840710876053 156.11494066486776
epoch 30 -27.87840710876053 156.11494066486776
epoch 35 -27.87840710876053 156.11494066486776
epoch 40 -27.87840710876053 156.11494066486776
epoch 45 -27.87840710876053 156.11494066486776
epoch 50 -27.87840710876053 156.11494066486776
epoch 55 -27.87840710876053 156.11494066486776
epoch 60 -27.87840710876053 156.11494066486776
epoch 65 -27.87840710876053 156.11494066486776
epoch 70 -27.87840710876053 156.11494066486776
epoch 75 -27.87840710876053 156.11494066486776
epoch 80 -27.87840710876053 156.11494066486776
epoch 85 -27.87840710876053 156.11494066486776
epoch 90 -27.87840710876053 156.11494066486776
epoch 95 -27.87840710876053 156.11494066486776
[32m[I 2021-08-22 06:08:14,918][0m Trial 17 finished with value: 156.11494066486776 and parameters: {'n_layers_fe': 4, 'fe_n_units_l0': 11, 'fe_dropout_l0': 0.26617219110917506, 'fe_n_units_l1': 144, 'fe_dropout_l1': 0.25483656603271054, 'fe_n_units_l2': 46, 'fe_dropout_l2': 0.4990798721302391, 'fe_n_units_l3': 254, 'fe_dropout_l3': 0.03852486665192836, 'n_units_l(Invariant)': 237, 'n_layers_mlp': 4, 'mlp_n_units_l0': 78, 'mlp_dropout_l0': 0.21222067817527038, 'mlp_n_units_l1': 63, 'mlp_dropout_l1': 0.04803886606890348, 'mlp_n_units_l2': 104, 'mlp_dropout_l2': 0.14721087193034196, 'mlp_n_units_l3': 74, 'mlp_dropout_l3': 0.09959295486374534, 'reduction': 'sum', 'lr': 0.0038340148670949546, 'criterion': 'L1Loss', 'batch_size': 128, 'no_epochs': 99}. Best is trial 9 with value: 26.26079674610733.[0m

Trial Id: 18 | Model params: 130419 | Timestamp: 2021-08-22 06:08:14.918247

epoch 0 -2.6793463828573527 55.72411614382281
epoch 5 -2.7267000384209426 56.08155796862788
[32m[I 2021-08-22 06:11:14,249][0m Trial 18 pruned. [0m

Trial Id: 19 | Model params: 70475 | Timestamp: 2021-08-22 06:11:14.249883

epoch 0 -2.492641471803594 54.29187672864284
epoch 5 -6.62184724499918 80.20251207771824
epoch 10 -5.75290823319185 75.49240742674135
epoch 15 -2.3221392802447087 52.95009811675318
epoch 20 -0.5329250340800797 35.96816728528936
epoch 25 -0.16453514075431008 31.34975493155842
epoch 30 -0.37200920001837656 34.02799519826117
epoch 35 -0.050963499861715444 29.781849707972462
epoch 40 -0.011580164829706696 29.218505850507682
epoch 45 0.03889423504048384 28.480226718863968
epoch 50 0.0810574750147326 27.84851397785662
epoch 55 0.07193569992729765 27.9863901720378
epoch 60 0.014706079672851202 28.836380840081265
[32m[I 2021-08-22 06:24:53,335][0m Trial 19 finished with value: 28.666766029359728 and parameters: {'n_layers_fe': 4, 'fe_n_units_l0': 44, 'fe_dropout_l0': 0.4841054831255871, 'fe_n_units_l1': 62, 'fe_dropout_l1': 0.0016608364559302802, 'fe_n_units_l2': 105, 'fe_dropout_l2': 0.23039138786485236, 'fe_n_units_l3': 84, 'fe_dropout_l3': 0.4315037738154145, 'n_units_l(Invariant)': 88, 'n_layers_mlp': 2, 'mlp_n_units_l0': 165, 'mlp_dropout_l0': 0.37127970949314504, 'mlp_n_units_l1': 199, 'mlp_dropout_l1': 0.28740306428519696, 'reduction': 'sum', 'lr': 7.250436450615541e-05, 'criterion': 'MSELoss', 'batch_size': 128, 'no_epochs': 62}. Best is trial 9 with value: 26.26079674610733.[0m

Trial Id: 20 | Model params: 152972 | Timestamp: 2021-08-22 06:24:53.335566

[32m[I 2021-08-22 06:25:17,356][0m Trial 20 pruned. [0m
epoch 0 -0.6512548504566595 37.33059432843679

Trial Id: 21 | Model params: 40354 | Timestamp: 2021-08-22 06:25:17.357063

[32m[I 2021-08-22 06:25:40,731][0m Trial 21 pruned. [0m
epoch 0 -2.2010685361955824 51.97629724231011

Trial Id: 22 | Model params: 59600 | Timestamp: 2021-08-22 06:25:40.731599

epoch 0 -27.87840710876053 156.11494066486776
epoch 5 -27.87840710876053 156.11494066486776
epoch 10 -27.87840710876053 156.11494066486776
epoch 15 -27.87840710876053 156.11494066486776
epoch 20 -27.87840710876053 156.11494066486776
epoch 25 -27.87840710876053 156.11494066486776
epoch 30 -27.87840710876053 156.11494066486776
epoch 35 -27.87840710876053 156.11494066486776
epoch 40 -1.8830720668823702 49.327101903417855
epoch 45 -0.9181634078601093 40.23468930278448
[32m[I 2021-08-22 06:44:55,303][0m Trial 22 finished with value: 33.07746409918116 and parameters: {'n_layers_fe': 2, 'fe_n_units_l0': 44, 'fe_dropout_l0': 0.4808022993962805, 'fe_n_units_l1': 21, 'fe_dropout_l1': 0.21796309419175408, 'n_units_l(Invariant)': 25, 'n_layers_mlp': 4, 'mlp_n_units_l0': 156, 'mlp_dropout_l0': 0.2447719998709551, 'mlp_n_units_l1': 256, 'mlp_dropout_l1': 0.44340571633607034, 'mlp_n_units_l2': 18, 'mlp_dropout_l2': 0.02330013412975446, 'mlp_n_units_l3': 125, 'mlp_dropout_l3': 0.008321254662240124, 'reduction': 'sum', 'lr': 4.284051910127988e-05, 'criterion': 'L1Loss', 'batch_size': 32, 'no_epochs': 50}. Best is trial 9 with value: 26.26079674610733.[0m

Trial Id: 23 | Model params: 48794 | Timestamp: 2021-08-22 06:44:55.303844

[32m[I 2021-08-22 06:45:19,630][0m Trial 23 pruned. [0m
epoch 0 -1.3151085056825367 44.202163469421016

Trial Id: 24 | Model params: 142004 | Timestamp: 2021-08-22 06:45:19.630933

[32m[I 2021-08-22 06:45:43,798][0m Trial 24 pruned. [0m
epoch 0 -2.277053664412493 52.58957096280257

Trial Id: 25 | Model params: 60341 | Timestamp: 2021-08-22 06:45:43.799118

epoch 0 -2.534693999848878 54.61774461461372
[32m[I 2021-08-22 06:46:28,705][0m Trial 25 pruned. [0m

Trial Id: 26 | Model params: 93090 | Timestamp: 2021-08-22 06:46:28.705355

epoch 0 -4.899814440099048 70.56299848832424
epoch 5 -8.765259714317294 90.78200079223616
epoch 10 -10.348799758181235 97.86622074720974
epoch 15 -10.901169413784647 100.21960109826284
epoch 20 -11.296182348172179 101.86922415951867
epoch 25 -11.491464047155619 102.67495524909941
epoch 30 -11.078657973649596 100.96414989582306
epoch 35 -9.625099948454709 94.69441449669286
epoch 40 -6.791250242038245 81.08890348669628
epoch 45 -1.5285674800980855 46.195016350843005
epoch 50 0.037616372382865415 28.499153735267477
epoch 55 0.06436410636563272 28.100321462720267
epoch 60 0.05193014530881279 28.286422241216517
epoch 65 0.04140774081040843 28.442961268525128
[32m[I 2021-08-22 07:17:50,807][0m Trial 26 pruned. [0m

Trial Id: 27 | Model params: 106301 | Timestamp: 2021-08-22 07:17:50.808202

[32m[I 2021-08-22 07:18:05,879][0m Trial 27 pruned. [0m
epoch 0 -0.4929895542944973 35.496557417517586

Trial Id: 28 | Model params: 155883 | Timestamp: 2021-08-22 07:18:05.879288

[32m[I 2021-08-22 07:18:34,003][0m Trial 28 pruned. [0m
epoch 0 0.10637881570496044 27.462152779078924

Trial Id: 29 | Model params: 80710 | Timestamp: 2021-08-22 07:18:34.003525

[32m[I 2021-08-22 07:18:49,765][0m Trial 29 pruned. [0m
++++++++++++++++++++
        NaN         
++++++++++++++++++++

Trial Id: 30 | Model params: 77811 | Timestamp: 2021-08-22 07:18:49.765940

epoch 0 -3.663845702840643 62.73789427907271
[32m[I 2021-08-22 07:20:18,902][0m Trial 30 pruned. [0m
epoch 5 -0.0005350864796116461 29.05855488588317

Trial Id: 31 | Model params: 67177 | Timestamp: 2021-08-22 07:20:18.903033

[32m[I 2021-08-22 07:20:32,446][0m Trial 31 pruned. [0m
epoch 0 -2.3866118028627175 53.461428608156865

Trial Id: 32 | Model params: 87274 | Timestamp: 2021-08-22 07:20:32.446815

[32m[I 2021-08-22 07:20:49,097][0m Trial 32 pruned. [0m
epoch 0 -2.099758123207688 51.14718713553781

Trial Id: 33 | Model params: 74740 | Timestamp: 2021-08-22 07:20:49.097574

epoch 0 -2.507323163348524 54.405867912649946
