[32m[I 2021-08-21 22:05:35,627][0m A new study created in memory with name: DeepSet[0m
Starting Loading north
Finished Loading north
Finished north setup

++++++++ Session Characteristics +++++++

Area: north
Gal Type: elg
Training Set: 78007
Validation Set: 19505
Test Samples: 19505
Number of features: 6
Device: cuda:0
Number of Workers: 8
Number of Trials: 40

+++++++++++++++++++++++++++++++++++++++

Trial Id: 0 | Model params: 34401 | Timestamp: 2021-08-21 22:05:35.628457

epoch 0 -1.2608001927688366 33.674778083816584
epoch 5 -1.1549206716635099 32.87678149598693
epoch 10 -0.8669813492926275 30.60156528182034
epoch 15 -0.30686517264540747 25.60289315449858
epoch 20 -0.4061384711401721 26.55753098635592
epoch 25 -0.13910290402285064 23.903149688638923
epoch 30 -0.10685445310240249 23.562366665435846
epoch 35 0.0506949406420758 21.821095469033324
epoch 40 -0.015073848255320321 22.56433148397305
[32m[I 2021-08-21 22:12:21,053][0m Trial 0 finished with value: 22.343902022252653 and parameters: {'n_layers_fe': 2, 'fe_n_units_l0': 15, 'fe_dropout_l0': 0.32461111121742103, 'fe_n_units_l1': 156, 'fe_dropout_l1': 0.02676905148023917, 'n_units_l(Invariant)': 74, 'n_layers_mlp': 2, 'mlp_n_units_l0': 218, 'mlp_dropout_l0': 0.27210561645929077, 'mlp_n_units_l1': 25, 'mlp_dropout_l1': 0.364905624730648, 'reduction': 'sum', 'lr': 0.0007903250852040774, 'criterion': 'L1Loss', 'batch_size': 128, 'no_epochs': 42}. Best is trial 0 with value: 22.343902022252653.[0m

Trial Id: 1 | Model params: 99430 | Timestamp: 2021-08-21 22:12:21.053818

[32m[I 2021-08-21 22:12:35,877][0m Trial 1 pruned. [0m
++++++++++++++++++++
        NaN         
++++++++++++++++++++

Trial Id: 2 | Model params: 71085 | Timestamp: 2021-08-21 22:12:35.878074

[32m[I 2021-08-21 22:12:56,565][0m Trial 2 pruned. [0m
++++++++++++++++++++
        NaN         
++++++++++++++++++++

Trial Id: 3 | Model params: 67286 | Timestamp: 2021-08-21 22:12:56.566017

epoch 0 -1.4122495657401144 34.78442030589459
epoch 5 -0.6807327524424853 29.035077077901317
epoch 10 -0.49753108102416266 27.407004687805813
epoch 15 -0.4328629555492989 26.808713842378026
epoch 20 -0.056005132633137 23.01477143502927
epoch 25 0.0742671416259757 21.54847256346296
epoch 30 -0.12673211162604225 23.77299984556913
epoch 35 0.03387031596905299 22.01361488995705
epoch 40 0.11994620518541466 21.01010687643273
epoch 45 0.11454862976739666 21.07443833294384
epoch 50 0.12179395154383965 20.988039050985737
epoch 55 0.07705012342721052 21.516058166191517
epoch 60 0.11438926576762265 21.076334741823974
epoch 65 0.037430399914632595 21.97301855588176
epoch 70 0.13718667975638965 20.80329234776062
[32m[I 2021-08-21 22:32:41,768][0m Trial 3 finished with value: 21.144143151737097 and parameters: {'n_layers_fe': 4, 'fe_n_units_l0': 55, 'fe_dropout_l0': 0.07829706815837595, 'fe_n_units_l1': 128, 'fe_dropout_l1': 0.011696349062760736, 'fe_n_units_l2': 63, 'fe_dropout_l2': 0.17092371092600295, 'fe_n_units_l3': 72, 'fe_dropout_l3': 0.3817395934948622, 'n_units_l(Invariant)': 225, 'n_layers_mlp': 2, 'mlp_n_units_l0': 238, 'mlp_dropout_l0': 0.36681285100564476, 'mlp_n_units_l1': 60, 'mlp_dropout_l1': 0.13134468798758958, 'reduction': 'sum', 'lr': 8.43158959338192e-05, 'criterion': 'MSELoss', 'batch_size': 128, 'no_epochs': 72}. Best is trial 3 with value: 21.144143151737097.[0m

Trial Id: 4 | Model params: 105649 | Timestamp: 2021-08-21 22:32:41.768585

[32m[I 2021-08-21 22:33:02,753][0m Trial 4 pruned. [0m
++++++++++++++++++++
        NaN         
++++++++++++++++++++

Trial Id: 5 | Model params: 41149 | Timestamp: 2021-08-21 22:33:02.753387

[32m[I 2021-08-21 22:33:14,114][0m Trial 5 pruned. [0m
++++++++++++++++++++
        NaN         
++++++++++++++++++++

Trial Id: 6 | Model params: 188364 | Timestamp: 2021-08-21 22:33:14.114584

epoch 0 -31.157568784120393 127.00337300512253
epoch 5 -31.157568784120393 127.00337300512253
epoch 10 -31.157568784120393 127.00337300512253
epoch 15 -31.157568784120393 127.00337300512253
epoch 20 -31.157568784120393 127.00337300512253
epoch 25 -31.157568784120393 127.00337300512253
epoch 30 -31.157568784120393 127.00337300512253
epoch 35 -31.157568784120393 127.00337300512253
epoch 40 -31.157568784120393 127.00337300512253
[32m[I 2021-08-21 22:54:25,156][0m Trial 6 finished with value: 127.00337300512253 and parameters: {'n_layers_fe': 4, 'fe_n_units_l0': 46, 'fe_dropout_l0': 0.171240040386882, 'fe_n_units_l1': 137, 'fe_dropout_l1': 0.16315252603724706, 'fe_n_units_l2': 194, 'fe_dropout_l2': 0.4053624717552851, 'fe_n_units_l3': 204, 'fe_dropout_l3': 0.35299487865468326, 'n_units_l(Invariant)': 144, 'n_layers_mlp': 4, 'mlp_n_units_l0': 115, 'mlp_dropout_l0': 0.15338017988938984, 'mlp_n_units_l1': 112, 'mlp_dropout_l1': 0.23201284910582687, 'mlp_n_units_l2': 184, 'mlp_dropout_l2': 0.418666418834502, 'mlp_n_units_l3': 236, 'mlp_dropout_l3': 0.09773824115850982, 'reduction': 'sum', 'lr': 0.008560233944029681, 'criterion': 'MSELoss', 'batch_size': 128, 'no_epochs': 46}. Best is trial 3 with value: 21.144143151737097.[0m
epoch 45 -31.157568784120393 127.00337300512253

Trial Id: 7 | Model params: 146294 | Timestamp: 2021-08-21 22:54:25.156459

[32m[I 2021-08-21 22:54:44,076][0m Trial 7 pruned. [0m
++++++++++++++++++++
        NaN         
++++++++++++++++++++

Trial Id: 8 | Model params: 69522 | Timestamp: 2021-08-21 22:54:44.076938

epoch 0 -0.47463155231134135 27.196650028536094
epoch 5 0.1407181800664209 20.76067469169124
epoch 10 0.16407010381771459 20.476634598060997
epoch 15 0.16115540005868245 20.512302295169594
epoch 20 0.17534248630183136 20.338103906794927
epoch 25 0.18766530988638763 20.1855762299049
epoch 30 0.18983179695984842 20.1586409115598
epoch 35 0.1883205145531911 20.1774340491976
epoch 40 0.19831116373947488 20.05287144418607
epoch 45 0.20992242534011674 19.907123887068483
[32m[I 2021-08-21 23:11:05,453][0m Trial 8 finished with value: 19.896305142112624 and parameters: {'n_layers_fe': 2, 'fe_n_units_l0': 41, 'fe_dropout_l0': 0.04275293862568813, 'fe_n_units_l1': 151, 'fe_dropout_l1': 0.4437053570557745, 'n_units_l(Invariant)': 149, 'n_layers_mlp': 2, 'mlp_n_units_l0': 224, 'mlp_dropout_l0': 0.37997226467814804, 'mlp_n_units_l1': 111, 'mlp_dropout_l1': 0.07985581665989028, 'reduction': 'sum', 'lr': 0.0003419430347455254, 'criterion': 'MSELoss', 'batch_size': 32, 'no_epochs': 47}. Best is trial 8 with value: 19.896305142112624.[0m

Trial Id: 9 | Model params: 81901 | Timestamp: 2021-08-21 23:11:05.453967

epoch 0 -2.0938801453225517 39.393574925202984
epoch 5 -0.6267255624111576 28.564774323783684
epoch 10 -0.3997138059503902 26.49679067171481
epoch 15 -1.2876753021691747 33.87434008954886
epoch 20 -2.416076966219688 41.39400760907652
epoch 25 -1.3982725500733943 34.683500256068754
epoch 30 -1.3392971514305807 34.25439864443101
epoch 35 -1.1716284545751865 33.003987458212215
epoch 40 -0.7560229582314306 29.678281268368508
epoch 45 -0.5694884841334018 28.057742061950115
[32m[I 2021-08-21 23:22:14,388][0m Trial 9 finished with value: 26.859027686537935 and parameters: {'n_layers_fe': 4, 'fe_n_units_l0': 224, 'fe_dropout_l0': 0.05061827297844773, 'fe_n_units_l1': 110, 'fe_dropout_l1': 0.28712446791147456, 'fe_n_units_l2': 46, 'fe_dropout_l2': 0.421252669571518, 'fe_n_units_l3': 17, 'fe_dropout_l3': 0.1411862536379861, 'n_units_l(Invariant)': 19, 'n_layers_mlp': 2, 'mlp_n_units_l0': 157, 'mlp_dropout_l0': 0.12462395088397538, 'mlp_n_units_l1': 244, 'mlp_dropout_l1': 0.30218766141162534, 'reduction': 'sum', 'lr': 7.503951235521912e-05, 'criterion': 'L1Loss', 'batch_size': 256, 'no_epochs': 49}. Best is trial 8 with value: 19.896305142112624.[0m

Trial Id: 10 | Model params: 30115 | Timestamp: 2021-08-21 23:22:14.389030

[32m[I 2021-08-21 23:22:35,887][0m Trial 10 pruned. [0m
epoch 0 -0.5603599793534904 27.97602794206974

Trial Id: 11 | Model params: 122420 | Timestamp: 2021-08-21 23:22:35.887582

epoch 0 -1.9933891202636471 38.74853073230659
epoch 5 -1.0082650817293985 31.73833721973919
epoch 10 -0.8099684020745579 30.130694924553747
epoch 15 -0.8301444531255715 30.298165713216733
epoch 20 -0.6494951415379322 28.763992841287482
epoch 25 -0.7147786639728266 29.327678532343633
epoch 30 -0.602694530019994 28.353000724840026
epoch 35 -0.4858371570166735 27.299787027893306
epoch 40 -0.3043219499577239 25.57796878982658
epoch 45 -0.13323832982313277 23.841538622190924
epoch 50 0.011655687702144535 22.265260737983024
epoch 55 0.045135094786851404 21.884902569891672
epoch 60 0.05870008617795497 21.728895991290294
epoch 65 0.09188544069019622 21.342435171776625
epoch 70 0.10183743219268115 21.22516755284888
epoch 75 0.07194034038592945 21.575536281706206
epoch 80 0.024532972098813333 22.11973647999299
[32m[I 2021-08-21 23:58:27,886][0m Trial 11 finished with value: 22.48376352823488 and parameters: {'n_layers_fe': 4, 'fe_n_units_l0': 69, 'fe_dropout_l0': 0.07702235818134304, 'fe_n_units_l1': 106, 'fe_dropout_l1': 0.33837539768463193, 'fe_n_units_l2': 126, 'fe_dropout_l2': 0.018723321679247146, 'fe_n_units_l3': 101, 'fe_dropout_l3': 0.4980080823642537, 'n_units_l(Invariant)': 254, 'n_layers_mlp': 2, 'mlp_n_units_l0': 256, 'mlp_dropout_l0': 0.4874763652653151, 'mlp_n_units_l1': 174, 'mlp_dropout_l1': 0.10731306382112901, 'reduction': 'sum', 'lr': 1.0502351500440898e-05, 'criterion': 'MSELoss', 'batch_size': 32, 'no_epochs': 85}. Best is trial 8 with value: 19.896305142112624.[0m

Trial Id: 12 | Model params: 98875 | Timestamp: 2021-08-21 23:58:27.886679

[32m[I 2021-08-21 23:58:51,000][0m Trial 12 pruned. [0m
epoch 0 -0.5421612620576226 27.812405105056637

Trial Id: 13 | Model params: 54297 | Timestamp: 2021-08-21 23:58:51.001054

epoch 0 -4.746510104930183 53.687816200011866
epoch 5 -8.232586316013112 68.05112981333723
epoch 10 -4.2125092686613135 51.132505266691076
epoch 15 -6.873786906684023 62.8442402385436
epoch 20 -6.184746138373882 60.03152354080427
epoch 25 -5.922350734597723 58.92511673906795
epoch 30 -5.711478397400564 58.02067139009718
epoch 35 -5.064664741351357 55.15400454073857
epoch 40 -4.923800641892696 54.50970966763474
epoch 45 -4.8567602265281264 54.200385306568926
epoch 50 -4.617803646285556 53.08317971410063
epoch 55 -4.407615580040181 52.08066931821486
[32m[I 2021-08-22 00:22:31,414][0m Trial 13 finished with value: 51.3039567791317 and parameters: {'n_layers_fe': 4, 'fe_n_units_l0': 16, 'fe_dropout_l0': 0.23323375504016075, 'fe_n_units_l1': 71, 'fe_dropout_l1': 0.39008327492594497, 'fe_n_units_l2': 116, 'fe_dropout_l2': 0.028702518991982312, 'fe_n_units_l3': 99, 'fe_dropout_l3': 0.2715665935093798, 'n_units_l(Invariant)': 228, 'n_layers_mlp': 2, 'mlp_n_units_l0': 71, 'mlp_dropout_l0': 0.4883105604926557, 'mlp_n_units_l1': 72, 'mlp_dropout_l1': 0.003939189150681963, 'reduction': 'sum', 'lr': 0.00019698450058948486, 'criterion': 'MSELoss', 'batch_size': 32, 'no_epochs': 58}. Best is trial 8 with value: 19.896305142112624.[0m

Trial Id: 14 | Model params: 156424 | Timestamp: 2021-08-22 00:22:31.414271

[32m[I 2021-08-22 00:22:57,837][0m Trial 14 pruned. [0m
epoch 0 -0.36480868366563635 26.16432530671918

Trial Id: 15 | Model params: 63913 | Timestamp: 2021-08-22 00:22:57.838098

epoch 0 -2.368402581038865 41.104147689965316
epoch 5 -1.0935116599022385 32.40494910367806
epoch 10 -0.834391453834106 30.333300034587108
epoch 15 -0.6363083285436413 28.648785916653527
epoch 20 -0.5897589436639903 28.23834826512391
epoch 25 -0.5365451430835673 27.7617164233575
epoch 30 -0.47979700916067203 27.24424168391597
epoch 35 -0.43375491882247985 26.81705681328919
epoch 40 -0.3519898599446152 26.04116257301765
epoch 45 -0.2964933314617759 25.50109301233216
epoch 50 -0.6039728795569357 28.36430600481053
epoch 55 -0.35428323324738487 26.063239958237187
epoch 60 -0.4596526264987364 27.05816920030995
epoch 65 -0.08230722487434661 23.29962495566142
epoch 70 -0.24515408088312896 24.991090072193977
epoch 75 -0.45724500901592235 27.035844502709377
epoch 80 -0.4717506103622642 27.170070414224966
epoch 85 -0.31684055977964354 25.700421674911436
epoch 90 -0.4261741538837347 26.746067261465825
epoch 95 -0.06336251963355655 23.094806399772278
[32m[I 2021-08-22 00:40:01,382][0m Trial 15 finished with value: 23.81959524627146 and parameters: {'n_layers_fe': 2, 'fe_n_units_l0': 102, 'fe_dropout_l0': 0.10403448389316944, 'fe_n_units_l1': 111, 'fe_dropout_l1': 0.09458461538697366, 'n_units_l(Invariant)': 71, 'n_layers_mlp': 2, 'mlp_n_units_l0': 193, 'mlp_dropout_l0': 0.19873040306073547, 'mlp_n_units_l1': 158, 'mlp_dropout_l1': 0.06802293066537413, 'reduction': 'sum', 'lr': 1.9211128186417528e-05, 'criterion': 'MSELoss', 'batch_size': 128, 'no_epochs': 97}. Best is trial 8 with value: 19.896305142112624.[0m

Trial Id: 16 | Model params: 81545 | Timestamp: 2021-08-22 00:40:01.382537

[32m[I 2021-08-22 00:40:22,384][0m Trial 16 pruned. [0m
epoch 0 -0.8790368118738761 30.700206438488216

Trial Id: 17 | Model params: 75964 | Timestamp: 2021-08-22 00:40:22.384345

[32m[I 2021-08-22 00:40:40,884][0m Trial 17 pruned. [0m
epoch 0 -0.6578301262038924 28.836574242697147

Trial Id: 18 | Model params: 89717 | Timestamp: 2021-08-22 00:40:40.884779

[32m[I 2021-08-22 00:41:05,787][0m Trial 18 pruned. [0m
epoch 0 -0.5215903648419009 27.626287456067498

Trial Id: 19 | Model params: 73286 | Timestamp: 2021-08-22 00:41:05.787632

epoch 0 -11.85548088198079 80.30041967850998
epoch 5 -3.3575190180947745 46.75125754147688
epoch 10 -0.7953832954346551 30.009049624753054
epoch 15 -0.698178402331536 29.185377038665106
epoch 20 -0.6488350425390854 28.758236842875093
epoch 25 -0.7369435281324763 29.516611631672433
epoch 30 -0.681475539925676 29.041492288615117
epoch 35 -0.3517439776324771 26.038794451552118
epoch 40 -0.473778466764025 27.1887821562164
epoch 45 -0.343296400051603 25.95730362215457
epoch 50 -0.21163255505023093 24.65239504577762
epoch 55 -0.3742499112803206 26.2546667668107
epoch 60 -0.4674441701880221 27.130290576717414
epoch 65 -0.1983910182612698 24.517315982964234
[32m[I 2021-08-22 01:00:41,777][0m Trial 19 finished with value: 25.989072748300714 and parameters: {'n_layers_fe': 2, 'fe_n_units_l0': 95, 'fe_dropout_l0': 0.054949640351346925, 'fe_n_units_l1': 198, 'fe_dropout_l1': 0.20876433443746778, 'n_units_l(Invariant)': 164, 'n_layers_mlp': 4, 'mlp_n_units_l0': 65, 'mlp_dropout_l0': 0.4902957906258244, 'mlp_n_units_l1': 42, 'mlp_dropout_l1': 0.2807489707268873, 'mlp_n_units_l2': 253, 'mlp_dropout_l2': 0.25027030043269993, 'mlp_n_units_l3': 11, 'mlp_dropout_l3': 0.4528286025977284, 'reduction': 'sum', 'lr': 0.0008229524972401365, 'criterion': 'MSELoss', 'batch_size': 128, 'no_epochs': 71}. Best is trial 8 with value: 19.896305142112624.[0m
epoch 70 -0.3465865313051433 25.989072748300714

Trial Id: 20 | Model params: 28174 | Timestamp: 2021-08-22 01:00:41.778135

[32m[I 2021-08-22 01:01:03,177][0m Trial 20 pruned. [0m
epoch 0 -1.4518949657390636 35.06909694425665

Trial Id: 21 | Model params: 25970 | Timestamp: 2021-08-22 01:01:03.178007

[32m[I 2021-08-22 01:01:12,290][0m Trial 21 pruned. [0m
epoch 0 -1.2687753639213835 33.73412116338494

Trial Id: 22 | Model params: 34547 | Timestamp: 2021-08-22 01:01:12.290360

[32m[I 2021-08-22 01:01:21,504][0m Trial 22 pruned. [0m
epoch 0 -0.8033325436537633 30.07541036154359

Trial Id: 23 | Model params: 39363 | Timestamp: 2021-08-22 01:01:21.505089

epoch 0 -2.1519885129384444 39.761793425150444
epoch 5 -2.574911800143536 42.345407578181614
epoch 10 -1.9494484764472837 38.46308003615306
epoch 15 -0.2894762209880797 25.431988618171122
epoch 20 -0.012740668702248215 22.538384148097663
epoch 25 0.06505878847758528 21.655379724596763
epoch 30 0.07369417448286864 21.555140068465164
epoch 35 0.046756010271306825 21.866319498899994
epoch 40 0.06177648348164466 21.69335927056556
epoch 45 -0.04559041354337445 22.901000067643622
epoch 50 -0.016977531265877976 22.585480296779103
[32m[I 2021-08-22 01:09:15,048][0m Trial 23 finished with value: 22.524954325011954 and parameters: {'n_layers_fe': 2, 'fe_n_units_l0': 8, 'fe_dropout_l0': 0.46122546555416016, 'fe_n_units_l1': 119, 'fe_dropout_l1': 0.0563317676491674, 'n_units_l(Invariant)': 102, 'n_layers_mlp': 2, 'mlp_n_units_l0': 180, 'mlp_dropout_l0': 0.2389945796507912, 'mlp_n_units_l1': 76, 'mlp_dropout_l1': 0.3801993735509404, 'reduction': 'sum', 'lr': 0.00023667885017717994, 'criterion': 'L1Loss', 'batch_size': 128, 'no_epochs': 53}. Best is trial 8 with value: 19.896305142112624.[0m

Trial Id: 24 | Model params: 31162 | Timestamp: 2021-08-22 01:09:15.048435

[32m[I 2021-08-22 01:09:23,664][0m Trial 24 pruned. [0m
epoch 0 -1.1846563640241716 33.102837245097

Trial Id: 25 | Model params: 54959 | Timestamp: 2021-08-22 01:09:23.665013

[32m[I 2021-08-22 01:09:35,481][0m Trial 25 pruned. [0m
epoch 0 -1.1085963703045802 32.52148580577218

Trial Id: 26 | Model params: 64499 | Timestamp: 2021-08-22 01:09:35.481903

[32m[I 2021-08-22 01:09:47,462][0m Trial 26 pruned. [0m
epoch 0 -1.0908080269409024 32.38401791077895

Trial Id: 27 | Model params: 70507 | Timestamp: 2021-08-22 01:09:47.462815

[32m[I 2021-08-22 01:10:11,383][0m Trial 27 pruned. [0m
epoch 0 -0.867946539218112 30.60947444119624

Trial Id: 28 | Model params: 40467 | Timestamp: 2021-08-22 01:10:11.383926

[32m[I 2021-08-22 01:10:20,838][0m Trial 28 pruned. [0m
epoch 0 -1.3274549969965 34.16758612590282

Trial Id: 29 | Model params: 92705 | Timestamp: 2021-08-22 01:10:20.838591

[32m[I 2021-08-22 01:10:45,886][0m Trial 29 pruned. [0m
++++++++++++++++++++
        NaN         
++++++++++++++++++++

Trial Id: 30 | Model params: 43938 | Timestamp: 2021-08-22 01:10:45.886352

epoch 0 -2.149953223382555 39.748953938157356
epoch 5 -0.9454378379628039 31.237936006160087
epoch 10 -0.8806954185166203 30.71375282949602
epoch 15 -0.8456768334724747 30.426463878444597
epoch 20 -0.713763698807566 29.31899782658469
epoch 25 -0.6794396723272473 29.023905788225644
epoch 30 -0.6836501187007997 29.0602652669204
epoch 35 -0.6124068871779496 28.438780806503896
epoch 40 -0.5293243580510154 27.696408400161733
epoch 45 -0.6679204627741382 28.924197615868984
epoch 50 -0.4770568163422293 27.219005429528835
epoch 55 -0.504251453405685 27.468432160998454
epoch 60 -0.40999938250553214 26.593966226171915
[32m[I 2021-08-22 01:27:17,398][0m Trial 30 finished with value: 26.454790749633702 and parameters: {'n_layers_fe': 4, 'fe_n_units_l0': 77, 'fe_dropout_l0': 0.04077484830059855, 'fe_n_units_l1': 149, 'fe_dropout_l1': 0.010484449696435381, 'fe_n_units_l2': 77, 'fe_dropout_l2': 0.12060929000115611, 'fe_n_units_l3': 47, 'fe_dropout_l3': 0.39421037537431836, 'n_units_l(Invariant)': 93, 'n_layers_mlp': 2, 'mlp_n_units_l0': 146, 'mlp_dropout_l0': 0.257476617321617, 'mlp_n_units_l1': 15, 'mlp_dropout_l1': 0.0420339406298872, 'reduction': 'sum', 'lr': 4.790983013275767e-05, 'criterion': 'L1Loss', 'batch_size': 128, 'no_epochs': 66}. Best is trial 8 with value: 19.896305142112624.[0m
epoch 65 -0.3952799649359995 26.454790749633702

Trial Id: 31 | Model params: 129409 | Timestamp: 2021-08-22 01:27:17.398283

epoch 0 -2.206007319783139 40.10106497328616
epoch 5 -0.9833498016851476 31.540843984066527
epoch 10 -1.0610084912680948 32.15241080935751
epoch 15 -1.0387696444020769 31.9784736640657
epoch 20 -0.9866922211676623 31.56740973486988
epoch 25 -1.1085562463254215 32.52117638248834
epoch 30 -1.0342513798535906 31.943019108121685
epoch 35 -1.3569501337137844 34.383402303167934
epoch 40 -0.6504763757901324 28.77254697949393
epoch 45 -0.3155906689811021 25.688221888710384
epoch 50 -0.3768761491987831 26.27974156956337
epoch 55 -0.2568543971865793 25.10823218559519
epoch 60 -0.9709735155382189 31.4422810916605
epoch 65 -1.0882837988064455 32.36446342861127
epoch 70 -0.8123924998978438 30.15086525256971
epoch 75 -0.7307072660178997 29.463576272782593
epoch 80 -0.4627466797834927 27.08683187570457
epoch 85 -0.530012475322297 27.702638678759016
[32m[I 2021-08-22 02:04:42,343][0m Trial 31 finished with value: 26.71766055514921 and parameters: {'n_layers_fe': 4, 'fe_n_units_l0': 53, 'fe_dropout_l0': 0.10526772647435033, 'fe_n_units_l1': 101, 'fe_dropout_l1': 0.3302924436352271, 'fe_n_units_l2': 136, 'fe_dropout_l2': 0.024038303911746634, 'fe_n_units_l3': 111, 'fe_dropout_l3': 0.4965669022512019, 'n_units_l(Invariant)': 253, 'n_layers_mlp': 2, 'mlp_n_units_l0': 256, 'mlp_dropout_l0': 0.4763037925600027, 'mlp_n_units_l1': 189, 'mlp_dropout_l1': 0.11286531801637883, 'reduction': 'sum', 'lr': 1.0229334476134362e-05, 'criterion': 'MSELoss', 'batch_size': 32, 'no_epochs': 89}. Best is trial 8 with value: 19.896305142112624.[0m

Trial Id: 32 | Model params: 119033 | Timestamp: 2021-08-22 02:04:42.343794

[32m[I 2021-08-22 02:05:07,689][0m Trial 32 pruned. [0m
epoch 0 -1.7084241794577801 36.8580192732031

Trial Id: 33 | Model params: 168423 | Timestamp: 2021-08-22 02:05:07.689730

[32m[I 2021-08-22 02:05:35,705][0m Trial 33 pruned. [0m
epoch 0 0.09503273690775527 21.305419321033202

Trial Id: 34 | Model params: 122790 | Timestamp: 2021-08-22 02:05:35.706068

[32m[I 2021-08-22 02:05:57,130][0m Trial 34 pruned. [0m
++++++++++++++++++++
        NaN         
++++++++++++++++++++

Trial Id: 35 | Model params: 79813 | Timestamp: 2021-08-22 02:05:57.130739

[32m[I 2021-08-22 02:06:22,050][0m Trial 35 pruned. [0m
epoch 0 0.07170539714097435 21.578267089839606

Trial Id: 36 | Model params: 102491 | Timestamp: 2021-08-22 02:06:22.051100

