[32m[I 2021-08-21 07:44:54,428][0m Trial 37 finished with value: 0.14014188350441004 and parameters: {'n_layers_fe': 4, 'fe_n_units_l0': 239, 'fe_dropout_l0': 0.4938981308882955, 'fe_n_units_l1': 38, 'fe_dropout_l1': 0.3200802786203929, 'fe_n_units_l2': 59, 'fe_dropout_l2': 0.2992773235195906, 'fe_n_units_l3': 30, 'fe_dropout_l3': 0.0455546918584904, 'n_units_l(Invariant)': 256, 'n_layers_mlp': 4, 'mlp_n_units_l0': 97, 'mlp_dropout_l0': 0.17151879852788288, 'mlp_n_units_l1': 119, 'mlp_dropout_l1': 0.3973622745358169, 'mlp_n_units_l2': 251, 'mlp_dropout_l2': 0.3422584013141804, 'mlp_n_units_l3': 232, 'mlp_dropout_l3': 0.08628212268476596, 'reduction': 'sum', 'lr': 0.001924681306960707, 'criterion': 'MSELoss', 'batch_size': 32, 'no_epochs': 78}. Best is trial 21 with value: 0.21758689986794688.[0m

Trial Id: 38 | Model params: 140388 | Timestamp: 2021-08-21 07:44:54.428614

[32m[I 2021-08-21 07:45:54,832][0m Trial 38 pruned. [0m
++++++++++++++++++++
        NaN         
++++++++++++++++++++

Trial Id: 39 | Model params: 91137 | Timestamp: 2021-08-21 07:45:54.832527

epoch 0 0.007220110600864804 23.089452360454278
epoch 5 0.08989188038453566 22.10719496282252
epoch 10 0.10467357864326388 21.9269308617259
[32m[I 2021-08-21 07:58:30,500][0m Trial 39 pruned. [0m

Trial Id: 40 | Model params: 82305 | Timestamp: 2021-08-21 07:58:30.501061

[32m[I 2021-08-21 07:59:42,400][0m Trial 40 pruned. [0m
epoch 0 -2.084623316163431 40.69941954024764

Trial Id: 41 | Model params: 159078 | Timestamp: 2021-08-21 07:59:42.400987

epoch 0 -0.03346400142718875 23.557805051875924
epoch 5 0.09177227033659441 22.084345127298217
epoch 10 0.10844410669673898 21.880711218179304
epoch 15 0.12439085311276155 21.68414444777962
epoch 20 0.1410114504683515 21.477356901859576
epoch 25 0.13679131485584295 21.530050449429936
epoch 30 0.14980542914092032 21.367135813130837
epoch 35 0.1520155981500808 21.339344696528716
epoch 40 0.15882464000752272 21.25349798346863
epoch 45 0.18120240958292 20.96888919453558
epoch 50 0.18768333813170213 20.885738085083407
epoch 55 0.21024482664586075 20.59365280386653
epoch 60 0.21577258481034844 20.521455348436422
epoch 65 0.21759820137059493 20.497555305625674
epoch 70 0.21169351043485696 20.574756197762266
epoch 75 0.2314914730550176 20.314750465534313
epoch 80 0.21127878784545862 20.58016760456326
[32m[I 2021-08-21 09:31:59,649][0m Trial 41 finished with value: 0.2293397182616156 and parameters: {'n_layers_fe': 4, 'fe_n_units_l0': 80, 'fe_dropout_l0': 0.11195388858334634, 'fe_n_units_l1': 255, 'fe_dropout_l1': 0.29541226939106335, 'fe_n_units_l2': 25, 'fe_dropout_l2': 0.33727603145672774, 'fe_n_units_l3': 53, 'fe_dropout_l3': 0.11556358626440802, 'n_units_l(Invariant)': 210, 'n_layers_mlp': 4, 'mlp_n_units_l0': 71, 'mlp_dropout_l0': 0.2784417731117772, 'mlp_n_units_l1': 246, 'mlp_dropout_l1': 0.4640231021166066, 'mlp_n_units_l2': 207, 'mlp_dropout_l2': 0.1462508249904636, 'mlp_n_units_l3': 215, 'mlp_dropout_l3': 0.18489804960201242, 'reduction': 'sum', 'lr': 0.0012133886263240518, 'criterion': 'L1Loss', 'batch_size': 256, 'no_epochs': 83}. Best is trial 41 with value: 0.2293397182616156.[0m

Trial Id: 42 | Model params: 146541 | Timestamp: 2021-08-21 09:31:59.649974

epoch 0 0.03567777412906137 22.756121038372214
[32m[I 2021-08-21 09:33:52,933][0m Trial 42 pruned. [0m

Trial Id: 43 | Model params: 178997 | Timestamp: 2021-08-21 09:33:52.933929

epoch 0 0.03799375007303851 22.72877835715123
[32m[I 2021-08-21 09:36:43,004][0m Trial 43 pruned. [0m

Trial Id: 44 | Model params: 138698 | Timestamp: 2021-08-21 09:36:43.004673

epoch 0 0.028421849156155976 22.841573424227565
epoch 5 0.08508163452194806 22.165540173870017
[32m[I 2021-08-21 09:53:02,053][0m Trial 44 pruned. [0m
epoch 10 0.09998645928212546 21.984250729957274

Trial Id: 45 | Model params: 125670 | Timestamp: 2021-08-21 09:53:02.053621

[32m[I 2021-08-21 09:54:06,805][0m Trial 45 pruned. [0m
epoch 0 -0.44173938844509686 27.824702436489822

Trial Id: 46 | Model params: 159556 | Timestamp: 2021-08-21 09:54:06.805815

epoch 0 0.08045116121527973 22.221560147981535
epoch 5 -0.0326968319200982 23.54905961666811
[32m[I 2021-08-21 10:03:35,667][0m Trial 46 pruned. [0m

Trial Id: 47 | Model params: 220432 | Timestamp: 2021-08-21 10:03:35.667534

epoch 0 -0.17508519225837005 25.120126586504618
[32m[I 2021-08-21 10:06:45,495][0m Trial 47 pruned. [0m

Trial Id: 48 | Model params: 163350 | Timestamp: 2021-08-21 10:06:45.495408

[32m[I 2021-08-21 10:08:07,453][0m Trial 48 pruned. [0m
++++++++++++++++++++
        NaN         
++++++++++++++++++++

Trial Id: 49 | Model params: 117152 | Timestamp: 2021-08-21 10:08:07.453514

[32m[I 2021-08-21 10:09:24,472][0m Trial 49 pruned. [0m
epoch 0 -31.557299582518752 132.22431770994723

Study statistics: 
  Number of finished trials:  50
  Number of pruned trials:  39
  Number of complete trials:  11

Best trial:
  Value:  0.2293397182616156
  Params: 
    n_layers_fe: 4
    fe_n_units_l0: 80
    fe_dropout_l0: 0.11195388858334634
    fe_n_units_l1: 255
    fe_dropout_l1: 0.29541226939106335
    fe_n_units_l2: 25
    fe_dropout_l2: 0.33727603145672774
    fe_n_units_l3: 53
    fe_dropout_l3: 0.11556358626440802
    n_units_l(Invariant): 210
    n_layers_mlp: 4
    mlp_n_units_l0: 71
    mlp_dropout_l0: 0.2784417731117772
    mlp_n_units_l1: 246
    mlp_dropout_l1: 0.4640231021166066
    mlp_n_units_l2: 207
    mlp_dropout_l2: 0.1462508249904636
    mlp_n_units_l3: 215
    mlp_dropout_l3: 0.18489804960201242
    reduction: sum
    lr: 0.0012133886263240518
    criterion: L1Loss
    batch_size: 256
    no_epochs: 83
Target 37139 0 274.0 1.0 130.19173914214167
[ 97. 150. 113. ... 133. 123. 139.]
Prediction 37139 0 150.04193115234375 13.452659606933594 131.0295432698133
[116.83377838 144.0846405  130.79600525 ... 127.47760773 121.24252319
 138.99223328]

 XXXXXX======== TRIAL south - elg ended

Test Set - R-squared:  0.23170155723434582
Test Set - RMSE:  20.38446017675692
Test Set - MAE:  15.692350823209225



