[32m[I 2021-08-22 07:22:12,559][0m Trial 33 pruned. [0m

Trial Id: 34 | Model params: 43321 | Timestamp: 2021-08-22 07:22:12.560091

[32m[I 2021-08-22 07:22:20,772][0m Trial 34 pruned. [0m
epoch 0 -2.24253838024302 52.311890312621216

Trial Id: 35 | Model params: 62047 | Timestamp: 2021-08-22 07:22:20.772788

[32m[I 2021-08-22 07:22:35,357][0m Trial 35 pruned. [0m
++++++++++++++++++++
        NaN         
++++++++++++++++++++

Trial Id: 36 | Model params: 66016 | Timestamp: 2021-08-22 07:22:35.358014

[32m[I 2021-08-22 07:22:59,697][0m Trial 36 pruned. [0m
epoch 0 -1.0895682138911442 41.993892069427936

Trial Id: 37 | Model params: 49781 | Timestamp: 2021-08-22 07:22:59.697316

[32m[I 2021-08-22 07:23:14,649][0m Trial 37 pruned. [0m
++++++++++++++++++++
        NaN         
++++++++++++++++++++

Trial Id: 38 | Model params: 51681 | Timestamp: 2021-08-22 07:23:14.650013

[32m[I 2021-08-22 07:23:35,695][0m Trial 38 pruned. [0m
epoch 0 -0.9760500657213222 40.83728142244641

Trial Id: 39 | Model params: 83584 | Timestamp: 2021-08-22 07:23:35.695440

[32m[I 2021-08-22 07:23:56,961][0m Trial 39 pruned. [0m
epoch 0 -2.4839355307035715 54.224169121386055

Study statistics: 
  Number of finished trials:  40
  Number of pruned trials:  31
  Number of complete trials:  9

Best trial:
  Value:  26.26079674610733
  Params: 
    n_layers_fe: 4
    fe_n_units_l0: 152
    fe_dropout_l0: 0.418137124036141
    fe_n_units_l1: 230
    fe_dropout_l1: 0.01408189247959557
    fe_n_units_l2: 21
    fe_dropout_l2: 0.13183919605745437
    fe_n_units_l3: 244
    fe_dropout_l3: 0.025963488771021004
    n_units_l(Invariant): 220
    n_layers_mlp: 4
    mlp_n_units_l0: 179
    mlp_dropout_l0: 0.2208762560524729
    mlp_n_units_l1: 202
    mlp_dropout_l1: 0.405170473478561
    mlp_n_units_l2: 234
    mlp_dropout_l2: 0.3490590875000104
    mlp_n_units_l3: 202
    mlp_dropout_l3: 0.10307616487995147
    reduction: sum
    lr: 0.0017803215352862516
    criterion: L1Loss
    batch_size: 128
    no_epochs: 75
Target 19505 0 314.0 1.0 153.38815688285055
[166. 146. 114. ... 168. 134. 150.]
Prediction 19505 0 172.1425323486328 0.0 150.51485989220294
[163.92359924 140.54692078 158.20352173 ... 132.81562805 139.90454102
 127.7782135 ]

 XXXXXX======== TRIAL north - qso ended

Test Set - R-squared:  0.1828531807910716
Test Set - RMSE:  26.26079674610733
Test Set - MAE:  20.26663867351001



