[32m[I 2021-08-21 06:51:44,284][0m Trial 14 pruned. [0m

Trial Id: 15 | Model params: 192226 | Timestamp: 2021-08-21 06:51:44.284428

[33m[W 2021-08-21 06:51:47,201][0m Trial 15 failed because of the following error: RuntimeError('CUDA out of memory. Tried to allocate 600.00 MiB (GPU 0; 7.93 GiB total capacity; 5.16 GiB already allocated; 382.06 MiB free; 5.54 GiB reserved in total by PyTorch)')
Traceback (most recent call last):
  File "/vol/bitbucket/ele20/venv/lib/python3.8/site-packages/optuna/_optimize.py", line 216, in _run_trial
    value_or_values = func(trial)
  File "hp_optim.py", line 260, in objective
    predictions = model(X1, X2, mask=mask)
  File "/vol/bitbucket/ele20/venv/lib/python3.8/site-packages/torch/nn/modules/module.py", line 1051, in _call_impl
    return forward_call(*input, **kwargs)
  File "/vol/bitbucket/ele20/astrostatistics/models/deep_set/models.py", line 95, in forward
    y = self.feature_extractor(X1)
  File "/vol/bitbucket/ele20/venv/lib/python3.8/site-packages/torch/nn/modules/module.py", line 1051, in _call_impl
    return forward_call(*input, **kwargs)
  File "/vol/bitbucket/ele20/venv/lib/python3.8/site-packages/torch/nn/modules/container.py", line 139, in forward
    input = module(input)
  File "/vol/bitbucket/ele20/venv/lib/python3.8/site-packages/torch/nn/modules/module.py", line 1051, in _call_impl
    return forward_call(*input, **kwargs)
  File "/vol/bitbucket/ele20/venv/lib/python3.8/site-packages/torch/nn/modules/activation.py", line 102, in forward
    return F.relu(input, inplace=self.inplace)
  File "/vol/bitbucket/ele20/venv/lib/python3.8/site-packages/torch/nn/functional.py", line 1298, in relu
    result = torch.relu(input)
RuntimeError: CUDA out of memory. Tried to allocate 600.00 MiB (GPU 0; 7.93 GiB total capacity; 5.16 GiB already allocated; 382.06 MiB free; 5.54 GiB reserved in total by PyTorch)[0m
Traceback (most recent call last):
  File "hp_optim.py", line 325, in <module>
    main()
  File "hp_optim.py", line 42, in main
    study.optimize(objective, n_trials=args['trials'], timeout=None)
  File "/vol/bitbucket/ele20/venv/lib/python3.8/site-packages/optuna/study.py", line 401, in optimize
    _optimize(
  File "/vol/bitbucket/ele20/venv/lib/python3.8/site-packages/optuna/_optimize.py", line 65, in _optimize
    _optimize_sequential(
  File "/vol/bitbucket/ele20/venv/lib/python3.8/site-packages/optuna/_optimize.py", line 162, in _optimize_sequential
    trial = _run_trial(study, func, catch)
  File "/vol/bitbucket/ele20/venv/lib/python3.8/site-packages/optuna/_optimize.py", line 267, in _run_trial
    raise func_err
  File "/vol/bitbucket/ele20/venv/lib/python3.8/site-packages/optuna/_optimize.py", line 216, in _run_trial
    value_or_values = func(trial)
  File "hp_optim.py", line 260, in objective
    predictions = model(X1, X2, mask=mask)
  File "/vol/bitbucket/ele20/venv/lib/python3.8/site-packages/torch/nn/modules/module.py", line 1051, in _call_impl
    return forward_call(*input, **kwargs)
  File "/vol/bitbucket/ele20/astrostatistics/models/deep_set/models.py", line 95, in forward
    y = self.feature_extractor(X1)
  File "/vol/bitbucket/ele20/venv/lib/python3.8/site-packages/torch/nn/modules/module.py", line 1051, in _call_impl
    return forward_call(*input, **kwargs)
  File "/vol/bitbucket/ele20/venv/lib/python3.8/site-packages/torch/nn/modules/container.py", line 139, in forward
    input = module(input)
  File "/vol/bitbucket/ele20/venv/lib/python3.8/site-packages/torch/nn/modules/module.py", line 1051, in _call_impl
    return forward_call(*input, **kwargs)
  File "/vol/bitbucket/ele20/venv/lib/python3.8/site-packages/torch/nn/modules/activation.py", line 102, in forward
    return F.relu(input, inplace=self.inplace)
  File "/vol/bitbucket/ele20/venv/lib/python3.8/site-packages/torch/nn/functional.py", line 1298, in relu
    result = torch.relu(input)
RuntimeError: CUDA out of memory. Tried to allocate 600.00 MiB (GPU 0; 7.93 GiB total capacity; 5.16 GiB already allocated; 382.06 MiB free; 5.54 GiB reserved in total by PyTorch)
