[32m[I 2021-08-19 16:23:08,132][0m A new study created in memory with name: DeepSet[0m
Starting Loading south
Finished Loading south
Finished south setup

++++++++ Session Characteristics +++++++

Area: south
Gal Type: qso
Training Set: 118848
Validation Set: 29712
Test Samples: 37139
Number of features: 6
Device: cuda:0
Number of Workers: 8
Number of Trials: 30

+++++++++++++++++++++++++++++++++++++++

Trial Id: 0 | Model params: 65213 | Timestamp: 2021-08-19 16:23:08.133204

[32m[I 2021-08-19 16:23:53,269][0m Trial 0 pruned. [0m
++++++++++++++++++++
        NaN         
++++++++++++++++++++

Trial Id: 1 | Model params: 84178 | Timestamp: 2021-08-19 16:23:53.269641

epoch 0 -4.032470518638728 62.194966942345296
epoch 5 -0.49223359602277705 33.867491334158096
epoch 10 -0.10662659754797321 29.165214423749344
epoch 15 0.06813944957019513 26.763326045942442
epoch 20 0.17019610794385787 25.255289744579848
epoch 25 0.1555872381332971 25.476632110230582
epoch 30 0.17846742579978603 25.12910469270872
epoch 35 0.1870829243629677 24.996991626159044
epoch 40 0.1842844643853313 25.039980623995152
epoch 45 0.1865291428011795 25.005504497116828
epoch 50 0.17082399503148682 25.24573298585212
epoch 55 0.18331932134574092 25.05478971958103
epoch 60 0.17023422905741425 25.25470962508716
epoch 65 0.17801651781960437 25.135999951549444
epoch 70 0.180804461903447 25.093336512422113
epoch 75 0.18176730504502714 25.07858542466823
epoch 80 0.19036683678359145 24.94645080007498
epoch 85 0.20298494037318482 24.75129266390786
[32m[I 2021-08-19 16:55:44,815][0m Trial 1 finished with value: 0.19672501422855704 and parameters: {'n_layers_fe': 2, 'fe_n_units_l0': 93, 'fe_dropout_l0': 0.19774189304148454, 'fe_n_units_l1': 139, 'fe_dropout_l1': 0.3416309450624026, 'n_units_l(Invariant)': 196, 'n_layers_mlp': 4, 'mlp_n_units_l0': 83, 'mlp_dropout_l0': 0.4088872827092664, 'mlp_n_units_l1': 158, 'mlp_dropout_l1': 0.41604533573723407, 'mlp_n_units_l2': 116, 'mlp_dropout_l2': 0.2987946537272819, 'mlp_n_units_l3': 47, 'mlp_dropout_l3': 0.21623352288391906, 'reduction': 'sum', 'lr': 0.0008379365544368044, 'criterion': 'MSELoss', 'batch_size': 256, 'no_epochs': 91}. Best is trial 1 with value: 0.19672501422855704.[0m
epoch 90 0.19672501422855704 24.84830351439104

Trial Id: 2 | Model params: 163365 | Timestamp: 2021-08-19 16:55:44.815207

epoch 0 -2.8710907310920875 54.5483096145127
epoch 5 -2.7526505667371435 53.70734513295709
epoch 10 -3.3291441225486915 57.68536484319132
epoch 15 -2.8074961764208437 54.09839238366463
epoch 20 -5.487795654673914 70.61764053334926
epoch 25 -15.135558526805145 111.36702623346436
epoch 30 -13.878128237607505 106.93965297697405
epoch 35 -6.538570652453712 76.12181352442009
epoch 40 -2.7476010298161313 53.67119887992952
epoch 45 -2.212825809335973 49.69448698768906
[32m[I 2021-08-19 17:23:17,016][0m Trial 2 finished with value: -1.858173866350005 and parameters: {'n_layers_fe': 4, 'fe_n_units_l0': 216, 'fe_dropout_l0': 0.14229700942644113, 'fe_n_units_l1': 227, 'fe_dropout_l1': 0.17098991670121594, 'fe_n_units_l2': 20, 'fe_dropout_l2': 0.44460641082118524, 'fe_n_units_l3': 126, 'fe_dropout_l3': 0.2914860061613601, 'n_units_l(Invariant)': 177, 'n_layers_mlp': 4, 'mlp_n_units_l0': 254, 'mlp_dropout_l0': 0.32355529265289956, 'mlp_n_units_l1': 206, 'mlp_dropout_l1': 0.10723899522269076, 'mlp_n_units_l2': 42, 'mlp_dropout_l2': 0.2678120632355467, 'mlp_n_units_l3': 102, 'mlp_dropout_l3': 0.1939659833909465, 'reduction': 'sum', 'lr': 3.190385234194116e-05, 'criterion': 'L1Loss', 'batch_size': 256, 'no_epochs': 51}. Best is trial 1 with value: 0.19672501422855704.[0m
epoch 50 -1.858173866350005 46.87150986474691

Trial Id: 3 | Model params: 109949 | Timestamp: 2021-08-19 17:23:17.017087

[32m[I 2021-08-19 17:23:49,142][0m Trial 3 pruned. [0m
++++++++++++++++++++
        NaN         
++++++++++++++++++++

Trial Id: 4 | Model params: 74008 | Timestamp: 2021-08-19 17:23:49.142937

[32m[I 2021-08-19 17:24:12,920][0m Trial 4 pruned. [0m
++++++++++++++++++++
        NaN         
++++++++++++++++++++

Trial Id: 5 | Model params: 181665 | Timestamp: 2021-08-19 17:24:12.921165

epoch 0 -0.08372298506402487 28.861823328560813
epoch 5 0.10907156718935684 26.168933958321897
epoch 10 0.11814773928611955 26.035297098473656
epoch 15 0.11024758989715466 26.15165680004517
epoch 20 0.12444711092384131 25.942140932774535
epoch 25 0.1311259253222702 25.84300675728793
epoch 30 0.11708873704249123 26.05092509349657
epoch 35 0.10777712504643089 26.187937659726177
epoch 40 0.12571674915140796 25.923324774759145
epoch 45 0.13432154245933636 25.795439203177615
epoch 50 0.12627361478277432 25.915067663565075
epoch 55 0.14271141396358022 25.670134395229184
epoch 60 0.15757595536787794 25.446613802713067
epoch 65 0.1641480919978079 25.34715909304198
epoch 70 0.1586472382302334 25.430428846017666
epoch 75 0.16377100903523634 25.35287595748144
epoch 80 0.17553412568566662 25.173926729173697
epoch 85 0.16940186363430698 25.267373366283415
epoch 90 0.17616995931084622 25.164217706127392
epoch 95 0.16880871984524093 25.276393679614365
[32m[I 2021-08-19 18:36:47,180][0m Trial 5 finished with value: 0.16675743031197687 and parameters: {'n_layers_fe': 4, 'fe_n_units_l0': 203, 'fe_dropout_l0': 0.06379975104345148, 'fe_n_units_l1': 12, 'fe_dropout_l1': 0.37445210287505576, 'fe_n_units_l2': 118, 'fe_dropout_l2': 0.06763807261931148, 'fe_n_units_l3': 247, 'fe_dropout_l3': 0.3788472079975324, 'n_units_l(Invariant)': 253, 'n_layers_mlp': 4, 'mlp_n_units_l0': 221, 'mlp_dropout_l0': 0.0738175606729129, 'mlp_n_units_l1': 149, 'mlp_dropout_l1': 0.3432552961808931, 'mlp_n_units_l2': 121, 'mlp_dropout_l2': 0.31035045025404207, 'mlp_n_units_l3': 145, 'mlp_dropout_l3': 0.13135769782475132, 'reduction': 'sum', 'lr': 0.0003777326647030101, 'criterion': 'L1Loss', 'batch_size': 32, 'no_epochs': 99}. Best is trial 1 with value: 0.19672501422855704.[0m

Trial Id: 6 | Model params: 96894 | Timestamp: 2021-08-19 18:36:47.180808

epoch 0 -0.00014500566124309167 27.726567430691947
epoch 5 -0.08172635138467688 28.83522379329855
epoch 10 -9.774951538421561e-06 27.72469289743846
epoch 15 -0.0015603767279432912 27.74617934043517
epoch 20 -0.011328939359969592 27.881160023130604
epoch 25 -0.006474517703823679 27.81416415737476
epoch 30 -0.000149383424959737 27.726628112006843
epoch 35 -0.0032875605853341927 27.77009308111244
epoch 40 -0.0030316442014235445 27.76655108810001
epoch 45 -0.010281614149066254 27.866719515904354
epoch 50 -0.0016044252335163378 27.74678947055123
epoch 55 -0.003524247122826285 27.77336852268662
epoch 60 -0.0024542808713476916 27.7585584708442
epoch 65 -0.0033496390300606915 27.77095220545025
epoch 70 -0.003692581375635662 27.775697820264437
epoch 75 -0.004716089766379827 27.78985624711599
epoch 80 -0.0003450864728158365 27.729340666902925
epoch 85 -3.212740993552288e-05 27.72500275020046
[32m[I 2021-08-19 19:29:43,039][0m Trial 6 finished with value: -0.004195083130285493 and parameters: {'n_layers_fe': 2, 'fe_n_units_l0': 59, 'fe_dropout_l0': 0.288623671600219, 'fe_n_units_l1': 196, 'fe_dropout_l1': 0.24222965385053097, 'n_units_l(Invariant)': 44, 'n_layers_mlp': 4, 'mlp_n_units_l0': 214, 'mlp_dropout_l0': 0.4104190848101619, 'mlp_n_units_l1': 35, 'mlp_dropout_l1': 0.4215706082414185, 'mlp_n_units_l2': 249, 'mlp_dropout_l2': 0.42289787637891435, 'mlp_n_units_l3': 180, 'mlp_dropout_l3': 0.25851536569342715, 'reduction': 'sum', 'lr': 0.0018848415030457413, 'criterion': 'L1Loss', 'batch_size': 32, 'no_epochs': 88}. Best is trial 1 with value: 0.19672501422855704.[0m

Trial Id: 7 | Model params: 139876 | Timestamp: 2021-08-19 19:29:43.040129

epoch 0 -0.4564997507191553 33.459529440602296
epoch 5 0.08629453639438756 26.501333813545024
epoch 10 0.07034664541675939 26.731611578132767
epoch 15 0.10181696868430246 26.275261359512598
epoch 20 0.1145379451996128 26.088529416945242
epoch 25 0.11541790222612991 26.07556302781646
epoch 30 0.11031729498776977 26.150632391855762
epoch 35 0.1132881845957936 26.106933886998227
epoch 40 0.13079252662330698 25.84796443684045
epoch 45 0.1266859126667359 25.908952483499633
[32m[I 2021-08-19 19:53:58,033][0m Trial 7 finished with value: 0.11919035582102122 and parameters: {'n_layers_fe': 4, 'fe_n_units_l0': 200, 'fe_dropout_l0': 0.3794848311933161, 'fe_n_units_l1': 252, 'fe_dropout_l1': 0.47392560752473895, 'fe_n_units_l2': 112, 'fe_dropout_l2': 0.187508808761302, 'fe_n_units_l3': 61, 'fe_dropout_l3': 0.3045274385979933, 'n_units_l(Invariant)': 22, 'n_layers_mlp': 4, 'mlp_n_units_l0': 163, 'mlp_dropout_l0': 0.212502831143491, 'mlp_n_units_l1': 54, 'mlp_dropout_l1': 0.25493218936585615, 'mlp_n_units_l2': 164, 'mlp_dropout_l2': 0.48543778133632626, 'mlp_n_units_l3': 135, 'mlp_dropout_l3': 0.4003280127060715, 'reduction': 'sum', 'lr': 0.0022000607175190435, 'criterion': 'L1Loss', 'batch_size': 256, 'no_epochs': 51}. Best is trial 1 with value: 0.19672501422855704.[0m
epoch 50 0.11919035582102122 26.01990174226963

Trial Id: 8 | Model params: 154533 | Timestamp: 2021-08-19 19:53:58.033458

[32m[I 2021-08-19 19:54:34,169][0m Trial 8 pruned. [0m
++++++++++++++++++++
        NaN         
++++++++++++++++++++

Trial Id: 9 | Model params: 89666 | Timestamp: 2021-08-19 19:54:34.169936

[32m[I 2021-08-19 19:54:59,216][0m Trial 9 pruned. [0m
epoch 0 -0.9792361528197511 39.00438452076432

Trial Id: 10 | Model params: 30814 | Timestamp: 2021-08-19 19:54:59.216932

epoch 0 0.006694124029387294 27.63160576309441
epoch 5 0.06572001460822585 26.798046987505153
epoch 10 0.14141072173700342 25.6896005877356
epoch 15 0.15901271915730264 25.42490479789567
epoch 20 0.1679807040358009 25.288980459783126
epoch 25 0.15203580521564286 25.530150732759697
epoch 30 0.17443951286350812 25.190632431456105
epoch 35 0.15633188781004814 25.46539628397215
epoch 40 0.16298220250518725 25.364830697420935
epoch 45 0.16471885650034201 25.33850341545696
epoch 50 0.1753486152183269 25.176758722825785
epoch 55 0.16777369439046785 25.292126262600256
epoch 60 0.1719134355465881 25.22914256096388
epoch 65 0.1650143780269301 25.334020651956177
epoch 70 0.1713367409170199 25.23792605015042
epoch 75 0.16926004774160353 25.26953034329375
[32m[I 2021-08-19 20:16:30,698][0m Trial 10 pruned. [0m
epoch 80 0.17060915723019343 25.249003332835084

Trial Id: 11 | Model params: 44730 | Timestamp: 2021-08-19 20:16:30.698690

epoch 0 -0.07640830262058107 28.764255722494827
epoch 5 0.07457081478723893 26.67081073390734
[32m[I 2021-08-19 20:22:34,424][0m Trial 11 pruned. [0m

Trial Id: 12 | Model params: 105594 | Timestamp: 2021-08-19 20:22:34.424438

epoch 0 0.01685389383325664 27.489931229216243
epoch 5 -5.610952680392376 71.28475247668086
[32m[I 2021-08-19 20:28:04,222][0m Trial 12 pruned. [0m

Trial Id: 13 | Model params: 250259 | Timestamp: 2021-08-19 20:28:04.222834

epoch 0 0.00030188302994860194 27.720372292095266
epoch 5 -0.0010415344439307361 27.738991677929082
[32m[I 2021-08-19 20:35:16,651][0m Trial 13 pruned. [0m

Trial Id: 14 | Model params: 171091 | Timestamp: 2021-08-19 20:35:16.651671

[32m[I 2021-08-19 20:35:53,564][0m Trial 14 pruned. [0m
epoch 0 -3.286702094238705 57.40190071834169

Trial Id: 15 | Model params: 63000 | Timestamp: 2021-08-19 20:35:53.564712

epoch 0 -0.3902518016470611 32.68973160800822
epoch 5 0.03102978788492483 27.291024214484057
[32m[I 2021-08-19 20:40:41,703][0m Trial 15 pruned. [0m

Trial Id: 16 | Model params: 170322 | Timestamp: 2021-08-19 20:40:41.703253

epoch 0 -0.272876998117894 31.279358733606966
epoch 5 0.003876428065355486 27.670769091238313
[32m[I 2021-08-19 20:45:19,421][0m Trial 16 pruned. [0m

Trial Id: 17 | Model params: 163720 | Timestamp: 2021-08-19 20:45:19.421551

[32m[I 2021-08-19 20:45:50,484][0m Trial 17 pruned. [0m
epoch 0 -2.9660002963223553 55.212955199630784

Trial Id: 18 | Model params: 89320 | Timestamp: 2021-08-19 20:45:50.484479

[32m[I 2021-08-19 20:46:33,584][0m Trial 18 pruned. [0m
epoch 0 -5.216835738915979 69.12725599843749

Trial Id: 19 | Model params: 41423 | Timestamp: 2021-08-19 20:46:33.585042

[32m[I 2021-08-19 20:46:51,228][0m Trial 19 pruned. [0m
epoch 0 -1.483098733750329 43.68794490729858

Trial Id: 20 | Model params: 143167 | Timestamp: 2021-08-19 20:46:51.228633

[32m[I 2021-08-19 20:47:07,317][0m Trial 20 pruned. [0m
epoch 0 -2.1302293713409393 49.05154631074394

Trial Id: 21 | Model params: 45748 | Timestamp: 2021-08-19 20:47:07.317313

[32m[I 2021-08-19 20:47:24,384][0m Trial 21 pruned. [0m
epoch 0 -1.7493223646867757 45.970312293814345

Trial Id: 22 | Model params: 137984 | Timestamp: 2021-08-19 20:47:24.384888

epoch 0 -0.3667261681996432 32.41196613879418
epoch 5 -0.03367101771393699 28.1874501676302
[32m[I 2021-08-19 20:51:57,183][0m Trial 22 pruned. [0m

Trial Id: 23 | Model params: 119437 | Timestamp: 2021-08-19 20:51:57.184080

epoch 0 -0.36080808694610456 32.341716241089046
epoch 5 0.0667915675415306 26.782674848157843
[32m[I 2021-08-19 20:57:17,095][0m Trial 23 pruned. [0m

Trial Id: 24 | Model params: 105963 | Timestamp: 2021-08-19 20:57:17.095969

[32m[I 2021-08-19 20:57:45,456][0m Trial 24 pruned. [0m
epoch 0 -1.4910208291055693 43.757580570633166

Trial Id: 25 | Model params: 223533 | Timestamp: 2021-08-19 20:57:45.457023

[32m[I 2021-08-19 20:58:26,011][0m Trial 25 pruned. [0m
epoch 0 -1.767676624306616 46.12350413748201

Trial Id: 26 | Model params: 98335 | Timestamp: 2021-08-19 20:58:26.011208

epoch 0 -0.06578073943370666 28.62190628380126
epoch 5 0.0979504363537782 26.33175599486226
epoch 10 0.14199964540323273 25.680788569350685
epoch 15 0.12690929671834494 25.905638660320804
epoch 20 0.16124661545246044 25.391114531979063
epoch 25 0.14456585936067023 25.642355164976387
epoch 30 0.106448820918283 26.207424163316784
epoch 35 0.1691847386945381 25.270675696372063
epoch 40 0.16894296290397426 25.274352442236864
epoch 45 0.17092717418514825 25.24416220088844
epoch 50 0.180146075647176 25.103418226098096
epoch 55 0.18234177799509532 25.069780167510697
epoch 60 0.17767227192590063 25.141262866912918
epoch 65 0.1828793980603246 25.061536972062925
[32m[I 2021-08-19 21:46:20,373][0m Trial 26 finished with value: 0.16085544276627828 and parameters: {'n_layers_fe': 4, 'fe_n_units_l0': 82, 'fe_dropout_l0': 0.3721003159782164, 'fe_n_units_l1': 136, 'fe_dropout_l1': 0.3706223941389832, 'fe_n_units_l2': 54, 'fe_dropout_l2': 0.09841698602203797, 'fe_n_units_l3': 47, 'fe_dropout_l3': 0.436842611277517, 'n_units_l(Invariant)': 128, 'n_layers_mlp': 4, 'mlp_n_units_l0': 238, 'mlp_dropout_l0': 0.33991748291466, 'mlp_n_units_l1': 84, 'mlp_dropout_l1': 0.1321554033873633, 'mlp_n_units_l2': 140, 'mlp_dropout_l2': 0.41940915465888257, 'mlp_n_units_l3': 157, 'mlp_dropout_l3': 0.15430762176064033, 'reduction': 'sum', 'lr': 0.0004596425241331073, 'criterion': 'L1Loss', 'batch_size': 32, 'no_epochs': 69}. Best is trial 1 with value: 0.19672501422855704.[0m

Trial Id: 27 | Model params: 90170 | Timestamp: 2021-08-19 21:46:20.373795

[32m[I 2021-08-19 21:47:02,212][0m Trial 27 pruned. [0m
++++++++++++++++++++
        NaN         
++++++++++++++++++++

Trial Id: 28 | Model params: 125413 | Timestamp: 2021-08-19 21:47:02.212593

epoch 0 0.09674074507464592 26.34940614671304
epoch 5 0.10356692502032727 26.249652448714052
[32m[I 2021-08-19 21:54:02,889][0m Trial 28 pruned. [0m

Trial Id: 29 | Model params: 58970 | Timestamp: 2021-08-19 21:54:02.889328

[32m[I 2021-08-19 21:54:37,686][0m Trial 29 pruned. [0m
++++++++++++++++++++
        NaN         
++++++++++++++++++++

Study statistics: 
  Number of finished trials:  30
  Number of pruned trials:  24
  Number of complete trials:  6

Best trial:
  Value:  0.19672501422855704
  Params: 
    n_layers_fe: 2
    fe_n_units_l0: 93
    fe_dropout_l0: 0.19774189304148454
    fe_n_units_l1: 139
    fe_dropout_l1: 0.3416309450624026
    n_units_l(Invariant): 196
    n_layers_mlp: 4
    mlp_n_units_l0: 83
    mlp_dropout_l0: 0.4088872827092664
    mlp_n_units_l1: 158
    mlp_dropout_l1: 0.41604533573723407
    mlp_n_units_l2: 116
    mlp_dropout_l2: 0.2987946537272819
    mlp_n_units_l3: 47
    mlp_dropout_l3: 0.21623352288391906
    reduction: sum
    lr: 0.0008379365544368044
    criterion: MSELoss
    batch_size: 256
    no_epochs: 91
Target 37139 0 344.0 1.0 158.8338135114031
[166. 176. 138. ... 178. 189. 186.]
Prediction 37139 0 202.1028289794922 19.82846450805664 156.01208315383778
[157.00959778 155.90812683 160.53540039 ... 161.67987061 160.21807861
 159.33572388]

 XXXXXX======== TRIAL south - qso ended

Test Set - R-squared:  0.19914111571436732
Test Set - RMSE:  25.17845051309063
Test Set - MAE:  19.238417817733634



