[32m[I 2022-03-02 19:46:58,469][0m Trial 29 pruned. [0m
epoch 0 -2.097678670916786 7.409803007316525

Study statistics: 
  Number of finished trials:  30
  Number of pruned trials:  20
  Number of complete trials:  10

Best trial:
  Value:  7.359932378242359
  Params: 
    n_layers_fe: 4
    fe_neurons: 256
    fe_dropout: 0.49268449101898226
    n_units_l(Invariant): 57
    n_layers_mlp: 4
    initialiser: kaiming_he
    lr: 0.002075673522730702
    weight_decay: 0.050914126737914595
    criterion: PoissonNLLLoss
    batch_size: 128
    epochs: 50
Target: 67698, NaN: 0, Max: 143.0, Min: 0.0, Mean: 8.148734083724777
Prediction: 67698, NaN: 0, Max: 2.111848831176758, Min: 2.111848831176758, Mean: 2.111848831176758

 XXXXXX======== TRIAL des - lrg ended

Test Set - R-squared:  -2.056122014080577
Test Set - RMSE:  7.359932378242359
Test Set - MAE:  6.079714004826294



./hp_optim.sh: line 11: t: command not found
./hp_optim.sh: line 12: syntax error near unexpected token `done'
./hp_optim.sh: line 12: `    done'
