[32m[I 2022-03-01 23:55:13,310][0m Trial 23 pruned. [0m
epoch 0 -0.0058833331536412015 1.9957893525190147

Trial Id: 24 | Model params: 492994 | Timestamp: 2022-03-01 23:55:13.310908

[32m[I 2022-03-01 23:56:06,097][0m Trial 24 pruned. [0m
epoch 0 -0.025122544310663075 2.014785364725573

Trial Id: 25 | Model params: 48532 | Timestamp: 2022-03-01 23:56:06.097704

[32m[I 2022-03-01 23:57:32,560][0m Trial 25 pruned. [0m
epoch 0 -0.027334817208297446 2.016958203924322

Trial Id: 26 | Model params: 531178 | Timestamp: 2022-03-01 23:57:32.560437

[32m[I 2022-03-01 23:58:28,535][0m Trial 26 pruned. [0m
epoch 0 -0.03921819811681626 2.028589937204308

Trial Id: 27 | Model params: 37642 | Timestamp: 2022-03-01 23:58:28.535531

[32m[I 2022-03-01 23:59:54,075][0m Trial 27 pruned. [0m
epoch 0 -0.011929506088697694 2.001778520707298

Trial Id: 28 | Model params: 552592 | Timestamp: 2022-03-01 23:59:54.076056

[32m[I 2022-03-02 00:00:56,180][0m Trial 28 pruned. [0m
epoch 0 -0.6031255127102091 2.5195597279836903

Trial Id: 29 | Model params: 129822 | Timestamp: 2022-03-02 00:00:56.180682

epoch 0 -1.2376552980223865 2.97671659224902
epoch 5 -1.1889346633365392 2.9441321145636112
epoch 10 -1.1962456734312608 2.9490446953217493
epoch 15 -1.2058200505851877 2.9554657803991393
[32m[I 2022-03-02 00:09:26,762][0m Trial 29 finished with value: 2.9539967243125096 and parameters: {'n_layers_fe': 2, 'fe_neurons': 128, 'fe_dropout': 0.1850079246489713, 'n_units_l(Invariant)': 398, 'n_layers_mlp': 4, 'lr': 0.00032630316287244276, 'weight_decay': 0.02766854563019552, 'criterion': 'PoissonNLLLoss', 'batch_size': 128, 'epochs': 20}. Best is trial 1 with value: 1.960393914473997.[0m

Study statistics: 
  Number of finished trials:  30
  Number of pruned trials:  22
  Number of complete trials:  8

Best trial:
  Value:  1.960393914473997
  Params: 
    n_layers_fe: 4
    fe_neurons: 128
    fe_dropout: 0.16437972501713694
    n_units_l(Invariant): 360
    n_layers_mlp: 4
    lr: 0.00017949352284268887
    weight_decay: 0.02462594915260007
    criterion: MSELoss
    batch_size: 32
    epochs: 20
Target: 67698, NaN: 0, Max: 45.0, Min: 0.0, Mean: 3.3989925847144673
Prediction: 67698, NaN: 0, Max: 5.1499857902526855, Min: 3.1070971488952637, Mean: 3.4776508379322046

 XXXXXX======== TRIAL des - qso ended

Test Set - R-squared:  0.029479080716163675
Test Set - RMSE:  1.960393914473997
Test Set - MAE:  1.5588549488266763



[32m[I 2022-03-02 00:09:59,695][0m A new study created in memory with name: DeepSet[0m
Starting Loading des
Finished Loading des
Finished des setup

++++++++ Session Characteristics +++++++

Area: des
Gal Type: glbg
Training Set: 270781
Validation Set: 67698
Test Samples: 67698
Number of features: 5
Device: cuda:0
Number of Workers: 8
Number of Trials: 30

+++++++++++++++++++++++++++++++++++++++

Trial Id: 0 | Model params: 306972 | Timestamp: 2022-03-02 00:09:59.695731

epoch 0 -7.577773453437265 27.89054055717273
epoch 5 -7.59745886126267 27.922525665475167
epoch 10 -7.596849102456055 27.921535471273756
epoch 15 -7.573378641447622 27.883394799194456
epoch 20 -7.6176501979283024 27.955294794883493
epoch 25 -7.58314365342766 27.8992697656506
epoch 30 -7.578905481598143 27.8923808853119
epoch 35 -7.577944084852684 27.89081795892339
[32m[I 2022-03-02 00:39:23,305][0m Trial 0 finished with value: 27.88984053076949 and parameters: {'n_layers_fe': 4, 'fe_neurons': 256, 'fe_dropout': 0.12814042975400286, 'n_units_l(Invariant)': 13, 'n_layers_mlp': 2, 'lr': 0.0008292699488834702, 'weight_decay': 0.24151246497507442, 'criterion': 'PoissonNLLLoss', 'batch_size': 128, 'epochs': 40}. Best is trial 0 with value: 27.88984053076949.[0m

Trial Id: 1 | Model params: 142562 | Timestamp: 2022-03-02 00:39:23.305697

epoch 0 -7.655201469870736 28.016135961739145
epoch 5 -7.633568222246669 27.98110158387878
epoch 10 -7.590508003971582 27.91123600776505
epoch 15 -7.578524001205654 27.89176072958689
epoch 20 -7.605668986494731 27.93585476262386
epoch 25 -7.582486684253039 27.898202015201765
epoch 30 -7.570130616081521 27.87811248537478
epoch 35 -7.5946970824467055 27.91804050101383
epoch 40 -7.60098258946406 27.928247199779424
epoch 45 -7.574240631932637 27.88479649961508
epoch 50 -7.604887164536192 27.934585752579462
epoch 55 -7.575362913018715 27.886621358344573
[32m[I 2022-03-02 01:06:53,848][0m Trial 1 finished with value: 27.891072461455817 and parameters: {'n_layers_fe': 2, 'fe_neurons': 128, 'fe_dropout': 0.3103917217769392, 'n_units_l(Invariant)': 496, 'n_layers_mlp': 4, 'lr': 0.00014353017257010567, 'weight_decay': 0.010433460420208162, 'criterion': 'PoissonNLLLoss', 'batch_size': 128, 'epochs': 60}. Best is trial 0 with value: 27.88984053076949.[0m

Trial Id: 2 | Model params: 181064 | Timestamp: 2022-03-02 01:06:53.848467

epoch 0 -0.2653697448204937 10.712192506776631
epoch 5 -0.2005798208890206 10.434344358073878
epoch 10 0.06402622636459265 9.213008789586645
epoch 15 0.09940466249103264 9.037212465944746
[32m[I 2022-03-02 01:14:27,663][0m Trial 2 finished with value: 9.034197053087425 and parameters: {'n_layers_fe': 2, 'fe_neurons': 256, 'fe_dropout': 0.30484282307510363, 'n_units_l(Invariant)': 35, 'n_layers_mlp': 2, 'lr': 4.990972651665134e-05, 'weight_decay': 0.29078795381014333, 'criterion': 'MSELoss', 'batch_size': 256, 'epochs': 20}. Best is trial 2 with value: 9.034197053087425.[0m

Trial Id: 3 | Model params: 32688 | Timestamp: 2022-03-02 01:14:27.663376

epoch 0 -0.22508037148290594 10.54027486488936
epoch 5 -0.14795024651612754 10.203077334716054
epoch 10 -0.007197146086580064 9.55711669415455
epoch 15 0.049450176263306944 9.284469383293233
[32m[I 2022-03-02 01:21:39,175][0m Trial 3 finished with value: 9.27614788363919 and parameters: {'n_layers_fe': 2, 'fe_neurons': 64, 'fe_dropout': 0.06336008060779713, 'n_units_l(Invariant)': 183, 'n_layers_mlp': 4, 'lr': 1.7147278747659175e-05, 'weight_decay': 0.15348996414427765, 'criterion': 'MSELoss', 'batch_size': 128, 'epochs': 20}. Best is trial 2 with value: 9.034197053087425.[0m

Trial Id: 4 | Model params: 46284 | Timestamp: 2022-03-02 01:21:39.175563

epoch 0 -7.6031827024640375 27.93181896441213
epoch 5 -7.5897230344864735 27.909960764841557
epoch 10 -7.599090341937892 27.925174872688544
epoch 15 -7.583145198689971 27.899272277066572
[32m[I 2022-03-02 01:48:07,986][0m Trial 4 finished with value: 27.897068042498216 and parameters: {'n_layers_fe': 2, 'fe_neurons': 64, 'fe_dropout': 0.38779859561476226, 'n_units_l(Invariant)': 389, 'n_layers_mlp': 4, 'lr': 0.0001421919901850972, 'weight_decay': 0.1743654794792607, 'criterion': 'PoissonNLLLoss', 'batch_size': 32, 'epochs': 20}. Best is trial 2 with value: 9.034197053087425.[0m

Trial Id: 5 | Model params: 428748 | Timestamp: 2022-03-02 01:48:07.986328

[32m[I 2022-03-02 01:49:08,574][0m Trial 5 pruned. [0m
epoch 0 -0.18059184641902193 10.34712118014767

Trial Id: 6 | Model params: 30510 | Timestamp: 2022-03-02 01:49:08.574302

epoch 0 -8.27511300712554 29.002086963759947
epoch 5 -7.608639888884317 27.940676440987843
epoch 10 -7.600530762275879 27.92751362620232
epoch 15 -7.600899796522269 27.9281127809915
epoch 20 -7.6010914012962765 27.928423860649588
epoch 25 -7.59277870396814 27.914924605453617
epoch 30 -7.595227230226019 27.91890152373524
epoch 35 -7.59422641181621 27.917276053965693
epoch 40 -7.596927328193479 27.921662504894304
epoch 45 -7.59211346230742 27.913844016107806
epoch 50 -7.598604436936062 27.924385883778232
epoch 55 -7.601717494976281 27.929440329993948
[32m[I 2022-03-02 03:07:46,765][0m Trial 6 finished with value: 27.90678871945051 and parameters: {'n_layers_fe': 2, 'fe_neurons': 64, 'fe_dropout': 0.2856206294767377, 'n_units_l(Invariant)': 150, 'n_layers_mlp': 4, 'lr': 2.0184056726921576e-05, 'weight_decay': 0.0058285935259946966, 'criterion': 'PoissonNLLLoss', 'batch_size': 32, 'epochs': 60}. Best is trial 2 with value: 9.034197053087425.[0m

Trial Id: 7 | Model params: 174356 | Timestamp: 2022-03-02 03:07:46.765851

[32m[I 2022-03-02 03:08:07,525][0m Trial 7 pruned. [0m
epoch 0 0.07769539542137494 9.145486942651965

Trial Id: 8 | Model params: 103042 | Timestamp: 2022-03-02 03:08:07.525390

epoch 0 -7.644562071082273 27.998911261514056
epoch 5 -7.589866356333653 27.91019360648441
epoch 10 -7.5946448285041726 27.91795563299072
epoch 15 -7.599583401906852 27.925975456700534
epoch 20 -7.574184190026358 27.884704720428545
epoch 25 -7.593095946318764 27.915439905269178
epoch 30 -7.5861995780740035 27.904235922696813
epoch 35 -7.594068860458009 27.917020159792838
epoch 40 -7.581560677468426 27.896696937351372
epoch 45 -7.579946544346381 27.894073224612796
epoch 50 -7.584953012520252 27.90221024640059
epoch 55 -7.5807626885742305 27.895399867231305
[32m[I 2022-03-02 04:27:08,289][0m Trial 8 finished with value: 27.897319704148856 and parameters: {'n_layers_fe': 2, 'fe_neurons': 128, 'fe_dropout': 0.3494007974936435, 'n_units_l(Invariant)': 192, 'n_layers_mlp': 4, 'lr': 5.411670130696135e-05, 'weight_decay': 0.17480030757327694, 'criterion': 'PoissonNLLLoss', 'batch_size': 32, 'epochs': 60}. Best is trial 2 with value: 9.034197053087425.[0m

Trial Id: 9 | Model params: 129046 | Timestamp: 2022-03-02 04:27:08.289307

epoch 0 -7.64827690654845 28.00492661404962
epoch 5 -7.582055715724939 27.89750155399269
epoch 10 -7.579301921198299 27.893025344946413
epoch 15 -7.585056716689756 27.902378771889214
epoch 20 -7.576677307123818 27.88875844610765
epoch 25 -7.589388653756632 27.909417520092045
epoch 30 -7.585341630996256 27.902841769467628
epoch 35 -7.591293370561209 27.912511837508767
epoch 40 -7.5900037599701395 27.910416831538303
epoch 45 -7.583195941402167 27.899354745824734
epoch 50 -7.5761815451933 27.887952400593864
epoch 55 -7.59492633496807 27.918412837492696
[32m[I 2022-03-02 04:51:57,111][0m Trial 9 finished with value: 27.919585212953393 and parameters: {'n_layers_fe': 4, 'fe_neurons': 128, 'fe_dropout': 0.10428348991406616, 'n_units_l(Invariant)': 138, 'n_layers_mlp': 4, 'lr': 0.00025690727246562245, 'weight_decay': 0.11654099356473986, 'criterion': 'PoissonNLLLoss', 'batch_size': 256, 'epochs': 60}. Best is trial 2 with value: 9.034197053087425.[0m

Trial Id: 10 | Model params: 389016 | Timestamp: 2022-03-02 04:51:57.111448

[32m[I 2022-03-02 04:52:52,054][0m Trial 10 pruned. [0m
epoch 0 0.05576123075324635 9.25359652786782

Trial Id: 11 | Model params: 17570 | Timestamp: 2022-03-02 04:52:52.054895

[32m[I 2022-03-02 04:53:10,800][0m Trial 11 pruned. [0m
epoch 0 -0.38555802879790857 11.209390663706985

Trial Id: 12 | Model params: 29846 | Timestamp: 2022-03-02 04:53:10.800542

[32m[I 2022-03-02 04:53:30,367][0m Trial 12 pruned. [0m
epoch 0 -0.15595815925665502 10.238602984578261

Trial Id: 13 | Model params: 323484 | Timestamp: 2022-03-02 04:53:30.367514

[32m[I 2022-03-02 04:53:56,042][0m Trial 13 pruned. [0m
epoch 0 -0.15342606668479752 10.22738315669587

Trial Id: 14 | Model params: 36582 | Timestamp: 2022-03-02 04:53:56.042645

[32m[I 2022-03-02 04:54:10,520][0m Trial 14 pruned. [0m
epoch 0 -0.6269702114833264 12.146731910321687

Trial Id: 15 | Model params: 17768 | Timestamp: 2022-03-02 04:54:10.520360

[32m[I 2022-03-02 04:54:21,787][0m Trial 15 pruned. [0m
epoch 0 -0.6884990283300783 12.374283256574477

Trial Id: 16 | Model params: 173066 | Timestamp: 2022-03-02 04:54:21.787697

[32m[I 2022-03-02 04:54:44,108][0m Trial 16 pruned. [0m
epoch 0 0.0017272652636958208 9.514681398656505

Trial Id: 17 | Model params: 362184 | Timestamp: 2022-03-02 04:54:44.109171

[32m[I 2022-03-02 04:55:13,910][0m Trial 17 pruned. [0m
epoch 0 0.009009990983492644 9.479911513608444

Trial Id: 18 | Model params: 42456 | Timestamp: 2022-03-02 04:55:13.910686

[32m[I 2022-03-02 04:55:36,025][0m Trial 18 pruned. [0m
epoch 0 -0.3188894567969145 10.936386342301999

Trial Id: 19 | Model params: 340254 | Timestamp: 2022-03-02 04:55:36.025849

[32m[I 2022-03-02 04:56:23,284][0m Trial 19 pruned. [0m
epoch 0 0.0695056186677292 9.186001735219577

Trial Id: 20 | Model params: 15722 | Timestamp: 2022-03-02 04:56:23.284497

[32m[I 2022-03-02 04:56:42,561][0m Trial 20 pruned. [0m
epoch 0 -0.40705092179477154 11.295996603185657

Trial Id: 21 | Model params: 308262 | Timestamp: 2022-03-02 04:56:42.561639

[32m[I 2022-03-02 04:57:26,365][0m Trial 21 pruned. [0m
epoch 0 -7.617205492228546 27.954573482284577

Trial Id: 22 | Model params: 334320 | Timestamp: 2022-03-02 04:57:26.365983

[32m[I 2022-03-02 04:58:14,262][0m Trial 22 pruned. [0m
epoch 0 -7.570626117720872 27.878918392040394

Trial Id: 23 | Model params: 311616 | Timestamp: 2022-03-02 04:58:14.262820

[32m[I 2022-03-02 04:58:59,021][0m Trial 23 pruned. [0m
epoch 0 -7.550889420486447 27.84679968185049

Trial Id: 24 | Model params: 356250 | Timestamp: 2022-03-02 04:58:59.021917

epoch 0 -7.652952510296078 28.01249588178851
epoch 5 -7.586170958339601 27.904189417110782
epoch 10 -7.564917266855517 27.869631841829133
epoch 15 -7.615388000847503 27.951625317958943
epoch 20 -7.6007838447370375 27.927924525952726
epoch 25 -7.58904571295893 27.90886035742125
epoch 30 -7.594768481455674 27.918156462999764
epoch 35 -7.61506648430403 27.951103751559224
[32m[I 2022-03-02 05:33:39,916][0m Trial 24 finished with value: 27.896696253945404 and parameters: {'n_layers_fe': 4, 'fe_neurons': 256, 'fe_dropout': 0.08496277540638066, 'n_units_l(Invariant)': 204, 'n_layers_mlp': 2, 'lr': 0.0024856998585951993, 'weight_decay': 0.296772641504221, 'criterion': 'PoissonNLLLoss', 'batch_size': 128, 'epochs': 40}. Best is trial 2 with value: 9.034197053087425.[0m

Trial Id: 25 | Model params: 349542 | Timestamp: 2022-03-02 05:33:39.916464

[32m[I 2022-03-02 05:34:31,250][0m Trial 25 pruned. [0m
epoch 0 0.08251047413155288 9.121582765653574

Trial Id: 26 | Model params: 51818 | Timestamp: 2022-03-02 05:34:31.250634

[32m[I 2022-03-02 05:35:40,005][0m Trial 26 pruned. [0m
epoch 0 -0.0532715240750119 9.773268202523886

Trial Id: 27 | Model params: 509764 | Timestamp: 2022-03-02 05:35:40.005264

[32m[I 2022-03-02 05:36:33,998][0m Trial 27 pruned. [0m
++++++++++++++++++++
        NaN         
++++++++++++++++++++

Trial Id: 28 | Model params: 19418 | Timestamp: 2022-03-02 05:36:33.999135

[32m[I 2022-03-02 05:36:45,508][0m Trial 28 pruned. [0m
epoch 0 -0.01275771027070527 9.583461990337364

Trial Id: 29 | Model params: 78342 | Timestamp: 2022-03-02 05:36:45.508888

[32m[I 2022-03-02 05:37:07,658][0m Trial 29 pruned. [0m
epoch 0 -7.6246855926434876 27.96670372909149

Study statistics: 
  Number of finished trials:  30
  Number of pruned trials:  21
  Number of complete trials:  9

Best trial:
  Value:  9.034197053087425
  Params: 
    n_layers_fe: 2
    fe_neurons: 256
    fe_dropout: 0.30484282307510363
    n_units_l(Invariant): 35
    n_layers_mlp: 2
    lr: 4.990972651665134e-05
    weight_decay: 0.29078795381014333
    criterion: MSELoss
    batch_size: 256
    epochs: 20
Target: 67698, NaN: 0, Max: 122.0, Min: 3.0, Mean: 29.60905787467872
Prediction: 67698, NaN: 0, Max: 42.89165496826172, Min: 24.1038875579834, Mean: 28.755645084699474

 XXXXXX======== TRIAL des - glbg ended

Test Set - R-squared:  0.10000555796016108
Test Set - RMSE:  9.034197057180105
Test Set - MAE:  6.955889074230952



[32m[I 2022-03-02 05:37:40,438][0m A new study created in memory with name: DeepSet[0m
Starting Loading des
Finished Loading des
Finished des setup

++++++++ Session Characteristics +++++++

Area: des
Gal Type: rlbg
Training Set: 270781
Validation Set: 67698
Test Samples: 67698
Number of features: 5
Device: cuda:0
Number of Workers: 8
Number of Trials: 30

+++++++++++++++++++++++++++++++++++++++

Trial Id: 0 | Model params: 238082 | Timestamp: 2022-03-02 05:37:40.439433

[32m[I 2022-03-02 05:38:12,346][0m Trial 0 pruned. [0m
++++++++++++++++++++
        NaN         
++++++++++++++++++++

Trial Id: 1 | Model params: 426168 | Timestamp: 2022-03-02 05:38:12.346966

epoch 0 -0.9485518212484914 3.6109033881308212
epoch 5 -1.0066375153063518 3.664328094531026
epoch 10 -0.9990920441872966 3.6574321996601586
epoch 15 -0.988996971342814 3.648185808241041
[32m[I 2022-03-02 06:05:26,778][0m Trial 1 finished with value: 3.68487101464919 and parameters: {'n_layers_fe': 2, 'fe_neurons': 256, 'fe_dropout': 0.06187583237615252, 'n_units_l(Invariant)': 475, 'n_layers_mlp': 4, 'lr': 0.0029654792109789782, 'weight_decay': 0.0020776598364404372, 'criterion': 'PoissonNLLLoss', 'batch_size': 32, 'epochs': 20}. Best is trial 1 with value: 3.68487101464919.[0m

Trial Id: 2 | Model params: 266462 | Timestamp: 2022-03-02 06:05:26.778642

epoch 0 -0.10483375294062847 2.718994664972131
epoch 5 0.047432629295112716 2.5246881359037734
epoch 10 0.05115059440952585 2.519756264453162
epoch 15 0.06272361348582267 2.5043425156615498
[32m[I 2022-03-02 06:17:05,552][0m Trial 2 finished with value: 2.522765995034339 and parameters: {'n_layers_fe': 2, 'fe_neurons': 256, 'fe_dropout': 0.41557140592447245, 'n_units_l(Invariant)': 366, 'n_layers_mlp': 2, 'lr': 4.1173613704309106e-05, 'weight_decay': 0.2940872120931186, 'criterion': 'MSELoss', 'batch_size': 256, 'epochs': 20}. Best is trial 2 with value: 2.522765995034339.[0m

Trial Id: 3 | Model params: 25626 | Timestamp: 2022-03-02 06:17:05.552614

epoch 0 -1.070647282801736 3.722313539931099
epoch 5 -1.0222079529938854 3.6785172392302266
epoch 10 -1.0339899244723019 3.6892177312928545
epoch 15 -1.0463831508577361 3.7004399786746887
epoch 20 -1.0383408177134816 3.693161413022364
epoch 25 -1.0261501520337446 3.68210104140937
epoch 30 -1.0401831840363518 3.6948300788689834
epoch 35 -1.0298334460579404 3.685446327224058
epoch 40 -0.9514896185334334 3.61362441064952
epoch 45 -1.0295144305575583 3.6851567072296336
epoch 50 -1.0365073097392457 3.6915000214945026
epoch 55 -1.0510171992849977 3.7046274450056877
[32m[I 2022-03-02 07:36:39,171][0m Trial 3 finished with value: 3.680623319311583 and parameters: {'n_layers_fe': 4, 'fe_neurons': 64, 'fe_dropout': 0.30780989213169613, 'n_units_l(Invariant)': 76, 'n_layers_mlp': 2, 'lr': 0.005197218995939452, 'weight_decay': 0.07031363847022366, 'criterion': 'PoissonNLLLoss', 'batch_size': 32, 'epochs': 60}. Best is trial 2 with value: 2.522765995034339.[0m

Trial Id: 4 | Model params: 345930 | Timestamp: 2022-03-02 07:36:39.171923

epoch 0 -0.1617130007578933 2.7881062081550847
epoch 5 -0.0416629706698719 2.6401189944203005
epoch 10 0.034242700750577004 2.5421073615170795
epoch 15 0.06873742269573035 2.4962953300283646
epoch 20 0.0638653574313559 2.5028167174835567
epoch 25 0.03816919599407742 2.5369343544329657
epoch 30 0.08573253221219801 2.473412333106067
epoch 35 0.08272751155897984 2.477473812923156
epoch 40 0.08686705592101951 2.4718772155849753
epoch 45 0.08337755427572235 2.4765958027075667
epoch 50 0.08670527528114247 2.472096178316003
epoch 55 0.0859725971545674 2.473087582093179
[32m[I 2022-03-02 08:04:20,089][0m Trial 4 finished with value: 2.485145745799281 and parameters: {'n_layers_fe': 2, 'fe_neurons': 256, 'fe_dropout': 0.24695397066124397, 'n_units_l(Invariant)': 164, 'n_layers_mlp': 4, 'lr': 3.3103432489638915e-05, 'weight_decay': 0.09918635153083022, 'criterion': 'MSELoss', 'batch_size': 256, 'epochs': 60}. Best is trial 4 with value: 2.485145745799281.[0m

Trial Id: 5 | Model params: 23114 | Timestamp: 2022-03-02 08:04:20.089449

epoch 0 -1.0387842532873548 3.693563109852911
epoch 5 -1.0667364744001486 3.718796732598388
epoch 10 -1.04809354462428 3.7019860937103193
epoch 15 -1.0469554223082862 3.7009573568898433
epoch 20 -1.0549830814469003 3.7082073809837772
epoch 25 -1.0582031089000088 3.711111506040897
epoch 30 -1.059531276965442 3.7123087117130007
epoch 35 -1.055055977024458 3.708273150265301
[32m[I 2022-03-02 08:51:53,826][0m Trial 5 finished with value: 3.703769063306261 and parameters: {'n_layers_fe': 2, 'fe_neurons': 64, 'fe_dropout': 0.0902711870511046, 'n_units_l(Invariant)': 164, 'n_layers_mlp': 2, 'lr': 0.00097546372355995, 'weight_decay': 0.1719240497654618, 'criterion': 'PoissonNLLLoss', 'batch_size': 32, 'epochs': 40}. Best is trial 4 with value: 2.485145745799281.[0m

Trial Id: 6 | Model params: 136196 | Timestamp: 2022-03-02 08:51:53.827299

epoch 0 -1.0206656575490145 3.6771142078247796
[32m[I 2022-03-02 08:54:47,983][0m Trial 6 pruned. [0m

Trial Id: 7 | Model params: 33942 | Timestamp: 2022-03-02 08:54:47.983475

epoch 0 -1.0130391750205185 3.6701684872641347
[32m[I 2022-03-02 08:55:56,597][0m Trial 7 pruned. [0m

Trial Id: 8 | Model params: 101088 | Timestamp: 2022-03-02 08:55:56.597212

epoch 0 -1.0868204084986997 3.7368221307562273
epoch 5 -1.0538531843997685 3.707187793839433
epoch 10 -1.0715750927930565 3.723147388587657
epoch 15 -1.0332170242944292 3.6885167278279383
epoch 20 -1.0553853073367754 3.708570270598027
epoch 25 -1.0443591749792218 3.6986095653261266
epoch 30 -1.0770682306271162 3.728080403557149
epoch 35 -1.0533036135545029 3.7066917752698765
epoch 40 -1.0540718485238898 3.7073851320433593
epoch 45 -1.0529413307956537 3.706364758419426
epoch 50 -1.0411001685946197 3.6956603282147538
epoch 55 -1.0319349399403381 3.687353611629778
[32m[I 2022-03-02 10:08:17,392][0m Trial 8 finished with value: 3.709722409690209 and parameters: {'n_layers_fe': 2, 'fe_neurons': 128, 'fe_dropout': 0.2584310940709973, 'n_units_l(Invariant)': 431, 'n_layers_mlp': 2, 'lr': 2.223152213510562e-05, 'weight_decay': 0.1765301708203109, 'criterion': 'PoissonNLLLoss', 'batch_size': 32, 'epochs': 60}. Best is trial 4 with value: 2.485145745799281.[0m

Trial Id: 9 | Model params: 74178 | Timestamp: 2022-03-02 10:08:17.392868

[32m[I 2022-03-02 10:08:36,063][0m Trial 9 pruned. [0m
epoch 0 -0.08099427894709388 2.68950023402124

Trial Id: 10 | Model params: 435460 | Timestamp: 2022-03-02 10:08:36.063776

[32m[I 2022-03-02 10:09:17,707][0m Trial 10 pruned. [0m
epoch 0 -0.05901570696724434 2.662018622971731

Trial Id: 11 | Model params: 395466 | Timestamp: 2022-03-02 10:09:17.707232

