[32m[I 2022-03-01 16:07:24,230][0m A new study created in memory with name: DeepSet[0m
Starting Loading des
Finished Loading des
Finished des setup

++++++++ Session Characteristics +++++++

Area: des
Gal Type: elg
Training Set: 270781
Validation Set: 67698
Test Samples: 67698
Number of features: 5
Device: cuda:0
Number of Workers: 8
Number of Trials: 30

+++++++++++++++++++++++++++++++++++++++

Trial Id: 0 | Model params: 83022 | Timestamp: 2022-03-01 16:07:24.231774

epoch 0 0.014172917691889109 7.161028905520065
epoch 5 0.017248954035958497 7.149848042579918
epoch 10 0.019513932499994113 7.141604045523083
epoch 15 0.016115574751707995 7.153969714418665
epoch 20 0.02051205340383444 7.137968094160443
epoch 25 0.025239154851065204 7.120723007909934
epoch 30 0.029004761717792316 7.106955636187118
epoch 35 0.0052101326543329 7.193507999287899
[32m[I 2022-03-01 16:21:33,981][0m Trial 0 finished with value: 7.123825606416691 and parameters: {'n_layers_fe': 4, 'fe_neurons': 128, 'fe_dropout': 0.12605817577732614, 'n_units_l(Invariant)': 38, 'n_layers_mlp': 2, 'lr': 0.0062328388458078796, 'weight_decay': 0.0704029565103942, 'criterion': 'MSELoss', 'batch_size': 256, 'epochs': 40}. Best is trial 0 with value: 7.123825606416691.[0m

Trial Id: 1 | Model params: 56238 | Timestamp: 2022-03-01 16:21:33.981836

epoch 0 0.00021417779451160524 7.2115487099834334
epoch 5 0.02835610352088702 7.109329085199365
epoch 10 0.018591194885218987 7.144963744964518
epoch 15 0.02810290892484235 7.110255312628028
[32m[I 2022-03-01 16:27:49,886][0m Trial 1 finished with value: 7.122333353575092 and parameters: {'n_layers_fe': 2, 'fe_neurons': 128, 'fe_dropout': 0.36453561685609137, 'n_units_l(Invariant)': 86, 'n_layers_mlp': 2, 'lr': 0.00393774808279095, 'weight_decay': 0.06300418484157502, 'criterion': 'MSELoss', 'batch_size': 128, 'epochs': 20}. Best is trial 1 with value: 7.122333353575092.[0m

Trial Id: 2 | Model params: 383598 | Timestamp: 2022-03-01 16:27:49.886779

epoch 0 -0.02357868950114672 7.2968542588337835
epoch 5 0.009955005694038177 7.176331969940192
epoch 10 0.013857563987809907 7.162174175549041
epoch 15 0.012721143736352802 7.166299794697356
epoch 20 0.007648539041280378 7.184686308165431
epoch 25 0.007098805349636583 7.186676085696229
epoch 30 0.009826422792157175 7.176797970796701
epoch 35 -0.009529543878562752 7.246604693042574
[32m[I 2022-03-01 16:50:20,917][0m Trial 2 finished with value: 7.202701132983983 and parameters: {'n_layers_fe': 2, 'fe_neurons': 256, 'fe_dropout': 0.3107211360887992, 'n_units_l(Invariant)': 310, 'n_layers_mlp': 4, 'lr': 0.0007025380593122992, 'weight_decay': 0.2049389007461308, 'criterion': 'MSELoss', 'batch_size': 128, 'epochs': 40}. Best is trial 1 with value: 7.122333353575092.[0m

Trial Id: 3 | Model params: 236792 | Timestamp: 2022-03-01 16:50:20.918247

epoch 0 -0.20587852793703676 7.92003016029258
epoch 5 0.02703537942264478 7.114159184862321
epoch 10 0.021092235654959768 7.1358537568410965
epoch 15 0.028015122228469025 7.110576422617822
epoch 20 0.03608289989903546 7.081004930468754
epoch 25 0.038226018028927555 7.073128799586478
epoch 30 0.036145438534396446 7.080775220067157
epoch 35 0.03946032566057611 7.068588637397306
[32m[I 2022-03-01 17:37:51,085][0m Trial 3 finished with value: 7.068836653229836 and parameters: {'n_layers_fe': 2, 'fe_neurons': 256, 'fe_dropout': 0.1284525730646594, 'n_units_l(Invariant)': 251, 'n_layers_mlp': 2, 'lr': 5.1023353351457756e-05, 'weight_decay': 0.053922977122880446, 'criterion': 'MSELoss', 'batch_size': 32, 'epochs': 40}. Best is trial 3 with value: 7.068836653229836.[0m

Trial Id: 4 | Model params: 75608 | Timestamp: 2022-03-01 17:37:51.085462

epoch 0 -15.693652980433807 29.468005690763537
epoch 5 -15.52373117484684 29.31764722803722
epoch 10 -15.220794633718615 29.047657642141395
epoch 15 -15.162386619449894 28.99531291752422
epoch 20 -15.032844036055849 28.878879480224402
epoch 25 -14.896040522538739 28.755408063500077
epoch 30 -14.741736808502969 28.615502577385964
epoch 35 -14.74351504741009 28.61711878288126
epoch 40 -14.762903594078963 28.634734722529807
epoch 45 -14.745230266475357 28.618677624434135
epoch 50 -14.758896908422889 28.63109523847818
epoch 55 -14.776446293972878 28.647032848935776
[32m[I 2022-03-01 17:58:12,961][0m Trial 4 finished with value: 28.62234175641832 and parameters: {'n_layers_fe': 2, 'fe_neurons': 128, 'fe_dropout': 0.3814845148400454, 'n_units_l(Invariant)': 235, 'n_layers_mlp': 2, 'lr': 0.0032928991495891477, 'weight_decay': 0.03871158594610078, 'criterion': 'PoissonNLLLoss', 'batch_size': 256, 'epochs': 60}. Best is trial 3 with value: 7.068836653229836.[0m

Trial Id: 5 | Model params: 59356 | Timestamp: 2022-03-01 17:58:12.961515

[32m[I 2022-03-01 18:01:47,904][0m Trial 5 pruned. [0m
epoch 0 2.443412470876094e-05 7.212232996942863

Trial Id: 6 | Model params: 564976 | Timestamp: 2022-03-01 18:01:47.904937

epoch 0 -14.708265757561847 28.585064366321486
epoch 5 -14.804898956732526 28.672853530647966
epoch 10 -14.806081124468555 28.673925840209186
epoch 15 -14.775222360876468 28.64592161225366
epoch 20 -14.771104159569667 28.642182287086992
epoch 25 -14.745401633048555 28.61883336275256
epoch 30 -14.794838322739269 28.663726202268077
epoch 35 -14.721144024114086 28.596779557030104
epoch 40 -14.767214681040105 28.63865019379339
epoch 45 -14.775403305424414 28.646085898637544
epoch 50 -14.720232862479145 28.595950842977015
epoch 55 -14.741477971348594 28.615267317903633
[32m[I 2022-03-01 19:13:46,799][0m Trial 6 finished with value: 28.63659297381789 and parameters: {'n_layers_fe': 4, 'fe_neurons': 256, 'fe_dropout': 0.03882176738341986, 'n_units_l(Invariant)': 503, 'n_layers_mlp': 4, 'lr': 0.0013459091203934471, 'weight_decay': 0.19468209557834823, 'criterion': 'PoissonNLLLoss', 'batch_size': 128, 'epochs': 60}. Best is trial 3 with value: 7.068836653229836.[0m

Trial Id: 7 | Model params: 132162 | Timestamp: 2022-03-01 19:13:46.799720

epoch 0 -14.986997521306366 28.837559804478914
epoch 5 -14.755312124635987 28.627838597987523
epoch 10 -14.748822456686753 28.621942037498407
epoch 15 -14.753150443715677 28.625874613560427
epoch 20 -14.73326700976621 28.607803294879716
epoch 25 -14.75948388389554 28.631628448203095
epoch 30 -14.745213744697574 28.618662609361376
epoch 35 -14.771344469726458 28.64240050202702
epoch 40 -14.769320516157306 28.640562588055182
epoch 45 -14.76800028066229 28.639363643600085
epoch 50 -14.761013945202853 28.63301831236089
epoch 55 -14.76085735252959 28.632876071130926
[32m[I 2022-03-01 19:47:47,633][0m Trial 7 finished with value: 28.62280766460984 and parameters: {'n_layers_fe': 4, 'fe_neurons': 128, 'fe_dropout': 0.051503384549000275, 'n_units_l(Invariant)': 416, 'n_layers_mlp': 2, 'lr': 2.9175250361184056e-05, 'weight_decay': 0.11659350735759297, 'criterion': 'PoissonNLLLoss', 'batch_size': 128, 'epochs': 60}. Best is trial 3 with value: 7.068836653229836.[0m

Trial Id: 8 | Model params: 54270 | Timestamp: 2022-03-01 19:47:47.633490

[32m[I 2022-03-01 19:48:07,977][0m Trial 8 pruned. [0m
epoch 0 0.012073746291804133 7.1686490214773295

Trial Id: 9 | Model params: 266978 | Timestamp: 2022-03-01 19:48:07.977854

epoch 0 -14.881340386829711 28.74210896010939
epoch 5 -14.754169137401956 28.626800159419364
epoch 10 -14.735816719014933 28.61012126945043
epoch 15 -14.750416444441306 28.62339045914678
epoch 20 -14.756500546771528 28.628918275599403
epoch 25 -14.700515614799828 28.578011848064424
epoch 30 -14.727797816439294 28.602830544896246
epoch 35 -14.750630722283313 28.623585163124922
[32m[I 2022-03-01 20:11:45,021][0m Trial 9 finished with value: 28.624056321394413 and parameters: {'n_layers_fe': 2, 'fe_neurons': 256, 'fe_dropout': 0.05108732203309729, 'n_units_l(Invariant)': 368, 'n_layers_mlp': 2, 'lr': 4.218650035680353e-05, 'weight_decay': 0.04187241114627649, 'criterion': 'PoissonNLLLoss', 'batch_size': 128, 'epochs': 40}. Best is trial 3 with value: 7.068836653229836.[0m

Trial Id: 10 | Model params: 214346 | Timestamp: 2022-03-01 20:11:45.021300

[32m[I 2022-03-01 20:12:56,532][0m Trial 10 pruned. [0m
epoch 0 0.005381196568316926 7.192889475426801

Trial Id: 11 | Model params: 52468 | Timestamp: 2022-03-01 20:12:56.532915

[32m[I 2022-03-01 20:14:03,817][0m Trial 11 pruned. [0m
epoch 0 -0.08986038154589515 7.529402035696905

Trial Id: 12 | Model params: 207122 | Timestamp: 2022-03-01 20:14:03.818167

[32m[I 2022-03-01 20:15:14,657][0m Trial 12 pruned. [0m
epoch 0 -1.0024517172391674 10.206012149688782

Trial Id: 13 | Model params: 73398 | Timestamp: 2022-03-01 20:15:14.657496

[32m[I 2022-03-01 20:16:22,826][0m Trial 13 pruned. [0m
epoch 0 -0.6502812603515278 9.265183784564897

Trial Id: 14 | Model params: 59618 | Timestamp: 2022-03-01 20:16:22.826202

[32m[I 2022-03-01 20:16:41,668][0m Trial 14 pruned. [0m
epoch 0 -0.9739175749993092 10.133035433302817

Trial Id: 15 | Model params: 249692 | Timestamp: 2022-03-01 20:16:41.668283

[32m[I 2022-03-01 20:17:14,994][0m Trial 15 pruned. [0m
epoch 0 -0.011733287604490883 7.254509837580166

Trial Id: 16 | Model params: 13346 | Timestamp: 2022-03-01 20:17:14.994220

[32m[I 2022-03-01 20:18:21,481][0m Trial 16 pruned. [0m
epoch 0 0.007519171586568785 7.185154607113344

Trial Id: 17 | Model params: 221570 | Timestamp: 2022-03-01 20:18:21.481286

[32m[I 2022-03-01 20:18:50,253][0m Trial 17 pruned. [0m
epoch 0 0.009279108282098436 7.1787811700628135

Trial Id: 18 | Model params: 57018 | Timestamp: 2022-03-01 20:18:50.253685

[32m[I 2022-03-01 20:19:58,118][0m Trial 18 pruned. [0m
epoch 0 -0.35876320052044686 8.407114117558198

Trial Id: 19 | Model params: 146596 | Timestamp: 2022-03-01 20:19:58.118267

[32m[I 2022-03-01 20:21:22,180][0m Trial 19 pruned. [0m
epoch 0 -0.2484374198726933 8.058578542611087

Trial Id: 20 | Model params: 268010 | Timestamp: 2022-03-01 20:21:22.180733

[32m[I 2022-03-01 20:21:57,054][0m Trial 20 pruned. [0m
epoch 0 0.003443963377688042 7.199890914455115

Trial Id: 21 | Model params: 80162 | Timestamp: 2022-03-01 20:21:57.054315

[32m[I 2022-03-01 20:22:17,161][0m Trial 21 pruned. [0m
epoch 0 0.005814938771997902 7.191320934831468

Trial Id: 22 | Model params: 85492 | Timestamp: 2022-03-01 20:22:17.161302

[32m[I 2022-03-01 20:22:38,453][0m Trial 22 pruned. [0m
epoch 0 0.01740521171026388 7.14927960612574

Trial Id: 23 | Model params: 78212 | Timestamp: 2022-03-01 20:22:38.454079

[32m[I 2022-03-01 20:22:58,121][0m Trial 23 pruned. [0m
epoch 0 0.004705486257054803 7.19533236327862

Trial Id: 24 | Model params: 87442 | Timestamp: 2022-03-01 20:22:58.121597

[32m[I 2022-03-01 20:23:20,154][0m Trial 24 pruned. [0m
epoch 0 0.008605068277491523 7.181222807759443

Trial Id: 25 | Model params: 97062 | Timestamp: 2022-03-01 20:23:20.154749

[32m[I 2022-03-01 20:23:44,570][0m Trial 25 pruned. [0m
epoch 0 -0.08567348108665263 7.514925322524859

Trial Id: 26 | Model params: 24764 | Timestamp: 2022-03-01 20:23:44.570506

[32m[I 2022-03-01 20:23:56,975][0m Trial 26 pruned. [0m
epoch 0 -0.016621164455310256 7.272012684818826

Trial Id: 27 | Model params: 84322 | Timestamp: 2022-03-01 20:23:56.975973

epoch 0 -14.758104090736527 28.63037502549883
epoch 5 -14.770048892700062 28.641224026607777
epoch 10 -14.758328580901853 28.630578959128645
epoch 15 -14.749749850881683 28.62278474914269
epoch 20 -14.737685135275651 28.611819752283132
epoch 25 -14.747394888650016 28.620644775569765
epoch 30 -14.741812538597296 28.615571408803028
epoch 35 -14.720944134347562 28.596597756591464
[32m[I 2022-03-01 20:39:27,051][0m Trial 27 finished with value: 28.649070738330618 and parameters: {'n_layers_fe': 4, 'fe_neurons': 128, 'fe_dropout': 0.1381363823383982, 'n_units_l(Invariant)': 48, 'n_layers_mlp': 2, 'lr': 0.0025470362223781583, 'weight_decay': 0.015203759217168773, 'criterion': 'PoissonNLLLoss', 'batch_size': 128, 'epochs': 40}. Best is trial 3 with value: 7.068836653229836.[0m

Trial Id: 28 | Model params: 197060 | Timestamp: 2022-03-01 20:39:27.051487

[32m[I 2022-03-01 20:39:51,146][0m Trial 28 pruned. [0m
epoch 0 -0.19116628197421814 7.871567974063034

Trial Id: 29 | Model params: 371214 | Timestamp: 2022-03-01 20:39:51.146571

[32m[I 2022-03-01 20:41:09,881][0m Trial 29 pruned. [0m
epoch 0 -0.0031078603833942786 7.223519860096863

Study statistics: 
  Number of finished trials:  30
  Number of pruned trials:  21
  Number of complete trials:  9

Best trial:
  Value:  7.068836653229836
  Params: 
    n_layers_fe: 2
    fe_neurons: 256
    fe_dropout: 0.1284525730646594
    n_units_l(Invariant): 251
    n_layers_mlp: 2
    lr: 5.1023353351457756e-05
    weight_decay: 0.053922977122880446
    criterion: MSELoss
    batch_size: 32
    epochs: 40
Target: 67698, NaN: 0, Max: 114.0, Min: 8.0, Mean: 31.138955360571952
Prediction: 67698, NaN: 0, Max: 37.869056701660156, Min: 22.84419822692871, Mean: 31.02249044773163

 XXXXXX======== TRIAL des - elg ended

Test Set - R-squared:  0.03939291952824697
Test Set - RMSE:  7.068836653109233
Test Set - MAE:  5.610933706388434



[32m[I 2022-03-01 20:41:45,414][0m A new study created in memory with name: DeepSet[0m
Starting Loading des
Finished Loading des
Finished des setup

++++++++ Session Characteristics +++++++

Area: des
Gal Type: qso
Training Set: 270781
Validation Set: 67698
Test Samples: 67698
Number of features: 5
Device: cuda:0
Number of Workers: 8
Number of Trials: 30

+++++++++++++++++++++++++++++++++++++++

Trial Id: 0 | Model params: 30836 | Timestamp: 2022-03-01 20:41:45.415282

epoch 0 -0.03622659745597967 2.0256679787435434
epoch 5 -0.014091744327506817 2.0039160275053205
epoch 10 -0.0015692408015850479 1.9915049236298548
epoch 15 0.003728764665256623 1.9862307031906647
[32m[I 2022-03-01 21:04:29,506][0m Trial 0 finished with value: 1.9850604760825605 and parameters: {'n_layers_fe': 2, 'fe_neurons': 64, 'fe_dropout': 0.09464266871663046, 'n_units_l(Invariant)': 281, 'n_layers_mlp': 2, 'lr': 2.9688054073320326e-05, 'weight_decay': 0.1340071114226532, 'criterion': 'MSELoss', 'batch_size': 32, 'epochs': 20}. Best is trial 0 with value: 1.9850604760825605.[0m

Trial Id: 1 | Model params: 157906 | Timestamp: 2022-03-01 21:04:29.506625

epoch 0 0.01752954837067855 1.972425661074762
epoch 5 0.024904764188818374 1.9650084057436197
epoch 10 0.029576769954437254 1.9602952487967176
epoch 15 0.029837015255976818 1.9600323780099975
[32m[I 2022-03-01 21:32:54,972][0m Trial 1 finished with value: 1.960393914473997 and parameters: {'n_layers_fe': 4, 'fe_neurons': 128, 'fe_dropout': 0.16437972501713694, 'n_units_l(Invariant)': 360, 'n_layers_mlp': 4, 'lr': 0.00017949352284268887, 'weight_decay': 0.02462594915260007, 'criterion': 'MSELoss', 'batch_size': 32, 'epochs': 20}. Best is trial 1 with value: 1.960393914473997.[0m

Trial Id: 2 | Model params: 538402 | Timestamp: 2022-03-01 21:32:54.973117

epoch 0 -8.070061145604157e-05 1.9900244781160166
epoch 5 -0.0007041167247789915 1.9906446380921372
epoch 10 -0.00019383937734285261 1.9901370403052516
epoch 15 -0.0049423107625949925 1.9948555852234517
epoch 20 -0.004462233804764182 1.9943790411507287
epoch 25 -0.0004837244089230808 1.9904254189778472
epoch 30 -0.0017374516809354201 1.9916721505756727
epoch 35 -0.01128875483744074 2.0011446597565503
[32m[I 2022-03-01 22:13:04,282][0m Trial 2 finished with value: 1.9926646588514785 and parameters: {'n_layers_fe': 4, 'fe_neurons': 256, 'fe_dropout': 0.4320610090099878, 'n_units_l(Invariant)': 400, 'n_layers_mlp': 4, 'lr': 0.0005089396011891427, 'weight_decay': 0.23531433806827382, 'criterion': 'MSELoss', 'batch_size': 128, 'epochs': 40}. Best is trial 1 with value: 1.960393914473997.[0m

Trial Id: 3 | Model params: 411720 | Timestamp: 2022-03-01 22:13:04.282624

epoch 0 -1.2066980523797182 2.956053916791194
epoch 5 -1.2078743917310533 2.9568417135735396
epoch 10 -1.2021219661832951 2.95298730382756
epoch 15 -1.2087976241984402 2.957459857197518
[32m[I 2022-03-01 22:26:03,426][0m Trial 3 finished with value: 2.9581294423132536 and parameters: {'n_layers_fe': 2, 'fe_neurons': 256, 'fe_dropout': 0.44522248898916555, 'n_units_l(Invariant)': 419, 'n_layers_mlp': 4, 'lr': 0.00032977794718149444, 'weight_decay': 0.04305276721269791, 'criterion': 'PoissonNLLLoss', 'batch_size': 128, 'epochs': 20}. Best is trial 1 with value: 1.960393914473997.[0m

Trial Id: 4 | Model params: 40414 | Timestamp: 2022-03-01 22:26:03.427038

epoch 0 -1.2372607736074022 2.9764541659623975
epoch 5 -1.2648440185385406 2.9947463470142752
epoch 10 -1.247529728959461 2.983277260163382
epoch 15 -1.2241732147018354 2.9677355453842633
epoch 20 -1.275194238593262 3.0015814648590093
epoch 25 -1.2270116953654755 2.9696286475029496
epoch 30 -1.2433286122830673 2.9804877624473276
epoch 35 -1.2397783089024452 2.9781283609590847
[32m[I 2022-03-01 22:42:40,037][0m Trial 4 finished with value: 2.9852792278927742 and parameters: {'n_layers_fe': 4, 'fe_neurons': 64, 'fe_dropout': 0.027050978374795864, 'n_units_l(Invariant)': 174, 'n_layers_mlp': 4, 'lr': 0.0032072555655803334, 'weight_decay': 0.12242607878656081, 'criterion': 'PoissonNLLLoss', 'batch_size': 128, 'epochs': 40}. Best is trial 1 with value: 1.960393914473997.[0m

Trial Id: 5 | Model params: 347220 | Timestamp: 2022-03-01 22:42:40.037894

[32m[I 2022-03-01 22:43:59,400][0m Trial 5 pruned. [0m
epoch 0 -0.035200540980299344 2.024664836901873

Trial Id: 6 | Model params: 49188 | Timestamp: 2022-03-01 22:43:59.400966

epoch 0 -1.295222037338585 3.0147634943723194
epoch 5 -1.2522949639064689 2.9864381727012566
epoch 10 -1.2203011630167873 2.965151162352596
epoch 15 -1.259930572829441 2.991496120351955
[32m[I 2022-03-01 22:52:02,329][0m Trial 6 finished with value: 2.9864590506917876 and parameters: {'n_layers_fe': 4, 'fe_neurons': 64, 'fe_dropout': 0.12776358754445555, 'n_units_l(Invariant)': 433, 'n_layers_mlp': 2, 'lr': 0.00016218235807163688, 'weight_decay': 0.1965044753162068, 'criterion': 'PoissonNLLLoss', 'batch_size': 128, 'epochs': 20}. Best is trial 1 with value: 1.960393914473997.[0m

Trial Id: 7 | Model params: 435976 | Timestamp: 2022-03-01 22:52:02.330075

[32m[I 2022-03-01 22:52:43,914][0m Trial 7 pruned. [0m
epoch 0 -0.01951297034170274 2.009265248331989

Trial Id: 8 | Model params: 145946 | Timestamp: 2022-03-01 22:52:43.914776

epoch 0 -1.2621254641650514 2.992948469266294
epoch 5 -1.2993504760471999 3.017473618780157
epoch 10 -1.2957830668795096 3.0151319267085666
epoch 15 -1.2978117629895256 3.0164638111977866
epoch 20 -1.3033246205150384 3.020080158989265
epoch 25 -1.3029200539732866 3.0198149169492945
epoch 30 -1.3050582107807553 3.021216472288986
epoch 35 -1.301577556646476 3.018934581468992
[32m[I 2022-03-01 23:13:07,876][0m Trial 8 finished with value: 3.0156638557565034 and parameters: {'n_layers_fe': 4, 'fe_neurons': 128, 'fe_dropout': 0.06673769670537616, 'n_units_l(Invariant)': 268, 'n_layers_mlp': 4, 'lr': 0.00010429999226576757, 'weight_decay': 0.29499272728683756, 'criterion': 'PoissonNLLLoss', 'batch_size': 128, 'epochs': 40}. Best is trial 1 with value: 1.960393914473997.[0m

Trial Id: 9 | Model params: 110712 | Timestamp: 2022-03-01 23:13:07.877167

epoch 0 -1.2110658968816468 2.958978014401429
epoch 5 -1.228531233797412 2.9706415957941856
epoch 10 -1.243463814708544 2.980577576106583
epoch 15 -1.2534480116655553 2.9872025186884676
[32m[I 2022-03-01 23:40:43,468][0m Trial 9 pruned. [0m
epoch 20 -1.2402255218682754 2.978425665191338

Trial Id: 10 | Model params: 144382 | Timestamp: 2022-03-01 23:40:43.468706

[32m[I 2022-03-01 23:42:03,604][0m Trial 10 pruned. [0m
epoch 0 0.030203988677009908 1.9596616424584012

Trial Id: 11 | Model params: 34268 | Timestamp: 2022-03-01 23:42:03.604835

[32m[I 2022-03-01 23:43:11,501][0m Trial 11 pruned. [0m
epoch 0 -0.0956817592035395 2.0829704603547787

Trial Id: 12 | Model params: 85878 | Timestamp: 2022-03-01 23:43:11.502030

[32m[I 2022-03-01 23:44:21,338][0m Trial 12 pruned. [0m
epoch 0 -0.1645048868785659 2.1473930981945735

Trial Id: 13 | Model params: 24566 | Timestamp: 2022-03-01 23:44:21.338762

[32m[I 2022-03-01 23:45:29,617][0m Trial 13 pruned. [0m
epoch 0 -0.048192174656867426 2.0373298663530517

Trial Id: 14 | Model params: 88222 | Timestamp: 2022-03-01 23:45:29.618024

[32m[I 2022-03-01 23:45:51,997][0m Trial 14 pruned. [0m
epoch 0 -0.02110459502193507 2.010833030732685

Trial Id: 15 | Model params: 35324 | Timestamp: 2022-03-01 23:45:51.997451

[32m[I 2022-03-01 23:47:00,563][0m Trial 15 pruned. [0m
epoch 0 -0.09580461262729378 2.0830872337142337

Trial Id: 16 | Model params: 108368 | Timestamp: 2022-03-01 23:47:00.563548

[32m[I 2022-03-01 23:48:09,810][0m Trial 16 pruned. [0m
epoch 0 -0.01725954568813637 2.0070434852693575

Trial Id: 17 | Model params: 45232 | Timestamp: 2022-03-01 23:48:09.810957

[32m[I 2022-03-01 23:49:33,862][0m Trial 17 pruned. [0m
epoch 0 -0.12477869601141967 2.1104469324147894

Trial Id: 18 | Model params: 53548 | Timestamp: 2022-03-01 23:49:33.862441

[32m[I 2022-03-01 23:49:54,972][0m Trial 18 pruned. [0m
epoch 0 -0.06128415112912 2.0500135638810617

Trial Id: 19 | Model params: 104598 | Timestamp: 2022-03-01 23:49:54.972618

[32m[I 2022-03-01 23:51:04,871][0m Trial 19 pruned. [0m
epoch 0 -0.03468135076985024 2.0241570521992496

Trial Id: 20 | Model params: 83928 | Timestamp: 2022-03-01 23:51:04.871747

[32m[I 2022-03-01 23:52:14,230][0m Trial 20 pruned. [0m
epoch 0 -0.014349243699232073 2.004170429717365

Trial Id: 21 | Model params: 545368 | Timestamp: 2022-03-01 23:52:14.230773

[32m[I 2022-03-01 23:53:14,634][0m Trial 21 pruned. [0m
epoch 0 -0.014892090919665701 2.0047066418911443

Trial Id: 22 | Model params: 531694 | Timestamp: 2022-03-01 23:53:14.634433

[32m[I 2022-03-01 23:54:12,734][0m Trial 22 pruned. [0m
epoch 0 -0.0174911359241674 2.0072719349430894

Trial Id: 23 | Model params: 538918 | Timestamp: 2022-03-01 23:54:12.734842

