[32m[I 2022-03-02 10:09:52,633][0m Trial 11 pruned. [0m
epoch 0 -0.07775814365966438 2.6854714845367287

Trial Id: 12 | Model params: 390822 | Timestamp: 2022-03-02 10:09:52.634088

[32m[I 2022-03-02 10:10:27,055][0m Trial 12 pruned. [0m
epoch 0 -0.3454102933551937 3.000455994506693

Trial Id: 13 | Model params: 389274 | Timestamp: 2022-03-02 10:10:27.056150

[32m[I 2022-03-02 10:11:01,460][0m Trial 13 pruned. [0m
epoch 0 -0.06710140909586593 2.672161702305469

Trial Id: 14 | Model params: 330192 | Timestamp: 2022-03-02 10:11:01.461168

[32m[I 2022-03-02 10:11:27,741][0m Trial 14 pruned. [0m
epoch 0 -0.5954878140672946 3.26743257452866

Trial Id: 15 | Model params: 269558 | Timestamp: 2022-03-02 10:11:27.741938

[32m[I 2022-03-02 10:12:03,029][0m Trial 15 pruned. [0m
epoch 0 -0.009391007818102315 2.598900211152341

Trial Id: 16 | Model params: 247370 | Timestamp: 2022-03-02 10:12:03.029601

[32m[I 2022-03-02 10:12:35,775][0m Trial 16 pruned. [0m
epoch 0 -0.051592376438357235 2.652672304785604

Trial Id: 17 | Model params: 330450 | Timestamp: 2022-03-02 10:12:35.775880

[32m[I 2022-03-02 10:13:00,487][0m Trial 17 pruned. [0m
epoch 0 -0.5612390193382499 3.2321729183725405

Trial Id: 18 | Model params: 434166 | Timestamp: 2022-03-02 10:13:00.487373

[32m[I 2022-03-02 10:13:42,378][0m Trial 18 pruned. [0m
epoch 0 0.05939035387137859 2.5087916916675805

Trial Id: 19 | Model params: 410430 | Timestamp: 2022-03-02 10:13:42.378417

[32m[I 2022-03-02 10:14:41,257][0m Trial 19 pruned. [0m
epoch 0 -0.07134470440123675 2.6774693147774062

Trial Id: 20 | Model params: 12884 | Timestamp: 2022-03-02 10:14:41.258155

[32m[I 2022-03-02 10:14:51,863][0m Trial 20 pruned. [0m
epoch 0 -0.09389014840662901 2.7054950532435837

Trial Id: 21 | Model params: 25296 | Timestamp: 2022-03-02 10:14:51.863469

epoch 0 -0.99921991938525 3.657549174611091
epoch 5 -1.017820264669667 3.674524338382388
epoch 10 -1.010714322355466 3.6680485419379583
epoch 15 -1.0771234849920077 3.7281299906005554
epoch 20 -1.0173409802764226 3.674087915280087
epoch 25 -1.0636597470271378 3.7160276361732754
epoch 30 -1.0524048623733986 3.705880458761505
epoch 35 -1.0629625539686178 3.7153998661317544
epoch 40 -1.0390953064159674 3.6938448587778954
epoch 45 -1.0953982634078763 3.744494340143367
epoch 50 -1.0652735616236457 3.7174803484418235
epoch 55 -1.0808463818743386 3.7314695200123373
[32m[I 2022-03-02 11:34:42,814][0m Trial 21 finished with value: 3.7011270181101223 and parameters: {'n_layers_fe': 4, 'fe_neurons': 64, 'fe_dropout': 0.31821905865523203, 'n_units_l(Invariant)': 71, 'n_layers_mlp': 2, 'lr': 0.006639164772116637, 'weight_decay': 0.08128859139901201, 'criterion': 'PoissonNLLLoss', 'batch_size': 32, 'epochs': 60}. Best is trial 4 with value: 2.485145745799281.[0m

Trial Id: 22 | Model params: 24108 | Timestamp: 2022-03-02 11:34:42.815142

epoch 0 -1.0042533749288909 3.66215060383004
[32m[I 2022-03-02 11:38:38,925][0m Trial 22 pruned. [0m

Trial Id: 23 | Model params: 29586 | Timestamp: 2022-03-02 11:38:38.925299

[32m[I 2022-03-02 11:39:58,852][0m Trial 23 pruned. [0m
epoch 0 0.012281887511465195 2.570847985710442

Trial Id: 24 | Model params: 37770 | Timestamp: 2022-03-02 11:39:58.852839

epoch 0 -1.150854683667529 3.793721304180416
epoch 5 -1.040228276235835 3.694870910274637
epoch 10 -1.0454850584966695 3.6996278869648003
epoch 15 -1.0426338367461536 3.697048513940089
epoch 20 -1.045755802844882 3.6998727238052664
epoch 25 -1.0424729110243187 3.6969028779703472
epoch 30 -1.0466650709399175 3.700694865550304
epoch 35 -1.045748168362898 3.699865820088321
epoch 40 -1.0417403384128185 3.696239835472617
epoch 45 -1.042244624847679 3.6966962717034537
epoch 50 -1.0423947112544414 3.6968321059860636
epoch 55 -1.0454619425253817 3.6996069822084263
[32m[I 2022-03-02 11:59:47,456][0m Trial 24 finished with value: 3.6950989816224413 and parameters: {'n_layers_fe': 4, 'fe_neurons': 64, 'fe_dropout': 0.438632692716179, 'n_units_l(Invariant)': 260, 'n_layers_mlp': 2, 'lr': 9.038551928910698e-05, 'weight_decay': 0.13004772877259801, 'criterion': 'PoissonNLLLoss', 'batch_size': 256, 'epochs': 60}. Best is trial 4 with value: 2.485145745799281.[0m

Trial Id: 25 | Model params: 84452 | Timestamp: 2022-03-02 11:59:47.456376

[32m[I 2022-03-02 12:00:10,918][0m Trial 25 pruned. [0m
epoch 0 -0.10218572748381538 2.715734316343502

Trial Id: 26 | Model params: 22718 | Timestamp: 2022-03-02 12:00:10.918835

[32m[I 2022-03-02 12:01:19,124][0m Trial 26 pruned. [0m
epoch 0 -0.10704495852326557 2.721714192209758

Trial Id: 27 | Model params: 463840 | Timestamp: 2022-03-02 12:01:19.124309

epoch 0 -1.0678829790539681 3.719828075170549
epoch 5 -1.035729091794642 3.6907946309355015
epoch 10 -1.033258277940544 3.688554147343445
epoch 15 -1.0347773333448527 3.6899317568766605
epoch 20 -1.0304061331480057 3.685966187286654
epoch 25 -1.02869724317677 3.6844147152743694
epoch 30 -1.0390628930892727 3.6938155001021142
epoch 35 -1.0357063922951908 3.6907740536827163
epoch 40 -1.0294901159530632 3.685134632147322
epoch 45 -1.0328768150164946 3.68820812326313
epoch 50 -1.030787981788504 3.686312771890158
epoch 55 -1.0287437973106224 3.6844569896335386
[32m[I 2022-03-02 12:46:49,852][0m Trial 27 finished with value: 3.685476215975079 and parameters: {'n_layers_fe': 4, 'fe_neurons': 256, 'fe_dropout': 0.21721441161551747, 'n_units_l(Invariant)': 111, 'n_layers_mlp': 4, 'lr': 0.00015742300813611254, 'weight_decay': 0.07577424596146434, 'criterion': 'PoissonNLLLoss', 'batch_size': 256, 'epochs': 60}. Best is trial 4 with value: 2.485145745799281.[0m

Trial Id: 28 | Model params: 32090 | Timestamp: 2022-03-02 12:46:49.853000

[32m[I 2022-03-02 12:47:58,106][0m Trial 28 pruned. [0m
epoch 0 -0.1448788800612073 2.7678315827178124

Trial Id: 29 | Model params: 234212 | Timestamp: 2022-03-02 12:47:58.107143

epoch 0 -1.0554954429368602 3.7086696291317693
epoch 5 -1.0522273497315457 3.705720194364486
epoch 10 -1.0330229591949354 3.6883406941240535
epoch 15 -1.0477310549440766 3.7016584741197156
epoch 20 -1.0465218432497787 3.700565374101368
epoch 25 -1.0396127667129038 3.6943135217192267
epoch 30 -1.0380647163017716 3.6929112778135074
epoch 35 -1.03888927900698 3.6936582435403746
[32m[I 2022-03-02 13:07:50,955][0m Trial 29 finished with value: 3.6943519908745683 and parameters: {'n_layers_fe': 2, 'fe_neurons': 256, 'fe_dropout': 0.3060288499494014, 'n_units_l(Invariant)': 241, 'n_layers_mlp': 2, 'lr': 8.848808407887977e-05, 'weight_decay': 0.1130386832960322, 'criterion': 'PoissonNLLLoss', 'batch_size': 256, 'epochs': 40}. Best is trial 4 with value: 2.485145745799281.[0m

Study statistics: 
  Number of finished trials:  30
  Number of pruned trials:  20
  Number of complete trials:  10

Best trial:
  Value:  2.485145745799281
  Params: 
    n_layers_fe: 2
    fe_neurons: 256
    fe_dropout: 0.24695397066124397
    n_units_l(Invariant): 164
    n_layers_mlp: 4
    lr: 3.3103432489638915e-05
    weight_decay: 0.09918635153083022
    criterion: MSELoss
    batch_size: 256
    epochs: 60
Target: 67698, NaN: 0, Max: 52.0, Min: 0.0, Mean: 3.994992466542586
Prediction: 67698, NaN: 0, Max: 5.971026420593262, Min: 2.7288694381713867, Mean: 3.7178013174286404

 XXXXXX======== TRIAL des - rlbg ended

Test Set - R-squared:  0.0770377242812631
Test Set - RMSE:  2.4851457463268027
Test Set - MAE:  1.8862423785923397



[32m[I 2022-03-02 13:08:23,593][0m A new study created in memory with name: DeepSet[0m
Starting Loading des
Finished Loading des
Finished des setup

++++++++ Session Characteristics +++++++

Area: des
Gal Type: lrg
Training Set: 270781
Validation Set: 67698
Test Samples: 67698
Number of features: 5
Device: cuda:0
Number of Workers: 8
Number of Trials: 30

+++++++++++++++++++++++++++++++++++++++

Trial Id: 0 | Model params: 163366 | Timestamp: 2022-03-02 13:08:23.593593

epoch 0 -2.0688820535610746 7.375281111713709
epoch 5 -2.0662031554617823 7.37206138221414
epoch 10 -2.0774734900808656 7.38559756779871
epoch 15 -2.073060615449046 7.380300461555784
epoch 20 -2.0676375171997345 7.373785496025839
[32m[I 2022-03-02 13:44:42,513][0m Trial 0 finished with value: 7.384739596723773 and parameters: {'n_layers_fe': 4, 'fe_neurons': 128, 'fe_dropout': 0.0920732489402094, 'n_units_l(Invariant)': 402, 'n_layers_mlp': 4, 'initialiser': 'uniform', 'lr': 3.339903526403689e-05, 'weight_decay': 0.12905751868593188, 'criterion': 'PoissonNLLLoss', 'batch_size': 32, 'epochs': 25}. Best is trial 0 with value: 7.384739596723773.[0m

Trial Id: 1 | Model params: 453262 | Timestamp: 2022-03-02 13:44:42.513284

epoch 0 -2.4686989432162716 7.841005951998419
epoch 5 -2.084793589204896 7.394376066752916
epoch 10 -2.0736389200239267 7.380994860605679
epoch 15 -2.076125112594747 7.3839794117729705
epoch 20 -2.0746461714020876 7.382204161446458
epoch 25 -2.0792665092203673 7.387748778773881
epoch 30 -2.083311926601268 7.3926000506168625
epoch 35 -2.0727198025312776 7.379891199944669
epoch 40 -2.073123399831904 7.380375853046723
epoch 45 -2.072353256083607 7.379451011161668
epoch 50 -2.0732530485141125 7.380531532755497
epoch 55 -2.0658957529004325 7.371691829507002
epoch 60 -2.0726394139029916 7.379794662796985
epoch 65 -2.0690852848326893 7.375525315126909
epoch 70 -2.075315741452865 7.383007934216274
[32m[I 2022-03-02 14:42:53,018][0m Trial 1 finished with value: 7.368055363704698 and parameters: {'n_layers_fe': 4, 'fe_neurons': 256, 'fe_dropout': 0.47630353498873085, 'n_units_l(Invariant)': 70, 'n_layers_mlp': 4, 'initialiser': 'uniform', 'lr': 1.641332511016133e-05, 'weight_decay': 0.11979514484315003, 'criterion': 'PoissonNLLLoss', 'batch_size': 128, 'epochs': 75}. Best is trial 1 with value: 7.368055363704698.[0m

Trial Id: 2 | Model params: 126446 | Timestamp: 2022-03-02 14:42:53.018583

epoch 0 -2.064654559140057 7.370199504772972
epoch 5 -2.0849578189994467 7.394572896891577
epoch 10 -2.072424345298697 7.379536384864152
epoch 15 -2.081574846883026 7.390517331596201
epoch 20 -2.068075963985297 7.374312431985103
[32m[I 2022-03-02 14:53:44,135][0m Trial 2 finished with value: 7.3995331739182975 and parameters: {'n_layers_fe': 4, 'fe_neurons': 128, 'fe_dropout': 0.3262098311522402, 'n_units_l(Invariant)': 118, 'n_layers_mlp': 4, 'initialiser': 'kaiming_he', 'lr': 0.0017219174408152362, 'weight_decay': 0.15085490839841684, 'criterion': 'PoissonNLLLoss', 'batch_size': 128, 'epochs': 25}. Best is trial 1 with value: 7.368055363704698.[0m

Trial Id: 3 | Model params: 106942 | Timestamp: 2022-03-02 14:53:44.135297

epoch 0 -2.0943447691266366 7.405814503574594
epoch 5 -2.084220279248445 7.393688911148507
epoch 10 -2.116783214220854 7.432617398859131
epoch 15 -2.0965807551339086 7.408489756085911
epoch 20 -2.119893546556061 7.436325091053731
epoch 25 -2.090303185846896 7.400976484845801
epoch 30 -2.1178202920399194 7.433853859821029
epoch 35 -2.067235738619375 7.373302595737828
epoch 40 -2.093355789293952 7.404630927236389
epoch 45 -2.0702806148401804 7.3769614642820365
[32m[I 2022-03-02 15:16:41,636][0m Trial 3 finished with value: 7.422666020792275 and parameters: {'n_layers_fe': 4, 'fe_neurons': 128, 'fe_dropout': 0.002226525192441098, 'n_units_l(Invariant)': 222, 'n_layers_mlp': 2, 'initialiser': 'uniform', 'lr': 0.0009424631714254792, 'weight_decay': 0.27880378981906695, 'criterion': 'PoissonNLLLoss', 'batch_size': 256, 'epochs': 50}. Best is trial 1 with value: 7.368055363704698.[0m

Trial Id: 4 | Model params: 118906 | Timestamp: 2022-03-02 15:16:41.636552

epoch 0 -2.0469173379336536 7.348840399383919
epoch 5 -2.0927438029643852 7.403898428719848
epoch 10 -2.070754234077619 7.377530424675484
epoch 15 -2.0720319023925655 7.379065073146805
epoch 20 -2.0677704144363545 7.373945219118462
epoch 25 -2.0727693735780783 7.379950728225822
epoch 30 -2.079130793352682 7.387585972829585
epoch 35 -2.0799966091938957 7.388624551541484
epoch 40 -2.068075963985297 7.374312431985103
epoch 45 -2.0593677083616577 7.363839576844988
[32m[I 2022-03-02 16:28:19,650][0m Trial 4 finished with value: 7.3622569783856795 and parameters: {'n_layers_fe': 4, 'fe_neurons': 128, 'fe_dropout': 0.3781299338036801, 'n_units_l(Invariant)': 60, 'n_layers_mlp': 4, 'initialiser': 'kaiming_he', 'lr': 0.00024087977142168938, 'weight_decay': 0.05076717098299192, 'criterion': 'PoissonNLLLoss', 'batch_size': 32, 'epochs': 50}. Best is trial 4 with value: 7.3622569783856795.[0m

Trial Id: 5 | Model params: 93552 | Timestamp: 2022-03-02 16:28:19.650747

epoch 0 -2.2561806978762315 7.597010528643109
epoch 5 -2.078017123948478 7.386249869708779
epoch 10 -2.0555734450495557 7.35927180053164
epoch 15 -2.0693725821320026 7.375870518782156
epoch 20 -2.078895301720817 7.387303466489708
epoch 25 -2.0724440744025157 7.379560078109189
epoch 30 -2.0767430170014647 7.38472098829383
epoch 35 -2.0641129031003023 7.369548160647729
epoch 40 -2.0617472667292356 7.366702795950419
epoch 45 -2.075254881817014 7.3829348800268555
epoch 50 -2.0738258343474296 7.3812192839558834
epoch 55 -2.0678244865931767 7.3740102049732466
epoch 60 -2.069770088579165 7.376348118207583
epoch 65 -2.067298453159302 7.373377974834149
epoch 70 -2.0669581142427846 7.372968898716591
[32m[I 2022-03-02 16:55:54,906][0m Trial 5 finished with value: 7.374514246232876 and parameters: {'n_layers_fe': 2, 'fe_neurons': 128, 'fe_dropout': 0.0967126823468471, 'n_units_l(Invariant)': 119, 'n_layers_mlp': 4, 'initialiser': 'kaiming_he', 'lr': 1.656007997843504e-05, 'weight_decay': 0.06670368154960968, 'criterion': 'PoissonNLLLoss', 'batch_size': 128, 'epochs': 75}. Best is trial 4 with value: 7.3622569783856795.[0m

Trial Id: 6 | Model params: 87698 | Timestamp: 2022-03-02 16:55:54.906248

epoch 0 -3.8650240937886213 9.286049133486927
epoch 5 -3.8650160199818835 9.286041428098862
epoch 10 -3.8651165034275534 9.28613732589421
epoch 15 -4.510236150794084 9.882653880573445
[32m[I 2022-03-02 17:02:02,688][0m Trial 6 pruned. [0m
++++++++++++++++++++
        NaN         
++++++++++++++++++++

Trial Id: 7 | Model params: 36050 | Timestamp: 2022-03-02 17:02:02.688667

epoch 0 -2.5173550048431865 7.895808039325506
epoch 5 -2.106510625804209 7.4203587285814185
epoch 10 -2.0474222345023656 7.349449252561177
epoch 15 -2.0682944198294733 7.374574963452902
epoch 20 -2.0667332325829517 7.372698585947909
epoch 25 -2.0788985541071714 7.387307368272052
epoch 30 -2.0728504232465554 7.380048057140389
epoch 35 -2.0776898967930597 7.385857239375987
epoch 40 -2.070949915431485 7.377765484539217
epoch 45 -2.0615381642704547 7.366451236655215
[32m[I 2022-03-02 17:16:13,025][0m Trial 7 finished with value: 7.377841157728108 and parameters: {'n_layers_fe': 2, 'fe_neurons': 64, 'fe_dropout': 0.3682363632635861, 'n_units_l(Invariant)': 360, 'n_layers_mlp': 2, 'initialiser': 'kaiming_he', 'lr': 3.1333328880902295e-05, 'weight_decay': 0.09527241330737507, 'criterion': 'PoissonNLLLoss', 'batch_size': 256, 'epochs': 50}. Best is trial 4 with value: 7.3622569783856795.[0m

Trial Id: 8 | Model params: 368118 | Timestamp: 2022-03-02 17:16:13.025718

epoch 0 -2.327745034170654 7.680040345892324
epoch 5 -2.114269731505358 7.429619833420198
epoch 10 -2.084782078261804 7.394362270639976
epoch 15 -2.0747361446953465 7.38231217328324
epoch 20 -2.0658852423666425 7.371679193643177
epoch 25 -2.071030528480085 7.377862317812464
epoch 30 -2.0850752929634147 7.394713686745365
epoch 35 -2.094332121352418 7.4057993683565675
epoch 40 -2.0762953009170624 7.384183670319215
epoch 45 -2.0738625135480904 7.38126332295324
[32m[I 2022-03-02 18:00:31,569][0m Trial 8 finished with value: 7.39381292124353 and parameters: {'n_layers_fe': 4, 'fe_neurons': 256, 'fe_dropout': 0.24487006912872278, 'n_units_l(Invariant)': 250, 'n_layers_mlp': 2, 'initialiser': 'xavier', 'lr': 1.612811849750179e-05, 'weight_decay': 0.19590214232680972, 'criterion': 'PoissonNLLLoss', 'batch_size': 128, 'epochs': 50}. Best is trial 4 with value: 7.3622569783856795.[0m

Trial Id: 9 | Model params: 26616 | Timestamp: 2022-03-02 18:00:31.569305

[32m[I 2022-03-02 18:00:45,664][0m Trial 9 pruned. [0m
epoch 0 -0.002001902048170523 4.214273841965097

Trial Id: 10 | Model params: 79252 | Timestamp: 2022-03-02 18:00:45.664235

[32m[I 2022-03-02 18:02:02,044][0m Trial 10 pruned. [0m
epoch 0 -0.003622136926203723 4.217679701484263

Trial Id: 11 | Model params: 437524 | Timestamp: 2022-03-02 18:02:02.044216

[32m[I 2022-03-02 18:03:31,484][0m Trial 11 pruned. [0m
epoch 0 -2.078159875484244 7.3864211465804015

Trial Id: 12 | Model params: 559300 | Timestamp: 2022-03-02 18:03:31.484288

[32m[I 2022-03-02 18:05:01,337][0m Trial 12 pruned. [0m
epoch 0 -0.9934998318573627 5.944243358290714

Trial Id: 13 | Model params: 481384 | Timestamp: 2022-03-02 18:05:01.337759

[32m[I 2022-03-02 18:05:53,283][0m Trial 13 pruned. [0m
epoch 0 -2.075581074292352 7.383326423823824

Trial Id: 14 | Model params: 449908 | Timestamp: 2022-03-02 18:05:53.283679

epoch 0 -2.2965471321406707 7.643955044555765
epoch 5 -2.068838773421784 7.375229105101256
epoch 10 -2.071706009006326 7.378673662451677
epoch 15 -2.0629151118653914 7.36810760618754
epoch 20 -2.07046820643049 7.377186823942743
epoch 25 -2.0528766076168345 7.356023451060032
epoch 30 -2.0761319668144522 7.383987638257126
epoch 35 -2.066972118066541 7.372985731297166
epoch 40 -2.0642269733399363 7.369685335472474
epoch 45 -2.0893545175535517 7.399840413362269
[32m[I 2022-03-02 18:44:15,609][0m Trial 14 finished with value: 7.359932378242359 and parameters: {'n_layers_fe': 4, 'fe_neurons': 256, 'fe_dropout': 0.49268449101898226, 'n_units_l(Invariant)': 57, 'n_layers_mlp': 4, 'initialiser': 'kaiming_he', 'lr': 0.002075673522730702, 'weight_decay': 0.050914126737914595, 'criterion': 'PoissonNLLLoss', 'batch_size': 128, 'epochs': 50}. Best is trial 14 with value: 7.359932378242359.[0m

Trial Id: 15 | Model params: 441910 | Timestamp: 2022-03-02 18:44:15.609566

[32m[I 2022-03-02 18:45:41,975][0m Trial 15 pruned. [0m
epoch 0 -2.1407110316012696 7.461093277374374

Trial Id: 16 | Model params: 39556 | Timestamp: 2022-03-02 18:45:41.975743

[32m[I 2022-03-02 18:47:06,998][0m Trial 16 pruned. [0m
epoch 0 -2.067301432705781 7.373381556050223

Trial Id: 17 | Model params: 452488 | Timestamp: 2022-03-02 18:47:06.998278

[32m[I 2022-03-02 18:47:53,354][0m Trial 17 pruned. [0m
epoch 0 -0.0003427698149893743 4.210783362386376

Trial Id: 18 | Model params: 135286 | Timestamp: 2022-03-02 18:47:53.354554

[32m[I 2022-03-02 18:48:21,021][0m Trial 18 pruned. [0m
epoch 0 -2.0651377621893 7.370780510305443

Trial Id: 19 | Model params: 117082 | Timestamp: 2022-03-02 18:48:21.021749

[32m[I 2022-03-02 18:49:40,499][0m Trial 19 pruned. [0m
epoch 0 -2.0949613578991126 7.406552319648982

Trial Id: 20 | Model params: 447844 | Timestamp: 2022-03-02 18:49:40.499631

[32m[I 2022-03-02 18:51:10,865][0m Trial 20 pruned. [0m
epoch 0 -2.0808812333578417 7.389685540787776

Trial Id: 21 | Model params: 435460 | Timestamp: 2022-03-02 18:51:10.866166

[32m[I 2022-03-02 18:51:54,525][0m Trial 21 pruned. [0m
epoch 0 -2.1574791886508993 7.480984034420747

Trial Id: 22 | Model params: 464356 | Timestamp: 2022-03-02 18:51:54.525826

epoch 0 -3.745976014386656 9.171729739489075
epoch 5 -2.2014453984518556 7.5328883259622765
epoch 10 -2.105568765458948 7.419233757142539
[32m[I 2022-03-02 19:03:01,159][0m Trial 22 pruned. [0m
++++++++++++++++++++
        NaN         
++++++++++++++++++++

Trial Id: 23 | Model params: 451456 | Timestamp: 2022-03-02 19:03:01.159684

epoch 0 -2.6003011299595675 7.988364865850181
epoch 5 -2.100982085752505 7.4137529216587525
epoch 10 -2.0768918376954524 7.384899583972297
epoch 15 -2.0823239839829792 7.391415601888611
epoch 20 -2.08270742958565 7.391875339035879
epoch 25 -2.0746319784694722 7.382187122860342
epoch 30 -2.0719559289569665 7.378973827936948
epoch 35 -2.075266303128375 7.382948589901804
epoch 40 -2.0743685207769906 7.381870835307302
epoch 45 -2.0766083628028675 7.38455938972009
[32m[I 2022-03-02 19:41:10,376][0m Trial 23 finished with value: 7.384372916876157 and parameters: {'n_layers_fe': 4, 'fe_neurons': 256, 'fe_dropout': 0.45347313101490266, 'n_units_l(Invariant)': 63, 'n_layers_mlp': 4, 'initialiser': 'uniform', 'lr': 1.0800733115556709e-05, 'weight_decay': 0.13814538036186463, 'criterion': 'PoissonNLLLoss', 'batch_size': 128, 'epochs': 50}. Best is trial 14 with value: 7.359932378242359.[0m

Trial Id: 24 | Model params: 473128 | Timestamp: 2022-03-02 19:41:10.376945

[32m[I 2022-03-02 19:42:00,636][0m Trial 24 pruned. [0m
epoch 0 -2.236994924098456 7.574596253422543

Trial Id: 25 | Model params: 455584 | Timestamp: 2022-03-02 19:42:00.637151

[32m[I 2022-03-02 19:42:48,220][0m Trial 25 pruned. [0m
epoch 0 -2.070643152447636 7.377396985876134

Trial Id: 26 | Model params: 31702 | Timestamp: 2022-03-02 19:42:48.220700

[32m[I 2022-03-02 19:43:13,159][0m Trial 26 pruned. [0m
epoch 0 -2.0598803347386765 7.364456491947421

Trial Id: 27 | Model params: 492478 | Timestamp: 2022-03-02 19:43:13.160007

[32m[I 2022-03-02 19:44:05,881][0m Trial 27 pruned. [0m
epoch 0 0.00031394399452078225 4.209400969441087

Trial Id: 28 | Model params: 111366 | Timestamp: 2022-03-02 19:44:05.882134

[32m[I 2022-03-02 19:45:31,080][0m Trial 28 pruned. [0m
epoch 0 -2.0690673638197947 7.375503781499629

Trial Id: 29 | Model params: 167266 | Timestamp: 2022-03-02 19:45:31.080558

