[32m[I 2022-02-27 06:12:12,400][0m Trial 3 finished with value: 24.0694760597499 and parameters: {'n_layers_mlp': 4, 'mlp_n_units_l0': 31, 'mlp_dropout_l0': 0.27539813542496194, 'mlp_n_units_l1': 16, 'mlp_dropout_l1': 0.14571987893453733, 'mlp_n_units_l2': 18, 'mlp_dropout_l2': 0.08928469662915611, 'mlp_n_units_l3': 51, 'mlp_dropout_l3': 0.12538402318670872, 'lr': 2.1308494685446086e-05, 'weight_decay': 0.22899522596806085, 'criterion': 'PoissonNLLLoss', 'batch_size': 32}. Best is trial 0 with value: 9.240394751339004.[0m
Trial Id: 4 | Model params: 1479 | Timestamp: 2022-02-27 06:12:12.401060

epoch 0 -6.466707336417617 26.721663335100637
epoch 5 -5.135784029487965 24.223336141021758
epoch 10 -5.075885637515294 24.104810347567334
epoch 15 -5.077856393787092 24.10871931306718
epoch 20 -5.073308716544392 24.09969810693205
epoch 25 -5.062741309150959 24.078722538523945
epoch 30 -5.067085613577447 24.08734789159037
epoch 35 -5.059028927947102 24.071349381688925
epoch 40 -5.063794987556842 24.08081483691089
epoch 45 -5.062624867711151 24.078491308586813
epoch 50 -5.062264553987752 24.07777578190031
epoch 55 -5.059395461358158 24.072077453833256
epoch 60 -5.060325842446348 24.073925439009916
epoch 65 -5.0598449682148265 24.07297031214474
epoch 70 -5.05826843565871 24.069838689938944
epoch 75 -5.055096015934602 24.06353576436714
epoch 80 -5.060329892673947 24.07393348353289
epoch 85 -5.060713786361482 24.07469595726865
epoch 90 -5.052483010437243 24.058343036116547
epoch 95 -5.05883127158799 24.070956753254787
[32m[I 2022-02-27 06:20:04,710][0m Trial 4 finished with value: 24.064706497624847 and parameters: {'n_layers_mlp': 2, 'mlp_n_units_l0': 52, 'mlp_dropout_l0': 0.1559234035187301, 'mlp_n_units_l1': 11, 'mlp_dropout_l1': 0.0912971948736529, 'lr': 4.4481914112808034e-05, 'weight_decay': 0.1362942435124419, 'criterion': 'PoissonNLLLoss', 'batch_size': 128}. Best is trial 0 with value: 9.240394751339004.[0m
Trial Id: 5 | Model params: 4736 | Timestamp: 2022-02-27 06:20:04.710187

epoch 0 -6.644520990483859 27.037968778307533
epoch 5 -5.064545494220543 24.08230501367833
epoch 10 -5.057814482250115 24.068936881928376
epoch 15 -5.053137339540282 24.05964346509334
epoch 20 -5.05400314305648 24.061364075242558
epoch 25 -5.057985975505274 24.06927756841966
epoch 30 -5.055352871876258 24.06404614410148
epoch 35 -5.055946121101716 24.06522490505872
epoch 40 -5.053233641501739 24.059834851932287
epoch 45 -5.063954606782295 24.081131778341597
epoch 50 -5.054606727578607 24.06256350515895
epoch 55 -5.063215837475742 24.079664836052196
epoch 60 -5.071235237234793 24.09558383466976
epoch 65 -5.06025065948188 24.073776110843294
epoch 70 -5.055813456545797 24.06496131124562
epoch 75 -5.051394200241026 24.05617895342955
epoch 80 -5.047659246061638 24.048754003805367
epoch 85 -5.057097086579751 24.067511659812453
epoch 90 -5.057106845730567 24.0675310485046
epoch 95 -5.0527048897795614 24.058784012191953
[32m[I 2022-02-27 06:29:37,517][0m Trial 5 finished with value: 24.073974147256987 and parameters: {'n_layers_mlp': 4, 'mlp_n_units_l0': 54, 'mlp_dropout_l0': 0.042501854566556974, 'mlp_n_units_l1': 48, 'mlp_dropout_l1': 0.29830572447179726, 'mlp_n_units_l2': 13, 'mlp_dropout_l2': 0.012713610320330958, 'mlp_n_units_l3': 36, 'mlp_dropout_l3': 0.028744411308673178, 'lr': 0.000171713694308163, 'weight_decay': 0.22874732294224423, 'criterion': 'PoissonNLLLoss', 'batch_size': 128}. Best is trial 0 with value: 9.240394751339004.[0m
Trial Id: 6 | Model params: 2013 | Timestamp: 2022-02-27 06:29:37.517949

[32m[I 2022-02-27 06:29:40,270][0m Trial 6 pruned. [0m
epoch 0 0.08283877953445451 9.356163176020496
Trial Id: 7 | Model params: 3027 | Timestamp: 2022-02-27 06:29:40.270432

[32m[I 2022-02-27 06:29:44,752][0m Trial 7 pruned. [0m
epoch 0 0.07923820880489851 9.383666579302858
Trial Id: 8 | Model params: 3942 | Timestamp: 2022-02-27 06:29:44.752405

[32m[I 2022-02-27 06:29:49,500][0m Trial 8 pruned. [0m
epoch 0 0.06311026694017119 9.465491358644112
Trial Id: 9 | Model params: 6521 | Timestamp: 2022-02-27 06:29:49.501041

[32m[I 2022-02-27 06:29:55,172][0m Trial 9 pruned. [0m
epoch 0 0.01922371985504423 9.6846493394731
Trial Id: 10 | Model params: 6842 | Timestamp: 2022-02-27 06:29:55.172840

[32m[I 2022-02-27 06:30:14,053][0m Trial 10 pruned. [0m
epoch 0 0.034327588264815745 9.609009823313645
Trial Id: 11 | Model params: 7642 | Timestamp: 2022-02-27 06:30:14.054089

[32m[I 2022-02-27 06:30:33,450][0m Trial 11 pruned. [0m
epoch 0 -5.088165748330109 24.127201927954737
Trial Id: 12 | Model params: 8300 | Timestamp: 2022-02-27 06:30:33.450585

[32m[I 2022-02-27 06:30:52,664][0m Trial 12 pruned. [0m
epoch 0 -5.066397905191572 24.08403067885354
Trial Id: 13 | Model params: 6600 | Timestamp: 2022-02-27 06:30:52.664503

[32m[I 2022-02-27 06:30:56,523][0m Trial 13 pruned. [0m
epoch 0 0.08651483744733246 9.337394212917896
Trial Id: 14 | Model params: 6413 | Timestamp: 2022-02-27 06:30:56.524128

[32m[I 2022-02-27 06:31:17,791][0m Trial 14 pruned. [0m
epoch 0 -5.043365870204593 24.03826779342658
Trial Id: 15 | Model params: 4952 | Timestamp: 2022-02-27 06:31:17.791818

[32m[I 2022-02-27 06:31:37,665][0m Trial 15 pruned. [0m
epoch 0 0.091913521152023 9.318099205000252
Trial Id: 16 | Model params: 5680 | Timestamp: 2022-02-27 06:31:37.665588

[32m[I 2022-02-27 06:31:56,884][0m Trial 16 pruned. [0m
epoch 0 0.08858520301349448 9.335159932984288
Trial Id: 17 | Model params: 4957 | Timestamp: 2022-02-27 06:31:56.884213

[32m[I 2022-02-27 06:32:00,412][0m Trial 17 pruned. [0m
epoch 0 -5.05783548274355 24.04549285191764
Trial Id: 18 | Model params: 8332 | Timestamp: 2022-02-27 06:32:00.412289

[32m[I 2022-02-27 06:32:18,950][0m Trial 18 pruned. [0m
epoch 0 0.08147804840935724 9.371486743603358
Trial Id: 19 | Model params: 6055 | Timestamp: 2022-02-27 06:32:18.950704

[32m[I 2022-02-27 06:32:38,604][0m Trial 19 pruned. [0m
epoch 0 -5.078916591106968 24.10886790810729
Trial Id: 20 | Model params: 2551 | Timestamp: 2022-02-27 06:32:38.604863

[32m[I 2022-02-27 06:32:57,453][0m Trial 20 pruned. [0m
epoch 0 0.06381210561607553 9.461178490704869
Trial Id: 21 | Model params: 3306 | Timestamp: 2022-02-27 06:32:57.453982

[32m[I 2022-02-27 06:33:12,854][0m Trial 21 pruned. [0m
epoch 0 -5.0908872072185165 24.132593851788894
Trial Id: 22 | Model params: 3601 | Timestamp: 2022-02-27 06:33:12.855155

[32m[I 2022-02-27 06:33:27,923][0m Trial 22 pruned. [0m
epoch 0 -5.049062684999164 24.04959503271258
Trial Id: 23 | Model params: 3507 | Timestamp: 2022-02-27 06:33:27.923590

[32m[I 2022-02-27 06:33:43,291][0m Trial 23 pruned. [0m
epoch 0 -5.0159432149426655 23.98366720803364
Trial Id: 24 | Model params: 3425 | Timestamp: 2022-02-27 06:33:43.291397

[32m[I 2022-02-27 06:33:58,829][0m Trial 24 pruned. [0m
epoch 0 -5.12963225706067 24.209227705122753
Study statistics: 
  Number of finished trials:  25
  Number of pruned trials:  19
  Number of complete trials:  6

Best trial:
  Value:  9.240394751339004
  Params: 
    n_layers_mlp: 4
    mlp_n_units_l0: 30
    mlp_dropout_l0: 0.10360829865405645
    mlp_n_units_l1: 72
    mlp_dropout_l1: 0.21846334206425938
    mlp_n_units_l2: 45
    mlp_dropout_l2: 0.19632682568179294
    mlp_n_units_l3: 29
    mlp_dropout_l3: 0.020884445732242806
    lr: 0.0018021501006259275
    weight_decay: 0.0766406573584813
    criterion: MSELoss
    batch_size: 32
Target: 72616, NaN: 0, Max: 105.0, Min: 1.0, Mean: 25.19630659909662
Prediction: 72616, NaN: 0, Max: 37.40652084350586, Min: 21.29096031188965, Mean: 26.326108098673615

 XXXXXX======== TRIAL north - rlbg ended

Test Set - R-squared:  0.10714464546759828
Test Set - RMSE:  9.247094752088213
Test Set - MAE:  7.305564280949436



