[32m[I 2022-02-27 00:23:54,215][0m Trial 1 finished with value: 2.3460829974887774 and parameters: {'n_layers_mlp': 4, 'mlp_n_units_l0': 68, 'mlp_dropout_l0': 0.11829427265413085, 'mlp_n_units_l1': 46, 'mlp_dropout_l1': 0.12491662296134984, 'mlp_n_units_l2': 56, 'mlp_dropout_l2': 0.12108876488390424, 'mlp_n_units_l3': 15, 'mlp_dropout_l3': 0.1583365398360761, 'lr': 0.0010011042073348102, 'weight_decay': 0.1262671807556401, 'criterion': 'MSELoss', 'batch_size': 32}. Best is trial 0 with value: 2.336807979413138.[0m
Trial Id: 2 | Model params: 2471 | Timestamp: 2022-02-27 00:23:54.216117

epoch 0 -2.961016861305308 4.855380268085831
epoch 5 -1.6645993678690365 3.9823173302690225
epoch 10 -1.5521675833255957 3.8973956630845534
epoch 15 -1.517901613913534 3.871143598448426
epoch 20 -1.5074841022743133 3.863127105169558
epoch 25 -1.5006795588983 3.857881872755231
epoch 30 -1.5012178378890964 3.8582970609020237
epoch 35 -1.5018199548484144 3.8587614359483777
epoch 40 -1.5000420940765369 3.857390122279155
epoch 45 -1.5015234318869495 3.858532753370285
epoch 50 -1.5025778022041512 3.859345836660045
epoch 55 -1.4976703407096514 3.8555599633211495
epoch 60 -1.50026964075527 3.857565662591382
epoch 65 -1.500145750760077 3.8574700889572453
epoch 70 -1.499166182533704 3.8567143279524765
epoch 75 -1.49580290315554 3.8541183471746905
epoch 80 -1.4973297415299593 3.855297069273118
epoch 85 -1.4971552712099325 3.855162396095858
epoch 90 -1.498399147331396 3.8561224380067234
epoch 95 -1.4974996775008727 3.8554282378758837
[32m[I 2022-02-27 00:29:42,270][0m Trial 2 finished with value: 3.856789299463728 and parameters: {'n_layers_mlp': 4, 'mlp_n_units_l0': 12, 'mlp_dropout_l0': 0.20079956767355098, 'mlp_n_units_l1': 56, 'mlp_dropout_l1': 0.1602190256044391, 'mlp_n_units_l2': 12, 'mlp_dropout_l2': 0.24641199825419635, 'mlp_n_units_l3': 61, 'mlp_dropout_l3': 0.11844763199804136, 'lr': 1.2846959518783889e-05, 'weight_decay': 0.17872803287722683, 'criterion': 'PoissonNLLLoss', 'batch_size': 256}. Best is trial 0 with value: 2.336807979413138.[0m
Trial Id: 3 | Model params: 5824 | Timestamp: 2022-02-27 00:29:42.270331

epoch 0 0.02863274255511561 2.404427207635843
epoch 5 0.06894016680417803 2.354012144548208
epoch 10 0.07719231293965034 2.343556915690335
epoch 15 0.07829608295480217 2.3421549324528432
epoch 20 0.0764767393989465 2.34446537276789
epoch 25 0.07798183737104958 2.3425541653882416
epoch 30 0.0795166754354234 2.3406035862230263
epoch 35 0.07840197642361546 2.3420203848883987
epoch 40 0.07830083489229167 2.342148894837092
epoch 45 0.07481827495470772 2.346569525732135
epoch 50 0.0782785904933695 2.3421771575186603
epoch 55 0.07919156433562224 2.341016895734446
epoch 60 0.07185382127912232 2.350325940856366
epoch 65 0.07314574217253522 2.3486896185687174
epoch 70 0.07645725838995165 2.3444900999794873
epoch 75 0.07984829974801166 2.3401819213443327
epoch 80 0.07409141105396455 2.347491129433443
epoch 85 0.07832543082665266 2.3421176440087383
epoch 90 0.07619969616676303 2.344816998757279
epoch 95 0.07677917567599168 2.3440814574573796
[32m[I 2022-02-27 00:35:25,388][0m Trial 3 finished with value: 2.340366839999919 and parameters: {'n_layers_mlp': 4, 'mlp_n_units_l0': 75, 'mlp_dropout_l0': 0.22978960535112863, 'mlp_n_units_l1': 35, 'mlp_dropout_l1': 0.19137855181210142, 'mlp_n_units_l2': 38, 'mlp_dropout_l2': 0.280109210009847, 'mlp_n_units_l3': 13, 'mlp_dropout_l3': 0.12109714699811858, 'lr': 0.000143027468081154, 'weight_decay': 0.1499010666299719, 'criterion': 'MSELoss', 'batch_size': 256}. Best is trial 0 with value: 2.336807979413138.[0m
Trial Id: 4 | Model params: 3801 | Timestamp: 2022-02-27 00:35:25.388214

epoch 0 -1.5152229687081564 3.8745226392678984
epoch 5 -1.4403824617703065 3.8164440975863676
epoch 10 -1.5074761270630255 3.8685513076945703
epoch 15 -1.5293153161938147 3.885361609304294
epoch 20 -1.5237293591090193 3.8810688548051466
epoch 25 -1.4989270649130826 3.861950901227245
epoch 30 -1.4965287052906882 3.8600971915491793
epoch 35 -1.491348006276327 3.856089949970069
epoch 40 -1.5368435727051888 3.891139510154877
epoch 45 -1.5620940560812984 3.910456797398486
epoch 50 -1.5373310993106841 3.89151338872662
epoch 55 -1.5657385795373484 3.9132370791932733
epoch 60 -1.5150160052373711 3.8743632297126918
epoch 65 -1.5012666135801709 3.863758298581442
epoch 70 -1.5227742187125326 3.8803343631220497
epoch 75 -1.51160121227811 3.87173210487092
epoch 80 -1.5064266716337182 3.8677416694663798
epoch 85 -1.514530202803702 3.873989024144741
epoch 90 -1.50884467433472 3.869606865729284
epoch 95 -1.4716656423949748 3.8408276376823376
[32m[I 2022-02-27 01:01:02,579][0m Trial 4 finished with value: 3.8741942643338656 and parameters: {'n_layers_mlp': 2, 'mlp_n_units_l0': 69, 'mlp_dropout_l0': 0.22847439990760737, 'mlp_n_units_l1': 37, 'mlp_dropout_l1': 0.257798254672437, 'lr': 0.00048224947022511674, 'weight_decay': 0.2894649487126483, 'criterion': 'PoissonNLLLoss', 'batch_size': 32}. Best is trial 0 with value: 2.336807979413138.[0m
Trial Id: 5 | Model params: 3999 | Timestamp: 2022-02-27 01:01:02.579912

epoch 0 -1.4524157079895978 3.8258417513589795
epoch 5 -1.4380754162973615 3.814639709931895
epoch 10 -1.4373370247961215 3.8140620184419864
epoch 15 -1.444713445725109 3.8198291471352888
epoch 20 -1.450467676970701 3.824321956207839
epoch 25 -1.4281402631044076 3.806859450525405
epoch 30 -1.4351013634887497 3.812312382048318
epoch 35 -1.4399523503520877 3.8161077633144096
epoch 40 -1.4442032111320935 3.819430509274806
epoch 45 -1.4185547536156924 3.799337897395324
epoch 50 -1.4280255777530608 3.806769547117516
epoch 55 -1.4354643562504719 3.812596516058812
epoch 60 -1.4456583423272527 3.8205672694083277
epoch 65 -1.4194560499392166 3.8000457602845623
epoch 70 -1.4260457902021257 3.8052172298828326
epoch 75 -1.4421922142023043 3.8178589452732807
epoch 80 -1.4346390060239025 3.8119504392577532
epoch 85 -1.4331553050779071 3.8107887359415096
epoch 90 -1.4484800421101913 3.8227706405657873
epoch 95 -1.44663555027924 3.8213304822783676
[32m[I 2022-02-27 01:26:33,623][0m Trial 5 finished with value: 3.803655208517307 and parameters: {'n_layers_mlp': 2, 'mlp_n_units_l0': 40, 'mlp_dropout_l0': 0.12296142491817966, 'mlp_n_units_l1': 79, 'mlp_dropout_l1': 0.0883486626203165, 'lr': 2.882535583244529e-05, 'weight_decay': 0.021329616329884036, 'criterion': 'PoissonNLLLoss', 'batch_size': 32}. Best is trial 0 with value: 2.336807979413138.[0m
Trial Id: 6 | Model params: 1287 | Timestamp: 2022-02-27 01:26:33.623399

[32m[I 2022-02-27 01:26:48,571][0m Trial 6 pruned. [0m
epoch 0 0.05536345417347366 2.3744461759842594
Trial Id: 7 | Model params: 4491 | Timestamp: 2022-02-27 01:26:48.571963

[32m[I 2022-02-27 01:26:53,055][0m Trial 7 pruned. [0m
epoch 0 0.05922259112335404 2.3696744003284684
Trial Id: 8 | Model params: 3362 | Timestamp: 2022-02-27 01:26:53.055726

[32m[I 2022-02-27 01:27:12,062][0m Trial 8 pruned. [0m
epoch 0 0.0473809134882216 2.3844575603666063
Trial Id: 9 | Model params: 9589 | Timestamp: 2022-02-27 01:27:12.062798

epoch 0 -1.5266565311133156 3.88345557369901
epoch 5 -1.4769367402183122 3.845056221920396
epoch 10 -1.5255694792420194 3.8826200878002335
epoch 15 -1.5279975243789998 3.88448598620489
epoch 20 -1.5092347495972955 3.87004382896314
epoch 25 -1.5268536813514073 3.883607080096313
epoch 30 -1.4939486959686215 3.8582378253657184
epoch 35 -1.5266757029630464 3.8834703071787184
epoch 40 -1.4541756324999136 3.8273489221346275
epoch 45 -1.5340390978864717 3.889124915346424
epoch 50 -1.5142927103907549 3.87394236328831
epoch 55 -1.530241829038383 3.886209887408016
epoch 60 -1.5058984528588826 3.867470153999908
epoch 65 -1.5172004757979365 3.8761818122974647
epoch 70 -1.5248533481556747 3.88206958580574
epoch 75 -1.4804906356986542 3.8478136661516014
epoch 80 -1.5358075505712367 3.8904817479749654
epoch 85 -1.5142127328088737 3.8738807493391527
epoch 90 -1.54017954763468 3.893834102077802
epoch 95 -1.5318130251087303 3.887416303732015
[32m[I 2022-02-27 01:36:44,021][0m Trial 9 finished with value: 3.8925230037181686 and parameters: {'n_layers_mlp': 4, 'mlp_n_units_l0': 60, 'mlp_dropout_l0': 0.20512676768855956, 'mlp_n_units_l1': 64, 'mlp_dropout_l1': 0.15870364501187226, 'mlp_n_units_l2': 49, 'mlp_dropout_l2': 0.05327655660512809, 'mlp_n_units_l3': 29, 'mlp_dropout_l3': 0.056907128214642805, 'lr': 0.006098315847546128, 'weight_decay': 0.2884593046453698, 'criterion': 'PoissonNLLLoss', 'batch_size': 128}. Best is trial 0 with value: 2.336807979413138.[0m
Trial Id: 10 | Model params: 1781 | Timestamp: 2022-02-27 01:36:44.021521

[32m[I 2022-02-27 01:36:47,362][0m Trial 10 pruned. [0m
epoch 0 0.08872261820218319 2.3288697457873218
Trial Id: 11 | Model params: 2022 | Timestamp: 2022-02-27 01:36:47.362970

[32m[I 2022-02-27 01:36:50,680][0m Trial 11 pruned. [0m
epoch 0 0.011750618246151645 2.4252313812536044
Trial Id: 12 | Model params: 4505 | Timestamp: 2022-02-27 01:36:50.680390

[32m[I 2022-02-27 01:36:54,246][0m Trial 12 pruned. [0m
epoch 0 0.03467565390757954 2.396936524562944
Trial Id: 13 | Model params: 8210 | Timestamp: 2022-02-27 01:36:54.246783

[32m[I 2022-02-27 01:36:57,759][0m Trial 13 pruned. [0m
epoch 0 0.05790749007644114 2.3679181095472055
Trial Id: 14 | Model params: 4525 | Timestamp: 2022-02-27 01:36:57.759522

[32m[I 2022-02-27 01:37:01,142][0m Trial 14 pruned. [0m
epoch 0 0.07527792143685308 2.345986544898424
Trial Id: 15 | Model params: 2604 | Timestamp: 2022-02-27 01:37:01.143004

epoch 0 -3.2962870762976078 5.05669256106001
epoch 5 -3.2962870762976078 5.05669256106001
epoch 10 -3.2962870762976078 5.05669256106001
epoch 15 0.04090363812178999 2.389191853682831
epoch 20 0.056472828248713025 2.369720410983887
epoch 25 0.060040986266169716 2.3652353540548
epoch 30 0.06279352744081279 2.361769681187593
epoch 35 0.06365202320903474 2.3606877243988484
epoch 40 0.06348928400709208 2.360892861673993
epoch 45 0.06469305305119488 2.3593750554531985
epoch 50 0.06393256358483967 2.360334053621018
epoch 55 0.06533228771712118 2.35856866129998
epoch 60 0.065412116440834 2.3584679380461773
epoch 65 0.06696861023456724 2.3565031841296653
epoch 70 0.06732512197173657 2.356052930622101
epoch 75 0.06559594564448656 2.3582359766585936
epoch 80 0.06674590707344685 2.3567844015688175
epoch 85 0.06634636211887723 2.3572888411214734
epoch 90 0.06677776228924259 2.3567441785915353
epoch 95 0.06684531667929594 2.3566588766718133
[32m[I 2022-02-27 01:42:45,769][0m Trial 15 finished with value: 2.3577923953622077 and parameters: {'n_layers_mlp': 4, 'mlp_n_units_l0': 24, 'mlp_dropout_l0': 0.1567073177297701, 'mlp_n_units_l1': 35, 'mlp_dropout_l1': 0.29579463288896646, 'mlp_n_units_l2': 22, 'mlp_dropout_l2': 0.18642950989894702, 'mlp_n_units_l3': 22, 'mlp_dropout_l3': 0.052206875890324675, 'lr': 2.6024807578504304e-05, 'weight_decay': 0.2131861143338588, 'criterion': 'MSELoss', 'batch_size': 256}. Best is trial 0 with value: 2.336807979413138.[0m
Trial Id: 16 | Model params: 3559 | Timestamp: 2022-02-27 01:42:45.769315

[32m[I 2022-02-27 01:42:49,428][0m Trial 16 pruned. [0m
epoch 0 0.05472252028145941 2.371917389955765
Trial Id: 17 | Model params: 3823 | Timestamp: 2022-02-27 01:42:49.428760

[32m[I 2022-02-27 01:42:55,019][0m Trial 17 pruned. [0m
epoch 0 0.07128340763494245 2.3544357265905624
Trial Id: 18 | Model params: 3492 | Timestamp: 2022-02-27 01:42:55.019941

[32m[I 2022-02-27 01:42:58,425][0m Trial 18 pruned. [0m
epoch 0 0.0944194763010594 2.3215788589119724
Trial Id: 19 | Model params: 4795 | Timestamp: 2022-02-27 01:42:58.425226

[32m[I 2022-02-27 01:43:01,286][0m Trial 19 pruned. [0m
epoch 0 0.05606621686425994 2.370230969417002
Trial Id: 20 | Model params: 8856 | Timestamp: 2022-02-27 01:43:01.286478

[32m[I 2022-02-27 01:43:04,770][0m Trial 20 pruned. [0m
epoch 0 -1.4640413627803226 3.829516106175241
Trial Id: 21 | Model params: 8584 | Timestamp: 2022-02-27 01:43:04.771116

[32m[I 2022-02-27 01:43:23,736][0m Trial 21 pruned. [0m
epoch 0 0.06296734138346682 2.364870269989395
Trial Id: 22 | Model params: 11380 | Timestamp: 2022-02-27 01:43:23.736457

[32m[I 2022-02-27 01:43:42,507][0m Trial 22 pruned. [0m
epoch 0 0.0672478239094425 2.359462575394819
Trial Id: 23 | Model params: 8160 | Timestamp: 2022-02-27 01:43:42.507451

[32m[I 2022-02-27 01:44:01,210][0m Trial 23 pruned. [0m
epoch 0 0.058425013218005084 2.3705952732931475
Trial Id: 24 | Model params: 4916 | Timestamp: 2022-02-27 01:44:01.210571

[32m[I 2022-02-27 01:44:07,108][0m Trial 24 pruned. [0m
epoch 0 0.07712003938638823 2.3470256978911674
Study statistics: 
  Number of finished trials:  25
  Number of pruned trials:  17
  Number of complete trials:  8

Best trial:
  Value:  2.336807979413138
  Params: 
    n_layers_mlp: 4
    mlp_n_units_l0: 19
    mlp_dropout_l0: 0.005041074646399779
    mlp_n_units_l1: 19
    mlp_dropout_l1: 0.29182966166767166
    mlp_n_units_l2: 22
    mlp_dropout_l2: 0.07096414200092095
    mlp_n_units_l3: 21
    mlp_dropout_l3: 0.10060635627683386
    lr: 0.005109896658215974
    weight_decay: 0.12740308448583054
    criterion: MSELoss
    batch_size: 256
Target: 72616, NaN: 0, Max: 64.0, Min: 0.0, Mean: 4.437699680511182
Prediction: 72616, NaN: 0, Max: 7.921332836151123, Min: 3.690495014190674, Mean: 4.523126966951701

 XXXXXX======== TRIAL north - qso ended

Test Set - R-squared:  0.08523505939697129
Test Set - RMSE:  2.3671615242754314
Test Set - MAE:  1.846988718789672



[32m[I 2022-02-27 01:44:14,977][0m A new study created in memory with name: NeuralNetwork[0m
++++++++ Session Characteristics +++++++

Area: north
Gal Type: glbg
Training Samples: 232368
Validation Samples: 58092
Test Samples: 72616
Number of features: 16
Device: cuda:0
Number of Workers: 8
Number of Trials: 25

+++++++++++++++++++++++++++++++++++++++
Trial Id: 0 | Model params: 3659 | Timestamp: 2022-02-27 01:44:14.978228

epoch 0 0.10051891882193353 10.744689874438546
epoch 5 0.09828549287480248 10.75802122270235
epoch 10 0.05192396611643468 11.031116023233283
epoch 15 0.04079480661250123 11.095672484873704
epoch 20 0.021054184565797218 11.2092665208408
epoch 25 0.1012973868874324 10.74003929941818
epoch 30 0.04914366430043349 11.047278956557712
epoch 35 0.1029065416210817 10.730419805761182
epoch 40 0.10135943180346307 10.739668555899497
epoch 45 0.10043286703378607 10.745203825028213
epoch 50 0.10013613994435733 10.746975860741648
epoch 55 0.07086961836526462 10.92034097525692
epoch 60 0.09296440389642979 10.789716501554466
epoch 65 0.09383837238942783 10.784517066752828
epoch 70 0.10361999759434792 10.726152020294744
epoch 75 0.09829468506446826 10.757966388260433
epoch 80 0.0932138404058015 10.788232803290693
epoch 85 0.06993083422338331 10.925856484625337
epoch 90 0.1023298781400509 10.733868079234453
epoch 95 0.06761303992756174 10.939461994405107
[32m[I 2022-02-27 01:51:54,544][0m Trial 0 finished with value: 10.73323817680598 and parameters: {'n_layers_mlp': 2, 'mlp_n_units_l0': 69, 'mlp_dropout_l0': 0.1647939977813582, 'mlp_n_units_l1': 35, 'mlp_dropout_l1': 0.06556523059775096, 'lr': 0.005539698796386361, 'weight_decay': 0.2750669268650364, 'criterion': 'MSELoss', 'batch_size': 128}. Best is trial 0 with value: 10.73323817680598.[0m
Trial Id: 1 | Model params: 1047 | Timestamp: 2022-02-27 01:51:54.544828

epoch 0 -0.643598863946865 14.526021017527844
epoch 5 0.07298580121770815 10.909175917061397
epoch 10 0.086580083093318 10.828891205896745
epoch 15 0.09299308114782245 10.790810155287073
epoch 20 0.09647541779182 10.770075268657232
epoch 25 0.09795228638687425 10.761269481078832
epoch 30 0.09985657430243966 10.749904571070768
epoch 35 0.10086184880222715 10.743900181378597
epoch 40 0.101709083721369 10.738837137012842
epoch 45 0.10147783142570299 10.740219328955604
epoch 50 0.10252120010489452 10.733981717989126
epoch 55 0.1028778583159704 10.73184866306834
epoch 60 0.10249307787689099 10.734149889714535
epoch 65 0.10328271667816946 10.729426825072599
epoch 70 0.10283875498721007 10.732082547850686
epoch 75 0.10367035692531823 10.727107472401798
epoch 80 0.10377196023598678 10.726499470351492
epoch 85 0.10398625872290135 10.725216978658183
epoch 90 0.1040165864739735 10.7250354666745
epoch 95 0.10419468031213774 10.72396951075016
[32m[I 2022-02-27 02:16:37,406][0m Trial 1 finished with value: 10.724008046324128 and parameters: {'n_layers_mlp': 2, 'mlp_n_units_l0': 38, 'mlp_dropout_l0': 0.098878298096254, 'mlp_n_units_l1': 10, 'mlp_dropout_l1': 0.0023495906166864588, 'lr': 3.016921247270509e-05, 'weight_decay': 0.22795802717321573, 'criterion': 'MSELoss', 'batch_size': 32}. Best is trial 1 with value: 10.724008046324128.[0m
Trial Id: 2 | Model params: 5631 | Timestamp: 2022-02-27 02:16:37.406873

epoch 0 -5.8420723610060765 29.637569367184142
epoch 5 -5.8553667323255425 29.666348779483105
epoch 10 -5.85016400237508 29.65508933102193
epoch 15 -5.851762011809256 29.658548105811093
epoch 20 -5.842358597704885 29.63818930152901
epoch 25 -5.846898422431949 29.64801996676579
epoch 30 -5.822875447788513 29.59596285852243
epoch 35 -5.847974703101467 29.650350097499665
epoch 40 -5.843085018011645 29.63976253178717
epoch 45 -5.837018592889632 29.6266217285349
epoch 50 -5.835641172707937 29.623637214035
epoch 55 -5.842289019975347 29.638038610569733
epoch 60 -5.828787397464733 29.60878237709699
epoch 65 -5.846315444507353 29.64675775225554
epoch 70 -5.837174259318924 29.626958998655137
epoch 75 -5.833469127991987 29.618930341978192
epoch 80 -5.845359277113451 29.64468742310166
epoch 85 -5.834847308391942 29.621916978088088
epoch 90 -5.835285558734584 29.622866641378852
epoch 95 -5.838230527640227 29.629247430140705
[32m[I 2022-02-27 02:48:27,310][0m Trial 2 finished with value: 29.644535845222915 and parameters: {'n_layers_mlp': 4, 'mlp_n_units_l0': 61, 'mlp_dropout_l0': 0.13223694429892843, 'mlp_n_units_l1': 28, 'mlp_dropout_l1': 0.2612233924346497, 'mlp_n_units_l2': 51, 'mlp_dropout_l2': 0.1451159519703775, 'mlp_n_units_l3': 26, 'mlp_dropout_l3': 0.16717252526046994, 'lr': 0.009030983483973165, 'weight_decay': 0.03308908011190752, 'criterion': 'PoissonNLLLoss', 'batch_size': 32}. Best is trial 1 with value: 10.724008046324128.[0m
Trial Id: 3 | Model params: 3353 | Timestamp: 2022-02-27 02:48:27.310799

epoch 0 -7.206942530335267 32.4555194508683
epoch 5 0.031232460199181244 11.150841881586068
epoch 10 0.04312627705274785 11.082179557947693
epoch 15 0.05604583590064194 11.0071103790888
epoch 20 0.06401962235801473 10.960522055412392
epoch 25 0.06646864477909875 10.94617338608299
epoch 30 0.07047838683401997 10.922639862557688
epoch 35 0.07253253788885239 10.910564209154336
epoch 40 0.07420832392231169 10.900702926520873
epoch 45 0.07276283639952497 10.909209529453612
epoch 50 0.06971024777302048 10.927152061934459
epoch 55 0.06390733769702317 10.961179473892939
epoch 60 0.056788294493796965 11.002780756106722
epoch 65 0.04870781962490289 11.049810540933807
epoch 70 0.04623553319176854 11.06415974462274
epoch 75 0.03779013267908404 11.113037283739077
epoch 80 0.027266508789860366 11.173643289974594
epoch 85 0.022498545724522923 11.200994252242229
epoch 90 0.013294136711956672 11.253606433688754
epoch 95 0.0070616607480668 11.289091894523809
[32m[I 2022-02-27 02:57:41,664][0m Trial 3 finished with value: 11.28950014308473 and parameters: {'n_layers_mlp': 4, 'mlp_n_units_l0': 11, 'mlp_dropout_l0': 0.18538425524003452, 'mlp_n_units_l1': 71, 'mlp_dropout_l1': 0.06785126787310139, 'mlp_n_units_l2': 19, 'mlp_dropout_l2': 0.29274642464307465, 'mlp_n_units_l3': 45, 'mlp_dropout_l3': 0.12521834312425775, 'lr': 1.2032061332689086e-05, 'weight_decay': 0.17087872237063498, 'criterion': 'MSELoss', 'batch_size': 128}. Best is trial 1 with value: 10.724008046324128.[0m
Trial Id: 4 | Model params: 693 | Timestamp: 2022-02-27 02:57:41.665086

epoch 0 -7.396540538010894 32.82366250291226
epoch 5 -7.396540538010894 32.82366250291226
epoch 10 -7.396540538010894 32.82366250291226
epoch 15 -7.396540538010894 32.82366250291226
epoch 20 -6.982902895684161 32.00495841493196
epoch 25 -4.8679129045758875 27.4396566981283
epoch 30 -1.4476123143454434 17.721813373781103
epoch 35 0.007705166922377105 11.283847522889468
epoch 40 0.03323837531408225 11.137726406310435
epoch 45 0.047075758305115456 11.057731277031625
epoch 50 0.05612201598904554 11.00511973752958
epoch 55 0.06292173166080994 10.965407536216649
epoch 60 0.06734800750339776 10.939479409097098
epoch 65 0.0713817678104699 10.91579691300512
epoch 70 0.07417630970780031 10.899359783522549
epoch 75 0.07698155621122726 10.882834721967601
epoch 80 0.07945181063554307 10.868262217074518
epoch 85 0.08162848935553801 10.85540535837259
epoch 90 0.08339391536745666 10.844966427188236
epoch 95 0.08506070798725307 10.835101483318274
