[32m[I 2022-02-26 18:41:40,350][0m A new study created in memory with name: NeuralNetwork[0m
++++++++ Session Characteristics +++++++

Area: north
Gal Type: lrg
Training Samples: 232368
Validation Samples: 58092
Test Samples: 72616
Number of features: 16
Device: cuda:0
Number of Workers: 8
Number of Trials: 25

+++++++++++++++++++++++++++++++++++++++
Trial Id: 0 | Model params: 2515 | Timestamp: 2022-02-26 18:41:40.351150

epoch 0 -3.063131153686575 9.79424429460631
epoch 5 -3.063131153686575 9.79424429460631
epoch 10 0.003894641151730216 4.849457415049881
epoch 15 0.004578935648169802 4.847791413001855
epoch 20 0.004872848394136042 4.847075669218659
epoch 25 0.00588165016577058 4.844618205177102
epoch 30 0.006332115174513264 4.843520459491923
epoch 35 0.005783761726612768 4.84485671824798
epoch 40 0.00647887664952429 4.843162760271218
epoch 45 0.006523860895600753 4.843053115651469
epoch 50 0.006159784205207242 4.843940445083533
epoch 55 0.006826893239482157 4.842314439799438
epoch 60 0.006978042634139703 4.841945953812146
epoch 65 0.00579685803326313 4.844824808721779
epoch 70 0.006454487077546145 4.843222206386172
epoch 75 0.006459188532998983 4.843210747313542
epoch 80 0.007097604513730205 4.841654454927644
epoch 85 0.006665208540720946 4.8427085786883985
epoch 90 0.006314500717624072 4.84356338912945
epoch 95 0.0070501325011844695 4.841770196583047
[32m[I 2022-02-26 18:48:11,931][0m Trial 0 finished with value: 4.841776821445545 and parameters: {'n_layers_mlp': 2, 'mlp_n_units_l0': 47, 'mlp_dropout_l0': 0.28688094775559225, 'mlp_n_units_l1': 35, 'mlp_dropout_l1': 0.1702961911583254, 'lr': 4.067056956869738e-05, 'weight_decay': 0.2052725478412232, 'criterion': 'MSELoss', 'batch_size': 128}. Best is trial 0 with value: 4.841776821445545.[0m
Trial Id: 1 | Model params: 7888 | Timestamp: 2022-02-26 18:48:11.932114

epoch 0 -1.7604522594820367 8.070345972128061
epoch 5 -1.7284423062943466 8.023418033685246
epoch 10 -1.73158443589432 8.028036669957942
epoch 15 -1.735099094904672 8.033199743217287
epoch 20 -1.7241533001761447 8.017109301524709
epoch 25 -1.7251831144056515 8.018624516016619
epoch 30 -1.7196335197859893 8.01045574499512
epoch 35 -1.7316102716703292 8.02807463511546
epoch 40 -1.728742128327112 8.023858858733353
epoch 45 -1.7246934373026654 8.017904066589955
epoch 50 -1.7295886883127314 8.025103415889244
epoch 55 -1.7306929613593156 8.02672655591248
epoch 60 -1.721442806658362 8.013119854450913
epoch 65 -1.7247352079930578 8.017965525266407
epoch 70 -1.7255248207443534 8.019127221490644
epoch 75 -1.7325149036814285 8.029403860627154
epoch 80 -1.7253934209820927 8.018933914846947
epoch 85 -1.7235435238755632 8.016211973747517
epoch 90 -1.7268541867290002 8.021082634866833
epoch 95 -1.7247194794638459 8.01794238338704
[32m[I 2022-02-26 19:15:29,128][0m Trial 1 finished with value: 8.027590587124152 and parameters: {'n_layers_mlp': 4, 'mlp_n_units_l0': 34, 'mlp_dropout_l0': 0.17694157123906037, 'mlp_n_units_l1': 79, 'mlp_dropout_l1': 0.19225005999612763, 'mlp_n_units_l2': 40, 'mlp_dropout_l2': 0.19255786106217632, 'mlp_n_units_l3': 32, 'mlp_dropout_l3': 0.09595490374911249, 'lr': 0.0001146781073902099, 'weight_decay': 0.12030823959938979, 'criterion': 'PoissonNLLLoss', 'batch_size': 32}. Best is trial 0 with value: 4.841776821445545.[0m
Trial Id: 2 | Model params: 3040 | Timestamp: 2022-02-26 19:15:29.128811

epoch 0 -0.009717471165910707 4.882479710060663
epoch 5 0.006749920660860997 4.842502079902133
epoch 10 0.00696839488574208 4.841969474824198
epoch 15 0.004829617044399104 4.847180953928931
epoch 20 0.007596459038768155 4.840438028875883
epoch 25 0.007196318633502563 4.841413770878695
epoch 30 0.006168249477047638 4.843919815328713
epoch 35 0.007215094756304108 4.841367989718231
epoch 40 0.006461149582584591 4.843205967549586
epoch 45 0.006679552754797369 4.842673613085695
epoch 50 0.005887947430835427 4.844602860981265
epoch 55 0.006562841296514965 4.842958102798868
epoch 60 0.004496315308859189 4.847992593123102
epoch 65 0.0036013802230359104 4.850171220931249
epoch 70 0.0075471274784639775 4.840558334468956
epoch 75 0.00549489641142864 4.845560493427025
epoch 80 0.005631513545336975 4.845227659879684
epoch 85 0.004862345491497111 4.847101247974816
epoch 90 0.0062690873262574165 4.843674068075069
epoch 95 0.006972771273331402 4.8419588052954765
[32m[I 2022-02-26 19:23:21,444][0m Trial 2 finished with value: 4.841388459471893 and parameters: {'n_layers_mlp': 4, 'mlp_n_units_l0': 49, 'mlp_dropout_l0': 0.18237018214525244, 'mlp_n_units_l1': 11, 'mlp_dropout_l1': 0.06460007089885812, 'mlp_n_units_l2': 46, 'mlp_dropout_l2': 0.19561383450039974, 'mlp_n_units_l3': 23, 'mlp_dropout_l3': 0.18608518090519344, 'lr': 0.0002615610802162963, 'weight_decay': 0.09754304467486694, 'criterion': 'MSELoss', 'batch_size': 128}. Best is trial 2 with value: 4.841388459471893.[0m
Trial Id: 3 | Model params: 6100 | Timestamp: 2022-02-26 19:23:21.444527

epoch 0 0.005332625213439468 4.8444108643848
epoch 5 0.007590653942559755 4.83890900799083
epoch 10 0.007439549394418266 4.839277380846098
epoch 15 0.006176630152758156 4.8423551146352475
epoch 20 0.007164721966294141 4.839947301809495
epoch 25 0.00529721751057588 4.844497088150806
epoch 30 0.005865213314481421 4.843113736766082
epoch 35 0.006882849136160107 4.840634300376931
epoch 40 0.00699991817311163 4.840348984039058
epoch 45 0.005674703889730459 4.8435777657013555
epoch 50 0.005403633754778259 4.844237941909689
epoch 55 0.0017282642160306727 4.853180236095298
epoch 60 0.007267302425503996 4.839697261922371
epoch 65 0.007477477796926424 4.839184919065197
epoch 70 0.00760428235971522 4.838875782337924
epoch 75 0.007838198064200275 4.838305467631737
epoch 80 0.0024657311714521013 4.851387276738246
epoch 85 0.007054801647370157 4.840215218269777
epoch 90 0.002770716180865773 4.850645591188869
epoch 95 0.004890806123661329 4.845486658980035
[32m[I 2022-02-26 19:50:02,583][0m Trial 3 finished with value: 4.838661498487303 and parameters: {'n_layers_mlp': 4, 'mlp_n_units_l0': 64, 'mlp_dropout_l0': 0.0974570354657251, 'mlp_n_units_l1': 36, 'mlp_dropout_l1': 0.020286516829743573, 'mlp_n_units_l2': 43, 'mlp_dropout_l2': 0.23508921328584165, 'mlp_n_units_l3': 24, 'mlp_dropout_l3': 0.10847079583063367, 'lr': 0.0014261033969104992, 'weight_decay': 0.028416090227268063, 'criterion': 'MSELoss', 'batch_size': 32}. Best is trial 3 with value: 4.838661498487303.[0m
Trial Id: 4 | Model params: 3867 | Timestamp: 2022-02-26 19:50:02.583687

epoch 0 0.006676289115004175 4.842681568589566
epoch 5 0.007023718854008432 4.841834594577034
epoch 10 0.0017167774555778559 4.854755896090062
epoch 15 -0.005444440132591488 4.872137655325513
epoch 20 0.0018281413699540172 4.854485101346385
epoch 25 -0.0008736859746980574 4.861050662659794
epoch 30 0.0023957923147323035 4.853104555040509
epoch 35 0.006775341050819228 4.842440112084847
epoch 40 0.0018956249850313744 4.854320999474381
epoch 45 0.00033209670915268497 4.858121653133831
epoch 50 9.124732670240387e-05 4.858706850041855
epoch 55 0.0035630431875953716 4.85026452665939
epoch 60 0.0044312181629404535 4.8481510984742435
epoch 65 -0.0074513932577406905 4.876997833004338
epoch 70 0.007404524194702611 4.840906086356454
epoch 75 0.0064052311693290065 4.8433422584365164
epoch 80 0.0028434480300582043 4.8520155641620395
epoch 85 0.005972835418139311 4.84439601439658
epoch 90 0.005964466480953834 4.844416407380824
epoch 95 0.004310829622216961 4.84844421945339
[32m[I 2022-02-26 19:56:26,208][0m Trial 4 finished with value: 4.863484955477734 and parameters: {'n_layers_mlp': 2, 'mlp_n_units_l0': 76, 'mlp_dropout_l0': 0.17497481344880744, 'mlp_n_units_l1': 33, 'mlp_dropout_l1': 0.23953055934839984, 'lr': 0.0017374388649373223, 'weight_decay': 0.1156407288823053, 'criterion': 'MSELoss', 'batch_size': 128}. Best is trial 3 with value: 4.838661498487303.[0m
Trial Id: 5 | Model params: 834 | Timestamp: 2022-02-26 19:56:26.208782

epoch 0 -3.0645591677100006 9.792842230586993
epoch 5 0.0028512527799872123 4.850449717284309
epoch 10 0.004822443757219408 4.845653094607271
epoch 15 0.005379917384077282 4.844295697528863
epoch 20 0.004753645631172421 4.8458205853675205
epoch 25 0.00567725503352956 4.843571552105384
epoch 30 0.00559024192801727 4.843783477752615
epoch 35 0.00576356048062765 4.843361340842564
epoch 40 0.006249566647225979 4.842177421647732
epoch 45 0.006438234183514746 4.841717746351645
epoch 50 0.0061519946350299115 4.842415131932897
epoch 55 0.006183160214768613 4.8423392059073604
epoch 60 0.006955553356589372 4.840457110312175
epoch 65 0.006368529904467346 4.841887581050138
epoch 70 0.007076991557199208 4.840161134449499
epoch 75 0.006945349784211796 4.840481978195865
epoch 80 0.006010051971862551 4.842760919596676
epoch 85 0.006655345187678519 4.841188716516665
epoch 90 0.007202052127023073 4.839856311031337
epoch 95 0.006840193018375906 4.840738256113441
[32m[I 2022-02-26 20:17:28,753][0m Trial 5 finished with value: 4.840836618099046 and parameters: {'n_layers_mlp': 2, 'mlp_n_units_l0': 15, 'mlp_dropout_l0': 0.21373717716632357, 'mlp_n_units_l1': 34, 'mlp_dropout_l1': 0.16866801994797867, 'lr': 2.1701901745695205e-05, 'weight_decay': 0.1713728745352111, 'criterion': 'MSELoss', 'batch_size': 32}. Best is trial 3 with value: 4.838661498487303.[0m
Trial Id: 6 | Model params: 14884 | Timestamp: 2022-02-26 20:17:28.753748

[32m[I 2022-02-26 20:17:44,633][0m Trial 6 pruned. [0m
epoch 0 0.003978093830038665 4.847708285334696
Trial Id: 7 | Model params: 1743 | Timestamp: 2022-02-26 20:17:44.633641

epoch 0 -1.7586767761149154 8.070323077964392
epoch 5 -1.7285207742752764 8.02609219423124
epoch 10 -1.7261732035317054 8.022638697755418
epoch 15 -1.7272212012721075 8.024180584262714
epoch 20 -1.722535670485506 8.017284607554275
epoch 25 -1.7347027791817617 8.035179401685127
epoch 30 -1.7323736195499388 8.031756872133244
epoch 35 -1.7288790791601145 8.02661916358066
epoch 40 -1.7351766075273867 8.03587547931524
epoch 45 -1.7366279926229402 8.03800726178494
epoch 50 -1.7153898399191774 8.00675622407576
epoch 55 -1.7137760481304984 8.004376610356157
epoch 60 -1.7389376971930823 8.04139857155039
epoch 65 -1.7221032072573967 8.01664782646132
epoch 70 -1.7275034065420085 8.024595733475644
epoch 75 -1.7421811321543519 8.046158452797865
epoch 80 -1.742744122076863 8.046984378114916
epoch 85 -1.717075533107164 8.00924110491644
epoch 90 -1.7285833791257512 8.026184271488672
epoch 95 -1.7375071234231254 8.03929824695869
[32m[I 2022-02-26 20:24:17,516][0m Trial 7 finished with value: 8.019121594080232 and parameters: {'n_layers_mlp': 2, 'mlp_n_units_l0': 35, 'mlp_dropout_l0': 0.12401842836027943, 'mlp_n_units_l1': 31, 'mlp_dropout_l1': 0.22833426408677646, 'lr': 0.00026232517850619707, 'weight_decay': 0.13312338385062458, 'criterion': 'PoissonNLLLoss', 'batch_size': 128}. Best is trial 3 with value: 4.838661498487303.[0m
Trial Id: 8 | Model params: 3075 | Timestamp: 2022-02-26 20:24:17.516502

[32m[I 2022-02-26 20:24:21,415][0m Trial 8 pruned. [0m
epoch 0 0.004644142900002479 4.847632627768208
Trial Id: 9 | Model params: 2824 | Timestamp: 2022-02-26 20:24:21.415881

[32m[I 2022-02-26 20:24:37,889][0m Trial 9 pruned. [0m
epoch 0 -1.746580790612783 8.050043403391083
Trial Id: 10 | Model params: 9090 | Timestamp: 2022-02-26 20:24:37.889909

[32m[I 2022-02-26 20:24:40,798][0m Trial 10 pruned. [0m
epoch 0 0.004345335474563727 4.816203313241241
Trial Id: 11 | Model params: 1311 | Timestamp: 2022-02-26 20:24:40.799027

epoch 0 -2.1394737205421057 8.606577005124114
epoch 5 -0.0009523539872511311 4.859691890707889
epoch 10 0.004141596147401283 4.847310380396981
epoch 15 0.004747713409126275 4.845835027239498
epoch 20 0.005499310531356771 4.844004936725952
epoch 25 0.005388830552098933 4.844273991694148
epoch 30 0.005088392670848818 4.845005580866235
epoch 35 0.006284234546196421 4.842092959001931
epoch 40 0.005882606521535938 4.843071369448494
epoch 45 0.006442661235515845 4.84170695962411
epoch 50 0.005212813202881694 4.844702620776388
epoch 55 0.005347233172850019 4.844375291077131
epoch 60 0.006093446176322348 4.84255776529607
epoch 65 0.005835401949089825 4.8431863520456195
epoch 70 0.006329864185215639 4.841981787629854
epoch 75 0.005849931456325064 4.843150960839581
epoch 80 0.006444761246019004 4.84170184283797
epoch 85 0.006052307712672067 4.8426579826276015
epoch 90 0.006196389219347953 4.84230697685964
epoch 95 0.006148011201645542 4.842424836343765
[32m[I 2022-02-26 20:45:43,353][0m Trial 11 finished with value: 4.840856311639516 and parameters: {'n_layers_mlp': 2, 'mlp_n_units_l0': 19, 'mlp_dropout_l0': 0.262735073314805, 'mlp_n_units_l1': 47, 'mlp_dropout_l1': 0.11926065951447001, 'lr': 1.0196489082407849e-05, 'weight_decay': 0.25726268788818746, 'criterion': 'MSELoss', 'batch_size': 32}. Best is trial 3 with value: 4.838661498487303.[0m
Trial Id: 12 | Model params: 1033 | Timestamp: 2022-02-26 20:45:43.353437

epoch 0 -1.8519237434235398 8.202967431265161
epoch 5 0.0003660278760161395 4.856490419278931
epoch 10 0.003470033267000683 4.848944510856924
epoch 15 0.004142860535928161 4.847307303209726
epoch 20 0.0045184066245220755 4.846393236884855
epoch 25 0.005091304407008335 4.84499849109657
epoch 30 0.005569368515607742 4.843834314823935
epoch 35 0.004554926868270637 4.8463043386637334
epoch 40 0.006418122774223378 4.841766748476059
epoch 45 0.006503330435748578 4.841559133745397
epoch 50 0.006447684196095316 4.841694720907237
epoch 55 0.007105745411330022 4.840091051324405
epoch 60 0.007050161802191535 4.84022652696186
epoch 65 0.007190391921299 4.839884732501528
epoch 70 0.007279018280226035 4.839668703702494
epoch 75 0.0071476659180818025 4.839988874677532
epoch 80 0.007440987685226275 4.839273874615977
epoch 85 0.007639346850622841 4.8387902951619655
epoch 90 0.007486915406203498 4.8391619118064035
epoch 95 0.007288872231353993 4.839644683873104
[32m[I 2022-02-26 21:06:44,548][0m Trial 12 finished with value: 4.83897951502611 and parameters: {'n_layers_mlp': 2, 'mlp_n_units_l0': 11, 'mlp_dropout_l0': 0.21996307516142616, 'mlp_n_units_l1': 65, 'mlp_dropout_l1': 0.12239723853420569, 'lr': 1.0451690775647478e-05, 'weight_decay': 0.05487513987682689, 'criterion': 'MSELoss', 'batch_size': 32}. Best is trial 3 with value: 4.838661498487303.[0m
Trial Id: 13 | Model params: 11002 | Timestamp: 2022-02-26 21:06:44.548197

[32m[I 2022-02-26 21:06:47,386][0m Trial 13 pruned. [0m
epoch 0 -0.053297275686095213 4.9536569344754415
Trial Id: 14 | Model params: 4340 | Timestamp: 2022-02-26 21:06:47.386639

[32m[I 2022-02-26 21:07:03,426][0m Trial 14 pruned. [0m
epoch 0 0.006580923219480228 4.8413700654789364
Trial Id: 15 | Model params: 5070 | Timestamp: 2022-02-26 21:07:03.426984

[32m[I 2022-02-26 21:07:15,979][0m Trial 15 pruned. [0m
epoch 0 0.0062634427932787284 4.8421436148722
Trial Id: 16 | Model params: 4887 | Timestamp: 2022-02-26 21:07:15.979273

[32m[I 2022-02-26 21:07:28,539][0m Trial 16 pruned. [0m
epoch 0 0.0043555299651343304 4.846789694268019
Trial Id: 17 | Model params: 6733 | Timestamp: 2022-02-26 21:07:28.539354

epoch 0 -3.1012513039052614 9.774817023500765
epoch 5 -1.7725828415955194 8.036976739366045
epoch 10 -1.7477349252048144 8.00088195214501
epoch 15 -1.7445519820157136 7.9962465464992984
epoch 20 -1.743012464735139 7.994003541696827
epoch 25 -1.739607878634501 7.989040982457752
epoch 30 -1.7414939648440133 7.991790541552524
epoch 35 -1.7415169101963297 7.991823985738116
epoch 40 -1.7498585425595663 8.003973140089455
epoch 45 -1.7383826203821813 7.987254279116528
epoch 50 -1.7418950087895166 7.9923750662762245
epoch 55 -1.7445050076223976 7.996178116307409
epoch 60 -1.7408240532746615 7.990814044774579
epoch 65 -1.7402625687954894 7.989995504841811
epoch 70 -1.7396347205944407 7.989080119626691
epoch 75 -1.7409748666463392 7.991033888333974
epoch 80 -1.7406109443931843 7.990503381537308
epoch 85 -1.7419671129389611 7.992480154110686
epoch 90 -1.7439010515632027 7.995298248002222
epoch 95 -1.7390434636369587 7.988217987523156
[32m[I 2022-02-26 21:12:23,060][0m Trial 17 finished with value: 7.998222232819414 and parameters: {'n_layers_mlp': 4, 'mlp_n_units_l0': 58, 'mlp_dropout_l0': 0.1385277121366597, 'mlp_n_units_l1': 58, 'mlp_dropout_l1': 0.1179574534598033, 'mlp_n_units_l2': 31, 'mlp_dropout_l2': 0.23686135188056617, 'mlp_n_units_l3': 15, 'mlp_dropout_l3': 0.2706946193467615, 'lr': 0.0005679229523521027, 'weight_decay': 0.04834786467376108, 'criterion': 'PoissonNLLLoss', 'batch_size': 256}. Best is trial 3 with value: 4.838661498487303.[0m
Trial Id: 18 | Model params: 6755 | Timestamp: 2022-02-26 21:12:23.060394

[32m[I 2022-02-26 21:12:39,109][0m Trial 18 pruned. [0m
epoch 0 -0.023401650919176564 4.913886142545286
Trial Id: 19 | Model params: 1119 | Timestamp: 2022-02-26 21:12:39.109244

[32m[I 2022-02-26 21:12:51,735][0m Trial 19 pruned. [0m
epoch 0 -1.256311274581838 7.296280799141956
Trial Id: 20 | Model params: 4612 | Timestamp: 2022-02-26 21:12:51.735465

[32m[I 2022-02-26 21:13:07,994][0m Trial 20 pruned. [0m
epoch 0 -1.696804039226437 7.97676371652616
Trial Id: 21 | Model params: 651 | Timestamp: 2022-02-26 21:13:07.994611

[32m[I 2022-02-26 21:13:20,424][0m Trial 21 pruned. [0m
epoch 0 -0.6039244443680505 6.151683538468108
Trial Id: 22 | Model params: 957 | Timestamp: 2022-02-26 21:13:20.424828

epoch 0 -2.8022698026895703 9.47160325320553
epoch 5 0.0036444419387052784 4.848520170894532
epoch 10 0.005149116561963041 4.844857722464287
epoch 15 0.005905310111142148 4.843016066255269
epoch 20 0.005356186579229649 4.844353487609785
epoch 25 0.0061058501583226565 4.842527547572616
epoch 30 0.005808327266299984 4.843252300300906
epoch 35 0.00647905686966832 4.841618278980271
epoch 40 0.0060929390441378795 4.842559000732428
epoch 45 0.006080145745415599 4.842590166676888
epoch 50 0.0063521128383803305 4.841927580417338
epoch 55 0.007132901853257212 4.840024860715634
epoch 60 0.007139487928664479 4.840008807800985
epoch 65 0.00699386495762655 4.840363737124837
epoch 70 0.006352331165986658 4.841927048475124
epoch 75 0.006415708293722733 4.841772631405573
epoch 80 0.006148550256661722 4.842423523103071
epoch 85 0.006608540061524559 4.841302770474871
epoch 90 0.005856557275789598 4.843134821476727
epoch 95 0.007071606515499984 4.840174259552844
[32m[I 2022-02-26 21:34:23,622][0m Trial 22 finished with value: 4.842592676108196 and parameters: {'n_layers_mlp': 2, 'mlp_n_units_l0': 20, 'mlp_dropout_l0': 0.2044652921842243, 'mlp_n_units_l1': 28, 'mlp_dropout_l1': 0.15870625017972487, 'lr': 2.589068089310451e-05, 'weight_decay': 0.18705832646601273, 'criterion': 'MSELoss', 'batch_size': 32}. Best is trial 3 with value: 4.838661498487303.[0m
Trial Id: 23 | Model params: 1122 | Timestamp: 2022-02-26 21:34:23.623116

[32m[I 2022-02-26 21:34:36,310][0m Trial 23 pruned. [0m
epoch 0 -0.3891704691053588 5.725056856319156
Trial Id: 24 | Model params: 771 | Timestamp: 2022-02-26 21:34:36.310546

[32m[I 2022-02-26 21:34:48,984][0m Trial 24 pruned. [0m
epoch 0 -0.005348911718918714 4.870352990349248
Study statistics: 
  Number of finished trials:  25
  Number of pruned trials:  14
  Number of complete trials:  11

Best trial:
  Value:  4.838661498487303
  Params: 
    n_layers_mlp: 4
    mlp_n_units_l0: 64
    mlp_dropout_l0: 0.0974570354657251
    mlp_n_units_l1: 36
    mlp_dropout_l1: 0.020286516829743573
    mlp_n_units_l2: 43
    mlp_dropout_l2: 0.23508921328584165
    mlp_n_units_l3: 24
    mlp_dropout_l3: 0.10847079583063367
    lr: 0.0014261033969104992
    weight_decay: 0.028416090227268063
    criterion: MSELoss
    batch_size: 32
Target: 72616, NaN: 0, Max: 178.0, Min: 0.0, Mean: 8.47994932246337
Prediction: 72616, NaN: 0, Max: 10.432184219360352, Min: 8.265448570251465, Mean: 8.537444167375119

 XXXXXX======== TRIAL north - lrg ended

Test Set - R-squared:  0.009592869264212434
Test Set - RMSE:  4.846222593349673
Test Set - MAE:  3.290500753131012



[32m[I 2022-02-26 21:35:03,403][0m A new study created in memory with name: NeuralNetwork[0m
++++++++ Session Characteristics +++++++

Area: north
Gal Type: elg
Training Samples: 232368
Validation Samples: 58092
Test Samples: 72616
Number of features: 16
Device: cuda:0
Number of Workers: 8
Number of Trials: 25

+++++++++++++++++++++++++++++++++++++++
Trial Id: 0 | Model params: 6426 | Timestamp: 2022-02-26 21:35:03.403424

epoch 0 -0.2766439099254814 8.867924962414952
epoch 5 0.03849496964498278 7.695961758875229
epoch 10 0.05757794291665841 7.619208210504305
epoch 15 0.06472912985821255 7.59024552981154
epoch 20 0.07114554009502494 7.564164343882343
epoch 25 0.0744396407925404 7.550739608915267
epoch 30 0.07483146351893866 7.549141190977506
epoch 35 0.07802207954114093 7.536112638669523
epoch 40 0.07715431000251594 7.539658315192345
epoch 45 0.0794902236217443 7.530110050644803
epoch 50 0.07650366439436296 7.5423157373676935
epoch 55 0.07864165222321806 7.533580064892557
epoch 60 0.07926024120681285 7.531050662457547
epoch 65 0.07785279022069502 7.536804479982156
epoch 70 0.07878995500125374 7.532973734132679
epoch 75 0.08089246701395614 7.524372430232974
epoch 80 0.07883073049255684 7.532807016397844
epoch 85 0.08124445171136974 7.522931512019987
epoch 90 0.0808253877250038 7.524647001121296
epoch 95 0.08082078525457537 7.524665839719258
