[32m[I 2022-02-27 03:02:33,886][0m Trial 4 finished with value: 10.830932440996696 and parameters: {'n_layers_mlp': 2, 'mlp_n_units_l0': 20, 'mlp_dropout_l0': 0.03450108830186888, 'mlp_n_units_l1': 16, 'mlp_dropout_l1': 0.08037361717115923, 'lr': 1.4097120409728765e-05, 'weight_decay': 0.27554403743175376, 'criterion': 'MSELoss', 'batch_size': 256}. Best is trial 1 with value: 10.724008046324128.[0m
Trial Id: 5 | Model params: 3049 | Timestamp: 2022-02-27 03:02:33.886374

epoch 0 -5.863327865759277 29.68356953818611
epoch 5 -5.8435985319914225 29.64087461404596
epoch 10 -5.855433072023134 29.666492320443222
epoch 15 -5.842295807110105 29.638053310132374
epoch 20 -5.850192392487212 29.655150782867377
epoch 25 -5.845012849432902 29.643937289337746
epoch 30 -5.850929622722131 29.656746510719383
epoch 35 -5.835644197991028 29.62364376937316
epoch 40 -5.850821940500526 29.656513438926606
epoch 45 -5.836309119075668 29.625084519198253
epoch 50 -5.844943462104785 29.64378703988889
epoch 55 -5.839779997717152 29.632604075675367
epoch 60 -5.842498774409669 29.63849289292769
epoch 65 -5.850557536732783 29.655941144856016
epoch 70 -5.833454658864346 29.61889898452983
epoch 75 -5.847966822391684 29.650333036552347
epoch 80 -5.836103416698839 29.62463881113889
epoch 85 -5.831404099891694 29.614454683726116
epoch 90 -5.848656643843046 29.65182639372223
epoch 95 -5.8359342056664465 29.624272166104994
[32m[I 2022-02-27 03:28:03,211][0m Trial 5 finished with value: 29.65762777758981 and parameters: {'n_layers_mlp': 2, 'mlp_n_units_l0': 65, 'mlp_dropout_l0': 0.23253248132089294, 'mlp_n_units_l1': 29, 'mlp_dropout_l1': 0.0895986823502192, 'lr': 0.00013973381760253883, 'weight_decay': 0.10779395026930248, 'criterion': 'PoissonNLLLoss', 'batch_size': 32}. Best is trial 1 with value: 10.724008046324128.[0m
Trial Id: 6 | Model params: 5280 | Timestamp: 2022-02-27 03:28:03.211184

[32m[I 2022-02-27 03:28:18,612][0m Trial 6 pruned. [0m
epoch 0 -5.828434653623928 29.608017640263846
Trial Id: 7 | Model params: 2185 | Timestamp: 2022-02-27 03:28:18.612998

[32m[I 2022-02-27 03:28:36,961][0m Trial 7 pruned. [0m
epoch 0 0.09342649183140317 10.788231668206508
Trial Id: 8 | Model params: 1587 | Timestamp: 2022-02-27 03:28:36.961590

epoch 0 -6.445286932602043 30.91281736707602
epoch 5 0.03604693838570305 11.12309923479227
epoch 10 0.06325755175735426 10.964983149008756
epoch 15 0.07538098584190378 10.893797004817392
epoch 20 0.083763526180756 10.844303318687672
epoch 25 0.08693012681974244 10.825547626027005
epoch 30 0.08891718597762488 10.81376171554526
epoch 35 0.09155107446573241 10.798119417720597
epoch 40 0.09374210318799481 10.785089916695405
epoch 45 0.09559180327016581 10.774077945710573
epoch 50 0.09558119522500264 10.774141131543427
epoch 55 0.09671844895480097 10.767365074708653
epoch 60 0.09653416828239325 10.7684633569014
epoch 65 0.09686645355660184 10.766482910745868
epoch 70 0.09612154029350783 10.770922145046937
epoch 75 0.0962145873289717 10.770367740769709
epoch 80 0.09797923419084886 10.7598479969677
epoch 85 0.09768218164046572 10.761619562162236
epoch 90 0.09873584351149112 10.755334404008806
epoch 95 0.09945212819148275 10.75105962369582
[32m[I 2022-02-27 03:36:15,721][0m Trial 8 finished with value: 10.760301157845719 and parameters: {'n_layers_mlp': 2, 'mlp_n_units_l0': 28, 'mlp_dropout_l0': 0.28433118779338395, 'mlp_n_units_l1': 37, 'mlp_dropout_l1': 0.2527429301504538, 'lr': 2.8223476562479228e-05, 'weight_decay': 0.263002934582684, 'criterion': 'MSELoss', 'batch_size': 128}. Best is trial 1 with value: 10.724008046324128.[0m
Trial Id: 9 | Model params: 559 | Timestamp: 2022-02-27 03:36:15.722081

epoch 0 -5.891864158695967 29.737550896357615
epoch 5 -5.849980923815499 29.647052675013065
epoch 10 -5.842717146470984 29.63132951374692
epoch 15 -5.852893213264275 29.653354270929338
epoch 20 -5.849920022480144 29.646920882740172
epoch 25 -5.842025102354382 29.629831080790968
epoch 30 -5.850776675430974 29.648774650972555
epoch 35 -5.834755516796282 29.614086192873636
epoch 40 -5.839333336985686 29.624002075641236
epoch 45 -5.842080110535396 29.629950188789785
epoch 50 -5.841262490558228 29.62817976498635
epoch 55 -5.844645681007037 29.635504830017936
epoch 60 -5.828858433142812 29.60130779656247
epoch 65 -5.845341593313903 29.637011349807494
epoch 70 -5.847194823901874 29.641022873435148
epoch 75 -5.847214875680149 29.641066274769464
epoch 80 -5.843814171776457 29.63370466786083
epoch 85 -5.856770123130348 29.66174102985746
epoch 90 -5.851439307251439 29.650208484493326
epoch 95 -5.841608198965092 29.62892835352859
[32m[I 2022-02-27 03:41:13,127][0m Trial 9 finished with value: 29.62573143722854 and parameters: {'n_layers_mlp': 2, 'mlp_n_units_l0': 14, 'mlp_dropout_l0': 0.11163877054051927, 'mlp_n_units_l1': 20, 'mlp_dropout_l1': 0.20486073229322105, 'lr': 0.0014000536750802884, 'weight_decay': 0.11995754199943572, 'criterion': 'PoissonNLLLoss', 'batch_size': 256}. Best is trial 1 with value: 10.724008046324128.[0m
Trial Id: 10 | Model params: 13533 | Timestamp: 2022-02-27 03:41:13.127794

[32m[I 2022-02-27 03:41:31,759][0m Trial 10 pruned. [0m
epoch 0 0.08926715166152088 10.812951437096057
Trial Id: 11 | Model params: 2712 | Timestamp: 2022-02-27 03:41:31.759160

[32m[I 2022-02-27 03:41:36,314][0m Trial 11 pruned. [0m
epoch 0 0.08863860762631826 10.815414830728821
Trial Id: 12 | Model params: 7824 | Timestamp: 2022-02-27 03:41:36.314912

[32m[I 2022-02-27 03:41:40,937][0m Trial 12 pruned. [0m
epoch 0 0.07804729617419925 10.878078523274988
Trial Id: 13 | Model params: 1398 | Timestamp: 2022-02-27 03:41:40.937249

[32m[I 2022-02-27 03:41:45,516][0m Trial 13 pruned. [0m
epoch 0 0.09236551933126314 10.793277954065022
Trial Id: 14 | Model params: 1791 | Timestamp: 2022-02-27 03:41:45.516978

epoch 0 -7.3939297718765875 32.823170897055434
epoch 5 -7.3939297718765875 32.823170897055434
epoch 10 0.06142532870218398 10.97570139960509
epoch 15 0.07985328497179767 10.867418910173233
epoch 20 0.08811822680838832 10.818502152227268
epoch 25 0.09274983413712456 10.790992642193356
epoch 30 0.09614408971275679 10.770787790946917
epoch 35 0.09619969278002993 10.770456489219427
epoch 40 0.0976593684828102 10.761755603458855
epoch 45 0.09855464639566902 10.75641551747442
epoch 50 0.09846482312685578 10.756951408159031
epoch 55 0.09882124141812709 10.75482483930735
epoch 60 0.1000614821763337 10.74742166628252
epoch 65 0.0975981026659104 10.762120940302921
epoch 70 0.10101898779610419 10.741702689294307
epoch 75 0.09826262399069507 10.758157641923043
epoch 80 0.0997740712770071 10.749137716590003
epoch 85 0.10157279344465264 10.738393535931408
epoch 90 0.10169941415641759 10.737636796301333
epoch 95 0.10098735320684471 10.741891684589282
[32m[I 2022-02-27 03:49:25,569][0m Trial 14 finished with value: 10.747597589957357 and parameters: {'n_layers_mlp': 2, 'mlp_n_units_l0': 36, 'mlp_dropout_l0': 0.2398833796297854, 'mlp_n_units_l1': 31, 'mlp_dropout_l1': 0.12849109293239502, 'lr': 4.249130985289612e-05, 'weight_decay': 0.29995136495741764, 'criterion': 'MSELoss', 'batch_size': 128}. Best is trial 1 with value: 10.724008046324128.[0m
Trial Id: 15 | Model params: 5051 | Timestamp: 2022-02-27 03:49:25.569715

epoch 0 -7.396540538010894 32.82366250291226
epoch 5 0.06946799904173673 10.92703918591964
epoch 10 0.09946988635156595 10.749443071880242
epoch 15 0.10234973277821713 10.732241240480995
epoch 20 0.104036075085149 10.722155608568015
epoch 25 0.10463483853528088 10.718572256785755
epoch 30 0.10516308156507581 10.715409945649832
epoch 35 0.10564936348688825 10.712498008211009
epoch 40 0.10628454397456888 10.708693248645561
epoch 45 0.10734454810475957 10.702340764292352
epoch 50 0.10404542936857275 10.722099636256251
epoch 55 0.10787555360382939 10.699157090688763
epoch 60 0.1084222540682751 10.695878326967813
epoch 65 0.10787538712077283 10.699158088995837
epoch 70 0.10683215362981058 10.705411956848694
epoch 75 0.10902610656833478 10.692255632890236
epoch 80 0.10880061942918773 10.693608542122085
epoch 85 0.10692985486637518 10.704826422676781
epoch 90 0.10915984252588795 10.691453144333156
epoch 95 0.10984578302503278 10.687336180749508
[32m[I 2022-02-27 03:54:17,772][0m Trial 15 finished with value: 10.68721813906839 and parameters: {'n_layers_mlp': 2, 'mlp_n_units_l0': 80, 'mlp_dropout_l0': 0.07121843739070802, 'mlp_n_units_l1': 45, 'mlp_dropout_l1': 0.12782122012468916, 'lr': 0.00021087617144704336, 'weight_decay': 0.2043795814697843, 'criterion': 'MSELoss', 'batch_size': 256}. Best is trial 15 with value: 10.68721813906839.[0m
Trial Id: 16 | Model params: 3900 | Timestamp: 2022-02-27 03:54:17.773148

epoch 0 -7.396540538010894 32.82366250291226
epoch 5 0.07079268271908823 10.919258676690188
epoch 10 0.09918191853821756 10.751161640833526
epoch 15 0.1027234902853632 10.73000669908419
epoch 20 0.10363023743855204 10.72458369837626
epoch 25 0.10471172568775411 10.718112032160132
epoch 30 0.1046588822191179 10.718428340256628
epoch 35 0.10463850532234809 10.718550308890046
epoch 40 0.10387460351397271 10.7231217441825
epoch 45 0.10595264632274504 10.710681499045718
epoch 50 0.10671506103630413 10.70611366335028
epoch 55 0.10806496255704257 10.698021249311491
epoch 60 0.10805747189308335 10.698066171368927
epoch 65 0.10745012385280361 10.701707854337805
epoch 70 0.10851277869143017 10.69533532051794
epoch 75 0.10898054180485883 10.69252903252288
epoch 80 0.10918982939538702 10.691273198522715
epoch 85 0.10900247232278037 10.692397444968694
epoch 90 0.10857775039044626 10.694945574735742
epoch 95 0.10948128736996221 10.689524053835752
[32m[I 2022-02-27 03:59:10,148][0m Trial 16 finished with value: 10.699998783965857 and parameters: {'n_layers_mlp': 2, 'mlp_n_units_l0': 55, 'mlp_dropout_l0': 0.05622269412125605, 'mlp_n_units_l1': 52, 'mlp_dropout_l1': 0.1332810713995833, 'lr': 0.0002192177227543054, 'weight_decay': 0.2057474279248339, 'criterion': 'MSELoss', 'batch_size': 256}. Best is trial 15 with value: 10.68721813906839.[0m
Trial Id: 17 | Model params: 5813 | Timestamp: 2022-02-27 03:59:10.148540

[32m[I 2022-02-27 03:59:13,124][0m Trial 17 pruned. [0m
epoch 0 0.055157303757666365 11.010742319263837
Trial Id: 18 | Model params: 3729 | Timestamp: 2022-02-27 03:59:13.124815

[32m[I 2022-02-27 03:59:15,856][0m Trial 18 pruned. [0m
epoch 0 0.03894930609934266 11.104780850123626
Trial Id: 19 | Model params: 13737 | Timestamp: 2022-02-27 03:59:15.856192

epoch 0 -7.396540538010894 32.82366250291226
epoch 5 0.10077521824809377 10.741649507213285
epoch 10 0.10565411878369935 10.712469528790717
epoch 15 0.10042513214432747 10.743740272704823
epoch 20 0.11153773862271055 10.677174402791413
epoch 25 0.11365793273819547 10.664426982389887
epoch 30 0.11523104149960406 10.654958993372533
epoch 35 0.11667008183653138 10.646290540836423
epoch 40 0.11649849578081273 10.647324506890104
epoch 45 0.11855609298326675 10.634918939222976
epoch 50 0.12103401131470559 10.619959957151265
epoch 55 0.11902136365548799 10.63211174469629
epoch 60 0.12126284674988463 10.618577434172511
epoch 65 0.12227397997933309 10.61246645613478
epoch 70 0.12068422783677024 10.622072847232847
epoch 75 0.11110126086398764 10.679796785935698
epoch 80 0.1232295388919924 10.606688116311219
epoch 85 0.11857864690103659 10.634782878028552
epoch 90 0.11840619791939244 10.635823168110463
epoch 95 0.12336486449402995 10.605869537271364
[32m[I 2022-02-27 04:04:59,797][0m Trial 19 finished with value: 10.607134820575032 and parameters: {'n_layers_mlp': 4, 'mlp_n_units_l0': 73, 'mlp_dropout_l0': 0.007855377566283891, 'mlp_n_units_l1': 43, 'mlp_dropout_l1': 0.11220731716266569, 'mlp_n_units_l2': 77, 'mlp_dropout_l2': 0.29876554890576845, 'mlp_n_units_l3': 75, 'mlp_dropout_l3': 1.7377843748139776e-05, 'lr': 0.0005293939878096676, 'weight_decay': 0.19111496815623008, 'criterion': 'MSELoss', 'batch_size': 256}. Best is trial 19 with value: 10.607134820575032.[0m
Trial Id: 20 | Model params: 17737 | Timestamp: 2022-02-27 04:04:59.797843

[32m[I 2022-02-27 04:05:03,396][0m Trial 20 pruned. [0m
epoch 0 0.08482825940719008 10.83647777354235
Trial Id: 21 | Model params: 9561 | Timestamp: 2022-02-27 04:05:03.396849

[32m[I 2022-02-27 04:05:06,851][0m Trial 21 pruned. [0m
epoch 0 0.05811721897120936 10.993482076740229
Trial Id: 22 | Model params: 12416 | Timestamp: 2022-02-27 04:05:06.851633

[32m[I 2022-02-27 04:05:10,054][0m Trial 22 pruned. [0m
epoch 0 0.09786450898764176 10.75902033541814
Trial Id: 23 | Model params: 8215 | Timestamp: 2022-02-27 04:05:10.054300

[32m[I 2022-02-27 04:05:13,789][0m Trial 23 pruned. [0m
epoch 0 0.10001307980824348 10.74620058846309
Trial Id: 24 | Model params: 8572 | Timestamp: 2022-02-27 04:05:13.789341

epoch 0 -7.396540538010894 32.82366250291226
epoch 5 -7.396540538010894 32.82366250291226
epoch 10 0.10099455498663024 10.740339388706461
epoch 15 0.10414041750050029 10.72153124850316
epoch 20 0.1003501778742113 10.744187857706015
epoch 25 0.09332434347955121 10.786059748479417
epoch 30 0.10817972427061107 10.697332991370654
epoch 35 0.10070294977997207 10.742081138421849
epoch 40 0.10429424301646872 10.720610727078054
epoch 45 0.10190140067964404 10.734921018883044
epoch 50 0.10766412449545759 10.700424839398936
epoch 55 0.10916769364318168 10.691406031483048
epoch 60 0.10101271538230594 10.740230907829561
epoch 65 0.11493957425793311 10.656713867204296
epoch 70 0.10981647238633596 10.68751213344671
epoch 75 0.10724608879890052 10.70293097857113
epoch 80 0.11140635653217745 10.677963821599153
epoch 85 0.11277974260289436 10.669708846048582
epoch 90 0.11611726112173915 10.649621442051291
epoch 95 0.11036288538895556 10.684231522294027
[32m[I 2022-02-27 04:10:57,227][0m Trial 24 finished with value: 10.658651390898495 and parameters: {'n_layers_mlp': 4, 'mlp_n_units_l0': 60, 'mlp_dropout_l0': 0.03861734056664128, 'mlp_n_units_l1': 51, 'mlp_dropout_l1': 0.14985601399995094, 'mlp_n_units_l2': 69, 'mlp_dropout_l2': 0.2184048149941798, 'mlp_n_units_l3': 12, 'mlp_dropout_l3': 0.22072091945898747, 'lr': 0.00016687979046537597, 'weight_decay': 0.15523844055335742, 'criterion': 'MSELoss', 'batch_size': 256}. Best is trial 19 with value: 10.607134820575032.[0m
Study statistics: 
  Number of finished trials:  25
  Number of pruned trials:  12
  Number of complete trials:  13

Best trial:
  Value:  10.607134820575032
  Params: 
    n_layers_mlp: 4
    mlp_n_units_l0: 73
    mlp_dropout_l0: 0.007855377566283891
    mlp_n_units_l1: 43
    mlp_dropout_l1: 0.11220731716266569
    mlp_n_units_l2: 77
    mlp_dropout_l2: 0.29876554890576845
    mlp_n_units_l3: 75
    mlp_dropout_l3: 1.7377843748139776e-05
    lr: 0.0005293939878096676
    weight_decay: 0.19111496815623008
    criterion: MSELoss
    batch_size: 256
Target: 72616, NaN: 0, Max: 135.0, Min: 0.0, Mean: 30.728833865814696
Prediction: 72616, NaN: 0, Max: 56.15050506591797, Min: 24.463159561157227, Mean: 31.026038146483895

 XXXXXX======== TRIAL north - glbg ended

Test Set - R-squared:  0.12933634359080126
Test Set - RMSE:  10.543280104894595
Test Set - MAE:  8.199155782647262



[32m[I 2022-02-27 04:11:05,122][0m A new study created in memory with name: NeuralNetwork[0m
++++++++ Session Characteristics +++++++

Area: north
Gal Type: rlbg
Training Samples: 232368
Validation Samples: 58092
Test Samples: 72616
Number of features: 16
Device: cuda:0
Number of Workers: 8
Number of Trials: 25

+++++++++++++++++++++++++++++++++++++++
Trial Id: 0 | Model params: 7391 | Timestamp: 2022-02-27 04:11:05.123001

epoch 0 0.09837285024903197 9.284899677521652
epoch 5 0.11387049674137673 9.20475690626441
epoch 10 0.10476790861706597 9.251913127289773
epoch 15 0.10221183867399453 9.265111760915707
epoch 20 0.09297442524692923 9.312654515081057
epoch 25 0.11405729803153164 9.203786646789375
epoch 30 0.08534531934931633 9.351737456998565
epoch 35 0.11206969951017609 9.214105137999635
epoch 40 0.1017266373418465 9.267615044845147
epoch 45 0.11412291488161419 9.203445803826291
epoch 50 0.10939928124072362 9.22795028012488
epoch 55 0.11490708875502775 9.199371480362752
epoch 60 0.11383070537871709 9.204963572280601
epoch 65 0.11430634766580816 9.20249290577913
epoch 70 0.1119592665514415 9.214678104850575
epoch 75 0.11067838767164673 9.22132117491097
epoch 80 0.10993552134739948 9.225171738611696
epoch 85 0.11809185592750138 9.182805841575645
epoch 90 0.0759911193817665 9.399436058681355
epoch 95 0.11228293559797808 9.212998689832721
[32m[I 2022-02-27 04:42:22,997][0m Trial 0 finished with value: 9.240394751339004 and parameters: {'n_layers_mlp': 4, 'mlp_n_units_l0': 30, 'mlp_dropout_l0': 0.10360829865405645, 'mlp_n_units_l1': 72, 'mlp_dropout_l1': 0.21846334206425938, 'mlp_n_units_l2': 45, 'mlp_dropout_l2': 0.19632682568179294, 'mlp_n_units_l3': 29, 'mlp_dropout_l3': 0.020884445732242806, 'lr': 0.0018021501006259275, 'weight_decay': 0.0766406573584813, 'criterion': 'MSELoss', 'batch_size': 32}. Best is trial 0 with value: 9.240394751339004.[0m
Trial Id: 1 | Model params: 3615 | Timestamp: 2022-02-27 04:42:22.998097

epoch 0 -6.645544319883231 27.03758702730244
epoch 5 -5.081010896808769 24.113020538818912
epoch 10 -5.065078245324652 24.08141096466094
epoch 15 -5.066940484229664 24.08510769343675
epoch 20 -5.061129374478812 24.073570186564705
epoch 25 -5.062217969774682 24.075731928796433
epoch 30 -5.058372572941021 24.068094837063487
epoch 35 -5.053758433630023 24.058927796392005
epoch 40 -5.062963508850001 24.077212314950756
epoch 45 -5.054812317822804 24.061021885589827
epoch 50 -5.061167749729548 24.07364639578024
epoch 55 -5.060719633653655 24.072756469300753
epoch 60 -5.059909587243469 24.071147691568566
epoch 65 -5.056826973499562 24.06502454001875
epoch 70 -5.0516489459337555 24.054735654043583
epoch 75 -5.05843499853188 24.068218835806768
epoch 80 -5.059226541336793 24.069791057282377
epoch 85 -5.060127845142515 24.071581169225503
epoch 90 -5.061651076082708 24.074606210477086
epoch 95 -5.056258255159223 24.063894695781364
[32m[I 2022-02-27 05:07:55,071][0m Trial 1 finished with value: 24.063577326783026 and parameters: {'n_layers_mlp': 2, 'mlp_n_units_l0': 55, 'mlp_dropout_l0': 0.27963860258339934, 'mlp_n_units_l1': 47, 'mlp_dropout_l1': 0.0864194790982893, 'lr': 1.0601706111146759e-05, 'weight_decay': 0.2616597641830019, 'criterion': 'PoissonNLLLoss', 'batch_size': 32}. Best is trial 0 with value: 9.240394751339004.[0m
Trial Id: 2 | Model params: 4956 | Timestamp: 2022-02-27 05:07:55.072185

epoch 0 -5.0595460721306384 24.070425704130326
epoch 5 -5.07166295756622 24.09447972814672
epoch 10 -5.048083624076817 24.047648700466706
epoch 15 -5.055888832362803 24.063160753595756
epoch 20 -5.063911090351542 24.079093757053286
epoch 25 -5.049848751965721 24.05115758703566
epoch 30 -5.058766215070972 24.068876735346393
epoch 35 -5.05340295400757 24.058221410085196
epoch 40 -5.055616467633651 24.062619624941014
epoch 45 -5.074302056479103 24.099715592478294
epoch 50 -5.033893729341208 24.019422074567576
epoch 55 -5.0574694381971526 24.066300828643715
epoch 60 -5.071302534631465 24.09376457547468
epoch 65 -5.058859224401632 24.069061477705155
epoch 70 -5.072949690641642 24.09703269607419
epoch 75 -5.0686097614648515 24.088420891988058
epoch 80 -5.067493838357261 24.08620604687438
epoch 85 -5.0707148157449105 24.092598375708196
epoch 90 -5.046827984083436 24.045152309981948
epoch 95 -5.0608036222539114 24.072923267159577
[32m[I 2022-02-27 05:40:04,533][0m Trial 2 finished with value: 24.059777649797304 and parameters: {'n_layers_mlp': 4, 'mlp_n_units_l0': 26, 'mlp_dropout_l0': 0.07734684547349956, 'mlp_n_units_l1': 21, 'mlp_dropout_l1': 0.16672082088708656, 'mlp_n_units_l2': 40, 'mlp_dropout_l2': 0.10781666532060176, 'mlp_n_units_l3': 73, 'mlp_dropout_l3': 0.13307731901059622, 'lr': 0.0009256355463188681, 'weight_decay': 0.1999648671345632, 'criterion': 'PoissonNLLLoss', 'batch_size': 32}. Best is trial 0 with value: 9.240394751339004.[0m
Trial Id: 3 | Model params: 2366 | Timestamp: 2022-02-27 05:40:04.533355

epoch 0 -5.171845835765316 24.29244678112883
epoch 5 -5.067201428983912 24.0856256493114
epoch 10 -5.066390221783688 24.084015427011124
epoch 15 -5.065316467955535 24.081883891844473
epoch 20 -5.0657859948805735 24.082815984517257
epoch 25 -5.062467724954863 24.07622786748297
epoch 30 -5.064097204435919 24.079463273033536
epoch 35 -5.060445450272242 24.07221194449031
epoch 40 -5.060229236813132 24.07178253854336
epoch 45 -5.057652801831733 24.066665077365162
epoch 50 -5.059055775233656 24.069451877573997
epoch 55 -5.062789430365272 24.076866662637684
epoch 60 -5.061838936698607 24.074979263565492
epoch 65 -5.060172414356989 24.071669686293024
epoch 70 -5.062605315308497 24.07650107618786
epoch 75 -5.065968850664213 24.083178975315615
epoch 80 -5.061206676877341 24.073723700758855
epoch 85 -5.0580873167290505 24.067528211761267
epoch 90 -5.06196565671755 24.075230900561834
epoch 95 -5.059621867350515 24.070576244903673
