[32m[I 2022-02-26 22:01:42,789][0m Trial 0 finished with value: 7.526030309245218 and parameters: {'n_layers_mlp': 4, 'mlp_n_units_l0': 11, 'mlp_dropout_l0': 0.27966790652596674, 'mlp_n_units_l1': 15, 'mlp_dropout_l1': 0.22938107799734686, 'mlp_n_units_l2': 68, 'mlp_dropout_l2': 0.2887073006339575, 'mlp_n_units_l3': 71, 'mlp_dropout_l3': 0.2745031317149543, 'lr': 1.6877986240167178e-05, 'weight_decay': 0.16171110910918393, 'criterion': 'MSELoss', 'batch_size': 32}. Best is trial 0 with value: 7.526030309245218.[0m
Trial Id: 1 | Model params: 5303 | Timestamp: 2022-02-26 22:01:42.789851

epoch 0 -15.983322721003596 32.32924689633376
epoch 5 -15.983322721003596 32.32924689633376
epoch 10 -13.74767834541636 30.126320027021805
epoch 15 -12.800258217130487 29.14257099143102
epoch 20 -12.799932613989961 29.14222719465347
epoch 25 -12.776250403728234 29.117210815225857
epoch 30 -12.767299472249036 29.107750022210045
epoch 35 -12.762963348454473 29.103165799015283
epoch 40 -12.745299133403458 29.084483425749184
epoch 45 -12.748434664125897 29.087800563129974
epoch 50 -12.735429707022803 29.074039902103333
epoch 55 -12.740064856770163 29.078945142211538
epoch 60 -12.735532377465367 29.07414856411935
epoch 65 -12.725156359827155 29.06316497557887
epoch 70 -12.722750129230455 29.060617254434415
epoch 75 -12.730338322385455 29.068650888315506
epoch 80 -12.725345958051555 29.063365713016783
epoch 85 -12.715992303116225 29.053460861578213
epoch 90 -12.718401387004084 29.05601223189848
epoch 95 -12.717008234999415 29.05453682422137
[32m[I 2022-02-26 22:09:45,870][0m Trial 1 finished with value: 29.048738783943605 and parameters: {'n_layers_mlp': 4, 'mlp_n_units_l0': 18, 'mlp_dropout_l0': 0.018969188845000172, 'mlp_n_units_l1': 38, 'mlp_dropout_l1': 0.1048348006624465, 'mlp_n_units_l2': 66, 'mlp_dropout_l2': 0.10641766853122693, 'mlp_n_units_l3': 25, 'mlp_dropout_l3': 0.2573577535322215, 'lr': 1.4573407974853183e-05, 'weight_decay': 0.24348859187717817, 'criterion': 'PoissonNLLLoss', 'batch_size': 128}. Best is trial 0 with value: 7.526030309245218.[0m
Trial Id: 2 | Model params: 4737 | Timestamp: 2022-02-26 22:09:45.871072

epoch 0 -12.706264972954413 29.056726288960952
epoch 5 -12.64455555332907 28.991241764022366
epoch 10 -12.64704751345917 28.993889036775858
epoch 15 -12.651919662996944 28.999064147256654
epoch 20 -12.650606845325473 28.997669786606245
epoch 25 -12.656731624742061 29.004174420999377
epoch 30 -12.650961182634367 28.998046139456903
epoch 35 -12.645979378515202 28.9927543594027
epoch 40 -12.64730576639788 28.9941633716317
epoch 45 -12.644094602066087 28.990752057255417
epoch 50 -12.668508692687773 29.0166777977793
epoch 55 -12.645950830097362 28.992724031872672
epoch 60 -12.651183577982012 28.998282350087052
epoch 65 -12.64618000711836 28.992967490108363
epoch 70 -12.653624444235641 29.000874717434822
epoch 75 -12.658386311006046 29.005931479594548
epoch 80 -12.658418307883135 29.005965455009346
epoch 85 -12.64025117236503 28.986668540955165
epoch 90 -12.64848437430811 28.99541534081561
epoch 95 -12.654692289020954 29.00200876896375
[32m[I 2022-02-26 22:31:30,548][0m Trial 2 finished with value: 28.991524992275302 and parameters: {'n_layers_mlp': 2, 'mlp_n_units_l0': 51, 'mlp_dropout_l0': 0.21859158208367924, 'mlp_n_units_l1': 73, 'mlp_dropout_l1': 0.0374391139293385, 'lr': 4.600777763503387e-05, 'weight_decay': 0.03613757598234578, 'criterion': 'PoissonNLLLoss', 'batch_size': 32}. Best is trial 0 with value: 7.526030309245218.[0m
Trial Id: 3 | Model params: 2333 | Timestamp: 2022-02-26 22:31:30.548557

epoch 0 0.061669938339937946 7.5990984651389475
epoch 5 0.07157952163638936 7.558865407584629
epoch 10 0.06093152477643049 7.602087911017152
epoch 15 0.07594226720561204 7.541084542285212
epoch 20 0.07713842860042286 7.536202122653412
epoch 25 0.07779226872490308 7.533531979825578
epoch 30 0.07303952567119254 7.55291965543369
epoch 35 0.07701549559210796 7.536704049039928
epoch 40 0.07833909845754827 7.5312981175403255
epoch 45 0.06419867598508322 7.588852022460346
epoch 50 0.07508462110723946 7.544583285660152
epoch 55 0.07206073633178112 7.556906215248523
epoch 60 0.07620387875550061 7.5400169821112915
epoch 65 0.05599651881961143 7.622037036182084
epoch 70 0.07782628925587876 7.533393021371249
epoch 75 0.06727447613035342 7.576370204396125
epoch 80 0.07771644255182586 7.533841686163278
epoch 85 0.07631223606218296 7.5395747633829115
epoch 90 0.07703338729971276 7.536631000598709
epoch 95 0.07740935768066415 7.535095821205556
[32m[I 2022-02-26 22:37:57,029][0m Trial 3 finished with value: 7.537286566997304 and parameters: {'n_layers_mlp': 2, 'mlp_n_units_l0': 24, 'mlp_dropout_l0': 0.28928071191005367, 'mlp_n_units_l1': 74, 'mlp_dropout_l1': 0.029201806130340468, 'lr': 0.0020054121653390283, 'weight_decay': 0.26611451380485956, 'criterion': 'MSELoss', 'batch_size': 128}. Best is trial 0 with value: 7.526030309245218.[0m
Trial Id: 4 | Model params: 7186 | Timestamp: 2022-02-26 22:37:57.029814

epoch 0 -15.976878134088441 32.33129609854056
epoch 5 0.01804258712646467 7.775718432401768
epoch 10 0.07050989505891936 7.565133299272092
epoch 15 0.07553089047558925 7.544672653493785
epoch 20 0.0737683804128989 7.551861227662431
epoch 25 0.07388118442478842 7.551401350152044
epoch 30 0.07678330295024471 7.539560398004502
epoch 35 0.07567512054243353 7.544084093489128
epoch 40 0.08144591501180287 7.520497407006228
epoch 45 0.08215240612903452 7.517604715803315
epoch 50 0.08330968997432875 7.512863870662993
epoch 55 0.08473770450354579 7.507009843357876
epoch 60 0.08394505459080315 7.5102598094947055
epoch 65 0.08565334621170162 7.503253842834528
epoch 70 0.0866323216029441 7.499235964021887
epoch 75 0.08735816174986222 7.496255604354038
epoch 80 0.08605306455899009 7.501613591805027
epoch 85 0.08736743383782852 7.496217524729037
epoch 90 0.08788443840371185 7.4940939276411624
epoch 95 0.0884966519637197 7.491578481002492
[32m[I 2022-02-26 22:42:49,671][0m Trial 4 finished with value: 7.491605316156688 and parameters: {'n_layers_mlp': 4, 'mlp_n_units_l0': 38, 'mlp_dropout_l0': 0.16856535713169174, 'mlp_n_units_l1': 43, 'mlp_dropout_l1': 0.13972834761847772, 'mlp_n_units_l2': 64, 'mlp_dropout_l2': 0.22777804358091663, 'mlp_n_units_l3': 31, 'mlp_dropout_l3': 0.17087237017493231, 'lr': 7.178830437546552e-05, 'weight_decay': 0.034379809672891705, 'criterion': 'MSELoss', 'batch_size': 256}. Best is trial 4 with value: 7.491605316156688.[0m
Trial Id: 5 | Model params: 9322 | Timestamp: 2022-02-26 22:42:49.671539

epoch 0 -12.707010083356586 29.057516080155597
epoch 5 -12.653554167497184 29.000800081959152
epoch 10 -12.649268620914825 28.996248372118625
epoch 15 -12.661707192211642 29.009457496362653
epoch 20 -12.615369079317265 28.96021821410209
epoch 25 -12.657260024308778 29.00473552322268
epoch 30 -12.649392952637061 28.996380435798695
epoch 35 -12.651095594303932 28.998188901059883
epoch 40 -12.647672120269414 28.994552534624738
epoch 45 -12.677605976460214 29.02633243713322
epoch 50 -12.63652747511823 28.982711687667035
epoch 55 -12.669806986105172 29.01805582913968
epoch 60 -12.62840479782026 28.974078541067087
epoch 65 -12.632386022552902 28.978310287065742
epoch 70 -12.64395342565326 28.99060207218542
epoch 75 -12.63994027687625 28.986338199683534
epoch 80 -12.63457084585422 28.980632329257
epoch 85 -12.656059958286056 29.003461169428117
epoch 90 -12.649963754677373 28.996986727233686
epoch 95 -12.676541012773693 29.025202393184326
[32m[I 2022-02-26 23:13:04,867][0m Trial 5 finished with value: 28.96799742421711 and parameters: {'n_layers_mlp': 4, 'mlp_n_units_l0': 67, 'mlp_dropout_l0': 0.01326341844245431, 'mlp_n_units_l1': 23, 'mlp_dropout_l1': 0.0002828989975487861, 'mlp_n_units_l2': 64, 'mlp_dropout_l2': 0.06314788232352649, 'mlp_n_units_l3': 77, 'mlp_dropout_l3': 0.011808432511970557, 'lr': 0.00012045013406109922, 'weight_decay': 0.05577731384076574, 'criterion': 'PoissonNLLLoss', 'batch_size': 32}. Best is trial 4 with value: 7.491605316156688.[0m
Trial Id: 6 | Model params: 817 | Timestamp: 2022-02-26 23:13:04.867300

epoch 0 -12.788924458816243 29.13060155236793
epoch 5 -12.674331701114102 29.009304188868807
epoch 10 -12.66623301992145 29.0007124745784
epoch 15 -12.673188793207904 29.008091857010783
epoch 20 -12.67828458345636 29.013496791584675
epoch 25 -12.666130846281666 29.000604064532855
epoch 30 -12.64524161093877 28.97843128845817
epoch 35 -12.661837400466194 28.996048191896623
epoch 40 -12.67297656603692 29.007866732891877
epoch 45 -12.667139998999836 29.001674795469576
epoch 50 -12.648073729354538 28.981438420658378
epoch 55 -12.678607223637368 29.013838971358727
epoch 60 -12.657844979167407 28.991811100803652
epoch 65 -12.677487914476536 29.01265185780222
epoch 70 -12.67687347442988 29.01200017616724
epoch 75 -12.654162328763823 28.98790221535985
epoch 80 -12.67683673935868 29.01196121409708
epoch 85 -12.674394230574066 29.009370515110223
epoch 90 -12.665055700373241 28.999463270023245
epoch 95 -12.671603434075845 29.006410114106963
[32m[I 2022-02-26 23:20:56,955][0m Trial 6 finished with value: 29.009398587419284 and parameters: {'n_layers_mlp': 2, 'mlp_n_units_l0': 23, 'mlp_dropout_l0': 0.10187546451360997, 'mlp_n_units_l1': 17, 'mlp_dropout_l1': 0.20410780729450836, 'lr': 0.0011232443540595057, 'weight_decay': 0.0648939995360547, 'criterion': 'PoissonNLLLoss', 'batch_size': 128}. Best is trial 4 with value: 7.491605316156688.[0m
Trial Id: 7 | Model params: 4916 | Timestamp: 2022-02-26 23:20:56.955279

[32m[I 2022-02-26 23:21:00,477][0m Trial 7 pruned. [0m
epoch 0 -0.24652551612878093 8.760820573457993
Trial Id: 8 | Model params: 3867 | Timestamp: 2022-02-26 23:21:00.478018

[32m[I 2022-02-26 23:21:05,203][0m Trial 8 pruned. [0m
epoch 0 -12.667555335019953 29.002115463695525
Trial Id: 9 | Model params: 4259 | Timestamp: 2022-02-26 23:21:05.203664

epoch 0 -15.983322721003596 32.32924689633376
epoch 5 -15.983322721003596 32.32924689633376
epoch 10 -12.803633745326602 29.146134894145078
epoch 15 -12.769973033173235 29.110576196123706
epoch 20 -12.747519684774677 29.086832628220822
epoch 25 -12.740194044956112 29.079081846345805
epoch 30 -12.732939391684983 29.071404134197252
epoch 35 -12.732103839054892 29.07051972566014
epoch 40 -12.715890690679446 29.053353242736005
epoch 45 -12.716679475415056 29.05418864280598
epoch 50 -12.703866534345595 29.04061551150439
epoch 55 -12.702768473218665 29.039452007404016
epoch 60 -12.699275296811193 29.03575033228082
epoch 65 -12.696865947659756 29.033196900252538
epoch 70 -12.689889563224181 29.025802050157342
epoch 75 -12.687290768313495 29.023046889623846
epoch 80 -12.688787923878111 29.02463415874549
epoch 85 -12.693749615804355 29.029893873718354
epoch 90 -12.686968661449109 29.0227053838508
epoch 95 -12.684571279912536 29.020163493574593
[32m[I 2022-02-26 23:28:57,774][0m Trial 9 finished with value: 29.014095257651395 and parameters: {'n_layers_mlp': 2, 'mlp_n_units_l0': 72, 'mlp_dropout_l0': 0.2881608341349439, 'mlp_n_units_l1': 41, 'mlp_dropout_l1': 0.27710108633185065, 'lr': 1.9390923755078963e-05, 'weight_decay': 0.02297777320706915, 'criterion': 'PoissonNLLLoss', 'batch_size': 128}. Best is trial 4 with value: 7.491605316156688.[0m
Trial Id: 10 | Model params: 5106 | Timestamp: 2022-02-26 23:28:57.774236

epoch 0 -15.976878134088441 32.33129609854056
epoch 5 0.06330162614906876 7.594410748701477
epoch 10 0.07250343933196124 7.55701620188569
epoch 15 0.07852355113586806 7.532451072936036
epoch 20 0.07883544055738845 7.531176221780705
epoch 25 0.08531600337470768 7.50463785594685
epoch 30 0.08638022625059383 7.500270811294418
epoch 35 0.0872130385148 7.496851587123405
epoch 40 0.08362971352229964 7.511552357275693
epoch 45 0.08882681886447763 7.490221549466576
epoch 50 0.08899447778990999 7.489532404803674
epoch 55 0.08043698110277497 7.524626506505147
epoch 60 0.08751124157381429 7.495626894621739
epoch 65 0.08893802157432273 7.489764469316536
epoch 70 0.08834661530541266 7.492195025721117
epoch 75 0.08846728083033562 7.491699179614725
epoch 80 0.08673357364091361 7.498820285874277
epoch 85 0.08901991802522802 7.48942782980804
epoch 90 0.08910413498850345 7.489081635934533
epoch 95 0.08669824266916581 7.498965335575912
[32m[I 2022-02-26 23:34:42,524][0m Trial 10 finished with value: 7.490979709757508 and parameters: {'n_layers_mlp': 4, 'mlp_n_units_l0': 37, 'mlp_dropout_l0': 0.09368484219388305, 'mlp_n_units_l1': 59, 'mlp_dropout_l1': 0.09746772176402725, 'mlp_n_units_l2': 20, 'mlp_dropout_l2': 0.2512631897092859, 'mlp_n_units_l3': 47, 'mlp_dropout_l3': 0.1566419220787097, 'lr': 0.0003572750736181214, 'weight_decay': 0.13953497952464833, 'criterion': 'MSELoss', 'batch_size': 256}. Best is trial 10 with value: 7.490979709757508.[0m
Trial Id: 11 | Model params: 4431 | Timestamp: 2022-02-26 23:34:42.524291

[32m[I 2022-02-26 23:34:45,863][0m Trial 11 pruned. [0m
epoch 0 -0.20324527888157817 8.607386062255681
Trial Id: 12 | Model params: 5379 | Timestamp: 2022-02-26 23:34:45.863305

[32m[I 2022-02-26 23:34:49,347][0m Trial 12 pruned. [0m
epoch 0 0.011764500017862667 7.800535628581221
Trial Id: 13 | Model params: 8391 | Timestamp: 2022-02-26 23:34:49.347113

[32m[I 2022-02-26 23:34:52,830][0m Trial 13 pruned. [0m
epoch 0 0.08097813655171127 7.522412089542092
Trial Id: 14 | Model params: 5366 | Timestamp: 2022-02-26 23:34:52.830892

[32m[I 2022-02-26 23:34:56,209][0m Trial 14 pruned. [0m
epoch 0 0.03698755276992172 7.700344402348868
Trial Id: 15 | Model params: 8176 | Timestamp: 2022-02-26 23:34:56.209364

[32m[I 2022-02-26 23:34:59,465][0m Trial 15 pruned. [0m
epoch 0 0.03340038242629895 7.7146727591185185
Trial Id: 16 | Model params: 5986 | Timestamp: 2022-02-26 23:34:59.465942

[32m[I 2022-02-26 23:35:02,979][0m Trial 16 pruned. [0m
epoch 0 -2.3924479233879508 14.45276010988962
Trial Id: 17 | Model params: 4980 | Timestamp: 2022-02-26 23:35:02.979947

[32m[I 2022-02-26 23:35:06,394][0m Trial 17 pruned. [0m
epoch 0 0.05216985921980544 7.639403633948376
Trial Id: 18 | Model params: 8121 | Timestamp: 2022-02-26 23:35:06.394623

epoch 0 -15.976878134088441 32.33129609854056
epoch 5 0.07160720172778734 7.560666483200955
epoch 10 0.08584065029367138 7.502485282000423
epoch 15 0.0819472665399884 7.518444763864434
epoch 20 0.08120777676243085 7.521472201009015
epoch 25 0.09284214039443861 7.473699522850675
epoch 30 0.09141630806425194 7.479570639064207
epoch 35 0.0925506502262462 7.474900160057834
epoch 40 0.09658977207569541 7.458245949952878
epoch 45 0.09831276791821675 7.451130323302835
epoch 50 0.09948322516761898 7.446292691564984
epoch 55 0.09727006746183586 7.45543727804792
epoch 60 0.10355363905038373 7.429444687171427
epoch 65 0.10488706397085068 7.423917143206337
epoch 70 0.10457993555010814 7.4251906698781145
epoch 75 0.10776349225214665 7.411979237133652
epoch 80 0.10792010747925729 7.411328692268959
epoch 85 0.10923831952339125 7.4058508675644985
epoch 90 0.10598028114282321 7.419382277866377
epoch 95 0.10405013358379245 7.427387012715399
[32m[I 2022-02-26 23:40:48,231][0m Trial 18 finished with value: 7.416419846321809 and parameters: {'n_layers_mlp': 4, 'mlp_n_units_l0': 42, 'mlp_dropout_l0': 0.05178173850287267, 'mlp_n_units_l1': 67, 'mlp_dropout_l1': 0.13482545295263093, 'mlp_n_units_l2': 57, 'mlp_dropout_l2': 0.2958659470890055, 'mlp_n_units_l3': 11, 'mlp_dropout_l3': 0.11909053818649518, 'lr': 0.0005483155562317579, 'weight_decay': 0.0030780942332826744, 'criterion': 'MSELoss', 'batch_size': 256}. Best is trial 18 with value: 7.416419846321809.[0m
Trial Id: 19 | Model params: 9288 | Timestamp: 2022-02-26 23:40:48.232081

[32m[I 2022-02-26 23:40:51,481][0m Trial 19 pruned. [0m
epoch 0 0.05124546065854496 7.643127999973763
Trial Id: 20 | Model params: 4049 | Timestamp: 2022-02-26 23:40:51.481244

[32m[I 2022-02-26 23:40:55,005][0m Trial 20 pruned. [0m
epoch 0 -0.9554564165069084 10.972820373297637
Trial Id: 21 | Model params: 10018 | Timestamp: 2022-02-26 23:40:55.006022

[32m[I 2022-02-26 23:40:58,497][0m Trial 21 pruned. [0m
epoch 0 0.0587191594344737 7.612964573586115
Trial Id: 22 | Model params: 9907 | Timestamp: 2022-02-26 23:40:58.497615

[32m[I 2022-02-26 23:41:02,074][0m Trial 22 pruned. [0m
epoch 0 -0.22246725269446754 8.67586561668157
Trial Id: 23 | Model params: 6674 | Timestamp: 2022-02-26 23:41:02.075102

epoch 0 -15.976878134088441 32.33129609854056
epoch 5 0.05666165946533286 7.62128043609334
epoch 10 0.07616518920378901 7.542083925880457
epoch 15 0.07885959283563193 7.531077490096963
epoch 20 0.08185569425375838 7.5188197227221
epoch 25 0.08388363013467526 7.510511598917166
epoch 30 0.08304583822794565 7.5139450098497855
epoch 35 0.08654617752200766 7.499589600116997
epoch 40 0.08765030391668582 7.495055709966431
epoch 45 0.08516605452392345 7.5052529676742035
epoch 50 0.08893559064498024 7.489774461543465
epoch 55 0.0884659729506686 7.491704554209245
epoch 60 0.09022612095965965 7.48446791777187
epoch 65 0.09012725222719142 7.4848745901166325
epoch 70 0.09331948366699572 7.471732946924433
epoch 75 0.09312286011815718 7.472543066355464
epoch 80 0.09458912771491412 7.466499700793909
epoch 85 0.095575730980762 7.462430564298196
epoch 90 0.09173581443573708 7.478255415917496
epoch 95 0.09559917794495287 7.462333832884496
[32m[I 2022-02-26 23:46:43,618][0m Trial 23 finished with value: 7.462625596291309 and parameters: {'n_layers_mlp': 4, 'mlp_n_units_l0': 42, 'mlp_dropout_l0': 0.12455513866296374, 'mlp_n_units_l1': 51, 'mlp_dropout_l1': 0.0880768289982384, 'mlp_n_units_l2': 41, 'mlp_dropout_l2': 0.16432595498337382, 'mlp_n_units_l3': 38, 'mlp_dropout_l3': 0.17964786454083828, 'lr': 0.00019900792837005275, 'weight_decay': 0.011502226678200528, 'criterion': 'MSELoss', 'batch_size': 256}. Best is trial 18 with value: 7.416419846321809.[0m
Trial Id: 24 | Model params: 7309 | Timestamp: 2022-02-26 23:46:43.618229

[32m[I 2022-02-26 23:46:47,155][0m Trial 24 pruned. [0m
epoch 0 0.0514768977581217 7.642195719182782
Study statistics: 
  Number of finished trials:  25
  Number of pruned trials:  14
  Number of complete trials:  11

Best trial:
  Value:  7.416419846321809
  Params: 
    n_layers_mlp: 4
    mlp_n_units_l0: 42
    mlp_dropout_l0: 0.05178173850287267
    mlp_n_units_l1: 67
    mlp_dropout_l1: 0.13482545295263093
    mlp_n_units_l2: 57
    mlp_dropout_l2: 0.2958659470890055
    mlp_n_units_l3: 11
    mlp_dropout_l3: 0.11909053818649518
    lr: 0.0005483155562317579
    weight_decay: 0.0030780942332826744
    criterion: MSELoss
    batch_size: 256
Target: 72616, NaN: 0, Max: 175.0, Min: 6.0, Mean: 31.337873195989864
Prediction: 72616, NaN: 0, Max: 44.82452392578125, Min: 21.54363250732422, Mean: 31.11361598821415

 XXXXXX======== TRIAL north - elg ended

Test Set - R-squared:  0.10677767187788834
Test Set - RMSE:  7.351019105098316
Test Set - MAE:  5.762119879265038



[32m[I 2022-02-26 23:46:56,987][0m A new study created in memory with name: NeuralNetwork[0m
++++++++ Session Characteristics +++++++

Area: north
Gal Type: qso
Training Samples: 232368
Validation Samples: 58092
Test Samples: 72616
Number of features: 16
Device: cuda:0
Number of Workers: 8
Number of Trials: 25

+++++++++++++++++++++++++++++++++++++++
Trial Id: 0 | Model params: 1648 | Timestamp: 2022-02-26 23:46:56.987584

epoch 0 0.06834188394551799 2.35476834672227
epoch 5 0.07227192745079136 2.349796500291135
epoch 10 0.06148035483825787 2.363423706047505
epoch 15 0.06476131511807637 2.3592889560410883
epoch 20 0.07914790993994592 2.3410723874429706
epoch 25 0.05245872890107128 2.3747558767005987
epoch 30 0.08018110180431526 2.3397586825517105
epoch 35 0.07581181472142229 2.3453092131202604
epoch 40 0.07543143118227014 2.3457918124740065
epoch 45 0.07573441049071294 2.345407425290341
epoch 50 0.08421829666752922 2.334618295930509
epoch 55 0.06913406209640915 2.3537670176390004
epoch 60 0.08468328967191618 2.3340255132788337
epoch 65 0.07645143015917188 2.3444974976922244
epoch 70 0.07940558108639217 2.340744827231695
epoch 75 0.07602984214251429 2.3450325530800966
epoch 80 0.08299918252720884 2.336171733596102
epoch 85 0.08010023801963773 2.3398615275707395
epoch 90 0.0791227162759719 2.3411044120147224
epoch 95 0.08034429296584678 2.339551117304347
[32m[I 2022-02-26 23:52:39,308][0m Trial 0 finished with value: 2.336807979413138 and parameters: {'n_layers_mlp': 4, 'mlp_n_units_l0': 19, 'mlp_dropout_l0': 0.005041074646399779, 'mlp_n_units_l1': 19, 'mlp_dropout_l1': 0.29182966166767166, 'mlp_n_units_l2': 22, 'mlp_dropout_l2': 0.07096414200092095, 'mlp_n_units_l3': 21, 'mlp_dropout_l3': 0.10060635627683386, 'lr': 0.005109896658215974, 'weight_decay': 0.12740308448583054, 'criterion': 'MSELoss', 'batch_size': 256}. Best is trial 0 with value: 2.336807979413138.[0m
Trial Id: 1 | Model params: 7833 | Timestamp: 2022-02-26 23:52:39.308300

epoch 0 0.08233412523788652 2.3403038585797984
epoch 5 0.07662737130469488 2.3475694871548223
epoch 10 0.06845642151799647 2.3579334633544966
epoch 15 0.07834171878559404 2.3453892083283647
epoch 20 0.07464551059319624 2.350087464072941
epoch 25 0.07805214058103804 2.3457576313493074
epoch 30 0.0721714903006393 2.3532269544805304
epoch 35 0.08294783197614253 2.3395211660448063
epoch 40 0.07271305901221714 2.352540071020436
epoch 45 0.07556693065776288 2.348917124981852
epoch 50 0.031867137491225384 2.4037950625873017
epoch 55 0.0792371268904799 2.3442496369363592
epoch 60 0.07762548393917712 2.3463003503867443
epoch 65 0.08036381340691645 2.3428149337070874
epoch 70 0.07779805010139706 2.346080856580639
epoch 75 0.07730438418065333 2.346708715376004
epoch 80 0.04922479932805668 2.3821487691623107
epoch 85 0.07815091063715962 2.345631975209306
epoch 90 0.08061176334129394 2.3424990805588184
epoch 95 0.08286727901584068 2.339623914407404
