[32m[I 2022-03-08 18:04:54,068][0m A new study created in memory with name: DeepSet[0m
Starting Loading north
Finished Loading north
Finished north setup

++++++++ Session Characteristics +++++++

Area: north
Gal Type: elg
Training Set: 290439
Validation Set: 72610
Test Samples: 72610
Number of features: 5
Device: cuda:0
Number of Workers: 8
Number of Trials: 15

+++++++++++++++++++++++++++++++++++++++

Trial Id: 0 | Model params: 320388 | Timestamp: 2022-03-08 18:04:54.068801

epoch 0 -16.451673793307712 32.492730136652234
[32m[I 2022-03-08 18:09:12,921][0m Trial 0 pruned. [0m
++++++++++++++++++++
        NaN         
++++++++++++++++++++

Trial Id: 1 | Model params: 368892 | Timestamp: 2022-03-08 18:09:12.921899

epoch 0 0.10920342756705625 7.34102881855382
epoch 5 0.09621595731821442 7.394349855346983
epoch 10 0.12501612878570556 7.275581067190401
epoch 15 0.1253940074406117 7.274009847551372
epoch 20 0.12562340739048083 7.273055836864988
epoch 25 0.12774155787264085 7.264241117916032
epoch 30 0.1270862034523026 7.266969528686845
epoch 35 0.12846409381406532 7.261231824782383
epoch 40 0.12136005583418852 7.290765533554747
epoch 45 0.12808708123746515 7.262802201691819
[32m[I 2022-03-08 19:44:49,225][0m Trial 1 finished with value: 7.258688711222006 and parameters: {'n_layers_fe': 4, 'fe_neurons': 256, 'fe_dropout': 0.05784705871196877, 'n_units_l(Invariant)': 253, 'n_layers_mlp': 2, 'initialiser': 'xavier', 'lr': 0.00013484649133661537, 'weight_decay': 0.12788675852240375, 'criterion': 'MSELoss', 'batch_size': 32, 'epochs': 50}. Best is trial 1 with value: 7.258688711222006.[0m

Trial Id: 2 | Model params: 41004 | Timestamp: 2022-03-08 19:44:49.226189

epoch 0 -15.643043250205231 31.73101988362565
epoch 5 -15.664424408892277 31.751395610673466
epoch 10 -15.672432018551973 31.759023304250952
epoch 15 -15.68395811876977 31.769999340635383
epoch 20 -15.69909796442592 31.78441090332964
epoch 25 -15.719534543067113 31.803854049283714
epoch 30 -15.726763663747068 31.810728913278663
epoch 35 -15.727577761833185 31.811503024127287
epoch 40 -15.735138851066399 31.818691824619556
epoch 45 -15.724595481640534 31.808667137018837
[32m[I 2022-03-08 20:22:02,133][0m Trial 2 finished with value: 31.808095359083044 and parameters: {'n_layers_fe': 4, 'fe_neurons': 64, 'fe_dropout': 0.072110212320318, 'n_units_l(Invariant)': 309, 'n_layers_mlp': 2, 'initialiser': 'normal', 'lr': 1.106414412809244e-05, 'weight_decay': 0.09804950929780755, 'criterion': 'PoissonNLLLoss', 'batch_size': 128, 'epochs': 50}. Best is trial 1 with value: 7.258688711222006.[0m

Trial Id: 3 | Model params: 276008 | Timestamp: 2022-03-08 20:22:02.134264

epoch 0 -0.7322540997352798 10.237017819275701
epoch 5 0.12121326459159765 7.291374529220985
epoch 10 0.11657582708951697 7.310587838140325
epoch 15 0.12217313140499453 7.28739138955999
epoch 20 0.12889233806147704 7.259447639634952
epoch 25 0.1271015337066408 7.266905716555159
epoch 30 0.13078601160368175 7.25155280429227
epoch 35 0.13125092387042336 7.249613243482296
epoch 40 0.12977250161895915 7.255779254924099
epoch 45 0.13278564363015455 7.2432068810702
epoch 50 0.1278203541677868 7.263912999443889
epoch 55 0.13310829284605874 7.241859329327587
epoch 60 0.13110273994803723 7.250231506194381
epoch 65 0.13373562072124534 7.239238562294722
epoch 70 0.13315877612441118 7.241648462087766
[32m[I 2022-03-08 22:10:16,211][0m Trial 3 finished with value: 7.232766149131779 and parameters: {'n_layers_fe': 2, 'fe_neurons': 256, 'fe_dropout': 0.4116347086328343, 'n_units_l(Invariant)': 403, 'n_layers_mlp': 2, 'initialiser': 'kaiming_he', 'lr': 6.968607481727695e-05, 'weight_decay': 0.06708529765076633, 'criterion': 'MSELoss', 'batch_size': 32, 'epochs': 75}. Best is trial 3 with value: 7.232766149131779.[0m

Trial Id: 4 | Model params: 25490 | Timestamp: 2022-03-08 22:10:16.211616

epoch 0 -14.412635399751498 30.535575729850933
[32m[I 2022-03-08 22:13:01,950][0m Trial 4 pruned. [0m
++++++++++++++++++++
        NaN         
++++++++++++++++++++

Trial Id: 5 | Model params: 360120 | Timestamp: 2022-03-08 22:13:01.950491

[32m[I 2022-03-08 22:14:00,391][0m Trial 5 pruned. [0m
++++++++++++++++++++
        NaN         
++++++++++++++++++++

Trial Id: 6 | Model params: 52224 | Timestamp: 2022-03-08 22:14:00.391842

[32m[I 2022-03-08 22:14:51,612][0m Trial 6 pruned. [0m
++++++++++++++++++++
        NaN         
++++++++++++++++++++

Trial Id: 7 | Model params: 407592 | Timestamp: 2022-03-08 22:14:51.613100

epoch 0 -0.4290605250030124 9.298073432618681
epoch 5 0.10224886769077535 7.369629268775159
epoch 10 0.12170047385859295 7.289353038904111
epoch 15 0.11898558597388242 7.300610307264127
epoch 20 0.12530712948000644 7.274371116198969
[32m[I 2022-03-08 23:05:57,905][0m Trial 7 finished with value: 7.31276468206355 and parameters: {'n_layers_fe': 4, 'fe_neurons': 256, 'fe_dropout': 0.139416516709523, 'n_units_l(Invariant)': 403, 'n_layers_mlp': 2, 'initialiser': 'xavier', 'lr': 5.465462581014413e-05, 'weight_decay': 0.13156493198672806, 'criterion': 'MSELoss', 'batch_size': 128, 'epochs': 25}. Best is trial 3 with value: 7.232766149131779.[0m

Trial Id: 8 | Model params: 518278 | Timestamp: 2022-03-08 23:05:57.905808

epoch 0 -0.05468241836138876 7.987824482561433
epoch 5 0.12385887135506302 7.280390834763917
epoch 10 0.12849265761539308 7.261112833653504
epoch 15 0.13302839511926268 7.242193047346843
epoch 20 0.13411187140002756 7.237666256939282
epoch 25 0.13514021497178963 7.233367191945442
epoch 30 0.1290084686021875 7.2589637317808124
epoch 35 0.1367351633675309 7.226694334977562
epoch 40 0.13261208938123914 7.243931630627339
epoch 45 0.13747944120491806 7.2235783571052545
epoch 50 0.1325037517721368 7.24438400361987
epoch 55 0.13594701401189868 7.2299925204282935
epoch 60 0.13707248814882633 7.225282264678274
epoch 65 0.14176158847031528 7.2056246317881465
epoch 70 0.13841851654953485 7.219644925221629
[32m[I 2022-03-09 01:44:16,292][0m Trial 8 finished with value: 7.202370622350592 and parameters: {'n_layers_fe': 4, 'fe_neurons': 256, 'fe_dropout': 0.17121504275913296, 'n_units_l(Invariant)': 322, 'n_layers_mlp': 4, 'initialiser': 'uniform', 'lr': 2.653434384787307e-05, 'weight_decay': 0.05519943674470178, 'criterion': 'MSELoss', 'batch_size': 32, 'epochs': 75}. Best is trial 8 with value: 7.202370622350592.[0m

Trial Id: 9 | Model params: 106812 | Timestamp: 2022-03-09 01:44:16.292368

[32m[I 2022-03-09 01:45:19,131][0m Trial 9 pruned. [0m
++++++++++++++++++++
        NaN         
++++++++++++++++++++

Trial Id: 10 | Model params: 116566 | Timestamp: 2022-03-09 01:45:19.131987

[32m[I 2022-03-09 01:46:55,970][0m Trial 10 pruned. [0m
epoch 0 -0.013563355983242431 7.83056521331577

Trial Id: 11 | Model params: 400884 | Timestamp: 2022-03-09 01:46:55.971155

[32m[I 2022-03-09 01:48:27,227][0m Trial 11 pruned. [0m
epoch 0 0.0787139788914557 7.465603162825941

Trial Id: 12 | Model params: 426684 | Timestamp: 2022-03-09 01:48:27.227603

epoch 0 -2.674109270473947 14.908834525921236
epoch 5 0.1193720301306197 7.2990089783897245
epoch 10 0.12186219527797482 7.288681913191903
epoch 15 0.1254032279956686 7.273971504236995
epoch 20 0.12832863253178295 7.261796103057959
epoch 25 0.12976888803904751 7.255794319554319
epoch 30 0.130729837579053 7.251787120772516
epoch 35 0.12948009665116222 7.256998159010379
epoch 40 0.13171549850978037 7.247674572731745
epoch 45 0.1326989366729635 7.243568971899789
epoch 50 0.13395492421954025 7.238322161441243
epoch 55 0.13094129863596338 7.2509050222571405
epoch 60 0.12209168323967334 7.28772945786975
epoch 65 0.13523384865423949 7.232975622611918
epoch 70 0.1333334128563931 7.240918961985145
[32m[I 2022-03-09 03:45:23,475][0m Trial 12 finished with value: 7.226769990943754 and parameters: {'n_layers_fe': 2, 'fe_neurons': 256, 'fe_dropout': 0.49657348283407715, 'n_units_l(Invariant)': 477, 'n_layers_mlp': 4, 'initialiser': 'kaiming_he', 'lr': 3.2406888111201565e-05, 'weight_decay': 0.050055304515492255, 'criterion': 'MSELoss', 'batch_size': 32, 'epochs': 75}. Best is trial 8 with value: 7.202370622350592.[0m

Trial Id: 13 | Model params: 429780 | Timestamp: 2022-03-09 03:45:23.476119

epoch 0 -0.9845657113636053 10.957220518057865
epoch 5 0.10339628344113583 7.364918201290219
epoch 10 0.12829862468023256 7.2619210979999655
epoch 15 0.13070864334288856 7.251875525481815
epoch 20 0.1316976062377867 7.247749246814095
epoch 25 0.12964063467424247 7.256328973934447
epoch 30 0.13353514919478504 7.240076168738229
epoch 35 0.1313133956348752 7.249352578875222
epoch 40 0.13499515250339655 7.233973790912288
epoch 45 0.13813842888836692 7.220818330863195
epoch 50 0.1358843275807764 7.230254781085656
epoch 55 0.13866753332652004 7.218601528476325
epoch 60 0.1384481999578413 7.219520557696269
epoch 65 0.14148363263536412 7.206791372431487
epoch 70 0.14044456322190624 7.2111512730310094
[32m[I 2022-03-09 05:43:04,182][0m Trial 13 finished with value: 7.212150857952423 and parameters: {'n_layers_fe': 2, 'fe_neurons': 256, 'fe_dropout': 0.2503305085520887, 'n_units_l(Invariant)': 489, 'n_layers_mlp': 4, 'initialiser': 'uniform', 'lr': 2.085992951494246e-05, 'weight_decay': 0.04966255599902354, 'criterion': 'MSELoss', 'batch_size': 32, 'epochs': 75}. Best is trial 8 with value: 7.202370622350592.[0m

Trial Id: 14 | Model params: 465904 | Timestamp: 2022-03-09 05:43:04.182632

[32m[I 2022-03-09 05:44:53,866][0m Trial 14 pruned. [0m
epoch 0 -0.26736004430758786 8.756240186323689

Study statistics: 
  Number of finished trials:  15
  Number of pruned trials:  8
  Number of complete trials:  7

Best trial:
  Value:  7.202370622350592
  Params: 
    n_layers_fe: 4
    fe_neurons: 256
    fe_dropout: 0.17121504275913296
    n_units_l(Invariant): 322
    n_layers_mlp: 4
    initialiser: uniform
    lr: 2.653434384787307e-05
    weight_decay: 0.05519943674470178
    criterion: MSELoss
    batch_size: 32
    epochs: 75
Target: 72610, NaN: 0, Max: 175.0, Min: 6.0, Mean: 31.337543038149015
Prediction: 72610, NaN: 0, Max: 48.20795440673828, Min: 21.312057495117188, Mean: 31.19229992915244

 XXXXXX======== TRIAL north - elg ended

Test Set - R-squared:  0.14253656231312106
Test Set - RMSE:  7.202370622350592
Test Set - MAE:  5.6469680541574



[32m[I 2022-03-09 05:46:57,588][0m A new study created in memory with name: DeepSet[0m
Starting Loading north
Finished Loading north
Finished north setup

++++++++ Session Characteristics +++++++

Area: north
Gal Type: elg
Training Set: 290439
Validation Set: 72610
Test Samples: 72610
Number of features: 5
Device: cuda:0
Number of Workers: 8
Number of Trials: 15

+++++++++++++++++++++++++++++++++++++++

Previous best Test-set performance: 0.14253656231312106

Trial Id: 0 | Model params: 518278 | Timestamp: 2022-03-09 05:46:57.588760

epoch 0 0.1287634045257725 7.259984858890864
epoch 1 0.12634840855152263 7.270039935328166
epoch 2 0.12622543670847963 7.270551568776469
epoch 3 0.12456008306038602 7.277476853802973
[32m[I 2022-03-09 05:56:46,952][0m Trial 0 finished with value: 7.2698856136414145 and parameters: {'lr': 0.000227291963622192, 'weight_decay': 0.28745957056709676, 'criterion': 'MSELoss', 'batch_size': 128, 'epochs': 5}. Best is trial 0 with value: 7.2698856136414145.[0m
epoch 4 0.12638549829448742 7.2698856136414145

Previous best Test-set performance: 0.14253656231312106

Trial Id: 1 | Model params: 518278 | Timestamp: 2022-03-09 05:56:46.952892

epoch 0 0.11333358259740434 7.32399080238686
epoch 1 0.11495808197936541 7.317278428419842
epoch 2 0.11507520483108546 7.316794242951084
epoch 3 0.10458495589680916 7.360034561657107
epoch 4 0.11364840937889775 7.322690429935082
epoch 5 0.1107880516863563 7.334496491403122
epoch 6 0.11399404562080695 7.321262534945192
epoch 7 0.10926857721727246 7.3407603654526685
epoch 8 0.11152341622392703 7.331463106514701
epoch 9 0.10513279470528258 7.357782684430795
epoch 10 0.09830493839545607 7.385799365258059
epoch 11 0.10332560545884362 7.3652084785279195
epoch 12 0.06994539568179758 7.501046951805099
epoch 13 0.10770204302254371 7.347212647360424
epoch 14 0.10708108741600897 7.349768687859168
epoch 15 0.04608518927820082 7.596655922512856
epoch 16 0.10170284696607301 7.371870067199762
epoch 17 0.10829872421371711 7.34475568962968
epoch 18 0.10487897854412631 7.358826074857468
[32m[I 2022-03-09 06:38:28,832][0m Trial 1 finished with value: 7.323091849590364 and parameters: {'lr': 0.001116932564039453, 'weight_decay': 0.2809395913766483, 'criterion': 'MSELoss', 'batch_size': 32, 'epochs': 20}. Best is trial 0 with value: 7.2698856136414145.[0m
epoch 19 0.11355122960444985 7.323091849590364

Previous best Test-set performance: 0.14253656231312106

Trial Id: 2 | Model params: 518278 | Timestamp: 2022-03-09 06:38:28.833146

epoch 0 0.12126463697844236 7.291161405392261
epoch 1 0.13467733347695565 7.235302617779757
epoch 2 0.1315746609850038 7.248262342729425
epoch 3 0.13201291369704626 7.246433186350908
epoch 4 0.13148693863266203 7.24862841827929
epoch 5 0.13341899005124713 7.240561458396349
epoch 6 0.13347597090756813 7.240323407844997
epoch 7 0.12892339873836667 7.259318215123259
epoch 8 0.1304655867623874 7.252889278156869
[32m[I 2022-03-09 06:57:22,032][0m Trial 2 finished with value: 7.269246055261242 and parameters: {'lr': 8.038759693326428e-05, 'weight_decay': 0.20763536320852535, 'criterion': 'MSELoss', 'batch_size': 128, 'epochs': 10}. Best is trial 2 with value: 7.269246055261242.[0m
epoch 9 0.12653920164792387 7.269246055261242

Previous best Test-set performance: 0.14253656231312106

Trial Id: 3 | Model params: 518278 | Timestamp: 2022-03-09 06:57:22.032348

epoch 0 -12.53872034473216 28.619132748368738
epoch 1 -12.724265226220279 28.814574545932327
epoch 2 -16.959145153907485 32.961767419002406
epoch 3 -12.85339813955377 28.949816696756354
[32m[I 2022-03-09 07:07:50,277][0m Trial 3 finished with value: 29.15515331033706 and parameters: {'lr': 0.0035080279408539355, 'weight_decay': 0.27891035005574966, 'criterion': 'PoissonNLLLoss', 'batch_size': 32, 'epochs': 5}. Best is trial 2 with value: 7.269246055261242.[0m
epoch 4 -13.050615143127999 29.15515331033706

Previous best Test-set performance: 0.14253656231312106

Trial Id: 4 | Model params: 518278 | Timestamp: 2022-03-09 07:07:50.277421

epoch 0 0.12599828605038565 7.2714965512257255
epoch 1 0.12499502099036375 7.275668823407999
epoch 2 0.10909920247525295 7.341458263977938
epoch 3 -0.06294103537033635 8.019037549612014
epoch 4 0.11476752791984302 7.318066109792272
epoch 5 0.12211762994175579 7.2876217621464745
epoch 6 0.12369022492745052 7.281091494045148
epoch 7 0.12707453330836527 7.267018105245766
epoch 8 0.11089487672289988 7.334055915120829
epoch 9 0.0971840924892754 7.390388373420587
epoch 10 0.12029298664614207 7.295191345687684
epoch 11 0.12524747293235183 7.274619178394648
epoch 12 0.12330457904969305 7.282693446996502
epoch 13 0.11259131086141738 7.327055796148557
epoch 14 0.12693680891008052 7.267591353627483
epoch 15 0.12268667199367944 7.285259466459499
epoch 16 0.1259263053184162 7.271795976764431
epoch 17 0.05084231494867464 7.577690175206983
epoch 18 0.10098473016701537 7.374816089089772
[32m[I 2022-03-09 07:45:00,053][0m Trial 4 finished with value: 7.283267400535512 and parameters: {'lr': 0.0008366957238646183, 'weight_decay': 0.17970030615476726, 'criterion': 'MSELoss', 'batch_size': 256, 'epochs': 20}. Best is trial 2 with value: 7.269246055261242.[0m
epoch 19 0.12316638779635813 7.283267400535512

Previous best Test-set performance: 0.14253656231312106

Trial Id: 5 | Model params: 518278 | Timestamp: 2022-03-09 07:45:00.053543

[32m[I 2022-03-09 07:46:52,159][0m Trial 5 pruned. [0m
epoch 0 0.14166669749523064 7.206022965071547

Previous best Test-set performance: 0.14253656231312106

Trial Id: 6 | Model params: 518278 | Timestamp: 2022-03-09 07:46:52.159560

epoch 0 -12.215823366626235 28.27579166237455
epoch 1 -12.79319733687835 28.886846598237142
epoch 2 -12.713808207248759 28.80359501569035
epoch 3 -13.235097029736636 29.345929927725187
epoch 4 -13.266157411085551 29.37792827319009
epoch 5 -12.996549305705749 29.099005694745138
epoch 6 -12.778302128213754 28.87124500046598
epoch 7 -12.797828710978312 28.8916958931972
epoch 8 -12.772266843815636 28.864921098643855
epoch 9 -12.759212830614969 28.851238079150278
epoch 10 -12.75080714525201 28.842423931031906
epoch 11 -12.744325932464312 28.835625933028318
epoch 12 -12.736465237609055 28.82737887617124
epoch 13 -12.705569943920661 28.794942158491207
epoch 14 -12.703024779598401 28.792268381971823
epoch 15 -12.745763011171823 28.837133390764343
[32m[I 2022-03-09 08:19:05,750][0m Trial 6 pruned. [0m
++++++++++++++++++++
        NaN         
++++++++++++++++++++

Previous best Test-set performance: 0.14253656231312106

Trial Id: 7 | Model params: 518278 | Timestamp: 2022-03-09 08:19:05.750986

epoch 0 0.05115381115453843 7.576446643457953
epoch 1 0.10879992155420226 7.342691271011357
epoch 2 0.11081980086427379 7.334365551691215
epoch 3 0.11135162161651535 7.332171873054497
[32m[I 2022-03-09 08:28:28,179][0m Trial 7 finished with value: 7.36862585482745 and parameters: {'lr': 0.0034873099607928863, 'weight_decay': 0.17766809477146087, 'criterion': 'MSELoss', 'batch_size': 256, 'epochs': 5}. Best is trial 2 with value: 7.269246055261242.[0m
epoch 4 0.10249331816432061 7.36862585482745

Previous best Test-set performance: 0.14253656231312106

Trial Id: 8 | Model params: 518278 | Timestamp: 2022-03-09 08:28:28.179955

epoch 0 0.051762968009231414 7.57401422319689
epoch 1 0.061059385790243614 7.5367953500002605
epoch 2 -0.03197789292797526 7.901378335616134
epoch 3 0.052507466947853465 7.571040308123078
epoch 4 -0.02143767483446246 7.860923982134565
epoch 5 0.04215238104366337 7.612299594511426
epoch 6 0.060109293631173566 7.540607539797081
epoch 7 0.04852421058812317 7.586937934991728
epoch 8 0.03977013767621729 7.621759913912678
[32m[I 2022-03-09 08:49:12,772][0m Trial 8 finished with value: 7.524744901019486 and parameters: {'lr': 0.0023127817317018674, 'weight_decay': 0.1901826361082419, 'criterion': 'MSELoss', 'batch_size': 32, 'epochs': 10}. Best is trial 2 with value: 7.269246055261242.[0m
epoch 9 0.06405949659084031 7.524744901019486

Previous best Test-set performance: 0.14253656231312106

Trial Id: 9 | Model params: 518278 | Timestamp: 2022-03-09 08:49:12.773289

epoch 0 -12.72441165962099 28.814728266543828
epoch 1 -12.754068819221077 28.845844421349877
epoch 2 -12.697642548526272 28.786613358214943
epoch 3 -12.686764806769713 28.77518089685972
[32m[I 2022-03-09 08:59:45,519][0m Trial 9 finished with value: 28.849975929286884 and parameters: {'lr': 0.0003238754864361833, 'weight_decay': 0.212374444736917, 'criterion': 'PoissonNLLLoss', 'batch_size': 32, 'epochs': 5}. Best is trial 2 with value: 7.269246055261242.[0m
epoch 4 -12.75800901338611 28.849975929286884

Previous best Test-set performance: 0.14253656231312106

Trial Id: 10 | Model params: 518278 | Timestamp: 2022-03-09 08:59:45.520082

[32m[I 2022-03-09 09:01:38,838][0m Trial 10 pruned. [0m
epoch 0 0.14251142854398746 7.2024761786845275

Previous best Test-set performance: 0.14253656231312106

Trial Id: 11 | Model params: 518278 | Timestamp: 2022-03-09 09:01:38.838504

[32m[I 2022-03-09 09:03:32,223][0m Trial 11 pruned. [0m
epoch 0 0.12004501330419148 7.296219463849034

Previous best Test-set performance: 0.14253656231312106

Trial Id: 12 | Model params: 518278 | Timestamp: 2022-03-09 09:03:32.224085

[32m[I 2022-03-09 09:05:22,402][0m Trial 12 pruned. [0m
epoch 0 0.13800553032030816 7.221375032459804

Previous best Test-set performance: 0.14253656231312106

Trial Id: 13 | Model params: 518278 | Timestamp: 2022-03-09 09:05:22.402728

[32m[I 2022-03-09 09:07:14,565][0m Trial 13 pruned. [0m
epoch 0 0.141065326024141 7.20854689012676

Previous best Test-set performance: 0.14253656231312106

Trial Id: 14 | Model params: 518278 | Timestamp: 2022-03-09 09:07:14.565647

[32m[I 2022-03-09 09:09:03,500][0m Trial 14 pruned. [0m
epoch 0 0.11373798601767515 7.322320396995539

Study statistics: 
  Number of finished trials:  15
  Number of pruned trials:  7
  Number of complete trials:  8

Best trial:
  Value:  7.269246055261242
  Params: 
    lr: 8.038759693326428e-05
    weight_decay: 0.20763536320852535
    criterion: MSELoss
    batch_size: 128
    epochs: 10
Target: 72610, NaN: 0, Max: 175.0, Min: 6.0, Mean: 31.337543038149015
Prediction: 72610, NaN: 0, Max: 48.12274169921875, Min: 24.69222640991211, Mean: 31.98746555739732

 XXXXXX======== TRIAL north - elg ended

Test Set - R-squared:  0.12653920164792387
Test Set - RMSE:  7.269246055261242
Test Set - MAE:  5.741219996946309



