[32m[I 2022-03-03 09:00:27,994][0m Trial 6 finished with value: 8.524715998927471 and parameters: {'n_layers_fe': 4, 'fe_neurons': 128, 'fe_dropout': 0.3140885791777155, 'n_units_l(Invariant)': 336, 'n_layers_mlp': 2, 'initialiser': 'kaiming_he', 'lr': 0.00043001994552297894, 'weight_decay': 0.23915155786613118, 'criterion': 'MSELoss', 'batch_size': 128, 'epochs': 50}. Best is trial 0 with value: 8.440809136323137.[0m

Trial Id: 7 | Model params: 49324 | Timestamp: 2022-03-03 09:00:27.994512

[32m[I 2022-03-03 09:01:20,699][0m Trial 7 pruned. [0m
epoch 0 0.10189487719480528 9.273798748890368

Trial Id: 8 | Model params: 142952 | Timestamp: 2022-03-03 09:01:20.699891

epoch 0 -0.2457535652675844 10.922200624000043
epoch 5 -0.0979057775486869 10.253605764254997
epoch 10 -0.10774418524846574 10.299444927634381
epoch 15 -0.07600984674468703 10.150845157518658
epoch 20 -0.04384305345564843 9.997966630901287
[32m[I 2022-03-03 09:39:37,536][0m Trial 8 finished with value: 10.302322343888891 and parameters: {'n_layers_fe': 4, 'fe_neurons': 128, 'fe_dropout': 0.37683230746153884, 'n_units_l(Invariant)': 499, 'n_layers_mlp': 2, 'initialiser': 'normal', 'lr': 1.4404862823648371e-05, 'weight_decay': 0.12144488300524366, 'criterion': 'MSELoss', 'batch_size': 128, 'epochs': 25}. Best is trial 0 with value: 8.440809136323137.[0m

Trial Id: 9 | Model params: 53742 | Timestamp: 2022-03-03 09:39:37.536275

epoch 0 -5.096786976987858 24.162651533835263
epoch 5 -5.033153565817094 24.036225519932334
epoch 10 -4.99314124262744 23.9563879097619
epoch 15 -5.029339293998061 24.028626244381083
epoch 20 -5.062411144231785 24.094436472084766
epoch 25 -5.075374146648074 24.12018278367106
epoch 30 -5.026767139560655 24.02350031534898
epoch 35 -5.035600517597957 24.04109938247792
epoch 40 -5.008866905831947 23.98779742162858
epoch 45 -5.013883444952116 23.997808511970845
epoch 50 -5.0228766668942955 24.015745091251087
epoch 55 -5.056414409164605 24.08251681693212
epoch 60 -5.03312844133347 24.03617547161377
epoch 65 -5.038456182393765 24.046786074487773
epoch 70 -5.034408566292889 24.038725365623527
[32m[I 2022-03-03 11:32:35,726][0m Trial 9 finished with value: 24.1228661299158 and parameters: {'n_layers_fe': 2, 'fe_neurons': 64, 'fe_dropout': 0.14786046471971487, 'n_units_l(Invariant)': 502, 'n_layers_mlp': 4, 'initialiser': 'uniform', 'lr': 0.0008448318985940032, 'weight_decay': 0.09908221055240617, 'criterion': 'PoissonNLLLoss', 'batch_size': 32, 'epochs': 75}. Best is trial 0 with value: 8.440809136323137.[0m

Study statistics: 
  Number of finished trials:  10
  Number of pruned trials:  2
  Number of complete trials:  8

Best trial:
  Value:  8.440809136323137
  Params: 
    n_layers_fe: 2
    fe_neurons: 64
    fe_dropout: 0.05933251255522426
    n_units_l(Invariant): 352
    n_layers_mlp: 4
    initialiser: uniform
    lr: 0.00034281039030819514
    weight_decay: 0.16816741223286236
    criterion: MSELoss
    batch_size: 128
    epochs: 25
Target: 72610, NaN: 0, Max: 105.0, Min: 1.0, Mean: 25.195950970940643
Prediction: 72610, NaN: 0, Max: 50.222896575927734, Min: 16.84969139099121, Mean: 24.808358065436128

 XXXXXX======== TRIAL north - rlbg ended

Test Set - R-squared:  0.25598789796540133
Test Set - RMSE:  8.440809136323137
Test Set - MAE:  6.533777049277016



./hp_optim.sh: line 11: north: command not found
./hp_optim.sh: line 12: syntax error near unexpected token `done'
./hp_optim.sh: line 12: `    done'
