[32m[I 2022-03-02 11:40:51,201][0m A new study created in memory with name: DeepSet[0m
Starting Loading north
Finished Loading north
Finished north setup

++++++++ Session Characteristics +++++++

Area: north
Gal Type: elg
Training Set: 290439
Validation Set: 72610
Test Samples: 72610
Number of features: 5
Device: cuda:0
Number of Workers: 8
Number of Trials: 10

+++++++++++++++++++++++++++++++++++++++

Trial Id: 0 | Model params: 58432 | Timestamp: 2022-03-02 11:40:51.202334

epoch 0 -15.025044017897706 31.13631955987744
epoch 5 -15.055535212301077 31.165927353705012
epoch 10 -14.93171021415467 31.04551435142305
epoch 15 -14.928202689863184 31.042096674086828
epoch 20 -14.939443633978776 31.053048346978677
epoch 25 -14.94915486959573 31.062506567652317
epoch 30 -14.952411857183364 31.06567805337296
epoch 35 -14.953865068776876 31.067093011055178
epoch 40 -14.954568168838962 31.06777757978737
epoch 45 -14.955275123464135 31.068465886281267
epoch 50 -14.955425245985662 31.068612046890586
epoch 55 -14.95506928625953 31.06826548024798
epoch 60 -14.95510744467043 31.068302631917774
epoch 65 -14.954701462076926 31.067907358167357
epoch 70 -14.954809434553125 31.06801248308055
[32m[I 2022-03-02 13:46:07,503][0m Trial 0 finished with value: 31.068114722470796 and parameters: {'n_layers_fe': 4, 'fe_neurons': 64, 'fe_dropout': 0.37637565487687413, 'n_units_l(Invariant)': 447, 'n_layers_mlp': 4, 'initialiser': 'kaiming_he', 'lr': 6.495706041201939e-05, 'weight_decay': 0.12220911456309706, 'criterion': 'PoissonNLLLoss', 'batch_size': 32, 'epochs': 75}. Best is trial 0 with value: 31.068114722470796.[0m

Trial Id: 1 | Model params: 43380 | Timestamp: 2022-03-02 13:46:07.503315

epoch 0 -8.123480250940835 23.493511188195683
epoch 5 0.030281932038863646 7.659323346109765
epoch 10 0.04661839899383413 7.594532474538596
epoch 15 0.06875142507136034 7.505860194518397
epoch 20 0.10030220810434332 7.3776149957831585
epoch 25 0.10716806333832041 7.34941072227631
epoch 30 0.1204545204265266 7.294521535216811
epoch 35 0.12200489650749446 7.2880896678041145
epoch 40 0.12191283734117087 7.288471741616373
epoch 45 0.12132567383106863 7.290908179397782
epoch 50 0.12119142719103615 7.291465122120646
epoch 55 0.12151733987591173 7.2901129497513395
epoch 60 0.11922312941903412 7.299626027660438
epoch 65 0.123132497530269 7.283408151005016
epoch 70 0.12269561992233058 7.285222314312115
[32m[I 2022-03-02 14:36:10,304][0m Trial 1 finished with value: 7.290561259460578 and parameters: {'n_layers_fe': 2, 'fe_neurons': 64, 'fe_dropout': 0.4677566158348737, 'n_units_l(Invariant)': 345, 'n_layers_mlp': 4, 'initialiser': 'normal', 'lr': 0.00021642527987158306, 'weight_decay': 0.21612286838074393, 'criterion': 'MSELoss', 'batch_size': 256, 'epochs': 75}. Best is trial 1 with value: 7.290561259460578.[0m

Trial Id: 2 | Model params: 137622 | Timestamp: 2022-03-02 14:36:10.304342

[32m[I 2022-03-02 14:37:11,323][0m Trial 2 pruned. [0m
++++++++++++++++++++
        NaN         
++++++++++++++++++++

Trial Id: 3 | Model params: 293810 | Timestamp: 2022-03-02 14:37:11.323156

[32m[I 2022-03-02 14:38:41,283][0m Trial 3 pruned. [0m
++++++++++++++++++++
        NaN         
++++++++++++++++++++

Trial Id: 4 | Model params: 119036 | Timestamp: 2022-03-02 14:38:41.283694

[32m[I 2022-03-02 14:40:19,284][0m Trial 4 pruned. [0m
++++++++++++++++++++
        NaN         
++++++++++++++++++++

Trial Id: 5 | Model params: 100568 | Timestamp: 2022-03-02 14:40:19.284362

epoch 0 0.07060449579667694 7.498388604059382
epoch 5 0.12073589999807888 7.293354629367826
epoch 10 0.13165195328467816 7.247939777676265
epoch 15 0.1294419244731646 7.257157266451624
epoch 20 0.13428477783774384 7.236943587619345
epoch 25 0.13304116305740366 7.2421397190643715
epoch 30 0.13284113751369775 7.242975127463527
epoch 35 0.1366661507883863 7.226983193521514
epoch 40 0.13526044848454988 7.232864380165953
epoch 45 0.13213575107582776 7.245920411237509
epoch 50 0.13753154469294793 7.223360171400097
epoch 55 0.1328534573682456 7.242923676269945
epoch 60 0.1305480993841568 7.2525451462291475
epoch 65 0.1378013259143953 7.22223034495085
epoch 70 0.1324190322272697 7.244737737675294
[32m[I 2022-03-02 16:19:18,431][0m Trial 5 finished with value: 7.216953900284352 and parameters: {'n_layers_fe': 2, 'fe_neurons': 128, 'fe_dropout': 0.13238475614411566, 'n_units_l(Invariant)': 427, 'n_layers_mlp': 2, 'initialiser': 'kaiming_he', 'lr': 0.00018294636997629666, 'weight_decay': 0.040169271961956486, 'criterion': 'MSELoss', 'batch_size': 32, 'epochs': 75}. Best is trial 5 with value: 7.216953900284352.[0m

Trial Id: 6 | Model params: 248402 | Timestamp: 2022-03-02 16:19:18.431262

epoch 0 -21.753385383072967 37.101431941688276
epoch 5 -172.77203413432838 102.53156888443347
[32m[I 2022-03-02 16:33:30,947][0m Trial 6 pruned. [0m
++++++++++++++++++++
        NaN         
++++++++++++++++++++

Trial Id: 7 | Model params: 373794 | Timestamp: 2022-03-02 16:33:30.948083

[32m[I 2022-03-02 16:35:45,624][0m Trial 7 pruned. [0m
++++++++++++++++++++
        NaN         
++++++++++++++++++++

Trial Id: 8 | Model params: 38694 | Timestamp: 2022-03-02 16:35:45.624826

epoch 0 0.1134470387375418 7.323522205463608
epoch 5 0.1001382571988394 7.378287172357584
epoch 10 0.04100332531183348 7.616864169616513
epoch 15 0.1180498990536597 7.304486108090169
epoch 20 0.09851678793482599 7.384931682726286
epoch 25 0.10897624286804841 7.341964870146651
epoch 30 0.10760830430392532 7.3475985611723615
epoch 35 0.08694126602707675 7.43219366652475
epoch 40 0.10978464368820207 7.33863353514712
epoch 45 0.09624057392365026 7.394249153728166
[32m[I 2022-03-02 17:47:09,866][0m Trial 8 finished with value: 7.389541141646543 and parameters: {'n_layers_fe': 2, 'fe_neurons': 64, 'fe_dropout': 0.21733075368002852, 'n_units_l(Invariant)': 274, 'n_layers_mlp': 4, 'initialiser': 'normal', 'lr': 0.00089749360743848, 'weight_decay': 0.29960266539493985, 'criterion': 'MSELoss', 'batch_size': 32, 'epochs': 50}. Best is trial 5 with value: 7.216953900284352.[0m

Trial Id: 9 | Model params: 85102 | Timestamp: 2022-03-02 17:47:09.866762

epoch 0 -0.7767513522147751 10.36766575947788
epoch 5 0.10402139763791807 7.362350334580747
epoch 10 0.11738562402628383 7.307236419244192
epoch 15 0.11817968550895697 7.303948629700682
epoch 20 0.10724497251424314 7.34909417373455
epoch 25 0.10904341890406188 7.341688102333876
epoch 30 0.12419695477933845 7.278986028576446
epoch 35 0.12278300980241552 7.284859458173316
epoch 40 0.13217972818931745 7.245736823365592
epoch 45 0.1299371348708791 7.255092883234714
[32m[I 2022-03-02 19:00:14,334][0m Trial 9 finished with value: 7.240916008995052 and parameters: {'n_layers_fe': 4, 'fe_neurons': 128, 'fe_dropout': 0.43136931223288577, 'n_units_l(Invariant)': 54, 'n_layers_mlp': 2, 'initialiser': 'xavier', 'lr': 3.957067958036339e-05, 'weight_decay': 0.025576652009714672, 'criterion': 'MSELoss', 'batch_size': 32, 'epochs': 50}. Best is trial 5 with value: 7.216953900284352.[0m

Study statistics: 
  Number of finished trials:  10
  Number of pruned trials:  5
  Number of complete trials:  5

Best trial:
  Value:  7.216953900284352
  Params: 
    n_layers_fe: 2
    fe_neurons: 128
    fe_dropout: 0.13238475614411566
    n_units_l(Invariant): 427
    n_layers_mlp: 2
    initialiser: kaiming_he
    lr: 0.00018294636997629666
    weight_decay: 0.040169271961956486
    criterion: MSELoss
    batch_size: 32
    epochs: 75
Target: 72610, NaN: 0, Max: 175.0, Min: 6.0, Mean: 31.337543038149015
Prediction: 72610, NaN: 0, Max: 48.79488754272461, Min: 21.420352935791016, Mean: 31.608632394207227

 XXXXXX======== TRIAL north - elg ended

Test Set - R-squared:  0.1390606825230084
Test Set - RMSE:  7.216953900284352
Test Set - MAE:  5.679819974884844



[32m[I 2022-03-02 19:00:48,795][0m A new study created in memory with name: DeepSet[0m
Starting Loading north
Finished Loading north
Finished north setup

++++++++ Session Characteristics +++++++

Area: north
Gal Type: qso
Training Set: 290439
Validation Set: 72610
Test Samples: 72610
Number of features: 5
Device: cuda:0
Number of Workers: 8
Number of Trials: 10

+++++++++++++++++++++++++++++++++++++++

Trial Id: 0 | Model params: 126442 | Timestamp: 2022-03-02 19:00:48.796567

[32m[I 2022-03-02 19:02:08,686][0m Trial 0 pruned. [0m
++++++++++++++++++++
        NaN         
++++++++++++++++++++

Trial Id: 1 | Model params: 478030 | Timestamp: 2022-03-02 19:02:08.686281

epoch 0 0.10992551809129003 2.3350631485712903
epoch 5 0.11218874513100319 2.332092531001971
epoch 10 0.10551205593670088 2.340845231599004
epoch 15 0.11940112323709895 2.3226005174586106
epoch 20 0.12102190400239021 2.320462109105374
[32m[I 2022-03-02 19:54:02,251][0m Trial 1 finished with value: 2.3313288296037085 and parameters: {'n_layers_fe': 4, 'fe_neurons': 256, 'fe_dropout': 0.16768324538700946, 'n_units_l(Invariant)': 166, 'n_layers_mlp': 4, 'initialiser': 'xavier', 'lr': 0.00021947924829424296, 'weight_decay': 0.02138275333446956, 'criterion': 'MSELoss', 'batch_size': 32, 'epochs': 25}. Best is trial 1 with value: 2.3313288296037085.[0m

Trial Id: 2 | Model params: 24764 | Timestamp: 2022-03-02 19:54:02.251377

epoch 0 -2.731836929229452 4.781308695011374
[32m[I 2022-03-02 19:57:56,826][0m Trial 2 pruned. [0m
++++++++++++++++++++
        NaN         
++++++++++++++++++++

Trial Id: 3 | Model params: 329418 | Timestamp: 2022-03-02 19:57:56.826310

epoch 0 0.07754079835341499 2.377163419355546
epoch 5 0.08920568295671738 2.362085485347426
epoch 10 0.09420470031839578 2.355594253823617
epoch 15 0.06916028005058039 2.3879372392081755
epoch 20 0.08564781604206961 2.3666945361713387
[32m[I 2022-03-02 20:41:03,913][0m Trial 3 finished with value: 2.366665254260995 and parameters: {'n_layers_fe': 4, 'fe_neurons': 256, 'fe_dropout': 0.45318238310181375, 'n_units_l(Invariant)': 100, 'n_layers_mlp': 2, 'initialiser': 'xavier', 'lr': 0.0022649408392230244, 'weight_decay': 0.0979985832793084, 'criterion': 'MSELoss', 'batch_size': 128, 'epochs': 25}. Best is trial 1 with value: 2.3313288296037085.[0m

Trial Id: 4 | Model params: 38958 | Timestamp: 2022-03-02 20:41:03.913955

epoch 0 0.0032730557627261847 2.4710046016272798
epoch 5 0.07370189719647502 2.3821046789408715
epoch 10 0.07368252046263368 2.38212959379648
epoch 15 0.07267873785271373 2.3834199142796555
epoch 20 0.07269070897160623 2.3834045300237277
epoch 25 0.07216718312336645 2.384077227810678
epoch 30 0.07258962593953155 2.383534430151827
epoch 35 0.07315876059515303 2.382802952333783
epoch 40 0.06860025941983539 2.3886554579368195
epoch 45 0.06130663956103255 2.3979897802522165
[32m[I 2022-03-02 21:54:28,834][0m Trial 4 finished with value: 2.387491754786874 and parameters: {'n_layers_fe': 4, 'fe_neurons': 64, 'fe_dropout': 0.27135060592117993, 'n_units_l(Invariant)': 278, 'n_layers_mlp': 2, 'initialiser': 'normal', 'lr': 9.775394931326847e-05, 'weight_decay': 0.2950264481685711, 'criterion': 'MSELoss', 'batch_size': 32, 'epochs': 50}. Best is trial 1 with value: 2.3313288296037085.[0m

Trial Id: 5 | Model params: 269042 | Timestamp: 2022-03-02 21:54:28.834691

epoch 0 -0.011076634140569919 2.4887283319816023
epoch 5 0.09743446369577757 2.3513908725072867
epoch 10 0.10239756945165823 2.34491694421878
epoch 15 0.09996024519731805 2.348098446518821
epoch 20 0.10191675970922354 2.345544899274588
epoch 25 0.09762010209383609 2.351149044703853
epoch 30 0.09591695777747078 2.3533667683478865
epoch 35 0.10073300511260541 2.347090209942051
epoch 40 0.10408357834847215 2.342713625145412
epoch 45 0.10295028929289729 2.344194864118649
epoch 50 0.10455447581263588 2.342097874124708
epoch 55 0.10240308958773148 2.344909733743366
epoch 60 0.09681775907277113 2.352194064042736
epoch 65 0.10153004834908486 2.346049836453912
epoch 70 0.09951371369347672 2.348680848524176
[32m[I 2022-03-02 23:36:48,481][0m Trial 5 finished with value: 2.3450122292910636 and parameters: {'n_layers_fe': 2, 'fe_neurons': 256, 'fe_dropout': 0.2320102443354644, 'n_units_l(Invariant)': 376, 'n_layers_mlp': 2, 'initialiser': 'xavier', 'lr': 5.282248619239916e-05, 'weight_decay': 0.13789037047052102, 'criterion': 'MSELoss', 'batch_size': 256, 'epochs': 75}. Best is trial 1 with value: 2.3313288296037085.[0m

Trial Id: 6 | Model params: 119682 | Timestamp: 2022-03-02 23:36:48.481718

epoch 0 0.09795066171734268 2.3507183690353557
epoch 5 0.10226081802507125 2.345095563679729
epoch 10 0.10405526983728708 2.3427506365280557
epoch 15 0.10307999073720209 2.344025388309781
epoch 20 0.10598304147328774 2.340228873702998
[32m[I 2022-03-02 23:58:48,286][0m Trial 6 finished with value: 2.3377955015967 and parameters: {'n_layers_fe': 2, 'fe_neurons': 128, 'fe_dropout': 0.14496010309449653, 'n_units_l(Invariant)': 320, 'n_layers_mlp': 4, 'initialiser': 'xavier', 'lr': 0.0008278185233362704, 'weight_decay': 0.09270746815208943, 'criterion': 'MSELoss', 'batch_size': 128, 'epochs': 25}. Best is trial 1 with value: 2.3313288296037085.[0m

Trial Id: 7 | Model params: 128522 | Timestamp: 2022-03-02 23:58:48.286252

epoch 0 -2.688682931981038 4.753583401231006
[32m[I 2022-03-03 00:06:03,435][0m Trial 7 pruned. [0m
++++++++++++++++++++
        NaN         
++++++++++++++++++++

Trial Id: 8 | Model params: 29520 | Timestamp: 2022-03-03 00:06:03.435758

epoch 0 0.07217943979132235 2.384061480933151
[32m[I 2022-03-03 00:08:53,530][0m Trial 8 pruned. [0m

Trial Id: 9 | Model params: 105512 | Timestamp: 2022-03-03 00:08:53.530427

epoch 0 -0.022100396252234367 2.5022588457762738
epoch 5 0.10523053713255004 2.341213565298928
epoch 10 0.1090382924490454 2.3362266533827856
epoch 15 0.11680342349321915 2.3260237422364103
epoch 20 0.11897472632426564 2.3231627654131737
epoch 25 0.11745008155620551 2.325172053340754
epoch 30 0.11378843222682211 2.3299905637704383
epoch 35 0.11643275842756395 2.326511790607696
epoch 40 0.12026572388004408 2.3214600350518695
epoch 45 0.11295246643385315 2.331089247965676
[32m[I 2022-03-03 00:50:12,088][0m Trial 9 finished with value: 2.3452963329915364 and parameters: {'n_layers_fe': 2, 'fe_neurons': 128, 'fe_dropout': 0.44711419956337645, 'n_units_l(Invariant)': 211, 'n_layers_mlp': 4, 'initialiser': 'normal', 'lr': 0.00042701471864656427, 'weight_decay': 0.030705383059091894, 'criterion': 'MSELoss', 'batch_size': 128, 'epochs': 50}. Best is trial 1 with value: 2.3313288296037085.[0m

Study statistics: 
  Number of finished trials:  10
  Number of pruned trials:  4
  Number of complete trials:  6

Best trial:
  Value:  2.3313288296037085
  Params: 
    n_layers_fe: 4
    fe_neurons: 256
    fe_dropout: 0.16768324538700946
    n_units_l(Invariant): 166
    n_layers_mlp: 4
    initialiser: xavier
    lr: 0.00021947924829424296
    weight_decay: 0.02138275333446956
    criterion: MSELoss
    batch_size: 32
    epochs: 25
Target: 72610, NaN: 0, Max: 64.0, Min: 0.0, Mean: 4.437694532433549
Prediction: 72610, NaN: 0, Max: 8.969512939453125, Min: 3.536651134490967, Mean: 4.690087103039219

 XXXXXX======== TRIAL north - qso ended

Test Set - R-squared:  0.11277012144439647
Test Set - RMSE:  2.3313288296037085
Test Set - MAE:  1.8347044527949323



[32m[I 2022-03-03 00:50:50,075][0m A new study created in memory with name: DeepSet[0m
Starting Loading north
Finished Loading north
Finished north setup

++++++++ Session Characteristics +++++++

Area: north
Gal Type: rlbg
Training Set: 290439
Validation Set: 72610
Test Samples: 72610
Number of features: 5
Device: cuda:0
Number of Workers: 8
Number of Trials: 10

+++++++++++++++++++++++++++++++++++++++

Trial Id: 0 | Model params: 43842 | Timestamp: 2022-03-03 00:50:50.075632

epoch 0 0.17249527840673196 8.901830496472066
epoch 5 0.24597646708595045 8.497409156773266
epoch 10 0.25298676872239834 8.45781589267196
epoch 15 0.25091100334614225 8.469558831963896
epoch 20 0.25793803710696483 8.429739724436653
[32m[I 2022-03-03 01:07:35,183][0m Trial 0 finished with value: 8.440809136323137 and parameters: {'n_layers_fe': 2, 'fe_neurons': 64, 'fe_dropout': 0.05933251255522426, 'n_units_l(Invariant)': 352, 'n_layers_mlp': 4, 'initialiser': 'uniform', 'lr': 0.00034281039030819514, 'weight_decay': 0.16816741223286236, 'criterion': 'MSELoss', 'batch_size': 128, 'epochs': 25}. Best is trial 0 with value: 8.440809136323137.[0m

Trial Id: 1 | Model params: 35134 | Timestamp: 2022-03-03 01:07:35.183763

epoch 0 -0.14657564363245923 10.47841117336704
epoch 5 0.19790334603583215 8.764102184092868
epoch 10 0.2226163652071963 8.628032594710495
epoch 15 0.21431407544700332 8.673983000183371
epoch 20 0.2191613399539607 8.647184671235998
epoch 25 0.23485619906803978 8.559839315511626
epoch 30 0.24244113330897776 8.517306444889602
epoch 35 0.24014892250687114 8.53018248432595
epoch 40 0.20990158684064308 8.698305864394916
epoch 45 0.22414210817095293 8.619561471197272
epoch 50 0.24918833324973055 8.4792919058519
epoch 55 0.2153010508784693 8.668533177224642
epoch 60 0.2548703066182001 8.447146288221672
epoch 65 0.25303280073327883 8.457555297374013
epoch 70 0.23671939099471218 8.549410985308478
[32m[I 2022-03-03 03:12:48,167][0m Trial 1 finished with value: 8.459275495818247 and parameters: {'n_layers_fe': 4, 'fe_neurons': 64, 'fe_dropout': 0.07763381300212241, 'n_units_l(Invariant)': 94, 'n_layers_mlp': 4, 'initialiser': 'kaiming_he', 'lr': 2.0704678276567484e-05, 'weight_decay': 0.2347108543098951, 'criterion': 'MSELoss', 'batch_size': 32, 'epochs': 75}. Best is trial 0 with value: 8.440809136323137.[0m

Trial Id: 2 | Model params: 51366 | Timestamp: 2022-03-03 03:12:48.167322

epoch 0 -0.9445245064219552 13.645856207989636
epoch 5 -0.017290176093652576 9.86998529190279
epoch 10 -0.27898216050623637 11.066908612019468
epoch 15 -0.2928808432879624 11.126878107491098
epoch 20 -0.1516535471700149 10.501588701968657
epoch 25 0.02188286006140805 9.678086844580887
epoch 30 0.051615030130169215 9.529857606028605
epoch 35 0.1094203295046221 9.234863249999336
epoch 40 0.10863763089763578 9.238920454203274
epoch 45 0.18829899668226513 8.816416965353564
[32m[I 2022-03-03 04:01:59,500][0m Trial 2 finished with value: 8.862338388341866 and parameters: {'n_layers_fe': 4, 'fe_neurons': 64, 'fe_dropout': 0.3864527576924308, 'n_units_l(Invariant)': 466, 'n_layers_mlp': 2, 'initialiser': 'xavier', 'lr': 2.942087933498581e-05, 'weight_decay': 0.0025724334798944426, 'criterion': 'MSELoss', 'batch_size': 128, 'epochs': 50}. Best is trial 0 with value: 8.440809136323137.[0m

Trial Id: 3 | Model params: 48268 | Timestamp: 2022-03-03 04:01:59.500785

epoch 0 -6.601895283716602 26.98081236216885
epoch 5 -6.607349908199994 26.990490462414428
epoch 10 -6.619775609255678 27.012524346257354
epoch 15 -6.555556274529127 26.898452949885204
epoch 20 -6.538593144081064 26.86824085566694
epoch 25 -6.482410887090852 26.76793424811843
epoch 30 -6.5381205525852675 26.867398662640834
epoch 35 -6.472721444166003 26.75059689543337
epoch 40 -6.524971057874337 26.84395469410825
epoch 45 -6.519715418789598 26.83457879226918
epoch 50 -6.519660737198239 26.834481224737853
epoch 55 -6.482632993103595 26.7683315315018
epoch 60 -6.462715118640761 26.73268074199517
epoch 65 -6.349972509481369 26.529980915760767
epoch 70 -6.398458396074622 26.61734282194218
[32m[I 2022-03-03 06:09:55,145][0m Trial 3 finished with value: 26.67221061930235 and parameters: {'n_layers_fe': 4, 'fe_neurons': 64, 'fe_dropout': 0.2003442169073918, 'n_units_l(Invariant)': 293, 'n_layers_mlp': 4, 'initialiser': 'normal', 'lr': 2.8124499173760917e-05, 'weight_decay': 0.27850133564593715, 'criterion': 'PoissonNLLLoss', 'batch_size': 32, 'epochs': 75}. Best is trial 0 with value: 8.440809136323137.[0m

Trial Id: 4 | Model params: 81848 | Timestamp: 2022-03-03 06:09:55.145393

epoch 0 -5.921104364575718 25.74434099762024
[32m[I 2022-03-03 06:13:59,709][0m Trial 4 pruned. [0m
++++++++++++++++++++
        NaN         
++++++++++++++++++++

Trial Id: 5 | Model params: 83668 | Timestamp: 2022-03-03 06:13:59.709879

epoch 0 0.22035270878337165 8.64058540855515
epoch 5 0.2243198161067287 8.618574272243677
epoch 10 0.2360088473252958 8.553389415184663
epoch 15 0.2130095247639564 8.681181141877888
epoch 20 0.20352021602868275 8.733361932279747
epoch 25 0.22557605540941672 8.611592413496636
epoch 30 0.20201208576944174 8.741626309310144
epoch 35 0.2065644156317381 8.716656204406029
epoch 40 0.2020469594879879 8.741435293668893
epoch 45 0.16676110336817107 8.932619765566121
epoch 50 0.19059666353302407 8.803929889042283
epoch 55 0.22725535567764943 8.60225043885977
epoch 60 0.2230926582254522 8.625389047078224
epoch 65 0.18877709537985432 8.813820111143052
epoch 70 0.21935530088322985 8.64611062084083
[32m[I 2022-03-03 07:53:39,208][0m Trial 5 finished with value: 8.826780188277079 and parameters: {'n_layers_fe': 2, 'fe_neurons': 128, 'fe_dropout': 0.24683186611816454, 'n_units_l(Invariant)': 297, 'n_layers_mlp': 2, 'initialiser': 'normal', 'lr': 0.0013843734008005771, 'weight_decay': 0.06483125240904476, 'criterion': 'MSELoss', 'batch_size': 32, 'epochs': 75}. Best is trial 0 with value: 8.440809136323137.[0m

Trial Id: 6 | Model params: 121762 | Timestamp: 2022-03-03 07:53:39.208998

epoch 0 -0.26527602457156263 11.007449954076165
epoch 5 0.23286846168506925 8.570950740869911
epoch 10 0.21873586542439127 8.649540251182877
epoch 15 0.24075624486497182 8.526772864815669
epoch 20 0.2347765607622332 8.560284769923644
epoch 25 0.24434383313349295 8.506603602681233
epoch 30 0.23318119056995856 8.56920354566231
epoch 35 0.24134935312280092 8.523441729446104
epoch 40 0.2087378391308118 8.704709439353907
epoch 45 0.24055862474628265 8.527882490162714
