[32m[I 2022-03-16 01:16:33,761][0m Trial 16 pruned. [0m
epoch 0 0.14404369736091038 7.196038154541695

Previous best Test-set performance: 0.14253656231312106

Trial Id: 17 | Model params: 518278 | Timestamp: 2022-03-16 01:16:33.761954

[32m[I 2022-03-16 01:18:37,673][0m Trial 17 pruned. [0m
epoch 0 0.1425380248416439 7.202364480003002

Previous best Test-set performance: 0.14253656231312106

Trial Id: 18 | Model params: 518278 | Timestamp: 2022-03-16 01:18:37.673975

[32m[I 2022-03-16 01:21:00,320][0m Trial 18 pruned. [0m
epoch 0 0.03177472776812029 7.653425647962891

Previous best Test-set performance: 0.14253656231312106

Trial Id: 19 | Model params: 518278 | Timestamp: 2022-03-16 01:21:00.320385

[32m[I 2022-03-16 01:23:27,370][0m Trial 19 pruned. [0m
epoch 0 0.13502397011722833 7.233853290085

Study statistics: 
  Number of finished trials:  20
  Number of pruned trials:  14
  Number of complete trials:  6

Best trial:
  Value:  7.208713997441174
  Params: 
    lr: 1.6971455900533224e-05
    weight_decay: 0.14420372552619432
    criterion: MSELoss
    batch_size: 256
    epochs: 5
Target: 72610, NaN: 0, Max: 175.0, Min: 6.0, Mean: 31.337543038149015
Prediction: 72610, NaN: 0, Max: 46.95216369628906, Min: 22.454978942871094, Mean: 31.168234134826953

 XXXXXX======== TRIAL north - elg ended

Test Set - R-squared:  0.1410255022059691
Test Set - RMSE:  7.208713997441174
Test Set - MAE:  5.6509852334891875



