[32m[I 2022-03-15 20:05:52,031][0m Trial 10 pruned. [0m
epoch 0 0.12943579905358504 2.3093292534028187

Previous best Test-set performance: 0.12880242798071206

Trial Id: 11 | Model params: 161571 | Timestamp: 2022-03-15 20:05:52.031502

[32m[I 2022-03-15 20:06:15,373][0m Trial 11 pruned. [0m
epoch 0 0.07069453052248698 2.3859684766662146

Previous best Test-set performance: 0.12880242798071206

Trial Id: 12 | Model params: 161571 | Timestamp: 2022-03-15 20:06:15.373203

[32m[I 2022-03-15 20:07:33,484][0m Trial 12 pruned. [0m
epoch 0 0.09702149477003918 2.351928750518802

Previous best Test-set performance: 0.12880242798071206

Trial Id: 13 | Model params: 161571 | Timestamp: 2022-03-15 20:07:33.484485

[32m[I 2022-03-15 20:07:56,786][0m Trial 13 pruned. [0m
epoch 0 0.08656119961124675 2.3655121471188356

Previous best Test-set performance: 0.12880242798071206

Trial Id: 14 | Model params: 161571 | Timestamp: 2022-03-15 20:07:56.787129

[32m[I 2022-03-15 20:09:17,699][0m Trial 14 pruned. [0m
epoch 0 0.10111489263330908 2.346591793094812

Previous best Test-set performance: 0.12880242798071206

Trial Id: 15 | Model params: 161571 | Timestamp: 2022-03-15 20:09:17.699845

[32m[I 2022-03-15 20:09:37,672][0m Trial 15 pruned. [0m
epoch 0 0.10622585098323034 2.339911056234476

Previous best Test-set performance: 0.12880242798071206

Trial Id: 16 | Model params: 161571 | Timestamp: 2022-03-15 20:09:37.672385

[32m[I 2022-03-15 20:10:00,862][0m Trial 16 pruned. [0m
epoch 0 0.07483658041661889 2.380645233834972

Previous best Test-set performance: 0.12880242798071206

Trial Id: 17 | Model params: 161571 | Timestamp: 2022-03-15 20:10:00.862370

[32m[I 2022-03-15 20:10:20,835][0m Trial 17 pruned. [0m
epoch 0 0.11275117426581716 2.331353722739582

Previous best Test-set performance: 0.12880242798071206

Trial Id: 18 | Model params: 161571 | Timestamp: 2022-03-15 20:10:20.835239

[32m[I 2022-03-15 20:10:44,015][0m Trial 18 pruned. [0m
epoch 0 0.10077312428954388 2.347037853757395

Previous best Test-set performance: 0.12880242798071206

Trial Id: 19 | Model params: 161571 | Timestamp: 2022-03-15 20:10:44.015745

[32m[I 2022-03-15 20:11:07,336][0m Trial 19 pruned. [0m
epoch 0 0.08465664422896158 2.3679769553413865

Study statistics: 
  Number of finished trials:  20
  Number of pruned trials:  14
  Number of complete trials:  6

Best trial:
  Value:  2.3424024566330717
  Params: 
    lr: 0.000137176677588281
    weight_decay: 0.12715509029687191
    criterion: MSELoss
    batch_size: 128
    epochs: 20
Target: 72610, NaN: 0, Max: 64.0, Min: 0.0, Mean: 4.437694532433549
Prediction: 72610, NaN: 0, Max: 7.3811869621276855, Min: 3.145176887512207, Mean: 4.406031138180143

 XXXXXX======== TRIAL north - qso ended

Test Set - R-squared:  0.10432156088523403
Test Set - RMSE:  2.3424024566330717
Test Set - MAE:  1.8163396110975978



