[32m[I 2022-02-21 22:42:20,253][0m A new study created in memory with name: DeepSet[0m
Starting Loading north
Finished Loading north
Finished north setup

++++++++ Session Characteristics +++++++

Area: north
Gal Type: qso
Training Set: 232352
Validation Set: 58087
Test Samples: 72610
Number of features: 5
Device: cuda:0
Number of Workers: 8
Number of Trials: 35

+++++++++++++++++++++++++++++++++++++++

Trial Id: 0 | Model params: 79956 | Timestamp: 2022-02-21 22:42:20.253917

[32m[I 2022-02-21 22:43:16,603][0m Trial 0 pruned. [0m
++++++++++++++++++++
        NaN         
++++++++++++++++++++

Trial Id: 1 | Model params: 77117 | Timestamp: 2022-02-21 22:43:16.604160

epoch 0 -0.05629042126764716 2.5109043001593045
epoch 5 0.0391271798387125 2.39481210185253
epoch 10 0.08043379366309822 2.3427718178615122
epoch 15 0.0906444110936927 2.329728754000897
epoch 20 0.09340063290256206 2.326195415499142
epoch 25 0.09275011974386027 2.327029824519292
epoch 30 0.0928283335580975 2.326929515990616
epoch 35 0.09392296232672181 2.3255252102159973
epoch 40 0.08998142067544912 2.3305778753080566
epoch 45 0.09431122682144011 2.325026899596878
epoch 50 0.09242109108209151 2.327451753537218
epoch 55 0.09407698066201953 2.325327551115895
epoch 60 0.09422317983466966 2.325139911176401
epoch 65 0.09296335140834233 2.3267563466096393
epoch 70 0.09416741226034442 2.325211488089235
epoch 75 0.0944304637033253 2.3248738458707296
epoch 80 0.09182141285553114 2.328220552618094
epoch 85 0.09337937622569459 2.3262226860313273
epoch 90 0.09359014745207461 2.3259522701070066
epoch 95 0.09389963251728595 2.325555149011765
[32m[I 2022-02-21 23:11:25,315][0m Trial 1 finished with value: 2.325568043568671 and parameters: {'n_layers_fe': 2, 'fe_n_units_l0': 130, 'fe_dropout_l0': 0.03309115832500209, 'fe_n_units_l1': 144, 'fe_dropout_l1': 0.3511520306358545, 'n_units_l(Invariant)': 240, 'n_layers_mlp': 2, 'mlp_n_units_l0': 89, 'mlp_dropout_l0': 0.1219629038482577, 'mlp_n_units_l1': 224, 'mlp_dropout_l1': 0.23939126636231334, 'reduction': 'sum', 'lr': 3.952573410670811e-05, 'weight_decay': 0.15715742303908398, 'criterion': 'MSELoss', 'batch_size': 128}. Best is trial 1 with value: 2.325568043568671.[0m

Trial Id: 2 | Model params: 124091 | Timestamp: 2022-02-21 23:11:25.315250

epoch 0 -2.8247942901012917 4.7779602339706235
epoch 5 -2.028794830481417 4.251805774192435
epoch 10 -1.880431820890328 4.146362706889328
epoch 15 -1.9829492820767607 4.2195042081856435
epoch 20 -1.5935587349150424 3.9344726756556434
epoch 25 -1.544344393118442 3.8969643914354664
epoch 30 -1.5266372545045113 3.883380427451725
epoch 35 -1.5007208189409322 3.863412623897867
epoch 40 -1.5105141144619254 3.8709701590756844
epoch 45 -1.5032971269468294 3.8654022059754216
epoch 50 -1.5049159401821397 3.86665182850209
epoch 55 -1.5021907207127554 3.864547897130019
epoch 60 -1.4937754768905984 3.8580438960615133
epoch 65 -1.4966177582357476 3.860241873295394
epoch 70 -1.512325923852841 3.872366724647382
epoch 75 -1.503841942837123 3.865822814849725
epoch 80 -1.5065990655427308 3.8679506678718187
epoch 85 -1.5132472748276395 3.8730767204673855
epoch 90 -1.4977232308850028 3.8610964133052397
epoch 95 -1.4895793356180658 3.854796668483336
[32m[I 2022-02-21 23:42:03,260][0m Trial 2 finished with value: 3.8560455644524083 and parameters: {'n_layers_fe': 2, 'fe_n_units_l0': 92, 'fe_dropout_l0': 0.3273854927645638, 'fe_n_units_l1': 191, 'fe_dropout_l1': 0.3255305864916559, 'n_units_l(Invariant)': 362, 'n_layers_mlp': 4, 'mlp_n_units_l0': 104, 'mlp_dropout_l0': 0.13255366044706235, 'mlp_n_units_l1': 239, 'mlp_dropout_l1': 0.3322747823493006, 'mlp_n_units_l2': 21, 'mlp_dropout_l2': 0.17418142600346653, 'mlp_n_units_l3': 147, 'mlp_dropout_l3': 0.02940912614830682, 'reduction': 'sum', 'lr': 0.0002488517632245928, 'weight_decay': 0.17696258702009976, 'criterion': 'PoissonNLLLoss', 'batch_size': 256}. Best is trial 1 with value: 2.325568043568671.[0m

Trial Id: 3 | Model params: 122068 | Timestamp: 2022-02-21 23:42:03.260883

[32m[I 2022-02-21 23:42:23,755][0m Trial 3 pruned. [0m
++++++++++++++++++++
        NaN         
++++++++++++++++++++

Trial Id: 4 | Model params: 108746 | Timestamp: 2022-02-21 23:42:23.755862

epoch 0 -2.786572644537007 4.754026915925347
epoch 5 -1.6992521969367669 4.013841523591844
epoch 10 -1.4867148472245773 3.8525783824058677
epoch 15 -1.4280935477597643 3.806897618177016
epoch 20 -1.3847264013786926 3.7727477573356016
epoch 25 -1.3172468962701074 3.7189868631865735
epoch 30 -1.2791831126378983 3.688315798978385
epoch 35 -1.2430039689044148 3.65892502735607
epoch 40 -1.2389608070030271 3.655625813642733
epoch 45 -1.2879399026133407 3.6953943973254244
epoch 50 -1.338757896465041 3.7362086633496627
epoch 55 -1.4422776529806391 3.8180007338733923
epoch 60 -1.4994126344624283 3.862401971781778
epoch 65 -1.4956800697306316 3.8595168835850555
epoch 70 -1.507674016693417 3.8687799613159086
epoch 75 -1.4985099985114987 3.861704476368408
epoch 80 -1.5007608683926335 3.863443560365589
epoch 85 -1.4930517468149538 3.8574840250869515
epoch 90 -1.4949557994189093 3.8589568085241805
epoch 95 -1.4884243664835006 3.8539024034176275
[32m[I 2022-02-22 00:36:56,548][0m Trial 4 finished with value: 3.8549598655667836 and parameters: {'n_layers_fe': 2, 'fe_n_units_l0': 180, 'fe_dropout_l0': 0.2593872812682824, 'fe_n_units_l1': 166, 'fe_dropout_l1': 0.35428733189482875, 'n_units_l(Invariant)': 424, 'n_layers_mlp': 2, 'mlp_n_units_l0': 22, 'mlp_dropout_l0': 0.017860942131709745, 'mlp_n_units_l1': 245, 'mlp_dropout_l1': 0.20076577167641108, 'reduction': 'sum', 'lr': 1.704941212554183e-05, 'weight_decay': 0.24720403441340022, 'criterion': 'PoissonNLLLoss', 'batch_size': 256}. Best is trial 1 with value: 2.325568043568671.[0m

Trial Id: 5 | Model params: 31258 | Timestamp: 2022-02-22 00:36:56.548654

[32m[I 2022-02-22 00:38:08,141][0m Trial 5 pruned. [0m
++++++++++++++++++++
        NaN         
++++++++++++++++++++

Trial Id: 6 | Model params: 93196 | Timestamp: 2022-02-22 00:38:08.141636

[32m[I 2022-02-22 00:39:28,923][0m Trial 6 pruned. [0m
++++++++++++++++++++
        NaN         
++++++++++++++++++++

Trial Id: 7 | Model params: 141651 | Timestamp: 2022-02-22 00:39:28.923300

[32m[I 2022-02-22 00:40:43,776][0m Trial 7 pruned. [0m
++++++++++++++++++++
        NaN         
++++++++++++++++++++

Trial Id: 8 | Model params: 287629 | Timestamp: 2022-02-22 00:40:43.777039

epoch 0 -3.287723863181361 5.05885106598364
epoch 5 -3.287723863181361 5.05885106598364
epoch 10 -3.287723863181361 5.05885106598364
epoch 15 -1.5312678127157073 3.8869373265770295
epoch 20 -1.5184962491471095 3.87711911549281
epoch 25 -1.5107190049966484 3.8711281165553006
epoch 30 -1.5097240917769899 3.870361041833939
epoch 35 -1.5026526272681355 3.8649045800997044
epoch 40 -1.513262627659401 3.8730885503030477
epoch 45 -1.5084992339609085 3.869416471763209
epoch 50 -1.5067937493759422 3.868100873952237
epoch 55 -1.509330097766072 3.870057231760235
epoch 60 -1.5129976909839815 3.8728844032639436
epoch 65 -1.511247435214826 3.871535472664682
epoch 70 -1.5115638102829343 3.8717793392598714
epoch 75 -1.507300033698812 3.868491464514843
epoch 80 -1.5116929133003496 3.8718788493678713
epoch 85 -1.5085664761515454 3.8694683327111647
epoch 90 -1.5084360684197113 3.8693677543227394
epoch 95 -1.5131399400082661 3.872994014632383
[32m[I 2022-02-22 02:00:14,174][0m Trial 8 finished with value: 3.8695644754377616 and parameters: {'n_layers_fe': 4, 'fe_n_units_l0': 218, 'fe_dropout_l0': 0.29914450385225816, 'fe_n_units_l1': 233, 'fe_dropout_l1': 0.38317334127507263, 'fe_n_units_l2': 177, 'fe_dropout_l2': 0.12557043819774905, 'fe_n_units_l3': 210, 'fe_dropout_l3': 0.032143634693560685, 'n_units_l(Invariant)': 449, 'n_layers_mlp': 4, 'mlp_n_units_l0': 176, 'mlp_dropout_l0': 0.043063982701310455, 'mlp_n_units_l1': 112, 'mlp_dropout_l1': 0.4230793247929698, 'mlp_n_units_l2': 138, 'mlp_dropout_l2': 0.3717103007619794, 'mlp_n_units_l3': 156, 'mlp_dropout_l3': 0.2993583186857708, 'reduction': 'sum', 'lr': 1.912792030198367e-05, 'weight_decay': 0.24259095606144163, 'criterion': 'PoissonNLLLoss', 'batch_size': 256}. Best is trial 1 with value: 2.325568043568671.[0m

Trial Id: 9 | Model params: 127146 | Timestamp: 2022-02-22 02:00:14.174591

[32m[I 2022-02-22 02:01:13,946][0m Trial 9 pruned. [0m
++++++++++++++++++++
        NaN         
++++++++++++++++++++

Trial Id: 10 | Model params: 29622 | Timestamp: 2022-02-22 02:01:13.947047

[32m[I 2022-02-22 02:01:35,964][0m Trial 10 pruned. [0m
++++++++++++++++++++
        NaN         
++++++++++++++++++++

Trial Id: 11 | Model params: 60425 | Timestamp: 2022-02-22 02:01:35.964363

epoch 0 -0.3901196640427351 2.8804781357868907
epoch 5 -0.05811002056238279 2.513066051173859
epoch 10 -0.02188353593161363 2.469671504182522
epoch 15 -0.0011271358134976595 2.4444609638472583
epoch 20 0.0163392883381428 2.4230431740302842
epoch 25 0.02619332217782433 2.410875945950854
epoch 30 0.036626536327015624 2.397926291373657
epoch 35 0.045978893154384304 2.386258461040169
epoch 40 0.05509919297072419 2.3748249318115047
epoch 45 0.06347496331859981 2.364276065797184
epoch 50 0.0680560682371879 2.3584864317741454
epoch 55 0.06993737154457502 2.356104705964608
epoch 60 0.07059065836816358 2.3552770829113814
epoch 65 0.07074750631122206 2.355078335203304
epoch 70 0.07359598091348196 2.351466007213481
epoch 75 0.07380570504838047 2.3511998236272236
epoch 80 0.07309848171515232 2.352097316778458
epoch 85 0.07403288263893804 2.3509114539669196
epoch 90 0.07439301902593998 2.3504542395156154
epoch 95 0.07441703564493118 2.350423745833487
[32m[I 2022-02-22 02:25:45,002][0m Trial 11 finished with value: 2.351377606353906 and parameters: {'n_layers_fe': 2, 'fe_n_units_l0': 181, 'fe_dropout_l0': 0.1357849101976655, 'fe_n_units_l1': 178, 'fe_dropout_l1': 0.4649632793429046, 'n_units_l(Invariant)': 133, 'n_layers_mlp': 2, 'mlp_n_units_l0': 9, 'mlp_dropout_l0': 0.011727836819268894, 'mlp_n_units_l1': 254, 'mlp_dropout_l1': 0.26863122316857824, 'reduction': 'sum', 'lr': 1.0169702876345946e-05, 'weight_decay': 0.29734876164653734, 'criterion': 'MSELoss', 'batch_size': 256}. Best is trial 1 with value: 2.325568043568671.[0m

Trial Id: 12 | Model params: 68003 | Timestamp: 2022-02-22 02:25:45.002709

[32m[I 2022-02-22 02:26:01,734][0m Trial 12 pruned. [0m
epoch 0 -0.037551810787351814 2.4885328958879396

Trial Id: 13 | Model params: 40145 | Timestamp: 2022-02-22 02:26:01.735069

epoch 0 -3.287723863181361 5.05885106598364
epoch 5 0.07450662533837793 2.3503099911260668
epoch 10 0.08976271998908747 2.3308579071517963
epoch 15 0.09079243627704359 2.329539129301075
epoch 20 0.0927964771699844 2.3269703720500354
epoch 25 0.09483215389185418 2.3243581579191686
epoch 30 0.08735336470128241 2.3339407041458573
epoch 35 0.09499868078880824 2.3241443379313504
epoch 40 0.09636738744092077 2.3223861772488057
epoch 45 0.09651545316028143 2.3221959008784814
epoch 50 0.09436009215295404 2.3249641767575877
epoch 55 0.09603138731413108 2.322817906645986
epoch 60 0.0933807559182076 2.326220916011343
epoch 65 0.09540307922018754 2.3236250097690125
epoch 70 0.0976341726882739 2.320757751989812
epoch 75 0.09728340017763493 2.321208776897189
epoch 80 0.09184805530479478 2.3281864018718865
epoch 85 0.09640814953739096 2.322333796228204
epoch 90 0.094543896599674 2.3247282328491314
epoch 95 0.09610187014012184 2.3227273493194067
[32m[I 2022-02-22 02:52:54,375][0m Trial 13 finished with value: 2.3208273996488296 and parameters: {'n_layers_fe': 2, 'fe_n_units_l0': 181, 'fe_dropout_l0': 0.011018761786058314, 'fe_n_units_l1': 84, 'fe_dropout_l1': 0.4625419391968889, 'n_units_l(Invariant)': 123, 'n_layers_mlp': 2, 'mlp_n_units_l0': 59, 'mlp_dropout_l0': 0.061345026321207335, 'mlp_n_units_l1': 194, 'mlp_dropout_l1': 0.26443299911918383, 'reduction': 'sum', 'lr': 5.655454761756996e-05, 'weight_decay': 0.13716666265231028, 'criterion': 'MSELoss', 'batch_size': 128}. Best is trial 13 with value: 2.3208273996488296.[0m

Trial Id: 14 | Model params: 22756 | Timestamp: 2022-02-22 02:52:54.375359

[32m[I 2022-02-22 02:53:09,995][0m Trial 14 pruned. [0m
epoch 0 -0.03860545287485473 2.4897961377012585

Trial Id: 15 | Model params: 32824 | Timestamp: 2022-02-22 02:53:09.996105

[32m[I 2022-02-22 02:53:28,227][0m Trial 15 pruned. [0m
epoch 0 0.018419353412833295 2.420479914816623

Trial Id: 16 | Model params: 42775 | Timestamp: 2022-02-22 02:53:28.227485

[32m[I 2022-02-22 02:53:44,063][0m Trial 16 pruned. [0m
epoch 0 -0.08390459827574404 2.543513336130782

Trial Id: 17 | Model params: 83465 | Timestamp: 2022-02-22 02:53:44.063208

[32m[I 2022-02-22 02:54:07,075][0m Trial 17 pruned. [0m
++++++++++++++++++++
        NaN         
++++++++++++++++++++

Trial Id: 18 | Model params: 38060 | Timestamp: 2022-02-22 02:54:07.075775

[32m[I 2022-02-22 02:54:23,141][0m Trial 18 pruned. [0m
epoch 0 -0.2627902878186419 2.745390371641889

Trial Id: 19 | Model params: 176145 | Timestamp: 2022-02-22 02:54:23.142106

[32m[I 2022-02-22 02:54:42,777][0m Trial 19 pruned. [0m
epoch 0 0.037921915391308625 2.3963135894910423

Trial Id: 20 | Model params: 108480 | Timestamp: 2022-02-22 02:54:42.778117

[32m[I 2022-02-22 02:55:04,939][0m Trial 20 pruned. [0m
epoch 0 -0.052595274823455496 2.5065085925886685

Trial Id: 21 | Model params: 61620 | Timestamp: 2022-02-22 02:55:04.939826

[32m[I 2022-02-22 02:55:18,991][0m Trial 21 pruned. [0m
epoch 0 -0.4233191140120851 2.9146716081319206

Trial Id: 22 | Model params: 82205 | Timestamp: 2022-02-22 02:55:18.991252

[32m[I 2022-02-22 02:55:35,176][0m Trial 22 pruned. [0m
epoch 0 -0.07977167770022353 2.5386595056159305

Trial Id: 23 | Model params: 47670 | Timestamp: 2022-02-22 02:55:35.176799

[32m[I 2022-02-22 02:55:48,026][0m Trial 23 pruned. [0m
epoch 0 -0.44413258207124406 2.9359051649013566

Trial Id: 24 | Model params: 89783 | Timestamp: 2022-02-22 02:55:48.026614

[32m[I 2022-02-22 02:56:06,285][0m Trial 24 pruned. [0m
epoch 0 -0.03517501619210783 2.485680930961393

Trial Id: 25 | Model params: 127616 | Timestamp: 2022-02-22 02:56:06.285711

[32m[I 2022-02-22 02:56:27,005][0m Trial 25 pruned. [0m
epoch 0 -0.06961414473224092 2.526690563823878

Trial Id: 26 | Model params: 43504 | Timestamp: 2022-02-22 02:56:27.006091

[32m[I 2022-02-22 02:56:44,598][0m Trial 26 pruned. [0m
++++++++++++++++++++
        NaN         
++++++++++++++++++++

Trial Id: 27 | Model params: 36073 | Timestamp: 2022-02-22 02:56:44.598481

[32m[I 2022-02-22 02:56:55,896][0m Trial 27 pruned. [0m
epoch 0 -0.06840488417339019 2.5252618751088622

Trial Id: 28 | Model params: 33901 | Timestamp: 2022-02-22 02:56:55.896245

[32m[I 2022-02-22 02:57:11,802][0m Trial 28 pruned. [0m
epoch 0 -0.344786538435659 2.8331212806057002

Trial Id: 29 | Model params: 77928 | Timestamp: 2022-02-22 02:57:11.802475

[32m[I 2022-02-22 02:57:27,016][0m Trial 29 pruned. [0m
++++++++++++++++++++
        NaN         
++++++++++++++++++++

Trial Id: 30 | Model params: 35014 | Timestamp: 2022-02-22 02:57:27.016451

[32m[I 2022-02-22 02:57:43,615][0m Trial 30 pruned. [0m
epoch 0 0.06843378030604852 2.358008442144332

Trial Id: 31 | Model params: 104814 | Timestamp: 2022-02-22 02:57:43.616054

epoch 0 -2.871070704147406 4.806777742657485
epoch 5 -3.127543213805539 4.963457460980922
epoch 10 -3.0451492495320283 4.913667494926495
epoch 15 -2.827723752715755 4.779789636514537
epoch 20 -2.9398290956265236 4.849279107207835
epoch 25 -2.8832925683893422 4.81435981651681
epoch 30 -2.8370788268797242 4.785627048169389
epoch 35 -2.824173265729322 4.777572324192458
epoch 40 -2.0459139756556106 4.263804724797936
epoch 45 -1.761035719817531 4.059518288697155
epoch 50 -1.697891279477179 4.012829540399742
epoch 55 -1.6497609112408052 3.976874026750352
epoch 60 -1.635249696176583 3.965969552077131
epoch 65 -1.6037473087635887 3.9421932205486683
epoch 70 -1.5634506410666105 3.9115687648959567
epoch 75 -1.5526781515802197 3.903341242425998
epoch 80 -1.5320285763585288 3.887521385370902
epoch 85 -1.5503388624818637 3.901552310181571
epoch 90 -1.53685149074703 3.891222027477692
epoch 95 -1.520669619648047 3.878791661000571
[32m[I 2022-02-22 03:31:12,532][0m Trial 31 finished with value: 3.875716848580965 and parameters: {'n_layers_fe': 2, 'fe_n_units_l0': 184, 'fe_dropout_l0': 0.2711131687401598, 'fe_n_units_l1': 169, 'fe_dropout_l1': 0.3317969834912725, 'n_units_l(Invariant)': 387, 'n_layers_mlp': 2, 'mlp_n_units_l0': 22, 'mlp_dropout_l0': 0.02861684695563163, 'mlp_n_units_l1': 240, 'mlp_dropout_l1': 0.20447658225510865, 'reduction': 'sum', 'lr': 1.728698108912867e-05, 'weight_decay': 0.2722718525781029, 'criterion': 'PoissonNLLLoss', 'batch_size': 256}. Best is trial 13 with value: 2.3208273996488296.[0m

Trial Id: 32 | Model params: 164003 | Timestamp: 2022-02-22 03:31:12.533156

[32m[I 2022-02-22 03:31:36,064][0m Trial 32 pruned. [0m
epoch 0 -2.77387277184703 4.746047900194565

Trial Id: 33 | Model params: 127448 | Timestamp: 2022-02-22 03:31:36.064675

[32m[I 2022-02-22 03:31:58,939][0m Trial 33 pruned. [0m
epoch 0 -2.414195524857093 4.514219620988368

Trial Id: 34 | Model params: 80337 | Timestamp: 2022-02-22 03:31:58.939843

[32m[I 2022-02-22 03:32:16,564][0m Trial 34 pruned. [0m
epoch 0 -2.5159100272507375 4.580969140123884

Study statistics: 
  Number of finished trials:  35
  Number of pruned trials:  28
  Number of complete trials:  7

Best trial:
  Value:  2.3208273996488296
  Params: 
    n_layers_fe: 2
    fe_n_units_l0: 181
    fe_dropout_l0: 0.011018761786058314
    fe_n_units_l1: 84
    fe_dropout_l1: 0.4625419391968889
    n_units_l(Invariant): 123
    n_layers_mlp: 2
    mlp_n_units_l0: 59
    mlp_dropout_l0: 0.061345026321207335
    mlp_n_units_l1: 194
    mlp_dropout_l1: 0.26443299911918383
    reduction: sum
    lr: 5.655454761756996e-05
    weight_decay: 0.13716666265231028
    criterion: MSELoss
    batch_size: 128
Target: 72610, NaN: 0, Max: 64.0, Min: 0.0, Mean: 4.437694532433549
Prediction: 72610, NaN: 0, Max: 7.900063991546631, Min: 1.065313458442688, Mean: 4.4507234561346465

 XXXXXX======== TRIAL north - qso ended

Test Set - R-squared:  0.10083260610544298
Test Set - RMSE:  2.346960226861431
Test Set - MAE:  1.8227918729820194



[32m[I 2022-02-22 03:32:46,215][0m A new study created in memory with name: DeepSet[0m
Starting Loading north
Finished Loading north
Finished north setup

++++++++ Session Characteristics +++++++

Area: north
Gal Type: rlbg
Training Set: 232352
Validation Set: 58087
Test Samples: 72610
Number of features: 5
Device: cuda:0
Number of Workers: 8
Number of Trials: 35

+++++++++++++++++++++++++++++++++++++++

Trial Id: 0 | Model params: 36455 | Timestamp: 2022-02-22 03:32:46.216122

[32m[I 2022-02-22 03:33:09,923][0m Trial 0 pruned. [0m
++++++++++++++++++++
        NaN         
++++++++++++++++++++

Trial Id: 1 | Model params: 319136 | Timestamp: 2022-02-22 03:33:09.923625

[32m[I 2022-02-22 03:33:40,211][0m Trial 1 pruned. [0m
++++++++++++++++++++
        NaN         
++++++++++++++++++++

Trial Id: 2 | Model params: 47739 | Timestamp: 2022-02-22 03:33:40.211474

epoch 0 -0.1469875106035392 10.470277580866682
epoch 5 0.16230830695207243 8.947896571827167
epoch 10 0.15615780748141994 8.980685117437526
epoch 15 0.217261024122954 8.649426866393128
epoch 20 0.2116632323433687 8.680300142770793
epoch 25 0.22942612522488315 8.581950228054836
epoch 30 0.19838820715339522 8.75308004279674
epoch 35 0.20237465732146875 8.73128819297724
epoch 40 0.21352258033605886 8.670057548993979
epoch 45 0.1776778351343179 8.865430902954483
epoch 50 0.20352788962531487 8.724973921547255
epoch 55 0.22272316923030777 8.619195118812534
epoch 60 0.21132263104776294 8.682175104286912
epoch 65 0.23173774596220387 8.56906819614787
epoch 70 0.24018266606890704 8.521841445109867
epoch 75 0.230471265654964 8.576128342040715
epoch 80 0.21036124003794854 8.687465241451182
epoch 85 0.2357877292593924 8.546451933834334
epoch 90 0.23779368873346973 8.535227891924173
epoch 95 0.2418739607136906 8.512351681175824
[32m[I 2022-02-22 03:58:45,981][0m Trial 2 finished with value: 8.505918341685174 and parameters: {'n_layers_fe': 4, 'fe_n_units_l0': 159, 'fe_dropout_l0': 0.48475756255930064, 'fe_n_units_l1': 204, 'fe_dropout_l1': 0.31591754387337184, 'fe_n_units_l2': 18, 'fe_dropout_l2': 0.14761362359814506, 'fe_n_units_l3': 46, 'fe_dropout_l3': 0.23836733114487924, 'n_units_l(Invariant)': 104, 'n_layers_mlp': 2, 'mlp_n_units_l0': 111, 'mlp_dropout_l0': 0.22630242744633067, 'mlp_n_units_l1': 18, 'mlp_dropout_l1': 0.3497447533859915, 'reduction': 'sum', 'lr': 0.0010366633309355248, 'weight_decay': 0.12690547527115797, 'criterion': 'MSELoss', 'batch_size': 256}. Best is trial 2 with value: 8.505918341685174.[0m

Trial Id: 3 | Model params: 276735 | Timestamp: 2022-02-22 03:58:45.981994

