[32m[I 2022-02-22 04:00:01,522][0m Trial 3 pruned. [0m
++++++++++++++++++++
        NaN         
++++++++++++++++++++

Trial Id: 4 | Model params: 57269 | Timestamp: 2022-02-22 04:00:01.522208

epoch 0 0.10882495366695044 9.229121421788475
epoch 5 0.19277491181976425 8.783673348035663
epoch 10 0.03768752930221542 9.590404124090322
epoch 15 -0.023077263262435865 9.888560332325142
epoch 20 0.02446261286812601 9.656078999175879
epoch 25 0.04936856392989586 9.532019824957862
epoch 30 0.023466124943385513 9.66100946637345
epoch 35 0.06859655450512414 9.435127453323583
epoch 40 0.01655847784296205 9.695118495643836
epoch 45 0.004249037814360701 9.755605243308729
epoch 50 0.0358409922829398 9.599601006424031
epoch 55 -0.09535436427065447 10.231897304323924
epoch 60 -0.12658844065022778 10.376753412006718
epoch 65 -0.06448795216071268 10.086702836670945
epoch 70 -0.083971674841532 10.178594615570445
epoch 75 0.13806064414121122 9.076474806600407
epoch 80 -0.0035804352839081677 9.793883736075173
epoch 85 0.1569001071590641 8.97673424462313
epoch 90 0.053343949137424906 9.512068270509321
epoch 95 0.05351728760025931 9.511197371953056
[32m[I 2022-02-22 04:28:34,321][0m Trial 4 finished with value: 9.00758353179439 and parameters: {'n_layers_fe': 2, 'fe_n_units_l0': 242, 'fe_dropout_l0': 0.1974957170134078, 'fe_n_units_l1': 149, 'fe_dropout_l1': 0.06700831462743162, 'n_units_l(Invariant)': 105, 'n_layers_mlp': 2, 'mlp_n_units_l0': 27, 'mlp_dropout_l0': 0.20656165120132408, 'mlp_n_units_l1': 108, 'mlp_dropout_l1': 0.08631392381517955, 'reduction': 'sum', 'lr': 0.001962045403100201, 'weight_decay': 0.24034951276872935, 'criterion': 'MSELoss', 'batch_size': 128}. Best is trial 2 with value: 8.505918341685174.[0m

Trial Id: 5 | Model params: 114862 | Timestamp: 2022-02-22 04:28:34.322153

epoch 0 0.03785654033287644 9.589561905315193
epoch 5 0.23397133085848598 8.556602613725296
epoch 10 0.2338354850509301 8.557361284457858
epoch 15 0.24489409455549993 8.495379505872382
epoch 20 0.23478088042114897 8.55208005126381
epoch 25 0.24506404993886977 8.494423403740013
epoch 30 0.2410425085037905 8.517018236453488
epoch 35 0.24770222399111474 8.479568249603426
epoch 40 0.24265001554020227 8.507993736256516
epoch 45 0.2376689992851999 8.535926002999355
epoch 50 0.2437665619531838 8.501719837844849
epoch 55 0.2420348417025927 8.511448435444398
epoch 60 0.24026546905414314 8.521377088016754
epoch 65 0.24823374840558554 8.476572166085
epoch 70 0.23597426060666793 8.545408847675713
epoch 75 0.23333080946920937 8.560179204271016
epoch 80 0.2267746964347057 8.59670214906778
epoch 85 0.2104190999119161 8.6871469535975
epoch 90 0.24677777535530587 8.484776638386222
epoch 95 0.2359859199692863 8.54534364411289
[32m[I 2022-02-22 04:59:06,388][0m Trial 5 finished with value: 8.49659089807697 and parameters: {'n_layers_fe': 4, 'fe_n_units_l0': 162, 'fe_dropout_l0': 0.37608424377080746, 'fe_n_units_l1': 151, 'fe_dropout_l1': 0.20286824139428394, 'fe_n_units_l2': 49, 'fe_dropout_l2': 0.22540146810105416, 'fe_n_units_l3': 96, 'fe_dropout_l3': 0.17463098026279994, 'n_units_l(Invariant)': 237, 'n_layers_mlp': 2, 'mlp_n_units_l0': 191, 'mlp_dropout_l0': 0.3281467697665857, 'mlp_n_units_l1': 256, 'mlp_dropout_l1': 0.26948719732629606, 'reduction': 'sum', 'lr': 0.0012409548743944072, 'weight_decay': 0.17703394282988108, 'criterion': 'MSELoss', 'batch_size': 256}. Best is trial 5 with value: 8.49659089807697.[0m

Trial Id: 6 | Model params: 138013 | Timestamp: 2022-02-22 04:59:06.388494

[32m[I 2022-02-22 04:59:29,416][0m Trial 6 pruned. [0m
++++++++++++++++++++
        NaN         
++++++++++++++++++++

Trial Id: 7 | Model params: 31646 | Timestamp: 2022-02-22 04:59:29.416291

[32m[I 2022-02-22 05:00:21,568][0m Trial 7 pruned. [0m
++++++++++++++++++++
        NaN         
++++++++++++++++++++

Trial Id: 8 | Model params: 29746 | Timestamp: 2022-02-22 05:00:21.568241

epoch 0 -0.6295530993140255 12.479957586240486
epoch 5 -0.13374809431552914 10.40967417257423
epoch 10 -0.05804808155124297 10.0561456083932
epoch 15 0.0014973630442737251 9.769075344744852
epoch 20 0.007261889545586486 9.74083525562561
epoch 25 0.00588942596906461 9.747566297776999
epoch 30 0.029081270720632713 9.63319364480795
epoch 35 0.05904049004881029 9.483405458586313
epoch 40 0.07940603263789514 9.380217605248408
epoch 45 0.008470356322990535 9.734904658108084
epoch 50 0.06084257958043571 9.474319979420077
epoch 55 0.0683028258948466 9.436615073123056
epoch 60 0.0998311577109855 9.275574956848926
epoch 65 0.09695462019713419 9.290383433044079
epoch 70 0.0731472594160536 9.412049884229166
epoch 75 0.11425324563302686 9.2009704494129
epoch 80 0.11055138939353282 9.220177494715136
epoch 85 0.09354501993837017 9.307905614537535
epoch 90 0.10827399828131046 9.231973862793486
epoch 95 0.11766345279384682 9.183241073191798
[32m[I 2022-02-22 05:27:40,768][0m Trial 8 finished with value: 9.430531764703389 and parameters: {'n_layers_fe': 2, 'fe_n_units_l0': 60, 'fe_dropout_l0': 0.14983178249492113, 'fe_n_units_l1': 199, 'fe_dropout_l1': 0.16659015775315517, 'n_units_l(Invariant)': 13, 'n_layers_mlp': 2, 'mlp_n_units_l0': 177, 'mlp_dropout_l0': 0.3484132501120907, 'mlp_n_units_l1': 59, 'mlp_dropout_l1': 0.32802234648805934, 'reduction': 'sum', 'lr': 1.284165362881298e-05, 'weight_decay': 0.24722238246580638, 'criterion': 'MSELoss', 'batch_size': 128}. Best is trial 5 with value: 8.49659089807697.[0m

Trial Id: 9 | Model params: 99095 | Timestamp: 2022-02-22 05:27:40.768381

[32m[I 2022-02-22 05:27:54,374][0m Trial 9 pruned. [0m
++++++++++++++++++++
        NaN         
++++++++++++++++++++

Trial Id: 10 | Model params: 105020 | Timestamp: 2022-02-22 05:27:54.375057

epoch 0 -6.521001175809239 26.81122636373378
[32m[I 2022-02-22 05:28:47,023][0m Trial 10 pruned. [0m
++++++++++++++++++++
        NaN         
++++++++++++++++++++

Trial Id: 11 | Model params: 39488 | Timestamp: 2022-02-22 05:28:47.023328

epoch 0 -0.11158401487349012 10.307420586512295
epoch 5 -0.023572059330786432 9.89095127067741
epoch 10 0.022054623283550234 9.667989053653953
epoch 15 0.16530024029451162 8.93190294454422
epoch 20 0.07200688203971128 9.41783828448812
epoch 25 0.053734773122696367 9.510104554015019
epoch 30 -0.00421661650334948 9.796987472241373
epoch 35 -0.05316130697579524 10.032895724119298
epoch 40 0.01650133399740461 9.695400163792787
epoch 45 -0.025091416803975086 9.898289453660576
epoch 50 0.050023799615093845 9.528734221351556
epoch 55 -0.02899454250247735 9.917115853584297
epoch 60 -0.03754894584306778 9.958252817180664
epoch 65 -0.024858589295741806 9.89716529785061
epoch 70 0.04574401872266942 9.55017426734463
epoch 75 -0.13528925465464892 10.416746964473976
epoch 80 0.028105428758419482 9.638033449343693
epoch 85 0.07252003675639518 9.415234021412001
epoch 90 0.023347470131344528 9.661596384284021
epoch 95 -0.07524753994326216 10.137551649025312
[32m[I 2022-02-22 05:53:32,600][0m Trial 11 finished with value: 9.251455791125467 and parameters: {'n_layers_fe': 4, 'fe_n_units_l0': 199, 'fe_dropout_l0': 0.48280062394099754, 'fe_n_units_l1': 106, 'fe_dropout_l1': 0.3574405604720198, 'fe_n_units_l2': 8, 'fe_dropout_l2': 0.1324222490477028, 'fe_n_units_l3': 61, 'fe_dropout_l3': 0.20842702107189048, 'n_units_l(Invariant)': 187, 'n_layers_mlp': 2, 'mlp_n_units_l0': 102, 'mlp_dropout_l0': 0.10731732003352781, 'mlp_n_units_l1': 15, 'mlp_dropout_l1': 0.43804912062015466, 'reduction': 'sum', 'lr': 0.0021520031658246452, 'weight_decay': 0.1289689607452135, 'criterion': 'MSELoss', 'batch_size': 256}. Best is trial 5 with value: 8.49659089807697.[0m

Trial Id: 12 | Model params: 93907 | Timestamp: 2022-02-22 05:53:32.600963

epoch 0 -6.6476115251449786 27.035957843392904
epoch 5 0.22083460315453518 8.629659887058462
epoch 10 0.2180127124007205 8.645272713684333
epoch 15 0.2383214619150057 8.532272363760494
epoch 20 0.2517625790807154 8.45665402462195
epoch 25 0.2491141525848971 8.471607194741544
epoch 30 0.2110771662303884 8.683526102053532
epoch 35 0.24336484002905678 8.503977655095918
epoch 40 0.21892526808286283 8.640226854340089
epoch 45 0.23957926782923566 8.525224523797238
epoch 50 0.23072293082905615 8.574725867235443
epoch 55 0.23377503624733376 8.55769885689744
epoch 60 0.21914673853694377 8.639001817508822
epoch 65 0.2511330593308354 8.46021072421131
epoch 70 0.19095672210093761 8.793559934824634
epoch 75 0.2231593602345382 8.616776326158805
epoch 80 0.24078387849247251 8.518469285373323
epoch 85 0.23594048331151307 8.545597740269168
epoch 90 0.23708987432537587 8.539167658733705
epoch 95 0.22499668336992107 8.606580428950721
[32m[I 2022-02-22 06:29:55,209][0m Trial 12 finished with value: 8.666387188515351 and parameters: {'n_layers_fe': 4, 'fe_n_units_l0': 104, 'fe_dropout_l0': 0.4936879891730851, 'fe_n_units_l1': 255, 'fe_dropout_l1': 0.3675104191836505, 'fe_n_units_l2': 83, 'fe_dropout_l2': 0.18282315809540312, 'fe_n_units_l3': 89, 'fe_dropout_l3': 0.31257387342708304, 'n_units_l(Invariant)': 316, 'n_layers_mlp': 2, 'mlp_n_units_l0': 250, 'mlp_dropout_l0': 0.4913315519039508, 'mlp_n_units_l1': 13, 'mlp_dropout_l1': 0.4136872846185535, 'reduction': 'sum', 'lr': 0.0008739793362144184, 'weight_decay': 0.004892601825254778, 'criterion': 'MSELoss', 'batch_size': 256}. Best is trial 5 with value: 8.49659089807697.[0m

Trial Id: 13 | Model params: 87417 | Timestamp: 2022-02-22 06:29:55.209591

[32m[I 2022-02-22 06:30:13,381][0m Trial 13 pruned. [0m
epoch 0 -0.055008230582159534 10.041689189544782

Trial Id: 14 | Model params: 165944 | Timestamp: 2022-02-22 06:30:13.382125

epoch 0 -0.1638866829851 10.547127610831451
epoch 5 0.035570636328955074 9.600946804864762
epoch 10 0.18735723110731572 8.813099811660498
epoch 15 0.21253271119630623 8.675511948237535
epoch 20 0.1728098474169708 8.891632998041961
epoch 25 0.2330126326180635 8.561955308208558
epoch 30 0.23473824295963042 8.552318305834001
epoch 35 0.23691902076976867 8.54012377756982
epoch 40 0.24422154921645023 8.49916192646224
epoch 45 0.2439701465914913 8.50057539224465
epoch 50 0.24375094223328264 8.5018076373193
epoch 55 0.2469017315201778 8.484078448919886
epoch 60 0.2144206104367712 8.665106232967863
epoch 65 0.22829483074574797 8.588247581531727
epoch 70 0.24040992499676228 8.520566922077899
epoch 75 0.24811125920372568 8.477262704046055
epoch 80 0.24350358666714322 8.503197918395964
epoch 85 0.24385336628147491 8.501231888475395
epoch 90 0.21821957013523596 8.644129178592046
epoch 95 0.2506559087163819 8.462905563378701
[32m[I 2022-02-22 07:12:29,999][0m Trial 14 finished with value: 8.487867110932532 and parameters: {'n_layers_fe': 4, 'fe_n_units_l0': 113, 'fe_dropout_l0': 0.4196985245057143, 'fe_n_units_l1': 223, 'fe_dropout_l1': 0.4405091209740758, 'fe_n_units_l2': 164, 'fe_dropout_l2': 0.31952170523937656, 'fe_n_units_l3': 183, 'fe_dropout_l3': 0.3400644707687546, 'n_units_l(Invariant)': 227, 'n_layers_mlp': 2, 'mlp_n_units_l0': 224, 'mlp_dropout_l0': 0.14296635732345214, 'mlp_n_units_l1': 114, 'mlp_dropout_l1': 0.38622234114152587, 'reduction': 'sum', 'lr': 0.00015223385226194184, 'weight_decay': 0.16471679385023588, 'criterion': 'MSELoss', 'batch_size': 256}. Best is trial 14 with value: 8.487867110932532.[0m

Trial Id: 15 | Model params: 196211 | Timestamp: 2022-02-22 07:12:30.000014

epoch 0 -0.4353699965394304 11.712801494906195
epoch 5 -0.22927870287192587 10.839369719412293
epoch 10 0.19962080200140653 8.746347886366335
epoch 15 0.1997429290834798 8.745680573485846
epoch 20 0.17045994603268377 8.904253821861245
epoch 25 0.22487501029361867 8.607256005426747
epoch 30 0.23812036303570328 8.533398637566137
epoch 35 0.233964884145767 8.556638618802566
epoch 40 0.20509711423384047 8.71637462846105
epoch 45 0.22497519444269576 8.606699747729442
epoch 50 0.24684601900255154 8.484392259645844
epoch 55 0.2504783922725323 8.463907917274488
epoch 60 0.24598739340257414 8.489227154957387
epoch 65 0.25775205045224714 8.422739216489367
epoch 70 0.2550361767458553 8.438134482503434
epoch 75 0.2424882549946905 8.508902288614202
epoch 80 0.2601679117540835 8.409020920604126
epoch 85 0.24305443280744665 8.505721841422387
epoch 90 0.25689937245387573 8.42757575595489
epoch 95 0.258880730882988 8.416332868268357
[32m[I 2022-02-22 07:59:50,481][0m Trial 15 finished with value: 8.471123803871203 and parameters: {'n_layers_fe': 4, 'fe_n_units_l0': 87, 'fe_dropout_l0': 0.3290472165312537, 'fe_n_units_l1': 235, 'fe_dropout_l1': 0.4770552550749427, 'fe_n_units_l2': 173, 'fe_dropout_l2': 0.3424058933374703, 'fe_n_units_l3': 170, 'fe_dropout_l3': 0.35081425847450554, 'n_units_l(Invariant)': 376, 'n_layers_mlp': 4, 'mlp_n_units_l0': 220, 'mlp_dropout_l0': 0.12716023433901236, 'mlp_n_units_l1': 101, 'mlp_dropout_l1': 0.4030502610603945, 'mlp_n_units_l2': 100, 'mlp_dropout_l2': 0.022871977492247036, 'mlp_n_units_l3': 23, 'mlp_dropout_l3': 0.003856826713194733, 'reduction': 'sum', 'lr': 0.00014378941012785563, 'weight_decay': 0.16200058303832898, 'criterion': 'MSELoss', 'batch_size': 256}. Best is trial 15 with value: 8.471123803871203.[0m

Trial Id: 16 | Model params: 223004 | Timestamp: 2022-02-22 07:59:50.481812

epoch 0 -6.6476115251449786 27.035957843392904
epoch 5 -6.6476115251449786 27.035957843392904
epoch 10 -5.066678779094766 24.079881825920562
epoch 15 -5.0642257617924615 24.075013071443795
epoch 20 -5.060777152939113 24.068166598904163
epoch 25 -5.058405865986653 24.063457787517194
epoch 30 -5.0584216624879454 24.063489158656953
epoch 35 -5.063830012615156 24.074227495309344
epoch 40 -5.059951626623571 24.066527404703912
epoch 45 -5.05613537553609 24.058948270309997
epoch 50 -5.056702511649234 24.060074762547416
epoch 55 -5.059977848446844 24.066579473398896
epoch 60 -5.056992617740379 24.06065097465692
epoch 65 -5.056687924303709 24.060045788626827
epoch 70 -5.052323633805153 24.051375707443132
epoch 75 -5.058351346307083 24.06334951357612
epoch 80 -5.054441614556201 24.055583669381807
epoch 85 -5.060514149008923 24.067644381132283
epoch 90 -5.057341085093072 24.061343086344262
epoch 95 -5.05213769986473 24.051006262443583
[32m[I 2022-02-22 09:00:20,222][0m Trial 16 finished with value: 24.064136625930097 and parameters: {'n_layers_fe': 4, 'fe_n_units_l0': 84, 'fe_dropout_l0': 0.2973114302857084, 'fe_n_units_l1': 235, 'fe_dropout_l1': 0.4958260325448542, 'fe_n_units_l2': 182, 'fe_dropout_l2': 0.3543247812030831, 'fe_n_units_l3': 194, 'fe_dropout_l3': 0.3586914225354419, 'n_units_l(Invariant)': 401, 'n_layers_mlp': 4, 'mlp_n_units_l0': 237, 'mlp_dropout_l0': 0.0911483833737004, 'mlp_n_units_l1': 113, 'mlp_dropout_l1': 0.48326986882377315, 'mlp_n_units_l2': 104, 'mlp_dropout_l2': 0.01022734120414421, 'mlp_n_units_l3': 12, 'mlp_dropout_l3': 0.01186563119511965, 'reduction': 'sum', 'lr': 0.00013017884490147943, 'weight_decay': 0.16133348812618536, 'criterion': 'PoissonNLLLoss', 'batch_size': 256}. Best is trial 15 with value: 8.471123803871203.[0m

Trial Id: 17 | Model params: 229009 | Timestamp: 2022-02-22 09:00:20.222279

[32m[I 2022-02-22 09:01:47,570][0m Trial 17 pruned. [0m
epoch 0 0.010480505383293148 9.72503176242319

Trial Id: 18 | Model params: 204482 | Timestamp: 2022-02-22 09:01:47.570943

epoch 0 -0.5311213488486026 12.09716647107699
epoch 5 -0.21753800410812385 10.787482747074721
epoch 10 -1.4744446884522344 15.378632764600532
epoch 15 -0.7551431333367478 12.951948853079882
epoch 20 -0.4245573333062498 11.668601745499215
epoch 25 -0.3528192627620914 11.3710021159317
epoch 30 -0.3002510164914205 11.147884284165608
epoch 35 -0.17924660986607588 10.616495237673584
epoch 40 -0.14041140236268568 10.440219427246463
epoch 45 -0.09129919038119305 10.2129396966388
epoch 50 -0.09116724535135612 10.212322273214006
epoch 55 -0.02506951425135906 9.898183707499758
epoch 60 -0.007672774259579684 9.813831871266427
epoch 65 -0.010915606121937094 9.829610328620761
epoch 70 -0.008034733311403919 9.81559429178439
epoch 75 0.0007180221471925208 9.772887029686798
epoch 80 -0.014102588912882963 9.845092406266648
epoch 85 -0.023263308462324384 9.889459402033607
epoch 90 0.022005135670767895 9.668233668362218
epoch 95 0.015040347290494194 9.702598747116335
[32m[I 2022-02-22 10:04:57,105][0m Trial 18 finished with value: 9.811490473395672 and parameters: {'n_layers_fe': 4, 'fe_n_units_l0': 62, 'fe_dropout_l0': 0.3050062141763784, 'fe_n_units_l1': 177, 'fe_dropout_l1': 0.42146754946450393, 'fe_n_units_l2': 207, 'fe_dropout_l2': 0.4558923467190249, 'fe_n_units_l3': 186, 'fe_dropout_l3': 0.4784090863404181, 'n_units_l(Invariant)': 362, 'n_layers_mlp': 4, 'mlp_n_units_l0': 219, 'mlp_dropout_l0': 0.011489957321224847, 'mlp_n_units_l1': 95, 'mlp_dropout_l1': 0.38293480897709586, 'mlp_n_units_l2': 125, 'mlp_dropout_l2': 0.16882886636195063, 'mlp_n_units_l3': 90, 'mlp_dropout_l3': 0.4128675943188374, 'reduction': 'sum', 'lr': 3.339357443773711e-05, 'weight_decay': 0.27083096654983074, 'criterion': 'MSELoss', 'batch_size': 256}. Best is trial 15 with value: 8.471123803871203.[0m

Trial Id: 19 | Model params: 171190 | Timestamp: 2022-02-22 10:04:57.106085

[32m[I 2022-02-22 10:05:50,696][0m Trial 19 pruned. [0m
++++++++++++++++++++
        NaN         
++++++++++++++++++++

Trial Id: 20 | Model params: 175380 | Timestamp: 2022-02-22 10:05:50.697148

epoch 0 -5.797069535582527 25.488231764440407
epoch 5 -5.982485752710669 25.83353750520559
epoch 10 -5.0092140082194545 23.965565794885485
epoch 15 -5.128497136430273 24.20225569015884
epoch 20 -5.148380967361333 24.24148585070987
epoch 25 -5.133074911606417 24.211293126338138
epoch 30 -5.117523328259378 24.18057746261124
epoch 35 -5.103722752025906 24.153287471233124
epoch 40 -5.096683872635802 24.139356536988576
epoch 45 -5.086309136750786 24.11880880253303
epoch 50 -5.0527754370087035 24.05227340281311
epoch 55 -5.038264920472952 24.02342545202654
epoch 60 -5.048604188826958 24.043984206074313
epoch 65 -5.04063418381936 24.028138083878797
epoch 70 -5.0718263533755605 24.09009554437517
epoch 75 -5.043193185600687 24.033227080795438
epoch 80 -5.054383800311398 24.05546881496485
epoch 85 -5.052391792317851 24.051511134882286
epoch 90 -5.064887692585333 24.07632697022276
epoch 95 -5.052600610217985 24.051926040501673
[32m[I 2022-02-22 10:52:32,715][0m Trial 20 finished with value: 24.083183459700752 and parameters: {'n_layers_fe': 4, 'fe_n_units_l0': 69, 'fe_dropout_l0': 0.2896386158219719, 'fe_n_units_l1': 124, 'fe_dropout_l1': 0.47594040158635365, 'fe_n_units_l2': 141, 'fe_dropout_l2': 0.42192185535429433, 'fe_n_units_l3': 220, 'fe_dropout_l3': 0.4254875019905753, 'n_units_l(Invariant)': 293, 'n_layers_mlp': 4, 'mlp_n_units_l0': 213, 'mlp_dropout_l0': 0.05678218634023066, 'mlp_n_units_l1': 41, 'mlp_dropout_l1': 0.4027761188452007, 'mlp_n_units_l2': 190, 'mlp_dropout_l2': 0.09227727804915525, 'mlp_n_units_l3': 160, 'mlp_dropout_l3': 0.3247848271457436, 'reduction': 'sum', 'lr': 9.311703035889813e-05, 'weight_decay': 0.1286421886586822, 'criterion': 'PoissonNLLLoss', 'batch_size': 256}. Best is trial 15 with value: 8.471123803871203.[0m

Trial Id: 21 | Model params: 161460 | Timestamp: 2022-02-22 10:52:32.715339

[32m[I 2022-02-22 10:53:10,452][0m Trial 21 pruned. [0m
epoch 0 -0.04703434840356269 10.003669051071627

Trial Id: 22 | Model params: 90313 | Timestamp: 2022-02-22 10:53:10.452913

[32m[I 2022-02-22 10:53:36,904][0m Trial 22 pruned. [0m
epoch 0 -0.03637963532471766 9.952639794094486

Trial Id: 23 | Model params: 153893 | Timestamp: 2022-02-22 10:53:36.904704

[32m[I 2022-02-22 10:54:11,705][0m Trial 23 pruned. [0m
epoch 0 0.1974876079012653 8.75799564193064

Trial Id: 24 | Model params: 214098 | Timestamp: 2022-02-22 10:54:11.705709

epoch 0 -0.5027519385648616 11.984571190020548
epoch 5 0.15947512097302985 8.963015294097996
epoch 10 0.12244212520434217 9.15833941854638
epoch 15 0.14059442533710287 9.063124257535156
epoch 20 0.23387922623105062 8.557117006357934
