[32m[I 2022-02-24 12:42:19,105][0m A new study created in memory with name: DeepSet[0m
Starting Loading north
Finished Loading north
Finished north setup

++++++++ Session Characteristics +++++++

Area: north
Gal Type: rlbg
Training Set: 232352
Validation Set: 58087
Test Samples: 72610
Number of features: 5
Device: cuda:0
Number of Workers: 8
Number of Trials: 20

+++++++++++++++++++++++++++++++++++++++

Trial Id: 0 | Model params: 111998 | Timestamp: 2022-02-24 12:42:19.106144

epoch 0 -6.6476115251449786 27.035957843392904
epoch 5 -5.072084170543287 24.090606986395535
epoch 10 -5.080968606137593 24.108224760359686
epoch 15 -5.02073744586483 23.988533310579616
epoch 20 -5.0676215392634845 24.081752756655014
epoch 25 -5.012694274186296 23.972504678245766
epoch 30 -5.0495080391969465 24.045780600046946
epoch 35 -5.0762812660104535 24.098931402557888
epoch 40 -5.0898153055344375 24.125754920224825
epoch 45 -5.028078462952589 24.00315332913804
epoch 50 -5.078722086164226 24.10377114326455
epoch 55 -5.090912930352755 24.1279290283799
epoch 60 -5.045632464883902 24.038076986845585
epoch 65 -5.034645193165992 24.016223773541828
epoch 70 -5.023556410667579 23.994148479661828
epoch 75 -5.050660081488168 24.04807007856916
epoch 80 -5.044773365501837 24.036368990957598
epoch 85 -5.066734148387097 24.07999171166056
epoch 90 -5.062848255122904 24.07227856122861
epoch 95 -5.072102427796598 24.090643203612817
[32m[I 2022-02-24 14:23:07,620][0m Trial 0 finished with value: 24.061205406332306 and parameters: {'n_layers_fe': 2, 'fe_n_units_l0': 25, 'fe_dropout_l0': 0.26845680455904075, 'fe_n_units_l1': 167, 'fe_dropout_l1': 0.34319980999843847, 'n_units_l(Invariant)': 478, 'n_layers_mlp': 2, 'mlp_n_units_l0': 110, 'mlp_dropout_l0': 0.199640171064407, 'mlp_n_units_l1': 216, 'mlp_dropout_l1': 0.08465866559092661, 'reduction': 'sum', 'lr': 0.0031327026078181463, 'weight_decay': 0.16935195893427363, 'criterion': 'PoissonNLLLoss', 'batch_size': 32}. Best is trial 0 with value: 24.061205406332306.[0m

Trial Id: 1 | Model params: 123775 | Timestamp: 2022-02-24 14:23:07.620929

[32m[I 2022-02-24 14:23:42,544][0m Trial 1 pruned. [0m
++++++++++++++++++++
        NaN         
++++++++++++++++++++

Trial Id: 2 | Model params: 48924 | Timestamp: 2022-02-24 14:23:42.545011

[32m[I 2022-02-24 14:24:04,657][0m Trial 2 pruned. [0m
++++++++++++++++++++
        NaN         
++++++++++++++++++++

Trial Id: 3 | Model params: 136038 | Timestamp: 2022-02-24 14:24:04.657482

[32m[I 2022-02-24 14:24:50,006][0m Trial 3 pruned. [0m
++++++++++++++++++++
        NaN         
++++++++++++++++++++

Trial Id: 4 | Model params: 37113 | Timestamp: 2022-02-24 14:24:50.006753

epoch 0 -6.6476115251449786 27.035957843392904
epoch 5 -6.6476115251449786 27.035957843392904
epoch 10 -6.6476115251449786 27.035957843392904
epoch 15 -6.6476115251449786 27.035957843392904
epoch 20 -6.6476115251449786 27.035957843392904
[32m[I 2022-02-24 14:53:54,647][0m Trial 4 pruned. [0m
++++++++++++++++++++
        NaN         
++++++++++++++++++++

Trial Id: 5 | Model params: 59782 | Timestamp: 2022-02-24 14:53:54.647433

epoch 0 -0.2014662949831616 10.71604792074785
epoch 5 0.027595718339500475 9.640560452928627
epoch 10 0.08743221570379489 9.339237453575857
epoch 15 0.1599610807343229 8.960423880902626
epoch 20 0.11149590219666816 9.215280703184707
epoch 25 0.14234666727835132 9.053880141597627
epoch 30 0.2147971155575521 8.66302951869442
epoch 35 0.1907670126132236 8.794590858641508
epoch 40 0.20954826247549885 8.691936208267633
epoch 45 0.21016059221931904 8.688568917157383
epoch 50 0.21109000641623887 8.683455437003738
epoch 55 0.19301076273052764 8.782390069845022
epoch 60 0.14840659575725457 9.02183740096806
epoch 65 0.22491083159885006 8.607057117046853
epoch 70 0.2270089108479152 8.595400055075102
epoch 75 0.22760767804169568 8.592070365580504
epoch 80 0.23015989945411552 8.577863200220726
epoch 85 0.18808890211179408 8.80913143715582
epoch 90 0.2088141437326514 8.695971516260148
epoch 95 0.22215350696684855 8.62235302260027
[32m[I 2022-02-24 16:37:12,221][0m Trial 5 finished with value: 8.789291936678715 and parameters: {'n_layers_fe': 2, 'fe_n_units_l0': 122, 'fe_dropout_l0': 0.3165231509080084, 'fe_n_units_l1': 108, 'fe_dropout_l1': 0.379330113045849, 'n_units_l(Invariant)': 355, 'n_layers_mlp': 2, 'mlp_n_units_l0': 167, 'mlp_dropout_l0': 0.46374654196526827, 'mlp_n_units_l1': 17, 'mlp_dropout_l1': 0.37205158169879726, 'reduction': 'sum', 'lr': 9.258347815959096e-05, 'weight_decay': 0.28814833931810896, 'criterion': 'MSELoss', 'batch_size': 32}. Best is trial 5 with value: 8.789291936678715.[0m

Trial Id: 6 | Model params: 67752 | Timestamp: 2022-02-24 16:37:12.221866

epoch 0 -0.19459885907911634 10.685378215495327
epoch 5 -0.9498561337014393 13.651492523251152
epoch 10 -0.32834971100006527 11.267694510198448
epoch 15 0.06455303071111596 9.455585744272732
epoch 20 0.134392689297971 9.095766625856582
epoch 25 0.1727780236624098 8.891804036359922
epoch 30 0.16760410490914535 8.919567902004607
epoch 35 0.17216588646878783 8.895093357456922
epoch 40 0.13764925106431902 9.078640593225057
epoch 45 0.1789172507917013 8.858747331865565
epoch 50 0.1998293992527438 8.745208062253756
epoch 55 0.19480591106865752 8.772616413843538
epoch 60 0.23328259053543743 8.560448392226752
epoch 65 0.20479899686008785 8.718008953340178
epoch 70 0.2207509191628061 8.63012329636802
epoch 75 0.2273575951025043 8.593461210783408
epoch 80 0.2244521047995196 8.609603729688702
epoch 85 0.2205276147701274 8.63135974723223
epoch 90 0.19580677827386694 8.767162477721296
epoch 95 0.19212272613165593 8.787220951743638
[32m[I 2022-02-24 17:47:09,939][0m Trial 6 finished with value: 8.759345307456332 and parameters: {'n_layers_fe': 4, 'fe_n_units_l0': 205, 'fe_dropout_l0': 0.04855757880860412, 'fe_n_units_l1': 88, 'fe_dropout_l1': 0.4932866263415082, 'fe_n_units_l2': 74, 'fe_dropout_l2': 0.18890187055487456, 'fe_n_units_l3': 84, 'fe_dropout_l3': 0.004936160318926741, 'n_units_l(Invariant)': 128, 'n_layers_mlp': 2, 'mlp_n_units_l0': 102, 'mlp_dropout_l0': 0.4266715732081579, 'mlp_n_units_l1': 213, 'mlp_dropout_l1': 0.04223836481205079, 'reduction': 'sum', 'lr': 3.539966873753225e-05, 'weight_decay': 0.15817529702791047, 'criterion': 'MSELoss', 'batch_size': 128}. Best is trial 6 with value: 8.759345307456332.[0m

Trial Id: 7 | Model params: 72727 | Timestamp: 2022-02-24 17:47:09.939227

[32m[I 2022-02-24 17:47:38,233][0m Trial 7 pruned. [0m
++++++++++++++++++++
        NaN         
++++++++++++++++++++

Trial Id: 8 | Model params: 160033 | Timestamp: 2022-02-24 17:47:38.234181

[32m[I 2022-02-24 17:49:04,079][0m Trial 8 pruned. [0m
++++++++++++++++++++
        NaN         
++++++++++++++++++++

Trial Id: 9 | Model params: 36033 | Timestamp: 2022-02-24 17:49:04.079673

epoch 0 0.18411006461268553 8.830689995724653
epoch 5 0.2117810365396292 8.679651553215995
epoch 10 0.19012546175350686 8.79807629459965
epoch 15 0.21152029974782882 8.681087015620083
epoch 20 0.21049025041716574 8.68675553783511
epoch 25 0.20802479671597163 8.70030831520958
epoch 30 0.19745982525039985 8.758147239732569
epoch 35 0.21838856120599304 8.643194862804886
epoch 40 0.21212999525649412 8.677730021564262
epoch 45 0.16848388596150132 8.914852993225201
epoch 50 0.17269181602404715 8.892267346981948
epoch 55 0.21932052356944576 8.638040425126801
epoch 60 0.21778394196771944 8.64653720876278
epoch 65 0.20337414581491597 8.72581597614756
epoch 70 0.20958769919777576 8.691719379248486
epoch 75 0.18877461944975849 8.805410678726522
epoch 80 0.19989069250069058 8.744873113387317
epoch 85 0.20280755230872527 8.728918506564924
epoch 90 0.21564538747519957 8.658348823681937
epoch 95 0.1475079130198338 9.026596498206423
[32m[I 2022-02-24 18:40:57,178][0m Trial 9 finished with value: 8.81796008811264 and parameters: {'n_layers_fe': 2, 'fe_n_units_l0': 191, 'fe_dropout_l0': 0.18729611551915903, 'fe_n_units_l1': 85, 'fe_dropout_l1': 0.488995687355059, 'n_units_l(Invariant)': 140, 'n_layers_mlp': 2, 'mlp_n_units_l0': 57, 'mlp_dropout_l0': 0.43135191761874914, 'mlp_n_units_l1': 86, 'mlp_dropout_l1': 0.3474978729754694, 'reduction': 'sum', 'lr': 0.005384021058333779, 'weight_decay': 0.23684109344827667, 'criterion': 'MSELoss', 'batch_size': 128}. Best is trial 6 with value: 8.759345307456332.[0m

Trial Id: 10 | Model params: 217764 | Timestamp: 2022-02-24 18:40:57.179107

[32m[I 2022-02-24 18:41:43,695][0m Trial 10 pruned. [0m
++++++++++++++++++++
        NaN         
++++++++++++++++++++

Trial Id: 11 | Model params: 39672 | Timestamp: 2022-02-24 18:41:43.695499

epoch 0 -6.6476115251449786 27.035957843392904
epoch 5 -0.06368344156026873 10.082890490478826
epoch 10 0.05203944027794538 9.518619913765805
epoch 15 0.013959990579902049 9.707918454798982
epoch 20 0.1497552195918639 9.014690864960336
epoch 25 0.14764072153521535 9.025893350580775
epoch 30 0.12300993251774961 9.155376073512098
epoch 35 0.07070705909003938 9.424431673211656
epoch 40 0.2042858530149938 8.720821368784673
epoch 45 0.17644864337131705 8.872054368715286
epoch 50 0.17459319893316694 8.882043024745286
epoch 55 0.1872182672643241 8.813853309946035
epoch 60 0.20771502170696465 8.70200967819508
epoch 65 0.15927595099264713 8.964077165010265
epoch 70 0.10384023613568272 9.25489661157842
epoch 75 0.16132236348388995 8.95316075548898
epoch 80 0.22044325875266813 8.631826785865735
epoch 85 0.02404118555467516 9.658164463093758
epoch 90 0.1628445114714432 8.945032349436088
epoch 95 0.16027558997193803 8.958746339633608
[32m[I 2022-02-24 20:35:09,280][0m Trial 11 finished with value: 8.861291525904191 and parameters: {'n_layers_fe': 4, 'fe_n_units_l0': 155, 'fe_dropout_l0': 0.42288383714238775, 'fe_n_units_l1': 20, 'fe_dropout_l1': 0.3453993244751493, 'fe_n_units_l2': 129, 'fe_dropout_l2': 0.32046832690482735, 'fe_n_units_l3': 51, 'fe_dropout_l3': 0.023433248370377902, 'n_units_l(Invariant)': 347, 'n_layers_mlp': 2, 'mlp_n_units_l0': 254, 'mlp_dropout_l0': 0.4789385567100291, 'mlp_n_units_l1': 8, 'mlp_dropout_l1': 0.4926354034341785, 'reduction': 'sum', 'lr': 7.445659674157005e-05, 'weight_decay': 0.2901486837810219, 'criterion': 'MSELoss', 'batch_size': 32}. Best is trial 6 with value: 8.759345307456332.[0m

Trial Id: 12 | Model params: 115942 | Timestamp: 2022-02-24 20:35:09.280552

epoch 0 -0.2486512865449535 10.924446334191082
epoch 5 -0.23979580110456644 10.885639098457917
epoch 10 -0.31847499909107313 11.22573538232647
