[32m[I 2022-03-03 02:06:59,565][0m Trial 1 finished with value: 4.853277235502351 and parameters: {'n_layers_fe': 2, 'fe_neurons': 128, 'fe_dropout': 0.2786403658703153, 'n_units_l(Invariant)': 201, 'n_layers_mlp': 4, 'initialiser': 'normal', 'lr': 7.481885332504913e-05, 'weight_decay': 0.2723782688481518, 'criterion': 'MSELoss', 'batch_size': 128, 'epochs': 25}. Best is trial 1 with value: 4.853277235502351.[0m

Trial Id: 2 | Model params: 41198 | Timestamp: 2022-03-03 02:06:59.566108

epoch 0 -0.054484385075020514 5.000554984837891
epoch 5 0.009593437098862956 4.846239636275237
epoch 10 0.00913006220462953 4.847373192565626
epoch 15 0.010294361142985431 4.844524458275086
epoch 20 0.011599332783519989 4.8413295424806755
epoch 25 0.011448384829408353 4.841699210832074
epoch 30 0.011742960573676742 4.840977774847674
epoch 35 0.01261809190534302 4.8388338844131855
epoch 40 0.012263516873178726 4.839702634215804
epoch 45 0.013100959841998994 4.837650551274212
epoch 50 0.013217622717959676 4.837364609712252
epoch 55 0.012835410785247303 4.838301350943027
epoch 60 0.013585832391890817 4.836462014229024
epoch 65 0.01435214763144843 4.83458299891898
epoch 70 0.013621499837107476 4.836374573370504
[32m[I 2022-03-03 02:49:18,935][0m Trial 2 finished with value: 4.8346284008037745 and parameters: {'n_layers_fe': 2, 'fe_neurons': 64, 'fe_dropout': 0.2327940545244253, 'n_units_l(Invariant)': 438, 'n_layers_mlp': 2, 'initialiser': 'uniform', 'lr': 0.0004835264121755147, 'weight_decay': 0.003567518588292828, 'criterion': 'MSELoss', 'batch_size': 256, 'epochs': 75}. Best is trial 2 with value: 4.8346284008037745.[0m

Trial Id: 3 | Model params: 567040 | Timestamp: 2022-03-03 02:49:18.935806

epoch 0 -0.0062646368215084625 4.884883782632095
epoch 5 -3.845554985559829e-10 4.869654290355475
epoch 10 -0.000589437886751476 4.871089257360965
epoch 15 -0.0003762597227141562 4.870570330646223
epoch 20 -3.5433647514075766 10.37975093642422
epoch 25 -44070.054931714905 1022.2917445587561
epoch 30 -6773851663941.026 12674066.209475389
epoch 35 -910.5279648178829 147.02227171953786
epoch 40 -1.2566920001559388e+22 545899323034.26825
epoch 45 -7.062998597084951e+17 4092537716.304383
[32m[I 2022-03-03 04:33:58,051][0m Trial 3 finished with value: 11.893470213039416 and parameters: {'n_layers_fe': 4, 'fe_neurons': 256, 'fe_dropout': 0.27809898992336, 'n_units_l(Invariant)': 511, 'n_layers_mlp': 4, 'initialiser': 'normal', 'lr': 0.00584032960661842, 'weight_decay': 0.09783310696680375, 'criterion': 'MSELoss', 'batch_size': 32, 'epochs': 50}. Best is trial 2 with value: 4.8346284008037745.[0m

Trial Id: 4 | Model params: 401658 | Timestamp: 2022-03-03 04:33:58.051653

epoch 0 -1.6990770018971313 8.000290699715846
epoch 5 -1.6877344692847989 7.983462892736803
epoch 10 -1.704919270583202 8.008944506653085
epoch 15 -1.703604306151044 8.006997543294636
epoch 20 -1.6796733181708174 7.971481756083033
[32m[I 2022-03-03 05:20:44,199][0m Trial 4 finished with value: 8.00440114977436 and parameters: {'n_layers_fe': 4, 'fe_neurons': 256, 'fe_dropout': 0.2209929563609292, 'n_units_l(Invariant)': 380, 'n_layers_mlp': 2, 'initialiser': 'uniform', 'lr': 2.506805964546197e-05, 'weight_decay': 0.0914671666074023, 'criterion': 'PoissonNLLLoss', 'batch_size': 32, 'epochs': 25}. Best is trial 2 with value: 4.8346284008037745.[0m

Trial Id: 5 | Model params: 32622 | Timestamp: 2022-03-03 05:20:44.199650

[32m[I 2022-03-03 05:21:16,565][0m Trial 5 pruned. [0m
++++++++++++++++++++
        NaN         
++++++++++++++++++++

Trial Id: 6 | Model params: 97582 | Timestamp: 2022-03-03 05:21:16.565194

[32m[I 2022-03-03 05:22:06,859][0m Trial 6 pruned. [0m
epoch 0 0.0069114378767789475 4.852796955261127

Trial Id: 7 | Model params: 88612 | Timestamp: 2022-03-03 05:22:06.859908

epoch 0 -0.7685652264374137 6.476027306936946
epoch 5 -0.0012449905374678494 4.872684683265153
[32m[I 2022-03-03 05:25:54,086][0m Trial 7 pruned. [0m

Trial Id: 8 | Model params: 290714 | Timestamp: 2022-03-03 05:25:54.086727

epoch 0 -2.440212422160457 9.032142074313654
epoch 5 -2.518963557717916 9.134936129739481
epoch 10 -2.8401985219133996 9.542781250034205
epoch 15 -3.0003569994237838 9.739743185085214
epoch 20 -2.959370864674105 9.68971987503492
[32m[I 2022-03-03 06:01:22,511][0m Trial 8 finished with value: 9.546096580597162 and parameters: {'n_layers_fe': 2, 'fe_neurons': 256, 'fe_dropout': 0.4813135721160101, 'n_units_l(Invariant)': 460, 'n_layers_mlp': 2, 'initialiser': 'uniform', 'lr': 1.7753702159367407e-05, 'weight_decay': 0.24310925023451715, 'criterion': 'PoissonNLLLoss', 'batch_size': 32, 'epochs': 25}. Best is trial 2 with value: 4.8346284008037745.[0m

Trial Id: 9 | Model params: 89912 | Timestamp: 2022-03-03 06:01:22.511598

epoch 0 -1.3896316008133955 7.527722602559426
epoch 5 -0.1768472391958651 5.282727110416645
[32m[I 2022-03-03 06:07:45,038][0m Trial 9 pruned. [0m

Trial Id: 10 | Model params: 44964 | Timestamp: 2022-03-03 06:07:45.038996

[32m[I 2022-03-03 06:08:16,008][0m Trial 10 pruned. [0m
epoch 0 0.007863641820154754 4.850469891614047

Trial Id: 11 | Model params: 38364 | Timestamp: 2022-03-03 06:08:16.008745

[32m[I 2022-03-03 06:08:45,059][0m Trial 11 pruned. [0m
epoch 0 0.004256999173147036 4.859278177725287

Trial Id: 12 | Model params: 34074 | Timestamp: 2022-03-03 06:08:45.059364

[32m[I 2022-03-03 06:09:12,348][0m Trial 12 pruned. [0m
epoch 0 -0.03614513236684935 4.956880236999753

Trial Id: 13 | Model params: 43512 | Timestamp: 2022-03-03 06:09:12.349038

[32m[I 2022-03-03 06:09:43,823][0m Trial 13 pruned. [0m
epoch 0 0.00615701069022867 4.854639886016203

Trial Id: 14 | Model params: 78212 | Timestamp: 2022-03-03 06:09:43.823277

[32m[I 2022-03-03 06:10:10,575][0m Trial 14 pruned. [0m
epoch 0 0.003995666807635856 4.8599157937318385

Trial Id: 15 | Model params: 102128 | Timestamp: 2022-03-03 06:10:10.575878

[32m[I 2022-03-03 06:10:56,502][0m Trial 15 pruned. [0m
epoch 0 -0.07912690607582284 5.058647189599267

Trial Id: 16 | Model params: 31034 | Timestamp: 2022-03-03 06:10:56.502342

[32m[I 2022-03-03 06:11:24,483][0m Trial 16 pruned. [0m
epoch 0 -0.02824709026325012 4.9379521264084385

Trial Id: 17 | Model params: 27870 | Timestamp: 2022-03-03 06:11:24.483991

[32m[I 2022-03-03 06:11:51,682][0m Trial 17 pruned. [0m
epoch 0 0.007696571188549162 4.850878271444597

Trial Id: 18 | Model params: 80942 | Timestamp: 2022-03-03 06:11:51.682772

[32m[I 2022-03-03 06:12:14,127][0m Trial 18 pruned. [0m
epoch 0 -0.11948368604252657 5.1523696701864115

Trial Id: 19 | Model params: 76388 | Timestamp: 2022-03-03 06:12:14.127308

[32m[I 2022-03-03 06:13:35,523][0m Trial 19 pruned. [0m
epoch 0 -0.10269472096079002 5.113588519079337

Trial Id: 20 | Model params: 45752 | Timestamp: 2022-03-03 06:13:35.523895

[32m[I 2022-03-03 06:14:13,319][0m Trial 20 pruned. [0m
epoch 0 -0.014142229047012789 4.903967282947775

Trial Id: 21 | Model params: 410688 | Timestamp: 2022-03-03 06:14:13.319241

epoch 0 -2.3435794156790273 8.904385462922898
epoch 5 -1.809294586373253 8.162003405746837
epoch 10 -1.702392426744574 8.005202790445228
epoch 15 -1.7145656659719108 8.023212712190194
epoch 20 -1.707113690967287 8.012192557010827
[32m[I 2022-03-03 07:03:08,618][0m Trial 21 finished with value: 8.000474615459478 and parameters: {'n_layers_fe': 4, 'fe_neurons': 256, 'fe_dropout': 0.23697041564929544, 'n_units_l(Invariant)': 415, 'n_layers_mlp': 2, 'initialiser': 'uniform', 'lr': 0.00014069857558348617, 'weight_decay': 0.08618092933217884, 'criterion': 'PoissonNLLLoss', 'batch_size': 32, 'epochs': 25}. Best is trial 2 with value: 4.8346284008037745.[0m

Trial Id: 22 | Model params: 413526 | Timestamp: 2022-03-03 07:03:08.618999

[32m[I 2022-03-03 07:05:05,935][0m Trial 22 pruned. [0m
epoch 0 -1.6867007456798593 7.981927494095134

Trial Id: 23 | Model params: 389274 | Timestamp: 2022-03-03 07:05:05.935862

[32m[I 2022-03-03 07:06:56,017][0m Trial 23 pruned. [0m
epoch 0 -1.6260957861800818 7.891388269505191

Trial Id: 24 | Model params: 408366 | Timestamp: 2022-03-03 07:06:56.017773

epoch 0 -1.7467857061991272 8.07068728231791
epoch 5 -1.7206367362346726 8.032179576519388
epoch 10 -1.7054416306937221 8.00971779242654
epoch 15 -1.710629167131084 8.017393212901785
epoch 20 -1.7172828799783848 8.027227227927773
[32m[I 2022-03-03 07:55:19,978][0m Trial 24 finished with value: 8.010947130304755 and parameters: {'n_layers_fe': 4, 'fe_neurons': 256, 'fe_dropout': 0.3965678836584782, 'n_units_l(Invariant)': 406, 'n_layers_mlp': 2, 'initialiser': 'uniform', 'lr': 0.00043272054562955753, 'weight_decay': 0.13096888244154445, 'criterion': 'PoissonNLLLoss', 'batch_size': 32, 'epochs': 25}. Best is trial 2 with value: 4.8346284008037745.[0m

Trial Id: 25 | Model params: 293294 | Timestamp: 2022-03-03 07:55:19.978534

[32m[I 2022-03-03 07:56:29,631][0m Trial 25 pruned. [0m
++++++++++++++++++++
        NaN         
++++++++++++++++++++

Trial Id: 26 | Model params: 253820 | Timestamp: 2022-03-03 07:56:29.631245

[32m[I 2022-03-03 07:57:53,982][0m Trial 26 pruned. [0m
++++++++++++++++++++
        NaN         
++++++++++++++++++++

Trial Id: 27 | Model params: 140226 | Timestamp: 2022-03-03 07:57:53.982294

[32m[I 2022-03-03 07:59:39,238][0m Trial 27 pruned. [0m
++++++++++++++++++++
        NaN         
++++++++++++++++++++

Trial Id: 28 | Model params: 294584 | Timestamp: 2022-03-03 07:59:39.239006

[32m[I 2022-03-03 08:00:49,340][0m Trial 28 pruned. [0m
epoch 0 0.008181523231054366 4.849692781832599

Trial Id: 29 | Model params: 46944 | Timestamp: 2022-03-03 08:00:49.340223

epoch 0 -1.871802789433925 8.252308157426366
epoch 5 -1.7689103166041091 8.103125686157915
epoch 10 -1.7366702102241973 8.05581274995778
epoch 15 -1.7152016744374445 8.024152555424244
epoch 20 -1.6978248950771824 7.99843480961698
epoch 25 -1.7152557143305147 8.024232406249434
epoch 30 -1.7103020321262243 8.016909404725967
epoch 35 -1.6995928560550366 8.001055180693616
epoch 40 -1.700808239611661 8.002856055337896
epoch 45 -1.6927994583468253 7.990981700921243
[32m[I 2022-03-03 08:35:25,143][0m Trial 29 finished with value: 8.0130895545462 and parameters: {'n_layers_fe': 4, 'fe_neurons': 64, 'fe_dropout': 0.2454322293558818, 'n_units_l(Invariant)': 399, 'n_layers_mlp': 2, 'initialiser': 'kaiming_he', 'lr': 9.22921392316379e-05, 'weight_decay': 0.16935438454830135, 'criterion': 'PoissonNLLLoss', 'batch_size': 128, 'epochs': 50}. Best is trial 2 with value: 4.8346284008037745.[0m

Study statistics: 
  Number of finished trials:  30
  Number of pruned trials:  21
  Number of complete trials:  9

Best trial:
  Value:  4.8346284008037745
  Params: 
    n_layers_fe: 2
    fe_neurons: 64
    fe_dropout: 0.2327940545244253
    n_units_l(Invariant): 438
    n_layers_mlp: 2
    initialiser: uniform
    lr: 0.0004835264121755147
    weight_decay: 0.003567518588292828
    criterion: MSELoss
    batch_size: 256
    epochs: 75
Traceback (most recent call last):
  File "hp_optim.py", line 435, in <module>
    main()
  File "hp_optim.py", line 76, in main
    model = torch.load(f"trained_models/{area}/{gal}/{trial.number}.pt")
  File "/vol/bitbucket/ele20/venv/lib/python3.8/site-packages/torch/serialization.py", line 594, in load
    with _open_file_like(f, 'rb') as opened_file:
  File "/vol/bitbucket/ele20/venv/lib/python3.8/site-packages/torch/serialization.py", line 230, in _open_file_like
    return _open_file(name_or_buffer, mode)
  File "/vol/bitbucket/ele20/venv/lib/python3.8/site-packages/torch/serialization.py", line 211, in __init__
    super(_open_file, self).__init__(open(name, mode))
FileNotFoundError: [Errno 2] No such file or directory: 'trained_models/north/lrg/2.pt'
./hp_optim.sh: line 11: 10: command not found
./hp_optim.sh: line 12: syntax error near unexpected token `done'
./hp_optim.sh: line 12: `    done'
