[32m[I 2022-03-01 16:05:59,315][0m A new study created in memory with name: DeepSet[0m
Starting Loading north
Finished Loading north
Finished north setup

++++++++ Session Characteristics +++++++

Area: north
Gal Type: elg
Training Set: 290439
Validation Set: 72610
Test Samples: 72610
Number of features: 5
Device: cuda:0
Number of Workers: 8
Number of Trials: 30

+++++++++++++++++++++++++++++++++++++++

Trial Id: 0 | Model params: 413526 | Timestamp: 2022-03-01 16:05:59.315905

epoch 0 -13.381644900753896 29.49659878910337
epoch 5 -12.859979834622433 28.956692852273584
epoch 10 -12.86741005205454 28.964453530812534
epoch 15 -12.860413198660153 28.957145547421522
epoch 20 -12.893777083711562 28.991976477902686
epoch 25 -12.854508878821264 28.950977244275016
epoch 30 -12.864033751921102 28.960927326529315
epoch 35 -12.872029928268308 28.9692778291677
epoch 40 -12.861815231367158 28.958610072250153
epoch 45 -12.890113168176214 28.988153501746872
epoch 50 -12.86813621017324 28.965211873490492
epoch 55 -12.878371236703344 28.97589842246195
[32m[I 2022-03-01 17:33:22,262][0m Trial 0 finished with value: 28.960618664678346 and parameters: {'n_layers_fe': 2, 'fe_neurons': 256, 'fe_dropout': 0.1154251713317434, 'n_units_l(Invariant)': 426, 'n_layers_mlp': 4, 'lr': 2.861003001599217e-05, 'weight_decay': 0.2833218593063263, 'criterion': 'PoissonNLLLoss', 'batch_size': 32, 'epochs': 60}. Best is trial 0 with value: 28.960618664678346.[0m

Trial Id: 1 | Model params: 34206 | Timestamp: 2022-03-01 17:33:22.262722

epoch 0 0.03419969711247273 7.643835442886294
epoch 5 0.11078964273048841 7.334489929686961
epoch 10 0.09494352926948812 7.399553238242155
epoch 15 0.09739818026618963 7.389512067623925
[32m[I 2022-03-01 18:01:07,907][0m Trial 1 finished with value: 7.317698601008332 and parameters: {'n_layers_fe': 2, 'fe_neurons': 64, 'fe_dropout': 0.21689381759931226, 'n_units_l(Invariant)': 206, 'n_layers_mlp': 4, 'lr': 0.0010507176215368336, 'weight_decay': 0.2589109862568354, 'criterion': 'MSELoss', 'batch_size': 32, 'epochs': 20}. Best is trial 1 with value: 7.317698601008332.[0m

Trial Id: 2 | Model params: 34008 | Timestamp: 2022-03-01 18:01:07.907546

epoch 0 -15.944262949506335 32.01687950409052
epoch 5 -14.268130721290023 30.392091994347368
epoch 10 -14.213006500081537 30.337178418634203
epoch 15 -14.45632615613218 30.57882525311562
[32m[I 2022-03-01 18:11:24,895][0m Trial 2 finished with value: 30.624874715299935 and parameters: {'n_layers_fe': 4, 'fe_neurons': 64, 'fe_dropout': 0.2089535350254489, 'n_units_l(Invariant)': 203, 'n_layers_mlp': 2, 'lr': 0.00011192157473998827, 'weight_decay': 0.10401962989576467, 'criterion': 'PoissonNLLLoss', 'batch_size': 256, 'epochs': 20}. Best is trial 1 with value: 7.317698601008332.[0m

Trial Id: 3 | Model params: 26946 | Timestamp: 2022-03-01 18:11:24.895350

epoch 0 0.0924709950070054 7.4096538071101286
epoch 5 0.10677806429122016 7.35101569972228
epoch 10 0.09663337794121285 7.3926420853223505
epoch 15 0.10254444674914365 7.368415966263163
[32m[I 2022-03-01 18:40:08,727][0m Trial 3 finished with value: 7.468714359374772 and parameters: {'n_layers_fe': 2, 'fe_neurons': 64, 'fe_dropout': 0.162767886412013, 'n_units_l(Invariant)': 96, 'n_layers_mlp': 4, 'lr': 0.0035498007407173708, 'weight_decay': 0.14937315736720083, 'criterion': 'MSELoss', 'batch_size': 32, 'epochs': 20}. Best is trial 1 with value: 7.317698601008332.[0m

Trial Id: 4 | Model params: 247628 | Timestamp: 2022-03-01 18:40:08.728132

[32m[I 2022-03-01 18:41:32,006][0m Trial 4 pruned. [0m
++++++++++++++++++++
        NaN         
++++++++++++++++++++

Trial Id: 5 | Model params: 53614 | Timestamp: 2022-03-01 18:41:32.006349

epoch 0 0.11791577717250701 7.305041499020447
epoch 5 0.11001614724461684 7.33767925469273
epoch 10 0.11034972958552536 7.336303977140958
epoch 15 0.06811088201783977 7.508441138144539
epoch 20 0.11965639065946931 7.2978304343828215
epoch 25 0.10948949407137487 7.3398499910064885
epoch 30 0.11147160321970684 7.331676876690448
epoch 35 0.1144243145505437 7.319484615554331
[32m[I 2022-03-01 19:07:41,840][0m Trial 5 finished with value: 7.3311975488038055 and parameters: {'n_layers_fe': 4, 'fe_neurons': 64, 'fe_dropout': 0.14237418403658386, 'n_units_l(Invariant)': 374, 'n_layers_mlp': 4, 'lr': 0.006493202028983634, 'weight_decay': 0.050387544434668176, 'criterion': 'MSELoss', 'batch_size': 256, 'epochs': 40}. Best is trial 1 with value: 7.317698601008332.[0m

Trial Id: 6 | Model params: 31966 | Timestamp: 2022-03-01 19:07:41.840709

[32m[I 2022-03-01 19:08:11,108][0m Trial 6 pruned. [0m
epoch 0 0.10564826252151038 7.355663237834629

Trial Id: 7 | Model params: 358572 | Timestamp: 2022-03-01 19:08:11.108645

[32m[I 2022-03-01 19:09:40,620][0m Trial 7 pruned. [0m
epoch 0 0.11151664000522787 7.331491064202939

Trial Id: 8 | Model params: 30576 | Timestamp: 2022-03-01 19:09:40.620696

[32m[I 2022-03-01 19:10:07,070][0m Trial 8 pruned. [0m
epoch 0 0.10883973701929017 7.342527247275049

Trial Id: 9 | Model params: 561364 | Timestamp: 2022-03-01 19:10:07.070859

[32m[I 2022-03-01 19:11:59,455][0m Trial 9 pruned. [0m
epoch 0 0.09631409012580217 7.393948405456545

Trial Id: 10 | Model params: 84058 | Timestamp: 2022-03-01 19:11:59.455841

epoch 0 -0.33100024105068004 8.973393801630856
epoch 5 0.11044289450662625 7.33591983513669
epoch 10 0.11899987445233184 7.300551105601626
epoch 15 0.1181120663720816 7.304228662506912
[32m[I 2022-03-01 19:39:50,680][0m Trial 10 pruned. [0m
epoch 20 0.10883540777465084 7.342545082202973

Trial Id: 11 | Model params: 53878 | Timestamp: 2022-03-01 19:39:50.681173

[32m[I 2022-03-01 19:40:28,946][0m Trial 11 pruned. [0m
epoch 0 0.052810123661298225 7.569831006142656

Trial Id: 12 | Model params: 124232 | Timestamp: 2022-03-01 19:40:28.946230

[32m[I 2022-03-01 19:41:10,413][0m Trial 12 pruned. [0m
epoch 0 0.07590163263449679 7.476989345773466

Trial Id: 13 | Model params: 61270 | Timestamp: 2022-03-01 19:41:10.413875

epoch 0 -0.009980258980617274 7.816711853524086
epoch 5 -1.2130518706957405 11.570801866122878
epoch 10 -1.112710065232247 11.305443684705747
epoch 15 -0.3346438502230149 8.98566772673771
epoch 20 -1.9913089187676012 13.452354184490181
epoch 25 -0.085566826145131 8.103934868744746
epoch 30 -1.5612802215052692 12.447903367354662
epoch 35 -1.3093164115584588 11.81977967747018
[32m[I 2022-03-01 20:48:24,664][0m Trial 13 finished with value: 29.17143363973303 and parameters: {'n_layers_fe': 4, 'fe_neurons': 64, 'fe_dropout': 0.34640265380710067, 'n_units_l(Invariant)': 490, 'n_layers_mlp': 4, 'lr': 0.009985059059600933, 'weight_decay': 0.014755034844120718, 'criterion': 'MSELoss', 'batch_size': 32, 'epochs': 40}. Best is trial 1 with value: 7.317698601008332.[0m

Trial Id: 14 | Model params: 45100 | Timestamp: 2022-03-01 20:48:24.664832

[32m[I 2022-03-01 20:50:04,380][0m Trial 14 pruned. [0m
epoch 0 0.09717255943568126 7.390435577658061

Trial Id: 15 | Model params: 30246 | Timestamp: 2022-03-01 20:50:04.380387

epoch 0 -4.128454469043845 17.614118445029888
epoch 5 0.058130972114045165 7.548539262295613
[32m[I 2022-03-01 20:53:37,733][0m Trial 15 pruned. [0m

Trial Id: 16 | Model params: 130992 | Timestamp: 2022-03-01 20:53:37.734042

[32m[I 2022-03-01 20:54:22,152][0m Trial 16 pruned. [0m
epoch 0 0.06363184383622111 7.526463819243949

Trial Id: 17 | Model params: 29062 | Timestamp: 2022-03-01 20:54:22.152962

epoch 0 -12.861485115465497 28.958265248919606
epoch 5 -12.855159938389605 28.951657477312473
epoch 10 -12.8771709164268 28.974645353572505
epoch 15 -12.864803572690814 28.96173136431106
[32m[I 2022-03-01 21:27:45,253][0m Trial 17 finished with value: 28.95886131795393 and parameters: {'n_layers_fe': 4, 'fe_neurons': 64, 'fe_dropout': 0.31068641724765794, 'n_units_l(Invariant)': 2, 'n_layers_mlp': 4, 'lr': 0.0025356495022178585, 'weight_decay': 0.19363380789218793, 'criterion': 'PoissonNLLLoss', 'batch_size': 32, 'epochs': 20}. Best is trial 1 with value: 7.317698601008332.[0m

Trial Id: 18 | Model params: 50248 | Timestamp: 2022-03-01 21:27:45.254044

[32m[I 2022-03-01 21:28:22,524][0m Trial 18 pruned. [0m
epoch 0 0.04183488339034558 7.613561114069248

Trial Id: 19 | Model params: 29912 | Timestamp: 2022-03-01 21:28:22.524222

epoch 0 -0.9125468302066782 10.756567313150347
[32m[I 2022-03-01 21:36:29,038][0m Trial 19 pruned. [0m
epoch 5 -0.37881540831824223 9.133152816143213

Trial Id: 20 | Model params: 171166 | Timestamp: 2022-03-01 21:36:29.038686

epoch 0 -12.846482314243758 28.94258970210672
epoch 5 -12.86616494309039 28.963153190296584
[32m[I 2022-03-01 21:46:45,644][0m Trial 20 pruned. [0m

Trial Id: 21 | Model params: 28266 | Timestamp: 2022-03-01 21:46:45.645172

[32m[I 2022-03-01 21:48:16,220][0m Trial 21 pruned. [0m
epoch 0 0.07178058626969153 7.4936427369725065

Trial Id: 22 | Model params: 25758 | Timestamp: 2022-03-01 21:48:16.221048

[32m[I 2022-03-01 21:49:44,411][0m Trial 22 pruned. [0m
epoch 0 0.09484664254882702 7.3999492904693955

Trial Id: 23 | Model params: 32886 | Timestamp: 2022-03-01 21:49:44.411396

[32m[I 2022-03-01 21:51:13,626][0m Trial 23 pruned. [0m
epoch 0 0.1086646258503906 7.343248607633185

Trial Id: 24 | Model params: 21798 | Timestamp: 2022-03-01 21:51:13.626381

[32m[I 2022-03-01 21:52:42,571][0m Trial 24 pruned. [0m
epoch 0 0.10361178653059522 7.364033051040047

Trial Id: 25 | Model params: 27606 | Timestamp: 2022-03-01 21:52:42.571825

[32m[I 2022-03-01 21:53:08,989][0m Trial 25 pruned. [0m
epoch 0 0.1142168161533661 7.3203420760713795

Trial Id: 26 | Model params: 24768 | Timestamp: 2022-03-01 21:53:08.989708

[32m[I 2022-03-01 21:54:37,796][0m Trial 26 pruned. [0m
epoch 0 0.11043508421069548 7.3359520396903495

Trial Id: 27 | Model params: 36516 | Timestamp: 2022-03-01 21:54:37.796285

[32m[I 2022-03-01 21:56:07,092][0m Trial 27 pruned. [0m
epoch 0 0.05808545922703401 7.548721639916151

Trial Id: 28 | Model params: 31566 | Timestamp: 2022-03-01 21:56:07.092687

[32m[I 2022-03-01 21:56:28,965][0m Trial 28 pruned. [0m
epoch 0 0.1039548747864264 7.36262364213866

Trial Id: 29 | Model params: 415332 | Timestamp: 2022-03-01 21:56:28.965684

epoch 0 -12.871448384378994 28.96867059709156
epoch 5 -12.865135387721558 28.962077920980136
epoch 10 -12.85968571956611 28.95638561356787
epoch 15 -12.892828972248584 28.990987254669058
epoch 20 -12.856854045399384 28.953427421033943
epoch 25 -12.899512062940387 28.997959416439038
epoch 30 -12.894187201699298 28.992404368865657
epoch 35 -12.858657522650283 28.955311512062686
epoch 40 -12.856977805093575 28.95355671659089
epoch 45 -12.86697287164518 28.96399696425087
epoch 50 -12.848044897024142 28.944222749237834
epoch 55 -12.903002902676151 29.00160058289018
[32m[I 2022-03-01 23:29:40,580][0m Trial 29 finished with value: 29.008883022065927 and parameters: {'n_layers_fe': 2, 'fe_neurons': 256, 'fe_dropout': 0.1252855075405798, 'n_units_l(Invariant)': 433, 'n_layers_mlp': 4, 'lr': 0.0003605235870850734, 'weight_decay': 0.2596195447403018, 'criterion': 'PoissonNLLLoss', 'batch_size': 32, 'epochs': 60}. Best is trial 1 with value: 7.317698601008332.[0m

Study statistics: 
  Number of finished trials:  30
  Number of pruned trials:  22
  Number of complete trials:  8

Best trial:
  Value:  7.317698601008332
  Params: 
    n_layers_fe: 2
    fe_neurons: 64
    fe_dropout: 0.21689381759931226
    n_units_l(Invariant): 206
    n_layers_mlp: 4
    lr: 0.0010507176215368336
    weight_decay: 0.2589109862568354
    criterion: MSELoss
    batch_size: 32
    epochs: 20
Traceback (most recent call last):
  File "hp_optim.py", line 392, in <module>
    main()
  File "hp_optim.py", line 76, in main
    model = torch.load(f"trained_models/{area}/{gal}/{trial.number}.pt")
  File "/vol/bitbucket/ele20/venv/lib/python3.8/site-packages/torch/serialization.py", line 594, in load
    with _open_file_like(f, 'rb') as opened_file:
  File "/vol/bitbucket/ele20/venv/lib/python3.8/site-packages/torch/serialization.py", line 230, in _open_file_like
    return _open_file(name_or_buffer, mode)
  File "/vol/bitbucket/ele20/venv/lib/python3.8/site-packages/torch/serialization.py", line 211, in __init__
    super(_open_file, self).__init__(open(name, mode))
FileNotFoundError: [Errno 2] No such file or directory: 'trained_models/north/elg/1.pt'
[32m[I 2022-03-01 23:31:12,127][0m A new study created in memory with name: DeepSet[0m
Starting Loading north
Finished Loading north
Finished north setup

++++++++ Session Characteristics +++++++

Area: north
Gal Type: qso
Training Set: 290439
Validation Set: 72610
Test Samples: 72610
Number of features: 5
Device: cuda:0
Number of Workers: 8
Number of Trials: 30

+++++++++++++++++++++++++++++++++++++++

Trial Id: 0 | Model params: 89128 | Timestamp: 2022-03-01 23:31:12.128736

epoch 0 -1.4555434915226315 3.8784595838461913
epoch 5 -1.4216876734027677 3.851629642963353
epoch 10 -1.3987917375806194 3.8333787144212557
epoch 15 -1.3809429634109085 3.8190905080972435
epoch 20 -1.4311579326951174 3.8591533919282153
epoch 25 -1.3929277897940064 3.8286904193423195
epoch 30 -1.4309195213450248 3.858964163471341
epoch 35 -1.3971219691253451 3.8320442990507066
epoch 40 -1.4200638438992041 3.8503380976661887
epoch 45 -1.392988176043981 3.8287387281126763
epoch 50 -1.389393753980937 3.8258621416607452
epoch 55 -1.4455814306691042 3.870584195374661
[32m[I 2022-03-02 00:12:09,213][0m Trial 0 finished with value: 3.8357563712027525 and parameters: {'n_layers_fe': 2, 'fe_neurons': 128, 'fe_dropout': 0.07507424853734623, 'n_units_l(Invariant)': 339, 'n_layers_mlp': 2, 'lr': 0.00018655183412378995, 'weight_decay': 0.07754025840138437, 'criterion': 'PoissonNLLLoss', 'batch_size': 256, 'epochs': 60}. Best is trial 0 with value: 3.8357563712027525.[0m

Trial Id: 1 | Model params: 16184 | Timestamp: 2022-03-02 00:12:09.213448

epoch 0 -2.3916034725363575 4.558143467828462
epoch 5 -2.5062493072647807 4.634542309683372
epoch 10 -2.5633369359896543 4.672119041259272
epoch 15 -2.6185548483435044 4.70817974689607
[32m[I 2022-03-02 00:20:05,866][0m Trial 1 finished with value: 4.738867829098983 and parameters: {'n_layers_fe': 2, 'fe_neurons': 64, 'fe_dropout': 0.4868633987895828, 'n_units_l(Invariant)': 59, 'n_layers_mlp': 2, 'lr': 1.7240206536488217e-05, 'weight_decay': 0.04503933897804393, 'criterion': 'PoissonNLLLoss', 'batch_size': 128, 'epochs': 20}. Best is trial 0 with value: 3.8357563712027525.[0m

Trial Id: 2 | Model params: 305682 | Timestamp: 2022-03-02 00:20:05.866551

epoch 0 0.040552957155223446 2.424353576512075
epoch 5 0.09950786747684315 2.348688472668467
epoch 10 0.10130391076162548 2.3463450587208197
epoch 15 0.08240319536904783 2.3708899796063645
epoch 20 0.10201634169314666 2.3454148553771157
epoch 25 0.10424794749632116 2.3424987125172776
epoch 30 0.09778380166385259 2.3509357755777454
epoch 35 0.10191100482965709 2.345552414338996
epoch 40 0.103013646556259 2.3441120791892502
epoch 45 0.10376729638038507 2.3431271082981135
epoch 50 0.10386791891873437 2.342995569907242
epoch 55 0.09652663684668061 2.3525731241975536
[32m[I 2022-03-02 00:58:04,470][0m Trial 2 finished with value: 2.351205240502974 and parameters: {'n_layers_fe': 2, 'fe_neurons': 256, 'fe_dropout': 0.16594140044939165, 'n_units_l(Invariant)': 8, 'n_layers_mlp': 4, 'lr': 8.447767555131369e-05, 'weight_decay': 0.14931616144847004, 'criterion': 'MSELoss', 'batch_size': 128, 'epochs': 60}. Best is trial 2 with value: 2.351205240502974.[0m

Trial Id: 3 | Model params: 46548 | Timestamp: 2022-03-02 00:58:04.470987

epoch 0 -2.239019965164477 4.4544313215949725
epoch 5 -2.390984187280613 4.557727304805019
epoch 10 -2.4534574134437013 4.5995199541082386
epoch 15 -2.4698605740724973 4.610430366339057
epoch 20 -2.5575102130031855 4.668297583768087
epoch 25 -2.509114244732673 4.636435352872081
epoch 30 -2.4808746607145284 4.617741819615098
epoch 35 -2.671343365567157 4.7423975430515775
epoch 40 -2.657594610560685 4.733509349606765
epoch 45 -2.2408097230007504 4.455661825335287
epoch 50 -2.142586773670802 4.38762087487972
epoch 55 -2.2989693228858448 4.495464716862406
[32m[I 2022-03-02 01:29:17,427][0m Trial 3 finished with value: 4.424636562820494 and parameters: {'n_layers_fe': 2, 'fe_neurons': 64, 'fe_dropout': 0.18734725744813296, 'n_units_l(Invariant)': 393, 'n_layers_mlp': 4, 'lr': 8.614289488453438e-05, 'weight_decay': 0.1623604217800024, 'criterion': 'PoissonNLLLoss', 'batch_size': 256, 'epochs': 60}. Best is trial 2 with value: 2.351205240502974.[0m

Trial Id: 4 | Model params: 460744 | Timestamp: 2022-03-02 01:29:17.428050

epoch 0 -1.3602309318313908 3.8024429227371535
epoch 5 -1.5206864518477956 3.9295685423741853
epoch 10 -1.478277722103873 3.8963722472927205
epoch 15 -1.4826149262453434 3.8997802540542743
epoch 20 -1.4822806625546954 3.8995177085407016
epoch 25 -1.4895517010964032 3.9052247204833415
epoch 30 -1.479304915538056 3.89717964537402
epoch 35 -1.4761546091007114 3.894702900270902
epoch 40 -1.47068496143384 3.890398962711522
epoch 45 -1.4829878213288974 3.90007312151953
epoch 50 -1.473476980704878 3.892596531823728
epoch 55 -1.4824890744747519 3.8996814065719594
[32m[I 2022-03-02 02:52:28,990][0m Trial 4 finished with value: 3.902434198451521 and parameters: {'n_layers_fe': 4, 'fe_neurons': 256, 'fe_dropout': 0.4337638313334492, 'n_units_l(Invariant)': 99, 'n_layers_mlp': 4, 'lr': 0.00012921835655410526, 'weight_decay': 0.26412414814446805, 'criterion': 'PoissonNLLLoss', 'batch_size': 128, 'epochs': 60}. Best is trial 2 with value: 2.351205240502974.[0m

Trial Id: 5 | Model params: 96542 | Timestamp: 2022-03-02 02:52:28.990654

[32m[I 2022-03-02 02:53:00,589][0m Trial 5 pruned. [0m
epoch 0 0.06826345600276984 2.389087299695551

Trial Id: 6 | Model params: 190094 | Timestamp: 2022-03-02 02:53:00.589999

epoch 0 -1.4915570400419154 3.906797237097978
[32m[I 2022-03-02 03:00:54,230][0m Trial 6 pruned. [0m
epoch 5 -1.475712431477926 3.894355137786

Trial Id: 7 | Model params: 137492 | Timestamp: 2022-03-02 03:00:54.230903

[32m[I 2022-03-02 03:02:21,394][0m Trial 7 pruned. [0m
epoch 0 -1.4360521551248646 3.8630359161042733

Trial Id: 8 | Model params: 429006 | Timestamp: 2022-03-02 03:02:21.394282

[32m[I 2022-03-02 03:04:09,688][0m Trial 8 pruned. [0m
epoch 0 0.014212270573503938 2.4574073837922326

Trial Id: 9 | Model params: 342318 | Timestamp: 2022-03-02 03:04:09.688597

[32m[I 2022-03-02 03:05:33,671][0m Trial 9 pruned. [0m
epoch 0 -1.4154687525327532 3.846680949973298

Trial Id: 10 | Model params: 367344 | Timestamp: 2022-03-02 03:05:33.671213

[32m[I 2022-03-02 03:06:29,300][0m Trial 10 pruned. [0m
epoch 0 0.11189255321950642 2.3324815153376357

Trial Id: 11 | Model params: 121112 | Timestamp: 2022-03-02 03:06:29.300372

[32m[I 2022-03-02 03:07:08,473][0m Trial 11 pruned. [0m
epoch 0 0.09312060843918568 2.357003466795041

Trial Id: 12 | Model params: 86268 | Timestamp: 2022-03-02 03:07:08.473650

[32m[I 2022-03-02 03:07:46,698][0m Trial 12 pruned. [0m
epoch 0 -0.060392826073650596 2.5487007417236267

Trial Id: 13 | Model params: 107072 | Timestamp: 2022-03-02 03:07:46.699074

[32m[I 2022-03-02 03:08:21,694][0m Trial 13 pruned. [0m
epoch 0 0.09172349257897228 2.35881833856934

Trial Id: 14 | Model params: 21336 | Timestamp: 2022-03-02 03:08:21.694546

epoch 0 -2.5659463302317502 4.673829400067851
epoch 5 -2.645685993952248 4.725797244828668
epoch 10 -2.701018313327754 4.761525033034443
epoch 15 -2.7516639185740632 4.793993249115138
epoch 20 -2.7615907690898465 4.8003314788770375
epoch 25 -2.720169500686494 4.7738285652924475
epoch 30 -2.715097268878269 4.770573038319637
epoch 35 -2.6906417576126094 4.754845397088192
epoch 40 -2.6974977278970766 4.75925979916325
epoch 45 -2.707740160269419 4.765847049354824
epoch 50 -2.7372600924809225 4.784781569702287
epoch 55 -2.7459813267522986 4.790361176636638
[32m[I 2022-03-02 03:24:13,358][0m Trial 14 finished with value: 4.733336589081312 and parameters: {'n_layers_fe': 2, 'fe_neurons': 64, 'fe_dropout': 0.3024581736342399, 'n_units_l(Invariant)': 11, 'n_layers_mlp': 4, 'lr': 1.1290267006020006e-05, 'weight_decay': 0.20450946452289545, 'criterion': 'PoissonNLLLoss', 'batch_size': 256, 'epochs': 60}. Best is trial 2 with value: 2.351205240502974.[0m

Trial Id: 15 | Model params: 277040 | Timestamp: 2022-03-02 03:24:13.359044

[32m[I 2022-03-02 03:25:33,845][0m Trial 15 pruned. [0m
epoch 0 0.06020102937285787 2.3994015627538294

Trial Id: 16 | Model params: 87698 | Timestamp: 2022-03-02 03:25:33.846079

[32m[I 2022-03-02 03:26:12,605][0m Trial 16 pruned. [0m
epoch 0 0.1145609719460694 2.3289747777129435

Trial Id: 17 | Model params: 356766 | Timestamp: 2022-03-02 03:26:12.605219

epoch 0 -2.0844990341875573 4.346881230667774
epoch 5 -2.2022387312340594 4.429067589863252
epoch 10 -1.804740155160736 4.145069063829309
epoch 15 -1.710324960217938 4.074704671570123
epoch 20 -1.6663202091723055 4.041490916879045
epoch 25 -1.5982276701595688 3.989551325595534
epoch 30 -1.529638758331187 3.936540358058898
epoch 35 -1.463821610399667 3.884991607392068
epoch 40 -1.474838842140239 3.893667988654333
epoch 45 -1.4270934608269092 3.8559261269503
epoch 50 -1.4633413125585815 3.884612918443979
epoch 55 -3.06582136223758 4.990678592911726
[32m[I 2022-03-02 04:16:12,406][0m Trial 17 finished with value: 4.4556083851786665 and parameters: {'n_layers_fe': 2, 'fe_neurons': 256, 'fe_dropout': 0.18972035995311695, 'n_units_l(Invariant)': 206, 'n_layers_mlp': 4, 'lr': 0.00014884696206192118, 'weight_decay': 0.1960094955278676, 'criterion': 'PoissonNLLLoss', 'batch_size': 256, 'epochs': 60}. Best is trial 2 with value: 2.351205240502974.[0m

Trial Id: 18 | Model params: 116952 | Timestamp: 2022-03-02 04:16:12.406575

[32m[I 2022-03-02 04:16:51,591][0m Trial 18 pruned. [0m
epoch 0 -1.3434174894974351 3.788875093682659

Trial Id: 19 | Model params: 403980 | Timestamp: 2022-03-02 04:16:51.591610

