[32m[I 2022-03-02 04:18:32,991][0m Trial 19 pruned. [0m
epoch 0 0.0798861907448094 2.3741394756347085

Trial Id: 20 | Model params: 32358 | Timestamp: 2022-03-02 04:18:32.991794

epoch 0 -2.1118214253774363 4.366091050092846
[32m[I 2022-03-02 04:25:48,302][0m Trial 20 pruned. [0m

Trial Id: 21 | Model params: 436234 | Timestamp: 2022-03-02 04:25:48.302577

[32m[I 2022-03-02 04:27:02,680][0m Trial 21 pruned. [0m
epoch 0 -1.51266903694746 3.9233142792072138

Trial Id: 22 | Model params: 451714 | Timestamp: 2022-03-02 04:27:02.680852

[32m[I 2022-03-02 04:28:21,706][0m Trial 22 pruned. [0m
epoch 0 -1.4763005340241495 3.8948176600373996

Trial Id: 23 | Model params: 463066 | Timestamp: 2022-03-02 04:28:21.706338

[32m[I 2022-03-02 04:29:44,507][0m Trial 23 pruned. [0m
epoch 0 -1.468592135582219 3.8887509070991206

Trial Id: 24 | Model params: 436750 | Timestamp: 2022-03-02 04:29:44.507695

[32m[I 2022-03-02 04:30:59,462][0m Trial 24 pruned. [0m
epoch 0 -1.6951430383368558 4.063276388541666

Trial Id: 25 | Model params: 510022 | Timestamp: 2022-03-02 04:30:59.462654

[32m[I 2022-03-02 04:32:36,476][0m Trial 25 pruned. [0m
epoch 0 -1.362387304663308 3.804179535146243

Trial Id: 26 | Model params: 92252 | Timestamp: 2022-03-02 04:32:36.477167

epoch 0 -2.6102020330003324 4.7027425933131095
epoch 5 -2.7237731037656037 4.776140129233622
epoch 10 -2.7290150251065906 4.7795006114084755
epoch 15 -2.8680688283016202 4.867798040389069
epoch 20 -2.909218329059725 4.89362197896754
epoch 25 -2.784779445965936 4.815104791388566
epoch 30 -2.7679109566037345 4.804362521036067
epoch 35 -1.8487823571075586 4.177486839503118
epoch 40 -2.456073614402499 4.601261830285634
epoch 45 -1.5987851577090244 3.9899793107805253
epoch 50 -1.4779957509684074 3.8961505821118076
epoch 55 -1.4764493211990972 3.894934667283522
[32m[I 2022-03-02 05:03:08,068][0m Trial 26 finished with value: 3.8928926227436107 and parameters: {'n_layers_fe': 2, 'fe_neurons': 128, 'fe_dropout': 0.2908288383445058, 'n_units_l(Invariant)': 109, 'n_layers_mlp': 4, 'lr': 2.385165899852784e-05, 'weight_decay': 0.23834589353983532, 'criterion': 'PoissonNLLLoss', 'batch_size': 128, 'epochs': 60}. Best is trial 2 with value: 2.351205240502974.[0m

Trial Id: 27 | Model params: 49348 | Timestamp: 2022-03-02 05:03:08.068621

[32m[I 2022-03-02 05:03:34,578][0m Trial 27 pruned. [0m
epoch 0 -0.05553339070519159 2.542854102526285

Trial Id: 28 | Model params: 126442 | Timestamp: 2022-03-02 05:03:34.578227

epoch 0 -2.392443345549166 4.558707806311198
epoch 5 -2.2694359911270174 4.475297125796115
epoch 10 -2.149384113396095 4.3923634710285455
epoch 15 -2.158030626108567 4.3983888705561345
epoch 20 -1.6841857114886114 4.055008183166353
epoch 25 -1.48618684060963 3.9025846910524726
epoch 30 -1.4487046924290232 3.8730549759911272
epoch 35 -1.471780947235462 3.8912617496195345
epoch 40 -1.470255570267693 3.8900608832799537
epoch 45 -1.4801778029074666 3.897865623831699
epoch 50 -1.472213237414111 3.8916020064487586
epoch 55 -1.4716034210217264 3.891122009613484
[32m[I 2022-03-02 05:43:18,132][0m Trial 28 finished with value: 3.891677808783065 and parameters: {'n_layers_fe': 2, 'fe_neurons': 128, 'fe_dropout': 0.2880711995923132, 'n_units_l(Invariant)': 372, 'n_layers_mlp': 4, 'lr': 1.1988798397119448e-05, 'weight_decay': 0.2313834658464292, 'criterion': 'PoissonNLLLoss', 'batch_size': 256, 'epochs': 60}. Best is trial 2 with value: 2.351205240502974.[0m

Trial Id: 29 | Model params: 91078 | Timestamp: 2022-03-02 05:43:18.132760

epoch 0 -2.7268544345158956 4.778115789919075
epoch 5 -2.9122434691090384 4.895515072126669
epoch 10 -2.912383242026485 4.895602522501101
epoch 15 -3.056304896458607 4.984834577485775
[32m[I 2022-03-02 05:56:38,693][0m Trial 29 finished with value: 4.985101933744559 and parameters: {'n_layers_fe': 2, 'fe_neurons': 128, 'fe_dropout': 0.35220915082653215, 'n_units_l(Invariant)': 354, 'n_layers_mlp': 2, 'lr': 1.0082576456375521e-05, 'weight_decay': 0.2957419015905932, 'criterion': 'PoissonNLLLoss', 'batch_size': 256, 'epochs': 20}. Best is trial 2 with value: 2.351205240502974.[0m

Study statistics: 
  Number of finished trials:  30
  Number of pruned trials:  20
  Number of complete trials:  10

Best trial:
  Value:  2.351205240502974
  Params: 
    n_layers_fe: 2
    fe_neurons: 256
    fe_dropout: 0.16594140044939165
    n_units_l(Invariant): 8
    n_layers_mlp: 4
    lr: 8.447767555131369e-05
    weight_decay: 0.14931616144847004
    criterion: MSELoss
    batch_size: 128
    epochs: 60
Target: 72610, NaN: 0, Max: 64.0, Min: 0.0, Mean: 4.437694532433549
Prediction: 72610, NaN: 0, Max: 8.229500770568848, Min: 3.1857993602752686, Mean: 4.633551834224259

 XXXXXX======== TRIAL north - qso ended

Test Set - R-squared:  0.09757696525773607
Test Set - RMSE:  2.351205240502974
Test Set - MAE:  1.844785839311841



[32m[I 2022-03-02 05:58:12,957][0m A new study created in memory with name: DeepSet[0m
Starting Loading north
Finished Loading north
Finished north setup

++++++++ Session Characteristics +++++++

Area: north
Gal Type: glbg
Training Set: 290439
Validation Set: 72610
Test Samples: 72610
Number of features: 5
Device: cuda:0
Number of Workers: 8
Number of Trials: 30

+++++++++++++++++++++++++++++++++++++++

Trial Id: 0 | Model params: 35398 | Timestamp: 2022-03-02 05:58:12.957885

epoch 0 -6.141874337105323 30.196436662272344
epoch 5 -5.951549909387386 29.791366020717916
epoch 10 -5.885466221988385 29.64942468764564
epoch 15 -5.858169299902424 29.59059484637948
epoch 20 -5.87781652661999 29.632949979168657
epoch 25 -5.834387876386858 29.539246043122695
epoch 30 -5.852374677824112 29.578091323868097
epoch 35 -5.838799944349394 29.5487793134123
[32m[I 2022-03-02 06:18:20,288][0m Trial 0 finished with value: 29.52337998853955 and parameters: {'n_layers_fe': 4, 'fe_neurons': 64, 'fe_dropout': 0.19261988104572453, 'n_units_l(Invariant)': 98, 'n_layers_mlp': 4, 'lr': 0.0003139945062273958, 'weight_decay': 0.15080387121138386, 'criterion': 'PoissonNLLLoss', 'batch_size': 128, 'epochs': 40}. Best is trial 0 with value: 29.52337998853955.[0m

Trial Id: 1 | Model params: 42914 | Timestamp: 2022-03-02 06:18:20.288685

epoch 0 0.1346104111673938 10.511275710783895
epoch 5 0.18211042485723805 10.21873015881854
epoch 10 0.1772493476866519 10.249052373006078
epoch 15 0.15527790983262113 10.385000469165755
epoch 20 0.17517120797299723 10.261987963028949
epoch 25 0.1757677375590283 10.258276473628078
epoch 30 0.13587929689993616 10.50356675481847
epoch 35 0.18263359505229915 10.215461386106439
epoch 40 0.16417297063712055 10.330177893754083
epoch 45 0.18203909591859113 10.219175741760031
epoch 50 0.1737703457443558 10.27069857841323
epoch 55 0.17794930094614025 10.244691766283893
[32m[I 2022-03-02 06:51:59,172][0m Trial 1 finished with value: 10.201899264891937 and parameters: {'n_layers_fe': 2, 'fe_neurons': 64, 'fe_dropout': 0.15439866780624695, 'n_units_l(Invariant)': 464, 'n_layers_mlp': 2, 'lr': 0.007257123173358593, 'weight_decay': 0.22613067826668426, 'criterion': 'MSELoss', 'batch_size': 256, 'epochs': 60}. Best is trial 1 with value: 10.201899264891937.[0m

Trial Id: 2 | Model params: 29128 | Timestamp: 2022-03-02 06:51:59.172157

epoch 0 0.1599076305583108 10.356502509953257
epoch 5 0.17296345297787996 10.275712517325383
epoch 10 0.18737557987447673 10.185785572402978
epoch 15 0.1732230644466478 10.2740995884816
epoch 20 0.17654174396588962 10.253458755985902
epoch 25 0.1814188844023309 10.223049306781846
epoch 30 0.18430021485557468 10.205041348229868
epoch 35 0.15152214538075537 10.408061519741274
epoch 40 0.1794945759588097 10.235058350208156
epoch 45 0.17667927769726588 10.252602455548422
epoch 50 0.18458418065518545 10.203264876646918
epoch 55 0.183059732040038 10.212798104711204
[32m[I 2022-03-02 07:20:21,686][0m Trial 2 finished with value: 10.239511113782221 and parameters: {'n_layers_fe': 4, 'fe_neurons': 64, 'fe_dropout': 0.23445389112709286, 'n_units_l(Invariant)': 3, 'n_layers_mlp': 4, 'lr': 0.0016457970020898156, 'weight_decay': 0.20258067105188676, 'criterion': 'MSELoss', 'batch_size': 128, 'epochs': 60}. Best is trial 1 with value: 10.201899264891937.[0m

Trial Id: 3 | Model params: 370182 | Timestamp: 2022-03-02 07:20:21.686924

[32m[I 2022-03-02 07:21:20,832][0m Trial 3 pruned. [0m
++++++++++++++++++++
        NaN         
++++++++++++++++++++

Trial Id: 4 | Model params: 28266 | Timestamp: 2022-03-02 07:21:20.832777

epoch 0 -6.482772252740124 30.90870847065132
epoch 5 -6.3214980637517595 30.573810587038803
epoch 10 -6.266657387257247 30.45909089398875
[32m[I 2022-03-02 07:41:15,976][0m Trial 4 pruned. [0m
++++++++++++++++++++
        NaN         
++++++++++++++++++++

Trial Id: 5 | Model params: 378438 | Timestamp: 2022-03-02 07:41:15.976936

epoch 0 0.14805446906080244 10.429308383882203
epoch 5 0.18561727561786245 10.196799290538886
epoch 10 0.17409999683992616 10.268649459985944
epoch 15 0.18106240634849258 10.22527504591835
epoch 20 0.18553472394962622 10.197316087762234
epoch 25 0.16581173346971045 10.320046002257284
epoch 30 0.1634487022176072 10.33465262432123
epoch 35 0.18017214563297523 10.230831444903597
[32m[I 2022-03-02 08:47:17,785][0m Trial 5 finished with value: 10.241435839984003 and parameters: {'n_layers_fe': 4, 'fe_neurons': 256, 'fe_dropout': 0.4773886247130871, 'n_units_l(Invariant)': 290, 'n_layers_mlp': 2, 'lr': 0.000947762013855716, 'weight_decay': 0.1081327645088301, 'criterion': 'MSELoss', 'batch_size': 128, 'epochs': 40}. Best is trial 1 with value: 10.201899264891937.[0m

Trial Id: 6 | Model params: 93422 | Timestamp: 2022-03-02 08:47:17.785783

epoch 0 -0.017945346916343752 11.400183069911266
epoch 5 0.191368523661673 10.160730114846624
epoch 10 0.19759518004843402 10.121534485193822
epoch 15 0.2005262392219045 10.10303138213549
[32m[I 2022-03-02 08:57:15,297][0m Trial 6 finished with value: 10.090342969808974 and parameters: {'n_layers_fe': 2, 'fe_neurons': 128, 'fe_dropout': 0.031109378444895586, 'n_units_l(Invariant)': 118, 'n_layers_mlp': 4, 'lr': 0.00037480067529604305, 'weight_decay': 0.26073612182983913, 'criterion': 'MSELoss', 'batch_size': 256, 'epochs': 20}. Best is trial 6 with value: 10.090342969808974.[0m

Trial Id: 7 | Model params: 111496 | Timestamp: 2022-03-02 08:57:15.297984

epoch 0 0.10730348385570776 10.675826685154714
epoch 5 0.1736205226810471 10.271629746741144
epoch 10 0.15323707650242369 10.397537888078302
epoch 15 0.1495701260904263 10.420027103130016
[32m[I 2022-03-02 09:29:09,993][0m Trial 7 finished with value: 10.26635275828889 and parameters: {'n_layers_fe': 4, 'fe_neurons': 128, 'fe_dropout': 0.411026070814367, 'n_units_l(Invariant)': 3, 'n_layers_mlp': 4, 'lr': 0.0008851603668190429, 'weight_decay': 0.1561250058975673, 'criterion': 'MSELoss', 'batch_size': 32, 'epochs': 20}. Best is trial 6 with value: 10.090342969808974.[0m

Trial Id: 8 | Model params: 533758 | Timestamp: 2022-03-02 09:29:09.994056

epoch 0 0.040434565021739144 11.068452166657886
epoch 5 0.18428142141879733 10.205158907838324
epoch 10 0.17251247032933614 10.278513806145801
epoch 15 0.19279857775920206 10.15174158048379
[32m[I 2022-03-02 10:03:54,056][0m Trial 8 finished with value: 10.172685648811688 and parameters: {'n_layers_fe': 4, 'fe_neurons': 256, 'fe_dropout': 0.4920952799164523, 'n_units_l(Invariant)': 382, 'n_layers_mlp': 4, 'lr': 0.00021209682768922526, 'weight_decay': 0.14372216542755825, 'criterion': 'MSELoss', 'batch_size': 128, 'epochs': 20}. Best is trial 6 with value: 10.090342969808974.[0m

Trial Id: 9 | Model params: 228278 | Timestamp: 2022-03-02 10:03:54.056649

[32m[I 2022-03-02 10:05:12,290][0m Trial 9 pruned. [0m
++++++++++++++++++++
        NaN         
++++++++++++++++++++

Trial Id: 10 | Model params: 63388 | Timestamp: 2022-03-02 10:05:12.290217

epoch 0 -0.18400550035435903 12.294941161133977
epoch 5 0.01943366075941544 11.18891784732995
epoch 10 0.1471674410104835 10.434736361369152
epoch 15 0.16824105437269044 10.305008040315577
[32m[I 2022-03-02 10:15:29,122][0m Trial 10 finished with value: 10.16517450937366 and parameters: {'n_layers_fe': 2, 'fe_neurons': 128, 'fe_dropout': 0.014509939558653151, 'n_units_l(Invariant)': 141, 'n_layers_mlp': 2, 'lr': 3.7114397638216724e-05, 'weight_decay': 0.2914293794551131, 'criterion': 'MSELoss', 'batch_size': 256, 'epochs': 20}. Best is trial 6 with value: 10.090342969808974.[0m

Trial Id: 11 | Model params: 62088 | Timestamp: 2022-03-02 10:15:29.122570

epoch 0 -0.3440486255474724 13.099571367558093
epoch 5 -0.03954370122616102 11.520490506843302
epoch 10 0.059275297644488356 10.959250878173119
epoch 15 0.1365693884613426 10.499371813942785
[32m[I 2022-03-02 10:25:42,865][0m Trial 11 finished with value: 10.345827911606047 and parameters: {'n_layers_fe': 2, 'fe_neurons': 128, 'fe_dropout': 0.0017235514638413371, 'n_units_l(Invariant)': 131, 'n_layers_mlp': 2, 'lr': 2.9685341951499016e-05, 'weight_decay': 0.2909809829187022, 'criterion': 'MSELoss', 'batch_size': 256, 'epochs': 20}. Best is trial 6 with value: 10.090342969808974.[0m

Trial Id: 12 | Model params: 69108 | Timestamp: 2022-03-02 10:25:42.865723

epoch 0 -0.09433734616183198 11.820210344159207
epoch 5 0.13772724500290645 10.492329647234968
epoch 10 0.1895731335845614 10.17200370480902
epoch 15 0.1906852246252655 10.165022150982583
[32m[I 2022-03-02 10:36:47,497][0m Trial 12 finished with value: 10.130734456683534 and parameters: {'n_layers_fe': 2, 'fe_neurons': 128, 'fe_dropout': 0.0025332518638839646, 'n_units_l(Invariant)': 185, 'n_layers_mlp': 2, 'lr': 7.094885916596661e-05, 'weight_decay': 0.2943300061085665, 'criterion': 'MSELoss', 'batch_size': 256, 'epochs': 20}. Best is trial 6 with value: 10.090342969808974.[0m

Trial Id: 13 | Model params: 70928 | Timestamp: 2022-03-02 10:36:47.497588

epoch 0 -0.1292973488225444 12.007531898619545
epoch 5 0.09319932630183303 10.759832528524406
epoch 10 0.17936891538294797 10.235842070857085
epoch 15 0.1722545781003041 10.280115366436847
[32m[I 2022-03-02 10:48:05,327][0m Trial 13 finished with value: 10.17069566406142 and parameters: {'n_layers_fe': 2, 'fe_neurons': 128, 'fe_dropout': 0.07069395450449299, 'n_units_l(Invariant)': 199, 'n_layers_mlp': 2, 'lr': 6.764717084519504e-05, 'weight_decay': 0.26940649246477316, 'criterion': 'MSELoss', 'batch_size': 256, 'epochs': 20}. Best is trial 6 with value: 10.090342969808974.[0m

Trial Id: 14 | Model params: 85232 | Timestamp: 2022-03-02 10:48:05.327821

epoch 0 -0.0692676391063134 11.684033847158934
epoch 5 0.179106602930994 10.237477869423408
epoch 10 0.18681164199190348 10.18931927996999
epoch 15 0.19881883472851425 10.11381395051434
[32m[I 2022-03-02 10:57:01,950][0m Trial 14 finished with value: 10.114390348977409 and parameters: {'n_layers_fe': 2, 'fe_neurons': 128, 'fe_dropout': 0.05368383535445586, 'n_units_l(Invariant)': 55, 'n_layers_mlp': 4, 'lr': 8.520642684583907e-05, 'weight_decay': 0.25198956522382565, 'criterion': 'MSELoss', 'batch_size': 256, 'epochs': 20}. Best is trial 6 with value: 10.090342969808974.[0m

Trial Id: 15 | Model params: 82632 | Timestamp: 2022-03-02 10:57:01.950514

[32m[I 2022-03-02 10:57:27,787][0m Trial 15 pruned. [0m
epoch 0 0.16116418454282322 10.348754329638133

Trial Id: 16 | Model params: 83282 | Timestamp: 2022-03-02 10:57:27.787828

[32m[I 2022-03-02 10:57:53,151][0m Trial 16 pruned. [0m
epoch 0 0.03130382662108411 11.120988376400506

Trial Id: 17 | Model params: 84842 | Timestamp: 2022-03-02 10:57:53.151987

epoch 0 -0.7653626545532839 15.012968116381739
epoch 5 -0.11485197053168972 11.930487709147886
epoch 10 -0.010749259380580467 11.35981635752401
epoch 15 0.1064650802946272 10.680838775134077
[32m[I 2022-03-02 11:06:34,123][0m Trial 17 finished with value: 10.412930391621902 and parameters: {'n_layers_fe': 2, 'fe_neurons': 128, 'fe_dropout': 0.08410495857283166, 'n_units_l(Invariant)': 52, 'n_layers_mlp': 4, 'lr': 1.0248234986787255e-05, 'weight_decay': 0.19128897602214195, 'criterion': 'MSELoss', 'batch_size': 256, 'epochs': 20}. Best is trial 6 with value: 10.090342969808974.[0m

Trial Id: 18 | Model params: 87572 | Timestamp: 2022-03-02 11:06:34.123912

[32m[I 2022-03-02 11:07:02,026][0m Trial 18 pruned. [0m
epoch 0 0.14162240456627362 10.468604232411291

Trial Id: 19 | Model params: 119552 | Timestamp: 2022-03-02 11:07:02.026197

epoch 0 -0.0928921669901186 11.81240289552399
epoch 5 0.1623387652681354 10.34150636448587
epoch 10 0.19473915529400598 10.139531433422153
epoch 15 0.1977671793547382 10.12044962742048
[32m[I 2022-03-02 11:20:18,715][0m Trial 19 finished with value: 10.114203464981776 and parameters: {'n_layers_fe': 2, 'fe_neurons': 128, 'fe_dropout': 0.030952470431793815, 'n_units_l(Invariant)': 319, 'n_layers_mlp': 4, 'lr': 8.63542707502975e-05, 'weight_decay': 0.2622023335593322, 'criterion': 'MSELoss', 'batch_size': 256, 'epochs': 20}. Best is trial 6 with value: 10.090342969808974.[0m

Trial Id: 20 | Model params: 122282 | Timestamp: 2022-03-02 11:20:18.716154

epoch 0 -1.2236226508745487 16.84923313294862
epoch 5 -0.4815890530531075 13.753507702232918
epoch 10 -0.7960997095736111 15.143100898725885
epoch 15 -0.8471073348638665 15.356620828303999
epoch 20 -0.5406855796211085 14.02512057500752
epoch 25 -0.12337437752355918 11.976001776972831
epoch 30 -0.03765392385566391 11.510014244211888
epoch 35 -0.016564790335370283 11.392449875945504
epoch 40 0.03699335603953757 11.088281335157221
epoch 45 0.0378339822277689 11.083440696331225
epoch 50 0.03485740102145751 11.10057146420091
epoch 55 0.043563759070770036 11.05039002287816
[32m[I 2022-03-02 12:02:06,501][0m Trial 20 finished with value: 11.089197776408904 and parameters: {'n_layers_fe': 2, 'fe_neurons': 128, 'fe_dropout': 0.28463737556408786, 'n_units_l(Invariant)': 340, 'n_layers_mlp': 4, 'lr': 1.0640485725612873e-05, 'weight_decay': 0.1859250734823617, 'criterion': 'MSELoss', 'batch_size': 256, 'epochs': 60}. Best is trial 6 with value: 10.090342969808974.[0m

Trial Id: 21 | Model params: 128132 | Timestamp: 2022-03-02 12:02:06.502194

[32m[I 2022-03-02 12:02:56,854][0m Trial 21 pruned. [0m
epoch 0 -0.06361479995472585 11.653108246254245

Trial Id: 22 | Model params: 117212 | Timestamp: 2022-03-02 12:02:56.854275

[32m[I 2022-03-02 12:03:40,282][0m Trial 22 pruned. [0m
epoch 0 -0.016038386108952363 11.389499837552547

Trial Id: 23 | Model params: 143472 | Timestamp: 2022-03-02 12:03:40.282212

epoch 0 -0.13476341551262316 12.036556469007163
epoch 5 0.1459312710578904 10.442296131765296
epoch 10 0.18124519932220928 10.224133803436274
epoch 15 0.16266414560483378 10.339497646931774
[32m[I 2022-03-02 12:22:58,150][0m Trial 23 finished with value: 10.317693611978113 and parameters: {'n_layers_fe': 2, 'fe_neurons': 128, 'fe_dropout': 0.11475246327591637, 'n_units_l(Invariant)': 503, 'n_layers_mlp': 4, 'lr': 4.735678271654606e-05, 'weight_decay': 0.2782405479575283, 'criterion': 'MSELoss', 'batch_size': 256, 'epochs': 20}. Best is trial 6 with value: 10.090342969808974.[0m

Trial Id: 24 | Model params: 99922 | Timestamp: 2022-03-02 12:22:58.150409

epoch 0 -0.646276473522605 14.497762491379062
epoch 5 -0.10112666979041385 11.856820237634679
epoch 10 0.11078544982063265 10.654985792655589
epoch 15 0.15694093926921082 10.374772803567389
[32m[I 2022-03-02 12:33:29,319][0m Trial 24 finished with value: 10.275825463136256 and parameters: {'n_layers_fe': 2, 'fe_neurons': 128, 'fe_dropout': 0.19289721718584618, 'n_units_l(Invariant)': 168, 'n_layers_mlp': 4, 'lr': 1.727052358466293e-05, 'weight_decay': 0.23475176654126098, 'criterion': 'MSELoss', 'batch_size': 256, 'epochs': 20}. Best is trial 6 with value: 10.090342969808974.[0m

Trial Id: 25 | Model params: 108502 | Timestamp: 2022-03-02 12:33:29.319425

[32m[I 2022-03-02 12:34:03,159][0m Trial 25 pruned. [0m
epoch 0 0.019513746534364662 11.188460921868728

Trial Id: 26 | Model params: 127482 | Timestamp: 2022-03-02 12:34:03.159160

[32m[I 2022-03-02 12:35:28,981][0m Trial 26 pruned. [0m
epoch 0 0.12141982447458322 10.591081121968681

Trial Id: 27 | Model params: 133202 | Timestamp: 2022-03-02 12:35:28.981720

[32m[I 2022-03-02 12:36:10,933][0m Trial 27 pruned. [0m
++++++++++++++++++++
        NaN         
++++++++++++++++++++

Trial Id: 28 | Model params: 113442 | Timestamp: 2022-03-02 12:36:10.933708

[32m[I 2022-03-02 12:36:45,936][0m Trial 28 pruned. [0m
epoch 0 0.11745322756565213 10.61496240249475

Trial Id: 29 | Model params: 34210 | Timestamp: 2022-03-02 12:36:45.936990

epoch 0 -5.847024939286093 29.566543068074782
epoch 5 -5.841151723571747 29.553859607648786
epoch 10 -5.856621723577069 29.587256033518905
epoch 15 -5.835601163849516 29.541867931655144
