[32m[I 2022-03-02 12:45:01,230][0m Trial 29 finished with value: 29.537713094374542 and parameters: {'n_layers_fe': 4, 'fe_neurons': 64, 'fe_dropout': 0.21957010449781797, 'n_units_l(Invariant)': 80, 'n_layers_mlp': 4, 'lr': 0.0013775029006765996, 'weight_decay': 0.2780821415155825, 'criterion': 'PoissonNLLLoss', 'batch_size': 256, 'epochs': 20}. Best is trial 6 with value: 10.090342969808974.[0m

Study statistics: 
  Number of finished trials:  30
  Number of pruned trials:  12
  Number of complete trials:  18

Best trial:
  Value:  10.090342969808974
  Params: 
    n_layers_fe: 2
    fe_neurons: 128
    fe_dropout: 0.031109378444895586
    n_units_l(Invariant): 118
    n_layers_mlp: 4
    lr: 0.00037480067529604305
    weight_decay: 0.26073612182983913
    criterion: MSELoss
    batch_size: 256
    epochs: 20
Target: 72610, NaN: 0, Max: 135.0, Min: 0.0, Mean: 30.72970665197631
Prediction: 72610, NaN: 0, Max: 54.531864166259766, Min: 20.48212432861328, Mean: 30.995451870419043

 XXXXXX======== TRIAL north - glbg ended

Test Set - R-squared:  0.20253309882116566
Test Set - RMSE:  10.090342969808974
Test Set - MAE:  7.853567586735152



[32m[I 2022-03-02 12:46:46,917][0m A new study created in memory with name: DeepSet[0m
Starting Loading north
Finished Loading north
Finished north setup

++++++++ Session Characteristics +++++++

Area: north
Gal Type: rlbg
Training Set: 290439
Validation Set: 72610
Test Samples: 72610
Number of features: 5
Device: cuda:0
Number of Workers: 8
Number of Trials: 30

+++++++++++++++++++++++++++++++++++++++

Trial Id: 0 | Model params: 234986 | Timestamp: 2022-03-02 12:46:46.917769

epoch 0 0.23766527853055086 8.544111958900135
epoch 5 0.24981692938329758 8.475741637242802
epoch 10 0.2664421737549799 8.38129752202088
epoch 15 0.2617292943880051 8.40817802270099
epoch 20 0.2712286181565522 8.35390890486992
epoch 25 0.2740857829256086 8.337516977979552
epoch 30 0.26665659083341264 8.38007251657176
epoch 35 0.2733895139634047 8.341514532238842
epoch 40 0.27268438657585414 8.345560994665096
epoch 45 0.27958843427234026 8.305856402800394
epoch 50 0.27474539416731203 8.333728121343746
epoch 55 0.2523519304508687 8.461409005027301
epoch 60 0.2795246283358691 8.306224214227342
epoch 65 0.2742765144844458 8.336421578521103
epoch 70 0.2795758285571367 8.305929070152853
[32m[I 2022-03-02 14:26:05,142][0m Trial 0 finished with value: 8.381911230463247 and parameters: {'n_layers_fe': 2, 'fe_neurons': 256, 'fe_dropout': 0.019415540170720447, 'n_units_l(Invariant)': 244, 'n_layers_mlp': 2, 'initialiser': 'uniform', 'lr': 0.00024451333428527955, 'weight_decay': 0.05303876177261872, 'criterion': 'MSELoss', 'batch_size': 32, 'epochs': 75}. Best is trial 0 with value: 8.381911230463247.[0m

Trial Id: 1 | Model params: 114876 | Timestamp: 2022-03-02 14:26:05.142612

epoch 0 -5.39838733297644 24.7530856010577
epoch 5 -5.153808803614433 24.27538238308964
epoch 10 -5.120503008092908 24.20960134578357
epoch 15 -5.094636282099961 24.158389364675916
epoch 20 -5.0850675918183175 24.139417358873704
[32m[I 2022-03-02 14:44:20,162][0m Trial 1 finished with value: 24.16347196172442 and parameters: {'n_layers_fe': 4, 'fe_neurons': 128, 'fe_dropout': 0.41265150749136115, 'n_units_l(Invariant)': 29, 'n_layers_mlp': 4, 'initialiser': 'kaiming_he', 'lr': 0.00035027398917705614, 'weight_decay': 0.10139163167076562, 'criterion': 'PoissonNLLLoss', 'batch_size': 256, 'epochs': 25}. Best is trial 0 with value: 8.381911230463247.[0m

Trial Id: 2 | Model params: 42390 | Timestamp: 2022-03-02 14:44:20.162303

epoch 0 -6.935499629792919 27.56647390999859
[32m[I 2022-03-02 14:48:57,545][0m Trial 2 pruned. [0m
++++++++++++++++++++
        NaN         
++++++++++++++++++++

Trial Id: 3 | Model params: 41928 | Timestamp: 2022-03-02 14:48:57.546140

[32m[I 2022-03-02 14:49:34,235][0m Trial 3 pruned. [0m
++++++++++++++++++++
        NaN         
++++++++++++++++++++

Trial Id: 4 | Model params: 49518 | Timestamp: 2022-03-02 14:49:34.235860

epoch 0 -5.182530233332335 24.331966205646005
epoch 5 -6.9716350743974065 27.629166582804213
epoch 10 -7.125143921435125 27.893923880023955
[32m[I 2022-03-02 14:56:22,936][0m Trial 4 pruned. [0m
++++++++++++++++++++
        NaN         
++++++++++++++++++++

Trial Id: 5 | Model params: 563170 | Timestamp: 2022-03-02 14:56:22.936327

epoch 0 0.17591959488876485 8.883392966880333
epoch 5 0.17551591173372771 8.88556850522449
epoch 10 0.16686195836935924 8.932079148317268
epoch 15 0.15038195006373622 9.019987700986226
epoch 20 0.16452342107050355 8.944606101890152
epoch 25 0.19337863298854618 8.788787039650657
epoch 30 0.13397079672371193 9.106685715862666
epoch 35 0.17315465303329802 8.898283198953258
epoch 40 0.16266985727587213 8.954522724923468
epoch 45 0.16973133734004264 8.916684565254839
epoch 50 0.1671021399483088 8.930791561264204
epoch 55 0.18615467744312308 8.828054713211676
epoch 60 0.16921268360722574 8.919469175785437
epoch 65 0.17534779723582006 8.88647435457308
epoch 70 0.17418302927740326 8.892747925551731
[32m[I 2022-03-02 17:24:13,201][0m Trial 5 finished with value: 8.812195038969708 and parameters: {'n_layers_fe': 4, 'fe_neurons': 256, 'fe_dropout': 0.4709968510440481, 'n_units_l(Invariant)': 496, 'n_layers_mlp': 4, 'initialiser': 'xavier', 'lr': 0.0017556771987190696, 'weight_decay': 0.29473985150349646, 'criterion': 'MSELoss', 'batch_size': 32, 'epochs': 75}. Best is trial 0 with value: 8.381911230463247.[0m

Trial Id: 6 | Model params: 67288 | Timestamp: 2022-03-02 17:24:13.201557

epoch 0 0.2337597744205543 8.565970097088746
epoch 5 0.22646412153147122 8.60665335055241
epoch 10 0.24162958360393016 8.52186738900626
epoch 15 0.24243705744540012 8.517329357519861
epoch 20 0.23777271845728487 8.543509853890868
epoch 25 0.2191352365722663 8.647329207416888
epoch 30 0.2391519553520246 8.535776688446179
epoch 35 0.23968475807932388 8.532787470295148
epoch 40 0.24368854927153072 8.510291147607605
epoch 45 0.241396713770185 8.523175676803678
[32m[I 2022-03-02 17:50:47,993][0m Trial 6 finished with value: 8.515891120332885 and parameters: {'n_layers_fe': 2, 'fe_neurons': 128, 'fe_dropout': 0.31521984982307644, 'n_units_l(Invariant)': 171, 'n_layers_mlp': 2, 'initialiser': 'xavier', 'lr': 0.004070210405899778, 'weight_decay': 0.021525347672087213, 'criterion': 'MSELoss', 'batch_size': 256, 'epochs': 50}. Best is trial 0 with value: 8.381911230463247.[0m

Trial Id: 7 | Model params: 131516 | Timestamp: 2022-03-02 17:50:47.993841

epoch 0 0.1759574334544196 8.88318901911958
epoch 5 0.1504771150764359 9.019482526171299
epoch 10 0.18324269589514053 8.843834233837857
epoch 15 0.19925008189936966 8.756741544221263
epoch 20 0.14695862896066736 9.038141312873536
[32m[I 2022-03-02 18:11:26,327][0m Trial 7 finished with value: 8.863546348491024 and parameters: {'n_layers_fe': 4, 'fe_neurons': 128, 'fe_dropout': 0.4576877470267814, 'n_units_l(Invariant)': 157, 'n_layers_mlp': 4, 'initialiser': 'xavier', 'lr': 0.004580046827900813, 'weight_decay': 0.2932376213863695, 'criterion': 'MSELoss', 'batch_size': 256, 'epochs': 25}. Best is trial 0 with value: 8.381911230463247.[0m

Trial Id: 8 | Model params: 18824 | Timestamp: 2022-03-02 18:11:26.328092

epoch 0 -6.156265386213242 26.17805037500329
epoch 5 -6.144077888012544 26.155749574375463
epoch 10 -6.172275928672404 26.207317779285354
epoch 15 -6.1300576255061765 26.130071622997665
epoch 20 -6.223547745912508 26.30082393927325
epoch 25 -6.218524084926303 26.291676813248525
epoch 30 -6.210934800841487 26.27785213970467
epoch 35 -6.059737392587069 26.000898352561485
epoch 40 -6.441506362354782 26.694667076740405
epoch 45 -6.1705324273821445 26.204132230514656
epoch 50 -5.669600053097057 25.27225390491693
epoch 55 -5.495130834294778 24.939516640805927
epoch 60 -5.238346031198807 24.441553750702436
epoch 65 -5.083520393691287 24.1363483021104
epoch 70 -5.0445106960447275 24.058838419801678
[32m[I 2022-03-02 18:35:54,799][0m Trial 8 finished with value: 24.036778964511093 and parameters: {'n_layers_fe': 2, 'fe_neurons': 64, 'fe_dropout': 0.2244370357758837, 'n_units_l(Invariant)': 99, 'n_layers_mlp': 2, 'initialiser': 'kaiming_he', 'lr': 7.426999541012484e-05, 'weight_decay': 0.05507204702736521, 'criterion': 'PoissonNLLLoss', 'batch_size': 256, 'epochs': 75}. Best is trial 0 with value: 8.381911230463247.[0m

Trial Id: 9 | Model params: 144642 | Timestamp: 2022-03-02 18:35:54.799964

[32m[I 2022-03-02 18:37:23,386][0m Trial 9 pruned. [0m
epoch 0 0.20416678402275978 8.729816419348932

Trial Id: 10 | Model params: 238082 | Timestamp: 2022-03-02 18:37:23.386921

[32m[I 2022-03-02 18:38:40,140][0m Trial 10 pruned. [0m
epoch 0 0.21051572238700966 8.694924654410208

Trial Id: 11 | Model params: 222860 | Timestamp: 2022-03-02 18:38:40.140414

epoch 0 -0.09125480874808112 10.22250108811901
epoch 5 0.19984653190569912 8.753479644723933
epoch 10 0.24850920958636125 8.483125880775004
epoch 15 0.2611683276136195 8.411371846337524
epoch 20 0.26639500667890736 8.381566972450807
epoch 25 0.2695791499115012 8.363357491653215
epoch 30 0.27063513867487765 8.357309741327247
epoch 35 0.2687206299745498 8.368271097659001
epoch 40 0.27394309881468315 8.338336339770013
epoch 45 0.27878356060575504 8.310494931123266
[32m[I 2022-03-02 19:20:01,953][0m Trial 11 finished with value: 8.328703448860335 and parameters: {'n_layers_fe': 2, 'fe_neurons': 256, 'fe_dropout': 0.37320416203069967, 'n_units_l(Invariant)': 197, 'n_layers_mlp': 2, 'initialiser': 'uniform', 'lr': 0.0003881372563740905, 'weight_decay': 0.00437306288214083, 'criterion': 'MSELoss', 'batch_size': 256, 'epochs': 50}. Best is trial 11 with value: 8.328703448860335.[0m

Trial Id: 12 | Model params: 236276 | Timestamp: 2022-03-02 19:20:01.953976

epoch 0 0.11807551062321409 9.189878749177709
epoch 5 0.24055540988857416 8.527900540206232
epoch 10 0.2467979278144441 8.492779201743492
epoch 15 0.2538863149927958 8.452721947723564
epoch 20 0.2536283589023518 8.454183013725906
epoch 25 0.2541672921592707 8.451130202690157
epoch 30 0.2501512368884553 8.473852885083966
epoch 35 0.2580496190201339 8.429105921671656
epoch 40 0.2530935229379784 8.457211526026342
epoch 45 0.251849544647197 8.464251370355452
[32m[I 2022-03-02 20:25:46,941][0m Trial 12 finished with value: 8.434441655361423 and parameters: {'n_layers_fe': 2, 'fe_neurons': 256, 'fe_dropout': 0.37853892843024256, 'n_units_l(Invariant)': 249, 'n_layers_mlp': 2, 'initialiser': 'uniform', 'lr': 0.00036011318715529973, 'weight_decay': 0.07581909282909356, 'criterion': 'MSELoss', 'batch_size': 32, 'epochs': 50}. Best is trial 11 with value: 8.328703448860335.[0m

Trial Id: 13 | Model params: 219248 | Timestamp: 2022-03-02 20:25:46.941284

epoch 0 -0.1298132205595015 10.401534320251272
epoch 5 0.1336088629221489 9.108588465255886
epoch 10 0.16980490918181324 8.916289493473343
epoch 15 0.2508585628212815 8.469855285615942
epoch 20 0.24316688380113838 8.513225626355903
epoch 25 0.23608393499243308 8.552969076652886
epoch 30 0.2584089808567699 8.427064366106837
epoch 35 0.2665062044226958 8.380931721419385
epoch 40 0.2654221565971244 8.387122623432202
epoch 45 0.2703214981335962 8.359106447996405
[32m[I 2022-03-02 21:08:04,331][0m Trial 13 finished with value: 8.372777315690023 and parameters: {'n_layers_fe': 2, 'fe_neurons': 256, 'fe_dropout': 0.15175853615908994, 'n_units_l(Invariant)': 183, 'n_layers_mlp': 2, 'initialiser': 'uniform', 'lr': 0.00010191846528641389, 'weight_decay': 0.11721347420030614, 'criterion': 'MSELoss', 'batch_size': 256, 'epochs': 50}. Best is trial 11 with value: 8.328703448860335.[0m

Trial Id: 14 | Model params: 193706 | Timestamp: 2022-03-02 21:08:04.331839

epoch 0 -0.14529264752925242 10.472546962091066
epoch 5 0.0915942793183484 9.326828915812756
epoch 10 0.19186603001591984 8.797023691610871
epoch 15 0.15339878327336953 9.003959323634776
epoch 20 0.12934581354568686 9.13097022332635
epoch 25 0.1522152958564802 9.010250568465779
epoch 30 0.1512544456540187 9.015355077547389
epoch 35 0.17838217156731628 8.870110037469784
epoch 40 0.1744572037769856 8.891271589267465
epoch 45 0.17498622705781286 8.88842228606777
[32m[I 2022-03-02 21:44:50,484][0m Trial 14 finished with value: 8.71424010119972 and parameters: {'n_layers_fe': 2, 'fe_neurons': 256, 'fe_dropout': 0.19131550111582385, 'n_units_l(Invariant)': 84, 'n_layers_mlp': 2, 'initialiser': 'uniform', 'lr': 3.904345827585173e-05, 'weight_decay': 0.22119675409327383, 'criterion': 'MSELoss', 'batch_size': 256, 'epochs': 50}. Best is trial 11 with value: 8.328703448860335.[0m

Trial Id: 15 | Model params: 216152 | Timestamp: 2022-03-02 21:44:50.484484

epoch 0 -0.1998347463864325 10.719012997566516
epoch 5 -0.03354887053472444 9.948545454714852
epoch 10 0.025278285381598264 9.661274037653358
epoch 15 0.17077028146737372 8.911103939749138
epoch 20 0.09240436315350342 9.322669321508286
epoch 25 0.07813002071725528 9.395695129798344
epoch 30 0.08851229691088547 9.342637261185391
epoch 35 0.0951206912578314 9.308708035456336
epoch 40 0.12058688168383724 9.17678485658678
epoch 45 0.18578800506767368 8.830043198727463
[32m[I 2022-03-02 22:27:04,276][0m Trial 15 finished with value: 9.19664794093295 and parameters: {'n_layers_fe': 2, 'fe_neurons': 256, 'fe_dropout': 0.15512311309212024, 'n_units_l(Invariant)': 171, 'n_layers_mlp': 2, 'initialiser': 'uniform', 'lr': 2.5997292214116767e-05, 'weight_decay': 0.11990117779894165, 'criterion': 'MSELoss', 'batch_size': 256, 'epochs': 50}. Best is trial 11 with value: 8.328703448860335.[0m

Trial Id: 16 | Model params: 258722 | Timestamp: 2022-03-02 22:27:04.276338

epoch 0 -0.09901812862936832 10.258798706231346
epoch 5 0.23951800285991465 8.533723140632038
epoch 10 0.19590405779738895 8.775017989065761
epoch 15 0.2364949341802277 8.550667949311064
epoch 20 0.19072466435090485 8.803233725132323
epoch 25 0.24765993368798012 8.487918008702971
epoch 30 0.2509874961186508 8.469126388970022
epoch 35 0.24919037901195729 8.479280353935703
epoch 40 0.20316741682362738 8.735295931164782
epoch 45 0.25486110019285324 8.44719847227914
[32m[I 2022-03-02 23:17:44,108][0m Trial 16 finished with value: 8.469114503340242 and parameters: {'n_layers_fe': 2, 'fe_neurons': 256, 'fe_dropout': 0.3531085608108665, 'n_units_l(Invariant)': 336, 'n_layers_mlp': 2, 'initialiser': 'uniform', 'lr': 0.0005550341957837297, 'weight_decay': 0.22022554092115465, 'criterion': 'MSELoss', 'batch_size': 256, 'epochs': 50}. Best is trial 11 with value: 8.328703448860335.[0m

Trial Id: 17 | Model params: 197834 | Timestamp: 2022-03-02 23:17:44.108727

[32m[I 2022-03-02 23:18:29,362][0m Trial 17 pruned. [0m
epoch 0 0.12555002047469477 9.150852732442763

Trial Id: 18 | Model params: 173066 | Timestamp: 2022-03-02 23:18:29.362514

[32m[I 2022-03-02 23:19:07,998][0m Trial 18 pruned. [0m
epoch 0 0.121201449862261 9.173577748629725

Trial Id: 19 | Model params: 353154 | Timestamp: 2022-03-02 23:19:07.998827

epoch 0 -0.8846743542902606 13.434213337229366
epoch 5 -1.300554933907895 14.842613691877617
epoch 10 -0.7750331189539257 13.037589732607398
epoch 15 -0.2554359640755328 10.964563902392378
epoch 20 -0.22520430642502887 10.831742759855096
epoch 25 -0.21152993748540783 10.771127216591566
epoch 30 -0.19092340827559884 10.67913301722548
epoch 35 -0.20156616152966156 10.726744216769058
epoch 40 -0.16827324816494493 10.577092349757498
epoch 45 -0.17459605308559678 10.605675838117124
[32m[I 2022-03-03 00:00:39,976][0m Trial 19 finished with value: 10.408490849353328 and parameters: {'n_layers_fe': 2, 'fe_neurons': 256, 'fe_dropout': 0.42673497811263095, 'n_units_l(Invariant)': 192, 'n_layers_mlp': 4, 'initialiser': 'kaiming_he', 'lr': 2.1241133150557686e-05, 'weight_decay': 0.03417457017333318, 'criterion': 'MSELoss', 'batch_size': 256, 'epochs': 50}. Best is trial 11 with value: 8.328703448860335.[0m

Trial Id: 20 | Model params: 274718 | Timestamp: 2022-03-03 00:00:39.976448

[32m[I 2022-03-03 00:01:45,065][0m Trial 20 pruned. [0m
epoch 0 -0.0793966696889592 10.166807885535462

Trial Id: 21 | Model params: 225440 | Timestamp: 2022-03-03 00:01:45.065741

[32m[I 2022-03-03 00:03:02,217][0m Trial 21 pruned. [0m
epoch 0 0.18430189256683827 8.83809789167032

Trial Id: 22 | Model params: 244532 | Timestamp: 2022-03-03 00:03:02.217776

[32m[I 2022-03-03 00:04:19,923][0m Trial 22 pruned. [0m
epoch 0 0.22084938809669596 8.637832699867879

Trial Id: 23 | Model params: 230342 | Timestamp: 2022-03-03 00:04:19.923408

[32m[I 2022-03-03 00:05:12,958][0m Trial 23 pruned. [0m
epoch 0 0.1554812636733789 8.99287847862269

Trial Id: 24 | Model params: 205574 | Timestamp: 2022-03-03 00:05:12.958934

[32m[I 2022-03-03 00:06:29,161][0m Trial 24 pruned. [0m
epoch 0 0.2376537359346973 8.544176642335893

Trial Id: 25 | Model params: 247886 | Timestamp: 2022-03-03 00:06:29.161819

epoch 0 -0.16704132796195048 10.571514215280137
epoch 5 0.014839892591275716 9.712868051391395
epoch 10 0.07906525838459089 9.39092795113871
epoch 15 0.1760054889961019 8.882929995677493
epoch 20 0.24639857497791462 8.495030367894143
epoch 25 0.22046784750419557 8.639947361905332
epoch 30 0.24360192642860967 8.510778489499438
epoch 35 0.256451272761018 8.438180235949314
epoch 40 0.24890621218599174 8.480884823411298
epoch 45 0.21753568969939108 8.65618140110807
[32m[I 2022-03-03 00:55:51,456][0m Trial 25 finished with value: 8.504776707710256 and parameters: {'n_layers_fe': 2, 'fe_neurons': 256, 'fe_dropout': 0.3112272814054811, 'n_units_l(Invariant)': 294, 'n_layers_mlp': 2, 'initialiser': 'uniform', 'lr': 8.719338560223228e-05, 'weight_decay': 0.16988975975808934, 'criterion': 'MSELoss', 'batch_size': 128, 'epochs': 50}. Best is trial 11 with value: 8.328703448860335.[0m

Trial Id: 26 | Model params: 228020 | Timestamp: 2022-03-03 00:55:51.456820

[32m[I 2022-03-03 00:56:42,545][0m Trial 26 pruned. [0m
epoch 0 0.00037168057490544193 9.783930427013013

Trial Id: 27 | Model params: 189320 | Timestamp: 2022-03-03 00:56:42.545561

[32m[I 2022-03-03 00:57:25,059][0m Trial 27 pruned. [0m
epoch 0 0.14246154120922805 9.061933761827312

Trial Id: 28 | Model params: 206864 | Timestamp: 2022-03-03 00:57:25.059255

[32m[I 2022-03-03 00:58:41,687][0m Trial 28 pruned. [0m
epoch 0 0.22399058339533573 8.620403128779623

Trial Id: 29 | Model params: 83672 | Timestamp: 2022-03-03 00:58:41.687872

epoch 0 -6.587031170589492 26.95442143812623
epoch 5 -6.698026105913813 27.150871229671175
[32m[I 2022-03-03 01:02:09,648][0m Trial 29 pruned. [0m
++++++++++++++++++++
        NaN         
++++++++++++++++++++

Study statistics: 
  Number of finished trials:  30
  Number of pruned trials:  16
  Number of complete trials:  14

Best trial:
  Value:  8.328703448860335
  Params: 
    n_layers_fe: 2
    fe_neurons: 256
    fe_dropout: 0.37320416203069967
    n_units_l(Invariant): 197
    n_layers_mlp: 2
    initialiser: uniform
    lr: 0.0003881372563740905
    weight_decay: 0.00437306288214083
    criterion: MSELoss
    batch_size: 256
    epochs: 50
Target: 72610, NaN: 0, Max: 105.0, Min: 1.0, Mean: 25.195950970940643
Prediction: 72610, NaN: 0, Max: 46.77867126464844, Min: 10.544905662536621, Mean: 24.737056397465764

 XXXXXX======== TRIAL north - rlbg ended

Test Set - R-squared:  0.2756196891324698
Test Set - RMSE:  8.328703448860335
Test Set - MAE:  6.440849697148237



[32m[I 2022-03-03 01:04:01,495][0m A new study created in memory with name: DeepSet[0m
Starting Loading north
Finished Loading north
Finished north setup

++++++++ Session Characteristics +++++++

Area: north
Gal Type: lrg
Training Set: 290439
Validation Set: 72610
Test Samples: 72610
Number of features: 5
Device: cuda:0
Number of Workers: 8
Number of Trials: 30

+++++++++++++++++++++++++++++++++++++++

Trial Id: 0 | Model params: 115912 | Timestamp: 2022-03-03 01:04:01.495761

epoch 0 -1.9222932563161854 8.324535859289497
epoch 5 -1.564173738500592 7.797795733750445
epoch 10 -1.5216872164658861 7.732923946818924
epoch 15 -1.585767520520434 7.8305608461735545
epoch 20 -1.7054686169732394 8.009757740053155
epoch 25 -1.7140414842326814 8.022438034920079
epoch 30 -1.7041524511224861 8.007809195537801
epoch 35 -1.7120009037724895 8.019421590879084
epoch 40 -1.7073732289465826 8.01257662259963
epoch 45 -1.7143487019989543 8.022892074728404
[32m[I 2022-03-03 01:52:08,792][0m Trial 0 finished with value: 8.005688904272077 and parameters: {'n_layers_fe': 4, 'fe_neurons': 128, 'fe_dropout': 0.23068996517038037, 'n_units_l(Invariant)': 291, 'n_layers_mlp': 2, 'initialiser': 'uniform', 'lr': 3.2694954205339826e-05, 'weight_decay': 0.24157178242372104, 'criterion': 'PoissonNLLLoss', 'batch_size': 256, 'epochs': 50}. Best is trial 0 with value: 8.005688904272077.[0m

Trial Id: 1 | Model params: 104212 | Timestamp: 2022-03-03 01:52:08.793035

epoch 0 -0.3566486499436001 5.671942558955143
epoch 5 -0.0012158863199043246 4.872613863082745
epoch 10 0.007375507568427198 4.851662968209106
epoch 15 0.007645632148989501 4.851002777670174
epoch 20 0.007100181305452757 4.852335779342402
